aiter/configs/a4w4_blockscale_tuned_gemm.csv
cu_num,M,N,K,kernelId,splitK,us,kernelName,tflops,bw,errRatio
256,1,16384,16384,0,0,49.0507,a4w4_blockscale_256x64x128x128_16x16_16x16_8x32x1_8x32x1_1x32x1x8_8_2x2_intrawave_v3,10.95,2737.14,0.0
256,1,106496,16384,1,0,170.4309,a4w4_blockscale_256x64x256x128_16x16_16x16_8x32x1_8x32x1_1x32x1x8_8_2x2_intrawave_v3,20.48,5120.18,0.0
256,1,16384,53248,0,0,156.56,a4w4_blockscale_256x64x128x128_16x16_16x16_8x32x1_8x32x1_1x32x1x8_8_2x2_intrawave_v3,11.14,2786.58,0.0
256,1,18432,16384,0,0,48.5148,a4w4_blockscale_256x64x128x128_16x16_16x16_8x32x1_8x32x1_1x32x1x8_8_2x2_intrawave_v3,12.45,3113.28,0.0
256,4,16384,16384,0,0,47.9976,a4w4_blockscale_256x64x128x128_16x16_16x16_8x32x1_8x32x1_1x32x1x8_8_2x2_intrawave_v3,44.74,2799.76,0.0
256,4,106496,16384,0,0,171.6698,a4w4_blockscale_256x64x128x128_16x16_16x16_8x32x1_8x32x1_1x32x1x8_8_2x2_intrawave_v3,81.31,5087.09,0.0
256,4,16384,53248,0,0,156.656,a4w4_blockscale_256x64x128x128_16x16_16x16_8x32x1_8x32x1_1x32x1x8_8_2x2_intrawave_v3,44.55,2786.01,0.0
256,4,18432,16384,0,0,47.9528,a4w4_blockscale_256x64x128x128_16x16_16x16_8x32x1_8x32x1_1x32x1x8_8_2x2_intrawave_v3,50.38,3152.58,0.0
256,8,16384,16384,0,0,47.6519,a4w4_blockscale_256x64x128x128_16x16_16x16_8x32x1_8x32x1_1x32x1x8_8_2x2_intrawave_v3,90.13,2823.51,0.0
256,8,106496,16384,0,0,172.5446,a4w4_blockscale_256x64x128x128_16x16_16x16_8x32x1_8x32x1_1x32x1x8_8_2x2_intrawave_v3,161.8,5066.43,0.0
256,8,16384,53248,0,0,157.2956,a4w4_blockscale_256x64x128x128_16x16_16x16_8x32x1_8x32x1_1x32x1x8_8_2x2_intrawave_v3,88.74,2776.19,0.0
256,32,16384,16384,0,0,48.676,a4w4_blockscale_256x64x128x128_16x16_16x16_8x32x1_8x32x1_1x32x1x8_8_2x2_intrawave_v3,352.94,2784.3,0.0
256,32,106496,16384,0,0,182.1863,a4w4_blockscale_256x64x128x128_16x16_16x16_8x32x1_8x32x1_1x32x1x8_8_2x2_intrawave_v3,612.94,4827.44,0.0
256,64,106496,16384,3,0,200.4057,a4w4_blockscale_256x64x512x128_16x16_16x16_8x32x1_8x32x1_1x32x1x8_8_2x2_intrawave_v3,1114.43,4423.88,0.0
256,128,16384,16384,0,0,53.748,a4w4_blockscale_256x64x128x128_16x16_16x16_8x32x1_8x32x1_1x32x1x8_8_2x2_intrawave_v3,1278.55,2594.71,0.0
256,128,16384,53248,0,0,178.2259,a4w4_blockscale_256x64x128x128_16x16_16x16_8x32x1_8x32x1_1x32x1x8_8_2x2_intrawave_v3,1253.12,2490.15,0.0
256,256,16384,16384,1,0,71.1126,a4w4_blockscale_256x64x256x128_16x16_16x16_8x32x1_8x32x1_1x32x1x8_8_2x2_intrawave_v3,1932.69,2034.85,0.0
256,256,16384,53248,1,0,240.1914,a4w4_blockscale_256x64x256x128_16x16_16x16_8x32x1_8x32x1_1x32x1x8_8_2x2_intrawave_v3,1859.67,1879.38,0.0
256,256,18432,16384,2,0,97.5677,a4w4_blockscale_256x64x384x128_16x16_16x16_8x32x1_8x32x1_1x32x1x8_8_2x2_intrawave_v3,1584.73,1665.81,0.0
256,16384,16384,16384,7,0,3602.8224,a4w4_blockscale_256x96x512x128_16x16_16x16_8x32x1_8x32x1_1x32x1x8_8_2x2_intrawave_v3,2441.45,223.52,0.0
256,16384,106496,16384,7,0,23937.2246,a4w4_blockscale_256x96x512x128_16x16_16x16_8x32x1_8x32x1_1x32x1x8_8_2x2_intrawave_v3,2388.52,187.84,0.0
256,16384,16384,53248,7,0,11530.0392,a4w4_blockscale_256x96x512x128_16x16_16x16_8x32x1_8x32x1_1x32x1x8_8_2x2_intrawave_v3,2479.38,122.23,0.0
256,16384,18432,16384,10,0,4031.1796,a4w4_blockscale_256x128x384x128_16x16_16x16_8x32x1_8x32x1_1x32x1x8_8_2x2_intrawave_v3,2454.77,220.58,0.0
256,16,1536,7168,0,0,19.9248,a4w4_blockscale_256x64x128x128_16x16_16x16_8x32x1_8x32x1_1x32x1x8_8_2x2_intrawave_v3,17.68,281.63,0.0
256,16,3072,1536,0,0,7.0507,a4w4_blockscale_256x64x128x128_16x16_16x16_8x32x1_8x32x1_1x32x1x8_8_2x2_intrawave_v3,21.42,350.3,0.0
256,16,7168,2048,0,0,8.4447,a4w4_blockscale_256x64x128x128_16x16_16x16_8x32x1_8x32x1_1x32x1x8_8_2x2_intrawave_v3,55.63,898.29,0.0
256,16,4608,7168,0,0,22.3101,a4w4_blockscale_256x64x128x128_16x16_16x16_8x32x1_8x32x1_1x32x1x8_8_2x2_intrawave_v3,47.38,749.43,0.0
256,16,7168,2304,0,0,9.5571,a4w4_blockscale_256x64x128x128_16x16_16x16_8x32x1_8x32x1_1x32x1x8_8_2x2_intrawave_v3,55.3,889.95,0.0
256,16,512,7168,4,0,16.8692,a4w4_blockscale_256x96x128x128_16x16_16x16_8x32x1_8x32x1_1x32x1x8_8_2x2_intrawave_v3,6.96,113.15,0.0
256,32,1536,7168,0,0,20.0168,a4w4_blockscale_256x64x128x128_16x16_16x16_8x32x1_8x32x1_1x32x1x8_8_2x2_intrawave_v3,35.2,285.66,0.0
256,32,3072,1536,0,0,7.0107,a4w4_blockscale_256x64x128x128_16x16_16x16_8x32x1_8x32x1_1x32x1x8_8_2x2_intrawave_v3,43.08,368.08,0.0
256,32,7168,2048,0,0,8.5347,a4w4_blockscale_256x64x128x128_16x16_16x16_8x32x1_8x32x1_1x32x1x8_8_2x2_intrawave_v3,110.08,917.61,0.0
256,32,4608,7168,0,0,22.2165,a4w4_blockscale_256x64x128x128_16x16_16x16_8x32x1_8x32x1_1x32x1x8_8_2x2_intrawave_v3,95.15,761.81,0.0
256,32,7168,2304,0,0,9.7787,a4w4_blockscale_256x64x128x128_16x16_16x16_8x32x1_8x32x1_1x32x1x8_8_2x2_intrawave_v3,108.09,895.12,0.0
256,32,512,7168,4,0,17.0396,a4w4_blockscale_256x96x128x128_16x16_16x16_8x32x1_8x32x1_1x32x1x8_8_2x2_intrawave_v3,13.78,116.34,0.0
256,64,1536,7168,0,0,21.3441,a4w4_blockscale_256x64x128x128_16x16_16x16_8x32x1_8x32x1_1x32x1x8_8_2x2_intrawave_v3,66.03,277.88,0.0
256,64,3072,1536,0,0,7.2719,a4w4_blockscale_256x64x128x128_16x16_16x16_8x32x1_8x32x1_1x32x1x8_8_2x2_intrawave_v3,83.06,385.27,0.0
256,64,7168,2048,0,0,9.0279,a4w4_blockscale_256x64x128x128_16x16_16x16_8x32x1_8x32x1_1x32x1x8_8_2x2_intrawave_v3,208.14,921.93,0.0
256,64,4608,7168,0,0,23.1497,a4w4_blockscale_256x64x128x128_16x16_16x16_8x32x1_8x32x1_1x32x1x8_8_2x2_intrawave_v3,182.63,748.79,0.0
256,64,7168,2304,0,0,10.2539,a4w4_blockscale_256x64x128x128_16x16_16x16_8x32x1_8x32x1_1x32x1x8_8_2x2_intrawave_v3,206.16,901.98,0.0
256,64,512,7168,4,0,18.2008,a4w4_blockscale_256x96x128x128_16x16_16x16_8x32x1_8x32x1_1x32x1x8_8_2x2_intrawave_v3,25.81,117.02,0.0
256,128,1536,7168,0,0,23.4761,a4w4_blockscale_256x64x128x128_16x16_16x16_8x32x1_8x32x1_1x32x1x8_8_2x2_intrawave_v3,120.06,270.79,0.0
256,128,3072,1536,0,0,7.7123,a4w4_blockscale_256x64x128x128_16x16_16x16_8x32x1_8x32x1_1x32x1x8_8_2x2_intrawave_v3,156.63,420.63,0.0
256,128,7168,2048,0,0,9.3607,a4w4_blockscale_256x64x128x128_16x16_16x16_8x32x1_8x32x1_1x32x1x8_8_2x2_intrawave_v3,401.48,994.17,0.0
256,128,4608,7168,0,0,23.5505,a4w4_blockscale_256x64x128x128_16x16_16x16_8x32x1_8x32x1_1x32x1x8_8_2x2_intrawave_v3,359.05,770.83,0.0
256,128,7168,2304,0,0,10.3883,a4w4_blockscale_256x64x128x128_16x16_16x16_8x32x1_8x32x1_1x32x1x8_8_2x2_intrawave_v3,406.98,985.72,0.0
256,128,512,7168,0,0,22.7857,a4w4_blockscale_256x64x128x128_16x16_16x16_8x32x1_8x32x1_1x32x1x8_8_2x2_intrawave_v3,41.23,106.42,0.0
256,256,1536,7168,0,0,23.3033,a4w4_blockscale_256x64x128x128_16x16_16x16_8x32x1_8x32x1_1x32x1x8_8_2x2_intrawave_v3,241.9,309.35,0.0
256,256,3072,1536,0,0,8.0887,a4w4_blockscale_256x64x128x128_16x16_16x16_8x32x1_8x32x1_1x32x1x8_8_2x2_intrawave_v3,298.68,510.44,0.0
256,256,7168,2048,0,0,9.7515,a4w4_blockscale_256x64x128x128_16x16_16x16_8x32x1_8x32x1_1x32x1x8_8_2x2_intrawave_v3,770.77,1155.94,0.0
256,256,4608,7168,0,0,23.7653,a4w4_blockscale_256x64x128x128_16x16_16x16_8x32x1_8x32x1_1x32x1x8_8_2x2_intrawave_v3,711.6,832.81,0.0
256,256,7168,2304,0,0,10.6915,a4w4_blockscale_256x64x128x128_16x16_16x16_8x32x1_8x32x1_1x32x1x8_8_2x2_intrawave_v3,790.88,1143.19,0.0
256,256,512,7168,0,0,22.6525,a4w4_blockscale_256x64x128x128_16x16_16x16_8x32x1_8x32x1_1x32x1x8_8_2x2_intrawave_v3,82.95,133.08,0.0
256,512,1536,7168,0,0,23.7305,a4w4_blockscale_256x64x128x128_16x16_16x16_8x32x1_8x32x1_1x32x1x8_8_2x2_intrawave_v3,475.1,375.59,0.0
256,512,3072,1536,0,0,8.7335,a4w4_blockscale_256x64x128x128_16x16_16x16_8x32x1_8x32x1_1x32x1x8_8_2x2_intrawave_v3,553.25,675.36,0.0
256,512,7168,2048,1,0,13.0804,a4w4_blockscale_256x64x256x128_16x16_16x16_8x32x1_8x32x1_1x32x1x8_8_2x2_intrawave_v3,1149.23,1162.38,0.0
256,512,4608,7168,4,0,29.4314,a4w4_blockscale_256x96x128x128_16x16_16x16_8x32x1_8x32x1_1x32x1x8_8_2x2_intrawave_v3,1149.21,783.81,0.0
256,512,7168,2304,8,0,12.9047,a4w4_blockscale_256x128x128x128_16x16_16x16_8x32x1_8x32x1_1x32x1x8_8_2x2_intrawave_v3,1310.49,1254.38,0.0
256,512,512,7168,0,0,23.2885,a4w4_blockscale_256x64x128x128_16x16_16x16_8x32x1_8x32x1_1x32x1x8_8_2x2_intrawave_v3,161.37,180.1,0.0
256,1024,1536,7168,0,0,25.4721,a4w4_blockscale_256x64x128x128_16x16_16x16_8x32x1_8x32x1_1x32x1x8_8_2x2_intrawave_v3,885.23,483.7,0.0
256,1024,3072,1536,8,0,10.7099,a4w4_blockscale_256x128x128x128_16x16_16x16_8x32x1_8x32x1_1x32x1x8_8_2x2_intrawave_v3,902.31,881.16,0.0
256,1024,7168,2048,8,0,19.98,a4w4_blockscale_256x128x128x128_16x16_16x16_8x32x1_8x32x1_1x32x1x8_8_2x2_intrawave_v3,1504.74,1154.59,0.0
256,1024,4608,7168,5,0,42.7675,a4w4_blockscale_256x96x256x128_16x16_16x16_8x32x1_8x32x1_1x32x1x8_8_2x2_intrawave_v3,1581.71,692.64,0.0
256,1024,7168,2304,9,0,22.1345,a4w4_blockscale_256x128x256x128_16x16_16x16_8x32x1_8x32x1_1x32x1x8_8_2x2_intrawave_v3,1528.06,1089.58,0.0
256,1024,512,7168,0,0,24.5597,a4w4_blockscale_256x64x128x128_16x16_16x16_8x32x1_8x32x1_1x32x1x8_8_2x2_intrawave_v3,306.04,266.84,0.0
256,1536,1536,7168,4,0,29.9466,a4w4_blockscale_256x96x128x128_16x16_16x16_8x32x1_8x32x1_1x32x1x8_8_2x2_intrawave_v3,1129.44,525.22,0.0
256,1536,3072,1536,4,0,12.9268,a4w4_blockscale_256x96x128x128_16x16_16x16_8x32x1_8x32x1_1x32x1x8_8_2x2_intrawave_v3,1121.35,1003.82,0.0
256,1536,7168,2048,10,0,26.9209,a4w4_blockscale_256x128x384x128_16x16_16x16_8x32x1_8x32x1_1x32x1x8_8_2x2_intrawave_v3,1675.17,1149.03,0.0
256,1536,4608,7168,6,0,54.4245,a4w4_blockscale_256x96x384x128_16x16_16x16_8x32x1_8x32x1_1x32x1x8_8_2x2_intrawave_v3,1864.39,664.7,0.0
256,1536,7168,2304,7,0,29.4102,a4w4_blockscale_256x96x512x128_16x16_16x16_8x32x1_8x32x1_1x32x1x8_8_2x2_intrawave_v3,1725.06,1089.66,0.0
256,1536,512,7168,0,0,25.5821,a4w4_blockscale_256x64x128x128_16x16_16x16_8x32x1_8x32x1_1x32x1x8_8_2x2_intrawave_v3,440.71,348.4,0.0
256,2048,1536,7168,1,0,36.063,a4w4_blockscale_256x64x256x128_16x16_16x16_8x32x1_8x32x1_1x32x1x8_8_2x2_intrawave_v3,1250.51,530.64,0.0
256,2048,3072,1536,9,0,16.228,a4w4_blockscale_256x128x256x128_16x16_16x16_8x32x1_8x32x1_1x32x1x8_8_2x2_intrawave_v3,1190.99,1017.69,0.0
256,2048,7168,2048,9,0,40.0639,a4w4_blockscale_256x128x256x128_16x16_16x16_8x32x1_8x32x1_1x32x1x8_8_2x2_intrawave_v3,1500.84,968.39,0.0
256,2048,4608,7168,10,0,66.6546,a4w4_blockscale_256x128x384x128_16x16_16x16_8x32x1_8x32x1_1x32x1x8_8_2x2_intrawave_v3,2029.74,641.06,0.0
256,2048,7168,2304,9,0,42.4075,a4w4_blockscale_256x128x256x128_16x16_16x16_8x32x1_8x32x1_1x32x1x8_8_2x2_intrawave_v3,1595.14,942.69,0.0
256,2048,512,7168,0,0,26.4625,a4w4_blockscale_256x64x128x128_16x16_16x16_8x32x1_8x32x1_1x32x1x8_8_2x2_intrawave_v3,568.06,425.97,0.0
256,4096,1536,7168,2,0,50.4116,a4w4_blockscale_256x64x384x128_16x16_16x16_8x32x1_8x32x1_1x32x1x8_8_2x2_intrawave_v3,1789.16,650.01,0.0
256,4096,3072,1536,10,0,28.6765,a4w4_blockscale_256x128x384x128_16x16_16x16_8x32x1_8x32x1_1x32x1x8_8_2x2_intrawave_v3,1347.96,1069.55,0.0
256,4096,7168,2048,10,0,77.5343,a4w4_blockscale_256x128x384x128_16x16_16x16_8x32x1_8x32x1_1x32x1x8_8_2x2_intrawave_v3,1551.04,906.11,0.0
256,4096,4608,7168,10,0,131.1566,a4w4_blockscale_256x128x384x128_16x16_16x16_8x32x1_8x32x1_1x32x1x8_8_2x2_intrawave_v3,2063.05,525.66,0.0
256,4096,7168,2304,5,0,80.8616,a4w4_blockscale_256x96x256x128_16x16_16x16_8x32x1_8x32x1_1x32x1x8_8_2x2_intrawave_v3,1673.12,886.66,0.0
256,4096,512,7168,0,0,27.3037,a4w4_blockscale_256x64x128x128_16x16_16x16_8x32x1_8x32x1_1x32x1x8_8_2x2_intrawave_v3,1101.12,758.48,0.0
256,8192,1536,7168,10,0,74.2943,a4w4_blockscale_256x128x384x128_16x16_16x16_8x32x1_8x32x1_1x32x1x8_8_2x2_intrawave_v3,2428.03,808.02,0.0
256,8192,3072,1536,10,0,50.2556,a4w4_blockscale_256x128x384x128_16x16_16x16_8x32x1_8x32x1_1x32x1x8_8_2x2_intrawave_v3,1538.32,1173.65,0.0
256,8192,7168,2048,10,0,135.959,a4w4_blockscale_256x128x384x128_16x16_16x16_8x32x1_8x32x1_1x32x1x8_8_2x2_intrawave_v3,1769.05,979.48,0.0
256,8192,4608,7168,10,0,227.7773,a4w4_blockscale_256x128x384x128_16x16_16x16_8x32x1_8x32x1_1x32x1x8_8_2x2_intrawave_v3,2375.86,532.86,0.0
256,8192,7168,2304,10,0,145.1712,a4w4_blockscale_256x128x384x128_16x16_16x16_8x32x1_8x32x1_1x32x1x8_8_2x2_intrawave_v3,1863.89,930.87,0.0
256,8192,512,7168,1,0,37.1971,a4w4_blockscale_256x64x256x128_16x16_16x16_8x32x1_8x32x1_1x32x1x8_8_2x2_intrawave_v3,1616.51,1064.16,0.0
256,16384,1536,7168,10,0,150.2504,a4w4_blockscale_256x128x384x128_16x16_16x16_8x32x1_8x32x1_1x32x1x8_8_2x2_intrawave_v3,2401.17,762.44,0.0
256,16384,3072,1536,10,0,97.6538,a4w4_blockscale_256x128x384x128_16x16_16x16_8x32x1_8x32x1_1x32x1x8_8_2x2_intrawave_v3,1583.34,1183.83,0.0
256,16384,7168,2048,10,0,269.441,a4w4_blockscale_256x128x384x128_16x16_16x16_8x32x1_8x32x1_1x32x1x8_8_2x2_intrawave_v3,1785.31,961.24,0.0
256,16384,4608,7168,10,0,454.2569,a4w4_blockscale_256x128x384x128_16x16_16x16_8x32x1_8x32x1_1x32x1x8_8_2x2_intrawave_v3,2382.64,498.02,0.0
256,16384,7168,2304,10,0,288.9433,a4w4_blockscale_256x128x384x128_16x16_16x16_8x32x1_8x32x1_1x32x1x8_8_2x2_intrawave_v3,1872.91,906.8,0.0
256,16384,512,7168,9,0,60.4461,a4w4_blockscale_256x128x256x128_16x16_16x16_8x32x1_8x32x1_1x32x1x8_8_2x2_intrawave_v3,1989.53,1279.36,0.0
256,20480,1536,7168,10,0,199.649,a4w4_blockscale_256x128x384x128_16x16_16x16_8x32x1_8x32x1_1x32x1x8_8_2x2_intrawave_v3,2258.82,710.35,0.0
256,20480,3072,1536,10,0,118.3924,a4w4_blockscale_256x128x384x128_16x16_16x16_8x32x1_8x32x1_1x32x1x8_8_2x2_intrawave_v3,1632.48,1215.59,0.0
256,20480,7168,2048,10,0,333.465,a4w4_blockscale_256x128x384x128_16x16_16x16_8x32x1_8x32x1_1x32x1x8_8_2x2_intrawave_v3,1803.17,965.36,0.0
256,20480,4608,7168,10,0,572.5215,a4w4_blockscale_256x128x384x128_16x16_16x16_8x32x1_8x32x1_1x32x1x8_8_2x2_intrawave_v3,2363.08,486.72,0.0
256,20480,7168,2304,10,0,355.0349,a4w4_blockscale_256x128x384x128_16x16_16x16_8x32x1_8x32x1_1x32x1x8_8_2x2_intrawave_v3,1905.33,916.68,0.0
256,20480,512,7168,7,0,72.5979,a4w4_blockscale_256x96x512x128_16x16_16x16_8x32x1_8x32x1_1x32x1x8_8_2x2_intrawave_v3,2070.64,1325.2,0.0
256,1,1280,8192,0,0,20.0932,a4w4_blockscale_256x64x128x128_16x16_16x16_8x32x1_8x32x1_1x32x1x8_8_2x2_intrawave_v3,1.04,261.26,0.0
256,64,1280,8192,0,0,23.0153,a4w4_blockscale_256x64x128x128_16x16_16x16_8x32x1_8x32x1_1x32x1x8_8_2x2_intrawave_v3,58.32,246.31,0.0
256,127,1280,8192,0,0,24.5329,a4w4_blockscale_256x64x128x128_16x16_16x16_8x32x1_8x32x1_1x32x1x8_8_2x2_intrawave_v3,108.56,248.16,0.0
256,129,1280,8192,0,0,24.2013,a4w4_blockscale_256x64x128x128_16x16_16x16_8x32x1_8x32x1_1x32x1x8_8_2x2_intrawave_v3,111.78,252.11,0.0
256,65,1280,8192,0,0,23.9233,a4w4_blockscale_256x64x128x128_16x16_16x16_8x32x1_8x32x1_1x32x1x8_8_2x2_intrawave_v3,56.98,237.24,0.0
256,32,1280,8192,0,0,20.6788,a4w4_blockscale_256x64x128x128_16x16_16x16_8x32x1_8x32x1_1x32x1x8_8_2x2_intrawave_v3,32.45,263.84,0.0
256,128,1280,8192,0,0,24.6385,a4w4_blockscale_256x64x128x128_16x16_16x16_8x32x1_8x32x1_1x32x1x8_8_2x2_intrawave_v3,108.95,247.37,0.0
256,192,1280,8192,0,0,24.7873,a4w4_blockscale_256x64x128x128_16x16_16x16_8x32x1_8x32x1_1x32x1x8_8_2x2_intrawave_v3,162.44,263.07,0.0
256,256,1280,8192,0,0,25.0285,a4w4_blockscale_256x64x128x128_16x16_16x16_8x32x1_8x32x1_1x32x1x8_8_2x2_intrawave_v3,214.5,277.56,0.0
256,320,1280,8192,0,0,25.6077,a4w4_blockscale_256x64x128x128_16x16_16x16_8x32x1_8x32x1_1x32x1x8_8_2x2_intrawave_v3,262.07,287.91,0.0
256,512,1280,8192,0,0,25.7465,a4w4_blockscale_256x64x128x128_16x16_16x16_8x32x1_8x32x1_1x32x1x8_8_2x2_intrawave_v3,417.04,336.0,0.0
256,1024,1280,8192,0,0,26.7393,a4w4_blockscale_256x64x128x128_16x16_16x16_8x32x1_8x32x1_1x32x1x8_8_2x2_intrawave_v3,803.12,450.97,0.0
256,2048,1280,8192,4,0,35.2002,a4w4_blockscale_256x96x128x128_16x16_16x16_8x32x1_8x32x1_1x32x1x8_8_2x2_intrawave_v3,1220.15,536.2,0.0
256,4096,1280,8192,5,0,50.0176,a4w4_blockscale_256x96x256x128_16x16_16x16_8x32x1_8x32x1_1x32x1x8_8_2x2_intrawave_v3,1717.38,649.89,0.0
256,8192,1280,8192,10,0,81.1756,a4w4_blockscale_256x128x384x128_16x16_16x16_8x32x1_8x32x1_1x32x1x8_8_2x2_intrawave_v3,2116.38,736.29,0.0
256,1,8192,1024,0,0,6.2531,a4w4_blockscale_256x64x128x128_16x16_16x16_8x32x1_8x32x1_1x32x1x8_8_2x2_intrawave_v3,2.68,673.46,0.0
256,32,8192,1024,0,0,6.2023,a4w4_blockscale_256x64x128x128_16x16_16x16_8x32x1_8x32x1_1x32x1x8_8_2x2_intrawave_v3,86.56,763.42,0.0
256,64,8192,1024,0,0,6.7819,a4w4_blockscale_256x64x128x128_16x16_16x16_8x32x1_8x32x1_1x32x1x8_8_2x2_intrawave_v3,158.32,777.9,0.0
256,128,8192,1024,0,0,6.9383,a4w4_blockscale_256x64x128x128_16x16_16x16_8x32x1_8x32x1_1x32x1x8_8_2x2_intrawave_v3,309.51,916.22,0.0
256,192,8192,1024,0,0,7.1247,a4w4_blockscale_256x64x128x128_16x16_16x16_8x32x1_8x32x1_1x32x1x8_8_2x2_intrawave_v3,452.12,1044.02,0.0
256,256,8192,1024,0,0,7.3495,a4w4_blockscale_256x64x128x128_16x16_16x16_8x32x1_8x32x1_1x32x1x8_8_2x2_intrawave_v3,584.39,1159.22,0.0
256,320,8192,1024,4,0,8.2715,a4w4_blockscale_256x96x128x128_16x16_16x16_8x32x1_8x32x1_1x32x1x8_8_2x2_intrawave_v3,649.06,1160.74,0.0
256,512,8192,1024,1,0,9.6435,a4w4_blockscale_256x64x256x128_16x16_16x16_8x32x1_8x32x1_1x32x1x8_8_2x2_intrawave_v3,890.75,1331.99,0.0
256,1024,8192,1024,9,0,15.072,a4w4_blockscale_256x128x256x128_16x16_16x16_8x32x1_8x32x1_1x32x1x8_8_2x2_intrawave_v3,1139.85,1426.21,0.0
256,2048,8192,1024,9,0,29.6818,a4w4_blockscale_256x128x256x128_16x16_16x16_8x32x1_8x32x1_1x32x1x8_8_2x2_intrawave_v3,1157.6,1307.11,0.0
256,4096,8192,1024,10,0,56.4649,a4w4_blockscale_256x128x384x128_16x16_16x16_8x32x1_8x32x1_1x32x1x8_8_2x2_intrawave_v3,1217.03,1299.93,0.0
256,8192,8192,1024,10,0,109.9155,a4w4_blockscale_256x128x384x128_16x16_16x16_8x32x1_8x32x1_1x32x1x8_8_2x2_intrawave_v3,1250.41,1297.42,0.0
256,16384,8192,1024,11,0,138.2206,a4w4_blockscale_256x128x512x128_16x16_16x16_8x32x1_8x32x1_1x32x1x8_8_2x2_intrawave_v3,1988.69,2033.11,0.0
256,1552,57344,8192,21,0,402.0203,_ZN5aiter42f4gemm_bf16_per1x32Fp4_BpreShuffle_128x512E,3627.03,1042.82,0.0
256,1664,57344,8192,21,0,410.6409,_ZN5aiter42f4gemm_bf16_per1x32Fp4_BpreShuffle_128x512E,3807.14,1053.32,0.0
256,1792,57344,8192,26,0,432.9381,_ZN5aiter42f4gemm_bf16_per1x32Fp4_BpreShuffle_224x256E,3888.84,1034.19,0.0
256,1920,57344,8192,21,0,476.6147,_ZN5aiter42f4gemm_bf16_per1x32Fp4_BpreShuffle_128x512E,3784.79,971.32,0.0
256,2048,57344,8192,21,0,481.0754,_ZN5aiter42f4gemm_bf16_per1x32Fp4_BpreShuffle_128x512E,3999.68,993.92,0.0
256,3072,57344,8192,21,0,735.2449,_ZN5aiter42f4gemm_bf16_per1x32Fp4_BpreShuffle_128x512E,3925.52,815.76,0.0
256,4096,57344,8192,21,0,935.7208,_ZN5aiter42f4gemm_bf16_per1x32Fp4_BpreShuffle_128x512E,4112.65,770.98,0.0
256,32768,57344,8192,27,0,6974.528,_ZN5aiter42f4gemm_bf16_per1x32Fp4_BpreShuffle_256x256E,4414.11,591.75,0.0
256,1,2560,8192,14,0,20.1935,a4w4_blockscale_256x32x128x128_16x16_16x16_8x32x1_8x32x1_1x16x1x16_8_2x2_intrawave_v3,2.08,519.72,0.0
256,1,7168,8192,14,0,20.9682,a4w4_blockscale_256x32x128x128_16x16_16x16_8x32x1_8x32x1_1x16x1x16_8_2x2_intrawave_v3,5.6,1401.1,0.0
256,1,8192,2048,14,0,7.88,a4w4_blockscale_256x32x128x128_16x16_16x16_8x32x1_8x32x1_1x16x1x16_8_2x2_intrawave_v3,4.26,1066.75,0.0
256,1,8192,3584,14,0,11.7177,a4w4_blockscale_256x32x128x128_16x16_16x16_8x32x1_8x32x1_1x16x1x16_8_2x2_intrawave_v3,5.01,1254.36,0.0
256,1,8192,7168,14,0,20.4814,a4w4_blockscale_256x32x128x128_16x16_16x16_8x32x1_8x32x1_1x16x1x16_8_2x2_intrawave_v3,5.73,1434.48,0.0
256,1,8192,8192,14,0,21.1499,a4w4_blockscale_256x32x128x128_16x16_16x16_8x32x1_8x32x1_1x16x1x16_8_2x2_intrawave_v3,6.35,1587.47,0.0
256,1,8192,28672,14,0,70.6455,a4w4_blockscale_256x32x128x128_16x16_16x16_8x32x1_8x32x1_1x16x1x16_8_2x2_intrawave_v3,6.65,1662.83,0.0
256,1,10240,8192,14,0,21.4492,a4w4_blockscale_256x32x128x128_16x16_16x16_8x32x1_8x32x1_1x16x1x16_8_2x2_intrawave_v3,7.82,1956.61,0.0
256,1,14336,8192,14,0,22.2254,a4w4_blockscale_256x32x128x128_16x16_16x16_8x32x1_8x32x1_1x16x1x16_8_2x2_intrawave_v3,10.57,2643.51,0.0
256,1,57344,8192,0,0,44.9349,a4w4_blockscale_256x64x128x128_16x16_16x16_8x32x1_8x32x1_1x32x1x8_8_2x2_intrawave_v3,20.91,5229.78,0.0
256,16,1280,8192,14,0,17.8843,a4w4_blockscale_256x32x128x128_16x16_16x16_8x32x1_8x32x1_1x16x1x16_8_2x2_intrawave_v3,18.76,299.11,0.0
256,16,2560,8192,14,0,20.3303,a4w4_blockscale_256x32x128x128_16x16_16x16_8x32x1_8x32x1_1x16x1x16_8_2x2_intrawave_v3,33.01,523.02,0.0
256,16,7168,8192,14,0,21.0998,a4w4_blockscale_256x32x128x128_16x16_16x16_8x32x1_8x32x1_1x16x1x16_8_2x2_intrawave_v3,89.06,1405.47,0.0
256,16,8192,1024,14,0,5.286,a4w4_blockscale_256x32x128x128_16x16_16x16_8x32x1_8x32x1_1x16x1x16_8_2x2_intrawave_v3,50.78,844.62,0.0
256,16,8192,2048,14,0,7.4009,a4w4_blockscale_256x32x128x128_16x16_16x16_8x32x1_8x32x1_1x16x1x16_8_2x2_intrawave_v3,72.54,1171.09,0.0
256,16,8192,3584,14,0,11.681,a4w4_blockscale_256x32x128x128_16x16_16x16_8x32x1_8x32x1_1x16x1x16_8_2x2_intrawave_v3,80.43,1281.64,0.0
256,16,8192,7168,14,0,20.7064,a4w4_blockscale_256x32x128x128_16x16_16x16_8x32x1_8x32x1_1x16x1x16_8_2x2_intrawave_v3,90.75,1433.35,0.0
256,16,8192,8192,14,0,21.2878,a4w4_blockscale_256x32x128x128_16x16_16x16_8x32x1_8x32x1_1x16x1x16_8_2x2_intrawave_v3,100.88,1591.62,0.0
256,16,8192,28672,14,0,71.0134,a4w4_blockscale_256x32x128x128_16x16_16x16_8x32x1_8x32x1_1x16x1x16_8_2x2_intrawave_v3,105.84,1660.7,0.0
256,16,10240,8192,14,0,21.5887,a4w4_blockscale_256x32x128x128_16x16_16x16_8x32x1_8x32x1_1x16x1x16_8_2x2_intrawave_v3,124.34,1961.04,0.0
256,16,14336,8192,14,0,22.4535,a4w4_blockscale_256x32x128x128_16x16_16x16_8x32x1_8x32x1_1x16x1x16_8_2x2_intrawave_v3,167.37,2638.54,0.0
256,16,57344,8192,14,0,45.8599,a4w4_blockscale_256x32x128x128_16x16_16x16_8x32x1_8x32x1_1x16x1x16_8_2x2_intrawave_v3,327.79,5163.15,0.0
256,32,2560,8192,14,0,20.3987,a4w4_blockscale_256x32x128x128_16x16_16x16_8x32x1_8x32x1_1x16x1x16_8_2x2_intrawave_v3,65.8,528.5,0.0
256,32,7168,8192,14,0,21.138,a4w4_blockscale_256x32x128x128_16x16_16x16_8x32x1_8x32x1_1x16x1x16_8_2x2_intrawave_v3,177.79,1416.88,0.0
256,32,8192,2048,12,0,7.9311,a4w4_blockscale_256x64x128x128_16x16_16x16_8x32x1_8x32x1_1x16x1x16_8_2x2_intrawave_v3,135.38,1127.92,0.0
256,32,8192,3584,14,0,12.4795,a4w4_blockscale_256x32x128x128_16x16_16x16_8x32x1_8x32x1_1x16x1x16_8_2x2_intrawave_v3,150.57,1222.94,0.0
256,32,8192,7168,14,0,20.6638,a4w4_blockscale_256x32x128x128_16x16_16x16_8x32x1_8x32x1_1x16x1x16_8_2x2_intrawave_v3,181.87,1451.77,0.0
256,32,8192,8192,14,0,21.3503,a4w4_blockscale_256x32x128x128_16x16_16x16_8x32x1_8x32x1_1x16x1x16_8_2x2_intrawave_v3,201.17,1602.31,0.0
256,32,8192,28672,14,0,71.1556,a4w4_blockscale_256x32x128x128_16x16_16x16_8x32x1_8x32x1_1x16x1x16_8_2x2_intrawave_v3,211.26,1664.29,0.0
256,32,10240,8192,14,0,21.6194,a4w4_blockscale_256x32x128x128_16x16_16x16_8x32x1_8x32x1_1x16x1x16_8_2x2_intrawave_v3,248.33,1976.44,0.0
256,32,14336,8192,14,0,22.5861,a4w4_blockscale_256x32x128x128_16x16_16x16_8x32x1_8x32x1_1x16x1x16_8_2x2_intrawave_v3,332.78,2646.27,0.0
256,32,57344,8192,15,0,46.7083,a4w4_blockscale_256x32x256x128_16x16_16x16_8x32x1_8x32x1_1x8x1x32_8_2x4_intrawave_v3,643.67,5110.06,0.0
256,64,192,1024,19,0,13.2008,a4w4_blockscale_256x256x256x128_16x16_16x16_8x32x1_8x32x1_1x8x1x32_8_2x8_intrawave_v3,1.91,11.79,0.0
256,64,2560,8192,14,0,20.9571,a4w4_blockscale_256x32x128x128_16x16_16x16_8x32x1_8x32x1_1x16x1x16_8_2x2_intrawave_v3,128.09,528.49,0.0
256,64,7168,8192,14,0,20.3909,a4w4_blockscale_256x32x128x128_16x16_16x16_8x32x1_8x32x1_1x16x1x16_8_2x2_intrawave_v3,368.61,1497.72,0.0
256,64,8192,2048,14,0,7.542,a4w4_blockscale_256x32x128x128_16x16_16x16_8x32x1_8x32x1_1x16x1x16_8_2x2_intrawave_v3,284.74,1259.97,0.0
256,64,8192,3584,14,0,12.5971,a4w4_blockscale_256x32x128x128_16x16_16x16_8x32x1_8x32x1_1x16x1x16_8_2x2_intrawave_v3,298.33,1257.7,0.0
256,64,8192,7168,14,0,20.12,a4w4_blockscale_256x32x128x128_16x16_16x16_8x32x1_8x32x1_1x16x1x16_8_2x2_intrawave_v3,373.57,1522.77,0.0
256,64,8192,8192,14,0,20.4294,a4w4_blockscale_256x32x128x128_16x16_16x16_8x32x1_8x32x1_1x16x1x16_8_2x2_intrawave_v3,420.47,1706.62,0.0
256,64,8192,28672,14,0,69.6281,a4w4_blockscale_256x32x128x128_16x16_16x16_8x32x1_8x32x1_1x16x1x16_8_2x2_intrawave_v3,431.79,1714.92,0.0
256,64,10240,8192,14,0,21.1196,a4w4_blockscale_256x32x128x128_16x16_16x16_8x32x1_8x32x1_1x16x1x16_8_2x2_intrawave_v3,508.41,2060.45,0.0
256,64,14336,8192,14,0,21.9162,a4w4_blockscale_256x32x128x128_16x16_16x16_8x32x1_8x32x1_1x16x1x16_8_2x2_intrawave_v3,685.9,2775.0,0.0
256,64,57344,8192,0,0,48.7005,a4w4_blockscale_256x64x128x128_16x16_16x16_8x32x1_8x32x1_1x32x1x8_8_2x2_intrawave_v3,1234.68,4979.07,0.0
256,128,2560,8192,14,0,20.4281,a4w4_blockscale_256x32x128x128_16x16_16x16_8x32x1_8x32x1_1x16x1x16_8_2x2_intrawave_v3,262.81,571.05,0.0
256,128,7168,8192,14,0,20.1978,a4w4_blockscale_256x32x128x128_16x16_16x16_8x32x1_8x32x1_1x16x1x16_8_2x2_intrawave_v3,744.26,1570.44,0.0
256,128,8192,2048,14,0,7.7839,a4w4_blockscale_256x32x128x128_16x16_16x16_8x32x1_8x32x1_1x16x1x16_8_2x2_intrawave_v3,551.78,1363.95,0.0
256,128,8192,3584,14,0,11.665,a4w4_blockscale_256x32x128x128_16x16_16x16_8x32x1_8x32x1_1x16x1x16_8_2x2_intrawave_v3,644.34,1457.92,0.0
256,128,8192,7168,14,0,19.6172,a4w4_blockscale_256x32x128x128_16x16_16x16_8x32x1_8x32x1_1x16x1x16_8_2x2_intrawave_v3,766.29,1626.94,0.0
256,128,8192,8192,14,0,20.1687,a4w4_blockscale_256x32x128x128_16x16_16x16_8x32x1_8x32x1_1x16x1x16_8_2x2_intrawave_v3,851.81,1793.66,0.0
256,128,8192,28672,14,0,67.8423,a4w4_blockscale_256x32x128x128_16x16_16x16_8x32x1_8x32x1_1x16x1x16_8_2x2_intrawave_v3,886.31,1789.04,0.0
256,128,10240,8192,14,0,23.8897,a4w4_blockscale_256x32x128x128_16x16_16x16_8x32x1_8x32x1_1x16x1x16_8_2x2_intrawave_v3,898.92,1887.37,0.0
256,128,14336,8192,14,0,24.8973,a4w4_blockscale_256x32x128x128_16x16_16x16_8x32x1_8x32x1_1x16x1x16_8_2x2_intrawave_v3,1207.55,2526.96,0.0
256,128,57344,8192,9,0,52.789,a4w4_blockscale_256x128x256x128_16x16_16x16_8x32x1_8x32x1_1x32x1x8_8_2x2_intrawave_v3,2278.11,4737.45,0.0
256,256,2560,8192,14,0,20.5719,a4w4_blockscale_256x32x128x128_16x16_16x16_8x32x1_8x32x1_1x16x1x16_8_2x2_intrawave_v3,521.95,624.4,0.0
256,256,7168,8192,12,0,23.699,a4w4_blockscale_256x64x128x128_16x16_16x16_8x32x1_8x32x1_1x16x1x16_8_2x2_intrawave_v3,1268.61,1437.98,0.0
256,256,8192,2048,0,0,8.8946,a4w4_blockscale_256x64x128x128_16x16_16x16_8x32x1_8x32x1_1x32x1x8_8_2x2_intrawave_v3,965.75,1444.14,0.0
256,256,8192,3584,12,0,13.2343,a4w4_blockscale_256x64x128x128_16x16_16x16_8x32x1_8x32x1_1x16x1x16_8_2x2_intrawave_v3,1135.87,1460.83,0.0
256,256,8192,7168,12,0,22.9609,a4w4_blockscale_256x64x128x128_16x16_16x16_8x32x1_8x32x1_1x16x1x16_8_2x2_intrawave_v3,1309.39,1501.33,0.0
256,256,8192,8192,0,0,23.9886,a4w4_blockscale_256x64x128x128_16x16_16x16_8x32x1_8x32x1_1x32x1x8_8_2x2_intrawave_v3,1432.34,1617.32,0.0
256,256,8192,28672,12,0,79.9059,a4w4_blockscale_256x64x128x128_16x16_16x16_8x32x1_8x32x1_1x16x1x16_8_2x2_intrawave_v3,1505.01,1568.15,0.0
256,256,10240,8192,4,0,25.5341,a4w4_blockscale_256x96x128x128_16x16_16x16_8x32x1_8x32x1_1x32x1x8_8_2x2_intrawave_v3,1682.05,1889.02,0.0
256,256,14336,8192,8,0,28.0357,a4w4_blockscale_256x128x128x128_16x16_16x16_8x32x1_8x32x1_1x32x1x8_8_2x2_intrawave_v3,2144.75,2393.69,0.0
256,256,57344,8192,24,0,70.5175,_ZN5aiter42f4gemm_bf16_per1x32Fp4_BpreShuffle_256x256E,3410.76,3762.04,0.0
256,512,2560,8192,12,0,23.8055,a4w4_blockscale_256x64x128x128_16x16_16x16_8x32x1_8x32x1_1x16x1x16_8_2x2_intrawave_v3,902.1,638.69,0.0
256,512,7168,8192,8,0,27.6576,a4w4_blockscale_256x128x128x128_16x16_16x16_8x32x1_8x32x1_1x32x1x8_8_2x2_intrawave_v3,2174.07,1402.77,0.0
256,512,8192,2048,8,0,10.7791,a4w4_blockscale_256x128x128x128_16x16_16x16_8x32x1_8x32x1_1x32x1x8_8_2x2_intrawave_v3,1593.81,1605.1,0.0
256,512,8192,3584,8,0,15.4143,a4w4_blockscale_256x128x128x128_16x16_16x16_8x32x1_8x32x1_1x32x1x8_8_2x2_intrawave_v3,1950.45,1556.1,0.0
256,512,8192,7168,8,0,26.3508,a4w4_blockscale_256x128x128x128_16x16_16x16_8x32x1_8x32x1_1x32x1x8_8_2x2_intrawave_v3,2281.89,1502.18,0.0
256,512,8192,8192,8,0,28.446,a4w4_blockscale_256x128x128x128_16x16_16x16_8x32x1_8x32x1_1x32x1x8_8_2x2_intrawave_v3,2415.79,1548.2,0.0
256,512,8192,28672,8,0,88.4322,a4w4_blockscale_256x128x128x128_16x16_16x16_8x32x1_8x32x1_1x32x1x8_8_2x2_intrawave_v3,2719.8,1505.89,0.0
256,512,10240,8192,9,0,37.3399,a4w4_blockscale_256x128x256x128_16x16_16x16_8x32x1_8x32x1_1x32x1x8_8_2x2_intrawave_v3,2300.47,1460.26,0.0
256,512,14336,8192,9,0,40.1157,a4w4_blockscale_256x128x256x128_16x16_16x16_8x32x1_8x32x1_1x32x1x8_8_2x2_intrawave_v3,2997.81,1881.99,0.0
256,512,57344,8192,18,0,125.5765,a4w4_blockscale_256x256x256x128_16x16_16x16_8x32x1_8x32x1_1x8x1x32_8_2x4_intrawave_v3,3830.62,2354.73,0.0
256,1024,2560,8192,4,0,26.3517,a4w4_blockscale_256x96x128x128_16x16_16x16_8x32x1_8x32x1_1x32x1x8_8_2x2_intrawave_v3,1629.86,756.04,0.0
256,1024,7168,8192,9,0,41.0141,a4w4_blockscale_256x128x256x128_16x16_16x16_8x32x1_8x32x1_1x32x1x8_8_2x2_intrawave_v3,2932.14,1176.05,0.0
256,1024,8192,2048,8,0,16.3364,a4w4_blockscale_256x128x128x128_16x16_16x16_8x32x1_8x32x1_1x32x1x8_8_2x2_intrawave_v3,2103.26,1604.66,0.0
256,1024,8192,3584,9,0,23.3284,a4w4_blockscale_256x128x256x128_16x16_16x16_8x32x1_8x32x1_1x32x1x8_8_2x2_intrawave_v3,2577.53,1427.11,0.0
256,1024,8192,7168,9,0,38.7665,a4w4_blockscale_256x128x256x128_16x16_16x16_8x32x1_8x32x1_1x32x1x8_8_2x2_intrawave_v3,3102.14,1284.8,0.0
256,1024,8192,8192,9,0,42.7765,a4w4_blockscale_256x128x256x128_16x16_16x16_8x32x1_8x32x1_1x32x1x8_8_2x2_intrawave_v3,3212.95,1274.67,0.0
256,1024,8192,28672,22,0,126.0662,_ZN5aiter42f4gemm_bf16_per1x32Fp4_BpreShuffle_192x256E,3815.74,1181.11,0.0
256,1024,10240,8192,22,0,47.0693,_ZN5aiter42f4gemm_bf16_per1x32Fp4_BpreShuffle_192x256E,3649.91,1425.75,0.0
256,1024,14336,8192,24,0,55.6742,_ZN5aiter42f4gemm_bf16_per1x32Fp4_BpreShuffle_256x256E,4320.1,1657.4,0.0
256,1024,57344,8192,18,0,238.8419,a4w4_blockscale_256x256x256x128_16x16_16x16_8x32x1_8x32x1_1x8x1x32_8_2x4_intrawave_v3,4028.07,1492.69,0.0
256,2048,2560,8192,22,0,38.4519,_ZN5aiter42f4gemm_bf16_per1x32Fp4_BpreShuffle_192x256E,2233.94,763.55,0.0
256,2048,7168,8192,24,0,56.2618,_ZN5aiter42f4gemm_bf16_per1x32Fp4_BpreShuffle_256x256E,4274.98,1192.8,0.0
256,2048,8192,2048,24,0,21.4821,_ZN5aiter42f4gemm_bf16_per1x32Fp4_BpreShuffle_256x256E,3198.92,2050.09,0.0
256,2048,8192,3584,24,0,31.9644,_ZN5aiter42f4gemm_bf16_per1x32Fp4_BpreShuffle_256x256E,3762.28,1623.82,0.0
256,2048,8192,7168,24,0,54.267,_ZN5aiter42f4gemm_bf16_per1x32Fp4_BpreShuffle_256x256E,4432.13,1294.61,0.0
256,2048,8192,8192,24,0,60.453,_ZN5aiter42f4gemm_bf16_per1x32Fp4_BpreShuffle_256x256E,4546.97,1248.86,0.0
256,2048,8192,28672,24,0,172.7778,_ZN5aiter42f4gemm_bf16_per1x32Fp4_BpreShuffle_256x256E,5568.27,1043.86,0.0
256,2048,10240,8192,22,0,91.1052,_ZN5aiter42f4gemm_bf16_per1x32Fp4_BpreShuffle_192x256E,3771.44,1012.84,0.0
256,2048,14336,8192,24,0,107.3856,_ZN5aiter42f4gemm_bf16_per1x32Fp4_BpreShuffle_256x256E,4479.52,1171.75,0.0
256,4096,2560,8192,22,0,49.0685,_ZN5aiter42f4gemm_bf16_per1x32Fp4_BpreShuffle_192x256E,3501.2,983.0,0.0
256,4096,7168,8192,24,0,110.7698,_ZN5aiter42f4gemm_bf16_per1x32Fp4_BpreShuffle_256x256E,4342.67,946.63,0.0
256,4096,8192,2048,24,0,42.5533,_ZN5aiter42f4gemm_bf16_per1x32Fp4_BpreShuffle_256x256E,3229.81,1872.75,0.0
256,4096,8192,3584,24,0,62.221,_ZN5aiter42f4gemm_bf16_per1x32Fp4_BpreShuffle_256x256E,3865.55,1432.46,0.0
256,4096,8192,7168,24,0,102.5193,_ZN5aiter42f4gemm_bf16_per1x32Fp4_BpreShuffle_256x256E,4692.15,1084.18,0.0
256,4096,8192,8192,24,0,114.6354,_ZN5aiter42f4gemm_bf16_per1x32Fp4_BpreShuffle_256x256E,4795.69,1024.47,0.0
256,4096,8192,28672,24,0,336.8039,_ZN5aiter42f4gemm_bf16_per1x32Fp4_BpreShuffle_256x256E,5712.95,722.29,0.0
256,4096,10240,8192,24,0,151.2279,_ZN5aiter42f4gemm_bf16_per1x32Fp4_BpreShuffle_256x256E,4544.1,942.99,0.0
256,4096,14336,8192,24,0,203.4186,_ZN5aiter42f4gemm_bf16_per1x32Fp4_BpreShuffle_256x256E,4729.52,948.48,0.0
256,8192,2560,8192,22,0,92.642,_ZN5aiter42f4gemm_bf16_per1x32Fp4_BpreShuffle_192x256E,3708.87,928.12,0.0
256,8192,7168,8192,24,0,208.9117,_ZN5aiter42f4gemm_bf16_per1x32Fp4_BpreShuffle_256x256E,4605.16,863.31,0.0
256,8192,8192,2048,24,0,82.6092,_ZN5aiter42f4gemm_bf16_per1x32Fp4_BpreShuffle_256x256E,3327.45,1827.82,0.0
256,8192,8192,3584,24,0,120.6525,_ZN5aiter42f4gemm_bf16_per1x32Fp4_BpreShuffle_256x256E,3986.96,1355.78,0.0
256,8192,8192,7168,24,0,194.4947,_ZN5aiter42f4gemm_bf16_per1x32Fp4_BpreShuffle_256x256E,4946.52,992.0,0.0
256,8192,8192,8192,24,0,216.7585,_ZN5aiter42f4gemm_bf16_per1x32Fp4_BpreShuffle_256x256E,5072.52,928.81,0.0
256,8192,8192,28672,24,0,657.763,_ZN5aiter42f4gemm_bf16_per1x32Fp4_BpreShuffle_256x256E,5850.57,561.14,0.0
256,8192,10240,8192,24,0,276.5124,_ZN5aiter42f4gemm_bf16_per1x32Fp4_BpreShuffle_256x256E,4970.44,879.78,0.0
256,8192,14336,8192,24,0,379.047,_ZN5aiter42f4gemm_bf16_per1x32Fp4_BpreShuffle_256x256E,5076.27,863.1,0.0
256,8192,57344,8192,24,0,1507.5194,_ZN5aiter42f4gemm_bf16_per1x32Fp4_BpreShuffle_256x256E,5105.46,801.29,0.0
256,16384,1280,8192,22,0,97.1819,_ZN5aiter42f4gemm_bf16_per1x32Fp4_BpreShuffle_192x256E,3535.61,1176.09,0.0
256,16384,2560,8192,23,0,161.8489,_ZN5aiter42f4gemm_bf16_per1x32Fp4_BpreShuffle_224x256E,4245.9,997.73,0.0
256,16384,7168,8192,24,0,387.9259,_ZN5aiter42f4gemm_bf16_per1x32Fp4_BpreShuffle_256x256E,4960.08,854.16,0.0
256,16384,8192,2048,24,0,158.7577,_ZN5aiter42f4gemm_bf16_per1x32Fp4_BpreShuffle_256x256E,3462.86,1849.37,0.0
256,16384,8192,3584,24,0,223.8924,_ZN5aiter42f4gemm_bf16_per1x32Fp4_BpreShuffle_256x256E,4297.03,1395.65,0.0
256,16384,8192,7168,24,0,380.1193,_ZN5aiter42f4gemm_bf16_per1x32Fp4_BpreShuffle_256x256E,5061.95,937.91,0.0
256,16384,8192,8192,24,0,429.3727,_ZN5aiter42f4gemm_bf16_per1x32Fp4_BpreShuffle_256x256E,5121.48,859.62,0.0
256,16384,8192,28672,24,0,1330.9626,_ZN5aiter42f4gemm_bf16_per1x32Fp4_BpreShuffle_256x256E,5782.72,466.4,0.0
256,16384,10240,8192,24,0,546.9175,_ZN5aiter42f4gemm_bf16_per1x32Fp4_BpreShuffle_256x256E,5025.95,812.91,0.0
256,16384,14336,8192,24,0,754.7949,_ZN5aiter42f4gemm_bf16_per1x32Fp4_BpreShuffle_256x256E,5098.46,789.08,0.0
256,16384,57344,8192,24,0,2964.3928,_ZN5aiter42f4gemm_bf16_per1x32Fp4_BpreShuffle_256x256E,5192.69,735.75,0.0
256,32768,1280,8192,21,0,167.9341,_ZN5aiter42f4gemm_bf16_per1x32Fp4_BpreShuffle_128x512E,4092.05,1329.97,0.0
256,32768,2560,8192,21,0,287.488,_ZN5aiter42f4gemm_bf16_per1x32Fp4_BpreShuffle_128x512E,4780.68,1086.92,0.0
256,32768,7168,8192,24,0,785.8103,_ZN5aiter42f4gemm_bf16_per1x32Fp4_BpreShuffle_256x256E,4897.23,805.97,0.0
256,32768,8192,1024,21,0,216.4753,_ZN5aiter42f4gemm_bf16_per1x32Fp4_BpreShuffle_128x512E,2539.58,2576.93,0.0
256,32768,8192,2048,24,0,308.4436,_ZN5aiter42f4gemm_bf16_per1x32Fp4_BpreShuffle_256x256E,3564.71,1876.56,0.0
256,32768,8192,3584,24,0,447.0983,_ZN5aiter42f4gemm_bf16_per1x32Fp4_BpreShuffle_256x256E,4303.63,1364.96,0.0
256,32768,8192,7168,24,0,774.6206,_ZN5aiter42f4gemm_bf16_per1x32Fp4_BpreShuffle_256x256E,4967.97,882.59,0.0
256,32768,8192,8192,24,0,854.7832,_ZN5aiter42f4gemm_bf16_per1x32Fp4_BpreShuffle_256x256E,5145.22,824.35,0.0
256,32768,8192,28672,21,0,2661.9311,_ZN5aiter42f4gemm_bf16_per1x32Fp4_BpreShuffle_128x512E,5782.71,422.28,0.0
256,32768,10240,8192,21,0,1095.985,_ZN5aiter42f4gemm_bf16_per1x32Fp4_BpreShuffle_128x512E,5016.09,773.05,0.0
256,32768,14336,8192,24,0,1518.3699,_ZN5aiter42f4gemm_bf16_per1x32Fp4_BpreShuffle_256x256E,5068.98,745.84,0.0
256,1,2304,16384,22,0,54.228,_ZN5aiter42f4gemm_bf16_per1x32Fp4_BpreShuffle_192x256E,1.39,348.29,0.0
256,1,4608,16384,22,0,54.8285,_ZN5aiter42f4gemm_bf16_per1x32Fp4_BpreShuffle_192x256E,2.75,688.8,0.0
256,1,9216,16384,22,0,55.6692,_ZN5aiter42f4gemm_bf16_per1x32Fp4_BpreShuffle_192x256E,5.42,1356.66,0.0
256,1,13312,16384,22,0,56.3998,_ZN5aiter42f4gemm_bf16_per1x32Fp4_BpreShuffle_192x256E,7.73,1934.17,0.0
256,1,16384,2048,22,0,13.1755,_ZN5aiter42f4gemm_bf16_per1x32Fp4_BpreShuffle_192x256E,5.09,1275.93,0.0
256,1,16384,4096,22,0,19.7349,_ZN5aiter42f4gemm_bf16_per1x32Fp4_BpreShuffle_192x256E,6.8,1702.02,0.0
256,1,16384,6656,22,0,27.4026,_ZN5aiter42f4gemm_bf16_per1x32Fp4_BpreShuffle_192x256E,7.96,1991.13,0.0
256,1,16384,8192,22,0,32.0702,_ZN5aiter42f4gemm_bf16_per1x32Fp4_BpreShuffle_192x256E,8.37,2093.71,0.0
256,1,16384,13312,22,0,48.2762,_ZN5aiter42f4gemm_bf16_per1x32Fp4_BpreShuffle_192x256E,9.04,2259.73,0.0
256,1,16384,26624,22,0,88.8555,_ZN5aiter42f4gemm_bf16_per1x32Fp4_BpreShuffle_192x256E,9.82,2455.11,0.0
256,1,26624,16384,22,0,67.635,_ZN5aiter42f4gemm_bf16_per1x32Fp4_BpreShuffle_192x256E,12.9,3225.63,0.0
256,1,53248,16384,23,0,93.552,_ZN5aiter42f4gemm_bf16_per1x32Fp4_BpreShuffle_224x256E,18.65,4663.95,0.0
256,16,2304,16384,22,0,54.497,_ZN5aiter42f4gemm_bf16_per1x32Fp4_BpreShuffle_192x256E,22.17,350.1,0.0
256,16,4608,16384,22,0,55.1294,_ZN5aiter42f4gemm_bf16_per1x32Fp4_BpreShuffle_192x256E,43.82,689.78,0.0
256,16,9216,16384,22,0,56.0213,_ZN5aiter42f4gemm_bf16_per1x32Fp4_BpreShuffle_192x256E,86.25,1355.26,0.0
256,16,13312,16384,22,0,57.3288,_ZN5aiter42f4gemm_bf16_per1x32Fp4_BpreShuffle_192x256E,121.74,1911.94,0.0
256,16,16384,2048,22,0,13.5196,_ZN5aiter42f4gemm_bf16_per1x32Fp4_BpreShuffle_192x256E,79.42,1280.95,0.0
256,16,16384,4096,22,0,20.1525,_ZN5aiter42f4gemm_bf16_per1x32Fp4_BpreShuffle_192x256E,106.56,1692.67,0.0
256,16,16384,6656,22,0,27.8764,_ZN5aiter42f4gemm_bf16_per1x32Fp4_BpreShuffle_192x256E,125.18,1976.71,0.0
256,16,16384,8192,22,0,32.3757,_ZN5aiter42f4gemm_bf16_per1x32Fp4_BpreShuffle_192x256E,132.66,2091.03,0.0
256,16,16384,13312,22,0,48.4342,_ZN5aiter42f4gemm_bf16_per1x32Fp4_BpreShuffle_192x256E,144.1,2264.57,0.0
256,16,16384,26624,22,0,88.5627,_ZN5aiter42f4gemm_bf16_per1x32Fp4_BpreShuffle_192x256E,157.61,2471.03,0.0
256,16,26624,16384,22,0,67.8006,_ZN5aiter42f4gemm_bf16_per1x32Fp4_BpreShuffle_192x256E,205.88,3231.34,0.0
256,16,53248,16384,23,0,90.25,_ZN5aiter42f4gemm_bf16_per1x32Fp4_BpreShuffle_224x256E,309.33,4853.66,0.0
256,32,2304,16384,22,0,57.4695,_ZN5aiter42f4gemm_bf16_per1x32Fp4_BpreShuffle_192x256E,42.04,335.55,0.0
256,32,4608,16384,22,0,58.335,_ZN5aiter42f4gemm_bf16_per1x32Fp4_BpreShuffle_192x256E,82.83,656.65,0.0
256,32,9216,16384,22,0,60.2896,_ZN5aiter42f4gemm_bf16_per1x32Fp4_BpreShuffle_192x256E,160.29,1266.38,0.0
256,32,13312,16384,22,0,61.121,_ZN5aiter42f4gemm_bf16_per1x32Fp4_BpreShuffle_192x256E,228.38,1802.42,0.0
256,32,16384,2048,22,0,14.0172,_ZN5aiter42f4gemm_bf16_per1x32Fp4_BpreShuffle_192x256E,153.2,1274.05,0.0
256,32,16384,4096,22,0,21.0909,_ZN5aiter42f4gemm_bf16_per1x32Fp4_BpreShuffle_192x256E,203.64,1643.77,0.0
256,32,16384,6656,22,0,28.5672,_ZN5aiter42f4gemm_bf16_per1x32Fp4_BpreShuffle_192x256E,244.31,1949.12,0.0
256,32,16384,8192,22,0,34.3324,_ZN5aiter42f4gemm_bf16_per1x32Fp4_BpreShuffle_192x256E,250.2,1989.04,0.0
256,32,16384,13312,22,0,51.6938,_ZN5aiter42f4gemm_bf16_per1x32Fp4_BpreShuffle_192x256E,270.03,2133.98,0.0
256,32,16384,26624,22,0,95.9257,_ZN5aiter42f4gemm_bf16_per1x32Fp4_BpreShuffle_192x256E,291.03,2289.05,0.0
256,32,26624,16384,22,0,66.3483,_ZN5aiter42f4gemm_bf16_per1x32Fp4_BpreShuffle_192x256E,420.77,3316.89,0.0
256,32,53248,16384,22,0,90.8983,_ZN5aiter42f4gemm_bf16_per1x32Fp4_BpreShuffle_192x256E,614.25,4839.23,0.0
256,64,2304,16384,22,0,71.074,_ZN5aiter42f4gemm_bf16_per1x32Fp4_BpreShuffle_192x256E,67.98,277.09,0.0
256,64,4608,16384,22,0,71.0803,_ZN5aiter42f4gemm_bf16_per1x32Fp4_BpreShuffle_192x256E,135.95,546.75,0.0
256,64,9216,16384,22,0,72.79,_ZN5aiter42f4gemm_bf16_per1x32Fp4_BpreShuffle_192x256E,265.52,1060.6,0.0
256,64,13312,16384,22,0,73.7269,_ZN5aiter42f4gemm_bf16_per1x32Fp4_BpreShuffle_192x256E,378.66,1509.36,0.0
256,64,16384,2048,22,0,15.9967,_ZN5aiter42f4gemm_bf16_per1x32Fp4_BpreShuffle_192x256E,268.49,1183.99,0.0
256,64,16384,4096,22,0,24.9174,_ZN5aiter42f4gemm_bf16_per1x32Fp4_BpreShuffle_192x256E,344.74,1436.05,0.0
256,64,16384,6656,22,0,29.7224,_ZN5aiter42f4gemm_bf16_per1x32Fp4_BpreShuffle_192x256E,469.63,1912.23,0.0
256,64,16384,8192,22,0,42.3136,_ZN5aiter42f4gemm_bf16_per1x32Fp4_BpreShuffle_192x256E,406.01,1641.75,0.0
256,64,16384,13312,22,0,63.2353,_ZN5aiter42f4gemm_bf16_per1x32Fp4_BpreShuffle_192x256E,441.48,1764.44,0.0
256,64,16384,26624,22,0,118.0797,_ZN5aiter42f4gemm_bf16_per1x32Fp4_BpreShuffle_192x256E,472.85,1872.07,0.0
256,64,26624,16384,22,0,81.4048,_ZN5aiter42f4gemm_bf16_per1x32Fp4_BpreShuffle_192x256E,685.89,2727.55,0.0
256,64,53248,16384,22,0,101.678,_ZN5aiter42f4gemm_bf16_per1x32Fp4_BpreShuffle_192x256E,1098.26,4362.28,0.0
256,128,2304,16384,22,0,92.3753,_ZN5aiter42f4gemm_bf16_per1x32Fp4_BpreShuffle_192x256E,104.61,222.06,0.0
256,128,4608,16384,22,0,91.2541,_ZN5aiter42f4gemm_bf16_per1x32Fp4_BpreShuffle_192x256E,211.8,438.08,0.0
256,128,9216,16384,22,0,92.7914,_ZN5aiter42f4gemm_bf16_per1x32Fp4_BpreShuffle_192x256E,416.58,850.35,0.0
256,128,13312,16384,22,0,93.9115,_ZN5aiter42f4gemm_bf16_per1x32Fp4_BpreShuffle_192x256E,594.54,1208.67,0.0
256,128,16384,2048,24,0,18.408,_ZN5aiter42f4gemm_bf16_per1x32Fp4_BpreShuffle_256x256E,466.64,1146.38,0.0
256,128,16384,4096,22,0,29.868,_ZN5aiter42f4gemm_bf16_per1x32Fp4_BpreShuffle_192x256E,575.19,1272.63,0.0
256,128,16384,6656,22,0,34.6837,_ZN5aiter42f4gemm_bf16_per1x32Fp4_BpreShuffle_192x256E,804.91,1705.3,0.0
256,128,16384,8192,22,0,50.9228,_ZN5aiter42f4gemm_bf16_per1x32Fp4_BpreShuffle_192x256E,674.74,1410.52,0.0
256,128,16384,13312,22,0,79.4221,_ZN5aiter42f4gemm_bf16_per1x32Fp4_BpreShuffle_192x256E,703.01,1436.6,0.0
256,128,16384,26624,22,0,150.0883,_ZN5aiter42f4gemm_bf16_per1x32Fp4_BpreShuffle_192x256E,744.02,1492.47,0.0
256,128,26624,16384,22,0,107.138,_ZN5aiter42f4gemm_bf16_per1x32Fp4_BpreShuffle_192x256E,1042.29,2109.13,0.0
256,128,53248,16384,22,0,141.2763,_ZN5aiter42f4gemm_bf16_per1x32Fp4_BpreShuffle_192x256E,1580.86,3191.53,0.0
256,256,2304,16384,21,0,108.4593,_ZN5aiter42f4gemm_bf16_per1x32Fp4_BpreShuffle_128x512E,178.2,204.23,0.0
256,256,4608,16384,22,0,107.8069,_ZN5aiter42f4gemm_bf16_per1x32Fp4_BpreShuffle_192x256E,358.56,391.49,0.0
256,256,9216,16384,22,0,108.3814,_ZN5aiter42f4gemm_bf16_per1x32Fp4_BpreShuffle_192x256E,713.31,759.48,0.0
256,256,13312,16384,22,0,110.1625,_ZN5aiter42f4gemm_bf16_per1x32Fp4_BpreShuffle_192x256E,1013.68,1070.83,0.0
256,256,16384,2048,22,0,21.1463,_ZN5aiter42f4gemm_bf16_per1x32Fp4_BpreShuffle_192x256E,812.43,1202.48,0.0
256,256,16384,4096,22,0,34.0919,_ZN5aiter42f4gemm_bf16_per1x32Fp4_BpreShuffle_192x256E,1007.86,1245.67,0.0
256,256,16384,6656,22,0,38.0461,_ZN5aiter42f4gemm_bf16_per1x32Fp4_BpreShuffle_192x256E,1467.55,1676.03,0.0
256,256,16384,8192,22,0,59.9,_ZN5aiter42f4gemm_bf16_per1x32Fp4_BpreShuffle_192x256E,1147.24,1277.9,0.0
256,256,16384,13312,22,0,93.0116,_ZN5aiter42f4gemm_bf16_per1x32Fp4_BpreShuffle_192x256E,1200.59,1280.96,0.0
256,256,16384,26624,22,0,176.6064,_ZN5aiter42f4gemm_bf16_per1x32Fp4_BpreShuffle_192x256E,1264.61,1301.77,0.0
256,256,26624,16384,22,0,120.1856,_ZN5aiter42f4gemm_bf16_per1x32Fp4_BpreShuffle_192x256E,1858.28,1945.59,0.0
256,256,53248,16384,21,0,151.2215,_ZN5aiter42f4gemm_bf16_per1x32Fp4_BpreShuffle_128x512E,2953.79,3078.71,0.0
256,512,2304,16384,21,0,107.5004,_ZN5aiter42f4gemm_bf16_per1x32Fp4_BpreShuffle_128x512E,359.58,236.54,0.0
256,512,4608,16384,22,0,109.4743,_ZN5aiter42f4gemm_bf16_per1x32Fp4_BpreShuffle_192x256E,706.19,426.23,0.0
256,512,9216,16384,22,0,110.9333,_ZN5aiter42f4gemm_bf16_per1x32Fp4_BpreShuffle_192x256E,1393.8,803.45,0.0
256,512,13312,16384,22,0,114.1209,_ZN5aiter42f4gemm_bf16_per1x32Fp4_BpreShuffle_192x256E,1957.03,1111.78,0.0
256,512,16384,2048,22,0,23.2178,_ZN5aiter42f4gemm_bf16_per1x32Fp4_BpreShuffle_192x256E,1479.89,1467.78,0.0
256,512,16384,4096,21,0,36.11,_ZN5aiter42f4gemm_bf16_per1x32Fp4_BpreShuffle_128x512E,1903.06,1422.88,0.0
256,512,16384,6656,22,0,42.752,_ZN5aiter42f4gemm_bf16_per1x32Fp4_BpreShuffle_192x256E,2612.02,1707.69,0.0
256,512,16384,8192,21,0,61.8761,_ZN5aiter42f4gemm_bf16_per1x32Fp4_BpreShuffle_128x512E,2221.2,1389.6,0.0
256,512,16384,13312,22,0,97.7111,_ZN5aiter42f4gemm_bf16_per1x32Fp4_BpreShuffle_192x256E,2285.7,1322.64,0.0
256,512,16384,26624,22,0,183.8225,_ZN5aiter42f4gemm_bf16_per1x32Fp4_BpreShuffle_192x256E,2429.93,1314.84,0.0
256,512,26624,16384,21,0,138.8661,_ZN5aiter42f4gemm_bf16_per1x32Fp4_BpreShuffle_128x512E,3216.6,1797.13,0.0
256,512,53248,16384,21,0,290.6719,_ZN5aiter42f4gemm_bf16_per1x32Fp4_BpreShuffle_128x512E,3073.41,1702.7,0.0
256,1024,2304,16384,21,0,107.5816,_ZN5aiter42f4gemm_bf16_per1x32Fp4_BpreShuffle_128x512E,718.61,297.28,0.0
256,1024,4608,16384,22,0,111.1722,_ZN5aiter42f4gemm_bf16_per1x32Fp4_BpreShuffle_192x256E,1390.8,499.9,0.0
256,1024,9216,16384,22,0,114.4692,_ZN5aiter42f4gemm_bf16_per1x32Fp4_BpreShuffle_192x256E,2701.49,897.71,0.0
256,1024,13312,16384,21,0,135.3356,_ZN5aiter42f4gemm_bf16_per1x32Fp4_BpreShuffle_128x512E,3300.51,1069.22,0.0
256,1024,16384,2048,21,0,25.9041,_ZN5aiter42f4gemm_bf16_per1x32Fp4_BpreShuffle_128x512E,2652.84,1983.48,0.0
256,1024,16384,4096,21,0,41.6209,_ZN5aiter42f4gemm_bf16_per1x32Fp4_BpreShuffle_128x512E,3302.16,1662.77,0.0
256,1024,16384,6656,24,0,54.1997,_ZN5aiter42f4gemm_bf16_per1x32Fp4_BpreShuffle_256x256E,4120.66,1687.98,0.0
256,1024,16384,8192,21,0,71.1258,_ZN5aiter42f4gemm_bf16_per1x32Fp4_BpreShuffle_128x512E,3864.67,1474.26,0.0
256,1024,16384,13312,21,0,107.964,_ZN5aiter42f4gemm_bf16_per1x32Fp4_BpreShuffle_128x512E,4137.27,1384.0,0.0
256,1024,16384,26624,21,0,209.6498,_ZN5aiter42f4gemm_bf16_per1x32Fp4_BpreShuffle_128x512E,4261.17,1265.39,0.0
256,1024,26624,16384,21,0,240.4895,_ZN5aiter42f4gemm_bf16_per1x32Fp4_BpreShuffle_128x512E,3714.73,1168.53,0.0
256,1024,53248,16384,21,0,568.4868,_ZN5aiter42f4gemm_bf16_per1x32Fp4_BpreShuffle_128x512E,3142.92,973.9,0.0
256,2048,2304,16384,21,0,108.8889,_ZN5aiter42f4gemm_bf16_per1x32Fp4_BpreShuffle_128x512E,1419.97,414.08,0.0
256,2048,4608,16384,22,0,115.5181,_ZN5aiter42f4gemm_bf16_per1x32Fp4_BpreShuffle_192x256E,2676.96,635.4,0.0
256,2048,9216,16384,21,0,223.9904,_ZN5aiter42f4gemm_bf16_per1x32Fp4_BpreShuffle_128x512E,2761.17,580.49,0.0
256,2048,13312,16384,21,0,238.795,_ZN5aiter42f4gemm_bf16_per1x32Fp4_BpreShuffle_128x512E,3741.09,755.27,0.0
256,2048,16384,2048,21,0,48.2561,_ZN5aiter42f4gemm_bf16_per1x32Fp4_BpreShuffle_128x512E,2848.12,1781.81,0.0
256,2048,16384,4096,21,0,74.5022,_ZN5aiter42f4gemm_bf16_per1x32Fp4_BpreShuffle_128x512E,3689.53,1407.44,0.0
256,2048,16384,6656,21,0,102.0232,_ZN5aiter42f4gemm_bf16_per1x32Fp4_BpreShuffle_128x512E,4378.19,1259.03,0.0
256,2048,16384,8192,21,0,132.5113,_ZN5aiter42f4gemm_bf16_per1x32Fp4_BpreShuffle_128x512E,4148.75,1076.18,0.0
256,2048,16384,13312,21,0,201.9408,_ZN5aiter42f4gemm_bf16_per1x32Fp4_BpreShuffle_128x512E,4423.84,939.84,0.0
256,2048,16384,26624,21,0,402.1677,_ZN5aiter42f4gemm_bf16_per1x32Fp4_BpreShuffle_128x512E,4442.69,776.98,0.0
256,2048,26624,16384,21,0,455.1222,_ZN5aiter42f4gemm_bf16_per1x32Fp4_BpreShuffle_128x512E,3925.77,755.69,0.0
256,2048,53248,16384,23,0,1020.5831,_ZN5aiter42f4gemm_bf16_per1x32Fp4_BpreShuffle_224x256E,3501.34,657.55,0.0
256,4096,2304,16384,21,0,111.9014,_ZN5aiter42f4gemm_bf16_per1x32Fp4_BpreShuffle_128x512E,2763.48,637.2,0.0
256,4096,4608,16384,21,0,229.3561,_ZN5aiter42f4gemm_bf16_per1x32Fp4_BpreShuffle_128x512E,2696.57,475.47,0.0
256,4096,9216,16384,21,0,332.5793,_ZN5aiter42f4gemm_bf16_per1x32Fp4_BpreShuffle_128x512E,3719.27,554.9,0.0
256,4096,13312,16384,21,0,452.543,_ZN5aiter42f4gemm_bf16_per1x32Fp4_BpreShuffle_128x512E,3948.15,556.1,0.0
256,4096,16384,2048,21,0,89.4208,_ZN5aiter42f4gemm_bf16_per1x32Fp4_BpreShuffle_128x512E,3073.98,1735.49,0.0
256,4096,16384,4096,21,0,143.3347,_ZN5aiter42f4gemm_bf16_per1x32Fp4_BpreShuffle_128x512E,3835.47,1229.02,0.0
256,4096,16384,6656,21,0,187.1434,_ZN5aiter42f4gemm_bf16_per1x32Fp4_BpreShuffle_128x512E,4773.63,1081.39,0.0
256,4096,16384,8192,21,0,241.4522,_ZN5aiter42f4gemm_bf16_per1x32Fp4_BpreShuffle_128x512E,4553.74,903.3,0.0
256,4096,16384,13312,21,0,375.9024,_ZN5aiter42f4gemm_bf16_per1x32Fp4_BpreShuffle_128x512E,4753.11,719.69,0.0
256,4096,16384,26624,21,0,774.919,_ZN5aiter42f4gemm_bf16_per1x32Fp4_BpreShuffle_128x512E,4611.34,525.02,0.0
256,4096,26624,16384,21,0,815.3837,_ZN5aiter42f4gemm_bf16_per1x32Fp4_BpreShuffle_128x512E,4382.49,576.12,0.0
256,4096,53248,16384,23,0,1873.5902,_ZN5aiter42f4gemm_bf16_per1x32Fp4_BpreShuffle_224x256E,3814.51,483.55,0.0
256,8192,2304,16384,21,0,206.6824,_ZN5aiter42f4gemm_bf16_per1x32Fp4_BpreShuffle_128x512E,2992.39,598.66,0.0
256,8192,4608,16384,21,0,343.9039,_ZN5aiter42f4gemm_bf16_per1x32Fp4_BpreShuffle_128x512E,3596.79,524.43,0.0
256,8192,9216,16384,21,0,575.8693,_ZN5aiter42f4gemm_bf16_per1x32Fp4_BpreShuffle_128x512E,4295.94,509.84,0.0
256,8192,13312,16384,21,0,817.9465,_ZN5aiter42f4gemm_bf16_per1x32Fp4_BpreShuffle_128x512E,4368.76,482.02,0.0
256,8192,16384,2048,21,0,173.5314,_ZN5aiter42f4gemm_bf16_per1x32Fp4_BpreShuffle_128x512E,3168.05,1691.92,0.0
256,8192,16384,4096,21,0,273.4299,_ZN5aiter42f4gemm_bf16_per1x32Fp4_BpreShuffle_128x512E,4021.18,1165.81,0.0
256,8192,16384,6656,21,0,367.9599,_ZN5aiter42f4gemm_bf16_per1x32Fp4_BpreShuffle_128x512E,4855.71,951.8,0.0
256,8192,16384,8192,21,0,479.4436,_ZN5aiter42f4gemm_bf16_per1x32Fp4_BpreShuffle_128x512E,4586.62,769.85,0.0
256,8192,16384,13312,21,0,736.0417,_ZN5aiter42f4gemm_bf16_per1x32Fp4_BpreShuffle_128x512E,4854.91,586.94,0.0
256,8192,16384,26624,21,0,1541.7372,_ZN5aiter42f4gemm_bf16_per1x32Fp4_BpreShuffle_128x512E,4635.57,386.31,0.0
256,8192,26624,16384,21,0,1511.9247,_ZN5aiter42f4gemm_bf16_per1x32Fp4_BpreShuffle_128x512E,4726.97,477.15,0.0
256,8192,53248,16384,24,0,3487.837,_ZN5aiter42f4gemm_bf16_per1x32Fp4_BpreShuffle_256x256E,4098.14,394.44,0.0
256,16384,2304,16384,21,0,319.2593,_ZN5aiter42f4gemm_bf16_per1x32Fp4_BpreShuffle_128x512E,3874.44,716.0,0.0
256,16384,4608,16384,21,0,582.7793,_ZN5aiter42f4gemm_bf16_per1x32Fp4_BpreShuffle_128x512E,4245.01,554.17,0.0
256,16384,9216,16384,21,0,1058.9369,_ZN5aiter42f4gemm_bf16_per1x32Fp4_BpreShuffle_128x512E,4672.42,483.23,0.0
256,16384,13312,16384,21,0,1515.2712,_ZN5aiter42f4gemm_bf16_per1x32Fp4_BpreShuffle_128x512E,4716.53,448.42,0.0
256,16384,16384,2048,21,0,333.8239,_ZN5aiter42f4gemm_bf16_per1x32Fp4_BpreShuffle_128x512E,3293.69,1708.76,0.0
256,16384,16384,4096,21,0,539.3316,_ZN5aiter42f4gemm_bf16_per1x32Fp4_BpreShuffle_128x512E,4077.31,1119.87,0.0
256,16384,16384,6656,21,0,742.6742,_ZN5aiter42f4gemm_bf16_per1x32Fp4_BpreShuffle_128x512E,4811.55,869.73,0.0
256,16384,16384,8192,21,0,946.9637,_ZN5aiter42f4gemm_bf16_per1x32Fp4_BpreShuffle_128x512E,4644.37,708.67,0.0
256,16384,16384,13312,21,0,1457.1619,_ZN5aiter42f4gemm_bf16_per1x32Fp4_BpreShuffle_128x512E,4904.62,518.11,0.0
256,16384,16384,26624,21,0,3056.6872,_ZN5aiter42f4gemm_bf16_per1x32Fp4_BpreShuffle_128x512E,4676.19,318.34,0.0
256,16384,26624,16384,21,0,3022.95,_ZN5aiter42f4gemm_bf16_per1x32Fp4_BpreShuffle_128x512E,4728.38,405.15,0.0
256,16384,53248,16384,23,0,6935.401,_ZN5aiter42f4gemm_bf16_per1x32Fp4_BpreShuffle_224x256E,4121.94,333.83,0.0
256,32768,2304,16384,21,0,567.9662,_ZN5aiter42f4gemm_bf16_per1x32Fp4_BpreShuffle_128x512E,4355.72,771.71,0.0
256,32768,4608,16384,21,0,1073.3623,_ZN5aiter42f4gemm_bf16_per1x32Fp4_BpreShuffle_128x512E,4609.63,566.61,0.0
256,32768,9216,16384,21,0,2140.2392,_ZN5aiter42f4gemm_bf16_per1x32Fp4_BpreShuffle_128x512E,4623.6,442.9,0.0
256,32768,13312,16384,21,0,3016.9627,_ZN5aiter42f4gemm_bf16_per1x32Fp4_BpreShuffle_128x512E,4737.76,414.29,0.0
256,32768,16384,2048,21,0,665.6559,_ZN5aiter42f4gemm_bf16_per1x32Fp4_BpreShuffle_128x512E,3303.54,1688.67,0.0
256,32768,16384,4096,21,0,1079.5229,_ZN5aiter42f4gemm_bf16_per1x32Fp4_BpreShuffle_128x512E,4074.07,1087.89,0.0
256,32768,16384,6656,21,0,1440.8879,_ZN5aiter42f4gemm_bf16_per1x32Fp4_BpreShuffle_128x512E,4960.01,858.72,0.0
256,32768,16384,8192,21,0,1881.3883,_ZN5aiter42f4gemm_bf16_per1x32Fp4_BpreShuffle_128x512E,4675.32,677.73,0.0
256,32768,16384,13312,21,0,2881.7149,_ZN5aiter42f4gemm_bf16_per1x32Fp4_BpreShuffle_128x512E,4960.12,486.13,0.0
256,32768,16384,26624,21,0,6065.6024,_ZN5aiter42f4gemm_bf16_per1x32Fp4_BpreShuffle_128x512E,4713.02,284.89,0.0
256,32768,26624,16384,21,0,6036.7678,_ZN5aiter42f4gemm_bf16_per1x32Fp4_BpreShuffle_128x512E,4735.53,369.63,0.0
256,32768,53248,16384,23,0,13786.4608,_ZN5aiter42f4gemm_bf16_per1x32Fp4_BpreShuffle_224x256E,4147.16,304.23,0.0
256,1,800,5120,22,0,21.1826,_ZN5aiter42f4gemm_bf16_per1x32Fp4_BpreShuffle_192x256E,0.39,96.88,0.0
256,1,5120,1280,24,0,10.6228,_ZN5aiter42f4gemm_bf16_per1x32Fp4_BpreShuffle_256x256E,1.23,309.49,0.0
256,1,5120,5120,22,0,21.6916,_ZN5aiter42f4gemm_bf16_per1x32Fp4_BpreShuffle_192x256E,2.42,604.84,0.0
256,1,5120,6400,22,0,25.1926,_ZN5aiter42f4gemm_bf16_per1x32Fp4_BpreShuffle_192x256E,2.6,650.88,0.0
256,1,5120,25600,22,0,80.971,_ZN5aiter42f4gemm_bf16_per1x32Fp4_BpreShuffle_192x256E,3.24,809.66,0.0
256,1,6400,5120,22,0,21.6256,_ZN5aiter42f4gemm_bf16_per1x32Fp4_BpreShuffle_192x256E,3.03,758.33,0.0
256,1,12800,5120,22,0,22.2311,_ZN5aiter42f4gemm_bf16_per1x32Fp4_BpreShuffle_192x256E,5.9,1475.24,0.0
256,1,51200,5120,22,0,31.4607,_ZN5aiter42f4gemm_bf16_per1x32Fp4_BpreShuffle_192x256E,16.66,4169.55,0.0
256,16,800,5120,22,0,21.2953,_ZN5aiter42f4gemm_bf16_per1x32Fp4_BpreShuffle_192x256E,6.15,99.3,0.0
256,16,5120,1280,24,0,10.5633,_ZN5aiter42f4gemm_bf16_per1x32Fp4_BpreShuffle_256x256E,19.85,326.69,0.0
256,16,5120,5120,22,0,21.8339,_ZN5aiter42f4gemm_bf16_per1x32Fp4_BpreShuffle_192x256E,38.42,609.69,0.0
256,16,5120,6400,22,0,25.6474,_ZN5aiter42f4gemm_bf16_per1x32Fp4_BpreShuffle_192x256E,40.88,647.2,0.0
256,16,5120,25600,22,0,81.7599,_ZN5aiter42f4gemm_bf16_per1x32Fp4_BpreShuffle_192x256E,51.3,806.08,0.0
256,16,6400,5120,22,0,22.5349,_ZN5aiter42f4gemm_bf16_per1x32Fp4_BpreShuffle_192x256E,46.53,737.96,0.0
256,16,12800,5120,22,0,22.5012,_ZN5aiter42f4gemm_bf16_per1x32Fp4_BpreShuffle_192x256E,93.2,1476.3,0.0
256,16,51200,5120,22,0,31.0446,_ZN5aiter42f4gemm_bf16_per1x32Fp4_BpreShuffle_192x256E,270.21,4276.15,0.0
256,32,800,5120,22,0,21.989,_ZN5aiter42f4gemm_bf16_per1x32Fp4_BpreShuffle_192x256E,11.92,99.19,0.0
256,32,5120,1280,24,0,10.7961,_ZN5aiter42f4gemm_bf16_per1x32Fp4_BpreShuffle_256x256E,38.85,335.77,0.0
256,32,5120,5120,22,0,23.3446,_ZN5aiter42f4gemm_bf16_per1x32Fp4_BpreShuffle_192x256E,71.87,579.01,0.0
256,32,5120,6400,22,0,25.8126,_ZN5aiter42f4gemm_bf16_per1x32Fp4_BpreShuffle_192x256E,81.25,651.39,0.0
256,32,5120,25600,22,0,92.6403,_ZN5aiter42f4gemm_bf16_per1x32Fp4_BpreShuffle_192x256E,90.55,715.38,0.0
256,32,6400,5120,22,0,23.2386,_ZN5aiter42f4gemm_bf16_per1x32Fp4_BpreShuffle_192x256E,90.24,726.18,0.0
256,32,12800,5120,22,0,24.1217,_ZN5aiter42f4gemm_bf16_per1x32Fp4_BpreShuffle_192x256E,173.88,1395.8,0.0
256,32,51200,5120,22,0,32.5996,_ZN5aiter42f4gemm_bf16_per1x32Fp4_BpreShuffle_192x256E,514.64,4123.69,0.0
256,64,800,5120,22,0,25.8477,_ZN5aiter42f4gemm_bf16_per1x32Fp4_BpreShuffle_192x256E,20.28,89.53,0.0
256,64,5120,1280,22,0,11.1583,_ZN5aiter42f4gemm_bf16_per1x32Fp4_BpreShuffle_192x256E,75.18,356.07,0.0
256,64,5120,5120,22,0,27.532,_ZN5aiter42f4gemm_bf16_per1x32Fp4_BpreShuffle_192x256E,121.87,505.83,0.0
256,64,5120,6400,22,0,25.4915,_ZN5aiter42f4gemm_bf16_per1x32Fp4_BpreShuffle_192x256E,164.54,676.47,0.0
256,64,5120,25600,22,0,109.1856,_ZN5aiter42f4gemm_bf16_per1x32Fp4_BpreShuffle_192x256E,153.66,613.73,0.0
256,64,6400,5120,22,0,27.7736,_ZN5aiter42f4gemm_bf16_per1x32Fp4_BpreShuffle_192x256E,151.02,625.31,0.0
256,64,12800,5120,22,0,28.2001,_ZN5aiter42f4gemm_bf16_per1x32Fp4_BpreShuffle_192x256E,297.47,1225.89,0.0
256,64,51200,5120,24,0,39.1796,_ZN5aiter42f4gemm_bf16_per1x32Fp4_BpreShuffle_256x256E,856.43,3516.87,0.0
256,128,800,5120,24,0,32.7867,_ZN5aiter42f4gemm_bf16_per1x32Fp4_BpreShuffle_256x256E,31.98,78.71,0.0
256,128,5120,1280,22,0,11.722,_ZN5aiter42f4gemm_bf16_per1x32Fp4_BpreShuffle_192x256E,143.13,398.35,0.0
256,128,5120,5120,22,0,33.783,_ZN5aiter42f4gemm_bf16_per1x32Fp4_BpreShuffle_192x256E,198.65,436.48,0.0
256,128,5120,6400,22,0,26.7835,_ZN5aiter42f4gemm_bf16_per1x32Fp4_BpreShuffle_192x256E,313.2,675.95,0.0
256,128,5120,25600,22,0,140.1972,_ZN5aiter42f4gemm_bf16_per1x32Fp4_BpreShuffle_192x256E,239.34,488.49,0.0
256,128,6400,5120,22,0,33.6507,_ZN5aiter42f4gemm_bf16_per1x32Fp4_BpreShuffle_192x256E,249.28,545.31,0.0
256,128,12800,5120,22,0,33.9284,_ZN5aiter42f4gemm_bf16_per1x32Fp4_BpreShuffle_192x256E,494.49,1072.04,0.0
256,128,51200,5120,21,0,52.5393,_ZN5aiter42f4gemm_bf16_per1x32Fp4_BpreShuffle_128x512E,1277.31,2750.45,0.0
256,256,800,5120,22,0,36.8477,_ZN5aiter42f4gemm_bf16_per1x32Fp4_BpreShuffle_192x256E,56.91,84.48,0.0
256,256,5120,1280,22,0,11.8102,_ZN5aiter42f4gemm_bf16_per1x32Fp4_BpreShuffle_192x256E,284.11,513.29,0.0
256,256,5120,5120,22,0,38.9154,_ZN5aiter42f4gemm_bf16_per1x32Fp4_BpreShuffle_192x256E,344.9,421.02,0.0
256,256,5120,6400,22,0,27.5295,_ZN5aiter42f4gemm_bf16_per1x32Fp4_BpreShuffle_192x256E,609.43,720.12,0.0
256,256,5120,25600,22,0,166.5121,_ZN5aiter42f4gemm_bf16_per1x32Fp4_BpreShuffle_192x256E,403.03,429.0,0.0
256,256,6400,5120,22,0,39.3243,_ZN5aiter42f4gemm_bf16_per1x32Fp4_BpreShuffle_192x256E,426.64,516.63,0.0
256,256,12800,5120,22,0,40.3949,_ZN5aiter42f4gemm_bf16_per1x32Fp4_BpreShuffle_192x256E,830.66,989.65,0.0
256,256,51200,5120,21,0,60.5051,_ZN5aiter42f4gemm_bf16_per1x32Fp4_BpreShuffle_128x512E,2218.29,2610.39,0.0
256,512,800,5120,21,0,38.7761,_ZN5aiter42f4gemm_bf16_per1x32Fp4_BpreShuffle_128x512E,108.17,107.74,0.0
256,512,5120,1280,22,0,12.1842,_ZN5aiter42f4gemm_bf16_per1x32Fp4_BpreShuffle_192x256E,550.79,726.13,0.0
256,512,5120,5120,22,0,39.796,_ZN5aiter42f4gemm_bf16_per1x32Fp4_BpreShuffle_192x256E,674.53,494.04,0.0
256,512,5120,6400,22,0,28.4174,_ZN5aiter42f4gemm_bf16_per1x32Fp4_BpreShuffle_192x256E,1180.77,818.7,0.0
256,512,5120,25600,22,0,167.8761,_ZN5aiter42f4gemm_bf16_per1x32Fp4_BpreShuffle_192x256E,799.5,460.65,0.0
256,512,6400,5120,22,0,40.5552,_ZN5aiter42f4gemm_bf16_per1x32Fp4_BpreShuffle_192x256E,827.38,597.91,0.0
256,512,12800,5120,22,0,42.4981,_ZN5aiter42f4gemm_bf16_per1x32Fp4_BpreShuffle_192x256E,1579.1,1110.31,0.0
256,512,51200,5120,21,0,105.2133,_ZN5aiter42f4gemm_bf16_per1x32Fp4_BpreShuffle_128x512E,2551.35,1756.54,0.0
256,1024,800,5120,23,0,46.2669,_ZN5aiter42f4gemm_bf16_per1x32Fp4_BpreShuffle_224x256E,181.31,136.34,0.0
256,1024,5120,1280,22,0,13.4783,_ZN5aiter42f4gemm_bf16_per1x32Fp4_BpreShuffle_192x256E,995.81,1069.71,0.0
256,1024,5120,5120,21,0,44.3527,_ZN5aiter42f4gemm_bf16_per1x32Fp4_BpreShuffle_128x512E,1210.46,591.04,0.0
256,1024,5120,6400,23,0,33.5992,_ZN5aiter42f4gemm_bf16_per1x32Fp4_BpreShuffle_224x256E,1997.34,897.24,0.0
256,1024,5120,25600,22,0,171.1837,_ZN5aiter42f4gemm_bf16_per1x32Fp4_BpreShuffle_192x256E,1568.11,520.66,0.0
256,1024,6400,5120,22,0,43.1962,_ZN5aiter42f4gemm_bf16_per1x32Fp4_BpreShuffle_192x256E,1553.58,743.41,0.0
256,1024,12800,5120,24,0,57.2077,_ZN5aiter42f4gemm_bf16_per1x32Fp4_BpreShuffle_256x256E,2346.15,1076.85,0.0
256,1024,51200,5120,24,0,187.2715,_ZN5aiter42f4gemm_bf16_per1x32Fp4_BpreShuffle_256x256E,2866.81,1273.82,0.0
256,2048,5120,1280,22,0,15.4982,_ZN5aiter42f4gemm_bf16_per1x32Fp4_BpreShuffle_192x256E,1732.04,1649.16,0.0
256,2048,5120,5120,21,0,46.2885,_ZN5aiter42f4gemm_bf16_per1x32Fp4_BpreShuffle_128x512E,2319.67,849.49,0.0
256,2048,5120,6400,24,0,41.7888,_ZN5aiter42f4gemm_bf16_per1x32Fp4_BpreShuffle_256x256E,3211.81,1050.74,0.0
256,2048,5120,25600,22,0,174.6649,_ZN5aiter42f4gemm_bf16_per1x32Fp4_BpreShuffle_192x256E,3073.72,645.36,0.0
256,2048,6400,5120,21,0,46.4622,_ZN5aiter42f4gemm_bf16_per1x32Fp4_BpreShuffle_128x512E,2888.75,1029.68,0.0
256,2048,12800,5120,21,0,99.5665,_ZN5aiter42f4gemm_bf16_per1x32Fp4_BpreShuffle_128x512E,2696.04,908.33,0.0
256,2048,51200,5120,24,0,329.4363,_ZN5aiter42f4gemm_bf16_per1x32Fp4_BpreShuffle_256x256E,3259.33,1050.37,0.0
256,4096,800,5120,21,0,39.6258,_ZN5aiter42f4gemm_bf16_per1x32Fp4_BpreShuffle_128x512E,846.78,481.69,0.0
256,4096,5120,1280,21,0,29.7493,_ZN5aiter42f4gemm_bf16_per1x32Fp4_BpreShuffle_128x512E,1804.65,1608.15,0.0
256,4096,5120,5120,21,0,82.8112,_ZN5aiter42f4gemm_bf16_per1x32Fp4_BpreShuffle_128x512E,2593.23,791.39,0.0
256,4096,5120,6400,24,0,78.0839,_ZN5aiter42f4gemm_bf16_per1x32Fp4_BpreShuffle_256x256E,3437.78,914.84,0.0
256,4096,5120,25600,21,0,335.5366,_ZN5aiter42f4gemm_bf16_per1x32Fp4_BpreShuffle_128x512E,3200.07,476.57,0.0
256,4096,6400,5120,23,0,104.9868,_ZN5aiter42f4gemm_bf16_per1x32Fp4_BpreShuffle_224x256E,2556.85,755.32,0.0
256,4096,12800,5120,24,0,173.0755,_ZN5aiter42f4gemm_bf16_per1x32Fp4_BpreShuffle_256x256E,3101.95,855.76,0.0
256,4096,51200,5120,24,0,615.387,_ZN5aiter42f4gemm_bf16_per1x32Fp4_BpreShuffle_256x256E,3489.65,911.6,0.0
256,8192,800,5120,21,0,41.7607,_ZN5aiter42f4gemm_bf16_per1x32Fp4_BpreShuffle_128x512E,1606.99,865.09,0.0
256,8192,5120,1280,24,0,45.8718,_ZN5aiter42f4gemm_bf16_per1x32Fp4_BpreShuffle_256x256E,2340.74,2014.44,0.0
256,8192,5120,5120,23,0,150.9595,_ZN5aiter42f4gemm_bf16_per1x32Fp4_BpreShuffle_224x256E,2845.11,781.43,0.0
256,8192,5120,6400,24,0,128.6764,_ZN5aiter42f4gemm_bf16_per1x32Fp4_BpreShuffle_256x256E,4172.26,982.97,0.0
256,8192,5120,25600,21,0,515.1458,_ZN5aiter42f4gemm_bf16_per1x32Fp4_BpreShuffle_128x512E,4168.69,493.61,0.0
256,8192,6400,5120,21,0,160.4623,_ZN5aiter42f4gemm_bf16_per1x32Fp4_BpreShuffle_128x512E,3345.78,886.27,0.0
256,8192,12800,5120,24,0,315.7672,_ZN5aiter42f4gemm_bf16_per1x32Fp4_BpreShuffle_256x256E,3400.42,834.33,0.0
256,8192,51200,5120,24,0,1047.6126,_ZN5aiter42f4gemm_bf16_per1x32Fp4_BpreShuffle_256x256E,4099.77,945.87,0.0
256,16384,800,5120,21,0,48.5545,_ZN5aiter42f4gemm_bf16_per1x32Fp4_BpreShuffle_128x512E,2764.27,1445.91,0.0
256,16384,5120,1280,24,0,80.3199,_ZN5aiter42f4gemm_bf16_per1x32Fp4_BpreShuffle_256x256E,2673.66,2260.15,0.0
256,16384,5120,5120,21,0,213.8374,_ZN5aiter42f4gemm_bf16_per1x32Fp4_BpreShuffle_128x512E,4017.04,1042.02,0.0
256,16384,5120,6400,21,0,227.3158,_ZN5aiter42f4gemm_bf16_per1x32Fp4_BpreShuffle_128x512E,4723.57,1040.78,0.0
256,16384,5120,25600,21,0,883.88,_ZN5aiter42f4gemm_bf16_per1x32Fp4_BpreShuffle_128x512E,4859.22,501.23,0.0
256,16384,6400,5120,21,0,294.6844,_ZN5aiter42f4gemm_bf16_per1x32Fp4_BpreShuffle_128x512E,3643.7,909.59,0.0
256,16384,12800,5120,24,0,603.8703,_ZN5aiter42f4gemm_bf16_per1x32Fp4_BpreShuffle_256x256E,3556.2,818.29,0.0
256,16384,51200,5120,24,0,2073.2909,_ZN5aiter42f4gemm_bf16_per1x32Fp4_BpreShuffle_256x256E,4143.14,892.66,0.0
256,32768,5120,1280,21,0,155.9821,_ZN5aiter42f4gemm_bf16_per1x32Fp4_BpreShuffle_128x512E,2753.5,2306.63,0.0
256,32768,5120,5120,21,0,431.6139,_ZN5aiter42f4gemm_bf16_per1x32Fp4_BpreShuffle_128x512E,3980.38,1002.14,0.0
256,32768,5120,6400,24,0,456.7883,_ZN5aiter42f4gemm_bf16_per1x32Fp4_BpreShuffle_256x256E,4701.27,999.99,0.0
256,32768,5120,25600,21,0,1746.4555,_ZN5aiter42f4gemm_bf16_per1x32Fp4_BpreShuffle_128x512E,4918.5,469.81,0.0
256,32768,6400,5120,21,0,555.166,_ZN5aiter42f4gemm_bf16_per1x32Fp4_BpreShuffle_128x512E,3868.18,936.12,0.0
256,32768,12800,5120,24,0,1278.2909,_ZN5aiter42f4gemm_bf16_per1x32Fp4_BpreShuffle_256x256E,3359.93,747.49,0.0
256,32768,51200,5120,24,0,4120.485,_ZN5aiter42f4gemm_bf16_per1x32Fp4_BpreShuffle_256x256E,4169.38,866.5,0.0
256,4,16384,4096,22,0,21.86,_ZN5aiter42f4gemm_bf16_per1x32Fp4_BpreShuffle_192x256E,24.56,1541.34,0.0
256,8,18432,16384,22,0,59.6071,_ZN5aiter42f4gemm_bf16_per1x32Fp4_BpreShuffle_192x256E,81.06,2539.22,0.0
256,8,26624,16384,24,0,82.4334,_ZN5aiter42f4gemm_bf16_per1x32Fp4_BpreShuffle_256x256E,84.67,2651.78,0.0
256,16,16384,16384,23,0,64.5006,_ZN5aiter42f4gemm_bf16_per1x32Fp4_BpreShuffle_224x256E,133.18,2091.04,0.0
256,16,16384,53248,22,0,172.551,_ZN5aiter42f4gemm_bf16_per1x32Fp4_BpreShuffle_192x256E,161.79,2533.5,0.0
256,16,18432,16384,22,0,60.0972,_ZN5aiter42f4gemm_bf16_per1x32Fp4_BpreShuffle_192x256E,160.8,2524.51,0.0
256,16,106496,16384,21,0,163.0693,_ZN5aiter42f4gemm_bf16_per1x32Fp4_BpreShuffle_128x512E,342.4,5371.67,0.0
256,32,16384,53248,22,0,173.429,_ZN5aiter42f4gemm_bf16_per1x32Fp4_BpreShuffle_192x256E,321.94,2526.15,0.0
256,32,18432,16384,22,0,63.2576,_ZN5aiter42f4gemm_bf16_per1x32Fp4_BpreShuffle_192x256E,305.53,2409.78,0.0
256,64,16384,16384,22,0,61.7101,_ZN5aiter42f4gemm_bf16_per1x32Fp4_BpreShuffle_192x256E,556.79,2217.45,0.0
256,64,16384,53248,22,0,178.4558,_ZN5aiter42f4gemm_bf16_per1x32Fp4_BpreShuffle_192x256E,625.75,2465.65,0.0
256,64,18432,16384,22,0,63.2113,_ZN5aiter42f4gemm_bf16_per1x32Fp4_BpreShuffle_192x256E,611.52,2434.35,0.0
256,128,18432,16384,22,0,67.9262,_ZN5aiter42f4gemm_bf16_per1x32Fp4_BpreShuffle_192x256E,1138.14,2307.83,0.0
256,128,106496,16384,21,0,170.5967,_ZN5aiter42f4gemm_bf16_per1x32Fp4_BpreShuffle_128x512E,2618.32,5279.86,0.0
256,256,106496,16384,22,0,422.1716,_ZN5aiter42f4gemm_bf16_per1x32Fp4_BpreShuffle_192x256E,2116.09,2200.62,0.0
256,1024,106496,16384,24,0,921.4139,_ZN5aiter42f4gemm_bf16_per1x32Fp4_BpreShuffle_256x256E,3878.18,1192.63,0.0
