aiter/configs/a8w8_tuned_gemm.csv
cu_num,M,N,K,kernelId,splitK,us,kernelName,errRatio,tflops,bw
80,1,8192,1024,78,0,8.869,a8w8_rowwise_64x16x16x128_16x16_1x1_8x8x1_8x8x1_1x16x1x4_4x4x1_1x1_interwave_v2,0.0,1.89,947.8
80,32,1280,8192,34,0,19.1319,a8w8_rowwise_256x16x64x512_16x16_1x1_32x8x1_32x8x1_1x16x1x16_4x4x1_1x1_intrawave_v3,0.0,35.08,566.06
80,32,8192,1024,28,0,10.039,a8w8_rowwise_256x32x128x256_32x32_1x1_16x16x1_16x16x1_1x32x1x8_8x8x1_1x1_intrawave_v3,0.0,53.48,891.09
80,64,1280,8192,34,0,19.1468,a8w8_rowwise_256x16x64x512_16x16_1x1_32x8x1_32x8x1_1x16x1x16_4x4x1_1x1_intrawave_v3,0.0,70.1,583.59
80,64,8192,1024,21,0,13.5783,a8w8_rowwise_256x64x128x256_32x32_1x2_16x16x1_16x16x1_1x32x1x8_8x8x1_1x1_intrawave_v3,0.0,79.08,699.85
80,128,1280,8192,30,0,23.4448,a8w8_rowwise_256x32x64x512_16x16_1x2_32x8x1_32x8x1_1x32x1x8_8x8x1_1x2_intrawave_v3,0.0,114.5,505.96
80,128,8192,1024,45,0,20.2387,a8w8_rowwise_256x128x64x128_32x32_2x1_8x32x1_8x32x1_1x32x1x8_8x8x1_1x1_intrawave_v3,0.0,106.11,524.58
80,192,1280,8192,23,0,33.0232,a8w8_rowwise_256x64x64x512_32x32_1x1_32x8x1_32x8x1_1x32x1x8_8x8x1_1x1_intrawave_v3,0.0,121.93,380.04
80,192,8192,1024,47,0,26.2387,a8w8_rowwise_256x64x64x128_32x32_1x1_8x32x1_8x32x1_1x32x1x8_8x8x1_1x1_intrawave_v3,0.0,122.77,447.09
80,256,1280,8192,23,0,33.4956,a8w8_rowwise_256x64x64x512_32x32_1x1_32x8x1_32x8x1_1x32x1x8_8x8x1_1x1_intrawave_v3,0.0,160.28,395.22
80,256,8192,1024,13,0,29.8954,a8w8_rowwise_256x128x128x128_32x32_2x2_8x32x1_8x32x1_1x32x1x8_8x8x1_1x1_intrawave_v3,0.0,143.67,429.67
80,320,1280,8192,21,0,54.5624,a8w8_rowwise_256x64x128x256_32x32_1x2_16x16x1_16x16x1_1x32x1x8_8x8x1_1x1_intrawave_v3,0.0,122.99,255.24
80,320,8192,1024,47,0,40.0372,a8w8_rowwise_256x64x64x128_32x32_1x1_8x32x1_8x32x1_1x32x1x8_8x8x1_1x1_intrawave_v3,0.0,134.09,348.65
80,512,1280,8192,21,0,55.414,a8w8_rowwise_256x64x128x256_32x32_1x2_16x16x1_16x16x1_1x32x1x8_8x8x1_1x1_intrawave_v3,0.0,193.77,288.57
80,512,8192,1024,13,0,53.0572,a8w8_rowwise_256x128x128x128_32x32_2x2_8x32x1_8x32x1_1x32x1x8_8x8x1_1x1_intrawave_v3,0.0,161.9,326.09
80,1024,1280,8192,13,0,89.2123,a8w8_rowwise_256x128x128x128_32x32_2x2_8x32x1_8x32x1_1x32x1x8_8x8x1_1x1_intrawave_v3,0.0,240.72,240.95
80,1024,8192,1024,13,0,91.5694,a8w8_rowwise_256x128x128x128_32x32_2x2_8x32x1_8x32x1_1x32x1x8_8x8x1_1x1_intrawave_v3,0.0,187.62,286.28
80,2048,1280,8192,13,0,141.1805,a8w8_rowwise_256x128x128x128_32x32_2x2_8x32x1_8x32x1_1x32x1x8_8x8x1_1x1_intrawave_v3,0.0,304.22,230.24
80,2048,8192,1024,13,0,161.9424,a8w8_rowwise_256x128x128x128_32x32_2x2_8x32x1_8x32x1_1x32x1x8_8x8x1_1x1_intrawave_v3,0.0,212.17,271.95
80,4096,1280,8192,13,0,276.1794,a8w8_rowwise_256x128x128x128_32x32_2x2_8x32x1_8x32x1_1x32x1x8_8x8x1_1x1_intrawave_v3,0.0,311.03,197.43
80,4096,8192,1024,13,0,308.5664,a8w8_rowwise_256x128x128x128_32x32_2x2_8x32x1_8x32x1_1x32x1x8_8x8x1_1x1_intrawave_v3,0.0,222.71,258.26
80,8192,1280,8192,13,0,547.3223,a8w8_rowwise_256x128x128x128_32x32_2x2_8x32x1_8x32x1_1x32x1x8_8x8x1_1x1_intrawave_v3,0.0,313.89,180.09
80,8192,8192,1024,13,0,604.5621,a8w8_rowwise_256x128x128x128_32x32_2x2_8x32x1_8x32x1_1x32x1x8_8x8x1_1x1_intrawave_v3,0.0,227.34,249.76
80,16384,1280,8192,13,0,1082.6103,a8w8_rowwise_256x128x128x128_32x32_2x2_8x32x1_8x32x1_1x32x1x8_8x8x1_1x1_intrawave_v3,0.0,317.38,172.4
80,16384,8192,1024,13,0,1183.8831,a8w8_rowwise_256x128x128x128_32x32_2x2_8x32x1_8x32x1_1x32x1x8_8x8x1_1x1_intrawave_v3,0.0,232.18,248.0
256,1,100,5120,34,0,8.7502,a8w8_rowwise_256x16x64x512_16x16_1x1_32x8x1_32x8x1_1x16x1x16_4x4x1_1x1_intrawave_v3,0.0,0.12,59.12
256,1,200,5120,34,0,9.0193,a8w8_rowwise_256x16x64x512_16x16_1x1_32x8x1_32x8x1_1x16x1x16_4x4x1_1x1_intrawave_v3,0.0,0.23,114.15
256,1,800,5120,34,0,11.5471,a8w8_rowwise_256x16x64x512_16x16_1x1_32x8x1_32x8x1_1x16x1x16_4x4x1_1x1_intrawave_v3,0.0,0.71,355.3
256,1,1280,8192,34,0,17.6914,a8w8_rowwise_256x16x64x512_16x16_1x1_32x8x1_32x8x1_1x16x1x16_4x4x1_1x1_intrawave_v3,0.0,1.19,593.31
256,1,2304,16384,34,0,28.7938,a8w8_rowwise_256x16x64x512_16x16_1x1_32x8x1_32x8x1_1x16x1x16_4x4x1_1x1_intrawave_v3,0.0,2.62,1311.73
256,1,2560,8192,34,0,17.4658,a8w8_rowwise_256x16x64x512_16x16_1x1_32x8x1_32x8x1_1x16x1x16_4x4x1_1x1_intrawave_v3,0.0,2.4,1201.48
256,1,4608,16384,34,0,30.4899,a8w8_rowwise_256x16x64x512_16x16_1x1_32x8x1_32x8x1_1x16x1x16_4x4x1_1x1_intrawave_v3,0.0,4.95,2476.99
256,1,5120,640,79,0,4.3227,a8w8_rowwise_128x16x32x128_16x16_1x1_8x16x1_8x16x1_1x16x1x8_4x4x1_1x1_interwave_v2,0.0,1.52,760.56
256,1,5120,1280,34,0,6.1049,a8w8_rowwise_256x16x64x512_16x16_1x1_32x8x1_32x8x1_1x16x1x16_4x4x1_1x1_intrawave_v3,0.0,2.15,1075.39
256,1,5120,3200,30,0,9.8138,a8w8_rowwise_256x32x64x512_16x16_1x2_32x8x1_32x8x1_1x32x1x8_8x8x1_1x2_intrawave_v3,0.0,3.34,1670.86
256,1,5120,5120,34,0,12.3186,a8w8_rowwise_256x16x64x512_16x16_1x1_32x8x1_32x8x1_1x16x1x16_4x4x1_1x1_intrawave_v3,0.0,4.26,2129.28
256,1,5120,6400,34,0,14.5779,a8w8_rowwise_256x16x64x512_16x16_1x1_32x8x1_32x8x1_1x16x1x16_4x4x1_1x1_intrawave_v3,0.0,4.5,2248.93
256,1,5120,25600,23,0,47.1407,a8w8_rowwise_256x64x64x512_32x32_1x1_32x8x1_32x8x1_1x32x1x8_8x8x1_1x1_intrawave_v3,0.0,5.56,2781.2
256,1,6400,5120,34,0,12.7506,a8w8_rowwise_256x16x64x512_16x16_1x1_32x8x1_32x8x1_1x16x1x16_4x4x1_1x1_intrawave_v3,0.0,5.14,2571.32
256,1,7168,8192,34,0,19.015,a8w8_rowwise_256x16x64x512_16x16_1x1_32x8x1_32x8x1_1x16x1x16_4x4x1_1x1_intrawave_v3,0.0,6.18,3089.29
256,1,8192,1024,79,0,5.7218,a8w8_rowwise_128x16x32x128_16x16_1x1_8x16x1_8x16x1_1x16x1x8_4x4x1_1x1_interwave_v2,0.0,2.93,1469.12
256,1,8192,2048,34,0,7.1625,a8w8_rowwise_256x16x64x512_16x16_1x1_32x8x1_32x8x1_1x16x1x16_4x4x1_1x1_intrawave_v3,0.0,4.68,2344.94
256,1,8192,3584,34,0,11.2488,a8w8_rowwise_256x16x64x512_16x16_1x1_32x8x1_32x8x1_1x16x1x16_4x4x1_1x1_intrawave_v3,0.0,5.22,2611.84
256,1,8192,7168,34,0,16.9371,a8w8_rowwise_256x16x64x512_16x16_1x1_32x8x1_32x8x1_1x16x1x16_4x4x1_1x1_intrawave_v3,0.0,6.93,3468.35
256,1,8192,8192,34,0,19.4709,a8w8_rowwise_256x16x64x512_16x16_1x1_32x8x1_32x8x1_1x16x1x16_4x4x1_1x1_intrawave_v3,0.0,6.89,3447.89
256,1,8192,28672,34,0,59.8294,a8w8_rowwise_256x16x64x512_16x16_1x1_32x8x1_32x8x1_1x16x1x16_4x4x1_1x1_intrawave_v3,0.0,7.85,3926.6
256,1,9216,16384,34,0,34.1179,a8w8_rowwise_256x16x64x512_16x16_1x1_32x8x1_32x8x1_1x16x1x16_4x4x1_1x1_intrawave_v3,0.0,8.85,4426.7
256,1,10240,8192,34,0,20.5574,a8w8_rowwise_256x16x64x512_16x16_1x1_32x8x1_32x8x1_1x16x1x16_4x4x1_1x1_intrawave_v3,0.0,8.16,4081.97
256,1,12800,5120,34,0,14.7015,a8w8_rowwise_256x16x64x512_16x16_1x1_32x8x1_32x8x1_1x16x1x16_4x4x1_1x1_intrawave_v3,0.0,8.92,4459.87
256,1,13312,16384,34,0,43.9839,a8w8_rowwise_256x16x64x512_16x16_1x1_32x8x1_32x8x1_1x16x1x16_4x4x1_1x1_intrawave_v3,0.0,9.92,4959.7
256,1,16384,2048,34,0,8.2219,a8w8_rowwise_256x16x64x512_16x16_1x1_32x8x1_32x8x1_1x16x1x16_4x4x1_1x1_intrawave_v3,0.0,8.16,4085.34
256,1,16384,4096,34,0,15.9093,a8w8_rowwise_256x16x64x512_16x16_1x1_32x8x1_32x8x1_1x16x1x16_4x4x1_1x1_intrawave_v3,0.0,8.44,4220.53
256,1,16384,6656,34,0,22.3992,a8w8_rowwise_256x16x64x512_16x16_1x1_32x8x1_32x8x1_1x16x1x16_4x4x1_1x1_intrawave_v3,0.0,9.74,4870.32
256,1,16384,8192,34,0,29.3945,a8w8_rowwise_256x16x64x512_16x16_1x1_32x8x1_32x8x1_1x16x1x16_4x4x1_1x1_intrawave_v3,0.0,9.13,4567.48
256,1,16384,13312,34,0,39.0876,a8w8_rowwise_256x16x64x512_16x16_1x1_32x8x1_32x8x1_1x16x1x16_4x4x1_1x1_intrawave_v3,0.0,11.16,5581.05
256,1,16384,26624,34,0,73.9812,a8w8_rowwise_256x16x64x512_16x16_1x1_32x8x1_32x8x1_1x16x1x16_4x4x1_1x1_intrawave_v3,0.0,11.79,5897.0
256,1,26624,16384,34,0,88.2574,a8w8_rowwise_256x16x64x512_16x16_1x1_32x8x1_32x8x1_1x16x1x16_4x4x1_1x1_intrawave_v3,0.0,9.88,4943.24
256,1,51200,5120,30,0,50.042,a8w8_rowwise_256x32x64x512_16x16_1x2_32x8x1_32x8x1_1x32x1x8_8x8x1_1x2_intrawave_v3,0.0,10.48,5240.63
256,1,53248,16384,57,0,170.1222,a8w8_rowwise_128x32x16x128_16x16_1x1_8x16x1_8x16x1_1x16x1x8_2x2x1_1x1_intrawave_v2,0.0,10.26,5128.89
256,1,57344,8192,76,0,88.899,a8w8_rowwise_128x32x16x128_16x16_1x1_8x16x1_8x16x1_1x16x1x8_2x2x1_1x1_interwave_v2,0.0,10.57,5285.6
256,16,100,5120,34,0,8.7447,a8w8_rowwise_256x16x64x512_16x16_1x1_32x8x1_32x8x1_1x16x1x16_4x4x1_1x1_intrawave_v3,0.0,1.87,68.28
256,16,200,5120,34,0,10.4705,a8w8_rowwise_256x16x64x512_16x16_1x1_32x8x1_32x8x1_1x16x1x16_4x4x1_1x1_intrawave_v3,0.0,3.13,106.23
256,16,800,5120,34,0,11.7219,a8w8_rowwise_256x16x64x512_16x16_1x1_32x8x1_32x8x1_1x16x1x16_4x4x1_1x1_intrawave_v3,0.0,11.18,358.6
256,16,1280,8192,34,0,15.0987,a8w8_rowwise_256x16x64x512_16x16_1x1_32x8x1_32x8x1_1x16x1x16_4x4x1_1x1_intrawave_v3,0.0,22.22,705.87
256,16,2304,16384,34,0,23.498,a8w8_rowwise_256x16x64x512_16x16_1x1_32x8x1_32x8x1_1x16x1x16_4x4x1_1x1_intrawave_v3,0.0,51.41,1620.76
256,16,2560,8192,34,0,14.8202,a8w8_rowwise_256x16x64x512_16x16_1x1_32x8x1_32x8x1_1x16x1x16_4x4x1_1x1_intrawave_v3,0.0,45.28,1429.43
256,16,4608,16384,34,0,25.7089,a8w8_rowwise_256x16x64x512_16x16_1x1_32x8x1_32x8x1_1x16x1x16_4x4x1_1x1_intrawave_v3,0.0,93.97,2952.56
256,16,5120,640,60,0,4.3842,a8w8_rowwise_128x16x32x128_16x16_1x1_8x16x1_8x16x1_1x16x1x8_4x4x1_1x1_intrawave_v2,0.0,23.92,787.12
256,16,5120,1280,79,0,6.1038,a8w8_rowwise_128x16x32x128_16x16_1x1_8x16x1_8x16x1_1x16x1x8_4x4x1_1x1_interwave_v2,0.0,34.36,1103.89
256,16,5120,3200,79,0,9.1289,a8w8_rowwise_128x16x32x128_16x16_1x1_8x16x1_8x16x1_1x16x1x8_4x4x1_1x1_interwave_v2,0.0,57.43,1818.3
256,16,5120,5120,34,0,11.1363,a8w8_rowwise_256x16x64x512_16x16_1x1_32x8x1_32x8x1_1x16x1x16_4x4x1_1x1_intrawave_v3,0.0,75.33,2376.03
256,16,5120,6400,34,0,14.8838,a8w8_rowwise_256x16x64x512_16x16_1x1_32x8x1_32x8x1_1x16x1x16_4x4x1_1x1_intrawave_v3,0.0,70.45,2219.48
256,16,5120,25600,34,0,38.7631,a8w8_rowwise_256x16x64x512_16x16_1x1_32x8x1_32x8x1_1x16x1x16_4x4x1_1x1_intrawave_v3,0.0,108.2,3396.15
256,16,6400,5120,34,0,11.5523,a8w8_rowwise_256x16x64x512_16x16_1x1_32x8x1_32x8x1_1x16x1x16_4x4x1_1x1_intrawave_v3,0.0,90.77,2861.31
256,16,7168,8192,34,0,16.6523,a8w8_rowwise_256x16x64x512_16x16_1x1_32x8x1_32x8x1_1x16x1x16_4x4x1_1x1_intrawave_v3,0.0,112.84,3547.9
256,16,8192,1024,79,0,5.4586,a8w8_rowwise_128x16x32x128_16x16_1x1_8x16x1_8x16x1_1x16x1x8_4x4x1_1x1_interwave_v2,0.0,49.18,1587.79
256,16,8192,2048,79,0,7.2552,a8w8_rowwise_128x16x32x128_16x16_1x1_8x16x1_8x16x1_1x16x1x8_4x4x1_1x1_interwave_v2,0.0,74.0,2353.09
256,16,8192,3584,34,0,10.6477,a8w8_rowwise_256x16x64x512_16x16_1x1_32x8x1_32x8x1_1x16x1x16_4x4x1_1x1_intrawave_v3,0.0,88.24,2787.42
256,16,8192,7168,34,0,15.2131,a8w8_rowwise_256x16x64x512_16x16_1x1_32x8x1_32x8x1_1x16x1x16_4x4x1_1x1_intrawave_v3,0.0,123.52,3884.62
256,16,8192,8192,34,0,17.2283,a8w8_rowwise_256x16x64x512_16x16_1x1_32x8x1_32x8x1_1x16x1x16_4x4x1_1x1_intrawave_v3,0.0,124.65,3918.09
256,16,8192,28672,34,0,55.9502,a8w8_rowwise_256x16x64x512_16x16_1x1_32x8x1_32x8x1_1x16x1x16_4x4x1_1x1_intrawave_v3,0.0,134.34,4210.92
256,16,9216,16384,34,0,33.174,a8w8_rowwise_256x16x64x512_16x16_1x1_32x8x1_32x8x1_1x16x1x16_4x4x1_1x1_intrawave_v3,0.0,145.65,4568.4
256,16,10240,8192,34,0,18.6072,a8w8_rowwise_256x16x64x512_16x16_1x1_32x8x1_32x8x1_1x16x1x16_4x4x1_1x1_intrawave_v3,0.0,144.26,4532.91
256,16,12800,5120,34,0,14.2563,a8w8_rowwise_256x16x64x512_16x16_1x1_32x8x1_32x8x1_1x16x1x16_4x4x1_1x1_intrawave_v3,0.0,147.1,4631.46
256,16,13312,16384,30,0,45.4589,a8w8_rowwise_256x32x64x512_16x16_1x2_32x8x1_32x8x1_1x32x1x8_8x8x1_1x2_intrawave_v3,0.0,153.53,4812.96
256,16,16384,2048,34,0,8.2068,a8w8_rowwise_256x16x64x512_16x16_1x1_32x8x1_32x8x1_1x16x1x16_4x4x1_1x1_intrawave_v3,0.0,130.84,4156.49
256,16,16384,4096,30,0,16.22,a8w8_rowwise_256x32x64x512_16x16_1x2_32x8x1_32x8x1_1x32x1x8_8x8x1_1x2_intrawave_v3,0.0,132.4,4173.78
256,16,16384,6656,34,0,21.7401,a8w8_rowwise_256x16x64x512_16x16_1x1_32x8x1_32x8x1_1x16x1x16_4x4x1_1x1_intrawave_v3,0.0,160.52,5045.18
256,16,16384,8192,30,0,29.6526,a8w8_rowwise_256x32x64x512_16x16_1x2_32x8x1_32x8x1_1x32x1x8_8x8x1_1x2_intrawave_v3,0.0,144.84,4548.44
256,16,16384,13312,34,0,38.6763,a8w8_rowwise_256x16x64x512_16x16_1x1_32x8x1_32x8x1_1x16x1x16_4x4x1_1x1_intrawave_v3,0.0,180.45,5658.27
256,16,16384,26624,34,0,73.7744,a8w8_rowwise_256x16x64x512_16x16_1x1_32x8x1_32x8x1_1x16x1x16_4x4x1_1x1_intrawave_v3,0.0,189.21,5925.6
256,16,26624,16384,30,0,86.8898,a8w8_rowwise_256x32x64x512_16x16_1x2_32x8x1_32x8x1_1x32x1x8_8x8x1_1x2_intrawave_v3,0.0,160.65,5033.06
256,16,51200,5120,30,0,51.7349,a8w8_rowwise_256x32x64x512_16x16_1x2_32x8x1_32x8x1_1x32x1x8_8x8x1_1x2_intrawave_v3,0.0,162.15,5100.32
256,16,53248,16384,34,0,180.7857,a8w8_rowwise_256x16x64x512_16x16_1x1_32x8x1_32x8x1_1x16x1x16_4x4x1_1x1_intrawave_v3,0.0,154.42,4836.56
256,16,57344,8192,80,0,90.9234,a8w8_rowwise_128x16x64x128_16x16_1x2_8x16x1_8x16x1_1x16x1x8_4x4x1_1x1_interwave_v2,0.0,165.33,5188.19
256,32,100,5120,34,0,9.2459,a8w8_rowwise_256x16x64x512_16x16_1x1_32x8x1_32x8x1_1x16x1x16_4x4x1_1x1_intrawave_v3,0.0,3.54,73.79
256,32,200,5120,34,0,10.4825,a8w8_rowwise_256x16x64x512_16x16_1x1_32x8x1_32x8x1_1x16x1x16_4x4x1_1x1_intrawave_v3,0.0,6.25,114.54
256,32,800,5120,34,0,11.9874,a8w8_rowwise_256x16x64x512_16x16_1x1_32x8x1_32x8x1_1x16x1x16_4x4x1_1x1_intrawave_v3,0.0,21.87,359.63
256,32,1280,8192,34,0,14.9955,a8w8_rowwise_256x16x64x512_16x16_1x1_32x8x1_32x8x1_1x16x1x16_4x4x1_1x1_intrawave_v3,0.0,44.75,722.2
256,32,2304,16384,34,0,23.2436,a8w8_rowwise_256x16x64x512_16x16_1x1_32x8x1_32x8x1_1x16x1x16_4x4x1_1x1_intrawave_v3,0.0,103.94,1652.95
256,32,2560,8192,34,0,14.7991,a8w8_rowwise_256x16x64x512_16x16_1x1_32x8x1_32x8x1_1x16x1x16_4x4x1_1x1_intrawave_v3,0.0,90.69,1445.87
256,32,4608,16384,34,0,24.957,a8w8_rowwise_256x16x64x512_16x16_1x1_32x8x1_32x8x1_1x16x1x16_4x4x1_1x1_intrawave_v3,0.0,193.61,3057.93
256,32,5120,640,79,0,4.5986,a8w8_rowwise_128x16x32x128_16x16_1x1_8x16x1_8x16x1_1x16x1x8_4x4x1_1x1_interwave_v2,0.0,45.6,788.27
256,32,5120,1280,76,0,6.0464,a8w8_rowwise_128x32x16x128_16x16_1x1_8x16x1_8x16x1_1x16x1x8_2x2x1_1x1_interwave_v2,0.0,69.37,1144.85
256,32,5120,3200,76,0,10.1191,a8w8_rowwise_128x32x16x128_16x16_1x1_8x16x1_8x16x1_1x16x1x8_2x2x1_1x1_interwave_v2,0.0,103.62,1661.62
256,32,5120,5120,34,0,10.4248,a8w8_rowwise_256x16x64x512_16x16_1x1_32x8x1_32x8x1_1x16x1x16_4x4x1_1x1_intrawave_v3,0.0,160.94,2561.77
256,32,5120,6400,34,0,15.0885,a8w8_rowwise_256x16x64x512_16x16_1x1_32x8x1_32x8x1_1x16x1x16_4x4x1_1x1_intrawave_v3,0.0,138.99,2207.01
256,32,5120,25600,34,0,38.3258,a8w8_rowwise_256x16x64x512_16x16_1x1_32x8x1_32x8x1_1x16x1x16_4x4x1_1x1_intrawave_v3,0.0,218.88,3449.87
256,32,6400,5120,34,0,10.9816,a8w8_rowwise_256x16x64x512_16x16_1x1_32x8x1_32x8x1_1x16x1x16_4x4x1_1x1_intrawave_v3,0.0,190.97,3036.12
256,32,7168,8192,34,0,16.942,a8w8_rowwise_256x16x64x512_16x16_1x1_32x8x1_32x8x1_1x16x1x16_4x4x1_1x1_intrawave_v3,0.0,221.82,3508.51
256,32,8192,1024,79,0,5.6281,a8w8_rowwise_128x16x32x128_16x16_1x1_8x16x1_8x16x1_1x16x1x8_4x4x1_1x1_interwave_v2,0.0,95.39,1589.46
256,32,8192,2048,76,0,7.2889,a8w8_rowwise_128x32x16x128_16x16_1x1_8x16x1_8x16x1_1x16x1x8_2x2x1_1x1_interwave_v2,0.0,147.31,2382.67
256,32,8192,3584,34,0,9.4243,a8w8_rowwise_256x16x64x512_16x16_1x1_32x8x1_32x8x1_1x16x1x16_4x4x1_1x1_intrawave_v3,0.0,199.38,3183.17
256,32,8192,7168,34,0,16.2902,a8w8_rowwise_256x16x64x512_16x16_1x1_32x8x1_32x8x1_1x16x1x16_4x4x1_1x1_intrawave_v3,0.0,230.7,3650.9
256,32,8192,8192,34,0,17.4586,a8w8_rowwise_256x16x64x512_16x16_1x1_32x8x1_32x8x1_1x16x1x16_4x4x1_1x1_intrawave_v3,0.0,246.01,3888.93
256,32,8192,28672,34,0,54.7382,a8w8_rowwise_256x16x64x512_16x16_1x1_32x8x1_32x8x1_1x16x1x16_4x4x1_1x1_intrawave_v3,0.0,274.62,4317.33
256,32,9216,16384,30,0,34.6699,a8w8_rowwise_256x32x64x512_16x16_1x2_32x8x1_32x8x1_1x32x1x8_8x8x1_1x2_intrawave_v3,0.0,278.73,4387.35
256,32,10240,8192,30,0,20.8953,a8w8_rowwise_256x32x64x512_16x16_1x2_32x8x1_32x8x1_1x32x1x8_8x8x1_1x2_intrawave_v3,0.0,256.93,4058.5
256,32,12800,5120,30,0,14.9578,a8w8_rowwise_256x32x64x512_16x16_1x2_32x8x1_32x8x1_1x32x1x8_8x8x1_1x2_intrawave_v3,0.0,280.41,4447.11
256,32,13312,16384,30,0,46.5921,a8w8_rowwise_256x32x64x512_16x16_1x2_32x8x1_32x8x1_1x32x1x8_8x8x1_1x2_intrawave_v3,0.0,299.59,4710.67
256,32,16384,2048,30,0,10.4352,a8w8_rowwise_256x32x64x512_16x16_1x2_32x8x1_32x8x1_1x32x1x8_8x8x1_1x2_intrawave_v3,0.0,205.79,3322.27
256,32,16384,4096,30,0,16.4693,a8w8_rowwise_256x32x64x512_16x16_1x2_32x8x1_32x8x1_1x32x1x8_8x8x1_1x2_intrawave_v3,0.0,260.79,4146.41
256,32,16384,6656,30,0,22.4014,a8w8_rowwise_256x32x64x512_16x16_1x2_32x8x1_32x8x1_1x32x1x8_8x8x1_1x2_intrawave_v3,0.0,311.56,4924.4
256,32,16384,8192,30,0,30.4324,a8w8_rowwise_256x32x64x512_16x16_1x2_32x8x1_32x8x1_1x32x1x8_8x8x1_1x2_intrawave_v3,0.0,282.26,4453.43
256,32,16384,13312,30,0,39.8351,a8w8_rowwise_256x32x64x512_16x16_1x2_32x8x1_32x8x1_1x32x1x8_8x8x1_1x2_intrawave_v3,0.0,350.41,5512.18
256,32,16384,26624,30,0,74.3742,a8w8_rowwise_256x32x64x512_16x16_1x2_32x8x1_32x8x1_1x32x1x8_8x8x1_1x2_intrawave_v3,0.0,375.36,5890.59
256,32,26624,16384,30,0,89.3239,a8w8_rowwise_256x32x64x512_16x16_1x2_32x8x1_32x8x1_1x32x1x8_8x8x1_1x2_intrawave_v3,0.0,312.54,4908.38
256,32,51200,5120,30,0,53.9026,a8w8_rowwise_256x32x64x512_16x16_1x2_32x8x1_32x8x1_1x32x1x8_8x8x1_1x2_intrawave_v3,0.0,311.25,4927.12
256,32,53248,16384,34,0,168.8762,a8w8_rowwise_256x16x64x512_16x16_1x1_32x8x1_32x8x1_1x16x1x16_4x4x1_1x1_intrawave_v3,0.0,330.62,5189.29
256,32,57344,8192,81,0,93.0943,a8w8_rowwise_128x32x64x128_32x32_1x1_8x16x1_8x16x1_1x16x1x8_8x8x1_1x1_interwave_v2,0.0,322.95,5088.33
256,64,100,5120,34,0,9.6716,a8w8_rowwise_256x16x64x512_16x16_1x1_32x8x1_32x8x1_1x16x1x16_4x4x1_1x1_intrawave_v3,0.0,6.78,88.14
256,64,192,1024,77,0,4.1582,a8w8_rowwise_64x16x16x64_16x16_1x1_4x16x1_4x16x1_1x16x1x4_4x4x1_1x1_interwave_v2,0.0,6.05,68.95
256,64,200,5120,34,0,9.9254,a8w8_rowwise_256x16x64x512_16x16_1x1_32x8x1_32x8x1_1x16x1x16_4x4x1_1x1_intrawave_v3,0.0,13.21,138.76
256,64,800,5120,34,0,12.0241,a8w8_rowwise_256x16x64x512_16x16_1x1_32x8x1_32x8x1_1x16x1x16_4x4x1_1x1_intrawave_v3,0.0,43.6,376.42
256,64,1280,8192,34,0,14.7691,a8w8_rowwise_256x16x64x512_16x16_1x1_32x8x1_32x8x1_1x16x1x16_4x4x1_1x1_intrawave_v3,0.0,90.88,756.57
256,64,2304,16384,34,0,23.2558,a8w8_rowwise_256x16x64x512_16x16_1x1_32x8x1_32x8x1_1x16x1x16_4x4x1_1x1_intrawave_v3,0.0,207.77,1680.97
256,64,2560,8192,34,0,14.5967,a8w8_rowwise_256x16x64x512_16x16_1x1_32x8x1_32x8x1_1x16x1x16_4x4x1_1x1_intrawave_v3,0.0,183.9,1495.1
256,64,4608,16384,30,0,27.9735,a8w8_rowwise_256x32x64x512_16x16_1x2_32x8x1_32x8x1_1x32x1x8_8x8x1_1x2_intrawave_v3,0.0,345.46,2757.46
256,64,5120,640,77,0,5.0956,a8w8_rowwise_64x16x16x64_16x16_1x1_4x16x1_4x16x1_1x16x1x4_4x4x1_1x1_interwave_v2,0.0,82.31,779.72
256,64,5120,1280,76,0,6.4203,a8w8_rowwise_128x32x16x128_16x16_1x1_8x16x1_8x16x1_1x16x1x8_2x2x1_1x1_interwave_v2,0.0,130.66,1135.6
256,64,5120,3200,76,0,10.7687,a8w8_rowwise_128x32x16x128_16x16_1x1_8x16x1_8x16x1_1x16x1x8_2x2x1_1x1_interwave_v2,0.0,194.75,1601.32
256,64,5120,5120,30,0,11.7059,a8w8_rowwise_256x32x64x512_16x16_1x2_32x8x1_32x8x1_1x32x1x8_8x8x1_1x2_intrawave_v3,0.0,286.65,2323.4
256,64,5120,6400,30,0,16.907,a8w8_rowwise_256x32x64x512_16x16_1x2_32x8x1_32x8x1_1x32x1x8_8x8x1_1x2_intrawave_v3,0.0,248.08,2001.12
256,64,5120,25600,30,0,43.5801,a8w8_rowwise_256x32x64x512_16x16_1x2_32x8x1_32x8x1_1x32x1x8_8x8x1_1x2_intrawave_v3,0.0,384.97,3060.24
256,64,6400,5120,30,0,12.4817,a8w8_rowwise_256x32x64x512_16x16_1x2_32x8x1_32x8x1_1x32x1x8_8x8x1_1x2_intrawave_v3,0.0,336.04,2717.17
256,64,7168,8192,30,0,18.4286,a8w8_rowwise_256x32x64x512_16x16_1x2_32x8x1_32x8x1_1x32x1x8_8x8x1_1x2_intrawave_v3,0.0,407.85,3264.6
256,64,8192,2048,30,0,7.5798,a8w8_rowwise_256x32x64x512_16x16_1x2_32x8x1_32x8x1_1x32x1x8_8x8x1_1x2_intrawave_v3,0.0,283.32,2369.04
256,64,8192,3584,30,0,11.279,a8w8_rowwise_256x32x64x512_16x16_1x2_32x8x1_32x8x1_1x32x1x8_8x8x1_1x2_intrawave_v3,0.0,333.19,2716.38
256,64,8192,7168,30,0,17.495,a8w8_rowwise_256x32x64x512_16x16_1x2_32x8x1_32x8x1_1x32x1x8_8x8x1_1x2_intrawave_v3,0.0,429.62,3442.56
256,64,8192,8192,30,0,19.4045,a8w8_rowwise_256x32x64x512_16x16_1x2_32x8x1_32x8x1_1x32x1x8_8x8x1_1x2_intrawave_v3,0.0,442.68,3539.47
256,64,8192,28672,30,0,61.7622,a8w8_rowwise_256x32x64x512_16x16_1x2_32x8x1_32x8x1_1x32x1x8_8x8x1_1x2_intrawave_v3,0.0,486.78,3849.68
256,64,9216,16384,23,0,41.0647,a8w8_rowwise_256x64x64x512_32x32_1x1_32x8x1_32x8x1_1x32x1x8_8x8x1_1x1_intrawave_v3,0.0,470.66,3731.26
256,64,10240,8192,28,0,27.6213,a8w8_rowwise_256x32x128x256_32x32_1x1_16x16x1_16x16x1_1x32x1x8_8x8x1_1x1_intrawave_v3,0.0,388.74,3103.44
256,64,12800,5120,23,0,18.5404,a8w8_rowwise_256x64x64x512_32x32_1x1_32x8x1_32x8x1_1x32x1x8_8x8x1_1x1_intrawave_v3,0.0,452.45,3640.81
256,64,13312,16384,23,0,50.0251,a8w8_rowwise_256x64x64x512_32x32_1x1_32x8x1_32x8x1_1x32x1x8_8x8x1_1x1_intrawave_v3,0.0,558.07,4414.91
256,64,16384,2048,23,0,11.4046,a8w8_rowwise_256x64x64x512_32x32_1x1_32x8x1_32x8x1_1x32x1x8_8x8x1_1x1_intrawave_v3,0.0,376.6,3137.56
256,64,16384,4096,23,0,19.0989,a8w8_rowwise_256x64x64x512_32x32_1x1_32x8x1_32x8x1_1x32x1x8_8x8x1_1x1_intrawave_v3,0.0,449.76,3637.29
256,64,16384,6656,23,0,26.4384,a8w8_rowwise_256x64x64x512_32x32_1x1_32x8x1_32x8x1_1x32x1x8_8x8x1_1x1_intrawave_v3,0.0,527.97,4220.19
256,64,16384,8192,23,0,33.8597,a8w8_rowwise_256x64x64x512_32x32_1x1_32x8x1_32x8x1_1x32x1x8_8x8x1_1x1_intrawave_v3,0.0,507.38,4041.36
256,64,16384,13312,23,0,46.8247,a8w8_rowwise_256x64x64x512_32x32_1x1_32x8x1_32x8x1_1x32x1x8_8x8x1_1x1_intrawave_v3,0.0,596.21,4720.86
256,64,16384,26624,23,0,89.8884,a8w8_rowwise_256x64x64x512_32x32_1x1_32x8x1_32x8x1_1x32x1x8_8x8x1_1x1_intrawave_v3,0.0,621.15,4895.06
256,64,26624,16384,23,0,91.2922,a8w8_rowwise_256x64x64x512_32x32_1x1_32x8x1_32x8x1_1x32x1x8_8x8x1_1x1_intrawave_v3,0.0,611.6,4826.96
256,64,51200,5120,23,0,61.5287,a8w8_rowwise_256x64x64x512_32x32_1x1_32x8x1_32x8x1_1x32x1x8_8x8x1_1x1_intrawave_v3,0.0,545.35,4372.35
256,64,53248,16384,23,0,184.3385,a8w8_rowwise_256x64x64x512_32x32_1x1_32x8x1_32x8x1_1x32x1x8_8x8x1_1x1_intrawave_v3,0.0,605.78,4775.34
256,64,57344,8192,46,0,99.6635,a8w8_rowwise_256x64x128x128_32x32_1x2_8x32x1_8x32x1_1x32x1x8_8x8x1_1x1_intrawave_v3,0.0,603.33,4792.39
256,128,100,5120,34,0,10.6683,a8w8_rowwise_256x16x64x512_16x16_1x1_32x8x1_32x8x1_1x16x1x16_4x4x1_1x1_intrawave_v3,0.0,12.29,111.82
256,128,200,5120,34,0,9.652,a8w8_rowwise_256x16x64x512_16x16_1x1_32x8x1_32x8x1_1x16x1x16_4x4x1_1x1_intrawave_v3,0.0,27.16,179.3
256,128,800,5120,34,0,11.5628,a8w8_rowwise_256x16x64x512_16x16_1x1_32x8x1_32x8x1_1x16x1x16_4x4x1_1x1_intrawave_v3,0.0,90.69,428.63
256,128,1280,8192,34,0,13.9827,a8w8_rowwise_256x16x64x512_16x16_1x1_32x8x1_32x8x1_1x16x1x16_4x4x1_1x1_intrawave_v3,0.0,191.98,848.34
256,128,2304,16384,30,0,26.5035,a8w8_rowwise_256x32x64x512_16x16_1x2_32x8x1_32x8x1_1x32x1x8_8x8x1_1x2_intrawave_v3,0.0,364.62,1525.67
256,128,2560,8192,30,0,16.5177,a8w8_rowwise_256x32x64x512_16x16_1x2_32x8x1_32x8x1_1x32x1x8_8x8x1_1x2_intrawave_v3,0.0,325.03,1372.8
256,128,4608,16384,23,0,33.4047,a8w8_rowwise_256x64x64x512_32x32_1x1_32x8x1_32x8x1_1x32x1x8_8x8x1_1x1_intrawave_v3,0.0,578.58,2358.18
256,128,5120,640,79,0,5.566,a8w8_rowwise_128x16x32x128_16x16_1x1_8x16x1_8x16x1_1x16x1x8_4x4x1_1x1_interwave_v2,0.0,150.71,838.92
256,128,5120,1280,23,0,7.6695,a8w8_rowwise_256x64x64x512_32x32_1x1_32x8x1_32x8x1_1x32x1x8_8x8x1_1x1_intrawave_v3,0.0,218.75,1046.76
256,128,5120,3200,23,0,11.8363,a8w8_rowwise_256x64x64x512_32x32_1x1_32x8x1_32x8x1_1x32x1x8_8x8x1_1x1_intrawave_v3,0.0,354.36,1529.56
256,128,5120,5120,23,0,14.1859,a8w8_rowwise_256x64x64x512_32x32_1x1_32x8x1_32x8x1_1x32x1x8_8x8x1_1x1_intrawave_v3,0.0,473.07,1986.51
256,128,5120,6400,23,0,18.7826,a8w8_rowwise_256x64x64x512_32x32_1x1_32x8x1_32x8x1_1x32x1x8_8x8x1_1x1_intrawave_v3,0.0,446.62,1857.99
256,128,5120,25600,23,0,54.0309,a8w8_rowwise_256x64x64x512_32x32_1x1_32x8x1_32x8x1_1x32x1x8_8x8x1_1x1_intrawave_v3,0.0,621.02,2510.78
256,128,6400,5120,23,0,14.96,a8w8_rowwise_256x64x64x512_32x32_1x1_32x8x1_32x8x1_1x32x1x8_8x8x1_1x1_intrawave_v3,0.0,560.74,2343.7
256,128,7168,8192,28,0,26.0097,a8w8_rowwise_256x32x128x256_32x32_1x1_16x16x1_16x16x1_1x32x1x8_8x8x1_1x1_intrawave_v3,0.0,577.95,2368.49
256,128,8192,1024,28,0,7.1186,a8w8_rowwise_256x32x128x256_32x32_1x1_16x16x1_16x16x1_1x32x1x8_8x8x1_1x1_intrawave_v3,0.0,301.67,1491.42
256,128,8192,2048,23,0,10.2945,a8w8_rowwise_256x64x64x512_32x32_1x1_32x8x1_32x8x1_1x32x1x8_8x8x1_1x1_intrawave_v3,0.0,417.21,1858.91
256,128,8192,3584,28,0,13.8708,a8w8_rowwise_256x32x128x256_32x32_1x1_16x16x1_16x16x1_1x32x1x8_8x8x1_1x1_intrawave_v3,0.0,541.87,2300.95
256,128,8192,7168,28,0,24.2653,a8w8_rowwise_256x32x128x256_32x32_1x1_16x16x1_16x16x1_1x32x1x8_8x8x1_1x1_intrawave_v3,0.0,619.5,2544.16
256,128,8192,8192,28,0,26.3513,a8w8_rowwise_256x32x128x256_32x32_1x1_16x16x1_16x16x1_1x32x1x8_8x8x1_1x1_intrawave_v3,0.0,651.96,2666.08
256,128,8192,28672,28,0,87.5085,a8w8_rowwise_256x32x128x256_32x32_1x1_16x16x1_16x16x1_1x32x1x8_8x8x1_1x1_intrawave_v3,0.0,687.13,2750.0
256,128,9216,16384,23,0,59.454,a8w8_rowwise_256x64x64x512_32x32_1x1_32x8x1_32x8x1_1x32x1x8_8x8x1_1x1_intrawave_v3,0.0,650.16,2614.65
256,128,10240,8192,15,0,31.2683,a8w8_rowwise_256x128x64x256_32x32_2x1_16x16x1_16x16x1_1x32x1x8_8x8x1_1x1_intrawave_v3,0.0,686.79,2800.16
256,128,12800,5120,23,0,25.5896,a8w8_rowwise_256x64x64x512_32x32_1x1_32x8x1_32x8x1_1x32x1x8_8x8x1_1x1_intrawave_v3,0.0,655.63,2714.7
256,128,13312,16384,23,0,65.9651,a8w8_rowwise_256x64x64x512_32x32_1x1_32x8x1_32x8x1_1x32x1x8_8x8x1_1x1_intrawave_v3,0.0,846.43,3389.81
256,128,16384,2048,23,0,14.5668,a8w8_rowwise_256x64x64x512_32x32_1x1_32x8x1_32x8x1_1x32x1x8_8x8x1_1x1_intrawave_v3,0.0,589.69,2609.42
256,128,16384,4096,23,0,23.3525,a8w8_rowwise_256x64x64x512_32x32_1x1_32x8x1_32x8x1_1x32x1x8_8x8x1_1x1_intrawave_v3,0.0,735.68,3075.79
256,128,16384,6656,23,0,34.0329,a8w8_rowwise_256x64x64x512_32x32_1x1_32x8x1_32x8x1_1x32x1x8_8x8x1_1x1_intrawave_v3,0.0,820.3,3352.58
256,128,16384,8192,23,0,45.1385,a8w8_rowwise_256x64x64x512_32x32_1x1_32x8x1_32x8x1_1x32x1x8_8x8x1_1x1_intrawave_v3,0.0,761.21,3089.62
256,128,16384,13312,23,0,61.6432,a8w8_rowwise_256x64x64x512_32x32_1x1_32x8x1_32x8x1_1x32x1x8_8x8x1_1x1_intrawave_v3,0.0,905.77,3633.85
256,128,16384,26624,23,0,118.3409,a8w8_rowwise_256x64x64x512_32x32_1x1_32x8x1_32x8x1_1x32x1x8_8x8x1_1x1_intrawave_v3,0.0,943.62,3750.27
256,128,26624,16384,23,0,129.1529,a8w8_rowwise_256x64x64x512_32x32_1x1_32x8x1_32x8x1_1x32x1x8_8x8x1_1x1_intrawave_v3,0.0,864.63,3446.46
256,128,51200,5120,23,0,82.0559,a8w8_rowwise_256x64x64x512_32x32_1x1_32x8x1_32x8x1_1x32x1x8_8x8x1_1x1_intrawave_v3,0.0,817.84,3362.42
256,128,53248,16384,23,0,230.1893,a8w8_rowwise_256x64x64x512_32x32_1x1_32x8x1_32x8x1_1x32x1x8_8x8x1_1x1_intrawave_v3,0.0,970.24,3858.32
256,128,57344,8192,13,0,108.1045,a8w8_rowwise_256x128x128x128_32x32_2x2_8x32x1_8x32x1_1x32x1x8_8x8x1_1x1_intrawave_v3,0.0,1112.43,4490.94
256,256,100,5120,34,0,10.9556,a8w8_rowwise_256x16x64x512_16x16_1x1_32x8x1_32x8x1_1x16x1x16_4x4x1_1x1_intrawave_v3,0.0,23.93,171.05
256,256,200,5120,34,0,9.8147,a8w8_rowwise_256x16x64x512_16x16_1x1_32x8x1_32x8x1_1x16x1x16_4x4x1_1x1_intrawave_v3,0.0,53.42,248.31
256,256,800,5120,34,0,11.8423,a8w8_rowwise_256x16x64x512_16x16_1x1_32x8x1_32x8x1_1x16x1x16_4x4x1_1x1_intrawave_v3,0.0,177.09,491.15
256,256,1280,8192,30,0,16.2863,a8w8_rowwise_256x32x64x512_16x16_1x2_32x8x1_32x8x1_1x32x1x8_8x8x1_1x2_intrawave_v3,0.0,329.65,812.85
256,256,2304,16384,23,0,32.4817,a8w8_rowwise_256x64x64x512_32x32_1x1_32x8x1_32x8x1_1x32x1x8_8x8x1_1x1_intrawave_v3,0.0,595.02,1327.6
256,256,2560,8192,28,0,23.112,a8w8_rowwise_256x32x128x256_32x32_1x1_16x16x1_16x16x1_1x32x1x8_8x8x1_1x1_intrawave_v3,0.0,464.58,1054.84
256,256,4608,16384,23,0,55.0189,a8w8_rowwise_256x64x64x512_32x32_1x1_32x8x1_32x8x1_1x32x1x8_8x8x1_1x1_intrawave_v3,0.0,702.57,1491.33
256,256,5120,640,81,0,6.6084,a8w8_rowwise_128x32x64x128_32x32_1x1_8x16x1_8x16x1_1x16x1x8_8x8x1_1x1_interwave_v2,0.0,253.88,917.33
256,256,5120,1280,15,0,8.2757,a8w8_rowwise_256x128x64x256_32x32_2x1_16x16x1_16x16x1_1x32x1x8_8x8x1_1x1_intrawave_v3,0.0,405.46,1148.27
256,256,5120,3200,15,0,15.7837,a8w8_rowwise_256x128x64x256_32x32_2x1_16x16x1_16x16x1_1x32x1x8_8x8x1_1x1_intrawave_v3,0.0,531.47,1256.02
256,256,5120,5120,23,0,21.8405,a8w8_rowwise_256x64x64x512_32x32_1x1_32x8x1_32x8x1_1x32x1x8_8x8x1_1x1_intrawave_v3,0.0,614.54,1380.31
256,256,5120,6400,21,0,23.7832,a8w8_rowwise_256x64x128x256_32x32_1x2_16x16x1_16x16x1_1x32x1x8_8x8x1_1x1_intrawave_v3,0.0,705.42,1556.89
256,256,5120,25600,23,0,86.0166,a8w8_rowwise_256x64x64x512_32x32_1x1_32x8x1_32x8x1_1x32x1x8_8x8x1_1x1_intrawave_v3,0.0,780.19,1630.46
256,256,6400,5120,23,0,22.7861,a8w8_rowwise_256x64x64x512_32x32_1x1_32x8x1_32x8x1_1x32x1x8_8x8x1_1x1_intrawave_v3,0.0,736.29,1639.4
256,256,7168,8192,15,0,30.291,a8w8_rowwise_256x128x64x256_32x32_2x1_16x16x1_16x16x1_1x32x1x8_8x8x1_1x1_intrawave_v3,0.0,992.53,2128.93
256,256,8192,1024,21,0,8.6043,a8w8_rowwise_256x64x128x256_32x32_1x2_16x16x1_16x16x1_1x32x1x8_8x8x1_1x1_intrawave_v3,0.0,499.17,1492.86
256,256,8192,2048,15,0,10.9387,a8w8_rowwise_256x128x64x256_32x32_2x1_16x16x1_16x16x1_1x32x1x8_8x8x1_1x1_intrawave_v3,0.0,785.28,1965.12
256,256,8192,3584,15,0,16.5846,a8w8_rowwise_256x128x64x256_32x32_2x1_16x16x1_16x16x1_1x32x1x8_8x8x1_1x1_intrawave_v3,0.0,906.41,2078.55
256,256,8192,7168,21,0,29.138,a8w8_rowwise_256x64x128x256_32x32_1x2_16x16x1_16x16x1_1x32x1x8_8x8x1_1x1_intrawave_v3,0.0,1031.81,2222.17
256,256,8192,8192,15,0,31.6256,a8w8_rowwise_256x128x64x256_32x32_2x1_16x16x1_16x16x1_1x32x1x8_8x8x1_1x1_intrawave_v3,0.0,1086.45,2320.91
256,256,8192,28672,15,0,102.0397,a8w8_rowwise_256x128x64x256_32x32_2x1_16x16x1_16x16x1_1x32x1x8_8x8x1_1x1_intrawave_v3,0.0,1178.55,2414.9
256,256,9216,16384,23,0,86.8248,a8w8_rowwise_256x64x64x512_32x32_1x1_32x8x1_32x8x1_1x32x1x8_8x8x1_1x1_intrawave_v3,0.0,890.41,1841.73
256,256,10240,8192,41,0,42.9954,a8w8_rowwise_256x128x128x128_32x32_2x2_8x32x1_8x32x1_1x32x1x8_8x8x1_1x1_intrawave_v5,0.0,998.94,2121.76
256,256,12800,5120,15,0,42.5463,a8w8_rowwise_256x128x64x256_32x32_2x1_16x16x1_16x16x1_1x32x1x8_8x8x1_1x1_intrawave_v3,0.0,788.66,1725.19
256,256,13312,16384,23,0,113.4219,a8w8_rowwise_256x64x64x512_32x32_1x1_32x8x1_32x8x1_1x32x1x8_8x8x1_1x1_intrawave_v3,0.0,984.55,2020.01
256,256,16384,2048,15,0,22.0982,a8w8_rowwise_256x128x64x256_32x32_2x1_16x16x1_16x16x1_1x32x1x8_8x8x1_1x1_intrawave_v3,0.0,777.43,1921.76
256,256,16384,4096,15,0,39.8495,a8w8_rowwise_256x128x64x256_32x32_2x1_16x16x1_16x16x1_1x32x1x8_8x8x1_1x1_intrawave_v3,0.0,862.24,1920.88
256,256,16384,6656,23,0,57.6756,a8w8_rowwise_256x64x64x512_32x32_1x1_32x8x1_32x8x1_1x32x1x8_8x8x1_1x1_intrawave_v3,0.0,968.08,2065.77
256,256,16384,8192,15,0,72.9104,a8w8_rowwise_256x128x64x256_32x32_2x1_16x16x1_16x16x1_1x32x1x8_8x8x1_1x1_intrawave_v3,0.0,942.52,1984.68
256,256,16384,13312,23,0,106.2833,a8w8_rowwise_256x64x64x512_32x32_1x1_32x8x1_32x8x1_1x32x1x8_8x8x1_1x1_intrawave_v3,0.0,1050.67,2163.09
256,256,16384,26624,23,0,202.2465,a8w8_rowwise_256x64x64x512_32x32_1x1_32x8x1_32x8x1_1x32x1x8_8x8x1_1x1_intrawave_v3,0.0,1104.29,2231.99
256,256,26624,16384,23,0,206.2403,a8w8_rowwise_256x64x64x512_32x32_1x1_32x8x1_32x8x1_1x32x1x8_8x8x1_1x1_intrawave_v3,0.0,1082.9,2201.48
256,256,51200,5120,40,0,120.9285,a8w8_rowwise_256x256x224x128_16x16_8x7_8x32x1_8x32x1_1x64x1x4_8x8x1_2x1_intrawave_v3,0.0,1109.89,2395.38
256,256,53248,16384,40,0,368.0253,a8w8_rowwise_256x256x224x128_16x16_8x7_8x32x1_8x32x1_1x64x1x4_8x8x1_2x1_intrawave_v3,0.0,1213.71,2456.01
256,256,57344,8192,2,0,135.372,a8w8_rowwise_256x256x224x128_32x32_2x7_8x32x1_8x32x1_1x64x1x4_8x8x1_2x1_intrawave_v3,0.0,1776.72,3702.53
256,512,100,5120,34,0,11.1055,a8w8_rowwise_256x16x64x512_16x16_1x1_32x8x1_32x8x1_1x16x1x16_4x4x1_1x1_intrawave_v3,0.0,47.21,291.37
256,512,200,5120,34,0,11.8774,a8w8_rowwise_256x16x64x512_16x16_1x1_32x8x1_32x8x1_1x16x1x16_4x4x1_1x1_intrawave_v3,0.0,88.28,324.17
256,512,800,5120,30,0,13.1908,a8w8_rowwise_256x32x64x512_16x16_1x2_32x8x1_32x8x1_1x32x1x8_8x8x1_1x2_intrawave_v3,0.0,317.97,571.36
256,512,1280,8192,28,0,23.2059,a8w8_rowwise_256x32x128x256_32x32_1x1_16x16x1_16x16x1_1x32x1x8_8x8x1_1x1_intrawave_v3,0.0,462.7,689.08
256,512,2304,16384,23,0,54.2058,a8w8_rowwise_256x64x64x512_32x32_1x1_32x8x1_32x8x1_1x32x1x8_8x8x1_1x1_intrawave_v3,0.0,713.11,894.68
256,512,2560,8192,21,0,27.6646,a8w8_rowwise_256x64x128x256_32x32_1x2_16x16x1_16x16x1_1x32x1x8_8x8x1_1x1_intrawave_v3,0.0,776.26,1004.43
256,512,4608,16384,23,0,87.1647,a8w8_rowwise_256x64x64x512_32x32_1x1_32x8x1_32x8x1_1x32x1x8_8x8x1_1x1_intrawave_v3,0.0,886.93,1016.52
256,512,5120,640,47,0,8.4036,a8w8_rowwise_256x64x64x128_32x32_1x1_8x32x1_8x32x1_1x32x1x8_8x8x1_1x1_intrawave_v3,0.0,399.29,1052.81
256,512,5120,1280,22,0,12.2285,a8w8_rowwise_256x64x96x256_16x16_2x3_16x16x1_16x16x1_1x64x1x4_8x8x1_2x1_intrawave_v3,0.0,548.79,1018.26
256,512,5120,3200,13,0,21.8498,a8w8_rowwise_256x128x128x128_32x32_2x2_8x32x1_8x32x1_1x32x1x8_8x8x1_1x1_intrawave_v3,0.0,767.84,1064.78
256,512,5120,5120,23,0,33.1376,a8w8_rowwise_256x64x64x512_32x32_1x1_32x8x1_32x8x1_1x32x1x8_8x8x1_1x1_intrawave_v3,0.0,810.06,1028.4
256,512,5120,6400,15,0,38.8017,a8w8_rowwise_256x128x64x256_32x32_2x1_16x16x1_16x16x1_1x32x1x8_8x8x1_1x1_intrawave_v3,0.0,864.77,1064.07
256,512,5120,25600,23,0,131.897,a8w8_rowwise_256x64x64x512_32x32_1x1_32x8x1_32x8x1_1x32x1x8_8x8x1_1x1_intrawave_v3,0.0,1017.6,1132.87
256,512,6400,5120,15,0,41.3468,a8w8_rowwise_256x128x64x256_32x32_2x1_16x16x1_16x16x1_1x32x1x8_8x8x1_1x1_intrawave_v3,0.0,811.54,1014.42
256,512,7168,8192,41,0,47.5197,a8w8_rowwise_256x128x128x128_32x32_2x2_8x32x1_8x32x1_1x32x1x8_8x8x1_1x1_intrawave_v5,0.0,1265.36,1478.43
256,512,8192,1024,13,0,11.7749,a8w8_rowwise_256x128x128x128_32x32_2x2_8x32x1_8x32x1_1x32x1x8_8x8x1_1x1_intrawave_v3,0.0,729.51,1469.35
256,512,8192,2048,41,0,16.8904,a8w8_rowwise_256x128x128x128_32x32_2x2_8x32x1_8x32x1_1x32x1x8_8x8x1_1x1_intrawave_v5,0.0,1017.14,1552.03
256,512,8192,3584,41,0,24.9561,a8w8_rowwise_256x128x128x128_32x32_2x2_8x32x1_8x32x1_1x32x1x8_8x8x1_1x1_intrawave_v5,0.0,1204.71,1586.14
256,512,8192,7168,41,0,44.168,a8w8_rowwise_256x128x128x128_32x32_2x2_8x32x1_8x32x1_1x32x1x8_8x8x1_1x1_intrawave_v5,0.0,1361.38,1602.49
256,512,8192,8192,13,0,51.209,a8w8_rowwise_256x128x128x128_32x32_2x2_8x32x1_8x32x1_1x32x1x8_8x8x1_1x1_intrawave_v3,0.0,1341.94,1556.21
256,512,8192,28672,41,0,150.8316,a8w8_rowwise_256x128x128x128_32x32_2x2_8x32x1_8x32x1_1x32x1x8_8x8x1_1x1_intrawave_v5,0.0,1594.61,1710.18
256,512,9216,16384,23,0,141.9471,a8w8_rowwise_256x64x64x512_32x32_1x1_32x8x1_32x8x1_1x32x1x8_8x8x1_1x1_intrawave_v3,0.0,1089.27,1189.32
256,512,10240,8192,11,0,61.9597,a8w8_rowwise_256x128x160x128_32x32_1x5_8x32x1_8x32x1_1x64x1x4_8x8x1_1x1_intrawave_v3,0.0,1386.37,1590.81
256,512,12800,5120,23,0,74.3061,a8w8_rowwise_256x64x64x512_32x32_1x1_32x8x1_32x8x1_1x32x1x8_8x8x1_1x1_intrawave_v3,0.0,903.14,1093.65
256,512,13312,16384,23,0,199.0315,a8w8_rowwise_256x64x64x512_32x32_1x1_32x8x1_32x8x1_1x32x1x8_8x8x1_1x1_intrawave_v3,0.0,1122.13,1206.46
256,512,16384,2048,15,0,38.4305,a8w8_rowwise_256x128x64x256_32x32_2x1_16x16x1_16x16x1_1x32x1x8_8x8x1_1x1_intrawave_v3,0.0,894.07,1336.96
256,512,16384,4096,15,0,65.4454,a8w8_rowwise_256x128x64x256_32x32_2x1_16x16x1_16x16x1_1x32x1x8_8x8x1_1x1_intrawave_v3,0.0,1050.03,1313.82
256,512,16384,6656,15,0,102.3241,a8w8_rowwise_256x128x64x256_32x32_2x1_16x16x1_16x16x1_1x32x1x8_8x8x1_1x1_intrawave_v3,0.0,1091.33,1263.02
256,512,16384,8192,15,0,123.6929,a8w8_rowwise_256x128x64x256_32x32_2x1_16x16x1_16x16x1_1x32x1x8_8x8x1_1x1_intrawave_v3,0.0,1111.13,1254.63
256,512,16384,13312,15,0,191.2442,a8w8_rowwise_256x128x64x256_32x32_2x1_16x16x1_16x16x1_1x32x1x8_8x8x1_1x1_intrawave_v3,0.0,1167.82,1263.81
256,512,16384,26624,15,0,365.7012,a8w8_rowwise_256x128x64x256_32x32_2x1_16x16x1_16x16x1_1x32x1x8_8x8x1_1x1_intrawave_v3,0.0,1221.43,1275.95
256,512,26624,16384,15,0,349.3418,a8w8_rowwise_256x128x64x256_32x32_2x1_16x16x1_16x16x1_1x32x1x8_8x8x1_1x1_intrawave_v3,0.0,1278.62,1350.71
256,512,51200,5120,40,0,223.8159,a8w8_rowwise_256x256x224x128_16x16_8x7_8x32x1_8x32x1_1x64x1x4_8x8x1_2x1_intrawave_v3,0.0,1199.36,1417.21
256,512,53248,16384,15,0,651.6344,a8w8_rowwise_256x128x64x256_32x32_2x1_16x16x1_16x16x1_1x32x1x8_8x8x1_1x1_intrawave_v3,0.0,1370.94,1435.36
256,512,57344,8192,2,0,233.9286,a8w8_rowwise_256x256x224x128_32x32_2x7_8x32x1_8x32x1_1x64x1x4_8x8x1_2x1_intrawave_v3,0.0,2056.34,2277.09
256,1024,100,5120,34,0,11.6746,a8w8_rowwise_256x16x64x512_16x16_1x1_32x8x1_32x8x1_1x16x1x16_4x4x1_1x1_intrawave_v3,0.0,89.82,510.48
256,1024,200,5120,34,0,12.0055,a8w8_rowwise_256x16x64x512_16x16_1x1_32x8x1_32x8x1_1x16x1x16_4x4x1_1x1_intrawave_v3,0.0,174.68,556.12
256,1024,800,5120,23,0,15.5235,a8w8_rowwise_256x64x64x512_32x32_1x1_32x8x1_32x8x1_1x32x1x8_8x8x1_1x1_intrawave_v3,0.0,540.38,707.14
256,1024,1280,8192,21,0,27.7294,a8w8_rowwise_256x64x128x256_32x32_1x2_16x16x1_16x16x1_1x32x1x8_8x8x1_1x1_intrawave_v3,0.0,774.44,775.2
256,1024,2304,16384,23,0,86.7135,a8w8_rowwise_256x64x64x512_32x32_1x1_32x8x1_32x8x1_1x32x1x8_8x8x1_1x1_intrawave_v3,0.0,891.55,683.22
256,1024,2560,8192,41,0,42.1202,a8w8_rowwise_256x128x128x128_32x32_2x2_8x32x1_8x32x1_1x32x1x8_8x8x1_1x1_intrawave_v5,0.0,1019.69,821.53
256,1024,4608,16384,23,0,143.2677,a8w8_rowwise_256x64x64x512_32x32_1x1_32x8x1_32x8x1_1x32x1x8_8x8x1_1x1_intrawave_v3,0.0,1079.23,709.94
256,1024,5120,640,11,0,11.7704,a8w8_rowwise_256x128x160x128_32x32_1x5_8x32x1_8x32x1_1x64x1x4_8x8x1_1x1_intrawave_v3,0.0,570.15,1224.93
256,1024,5120,1280,11,0,17.5871,a8w8_rowwise_256x128x160x128_32x32_1x5_8x32x1_8x32x1_1x64x1x4_8x8x1_1x1_intrawave_v3,0.0,763.16,1043.38
256,1024,5120,3200,11,0,27.688,a8w8_rowwise_256x128x160x128_32x32_1x5_8x32x1_8x32x1_1x64x1x4_8x8x1_1x1_intrawave_v3,0.0,1211.88,1088.8
256,1024,5120,5120,23,0,55.7649,a8w8_rowwise_256x64x64x512_32x32_1x1_32x8x1_32x8x1_1x32x1x8_8x8x1_1x1_intrawave_v3,0.0,962.74,752.14
256,1024,5120,6400,11,0,57.5786,a8w8_rowwise_256x128x160x128_32x32_1x5_8x32x1_8x32x1_1x64x1x4_8x8x1_1x1_intrawave_v3,0.0,1165.52,865.03
256,1024,5120,25600,23,0,227.1849,a8w8_rowwise_256x64x64x512_32x32_1x1_32x8x1_32x8x1_1x32x1x8_8x8x1_1x1_intrawave_v3,0.0,1181.57,738.48
256,1024,6400,5120,23,0,72.0506,a8w8_rowwise_256x64x64x512_32x32_1x1_32x8x1_32x8x1_1x32x1x8_8x8x1_1x1_intrawave_v3,0.0,931.41,709.47
256,1024,7168,8192,13,0,82.6278,a8w8_rowwise_256x128x128x128_32x32_2x2_8x32x1_8x32x1_1x32x1x8_8x8x1_1x1_intrawave_v3,0.0,1455.43,989.85
256,1024,8192,1024,13,0,17.3848,a8w8_rowwise_256x128x128x128_32x32_2x2_8x32x1_8x32x1_1x32x1x8_8x8x1_1x1_intrawave_v3,0.0,988.21,1507.89
256,1024,8192,2048,41,0,27.2285,a8w8_rowwise_256x128x128x128_32x32_2x2_8x32x1_8x32x1_1x32x1x8_8x8x1_1x1_intrawave_v5,0.0,1261.9,1309.35
256,1024,8192,3584,13,0,43.9928,a8w8_rowwise_256x128x128x128_32x32_2x2_8x32x1_8x32x1_1x32x1x8_8x8x1_1x1_intrawave_v3,0.0,1366.8,1132.17
256,1024,8192,7168,13,0,79.3336,a8w8_rowwise_256x128x128x128_32x32_2x2_8x32x1_8x32x1_1x32x1x8_8x8x1_1x1_intrawave_v3,0.0,1515.87,1044.17
256,1024,8192,8192,13,0,88.9386,a8w8_rowwise_256x128x128x128_32x32_2x2_8x32x1_8x32x1_1x32x1x8_8x8x1_1x1_intrawave_v3,0.0,1545.32,1037.51
256,1024,8192,28672,41,0,274.6402,a8w8_rowwise_256x128x128x128_32x32_2x2_8x32x1_8x32x1_1x32x1x8_8x8x1_1x1_intrawave_v5,0.0,1751.51,1023.22
256,1024,9216,16384,15,0,243.9282,a8w8_rowwise_256x128x64x256_32x32_2x1_16x16x1_16x16x1_1x32x1x8_8x8x1_1x1_intrawave_v3,0.0,1267.74,765.17
256,1024,10240,8192,4,0,89.391,a8w8_rowwise_256x256x160x128_32x32_2x5_8x32x1_8x32x1_1x64x1x4_8x8x1_2x1_intrawave_v3,0.0,1921.88,1266.86
256,1024,12800,5120,40,0,104.2861,a8w8_rowwise_256x256x224x128_16x16_8x7_8x32x1_8x32x1_1x64x1x4_8x8x1_2x1_intrawave_v3,0.0,1287.01,930.07
256,1024,13312,16384,40,0,306.5211,a8w8_rowwise_256x256x224x128_16x16_8x7_8x32x1_8x32x1_1x64x1x4_8x8x1_2x1_intrawave_v3,0.0,1457.25,855.22
256,1024,16384,2048,1,0,61.8687,a8w8_rowwise_256x256x256x128_32x32_4x4_8x32x1_8x32x1_1x32x1x8_8x8x1_1x1_intrawave_v3,0.0,1110.73,1118.59
256,1024,16384,4096,1,0,108.4683,a8w8_rowwise_256x256x256x128_32x32_4x4_8x32x1_8x32x1_1x32x1x8_8x8x1_1x1_intrawave_v3,0.0,1267.09,966.71
256,1024,16384,6656,1,0,165.4754,a8w8_rowwise_256x256x256x128_32x32_4x4_8x32x1_8x32x1_1x32x1x8_8x8x1_1x1_intrawave_v3,0.0,1349.68,902.99
256,1024,16384,8192,1,0,202.2384,a8w8_rowwise_256x256x256x128_32x32_4x4_8x32x1_8x32x1_1x32x1x8_8x8x1_1x1_intrawave_v3,0.0,1359.18,871.05
256,1024,16384,13312,1,0,307.7016,a8w8_rowwise_256x256x256x128_32x32_4x4_8x32x1_8x32x1_1x32x1x8_8x8x1_1x1_intrawave_v3,0.0,1451.66,862.17
256,1024,16384,26624,1,0,603.8507,a8w8_rowwise_256x256x256x128_32x32_4x4_8x32x1_8x32x1_1x32x1x8_8x8x1_1x1_intrawave_v3,0.0,1479.43,823.09
256,1024,26624,16384,15,0,630.2527,a8w8_rowwise_256x128x64x256_32x32_2x1_16x16x1_16x16x1_1x32x1x8_8x8x1_1x1_intrawave_v3,0.0,1417.45,805.25
256,1024,51200,5120,39,0,396.7395,a8w8_rowwise_256x224x256x128_16x16_7x8_8x32x1_8x32x1_1x32x1x8_8x8x1_1x2_intrawave_v3,0.0,1353.21,938.26
256,1024,53248,16384,40,0,1195.3563,a8w8_rowwise_256x256x224x128_16x16_8x7_8x32x1_8x32x1_1x64x1x4_8x8x1_2x1_intrawave_v3,0.0,1494.71,835.1
256,1024,57344,8192,2,0,438.8629,a8w8_rowwise_256x256x224x128_32x32_2x7_8x32x1_8x32x1_1x64x1x4_8x8x1_2x1_intrawave_v3,0.0,2192.19,1357.12
256,2048,100,5120,34,0,11.6595,a8w8_rowwise_256x16x64x512_16x16_1x1_32x8x1_32x8x1_1x16x1x16_4x4x1_1x1_intrawave_v3,0.0,179.87,978.37
256,2048,200,5120,30,0,13.0876,a8w8_rowwise_256x32x64x512_16x16_1x2_32x8x1_32x8x1_1x32x1x8_8x8x1_1x2_intrawave_v3,0.0,320.48,942.03
256,2048,800,5120,23,0,24.3923,a8w8_rowwise_256x64x64x512_32x32_1x1_32x8x1_32x8x1_1x32x1x8_8x8x1_1x1_intrawave_v3,0.0,687.81,732.14
256,2048,1280,8192,41,0,42.0169,a8w8_rowwise_256x128x128x128_32x32_2x2_8x32x1_8x32x1_1x32x1x8_8x8x1_1x1_intrawave_v5,0.0,1022.2,773.64
256,2048,2304,16384,23,0,145.2155,a8w8_rowwise_256x64x64x512_32x32_1x1_32x8x1_32x8x1_1x32x1x8_8x8x1_1x1_intrawave_v3,0.0,1064.75,556.0
256,2048,2560,8192,11,0,61.0366,a8w8_rowwise_256x128x160x128_32x32_1x5_8x32x1_8x32x1_1x64x1x4_8x8x1_1x1_intrawave_v3,0.0,1407.34,790.26
256,2048,4608,16384,11,0,247.0665,a8w8_rowwise_256x128x160x128_32x32_1x5_8x32x1_8x32x1_1x64x1x4_8x8x1_1x1_intrawave_v3,0.0,1251.64,517.78
256,2048,5120,640,10,0,17.6749,a8w8_rowwise_256x128x192x128_32x32_2x3_8x32x1_8x32x1_1x32x1x8_8x8x1_1x1_intrawave_v3,0.0,759.37,1446.06
256,2048,5120,1280,4,0,27.4475,a8w8_rowwise_256x256x160x128_32x32_2x5_8x32x1_8x32x1_1x64x1x4_8x8x1_2x1_intrawave_v3,0.0,978.0,1098.34
256,2048,5120,3200,4,0,44.9517,a8w8_rowwise_256x256x160x128_32x32_2x5_8x32x1_8x32x1_1x64x1x4_8x8x1_2x1_intrawave_v3,0.0,1492.91,976.81
256,2048,5120,5120,15,0,96.048,a8w8_rowwise_256x128x64x256_32x32_2x1_16x16x1_16x16x1_1x32x1x8_8x8x1_1x1_intrawave_v3,0.0,1117.92,600.45
256,2048,5120,6400,4,0,90.0028,a8w8_rowwise_256x256x160x128_32x32_2x5_8x32x1_8x32x1_1x64x1x4_8x8x1_2x1_intrawave_v3,0.0,1491.26,742.72
256,2048,5120,25600,15,0,419.2679,a8w8_rowwise_256x128x64x256_32x32_2x1_16x16x1_16x16x1_1x32x1x8_8x8x1_1x1_intrawave_v3,0.0,1280.5,487.69
256,2048,6400,5120,39,0,107.5421,a8w8_rowwise_256x224x256x128_16x16_7x8_8x32x1_8x32x1_1x32x1x8_8x8x1_1x2_intrawave_v3,0.0,1248.05,645.96
256,2048,7168,8192,2,0,116.6871,a8w8_rowwise_256x256x224x128_32x32_2x7_8x32x1_8x32x1_1x64x1x4_8x8x1_2x1_intrawave_v3,0.0,2061.22,898.62
256,2048,8192,1024,1,0,29.7892,a8w8_rowwise_256x256x256x128_32x32_4x4_8x32x1_8x32x1_1x32x1x8_8x8x1_1x1_intrawave_v3,0.0,1153.43,1478.39
256,2048,8192,2048,1,0,42.7444,a8w8_rowwise_256x256x256x128_32x32_4x4_8x32x1_8x32x1_1x32x1x8_8x8x1_1x1_intrawave_v3,0.0,1607.68,1275.63
256,2048,8192,3584,1,0,65.1518,a8w8_rowwise_256x256x256x128_32x32_4x4_8x32x1_8x32x1_1x32x1x8_8x8x1_1x1_intrawave_v3,0.0,1845.83,1078.32
256,2048,8192,7168,1,0,113.2102,a8w8_rowwise_256x256x256x128_32x32_4x4_8x32x1_8x32x1_1x32x1x8_8x8x1_1x1_intrawave_v3,0.0,2124.53,944.74
256,2048,8192,8192,1,0,125.3472,a8w8_rowwise_256x256x256x128_32x32_4x4_8x32x1_8x32x1_1x32x1x8_8x8x1_1x1_intrawave_v3,0.0,2192.93,936.92
256,2048,8192,28672,1,0,387.0603,a8w8_rowwise_256x256x256x128_32x32_4x4_8x32x1_8x32x1_1x32x1x8_8x8x1_1x1_intrawave_v3,0.0,2485.59,845.23
256,2048,9216,16384,15,0,431.0243,a8w8_rowwise_256x128x64x256_32x32_2x1_16x16x1_16x16x1_1x32x1x8_8x8x1_1x1_intrawave_v3,0.0,1434.9,515.74
256,2048,10240,8192,4,0,170.1034,a8w8_rowwise_256x256x160x128_32x32_2x5_8x32x1_8x32x1_1x64x1x4_8x8x1_2x1_intrawave_v3,0.0,2019.93,838.35
256,2048,12800,5120,39,0,188.6903,a8w8_rowwise_256x224x256x128_16x16_7x8_8x32x1_8x32x1_1x32x1x8_8x8x1_1x2_intrawave_v3,0.0,1422.62,680.75
256,2048,13312,16384,40,0,609.7983,a8w8_rowwise_256x256x224x128_16x16_8x7_8x32x1_8x32x1_1x64x1x4_8x8x1_2x1_intrawave_v3,0.0,1465.0,502.11
256,2048,16384,2048,1,0,109.435,a8w8_rowwise_256x256x256x128_32x32_4x4_8x32x1_8x32x1_1x32x1x8_8x8x1_1x1_intrawave_v3,0.0,1255.9,958.17
256,2048,16384,4096,1,0,192.1657,a8w8_rowwise_256x256x256x128_32x32_4x4_8x32x1_8x32x1_1x32x1x8_8x8x1_1x1_intrawave_v3,0.0,1430.42,742.1
256,2048,16384,6656,1,0,297.4271,a8w8_rowwise_256x256x256x128_32x32_4x4_8x32x1_8x32x1_1x32x1x8_8x8x1_1x1_intrawave_v3,0.0,1501.8,638.11
256,2048,16384,8192,1,0,351.3779,a8w8_rowwise_256x256x256x128_32x32_4x4_8x32x1_8x32x1_1x32x1x8_8x8x1_1x1_intrawave_v3,0.0,1564.57,620.71
256,2048,16384,13312,1,0,562.4285,a8w8_rowwise_256x256x256x128_32x32_4x4_8x32x1_8x32x1_1x32x1x8_8x8x1_1x1_intrawave_v3,0.0,1588.39,555.58
256,2048,16384,26624,1,0,1159.8861,a8w8_rowwise_256x256x256x128_32x32_4x4_8x32x1_8x32x1_1x32x1x8_8x8x1_1x1_intrawave_v3,0.0,1540.42,480.95
256,2048,26624,16384,40,0,1145.701,a8w8_rowwise_256x256x224x128_16x16_8x7_8x32x1_8x32x1_1x64x1x4_8x8x1_2x1_intrawave_v3,0.0,1559.49,505.21
256,2048,51200,5120,39,0,756.332,a8w8_rowwise_256x224x256x128_16x16_7x8_8x32x1_8x32x1_1x32x1x8_8x8x1_1x2_intrawave_v3,0.0,1419.67,637.74
256,2048,53248,16384,1,0,2196.6099,a8w8_rowwise_256x256x256x128_32x32_4x4_8x32x1_8x32x1_1x32x1x8_8x8x1_1x1_intrawave_v3,0.0,1626.79,511.73
256,2048,57344,8192,1,0,814.7053,a8w8_rowwise_256x256x256x128_32x32_4x4_8x32x1_8x32x1_1x32x1x8_8x8x1_1x1_intrawave_v3,0.0,2361.77,885.5
256,4096,100,5120,34,0,16.1651,a8w8_rowwise_256x16x64x512_16x16_1x1_32x8x1_32x8x1_1x16x1x16_4x4x1_1x1_intrawave_v3,0.0,259.47,1379.68
256,4096,200,5120,23,0,15.2341,a8w8_rowwise_256x64x64x512_32x32_1x1_32x8x1_32x8x1_1x32x1x8_8x8x1_1x1_intrawave_v3,0.0,550.65,1551.38
256,4096,800,5120,15,0,36.4711,a8w8_rowwise_256x128x64x256_32x32_2x1_16x16x1_16x16x1_1x32x1x8_8x8x1_1x1_intrawave_v3,0.0,920.03,867.02
256,4096,1280,8192,11,0,59.932,a8w8_rowwise_256x128x160x128_32x32_1x5_8x32x1_8x32x1_1x64x1x4_8x8x1_1x1_intrawave_v3,0.0,1433.28,909.8
256,4096,2304,16384,11,0,246.424,a8w8_rowwise_256x128x160x128_32x32_1x5_8x32x1_8x32x1_1x64x1x4_8x8x1_1x1_intrawave_v3,0.0,1254.9,502.11
256,4096,2560,8192,4,0,90.7509,a8w8_rowwise_256x256x160x128_32x32_2x5_8x32x1_8x32x1_1x64x1x4_8x8x1_2x1_intrawave_v3,0.0,1893.08,831.92
256,4096,4608,16384,15,0,433.3975,a8w8_rowwise_256x128x64x256_32x32_2x1_16x16x1_16x16x1_1x32x1x8_8x8x1_1x1_intrawave_v3,0.0,1427.04,416.14
256,4096,5120,640,13,0,32.4583,a8w8_rowwise_256x128x128x128_32x32_2x2_8x32x1_8x32x1_1x32x1x8_8x8x1_1x1_intrawave_v3,0.0,827.02,1473.93
256,4096,5120,1280,13,0,50.6317,a8w8_rowwise_256x128x128x128_32x32_2x2_8x32x1_8x32x1_1x32x1x8_8x8x1_1x1_intrawave_v3,0.0,1060.35,1061.38
256,4096,5120,3200,4,0,86.6115,a8w8_rowwise_256x256x160x128_32x32_2x5_8x32x1_8x32x1_1x64x1x4_8x8x1_2x1_intrawave_v3,0.0,1549.65,824.77
256,4096,5120,5120,15,0,177.0814,a8w8_rowwise_256x128x64x256_32x32_2x1_16x16x1_16x16x1_1x32x1x8_8x8x1_1x1_intrawave_v3,0.0,1212.71,503.32
256,4096,5120,6400,4,0,162.2341,a8w8_rowwise_256x256x160x128_32x32_2x5_8x32x1_8x32x1_1x64x1x4_8x8x1_2x1_intrawave_v3,0.0,1654.62,622.1
256,4096,5120,25600,15,0,782.4893,a8w8_rowwise_256x128x64x256_32x32_2x1_16x16x1_16x16x1_1x32x1x8_8x8x1_1x1_intrawave_v3,0.0,1372.21,355.11
256,4096,6400,5120,39,0,188.523,a8w8_rowwise_256x224x256x128_16x16_7x8_8x32x1_8x32x1_1x32x1x8_8x8x1_1x2_intrawave_v3,0.0,1423.89,563.16
256,4096,7168,8192,2,0,219.2844,a8w8_rowwise_256x256x224x128_32x32_2x7_8x32x1_8x32x1_1x64x1x4_8x8x1_2x1_intrawave_v3,0.0,2193.66,688.58
256,4096,8192,1024,1,0,55.6305,a8w8_rowwise_256x256x256x128_32x32_4x4_8x32x1_8x32x1_1x32x1x8_8x8x1_1x1_intrawave_v3,0.0,1235.28,1432.52
256,4096,8192,2048,1,0,83.0059,a8w8_rowwise_256x256x256x128_32x32_4x4_8x32x1_8x32x1_1x32x1x8_8x8x1_1x1_intrawave_v3,0.0,1655.77,1111.66
256,4096,8192,3584,1,0,122.3648,a8w8_rowwise_256x256x256x128_32x32_4x4_8x32x1_8x32x1_1x32x1x8_8x8x1_1x1_intrawave_v3,0.0,1965.58,908.34
256,4096,8192,7168,1,0,215.6239,a8w8_rowwise_256x256x256x128_32x32_4x4_8x32x1_8x32x1_1x32x1x8_8x8x1_1x1_intrawave_v3,0.0,2230.9,719.72
256,4096,8192,8192,1,0,240.0438,a8w8_rowwise_256x256x256x128_32x32_4x4_8x32x1_8x32x1_1x32x1x8_8x8x1_1x1_intrawave_v3,0.0,2290.23,698.92
256,4096,8192,28672,1,0,764.1022,a8w8_rowwise_256x256x256x128_32x32_4x4_8x32x1_8x32x1_1x32x1x8_8x8x1_1x1_intrawave_v3,0.0,2518.18,548.92
256,4096,9216,16384,39,0,778.6417,a8w8_rowwise_256x224x256x128_16x16_7x8_8x32x1_8x32x1_1x32x1x8_8x8x1_1x2_intrawave_v3,0.0,1588.6,377.07
256,4096,10240,8192,1,0,318.603,a8w8_rowwise_256x256x256x128_32x32_4x4_8x32x1_8x32x1_1x32x1x8_8x8x1_1x1_intrawave_v3,0.0,2156.9,631.9
256,4096,12800,5120,39,0,356.6531,a8w8_rowwise_256x224x256x128_16x16_7x8_8x32x1_8x32x1_1x32x1x8_8x8x1_1x2_intrawave_v3,0.0,1505.3,536.56
256,4096,13312,16384,10,0,1114.1158,a8w8_rowwise_256x128x192x128_32x32_2x3_8x32x1_8x32x1_1x32x1x8_8x8x1_1x1_intrawave_v3,0.0,1603.7,353.88
256,4096,16384,2048,1,0,205.0841,a8w8_rowwise_256x256x256x128_32x32_4x4_8x32x1_8x32x1_1x32x1x8_8x8x1_1x1_intrawave_v3,0.0,1340.32,858.97
256,4096,16384,4096,39,0,353.73,a8w8_rowwise_256x224x256x128_16x16_7x8_8x32x1_8x32x1_1x32x1x8_8x8x1_1x2_intrawave_v3,0.0,1554.17,616.58
256,4096,16384,6656,39,0,561.0198,a8w8_rowwise_256x224x256x128_16x16_7x8_8x32x1_8x32x1_1x32x1x8_8x8x1_1x2_intrawave_v3,0.0,1592.37,482.22
256,4096,16384,8192,39,0,657.0519,a8w8_rowwise_256x224x256x128_16x16_7x8_8x32x1_8x32x1_1x32x1x8_8x8x1_1x2_intrawave_v3,0.0,1673.4,459.61
256,4096,16384,13312,1,0,1080.1678,a8w8_rowwise_256x256x256x128_32x32_4x4_8x32x1_8x32x1_1x32x1x8_8x8x1_1x1_intrawave_v3,0.0,1654.1,376.65
256,4096,16384,26624,1,0,2197.8702,a8w8_rowwise_256x256x256x128_32x32_4x4_8x32x1_8x32x1_1x32x1x8_8x8x1_1x1_intrawave_v3,0.0,1625.85,309.15
256,4096,26624,16384,10,0,2199.7579,a8w8_rowwise_256x128x192x128_32x32_2x3_8x32x1_8x32x1_1x32x1x8_8x8x1_1x1_intrawave_v3,0.0,1624.46,327.95
256,4096,51200,5120,1,0,1418.8126,a8w8_rowwise_256x256x256x128_32x32_4x4_8x32x1_8x32x1_1x32x1x8_8x8x1_1x1_intrawave_v3,0.0,1513.58,495.16
256,4096,53248,16384,1,0,4075.2597,a8w8_rowwise_256x256x256x128_32x32_4x4_8x32x1_8x32x1_1x32x1x8_8x8x1_1x1_intrawave_v3,0.0,1753.71,337.58
256,4096,57344,8192,1,0,1617.8989,a8w8_rowwise_256x256x256x128_32x32_4x4_8x32x1_8x32x1_1x32x1x8_8x8x1_1x1_intrawave_v3,0.0,2378.57,601.45
256,8192,100,5120,29,0,27.2037,a8w8_rowwise_256x32x96x256_16x16_1x3_16x16x1_16x16x1_1x32x1x8_4x4x1_1x1_intrawave_v3,0.0,308.36,1620.86
256,8192,200,5120,21,0,25.2734,a8w8_rowwise_256x64x128x256_32x32_1x2_16x16x1_16x16x1_1x32x1x8_8x8x1_1x1_intrawave_v3,0.0,663.83,1829.74
256,8192,800,5120,41,0,65.9722,a8w8_rowwise_256x128x128x128_32x32_2x2_8x32x1_8x32x1_1x32x1x8_8x8x1_1x1_intrawave_v5,0.0,1017.23,896.53
256,8192,1280,8192,4,0,95.3807,a8w8_rowwise_256x256x160x128_32x32_2x5_8x32x1_8x32x1_1x64x1x4_8x8x1_2x1_intrawave_v3,0.0,1801.19,1033.4
256,8192,2304,16384,15,0,463.8213,a8w8_rowwise_256x128x64x256_32x32_2x1_16x16x1_16x16x1_1x32x1x8_8x8x1_1x1_intrawave_v3,0.0,1333.43,452.15
256,8192,2560,8192,4,0,173.6356,a8w8_rowwise_256x256x160x128_32x32_2x5_8x32x1_8x32x1_1x64x1x4_8x8x1_2x1_intrawave_v3,0.0,1978.84,748.83
256,8192,4608,16384,39,0,844.5637,a8w8_rowwise_256x224x256x128_16x16_7x8_8x32x1_8x32x1_1x32x1x8_8x8x1_1x2_intrawave_v3,0.0,1464.6,337.7
256,8192,5120,640,42,0,55.1814,a8w8_rowwise_256x128x256x64_32x32_2x4_4x64x1_4x64x1_1x32x1x8_8x8x1_1x1_interwave_v1,0.0,972.92,1674.58
256,8192,5120,1280,39,0,86.4091,a8w8_rowwise_256x224x256x128_16x16_7x8_8x32x1_8x32x1_1x32x1x8_8x8x1_1x2_intrawave_v3,0.0,1242.63,1168.0
256,8192,5120,3200,40,0,149.3935,a8w8_rowwise_256x256x224x128_16x16_8x7_8x32x1_8x32x1_1x64x1x4_8x8x1_2x1_intrawave_v3,0.0,1796.83,846.65
256,8192,5120,5120,39,0,277.9848,a8w8_rowwise_256x224x256x128_16x16_7x8_8x32x1_8x32x1_1x32x1x8_8x8x1_1x2_intrawave_v3,0.0,1545.04,546.95
256,8192,5120,6400,40,0,276.3348,a8w8_rowwise_256x256x224x128_16x16_8x7_8x32x1_8x32x1_1x64x1x4_8x8x1_2x1_intrawave_v3,0.0,1942.83,611.88
256,8192,5120,25600,39,0,1513.1737,a8w8_rowwise_256x224x256x128_16x16_7x8_8x32x1_8x32x1_1x32x1x8_8x8x1_1x2_intrawave_v3,0.0,1419.19,280.65
256,8192,6400,5120,39,0,359.0195,a8w8_rowwise_256x224x256x128_16x16_7x8_8x32x1_8x32x1_1x32x1x8_8x8x1_1x2_intrawave_v3,0.0,1495.38,500.16
256,8192,7168,8192,2,0,420.8889,a8w8_rowwise_256x256x224x128_32x32_2x7_8x32x1_8x32x1_1x64x1x4_8x8x1_2x1_intrawave_v3,0.0,2285.81,577.99
256,8192,8192,1024,1,0,105.9654,a8w8_rowwise_256x256x256x128_32x32_4x4_8x32x1_8x32x1_1x32x1x8_8x8x1_1x1_intrawave_v3,0.0,1297.02,1424.95
256,8192,8192,2048,1,0,159.9883,a8w8_rowwise_256x256x256x128_32x32_4x4_8x32x1_8x32x1_1x32x1x8_8x8x1_1x1_intrawave_v3,0.0,1718.11,1048.65
256,8192,8192,3584,1,0,232.9396,a8w8_rowwise_256x256x256x128_32x32_4x4_8x32x1_8x32x1_1x32x1x8_8x8x1_1x1_intrawave_v3,0.0,2065.07,828.27
256,8192,8192,7168,1,0,412.978,a8w8_rowwise_256x256x256x128_32x32_4x4_8x32x1_8x32x1_1x32x1x8_8x8x1_1x1_intrawave_v3,0.0,2329.6,609.37
256,8192,8192,8192,1,0,469.2882,a8w8_rowwise_256x256x256x128_32x32_4x4_8x32x1_8x32x1_1x32x1x8_8x8x1_1x1_intrawave_v3,0.0,2342.93,572.01
256,8192,8192,28672,1,0,1532.6908,a8w8_rowwise_256x256x256x128_32x32_4x4_8x32x1_8x32x1_1x32x1x8_8x8x1_1x1_intrawave_v3,0.0,2510.81,394.06
256,8192,9216,16384,43,0,1557.3892,a8w8_rowwise_256x256x128x64_32x32_4x2_4x64x1_4x64x1_1x32x1x8_8x8x1_1x1_interwave_v1,0.0,1588.49,280.09
256,8192,10240,8192,1,0,575.9516,a8w8_rowwise_256x256x256x128_32x32_4x4_8x32x1_8x32x1_1x32x1x8_8x8x1_1x1_intrawave_v3,0.0,2386.29,553.46
256,8192,12800,5120,39,0,683.3672,a8w8_rowwise_256x224x256x128_16x16_7x8_8x32x1_8x32x1_1x32x1x8_8x8x1_1x2_intrawave_v3,0.0,1571.25,464.16
256,8192,13312,16384,40,0,2189.1084,a8w8_rowwise_256x256x224x128_16x16_8x7_8x32x1_8x32x1_1x64x1x4_8x8x1_2x1_intrawave_v3,0.0,1632.36,260.57
256,8192,16384,2048,39,0,392.4492,a8w8_rowwise_256x224x256x128_16x16_7x8_8x32x1_8x32x1_1x32x1x8_8x8x1_1x2_intrawave_v3,0.0,1400.83,812.25
256,8192,16384,4096,39,0,678.4652,a8w8_rowwise_256x224x256x128_16x16_7x8_8x32x1_8x32x1_1x32x1x8_8x8x1_1x2_intrawave_v3,0.0,1620.59,544.02
256,8192,16384,6656,39,0,1094.0621,a8w8_rowwise_256x224x256x128_16x16_7x8_8x32x1_8x32x1_1x32x1x8_8x8x1_1x2_intrawave_v3,0.0,1633.09,394.87
256,8192,16384,8192,1,0,1288.1354,a8w8_rowwise_256x256x256x128_32x32_4x4_8x32x1_8x32x1_1x32x1x8_8x8x1_1x1_intrawave_v3,0.0,1707.14,364.68
256,8192,16384,13312,1,0,2091.5748,a8w8_rowwise_256x256x256x128_32x32_4x4_8x32x1_8x32x1_1x32x1x8_8x8x1_1x1_intrawave_v3,0.0,1708.48,284.76
256,8192,16384,26624,1,0,4736.0103,a8w8_rowwise_256x256x256x128_32x32_4x4_8x32x1_8x32x1_1x32x1x8_8x8x1_1x1_intrawave_v3,0.0,1509.04,194.84
256,8192,26624,16384,40,0,4074.1172,a8w8_rowwise_256x256x224x128_16x16_8x7_8x32x1_8x32x1_1x64x1x4_8x8x1_2x1_intrawave_v3,0.0,1754.2,247.08
256,8192,51200,5120,1,0,2639.7599,a8w8_rowwise_256x256x256x128_32x32_4x4_8x32x1_8x32x1_1x32x1x8_8x8x1_1x1_intrawave_v3,0.0,1627.03,432.97
256,8192,53248,16384,40,0,8028.0784,a8w8_rowwise_256x256x224x128_16x16_8x7_8x32x1_8x32x1_1x64x1x4_8x8x1_2x1_intrawave_v3,0.0,1780.46,234.06
256,8192,57344,8192,1,0,3164.0659,a8w8_rowwise_256x256x256x128_32x32_4x4_8x32x1_8x32x1_1x32x1x8_8x8x1_1x1_intrawave_v3,0.0,2432.5,466.61
256,16384,100,5120,27,0,42.6746,a8w8_rowwise_256x32x160x256_16x16_1x5_16x16x1_16x16x1_1x32x1x8_4x4x1_1x1_intrawave_v3,0.0,393.14,2054.5
256,16384,200,5120,21,0,44.0772,a8w8_rowwise_256x64x128x256_32x32_1x2_16x16x1_16x16x1_1x32x1x8_8x8x1_1x1_intrawave_v3,0.0,761.27,2075.08
256,16384,800,5120,1,0,111.2384,a8w8_rowwise_256x256x256x128_32x32_4x4_8x32x1_8x32x1_1x32x1x8_8x8x1_1x1_intrawave_v3,0.0,1206.58,1026.59
256,16384,1280,8192,4,0,178.1119,a8w8_rowwise_256x256x160x128_32x32_2x5_8x32x1_8x32x1_1x64x1x4_8x8x1_2x1_intrawave_v3,0.0,1929.11,1047.92
256,16384,2304,16384,15,0,878.7062,a8w8_rowwise_256x128x64x256_32x32_2x1_16x16x1_16x16x1_1x32x1x8_8x8x1_1x1_intrawave_v3,0.0,1407.7,434.37
256,16384,2560,8192,1,0,329.1334,a8w8_rowwise_256x256x256x128_32x32_4x4_8x32x1_8x32x1_1x32x1x8_8x8x1_1x1_intrawave_v3,0.0,2087.89,726.38
256,16384,4608,16384,40,0,1632.4516,a8w8_rowwise_256x256x224x128_16x16_8x7_8x32x1_8x32x1_1x64x1x4_8x8x1_2x1_intrawave_v3,0.0,1515.45,303.18
256,16384,5120,640,43,0,99.8836,a8w8_rowwise_256x256x128x64_32x32_4x2_4x64x1_4x64x1_1x32x1x8_8x8x1_1x1_interwave_v1,0.0,1074.99,1817.46
256,16384,5120,1280,1,0,153.6015,a8w8_rowwise_256x256x256x128_32x32_4x4_8x32x1_8x32x1_1x32x1x8_8x8x1_1x1_intrawave_v3,0.0,1398.09,1271.45
256,16384,5120,3200,1,0,271.2735,a8w8_rowwise_256x256x256x128_32x32_4x4_8x32x1_8x32x1_1x32x1x8_8x8x1_1x1_intrawave_v3,0.0,1979.08,872.13
256,16384,5120,5120,1,0,518.1604,a8w8_rowwise_256x256x256x128_32x32_4x4_8x32x1_8x32x1_1x32x1x8_8x8x1_1x1_intrawave_v3,0.0,1657.78,536.27
256,16384,5120,6400,1,0,543.7765,a8w8_rowwise_256x256x256x128_32x32_4x4_8x32x1_8x32x1_1x32x1x8_8x8x1_1x1_intrawave_v3,0.0,1974.6,561.62
256,16384,5120,25600,1,0,2869.8056,a8w8_rowwise_256x256x256x128_32x32_4x4_8x32x1_8x32x1_1x32x1x8_8x8x1_1x1_intrawave_v3,0.0,1496.61,250.29
256,16384,6400,5120,40,0,690.0605,a8w8_rowwise_256x256x224x128_16x16_8x7_8x32x1_8x32x1_1x64x1x4_8x8x1_2x1_intrawave_v3,0.0,1556.01,472.96
256,16384,7168,8192,1,0,815.6995,a8w8_rowwise_256x256x256x128_32x32_4x4_8x32x1_8x32x1_1x32x1x8_8x8x1_1x1_intrawave_v3,0.0,2358.89,524.48
256,16384,8192,1024,10,0,198.2601,a8w8_rowwise_256x128x192x128_32x32_2x3_8x32x1_8x32x1_1x32x1x8_8x8x1_1x1_intrawave_v3,0.0,1386.45,1480.89
256,16384,8192,2048,1,0,299.7045,a8w8_rowwise_256x256x256x128_32x32_4x4_8x32x1_8x32x1_1x32x1x8_8x8x1_1x1_intrawave_v3,0.0,1834.33,1063.6
256,16384,8192,3584,1,0,463.2471,a8w8_rowwise_256x256x256x128_32x32_4x4_8x32x1_8x32x1_1x32x1x8_8x8x1_1x1_intrawave_v3,0.0,2076.8,769.6
256,16384,8192,7168,1,0,819.3844,a8w8_rowwise_256x256x256x128_32x32_4x4_8x32x1_8x32x1_1x32x1x8_8x8x1_1x1_intrawave_v3,0.0,2348.28,542.6
256,16384,8192,8192,1,0,933.9446,a8w8_rowwise_256x256x256x128_32x32_4x4_8x32x1_8x32x1_1x32x1x8_8x8x1_1x1_intrawave_v3,0.0,2354.55,502.99
256,16384,8192,28672,1,0,3088.0838,a8w8_rowwise_256x256x256x128_32x32_4x4_8x32x1_8x32x1_1x32x1x8_8x8x1_1x1_intrawave_v3,0.0,2492.35,315.11
256,16384,9216,16384,1,0,2949.0967,a8w8_rowwise_256x256x256x128_32x32_4x4_8x32x1_8x32x1_1x32x1x8_8x8x1_1x1_intrawave_v3,0.0,1677.73,244.62
256,16384,10240,8192,1,0,1149.3883,a8w8_rowwise_256x256x256x128_32x32_4x4_8x32x1_8x32x1_1x32x1x8_8x8x1_1x1_intrawave_v3,0.0,2391.51,481.69
256,16384,12800,5120,39,0,1303.8826,a8w8_rowwise_256x224x256x128_16x16_7x8_8x32x1_8x32x1_1x32x1x8_8x8x1_1x2_intrawave_v3,0.0,1646.99,436.28
256,16384,13312,16384,1,0,4134.6494,a8w8_rowwise_256x256x256x128_32x32_4x4_8x32x1_8x32x1_1x32x1x8_8x8x1_1x1_intrawave_v3,0.0,1728.52,223.17
256,16384,16384,2048,1,0,719.1952,a8w8_rowwise_256x256x256x128_32x32_4x4_8x32x1_8x32x1_1x32x1x8_8x8x1_1x1_intrawave_v3,0.0,1528.81,839.8
256,16384,16384,4096,39,0,1327.6342,a8w8_rowwise_256x224x256x128_16x16_7x8_8x32x1_8x32x1_1x32x1x8_8x8x1_1x2_intrawave_v3,0.0,1656.35,505.48
256,16384,16384,6656,39,0,2120.7951,a8w8_rowwise_256x224x256x128_16x16_7x8_8x32x1_8x32x1_1x32x1x8_8x8x1_1x2_intrawave_v3,0.0,1684.94,355.99
256,16384,16384,8192,1,0,2555.2385,a8w8_rowwise_256x256x256x128_32x32_4x4_8x32x1_8x32x1_1x32x1x8_8x8x1_1x1_intrawave_v3,0.0,1721.19,315.16
256,16384,16384,13312,1,0,4157.4955,a8w8_rowwise_256x256x256x128_32x32_4x4_8x32x1_8x32x1_1x32x1x8_8x8x1_1x1_intrawave_v3,0.0,1719.02,234.05
256,16384,16384,26624,1,0,9368.503,a8w8_rowwise_256x256x256x128_32x32_4x4_8x32x1_8x32x1_1x32x1x8_8x8x1_1x1_intrawave_v3,0.0,1525.71,150.43
256,16384,26624,16384,40,0,8090.2903,a8w8_rowwise_256x256x224x128_16x16_8x7_8x32x1_8x32x1_1x64x1x4_8x8x1_2x1_intrawave_v3,0.0,1766.77,194.93
256,16384,51200,5120,1,0,5290.8019,a8w8_rowwise_256x256x256x128_32x32_4x4_8x32x1_8x32x1_1x32x1x8_8x8x1_1x1_intrawave_v3,0.0,1623.56,382.5
256,16384,53248,16384,40,0,15996.8357,a8w8_rowwise_256x256x224x128_16x16_8x7_8x32x1_8x32x1_1x64x1x4_8x8x1_2x1_intrawave_v3,0.0,1787.06,180.39
256,16384,57344,8192,1,0,6467.762,a8w8_rowwise_256x256x256x128_32x32_4x4_8x32x1_8x32x1_1x32x1x8_8x8x1_1x1_intrawave_v3,0.0,2379.98,383.91
256,32768,100,5120,27,0,78.5325,a8w8_rowwise_256x32x160x256_16x16_1x5_16x16x1_16x16x1_1x32x1x8_4x4x1_1x1_intrawave_v3,0.0,427.27,2226.31
256,32768,200,5120,21,0,82.0643,a8w8_rowwise_256x64x128x256_32x32_1x2_16x16x1_16x16x1_1x32x1x8_8x8x1_1x1_intrawave_v3,0.0,817.76,2216.6
256,32768,800,5120,1,0,216.0528,a8w8_rowwise_256x256x256x128_32x32_4x4_8x32x1_8x32x1_1x32x1x8_8x8x1_1x1_intrawave_v3,0.0,1242.45,1038.16
256,32768,1280,8192,1,0,339.8668,a8w8_rowwise_256x256x256x128_32x32_4x4_8x32x1_8x32x1_1x32x1x8_8x8x1_1x1_intrawave_v3,0.0,2021.95,1067.5
256,32768,2304,16384,1,0,1717.9546,a8w8_rowwise_256x256x256x128_32x32_4x4_8x32x1_8x32x1_1x32x1x8_8x8x1_1x1_intrawave_v3,0.0,1440.03,422.37
256,32768,2560,8192,1,0,599.612,a8w8_rowwise_256x256x256x128_32x32_4x4_8x32x1_8x32x1_1x32x1x8_8x8x1_1x1_intrawave_v3,0.0,2292.13,762.46
256,32768,4608,16384,40,0,3026.9648,a8w8_rowwise_256x256x224x128_16x16_8x7_8x32x1_8x32x1_1x64x1x4_8x8x1_2x1_intrawave_v3,0.0,1634.58,302.07
256,32768,5120,640,43,0,191.0117,a8w8_rowwise_256x256x128x64_32x32_4x2_4x64x1_4x64x1_1x32x1x8_8x8x1_1x1_interwave_v1,0.0,1124.27,1883.62
256,32768,5120,1280,1,0,299.0856,a8w8_rowwise_256x256x256x128_32x32_4x4_8x32x1_8x32x1_1x32x1x8_8x8x1_1x1_intrawave_v3,0.0,1436.03,1284.05
256,32768,5120,3200,1,0,538.4921,a8w8_rowwise_256x256x256x128_32x32_4x4_8x32x1_8x32x1_1x32x1x8_8x8x1_1x1_intrawave_v3,0.0,1993.98,848.27
256,32768,5120,5120,40,0,999.0598,a8w8_rowwise_256x256x224x128_16x16_8x7_8x32x1_8x32x1_1x64x1x4_8x8x1_2x1_intrawave_v3,0.0,1719.6,530.03
256,32768,5120,6400,1,0,1028.2651,a8w8_rowwise_256x256x256x128_32x32_4x4_8x32x1_8x32x1_1x32x1x8_8x8x1_1x1_intrawave_v3,0.0,2088.45,562.14
256,32768,5120,25600,1,0,5734.5832,a8w8_rowwise_256x256x256x128_32x32_4x4_8x32x1_8x32x1_1x32x1x8_8x8x1_1x1_intrawave_v3,0.0,1497.92,227.65
256,32768,6400,5120,40,0,1274.1106,a8w8_rowwise_256x256x224x128_16x16_8x7_8x32x1_8x32x1_1x64x1x4_8x8x1_2x1_intrawave_v3,0.0,1685.48,486.59
256,32768,7168,8192,1,0,1620.6254,a8w8_rowwise_256x256x256x128_32x32_4x4_8x32x1_8x32x1_1x32x1x8_8x8x1_1x1_intrawave_v3,0.0,2374.57,491.73
256,32768,8192,1024,10,0,379.9256,a8w8_rowwise_256x128x192x128_32x32_2x3_8x32x1_8x32x1_1x32x1x8_8x8x1_1x1_intrawave_v3,0.0,1447.01,1523.49
256,32768,8192,2048,1,0,594.1387,a8w8_rowwise_256x256x256x128_32x32_4x4_8x32x1_8x32x1_1x32x1x8_8x8x1_1x1_intrawave_v3,0.0,1850.6,1044.8
256,32768,8192,3584,1,0,899.1908,a8w8_rowwise_256x256x256x128_32x32_4x4_8x32x1_8x32x1_1x32x1x8_8x8x1_1x1_intrawave_v3,0.0,2139.86,760.32
256,32768,8192,7168,1,0,1640.4404,a8w8_rowwise_256x256x256x128_32x32_4x4_8x32x1_8x32x1_1x32x1x8_8x8x1_1x1_intrawave_v3,0.0,2345.89,506.25
256,32768,8192,8192,1,0,1837.7153,a8w8_rowwise_256x256x256x128_32x32_4x4_8x32x1_8x32x1_1x32x1x8_8x8x1_1x1_intrawave_v3,0.0,2393.21,474.73
256,32768,8192,28672,1,0,6209.7387,a8w8_rowwise_256x256x256x128_32x32_4x4_8x32x1_8x32x1_1x32x1x8_8x8x1_1x1_intrawave_v3,0.0,2478.87,275.58
256,32768,9216,16384,1,0,5884.19,a8w8_rowwise_256x256x256x128_32x32_4x4_8x32x1_8x32x1_1x32x1x8_8x8x1_1x1_intrawave_v3,0.0,1681.73,219.55
256,32768,10240,8192,1,0,2299.333,a8w8_rowwise_256x256x256x128_32x32_4x4_8x32x1_8x32x1_1x32x1x8_8x8x1_1x1_intrawave_v3,0.0,2390.94,445.09
256,32768,12800,5120,39,0,2481.3683,a8w8_rowwise_256x224x256x128_16x16_7x8_8x32x1_8x32x1_1x32x1x8_8x8x1_1x2_intrawave_v3,0.0,1730.89,432.09
256,32768,13312,16384,40,0,8230.5195,a8w8_rowwise_256x256x224x128_16x16_8x7_8x32x1_8x32x1_1x64x1x4_8x8x1_2x1_intrawave_v3,0.0,1736.66,197.73
256,32768,16384,2048,1,0,1409.7173,a8w8_rowwise_256x256x256x128_32x32_4x4_8x32x1_8x32x1_1x32x1x8_8x8x1_1x1_intrawave_v3,0.0,1559.9,833.08
256,32768,16384,4096,39,0,2546.0869,a8w8_rowwise_256x224x256x128_16x16_7x8_8x32x1_8x32x1_1x32x1x8_8x8x1_1x2_intrawave_v3,0.0,1727.37,500.8
256,32768,16384,6656,39,0,4073.3594,a8w8_rowwise_256x224x256x128_16x16_7x8_8x32x1_8x32x1_1x32x1x8_8x8x1_1x2_intrawave_v3,0.0,1754.53,343.92
256,32768,16384,8192,39,0,4965.434,a8w8_rowwise_256x224x256x128_16x16_7x8_8x32x1_8x32x1_1x32x1x8_8x8x1_1x2_intrawave_v3,0.0,1771.47,297.33
256,32768,16384,13312,1,0,8271.2663,a8w8_rowwise_256x256x256x128_32x32_4x4_8x32x1_8x32x1_1x32x1x8_8x8x1_1x1_intrawave_v3,0.0,1728.11,208.92
256,32768,16384,26624,1,0,19064.3766,a8w8_rowwise_256x256x256x128_32x32_4x4_8x32x1_8x32x1_1x32x1x8_8x8x1_1x1_intrawave_v3,0.0,1499.51,124.96
256,32768,26624,16384,40,0,16029.2644,a8w8_rowwise_256x256x224x128_16x16_8x7_8x32x1_8x32x1_1x64x1x4_8x8x1_2x1_intrawave_v3,0.0,1783.44,169.56
256,32768,51200,5120,1,0,10610.0611,a8w8_rowwise_256x256x256x128_32x32_4x4_8x32x1_8x32x1_1x32x1x8_8x8x1_1x1_intrawave_v3,0.0,1619.21,356.77
256,32768,53248,16384,40,0,31823.1958,a8w8_rowwise_256x256x224x128_16x16_8x7_8x32x1_8x32x1_1x64x1x4_8x8x1_2x1_intrawave_v3,0.0,1796.63,153.94
256,32768,57344,8192,1,0,12840.4952,a8w8_rowwise_256x256x256x128_32x32_4x4_8x32x1_8x32x1_1x32x1x8_8x8x1_1x1_intrawave_v3,0.0,2397.6,350.17