aiter/configs/tuned_fmoe.csv
cu_num,token,model_dim,inter_dim,expert,topk,act_type,dtype,q_dtype_a,q_dtype_w,q_type,use_g1u1,doweight_stage1,block_m,ksplit,us1,kernelName1,err1,us2,kernelName2,err2,total_us,run_1stage
80,512,6144,4096,8,2,ActivationType.Silu,torch.bfloat16,torch.float8_e4m3fnuz,torch.float8_e4m3fnuz,QuantType.per_Token,1,0,64,0,373.4158,_ZN5aiter48fmoe_stage1_bf16_pertokenFp8_g1u1_64x128_2tg_pf3E,0.0%,268.4886,moe_ck2stages_gemm2_256x64x128x256_1x4_MulABScaleExpertWeight_v3_Nswizzle0_Quant2_MulRoutedWeight1_F8_F8_B16,2.3%,641.9044,0
80,512,6144,4096,8,2,ActivationType.Silu,torch.bfloat16,torch.int8,torch.int8,QuantType.per_Tensor,1,0,64,0,386.1143,_ZN5aiter49fmoe_stage1_bf16_pertokenInt8_g1u1_64x128_2tg_pf3E,0.0%,250.0186,moe_ck2stages_gemm2_256x64x128x256_1x4_MulABScaleExpertWeight_v3_Nswizzle0_Quant1_MulRoutedWeight1_I8_I8_B16,2.1%,636.1329000000001,0
80,4,2304,1536,8,2,ActivationType.Gelu,torch.bfloat16,torch.float8_e4m3fnuz,torch.float8_e4m3fnuz,QuantType.per_Token,1,0,32,0,17.6606,_ZN5aiter47fmoe_stage1_bf16_pertokenFp8_g1u1_32x64_4tg_pf3E,0.0%,15.126,moe_ck2stages_gemm2_256x32x64x256_1x4_MulABScaleExpertWeight_v1_Nswizzle0_Quant2_MulRoutedWeight1_F8_F8_B16,0.3%,32.7866,0
80,4,2304,1536,8,2,ActivationType.Gelu,torch.bfloat16,torch.float8_e4m3fnuz,torch.float8_e4m3fnuz,QuantType.per_Token,1,1,32,0,17.8008,_ZN5aiter56fmoe_stage1_bf16_pertokenFp8_doweight_g1u1_32x64_4tg_pf3E,0.0%,14.5115,moe_ck2stages_gemm2_256x32x64x128_1x4_MulABScaleExpertWeight_v1_Nswizzle0_Quant2_MulRoutedWeight0_F8_F8_B16,0.0%,32.3123,0
80,56,6144,4096,8,2,ActivationType.Silu,torch.bfloat16,torch.float8_e4m3fnuz,torch.float8_e4m3fnuz,QuantType.per_1x128,1,0,64,0,203.0534,_ZN5aiter59fmoe_stage1_bf16_pertokenFp8_blockscale_g1u1_64x128_2tg_pf3E,5.0%,128.7294,moe_ck2stages_gemm2_256x64x128x128_1x4_MulABScaleExpertWeightA8W8blkscale_v3_Nswizzle0_Quant4_MulRoutedWeight1_F8_F8_B16,5.2%,331.7828,0
80,512,6144,4096,8,2,ActivationType.Silu,torch.bfloat16,torch.bfloat16,torch.bfloat16,QuantType.No,1,0,64,0,774.6328,moe_ck2stages_gemm1_256x64x128x64_1x4_TypeCast_v3_Nswizzle0_Quant0_MulRoutedWeight0_silu_B16_B16_B16,0.0%,459.0113,moe_ck2stages_gemm2_256x64x128x128_1x4_TypeCastExpertWeight_v3_Nswizzle0_Quant0_MulRoutedWeight1_B16_B16_B16,2.3%,1233.6441,0
256,16,7168,256,256,8,ActivationType.Gelu,torch.bfloat16,torch.bfloat16,torch.bfloat16,QuantType.No,1,0,32,0,130.4639,moe_ck2stages_gemm1_256x32x64x128_1x4_TypeCast_v1_Nswizzle0_Quant0_MulRoutedWeight0_gelu_B16_B16_B16,0.0%,70.3202,moe_ck2stages_gemm2_256x32x128x128_1x4_TypeCast_v1_Nswizzle0_Quant0_MulRoutedWeight1_B16_B16_B16,1.7%,200.7841,0
256,32,7168,256,256,8,ActivationType.Gelu,torch.bfloat16,torch.bfloat16,torch.bfloat16,QuantType.No,1,0,64,0,195.38,moe_ck2stages_gemm1_256x64x64x64_1x4_TypeCast_v1_Nswizzle0_Quant0_MulRoutedWeight0_gelu_B16_B16_B16,0.0%,107.5659,moe_ck2stages_gemm2_256x64x128x128_1x4_TypeCast_v1_Nswizzle0_Quant0_MulRoutedWeight1_B16_B16_B16,1.7%,302.9459,0
256,64,7168,256,256,8,ActivationType.Gelu,torch.bfloat16,torch.bfloat16,torch.bfloat16,QuantType.No,1,0,32,0,278.093,moe_ck2stages_gemm1_256x32x64x128_1x4_TypeCast_v1_Nswizzle0_Quant0_MulRoutedWeight0_gelu_B16_B16_B16,0.0%,140.8376,moe_ck2stages_gemm2_256x32x128x128_1x4_TypeCast_v1_Nswizzle0_Quant0_MulRoutedWeight1_B16_B16_B16,1.7%,418.9306,0
256,128,7168,256,256,8,ActivationType.Gelu,torch.bfloat16,torch.bfloat16,torch.bfloat16,QuantType.No,1,0,64,0,294.8532,moe_ck2stages_gemm1_256x64x64x64_1x4_TypeCast_v1_Nswizzle0_Quant0_MulRoutedWeight0_gelu_B16_B16_B16,0.0%,160.973,moe_ck2stages_gemm2_256x64x128x128_1x4_TypeCast_v1_Nswizzle0_Quant0_MulRoutedWeight1_B16_B16_B16,1.7%,455.8262,0
256,256,7168,256,256,8,ActivationType.Gelu,torch.bfloat16,torch.bfloat16,torch.bfloat16,QuantType.No,1,0,64,0,306.0006,moe_ck2stages_gemm1_256x64x64x64_1x4_TypeCast_v1_Nswizzle0_Quant0_MulRoutedWeight0_gelu_B16_B16_B16,0.0%,170.2105,moe_ck2stages_gemm2_256x64x128x128_1x4_TypeCast_v1_Nswizzle0_Quant0_MulRoutedWeight1_B16_B16_B16,1.7%,476.2111,0
256,512,7168,256,256,8,ActivationType.Gelu,torch.bfloat16,torch.bfloat16,torch.bfloat16,QuantType.No,1,0,64,0,309.2402,moe_ck2stages_gemm1_256x64x64x64_1x4_TypeCast_v1_Nswizzle0_Quant0_MulRoutedWeight0_gelu_B16_B16_B16,0.0%,184.9719,moe_ck2stages_gemm2_256x64x128x128_1x4_TypeCast_v1_Nswizzle0_Quant0_MulRoutedWeight1_B16_B16_B16,1.6%,494.2121,0
256,1024,7168,256,256,8,ActivationType.Gelu,torch.bfloat16,torch.bfloat16,torch.bfloat16,QuantType.No,1,0,64,0,325.0568,moe_ck2stages_gemm1_256x64x64x64_1x4_TypeCast_v1_Nswizzle0_Quant0_MulRoutedWeight0_gelu_B16_B16_B16,0.0%,231.4032,moe_ck2stages_gemm2_256x64x128x128_1x4_TypeCast_v1_Nswizzle0_Quant0_MulRoutedWeight1_B16_B16_B16,1.6%,556.46,0
256,16,7168,256,256,8,ActivationType.Gelu,torch.bfloat16,torch.bfloat16,torch.bfloat16,QuantType.No,1,1,64,0,128.2525,moe_ck2stages_gemm1_256x64x64x64_1x4_TypeCast_v1_Nswizzle0_Quant0_MulRoutedWeight1_gelu_B16_B16_B16,0.0%,72.0121,moe_ck2stages_gemm2_256x64x128x128_1x4_TypeCast_v1_Nswizzle0_Quant0_MulRoutedWeight0_B16_B16_B16,0.0%,200.2646,0
256,32,7168,256,256,8,ActivationType.Gelu,torch.bfloat16,torch.bfloat16,torch.bfloat16,QuantType.No,1,1,64,0,195.9999,moe_ck2stages_gemm1_256x64x64x64_1x4_TypeCast_v1_Nswizzle0_Quant0_MulRoutedWeight1_gelu_B16_B16_B16,0.0%,102.7882,moe_ck2stages_gemm2_256x64x128x128_1x4_TypeCast_v1_Nswizzle0_Quant0_MulRoutedWeight0_B16_B16_B16,0.0%,298.7881,0
256,64,7168,256,256,8,ActivationType.Gelu,torch.bfloat16,torch.bfloat16,torch.bfloat16,QuantType.No,1,1,64,0,277.4499,moe_ck2stages_gemm1_256x64x64x64_1x4_TypeCast_v1_Nswizzle0_Quant0_MulRoutedWeight1_gelu_B16_B16_B16,0.0%,139.0861,moe_ck2stages_gemm2_256x64x128x128_1x4_TypeCast_v1_Nswizzle0_Quant0_MulRoutedWeight0_B16_B16_B16,0.0%,416.536,0
256,128,7168,256,256,8,ActivationType.Gelu,torch.bfloat16,torch.bfloat16,torch.bfloat16,QuantType.No,1,1,64,0,296.1855,moe_ck2stages_gemm1_256x64x64x64_1x4_TypeCast_v1_Nswizzle0_Quant0_MulRoutedWeight1_gelu_B16_B16_B16,0.0%,156.7142,moe_ck2stages_gemm2_256x64x128x128_1x4_TypeCast_v1_Nswizzle0_Quant0_MulRoutedWeight0_B16_B16_B16,0.0%,452.8997,0
256,256,7168,256,256,8,ActivationType.Gelu,torch.bfloat16,torch.bfloat16,torch.bfloat16,QuantType.No,1,1,64,0,306.2672,moe_ck2stages_gemm1_256x64x64x64_1x4_TypeCast_v1_Nswizzle0_Quant0_MulRoutedWeight1_gelu_B16_B16_B16,0.0%,164.6962,moe_ck2stages_gemm2_256x64x128x128_1x4_TypeCast_v1_Nswizzle0_Quant0_MulRoutedWeight0_B16_B16_B16,0.0%,470.9634,0
256,512,7168,256,256,8,ActivationType.Gelu,torch.bfloat16,torch.bfloat16,torch.bfloat16,QuantType.No,1,1,64,0,309.6434,moe_ck2stages_gemm1_256x64x64x64_1x4_TypeCast_v1_Nswizzle0_Quant0_MulRoutedWeight1_gelu_B16_B16_B16,0.0%,178.4363,moe_ck2stages_gemm2_256x64x128x128_1x4_TypeCast_v1_Nswizzle0_Quant0_MulRoutedWeight0_B16_B16_B16,0.0%,488.0797,0
256,1024,7168,256,256,8,ActivationType.Gelu,torch.bfloat16,torch.bfloat16,torch.bfloat16,QuantType.No,1,1,64,0,325.7872,moe_ck2stages_gemm1_256x64x64x64_1x4_TypeCast_v1_Nswizzle0_Quant0_MulRoutedWeight1_gelu_B16_B16_B16,0.0%,223.4421,moe_ck2stages_gemm2_256x64x128x128_1x4_TypeCast_v1_Nswizzle0_Quant0_MulRoutedWeight0_B16_B16_B16,0.0%,549.2293,0
256,16,7168,256,256,8,ActivationType.Gelu,torch.bfloat16,torch.float8_e4m3fn,torch.float8_e4m3fn,QuantType.per_Tensor,1,0,32,0,67.4265,moe_ck2stages_gemm1_256x32x64x256_1x4_TypeCast_v1_Nswizzle0_Quant1_MulRoutedWeight0_gelu_F8_F8_B16,0.0%,41.189,moe_ck2stages_gemm2_256x32x128x256_1x4_TypeCast_v1_Nswizzle0_Quant1_MulRoutedWeight1_F8_F8_B16,1.6%,108.6155,0
256,32,7168,256,256,8,ActivationType.Gelu,torch.bfloat16,torch.float8_e4m3fn,torch.float8_e4m3fn,QuantType.per_Tensor,1,0,32,0,102.7345,moe_ck2stages_gemm1_256x32x64x256_1x4_TypeCast_v1_Nswizzle0_Quant1_MulRoutedWeight0_gelu_F8_F8_B16,0.0%,56.8998,moe_ck2stages_gemm2_256x32x128x256_1x4_TypeCast_v1_Nswizzle0_Quant1_MulRoutedWeight1_F8_F8_B16,1.6%,159.6343,0
256,64,7168,256,256,8,ActivationType.Gelu,torch.bfloat16,torch.float8_e4m3fn,torch.float8_e4m3fn,QuantType.per_Tensor,1,0,32,0,140.8235,moe_ck2stages_gemm1_256x32x64x256_1x4_TypeCast_v1_Nswizzle0_Quant1_MulRoutedWeight0_gelu_F8_F8_B16,0.0%,76.5494,moe_ck2stages_gemm2_256x32x128x256_1x4_TypeCast_v1_Nswizzle0_Quant1_MulRoutedWeight1_F8_F8_B16,1.6%,217.3729,0
256,128,7168,256,256,8,ActivationType.Gelu,torch.bfloat16,torch.float8_e4m3fn,torch.float8_e4m3fn,QuantType.per_Tensor,1,0,32,0,152.4946,moe_ck2stages_gemm1_256x32x64x256_1x4_TypeCast_v1_Nswizzle0_Quant1_MulRoutedWeight0_gelu_F8_F8_B16,0.0%,85.8934,moe_ck2stages_gemm2_256x32x128x256_1x4_TypeCast_v1_Nswizzle0_Quant1_MulRoutedWeight1_F8_F8_B16,1.7%,238.388,0
256,256,7168,256,256,8,ActivationType.Gelu,torch.bfloat16,torch.float8_e4m3fn,torch.float8_e4m3fn,QuantType.per_Tensor,1,0,32,0,158.9481,moe_ck2stages_gemm1_256x32x64x256_1x4_TypeCast_v1_Nswizzle0_Quant1_MulRoutedWeight0_gelu_F8_F8_B16,0.0%,92.9698,moe_ck2stages_gemm2_256x32x128x256_1x4_TypeCast_v1_Nswizzle0_Quant1_MulRoutedWeight1_F8_F8_B16,1.6%,251.91790000000003,0
256,512,7168,256,256,8,ActivationType.Gelu,torch.bfloat16,torch.float8_e4m3fn,torch.float8_e4m3fn,QuantType.per_Tensor,1,0,32,0,161.9427,moe_ck2stages_gemm1_256x32x64x256_1x4_TypeCast_v1_Nswizzle0_Quant1_MulRoutedWeight0_gelu_F8_F8_B16,0.0%,114.4508,moe_ck2stages_gemm2_256x32x128x256_1x4_TypeCast_v1_Nswizzle0_Quant1_MulRoutedWeight1_F8_F8_B16,1.6%,276.3935,0
256,1024,7168,256,256,8,ActivationType.Gelu,torch.bfloat16,torch.float8_e4m3fn,torch.float8_e4m3fn,QuantType.per_Tensor,1,0,64,0,168.3246,moe_ck2stages_gemm1_256x64x64x256_1x4_TypeCast_v1_Nswizzle0_Quant1_MulRoutedWeight0_gelu_F8_F8_B16,0.0%,205.6813,moe_ck2stages_gemm2_256x64x128x256_1x4_TypeCast_v1_Nswizzle0_Quant1_MulRoutedWeight1_F8_F8_B16,1.6%,374.0059,0
256,16,7168,256,256,8,ActivationType.Gelu,torch.bfloat16,torch.float8_e4m3fn,torch.float8_e4m3fn,QuantType.per_Tensor,1,1,32,0,68.0621,moe_ck2stages_gemm1_256x32x64x128_1x4_TypeCast_v1_Nswizzle0_Quant1_MulRoutedWeight1_gelu_F8_F8_B16,0.0%,40.8199,moe_ck2stages_gemm2_256x32x128x256_1x4_TypeCast_v1_Nswizzle0_Quant1_MulRoutedWeight0_F8_F8_B16,0.0%,108.882,0
256,32,7168,256,256,8,ActivationType.Gelu,torch.bfloat16,torch.float8_e4m3fn,torch.float8_e4m3fn,QuantType.per_Tensor,1,1,32,0,102.8318,moe_ck2stages_gemm1_256x32x64x256_1x4_TypeCast_v1_Nswizzle0_Quant1_MulRoutedWeight1_gelu_F8_F8_B16,0.0%,57.3307,moe_ck2stages_gemm2_256x32x128x256_1x4_TypeCast_v1_Nswizzle0_Quant1_MulRoutedWeight0_F8_F8_B16,0.0%,160.1625,0
256,64,7168,256,256,8,ActivationType.Gelu,torch.bfloat16,torch.float8_e4m3fn,torch.float8_e4m3fn,QuantType.per_Tensor,1,1,32,0,141.6806,moe_ck2stages_gemm1_256x32x64x256_1x4_TypeCast_v1_Nswizzle0_Quant1_MulRoutedWeight1_gelu_F8_F8_B16,0.0%,77.5578,moe_ck2stages_gemm2_256x32x128x256_1x4_TypeCast_v1_Nswizzle0_Quant1_MulRoutedWeight0_F8_F8_B16,0.0%,219.2384,0
256,128,7168,256,256,8,ActivationType.Gelu,torch.bfloat16,torch.float8_e4m3fn,torch.float8_e4m3fn,QuantType.per_Tensor,1,1,32,0,154.7826,moe_ck2stages_gemm1_256x32x64x256_1x4_TypeCast_v1_Nswizzle0_Quant1_MulRoutedWeight1_gelu_F8_F8_B16,0.0%,86.5442,moe_ck2stages_gemm2_256x32x128x256_1x4_TypeCast_v1_Nswizzle0_Quant1_MulRoutedWeight0_F8_F8_B16,0.0%,241.3268,0
256,256,7168,256,256,8,ActivationType.Gelu,torch.bfloat16,torch.float8_e4m3fn,torch.float8_e4m3fn,QuantType.per_Tensor,1,1,32,0,159.3862,moe_ck2stages_gemm1_256x32x64x256_1x4_TypeCast_v1_Nswizzle0_Quant1_MulRoutedWeight1_gelu_F8_F8_B16,0.0%,95.0034,moe_ck2stages_gemm2_256x32x128x256_1x4_TypeCast_v1_Nswizzle0_Quant1_MulRoutedWeight0_F8_F8_B16,0.0%,254.3896,0
256,512,7168,256,256,8,ActivationType.Gelu,torch.bfloat16,torch.float8_e4m3fn,torch.float8_e4m3fn,QuantType.per_Tensor,1,1,32,0,162.5288,moe_ck2stages_gemm1_256x32x64x256_1x4_TypeCast_v1_Nswizzle0_Quant1_MulRoutedWeight1_gelu_F8_F8_B16,0.0%,113.9963,moe_ck2stages_gemm2_256x32x128x256_1x4_TypeCast_v1_Nswizzle0_Quant1_MulRoutedWeight0_F8_F8_B16,0.0%,276.5251,0
256,1024,7168,256,256,8,ActivationType.Gelu,torch.bfloat16,torch.float8_e4m3fn,torch.float8_e4m3fn,QuantType.per_Tensor,1,1,64,0,168.5532,moe_ck2stages_gemm1_256x64x64x256_1x4_TypeCast_v1_Nswizzle0_Quant1_MulRoutedWeight1_gelu_F8_F8_B16,0.0%,205.3887,moe_ck2stages_gemm2_256x64x128x256_1x4_TypeCast_v1_Nswizzle0_Quant1_MulRoutedWeight0_F8_F8_B16,0.0%,373.9419,0
256,16,7168,256,256,8,ActivationType.Gelu,torch.bfloat16,torch.float8_e4m3fn,torch.float8_e4m3fn,QuantType.per_Token,1,0,32,0,68.6613,moe_ck2stages_gemm1_256x32x64x256_1x4_TypeCast_v1_Nswizzle0_Quant2_MulRoutedWeight0_gelu_F8_F8_B16,0.0%,46.3816,moe_ck2stages_gemm2_256x32x128x256_1x4_TypeCast_v1_Nswizzle0_Quant2_MulRoutedWeight1_F8_F8_B16,1.7%,115.0429,0
256,32,7168,256,256,8,ActivationType.Gelu,torch.bfloat16,torch.float8_e4m3fn,torch.float8_e4m3fn,QuantType.per_Token,1,0,32,0,161.5767,_ZN5aiter45fmoe_bf16_pertokenFp8_g1u1_gelu_1tg_ps_32x256E,0.0%,0.0,nan,0,161.5767,1
256,64,7168,256,256,8,ActivationType.Gelu,torch.bfloat16,torch.float8_e4m3fn,torch.float8_e4m3fn,QuantType.per_Token,1,0,32,0,215.9822,_ZN5aiter42fmoe_bf16_pertokenFp8_g1u1_gelu_1tg_32x256E,0.0%,0.0,nan,0,215.9822,1
256,128,7168,256,256,8,ActivationType.Gelu,torch.bfloat16,torch.float8_e4m3fn,torch.float8_e4m3fn,QuantType.per_Token,1,0,32,0,246.5531,_ZN5aiter45fmoe_bf16_pertokenFp8_g1u1_gelu_1tg_ps_32x256E,0.0%,0.0,nan,0,246.5531,1
256,256,7168,256,256,8,ActivationType.Gelu,torch.bfloat16,torch.float8_e4m3fn,torch.float8_e4m3fn,QuantType.per_Token,1,0,32,0,254.8643,_ZN5aiter42fmoe_bf16_pertokenFp8_g1u1_gelu_1tg_32x256E,0.0%,0.0,nan,0,254.8643,1
256,512,7168,256,256,8,ActivationType.Gelu,torch.bfloat16,torch.float8_e4m3fn,torch.float8_e4m3fn,QuantType.per_Token,1,0,32,0,269.4159,_ZN5aiter45fmoe_bf16_pertokenFp8_g1u1_gelu_1tg_ps_32x256E,0.0%,0.0,nan,0,269.4159,1
256,1024,7168,256,256,8,ActivationType.Gelu,torch.bfloat16,torch.float8_e4m3fn,torch.float8_e4m3fn,QuantType.per_Token,1,0,32,0,360.0386,_ZN5aiter42fmoe_bf16_pertokenFp8_g1u1_gelu_1tg_32x256E,0.0%,0.0,nan,0,360.0386,1
256,16,7168,256,256,8,ActivationType.Gelu,torch.bfloat16,torch.float8_e4m3fn,torch.float8_e4m3fn,QuantType.per_Token,1,1,32,0,68.3263,moe_ck2stages_gemm1_256x32x64x256_1x4_TypeCast_v1_Nswizzle0_Quant2_MulRoutedWeight1_gelu_F8_F8_B16,0.0%,44.1851,moe_ck2stages_gemm2_256x32x128x256_1x4_TypeCast_v1_Nswizzle0_Quant2_MulRoutedWeight0_F8_F8_B16,0.0%,112.5114,0
256,32,7168,256,256,8,ActivationType.Gelu,torch.bfloat16,torch.float8_e4m3fn,torch.float8_e4m3fn,QuantType.per_Token,1,1,32,0,100.365,_ZN5aiter56fmoe_stage1_bf16_pertokenFp8_doweight_g1u1_32x64_4tg_pf2E,0.0%,61.0618,moe_ck2stages_gemm2_256x32x128x256_1x4_TypeCast_v1_Nswizzle0_Quant2_MulRoutedWeight0_F8_F8_B16,0.0%,161.4268,0
256,64,7168,256,256,8,ActivationType.Gelu,torch.bfloat16,torch.float8_e4m3fn,torch.float8_e4m3fn,QuantType.per_Token,1,1,32,0,140.407,_ZN5aiter57fmoe_stage1_bf16_pertokenFp8_doweight_g1u1_32x256_2tg_pf3E,0.0%,78.9057,moe_ck2stages_gemm2_256x32x128x256_1x4_TypeCast_v1_Nswizzle0_Quant2_MulRoutedWeight0_F8_F8_B16,0.0%,219.3127,0
256,128,7168,256,256,8,ActivationType.Gelu,torch.bfloat16,torch.float8_e4m3fn,torch.float8_e4m3fn,QuantType.per_Token,1,1,32,0,153.1395,moe_ck2stages_gemm1_256x32x64x256_1x4_TypeCast_v1_Nswizzle0_Quant2_MulRoutedWeight1_gelu_F8_F8_B16,0.0%,91.6374,moe_ck2stages_gemm2_256x32x128x256_1x4_TypeCast_v1_Nswizzle0_Quant2_MulRoutedWeight0_F8_F8_B16,0.0%,244.7769,0
256,256,7168,256,256,8,ActivationType.Gelu,torch.bfloat16,torch.float8_e4m3fn,torch.float8_e4m3fn,QuantType.per_Token,1,1,32,0,159.338,moe_ck2stages_gemm1_256x32x64x256_1x4_TypeCast_v1_Nswizzle0_Quant2_MulRoutedWeight1_gelu_F8_F8_B16,0.0%,102.7582,moe_ck2stages_gemm2_256x32x128x256_1x4_TypeCast_v1_Nswizzle0_Quant2_MulRoutedWeight0_F8_F8_B16,0.0%,262.0962,0
256,512,7168,256,256,8,ActivationType.Gelu,torch.bfloat16,torch.float8_e4m3fn,torch.float8_e4m3fn,QuantType.per_Token,1,1,32,0,161.3644,_ZN5aiter57fmoe_stage1_bf16_pertokenFp8_doweight_g1u1_32x128_3tg_pf2E,0.0%,132.3204,moe_ck2stages_gemm2_256x32x128x256_1x4_TypeCast_v1_Nswizzle0_Quant2_MulRoutedWeight0_F8_F8_B16,0.0%,293.6848,0
256,1024,7168,256,256,8,ActivationType.Gelu,torch.bfloat16,torch.float8_e4m3fn,torch.float8_e4m3fn,QuantType.per_Token,1,1,64,0,163.9563,_ZN5aiter57fmoe_stage1_bf16_pertokenFp8_doweight_g1u1_64x128_2tg_pf3E,0.0%,218.341,moe_ck2stages_gemm2_256x64x128x256_1x4_TypeCast_v1_Nswizzle0_Quant2_MulRoutedWeight0_F8_F8_B16,0.0%,382.2973,0
256,16,7168,256,256,8,ActivationType.Gelu,torch.bfloat16,torch.float8_e4m3fn,torch.float8_e4m3fn,QuantType.per_1x128,1,0,64,0,70.0022,_ZN5aiter59fmoe_stage1_bf16_pertokenFp8_blockscale_g1u1_64x128_2tg_pf3E,96.7%,58.8747,moe_ck2stages_gemm2_256x64x128x128_1x4_MulABScaleExpertWeightA8W8blkscale_v3_Nswizzle0_Quant4_MulRoutedWeight1_F8_F8_B16,15.7%,128.8769,0
256,32,7168,256,256,8,ActivationType.Gelu,torch.bfloat16,torch.float8_e4m3fn,torch.float8_e4m3fn,QuantType.per_1x128,1,0,32,0,154.9329,_ZN5aiter47fmoe_bf16_blockscaleFp8_g1u1_vs_gelu_1tg_32x256E,2.1%,0.0,nan,0,154.9329,1
256,64,7168,256,256,8,ActivationType.Gelu,torch.bfloat16,torch.float8_e4m3fn,torch.float8_e4m3fn,QuantType.per_1x128,1,0,32,0,213.5376,_ZN5aiter47fmoe_bf16_blockscaleFp8_g1u1_vs_gelu_1tg_32x256E,2.1%,0.0,nan,0,213.5376,1
256,128,7168,256,256,8,ActivationType.Gelu,torch.bfloat16,torch.float8_e4m3fn,torch.float8_e4m3fn,QuantType.per_1x128,1,0,32,0,240.1029,_ZN5aiter47fmoe_bf16_blockscaleFp8_g1u1_vs_gelu_1tg_32x256E,2.2%,0.0,nan,0,240.1029,1
256,256,7168,256,256,8,ActivationType.Gelu,torch.bfloat16,torch.float8_e4m3fn,torch.float8_e4m3fn,QuantType.per_1x128,1,0,32,0,253.7872,_ZN5aiter52fmoe_bf16_blockscaleFp8_g1u1_novs_gelu_1tg_ps_32x256E,2.3%,0.0,nan,0,253.7872,1
256,512,7168,256,256,8,ActivationType.Gelu,torch.bfloat16,torch.float8_e4m3fn,torch.float8_e4m3fn,QuantType.per_1x128,1,0,32,0,259.9816,_ZN5aiter49fmoe_bf16_blockscaleFp8_g1u1_novs_gelu_1tg_32x256E,2.2%,0.0,nan,0,259.9816,1
256,1024,7168,256,256,8,ActivationType.Gelu,torch.bfloat16,torch.float8_e4m3fn,torch.float8_e4m3fn,QuantType.per_1x128,1,0,32,0,361.3792,_ZN5aiter49fmoe_bf16_blockscaleFp8_g1u1_novs_gelu_1tg_32x256E,2.2%,0.0,nan,0,361.3792,1
256,16,7168,256,256,8,ActivationType.Gelu,torch.bfloat16,torch.float8_e4m3fn,torch.float8_e4m3fn,QuantType.per_1x128,1,1,64,0,81.436,moe_ck2stages_gemm1_256x64x128x128_1x4_MulABScaleExpertWeightA8W8blkscale_v3_Nswizzle0_Quant4_MulRoutedWeight1_gelu_F8_F8_B16,0.1%,62.277,moe_ck2stages_gemm2_256x64x128x128_1x4_MulABScaleExpertWeightA8W8blkscale_v3_Nswizzle0_Quant4_MulRoutedWeight0_F8_F8_B16,16.8%,143.71300000000002,0
256,32,7168,256,256,8,ActivationType.Gelu,torch.bfloat16,torch.float8_e4m3fn,torch.float8_e4m3fn,QuantType.per_1x128,1,1,64,0,140.0599,moe_ck2stages_gemm1_256x64x128x128_1x4_MulABScaleExpertWeightA8W8blkscale_v3_Nswizzle0_Quant4_MulRoutedWeight1_gelu_F8_F8_B16,0.1%,87.1939,moe_ck2stages_gemm2_256x64x128x128_1x4_MulABScaleExpertWeightA8W8blkscale_v3_Nswizzle0_Quant4_MulRoutedWeight0_F8_F8_B16,16.7%,227.2538,0
256,64,7168,256,256,8,ActivationType.Gelu,torch.bfloat16,torch.float8_e4m3fn,torch.float8_e4m3fn,QuantType.per_1x128,1,1,64,0,159.6384,moe_ck2stages_gemm1_256x64x128x128_1x4_MulABScaleExpertWeightA8W8blkscale_v3_Nswizzle0_Quant4_MulRoutedWeight1_gelu_F8_F8_B16,0.1%,119.0639,moe_ck2stages_gemm2_256x64x128x128_1x4_MulABScaleExpertWeightA8W8blkscale_v3_Nswizzle0_Quant4_MulRoutedWeight0_F8_F8_B16,16.7%,278.7023,0
256,128,7168,256,256,8,ActivationType.Gelu,torch.bfloat16,torch.float8_e4m3fn,torch.float8_e4m3fn,QuantType.per_1x128,1,1,64,0,174.3826,moe_ck2stages_gemm1_256x64x128x128_1x4_MulABScaleExpertWeightA8W8blkscale_v3_Nswizzle0_Quant4_MulRoutedWeight1_gelu_F8_F8_B16,0.1%,142.3551,moe_ck2stages_gemm2_256x64x128x128_1x4_MulABScaleExpertWeightA8W8blkscale_v3_Nswizzle0_Quant4_MulRoutedWeight0_F8_F8_B16,16.7%,316.7377,0
256,256,7168,256,256,8,ActivationType.Gelu,torch.bfloat16,torch.float8_e4m3fn,torch.float8_e4m3fn,QuantType.per_1x128,1,1,64,0,175.6725,moe_ck2stages_gemm1_256x64x128x128_1x4_MulABScaleExpertWeightA8W8blkscale_v3_Nswizzle0_Quant4_MulRoutedWeight1_gelu_F8_F8_B16,0.1%,237.7232,moe_ck2stages_gemm2_256x64x128x128_1x4_MulABScaleExpertWeightA8W8blkscale_v3_Nswizzle0_Quant4_MulRoutedWeight0_F8_F8_B16,16.7%,413.3957,0
256,512,7168,256,256,8,ActivationType.Gelu,torch.bfloat16,torch.float8_e4m3fn,torch.float8_e4m3fn,QuantType.per_1x128,1,1,64,0,179.6589,moe_ck2stages_gemm1_256x64x128x128_1x4_MulABScaleExpertWeightA8W8blkscale_v3_Nswizzle0_Quant4_MulRoutedWeight1_gelu_F8_F8_B16,0.1%,429.1027,moe_ck2stages_gemm2_256x64x128x128_1x4_MulABScaleExpertWeightA8W8blkscale_v3_Nswizzle0_Quant4_MulRoutedWeight0_F8_F8_B16,16.6%,608.7616,0
256,1024,7168,256,256,8,ActivationType.Gelu,torch.bfloat16,torch.float8_e4m3fn,torch.float8_e4m3fn,QuantType.per_1x128,1,1,64,0,184.3856,moe_ck2stages_gemm1_256x64x128x128_1x4_MulABScaleExpertWeightA8W8blkscale_v3_Nswizzle0_Quant4_MulRoutedWeight1_gelu_F8_F8_B16,0.1%,810.4303,moe_ck2stages_gemm2_256x64x128x128_1x4_MulABScaleExpertWeightA8W8blkscale_v3_Nswizzle0_Quant4_MulRoutedWeight0_F8_F8_B16,16.7%,994.8159,0
256,16,7168,512,256,8,ActivationType.Gelu,torch.bfloat16,torch.bfloat16,torch.bfloat16,QuantType.No,1,0,32,0,268.7481,moe_ck2stages_gemm1_256x32x64x128_1x4_TypeCast_v1_Nswizzle0_Quant0_MulRoutedWeight0_gelu_B16_B16_B16,0.0%,135.0723,moe_ck2stages_gemm2_256x32x128x128_1x4_TypeCast_v1_Nswizzle0_Quant0_MulRoutedWeight1_B16_B16_B16,3.3%,403.82040000000006,0
256,32,7168,512,256,8,ActivationType.Gelu,torch.bfloat16,torch.bfloat16,torch.bfloat16,QuantType.No,1,0,32,0,378.5195,moe_ck2stages_gemm1_256x32x64x128_1x4_TypeCast_v1_Nswizzle0_Quant0_MulRoutedWeight0_gelu_B16_B16_B16,0.0%,196.1646,moe_ck2stages_gemm2_256x32x128x128_1x4_TypeCast_v1_Nswizzle0_Quant0_MulRoutedWeight1_B16_B16_B16,3.3%,574.6841,0
256,64,7168,512,256,8,ActivationType.Gelu,torch.bfloat16,torch.bfloat16,torch.bfloat16,QuantType.No,1,0,32,0,559.7713,moe_ck2stages_gemm1_256x32x64x128_1x4_TypeCast_v1_Nswizzle0_Quant0_MulRoutedWeight0_gelu_B16_B16_B16,0.0%,271.7302,moe_ck2stages_gemm2_256x32x128x128_1x4_TypeCast_v1_Nswizzle0_Quant0_MulRoutedWeight1_B16_B16_B16,3.3%,831.5015000000001,0
256,128,7168,512,256,8,ActivationType.Gelu,torch.bfloat16,torch.bfloat16,torch.bfloat16,QuantType.No,1,0,32,0,608.7673,moe_ck2stages_gemm1_256x32x64x128_1x4_TypeCast_v1_Nswizzle0_Quant0_MulRoutedWeight0_gelu_B16_B16_B16,0.0%,313.0697,moe_ck2stages_gemm2_256x32x128x128_1x4_TypeCast_v1_Nswizzle0_Quant0_MulRoutedWeight1_B16_B16_B16,3.3%,921.837,0
256,256,7168,512,256,8,ActivationType.Gelu,torch.bfloat16,torch.bfloat16,torch.bfloat16,QuantType.No,1,0,32,0,612.6749,moe_ck2stages_gemm1_256x32x64x128_1x4_TypeCast_v1_Nswizzle0_Quant0_MulRoutedWeight0_gelu_B16_B16_B16,0.0%,322.9055,moe_ck2stages_gemm2_256x32x128x128_1x4_TypeCast_v1_Nswizzle0_Quant0_MulRoutedWeight1_B16_B16_B16,3.3%,935.5804,0
256,512,7168,512,256,8,ActivationType.Gelu,torch.bfloat16,torch.bfloat16,torch.bfloat16,QuantType.No,1,0,64,0,623.7185,moe_ck2stages_gemm1_256x64x64x64_1x4_TypeCast_v1_Nswizzle0_Quant0_MulRoutedWeight0_gelu_B16_B16_B16,0.0%,338.7751,moe_ck2stages_gemm2_256x64x128x128_1x4_TypeCast_v1_Nswizzle0_Quant0_MulRoutedWeight1_B16_B16_B16,3.3%,962.4936,0
256,1024,7168,512,256,8,ActivationType.Gelu,torch.bfloat16,torch.bfloat16,torch.bfloat16,QuantType.No,1,0,64,0,649.3028,moe_ck2stages_gemm1_256x64x64x64_1x4_TypeCast_v1_Nswizzle0_Quant0_MulRoutedWeight0_gelu_B16_B16_B16,0.0%,368.4383,moe_ck2stages_gemm2_256x64x128x128_1x4_TypeCast_v1_Nswizzle0_Quant0_MulRoutedWeight1_B16_B16_B16,3.3%,1017.7411,0
256,16,7168,512,256,8,ActivationType.Gelu,torch.bfloat16,torch.bfloat16,torch.bfloat16,QuantType.No,1,1,32,0,265.8935,moe_ck2stages_gemm1_256x32x64x128_1x4_TypeCast_v1_Nswizzle0_Quant0_MulRoutedWeight1_gelu_B16_B16_B16,0.0%,135.088,moe_ck2stages_gemm2_256x32x128x128_1x4_TypeCast_v1_Nswizzle0_Quant0_MulRoutedWeight0_B16_B16_B16,0.0%,400.9815,0
256,32,7168,512,256,8,ActivationType.Gelu,torch.bfloat16,torch.bfloat16,torch.bfloat16,QuantType.No,1,1,32,0,376.5017,moe_ck2stages_gemm1_256x32x64x128_1x4_TypeCast_v1_Nswizzle0_Quant0_MulRoutedWeight1_gelu_B16_B16_B16,0.0%,196.4837,moe_ck2stages_gemm2_256x32x128x128_1x4_TypeCast_v1_Nswizzle0_Quant0_MulRoutedWeight0_B16_B16_B16,0.0%,572.9854,0
256,64,7168,512,256,8,ActivationType.Gelu,torch.bfloat16,torch.bfloat16,torch.bfloat16,QuantType.No,1,1,32,0,556.9744,moe_ck2stages_gemm1_256x32x64x128_1x4_TypeCast_v1_Nswizzle0_Quant0_MulRoutedWeight1_gelu_B16_B16_B16,0.0%,271.6147,moe_ck2stages_gemm2_256x32x128x128_1x4_TypeCast_v1_Nswizzle0_Quant0_MulRoutedWeight0_B16_B16_B16,0.0%,828.5890999999999,0
256,128,7168,512,256,8,ActivationType.Gelu,torch.bfloat16,torch.bfloat16,torch.bfloat16,QuantType.No,1,1,64,0,610.8427,moe_ck2stages_gemm1_256x64x64x64_1x4_TypeCast_v1_Nswizzle0_Quant0_MulRoutedWeight1_gelu_B16_B16_B16,0.0%,308.854,moe_ck2stages_gemm2_256x64x128x128_1x4_TypeCast_v1_Nswizzle0_Quant0_MulRoutedWeight0_B16_B16_B16,0.0%,919.6967,0
256,256,7168,512,256,8,ActivationType.Gelu,torch.bfloat16,torch.bfloat16,torch.bfloat16,QuantType.No,1,1,64,0,614.0275,moe_ck2stages_gemm1_256x64x64x64_1x4_TypeCast_v1_Nswizzle0_Quant0_MulRoutedWeight1_gelu_B16_B16_B16,0.0%,317.5052,moe_ck2stages_gemm2_256x64x128x128_1x4_TypeCast_v1_Nswizzle0_Quant0_MulRoutedWeight0_B16_B16_B16,0.0%,931.5327,0
256,512,7168,512,256,8,ActivationType.Gelu,torch.bfloat16,torch.bfloat16,torch.bfloat16,QuantType.No,1,1,64,0,624.6592,moe_ck2stages_gemm1_256x64x64x128_1x4_TypeCast_v1_Nswizzle0_Quant0_MulRoutedWeight1_gelu_B16_B16_B16,0.0%,332.6196,moe_ck2stages_gemm2_256x64x128x128_1x4_TypeCast_v1_Nswizzle0_Quant0_MulRoutedWeight0_B16_B16_B16,0.0%,957.2788,0
256,1024,7168,512,256,8,ActivationType.Gelu,torch.bfloat16,torch.bfloat16,torch.bfloat16,QuantType.No,1,1,64,0,644.3248,moe_ck2stages_gemm1_256x64x64x64_1x4_TypeCast_v1_Nswizzle0_Quant0_MulRoutedWeight1_gelu_B16_B16_B16,0.0%,363.2348,moe_ck2stages_gemm2_256x64x128x128_1x4_TypeCast_v1_Nswizzle0_Quant0_MulRoutedWeight0_B16_B16_B16,0.0%,1007.5596,0
256,16,7168,512,256,8,ActivationType.Gelu,torch.bfloat16,torch.float8_e4m3fn,torch.float8_e4m3fn,QuantType.per_Tensor,1,0,32,0,139.2785,moe_ck2stages_gemm1_256x32x64x256_1x4_TypeCast_v1_Nswizzle0_Quant1_MulRoutedWeight0_gelu_F8_F8_B16,0.0%,70.4958,moe_ck2stages_gemm2_256x32x128x256_1x4_TypeCast_v1_Nswizzle0_Quant1_MulRoutedWeight1_F8_F8_B16,3.3%,209.7743,0
256,32,7168,512,256,8,ActivationType.Gelu,torch.bfloat16,torch.float8_e4m3fn,torch.float8_e4m3fn,QuantType.per_Tensor,1,0,32,0,194.034,moe_ck2stages_gemm1_256x32x64x256_1x4_TypeCast_v1_Nswizzle0_Quant1_MulRoutedWeight0_gelu_F8_F8_B16,0.0%,100.7957,moe_ck2stages_gemm2_256x32x128x256_1x4_TypeCast_v1_Nswizzle0_Quant1_MulRoutedWeight1_F8_F8_B16,3.4%,294.8297,0
256,64,7168,512,256,8,ActivationType.Gelu,torch.bfloat16,torch.float8_e4m3fn,torch.float8_e4m3fn,QuantType.per_Tensor,1,0,32,0,274.3536,_ZN5aiter44fmoe_stage1_bf16_pertokenFp8_g1u1_32x512_pf2E,0.0%,140.3968,moe_ck2stages_gemm2_256x32x128x256_1x4_TypeCast_v1_Nswizzle0_Quant1_MulRoutedWeight1_F8_F8_B16,3.3%,414.7504,0
256,128,7168,512,256,8,ActivationType.Gelu,torch.bfloat16,torch.float8_e4m3fn,torch.float8_e4m3fn,QuantType.per_Tensor,1,0,32,0,312.5621,moe_ck2stages_gemm1_256x32x64x256_1x4_TypeCast_v1_Nswizzle0_Quant1_MulRoutedWeight0_gelu_F8_F8_B16,0.0%,161.8549,moe_ck2stages_gemm2_256x32x128x256_1x4_TypeCast_v1_Nswizzle0_Quant1_MulRoutedWeight1_F8_F8_B16,3.3%,474.417,0
256,256,7168,512,256,8,ActivationType.Gelu,torch.bfloat16,torch.float8_e4m3fn,torch.float8_e4m3fn,QuantType.per_Tensor,1,0,64,0,314.2275,moe_ck2stages_gemm1_256x64x64x256_1x4_TypeCast_v1_Nswizzle0_Quant1_MulRoutedWeight0_gelu_F8_F8_B16,0.0%,169.8802,moe_ck2stages_gemm2_256x64x128x256_1x4_TypeCast_v1_Nswizzle0_Quant1_MulRoutedWeight1_F8_F8_B16,3.3%,484.1077,0
256,512,7168,512,256,8,ActivationType.Gelu,torch.bfloat16,torch.float8_e4m3fn,torch.float8_e4m3fn,QuantType.per_Tensor,1,0,32,0,318.189,_ZN5aiter44fmoe_stage1_bf16_pertokenFp8_g1u1_32x512_pf2E,0.0%,183.5436,moe_ck2stages_gemm2_256x32x128x256_1x4_TypeCast_v1_Nswizzle0_Quant1_MulRoutedWeight1_F8_F8_B16,3.3%,501.7326000000001,0
256,1024,7168,512,256,8,ActivationType.Gelu,torch.bfloat16,torch.float8_e4m3fn,torch.float8_e4m3fn,QuantType.per_Tensor,1,0,64,0,328.7642,_ZN5aiter48fmoe_stage1_bf16_pertokenFp8_g1u1_64x128_2tg_pf2E,0.0%,226.0569,moe_ck2stages_gemm2_256x64x128x256_1x4_TypeCast_v1_Nswizzle0_Quant1_MulRoutedWeight1_F8_F8_B16,3.3%,554.8211,0
256,16,7168,512,256,8,ActivationType.Gelu,torch.bfloat16,torch.float8_e4m3fn,torch.float8_e4m3fn,QuantType.per_Tensor,1,1,32,0,138.6795,moe_ck2stages_gemm1_256x32x64x256_1x4_TypeCast_v1_Nswizzle0_Quant1_MulRoutedWeight1_gelu_F8_F8_B16,0.0%,70.6801,moe_ck2stages_gemm2_256x32x128x256_1x4_TypeCast_v1_Nswizzle0_Quant1_MulRoutedWeight0_F8_F8_B16,0.0%,209.3596,0
256,32,7168,512,256,8,ActivationType.Gelu,torch.bfloat16,torch.float8_e4m3fn,torch.float8_e4m3fn,QuantType.per_Tensor,1,1,32,0,193.8469,moe_ck2stages_gemm1_256x32x64x256_1x4_TypeCast_v1_Nswizzle0_Quant1_MulRoutedWeight1_gelu_F8_F8_B16,0.0%,101.2026,moe_ck2stages_gemm2_256x32x128x256_1x4_TypeCast_v1_Nswizzle0_Quant1_MulRoutedWeight0_F8_F8_B16,0.0%,295.0495,0
256,64,7168,512,256,8,ActivationType.Gelu,torch.bfloat16,torch.float8_e4m3fn,torch.float8_e4m3fn,QuantType.per_Tensor,1,1,32,0,277.7873,_ZN5aiter53fmoe_stage1_bf16_pertokenFp8_doweight_g1u1_32x512_pf2E,0.0%,141.146,moe_ck2stages_gemm2_256x32x128x256_1x4_TypeCast_v1_Nswizzle0_Quant1_MulRoutedWeight0_F8_F8_B16,0.0%,418.9333,0
256,128,7168,512,256,8,ActivationType.Gelu,torch.bfloat16,torch.float8_e4m3fn,torch.float8_e4m3fn,QuantType.per_Tensor,1,1,32,0,310.6676,moe_ck2stages_gemm1_256x32x64x256_1x4_TypeCast_v1_Nswizzle0_Quant1_MulRoutedWeight1_gelu_F8_F8_B16,0.0%,164.6245,moe_ck2stages_gemm2_256x32x128x256_1x4_TypeCast_v1_Nswizzle0_Quant1_MulRoutedWeight0_F8_F8_B16,0.0%,475.2921,0
256,256,7168,512,256,8,ActivationType.Gelu,torch.bfloat16,torch.float8_e4m3fn,torch.float8_e4m3fn,QuantType.per_Tensor,1,1,32,0,314.5026,moe_ck2stages_gemm1_256x32x64x256_1x4_TypeCast_v1_Nswizzle0_Quant1_MulRoutedWeight1_gelu_F8_F8_B16,0.0%,168.2646,moe_ck2stages_gemm2_256x32x128x256_1x4_TypeCast_v1_Nswizzle0_Quant1_MulRoutedWeight0_F8_F8_B16,0.0%,482.7672,0
256,512,7168,512,256,8,ActivationType.Gelu,torch.bfloat16,torch.float8_e4m3fn,torch.float8_e4m3fn,QuantType.per_Tensor,1,1,32,0,318.2151,_ZN5aiter53fmoe_stage1_bf16_pertokenFp8_doweight_g1u1_32x512_pf3E,0.0%,183.4334,moe_ck2stages_gemm2_256x32x128x256_1x4_TypeCast_v1_Nswizzle0_Quant1_MulRoutedWeight0_F8_F8_B16,0.0%,501.6485,0
256,1024,7168,512,256,8,ActivationType.Gelu,torch.bfloat16,torch.float8_e4m3fn,torch.float8_e4m3fn,QuantType.per_Tensor,1,1,64,0,328.5261,_ZN5aiter57fmoe_stage1_bf16_pertokenFp8_doweight_g1u1_64x128_2tg_pf2E,0.0%,225.2001,moe_ck2stages_gemm2_256x64x128x256_1x4_TypeCast_v1_Nswizzle0_Quant1_MulRoutedWeight0_F8_F8_B16,0.0%,553.7262,0
256,16,7168,512,256,8,ActivationType.Gelu,torch.bfloat16,torch.float8_e4m3fn,torch.float8_e4m3fn,QuantType.per_Token,1,0,32,0,201.994,_ZN5aiter45fmoe_bf16_pertokenFp8_g1u1_gelu_1tg_ps_32x256E,0.0%,0.0,nan,0,201.994,1
256,32,7168,512,256,8,ActivationType.Gelu,torch.bfloat16,torch.float8_e4m3fn,torch.float8_e4m3fn,QuantType.per_Token,1,0,32,0,196.4497,_ZN5aiter48fmoe_stage1_bf16_pertokenFp8_g1u1_32x128_3tg_pf2E,0.0%,105.2123,moe_ck2stages_gemm2_256x32x128x256_1x4_TypeCast_v1_Nswizzle0_Quant2_MulRoutedWeight1_F8_F8_B16,3.4%,301.66200000000003,0
256,64,7168,512,256,8,ActivationType.Gelu,torch.bfloat16,torch.float8_e4m3fn,torch.float8_e4m3fn,QuantType.per_Token,1,0,32,0,264.1173,_ZN5aiter44fmoe_stage1_bf16_pertokenFp8_g1u1_32x512_pf2E,0.0%,144.1125,moe_ck2stages_gemm2_256x32x128x256_1x4_TypeCast_v1_Nswizzle0_Quant2_MulRoutedWeight1_F8_F8_B16,3.3%,408.2298,0
256,128,7168,512,256,8,ActivationType.Gelu,torch.bfloat16,torch.float8_e4m3fn,torch.float8_e4m3fn,QuantType.per_Token,1,0,32,0,306.5916,_ZN5aiter44fmoe_stage1_bf16_pertokenFp8_g1u1_32x512_pf2E,0.0%,167.7523,moe_ck2stages_gemm2_256x32x128x256_1x4_TypeCast_v1_Nswizzle0_Quant2_MulRoutedWeight1_F8_F8_B16,3.3%,474.3439,0
256,256,7168,512,256,8,ActivationType.Gelu,torch.bfloat16,torch.float8_e4m3fn,torch.float8_e4m3fn,QuantType.per_Token,1,0,32,0,479.2186,_ZN5aiter42fmoe_bf16_pertokenFp8_g1u1_gelu_1tg_32x512E,0.0%,0.0,nan,0,479.2186,1
256,512,7168,512,256,8,ActivationType.Gelu,torch.bfloat16,torch.float8_e4m3fn,torch.float8_e4m3fn,QuantType.per_Token,1,0,32,0,495.8013,_ZN5aiter45fmoe_bf16_pertokenFp8_g1u1_gelu_1tg_ps_32x512E,0.0%,0.0,nan,0,495.8013,1
256,1024,7168,512,256,8,ActivationType.Gelu,torch.bfloat16,torch.float8_e4m3fn,torch.float8_e4m3fn,QuantType.per_Token,1,0,32,0,333.8711,_ZN5aiter47fmoe_stage1_bf16_pertokenFp8_g1u1_32x64_4tg_pf2E,0.0%,248.6884,moe_ck2stages_gemm2_256x32x128x256_1x4_TypeCast_v1_Nswizzle0_Quant2_MulRoutedWeight1_F8_F8_B16,3.3%,582.5595000000001,0
256,16,7168,512,256,8,ActivationType.Gelu,torch.bfloat16,torch.float8_e4m3fn,torch.float8_e4m3fn,QuantType.per_Token,1,1,32,0,129.8926,_ZN5aiter57fmoe_stage1_bf16_pertokenFp8_doweight_g1u1_32x128_3tg_pf2E,0.0%,73.8599,moe_ck2stages_gemm2_256x32x128x256_1x4_TypeCast_v1_Nswizzle0_Quant2_MulRoutedWeight0_F8_F8_B16,0.0%,203.7525,0
256,32,7168,512,256,8,ActivationType.Gelu,torch.bfloat16,torch.float8_e4m3fn,torch.float8_e4m3fn,QuantType.per_Token,1,1,32,0,196.3192,_ZN5aiter57fmoe_stage1_bf16_pertokenFp8_doweight_g1u1_32x128_3tg_pf2E,0.0%,102.4978,moe_ck2stages_gemm2_256x32x128x256_1x4_TypeCast_v1_Nswizzle0_Quant2_MulRoutedWeight0_F8_F8_B16,0.0%,298.817,0
256,64,7168,512,256,8,ActivationType.Gelu,torch.bfloat16,torch.float8_e4m3fn,torch.float8_e4m3fn,QuantType.per_Token,1,1,32,0,264.1664,_ZN5aiter53fmoe_stage1_bf16_pertokenFp8_doweight_g1u1_32x512_pf2E,0.0%,141.5633,moe_ck2stages_gemm2_256x32x128x256_1x4_TypeCast_v1_Nswizzle0_Quant2_MulRoutedWeight0_F8_F8_B16,0.0%,405.7297,0
256,128,7168,512,256,8,ActivationType.Gelu,torch.bfloat16,torch.float8_e4m3fn,torch.float8_e4m3fn,QuantType.per_Token,1,1,32,0,305.1523,_ZN5aiter53fmoe_stage1_bf16_pertokenFp8_doweight_g1u1_32x512_pf2E,0.0%,165.1653,moe_ck2stages_gemm2_256x32x128x256_1x4_TypeCast_v1_Nswizzle0_Quant2_MulRoutedWeight0_F8_F8_B16,0.0%,470.3176,0
256,256,7168,512,256,8,ActivationType.Gelu,torch.bfloat16,torch.float8_e4m3fn,torch.float8_e4m3fn,QuantType.per_Token,1,1,32,0,305.4521,_ZN5aiter53fmoe_stage1_bf16_pertokenFp8_doweight_g1u1_32x512_pf2E,0.0%,172.4236,moe_ck2stages_gemm2_256x32x128x256_1x4_TypeCast_v1_Nswizzle0_Quant2_MulRoutedWeight0_F8_F8_B16,0.0%,477.8757,0
256,512,7168,512,256,8,ActivationType.Gelu,torch.bfloat16,torch.float8_e4m3fn,torch.float8_e4m3fn,QuantType.per_Token,1,1,32,0,306.7972,_ZN5aiter53fmoe_stage1_bf16_pertokenFp8_doweight_g1u1_32x512_pf2E,0.0%,190.6723,moe_ck2stages_gemm2_256x32x128x256_1x4_TypeCast_v1_Nswizzle0_Quant2_MulRoutedWeight0_F8_F8_B16,0.0%,497.4695,0
256,1024,7168,512,256,8,ActivationType.Gelu,torch.bfloat16,torch.float8_e4m3fn,torch.float8_e4m3fn,QuantType.per_Token,1,1,32,0,333.2413,_ZN5aiter56fmoe_stage1_bf16_pertokenFp8_doweight_g1u1_32x64_4tg_pf2E,0.0%,244.2778,moe_ck2stages_gemm2_256x32x128x256_1x4_TypeCast_v1_Nswizzle0_Quant2_MulRoutedWeight0_F8_F8_B16,0.0%,577.5191,0
256,16,7168,512,256,8,ActivationType.Gelu,torch.bfloat16,torch.float8_e4m3fn,torch.float8_e4m3fn,QuantType.per_1x128,1,0,32,0,200.6137,_ZN5aiter49fmoe_bf16_blockscaleFp8_g1u1_novs_gelu_1tg_32x256E,10.1%,0.0,nan,0,200.6137,1
256,32,7168,512,256,8,ActivationType.Gelu,torch.bfloat16,torch.float8_e4m3fn,torch.float8_e4m3fn,QuantType.per_1x128,1,0,32,0,349.2334,_ZN5aiter47fmoe_bf16_blockscaleFp8_g1u1_vs_gelu_1tg_32x256E,10.2%,0.0,nan,0,349.2334,1
256,64,7168,512,256,8,ActivationType.Gelu,torch.bfloat16,torch.float8_e4m3fn,torch.float8_e4m3fn,QuantType.per_1x128,1,0,32,0,419.923,_ZN5aiter52fmoe_bf16_blockscaleFp8_g1u1_novs_gelu_1tg_ps_32x256E,9.9%,0.0,nan,0,419.923,1
256,128,7168,512,256,8,ActivationType.Gelu,torch.bfloat16,torch.float8_e4m3fn,torch.float8_e4m3fn,QuantType.per_1x128,1,0,32,0,481.4058,_ZN5aiter50fmoe_bf16_blockscaleFp8_g1u1_vs_gelu_1tg_ps_32x256E,10.1%,0.0,nan,0,481.4058,1
256,256,7168,512,256,8,ActivationType.Gelu,torch.bfloat16,torch.float8_e4m3fn,torch.float8_e4m3fn,QuantType.per_1x128,1,0,32,0,496.5234,_ZN5aiter47fmoe_bf16_blockscaleFp8_g1u1_vs_gelu_1tg_32x256E,10.2%,0.0,nan,0,496.5234,1
256,512,7168,512,256,8,ActivationType.Gelu,torch.bfloat16,torch.float8_e4m3fn,torch.float8_e4m3fn,QuantType.per_1x128,1,0,32,0,517.5814,_ZN5aiter47fmoe_bf16_blockscaleFp8_g1u1_vs_gelu_1tg_32x256E,10.0%,0.0,nan,0,517.5814,1
256,1024,7168,512,256,8,ActivationType.Gelu,torch.bfloat16,torch.float8_e4m3fn,torch.float8_e4m3fn,QuantType.per_1x128,1,0,32,0,659.4865,_ZN5aiter52fmoe_bf16_blockscaleFp8_g1u1_novs_gelu_1tg_ps_32x256E,10.0%,0.0,nan,0,659.4865,1
256,16,7168,512,256,8,ActivationType.Gelu,torch.bfloat16,torch.float8_e4m3fn,torch.float8_e4m3fn,QuantType.per_1x128,1,1,64,0,153.7979,moe_ck2stages_gemm1_256x64x128x128_1x4_MulABScaleExpertWeightA8W8blkscale_v3_Nswizzle0_Quant4_MulRoutedWeight1_gelu_F8_F8_B16,0.1%,100.2043,moe_ck2stages_gemm2_256x64x128x128_1x4_MulABScaleExpertWeightA8W8blkscale_v3_Nswizzle0_Quant4_MulRoutedWeight0_F8_F8_B16,16.8%,254.0022,0
256,32,7168,512,256,8,ActivationType.Gelu,torch.bfloat16,torch.float8_e4m3fn,torch.float8_e4m3fn,QuantType.per_1x128,1,1,64,0,229.5505,moe_ck2stages_gemm1_256x64x128x128_1x4_MulABScaleExpertWeightA8W8blkscale_v3_Nswizzle0_Quant4_MulRoutedWeight1_gelu_F8_F8_B16,0.1%,142.5418,moe_ck2stages_gemm2_256x64x128x128_1x4_MulABScaleExpertWeightA8W8blkscale_v3_Nswizzle0_Quant4_MulRoutedWeight0_F8_F8_B16,16.8%,372.0923,0
256,64,7168,512,256,8,ActivationType.Gelu,torch.bfloat16,torch.float8_e4m3fn,torch.float8_e4m3fn,QuantType.per_1x128,1,1,64,0,312.4346,moe_ck2stages_gemm1_256x64x128x128_1x4_MulABScaleExpertWeightA8W8blkscale_v3_Nswizzle0_Quant4_MulRoutedWeight1_gelu_F8_F8_B16,0.1%,195.7476,moe_ck2stages_gemm2_256x64x128x128_1x4_MulABScaleExpertWeightA8W8blkscale_v3_Nswizzle0_Quant4_MulRoutedWeight0_F8_F8_B16,16.7%,508.1822,0
256,128,7168,512,256,8,ActivationType.Gelu,torch.bfloat16,torch.float8_e4m3fn,torch.float8_e4m3fn,QuantType.per_1x128,1,1,64,0,335.4235,moe_ck2stages_gemm1_256x64x128x128_1x4_MulABScaleExpertWeightA8W8blkscale_v3_Nswizzle0_Quant4_MulRoutedWeight1_gelu_F8_F8_B16,0.1%,227.6135,moe_ck2stages_gemm2_256x64x128x128_1x4_MulABScaleExpertWeightA8W8blkscale_v3_Nswizzle0_Quant4_MulRoutedWeight0_F8_F8_B16,16.7%,563.037,0
256,256,7168,512,256,8,ActivationType.Gelu,torch.bfloat16,torch.float8_e4m3fn,torch.float8_e4m3fn,QuantType.per_1x128,1,1,64,0,338.6456,moe_ck2stages_gemm1_256x64x128x128_1x4_MulABScaleExpertWeightA8W8blkscale_v3_Nswizzle0_Quant4_MulRoutedWeight1_gelu_F8_F8_B16,0.1%,280.698,moe_ck2stages_gemm2_256x64x128x128_1x4_MulABScaleExpertWeightA8W8blkscale_v3_Nswizzle0_Quant4_MulRoutedWeight0_F8_F8_B16,16.7%,619.3435999999999,0
256,512,7168,512,256,8,ActivationType.Gelu,torch.bfloat16,torch.float8_e4m3fn,torch.float8_e4m3fn,QuantType.per_1x128,1,1,64,0,346.0512,moe_ck2stages_gemm1_256x64x128x128_1x4_MulABScaleExpertWeightA8W8blkscale_v3_Nswizzle0_Quant4_MulRoutedWeight1_gelu_F8_F8_B16,0.1%,465.5625,moe_ck2stages_gemm2_256x64x128x128_1x4_MulABScaleExpertWeightA8W8blkscale_v3_Nswizzle0_Quant4_MulRoutedWeight0_F8_F8_B16,16.7%,811.6137,0
256,1024,7168,512,256,8,ActivationType.Gelu,torch.bfloat16,torch.float8_e4m3fn,torch.float8_e4m3fn,QuantType.per_1x128,1,1,64,0,356.8395,moe_ck2stages_gemm1_256x64x128x128_1x4_MulABScaleExpertWeightA8W8blkscale_v3_Nswizzle0_Quant4_MulRoutedWeight1_gelu_F8_F8_B16,0.1%,844.2523,moe_ck2stages_gemm2_256x64x128x128_1x4_MulABScaleExpertWeightA8W8blkscale_v3_Nswizzle0_Quant4_MulRoutedWeight0_F8_F8_B16,16.7%,1201.0918,0
256,16,4096,192,128,8,ActivationType.Gelu,torch.bfloat16,torch.bfloat16,torch.bfloat16,QuantType.No,1,0,128,0,56.3586,moe_ck2stages_gemm1_256x128x64x64_1x4_TypeCast_v1_Nswizzle0_Quant0_MulRoutedWeight0_gelu_B16_B16_B16,0.0%,52.2631,moe_ck2stages_gemm2_256x128x128x64_1x4_TypeCast_v1_Nswizzle0_Quant0_MulRoutedWeight1_B16_B16_B16,0.1%,108.6217,0
256,32,4096,192,128,8,ActivationType.Gelu,torch.bfloat16,torch.bfloat16,torch.bfloat16,QuantType.No,1,0,128,0,72.1771,moe_ck2stages_gemm1_256x128x64x64_1x4_TypeCast_v1_Nswizzle0_Quant0_MulRoutedWeight0_gelu_B16_B16_B16,0.0%,62.1327,moe_ck2stages_gemm2_256x128x128x64_1x4_TypeCast_v1_Nswizzle0_Quant0_MulRoutedWeight1_B16_B16_B16,0.1%,134.3098,0
256,64,4096,192,128,8,ActivationType.Gelu,torch.bfloat16,torch.bfloat16,torch.bfloat16,QuantType.No,1,0,128,0,76.7409,moe_ck2stages_gemm1_256x128x64x64_1x4_TypeCast_v1_Nswizzle0_Quant0_MulRoutedWeight0_gelu_B16_B16_B16,0.0%,70.1428,moe_ck2stages_gemm2_256x128x128x64_1x4_TypeCast_v3_Nswizzle0_Quant0_MulRoutedWeight1_B16_B16_B16,0.1%,146.88369999999998,0
256,128,4096,192,128,8,ActivationType.Gelu,torch.bfloat16,torch.bfloat16,torch.bfloat16,QuantType.No,1,0,128,0,78.4201,moe_ck2stages_gemm1_256x128x64x64_1x4_TypeCast_v1_Nswizzle0_Quant0_MulRoutedWeight0_gelu_B16_B16_B16,0.0%,73.1654,moe_ck2stages_gemm2_256x128x128x64_1x4_TypeCast_v1_Nswizzle0_Quant0_MulRoutedWeight1_B16_B16_B16,0.1%,151.58550000000002,0
256,256,4096,192,128,8,ActivationType.Gelu,torch.bfloat16,torch.bfloat16,torch.bfloat16,QuantType.No,1,0,128,0,79.0071,moe_ck2stages_gemm1_256x128x64x64_1x4_TypeCast_v1_Nswizzle0_Quant0_MulRoutedWeight0_gelu_B16_B16_B16,0.0%,77.6929,moe_ck2stages_gemm2_256x128x128x64_1x4_TypeCast_v3_Nswizzle0_Quant0_MulRoutedWeight1_B16_B16_B16,0.1%,156.7,0
256,512,4096,192,128,8,ActivationType.Gelu,torch.bfloat16,torch.bfloat16,torch.bfloat16,QuantType.No,1,0,128,0,82.0161,moe_ck2stages_gemm1_256x128x64x64_1x4_TypeCast_v1_Nswizzle0_Quant0_MulRoutedWeight0_gelu_B16_B16_B16,0.0%,90.6126,moe_ck2stages_gemm2_256x128x128x64_1x4_TypeCast_v1_Nswizzle0_Quant0_MulRoutedWeight1_B16_B16_B16,0.1%,172.62869999999998,0
256,1024,4096,192,128,8,ActivationType.Gelu,torch.bfloat16,torch.bfloat16,torch.bfloat16,QuantType.No,1,0,128,0,87.7916,moe_ck2stages_gemm1_256x128x64x64_1x4_TypeCast_v1_Nswizzle0_Quant0_MulRoutedWeight0_gelu_B16_B16_B16,0.0%,128.5252,moe_ck2stages_gemm2_256x128x128x64_1x4_TypeCast_v1_Nswizzle0_Quant0_MulRoutedWeight1_B16_B16_B16,0.1%,216.3168,0
256,16,4096,192,128,8,ActivationType.Gelu,torch.bfloat16,torch.bfloat16,torch.bfloat16,QuantType.No,1,1,128,0,57.697,moe_ck2stages_gemm1_256x128x64x64_1x4_TypeCast_v1_Nswizzle0_Quant0_MulRoutedWeight1_gelu_B16_B16_B16,0.0%,48.9412,moe_ck2stages_gemm2_256x128x128x64_1x4_TypeCast_v1_Nswizzle0_Quant0_MulRoutedWeight0_B16_B16_B16,0.0%,106.6382,0
256,32,4096,192,128,8,ActivationType.Gelu,torch.bfloat16,torch.bfloat16,torch.bfloat16,QuantType.No,1,1,128,0,73.281,moe_ck2stages_gemm1_256x128x64x64_1x4_TypeCast_v1_Nswizzle0_Quant0_MulRoutedWeight1_gelu_B16_B16_B16,0.0%,57.9639,moe_ck2stages_gemm2_256x128x128x64_1x4_TypeCast_v1_Nswizzle0_Quant0_MulRoutedWeight0_B16_B16_B16,0.0%,131.2449,0
256,64,4096,192,128,8,ActivationType.Gelu,torch.bfloat16,torch.bfloat16,torch.bfloat16,QuantType.No,1,1,128,0,78.0395,moe_ck2stages_gemm1_256x128x64x64_1x4_TypeCast_v1_Nswizzle0_Quant0_MulRoutedWeight1_gelu_B16_B16_B16,0.0%,65.8716,moe_ck2stages_gemm2_256x128x128x64_1x4_TypeCast_v1_Nswizzle0_Quant0_MulRoutedWeight0_B16_B16_B16,0.0%,143.9111,0
256,128,4096,192,128,8,ActivationType.Gelu,torch.bfloat16,torch.bfloat16,torch.bfloat16,QuantType.No,1,1,128,0,78.9232,moe_ck2stages_gemm1_256x128x64x64_1x4_TypeCast_v1_Nswizzle0_Quant0_MulRoutedWeight1_gelu_B16_B16_B16,0.0%,69.2272,moe_ck2stages_gemm2_256x128x128x64_1x4_TypeCast_v1_Nswizzle0_Quant0_MulRoutedWeight0_B16_B16_B16,0.0%,148.1504,0
256,256,4096,192,128,8,ActivationType.Gelu,torch.bfloat16,torch.bfloat16,torch.bfloat16,QuantType.No,1,1,128,0,79.7666,moe_ck2stages_gemm1_256x128x64x64_1x4_TypeCast_v1_Nswizzle0_Quant0_MulRoutedWeight1_gelu_B16_B16_B16,0.0%,73.1906,moe_ck2stages_gemm2_256x128x128x64_1x4_TypeCast_v1_Nswizzle0_Quant0_MulRoutedWeight0_B16_B16_B16,0.0%,152.9572,0
256,512,4096,192,128,8,ActivationType.Gelu,torch.bfloat16,torch.bfloat16,torch.bfloat16,QuantType.No,1,1,128,0,82.0796,moe_ck2stages_gemm1_256x128x64x64_1x4_TypeCast_v1_Nswizzle0_Quant0_MulRoutedWeight1_gelu_B16_B16_B16,0.0%,84.9101,moe_ck2stages_gemm2_256x128x128x64_1x4_TypeCast_v3_Nswizzle0_Quant0_MulRoutedWeight0_B16_B16_B16,0.0%,166.9897,0
256,1024,4096,192,128,8,ActivationType.Gelu,torch.bfloat16,torch.bfloat16,torch.bfloat16,QuantType.No,1,1,128,0,88.0883,moe_ck2stages_gemm1_256x128x64x64_1x4_TypeCast_v1_Nswizzle0_Quant0_MulRoutedWeight1_gelu_B16_B16_B16,0.0%,125.6469,moe_ck2stages_gemm2_256x128x128x64_1x4_TypeCast_v1_Nswizzle0_Quant0_MulRoutedWeight0_B16_B16_B16,0.0%,213.7352,0
256,16,4096,384,128,8,ActivationType.Gelu,torch.bfloat16,torch.bfloat16,torch.bfloat16,QuantType.No,1,0,32,0,89.5023,moe_ck2stages_gemm1_256x32x64x128_1x4_TypeCast_v1_Nswizzle0_Quant0_MulRoutedWeight0_gelu_B16_B16_B16,0.0%,51.4998,moe_ck2stages_gemm2_256x32x128x128_1x4_TypeCast_v1_Nswizzle0_Quant0_MulRoutedWeight1_B16_B16_B16,0.5%,141.0021,0
256,32,4096,384,128,8,ActivationType.Gelu,torch.bfloat16,torch.bfloat16,torch.bfloat16,QuantType.No,1,0,32,0,127.8742,moe_ck2stages_gemm1_256x32x64x128_1x4_TypeCast_v1_Nswizzle0_Quant0_MulRoutedWeight0_gelu_B16_B16_B16,0.0%,68.7529,moe_ck2stages_gemm2_256x32x128x128_1x4_TypeCast_v1_Nswizzle0_Quant0_MulRoutedWeight1_B16_B16_B16,0.5%,196.6271,0
256,64,4096,384,128,8,ActivationType.Gelu,torch.bfloat16,torch.bfloat16,torch.bfloat16,QuantType.No,1,0,32,0,136.8058,moe_ck2stages_gemm1_256x32x64x128_1x4_TypeCast_v1_Nswizzle0_Quant0_MulRoutedWeight0_gelu_B16_B16_B16,0.0%,75.6377,moe_ck2stages_gemm2_256x32x128x128_1x4_TypeCast_v1_Nswizzle0_Quant0_MulRoutedWeight1_B16_B16_B16,0.5%,212.4435,0
256,128,4096,384,128,8,ActivationType.Gelu,torch.bfloat16,torch.bfloat16,torch.bfloat16,QuantType.No,1,0,32,0,138.3157,moe_ck2stages_gemm1_256x32x64x128_1x4_TypeCast_v1_Nswizzle0_Quant0_MulRoutedWeight0_gelu_B16_B16_B16,0.0%,77.7254,moe_ck2stages_gemm2_256x32x128x128_1x4_TypeCast_v1_Nswizzle0_Quant0_MulRoutedWeight1_B16_B16_B16,0.5%,216.0411,0
256,256,4096,384,128,8,ActivationType.Gelu,torch.bfloat16,torch.bfloat16,torch.bfloat16,QuantType.No,1,0,32,0,140.7161,moe_ck2stages_gemm1_256x32x64x128_1x4_TypeCast_v1_Nswizzle0_Quant0_MulRoutedWeight0_gelu_B16_B16_B16,0.0%,80.4366,moe_ck2stages_gemm2_256x32x128x128_1x4_TypeCast_v1_Nswizzle0_Quant0_MulRoutedWeight1_B16_B16_B16,0.5%,221.1527,0
256,512,4096,384,128,8,ActivationType.Gelu,torch.bfloat16,torch.bfloat16,torch.bfloat16,QuantType.No,1,0,64,0,144.981,moe_ck2stages_gemm1_256x64x64x64_1x4_TypeCast_v1_Nswizzle0_Quant0_MulRoutedWeight0_gelu_B16_B16_B16,0.0%,104.8371,moe_ck2stages_gemm2_256x64x128x128_1x4_TypeCast_v1_Nswizzle0_Quant0_MulRoutedWeight1_B16_B16_B16,0.5%,249.8181,0
256,1024,4096,384,128,8,ActivationType.Gelu,torch.bfloat16,torch.bfloat16,torch.bfloat16,QuantType.No,1,0,128,0,171.882,moe_ck2stages_gemm1_256x128x64x64_1x4_TypeCast_v1_Nswizzle0_Quant0_MulRoutedWeight0_gelu_B16_B16_B16,0.0%,152.5554,moe_ck2stages_gemm2_256x128x128x64_1x4_TypeCast_v3_Nswizzle0_Quant0_MulRoutedWeight1_B16_B16_B16,0.5%,324.4374,0
256,16,4096,384,128,8,ActivationType.Gelu,torch.bfloat16,torch.bfloat16,torch.bfloat16,QuantType.No,1,1,32,0,89.9594,moe_ck2stages_gemm1_256x32x64x128_1x4_TypeCast_v1_Nswizzle0_Quant0_MulRoutedWeight1_gelu_B16_B16_B16,0.0%,51.0022,moe_ck2stages_gemm2_256x32x128x128_1x4_TypeCast_v1_Nswizzle0_Quant0_MulRoutedWeight0_B16_B16_B16,0.0%,140.9616,0
256,32,4096,384,128,8,ActivationType.Gelu,torch.bfloat16,torch.bfloat16,torch.bfloat16,QuantType.No,1,1,32,0,127.4464,moe_ck2stages_gemm1_256x32x64x128_1x4_TypeCast_v1_Nswizzle0_Quant0_MulRoutedWeight1_gelu_B16_B16_B16,0.0%,69.0267,moe_ck2stages_gemm2_256x32x128x128_1x4_TypeCast_v1_Nswizzle0_Quant0_MulRoutedWeight0_B16_B16_B16,0.0%,196.4731,0
256,64,4096,384,128,8,ActivationType.Gelu,torch.bfloat16,torch.bfloat16,torch.bfloat16,QuantType.No,1,1,32,0,136.676,moe_ck2stages_gemm1_256x32x64x128_1x4_TypeCast_v1_Nswizzle0_Quant0_MulRoutedWeight1_gelu_B16_B16_B16,0.0%,75.4552,moe_ck2stages_gemm2_256x32x128x128_1x4_TypeCast_v1_Nswizzle0_Quant0_MulRoutedWeight0_B16_B16_B16,0.0%,212.1312,0
256,128,4096,384,128,8,ActivationType.Gelu,torch.bfloat16,torch.bfloat16,torch.bfloat16,QuantType.No,1,1,32,0,139.2281,moe_ck2stages_gemm1_256x32x64x128_1x4_TypeCast_v1_Nswizzle0_Quant0_MulRoutedWeight1_gelu_B16_B16_B16,0.0%,77.6845,moe_ck2stages_gemm2_256x32x128x128_1x4_TypeCast_v1_Nswizzle0_Quant0_MulRoutedWeight0_B16_B16_B16,0.0%,216.9126,0
256,256,4096,384,128,8,ActivationType.Gelu,torch.bfloat16,torch.bfloat16,torch.bfloat16,QuantType.No,1,1,32,0,141.0976,moe_ck2stages_gemm1_256x32x64x64_1x4_TypeCast_v1_Nswizzle0_Quant0_MulRoutedWeight1_gelu_B16_B16_B16,0.0%,80.1778,moe_ck2stages_gemm2_256x32x128x128_1x4_TypeCast_v1_Nswizzle0_Quant0_MulRoutedWeight0_B16_B16_B16,0.0%,221.2754,0
256,16,7168,256,256,8,ActivationType.Silu,torch.bfloat16,torch.bfloat16,torch.bfloat16,QuantType.No,1,0,32,0,131.8625,moe_ck2stages_gemm1_256x32x64x128_1x4_TypeCast_v1_Nswizzle0_Quant0_MulRoutedWeight0_silu_B16_B16_B16,0.0%,70.246,moe_ck2stages_gemm2_256x32x128x128_1x4_TypeCast_v1_Nswizzle0_Quant0_MulRoutedWeight1_B16_B16_B16,1.4%,202.1085,0
256,32,7168,256,256,8,ActivationType.Silu,torch.bfloat16,torch.bfloat16,torch.bfloat16,QuantType.No,1,0,32,0,198.5347,moe_ck2stages_gemm1_256x32x64x128_1x4_TypeCast_v1_Nswizzle0_Quant0_MulRoutedWeight0_silu_B16_B16_B16,0.0%,102.7245,moe_ck2stages_gemm2_256x32x128x128_1x4_TypeCast_v1_Nswizzle0_Quant0_MulRoutedWeight1_B16_B16_B16,1.4%,301.2592,0
256,64,7168,256,256,8,ActivationType.Silu,torch.bfloat16,torch.bfloat16,torch.bfloat16,QuantType.No,1,0,32,0,277.5506,moe_ck2stages_gemm1_256x32x64x128_1x4_TypeCast_v1_Nswizzle0_Quant0_MulRoutedWeight0_silu_B16_B16_B16,0.0%,141.6194,moe_ck2stages_gemm2_256x32x128x128_1x4_TypeCast_v1_Nswizzle0_Quant0_MulRoutedWeight1_B16_B16_B16,1.3%,419.17,0
256,128,7168,256,256,8,ActivationType.Silu,torch.bfloat16,torch.bfloat16,torch.bfloat16,QuantType.No,1,0,64,0,298.4138,moe_ck2stages_gemm1_256x64x64x64_1x4_TypeCast_v1_Nswizzle0_Quant0_MulRoutedWeight0_silu_B16_B16_B16,0.0%,160.1887,moe_ck2stages_gemm2_256x64x128x128_1x4_TypeCast_v1_Nswizzle0_Quant0_MulRoutedWeight1_B16_B16_B16,1.3%,458.6025,0
256,256,7168,256,256,8,ActivationType.Silu,torch.bfloat16,torch.bfloat16,torch.bfloat16,QuantType.No,1,0,64,0,307.9132,moe_ck2stages_gemm1_256x64x64x64_1x4_TypeCast_v1_Nswizzle0_Quant0_MulRoutedWeight0_silu_B16_B16_B16,0.0%,170.5755,moe_ck2stages_gemm2_256x64x128x128_1x4_TypeCast_v1_Nswizzle0_Quant0_MulRoutedWeight1_B16_B16_B16,1.3%,478.4887,0
256,512,7168,256,256,8,ActivationType.Silu,torch.bfloat16,torch.bfloat16,torch.bfloat16,QuantType.No,1,0,64,0,310.8521,moe_ck2stages_gemm1_256x64x64x64_1x4_TypeCast_v1_Nswizzle0_Quant0_MulRoutedWeight0_silu_B16_B16_B16,0.0%,187.6128,moe_ck2stages_gemm2_256x64x128x128_1x4_TypeCast_v1_Nswizzle0_Quant0_MulRoutedWeight1_B16_B16_B16,1.3%,498.4649,0
256,1024,7168,256,256,8,ActivationType.Silu,torch.bfloat16,torch.bfloat16,torch.bfloat16,QuantType.No,1,0,64,0,325.8822,moe_ck2stages_gemm1_256x64x64x64_1x4_TypeCast_v1_Nswizzle0_Quant0_MulRoutedWeight0_silu_B16_B16_B16,0.0%,228.9235,moe_ck2stages_gemm2_256x64x128x128_1x4_TypeCast_v1_Nswizzle0_Quant0_MulRoutedWeight1_B16_B16_B16,1.3%,554.8057,0
256,16,7168,256,256,8,ActivationType.Silu,torch.bfloat16,torch.bfloat16,torch.bfloat16,QuantType.No,1,1,64,0,128.4088,moe_ck2stages_gemm1_256x64x64x64_1x4_TypeCast_v1_Nswizzle0_Quant0_MulRoutedWeight1_silu_B16_B16_B16,0.0%,71.9127,moe_ck2stages_gemm2_256x64x128x128_1x4_TypeCast_v1_Nswizzle0_Quant0_MulRoutedWeight0_B16_B16_B16,0.0%,200.3215,0
256,32,7168,256,256,8,ActivationType.Silu,torch.bfloat16,torch.bfloat16,torch.bfloat16,QuantType.No,1,1,64,0,198.743,moe_ck2stages_gemm1_256x64x64x64_1x4_TypeCast_v1_Nswizzle0_Quant0_MulRoutedWeight1_silu_B16_B16_B16,0.0%,102.3427,moe_ck2stages_gemm2_256x64x128x128_1x4_TypeCast_v1_Nswizzle0_Quant0_MulRoutedWeight0_B16_B16_B16,0.0%,301.0857,0
256,64,7168,256,256,8,ActivationType.Silu,torch.bfloat16,torch.bfloat16,torch.bfloat16,QuantType.No,1,1,64,0,278.5912,moe_ck2stages_gemm1_256x64x64x128_1x4_TypeCast_v1_Nswizzle0_Quant0_MulRoutedWeight1_silu_B16_B16_B16,0.0%,137.9968,moe_ck2stages_gemm2_256x64x128x128_1x4_TypeCast_v1_Nswizzle0_Quant0_MulRoutedWeight0_B16_B16_B16,0.0%,416.588,0
256,128,7168,256,256,8,ActivationType.Silu,torch.bfloat16,torch.bfloat16,torch.bfloat16,QuantType.No,1,1,64,0,298.2262,moe_ck2stages_gemm1_256x64x64x64_1x4_TypeCast_v1_Nswizzle0_Quant0_MulRoutedWeight1_silu_B16_B16_B16,0.0%,156.1018,moe_ck2stages_gemm2_256x64x128x128_1x4_TypeCast_v1_Nswizzle0_Quant0_MulRoutedWeight0_B16_B16_B16,0.0%,454.328,0
256,256,7168,256,256,8,ActivationType.Silu,torch.bfloat16,torch.bfloat16,torch.bfloat16,QuantType.No,1,1,64,0,307.5774,moe_ck2stages_gemm1_256x64x64x64_1x4_TypeCast_v1_Nswizzle0_Quant0_MulRoutedWeight1_silu_B16_B16_B16,0.0%,164.881,moe_ck2stages_gemm2_256x64x128x128_1x4_TypeCast_v1_Nswizzle0_Quant0_MulRoutedWeight0_B16_B16_B16,0.0%,472.4584,0
256,512,7168,256,256,8,ActivationType.Silu,torch.bfloat16,torch.bfloat16,torch.bfloat16,QuantType.No,1,1,64,0,311.7026,moe_ck2stages_gemm1_256x64x64x64_1x4_TypeCast_v1_Nswizzle0_Quant0_MulRoutedWeight1_silu_B16_B16_B16,0.0%,177.8505,moe_ck2stages_gemm2_256x64x128x128_1x4_TypeCast_v1_Nswizzle0_Quant0_MulRoutedWeight0_B16_B16_B16,0.0%,489.5531,0
256,1024,7168,256,256,8,ActivationType.Silu,torch.bfloat16,torch.bfloat16,torch.bfloat16,QuantType.No,1,1,64,0,326.6863,moe_ck2stages_gemm1_256x64x64x64_1x4_TypeCast_v1_Nswizzle0_Quant0_MulRoutedWeight1_silu_B16_B16_B16,0.0%,223.1283,moe_ck2stages_gemm2_256x64x128x128_1x4_TypeCast_v1_Nswizzle0_Quant0_MulRoutedWeight0_B16_B16_B16,0.0%,549.8146,0
256,16,7168,256,256,8,ActivationType.Silu,torch.bfloat16,torch.float8_e4m3fn,torch.float8_e4m3fn,QuantType.per_Tensor,1,0,32,0,67.999,moe_ck2stages_gemm1_256x32x64x256_1x4_TypeCast_v1_Nswizzle0_Quant1_MulRoutedWeight0_silu_F8_F8_B16,0.0%,40.5166,moe_ck2stages_gemm2_256x32x128x256_1x4_TypeCast_v1_Nswizzle0_Quant1_MulRoutedWeight1_F8_F8_B16,1.4%,108.5156,0
256,32,7168,256,256,8,ActivationType.Silu,torch.bfloat16,torch.float8_e4m3fn,torch.float8_e4m3fn,QuantType.per_Tensor,1,0,32,0,102.4854,moe_ck2stages_gemm1_256x32x64x256_1x4_TypeCast_v1_Nswizzle0_Quant1_MulRoutedWeight0_silu_F8_F8_B16,0.0%,56.7236,moe_ck2stages_gemm2_256x32x128x256_1x4_TypeCast_v1_Nswizzle0_Quant1_MulRoutedWeight1_F8_F8_B16,1.4%,159.209,0
256,64,7168,256,256,8,ActivationType.Silu,torch.bfloat16,torch.float8_e4m3fn,torch.float8_e4m3fn,QuantType.per_Tensor,1,0,32,0,140.7195,moe_ck2stages_gemm1_256x32x64x256_1x4_TypeCast_v1_Nswizzle0_Quant1_MulRoutedWeight0_silu_F8_F8_B16,0.0%,75.8797,moe_ck2stages_gemm2_256x32x128x256_1x4_TypeCast_v1_Nswizzle0_Quant1_MulRoutedWeight1_F8_F8_B16,1.3%,216.5992,0
256,128,7168,256,256,8,ActivationType.Silu,torch.bfloat16,torch.float8_e4m3fn,torch.float8_e4m3fn,QuantType.per_Tensor,1,0,32,0,154.2075,moe_ck2stages_gemm1_256x32x64x256_1x4_TypeCast_v1_Nswizzle0_Quant1_MulRoutedWeight0_silu_F8_F8_B16,0.0%,85.2527,moe_ck2stages_gemm2_256x32x128x256_1x4_TypeCast_v1_Nswizzle0_Quant1_MulRoutedWeight1_F8_F8_B16,1.3%,239.4602,0
256,256,7168,256,256,8,ActivationType.Silu,torch.bfloat16,torch.float8_e4m3fn,torch.float8_e4m3fn,QuantType.per_Tensor,1,0,32,0,158.7735,moe_ck2stages_gemm1_256x32x64x256_1x4_TypeCast_v1_Nswizzle0_Quant1_MulRoutedWeight0_silu_F8_F8_B16,0.0%,92.6941,moe_ck2stages_gemm2_256x32x128x256_1x4_TypeCast_v1_Nswizzle0_Quant1_MulRoutedWeight1_F8_F8_B16,1.3%,251.4676,0
256,512,7168,256,256,8,ActivationType.Silu,torch.bfloat16,torch.float8_e4m3fn,torch.float8_e4m3fn,QuantType.per_Tensor,1,0,32,0,162.9055,moe_ck2stages_gemm1_256x32x64x128_1x4_TypeCast_v1_Nswizzle0_Quant1_MulRoutedWeight0_silu_F8_F8_B16,0.0%,114.6803,moe_ck2stages_gemm2_256x32x128x256_1x4_TypeCast_v1_Nswizzle0_Quant1_MulRoutedWeight1_F8_F8_B16,1.3%,277.5858,0
256,1024,7168,256,256,8,ActivationType.Silu,torch.bfloat16,torch.float8_e4m3fn,torch.float8_e4m3fn,QuantType.per_Tensor,1,0,64,0,171.438,moe_ck2stages_gemm1_256x64x64x256_1x4_TypeCast_v1_Nswizzle0_Quant1_MulRoutedWeight0_silu_F8_F8_B16,0.0%,205.2641,moe_ck2stages_gemm2_256x64x128x256_1x4_TypeCast_v1_Nswizzle0_Quant1_MulRoutedWeight1_F8_F8_B16,1.3%,376.7021,0
256,16,7168,256,256,8,ActivationType.Silu,torch.bfloat16,torch.float8_e4m3fn,torch.float8_e4m3fn,QuantType.per_Tensor,1,1,32,0,67.7683,moe_ck2stages_gemm1_256x32x64x256_1x4_TypeCast_v1_Nswizzle0_Quant1_MulRoutedWeight1_silu_F8_F8_B16,0.0%,40.8282,moe_ck2stages_gemm2_256x32x128x256_1x4_TypeCast_v1_Nswizzle0_Quant1_MulRoutedWeight0_F8_F8_B16,0.0%,108.5965,0
256,32,7168,256,256,8,ActivationType.Silu,torch.bfloat16,torch.float8_e4m3fn,torch.float8_e4m3fn,QuantType.per_Tensor,1,1,32,0,104.0822,moe_ck2stages_gemm1_256x32x64x128_1x4_TypeCast_v1_Nswizzle0_Quant1_MulRoutedWeight1_silu_F8_F8_B16,0.0%,57.7224,moe_ck2stages_gemm2_256x32x128x256_1x4_TypeCast_v1_Nswizzle0_Quant1_MulRoutedWeight0_F8_F8_B16,0.0%,161.8046,0
256,64,7168,256,256,8,ActivationType.Silu,torch.bfloat16,torch.float8_e4m3fn,torch.float8_e4m3fn,QuantType.per_Tensor,1,1,32,0,142.2581,moe_ck2stages_gemm1_256x32x64x256_1x4_TypeCast_v1_Nswizzle0_Quant1_MulRoutedWeight1_silu_F8_F8_B16,0.0%,77.8633,moe_ck2stages_gemm2_256x32x128x256_1x4_TypeCast_v1_Nswizzle0_Quant1_MulRoutedWeight0_F8_F8_B16,0.0%,220.1214,0
256,128,7168,256,256,8,ActivationType.Silu,torch.bfloat16,torch.float8_e4m3fn,torch.float8_e4m3fn,QuantType.per_Tensor,1,1,32,0,153.3471,moe_ck2stages_gemm1_256x32x64x256_1x4_TypeCast_v1_Nswizzle0_Quant1_MulRoutedWeight1_silu_F8_F8_B16,0.0%,86.6202,moe_ck2stages_gemm2_256x32x128x256_1x4_TypeCast_v1_Nswizzle0_Quant1_MulRoutedWeight0_F8_F8_B16,0.0%,239.9673,0
256,256,7168,256,256,8,ActivationType.Silu,torch.bfloat16,torch.float8_e4m3fn,torch.float8_e4m3fn,QuantType.per_Tensor,1,1,32,0,158.256,moe_ck2stages_gemm1_256x32x64x256_1x4_TypeCast_v1_Nswizzle0_Quant1_MulRoutedWeight1_silu_F8_F8_B16,0.0%,94.9442,moe_ck2stages_gemm2_256x32x128x256_1x4_TypeCast_v1_Nswizzle0_Quant1_MulRoutedWeight0_F8_F8_B16,0.0%,253.2002,0
256,512,7168,256,256,8,ActivationType.Silu,torch.bfloat16,torch.float8_e4m3fn,torch.float8_e4m3fn,QuantType.per_Tensor,1,1,32,0,162.1092,moe_ck2stages_gemm1_256x32x64x256_1x4_TypeCast_v1_Nswizzle0_Quant1_MulRoutedWeight1_silu_F8_F8_B16,0.0%,114.1086,moe_ck2stages_gemm2_256x32x128x256_1x4_TypeCast_v1_Nswizzle0_Quant1_MulRoutedWeight0_F8_F8_B16,0.0%,276.2178,0
256,1024,7168,256,256,8,ActivationType.Silu,torch.bfloat16,torch.float8_e4m3fn,torch.float8_e4m3fn,QuantType.per_Tensor,1,1,64,0,169.5988,moe_ck2stages_gemm1_256x64x64x256_1x4_TypeCast_v1_Nswizzle0_Quant1_MulRoutedWeight1_silu_F8_F8_B16,0.0%,205.5691,moe_ck2stages_gemm2_256x64x128x256_1x4_TypeCast_v1_Nswizzle0_Quant1_MulRoutedWeight0_F8_F8_B16,0.0%,375.1679,0
256,16,7168,256,256,8,ActivationType.Silu,torch.bfloat16,torch.float8_e4m3fn,torch.float8_e4m3fn,QuantType.per_Token,1,0,32,0,68.2374,moe_ck2stages_gemm1_256x32x64x256_1x4_TypeCast_v1_Nswizzle0_Quant2_MulRoutedWeight0_silu_F8_F8_B16,0.0%,46.5664,moe_ck2stages_gemm2_256x32x128x256_1x4_TypeCast_v1_Nswizzle0_Quant2_MulRoutedWeight1_F8_F8_B16,1.4%,114.8038,0
256,32,7168,256,256,8,ActivationType.Silu,torch.bfloat16,torch.float8_e4m3fn,torch.float8_e4m3fn,QuantType.per_Token,1,0,32,0,158.4806,_ZN5aiter45fmoe_bf16_pertokenFp8_g1u1_silu_1tg_ps_32x256E,0.0%,0.0,nan,0,158.4806,1
256,64,7168,256,256,8,ActivationType.Silu,torch.bfloat16,torch.float8_e4m3fn,torch.float8_e4m3fn,QuantType.per_Token,1,0,32,0,217.2401,_ZN5aiter45fmoe_bf16_pertokenFp8_g1u1_silu_1tg_ps_32x256E,0.0%,0.0,nan,0,217.2401,1
256,128,7168,256,256,8,ActivationType.Silu,torch.bfloat16,torch.float8_e4m3fn,torch.float8_e4m3fn,QuantType.per_Token,1,0,32,0,245.3278,_ZN5aiter42fmoe_bf16_pertokenFp8_g1u1_silu_1tg_32x256E,0.0%,0.0,nan,0,245.3278,1
256,256,7168,256,256,8,ActivationType.Silu,torch.bfloat16,torch.float8_e4m3fn,torch.float8_e4m3fn,QuantType.per_Token,1,0,32,0,258.7196,_ZN5aiter42fmoe_bf16_pertokenFp8_g1u1_silu_1tg_32x256E,0.0%,0.0,nan,0,258.7196,1
256,512,7168,256,256,8,ActivationType.Silu,torch.bfloat16,torch.float8_e4m3fn,torch.float8_e4m3fn,QuantType.per_Token,1,0,32,0,269.2064,_ZN5aiter42fmoe_bf16_pertokenFp8_g1u1_silu_1tg_32x256E,0.0%,0.0,nan,0,269.2064,1
256,1024,7168,256,256,8,ActivationType.Silu,torch.bfloat16,torch.float8_e4m3fn,torch.float8_e4m3fn,QuantType.per_Token,1,0,32,0,361.5091,_ZN5aiter42fmoe_bf16_pertokenFp8_g1u1_silu_1tg_32x256E,0.0%,0.0,nan,0,361.5091,1
256,16,7168,256,256,8,ActivationType.Silu,torch.bfloat16,torch.float8_e4m3fn,torch.float8_e4m3fn,QuantType.per_Token,1,1,32,0,68.7365,_ZN5aiter57fmoe_stage1_bf16_pertokenFp8_doweight_g1u1_32x128_3tg_pf3E,0.0%,44.3023,moe_ck2stages_gemm2_256x32x128x256_1x4_TypeCast_v1_Nswizzle0_Quant2_MulRoutedWeight0_F8_F8_B16,0.0%,113.0388,0
256,16,7168,512,256,8,ActivationType.Silu,torch.bfloat16,torch.bfloat16,torch.bfloat16,QuantType.No,1,1,32,0,268.2034,moe_ck2stages_gemm1_256x32x64x128_1x4_TypeCast_v1_Nswizzle0_Quant0_MulRoutedWeight1_silu_B16_B16_B16,0.0%,134.7329,moe_ck2stages_gemm2_256x32x128x128_1x4_TypeCast_v1_Nswizzle0_Quant0_MulRoutedWeight0_B16_B16_B16,0.0%,402.9363,0
256,32,7168,512,256,8,ActivationType.Silu,torch.bfloat16,torch.bfloat16,torch.bfloat16,QuantType.No,1,1,64,0,380.515,moe_ck2stages_gemm1_256x64x64x128_1x4_TypeCast_v1_Nswizzle0_Quant0_MulRoutedWeight1_silu_B16_B16_B16,0.0%,194.6522,moe_ck2stages_gemm2_256x64x128x128_1x4_TypeCast_v1_Nswizzle0_Quant0_MulRoutedWeight0_B16_B16_B16,0.0%,575.1672,0
256,64,7168,512,256,8,ActivationType.Silu,torch.bfloat16,torch.bfloat16,torch.bfloat16,QuantType.No,1,1,64,0,563.744,moe_ck2stages_gemm1_256x64x64x128_1x4_TypeCast_v1_Nswizzle0_Quant0_MulRoutedWeight1_silu_B16_B16_B16,0.0%,268.523,moe_ck2stages_gemm2_256x64x128x128_1x4_TypeCast_v1_Nswizzle0_Quant0_MulRoutedWeight0_B16_B16_B16,0.0%,832.267,0
256,128,7168,512,256,8,ActivationType.Silu,torch.bfloat16,torch.bfloat16,torch.bfloat16,QuantType.No,1,1,64,0,605.8382,moe_ck2stages_gemm1_256x64x64x128_1x4_TypeCast_v1_Nswizzle0_Quant0_MulRoutedWeight1_silu_B16_B16_B16,0.0%,308.8384,moe_ck2stages_gemm2_256x64x128x128_1x4_TypeCast_v1_Nswizzle0_Quant0_MulRoutedWeight0_B16_B16_B16,0.0%,914.6766,0
256,256,7168,512,256,8,ActivationType.Silu,torch.bfloat16,torch.bfloat16,torch.bfloat16,QuantType.No,1,1,64,0,613.3676,moe_ck2stages_gemm1_256x64x64x64_1x4_TypeCast_v1_Nswizzle0_Quant0_MulRoutedWeight1_silu_B16_B16_B16,0.0%,316.2011,moe_ck2stages_gemm2_256x64x128x128_1x4_TypeCast_v1_Nswizzle0_Quant0_MulRoutedWeight0_B16_B16_B16,0.0%,929.5687,0
256,512,7168,512,256,8,ActivationType.Silu,torch.bfloat16,torch.bfloat16,torch.bfloat16,QuantType.No,1,1,64,0,621.3253,moe_ck2stages_gemm1_256x64x64x64_1x4_TypeCast_v1_Nswizzle0_Quant0_MulRoutedWeight1_silu_B16_B16_B16,0.0%,334.5202,moe_ck2stages_gemm2_256x64x128x128_1x4_TypeCast_v1_Nswizzle0_Quant0_MulRoutedWeight0_B16_B16_B16,0.0%,955.8455,0
256,1024,7168,512,256,8,ActivationType.Silu,torch.bfloat16,torch.bfloat16,torch.bfloat16,QuantType.No,1,1,64,0,647.0892,moe_ck2stages_gemm1_256x64x64x64_1x4_TypeCast_v1_Nswizzle0_Quant0_MulRoutedWeight1_silu_B16_B16_B16,0.0%,363.288,moe_ck2stages_gemm2_256x64x128x128_1x4_TypeCast_v1_Nswizzle0_Quant0_MulRoutedWeight0_B16_B16_B16,0.0%,1010.3772,0
256,16,7168,512,256,8,ActivationType.Silu,torch.bfloat16,torch.float8_e4m3fn,torch.float8_e4m3fn,QuantType.per_Tensor,1,0,32,0,138.6611,moe_ck2stages_gemm1_256x32x64x256_1x4_TypeCast_v1_Nswizzle0_Quant1_MulRoutedWeight0_silu_F8_F8_B16,0.0%,69.9939,moe_ck2stages_gemm2_256x32x128x256_1x4_TypeCast_v1_Nswizzle0_Quant1_MulRoutedWeight1_F8_F8_B16,2.8%,208.655,0
256,32,7168,512,256,8,ActivationType.Silu,torch.bfloat16,torch.float8_e4m3fn,torch.float8_e4m3fn,QuantType.per_Tensor,1,0,32,0,194.5186,moe_ck2stages_gemm1_256x32x64x256_1x4_TypeCast_v1_Nswizzle0_Quant1_MulRoutedWeight0_silu_F8_F8_B16,0.0%,101.0683,moe_ck2stages_gemm2_256x32x128x256_1x4_TypeCast_v1_Nswizzle0_Quant1_MulRoutedWeight1_F8_F8_B16,2.8%,295.5869,0
256,64,7168,512,256,8,ActivationType.Silu,torch.bfloat16,torch.float8_e4m3fn,torch.float8_e4m3fn,QuantType.per_Tensor,1,0,32,0,276.1106,_ZN5aiter44fmoe_stage1_bf16_pertokenFp8_g1u1_32x512_pf2E,0.0%,141.0625,moe_ck2stages_gemm2_256x32x128x256_1x4_TypeCast_v1_Nswizzle0_Quant1_MulRoutedWeight1_F8_F8_B16,2.8%,417.1731,0
256,128,7168,512,256,8,ActivationType.Silu,torch.bfloat16,torch.float8_e4m3fn,torch.float8_e4m3fn,QuantType.per_Tensor,1,0,64,0,310.9421,moe_ck2stages_gemm1_256x64x64x256_1x4_TypeCast_v1_Nswizzle0_Quant1_MulRoutedWeight0_silu_F8_F8_B16,0.0%,164.4566,moe_ck2stages_gemm2_256x64x128x256_1x4_TypeCast_v1_Nswizzle0_Quant1_MulRoutedWeight1_F8_F8_B16,2.8%,475.3987,0
256,256,7168,512,256,8,ActivationType.Silu,torch.bfloat16,torch.float8_e4m3fn,torch.float8_e4m3fn,QuantType.per_Tensor,1,0,32,0,313.5176,moe_ck2stages_gemm1_256x32x64x256_1x4_TypeCast_v1_Nswizzle0_Quant1_MulRoutedWeight0_silu_F8_F8_B16,0.0%,168.5062,moe_ck2stages_gemm2_256x32x128x256_1x4_TypeCast_v1_Nswizzle0_Quant1_MulRoutedWeight1_F8_F8_B16,2.8%,482.0238000000001,0
256,512,7168,512,256,8,ActivationType.Silu,torch.bfloat16,torch.float8_e4m3fn,torch.float8_e4m3fn,QuantType.per_Tensor,1,0,32,0,316.7569,_ZN5aiter44fmoe_stage1_bf16_pertokenFp8_g1u1_32x512_pf2E,0.0%,183.8783,moe_ck2stages_gemm2_256x32x128x256_1x4_TypeCast_v1_Nswizzle0_Quant1_MulRoutedWeight1_F8_F8_B16,2.8%,500.6352,0
256,1024,7168,512,256,8,ActivationType.Silu,torch.bfloat16,torch.float8_e4m3fn,torch.float8_e4m3fn,QuantType.per_Tensor,1,0,64,0,328.9474,_ZN5aiter44fmoe_stage1_bf16_pertokenFp8_g1u1_64x256_pf2E,0.0%,225.6663,moe_ck2stages_gemm2_256x64x128x256_1x4_TypeCast_v1_Nswizzle0_Quant1_MulRoutedWeight1_F8_F8_B16,2.8%,554.6137,0
256,16,7168,512,256,8,ActivationType.Silu,torch.bfloat16,torch.float8_e4m3fn,torch.float8_e4m3fn,QuantType.per_Tensor,1,1,32,0,138.8701,moe_ck2stages_gemm1_256x32x64x256_1x4_TypeCast_v1_Nswizzle0_Quant1_MulRoutedWeight1_silu_F8_F8_B16,0.0%,70.2409,moe_ck2stages_gemm2_256x32x128x256_1x4_TypeCast_v1_Nswizzle0_Quant1_MulRoutedWeight0_F8_F8_B16,0.0%,209.111,0
256,32,7168,512,256,8,ActivationType.Silu,torch.bfloat16,torch.float8_e4m3fn,torch.float8_e4m3fn,QuantType.per_Tensor,1,1,32,0,195.414,moe_ck2stages_gemm1_256x32x64x256_1x4_TypeCast_v1_Nswizzle0_Quant1_MulRoutedWeight1_silu_F8_F8_B16,0.0%,101.3303,moe_ck2stages_gemm2_256x32x128x256_1x4_TypeCast_v1_Nswizzle0_Quant1_MulRoutedWeight0_F8_F8_B16,0.0%,296.74429999999995,0
256,64,7168,512,256,8,ActivationType.Silu,torch.bfloat16,torch.float8_e4m3fn,torch.float8_e4m3fn,QuantType.per_Tensor,1,1,32,0,275.5829,_ZN5aiter53fmoe_stage1_bf16_pertokenFp8_doweight_g1u1_32x512_pf2E,0.0%,141.8053,moe_ck2stages_gemm2_256x32x128x256_1x4_TypeCast_v1_Nswizzle0_Quant1_MulRoutedWeight0_F8_F8_B16,0.0%,417.3882,0
256,128,7168,512,256,8,ActivationType.Silu,torch.bfloat16,torch.float8_e4m3fn,torch.float8_e4m3fn,QuantType.per_Tensor,1,1,32,0,311.4401,moe_ck2stages_gemm1_256x32x64x256_1x4_TypeCast_v1_Nswizzle0_Quant1_MulRoutedWeight1_silu_F8_F8_B16,0.0%,164.7923,moe_ck2stages_gemm2_256x32x128x256_1x4_TypeCast_v1_Nswizzle0_Quant1_MulRoutedWeight0_F8_F8_B16,0.0%,476.2324,0
256,256,7168,512,256,8,ActivationType.Silu,torch.bfloat16,torch.float8_e4m3fn,torch.float8_e4m3fn,QuantType.per_Tensor,1,1,32,0,314.331,moe_ck2stages_gemm1_256x32x64x256_1x4_TypeCast_v1_Nswizzle0_Quant1_MulRoutedWeight1_silu_F8_F8_B16,0.0%,169.9851,moe_ck2stages_gemm2_256x32x128x256_1x4_TypeCast_v1_Nswizzle0_Quant1_MulRoutedWeight0_F8_F8_B16,0.0%,484.3161,0
256,512,7168,512,256,8,ActivationType.Silu,torch.bfloat16,torch.float8_e4m3fn,torch.float8_e4m3fn,QuantType.per_Tensor,1,1,32,0,315.989,_ZN5aiter53fmoe_stage1_bf16_pertokenFp8_doweight_g1u1_32x512_pf2E,0.0%,183.8335,moe_ck2stages_gemm2_256x32x128x256_1x4_TypeCast_v1_Nswizzle0_Quant1_MulRoutedWeight0_F8_F8_B16,0.0%,499.8225,0
256,1024,7168,512,256,8,ActivationType.Silu,torch.bfloat16,torch.float8_e4m3fn,torch.float8_e4m3fn,QuantType.per_Tensor,1,1,64,0,328.6203,_ZN5aiter53fmoe_stage1_bf16_pertokenFp8_doweight_g1u1_64x256_pf2E,0.0%,227.39,moe_ck2stages_gemm2_256x64x128x256_1x4_TypeCast_v1_Nswizzle0_Quant1_MulRoutedWeight0_F8_F8_B16,0.0%,556.0102999999999,0
256,16,7168,512,256,8,ActivationType.Silu,torch.bfloat16,torch.float8_e4m3fn,torch.float8_e4m3fn,QuantType.per_Token,1,0,32,0,130.3234,_ZN5aiter48fmoe_stage1_bf16_pertokenFp8_g1u1_32x256_2tg_pf3E,0.0%,74.9639,moe_ck2stages_gemm2_256x32x128x256_1x4_TypeCast_v1_Nswizzle0_Quant2_MulRoutedWeight1_F8_F8_B16,2.8%,205.2873,0
256,32,7168,512,256,8,ActivationType.Silu,torch.bfloat16,torch.float8_e4m3fn,torch.float8_e4m3fn,QuantType.per_Token,1,0,32,0,296.2538,_ZN5aiter45fmoe_bf16_pertokenFp8_g1u1_silu_1tg_ps_32x512E,0.0%,0.0,nan,0,296.2538,1
256,64,7168,512,256,8,ActivationType.Silu,torch.bfloat16,torch.float8_e4m3fn,torch.float8_e4m3fn,QuantType.per_Token,1,0,32,0,266.0248,_ZN5aiter44fmoe_stage1_bf16_pertokenFp8_g1u1_32x512_pf2E,0.0%,146.7599,moe_ck2stages_gemm2_256x32x128x256_1x4_TypeCast_v1_Nswizzle0_Quant2_MulRoutedWeight1_F8_F8_B16,2.8%,412.7847,0
256,128,7168,512,256,8,ActivationType.Silu,torch.bfloat16,torch.float8_e4m3fn,torch.float8_e4m3fn,QuantType.per_Token,1,0,32,0,306.4239,_ZN5aiter44fmoe_stage1_bf16_pertokenFp8_g1u1_32x512_pf2E,0.0%,166.6554,moe_ck2stages_gemm2_256x32x128x256_1x4_TypeCast_v1_Nswizzle0_Quant2_MulRoutedWeight1_F8_F8_B16,2.8%,473.0793,0
256,256,7168,512,256,8,ActivationType.Silu,torch.bfloat16,torch.float8_e4m3fn,torch.float8_e4m3fn,QuantType.per_Token,1,0,32,0,304.5903,_ZN5aiter44fmoe_stage1_bf16_pertokenFp8_g1u1_32x512_pf2E,0.0%,178.5369,moe_ck2stages_gemm2_256x32x128x256_1x4_TypeCast_v1_Nswizzle0_Quant2_MulRoutedWeight1_F8_F8_B16,2.8%,483.1272,0
256,512,7168,512,256,8,ActivationType.Silu,torch.bfloat16,torch.float8_e4m3fn,torch.float8_e4m3fn,QuantType.per_Token,1,0,32,0,495.4042,_ZN5aiter45fmoe_bf16_pertokenFp8_g1u1_silu_1tg_ps_32x512E,0.0%,0.0,nan,0,495.4042,1
256,1024,7168,512,256,8,ActivationType.Silu,torch.bfloat16,torch.float8_e4m3fn,torch.float8_e4m3fn,QuantType.per_Token,1,0,32,0,333.1281,_ZN5aiter47fmoe_stage1_bf16_pertokenFp8_g1u1_32x64_4tg_pf2E,0.0%,249.1231,moe_ck2stages_gemm2_256x32x128x256_1x4_TypeCast_v1_Nswizzle0_Quant2_MulRoutedWeight1_F8_F8_B16,2.8%,582.2512,0
256,16,7168,512,256,8,ActivationType.Silu,torch.bfloat16,torch.float8_e4m3fn,torch.float8_e4m3fn,QuantType.per_Token,1,1,32,0,130.2529,_ZN5aiter57fmoe_stage1_bf16_pertokenFp8_doweight_g1u1_32x256_2tg_pf3E,0.0%,74.4948,moe_ck2stages_gemm2_256x32x128x256_1x4_TypeCast_v1_Nswizzle0_Quant2_MulRoutedWeight0_F8_F8_B16,0.0%,204.7477,0
256,32,7168,512,256,8,ActivationType.Silu,torch.bfloat16,torch.float8_e4m3fn,torch.float8_e4m3fn,QuantType.per_Token,1,1,32,0,195.8963,_ZN5aiter53fmoe_stage1_bf16_pertokenFp8_doweight_g1u1_32x512_pf3E,0.0%,103.7824,moe_ck2stages_gemm2_256x32x128x256_1x4_TypeCast_v1_Nswizzle0_Quant2_MulRoutedWeight0_F8_F8_B16,0.0%,299.6787,0
256,64,7168,512,256,8,ActivationType.Silu,torch.bfloat16,torch.float8_e4m3fn,torch.float8_e4m3fn,QuantType.per_Token,1,1,32,0,265.4483,_ZN5aiter53fmoe_stage1_bf16_pertokenFp8_doweight_g1u1_32x512_pf2E,0.0%,142.3836,moe_ck2stages_gemm2_256x32x128x256_1x4_TypeCast_v1_Nswizzle0_Quant2_MulRoutedWeight0_F8_F8_B16,0.0%,407.8319,0
256,128,7168,512,256,8,ActivationType.Silu,torch.bfloat16,torch.float8_e4m3fn,torch.float8_e4m3fn,QuantType.per_Token,1,1,32,0,306.0949,_ZN5aiter53fmoe_stage1_bf16_pertokenFp8_doweight_g1u1_32x512_pf2E,0.0%,166.151,moe_ck2stages_gemm2_256x32x128x256_1x4_TypeCast_v1_Nswizzle0_Quant2_MulRoutedWeight0_F8_F8_B16,0.0%,472.2459,0
256,256,7168,512,256,8,ActivationType.Silu,torch.bfloat16,torch.float8_e4m3fn,torch.float8_e4m3fn,QuantType.per_Token,1,1,32,0,304.4449,_ZN5aiter53fmoe_stage1_bf16_pertokenFp8_doweight_g1u1_32x512_pf2E,0.0%,177.3471,moe_ck2stages_gemm2_256x32x128x256_1x4_TypeCast_v1_Nswizzle0_Quant2_MulRoutedWeight0_F8_F8_B16,0.0%,481.792,0
256,512,7168,512,256,8,ActivationType.Silu,torch.bfloat16,torch.float8_e4m3fn,torch.float8_e4m3fn,QuantType.per_Token,1,1,32,0,306.5738,_ZN5aiter53fmoe_stage1_bf16_pertokenFp8_doweight_g1u1_32x512_pf2E,0.0%,190.3011,moe_ck2stages_gemm2_256x32x128x256_1x4_TypeCast_v1_Nswizzle0_Quant2_MulRoutedWeight0_F8_F8_B16,0.0%,496.8749,0
256,1024,7168,512,256,8,ActivationType.Silu,torch.bfloat16,torch.float8_e4m3fn,torch.float8_e4m3fn,QuantType.per_Token,1,1,32,0,332.9031,_ZN5aiter56fmoe_stage1_bf16_pertokenFp8_doweight_g1u1_32x64_4tg_pf2E,0.0%,245.6419,moe_ck2stages_gemm2_256x32x128x256_1x4_TypeCast_v1_Nswizzle0_Quant2_MulRoutedWeight0_F8_F8_B16,0.0%,578.545,0
256,16,7168,512,256,8,ActivationType.Silu,torch.bfloat16,torch.float8_e4m3fn,torch.float8_e4m3fn,QuantType.per_1x128,1,0,32,0,200.7842,_ZN5aiter47fmoe_bf16_blockscaleFp8_g1u1_vs_silu_1tg_32x256E,0.0%,0.0,nan,0,200.7842,1
256,32,7168,512,256,8,ActivationType.Silu,torch.bfloat16,torch.float8_e4m3fn,torch.float8_e4m3fn,QuantType.per_1x128,1,0,32,0,347.5139,_ZN5aiter47fmoe_bf16_blockscaleFp8_g1u1_vs_silu_1tg_32x256E,0.0%,0.0,nan,0,347.5139,1
256,64,7168,512,256,8,ActivationType.Silu,torch.bfloat16,torch.float8_e4m3fn,torch.float8_e4m3fn,QuantType.per_1x128,1,0,32,0,419.7841,_ZN5aiter47fmoe_bf16_blockscaleFp8_g1u1_vs_silu_1tg_32x256E,0.0%,0.0,nan,0,419.7841,1
256,128,7168,512,256,8,ActivationType.Silu,torch.bfloat16,torch.float8_e4m3fn,torch.float8_e4m3fn,QuantType.per_1x128,1,0,32,0,484.6959,_ZN5aiter49fmoe_bf16_blockscaleFp8_g1u1_novs_silu_1tg_32x256E,0.0%,0.0,nan,0,484.6959,1
256,256,7168,512,256,8,ActivationType.Silu,torch.bfloat16,torch.float8_e4m3fn,torch.float8_e4m3fn,QuantType.per_1x128,1,0,32,0,493.8769,_ZN5aiter50fmoe_bf16_blockscaleFp8_g1u1_vs_silu_1tg_ps_32x256E,0.0%,0.0,nan,0,493.8769,1
256,512,7168,512,256,8,ActivationType.Silu,torch.bfloat16,torch.float8_e4m3fn,torch.float8_e4m3fn,QuantType.per_1x128,1,0,32,0,515.4595,_ZN5aiter49fmoe_bf16_blockscaleFp8_g1u1_novs_silu_1tg_32x256E,0.0%,0.0,nan,0,515.4595,1
256,1024,7168,512,256,8,ActivationType.Silu,torch.bfloat16,torch.float8_e4m3fn,torch.float8_e4m3fn,QuantType.per_1x128,1,0,32,0,658.8246,_ZN5aiter49fmoe_bf16_blockscaleFp8_g1u1_novs_silu_1tg_32x256E,0.0%,0.0,nan,0,658.8246,1
256,16,7168,512,256,8,ActivationType.Silu,torch.bfloat16,torch.float8_e4m3fn,torch.float8_e4m3fn,QuantType.per_1x128,1,1,64,0,148.6843,moe_ck2stages_gemm1_256x64x128x128_1x4_MulABScaleExpertWeightA8W8blkscale_v3_Nswizzle0_Quant4_MulRoutedWeight1_silu_F8_F8_B16,0.1%,100.5581,moe_ck2stages_gemm2_256x64x128x128_1x4_MulABScaleExpertWeightA8W8blkscale_v3_Nswizzle0_Quant4_MulRoutedWeight0_F8_F8_B16,16.8%,249.2424,0
256,32,7168,512,256,8,ActivationType.Silu,torch.bfloat16,torch.float8_e4m3fn,torch.float8_e4m3fn,QuantType.per_1x128,1,1,64,0,222.8071,moe_ck2stages_gemm1_256x64x128x128_1x4_MulABScaleExpertWeightA8W8blkscale_v3_Nswizzle0_Quant4_MulRoutedWeight1_silu_F8_F8_B16,0.1%,142.2981,moe_ck2stages_gemm2_256x64x128x128_1x4_MulABScaleExpertWeightA8W8blkscale_v3_Nswizzle0_Quant4_MulRoutedWeight0_F8_F8_B16,16.8%,365.1052,0
256,64,7168,512,256,8,ActivationType.Silu,torch.bfloat16,torch.float8_e4m3fn,torch.float8_e4m3fn,QuantType.per_1x128,1,1,64,0,298.2406,moe_ck2stages_gemm1_256x64x128x128_1x4_MulABScaleExpertWeightA8W8blkscale_v3_Nswizzle0_Quant4_MulRoutedWeight1_silu_F8_F8_B16,0.1%,195.4571,moe_ck2stages_gemm2_256x64x128x128_1x4_MulABScaleExpertWeightA8W8blkscale_v3_Nswizzle0_Quant4_MulRoutedWeight0_F8_F8_B16,16.7%,493.6977,0
256,128,7168,512,256,8,ActivationType.Silu,torch.bfloat16,torch.float8_e4m3fn,torch.float8_e4m3fn,QuantType.per_1x128,1,1,64,0,321.4034,moe_ck2stages_gemm1_256x64x128x128_1x4_MulABScaleExpertWeightA8W8blkscale_v3_Nswizzle0_Quant4_MulRoutedWeight1_silu_F8_F8_B16,0.1%,228.255,moe_ck2stages_gemm2_256x64x128x128_1x4_MulABScaleExpertWeightA8W8blkscale_v3_Nswizzle0_Quant4_MulRoutedWeight0_F8_F8_B16,16.7%,549.6584,0
256,256,7168,512,256,8,ActivationType.Silu,torch.bfloat16,torch.float8_e4m3fn,torch.float8_e4m3fn,QuantType.per_1x128,1,1,64,0,324.8469,moe_ck2stages_gemm1_256x64x128x128_1x4_MulABScaleExpertWeightA8W8blkscale_v3_Nswizzle0_Quant4_MulRoutedWeight1_silu_F8_F8_B16,0.1%,280.7238,moe_ck2stages_gemm2_256x64x128x128_1x4_MulABScaleExpertWeightA8W8blkscale_v3_Nswizzle0_Quant4_MulRoutedWeight0_F8_F8_B16,16.7%,605.5707,0
256,512,7168,512,256,8,ActivationType.Silu,torch.bfloat16,torch.float8_e4m3fn,torch.float8_e4m3fn,QuantType.per_1x128,1,1,64,0,333.9897,moe_ck2stages_gemm1_256x64x128x128_1x4_MulABScaleExpertWeightA8W8blkscale_v3_Nswizzle0_Quant4_MulRoutedWeight1_silu_F8_F8_B16,0.1%,465.2377,moe_ck2stages_gemm2_256x64x128x128_1x4_MulABScaleExpertWeightA8W8blkscale_v3_Nswizzle0_Quant4_MulRoutedWeight0_F8_F8_B16,16.7%,799.2274,0
256,1024,7168,512,256,8,ActivationType.Silu,torch.bfloat16,torch.float8_e4m3fn,torch.float8_e4m3fn,QuantType.per_1x128,1,1,64,0,342.1698,moe_ck2stages_gemm1_256x64x128x128_1x4_MulABScaleExpertWeightA8W8blkscale_v3_Nswizzle0_Quant4_MulRoutedWeight1_silu_F8_F8_B16,0.1%,842.7534,moe_ck2stages_gemm2_256x64x128x128_1x4_MulABScaleExpertWeightA8W8blkscale_v3_Nswizzle0_Quant4_MulRoutedWeight0_F8_F8_B16,16.7%,1184.9232000000002,0
256,16,4096,192,128,8,ActivationType.Silu,torch.bfloat16,torch.bfloat16,torch.bfloat16,QuantType.No,1,0,128,0,56.9564,moe_ck2stages_gemm1_256x128x64x64_1x4_TypeCast_v1_Nswizzle0_Quant0_MulRoutedWeight0_silu_B16_B16_B16,0.0%,51.8748,moe_ck2stages_gemm2_256x128x128x64_1x4_TypeCast_v3_Nswizzle0_Quant0_MulRoutedWeight1_B16_B16_B16,0.1%,108.8312,0
256,32,4096,192,128,8,ActivationType.Silu,torch.bfloat16,torch.bfloat16,torch.bfloat16,QuantType.No,1,0,128,0,72.4346,moe_ck2stages_gemm1_256x128x64x64_1x4_TypeCast_v1_Nswizzle0_Quant0_MulRoutedWeight0_silu_B16_B16_B16,0.0%,61.6823,moe_ck2stages_gemm2_256x128x128x64_1x4_TypeCast_v3_Nswizzle0_Quant0_MulRoutedWeight1_B16_B16_B16,0.1%,134.1169,0
256,64,4096,192,128,8,ActivationType.Silu,torch.bfloat16,torch.bfloat16,torch.bfloat16,QuantType.No,1,0,128,0,77.8336,moe_ck2stages_gemm1_256x128x64x64_1x4_TypeCast_v1_Nswizzle0_Quant0_MulRoutedWeight0_silu_B16_B16_B16,0.0%,69.7794,moe_ck2stages_gemm2_256x128x128x64_1x4_TypeCast_v3_Nswizzle0_Quant0_MulRoutedWeight1_B16_B16_B16,0.1%,147.613,0
256,128,4096,192,128,8,ActivationType.Silu,torch.bfloat16,torch.bfloat16,torch.bfloat16,QuantType.No,1,0,128,0,79.4488,moe_ck2stages_gemm1_256x128x64x64_1x4_TypeCast_v1_Nswizzle0_Quant0_MulRoutedWeight0_silu_B16_B16_B16,0.0%,73.0762,moe_ck2stages_gemm2_256x128x128x64_1x4_TypeCast_v3_Nswizzle0_Quant0_MulRoutedWeight1_B16_B16_B16,0.1%,152.525,0
256,256,4096,192,128,8,ActivationType.Silu,torch.bfloat16,torch.bfloat16,torch.bfloat16,QuantType.No,1,0,128,0,79.712,moe_ck2stages_gemm1_256x128x64x64_1x4_TypeCast_v1_Nswizzle0_Quant0_MulRoutedWeight0_silu_B16_B16_B16,0.0%,78.3164,moe_ck2stages_gemm2_256x128x128x64_1x4_TypeCast_v1_Nswizzle0_Quant0_MulRoutedWeight1_B16_B16_B16,0.1%,158.0284,0
256,512,4096,192,128,8,ActivationType.Silu,torch.bfloat16,torch.bfloat16,torch.bfloat16,QuantType.No,1,0,128,0,82.3069,moe_ck2stages_gemm1_256x128x64x64_1x4_TypeCast_v1_Nswizzle0_Quant0_MulRoutedWeight0_silu_B16_B16_B16,0.0%,89.8244,moe_ck2stages_gemm2_256x128x128x64_1x4_TypeCast_v3_Nswizzle0_Quant0_MulRoutedWeight1_B16_B16_B16,0.1%,172.1313,0
256,1024,4096,192,128,8,ActivationType.Silu,torch.bfloat16,torch.bfloat16,torch.bfloat16,QuantType.No,1,0,128,0,87.3878,moe_ck2stages_gemm1_256x128x64x64_1x4_TypeCast_v1_Nswizzle0_Quant0_MulRoutedWeight0_silu_B16_B16_B16,0.0%,127.8405,moe_ck2stages_gemm2_256x128x128x64_1x4_TypeCast_v1_Nswizzle0_Quant0_MulRoutedWeight1_B16_B16_B16,0.1%,215.2283,0
256,16,4096,192,128,8,ActivationType.Silu,torch.bfloat16,torch.bfloat16,torch.bfloat16,QuantType.No,1,1,128,0,57.6288,moe_ck2stages_gemm1_256x128x64x64_1x4_TypeCast_v1_Nswizzle0_Quant0_MulRoutedWeight1_silu_B16_B16_B16,0.0%,48.632,moe_ck2stages_gemm2_256x128x128x64_1x4_TypeCast_v3_Nswizzle0_Quant0_MulRoutedWeight0_B16_B16_B16,0.0%,106.2608,0
256,32,4096,192,128,8,ActivationType.Silu,torch.bfloat16,torch.bfloat16,torch.bfloat16,QuantType.No,1,1,128,0,73.5884,moe_ck2stages_gemm1_256x128x64x64_1x4_TypeCast_v1_Nswizzle0_Quant0_MulRoutedWeight1_silu_B16_B16_B16,0.0%,57.5932,moe_ck2stages_gemm2_256x128x128x64_1x4_TypeCast_v1_Nswizzle0_Quant0_MulRoutedWeight0_B16_B16_B16,0.0%,131.1816,0
256,64,4096,192,128,8,ActivationType.Silu,torch.bfloat16,torch.bfloat16,torch.bfloat16,QuantType.No,1,1,128,0,78.3268,moe_ck2stages_gemm1_256x128x64x64_1x4_TypeCast_v1_Nswizzle0_Quant0_MulRoutedWeight1_silu_B16_B16_B16,0.0%,65.9747,moe_ck2stages_gemm2_256x128x128x64_1x4_TypeCast_v1_Nswizzle0_Quant0_MulRoutedWeight0_B16_B16_B16,0.0%,144.3015,0
256,128,4096,192,128,8,ActivationType.Silu,torch.bfloat16,torch.bfloat16,torch.bfloat16,QuantType.No,1,1,128,0,79.5325,moe_ck2stages_gemm1_256x128x64x64_1x4_TypeCast_v1_Nswizzle0_Quant0_MulRoutedWeight1_silu_B16_B16_B16,0.0%,69.0718,moe_ck2stages_gemm2_256x128x128x64_1x4_TypeCast_v1_Nswizzle0_Quant0_MulRoutedWeight0_B16_B16_B16,0.0%,148.6043,0
256,256,4096,192,128,8,ActivationType.Silu,torch.bfloat16,torch.bfloat16,torch.bfloat16,QuantType.No,1,1,128,0,80.296,moe_ck2stages_gemm1_256x128x64x64_1x4_TypeCast_v1_Nswizzle0_Quant0_MulRoutedWeight1_silu_B16_B16_B16,0.0%,73.3562,moe_ck2stages_gemm2_256x128x128x64_1x4_TypeCast_v1_Nswizzle0_Quant0_MulRoutedWeight0_B16_B16_B16,0.0%,153.6522,0
256,512,4096,192,128,8,ActivationType.Silu,torch.bfloat16,torch.bfloat16,torch.bfloat16,QuantType.No,1,1,128,0,83.1443,moe_ck2stages_gemm1_256x128x64x64_1x4_TypeCast_v1_Nswizzle0_Quant0_MulRoutedWeight1_silu_B16_B16_B16,0.0%,85.1355,moe_ck2stages_gemm2_256x128x128x64_1x4_TypeCast_v1_Nswizzle0_Quant0_MulRoutedWeight0_B16_B16_B16,0.0%,168.2798,0
256,1024,4096,192,128,8,ActivationType.Silu,torch.bfloat16,torch.bfloat16,torch.bfloat16,QuantType.No,1,1,128,0,88.1731,moe_ck2stages_gemm1_256x128x64x64_1x4_TypeCast_v1_Nswizzle0_Quant0_MulRoutedWeight1_silu_B16_B16_B16,0.0%,125.4523,moe_ck2stages_gemm2_256x128x128x64_1x4_TypeCast_v3_Nswizzle0_Quant0_MulRoutedWeight0_B16_B16_B16,0.0%,213.6254,0
256,16,4096,384,128,8,ActivationType.Silu,torch.bfloat16,torch.bfloat16,torch.bfloat16,QuantType.No,1,0,32,0,89.9773,moe_ck2stages_gemm1_256x32x64x128_1x4_TypeCast_v1_Nswizzle0_Quant0_MulRoutedWeight0_silu_B16_B16_B16,0.0%,50.9117,moe_ck2stages_gemm2_256x32x128x128_1x4_TypeCast_v1_Nswizzle0_Quant0_MulRoutedWeight1_B16_B16_B16,0.3%,140.889,0
256,32,4096,384,128,8,ActivationType.Silu,torch.bfloat16,torch.bfloat16,torch.bfloat16,QuantType.No,1,0,32,0,127.6678,moe_ck2stages_gemm1_256x32x64x128_1x4_TypeCast_v1_Nswizzle0_Quant0_MulRoutedWeight0_silu_B16_B16_B16,0.0%,69.4848,moe_ck2stages_gemm2_256x32x128x128_1x4_TypeCast_v1_Nswizzle0_Quant0_MulRoutedWeight1_B16_B16_B16,0.4%,197.1526,0
256,64,4096,384,128,8,ActivationType.Silu,torch.bfloat16,torch.bfloat16,torch.bfloat16,QuantType.No,1,0,32,0,136.4991,moe_ck2stages_gemm1_256x32x64x128_1x4_TypeCast_v1_Nswizzle0_Quant0_MulRoutedWeight0_silu_B16_B16_B16,0.0%,75.3558,moe_ck2stages_gemm2_256x32x128x128_1x4_TypeCast_v1_Nswizzle0_Quant0_MulRoutedWeight1_B16_B16_B16,0.4%,211.8549,0
256,128,4096,384,128,8,ActivationType.Silu,torch.bfloat16,torch.bfloat16,torch.bfloat16,QuantType.No,1,0,32,0,139.0821,moe_ck2stages_gemm1_256x32x64x128_1x4_TypeCast_v1_Nswizzle0_Quant0_MulRoutedWeight0_silu_B16_B16_B16,0.0%,77.5844,moe_ck2stages_gemm2_256x32x128x128_1x4_TypeCast_v1_Nswizzle0_Quant0_MulRoutedWeight1_B16_B16_B16,0.4%,216.6665,0
256,256,4096,384,128,8,ActivationType.Silu,torch.bfloat16,torch.bfloat16,torch.bfloat16,QuantType.No,1,0,32,0,141.1941,moe_ck2stages_gemm1_256x32x64x128_1x4_TypeCast_v1_Nswizzle0_Quant0_MulRoutedWeight0_silu_B16_B16_B16,0.0%,80.8519,moe_ck2stages_gemm2_256x32x128x128_1x4_TypeCast_v1_Nswizzle0_Quant0_MulRoutedWeight1_B16_B16_B16,0.4%,222.046,0
256,512,4096,384,128,8,ActivationType.Silu,torch.bfloat16,torch.bfloat16,torch.bfloat16,QuantType.No,1,0,64,0,144.5293,moe_ck2stages_gemm1_256x64x64x64_1x4_TypeCast_v1_Nswizzle0_Quant0_MulRoutedWeight0_silu_B16_B16_B16,0.0%,104.6954,moe_ck2stages_gemm2_256x64x128x128_1x4_TypeCast_v1_Nswizzle0_Quant0_MulRoutedWeight1_B16_B16_B16,0.4%,249.2247,0
256,1024,4096,384,128,8,ActivationType.Silu,torch.bfloat16,torch.bfloat16,torch.bfloat16,QuantType.No,1,0,128,0,169.6864,moe_ck2stages_gemm1_256x128x64x64_1x4_TypeCast_v1_Nswizzle0_Quant0_MulRoutedWeight0_silu_B16_B16_B16,0.0%,153.1648,moe_ck2stages_gemm2_256x128x128x64_1x4_TypeCast_v3_Nswizzle0_Quant0_MulRoutedWeight1_B16_B16_B16,0.4%,322.8512,0
256,16,4096,384,128,8,ActivationType.Silu,torch.bfloat16,torch.bfloat16,torch.bfloat16,QuantType.No,1,1,32,0,90.339,moe_ck2stages_gemm1_256x32x64x128_1x4_TypeCast_v1_Nswizzle0_Quant0_MulRoutedWeight1_silu_B16_B16_B16,0.0%,50.8203,moe_ck2stages_gemm2_256x32x128x128_1x4_TypeCast_v1_Nswizzle0_Quant0_MulRoutedWeight0_B16_B16_B16,0.0%,141.1593,0
256,32,4096,384,128,8,ActivationType.Silu,torch.bfloat16,torch.bfloat16,torch.bfloat16,QuantType.No,1,1,32,0,127.4505,moe_ck2stages_gemm1_256x32x64x128_1x4_TypeCast_v1_Nswizzle0_Quant0_MulRoutedWeight1_silu_B16_B16_B16,0.0%,69.9278,moe_ck2stages_gemm2_256x32x128x128_1x4_TypeCast_v1_Nswizzle0_Quant0_MulRoutedWeight0_B16_B16_B16,0.0%,197.3783,0
256,64,4096,384,128,8,ActivationType.Silu,torch.bfloat16,torch.bfloat16,torch.bfloat16,QuantType.No,1,1,32,0,136.5934,moe_ck2stages_gemm1_256x32x64x128_1x4_TypeCast_v1_Nswizzle0_Quant0_MulRoutedWeight1_silu_B16_B16_B16,0.0%,76.0763,moe_ck2stages_gemm2_256x32x128x128_1x4_TypeCast_v1_Nswizzle0_Quant0_MulRoutedWeight0_B16_B16_B16,0.0%,212.6697,0
256,128,4096,384,128,8,ActivationType.Silu,torch.bfloat16,torch.bfloat16,torch.bfloat16,QuantType.No,1,1,32,0,138.5011,moe_ck2stages_gemm1_256x32x64x128_1x4_TypeCast_v1_Nswizzle0_Quant0_MulRoutedWeight1_silu_B16_B16_B16,0.0%,78.0269,moe_ck2stages_gemm2_256x32x128x128_1x4_TypeCast_v1_Nswizzle0_Quant0_MulRoutedWeight0_B16_B16_B16,0.0%,216.528,0
256,256,4096,384,128,8,ActivationType.Silu,torch.bfloat16,torch.bfloat16,torch.bfloat16,QuantType.No,1,1,32,0,140.488,moe_ck2stages_gemm1_256x32x64x128_1x4_TypeCast_v1_Nswizzle0_Quant0_MulRoutedWeight1_silu_B16_B16_B16,0.0%,80.8556,moe_ck2stages_gemm2_256x32x128x128_1x4_TypeCast_v1_Nswizzle0_Quant0_MulRoutedWeight0_B16_B16_B16,0.0%,221.3436,0
256,512,4096,384,128,8,ActivationType.Silu,torch.bfloat16,torch.bfloat16,torch.bfloat16,QuantType.No,1,1,64,0,144.855,moe_ck2stages_gemm1_256x64x64x64_1x4_TypeCast_v1_Nswizzle0_Quant0_MulRoutedWeight1_silu_B16_B16_B16,0.0%,97.8569,moe_ck2stages_gemm2_256x64x128x128_1x4_TypeCast_v1_Nswizzle0_Quant0_MulRoutedWeight0_B16_B16_B16,0.0%,242.7119,0
256,1024,4096,384,128,8,ActivationType.Silu,torch.bfloat16,torch.bfloat16,torch.bfloat16,QuantType.No,1,1,128,0,171.8959,moe_ck2stages_gemm1_256x128x64x64_1x4_TypeCast_v1_Nswizzle0_Quant0_MulRoutedWeight1_silu_B16_B16_B16,0.0%,144.4775,moe_ck2stages_gemm2_256x128x128x64_1x4_TypeCast_v3_Nswizzle0_Quant0_MulRoutedWeight0_B16_B16_B16,0.0%,316.3734,0
256,16,4096,384,128,8,ActivationType.Silu,torch.bfloat16,torch.float8_e4m3fn,torch.float8_e4m3fn,QuantType.per_Tensor,1,0,128,0,50.9507,moe_ck2stages_gemm1_256x128x64x128_1x4_TypeCast_v1_Nswizzle0_Quant1_MulRoutedWeight0_silu_F8_F8_B16,0.0%,42.2681,moe_ck2stages_gemm2_256x128x128x128_1x4_TypeCast_v3_Nswizzle0_Quant1_MulRoutedWeight1_F8_F8_B16,0.4%,93.2188,0
256,32,4096,384,128,8,ActivationType.Silu,torch.bfloat16,torch.float8_e4m3fn,torch.float8_e4m3fn,QuantType.per_Tensor,1,0,128,0,79.6392,moe_ck2stages_gemm1_256x128x64x128_1x4_TypeCast_v1_Nswizzle0_Quant1_MulRoutedWeight0_silu_F8_F8_B16,0.0%,54.2772,moe_ck2stages_gemm2_256x128x128x128_1x4_TypeCast_v3_Nswizzle0_Quant1_MulRoutedWeight1_F8_F8_B16,0.4%,133.9164,0
256,64,4096,384,128,8,ActivationType.Silu,torch.bfloat16,torch.float8_e4m3fn,torch.float8_e4m3fn,QuantType.per_Tensor,1,0,128,0,83.5661,moe_ck2stages_gemm1_256x128x64x128_1x4_TypeCast_v1_Nswizzle0_Quant1_MulRoutedWeight0_silu_F8_F8_B16,0.0%,60.2323,moe_ck2stages_gemm2_256x128x128x128_1x4_TypeCast_v3_Nswizzle0_Quant1_MulRoutedWeight1_F8_F8_B16,0.4%,143.79840000000002,0
256,128,4096,384,128,8,ActivationType.Silu,torch.bfloat16,torch.float8_e4m3fn,torch.float8_e4m3fn,QuantType.per_Tensor,1,0,128,0,84.7796,moe_ck2stages_gemm1_256x128x64x128_1x4_TypeCast_v1_Nswizzle0_Quant1_MulRoutedWeight0_silu_F8_F8_B16,0.0%,61.864,moe_ck2stages_gemm2_256x128x128x128_1x4_TypeCast_v3_Nswizzle0_Quant1_MulRoutedWeight1_F8_F8_B16,0.4%,146.6436,0
256,256,4096,384,128,8,ActivationType.Silu,torch.bfloat16,torch.float8_e4m3fn,torch.float8_e4m3fn,QuantType.per_Tensor,1,0,128,0,85.0781,moe_ck2stages_gemm1_256x128x64x128_1x4_TypeCast_v1_Nswizzle0_Quant1_MulRoutedWeight0_silu_F8_F8_B16,0.0%,66.2997,moe_ck2stages_gemm2_256x128x128x128_1x4_TypeCast_v3_Nswizzle0_Quant1_MulRoutedWeight1_F8_F8_B16,0.4%,151.3778,0
256,512,4096,384,128,8,ActivationType.Silu,torch.bfloat16,torch.float8_e4m3fn,torch.float8_e4m3fn,QuantType.per_Tensor,1,0,128,0,87.3865,moe_ck2stages_gemm1_256x128x64x128_1x4_TypeCast_v1_Nswizzle0_Quant1_MulRoutedWeight0_silu_F8_F8_B16,0.0%,82.0796,moe_ck2stages_gemm2_256x128x128x128_1x4_TypeCast_v3_Nswizzle0_Quant1_MulRoutedWeight1_F8_F8_B16,0.4%,169.46609999999998,0
256,1024,4096,384,128,8,ActivationType.Silu,torch.bfloat16,torch.float8_e4m3fn,torch.float8_e4m3fn,QuantType.per_Tensor,1,0,128,0,92.393,moe_ck2stages_gemm1_256x128x64x128_1x4_TypeCast_v1_Nswizzle0_Quant1_MulRoutedWeight0_silu_F8_F8_B16,0.0%,125.505,moe_ck2stages_gemm2_256x128x128x128_1x4_TypeCast_v1_Nswizzle0_Quant1_MulRoutedWeight1_F8_F8_B16,0.4%,217.898,0
256,16,4096,384,128,8,ActivationType.Silu,torch.bfloat16,torch.float8_e4m3fn,torch.float8_e4m3fn,QuantType.per_Tensor,1,1,128,0,51.387,moe_ck2stages_gemm1_256x128x64x128_1x4_TypeCast_v1_Nswizzle0_Quant1_MulRoutedWeight1_silu_F8_F8_B16,0.0%,41.0638,moe_ck2stages_gemm2_256x128x128x128_1x4_TypeCast_v3_Nswizzle0_Quant1_MulRoutedWeight0_F8_F8_B16,0.0%,92.4508,0
256,32,4096,384,128,8,ActivationType.Silu,torch.bfloat16,torch.float8_e4m3fn,torch.float8_e4m3fn,QuantType.per_Tensor,1,1,128,0,81.0339,moe_ck2stages_gemm1_256x128x64x128_1x4_TypeCast_v1_Nswizzle0_Quant1_MulRoutedWeight1_silu_F8_F8_B16,0.0%,51.9652,moe_ck2stages_gemm2_256x128x128x128_1x4_TypeCast_v3_Nswizzle0_Quant1_MulRoutedWeight0_F8_F8_B16,0.0%,132.9991,0
256,64,4096,384,128,8,ActivationType.Silu,torch.bfloat16,torch.float8_e4m3fn,torch.float8_e4m3fn,QuantType.per_Tensor,1,1,128,0,84.9852,moe_ck2stages_gemm1_256x128x64x128_1x4_TypeCast_v1_Nswizzle0_Quant1_MulRoutedWeight1_silu_F8_F8_B16,0.0%,57.2253,moe_ck2stages_gemm2_256x128x128x128_1x4_TypeCast_v3_Nswizzle0_Quant1_MulRoutedWeight0_F8_F8_B16,0.0%,142.2105,0
256,128,4096,384,128,8,ActivationType.Silu,torch.bfloat16,torch.float8_e4m3fn,torch.float8_e4m3fn,QuantType.per_Tensor,1,1,128,0,86.5581,moe_ck2stages_gemm1_256x128x64x128_1x4_TypeCast_v1_Nswizzle0_Quant1_MulRoutedWeight1_silu_F8_F8_B16,0.0%,59.0823,moe_ck2stages_gemm2_256x128x128x128_1x4_TypeCast_v3_Nswizzle0_Quant1_MulRoutedWeight0_F8_F8_B16,0.0%,145.6404,0
256,256,4096,384,128,8,ActivationType.Silu,torch.bfloat16,torch.float8_e4m3fn,torch.float8_e4m3fn,QuantType.per_Tensor,1,1,128,0,86.6075,moe_ck2stages_gemm1_256x128x64x128_1x4_TypeCast_v1_Nswizzle0_Quant1_MulRoutedWeight1_silu_F8_F8_B16,0.0%,64.6415,moe_ck2stages_gemm2_256x128x128x128_1x4_TypeCast_v3_Nswizzle0_Quant1_MulRoutedWeight0_F8_F8_B16,0.0%,151.249,0
256,512,4096,384,128,8,ActivationType.Silu,torch.bfloat16,torch.float8_e4m3fn,torch.float8_e4m3fn,QuantType.per_Tensor,1,1,128,0,91.2218,moe_ck2stages_gemm1_256x128x64x128_1x4_TypeCast_v1_Nswizzle0_Quant1_MulRoutedWeight1_silu_F8_F8_B16,0.0%,82.8771,moe_ck2stages_gemm2_256x128x128x128_1x4_TypeCast_v3_Nswizzle0_Quant1_MulRoutedWeight0_F8_F8_B16,0.0%,174.0989,0
256,1024,4096,384,128,8,ActivationType.Silu,torch.bfloat16,torch.float8_e4m3fn,torch.float8_e4m3fn,QuantType.per_Tensor,1,1,128,0,93.6859,moe_ck2stages_gemm1_256x128x64x128_1x4_TypeCast_v1_Nswizzle0_Quant1_MulRoutedWeight1_silu_F8_F8_B16,0.0%,125.2007,moe_ck2stages_gemm2_256x128x128x128_1x4_TypeCast_v3_Nswizzle0_Quant1_MulRoutedWeight0_F8_F8_B16,0.0%,218.8866,0
256,16,4096,384,128,8,ActivationType.Silu,torch.bfloat16,torch.float8_e4m3fn,torch.float8_e4m3fn,QuantType.per_Token,1,0,32,0,78.332,_ZN5aiter42fmoe_bf16_pertokenFp8_g1u1_silu_1tg_32x128E,0.0%,0.0,nan,0,78.332,1
256,32,4096,384,128,8,ActivationType.Silu,torch.bfloat16,torch.float8_e4m3fn,torch.float8_e4m3fn,QuantType.per_Token,1,0,32,0,104.4301,_ZN5aiter42fmoe_bf16_pertokenFp8_g1u1_silu_1tg_32x192E,0.0%,0.0,nan,0,104.4301,1
256,64,4096,384,128,8,ActivationType.Silu,torch.bfloat16,torch.float8_e4m3fn,torch.float8_e4m3fn,QuantType.per_Token,1,0,32,0,115.4337,_ZN5aiter42fmoe_bf16_pertokenFp8_g1u1_silu_1tg_32x192E,0.0%,0.0,nan,0,115.4337,1
256,128,4096,384,128,8,ActivationType.Silu,torch.bfloat16,torch.float8_e4m3fn,torch.float8_e4m3fn,QuantType.per_Token,1,0,32,0,117.2174,_ZN5aiter42fmoe_bf16_pertokenFp8_g1u1_silu_1tg_32x192E,0.0%,0.0,nan,0,117.2174,1
256,256,4096,384,128,8,ActivationType.Silu,torch.bfloat16,torch.float8_e4m3fn,torch.float8_e4m3fn,QuantType.per_Token,1,0,32,0,119.8616,_ZN5aiter42fmoe_bf16_pertokenFp8_g1u1_silu_1tg_32x192E,0.0%,0.0,nan,0,119.8616,1
256,512,4096,384,128,8,ActivationType.Silu,torch.bfloat16,torch.float8_e4m3fn,torch.float8_e4m3fn,QuantType.per_Token,1,0,32,0,146.9528,_ZN5aiter42fmoe_bf16_pertokenFp8_g1u1_silu_1tg_32x384E,0.0%,0.0,nan,0,146.9528,1
256,1024,4096,384,128,8,ActivationType.Silu,torch.bfloat16,torch.float8_e4m3fn,torch.float8_e4m3fn,QuantType.per_Token,1,0,128,0,91.8397,_ZN5aiter45fmoe_stage1_bf16_pertokenFp8_g1u1_128x128_pf3E,0.0%,159.1852,moe_ck2stages_gemm2_256x128x128x128_1x4_TypeCast_v3_Nswizzle0_Quant2_MulRoutedWeight1_F8_F8_B16,0.4%,251.0249,0
256,16,4096,384,128,8,ActivationType.Silu,torch.bfloat16,torch.float8_e4m3fn,torch.float8_e4m3fn,QuantType.per_Token,1,1,128,0,49.7186,_ZN5aiter54fmoe_stage1_bf16_pertokenFp8_doweight_g1u1_128x128_pf3E,0.0%,64.1778,moe_ck2stages_gemm2_256x128x128x128_1x4_TypeCast_v3_Nswizzle0_Quant2_MulRoutedWeight0_F8_F8_B16,0.0%,113.8964,0
256,32,4096,384,128,8,ActivationType.Silu,torch.bfloat16,torch.float8_e4m3fn,torch.float8_e4m3fn,QuantType.per_Token,1,1,128,0,80.6595,_ZN5aiter53fmoe_stage1_bf16_pertokenFp8_doweight_g1u1_128x64_pf3E,0.0%,84.4366,moe_ck2stages_gemm2_256x128x128x128_1x4_TypeCast_v3_Nswizzle0_Quant2_MulRoutedWeight0_F8_F8_B16,0.0%,165.09609999999998,0
256,64,4096,384,128,8,ActivationType.Silu,torch.bfloat16,torch.float8_e4m3fn,torch.float8_e4m3fn,QuantType.per_Token,1,1,128,0,83.8169,_ZN5aiter53fmoe_stage1_bf16_pertokenFp8_doweight_g1u1_128x64_pf3E,0.0%,88.246,moe_ck2stages_gemm2_256x128x128x128_1x4_TypeCast_v3_Nswizzle0_Quant2_MulRoutedWeight0_F8_F8_B16,0.0%,172.0629,0
256,128,4096,384,128,8,ActivationType.Silu,torch.bfloat16,torch.float8_e4m3fn,torch.float8_e4m3fn,QuantType.per_Token,1,1,128,0,86.7298,_ZN5aiter54fmoe_stage1_bf16_pertokenFp8_doweight_g1u1_128x128_pf3E,0.0%,90.677,moe_ck2stages_gemm2_256x128x128x128_1x4_TypeCast_v3_Nswizzle0_Quant2_MulRoutedWeight0_F8_F8_B16,0.0%,177.4068,0
256,256,4096,384,128,8,ActivationType.Silu,torch.bfloat16,torch.float8_e4m3fn,torch.float8_e4m3fn,QuantType.per_Token,1,1,128,0,86.3577,_ZN5aiter53fmoe_stage1_bf16_pertokenFp8_doweight_g1u1_128x64_pf3E,0.0%,95.0934,moe_ck2stages_gemm2_256x128x128x128_1x4_TypeCast_v3_Nswizzle0_Quant2_MulRoutedWeight0_F8_F8_B16,0.0%,181.4511,0
256,512,4096,384,128,8,ActivationType.Silu,torch.bfloat16,torch.float8_e4m3fn,torch.float8_e4m3fn,QuantType.per_Token,1,1,128,0,89.1708,_ZN5aiter53fmoe_stage1_bf16_pertokenFp8_doweight_g1u1_128x64_pf3E,0.0%,112.8318,moe_ck2stages_gemm2_256x128x128x128_1x4_TypeCast_v3_Nswizzle0_Quant2_MulRoutedWeight0_F8_F8_B16,0.0%,202.0026,0
256,1024,4096,384,128,8,ActivationType.Silu,torch.bfloat16,torch.float8_e4m3fn,torch.float8_e4m3fn,QuantType.per_Token,1,1,128,0,92.5497,_ZN5aiter54fmoe_stage1_bf16_pertokenFp8_doweight_g1u1_128x128_pf3E,0.0%,158.3452,moe_ck2stages_gemm2_256x128x128x128_1x4_TypeCast_v1_Nswizzle0_Quant2_MulRoutedWeight0_F8_F8_B16,0.0%,250.8949,0
256,16,4096,384,128,8,ActivationType.Silu,torch.bfloat16,torch.float8_e4m3fn,torch.float8_e4m3fn,QuantType.per_1x128,1,0,64,0,47.3054,_ZN5aiter59fmoe_stage1_bf16_pertokenFp8_blockscale_g1u1_64x128_2tg_pf3E,96.8%,48.4233,moe_ck2stages_gemm2_256x64x128x128_1x4_MulABScaleExpertWeightA8W8blkscale_v3_Nswizzle0_Quant4_MulRoutedWeight1_F8_F8_B16,15.6%,95.7287,0
256,32,4096,384,128,8,ActivationType.Silu,torch.bfloat16,torch.float8_e4m3fn,torch.float8_e4m3fn,QuantType.per_1x128,1,0,64,0,66.3884,_ZN5aiter59fmoe_stage1_bf16_pertokenFp8_blockscale_g1u1_64x128_2tg_pf2E,99.7%,63.0006,moe_ck2stages_gemm2_256x64x128x128_1x4_MulABScaleExpertWeightA8W8blkscale_v3_Nswizzle0_Quant4_MulRoutedWeight1_F8_F8_B16,15.8%,129.389,0
256,64,4096,384,128,8,ActivationType.Silu,torch.bfloat16,torch.float8_e4m3fn,torch.float8_e4m3fn,QuantType.per_1x128,1,0,64,0,71.0848,_ZN5aiter59fmoe_stage1_bf16_pertokenFp8_blockscale_g1u1_64x128_2tg_pf2E,99.7%,69.2402,moe_ck2stages_gemm2_256x64x128x128_1x4_MulABScaleExpertWeightA8W8blkscale_v3_Nswizzle0_Quant4_MulRoutedWeight1_F8_F8_B16,15.6%,140.325,0
256,128,4096,384,128,8,ActivationType.Silu,torch.bfloat16,torch.float8_e4m3fn,torch.float8_e4m3fn,QuantType.per_1x128,1,0,64,0,72.1859,_ZN5aiter59fmoe_stage1_bf16_pertokenFp8_blockscale_g1u1_64x128_2tg_pf2E,99.7%,84.9021,moe_ck2stages_gemm2_256x64x128x128_1x4_MulABScaleExpertWeightA8W8blkscale_v3_Nswizzle0_Quant4_MulRoutedWeight1_F8_F8_B16,15.6%,157.08800000000002,0
256,256,4096,384,128,8,ActivationType.Silu,torch.bfloat16,torch.float8_e4m3fn,torch.float8_e4m3fn,QuantType.per_1x128,1,0,64,0,73.2675,_ZN5aiter59fmoe_stage1_bf16_pertokenFp8_blockscale_g1u1_64x128_2tg_pf2E,99.7%,139.7191,moe_ck2stages_gemm2_256x64x128x128_1x4_MulABScaleExpertWeightA8W8blkscale_v3_Nswizzle0_Quant4_MulRoutedWeight1_F8_F8_B16,15.5%,212.9866,0
256,512,4096,384,128,8,ActivationType.Silu,torch.bfloat16,torch.float8_e4m3fn,torch.float8_e4m3fn,QuantType.per_1x128,1,0,64,0,75.8325,_ZN5aiter59fmoe_stage1_bf16_pertokenFp8_blockscale_g1u1_64x128_2tg_pf2E,99.7%,244.422,moe_ck2stages_gemm2_256x64x128x128_1x4_MulABScaleExpertWeightA8W8blkscale_v3_Nswizzle0_Quant4_MulRoutedWeight1_F8_F8_B16,15.6%,320.2545,0
256,1024,4096,384,128,8,ActivationType.Silu,torch.bfloat16,torch.float8_e4m3fn,torch.float8_e4m3fn,QuantType.per_1x128,1,0,64,0,111.711,_ZN5aiter59fmoe_stage1_bf16_pertokenFp8_blockscale_g1u1_64x128_2tg_pf3E,99.6%,475.0071,moe_ck2stages_gemm2_256x64x128x128_1x4_MulABScaleExpertWeightA8W8blkscale_v3_Nswizzle0_Quant4_MulRoutedWeight1_F8_F8_B16,15.5%,586.7180999999999,0
256,16,4096,384,128,8,ActivationType.Silu,torch.bfloat16,torch.float8_e4m3fn,torch.float8_e4m3fn,QuantType.per_1x128,1,1,64,0,53.5929,moe_ck2stages_gemm1_256x64x128x128_1x4_MulABScaleExpertWeightA8W8blkscale_v3_Nswizzle0_Quant4_MulRoutedWeight1_silu_F8_F8_B16,0.1%,42.6009,moe_ck2stages_gemm2_256x64x128x128_1x4_MulABScaleExpertWeightA8W8blkscale_v3_Nswizzle0_Quant4_MulRoutedWeight0_F8_F8_B16,16.6%,96.1938,0
256,32,4096,384,128,8,ActivationType.Silu,torch.bfloat16,torch.float8_e4m3fn,torch.float8_e4m3fn,QuantType.per_1x128,1,1,64,0,82.0,moe_ck2stages_gemm1_256x64x128x128_1x4_MulABScaleExpertWeightA8W8blkscale_v3_Nswizzle0_Quant4_MulRoutedWeight1_silu_F8_F8_B16,0.1%,55.6798,moe_ck2stages_gemm2_256x64x128x128_1x4_MulABScaleExpertWeightA8W8blkscale_v3_Nswizzle0_Quant4_MulRoutedWeight0_F8_F8_B16,16.8%,137.6798,0
256,64,4096,384,128,8,ActivationType.Silu,torch.bfloat16,torch.float8_e4m3fn,torch.float8_e4m3fn,QuantType.per_1x128,1,1,64,0,86.0827,moe_ck2stages_gemm1_256x64x128x128_1x4_MulABScaleExpertWeightA8W8blkscale_v3_Nswizzle0_Quant4_MulRoutedWeight1_silu_F8_F8_B16,0.1%,61.9589,moe_ck2stages_gemm2_256x64x128x128_1x4_MulABScaleExpertWeightA8W8blkscale_v3_Nswizzle0_Quant4_MulRoutedWeight0_F8_F8_B16,16.7%,148.04160000000002,0
256,128,4096,384,128,8,ActivationType.Silu,torch.bfloat16,torch.float8_e4m3fn,torch.float8_e4m3fn,QuantType.per_1x128,1,1,64,0,87.2379,moe_ck2stages_gemm1_256x64x128x128_1x4_MulABScaleExpertWeightA8W8blkscale_v3_Nswizzle0_Quant4_MulRoutedWeight1_silu_F8_F8_B16,0.1%,79.9875,moe_ck2stages_gemm2_256x64x128x128_1x4_MulABScaleExpertWeightA8W8blkscale_v3_Nswizzle0_Quant4_MulRoutedWeight0_F8_F8_B16,16.8%,167.22539999999998,0
256,256,4096,384,128,8,ActivationType.Silu,torch.bfloat16,torch.float8_e4m3fn,torch.float8_e4m3fn,QuantType.per_1x128,1,1,64,0,89.6396,moe_ck2stages_gemm1_256x64x128x128_1x4_MulABScaleExpertWeightA8W8blkscale_v3_Nswizzle0_Quant4_MulRoutedWeight1_silu_F8_F8_B16,0.1%,135.1774,moe_ck2stages_gemm2_256x64x128x128_1x4_MulABScaleExpertWeightA8W8blkscale_v3_Nswizzle0_Quant4_MulRoutedWeight0_F8_F8_B16,16.7%,224.817,0
256,512,4096,384,128,8,ActivationType.Silu,torch.bfloat16,torch.float8_e4m3fn,torch.float8_e4m3fn,QuantType.per_1x128,1,1,64,0,93.3959,moe_ck2stages_gemm1_256x64x128x128_1x4_MulABScaleExpertWeightA8W8blkscale_v3_Nswizzle0_Quant4_MulRoutedWeight1_silu_F8_F8_B16,0.1%,245.5911,moe_ck2stages_gemm2_256x64x128x128_1x4_MulABScaleExpertWeightA8W8blkscale_v3_Nswizzle0_Quant4_MulRoutedWeight0_F8_F8_B16,16.7%,338.987,0
256,1024,4096,384,128,8,ActivationType.Silu,torch.bfloat16,torch.float8_e4m3fn,torch.float8_e4m3fn,QuantType.per_1x128,1,1,64,0,125.6807,moe_ck2stages_gemm1_256x64x128x128_1x4_MulABScaleExpertWeightA8W8blkscale_v3_Nswizzle0_Quant4_MulRoutedWeight1_silu_F8_F8_B16,0.1%,470.1367,moe_ck2stages_gemm2_256x64x128x128_1x4_MulABScaleExpertWeightA8W8blkscale_v3_Nswizzle0_Quant4_MulRoutedWeight0_F8_F8_B16,16.7%,595.8174,0
256,16,2048,192,128,8,ActivationType.Silu,torch.bfloat16,torch.bfloat16,torch.bfloat16,QuantType.No,1,0,128,0,31.9957,moe_ck2stages_gemm1_256x128x64x64_1x4_TypeCast_v1_Nswizzle0_Quant0_MulRoutedWeight0_silu_B16_B16_B16,0.0%,30.1038,moe_ck2stages_gemm2_256x128x128x64_1x4_TypeCast_v1_Nswizzle0_Quant0_MulRoutedWeight1_B16_B16_B16,0.0%,62.0995,0
256,32,2048,192,128,8,ActivationType.Silu,torch.bfloat16,torch.bfloat16,torch.bfloat16,QuantType.No,1,0,128,0,40.3657,moe_ck2stages_gemm1_256x128x64x64_1x4_TypeCast_v1_Nswizzle0_Quant0_MulRoutedWeight0_silu_B16_B16_B16,0.0%,37.7337,moe_ck2stages_gemm2_256x128x128x64_1x4_TypeCast_v3_Nswizzle0_Quant0_MulRoutedWeight1_B16_B16_B16,0.0%,78.0994,0
256,64,2048,192,128,8,ActivationType.Silu,torch.bfloat16,torch.bfloat16,torch.bfloat16,QuantType.No,1,0,128,0,43.9549,moe_ck2stages_gemm1_256x128x64x64_1x4_TypeCast_v1_Nswizzle0_Quant0_MulRoutedWeight0_silu_B16_B16_B16,0.0%,39.2564,moe_ck2stages_gemm2_256x128x128x64_1x4_TypeCast_v3_Nswizzle0_Quant0_MulRoutedWeight1_B16_B16_B16,0.0%,83.2113,0
256,128,2048,192,128,8,ActivationType.Silu,torch.bfloat16,torch.bfloat16,torch.bfloat16,QuantType.No,1,0,128,0,44.446,moe_ck2stages_gemm1_256x128x64x64_1x4_TypeCast_v1_Nswizzle0_Quant0_MulRoutedWeight0_silu_B16_B16_B16,0.0%,40.9879,moe_ck2stages_gemm2_256x128x128x64_1x4_TypeCast_v3_Nswizzle0_Quant0_MulRoutedWeight1_B16_B16_B16,0.0%,85.4339,0
256,256,2048,192,128,8,ActivationType.Silu,torch.bfloat16,torch.bfloat16,torch.bfloat16,QuantType.No,1,0,128,0,44.6873,moe_ck2stages_gemm1_256x128x64x64_1x4_TypeCast_v1_Nswizzle0_Quant0_MulRoutedWeight0_silu_B16_B16_B16,0.0%,44.981,moe_ck2stages_gemm2_256x128x128x64_1x4_TypeCast_v1_Nswizzle0_Quant0_MulRoutedWeight1_B16_B16_B16,0.0%,89.6683,0
256,512,2048,192,128,8,ActivationType.Silu,torch.bfloat16,torch.bfloat16,torch.bfloat16,QuantType.No,1,0,128,0,46.3556,moe_ck2stages_gemm1_256x128x64x64_1x4_TypeCast_v1_Nswizzle0_Quant0_MulRoutedWeight0_silu_B16_B16_B16,0.0%,55.2946,moe_ck2stages_gemm2_256x128x128x64_1x4_TypeCast_v1_Nswizzle0_Quant0_MulRoutedWeight1_B16_B16_B16,0.0%,101.6502,0
256,1024,2048,192,128,8,ActivationType.Silu,torch.bfloat16,torch.bfloat16,torch.bfloat16,QuantType.No,1,0,128,0,50.6579,moe_ck2stages_gemm1_256x128x64x64_1x4_TypeCast_v1_Nswizzle0_Quant0_MulRoutedWeight0_silu_B16_B16_B16,0.0%,74.879,moe_ck2stages_gemm2_256x128x128x64_1x4_TypeCast_v1_Nswizzle0_Quant0_MulRoutedWeight1_B16_B16_B16,0.0%,125.5369,0
256,16,2048,192,128,8,ActivationType.Silu,torch.bfloat16,torch.bfloat16,torch.bfloat16,QuantType.No,1,1,128,0,32.5775,moe_ck2stages_gemm1_256x128x64x64_1x4_TypeCast_v1_Nswizzle0_Quant0_MulRoutedWeight1_silu_B16_B16_B16,0.0%,28.6034,moe_ck2stages_gemm2_256x128x128x64_1x4_TypeCast_v1_Nswizzle0_Quant0_MulRoutedWeight0_B16_B16_B16,0.0%,61.1809,0
256,32,2048,192,128,8,ActivationType.Silu,torch.bfloat16,torch.bfloat16,torch.bfloat16,QuantType.No,1,1,128,0,40.6161,moe_ck2stages_gemm1_256x128x64x64_1x4_TypeCast_v1_Nswizzle0_Quant0_MulRoutedWeight1_silu_B16_B16_B16,0.0%,35.9052,moe_ck2stages_gemm2_256x128x128x64_1x4_TypeCast_v1_Nswizzle0_Quant0_MulRoutedWeight0_B16_B16_B16,0.0%,76.5213,0
256,64,2048,192,128,8,ActivationType.Silu,torch.bfloat16,torch.bfloat16,torch.bfloat16,QuantType.No,1,1,128,0,44.6324,moe_ck2stages_gemm1_256x128x64x64_1x4_TypeCast_v1_Nswizzle0_Quant0_MulRoutedWeight1_silu_B16_B16_B16,0.0%,37.0365,moe_ck2stages_gemm2_256x128x128x64_1x4_TypeCast_v1_Nswizzle0_Quant0_MulRoutedWeight0_B16_B16_B16,0.0%,81.6689,0
256,128,2048,192,128,8,ActivationType.Silu,torch.bfloat16,torch.bfloat16,torch.bfloat16,QuantType.No,1,1,128,0,45.1276,moe_ck2stages_gemm1_256x128x64x64_1x4_TypeCast_v1_Nswizzle0_Quant0_MulRoutedWeight1_silu_B16_B16_B16,0.0%,38.8944,moe_ck2stages_gemm2_256x128x128x64_1x4_TypeCast_v3_Nswizzle0_Quant0_MulRoutedWeight0_B16_B16_B16,0.0%,84.02199999999999,0
256,256,2048,192,128,8,ActivationType.Silu,torch.bfloat16,torch.bfloat16,torch.bfloat16,QuantType.No,1,1,128,0,45.3314,moe_ck2stages_gemm1_256x128x64x64_1x4_TypeCast_v1_Nswizzle0_Quant0_MulRoutedWeight1_silu_B16_B16_B16,0.0%,42.1258,moe_ck2stages_gemm2_256x128x128x64_1x4_TypeCast_v3_Nswizzle0_Quant0_MulRoutedWeight0_B16_B16_B16,0.0%,87.4572,0
256,512,2048,192,128,8,ActivationType.Silu,torch.bfloat16,torch.bfloat16,torch.bfloat16,QuantType.No,1,1,128,0,46.9968,moe_ck2stages_gemm1_256x128x64x64_1x4_TypeCast_v1_Nswizzle0_Quant0_MulRoutedWeight1_silu_B16_B16_B16,0.0%,51.8059,moe_ck2stages_gemm2_256x128x128x64_1x4_TypeCast_v1_Nswizzle0_Quant0_MulRoutedWeight0_B16_B16_B16,0.0%,98.8027,0
256,1024,2048,192,128,8,ActivationType.Silu,torch.bfloat16,torch.bfloat16,torch.bfloat16,QuantType.No,1,1,128,0,50.6815,moe_ck2stages_gemm1_256x128x64x64_1x4_TypeCast_v1_Nswizzle0_Quant0_MulRoutedWeight1_silu_B16_B16_B16,0.0%,72.1097,moe_ck2stages_gemm2_256x128x128x64_1x4_TypeCast_v3_Nswizzle0_Quant0_MulRoutedWeight0_B16_B16_B16,0.0%,122.7912,0
256,32,7168,256,256,8,ActivationType.Silu,torch.bfloat16,torch.float8_e4m3fn,torch.float8_e4m3fn,QuantType.per_Token,1,1,32,0,100.2236,_ZN5aiter56fmoe_stage1_bf16_pertokenFp8_doweight_g1u1_32x64_4tg_pf2E,0.0%,60.6688,moe_ck2stages_gemm2_256x32x128x256_1x4_TypeCast_v1_Nswizzle0_Quant2_MulRoutedWeight0_F8_F8_B16,0.0%,160.8924,0
256,64,7168,256,256,8,ActivationType.Silu,torch.bfloat16,torch.float8_e4m3fn,torch.float8_e4m3fn,QuantType.per_Token,1,1,32,0,139.0921,_ZN5aiter57fmoe_stage1_bf16_pertokenFp8_doweight_g1u1_32x128_3tg_pf2E,0.0%,81.0365,moe_ck2stages_gemm2_256x32x128x256_1x4_TypeCast_v1_Nswizzle0_Quant2_MulRoutedWeight0_F8_F8_B16,0.0%,220.1286,0
256,128,7168,256,256,8,ActivationType.Silu,torch.bfloat16,torch.float8_e4m3fn,torch.float8_e4m3fn,QuantType.per_Token,1,1,32,0,153.5346,_ZN5aiter57fmoe_stage1_bf16_pertokenFp8_doweight_g1u1_32x128_3tg_pf2E,0.0%,92.7369,moe_ck2stages_gemm2_256x32x128x256_1x4_TypeCast_v1_Nswizzle0_Quant2_MulRoutedWeight0_F8_F8_B16,0.0%,246.2715,0
256,256,7168,256,256,8,ActivationType.Silu,torch.bfloat16,torch.float8_e4m3fn,torch.float8_e4m3fn,QuantType.per_Token,1,1,32,0,159.5203,_ZN5aiter57fmoe_stage1_bf16_pertokenFp8_doweight_g1u1_32x256_2tg_pf3E,0.0%,103.4399,moe_ck2stages_gemm2_256x32x128x256_1x4_TypeCast_v1_Nswizzle0_Quant2_MulRoutedWeight0_F8_F8_B16,0.0%,262.9602,0
256,512,7168,256,256,8,ActivationType.Silu,torch.bfloat16,torch.float8_e4m3fn,torch.float8_e4m3fn,QuantType.per_Token,1,1,32,0,160.4127,_ZN5aiter57fmoe_stage1_bf16_pertokenFp8_doweight_g1u1_32x256_2tg_pf2E,0.0%,132.4101,moe_ck2stages_gemm2_256x32x128x256_1x4_TypeCast_v1_Nswizzle0_Quant2_MulRoutedWeight0_F8_F8_B16,0.0%,292.82280000000003,0
256,1024,7168,256,256,8,ActivationType.Silu,torch.bfloat16,torch.float8_e4m3fn,torch.float8_e4m3fn,QuantType.per_Token,1,1,64,0,162.8098,_ZN5aiter57fmoe_stage1_bf16_pertokenFp8_doweight_g1u1_64x128_2tg_pf2E,0.0%,221.1124,moe_ck2stages_gemm2_256x64x128x256_1x4_TypeCast_v1_Nswizzle0_Quant2_MulRoutedWeight0_F8_F8_B16,0.0%,383.9222,0
256,16,7168,256,256,8,ActivationType.Silu,torch.bfloat16,torch.float8_e4m3fn,torch.float8_e4m3fn,QuantType.per_1x128,1,0,64,0,69.9713,_ZN5aiter59fmoe_stage1_bf16_pertokenFp8_blockscale_g1u1_64x128_2tg_pf3E,96.8%,59.3329,moe_ck2stages_gemm2_256x64x128x128_1x4_MulABScaleExpertWeightA8W8blkscale_v3_Nswizzle0_Quant4_MulRoutedWeight1_F8_F8_B16,15.7%,129.3042,0
256,32,7168,256,256,8,ActivationType.Silu,torch.bfloat16,torch.float8_e4m3fn,torch.float8_e4m3fn,QuantType.per_1x128,1,0,32,0,156.211,_ZN5aiter47fmoe_bf16_blockscaleFp8_g1u1_vs_silu_1tg_32x256E,0.0%,0.0,nan,0,156.211,1
256,64,7168,256,256,8,ActivationType.Silu,torch.bfloat16,torch.float8_e4m3fn,torch.float8_e4m3fn,QuantType.per_1x128,1,0,32,0,212.9749,_ZN5aiter47fmoe_bf16_blockscaleFp8_g1u1_vs_silu_1tg_32x256E,0.0%,0.0,nan,0,212.9749,1
256,128,7168,256,256,8,ActivationType.Silu,torch.bfloat16,torch.float8_e4m3fn,torch.float8_e4m3fn,QuantType.per_1x128,1,0,32,0,239.3243,_ZN5aiter47fmoe_bf16_blockscaleFp8_g1u1_vs_silu_1tg_32x256E,0.0%,0.0,nan,0,239.3243,1
256,256,7168,256,256,8,ActivationType.Silu,torch.bfloat16,torch.float8_e4m3fn,torch.float8_e4m3fn,QuantType.per_1x128,1,0,32,0,254.3401,_ZN5aiter47fmoe_bf16_blockscaleFp8_g1u1_vs_silu_1tg_32x256E,0.0%,0.0,nan,0,254.3401,1
256,512,7168,256,256,8,ActivationType.Silu,torch.bfloat16,torch.float8_e4m3fn,torch.float8_e4m3fn,QuantType.per_1x128,1,0,32,0,265.2222,_ZN5aiter52fmoe_bf16_blockscaleFp8_g1u1_novs_silu_1tg_ps_32x256E,0.0%,0.0,nan,0,265.2222,1
256,1024,7168,256,256,8,ActivationType.Silu,torch.bfloat16,torch.float8_e4m3fn,torch.float8_e4m3fn,QuantType.per_1x128,1,0,32,0,361.034,_ZN5aiter49fmoe_bf16_blockscaleFp8_g1u1_novs_silu_1tg_32x256E,0.0%,0.0,nan,0,361.034,1
256,16,7168,256,256,8,ActivationType.Silu,torch.bfloat16,torch.float8_e4m3fn,torch.float8_e4m3fn,QuantType.per_1x128,1,1,64,0,79.0001,moe_ck2stages_gemm1_256x64x128x128_1x4_MulABScaleExpertWeightA8W8blkscale_v3_Nswizzle0_Quant4_MulRoutedWeight1_silu_F8_F8_B16,0.1%,62.5134,moe_ck2stages_gemm2_256x64x128x128_1x4_MulABScaleExpertWeightA8W8blkscale_v3_Nswizzle0_Quant4_MulRoutedWeight0_F8_F8_B16,16.6%,141.5135,0
256,32,7168,256,256,8,ActivationType.Silu,torch.bfloat16,torch.float8_e4m3fn,torch.float8_e4m3fn,QuantType.per_1x128,1,1,64,0,136.1616,moe_ck2stages_gemm1_256x64x128x128_1x4_MulABScaleExpertWeightA8W8blkscale_v3_Nswizzle0_Quant4_MulRoutedWeight1_silu_F8_F8_B16,0.1%,87.687,moe_ck2stages_gemm2_256x64x128x128_1x4_MulABScaleExpertWeightA8W8blkscale_v3_Nswizzle0_Quant4_MulRoutedWeight0_F8_F8_B16,16.6%,223.8486,0
256,64,7168,256,256,8,ActivationType.Silu,torch.bfloat16,torch.float8_e4m3fn,torch.float8_e4m3fn,QuantType.per_1x128,1,1,64,0,151.8821,moe_ck2stages_gemm1_256x64x128x128_1x4_MulABScaleExpertWeightA8W8blkscale_v3_Nswizzle0_Quant4_MulRoutedWeight1_silu_F8_F8_B16,0.1%,117.6746,moe_ck2stages_gemm2_256x64x128x128_1x4_MulABScaleExpertWeightA8W8blkscale_v3_Nswizzle0_Quant4_MulRoutedWeight0_F8_F8_B16,16.6%,269.5567,0
256,128,7168,256,256,8,ActivationType.Silu,torch.bfloat16,torch.float8_e4m3fn,torch.float8_e4m3fn,QuantType.per_1x128,1,1,64,0,163.0163,moe_ck2stages_gemm1_256x64x128x128_1x4_MulABScaleExpertWeightA8W8blkscale_v3_Nswizzle0_Quant4_MulRoutedWeight1_silu_F8_F8_B16,0.1%,142.5324,moe_ck2stages_gemm2_256x64x128x128_1x4_MulABScaleExpertWeightA8W8blkscale_v3_Nswizzle0_Quant4_MulRoutedWeight0_F8_F8_B16,16.6%,305.5487,0
256,256,7168,256,256,8,ActivationType.Silu,torch.bfloat16,torch.float8_e4m3fn,torch.float8_e4m3fn,QuantType.per_1x128,1,1,64,0,168.3375,moe_ck2stages_gemm1_256x64x128x128_1x4_MulABScaleExpertWeightA8W8blkscale_v3_Nswizzle0_Quant4_MulRoutedWeight1_silu_F8_F8_B16,0.1%,238.4327,moe_ck2stages_gemm2_256x64x128x128_1x4_MulABScaleExpertWeightA8W8blkscale_v3_Nswizzle0_Quant4_MulRoutedWeight0_F8_F8_B16,16.6%,406.7702000000001,0
256,512,7168,256,256,8,ActivationType.Silu,torch.bfloat16,torch.float8_e4m3fn,torch.float8_e4m3fn,QuantType.per_1x128,1,1,64,0,171.1024,moe_ck2stages_gemm1_256x64x128x128_1x4_MulABScaleExpertWeightA8W8blkscale_v3_Nswizzle0_Quant4_MulRoutedWeight1_silu_F8_F8_B16,0.1%,428.9958,moe_ck2stages_gemm2_256x64x128x128_1x4_MulABScaleExpertWeightA8W8blkscale_v3_Nswizzle0_Quant4_MulRoutedWeight0_F8_F8_B16,16.6%,600.0981999999999,0
256,1024,7168,256,256,8,ActivationType.Silu,torch.bfloat16,torch.float8_e4m3fn,torch.float8_e4m3fn,QuantType.per_1x128,1,1,64,0,176.774,moe_ck2stages_gemm1_256x64x128x128_1x4_MulABScaleExpertWeightA8W8blkscale_v3_Nswizzle0_Quant4_MulRoutedWeight1_silu_F8_F8_B16,0.1%,810.1068,moe_ck2stages_gemm2_256x64x128x128_1x4_MulABScaleExpertWeightA8W8blkscale_v3_Nswizzle0_Quant4_MulRoutedWeight0_F8_F8_B16,16.7%,986.8808,0
256,16,7168,512,256,8,ActivationType.Silu,torch.bfloat16,torch.bfloat16,torch.bfloat16,QuantType.No,1,0,32,0,269.3232,moe_ck2stages_gemm1_256x32x64x128_1x4_TypeCast_v1_Nswizzle0_Quant0_MulRoutedWeight0_silu_B16_B16_B16,0.0%,134.7722,moe_ck2stages_gemm2_256x32x128x128_1x4_TypeCast_v1_Nswizzle0_Quant0_MulRoutedWeight1_B16_B16_B16,2.8%,404.0954,0
256,32,7168,512,256,8,ActivationType.Silu,torch.bfloat16,torch.bfloat16,torch.bfloat16,QuantType.No,1,0,32,0,381.0416,moe_ck2stages_gemm1_256x32x64x128_1x4_TypeCast_v1_Nswizzle0_Quant0_MulRoutedWeight0_silu_B16_B16_B16,0.0%,195.7302,moe_ck2stages_gemm2_256x32x128x128_1x4_TypeCast_v1_Nswizzle0_Quant0_MulRoutedWeight1_B16_B16_B16,2.9%,576.7718,0
256,64,7168,512,256,8,ActivationType.Silu,torch.bfloat16,torch.bfloat16,torch.bfloat16,QuantType.No,1,0,32,0,562.6212,moe_ck2stages_gemm1_256x32x64x128_1x4_TypeCast_v1_Nswizzle0_Quant0_MulRoutedWeight0_silu_B16_B16_B16,0.0%,271.5572,moe_ck2stages_gemm2_256x32x128x128_1x4_TypeCast_v1_Nswizzle0_Quant0_MulRoutedWeight1_B16_B16_B16,2.8%,834.1784,0
256,128,7168,512,256,8,ActivationType.Silu,torch.bfloat16,torch.bfloat16,torch.bfloat16,QuantType.No,1,0,32,0,610.7903,moe_ck2stages_gemm1_256x32x64x128_1x4_TypeCast_v1_Nswizzle0_Quant0_MulRoutedWeight0_silu_B16_B16_B16,0.0%,311.8041,moe_ck2stages_gemm2_256x32x128x128_1x4_TypeCast_v1_Nswizzle0_Quant0_MulRoutedWeight1_B16_B16_B16,2.8%,922.5944,0
256,256,7168,512,256,8,ActivationType.Silu,torch.bfloat16,torch.bfloat16,torch.bfloat16,QuantType.No,1,0,32,0,616.9613,moe_ck2stages_gemm1_256x32x64x128_1x4_TypeCast_v1_Nswizzle0_Quant0_MulRoutedWeight0_silu_B16_B16_B16,0.0%,321.0372,moe_ck2stages_gemm2_256x32x128x128_1x4_TypeCast_v1_Nswizzle0_Quant0_MulRoutedWeight1_B16_B16_B16,2.8%,937.9985,0
256,512,7168,512,256,8,ActivationType.Silu,torch.bfloat16,torch.bfloat16,torch.bfloat16,QuantType.No,1,0,64,0,622.7788,moe_ck2stages_gemm1_256x64x64x128_1x4_TypeCast_v1_Nswizzle0_Quant0_MulRoutedWeight0_silu_B16_B16_B16,0.0%,341.9723,moe_ck2stages_gemm2_256x64x128x128_1x4_TypeCast_v1_Nswizzle0_Quant0_MulRoutedWeight1_B16_B16_B16,2.8%,964.7511,0
256,1024,7168,512,256,8,ActivationType.Silu,torch.bfloat16,torch.bfloat16,torch.bfloat16,QuantType.No,1,0,64,0,649.2553,moe_ck2stages_gemm1_256x64x64x64_1x4_TypeCast_v1_Nswizzle0_Quant0_MulRoutedWeight0_silu_B16_B16_B16,0.0%,371.4126,moe_ck2stages_gemm2_256x64x128x128_1x4_TypeCast_v1_Nswizzle0_Quant0_MulRoutedWeight1_B16_B16_B16,2.8%,1020.6679,0
256,1024,4096,384,128,8,ActivationType.Gelu,torch.bfloat16,torch.bfloat16,torch.bfloat16,QuantType.No,1,1,128,0,171.7102,moe_ck2stages_gemm1_256x128x64x64_1x4_TypeCast_v1_Nswizzle0_Quant0_MulRoutedWeight1_gelu_B16_B16_B16,0.0%,144.3167,moe_ck2stages_gemm2_256x128x128x64_1x4_TypeCast_v3_Nswizzle0_Quant0_MulRoutedWeight0_B16_B16_B16,0.0%,316.0269,0
256,16,4096,384,128,8,ActivationType.Gelu,torch.bfloat16,torch.float8_e4m3fn,torch.float8_e4m3fn,QuantType.per_Tensor,1,0,128,0,50.0987,moe_ck2stages_gemm1_256x128x64x128_1x4_TypeCast_v1_Nswizzle0_Quant1_MulRoutedWeight0_gelu_F8_F8_B16,0.0%,42.6821,moe_ck2stages_gemm2_256x128x128x128_1x4_TypeCast_v3_Nswizzle0_Quant1_MulRoutedWeight1_F8_F8_B16,0.5%,92.7808,0
256,32,4096,384,128,8,ActivationType.Gelu,torch.bfloat16,torch.float8_e4m3fn,torch.float8_e4m3fn,QuantType.per_Tensor,1,0,128,0,78.873,moe_ck2stages_gemm1_256x128x64x128_1x4_TypeCast_v1_Nswizzle0_Quant1_MulRoutedWeight0_gelu_F8_F8_B16,0.0%,54.6731,moe_ck2stages_gemm2_256x128x128x128_1x4_TypeCast_v3_Nswizzle0_Quant1_MulRoutedWeight1_F8_F8_B16,0.5%,133.5461,0
256,64,4096,384,128,8,ActivationType.Gelu,torch.bfloat16,torch.float8_e4m3fn,torch.float8_e4m3fn,QuantType.per_Tensor,1,0,128,0,82.7604,moe_ck2stages_gemm1_256x128x64x128_1x4_TypeCast_v1_Nswizzle0_Quant1_MulRoutedWeight0_gelu_F8_F8_B16,0.0%,60.2229,moe_ck2stages_gemm2_256x128x128x128_1x4_TypeCast_v3_Nswizzle0_Quant1_MulRoutedWeight1_F8_F8_B16,0.5%,142.9833,0
256,128,4096,384,128,8,ActivationType.Gelu,torch.bfloat16,torch.float8_e4m3fn,torch.float8_e4m3fn,QuantType.per_Tensor,1,0,128,0,83.8868,moe_ck2stages_gemm1_256x128x64x128_1x4_TypeCast_v1_Nswizzle0_Quant1_MulRoutedWeight0_gelu_F8_F8_B16,0.0%,61.8545,moe_ck2stages_gemm2_256x128x128x128_1x4_TypeCast_v3_Nswizzle0_Quant1_MulRoutedWeight1_F8_F8_B16,0.5%,145.7413,0
256,256,4096,384,128,8,ActivationType.Gelu,torch.bfloat16,torch.float8_e4m3fn,torch.float8_e4m3fn,QuantType.per_Tensor,1,0,128,0,84.7124,moe_ck2stages_gemm1_256x128x64x128_1x4_TypeCast_v1_Nswizzle0_Quant1_MulRoutedWeight0_gelu_F8_F8_B16,0.0%,66.4881,moe_ck2stages_gemm2_256x128x128x128_1x4_TypeCast_v3_Nswizzle0_Quant1_MulRoutedWeight1_F8_F8_B16,0.5%,151.2005,0
256,512,4096,384,128,8,ActivationType.Gelu,torch.bfloat16,torch.float8_e4m3fn,torch.float8_e4m3fn,QuantType.per_Tensor,1,0,128,0,86.6188,moe_ck2stages_gemm1_256x128x64x128_1x4_TypeCast_v1_Nswizzle0_Quant1_MulRoutedWeight0_gelu_F8_F8_B16,0.0%,83.3428,moe_ck2stages_gemm2_256x128x128x128_1x4_TypeCast_v3_Nswizzle0_Quant1_MulRoutedWeight1_F8_F8_B16,0.5%,169.96159999999998,0
256,1024,4096,384,128,8,ActivationType.Gelu,torch.bfloat16,torch.float8_e4m3fn,torch.float8_e4m3fn,QuantType.per_Tensor,1,0,128,0,92.6237,moe_ck2stages_gemm1_256x128x64x128_1x4_TypeCast_v1_Nswizzle0_Quant1_MulRoutedWeight0_gelu_F8_F8_B16,0.0%,125.9531,moe_ck2stages_gemm2_256x128x128x128_1x4_TypeCast_v3_Nswizzle0_Quant1_MulRoutedWeight1_F8_F8_B16,0.5%,218.5768,0
256,16,4096,384,128,8,ActivationType.Gelu,torch.bfloat16,torch.float8_e4m3fn,torch.float8_e4m3fn,QuantType.per_Tensor,1,1,128,0,51.0702,moe_ck2stages_gemm1_256x128x64x128_1x4_TypeCast_v1_Nswizzle0_Quant1_MulRoutedWeight1_gelu_F8_F8_B16,0.0%,41.1541,moe_ck2stages_gemm2_256x128x128x128_1x4_TypeCast_v3_Nswizzle0_Quant1_MulRoutedWeight0_F8_F8_B16,0.0%,92.2243,0
256,32,4096,384,128,8,ActivationType.Gelu,torch.bfloat16,torch.float8_e4m3fn,torch.float8_e4m3fn,QuantType.per_Tensor,1,1,128,0,81.6357,moe_ck2stages_gemm1_256x128x64x128_1x4_TypeCast_v1_Nswizzle0_Quant1_MulRoutedWeight1_gelu_F8_F8_B16,0.0%,52.029,moe_ck2stages_gemm2_256x128x128x128_1x4_TypeCast_v3_Nswizzle0_Quant1_MulRoutedWeight0_F8_F8_B16,0.0%,133.6647,0
256,64,4096,384,128,8,ActivationType.Gelu,torch.bfloat16,torch.float8_e4m3fn,torch.float8_e4m3fn,QuantType.per_Tensor,1,1,128,0,84.8817,moe_ck2stages_gemm1_256x128x64x128_1x4_TypeCast_v1_Nswizzle0_Quant1_MulRoutedWeight1_gelu_F8_F8_B16,0.0%,56.8257,moe_ck2stages_gemm2_256x128x128x128_1x4_TypeCast_v3_Nswizzle0_Quant1_MulRoutedWeight0_F8_F8_B16,0.0%,141.7074,0
256,128,4096,384,128,8,ActivationType.Gelu,torch.bfloat16,torch.float8_e4m3fn,torch.float8_e4m3fn,QuantType.per_Tensor,1,1,128,0,86.191,moe_ck2stages_gemm1_256x128x64x128_1x4_TypeCast_v1_Nswizzle0_Quant1_MulRoutedWeight1_gelu_F8_F8_B16,0.0%,58.783,moe_ck2stages_gemm2_256x128x128x128_1x4_TypeCast_v3_Nswizzle0_Quant1_MulRoutedWeight0_F8_F8_B16,0.0%,144.974,0
256,256,4096,384,128,8,ActivationType.Gelu,torch.bfloat16,torch.float8_e4m3fn,torch.float8_e4m3fn,QuantType.per_Tensor,1,1,128,0,86.7569,moe_ck2stages_gemm1_256x128x64x128_1x4_TypeCast_v1_Nswizzle0_Quant1_MulRoutedWeight1_gelu_F8_F8_B16,0.0%,64.6359,moe_ck2stages_gemm2_256x128x128x128_1x4_TypeCast_v3_Nswizzle0_Quant1_MulRoutedWeight0_F8_F8_B16,0.0%,151.39280000000002,0
256,512,4096,384,128,8,ActivationType.Gelu,torch.bfloat16,torch.float8_e4m3fn,torch.float8_e4m3fn,QuantType.per_Tensor,1,1,128,0,88.2869,moe_ck2stages_gemm1_256x128x64x128_1x4_TypeCast_v1_Nswizzle0_Quant1_MulRoutedWeight1_gelu_F8_F8_B16,0.0%,82.4745,moe_ck2stages_gemm2_256x128x128x128_1x4_TypeCast_v3_Nswizzle0_Quant1_MulRoutedWeight0_F8_F8_B16,0.0%,170.7614,0
256,1024,4096,384,128,8,ActivationType.Gelu,torch.bfloat16,torch.float8_e4m3fn,torch.float8_e4m3fn,QuantType.per_Tensor,1,1,128,0,93.1182,moe_ck2stages_gemm1_256x128x64x128_1x4_TypeCast_v1_Nswizzle0_Quant1_MulRoutedWeight1_gelu_F8_F8_B16,0.0%,125.1912,moe_ck2stages_gemm2_256x128x128x128_1x4_TypeCast_v3_Nswizzle0_Quant1_MulRoutedWeight0_F8_F8_B16,0.0%,218.3094,0
256,16,4096,384,128,8,ActivationType.Gelu,torch.bfloat16,torch.float8_e4m3fn,torch.float8_e4m3fn,QuantType.per_Token,1,0,32,0,78.7786,_ZN5aiter42fmoe_bf16_pertokenFp8_g1u1_gelu_1tg_32x128E,0.0%,0.0,nan,0,78.7786,1
256,32,4096,384,128,8,ActivationType.Gelu,torch.bfloat16,torch.float8_e4m3fn,torch.float8_e4m3fn,QuantType.per_Token,1,0,32,0,104.0766,_ZN5aiter42fmoe_bf16_pertokenFp8_g1u1_gelu_1tg_32x192E,0.0%,0.0,nan,0,104.0766,1
256,64,4096,384,128,8,ActivationType.Gelu,torch.bfloat16,torch.float8_e4m3fn,torch.float8_e4m3fn,QuantType.per_Token,1,0,32,0,116.7965,_ZN5aiter42fmoe_bf16_pertokenFp8_g1u1_gelu_1tg_32x192E,0.0%,0.0,nan,0,116.7965,1
256,128,4096,384,128,8,ActivationType.Gelu,torch.bfloat16,torch.float8_e4m3fn,torch.float8_e4m3fn,QuantType.per_Token,1,0,32,0,118.3661,_ZN5aiter42fmoe_bf16_pertokenFp8_g1u1_gelu_1tg_32x192E,0.0%,0.0,nan,0,118.3661,1
256,256,4096,384,128,8,ActivationType.Gelu,torch.bfloat16,torch.float8_e4m3fn,torch.float8_e4m3fn,QuantType.per_Token,1,0,32,0,119.5251,_ZN5aiter42fmoe_bf16_pertokenFp8_g1u1_gelu_1tg_32x192E,0.0%,0.0,nan,0,119.5251,1
256,512,4096,384,128,8,ActivationType.Gelu,torch.bfloat16,torch.float8_e4m3fn,torch.float8_e4m3fn,QuantType.per_Token,1,0,32,0,147.5327,_ZN5aiter42fmoe_bf16_pertokenFp8_g1u1_gelu_1tg_32x384E,0.0%,0.0,nan,0,147.5327,1
256,1024,4096,384,128,8,ActivationType.Gelu,torch.bfloat16,torch.float8_e4m3fn,torch.float8_e4m3fn,QuantType.per_Token,1,0,128,0,92.8309,_ZN5aiter45fmoe_stage1_bf16_pertokenFp8_g1u1_128x128_pf3E,0.0%,159.4309,moe_ck2stages_gemm2_256x128x128x128_1x4_TypeCast_v1_Nswizzle0_Quant2_MulRoutedWeight1_F8_F8_B16,0.5%,252.2618,0
256,16,4096,384,128,8,ActivationType.Gelu,torch.bfloat16,torch.float8_e4m3fn,torch.float8_e4m3fn,QuantType.per_Token,1,1,128,0,49.6325,_ZN5aiter54fmoe_stage1_bf16_pertokenFp8_doweight_g1u1_128x128_pf3E,0.0%,64.2871,moe_ck2stages_gemm2_256x128x128x128_1x4_TypeCast_v3_Nswizzle0_Quant2_MulRoutedWeight0_F8_F8_B16,0.0%,113.9196,0
256,32,4096,384,128,8,ActivationType.Gelu,torch.bfloat16,torch.float8_e4m3fn,torch.float8_e4m3fn,QuantType.per_Token,1,1,128,0,80.9233,_ZN5aiter53fmoe_stage1_bf16_pertokenFp8_doweight_g1u1_128x64_pf3E,0.0%,84.6624,moe_ck2stages_gemm2_256x128x128x128_1x4_TypeCast_v3_Nswizzle0_Quant2_MulRoutedWeight0_F8_F8_B16,0.0%,165.5857,0
256,64,4096,384,128,8,ActivationType.Gelu,torch.bfloat16,torch.float8_e4m3fn,torch.float8_e4m3fn,QuantType.per_Token,1,1,128,0,84.5381,_ZN5aiter53fmoe_stage1_bf16_pertokenFp8_doweight_g1u1_128x64_pf3E,0.0%,88.2359,moe_ck2stages_gemm2_256x128x128x128_1x4_TypeCast_v3_Nswizzle0_Quant2_MulRoutedWeight0_F8_F8_B16,0.0%,172.774,0
256,128,4096,384,128,8,ActivationType.Gelu,torch.bfloat16,torch.float8_e4m3fn,torch.float8_e4m3fn,QuantType.per_Token,1,1,128,0,85.2495,_ZN5aiter53fmoe_stage1_bf16_pertokenFp8_doweight_g1u1_128x64_pf3E,0.0%,90.1821,moe_ck2stages_gemm2_256x128x128x128_1x4_TypeCast_v3_Nswizzle0_Quant2_MulRoutedWeight0_F8_F8_B16,0.0%,175.4316,0
256,256,4096,384,128,8,ActivationType.Gelu,torch.bfloat16,torch.float8_e4m3fn,torch.float8_e4m3fn,QuantType.per_Token,1,1,128,0,86.7616,_ZN5aiter53fmoe_stage1_bf16_pertokenFp8_doweight_g1u1_128x64_pf3E,0.0%,94.7695,moe_ck2stages_gemm2_256x128x128x128_1x4_TypeCast_v3_Nswizzle0_Quant2_MulRoutedWeight0_F8_F8_B16,0.0%,181.5311,0
256,512,4096,384,128,8,ActivationType.Gelu,torch.bfloat16,torch.float8_e4m3fn,torch.float8_e4m3fn,QuantType.per_Token,1,1,128,0,89.8093,_ZN5aiter53fmoe_stage1_bf16_pertokenFp8_doweight_g1u1_128x64_pf3E,0.0%,111.8215,moe_ck2stages_gemm2_256x128x128x128_1x4_TypeCast_v3_Nswizzle0_Quant2_MulRoutedWeight0_F8_F8_B16,0.0%,201.6308,0
256,1024,4096,384,128,8,ActivationType.Gelu,torch.bfloat16,torch.float8_e4m3fn,torch.float8_e4m3fn,QuantType.per_Token,1,1,128,0,94.4833,_ZN5aiter54fmoe_stage1_bf16_pertokenFp8_doweight_g1u1_128x128_pf3E,0.0%,162.4132,moe_ck2stages_gemm2_256x128x128x128_1x4_TypeCast_v3_Nswizzle0_Quant2_MulRoutedWeight0_F8_F8_B16,0.0%,256.8965,0
256,16,4096,384,128,8,ActivationType.Gelu,torch.bfloat16,torch.float8_e4m3fn,torch.float8_e4m3fn,QuantType.per_1x128,1,0,64,0,47.4343,_ZN5aiter59fmoe_stage1_bf16_pertokenFp8_blockscale_g1u1_64x128_2tg_pf3E,96.7%,48.5974,moe_ck2stages_gemm2_256x64x128x128_1x4_MulABScaleExpertWeightA8W8blkscale_v3_Nswizzle0_Quant4_MulRoutedWeight1_F8_F8_B16,15.7%,96.0317,0
256,32,4096,384,128,8,ActivationType.Gelu,torch.bfloat16,torch.float8_e4m3fn,torch.float8_e4m3fn,QuantType.per_1x128,1,0,64,0,66.6865,_ZN5aiter59fmoe_stage1_bf16_pertokenFp8_blockscale_g1u1_64x128_2tg_pf2E,99.7%,63.1635,moe_ck2stages_gemm2_256x64x128x128_1x4_MulABScaleExpertWeightA8W8blkscale_v3_Nswizzle0_Quant4_MulRoutedWeight1_F8_F8_B16,15.8%,129.85,0
256,64,4096,384,128,8,ActivationType.Gelu,torch.bfloat16,torch.float8_e4m3fn,torch.float8_e4m3fn,QuantType.per_1x128,1,0,64,0,71.5632,_ZN5aiter59fmoe_stage1_bf16_pertokenFp8_blockscale_g1u1_64x128_2tg_pf2E,99.7%,69.2421,moe_ck2stages_gemm2_256x64x128x128_1x4_MulABScaleExpertWeightA8W8blkscale_v3_Nswizzle0_Quant4_MulRoutedWeight1_F8_F8_B16,15.6%,140.8053,0
256,128,4096,384,128,8,ActivationType.Gelu,torch.bfloat16,torch.float8_e4m3fn,torch.float8_e4m3fn,QuantType.per_1x128,1,0,64,0,72.3498,_ZN5aiter59fmoe_stage1_bf16_pertokenFp8_blockscale_g1u1_64x128_2tg_pf2E,99.7%,85.0403,moe_ck2stages_gemm2_256x64x128x128_1x4_MulABScaleExpertWeightA8W8blkscale_v3_Nswizzle0_Quant4_MulRoutedWeight1_F8_F8_B16,15.5%,157.39010000000002,0
256,256,4096,384,128,8,ActivationType.Gelu,torch.bfloat16,torch.float8_e4m3fn,torch.float8_e4m3fn,QuantType.per_1x128,1,0,64,0,72.9555,_ZN5aiter59fmoe_stage1_bf16_pertokenFp8_blockscale_g1u1_64x128_2tg_pf2E,99.7%,139.7088,moe_ck2stages_gemm2_256x64x128x128_1x4_MulABScaleExpertWeightA8W8blkscale_v3_Nswizzle0_Quant4_MulRoutedWeight1_F8_F8_B16,15.6%,212.6643,0
256,512,4096,384,128,8,ActivationType.Gelu,torch.bfloat16,torch.float8_e4m3fn,torch.float8_e4m3fn,QuantType.per_1x128,1,0,64,0,76.8029,_ZN5aiter59fmoe_stage1_bf16_pertokenFp8_blockscale_g1u1_64x128_2tg_pf2E,99.7%,244.488,moe_ck2stages_gemm2_256x64x128x128_1x4_MulABScaleExpertWeightA8W8blkscale_v3_Nswizzle0_Quant4_MulRoutedWeight1_F8_F8_B16,15.6%,321.2909,0
256,1024,4096,384,128,8,ActivationType.Gelu,torch.bfloat16,torch.float8_e4m3fn,torch.float8_e4m3fn,QuantType.per_1x128,1,0,64,0,112.5799,_ZN5aiter59fmoe_stage1_bf16_pertokenFp8_blockscale_g1u1_64x128_2tg_pf3E,99.6%,473.8998,moe_ck2stages_gemm2_256x64x128x128_1x4_MulABScaleExpertWeightA8W8blkscale_v3_Nswizzle0_Quant4_MulRoutedWeight1_F8_F8_B16,15.6%,586.4797,0
256,16,4096,384,128,8,ActivationType.Gelu,torch.bfloat16,torch.float8_e4m3fn,torch.float8_e4m3fn,QuantType.per_1x128,1,1,64,0,55.758,moe_ck2stages_gemm1_256x64x128x128_1x4_MulABScaleExpertWeightA8W8blkscale_v3_Nswizzle0_Quant4_MulRoutedWeight1_gelu_F8_F8_B16,0.1%,42.6396,moe_ck2stages_gemm2_256x64x128x128_1x4_MulABScaleExpertWeightA8W8blkscale_v3_Nswizzle0_Quant4_MulRoutedWeight0_F8_F8_B16,16.7%,98.3976,0
256,32,4096,384,128,8,ActivationType.Gelu,torch.bfloat16,torch.float8_e4m3fn,torch.float8_e4m3fn,QuantType.per_1x128,1,1,64,0,85.9194,moe_ck2stages_gemm1_256x64x128x128_1x4_MulABScaleExpertWeightA8W8blkscale_v3_Nswizzle0_Quant4_MulRoutedWeight1_gelu_F8_F8_B16,0.1%,55.8478,moe_ck2stages_gemm2_256x64x128x128_1x4_MulABScaleExpertWeightA8W8blkscale_v3_Nswizzle0_Quant4_MulRoutedWeight0_F8_F8_B16,16.8%,141.7672,0
256,64,4096,384,128,8,ActivationType.Gelu,torch.bfloat16,torch.float8_e4m3fn,torch.float8_e4m3fn,QuantType.per_1x128,1,1,64,0,90.7466,moe_ck2stages_gemm1_256x64x128x128_1x4_MulABScaleExpertWeightA8W8blkscale_v3_Nswizzle0_Quant4_MulRoutedWeight1_gelu_F8_F8_B16,0.1%,61.7646,moe_ck2stages_gemm2_256x64x128x128_1x4_MulABScaleExpertWeightA8W8blkscale_v3_Nswizzle0_Quant4_MulRoutedWeight0_F8_F8_B16,16.7%,152.5112,0
256,128,4096,384,128,8,ActivationType.Gelu,torch.bfloat16,torch.float8_e4m3fn,torch.float8_e4m3fn,QuantType.per_1x128,1,1,64,0,91.9364,moe_ck2stages_gemm1_256x64x128x128_1x4_MulABScaleExpertWeightA8W8blkscale_v3_Nswizzle0_Quant4_MulRoutedWeight1_gelu_F8_F8_B16,0.1%,80.3865,moe_ck2stages_gemm2_256x64x128x128_1x4_MulABScaleExpertWeightA8W8blkscale_v3_Nswizzle0_Quant4_MulRoutedWeight0_F8_F8_B16,16.8%,172.3229,0
256,256,4096,384,128,8,ActivationType.Gelu,torch.bfloat16,torch.float8_e4m3fn,torch.float8_e4m3fn,QuantType.per_1x128,1,1,64,0,93.807,moe_ck2stages_gemm1_256x64x128x128_1x4_MulABScaleExpertWeightA8W8blkscale_v3_Nswizzle0_Quant4_MulRoutedWeight1_gelu_F8_F8_B16,0.1%,135.3119,moe_ck2stages_gemm2_256x64x128x128_1x4_MulABScaleExpertWeightA8W8blkscale_v3_Nswizzle0_Quant4_MulRoutedWeight0_F8_F8_B16,16.7%,229.1189,0
256,512,4096,384,128,8,ActivationType.Gelu,torch.bfloat16,torch.float8_e4m3fn,torch.float8_e4m3fn,QuantType.per_1x128,1,1,64,0,97.8583,moe_ck2stages_gemm1_256x64x128x128_1x4_MulABScaleExpertWeightA8W8blkscale_v3_Nswizzle0_Quant4_MulRoutedWeight1_gelu_F8_F8_B16,0.1%,245.4917,moe_ck2stages_gemm2_256x64x128x128_1x4_MulABScaleExpertWeightA8W8blkscale_v3_Nswizzle0_Quant4_MulRoutedWeight0_F8_F8_B16,16.7%,343.35,0
256,1024,4096,384,128,8,ActivationType.Gelu,torch.bfloat16,torch.float8_e4m3fn,torch.float8_e4m3fn,QuantType.per_1x128,1,1,64,0,130.5298,moe_ck2stages_gemm1_256x64x128x128_1x4_MulABScaleExpertWeightA8W8blkscale_v3_Nswizzle0_Quant4_MulRoutedWeight1_gelu_F8_F8_B16,0.1%,470.5831,moe_ck2stages_gemm2_256x64x128x128_1x4_MulABScaleExpertWeightA8W8blkscale_v3_Nswizzle0_Quant4_MulRoutedWeight0_F8_F8_B16,16.7%,601.1129,0
80,16,7168,256,256,8,ActivationType.Silu,torch.bfloat16,torch.bfloat16,torch.bfloat16,QuantType.No,1,0,32,0,238.4483,moe_ck2stages_gemm1_256x32x64x128_1x4_TypeCast_v1_Nswizzle0_Quant0_MulRoutedWeight0_silu_B16_B16_B16,0.0%,155.017,moe_ck2stages_gemm2_256x32x64x64_1x4_TypeCastExpertWeight_v1_Nswizzle0_Quant0_MulRoutedWeight1_B16_B16_B16,1.3%,393.4653,0
80,32,7168,256,256,8,ActivationType.Silu,torch.bfloat16,torch.bfloat16,torch.bfloat16,QuantType.No,1,0,32,0,367.326,moe_ck2stages_gemm1_256x32x64x64_1x4_TypeCast_v1_Nswizzle0_Quant0_MulRoutedWeight0_silu_B16_B16_B16,0.0%,243.7681,moe_ck2stages_gemm2_256x32x64x64_1x4_TypeCastExpertWeight_v1_Nswizzle0_Quant0_MulRoutedWeight1_B16_B16_B16,1.3%,611.0941,0
80,64,7168,256,256,8,ActivationType.Silu,torch.bfloat16,torch.bfloat16,torch.bfloat16,QuantType.No,1,0,32,0,485.1197,moe_ck2stages_gemm1_256x32x64x64_1x4_TypeCast_v1_Nswizzle0_Quant0_MulRoutedWeight0_silu_B16_B16_B16,0.0%,319.3392,moe_ck2stages_gemm2_256x32x64x64_1x4_TypeCastExpertWeight_v1_Nswizzle0_Quant0_MulRoutedWeight1_B16_B16_B16,1.3%,804.4589000000001,0
80,128,7168,256,256,8,ActivationType.Silu,torch.bfloat16,torch.bfloat16,torch.bfloat16,QuantType.No,1,0,32,0,560.9087,moe_ck2stages_gemm1_256x32x64x64_1x4_TypeCast_v1_Nswizzle0_Quant0_MulRoutedWeight0_silu_B16_B16_B16,0.0%,389.4697,moe_ck2stages_gemm2_256x32x64x64_1x4_TypeCastExpertWeight_v1_Nswizzle0_Quant0_MulRoutedWeight1_B16_B16_B16,1.3%,950.3784,0
80,256,7168,256,256,8,ActivationType.Silu,torch.bfloat16,torch.bfloat16,torch.bfloat16,QuantType.No,1,0,32,0,588.4224,moe_ck2stages_gemm1_256x32x64x64_1x4_TypeCast_v1_Nswizzle0_Quant0_MulRoutedWeight0_silu_B16_B16_B16,0.0%,400.0835,moe_ck2stages_gemm2_256x32x64x64_1x4_TypeCastExpertWeight_v1_Nswizzle0_Quant0_MulRoutedWeight1_B16_B16_B16,1.3%,988.5059,0
80,512,7168,256,256,8,ActivationType.Silu,torch.bfloat16,torch.bfloat16,torch.bfloat16,QuantType.No,1,0,32,0,617.8863,moe_ck2stages_gemm1_256x32x64x64_1x4_TypeCast_v1_Nswizzle0_Quant0_MulRoutedWeight0_silu_B16_B16_B16,0.0%,423.4145,moe_ck2stages_gemm2_256x32x64x64_1x4_TypeCastExpertWeight_v1_Nswizzle0_Quant0_MulRoutedWeight1_B16_B16_B16,1.3%,1041.3008,0
80,1024,7168,256,256,8,ActivationType.Silu,torch.bfloat16,torch.bfloat16,torch.bfloat16,QuantType.No,1,0,32,0,783.2767,moe_ck2stages_gemm1_256x32x64x128_1x4_TypeCast_v1_Nswizzle0_Quant0_MulRoutedWeight0_silu_B16_B16_B16,0.0%,600.1759,moe_ck2stages_gemm2_256x32x64x64_1x4_TypeCastExpertWeight_v1_Nswizzle0_Quant0_MulRoutedWeight1_B16_B16_B16,1.3%,1383.4526,0
80,16,7168,256,256,8,ActivationType.Silu,torch.bfloat16,torch.bfloat16,torch.bfloat16,QuantType.No,1,1,32,0,238.507,moe_ck2stages_gemm1_256x32x64x128_1x4_TypeCastExpertWeight_v1_Nswizzle0_Quant0_MulRoutedWeight1_silu_B16_B16_B16,0.0%,146.2522,moe_ck2stages_gemm2_256x32x64x64_1x4_TypeCast_v1_Nswizzle0_Quant0_MulRoutedWeight0_B16_B16_B16,0.0%,384.7592,0
80,32,7168,256,256,8,ActivationType.Silu,torch.bfloat16,torch.bfloat16,torch.bfloat16,QuantType.No,1,1,32,0,376.8336,moe_ck2stages_gemm1_256x32x64x64_1x4_TypeCastExpertWeight_v1_Nswizzle0_Quant0_MulRoutedWeight1_silu_B16_B16_B16,0.0%,233.1548,moe_ck2stages_gemm2_256x32x64x64_1x4_TypeCast_v1_Nswizzle0_Quant0_MulRoutedWeight0_B16_B16_B16,0.0%,609.9884,0
80,64,7168,256,256,8,ActivationType.Silu,torch.bfloat16,torch.bfloat16,torch.bfloat16,QuantType.No,1,1,32,0,484.4582,moe_ck2stages_gemm1_256x32x64x64_1x4_TypeCastExpertWeight_v1_Nswizzle0_Quant0_MulRoutedWeight1_silu_B16_B16_B16,0.0%,310.4899,moe_ck2stages_gemm2_256x32x64x64_1x4_TypeCast_v1_Nswizzle0_Quant0_MulRoutedWeight0_B16_B16_B16,0.0%,794.9481,0
80,128,7168,256,256,8,ActivationType.Silu,torch.bfloat16,torch.bfloat16,torch.bfloat16,QuantType.No,1,1,32,0,560.7307,moe_ck2stages_gemm1_256x32x64x64_1x4_TypeCastExpertWeight_v1_Nswizzle0_Quant0_MulRoutedWeight1_silu_B16_B16_B16,0.0%,356.8918,moe_ck2stages_gemm2_256x32x64x64_1x4_TypeCast_v1_Nswizzle0_Quant0_MulRoutedWeight0_B16_B16_B16,0.0%,917.6225,0
80,256,7168,256,256,8,ActivationType.Silu,torch.bfloat16,torch.bfloat16,torch.bfloat16,QuantType.No,1,1,32,0,591.6172,moe_ck2stages_gemm1_256x32x64x64_1x4_TypeCastExpertWeight_v1_Nswizzle0_Quant0_MulRoutedWeight1_silu_B16_B16_B16,0.0%,377.301,moe_ck2stages_gemm2_256x32x64x64_1x4_TypeCast_v1_Nswizzle0_Quant0_MulRoutedWeight0_B16_B16_B16,0.0%,968.9182,0
80,512,7168,256,256,8,ActivationType.Silu,torch.bfloat16,torch.bfloat16,torch.bfloat16,QuantType.No,1,1,32,0,621.3374,moe_ck2stages_gemm1_256x32x64x128_1x4_TypeCastExpertWeight_v1_Nswizzle0_Quant0_MulRoutedWeight1_silu_B16_B16_B16,0.0%,402.5935,moe_ck2stages_gemm2_256x32x64x64_1x4_TypeCast_v1_Nswizzle0_Quant0_MulRoutedWeight0_B16_B16_B16,0.0%,1023.9309,0
80,1024,7168,256,256,8,ActivationType.Silu,torch.bfloat16,torch.bfloat16,torch.bfloat16,QuantType.No,1,1,32,0,784.9765,moe_ck2stages_gemm1_256x32x64x128_1x4_TypeCastExpertWeight_v1_Nswizzle0_Quant0_MulRoutedWeight1_silu_B16_B16_B16,0.0%,567.3861,moe_ck2stages_gemm2_256x32x64x64_1x4_TypeCast_v1_Nswizzle0_Quant0_MulRoutedWeight0_B16_B16_B16,0.0%,1352.3626,0
80,16,7168,256,256,8,ActivationType.Silu,torch.bfloat16,torch.float8_e4m3fnuz,torch.float8_e4m3fnuz,QuantType.per_Tensor,1,0,32,0,121.6233,moe_ck2stages_gemm1_256x32x64x256_1x4_MulABScale_v1_Nswizzle0_Quant1_MulRoutedWeight0_silu_F8_F8_B16,0.0%,117.3629,moe_ck2stages_gemm2_256x32x64x128_1x4_MulABScaleExpertWeight_v1_Nswizzle0_Quant1_MulRoutedWeight1_F8_F8_B16,1.3%,238.9862,0
80,32,7168,256,256,8,ActivationType.Silu,torch.bfloat16,torch.float8_e4m3fnuz,torch.float8_e4m3fnuz,QuantType.per_Tensor,1,0,32,0,194.485,moe_ck2stages_gemm1_256x32x64x256_1x4_MulABScale_v1_Nswizzle0_Quant1_MulRoutedWeight0_silu_F8_F8_B16,0.0%,176.724,moe_ck2stages_gemm2_256x32x64x128_1x4_MulABScaleExpertWeight_v1_Nswizzle0_Quant1_MulRoutedWeight1_F8_F8_B16,1.3%,371.209,0
80,64,7168,256,256,8,ActivationType.Silu,torch.bfloat16,torch.float8_e4m3fnuz,torch.float8_e4m3fnuz,QuantType.per_Tensor,1,0,32,0,251.2934,_ZN5aiter48fmoe_stage1_bf16_pertokenFp8_g1u1_32x128_3tg_pf3E,0.0%,233.6045,moe_ck2stages_gemm2_256x32x64x256_1x4_MulABScaleExpertWeight_v1_Nswizzle0_Quant1_MulRoutedWeight1_F8_F8_B16,1.3%,484.8979,0
80,128,7168,256,256,8,ActivationType.Silu,torch.bfloat16,torch.float8_e4m3fnuz,torch.float8_e4m3fnuz,QuantType.per_Tensor,1,0,32,0,292.2127,_ZN5aiter48fmoe_stage1_bf16_pertokenFp8_g1u1_32x128_3tg_pf3E,0.0%,265.0419,moe_ck2stages_gemm2_256x32x64x128_1x4_MulABScaleExpertWeight_v1_Nswizzle0_Quant1_MulRoutedWeight1_F8_F8_B16,1.3%,557.2546,0
80,256,7168,256,256,8,ActivationType.Silu,torch.bfloat16,torch.float8_e4m3fnuz,torch.float8_e4m3fnuz,QuantType.per_Tensor,1,0,32,0,300.6316,moe_ck2stages_gemm1_256x32x64x128_1x4_MulABScale_v1_Nswizzle0_Quant1_MulRoutedWeight0_silu_F8_F8_B16,0.0%,279.9782,moe_ck2stages_gemm2_256x32x64x128_1x4_MulABScaleExpertWeight_v1_Nswizzle0_Quant1_MulRoutedWeight1_F8_F8_B16,1.3%,580.6098,0
80,512,7168,256,256,8,ActivationType.Silu,torch.bfloat16,torch.float8_e4m3fnuz,torch.float8_e4m3fnuz,QuantType.per_Tensor,1,0,32,0,312.6244,_ZN5aiter48fmoe_stage1_bf16_pertokenFp8_g1u1_32x128_3tg_pf3E,0.0%,296.8907,moe_ck2stages_gemm2_256x32x64x128_1x4_MulABScaleExpertWeight_v1_Nswizzle0_Quant1_MulRoutedWeight1_F8_F8_B16,1.3%,609.5151,0
80,1024,7168,256,256,8,ActivationType.Silu,torch.bfloat16,torch.float8_e4m3fnuz,torch.float8_e4m3fnuz,QuantType.per_Tensor,1,0,32,0,394.9761,_ZN5aiter48fmoe_stage1_bf16_pertokenFp8_g1u1_32x256_2tg_pf3E,0.0%,427.6178,moe_ck2stages_gemm2_256x32x64x128_1x4_MulABScaleExpertWeight_v1_Nswizzle0_Quant1_MulRoutedWeight1_F8_F8_B16,1.3%,822.5939,0
80,16,7168,256,256,8,ActivationType.Silu,torch.bfloat16,torch.float8_e4m3fnuz,torch.float8_e4m3fnuz,QuantType.per_Tensor,1,1,32,0,120.6124,moe_ck2stages_gemm1_256x32x64x256_1x4_MulABScale_v1_Nswizzle0_Quant1_MulRoutedWeight1_silu_F8_F8_B16,0.0%,113.2457,moe_ck2stages_gemm2_256x32x64x128_1x4_MulABScaleExpertWeight_v1_Nswizzle0_Quant1_MulRoutedWeight0_F8_F8_B16,0.0%,233.8581,0
80,32,7168,256,256,8,ActivationType.Silu,torch.bfloat16,torch.float8_e4m3fnuz,torch.float8_e4m3fnuz,QuantType.per_Tensor,1,1,32,0,188.7522,moe_ck2stages_gemm1_256x32x64x128_1x4_MulABScale_v1_Nswizzle0_Quant1_MulRoutedWeight1_silu_F8_F8_B16,0.0%,170.2119,moe_ck2stages_gemm2_256x32x64x128_1x4_MulABScaleExpertWeight_v1_Nswizzle0_Quant1_MulRoutedWeight0_F8_F8_B16,0.0%,358.96410000000003,0
80,64,7168,256,256,8,ActivationType.Silu,torch.bfloat16,torch.float8_e4m3fnuz,torch.float8_e4m3fnuz,QuantType.per_Tensor,1,1,32,0,254.6539,_ZN5aiter57fmoe_stage1_bf16_pertokenFp8_doweight_g1u1_32x128_3tg_pf3E,0.1%,220.0918,moe_ck2stages_gemm2_256x32x64x128_1x4_MulABScaleExpertWeight_v1_Nswizzle0_Quant1_MulRoutedWeight0_F8_F8_B16,0.0%,474.7457,0
80,128,7168,256,256,8,ActivationType.Silu,torch.bfloat16,torch.float8_e4m3fnuz,torch.float8_e4m3fnuz,QuantType.per_Tensor,1,1,32,0,290.9005,_ZN5aiter57fmoe_stage1_bf16_pertokenFp8_doweight_g1u1_32x128_3tg_pf3E,0.0%,254.8242,moe_ck2stages_gemm2_256x32x64x256_1x4_MulABScaleExpertWeight_v1_Nswizzle0_Quant1_MulRoutedWeight0_F8_F8_B16,0.0%,545.7247,0
80,256,7168,256,256,8,ActivationType.Silu,torch.bfloat16,torch.float8_e4m3fnuz,torch.float8_e4m3fnuz,QuantType.per_Tensor,1,1,32,0,299.2146,_ZN5aiter57fmoe_stage1_bf16_pertokenFp8_doweight_g1u1_32x128_3tg_pf3E,0.0%,268.1991,moe_ck2stages_gemm2_256x32x64x256_1x4_MulABScaleExpertWeight_v1_Nswizzle0_Quant1_MulRoutedWeight0_F8_F8_B16,0.0%,567.4137000000001,0
80,512,7168,256,256,8,ActivationType.Silu,torch.bfloat16,torch.float8_e4m3fnuz,torch.float8_e4m3fnuz,QuantType.per_Tensor,1,1,32,0,316.0831,_ZN5aiter57fmoe_stage1_bf16_pertokenFp8_doweight_g1u1_32x128_3tg_pf3E,0.0%,287.2443,moe_ck2stages_gemm2_256x32x64x256_1x4_MulABScaleExpertWeight_v1_Nswizzle0_Quant1_MulRoutedWeight0_F8_F8_B16,0.0%,603.3274,0
80,1024,7168,256,256,8,ActivationType.Silu,torch.bfloat16,torch.float8_e4m3fnuz,torch.float8_e4m3fnuz,QuantType.per_Tensor,1,1,32,0,398.3967,_ZN5aiter57fmoe_stage1_bf16_pertokenFp8_doweight_g1u1_32x256_2tg_pf3E,0.0%,410.8972,moe_ck2stages_gemm2_256x32x64x128_1x4_MulABScaleExpertWeight_v1_Nswizzle0_Quant1_MulRoutedWeight0_F8_F8_B16,0.0%,809.2939,0
80,16,7168,256,256,8,ActivationType.Silu,torch.bfloat16,torch.float8_e4m3fnuz,torch.float8_e4m3fnuz,QuantType.per_Token,1,0,32,0,118.9203,_ZN5aiter47fmoe_stage1_bf16_pertokenFp8_g1u1_32x64_4tg_pf3E,0.0%,134.5117,moe_ck2stages_gemm2_256x32x64x128_1x4_MulABScaleExpertWeight_v1_Nswizzle0_Quant2_MulRoutedWeight1_F8_F8_B16,1.3%,253.432,0
80,32,7168,256,256,8,ActivationType.Silu,torch.bfloat16,torch.float8_e4m3fnuz,torch.float8_e4m3fnuz,QuantType.per_Token,1,0,32,0,190.3221,_ZN5aiter47fmoe_stage1_bf16_pertokenFp8_g1u1_32x64_4tg_pf3E,0.0%,205.7596,moe_ck2stages_gemm2_256x32x64x128_1x4_MulABScaleExpertWeight_v1_Nswizzle0_Quant2_MulRoutedWeight1_F8_F8_B16,1.3%,396.0817,0
80,64,7168,256,256,8,ActivationType.Silu,torch.bfloat16,torch.float8_e4m3fnuz,torch.float8_e4m3fnuz,QuantType.per_Token,1,0,32,0,248.4832,_ZN5aiter48fmoe_stage1_bf16_pertokenFp8_g1u1_32x128_3tg_pf3E,0.0%,268.7225,moe_ck2stages_gemm2_256x32x64x128_1x4_MulABScaleExpertWeight_v1_Nswizzle0_Quant2_MulRoutedWeight1_F8_F8_B16,1.3%,517.2057,0
80,128,7168,256,256,8,ActivationType.Silu,torch.bfloat16,torch.float8_e4m3fnuz,torch.float8_e4m3fnuz,QuantType.per_Token,1,0,32,0,290.4406,_ZN5aiter47fmoe_stage1_bf16_pertokenFp8_g1u1_32x64_4tg_pf3E,0.0%,311.0546,moe_ck2stages_gemm2_256x32x64x128_1x4_MulABScaleExpertWeight_v1_Nswizzle0_Quant2_MulRoutedWeight1_F8_F8_B16,1.3%,601.4952000000001,0
80,256,7168,256,256,8,ActivationType.Silu,torch.bfloat16,torch.float8_e4m3fnuz,torch.float8_e4m3fnuz,QuantType.per_Token,1,0,32,0,301.7002,_ZN5aiter48fmoe_stage1_bf16_pertokenFp8_g1u1_32x256_2tg_pf3E,0.0%,327.6233,moe_ck2stages_gemm2_256x32x64x128_1x4_MulABScaleExpertWeight_v1_Nswizzle0_Quant2_MulRoutedWeight1_F8_F8_B16,1.3%,629.3235,0
80,512,7168,256,256,8,ActivationType.Silu,torch.bfloat16,torch.float8_e4m3fnuz,torch.float8_e4m3fnuz,QuantType.per_Token,1,0,32,0,309.3462,_ZN5aiter48fmoe_stage1_bf16_pertokenFp8_g1u1_32x128_3tg_pf3E,0.0%,357.9321,moe_ck2stages_gemm2_256x32x64x128_1x4_MulABScaleExpertWeight_v1_Nswizzle0_Quant2_MulRoutedWeight1_F8_F8_B16,1.3%,667.2783,0
80,1024,7168,256,256,8,ActivationType.Silu,torch.bfloat16,torch.float8_e4m3fnuz,torch.float8_e4m3fnuz,QuantType.per_Token,1,0,32,0,396.699,_ZN5aiter48fmoe_stage1_bf16_pertokenFp8_g1u1_32x256_2tg_pf3E,0.0%,530.6901,moe_ck2stages_gemm2_256x32x64x128_1x4_MulABScaleExpertWeight_v1_Nswizzle0_Quant2_MulRoutedWeight1_F8_F8_B16,1.3%,927.3891,0
80,16,7168,512,256,8,ActivationType.Silu,torch.bfloat16,torch.bfloat16,torch.bfloat16,QuantType.No,1,0,32,0,438.8756,moe_ck2stages_gemm1_256x32x64x64_1x4_TypeCast_v1_Nswizzle0_Quant0_MulRoutedWeight0_silu_B16_B16_B16,0.0%,256.4253,moe_ck2stages_gemm2_256x32x64x64_1x4_TypeCastExpertWeight_v1_Nswizzle0_Quant0_MulRoutedWeight1_B16_B16_B16,2.9%,695.3009,0
80,32,7168,512,256,8,ActivationType.Silu,torch.bfloat16,torch.bfloat16,torch.bfloat16,QuantType.No,1,0,32,0,714.79,moe_ck2stages_gemm1_256x32x64x64_1x4_TypeCast_v1_Nswizzle0_Quant0_MulRoutedWeight0_silu_B16_B16_B16,0.0%,400.2169,moe_ck2stages_gemm2_256x32x64x64_1x4_TypeCastExpertWeight_v1_Nswizzle0_Quant0_MulRoutedWeight1_B16_B16_B16,2.9%,1115.0069,0
80,64,7168,512,256,8,ActivationType.Silu,torch.bfloat16,torch.bfloat16,torch.bfloat16,QuantType.No,1,0,32,0,998.4164,moe_ck2stages_gemm1_256x32x64x64_1x4_TypeCast_v1_Nswizzle0_Quant0_MulRoutedWeight0_silu_B16_B16_B16,0.0%,561.412,moe_ck2stages_gemm2_256x32x64x64_1x4_TypeCastExpertWeight_v1_Nswizzle0_Quant0_MulRoutedWeight1_B16_B16_B16,2.9%,1559.8284,0
80,128,7168,512,256,8,ActivationType.Silu,torch.bfloat16,torch.bfloat16,torch.bfloat16,QuantType.No,1,0,32,0,1118.5366,moe_ck2stages_gemm1_256x32x64x64_1x4_TypeCast_v1_Nswizzle0_Quant0_MulRoutedWeight0_silu_B16_B16_B16,0.0%,643.0011,moe_ck2stages_gemm2_256x32x64x64_1x4_TypeCastExpertWeight_v1_Nswizzle0_Quant0_MulRoutedWeight1_B16_B16_B16,2.8%,1761.5377,0
80,256,7168,512,256,8,ActivationType.Silu,torch.bfloat16,torch.bfloat16,torch.bfloat16,QuantType.No,1,0,32,0,1174.4719,moe_ck2stages_gemm1_256x32x64x64_1x4_TypeCast_v1_Nswizzle0_Quant0_MulRoutedWeight0_silu_B16_B16_B16,0.0%,676.1183,moe_ck2stages_gemm2_256x32x64x64_1x4_TypeCastExpertWeight_v1_Nswizzle0_Quant0_MulRoutedWeight1_B16_B16_B16,2.8%,1850.5902,0
80,512,7168,512,256,8,ActivationType.Silu,torch.bfloat16,torch.bfloat16,torch.bfloat16,QuantType.No,1,0,32,0,1216.8417,moe_ck2stages_gemm1_256x32x64x128_1x4_TypeCast_v1_Nswizzle0_Quant0_MulRoutedWeight0_silu_B16_B16_B16,0.0%,726.8006,moe_ck2stages_gemm2_256x32x64x64_1x4_TypeCastExpertWeight_v1_Nswizzle0_Quant0_MulRoutedWeight1_B16_B16_B16,2.8%,1943.6423,0
80,32,7168,512,256,8,ActivationType.Silu,torch.bfloat16,torch.float8_e4m3fnuz,torch.float8_e4m3fnuz,QuantType.per_Token,1,0,32,0,366.9854,_ZN5aiter48fmoe_stage1_bf16_pertokenFp8_g1u1_32x128_3tg_pf3E,0.0%,263.1156,moe_ck2stages_gemm2_256x32x64x128_1x4_MulABScaleExpertWeight_v1_Nswizzle0_Quant2_MulRoutedWeight1_F8_F8_B16,2.9%,630.101,0
80,64,7168,512,256,8,ActivationType.Silu,torch.bfloat16,torch.float8_e4m3fnuz,torch.float8_e4m3fnuz,QuantType.per_Token,1,0,32,0,504.1748,_ZN5aiter44fmoe_stage1_bf16_pertokenFp8_g1u1_32x512_pf3E,0.0%,378.662,moe_ck2stages_gemm2_256x32x64x128_1x4_MulABScaleExpertWeight_v1_Nswizzle0_Quant2_MulRoutedWeight1_F8_F8_B16,2.9%,882.8368,0
80,128,7168,512,256,8,ActivationType.Silu,torch.bfloat16,torch.float8_e4m3fnuz,torch.float8_e4m3fnuz,QuantType.per_Token,1,0,32,0,570.6719,_ZN5aiter48fmoe_stage1_bf16_pertokenFp8_g1u1_32x128_3tg_pf3E,0.1%,417.051,moe_ck2stages_gemm2_256x32x64x128_1x4_MulABScaleExpertWeight_v1_Nswizzle0_Quant2_MulRoutedWeight1_F8_F8_B16,2.8%,987.7229,0
80,256,7168,512,256,8,ActivationType.Silu,torch.bfloat16,torch.float8_e4m3fnuz,torch.float8_e4m3fnuz,QuantType.per_Token,1,0,32,0,597.6775,_ZN5aiter48fmoe_stage1_bf16_pertokenFp8_g1u1_32x128_3tg_pf3E,0.0%,432.5419,moe_ck2stages_gemm2_256x32x64x128_1x4_MulABScaleExpertWeight_v1_Nswizzle0_Quant2_MulRoutedWeight1_F8_F8_B16,2.8%,1030.2194,0
80,16,4096,192,128,8,ActivationType.Silu,torch.bfloat16,torch.bfloat16,torch.bfloat16,QuantType.No,1,0,32,0,88.0761,moe_ck2stages_gemm1_256x32x64x64_1x4_TypeCast_v1_Nswizzle0_Quant0_MulRoutedWeight0_silu_B16_B16_B16,0.0%,66.5013,moe_ck2stages_gemm2_256x32x64x64_1x4_TypeCastExpertWeight_v1_Nswizzle0_Quant0_MulRoutedWeight1_B16_B16_B16,0.1%,154.5774,0
80,32,4096,192,128,8,ActivationType.Silu,torch.bfloat16,torch.bfloat16,torch.bfloat16,QuantType.No,1,0,32,0,116.9005,moe_ck2stages_gemm1_256x32x64x64_1x4_TypeCast_v1_Nswizzle0_Quant0_MulRoutedWeight0_silu_B16_B16_B16,0.0%,89.872,moe_ck2stages_gemm2_256x32x64x64_1x4_TypeCastExpertWeight_v1_Nswizzle0_Quant0_MulRoutedWeight1_B16_B16_B16,0.1%,206.7725,0
80,64,4096,192,128,8,ActivationType.Silu,torch.bfloat16,torch.bfloat16,torch.bfloat16,QuantType.No,1,0,32,0,130.2259,moe_ck2stages_gemm1_256x32x64x64_1x4_TypeCast_v1_Nswizzle0_Quant0_MulRoutedWeight0_silu_B16_B16_B16,0.0%,101.7908,moe_ck2stages_gemm2_256x32x64x64_1x4_TypeCastExpertWeight_v1_Nswizzle0_Quant0_MulRoutedWeight1_B16_B16_B16,0.1%,232.0167,0
80,128,4096,192,128,8,ActivationType.Silu,torch.bfloat16,torch.bfloat16,torch.bfloat16,QuantType.No,1,0,32,0,134.8012,moe_ck2stages_gemm1_256x32x64x128_1x4_TypeCast_v1_Nswizzle0_Quant0_MulRoutedWeight0_silu_B16_B16_B16,0.0%,104.118,moe_ck2stages_gemm2_256x32x64x64_1x4_TypeCastExpertWeight_v1_Nswizzle0_Quant0_MulRoutedWeight1_B16_B16_B16,0.1%,238.9192,0
80,256,4096,192,128,8,ActivationType.Silu,torch.bfloat16,torch.bfloat16,torch.bfloat16,QuantType.No,1,0,32,0,139.8396,moe_ck2stages_gemm1_256x32x64x64_1x4_TypeCast_v1_Nswizzle0_Quant0_MulRoutedWeight0_silu_B16_B16_B16,0.0%,107.8712,moe_ck2stages_gemm2_256x32x64x64_1x4_TypeCastExpertWeight_v1_Nswizzle0_Quant0_MulRoutedWeight1_B16_B16_B16,0.1%,247.7108,0
80,512,4096,192,128,8,ActivationType.Silu,torch.bfloat16,torch.bfloat16,torch.bfloat16,QuantType.No,1,0,32,0,176.0293,moe_ck2stages_gemm1_256x32x64x128_1x4_TypeCast_v1_Nswizzle0_Quant0_MulRoutedWeight0_silu_B16_B16_B16,0.0%,152.7806,moe_ck2stages_gemm2_256x32x64x64_1x4_TypeCastExpertWeight_v1_Nswizzle0_Quant0_MulRoutedWeight1_B16_B16_B16,0.1%,328.8099,0
80,1024,4096,192,128,8,ActivationType.Silu,torch.bfloat16,torch.bfloat16,torch.bfloat16,QuantType.No,1,0,32,0,283.4477,moe_ck2stages_gemm1_256x32x64x128_1x4_TypeCast_v1_Nswizzle0_Quant0_MulRoutedWeight0_silu_B16_B16_B16,0.0%,254.2291,moe_ck2stages_gemm2_256x32x64x64_1x4_TypeCastExpertWeight_v1_Nswizzle0_Quant0_MulRoutedWeight1_B16_B16_B16,0.1%,537.6768,0
80,16,4096,192,128,8,ActivationType.Silu,torch.bfloat16,torch.bfloat16,torch.bfloat16,QuantType.No,1,1,32,0,88.5875,moe_ck2stages_gemm1_256x32x64x64_1x4_TypeCastExpertWeight_v1_Nswizzle0_Quant0_MulRoutedWeight1_silu_B16_B16_B16,0.0%,61.2038,moe_ck2stages_gemm2_256x32x64x64_1x4_TypeCast_v1_Nswizzle0_Quant0_MulRoutedWeight0_B16_B16_B16,0.0%,149.7913,0
80,32,4096,192,128,8,ActivationType.Silu,torch.bfloat16,torch.bfloat16,torch.bfloat16,QuantType.No,1,1,32,0,116.7801,moe_ck2stages_gemm1_256x32x64x64_1x4_TypeCastExpertWeight_v1_Nswizzle0_Quant0_MulRoutedWeight1_silu_B16_B16_B16,0.0%,82.5179,moe_ck2stages_gemm2_256x32x64x64_1x4_TypeCast_v1_Nswizzle0_Quant0_MulRoutedWeight0_B16_B16_B16,0.0%,199.298,0
80,64,4096,192,128,8,ActivationType.Silu,torch.bfloat16,torch.bfloat16,torch.bfloat16,QuantType.No,1,1,32,0,130.0463,moe_ck2stages_gemm1_256x32x64x64_1x4_TypeCastExpertWeight_v1_Nswizzle0_Quant0_MulRoutedWeight1_silu_B16_B16_B16,0.0%,93.2196,moe_ck2stages_gemm2_256x32x64x64_1x4_TypeCast_v1_Nswizzle0_Quant0_MulRoutedWeight0_B16_B16_B16,0.0%,223.2659,0
80,128,4096,192,128,8,ActivationType.Silu,torch.bfloat16,torch.bfloat16,torch.bfloat16,QuantType.No,1,1,32,0,133.8064,moe_ck2stages_gemm1_256x32x64x128_1x4_TypeCastExpertWeight_v1_Nswizzle0_Quant0_MulRoutedWeight1_silu_B16_B16_B16,0.0%,96.146,moe_ck2stages_gemm2_256x32x64x64_1x4_TypeCast_v1_Nswizzle0_Quant0_MulRoutedWeight0_B16_B16_B16,0.0%,229.9524,0
80,256,4096,192,128,8,ActivationType.Silu,torch.bfloat16,torch.bfloat16,torch.bfloat16,QuantType.No,1,1,32,0,136.6552,moe_ck2stages_gemm1_256x32x64x128_1x4_TypeCastExpertWeight_v1_Nswizzle0_Quant0_MulRoutedWeight1_silu_B16_B16_B16,0.0%,99.1414,moe_ck2stages_gemm2_256x32x64x64_1x4_TypeCast_v1_Nswizzle0_Quant0_MulRoutedWeight0_B16_B16_B16,0.0%,235.7966,0
80,512,4096,192,128,8,ActivationType.Silu,torch.bfloat16,torch.bfloat16,torch.bfloat16,QuantType.No,1,1,32,0,177.8056,moe_ck2stages_gemm1_256x32x64x128_1x4_TypeCastExpertWeight_v1_Nswizzle0_Quant0_MulRoutedWeight1_silu_B16_B16_B16,0.0%,140.1446,moe_ck2stages_gemm2_256x32x64x64_1x4_TypeCast_v1_Nswizzle0_Quant0_MulRoutedWeight0_B16_B16_B16,0.0%,317.9502,0
80,1024,4096,192,128,8,ActivationType.Silu,torch.bfloat16,torch.bfloat16,torch.bfloat16,QuantType.No,1,1,32,0,284.4745,moe_ck2stages_gemm1_256x32x64x64_1x4_TypeCastExpertWeight_v1_Nswizzle0_Quant0_MulRoutedWeight1_silu_B16_B16_B16,0.0%,232.9485,moe_ck2stages_gemm2_256x32x64x64_1x4_TypeCast_v1_Nswizzle0_Quant0_MulRoutedWeight0_B16_B16_B16,0.0%,517.423,0
80,16,4096,384,128,8,ActivationType.Silu,torch.bfloat16,torch.bfloat16,torch.bfloat16,QuantType.No,1,0,32,0,160.613,moe_ck2stages_gemm1_256x32x64x64_1x4_TypeCast_v1_Nswizzle0_Quant0_MulRoutedWeight0_silu_B16_B16_B16,0.0%,97.024,moe_ck2stages_gemm2_256x32x64x64_1x4_TypeCastExpertWeight_v1_Nswizzle0_Quant0_MulRoutedWeight1_B16_B16_B16,0.3%,257.637,0
80,32,4096,384,128,8,ActivationType.Silu,torch.bfloat16,torch.bfloat16,torch.bfloat16,QuantType.No,1,0,32,0,214.8572,moe_ck2stages_gemm1_256x32x64x64_1x4_TypeCast_v1_Nswizzle0_Quant0_MulRoutedWeight0_silu_B16_B16_B16,0.0%,129.0874,moe_ck2stages_gemm2_256x32x64x64_1x4_TypeCastExpertWeight_v1_Nswizzle0_Quant0_MulRoutedWeight1_B16_B16_B16,0.3%,343.94460000000004,0
80,64,4096,384,128,8,ActivationType.Silu,torch.bfloat16,torch.bfloat16,torch.bfloat16,QuantType.No,1,0,32,0,238.0028,moe_ck2stages_gemm1_256x32x64x64_1x4_TypeCast_v1_Nswizzle0_Quant0_MulRoutedWeight0_silu_B16_B16_B16,0.0%,151.5356,moe_ck2stages_gemm2_256x32x64x64_1x4_TypeCastExpertWeight_v1_Nswizzle0_Quant0_MulRoutedWeight1_B16_B16_B16,0.3%,389.5384,0
80,128,4096,384,128,8,ActivationType.Silu,torch.bfloat16,torch.bfloat16,torch.bfloat16,QuantType.No,1,0,32,0,256.0,moe_ck2stages_gemm1_256x32x64x64_1x4_TypeCast_v1_Nswizzle0_Quant0_MulRoutedWeight0_silu_B16_B16_B16,0.0%,155.7118,moe_ck2stages_gemm2_256x32x64x64_1x4_TypeCastExpertWeight_v1_Nswizzle0_Quant0_MulRoutedWeight1_B16_B16_B16,0.4%,411.7118,0
80,256,4096,384,128,8,ActivationType.Silu,torch.bfloat16,torch.bfloat16,torch.bfloat16,QuantType.No,1,0,32,0,268.9473,moe_ck2stages_gemm1_256x32x64x128_1x4_TypeCast_v1_Nswizzle0_Quant0_MulRoutedWeight0_silu_B16_B16_B16,0.0%,167.0488,moe_ck2stages_gemm2_256x32x64x64_1x4_TypeCastExpertWeight_v1_Nswizzle0_Quant0_MulRoutedWeight1_B16_B16_B16,0.4%,435.9961,0
80,512,4096,384,128,8,ActivationType.Silu,torch.bfloat16,torch.bfloat16,torch.bfloat16,QuantType.No,1,0,32,0,347.7216,moe_ck2stages_gemm1_256x32x64x128_1x4_TypeCast_v1_Nswizzle0_Quant0_MulRoutedWeight0_silu_B16_B16_B16,0.0%,219.8661,moe_ck2stages_gemm2_256x32x64x64_1x4_TypeCastExpertWeight_v1_Nswizzle0_Quant0_MulRoutedWeight1_B16_B16_B16,0.4%,567.5877,0
80,1024,4096,384,128,8,ActivationType.Silu,torch.bfloat16,torch.bfloat16,torch.bfloat16,QuantType.No,1,0,32,0,523.4769,moe_ck2stages_gemm1_256x32x64x128_1x4_TypeCast_v1_Nswizzle0_Quant0_MulRoutedWeight0_silu_B16_B16_B16,0.0%,371.6201,moe_ck2stages_gemm2_256x32x64x64_1x4_TypeCastExpertWeight_v1_Nswizzle0_Quant0_MulRoutedWeight1_B16_B16_B16,0.4%,895.097,0
80,16,4096,384,128,8,ActivationType.Silu,torch.bfloat16,torch.bfloat16,torch.bfloat16,QuantType.No,1,1,32,0,165.7381,moe_ck2stages_gemm1_256x32x64x64_1x4_TypeCastExpertWeight_v1_Nswizzle0_Quant0_MulRoutedWeight1_silu_B16_B16_B16,0.0%,94.3172,moe_ck2stages_gemm2_256x32x64x64_1x4_TypeCast_v1_Nswizzle0_Quant0_MulRoutedWeight0_B16_B16_B16,0.0%,260.0553,0
80,32,4096,384,128,8,ActivationType.Silu,torch.bfloat16,torch.bfloat16,torch.bfloat16,QuantType.No,1,1,32,0,216.9447,moe_ck2stages_gemm1_256x32x64x64_1x4_TypeCastExpertWeight_v1_Nswizzle0_Quant0_MulRoutedWeight1_silu_B16_B16_B16,0.0%,126.1828,moe_ck2stages_gemm2_256x32x64x64_1x4_TypeCast_v1_Nswizzle0_Quant0_MulRoutedWeight0_B16_B16_B16,0.0%,343.1275,0
80,64,4096,384,128,8,ActivationType.Silu,torch.bfloat16,torch.bfloat16,torch.bfloat16,QuantType.No,1,1,32,0,246.22,moe_ck2stages_gemm1_256x32x64x64_1x4_TypeCastExpertWeight_v1_Nswizzle0_Quant0_MulRoutedWeight1_silu_B16_B16_B16,0.0%,145.7239,moe_ck2stages_gemm2_256x32x64x64_1x4_TypeCast_v1_Nswizzle0_Quant0_MulRoutedWeight0_B16_B16_B16,0.0%,391.9439,0
80,128,4096,384,128,8,ActivationType.Silu,torch.bfloat16,torch.bfloat16,torch.bfloat16,QuantType.No,1,1,32,0,255.4375,moe_ck2stages_gemm1_256x32x64x64_1x4_TypeCastExpertWeight_v1_Nswizzle0_Quant0_MulRoutedWeight1_silu_B16_B16_B16,0.0%,152.2483,moe_ck2stages_gemm2_256x32x64x64_1x4_TypeCast_v1_Nswizzle0_Quant0_MulRoutedWeight0_B16_B16_B16,0.0%,407.6858,0
80,256,4096,384,128,8,ActivationType.Silu,torch.bfloat16,torch.bfloat16,torch.bfloat16,QuantType.No,1,1,32,0,271.8789,moe_ck2stages_gemm1_256x32x64x64_1x4_TypeCastExpertWeight_v1_Nswizzle0_Quant0_MulRoutedWeight1_silu_B16_B16_B16,0.0%,161.456,moe_ck2stages_gemm2_256x32x64x64_1x4_TypeCast_v1_Nswizzle0_Quant0_MulRoutedWeight0_B16_B16_B16,0.0%,433.3349,0
80,512,4096,384,128,8,ActivationType.Silu,torch.bfloat16,torch.bfloat16,torch.bfloat16,QuantType.No,1,1,32,0,347.2111,moe_ck2stages_gemm1_256x32x64x128_1x4_TypeCastExpertWeight_v1_Nswizzle0_Quant0_MulRoutedWeight1_silu_B16_B16_B16,0.0%,210.4569,moe_ck2stages_gemm2_256x32x64x64_1x4_TypeCast_v1_Nswizzle0_Quant0_MulRoutedWeight0_B16_B16_B16,0.0%,557.668,0
80,1024,4096,384,128,8,ActivationType.Silu,torch.bfloat16,torch.bfloat16,torch.bfloat16,QuantType.No,1,1,32,0,524.4171,moe_ck2stages_gemm1_256x32x64x128_1x4_TypeCastExpertWeight_v1_Nswizzle0_Quant0_MulRoutedWeight1_silu_B16_B16_B16,0.0%,354.8123,moe_ck2stages_gemm2_256x32x64x64_1x4_TypeCast_v1_Nswizzle0_Quant0_MulRoutedWeight0_B16_B16_B16,0.0%,879.2293999999999,0
80,16,4096,384,128,8,ActivationType.Silu,torch.bfloat16,torch.float8_e4m3fnuz,torch.float8_e4m3fnuz,QuantType.per_Tensor,1,0,32,0,82.6308,moe_ck2stages_gemm1_256x32x64x128_1x4_MulABScale_v1_Nswizzle0_Quant1_MulRoutedWeight0_silu_F8_F8_B16,0.0%,68.157,moe_ck2stages_gemm2_256x32x64x128_1x4_MulABScaleExpertWeight_v1_Nswizzle0_Quant1_MulRoutedWeight1_F8_F8_B16,0.4%,150.7878,0
80,32,4096,384,128,8,ActivationType.Silu,torch.bfloat16,torch.float8_e4m3fnuz,torch.float8_e4m3fnuz,QuantType.per_Tensor,1,0,32,0,109.4253,moe_ck2stages_gemm1_256x32x64x256_1x4_MulABScale_v1_Nswizzle0_Quant1_MulRoutedWeight0_silu_F8_F8_B16,0.0%,88.2541,moe_ck2stages_gemm2_256x32x64x128_1x4_MulABScaleExpertWeight_v1_Nswizzle0_Quant1_MulRoutedWeight1_F8_F8_B16,0.4%,197.6794,0
80,64,4096,384,128,8,ActivationType.Silu,torch.bfloat16,torch.float8_e4m3fnuz,torch.float8_e4m3fnuz,QuantType.per_Tensor,1,0,32,0,127.2465,moe_ck2stages_gemm1_256x32x64x128_1x4_MulABScale_v1_Nswizzle0_Quant1_MulRoutedWeight0_silu_F8_F8_B16,0.0%,102.2132,moe_ck2stages_gemm2_256x32x64x128_1x4_MulABScaleExpertWeight_v1_Nswizzle0_Quant1_MulRoutedWeight1_F8_F8_B16,0.4%,229.4597,0
80,128,4096,384,128,8,ActivationType.Silu,torch.bfloat16,torch.float8_e4m3fnuz,torch.float8_e4m3fnuz,QuantType.per_Tensor,1,0,32,0,132.4286,moe_ck2stages_gemm1_256x32x64x256_1x4_MulABScale_v1_Nswizzle0_Quant1_MulRoutedWeight0_silu_F8_F8_B16,0.0%,105.8564,moe_ck2stages_gemm2_256x32x64x128_1x4_MulABScaleExpertWeight_v1_Nswizzle0_Quant1_MulRoutedWeight1_F8_F8_B16,0.4%,238.285,0
80,256,4096,384,128,8,ActivationType.Silu,torch.bfloat16,torch.float8_e4m3fnuz,torch.float8_e4m3fnuz,QuantType.per_Tensor,1,0,32,0,134.0808,moe_ck2stages_gemm1_256x32x64x256_1x4_MulABScale_v1_Nswizzle0_Quant1_MulRoutedWeight0_silu_F8_F8_B16,0.0%,109.8052,moe_ck2stages_gemm2_256x32x64x128_1x4_MulABScaleExpertWeight_v1_Nswizzle0_Quant1_MulRoutedWeight1_F8_F8_B16,0.4%,243.886,0
80,512,4096,384,128,8,ActivationType.Silu,torch.bfloat16,torch.float8_e4m3fnuz,torch.float8_e4m3fnuz,QuantType.per_Tensor,1,0,32,0,179.6681,moe_ck2stages_gemm1_256x32x64x256_1x4_MulABScale_v1_Nswizzle0_Quant1_MulRoutedWeight0_silu_F8_F8_B16,0.0%,155.5374,moe_ck2stages_gemm2_256x32x64x128_1x4_MulABScaleExpertWeight_v1_Nswizzle0_Quant1_MulRoutedWeight1_F8_F8_B16,0.4%,335.20550000000003,0
80,1024,4096,384,128,8,ActivationType.Silu,torch.bfloat16,torch.float8_e4m3fnuz,torch.float8_e4m3fnuz,QuantType.per_Tensor,1,0,32,0,269.7206,moe_ck2stages_gemm1_256x32x64x256_1x4_MulABScale_v1_Nswizzle0_Quant1_MulRoutedWeight0_silu_F8_F8_B16,0.0%,263.4387,moe_ck2stages_gemm2_256x32x64x128_1x4_MulABScaleExpertWeight_v1_Nswizzle0_Quant1_MulRoutedWeight1_F8_F8_B16,0.4%,533.1593,0
80,16,4096,384,128,8,ActivationType.Silu,torch.bfloat16,torch.float8_e4m3fnuz,torch.float8_e4m3fnuz,QuantType.per_Tensor,1,1,32,0,83.7141,moe_ck2stages_gemm1_256x32x64x128_1x4_MulABScale_v1_Nswizzle0_Quant1_MulRoutedWeight1_silu_F8_F8_B16,0.0%,64.4684,moe_ck2stages_gemm2_256x32x64x128_1x4_MulABScaleExpertWeight_v1_Nswizzle0_Quant1_MulRoutedWeight0_F8_F8_B16,0.0%,148.1825,0
80,32,4096,384,128,8,ActivationType.Silu,torch.bfloat16,torch.float8_e4m3fnuz,torch.float8_e4m3fnuz,QuantType.per_Tensor,1,1,32,0,109.0496,moe_ck2stages_gemm1_256x32x64x256_1x4_MulABScale_v1_Nswizzle0_Quant1_MulRoutedWeight1_silu_F8_F8_B16,0.0%,83.8951,moe_ck2stages_gemm2_256x32x64x128_1x4_MulABScaleExpertWeight_v1_Nswizzle0_Quant1_MulRoutedWeight0_F8_F8_B16,0.0%,192.9447,0
80,64,4096,384,128,8,ActivationType.Silu,torch.bfloat16,torch.float8_e4m3fnuz,torch.float8_e4m3fnuz,QuantType.per_Tensor,1,1,32,0,127.6734,moe_ck2stages_gemm1_256x32x64x128_1x4_MulABScale_v1_Nswizzle0_Quant1_MulRoutedWeight1_silu_F8_F8_B16,0.0%,97.1704,moe_ck2stages_gemm2_256x32x64x128_1x4_MulABScaleExpertWeight_v1_Nswizzle0_Quant1_MulRoutedWeight0_F8_F8_B16,0.0%,224.8438,0
80,128,4096,384,128,8,ActivationType.Silu,torch.bfloat16,torch.float8_e4m3fnuz,torch.float8_e4m3fnuz,QuantType.per_Tensor,1,1,32,0,129.4139,_ZN5aiter57fmoe_stage1_bf16_pertokenFp8_doweight_g1u1_32x128_3tg_pf3E,0.0%,101.0604,moe_ck2stages_gemm2_256x32x64x128_1x4_MulABScaleExpertWeight_v1_Nswizzle0_Quant1_MulRoutedWeight0_F8_F8_B16,0.0%,230.47430000000003,0
80,256,4096,384,128,8,ActivationType.Silu,torch.bfloat16,torch.float8_e4m3fnuz,torch.float8_e4m3fnuz,QuantType.per_Tensor,1,1,32,0,134.708,moe_ck2stages_gemm1_256x32x64x256_1x4_MulABScale_v1_Nswizzle0_Quant1_MulRoutedWeight1_silu_F8_F8_B16,0.0%,105.5023,moe_ck2stages_gemm2_256x32x64x128_1x4_MulABScaleExpertWeight_v1_Nswizzle0_Quant1_MulRoutedWeight0_F8_F8_B16,0.0%,240.2103,0
80,512,4096,384,128,8,ActivationType.Silu,torch.bfloat16,torch.float8_e4m3fnuz,torch.float8_e4m3fnuz,QuantType.per_Tensor,1,1,32,0,178.7076,moe_ck2stages_gemm1_256x32x64x256_1x4_MulABScale_v1_Nswizzle0_Quant1_MulRoutedWeight1_silu_F8_F8_B16,0.0%,147.3146,moe_ck2stages_gemm2_256x32x64x128_1x4_MulABScaleExpertWeight_v1_Nswizzle0_Quant1_MulRoutedWeight0_F8_F8_B16,0.0%,326.0222,0
80,1024,4096,384,128,8,ActivationType.Silu,torch.bfloat16,torch.float8_e4m3fnuz,torch.float8_e4m3fnuz,QuantType.per_Tensor,1,1,32,0,269.4957,moe_ck2stages_gemm1_256x32x64x256_1x4_MulABScale_v1_Nswizzle0_Quant1_MulRoutedWeight1_silu_F8_F8_B16,0.0%,248.2335,moe_ck2stages_gemm2_256x32x64x128_1x4_MulABScaleExpertWeight_v1_Nswizzle0_Quant1_MulRoutedWeight0_F8_F8_B16,0.0%,517.7292,0
80,16,4096,384,128,8,ActivationType.Silu,torch.bfloat16,torch.float8_e4m3fnuz,torch.float8_e4m3fnuz,QuantType.per_Token,1,0,32,0,82.7173,_ZN5aiter47fmoe_stage1_bf16_pertokenFp8_g1u1_32x64_4tg_pf3E,0.3%,76.402,moe_ck2stages_gemm2_256x32x64x128_1x4_MulABScaleExpertWeight_v1_Nswizzle0_Quant2_MulRoutedWeight1_F8_F8_B16,0.4%,159.1193,0
80,32,4096,384,128,8,ActivationType.Silu,torch.bfloat16,torch.float8_e4m3fnuz,torch.float8_e4m3fnuz,QuantType.per_Token,1,0,32,0,109.8209,moe_ck2stages_gemm1_256x32x64x128_1x4_MulABScale_v1_Nswizzle0_Quant2_MulRoutedWeight0_silu_F8_F8_B16,0.0%,99.0655,moe_ck2stages_gemm2_256x32x64x128_1x4_MulABScaleExpertWeight_v1_Nswizzle0_Quant2_MulRoutedWeight1_F8_F8_B16,0.4%,208.8864,0
80,64,4096,384,128,8,ActivationType.Silu,torch.bfloat16,torch.float8_e4m3fnuz,torch.float8_e4m3fnuz,QuantType.per_Token,1,0,32,0,119.69,_ZN5aiter48fmoe_stage1_bf16_pertokenFp8_g1u1_32x128_3tg_pf3E,0.0%,114.5365,moe_ck2stages_gemm2_256x32x64x128_1x4_MulABScaleExpertWeight_v1_Nswizzle0_Quant2_MulRoutedWeight1_F8_F8_B16,0.4%,234.2265,0
80,128,4096,384,128,8,ActivationType.Silu,torch.bfloat16,torch.float8_e4m3fnuz,torch.float8_e4m3fnuz,QuantType.per_Token,1,0,32,0,131.0244,_ZN5aiter48fmoe_stage1_bf16_pertokenFp8_g1u1_32x128_3tg_pf3E,0.0%,119.5634,moe_ck2stages_gemm2_256x32x64x128_1x4_MulABScaleExpertWeight_v1_Nswizzle0_Quant2_MulRoutedWeight1_F8_F8_B16,0.4%,250.5878,0
80,256,4096,384,128,8,ActivationType.Silu,torch.bfloat16,torch.float8_e4m3fnuz,torch.float8_e4m3fnuz,QuantType.per_Token,1,0,32,0,129.4978,_ZN5aiter48fmoe_stage1_bf16_pertokenFp8_g1u1_32x128_3tg_pf3E,0.0%,126.7846,moe_ck2stages_gemm2_256x32x64x128_1x4_MulABScaleExpertWeight_v1_Nswizzle0_Quant2_MulRoutedWeight1_F8_F8_B16,0.4%,256.2824,0
80,512,4096,384,128,8,ActivationType.Silu,torch.bfloat16,torch.float8_e4m3fnuz,torch.float8_e4m3fnuz,QuantType.per_Token,1,0,32,0,174.904,_ZN5aiter48fmoe_stage1_bf16_pertokenFp8_g1u1_32x128_3tg_pf3E,0.0%,184.6529,moe_ck2stages_gemm2_256x32x64x128_1x4_MulABScaleExpertWeight_v1_Nswizzle0_Quant2_MulRoutedWeight1_F8_F8_B16,0.4%,359.5569,0
80,1024,4096,384,128,8,ActivationType.Silu,torch.bfloat16,torch.float8_e4m3fnuz,torch.float8_e4m3fnuz,QuantType.per_Token,1,0,32,0,272.1056,moe_ck2stages_gemm1_256x32x64x256_1x4_MulABScale_v1_Nswizzle0_Quant2_MulRoutedWeight0_silu_F8_F8_B16,0.0%,314.319,moe_ck2stages_gemm2_256x32x64x128_1x4_MulABScaleExpertWeight_v1_Nswizzle0_Quant2_MulRoutedWeight1_F8_F8_B16,0.4%,586.4246,0
80,16,4096,384,128,8,ActivationType.Silu,torch.bfloat16,torch.float8_e4m3fnuz,torch.float8_e4m3fnuz,QuantType.per_Token,1,1,32,0,82.1262,_ZN5aiter56fmoe_stage1_bf16_pertokenFp8_doweight_g1u1_32x64_4tg_pf3E,0.0%,74.17,moe_ck2stages_gemm2_256x32x64x128_1x4_MulABScaleExpertWeight_v1_Nswizzle0_Quant2_MulRoutedWeight0_F8_F8_B16,0.0%,156.2962,0
80,32,4096,384,128,8,ActivationType.Silu,torch.bfloat16,torch.float8_e4m3fnuz,torch.float8_e4m3fnuz,QuantType.per_Token,1,1,32,0,110.0096,_ZN5aiter57fmoe_stage1_bf16_pertokenFp8_doweight_g1u1_32x128_3tg_pf3E,0.0%,95.6992,moe_ck2stages_gemm2_256x32x64x128_1x4_MulABScaleExpertWeight_v1_Nswizzle0_Quant2_MulRoutedWeight0_F8_F8_B16,0.0%,205.7088,0
80,64,4096,384,128,8,ActivationType.Silu,torch.bfloat16,torch.float8_e4m3fnuz,torch.float8_e4m3fnuz,QuantType.per_Token,1,1,32,0,125.1757,moe_ck2stages_gemm1_256x32x64x256_1x4_MulABScale_v1_Nswizzle0_Quant2_MulRoutedWeight1_silu_F8_F8_B16,0.0%,111.2889,moe_ck2stages_gemm2_256x32x64x128_1x4_MulABScaleExpertWeight_v1_Nswizzle0_Quant2_MulRoutedWeight0_F8_F8_B16,0.0%,236.4646,0
80,128,4096,384,128,8,ActivationType.Silu,torch.bfloat16,torch.float8_e4m3fnuz,torch.float8_e4m3fnuz,QuantType.per_Token,1,1,32,0,129.4724,_ZN5aiter57fmoe_stage1_bf16_pertokenFp8_doweight_g1u1_32x128_3tg_pf3E,0.0%,116.1173,moe_ck2stages_gemm2_256x32x64x128_1x4_MulABScaleExpertWeight_v1_Nswizzle0_Quant2_MulRoutedWeight0_F8_F8_B16,0.0%,245.5897,0
80,256,4096,384,128,8,ActivationType.Silu,torch.bfloat16,torch.float8_e4m3fnuz,torch.float8_e4m3fnuz,QuantType.per_Token,1,1,32,0,136.164,_ZN5aiter57fmoe_stage1_bf16_pertokenFp8_doweight_g1u1_32x128_3tg_pf3E,0.0%,123.0773,moe_ck2stages_gemm2_256x32x64x128_1x4_MulABScaleExpertWeight_v1_Nswizzle0_Quant2_MulRoutedWeight0_F8_F8_B16,0.0%,259.2413,0
80,512,4096,384,128,8,ActivationType.Silu,torch.bfloat16,torch.float8_e4m3fnuz,torch.float8_e4m3fnuz,QuantType.per_Token,1,1,32,0,173.4458,_ZN5aiter57fmoe_stage1_bf16_pertokenFp8_doweight_g1u1_32x128_3tg_pf3E,0.0%,178.424,moe_ck2stages_gemm2_256x32x64x128_1x4_MulABScaleExpertWeight_v1_Nswizzle0_Quant2_MulRoutedWeight0_F8_F8_B16,0.0%,351.8698,0
80,1024,4096,384,128,8,ActivationType.Silu,torch.bfloat16,torch.float8_e4m3fnuz,torch.float8_e4m3fnuz,QuantType.per_Token,1,1,32,0,268.8237,moe_ck2stages_gemm1_256x32x64x256_1x4_MulABScale_v1_Nswizzle0_Quant2_MulRoutedWeight1_silu_F8_F8_B16,0.0%,301.9153,moe_ck2stages_gemm2_256x32x64x128_1x4_MulABScaleExpertWeight_v1_Nswizzle0_Quant2_MulRoutedWeight0_F8_F8_B16,0.0%,570.739,0
80,16,4096,384,128,8,ActivationType.Silu,torch.bfloat16,torch.float8_e4m3fnuz,torch.float8_e4m3fnuz,QuantType.per_1x128,1,0,64,0,137.6967,_ZN5aiter59fmoe_stage1_bf16_pertokenFp8_blockscale_g1u1_64x128_2tg_pf3E,4.8%,189.4446,moe_ck2stages_gemm2_256x64x128x128_1x4_MulABScaleExpertWeightA8W8blkscale_v3_Nswizzle0_Quant4_MulRoutedWeight1_F8_F8_B16,15.5%,327.1413,0
80,32,4096,384,128,8,ActivationType.Silu,torch.bfloat16,torch.float8_e4m3fnuz,torch.float8_e4m3fnuz,QuantType.per_1x128,1,0,64,0,170.3121,_ZN5aiter59fmoe_stage1_bf16_pertokenFp8_blockscale_g1u1_64x128_2tg_pf3E,4.9%,245.6729,moe_ck2stages_gemm2_256x64x128x128_1x4_MulABScaleExpertWeightA8W8blkscale_v3_Nswizzle0_Quant4_MulRoutedWeight1_F8_F8_B16,15.5%,415.985,0
80,64,4096,384,128,8,ActivationType.Silu,torch.bfloat16,torch.float8_e4m3fnuz,torch.float8_e4m3fnuz,QuantType.per_1x128,1,0,64,0,174.1132,_ZN5aiter59fmoe_stage1_bf16_pertokenFp8_blockscale_g1u1_64x128_2tg_pf3E,5.0%,281.1766,moe_ck2stages_gemm2_256x64x128x128_1x4_MulABScaleExpertWeightA8W8blkscale_v3_Nswizzle0_Quant4_MulRoutedWeight1_F8_F8_B16,15.5%,455.2898,0
80,128,4096,384,128,8,ActivationType.Silu,torch.bfloat16,torch.float8_e4m3fnuz,torch.float8_e4m3fnuz,QuantType.per_1x128,1,0,64,0,175.5153,_ZN5aiter59fmoe_stage1_bf16_pertokenFp8_blockscale_g1u1_64x128_2tg_pf3E,5.0%,290.2429,moe_ck2stages_gemm2_256x64x128x128_1x4_MulABScaleExpertWeightA8W8blkscale_v3_Nswizzle0_Quant4_MulRoutedWeight1_F8_F8_B16,15.6%,465.7582,0
80,256,4096,384,128,8,ActivationType.Silu,torch.bfloat16,torch.float8_e4m3fnuz,torch.float8_e4m3fnuz,QuantType.per_1x128,1,0,64,0,180.466,_ZN5aiter59fmoe_stage1_bf16_pertokenFp8_blockscale_g1u1_64x128_2tg_pf3E,5.0%,303.4173,moe_ck2stages_gemm2_256x64x128x128_1x4_MulABScaleExpertWeightA8W8blkscale_v3_Nswizzle0_Quant4_MulRoutedWeight1_F8_F8_B16,15.4%,483.8833,0
80,512,4096,384,128,8,ActivationType.Silu,torch.bfloat16,torch.float8_e4m3fnuz,torch.float8_e4m3fnuz,QuantType.per_1x128,1,0,64,0,193.6215,_ZN5aiter59fmoe_stage1_bf16_pertokenFp8_blockscale_g1u1_64x128_2tg_pf3E,5.0%,379.5661,moe_ck2stages_gemm2_256x64x128x128_1x4_MulABScaleExpertWeightA8W8blkscale_v3_Nswizzle0_Quant4_MulRoutedWeight1_F8_F8_B16,15.5%,573.1876,0
80,1024,4096,384,128,8,ActivationType.Silu,torch.bfloat16,torch.float8_e4m3fnuz,torch.float8_e4m3fnuz,QuantType.per_1x128,1,0,64,0,297.6803,_ZN5aiter59fmoe_stage1_bf16_pertokenFp8_blockscale_g1u1_64x128_2tg_pf3E,5.0%,611.5631,moe_ck2stages_gemm2_256x64x128x128_1x4_MulABScaleExpertWeightA8W8blkscale_v3_Nswizzle0_Quant4_MulRoutedWeight1_F8_F8_B16,15.4%,909.2434,0
80,16,4096,384,128,8,ActivationType.Silu,torch.bfloat16,torch.float8_e4m3fnuz,torch.float8_e4m3fnuz,QuantType.per_1x128,1,1,64,0,258.2192,moe_ck2stages_gemm1_256x64x128x128_1x4_MulABScaleExpertWeightA8W8blkscale_v3_Nswizzle0_Quant4_MulRoutedWeight1_silu_F8_F8_B16,0.0%,191.0288,moe_ck2stages_gemm2_256x64x128x128_1x4_MulABScaleExpertWeightA8W8blkscale_v3_Nswizzle0_Quant4_MulRoutedWeight0_F8_F8_B16,16.9%,449.248,0
80,32,4096,384,128,8,ActivationType.Silu,torch.bfloat16,torch.float8_e4m3fnuz,torch.float8_e4m3fnuz,QuantType.per_1x128,1,1,64,0,321.0962,moe_ck2stages_gemm1_256x64x128x128_1x4_MulABScaleExpertWeightA8W8blkscale_v3_Nswizzle0_Quant4_MulRoutedWeight1_silu_F8_F8_B16,0.0%,246.7595,moe_ck2stages_gemm2_256x64x128x128_1x4_MulABScaleExpertWeightA8W8blkscale_v3_Nswizzle0_Quant4_MulRoutedWeight0_F8_F8_B16,16.9%,567.8557000000001,0
80,64,4096,384,128,8,ActivationType.Silu,torch.bfloat16,torch.float8_e4m3fnuz,torch.float8_e4m3fnuz,QuantType.per_1x128,1,1,64,0,325.3923,moe_ck2stages_gemm1_256x64x128x128_1x4_MulABScaleExpertWeightA8W8blkscale_v3_Nswizzle0_Quant4_MulRoutedWeight1_silu_F8_F8_B16,0.0%,282.7636,moe_ck2stages_gemm2_256x64x128x128_1x4_MulABScaleExpertWeightA8W8blkscale_v3_Nswizzle0_Quant4_MulRoutedWeight0_F8_F8_B16,16.8%,608.1559,0
80,128,4096,384,128,8,ActivationType.Silu,torch.bfloat16,torch.float8_e4m3fnuz,torch.float8_e4m3fnuz,QuantType.per_1x128,1,1,64,0,332.9041,moe_ck2stages_gemm1_256x64x128x128_1x4_MulABScaleExpertWeightA8W8blkscale_v3_Nswizzle0_Quant4_MulRoutedWeight1_silu_F8_F8_B16,0.0%,290.7361,moe_ck2stages_gemm2_256x64x128x128_1x4_MulABScaleExpertWeightA8W8blkscale_v3_Nswizzle0_Quant4_MulRoutedWeight0_F8_F8_B16,16.7%,623.6402,0
80,256,4096,384,128,8,ActivationType.Silu,torch.bfloat16,torch.float8_e4m3fnuz,torch.float8_e4m3fnuz,QuantType.per_1x128,1,1,64,0,348.1054,moe_ck2stages_gemm1_256x64x128x128_1x4_MulABScaleExpertWeightA8W8blkscale_v3_Nswizzle0_Quant4_MulRoutedWeight1_silu_F8_F8_B16,0.0%,303.6483,moe_ck2stages_gemm2_256x64x128x128_1x4_MulABScaleExpertWeightA8W8blkscale_v3_Nswizzle0_Quant4_MulRoutedWeight0_F8_F8_B16,16.7%,651.7537,0
80,512,4096,384,128,8,ActivationType.Silu,torch.bfloat16,torch.float8_e4m3fnuz,torch.float8_e4m3fnuz,QuantType.per_1x128,1,1,64,0,374.2201,moe_ck2stages_gemm1_256x64x128x128_1x4_MulABScaleExpertWeightA8W8blkscale_v3_Nswizzle0_Quant4_MulRoutedWeight1_silu_F8_F8_B16,0.0%,380.6265,moe_ck2stages_gemm2_256x64x128x128_1x4_MulABScaleExpertWeightA8W8blkscale_v3_Nswizzle0_Quant4_MulRoutedWeight0_F8_F8_B16,16.7%,754.8466000000001,0
80,1024,4096,384,128,8,ActivationType.Silu,torch.bfloat16,torch.float8_e4m3fnuz,torch.float8_e4m3fnuz,QuantType.per_1x128,1,1,64,0,582.5626,moe_ck2stages_gemm1_256x64x128x128_1x4_MulABScaleExpertWeightA8W8blkscale_v3_Nswizzle0_Quant4_MulRoutedWeight1_silu_F8_F8_B16,0.0%,610.5687,moe_ck2stages_gemm2_256x64x128x128_1x4_MulABScaleExpertWeightA8W8blkscale_v3_Nswizzle0_Quant4_MulRoutedWeight0_F8_F8_B16,16.7%,1193.1313,0
80,16,4096,384,128,8,ActivationType.Gelu,torch.bfloat16,torch.bfloat16,torch.bfloat16,QuantType.No,1,0,32,0,165.0797,moe_ck2stages_gemm1_256x32x64x64_1x4_TypeCast_v1_Nswizzle0_Quant0_MulRoutedWeight0_gelu_B16_B16_B16,0.0%,96.9624,moe_ck2stages_gemm2_256x32x64x64_1x4_TypeCastExpertWeight_v1_Nswizzle0_Quant0_MulRoutedWeight1_B16_B16_B16,0.5%,262.0421,0
80,32,4096,384,128,8,ActivationType.Gelu,torch.bfloat16,torch.bfloat16,torch.bfloat16,QuantType.No,1,0,32,0,217.0102,moe_ck2stages_gemm1_256x32x64x64_1x4_TypeCast_v1_Nswizzle0_Quant0_MulRoutedWeight0_gelu_B16_B16_B16,0.0%,129.4305,moe_ck2stages_gemm2_256x32x64x64_1x4_TypeCastExpertWeight_v1_Nswizzle0_Quant0_MulRoutedWeight1_B16_B16_B16,0.5%,346.4407,0
80,64,4096,384,128,8,ActivationType.Gelu,torch.bfloat16,torch.bfloat16,torch.bfloat16,QuantType.No,1,0,32,0,241.1054,moe_ck2stages_gemm1_256x32x64x64_1x4_TypeCast_v1_Nswizzle0_Quant0_MulRoutedWeight0_gelu_B16_B16_B16,0.0%,150.0225,moe_ck2stages_gemm2_256x32x64x64_1x4_TypeCastExpertWeight_v1_Nswizzle0_Quant0_MulRoutedWeight1_B16_B16_B16,0.5%,391.1279,0
80,128,4096,384,128,8,ActivationType.Gelu,torch.bfloat16,torch.bfloat16,torch.bfloat16,QuantType.No,1,0,32,0,256.7095,moe_ck2stages_gemm1_256x32x64x64_1x4_TypeCast_v1_Nswizzle0_Quant0_MulRoutedWeight0_gelu_B16_B16_B16,0.0%,157.2573,moe_ck2stages_gemm2_256x32x64x64_1x4_TypeCastExpertWeight_v1_Nswizzle0_Quant0_MulRoutedWeight1_B16_B16_B16,0.5%,413.9668,0
80,256,4096,384,128,8,ActivationType.Gelu,torch.bfloat16,torch.bfloat16,torch.bfloat16,QuantType.No,1,0,32,0,265.3977,moe_ck2stages_gemm1_256x32x64x128_1x4_TypeCast_v1_Nswizzle0_Quant0_MulRoutedWeight0_gelu_B16_B16_B16,0.0%,166.4318,moe_ck2stages_gemm2_256x32x64x64_1x4_TypeCastExpertWeight_v1_Nswizzle0_Quant0_MulRoutedWeight1_B16_B16_B16,0.5%,431.8295,0
80,16,2048,192,128,8,ActivationType.Silu,torch.bfloat16,torch.bfloat16,torch.bfloat16,QuantType.No,1,0,32,0,38.52,moe_ck2stages_gemm1_256x32x64x64_1x4_TypeCast_v1_Nswizzle0_Quant0_MulRoutedWeight0_silu_B16_B16_B16,0.0%,36.2602,moe_ck2stages_gemm2_256x32x64x64_1x4_TypeCastExpertWeight_v1_Nswizzle0_Quant0_MulRoutedWeight1_B16_B16_B16,0.0%,74.78020000000001,0
80,32,2048,192,128,8,ActivationType.Silu,torch.bfloat16,torch.bfloat16,torch.bfloat16,QuantType.No,1,0,32,0,58.4576,moe_ck2stages_gemm1_256x32x64x64_1x4_TypeCast_v1_Nswizzle0_Quant0_MulRoutedWeight0_silu_B16_B16_B16,0.0%,49.4407,moe_ck2stages_gemm2_256x32x64x64_1x4_TypeCastExpertWeight_v1_Nswizzle0_Quant0_MulRoutedWeight1_B16_B16_B16,0.0%,107.8983,0
80,64,2048,192,128,8,ActivationType.Silu,torch.bfloat16,torch.bfloat16,torch.bfloat16,QuantType.No,1,0,32,0,62.2694,moe_ck2stages_gemm1_256x32x64x64_1x4_TypeCast_v1_Nswizzle0_Quant0_MulRoutedWeight0_silu_B16_B16_B16,0.0%,55.5013,moe_ck2stages_gemm2_256x32x64x64_1x4_TypeCastExpertWeight_v1_Nswizzle0_Quant0_MulRoutedWeight1_B16_B16_B16,0.0%,117.7707,0
80,128,2048,192,128,8,ActivationType.Silu,torch.bfloat16,torch.bfloat16,torch.bfloat16,QuantType.No,1,0,32,0,64.7876,moe_ck2stages_gemm1_256x32x64x64_1x4_TypeCast_v1_Nswizzle0_Quant0_MulRoutedWeight0_silu_B16_B16_B16,0.0%,57.4819,moe_ck2stages_gemm2_256x32x64x64_1x4_TypeCastExpertWeight_v1_Nswizzle0_Quant0_MulRoutedWeight1_B16_B16_B16,0.0%,122.2695,0
80,256,2048,192,128,8,ActivationType.Silu,torch.bfloat16,torch.bfloat16,torch.bfloat16,QuantType.No,1,0,32,0,66.8949,moe_ck2stages_gemm1_256x32x64x128_1x4_TypeCast_v1_Nswizzle0_Quant0_MulRoutedWeight0_silu_B16_B16_B16,0.0%,59.7486,moe_ck2stages_gemm2_256x32x64x64_1x4_TypeCastExpertWeight_v1_Nswizzle0_Quant0_MulRoutedWeight1_B16_B16_B16,0.0%,126.64350000000002,0
80,512,2048,192,128,8,ActivationType.Silu,torch.bfloat16,torch.bfloat16,torch.bfloat16,QuantType.No,1,0,32,0,94.7614,moe_ck2stages_gemm1_256x32x64x128_1x4_TypeCast_v1_Nswizzle0_Quant0_MulRoutedWeight0_silu_B16_B16_B16,0.0%,83.103,moe_ck2stages_gemm2_256x32x64x64_1x4_TypeCastExpertWeight_v1_Nswizzle0_Quant0_MulRoutedWeight1_B16_B16_B16,0.0%,177.8644,0
80,1024,2048,192,128,8,ActivationType.Silu,torch.bfloat16,torch.bfloat16,torch.bfloat16,QuantType.No,1,0,32,0,143.5168,moe_ck2stages_gemm1_256x32x64x64_1x4_TypeCast_v1_Nswizzle0_Quant0_MulRoutedWeight0_silu_B16_B16_B16,0.0%,134.0455,moe_ck2stages_gemm2_256x32x64x64_1x4_TypeCastExpertWeight_v1_Nswizzle0_Quant0_MulRoutedWeight1_B16_B16_B16,0.0%,277.5623,0
80,16,2048,192,128,8,ActivationType.Silu,torch.bfloat16,torch.bfloat16,torch.bfloat16,QuantType.No,1,1,32,0,38.6753,moe_ck2stages_gemm1_256x32x64x64_1x4_TypeCastExpertWeight_v1_Nswizzle0_Quant0_MulRoutedWeight1_silu_B16_B16_B16,0.0%,33.9165,moe_ck2stages_gemm2_256x32x64x64_1x4_TypeCast_v1_Nswizzle0_Quant0_MulRoutedWeight0_B16_B16_B16,0.0%,72.5918,0
80,32,2048,192,128,8,ActivationType.Silu,torch.bfloat16,torch.bfloat16,torch.bfloat16,QuantType.No,1,1,32,0,59.5728,moe_ck2stages_gemm1_256x32x64x64_1x4_TypeCastExpertWeight_v1_Nswizzle0_Quant0_MulRoutedWeight1_silu_B16_B16_B16,0.0%,45.8094,moe_ck2stages_gemm2_256x32x64x64_1x4_TypeCast_v1_Nswizzle0_Quant0_MulRoutedWeight0_B16_B16_B16,0.0%,105.3822,0
80,64,2048,192,128,8,ActivationType.Silu,torch.bfloat16,torch.bfloat16,torch.bfloat16,QuantType.No,1,1,32,0,62.2801,moe_ck2stages_gemm1_256x32x64x64_1x4_TypeCastExpertWeight_v1_Nswizzle0_Quant0_MulRoutedWeight1_silu_B16_B16_B16,0.0%,51.218,moe_ck2stages_gemm2_256x32x64x64_1x4_TypeCast_v1_Nswizzle0_Quant0_MulRoutedWeight0_B16_B16_B16,0.0%,113.4981,0
80,128,2048,192,128,8,ActivationType.Silu,torch.bfloat16,torch.bfloat16,torch.bfloat16,QuantType.No,1,1,32,0,64.8002,moe_ck2stages_gemm1_256x32x64x64_1x4_TypeCastExpertWeight_v1_Nswizzle0_Quant0_MulRoutedWeight1_silu_B16_B16_B16,0.0%,52.9275,moe_ck2stages_gemm2_256x32x64x64_1x4_TypeCast_v1_Nswizzle0_Quant0_MulRoutedWeight0_B16_B16_B16,0.0%,117.7277,0
80,256,2048,192,128,8,ActivationType.Silu,torch.bfloat16,torch.bfloat16,torch.bfloat16,QuantType.No,1,1,32,0,68.4938,moe_ck2stages_gemm1_256x32x64x128_1x4_TypeCastExpertWeight_v1_Nswizzle0_Quant0_MulRoutedWeight1_silu_B16_B16_B16,0.0%,55.1259,moe_ck2stages_gemm2_256x32x64x64_1x4_TypeCast_v1_Nswizzle0_Quant0_MulRoutedWeight0_B16_B16_B16,0.0%,123.6197,0
80,512,2048,192,128,8,ActivationType.Silu,torch.bfloat16,torch.bfloat16,torch.bfloat16,QuantType.No,1,1,32,0,95.8693,moe_ck2stages_gemm1_256x32x64x128_1x4_TypeCastExpertWeight_v1_Nswizzle0_Quant0_MulRoutedWeight1_silu_B16_B16_B16,0.0%,76.473,moe_ck2stages_gemm2_256x32x64x64_1x4_TypeCast_v1_Nswizzle0_Quant0_MulRoutedWeight0_B16_B16_B16,0.0%,172.3423,0
80,1024,2048,192,128,8,ActivationType.Silu,torch.bfloat16,torch.bfloat16,torch.bfloat16,QuantType.No,1,1,32,0,141.5184,moe_ck2stages_gemm1_256x32x64x128_1x4_TypeCastExpertWeight_v1_Nswizzle0_Quant0_MulRoutedWeight1_silu_B16_B16_B16,0.0%,122.9113,moe_ck2stages_gemm2_256x32x64x64_1x4_TypeCast_v1_Nswizzle0_Quant0_MulRoutedWeight0_B16_B16_B16,0.0%,264.4297,0
80,32,7168,256,256,8,ActivationType.Silu,torch.bfloat16,torch.float8_e4m3fnuz,torch.float8_e4m3fnuz,QuantType.per_Token,1,1,32,0,191.3917,moe_ck2stages_gemm1_256x32x64x256_1x4_MulABScale_v1_Nswizzle0_Quant2_MulRoutedWeight1_silu_F8_F8_B16,0.0%,200.8431,moe_ck2stages_gemm2_256x32x64x256_1x4_MulABScaleExpertWeight_v1_Nswizzle0_Quant2_MulRoutedWeight0_F8_F8_B16,0.0%,392.2348,0
80,64,7168,256,256,8,ActivationType.Silu,torch.bfloat16,torch.float8_e4m3fnuz,torch.float8_e4m3fnuz,QuantType.per_Token,1,1,32,0,243.4825,_ZN5aiter57fmoe_stage1_bf16_pertokenFp8_doweight_g1u1_32x128_3tg_pf3E,0.0%,262.4499,moe_ck2stages_gemm2_256x32x64x256_1x4_MulABScaleExpertWeight_v1_Nswizzle0_Quant2_MulRoutedWeight0_F8_F8_B16,0.0%,505.9324,0
80,128,7168,256,256,8,ActivationType.Silu,torch.bfloat16,torch.float8_e4m3fnuz,torch.float8_e4m3fnuz,QuantType.per_Token,1,1,32,0,287.1619,moe_ck2stages_gemm1_256x32x64x128_1x4_MulABScale_v1_Nswizzle0_Quant2_MulRoutedWeight1_silu_F8_F8_B16,0.0%,303.9818,moe_ck2stages_gemm2_256x32x64x256_1x4_MulABScaleExpertWeight_v1_Nswizzle0_Quant2_MulRoutedWeight0_F8_F8_B16,0.0%,591.1437000000001,0
80,256,7168,256,256,8,ActivationType.Silu,torch.bfloat16,torch.float8_e4m3fnuz,torch.float8_e4m3fnuz,QuantType.per_Token,1,1,32,0,292.8938,moe_ck2stages_gemm1_256x32x64x256_1x4_MulABScale_v1_Nswizzle0_Quant2_MulRoutedWeight1_silu_F8_F8_B16,0.0%,319.6213,moe_ck2stages_gemm2_256x32x64x256_1x4_MulABScaleExpertWeight_v1_Nswizzle0_Quant2_MulRoutedWeight0_F8_F8_B16,0.0%,612.5151000000001,0
80,512,7168,256,256,8,ActivationType.Silu,torch.bfloat16,torch.float8_e4m3fnuz,torch.float8_e4m3fnuz,QuantType.per_Token,1,1,32,0,305.4473,_ZN5aiter57fmoe_stage1_bf16_pertokenFp8_doweight_g1u1_32x128_3tg_pf3E,0.0%,349.9039,moe_ck2stages_gemm2_256x32x64x128_1x4_MulABScaleExpertWeight_v1_Nswizzle0_Quant2_MulRoutedWeight0_F8_F8_B16,0.0%,655.3512000000001,0
80,1024,7168,256,256,8,ActivationType.Silu,torch.bfloat16,torch.float8_e4m3fnuz,torch.float8_e4m3fnuz,QuantType.per_Token,1,1,32,0,394.0843,_ZN5aiter57fmoe_stage1_bf16_pertokenFp8_doweight_g1u1_32x256_2tg_pf3E,0.0%,517.6212,moe_ck2stages_gemm2_256x32x64x128_1x4_MulABScaleExpertWeight_v1_Nswizzle0_Quant2_MulRoutedWeight0_F8_F8_B16,0.0%,911.7055,0
80,16,7168,256,256,8,ActivationType.Silu,torch.bfloat16,torch.float8_e4m3fnuz,torch.float8_e4m3fnuz,QuantType.per_1x128,1,0,64,0,173.8206,_ZN5aiter59fmoe_stage1_bf16_pertokenFp8_blockscale_g1u1_64x128_2tg_pf3E,4.8%,362.9131,moe_ck2stages_gemm2_256x64x128x128_1x4_MulABScaleExpertWeightA8W8blkscale_v3_Nswizzle0_Quant4_MulRoutedWeight1_F8_F8_B16,15.6%,536.7337,0
80,32,7168,256,256,8,ActivationType.Silu,torch.bfloat16,torch.float8_e4m3fnuz,torch.float8_e4m3fnuz,QuantType.per_1x128,1,0,64,0,283.1441,_ZN5aiter59fmoe_stage1_bf16_pertokenFp8_blockscale_g1u1_64x128_2tg_pf3E,5.0%,584.1378,moe_ck2stages_gemm2_256x64x128x128_1x4_MulABScaleExpertWeightA8W8blkscale_v3_Nswizzle0_Quant4_MulRoutedWeight1_F8_F8_B16,15.6%,867.2819,0
80,64,7168,256,256,8,ActivationType.Silu,torch.bfloat16,torch.float8_e4m3fnuz,torch.float8_e4m3fnuz,QuantType.per_1x128,1,0,64,0,348.4948,_ZN5aiter59fmoe_stage1_bf16_pertokenFp8_blockscale_g1u1_64x128_2tg_pf3E,5.0%,770.8557,moe_ck2stages_gemm2_256x64x128x128_1x4_MulABScaleExpertWeightA8W8blkscale_v3_Nswizzle0_Quant4_MulRoutedWeight1_F8_F8_B16,15.6%,1119.3505,0
80,128,7168,256,256,8,ActivationType.Silu,torch.bfloat16,torch.float8_e4m3fnuz,torch.float8_e4m3fnuz,QuantType.per_1x128,1,0,64,0,400.1271,_ZN5aiter59fmoe_stage1_bf16_pertokenFp8_blockscale_g1u1_64x128_2tg_pf3E,5.0%,873.4093,moe_ck2stages_gemm2_256x64x128x128_1x4_MulABScaleExpertWeightA8W8blkscale_v3_Nswizzle0_Quant4_MulRoutedWeight1_F8_F8_B16,15.5%,1273.5364,0
80,256,7168,256,256,8,ActivationType.Silu,torch.bfloat16,torch.float8_e4m3fnuz,torch.float8_e4m3fnuz,QuantType.per_1x128,1,0,64,0,398.4198,_ZN5aiter59fmoe_stage1_bf16_pertokenFp8_blockscale_g1u1_64x128_2tg_pf3E,5.0%,899.3568,moe_ck2stages_gemm2_256x64x128x128_1x4_MulABScaleExpertWeightA8W8blkscale_v3_Nswizzle0_Quant4_MulRoutedWeight1_F8_F8_B16,15.6%,1297.7766,0
80,512,7168,256,256,8,ActivationType.Silu,torch.bfloat16,torch.float8_e4m3fnuz,torch.float8_e4m3fnuz,QuantType.per_1x128,1,0,64,0,411.5888,_ZN5aiter59fmoe_stage1_bf16_pertokenFp8_blockscale_g1u1_64x128_2tg_pf3E,4.9%,932.8455,moe_ck2stages_gemm2_256x64x128x128_1x4_MulABScaleExpertWeightA8W8blkscale_v3_Nswizzle0_Quant4_MulRoutedWeight1_F8_F8_B16,15.6%,1344.4343,0
80,1024,7168,256,256,8,ActivationType.Silu,torch.bfloat16,torch.float8_e4m3fnuz,torch.float8_e4m3fnuz,QuantType.per_1x128,1,0,64,0,450.8786,_ZN5aiter59fmoe_stage1_bf16_pertokenFp8_blockscale_g1u1_64x128_2tg_pf3E,5.0%,1182.7394,moe_ck2stages_gemm2_256x64x128x128_1x4_MulABScaleExpertWeightA8W8blkscale_v3_Nswizzle0_Quant4_MulRoutedWeight1_F8_F8_B16,15.6%,1633.618,0
80,16,7168,256,256,8,ActivationType.Silu,torch.bfloat16,torch.float8_e4m3fnuz,torch.float8_e4m3fnuz,QuantType.per_1x128,1,1,64,0,318.4718,moe_ck2stages_gemm1_256x64x128x128_1x4_MulABScaleExpertWeightA8W8blkscale_v3_Nswizzle0_Quant4_MulRoutedWeight1_silu_F8_F8_B16,0.0%,359.9798,moe_ck2stages_gemm2_256x64x128x128_1x4_MulABScaleExpertWeightA8W8blkscale_v3_Nswizzle0_Quant4_MulRoutedWeight0_F8_F8_B16,16.6%,678.4516,0
80,32,7168,256,256,8,ActivationType.Silu,torch.bfloat16,torch.float8_e4m3fnuz,torch.float8_e4m3fnuz,QuantType.per_1x128,1,1,64,0,524.5702,moe_ck2stages_gemm1_256x64x128x128_1x4_MulABScaleExpertWeightA8W8blkscale_v3_Nswizzle0_Quant4_MulRoutedWeight1_silu_F8_F8_B16,0.0%,579.9509,moe_ck2stages_gemm2_256x64x128x128_1x4_MulABScaleExpertWeightA8W8blkscale_v3_Nswizzle0_Quant4_MulRoutedWeight0_F8_F8_B16,16.6%,1104.5211,0
80,64,7168,256,256,8,ActivationType.Silu,torch.bfloat16,torch.float8_e4m3fnuz,torch.float8_e4m3fnuz,QuantType.per_1x128,1,1,64,0,631.3181,moe_ck2stages_gemm1_256x64x128x128_1x4_MulABScaleExpertWeightA8W8blkscale_v3_Nswizzle0_Quant4_MulRoutedWeight1_silu_F8_F8_B16,0.0%,761.4466,moe_ck2stages_gemm2_256x64x128x128_1x4_MulABScaleExpertWeightA8W8blkscale_v3_Nswizzle0_Quant4_MulRoutedWeight0_F8_F8_B16,16.6%,1392.7647,0
80,128,7168,256,256,8,ActivationType.Silu,torch.bfloat16,torch.float8_e4m3fnuz,torch.float8_e4m3fnuz,QuantType.per_1x128,1,1,64,0,735.859,moe_ck2stages_gemm1_256x64x128x128_1x4_MulABScaleExpertWeightA8W8blkscale_v3_Nswizzle0_Quant4_MulRoutedWeight1_silu_F8_F8_B16,0.0%,867.1544,moe_ck2stages_gemm2_256x64x128x128_1x4_MulABScaleExpertWeightA8W8blkscale_v3_Nswizzle0_Quant4_MulRoutedWeight0_F8_F8_B16,16.6%,1603.0134,0
80,256,7168,256,256,8,ActivationType.Silu,torch.bfloat16,torch.float8_e4m3fnuz,torch.float8_e4m3fnuz,QuantType.per_1x128,1,1,64,0,755.7391,moe_ck2stages_gemm1_256x64x128x128_1x4_MulABScaleExpertWeightA8W8blkscale_v3_Nswizzle0_Quant4_MulRoutedWeight1_silu_F8_F8_B16,0.0%,889.3453,moe_ck2stages_gemm2_256x64x128x128_1x4_MulABScaleExpertWeightA8W8blkscale_v3_Nswizzle0_Quant4_MulRoutedWeight0_F8_F8_B16,16.6%,1645.0844,0
80,512,7168,256,256,8,ActivationType.Silu,torch.bfloat16,torch.float8_e4m3fnuz,torch.float8_e4m3fnuz,QuantType.per_1x128,1,1,64,0,789.2709,moe_ck2stages_gemm1_256x64x128x128_1x4_MulABScaleExpertWeightA8W8blkscale_v3_Nswizzle0_Quant4_MulRoutedWeight1_silu_F8_F8_B16,0.0%,928.2071,moe_ck2stages_gemm2_256x64x128x128_1x4_MulABScaleExpertWeightA8W8blkscale_v3_Nswizzle0_Quant4_MulRoutedWeight0_F8_F8_B16,16.6%,1717.478,0
80,1024,7168,256,256,8,ActivationType.Silu,torch.bfloat16,torch.float8_e4m3fnuz,torch.float8_e4m3fnuz,QuantType.per_1x128,1,1,64,0,852.6112,moe_ck2stages_gemm1_256x64x128x128_1x4_MulABScaleExpertWeightA8W8blkscale_v3_Nswizzle0_Quant4_MulRoutedWeight1_silu_F8_F8_B16,0.0%,1174.1346,moe_ck2stages_gemm2_256x64x128x128_1x4_MulABScaleExpertWeightA8W8blkscale_v3_Nswizzle0_Quant4_MulRoutedWeight0_F8_F8_B16,16.7%,2026.7458,0
80,16,7168,256,256,8,ActivationType.Gelu,torch.bfloat16,torch.bfloat16,torch.bfloat16,QuantType.No,1,0,32,0,241.3413,moe_ck2stages_gemm1_256x32x64x128_1x4_TypeCast_v1_Nswizzle0_Quant0_MulRoutedWeight0_gelu_B16_B16_B16,0.0%,156.5265,moe_ck2stages_gemm2_256x32x64x64_1x4_TypeCastExpertWeight_v1_Nswizzle0_Quant0_MulRoutedWeight1_B16_B16_B16,1.7%,397.8678,0
80,32,7168,256,256,8,ActivationType.Gelu,torch.bfloat16,torch.bfloat16,torch.bfloat16,QuantType.No,1,0,32,0,368.8396,moe_ck2stages_gemm1_256x32x64x64_1x4_TypeCast_v1_Nswizzle0_Quant0_MulRoutedWeight0_gelu_B16_B16_B16,0.0%,244.9596,moe_ck2stages_gemm2_256x32x64x64_1x4_TypeCastExpertWeight_v1_Nswizzle0_Quant0_MulRoutedWeight1_B16_B16_B16,1.6%,613.7992,0
80,64,7168,256,256,8,ActivationType.Gelu,torch.bfloat16,torch.bfloat16,torch.bfloat16,QuantType.No,1,0,32,0,486.2218,moe_ck2stages_gemm1_256x32x64x64_1x4_TypeCast_v1_Nswizzle0_Quant0_MulRoutedWeight0_gelu_B16_B16_B16,0.0%,330.374,moe_ck2stages_gemm2_256x32x64x64_1x4_TypeCastExpertWeight_v1_Nswizzle0_Quant0_MulRoutedWeight1_B16_B16_B16,1.6%,816.5958,0
80,128,7168,256,256,8,ActivationType.Gelu,torch.bfloat16,torch.bfloat16,torch.bfloat16,QuantType.No,1,0,32,0,569.5169,moe_ck2stages_gemm1_256x32x64x64_1x4_TypeCast_v1_Nswizzle0_Quant0_MulRoutedWeight0_gelu_B16_B16_B16,0.0%,372.7784,moe_ck2stages_gemm2_256x32x64x64_1x4_TypeCastExpertWeight_v1_Nswizzle0_Quant0_MulRoutedWeight1_B16_B16_B16,1.6%,942.2953,0
80,256,7168,256,256,8,ActivationType.Gelu,torch.bfloat16,torch.bfloat16,torch.bfloat16,QuantType.No,1,0,32,0,587.3979,moe_ck2stages_gemm1_256x32x64x64_1x4_TypeCast_v1_Nswizzle0_Quant0_MulRoutedWeight0_gelu_B16_B16_B16,0.0%,399.9114,moe_ck2stages_gemm2_256x32x64x64_1x4_TypeCastExpertWeight_v1_Nswizzle0_Quant0_MulRoutedWeight1_B16_B16_B16,1.6%,987.3093,0
80,512,7168,256,256,8,ActivationType.Gelu,torch.bfloat16,torch.bfloat16,torch.bfloat16,QuantType.No,1,0,32,0,619.5779,moe_ck2stages_gemm1_256x32x64x64_1x4_TypeCast_v1_Nswizzle0_Quant0_MulRoutedWeight0_gelu_B16_B16_B16,0.0%,428.3394,moe_ck2stages_gemm2_256x32x64x64_1x4_TypeCastExpertWeight_v1_Nswizzle0_Quant0_MulRoutedWeight1_B16_B16_B16,1.6%,1047.9173,0
80,1024,7168,256,256,8,ActivationType.Gelu,torch.bfloat16,torch.bfloat16,torch.bfloat16,QuantType.No,1,0,32,0,785.2244,moe_ck2stages_gemm1_256x32x64x128_1x4_TypeCast_v1_Nswizzle0_Quant0_MulRoutedWeight0_gelu_B16_B16_B16,0.0%,600.8826,moe_ck2stages_gemm2_256x32x64x64_1x4_TypeCastExpertWeight_v1_Nswizzle0_Quant0_MulRoutedWeight1_B16_B16_B16,1.6%,1386.107,0
80,16,7168,256,256,8,ActivationType.Gelu,torch.bfloat16,torch.bfloat16,torch.bfloat16,QuantType.No,1,1,32,0,239.8912,moe_ck2stages_gemm1_256x32x64x128_1x4_TypeCastExpertWeight_v1_Nswizzle0_Quant0_MulRoutedWeight1_gelu_B16_B16_B16,0.0%,147.6741,moe_ck2stages_gemm2_256x32x64x64_1x4_TypeCast_v1_Nswizzle0_Quant0_MulRoutedWeight0_B16_B16_B16,0.0%,387.5653,0
80,32,7168,256,256,8,ActivationType.Gelu,torch.bfloat16,torch.bfloat16,torch.bfloat16,QuantType.No,1,1,32,0,368.433,moe_ck2stages_gemm1_256x32x64x64_1x4_TypeCastExpertWeight_v1_Nswizzle0_Quant0_MulRoutedWeight1_gelu_B16_B16_B16,0.0%,237.6243,moe_ck2stages_gemm2_256x32x64x64_1x4_TypeCast_v1_Nswizzle0_Quant0_MulRoutedWeight0_B16_B16_B16,0.0%,606.0572999999999,0
80,64,7168,256,256,8,ActivationType.Gelu,torch.bfloat16,torch.bfloat16,torch.bfloat16,QuantType.No,1,1,32,0,493.7026,moe_ck2stages_gemm1_256x32x64x64_1x4_TypeCastExpertWeight_v1_Nswizzle0_Quant0_MulRoutedWeight1_gelu_B16_B16_B16,0.0%,313.5552,moe_ck2stages_gemm2_256x32x64x64_1x4_TypeCast_v1_Nswizzle0_Quant0_MulRoutedWeight0_B16_B16_B16,0.0%,807.2578000000001,0
80,128,7168,256,256,8,ActivationType.Gelu,torch.bfloat16,torch.bfloat16,torch.bfloat16,QuantType.No,1,1,32,0,568.3004,moe_ck2stages_gemm1_256x32x64x64_1x4_TypeCastExpertWeight_v1_Nswizzle0_Quant0_MulRoutedWeight1_gelu_B16_B16_B16,0.0%,363.255,moe_ck2stages_gemm2_256x32x64x64_1x4_TypeCast_v1_Nswizzle0_Quant0_MulRoutedWeight0_B16_B16_B16,0.0%,931.5554,0
80,256,7168,256,256,8,ActivationType.Gelu,torch.bfloat16,torch.bfloat16,torch.bfloat16,QuantType.No,1,1,32,0,593.7672,moe_ck2stages_gemm1_256x32x64x64_1x4_TypeCastExpertWeight_v1_Nswizzle0_Quant0_MulRoutedWeight1_gelu_B16_B16_B16,0.0%,382.7183,moe_ck2stages_gemm2_256x32x64x64_1x4_TypeCast_v1_Nswizzle0_Quant0_MulRoutedWeight0_B16_B16_B16,0.0%,976.4855,0
80,512,7168,256,256,8,ActivationType.Gelu,torch.bfloat16,torch.bfloat16,torch.bfloat16,QuantType.No,1,1,32,0,617.3315,moe_ck2stages_gemm1_256x32x64x64_1x4_TypeCastExpertWeight_v1_Nswizzle0_Quant0_MulRoutedWeight1_gelu_B16_B16_B16,0.0%,411.0096,moe_ck2stages_gemm2_256x32x64x64_1x4_TypeCast_v1_Nswizzle0_Quant0_MulRoutedWeight0_B16_B16_B16,0.0%,1028.3411,0
80,1024,7168,256,256,8,ActivationType.Gelu,torch.bfloat16,torch.bfloat16,torch.bfloat16,QuantType.No,1,1,32,0,781.9082,moe_ck2stages_gemm1_256x32x64x128_1x4_TypeCastExpertWeight_v1_Nswizzle0_Quant0_MulRoutedWeight1_gelu_B16_B16_B16,0.0%,569.3894,moe_ck2stages_gemm2_256x32x64x64_1x4_TypeCast_v1_Nswizzle0_Quant0_MulRoutedWeight0_B16_B16_B16,0.0%,1351.2976,0
80,16,7168,256,256,8,ActivationType.Silu,torch.bfloat16,torch.float8_e4m3fnuz,torch.float8_e4m3fnuz,QuantType.per_Token,1,1,32,0,118.5389,moe_ck2stages_gemm1_256x32x64x128_1x4_MulABScale_v1_Nswizzle0_Quant2_MulRoutedWeight1_silu_F8_F8_B16,0.0%,118.5512,moe_ck2stages_gemm2_256x32x64x128_1x4_MulABScaleExpertWeight_v1_Nswizzle0_Quant2_MulRoutedWeight0_F8_F8_B16,0.0%,237.0901,0
80,16,7168,256,256,8,ActivationType.Gelu,torch.bfloat16,torch.float8_e4m3fnuz,torch.float8_e4m3fnuz,QuantType.per_Tensor,1,0,32,0,120.5717,moe_ck2stages_gemm1_256x32x64x256_1x4_MulABScale_v1_Nswizzle0_Quant1_MulRoutedWeight0_gelu_F8_F8_B16,0.0%,117.6181,moe_ck2stages_gemm2_256x32x64x128_1x4_MulABScaleExpertWeight_v1_Nswizzle0_Quant1_MulRoutedWeight1_F8_F8_B16,1.7%,238.1898,0
80,32,7168,256,256,8,ActivationType.Gelu,torch.bfloat16,torch.float8_e4m3fnuz,torch.float8_e4m3fnuz,QuantType.per_Tensor,1,0,32,0,188.5396,moe_ck2stages_gemm1_256x32x64x128_1x4_MulABScale_v1_Nswizzle0_Quant1_MulRoutedWeight0_gelu_F8_F8_B16,0.0%,176.4776,moe_ck2stages_gemm2_256x32x64x128_1x4_MulABScaleExpertWeight_v1_Nswizzle0_Quant1_MulRoutedWeight1_F8_F8_B16,1.6%,365.0172,0
80,64,7168,256,256,8,ActivationType.Gelu,torch.bfloat16,torch.float8_e4m3fnuz,torch.float8_e4m3fnuz,QuantType.per_Tensor,1,0,32,0,252.7997,moe_ck2stages_gemm1_256x32x64x128_1x4_MulABScale_v1_Nswizzle0_Quant1_MulRoutedWeight0_gelu_F8_F8_B16,0.0%,230.1231,moe_ck2stages_gemm2_256x32x64x128_1x4_MulABScaleExpertWeight_v1_Nswizzle0_Quant1_MulRoutedWeight1_F8_F8_B16,1.7%,482.9228,0
80,128,7168,256,256,8,ActivationType.Gelu,torch.bfloat16,torch.float8_e4m3fnuz,torch.float8_e4m3fnuz,QuantType.per_Tensor,1,0,32,0,278.3578,moe_ck2stages_gemm1_256x32x64x256_1x4_MulABScale_v1_Nswizzle0_Quant1_MulRoutedWeight0_gelu_F8_F8_B16,0.0%,264.9256,moe_ck2stages_gemm2_256x32x64x128_1x4_MulABScaleExpertWeight_v1_Nswizzle0_Quant1_MulRoutedWeight1_F8_F8_B16,1.6%,543.2834,0
80,256,7168,256,256,8,ActivationType.Gelu,torch.bfloat16,torch.float8_e4m3fnuz,torch.float8_e4m3fnuz,QuantType.per_Tensor,1,0,32,0,301.0401,_ZN5aiter48fmoe_stage1_bf16_pertokenFp8_g1u1_32x128_3tg_pf3E,0.0%,279.1768,moe_ck2stages_gemm2_256x32x64x128_1x4_MulABScaleExpertWeight_v1_Nswizzle0_Quant1_MulRoutedWeight1_F8_F8_B16,1.6%,580.2169,0
80,512,7168,256,256,8,ActivationType.Gelu,torch.bfloat16,torch.float8_e4m3fnuz,torch.float8_e4m3fnuz,QuantType.per_Tensor,1,0,32,0,314.4244,_ZN5aiter48fmoe_stage1_bf16_pertokenFp8_g1u1_32x128_3tg_pf3E,0.0%,297.6385,moe_ck2stages_gemm2_256x32x64x128_1x4_MulABScaleExpertWeight_v1_Nswizzle0_Quant1_MulRoutedWeight1_F8_F8_B16,1.6%,612.0629,0
80,1024,7168,256,256,8,ActivationType.Gelu,torch.bfloat16,torch.float8_e4m3fnuz,torch.float8_e4m3fnuz,QuantType.per_Tensor,1,0,32,0,388.4815,moe_ck2stages_gemm1_256x32x64x256_1x4_MulABScale_v1_Nswizzle0_Quant1_MulRoutedWeight0_gelu_F8_F8_B16,0.0%,429.5016,moe_ck2stages_gemm2_256x32x64x128_1x4_MulABScaleExpertWeight_v1_Nswizzle0_Quant1_MulRoutedWeight1_F8_F8_B16,1.6%,817.9830999999999,0
80,16,7168,256,256,8,ActivationType.Gelu,torch.bfloat16,torch.float8_e4m3fnuz,torch.float8_e4m3fnuz,QuantType.per_Tensor,1,1,32,0,121.9866,moe_ck2stages_gemm1_256x32x64x256_1x4_MulABScale_v1_Nswizzle0_Quant1_MulRoutedWeight1_gelu_F8_F8_B16,0.0%,113.0687,moe_ck2stages_gemm2_256x32x64x128_1x4_MulABScaleExpertWeight_v1_Nswizzle0_Quant1_MulRoutedWeight0_F8_F8_B16,0.0%,235.0553,0
80,32,7168,256,256,8,ActivationType.Gelu,torch.bfloat16,torch.float8_e4m3fnuz,torch.float8_e4m3fnuz,QuantType.per_Tensor,1,1,32,0,191.3402,moe_ck2stages_gemm1_256x32x64x256_1x4_MulABScale_v1_Nswizzle0_Quant1_MulRoutedWeight1_gelu_F8_F8_B16,0.0%,169.9426,moe_ck2stages_gemm2_256x32x64x128_1x4_MulABScaleExpertWeight_v1_Nswizzle0_Quant1_MulRoutedWeight0_F8_F8_B16,0.0%,361.2828,0
80,64,7168,256,256,8,ActivationType.Gelu,torch.bfloat16,torch.float8_e4m3fnuz,torch.float8_e4m3fnuz,QuantType.per_Tensor,1,1,32,0,253.0207,_ZN5aiter56fmoe_stage1_bf16_pertokenFp8_doweight_g1u1_32x64_4tg_pf3E,0.0%,220.8733,moe_ck2stages_gemm2_256x32x64x128_1x4_MulABScaleExpertWeight_v1_Nswizzle0_Quant1_MulRoutedWeight0_F8_F8_B16,0.0%,473.894,0
80,128,7168,256,256,8,ActivationType.Gelu,torch.bfloat16,torch.float8_e4m3fnuz,torch.float8_e4m3fnuz,QuantType.per_Tensor,1,1,32,0,290.3441,_ZN5aiter56fmoe_stage1_bf16_pertokenFp8_doweight_g1u1_32x64_4tg_pf3E,0.0%,254.7127,moe_ck2stages_gemm2_256x32x64x256_1x4_MulABScaleExpertWeight_v1_Nswizzle0_Quant1_MulRoutedWeight0_F8_F8_B16,0.0%,545.0568000000001,0
80,256,7168,256,256,8,ActivationType.Gelu,torch.bfloat16,torch.float8_e4m3fnuz,torch.float8_e4m3fnuz,QuantType.per_Tensor,1,1,32,0,300.1714,moe_ck2stages_gemm1_256x32x64x256_1x4_MulABScale_v1_Nswizzle0_Quant1_MulRoutedWeight1_gelu_F8_F8_B16,0.0%,268.3368,moe_ck2stages_gemm2_256x32x64x256_1x4_MulABScaleExpertWeight_v1_Nswizzle0_Quant1_MulRoutedWeight0_F8_F8_B16,0.0%,568.5082,0
80,512,7168,256,256,8,ActivationType.Gelu,torch.bfloat16,torch.float8_e4m3fnuz,torch.float8_e4m3fnuz,QuantType.per_Tensor,1,1,32,0,304.03,moe_ck2stages_gemm1_256x32x64x256_1x4_MulABScale_v1_Nswizzle0_Quant1_MulRoutedWeight1_gelu_F8_F8_B16,0.0%,287.1332,moe_ck2stages_gemm2_256x32x64x256_1x4_MulABScaleExpertWeight_v1_Nswizzle0_Quant1_MulRoutedWeight0_F8_F8_B16,0.0%,591.1632,0
80,1024,7168,256,256,8,ActivationType.Gelu,torch.bfloat16,torch.float8_e4m3fnuz,torch.float8_e4m3fnuz,QuantType.per_Tensor,1,1,32,0,390.4133,moe_ck2stages_gemm1_256x32x64x256_1x4_MulABScale_v1_Nswizzle0_Quant1_MulRoutedWeight1_gelu_F8_F8_B16,0.0%,410.897,moe_ck2stages_gemm2_256x32x64x128_1x4_MulABScaleExpertWeight_v1_Nswizzle0_Quant1_MulRoutedWeight0_F8_F8_B16,0.0%,801.3103,0
80,1024,7168,512,256,8,ActivationType.Silu,torch.bfloat16,torch.bfloat16,torch.bfloat16,QuantType.No,1,1,32,0,1538.2556,moe_ck2stages_gemm1_256x32x64x128_1x4_TypeCastExpertWeight_v1_Nswizzle0_Quant0_MulRoutedWeight1_silu_B16_B16_B16,0.0%,1005.4051,moe_ck2stages_gemm2_256x32x64x64_1x4_TypeCast_v1_Nswizzle0_Quant0_MulRoutedWeight0_B16_B16_B16,0.0%,2543.6607,0
80,16,7168,512,256,8,ActivationType.Silu,torch.bfloat16,torch.float8_e4m3fnuz,torch.float8_e4m3fnuz,QuantType.per_Tensor,1,0,32,0,237.9312,moe_ck2stages_gemm1_256x32x64x256_1x4_MulABScale_v1_Nswizzle0_Quant1_MulRoutedWeight0_silu_F8_F8_B16,0.0%,159.3483,moe_ck2stages_gemm2_256x32x64x128_1x4_MulABScaleExpertWeight_v1_Nswizzle0_Quant1_MulRoutedWeight1_F8_F8_B16,2.8%,397.2795,0
80,32,7168,512,256,8,ActivationType.Silu,torch.bfloat16,torch.float8_e4m3fnuz,torch.float8_e4m3fnuz,QuantType.per_Tensor,1,0,32,0,369.2362,moe_ck2stages_gemm1_256x32x64x256_1x4_MulABScale_v1_Nswizzle0_Quant1_MulRoutedWeight0_silu_F8_F8_B16,0.0%,241.8314,moe_ck2stages_gemm2_256x32x64x128_1x4_MulABScaleExpertWeight_v1_Nswizzle0_Quant1_MulRoutedWeight1_F8_F8_B16,2.9%,611.0676,0
80,64,7168,512,256,8,ActivationType.Silu,torch.bfloat16,torch.float8_e4m3fnuz,torch.float8_e4m3fnuz,QuantType.per_Tensor,1,0,32,0,510.6484,_ZN5aiter44fmoe_stage1_bf16_pertokenFp8_g1u1_32x512_pf3E,0.0%,335.3164,moe_ck2stages_gemm2_256x32x64x128_1x4_MulABScaleExpertWeight_v1_Nswizzle0_Quant1_MulRoutedWeight1_F8_F8_B16,2.8%,845.9648,0
80,128,7168,512,256,8,ActivationType.Silu,torch.bfloat16,torch.float8_e4m3fnuz,torch.float8_e4m3fnuz,QuantType.per_Tensor,1,0,32,0,582.0633,moe_ck2stages_gemm1_256x32x64x256_1x4_MulABScale_v1_Nswizzle0_Quant1_MulRoutedWeight0_silu_F8_F8_B16,0.0%,408.0174,moe_ck2stages_gemm2_256x32x64x128_1x4_MulABScaleExpertWeight_v1_Nswizzle0_Quant1_MulRoutedWeight1_F8_F8_B16,2.8%,990.0807,0
80,256,7168,512,256,8,ActivationType.Silu,torch.bfloat16,torch.float8_e4m3fnuz,torch.float8_e4m3fnuz,QuantType.per_Tensor,1,0,32,0,615.4904,_ZN5aiter44fmoe_stage1_bf16_pertokenFp8_g1u1_32x512_pf3E,0.0%,418.179,moe_ck2stages_gemm2_256x32x64x128_1x4_MulABScaleExpertWeight_v1_Nswizzle0_Quant1_MulRoutedWeight1_F8_F8_B16,2.8%,1033.6694,0
80,1024,7168,512,256,8,ActivationType.Silu,torch.bfloat16,torch.float8_e4m3fnuz,torch.float8_e4m3fnuz,QuantType.per_Tensor,1,0,32,0,762.665,_ZN5aiter44fmoe_stage1_bf16_pertokenFp8_g1u1_32x512_pf3E,0.0%,620.1682,moe_ck2stages_gemm2_256x32x64x128_1x4_MulABScaleExpertWeight_v1_Nswizzle0_Quant1_MulRoutedWeight1_F8_F8_B16,2.8%,1382.8332,0
80,16,7168,512,256,8,ActivationType.Silu,torch.bfloat16,torch.float8_e4m3fnuz,torch.float8_e4m3fnuz,QuantType.per_Tensor,1,1,32,0,231.5308,moe_ck2stages_gemm1_256x32x64x256_1x4_MulABScale_v1_Nswizzle0_Quant1_MulRoutedWeight1_silu_F8_F8_B16,0.0%,154.9071,moe_ck2stages_gemm2_256x32x64x128_1x4_MulABScaleExpertWeight_v1_Nswizzle0_Quant1_MulRoutedWeight0_F8_F8_B16,0.0%,386.4379,0
80,128,7168,512,256,8,ActivationType.Silu,torch.bfloat16,torch.float8_e4m3fnuz,torch.float8_e4m3fnuz,QuantType.per_Tensor,1,1,32,0,579.7023,_ZN5aiter57fmoe_stage1_bf16_pertokenFp8_doweight_g1u1_32x128_3tg_pf3E,0.1%,364.33,moe_ck2stages_gemm2_256x32x64x128_1x4_MulABScaleExpertWeight_v1_Nswizzle0_Quant1_MulRoutedWeight0_F8_F8_B16,0.0%,944.0323,0
80,256,7168,512,256,8,ActivationType.Silu,torch.bfloat16,torch.float8_e4m3fnuz,torch.float8_e4m3fnuz,QuantType.per_Tensor,1,1,32,0,601.7144,_ZN5aiter57fmoe_stage1_bf16_pertokenFp8_doweight_g1u1_32x128_3tg_pf3E,0.0%,402.2826,moe_ck2stages_gemm2_256x32x64x128_1x4_MulABScaleExpertWeight_v1_Nswizzle0_Quant1_MulRoutedWeight0_F8_F8_B16,0.0%,1003.997,0
80,512,7168,512,256,8,ActivationType.Silu,torch.bfloat16,torch.float8_e4m3fnuz,torch.float8_e4m3fnuz,QuantType.per_Tensor,1,1,32,0,625.392,_ZN5aiter57fmoe_stage1_bf16_pertokenFp8_doweight_g1u1_32x128_3tg_pf3E,0.0%,411.3256,moe_ck2stages_gemm2_256x32x64x128_1x4_MulABScaleExpertWeight_v1_Nswizzle0_Quant1_MulRoutedWeight0_F8_F8_B16,0.0%,1036.7176,0
80,1024,7168,512,256,8,ActivationType.Silu,torch.bfloat16,torch.float8_e4m3fnuz,torch.float8_e4m3fnuz,QuantType.per_Tensor,1,1,32,0,763.616,_ZN5aiter53fmoe_stage1_bf16_pertokenFp8_doweight_g1u1_32x512_pf3E,0.0%,611.4583,moe_ck2stages_gemm2_256x32x64x128_1x4_MulABScaleExpertWeight_v1_Nswizzle0_Quant1_MulRoutedWeight0_F8_F8_B16,0.0%,1375.0743,0
80,16,7168,512,256,8,ActivationType.Silu,torch.bfloat16,torch.float8_e4m3fnuz,torch.float8_e4m3fnuz,QuantType.per_Token,1,0,32,0,228.7896,_ZN5aiter48fmoe_stage1_bf16_pertokenFp8_g1u1_32x128_3tg_pf3E,0.0%,171.5575,moe_ck2stages_gemm2_256x32x64x128_1x4_MulABScaleExpertWeight_v1_Nswizzle0_Quant2_MulRoutedWeight1_F8_F8_B16,2.9%,400.3471,0
80,512,7168,512,256,8,ActivationType.Silu,torch.bfloat16,torch.float8_e4m3fnuz,torch.float8_e4m3fnuz,QuantType.per_Token,1,0,32,0,618.0944,_ZN5aiter48fmoe_stage1_bf16_pertokenFp8_g1u1_32x128_3tg_pf3E,0.1%,476.0445,moe_ck2stages_gemm2_256x32x64x128_1x4_MulABScaleExpertWeight_v1_Nswizzle0_Quant2_MulRoutedWeight1_F8_F8_B16,2.8%,1094.1389,0
80,1024,7168,512,256,8,ActivationType.Silu,torch.bfloat16,torch.float8_e4m3fnuz,torch.float8_e4m3fnuz,QuantType.per_Token,1,0,32,0,750.5786,_ZN5aiter44fmoe_stage1_bf16_pertokenFp8_g1u1_32x512_pf3E,0.0%,718.1941,moe_ck2stages_gemm2_256x32x64x128_1x4_MulABScaleExpertWeight_v1_Nswizzle0_Quant2_MulRoutedWeight1_F8_F8_B16,2.8%,1468.7727,0
80,16,7168,512,256,8,ActivationType.Silu,torch.bfloat16,torch.float8_e4m3fnuz,torch.float8_e4m3fnuz,QuantType.per_Token,1,1,32,0,231.8332,_ZN5aiter56fmoe_stage1_bf16_pertokenFp8_doweight_g1u1_32x64_4tg_pf3E,0.0%,169.7631,moe_ck2stages_gemm2_256x32x64x128_1x4_MulABScaleExpertWeight_v1_Nswizzle0_Quant2_MulRoutedWeight0_F8_F8_B16,0.0%,401.5963,0
80,32,7168,512,256,8,ActivationType.Silu,torch.bfloat16,torch.float8_e4m3fnuz,torch.float8_e4m3fnuz,QuantType.per_Token,1,1,32,0,367.8369,_ZN5aiter56fmoe_stage1_bf16_pertokenFp8_doweight_g1u1_32x64_4tg_pf3E,0.0%,260.1737,moe_ck2stages_gemm2_256x32x64x128_1x4_MulABScaleExpertWeight_v1_Nswizzle0_Quant2_MulRoutedWeight0_F8_F8_B16,0.0%,628.0106000000001,0
80,64,7168,512,256,8,ActivationType.Silu,torch.bfloat16,torch.float8_e4m3fnuz,torch.float8_e4m3fnuz,QuantType.per_Token,1,1,32,0,495.9422,_ZN5aiter53fmoe_stage1_bf16_pertokenFp8_doweight_g1u1_32x512_pf3E,0.0%,361.1859,moe_ck2stages_gemm2_256x32x64x128_1x4_MulABScaleExpertWeight_v1_Nswizzle0_Quant2_MulRoutedWeight0_F8_F8_B16,0.0%,857.1281,0
80,128,7168,512,256,8,ActivationType.Silu,torch.bfloat16,torch.float8_e4m3fnuz,torch.float8_e4m3fnuz,QuantType.per_Token,1,1,32,0,571.3622,_ZN5aiter57fmoe_stage1_bf16_pertokenFp8_doweight_g1u1_32x128_3tg_pf3E,0.0%,410.8419,moe_ck2stages_gemm2_256x32x64x128_1x4_MulABScaleExpertWeight_v1_Nswizzle0_Quant2_MulRoutedWeight0_F8_F8_B16,0.0%,982.2041,0
80,256,7168,512,256,8,ActivationType.Silu,torch.bfloat16,torch.float8_e4m3fnuz,torch.float8_e4m3fnuz,QuantType.per_Token,1,1,32,0,595.5339,_ZN5aiter57fmoe_stage1_bf16_pertokenFp8_doweight_g1u1_32x128_3tg_pf3E,0.0%,429.8353,moe_ck2stages_gemm2_256x32x64x128_1x4_MulABScaleExpertWeight_v1_Nswizzle0_Quant2_MulRoutedWeight0_F8_F8_B16,0.0%,1025.3692,0
80,512,7168,512,256,8,ActivationType.Silu,torch.bfloat16,torch.float8_e4m3fnuz,torch.float8_e4m3fnuz,QuantType.per_Token,1,1,32,0,617.4891,_ZN5aiter53fmoe_stage1_bf16_pertokenFp8_doweight_g1u1_32x512_pf3E,0.0%,481.3596,moe_ck2stages_gemm2_256x32x64x128_1x4_MulABScaleExpertWeight_v1_Nswizzle0_Quant2_MulRoutedWeight0_F8_F8_B16,0.0%,1098.8487,0
80,1024,7168,512,256,8,ActivationType.Silu,torch.bfloat16,torch.float8_e4m3fnuz,torch.float8_e4m3fnuz,QuantType.per_Token,1,1,32,0,752.5409,_ZN5aiter53fmoe_stage1_bf16_pertokenFp8_doweight_g1u1_32x512_pf3E,0.0%,695.4453,moe_ck2stages_gemm2_256x32x64x128_1x4_MulABScaleExpertWeight_v1_Nswizzle0_Quant2_MulRoutedWeight0_F8_F8_B16,0.0%,1447.9861999999998,0
80,16,7168,512,256,8,ActivationType.Silu,torch.bfloat16,torch.float8_e4m3fnuz,torch.float8_e4m3fnuz,QuantType.per_1x128,1,0,64,0,338.7516,_ZN5aiter59fmoe_stage1_bf16_pertokenFp8_blockscale_g1u1_64x128_2tg_pf3E,4.8%,438.1102,moe_ck2stages_gemm2_256x64x128x128_1x4_MulABScaleExpertWeightA8W8blkscale_v3_Nswizzle0_Quant4_MulRoutedWeight1_F8_F8_B16,15.3%,776.8618,0
80,32,7168,512,256,8,ActivationType.Silu,torch.bfloat16,torch.float8_e4m3fnuz,torch.float8_e4m3fnuz,QuantType.per_1x128,1,0,64,0,515.9074,_ZN5aiter59fmoe_stage1_bf16_pertokenFp8_blockscale_g1u1_64x128_2tg_pf3E,5.0%,689.3267,moe_ck2stages_gemm2_256x64x128x128_1x4_MulABScaleExpertWeightA8W8blkscale_v3_Nswizzle0_Quant4_MulRoutedWeight1_F8_F8_B16,15.6%,1205.2341,0
80,64,7168,512,256,8,ActivationType.Silu,torch.bfloat16,torch.float8_e4m3fnuz,torch.float8_e4m3fnuz,QuantType.per_1x128,1,0,64,0,672.0027,_ZN5aiter59fmoe_stage1_bf16_pertokenFp8_blockscale_g1u1_64x128_2tg_pf3E,5.0%,950.1698,moe_ck2stages_gemm2_256x64x128x128_1x4_MulABScaleExpertWeightA8W8blkscale_v3_Nswizzle0_Quant4_MulRoutedWeight1_F8_F8_B16,15.9%,1622.1725,0
80,512,4096,384,128,8,ActivationType.Gelu,torch.bfloat16,torch.bfloat16,torch.bfloat16,QuantType.No,1,0,32,0,351.9236,moe_ck2stages_gemm1_256x32x64x128_1x4_TypeCast_v1_Nswizzle0_Quant0_MulRoutedWeight0_gelu_B16_B16_B16,0.0%,220.5397,moe_ck2stages_gemm2_256x32x64x64_1x4_TypeCastExpertWeight_v1_Nswizzle0_Quant0_MulRoutedWeight1_B16_B16_B16,0.5%,572.4633,0
80,1024,4096,384,128,8,ActivationType.Gelu,torch.bfloat16,torch.bfloat16,torch.bfloat16,QuantType.No,1,0,32,0,523.5384,moe_ck2stages_gemm1_256x32x64x128_1x4_TypeCast_v1_Nswizzle0_Quant0_MulRoutedWeight0_gelu_B16_B16_B16,0.0%,372.5179,moe_ck2stages_gemm2_256x32x64x64_1x4_TypeCastExpertWeight_v1_Nswizzle0_Quant0_MulRoutedWeight1_B16_B16_B16,0.5%,896.0563,0
80,16,4096,384,128,8,ActivationType.Gelu,torch.bfloat16,torch.bfloat16,torch.bfloat16,QuantType.No,1,1,32,0,161.7277,moe_ck2stages_gemm1_256x32x64x64_1x4_TypeCastExpertWeight_v1_Nswizzle0_Quant0_MulRoutedWeight1_gelu_B16_B16_B16,0.0%,96.3101,moe_ck2stages_gemm2_256x32x64x64_1x4_TypeCast_v1_Nswizzle0_Quant0_MulRoutedWeight0_B16_B16_B16,0.0%,258.0378,0
80,32,4096,384,128,8,ActivationType.Gelu,torch.bfloat16,torch.bfloat16,torch.bfloat16,QuantType.No,1,1,32,0,209.4214,moe_ck2stages_gemm1_256x32x64x64_1x4_TypeCastExpertWeight_v1_Nswizzle0_Quant0_MulRoutedWeight1_gelu_B16_B16_B16,0.0%,126.4843,moe_ck2stages_gemm2_256x32x64x64_1x4_TypeCast_v1_Nswizzle0_Quant0_MulRoutedWeight0_B16_B16_B16,0.0%,335.9057,0
80,64,4096,384,128,8,ActivationType.Gelu,torch.bfloat16,torch.bfloat16,torch.bfloat16,QuantType.No,1,1,32,0,240.9494,moe_ck2stages_gemm1_256x32x64x64_1x4_TypeCastExpertWeight_v1_Nswizzle0_Quant0_MulRoutedWeight1_gelu_B16_B16_B16,0.0%,148.9541,moe_ck2stages_gemm2_256x32x64x64_1x4_TypeCast_v1_Nswizzle0_Quant0_MulRoutedWeight0_B16_B16_B16,0.0%,389.9035,0
80,128,4096,384,128,8,ActivationType.Gelu,torch.bfloat16,torch.bfloat16,torch.bfloat16,QuantType.No,1,1,32,0,257.2833,moe_ck2stages_gemm1_256x32x64x64_1x4_TypeCastExpertWeight_v1_Nswizzle0_Quant0_MulRoutedWeight1_gelu_B16_B16_B16,0.0%,157.5746,moe_ck2stages_gemm2_256x32x64x64_1x4_TypeCast_v1_Nswizzle0_Quant0_MulRoutedWeight0_B16_B16_B16,0.0%,414.8579,0
80,256,4096,384,128,8,ActivationType.Gelu,torch.bfloat16,torch.bfloat16,torch.bfloat16,QuantType.No,1,1,32,0,269.3657,moe_ck2stages_gemm1_256x32x64x128_1x4_TypeCastExpertWeight_v1_Nswizzle0_Quant0_MulRoutedWeight1_gelu_B16_B16_B16,0.0%,164.1089,moe_ck2stages_gemm2_256x32x64x64_1x4_TypeCast_v1_Nswizzle0_Quant0_MulRoutedWeight0_B16_B16_B16,0.0%,433.4746,0
80,512,4096,384,128,8,ActivationType.Gelu,torch.bfloat16,torch.bfloat16,torch.bfloat16,QuantType.No,1,1,32,0,352.9213,moe_ck2stages_gemm1_256x32x64x128_1x4_TypeCastExpertWeight_v1_Nswizzle0_Quant0_MulRoutedWeight1_gelu_B16_B16_B16,0.0%,213.1932,moe_ck2stages_gemm2_256x32x64x64_1x4_TypeCast_v1_Nswizzle0_Quant0_MulRoutedWeight0_B16_B16_B16,0.0%,566.1144999999999,0
80,1024,4096,384,128,8,ActivationType.Gelu,torch.bfloat16,torch.bfloat16,torch.bfloat16,QuantType.No,1,1,32,0,524.8862,moe_ck2stages_gemm1_256x32x64x128_1x4_TypeCastExpertWeight_v1_Nswizzle0_Quant0_MulRoutedWeight1_gelu_B16_B16_B16,0.0%,354.9441,moe_ck2stages_gemm2_256x32x64x64_1x4_TypeCast_v1_Nswizzle0_Quant0_MulRoutedWeight0_B16_B16_B16,0.0%,879.8303000000001,0
80,16,4096,384,128,8,ActivationType.Gelu,torch.bfloat16,torch.float8_e4m3fnuz,torch.float8_e4m3fnuz,QuantType.per_Tensor,1,0,32,0,83.611,moe_ck2stages_gemm1_256x32x64x128_1x4_MulABScale_v1_Nswizzle0_Quant1_MulRoutedWeight0_gelu_F8_F8_B16,0.0%,67.927,moe_ck2stages_gemm2_256x32x64x128_1x4_MulABScaleExpertWeight_v1_Nswizzle0_Quant1_MulRoutedWeight1_F8_F8_B16,0.5%,151.538,0
80,32,4096,384,128,8,ActivationType.Gelu,torch.bfloat16,torch.float8_e4m3fnuz,torch.float8_e4m3fnuz,QuantType.per_Tensor,1,0,32,0,107.6661,moe_ck2stages_gemm1_256x32x64x256_1x4_MulABScale_v1_Nswizzle0_Quant1_MulRoutedWeight0_gelu_F8_F8_B16,0.0%,87.4868,moe_ck2stages_gemm2_256x32x64x128_1x4_MulABScaleExpertWeight_v1_Nswizzle0_Quant1_MulRoutedWeight1_F8_F8_B16,0.5%,195.1529,0
80,64,4096,384,128,8,ActivationType.Gelu,torch.bfloat16,torch.float8_e4m3fnuz,torch.float8_e4m3fnuz,QuantType.per_Tensor,1,0,32,0,125.0556,moe_ck2stages_gemm1_256x32x64x128_1x4_MulABScale_v1_Nswizzle0_Quant1_MulRoutedWeight0_gelu_F8_F8_B16,0.0%,101.2628,moe_ck2stages_gemm2_256x32x64x128_1x4_MulABScaleExpertWeight_v1_Nswizzle0_Quant1_MulRoutedWeight1_F8_F8_B16,0.5%,226.3184,0
80,128,4096,384,128,8,ActivationType.Gelu,torch.bfloat16,torch.float8_e4m3fnuz,torch.float8_e4m3fnuz,QuantType.per_Tensor,1,0,32,0,130.9247,moe_ck2stages_gemm1_256x32x64x128_1x4_MulABScale_v1_Nswizzle0_Quant1_MulRoutedWeight0_gelu_F8_F8_B16,0.0%,105.8912,moe_ck2stages_gemm2_256x32x64x128_1x4_MulABScaleExpertWeight_v1_Nswizzle0_Quant1_MulRoutedWeight1_F8_F8_B16,0.5%,236.8159,0
80,256,4096,384,128,8,ActivationType.Gelu,torch.bfloat16,torch.float8_e4m3fnuz,torch.float8_e4m3fnuz,QuantType.per_Tensor,1,0,32,0,135.4179,moe_ck2stages_gemm1_256x32x64x256_1x4_MulABScale_v1_Nswizzle0_Quant1_MulRoutedWeight0_gelu_F8_F8_B16,0.0%,109.748,moe_ck2stages_gemm2_256x32x64x128_1x4_MulABScaleExpertWeight_v1_Nswizzle0_Quant1_MulRoutedWeight1_F8_F8_B16,0.5%,245.1659,0
80,512,4096,384,128,8,ActivationType.Gelu,torch.bfloat16,torch.float8_e4m3fnuz,torch.float8_e4m3fnuz,QuantType.per_Tensor,1,0,32,0,177.8313,moe_ck2stages_gemm1_256x32x64x256_1x4_MulABScale_v1_Nswizzle0_Quant1_MulRoutedWeight0_gelu_F8_F8_B16,0.0%,155.4294,moe_ck2stages_gemm2_256x32x64x128_1x4_MulABScaleExpertWeight_v1_Nswizzle0_Quant1_MulRoutedWeight1_F8_F8_B16,0.5%,333.2607,0
80,1024,4096,384,128,8,ActivationType.Gelu,torch.bfloat16,torch.float8_e4m3fnuz,torch.float8_e4m3fnuz,QuantType.per_Tensor,1,0,32,0,264.4639,moe_ck2stages_gemm1_256x32x64x256_1x4_MulABScale_v1_Nswizzle0_Quant1_MulRoutedWeight0_gelu_F8_F8_B16,0.0%,263.7878,moe_ck2stages_gemm2_256x32x64x128_1x4_MulABScaleExpertWeight_v1_Nswizzle0_Quant1_MulRoutedWeight1_F8_F8_B16,0.5%,528.2517,0
80,16,4096,384,128,8,ActivationType.Gelu,torch.bfloat16,torch.float8_e4m3fnuz,torch.float8_e4m3fnuz,QuantType.per_Tensor,1,1,32,0,84.3415,moe_ck2stages_gemm1_256x32x64x128_1x4_MulABScale_v1_Nswizzle0_Quant1_MulRoutedWeight1_gelu_F8_F8_B16,0.0%,65.6237,moe_ck2stages_gemm2_256x32x64x128_1x4_MulABScaleExpertWeight_v1_Nswizzle0_Quant1_MulRoutedWeight0_F8_F8_B16,0.0%,149.96519999999998,0
80,32,4096,384,128,8,ActivationType.Gelu,torch.bfloat16,torch.float8_e4m3fnuz,torch.float8_e4m3fnuz,QuantType.per_Tensor,1,1,32,0,109.5369,moe_ck2stages_gemm1_256x32x64x128_1x4_MulABScale_v1_Nswizzle0_Quant1_MulRoutedWeight1_gelu_F8_F8_B16,0.0%,83.7014,moe_ck2stages_gemm2_256x32x64x128_1x4_MulABScaleExpertWeight_v1_Nswizzle0_Quant1_MulRoutedWeight0_F8_F8_B16,0.0%,193.2383,0
80,64,4096,384,128,8,ActivationType.Gelu,torch.bfloat16,torch.float8_e4m3fnuz,torch.float8_e4m3fnuz,QuantType.per_Tensor,1,1,32,0,130.7478,_ZN5aiter57fmoe_stage1_bf16_pertokenFp8_doweight_g1u1_32x128_3tg_pf3E,0.0%,96.7112,moe_ck2stages_gemm2_256x32x64x128_1x4_MulABScaleExpertWeight_v1_Nswizzle0_Quant1_MulRoutedWeight0_F8_F8_B16,0.0%,227.459,0
80,128,4096,384,128,8,ActivationType.Gelu,torch.bfloat16,torch.float8_e4m3fnuz,torch.float8_e4m3fnuz,QuantType.per_Tensor,1,1,32,0,130.8193,moe_ck2stages_gemm1_256x32x64x128_1x4_MulABScale_v1_Nswizzle0_Quant1_MulRoutedWeight1_gelu_F8_F8_B16,0.0%,102.1228,moe_ck2stages_gemm2_256x32x64x128_1x4_MulABScaleExpertWeight_v1_Nswizzle0_Quant1_MulRoutedWeight0_F8_F8_B16,0.0%,232.9421,0
80,256,4096,384,128,8,ActivationType.Gelu,torch.bfloat16,torch.float8_e4m3fnuz,torch.float8_e4m3fnuz,QuantType.per_Tensor,1,1,32,0,134.1437,moe_ck2stages_gemm1_256x32x64x256_1x4_MulABScale_v1_Nswizzle0_Quant1_MulRoutedWeight1_gelu_F8_F8_B16,0.0%,106.1464,moe_ck2stages_gemm2_256x32x64x128_1x4_MulABScaleExpertWeight_v1_Nswizzle0_Quant1_MulRoutedWeight0_F8_F8_B16,0.0%,240.2901,0
80,512,4096,384,128,8,ActivationType.Gelu,torch.bfloat16,torch.float8_e4m3fnuz,torch.float8_e4m3fnuz,QuantType.per_Tensor,1,1,32,0,179.8699,moe_ck2stages_gemm1_256x32x64x256_1x4_MulABScale_v1_Nswizzle0_Quant1_MulRoutedWeight1_gelu_F8_F8_B16,0.0%,146.8478,moe_ck2stages_gemm2_256x32x64x128_1x4_MulABScaleExpertWeight_v1_Nswizzle0_Quant1_MulRoutedWeight0_F8_F8_B16,0.0%,326.71770000000004,0
80,1024,4096,384,128,8,ActivationType.Gelu,torch.bfloat16,torch.float8_e4m3fnuz,torch.float8_e4m3fnuz,QuantType.per_Tensor,1,1,32,0,266.6047,moe_ck2stages_gemm1_256x32x64x256_1x4_MulABScale_v1_Nswizzle0_Quant1_MulRoutedWeight1_gelu_F8_F8_B16,0.0%,248.2173,moe_ck2stages_gemm2_256x32x64x128_1x4_MulABScaleExpertWeight_v1_Nswizzle0_Quant1_MulRoutedWeight0_F8_F8_B16,0.0%,514.822,0
80,16,4096,384,128,8,ActivationType.Gelu,torch.bfloat16,torch.float8_e4m3fnuz,torch.float8_e4m3fnuz,QuantType.per_Token,1,0,32,0,82.4918,_ZN5aiter47fmoe_stage1_bf16_pertokenFp8_g1u1_32x64_4tg_pf3E,0.0%,76.3624,moe_ck2stages_gemm2_256x32x64x128_1x4_MulABScaleExpertWeight_v1_Nswizzle0_Quant2_MulRoutedWeight1_F8_F8_B16,0.5%,158.8542,0
80,32,4096,384,128,8,ActivationType.Gelu,torch.bfloat16,torch.float8_e4m3fnuz,torch.float8_e4m3fnuz,QuantType.per_Token,1,0,32,0,108.8976,_ZN5aiter47fmoe_stage1_bf16_pertokenFp8_g1u1_32x64_4tg_pf3E,0.0%,99.2988,moe_ck2stages_gemm2_256x32x64x128_1x4_MulABScaleExpertWeight_v1_Nswizzle0_Quant2_MulRoutedWeight1_F8_F8_B16,0.5%,208.1964,0
80,64,4096,384,128,8,ActivationType.Gelu,torch.bfloat16,torch.float8_e4m3fnuz,torch.float8_e4m3fnuz,QuantType.per_Token,1,0,32,0,126.1647,moe_ck2stages_gemm1_256x32x64x128_1x4_MulABScale_v1_Nswizzle0_Quant2_MulRoutedWeight0_gelu_F8_F8_B16,0.0%,114.79,moe_ck2stages_gemm2_256x32x64x128_1x4_MulABScaleExpertWeight_v1_Nswizzle0_Quant2_MulRoutedWeight1_F8_F8_B16,0.5%,240.9547,0
80,128,4096,384,128,8,ActivationType.Gelu,torch.bfloat16,torch.float8_e4m3fnuz,torch.float8_e4m3fnuz,QuantType.per_Token,1,0,32,0,124.3466,_ZN5aiter48fmoe_stage1_bf16_pertokenFp8_g1u1_32x128_3tg_pf3E,0.0%,119.6476,moe_ck2stages_gemm2_256x32x64x128_1x4_MulABScaleExpertWeight_v1_Nswizzle0_Quant2_MulRoutedWeight1_F8_F8_B16,0.5%,243.9942,0
80,256,4096,384,128,8,ActivationType.Gelu,torch.bfloat16,torch.float8_e4m3fnuz,torch.float8_e4m3fnuz,QuantType.per_Token,1,0,32,0,136.6099,_ZN5aiter48fmoe_stage1_bf16_pertokenFp8_g1u1_32x128_3tg_pf3E,0.0%,127.3005,moe_ck2stages_gemm2_256x32x64x128_1x4_MulABScaleExpertWeight_v1_Nswizzle0_Quant2_MulRoutedWeight1_F8_F8_B16,0.5%,263.9104,0
80,512,4096,384,128,8,ActivationType.Gelu,torch.bfloat16,torch.float8_e4m3fnuz,torch.float8_e4m3fnuz,QuantType.per_Token,1,0,32,0,174.3438,_ZN5aiter48fmoe_stage1_bf16_pertokenFp8_g1u1_32x128_3tg_pf3E,0.0%,184.6666,moe_ck2stages_gemm2_256x32x64x128_1x4_MulABScaleExpertWeight_v1_Nswizzle0_Quant2_MulRoutedWeight1_F8_F8_B16,0.5%,359.0104,0
80,1024,4096,384,128,8,ActivationType.Gelu,torch.bfloat16,torch.float8_e4m3fnuz,torch.float8_e4m3fnuz,QuantType.per_Token,1,0,32,0,272.9741,_ZN5aiter48fmoe_stage1_bf16_pertokenFp8_g1u1_32x128_3tg_pf3E,0.0%,313.1772,moe_ck2stages_gemm2_256x32x64x128_1x4_MulABScaleExpertWeight_v1_Nswizzle0_Quant2_MulRoutedWeight1_F8_F8_B16,0.5%,586.1513,0
80,16,4096,384,128,8,ActivationType.Gelu,torch.bfloat16,torch.float8_e4m3fnuz,torch.float8_e4m3fnuz,QuantType.per_Token,1,1,32,0,84.9173,moe_ck2stages_gemm1_256x32x64x128_1x4_MulABScale_v1_Nswizzle0_Quant2_MulRoutedWeight1_gelu_F8_F8_B16,0.0%,74.1307,moe_ck2stages_gemm2_256x32x64x128_1x4_MulABScaleExpertWeight_v1_Nswizzle0_Quant2_MulRoutedWeight0_F8_F8_B16,0.0%,159.048,0
80,32,4096,384,128,8,ActivationType.Gelu,torch.bfloat16,torch.float8_e4m3fnuz,torch.float8_e4m3fnuz,QuantType.per_Token,1,1,32,0,110.1287,moe_ck2stages_gemm1_256x32x64x256_1x4_MulABScale_v1_Nswizzle0_Quant2_MulRoutedWeight1_gelu_F8_F8_B16,0.0%,96.0451,moe_ck2stages_gemm2_256x32x64x128_1x4_MulABScaleExpertWeight_v1_Nswizzle0_Quant2_MulRoutedWeight0_F8_F8_B16,0.0%,206.1738,0
80,64,4096,384,128,8,ActivationType.Gelu,torch.bfloat16,torch.float8_e4m3fnuz,torch.float8_e4m3fnuz,QuantType.per_Token,1,1,32,0,126.6253,moe_ck2stages_gemm1_256x32x64x128_1x4_MulABScale_v1_Nswizzle0_Quant2_MulRoutedWeight1_gelu_F8_F8_B16,0.0%,111.3536,moe_ck2stages_gemm2_256x32x64x128_1x4_MulABScaleExpertWeight_v1_Nswizzle0_Quant2_MulRoutedWeight0_F8_F8_B16,0.0%,237.9789,0
80,128,4096,384,128,8,ActivationType.Gelu,torch.bfloat16,torch.float8_e4m3fnuz,torch.float8_e4m3fnuz,QuantType.per_Token,1,1,32,0,132.4651,_ZN5aiter57fmoe_stage1_bf16_pertokenFp8_doweight_g1u1_32x128_3tg_pf3E,0.0%,116.0108,moe_ck2stages_gemm2_256x32x64x128_1x4_MulABScaleExpertWeight_v1_Nswizzle0_Quant2_MulRoutedWeight0_F8_F8_B16,0.0%,248.4759,0
80,256,4096,384,128,8,ActivationType.Gelu,torch.bfloat16,torch.float8_e4m3fnuz,torch.float8_e4m3fnuz,QuantType.per_Token,1,1,32,0,130.1837,_ZN5aiter57fmoe_stage1_bf16_pertokenFp8_doweight_g1u1_32x128_3tg_pf3E,0.0%,123.1176,moe_ck2stages_gemm2_256x32x64x128_1x4_MulABScaleExpertWeight_v1_Nswizzle0_Quant2_MulRoutedWeight0_F8_F8_B16,0.0%,253.3013,0
80,512,4096,384,128,8,ActivationType.Gelu,torch.bfloat16,torch.float8_e4m3fnuz,torch.float8_e4m3fnuz,QuantType.per_Token,1,1,32,0,177.7956,_ZN5aiter57fmoe_stage1_bf16_pertokenFp8_doweight_g1u1_32x128_3tg_pf3E,0.0%,178.1446,moe_ck2stages_gemm2_256x32x64x128_1x4_MulABScaleExpertWeight_v1_Nswizzle0_Quant2_MulRoutedWeight0_F8_F8_B16,0.0%,355.9402,0
80,1024,4096,384,128,8,ActivationType.Gelu,torch.bfloat16,torch.float8_e4m3fnuz,torch.float8_e4m3fnuz,QuantType.per_Token,1,1,32,0,271.6424,_ZN5aiter57fmoe_stage1_bf16_pertokenFp8_doweight_g1u1_32x128_3tg_pf3E,0.0%,302.5119,moe_ck2stages_gemm2_256x32x64x128_1x4_MulABScaleExpertWeight_v1_Nswizzle0_Quant2_MulRoutedWeight0_F8_F8_B16,0.0%,574.1543,0
80,16,4096,384,128,8,ActivationType.Gelu,torch.bfloat16,torch.float8_e4m3fnuz,torch.float8_e4m3fnuz,QuantType.per_1x128,1,0,64,0,137.572,_ZN5aiter59fmoe_stage1_bf16_pertokenFp8_blockscale_g1u1_64x128_2tg_pf3E,4.9%,189.9224,moe_ck2stages_gemm2_256x64x128x128_1x4_MulABScaleExpertWeightA8W8blkscale_v3_Nswizzle0_Quant4_MulRoutedWeight1_F8_F8_B16,15.5%,327.49440000000004,0
80,16,7168,256,256,8,ActivationType.Gelu,torch.bfloat16,torch.float8_e4m3fnuz,torch.float8_e4m3fnuz,QuantType.per_Token,1,0,32,0,120.3829,_ZN5aiter47fmoe_stage1_bf16_pertokenFp8_g1u1_32x64_4tg_pf3E,0.0%,134.4734,moe_ck2stages_gemm2_256x32x64x128_1x4_MulABScaleExpertWeight_v1_Nswizzle0_Quant2_MulRoutedWeight1_F8_F8_B16,1.6%,254.8563,0
80,32,7168,256,256,8,ActivationType.Gelu,torch.bfloat16,torch.float8_e4m3fnuz,torch.float8_e4m3fnuz,QuantType.per_Token,1,0,32,0,188.6312,moe_ck2stages_gemm1_256x32x64x128_1x4_MulABScale_v1_Nswizzle0_Quant2_MulRoutedWeight0_gelu_F8_F8_B16,0.0%,205.9065,moe_ck2stages_gemm2_256x32x64x128_1x4_MulABScaleExpertWeight_v1_Nswizzle0_Quant2_MulRoutedWeight1_F8_F8_B16,1.6%,394.5377,0
80,64,7168,256,256,8,ActivationType.Gelu,torch.bfloat16,torch.float8_e4m3fnuz,torch.float8_e4m3fnuz,QuantType.per_Token,1,0,32,0,249.8568,_ZN5aiter48fmoe_stage1_bf16_pertokenFp8_g1u1_32x128_3tg_pf2E,0.0%,269.7859,moe_ck2stages_gemm2_256x32x64x128_1x4_MulABScaleExpertWeight_v1_Nswizzle0_Quant2_MulRoutedWeight1_F8_F8_B16,1.6%,519.6427,0
80,128,7168,256,256,8,ActivationType.Gelu,torch.bfloat16,torch.float8_e4m3fnuz,torch.float8_e4m3fnuz,QuantType.per_Token,1,0,32,0,285.1047,_ZN5aiter48fmoe_stage1_bf16_pertokenFp8_g1u1_32x128_3tg_pf3E,0.0%,312.3733,moe_ck2stages_gemm2_256x32x64x128_1x4_MulABScaleExpertWeight_v1_Nswizzle0_Quant2_MulRoutedWeight1_F8_F8_B16,1.6%,597.478,0
80,256,7168,256,256,8,ActivationType.Gelu,torch.bfloat16,torch.float8_e4m3fnuz,torch.float8_e4m3fnuz,QuantType.per_Token,1,0,32,0,302.8986,_ZN5aiter48fmoe_stage1_bf16_pertokenFp8_g1u1_32x128_3tg_pf3E,0.0%,328.0652,moe_ck2stages_gemm2_256x32x64x128_1x4_MulABScaleExpertWeight_v1_Nswizzle0_Quant2_MulRoutedWeight1_F8_F8_B16,1.6%,630.9638,0
80,512,7168,256,256,8,ActivationType.Gelu,torch.bfloat16,torch.float8_e4m3fnuz,torch.float8_e4m3fnuz,QuantType.per_Token,1,0,32,0,305.7627,_ZN5aiter48fmoe_stage1_bf16_pertokenFp8_g1u1_32x128_3tg_pf3E,0.1%,359.7434,moe_ck2stages_gemm2_256x32x64x128_1x4_MulABScaleExpertWeight_v1_Nswizzle0_Quant2_MulRoutedWeight1_F8_F8_B16,1.6%,665.5061000000001,0
80,1024,7168,256,256,8,ActivationType.Gelu,torch.bfloat16,torch.float8_e4m3fnuz,torch.float8_e4m3fnuz,QuantType.per_Token,1,0,32,0,390.1172,_ZN5aiter48fmoe_stage1_bf16_pertokenFp8_g1u1_32x256_2tg_pf3E,0.0%,531.1275,moe_ck2stages_gemm2_256x32x64x128_1x4_MulABScaleExpertWeight_v1_Nswizzle0_Quant2_MulRoutedWeight1_F8_F8_B16,1.6%,921.2447,0
80,16,7168,256,256,8,ActivationType.Gelu,torch.bfloat16,torch.float8_e4m3fnuz,torch.float8_e4m3fnuz,QuantType.per_Token,1,1,32,0,119.4832,_ZN5aiter56fmoe_stage1_bf16_pertokenFp8_doweight_g1u1_32x64_4tg_pf3E,0.0%,131.8606,moe_ck2stages_gemm2_256x32x64x256_1x4_MulABScaleExpertWeight_v1_Nswizzle0_Quant2_MulRoutedWeight0_F8_F8_B16,0.0%,251.3438,0
80,32,7168,256,256,8,ActivationType.Gelu,torch.bfloat16,torch.float8_e4m3fnuz,torch.float8_e4m3fnuz,QuantType.per_Token,1,1,32,0,192.247,_ZN5aiter56fmoe_stage1_bf16_pertokenFp8_doweight_g1u1_32x64_4tg_pf3E,0.0%,200.7748,moe_ck2stages_gemm2_256x32x64x256_1x4_MulABScaleExpertWeight_v1_Nswizzle0_Quant2_MulRoutedWeight0_F8_F8_B16,0.0%,393.0218,0
80,64,7168,256,256,8,ActivationType.Gelu,torch.bfloat16,torch.float8_e4m3fnuz,torch.float8_e4m3fnuz,QuantType.per_Token,1,1,32,0,247.1864,_ZN5aiter57fmoe_stage1_bf16_pertokenFp8_doweight_g1u1_32x128_3tg_pf3E,0.0%,262.0145,moe_ck2stages_gemm2_256x32x64x256_1x4_MulABScaleExpertWeight_v1_Nswizzle0_Quant2_MulRoutedWeight0_F8_F8_B16,0.0%,509.2009,0
80,128,7168,256,256,8,ActivationType.Gelu,torch.bfloat16,torch.float8_e4m3fnuz,torch.float8_e4m3fnuz,QuantType.per_Token,1,1,32,0,280.8024,_ZN5aiter57fmoe_stage1_bf16_pertokenFp8_doweight_g1u1_32x128_3tg_pf3E,0.0%,303.8392,moe_ck2stages_gemm2_256x32x64x256_1x4_MulABScaleExpertWeight_v1_Nswizzle0_Quant2_MulRoutedWeight0_F8_F8_B16,0.0%,584.6415999999999,0
80,256,7168,256,256,8,ActivationType.Gelu,torch.bfloat16,torch.float8_e4m3fnuz,torch.float8_e4m3fnuz,QuantType.per_Token,1,1,32,0,301.3686,_ZN5aiter57fmoe_stage1_bf16_pertokenFp8_doweight_g1u1_32x128_3tg_pf3E,0.0%,321.4971,moe_ck2stages_gemm2_256x32x64x256_1x4_MulABScaleExpertWeight_v1_Nswizzle0_Quant2_MulRoutedWeight0_F8_F8_B16,0.0%,622.8657000000001,0
80,512,7168,256,256,8,ActivationType.Gelu,torch.bfloat16,torch.float8_e4m3fnuz,torch.float8_e4m3fnuz,QuantType.per_Token,1,1,32,0,310.6611,_ZN5aiter57fmoe_stage1_bf16_pertokenFp8_doweight_g1u1_32x128_3tg_pf3E,0.0%,349.0712,moe_ck2stages_gemm2_256x32x64x128_1x4_MulABScaleExpertWeight_v1_Nswizzle0_Quant2_MulRoutedWeight0_F8_F8_B16,0.0%,659.7322999999999,0
80,1024,7168,256,256,8,ActivationType.Gelu,torch.bfloat16,torch.float8_e4m3fnuz,torch.float8_e4m3fnuz,QuantType.per_Token,1,1,32,0,385.5365,_ZN5aiter57fmoe_stage1_bf16_pertokenFp8_doweight_g1u1_32x256_2tg_pf3E,0.0%,515.5173,moe_ck2stages_gemm2_256x32x64x128_1x4_MulABScaleExpertWeight_v1_Nswizzle0_Quant2_MulRoutedWeight0_F8_F8_B16,0.0%,901.0538,0
80,16,7168,256,256,8,ActivationType.Gelu,torch.bfloat16,torch.float8_e4m3fnuz,torch.float8_e4m3fnuz,QuantType.per_1x128,1,0,64,0,174.2438,_ZN5aiter59fmoe_stage1_bf16_pertokenFp8_blockscale_g1u1_64x128_2tg_pf3E,5.0%,362.873,moe_ck2stages_gemm2_256x64x128x128_1x4_MulABScaleExpertWeightA8W8blkscale_v3_Nswizzle0_Quant4_MulRoutedWeight1_F8_F8_B16,15.8%,537.1168,0
80,32,7168,256,256,8,ActivationType.Gelu,torch.bfloat16,torch.float8_e4m3fnuz,torch.float8_e4m3fnuz,QuantType.per_1x128,1,0,64,0,284.9977,_ZN5aiter59fmoe_stage1_bf16_pertokenFp8_blockscale_g1u1_64x128_2tg_pf3E,5.2%,583.2848,moe_ck2stages_gemm2_256x64x128x128_1x4_MulABScaleExpertWeightA8W8blkscale_v3_Nswizzle0_Quant4_MulRoutedWeight1_F8_F8_B16,15.8%,868.2825,0
80,64,7168,256,256,8,ActivationType.Gelu,torch.bfloat16,torch.float8_e4m3fnuz,torch.float8_e4m3fnuz,QuantType.per_1x128,1,0,64,0,346.4359,_ZN5aiter59fmoe_stage1_bf16_pertokenFp8_blockscale_g1u1_64x128_2tg_pf3E,5.2%,771.2497,moe_ck2stages_gemm2_256x64x128x128_1x4_MulABScaleExpertWeightA8W8blkscale_v3_Nswizzle0_Quant4_MulRoutedWeight1_F8_F8_B16,15.7%,1117.6856,0
80,128,7168,256,256,8,ActivationType.Gelu,torch.bfloat16,torch.float8_e4m3fnuz,torch.float8_e4m3fnuz,QuantType.per_1x128,1,0,64,0,400.4345,_ZN5aiter59fmoe_stage1_bf16_pertokenFp8_blockscale_g1u1_64x128_2tg_pf3E,5.2%,874.2435,moe_ck2stages_gemm2_256x64x128x128_1x4_MulABScaleExpertWeightA8W8blkscale_v3_Nswizzle0_Quant4_MulRoutedWeight1_F8_F8_B16,15.5%,1274.678,0
80,256,7168,256,256,8,ActivationType.Gelu,torch.bfloat16,torch.float8_e4m3fnuz,torch.float8_e4m3fnuz,QuantType.per_1x128,1,0,64,0,405.3349,_ZN5aiter59fmoe_stage1_bf16_pertokenFp8_blockscale_g1u1_64x128_2tg_pf3E,5.3%,899.1665,moe_ck2stages_gemm2_256x64x128x128_1x4_MulABScaleExpertWeightA8W8blkscale_v3_Nswizzle0_Quant4_MulRoutedWeight1_F8_F8_B16,15.6%,1304.5014,0
80,512,7168,256,256,8,ActivationType.Gelu,torch.bfloat16,torch.float8_e4m3fnuz,torch.float8_e4m3fnuz,QuantType.per_1x128,1,0,64,0,409.5824,_ZN5aiter59fmoe_stage1_bf16_pertokenFp8_blockscale_g1u1_64x128_2tg_pf3E,5.2%,934.9675,moe_ck2stages_gemm2_256x64x128x128_1x4_MulABScaleExpertWeightA8W8blkscale_v3_Nswizzle0_Quant4_MulRoutedWeight1_F8_F8_B16,15.6%,1344.5499,0
80,1024,7168,256,256,8,ActivationType.Gelu,torch.bfloat16,torch.float8_e4m3fnuz,torch.float8_e4m3fnuz,QuantType.per_1x128,1,0,64,0,450.1769,_ZN5aiter59fmoe_stage1_bf16_pertokenFp8_blockscale_g1u1_64x128_2tg_pf3E,5.2%,1179.9484,moe_ck2stages_gemm2_256x64x128x128_1x4_MulABScaleExpertWeightA8W8blkscale_v3_Nswizzle0_Quant4_MulRoutedWeight1_F8_F8_B16,15.6%,1630.1253,0
80,16,7168,256,256,8,ActivationType.Gelu,torch.bfloat16,torch.float8_e4m3fnuz,torch.float8_e4m3fnuz,QuantType.per_1x128,1,1,64,0,321.0811,moe_ck2stages_gemm1_256x64x128x128_1x4_MulABScaleExpertWeightA8W8blkscale_v3_Nswizzle0_Quant4_MulRoutedWeight1_gelu_F8_F8_B16,0.0%,359.6686,moe_ck2stages_gemm2_256x64x128x128_1x4_MulABScaleExpertWeightA8W8blkscale_v3_Nswizzle0_Quant4_MulRoutedWeight0_F8_F8_B16,16.7%,680.7497000000001,0
80,32,7168,256,256,8,ActivationType.Gelu,torch.bfloat16,torch.float8_e4m3fnuz,torch.float8_e4m3fnuz,QuantType.per_1x128,1,1,64,0,530.1209,moe_ck2stages_gemm1_256x64x128x128_1x4_MulABScaleExpertWeightA8W8blkscale_v3_Nswizzle0_Quant4_MulRoutedWeight1_gelu_F8_F8_B16,0.0%,579.3162,moe_ck2stages_gemm2_256x64x128x128_1x4_MulABScaleExpertWeightA8W8blkscale_v3_Nswizzle0_Quant4_MulRoutedWeight0_F8_F8_B16,16.6%,1109.4371,0
80,64,7168,256,256,8,ActivationType.Gelu,torch.bfloat16,torch.float8_e4m3fnuz,torch.float8_e4m3fnuz,QuantType.per_1x128,1,1,64,0,640.2938,moe_ck2stages_gemm1_256x64x128x128_1x4_MulABScaleExpertWeightA8W8blkscale_v3_Nswizzle0_Quant4_MulRoutedWeight1_gelu_F8_F8_B16,0.0%,763.4434,moe_ck2stages_gemm2_256x64x128x128_1x4_MulABScaleExpertWeightA8W8blkscale_v3_Nswizzle0_Quant4_MulRoutedWeight0_F8_F8_B16,16.6%,1403.7372,0
80,128,7168,256,256,8,ActivationType.Gelu,torch.bfloat16,torch.float8_e4m3fnuz,torch.float8_e4m3fnuz,QuantType.per_1x128,1,1,64,0,739.6958,moe_ck2stages_gemm1_256x64x128x128_1x4_MulABScaleExpertWeightA8W8blkscale_v3_Nswizzle0_Quant4_MulRoutedWeight1_gelu_F8_F8_B16,0.0%,865.9768,moe_ck2stages_gemm2_256x64x128x128_1x4_MulABScaleExpertWeightA8W8blkscale_v3_Nswizzle0_Quant4_MulRoutedWeight0_F8_F8_B16,16.5%,1605.6726,0
80,256,7168,256,256,8,ActivationType.Gelu,torch.bfloat16,torch.float8_e4m3fnuz,torch.float8_e4m3fnuz,QuantType.per_1x128,1,1,64,0,759.1137,moe_ck2stages_gemm1_256x64x128x128_1x4_MulABScaleExpertWeightA8W8blkscale_v3_Nswizzle0_Quant4_MulRoutedWeight1_gelu_F8_F8_B16,0.0%,888.8978,moe_ck2stages_gemm2_256x64x128x128_1x4_MulABScaleExpertWeightA8W8blkscale_v3_Nswizzle0_Quant4_MulRoutedWeight0_F8_F8_B16,16.6%,1648.0115,0
80,512,7168,256,256,8,ActivationType.Gelu,torch.bfloat16,torch.float8_e4m3fnuz,torch.float8_e4m3fnuz,QuantType.per_1x128,1,1,64,0,793.5153,moe_ck2stages_gemm1_256x64x128x128_1x4_MulABScaleExpertWeightA8W8blkscale_v3_Nswizzle0_Quant4_MulRoutedWeight1_gelu_F8_F8_B16,0.0%,928.5837,moe_ck2stages_gemm2_256x64x128x128_1x4_MulABScaleExpertWeightA8W8blkscale_v3_Nswizzle0_Quant4_MulRoutedWeight0_F8_F8_B16,16.6%,1722.0990000000002,0
80,1024,7168,256,256,8,ActivationType.Gelu,torch.bfloat16,torch.float8_e4m3fnuz,torch.float8_e4m3fnuz,QuantType.per_1x128,1,1,64,0,855.3789,moe_ck2stages_gemm1_256x64x128x128_1x4_MulABScaleExpertWeightA8W8blkscale_v3_Nswizzle0_Quant4_MulRoutedWeight1_gelu_F8_F8_B16,0.0%,1177.5476,moe_ck2stages_gemm2_256x64x128x128_1x4_MulABScaleExpertWeightA8W8blkscale_v3_Nswizzle0_Quant4_MulRoutedWeight0_F8_F8_B16,16.6%,2032.9265,0
80,1024,7168,512,256,8,ActivationType.Silu,torch.bfloat16,torch.bfloat16,torch.bfloat16,QuantType.No,1,0,32,0,1545.4564,moe_ck2stages_gemm1_256x32x64x128_1x4_TypeCast_v1_Nswizzle0_Quant0_MulRoutedWeight0_silu_B16_B16_B16,0.0%,1031.1042,moe_ck2stages_gemm2_256x32x64x64_1x4_TypeCastExpertWeight_v1_Nswizzle0_Quant0_MulRoutedWeight1_B16_B16_B16,2.8%,2576.5606,0
80,16,7168,512,256,8,ActivationType.Silu,torch.bfloat16,torch.bfloat16,torch.bfloat16,QuantType.No,1,1,32,0,442.5097,moe_ck2stages_gemm1_256x32x64x64_1x4_TypeCastExpertWeight_v1_Nswizzle0_Quant0_MulRoutedWeight1_silu_B16_B16_B16,0.0%,249.4045,moe_ck2stages_gemm2_256x32x64x64_1x4_TypeCast_v1_Nswizzle0_Quant0_MulRoutedWeight0_B16_B16_B16,0.0%,691.9142,0
80,32,7168,512,256,8,ActivationType.Silu,torch.bfloat16,torch.bfloat16,torch.bfloat16,QuantType.No,1,1,32,0,708.8776,moe_ck2stages_gemm1_256x32x64x64_1x4_TypeCastExpertWeight_v1_Nswizzle0_Quant0_MulRoutedWeight1_silu_B16_B16_B16,0.0%,395.3054,moe_ck2stages_gemm2_256x32x64x64_1x4_TypeCast_v1_Nswizzle0_Quant0_MulRoutedWeight0_B16_B16_B16,0.0%,1104.183,0
80,64,7168,512,256,8,ActivationType.Silu,torch.bfloat16,torch.bfloat16,torch.bfloat16,QuantType.No,1,1,32,0,1025.0488,moe_ck2stages_gemm1_256x32x64x64_1x4_TypeCastExpertWeight_v1_Nswizzle0_Quant0_MulRoutedWeight1_silu_B16_B16_B16,0.0%,559.4474,moe_ck2stages_gemm2_256x32x64x64_1x4_TypeCast_v1_Nswizzle0_Quant0_MulRoutedWeight0_B16_B16_B16,0.0%,1584.4962,0
80,128,7168,512,256,8,ActivationType.Silu,torch.bfloat16,torch.bfloat16,torch.bfloat16,QuantType.No,1,1,32,0,1128.3663,moe_ck2stages_gemm1_256x32x64x64_1x4_TypeCastExpertWeight_v1_Nswizzle0_Quant0_MulRoutedWeight1_silu_B16_B16_B16,0.0%,636.7004,moe_ck2stages_gemm2_256x32x64x64_1x4_TypeCast_v1_Nswizzle0_Quant0_MulRoutedWeight0_B16_B16_B16,0.0%,1765.0667,0
80,256,7168,512,256,8,ActivationType.Silu,torch.bfloat16,torch.bfloat16,torch.bfloat16,QuantType.No,1,1,32,0,1186.9346,moe_ck2stages_gemm1_256x32x64x64_1x4_TypeCastExpertWeight_v1_Nswizzle0_Quant0_MulRoutedWeight1_silu_B16_B16_B16,0.0%,673.7193,moe_ck2stages_gemm2_256x32x64x64_1x4_TypeCast_v1_Nswizzle0_Quant0_MulRoutedWeight0_B16_B16_B16,0.0%,1860.6539,0
80,512,7168,512,256,8,ActivationType.Silu,torch.bfloat16,torch.bfloat16,torch.bfloat16,QuantType.No,1,1,32,0,1257.2784,moe_ck2stages_gemm1_256x32x64x64_1x4_TypeCastExpertWeight_v1_Nswizzle0_Quant0_MulRoutedWeight1_silu_B16_B16_B16,0.0%,722.716,moe_ck2stages_gemm2_256x32x64x64_1x4_TypeCast_v1_Nswizzle0_Quant0_MulRoutedWeight0_B16_B16_B16,0.0%,1979.9944,0
80,512,7168,512,256,8,ActivationType.Silu,torch.bfloat16,torch.float8_e4m3fnuz,torch.float8_e4m3fnuz,QuantType.per_Tensor,1,0,32,0,625.1681,_ZN5aiter48fmoe_stage1_bf16_pertokenFp8_g1u1_32x256_2tg_pf2E,0.0%,436.7729,moe_ck2stages_gemm2_256x32x64x128_1x4_MulABScaleExpertWeight_v1_Nswizzle0_Quant1_MulRoutedWeight1_F8_F8_B16,2.8%,1061.941,0
80,32,7168,512,256,8,ActivationType.Silu,torch.bfloat16,torch.float8_e4m3fnuz,torch.float8_e4m3fnuz,QuantType.per_Tensor,1,1,32,0,369.4651,moe_ck2stages_gemm1_256x32x64x256_1x4_MulABScale_v1_Nswizzle0_Quant1_MulRoutedWeight1_silu_F8_F8_B16,0.0%,236.5581,moe_ck2stages_gemm2_256x32x64x128_1x4_MulABScaleExpertWeight_v1_Nswizzle0_Quant1_MulRoutedWeight0_F8_F8_B16,0.0%,606.0232,0
80,64,7168,512,256,8,ActivationType.Silu,torch.bfloat16,torch.float8_e4m3fnuz,torch.float8_e4m3fnuz,QuantType.per_Tensor,1,1,32,0,516.6341,_ZN5aiter53fmoe_stage1_bf16_pertokenFp8_doweight_g1u1_32x512_pf3E,0.0%,344.0188,moe_ck2stages_gemm2_256x32x64x128_1x4_MulABScaleExpertWeight_v1_Nswizzle0_Quant1_MulRoutedWeight0_F8_F8_B16,0.0%,860.6529,0
80,128,7168,512,256,8,ActivationType.Silu,torch.bfloat16,torch.float8_e4m3fnuz,torch.float8_e4m3fnuz,QuantType.per_1x128,1,0,64,0,734.083,_ZN5aiter59fmoe_stage1_bf16_pertokenFp8_blockscale_g1u1_64x128_2tg_pf3E,5.0%,1066.5986,moe_ck2stages_gemm2_256x64x128x128_1x4_MulABScaleExpertWeightA8W8blkscale_v3_Nswizzle0_Quant4_MulRoutedWeight1_F8_F8_B16,15.6%,1800.6816,0
80,256,7168,512,256,8,ActivationType.Silu,torch.bfloat16,torch.float8_e4m3fnuz,torch.float8_e4m3fnuz,QuantType.per_1x128,1,0,64,0,742.2443,_ZN5aiter59fmoe_stage1_bf16_pertokenFp8_blockscale_g1u1_64x128_2tg_pf3E,5.0%,1076.2895,moe_ck2stages_gemm2_256x64x128x128_1x4_MulABScaleExpertWeightA8W8blkscale_v3_Nswizzle0_Quant4_MulRoutedWeight1_F8_F8_B16,15.6%,1818.5338,0
80,512,7168,512,256,8,ActivationType.Silu,torch.bfloat16,torch.float8_e4m3fnuz,torch.float8_e4m3fnuz,QuantType.per_1x128,1,0,64,0,766.7505,_ZN5aiter59fmoe_stage1_bf16_pertokenFp8_blockscale_g1u1_64x128_2tg_pf3E,5.0%,1169.6422,moe_ck2stages_gemm2_256x64x128x128_1x4_MulABScaleExpertWeightA8W8blkscale_v3_Nswizzle0_Quant4_MulRoutedWeight1_F8_F8_B16,15.6%,1936.3927,0
80,1024,7168,512,256,8,ActivationType.Silu,torch.bfloat16,torch.float8_e4m3fnuz,torch.float8_e4m3fnuz,QuantType.per_1x128,1,0,64,0,842.358,_ZN5aiter59fmoe_stage1_bf16_pertokenFp8_blockscale_g1u1_64x128_2tg_pf3E,5.0%,1457.3768,moe_ck2stages_gemm2_256x64x128x128_1x4_MulABScaleExpertWeightA8W8blkscale_v3_Nswizzle0_Quant4_MulRoutedWeight1_F8_F8_B16,15.6%,2299.7348,0
80,16,7168,512,256,8,ActivationType.Silu,torch.bfloat16,torch.float8_e4m3fnuz,torch.float8_e4m3fnuz,QuantType.per_1x128,1,1,64,0,626.7359,moe_ck2stages_gemm1_256x64x128x128_1x4_MulABScaleExpertWeightA8W8blkscale_v3_Nswizzle0_Quant4_MulRoutedWeight1_silu_F8_F8_B16,0.0%,439.6045,moe_ck2stages_gemm2_256x64x128x128_1x4_MulABScaleExpertWeightA8W8blkscale_v3_Nswizzle0_Quant4_MulRoutedWeight0_F8_F8_B16,16.7%,1066.3404,0
80,32,7168,512,256,8,ActivationType.Silu,torch.bfloat16,torch.float8_e4m3fnuz,torch.float8_e4m3fnuz,QuantType.per_1x128,1,1,64,0,937.3925,moe_ck2stages_gemm1_256x64x128x128_1x4_MulABScaleExpertWeightA8W8blkscale_v3_Nswizzle0_Quant4_MulRoutedWeight1_silu_F8_F8_B16,0.0%,691.1824,moe_ck2stages_gemm2_256x64x128x128_1x4_MulABScaleExpertWeightA8W8blkscale_v3_Nswizzle0_Quant4_MulRoutedWeight0_F8_F8_B16,16.7%,1628.5749,0
80,64,7168,512,256,8,ActivationType.Silu,torch.bfloat16,torch.float8_e4m3fnuz,torch.float8_e4m3fnuz,QuantType.per_1x128,1,1,64,0,1251.8964,moe_ck2stages_gemm1_256x64x128x128_1x4_MulABScaleExpertWeightA8W8blkscale_v3_Nswizzle0_Quant4_MulRoutedWeight1_silu_F8_F8_B16,0.0%,956.1773,moe_ck2stages_gemm2_256x64x128x128_1x4_MulABScaleExpertWeightA8W8blkscale_v3_Nswizzle0_Quant4_MulRoutedWeight0_F8_F8_B16,16.7%,2208.0737,0
80,128,7168,512,256,8,ActivationType.Silu,torch.bfloat16,torch.float8_e4m3fnuz,torch.float8_e4m3fnuz,QuantType.per_1x128,1,1,64,0,1365.5036,moe_ck2stages_gemm1_256x64x128x128_1x4_MulABScaleExpertWeightA8W8blkscale_v3_Nswizzle0_Quant4_MulRoutedWeight1_silu_F8_F8_B16,0.0%,1069.1426,moe_ck2stages_gemm2_256x64x128x128_1x4_MulABScaleExpertWeightA8W8blkscale_v3_Nswizzle0_Quant4_MulRoutedWeight0_F8_F8_B16,16.7%,2434.6462,0
80,256,7168,512,256,8,ActivationType.Silu,torch.bfloat16,torch.float8_e4m3fnuz,torch.float8_e4m3fnuz,QuantType.per_1x128,1,1,64,0,1395.7071,moe_ck2stages_gemm1_256x64x128x128_1x4_MulABScaleExpertWeightA8W8blkscale_v3_Nswizzle0_Quant4_MulRoutedWeight1_silu_F8_F8_B16,0.0%,1079.6034,moe_ck2stages_gemm2_256x64x128x128_1x4_MulABScaleExpertWeightA8W8blkscale_v3_Nswizzle0_Quant4_MulRoutedWeight0_F8_F8_B16,16.7%,2475.3105,0
80,512,7168,512,256,8,ActivationType.Silu,torch.bfloat16,torch.float8_e4m3fnuz,torch.float8_e4m3fnuz,QuantType.per_1x128,1,1,64,0,1465.3705,moe_ck2stages_gemm1_256x64x128x128_1x4_MulABScaleExpertWeightA8W8blkscale_v3_Nswizzle0_Quant4_MulRoutedWeight1_silu_F8_F8_B16,0.0%,1165.3011,moe_ck2stages_gemm2_256x64x128x128_1x4_MulABScaleExpertWeightA8W8blkscale_v3_Nswizzle0_Quant4_MulRoutedWeight0_F8_F8_B16,16.7%,2630.6716,0
80,1024,7168,512,256,8,ActivationType.Silu,torch.bfloat16,torch.float8_e4m3fnuz,torch.float8_e4m3fnuz,QuantType.per_1x128,1,1,64,0,1597.7791,moe_ck2stages_gemm1_256x64x128x128_1x4_MulABScaleExpertWeightA8W8blkscale_v3_Nswizzle0_Quant4_MulRoutedWeight1_silu_F8_F8_B16,0.0%,1447.9449,moe_ck2stages_gemm2_256x64x128x128_1x4_MulABScaleExpertWeightA8W8blkscale_v3_Nswizzle0_Quant4_MulRoutedWeight0_F8_F8_B16,16.7%,3045.724,0
80,16,7168,512,256,8,ActivationType.Gelu,torch.bfloat16,torch.bfloat16,torch.bfloat16,QuantType.No,1,0,32,0,440.6719,moe_ck2stages_gemm1_256x32x64x64_1x4_TypeCast_v1_Nswizzle0_Quant0_MulRoutedWeight0_gelu_B16_B16_B16,0.0%,255.5291,moe_ck2stages_gemm2_256x32x64x64_1x4_TypeCastExpertWeight_v1_Nswizzle0_Quant0_MulRoutedWeight1_B16_B16_B16,3.4%,696.201,0
80,32,7168,512,256,8,ActivationType.Gelu,torch.bfloat16,torch.bfloat16,torch.bfloat16,QuantType.No,1,0,32,0,714.05,moe_ck2stages_gemm1_256x32x64x64_1x4_TypeCast_v1_Nswizzle0_Quant0_MulRoutedWeight0_gelu_B16_B16_B16,0.0%,401.6611,moe_ck2stages_gemm2_256x32x64x64_1x4_TypeCastExpertWeight_v1_Nswizzle0_Quant0_MulRoutedWeight1_B16_B16_B16,3.4%,1115.7111,0
80,64,7168,512,256,8,ActivationType.Gelu,torch.bfloat16,torch.bfloat16,torch.bfloat16,QuantType.No,1,0,32,0,985.8866,moe_ck2stages_gemm1_256x32x64x64_1x4_TypeCast_v1_Nswizzle0_Quant0_MulRoutedWeight0_gelu_B16_B16_B16,0.0%,559.8234,moe_ck2stages_gemm2_256x32x64x64_1x4_TypeCastExpertWeight_v1_Nswizzle0_Quant0_MulRoutedWeight1_B16_B16_B16,3.5%,1545.71,0
80,128,7168,512,256,8,ActivationType.Gelu,torch.bfloat16,torch.bfloat16,torch.bfloat16,QuantType.No,1,0,32,0,1134.7112,moe_ck2stages_gemm1_256x32x64x64_1x4_TypeCast_v1_Nswizzle0_Quant0_MulRoutedWeight0_gelu_B16_B16_B16,0.0%,643.4691,moe_ck2stages_gemm2_256x32x64x64_1x4_TypeCastExpertWeight_v1_Nswizzle0_Quant0_MulRoutedWeight1_B16_B16_B16,3.3%,1778.1803,0
80,256,7168,512,256,8,ActivationType.Gelu,torch.bfloat16,torch.bfloat16,torch.bfloat16,QuantType.No,1,0,32,0,1149.8246,moe_ck2stages_gemm1_256x32x64x64_1x4_TypeCast_v1_Nswizzle0_Quant0_MulRoutedWeight0_gelu_B16_B16_B16,0.0%,670.1762,moe_ck2stages_gemm2_256x32x64x64_1x4_TypeCastExpertWeight_v1_Nswizzle0_Quant0_MulRoutedWeight1_B16_B16_B16,3.3%,1820.0008,0
80,512,7168,512,256,8,ActivationType.Gelu,torch.bfloat16,torch.bfloat16,torch.bfloat16,QuantType.No,1,0,32,0,1256.2287,moe_ck2stages_gemm1_256x32x64x64_1x4_TypeCast_v1_Nswizzle0_Quant0_MulRoutedWeight0_gelu_B16_B16_B16,0.0%,729.0988,moe_ck2stages_gemm2_256x32x64x64_1x4_TypeCastExpertWeight_v1_Nswizzle0_Quant0_MulRoutedWeight1_B16_B16_B16,3.3%,1985.3275,0
80,1024,7168,512,256,8,ActivationType.Gelu,torch.bfloat16,torch.bfloat16,torch.bfloat16,QuantType.No,1,0,32,0,1545.4364,moe_ck2stages_gemm1_256x32x64x128_1x4_TypeCast_v1_Nswizzle0_Quant0_MulRoutedWeight0_gelu_B16_B16_B16,0.0%,1026.4073,moe_ck2stages_gemm2_256x32x64x64_1x4_TypeCastExpertWeight_v1_Nswizzle0_Quant0_MulRoutedWeight1_B16_B16_B16,3.3%,2571.8437000000004,0
80,16,7168,512,256,8,ActivationType.Gelu,torch.bfloat16,torch.bfloat16,torch.bfloat16,QuantType.No,1,1,32,0,438.1766,moe_ck2stages_gemm1_256x32x64x64_1x4_TypeCastExpertWeight_v1_Nswizzle0_Quant0_MulRoutedWeight1_gelu_B16_B16_B16,0.0%,247.4425,moe_ck2stages_gemm2_256x32x64x64_1x4_TypeCast_v1_Nswizzle0_Quant0_MulRoutedWeight0_B16_B16_B16,0.0%,685.6191,0
80,32,7168,512,256,8,ActivationType.Gelu,torch.bfloat16,torch.bfloat16,torch.bfloat16,QuantType.No,1,1,32,0,712.3917,moe_ck2stages_gemm1_256x32x64x64_1x4_TypeCastExpertWeight_v1_Nswizzle0_Quant0_MulRoutedWeight1_gelu_B16_B16_B16,0.0%,389.8042,moe_ck2stages_gemm2_256x32x64x64_1x4_TypeCast_v1_Nswizzle0_Quant0_MulRoutedWeight0_B16_B16_B16,0.0%,1102.1959,0
80,64,7168,512,256,8,ActivationType.Gelu,torch.bfloat16,torch.bfloat16,torch.bfloat16,QuantType.No,1,1,32,0,979.7129,moe_ck2stages_gemm1_256x32x64x64_1x4_TypeCastExpertWeight_v1_Nswizzle0_Quant0_MulRoutedWeight1_gelu_B16_B16_B16,0.0%,568.5654,moe_ck2stages_gemm2_256x32x64x64_1x4_TypeCast_v1_Nswizzle0_Quant0_MulRoutedWeight0_B16_B16_B16,0.0%,1548.2783,0
80,128,7168,512,256,8,ActivationType.Gelu,torch.bfloat16,torch.bfloat16,torch.bfloat16,QuantType.No,1,1,32,0,1135.1695,moe_ck2stages_gemm1_256x32x64x64_1x4_TypeCastExpertWeight_v1_Nswizzle0_Quant0_MulRoutedWeight1_gelu_B16_B16_B16,0.0%,627.8855,moe_ck2stages_gemm2_256x32x64x64_1x4_TypeCast_v1_Nswizzle0_Quant0_MulRoutedWeight0_B16_B16_B16,0.0%,1763.0549999999998,0
80,256,7168,512,256,8,ActivationType.Gelu,torch.bfloat16,torch.bfloat16,torch.bfloat16,QuantType.No,1,1,32,0,1171.5851,moe_ck2stages_gemm1_256x32x64x64_1x4_TypeCastExpertWeight_v1_Nswizzle0_Quant0_MulRoutedWeight1_gelu_B16_B16_B16,0.0%,662.7687,moe_ck2stages_gemm2_256x32x64x64_1x4_TypeCast_v1_Nswizzle0_Quant0_MulRoutedWeight0_B16_B16_B16,0.0%,1834.3538,0
80,512,7168,512,256,8,ActivationType.Gelu,torch.bfloat16,torch.bfloat16,torch.bfloat16,QuantType.No,1,1,128,0,27.2341,moe_ck2stages_gemm1_256x128x128x128_1x4_TypeCastExpertWeight_v3_Nswizzle0_Quant0_MulRoutedWeight1_gelu_B16_B16_B16,0.0%,1749.6879,moe_ck2stages_gemm2_256x128x128x64_1x4_TypeCast_v3_Nswizzle0_Quant0_MulRoutedWeight0_B16_B16_B16,0.0%,1776.9219999999998,0
80,1024,7168,512,256,8,ActivationType.Gelu,torch.bfloat16,torch.bfloat16,torch.bfloat16,QuantType.No,1,1,32,0,1551.7224,moe_ck2stages_gemm1_256x32x64x128_1x4_TypeCastExpertWeight_v1_Nswizzle0_Quant0_MulRoutedWeight1_gelu_B16_B16_B16,0.0%,998.809,moe_ck2stages_gemm2_256x32x64x64_1x4_TypeCast_v1_Nswizzle0_Quant0_MulRoutedWeight0_B16_B16_B16,0.0%,2550.5314,0
80,16,7168,512,256,8,ActivationType.Gelu,torch.bfloat16,torch.float8_e4m3fnuz,torch.float8_e4m3fnuz,QuantType.per_Tensor,1,0,32,0,230.2686,moe_ck2stages_gemm1_256x32x64x128_1x4_MulABScale_v1_Nswizzle0_Quant1_MulRoutedWeight0_gelu_F8_F8_B16,0.0%,158.8229,moe_ck2stages_gemm2_256x32x64x128_1x4_MulABScaleExpertWeight_v1_Nswizzle0_Quant1_MulRoutedWeight1_F8_F8_B16,3.4%,389.0915,0
80,32,7168,512,256,8,ActivationType.Gelu,torch.bfloat16,torch.float8_e4m3fnuz,torch.float8_e4m3fnuz,QuantType.per_Tensor,1,0,32,0,372.7495,_ZN5aiter48fmoe_stage1_bf16_pertokenFp8_g1u1_32x128_3tg_pf3E,0.1%,246.5629,moe_ck2stages_gemm2_256x32x64x128_1x4_MulABScaleExpertWeight_v1_Nswizzle0_Quant1_MulRoutedWeight1_F8_F8_B16,3.5%,619.3124,0
80,64,7168,512,256,8,ActivationType.Gelu,torch.bfloat16,torch.float8_e4m3fnuz,torch.float8_e4m3fnuz,QuantType.per_Tensor,1,0,32,0,502.1489,moe_ck2stages_gemm1_256x32x64x128_1x4_MulABScale_v1_Nswizzle0_Quant1_MulRoutedWeight0_gelu_F8_F8_B16,0.0%,339.9999,moe_ck2stages_gemm2_256x32x64x128_1x4_MulABScaleExpertWeight_v1_Nswizzle0_Quant1_MulRoutedWeight1_F8_F8_B16,3.4%,842.1488,0
80,128,7168,512,256,8,ActivationType.Gelu,torch.bfloat16,torch.float8_e4m3fnuz,torch.float8_e4m3fnuz,QuantType.per_Tensor,1,0,32,0,586.3089,_ZN5aiter48fmoe_stage1_bf16_pertokenFp8_g1u1_32x128_3tg_pf3E,0.0%,394.6809,moe_ck2stages_gemm2_256x32x64x128_1x4_MulABScaleExpertWeight_v1_Nswizzle0_Quant1_MulRoutedWeight1_F8_F8_B16,3.3%,980.9898,0
80,256,7168,512,256,8,ActivationType.Gelu,torch.bfloat16,torch.float8_e4m3fnuz,torch.float8_e4m3fnuz,QuantType.per_Tensor,1,0,32,0,591.8466,_ZN5aiter48fmoe_stage1_bf16_pertokenFp8_g1u1_32x128_3tg_pf3E,0.1%,398.0473,moe_ck2stages_gemm2_256x32x64x128_1x4_MulABScaleExpertWeight_v1_Nswizzle0_Quant1_MulRoutedWeight1_F8_F8_B16,3.3%,989.8939,0
80,512,7168,512,256,8,ActivationType.Gelu,torch.bfloat16,torch.float8_e4m3fnuz,torch.float8_e4m3fnuz,QuantType.per_Tensor,1,0,32,0,626.1058,_ZN5aiter48fmoe_stage1_bf16_pertokenFp8_g1u1_32x256_2tg_pf2E,0.0%,442.0281,moe_ck2stages_gemm2_256x32x64x128_1x4_MulABScaleExpertWeight_v1_Nswizzle0_Quant1_MulRoutedWeight1_F8_F8_B16,3.3%,1068.1339,0
80,1024,7168,512,256,8,ActivationType.Gelu,torch.bfloat16,torch.float8_e4m3fnuz,torch.float8_e4m3fnuz,QuantType.per_Tensor,1,0,32,0,761.7135,_ZN5aiter44fmoe_stage1_bf16_pertokenFp8_g1u1_32x512_pf3E,0.0%,621.4747,moe_ck2stages_gemm2_256x32x64x128_1x4_MulABScaleExpertWeight_v1_Nswizzle0_Quant1_MulRoutedWeight1_F8_F8_B16,3.3%,1383.1882,0
80,16,7168,512,256,8,ActivationType.Gelu,torch.bfloat16,torch.float8_e4m3fnuz,torch.float8_e4m3fnuz,QuantType.per_Tensor,1,1,32,0,227.7593,moe_ck2stages_gemm1_256x32x64x128_1x4_MulABScale_v1_Nswizzle0_Quant1_MulRoutedWeight1_gelu_F8_F8_B16,0.0%,155.545,moe_ck2stages_gemm2_256x32x64x128_1x4_MulABScaleExpertWeight_v1_Nswizzle0_Quant1_MulRoutedWeight0_F8_F8_B16,0.0%,383.3043,0
80,32,7168,512,256,8,ActivationType.Gelu,torch.bfloat16,torch.float8_e4m3fnuz,torch.float8_e4m3fnuz,QuantType.per_Tensor,1,1,32,0,370.0464,_ZN5aiter57fmoe_stage1_bf16_pertokenFp8_doweight_g1u1_32x128_3tg_pf3E,0.0%,232.0003,moe_ck2stages_gemm2_256x32x64x128_1x4_MulABScaleExpertWeight_v1_Nswizzle0_Quant1_MulRoutedWeight0_F8_F8_B16,0.0%,602.0467,0
80,64,7168,512,256,8,ActivationType.Gelu,torch.bfloat16,torch.float8_e4m3fnuz,torch.float8_e4m3fnuz,QuantType.per_Tensor,1,1,32,0,509.0501,_ZN5aiter57fmoe_stage1_bf16_pertokenFp8_doweight_g1u1_32x128_3tg_pf3E,0.0%,326.8678,moe_ck2stages_gemm2_256x32x64x128_1x4_MulABScaleExpertWeight_v1_Nswizzle0_Quant1_MulRoutedWeight0_F8_F8_B16,0.0%,835.9178999999999,0
80,128,7168,512,256,8,ActivationType.Gelu,torch.bfloat16,torch.float8_e4m3fnuz,torch.float8_e4m3fnuz,QuantType.per_Tensor,1,1,32,0,583.1963,_ZN5aiter56fmoe_stage1_bf16_pertokenFp8_doweight_g1u1_32x64_4tg_pf3E,0.1%,372.1123,moe_ck2stages_gemm2_256x32x64x128_1x4_MulABScaleExpertWeight_v1_Nswizzle0_Quant1_MulRoutedWeight0_F8_F8_B16,0.0%,955.3086,0
80,256,7168,512,256,8,ActivationType.Gelu,torch.bfloat16,torch.float8_e4m3fnuz,torch.float8_e4m3fnuz,QuantType.per_Tensor,1,1,32,0,610.1172,_ZN5aiter57fmoe_stage1_bf16_pertokenFp8_doweight_g1u1_32x128_3tg_pf3E,0.0%,408.2756,moe_ck2stages_gemm2_256x32x64x128_1x4_MulABScaleExpertWeight_v1_Nswizzle0_Quant1_MulRoutedWeight0_F8_F8_B16,0.0%,1018.3928,0
80,512,7168,512,256,8,ActivationType.Gelu,torch.bfloat16,torch.float8_e4m3fnuz,torch.float8_e4m3fnuz,QuantType.per_Tensor,1,1,32,0,624.0096,_ZN5aiter57fmoe_stage1_bf16_pertokenFp8_doweight_g1u1_32x256_2tg_pf2E,0.0%,411.5878,moe_ck2stages_gemm2_256x32x64x128_1x4_MulABScaleExpertWeight_v1_Nswizzle0_Quant1_MulRoutedWeight0_F8_F8_B16,0.0%,1035.5974,0
80,1024,7168,512,256,8,ActivationType.Gelu,torch.bfloat16,torch.float8_e4m3fnuz,torch.float8_e4m3fnuz,QuantType.per_Tensor,1,1,32,0,759.5362,_ZN5aiter53fmoe_stage1_bf16_pertokenFp8_doweight_g1u1_32x512_pf3E,0.0%,596.1779,moe_ck2stages_gemm2_256x32x64x128_1x4_MulABScaleExpertWeight_v1_Nswizzle0_Quant1_MulRoutedWeight0_F8_F8_B16,0.0%,1355.7141,0
80,16,7168,512,256,8,ActivationType.Gelu,torch.bfloat16,torch.float8_e4m3fnuz,torch.float8_e4m3fnuz,QuantType.per_Token,1,0,32,0,231.6437,moe_ck2stages_gemm1_256x32x64x128_1x4_MulABScale_v1_Nswizzle0_Quant2_MulRoutedWeight0_gelu_F8_F8_B16,0.0%,173.6438,moe_ck2stages_gemm2_256x32x64x128_1x4_MulABScaleExpertWeight_v1_Nswizzle0_Quant2_MulRoutedWeight1_F8_F8_B16,3.4%,405.2875,0
80,32,7168,512,256,8,ActivationType.Gelu,torch.bfloat16,torch.float8_e4m3fnuz,torch.float8_e4m3fnuz,QuantType.per_Token,1,0,32,0,363.3125,moe_ck2stages_gemm1_256x32x64x256_1x4_MulABScale_v1_Nswizzle0_Quant2_MulRoutedWeight0_gelu_F8_F8_B16,0.0%,265.3606,moe_ck2stages_gemm2_256x32x64x128_1x4_MulABScaleExpertWeight_v1_Nswizzle0_Quant2_MulRoutedWeight1_F8_F8_B16,3.4%,628.6731,0
80,64,7168,512,256,8,ActivationType.Gelu,torch.bfloat16,torch.float8_e4m3fnuz,torch.float8_e4m3fnuz,QuantType.per_Token,1,0,32,0,507.5861,_ZN5aiter44fmoe_stage1_bf16_pertokenFp8_g1u1_32x512_pf3E,0.0%,362.0567,moe_ck2stages_gemm2_256x32x64x128_1x4_MulABScaleExpertWeight_v1_Nswizzle0_Quant2_MulRoutedWeight1_F8_F8_B16,3.4%,869.6428,0
80,128,7168,512,256,8,ActivationType.Gelu,torch.bfloat16,torch.float8_e4m3fnuz,torch.float8_e4m3fnuz,QuantType.per_Token,1,0,32,0,571.3867,_ZN5aiter48fmoe_stage1_bf16_pertokenFp8_g1u1_32x128_3tg_pf3E,0.0%,421.5456,moe_ck2stages_gemm2_256x32x64x128_1x4_MulABScaleExpertWeight_v1_Nswizzle0_Quant2_MulRoutedWeight1_F8_F8_B16,3.3%,992.9323,0
80,256,7168,512,256,8,ActivationType.Gelu,torch.bfloat16,torch.float8_e4m3fnuz,torch.float8_e4m3fnuz,QuantType.per_Token,1,0,32,0,600.7597,_ZN5aiter48fmoe_stage1_bf16_pertokenFp8_g1u1_32x128_3tg_pf3E,0.0%,432.403,moe_ck2stages_gemm2_256x32x64x128_1x4_MulABScaleExpertWeight_v1_Nswizzle0_Quant2_MulRoutedWeight1_F8_F8_B16,3.3%,1033.1627,0
80,512,7168,512,256,8,ActivationType.Gelu,torch.bfloat16,torch.float8_e4m3fnuz,torch.float8_e4m3fnuz,QuantType.per_Token,1,0,32,0,620.397,_ZN5aiter48fmoe_stage1_bf16_pertokenFp8_g1u1_32x128_3tg_pf3E,0.0%,467.8512,moe_ck2stages_gemm2_256x32x64x128_1x4_MulABScaleExpertWeight_v1_Nswizzle0_Quant2_MulRoutedWeight1_F8_F8_B16,3.3%,1088.2482,0
80,1024,7168,512,256,8,ActivationType.Gelu,torch.bfloat16,torch.float8_e4m3fnuz,torch.float8_e4m3fnuz,QuantType.per_Token,1,0,32,0,750.417,_ZN5aiter44fmoe_stage1_bf16_pertokenFp8_g1u1_32x512_pf3E,0.0%,717.4604,moe_ck2stages_gemm2_256x32x64x128_1x4_MulABScaleExpertWeight_v1_Nswizzle0_Quant2_MulRoutedWeight1_F8_F8_B16,3.3%,1467.8774,0
80,32,4096,384,128,8,ActivationType.Gelu,torch.bfloat16,torch.float8_e4m3fnuz,torch.float8_e4m3fnuz,QuantType.per_1x128,1,0,64,0,170.8048,_ZN5aiter59fmoe_stage1_bf16_pertokenFp8_blockscale_g1u1_64x128_2tg_pf3E,5.0%,245.0293,moe_ck2stages_gemm2_256x64x128x128_1x4_MulABScaleExpertWeightA8W8blkscale_v3_Nswizzle0_Quant4_MulRoutedWeight1_F8_F8_B16,15.6%,415.8341,0
80,64,4096,384,128,8,ActivationType.Gelu,torch.bfloat16,torch.float8_e4m3fnuz,torch.float8_e4m3fnuz,QuantType.per_1x128,1,0,64,0,172.4901,_ZN5aiter59fmoe_stage1_bf16_pertokenFp8_blockscale_g1u1_64x128_2tg_pf3E,5.0%,281.1187,moe_ck2stages_gemm2_256x64x128x128_1x4_MulABScaleExpertWeightA8W8blkscale_v3_Nswizzle0_Quant4_MulRoutedWeight1_F8_F8_B16,15.5%,453.6088,0
80,128,4096,384,128,8,ActivationType.Gelu,torch.bfloat16,torch.float8_e4m3fnuz,torch.float8_e4m3fnuz,QuantType.per_1x128,1,0,64,0,176.2462,_ZN5aiter59fmoe_stage1_bf16_pertokenFp8_blockscale_g1u1_64x128_2tg_pf3E,5.0%,289.4429,moe_ck2stages_gemm2_256x64x128x128_1x4_MulABScaleExpertWeightA8W8blkscale_v3_Nswizzle0_Quant4_MulRoutedWeight1_F8_F8_B16,15.5%,465.6891,0
80,256,4096,384,128,8,ActivationType.Gelu,torch.bfloat16,torch.float8_e4m3fnuz,torch.float8_e4m3fnuz,QuantType.per_1x128,1,0,64,0,179.9787,_ZN5aiter59fmoe_stage1_bf16_pertokenFp8_blockscale_g1u1_64x128_2tg_pf3E,5.0%,303.649,moe_ck2stages_gemm2_256x64x128x128_1x4_MulABScaleExpertWeightA8W8blkscale_v3_Nswizzle0_Quant4_MulRoutedWeight1_F8_F8_B16,15.4%,483.6277,0
80,512,4096,384,128,8,ActivationType.Gelu,torch.bfloat16,torch.float8_e4m3fnuz,torch.float8_e4m3fnuz,QuantType.per_1x128,1,0,64,0,192.9475,_ZN5aiter59fmoe_stage1_bf16_pertokenFp8_blockscale_g1u1_64x128_2tg_pf3E,5.1%,380.3291,moe_ck2stages_gemm2_256x64x128x128_1x4_MulABScaleExpertWeightA8W8blkscale_v3_Nswizzle0_Quant4_MulRoutedWeight1_F8_F8_B16,15.5%,573.2765999999999,0
80,1024,4096,384,128,8,ActivationType.Gelu,torch.bfloat16,torch.float8_e4m3fnuz,torch.float8_e4m3fnuz,QuantType.per_1x128,1,0,64,0,298.7441,_ZN5aiter59fmoe_stage1_bf16_pertokenFp8_blockscale_g1u1_64x128_2tg_pf3E,5.1%,610.7752,moe_ck2stages_gemm2_256x64x128x128_1x4_MulABScaleExpertWeightA8W8blkscale_v3_Nswizzle0_Quant4_MulRoutedWeight1_F8_F8_B16,15.5%,909.5193,0
80,16,4096,384,128,8,ActivationType.Gelu,torch.bfloat16,torch.float8_e4m3fnuz,torch.float8_e4m3fnuz,QuantType.per_1x128,1,1,64,0,259.659,moe_ck2stages_gemm1_256x64x128x128_1x4_MulABScaleExpertWeightA8W8blkscale_v3_Nswizzle0_Quant4_MulRoutedWeight1_gelu_F8_F8_B16,0.0%,191.0063,moe_ck2stages_gemm2_256x64x128x128_1x4_MulABScaleExpertWeightA8W8blkscale_v3_Nswizzle0_Quant4_MulRoutedWeight0_F8_F8_B16,16.8%,450.6653,0
80,32,4096,384,128,8,ActivationType.Gelu,torch.bfloat16,torch.float8_e4m3fnuz,torch.float8_e4m3fnuz,QuantType.per_1x128,1,1,64,0,323.568,moe_ck2stages_gemm1_256x64x128x128_1x4_MulABScaleExpertWeightA8W8blkscale_v3_Nswizzle0_Quant4_MulRoutedWeight1_gelu_F8_F8_B16,0.0%,246.7639,moe_ck2stages_gemm2_256x64x128x128_1x4_MulABScaleExpertWeightA8W8blkscale_v3_Nswizzle0_Quant4_MulRoutedWeight0_F8_F8_B16,16.7%,570.3319,0
80,64,4096,384,128,8,ActivationType.Gelu,torch.bfloat16,torch.float8_e4m3fnuz,torch.float8_e4m3fnuz,QuantType.per_1x128,1,1,64,0,327.6691,moe_ck2stages_gemm1_256x64x128x128_1x4_MulABScaleExpertWeightA8W8blkscale_v3_Nswizzle0_Quant4_MulRoutedWeight1_gelu_F8_F8_B16,0.0%,282.5738,moe_ck2stages_gemm2_256x64x128x128_1x4_MulABScaleExpertWeightA8W8blkscale_v3_Nswizzle0_Quant4_MulRoutedWeight0_F8_F8_B16,16.6%,610.2429,0
80,128,4096,384,128,8,ActivationType.Gelu,torch.bfloat16,torch.float8_e4m3fnuz,torch.float8_e4m3fnuz,QuantType.per_1x128,1,1,64,0,334.8265,moe_ck2stages_gemm1_256x64x128x128_1x4_MulABScaleExpertWeightA8W8blkscale_v3_Nswizzle0_Quant4_MulRoutedWeight1_gelu_F8_F8_B16,0.0%,290.6811,moe_ck2stages_gemm2_256x64x128x128_1x4_MulABScaleExpertWeightA8W8blkscale_v3_Nswizzle0_Quant4_MulRoutedWeight0_F8_F8_B16,16.6%,625.5076,0
80,256,4096,384,128,8,ActivationType.Gelu,torch.bfloat16,torch.float8_e4m3fnuz,torch.float8_e4m3fnuz,QuantType.per_1x128,1,1,64,0,350.2147,moe_ck2stages_gemm1_256x64x128x128_1x4_MulABScaleExpertWeightA8W8blkscale_v3_Nswizzle0_Quant4_MulRoutedWeight1_gelu_F8_F8_B16,0.0%,304.0772,moe_ck2stages_gemm2_256x64x128x128_1x4_MulABScaleExpertWeightA8W8blkscale_v3_Nswizzle0_Quant4_MulRoutedWeight0_F8_F8_B16,16.7%,654.2918999999999,0
80,512,4096,384,128,8,ActivationType.Gelu,torch.bfloat16,torch.float8_e4m3fnuz,torch.float8_e4m3fnuz,QuantType.per_1x128,1,1,64,0,376.2502,moe_ck2stages_gemm1_256x64x128x128_1x4_MulABScaleExpertWeightA8W8blkscale_v3_Nswizzle0_Quant4_MulRoutedWeight1_gelu_F8_F8_B16,0.0%,381.8117,moe_ck2stages_gemm2_256x64x128x128_1x4_MulABScaleExpertWeightA8W8blkscale_v3_Nswizzle0_Quant4_MulRoutedWeight0_F8_F8_B16,16.7%,758.0618999999999,0
80,1024,4096,384,128,8,ActivationType.Gelu,torch.bfloat16,torch.float8_e4m3fnuz,torch.float8_e4m3fnuz,QuantType.per_1x128,1,1,64,0,586.4168,moe_ck2stages_gemm1_256x64x128x128_1x4_MulABScaleExpertWeightA8W8blkscale_v3_Nswizzle0_Quant4_MulRoutedWeight1_gelu_F8_F8_B16,0.0%,613.9621,moe_ck2stages_gemm2_256x64x128x128_1x4_MulABScaleExpertWeightA8W8blkscale_v3_Nswizzle0_Quant4_MulRoutedWeight0_F8_F8_B16,16.7%,1200.3789,0
80,16,7168,512,256,8,ActivationType.Gelu,torch.bfloat16,torch.float8_e4m3fnuz,torch.float8_e4m3fnuz,QuantType.per_Token,1,1,32,0,230.2993,moe_ck2stages_gemm1_256x32x64x256_1x4_MulABScale_v1_Nswizzle0_Quant2_MulRoutedWeight1_gelu_F8_F8_B16,0.0%,169.4253,moe_ck2stages_gemm2_256x32x64x128_1x4_MulABScaleExpertWeight_v1_Nswizzle0_Quant2_MulRoutedWeight0_F8_F8_B16,0.0%,399.7246,0
80,32,7168,512,256,8,ActivationType.Gelu,torch.bfloat16,torch.float8_e4m3fnuz,torch.float8_e4m3fnuz,QuantType.per_Token,1,1,32,0,363.9112,moe_ck2stages_gemm1_256x32x64x128_1x4_MulABScale_v1_Nswizzle0_Quant2_MulRoutedWeight1_gelu_F8_F8_B16,0.0%,259.8372,moe_ck2stages_gemm2_256x32x64x128_1x4_MulABScaleExpertWeight_v1_Nswizzle0_Quant2_MulRoutedWeight0_F8_F8_B16,0.0%,623.7484,0
80,64,7168,512,256,8,ActivationType.Gelu,torch.bfloat16,torch.float8_e4m3fnuz,torch.float8_e4m3fnuz,QuantType.per_Token,1,1,32,0,510.4385,_ZN5aiter53fmoe_stage1_bf16_pertokenFp8_doweight_g1u1_32x512_pf3E,0.0%,361.3331,moe_ck2stages_gemm2_256x32x64x128_1x4_MulABScaleExpertWeight_v1_Nswizzle0_Quant2_MulRoutedWeight0_F8_F8_B16,0.0%,871.7716,0
80,128,7168,512,256,8,ActivationType.Gelu,torch.bfloat16,torch.float8_e4m3fnuz,torch.float8_e4m3fnuz,QuantType.per_Token,1,1,32,0,570.8776,_ZN5aiter57fmoe_stage1_bf16_pertokenFp8_doweight_g1u1_32x128_3tg_pf3E,0.0%,416.9556,moe_ck2stages_gemm2_256x32x64x128_1x4_MulABScaleExpertWeight_v1_Nswizzle0_Quant2_MulRoutedWeight0_F8_F8_B16,0.0%,987.8332,0
80,256,7168,512,256,8,ActivationType.Gelu,torch.bfloat16,torch.float8_e4m3fnuz,torch.float8_e4m3fnuz,QuantType.per_Token,1,1,32,0,591.7744,_ZN5aiter57fmoe_stage1_bf16_pertokenFp8_doweight_g1u1_32x128_3tg_pf3E,0.0%,430.4532,moe_ck2stages_gemm2_256x32x64x128_1x4_MulABScaleExpertWeight_v1_Nswizzle0_Quant2_MulRoutedWeight0_F8_F8_B16,0.0%,1022.2276,0
80,512,7168,512,256,8,ActivationType.Gelu,torch.bfloat16,torch.float8_e4m3fnuz,torch.float8_e4m3fnuz,QuantType.per_Token,1,1,32,0,619.0301,_ZN5aiter57fmoe_stage1_bf16_pertokenFp8_doweight_g1u1_32x256_2tg_pf2E,0.0%,468.3093,moe_ck2stages_gemm2_256x32x64x128_1x4_MulABScaleExpertWeight_v1_Nswizzle0_Quant2_MulRoutedWeight0_F8_F8_B16,0.0%,1087.3393999999998,0
