aiter/ops/triton/configs/gemm/gfx1201-GEMM-A8W8_BLOCKSCALE_PRESHUFFLED-N=24576-K=4096.json
{
  "M_LEQ_8": {
    "BLOCK_SIZE_M": 16,
    "BLOCK_SIZE_N": 32,
    "BLOCK_SIZE_K": 128,
    "GROUP_SIZE_M": 1,
    "num_warps": 2,
    "num_stages": 1,
    "waves_per_eu": 4,
    "matrix_instr_nonkdim": 16,
    "cache_modifier": null,
    "NUM_KSPLIT": 1
  },
  "M_LEQ_512": {
    "BLOCK_SIZE_M": 128,
    "BLOCK_SIZE_N": 64,
    "BLOCK_SIZE_K": 128,
    "GROUP_SIZE_M": 1,
    "num_warps": 4,
    "num_stages": 1,
    "waves_per_eu": 2,
    "matrix_instr_nonkdim": 16,
    "cache_modifier": null,
    "NUM_KSPLIT": 1
  },
  "M_LEQ_1024": {
    "BLOCK_SIZE_M": 128,
    "BLOCK_SIZE_N": 64,
    "BLOCK_SIZE_K": 128,
    "GROUP_SIZE_M": 1,
    "num_warps": 4,
    "num_stages": 1,
    "waves_per_eu": 2,
    "matrix_instr_nonkdim": 16,
    "cache_modifier": null,
    "NUM_KSPLIT": 1
  },
  "any": {
    "BLOCK_SIZE_M": 16,
    "BLOCK_SIZE_N": 64,
    "BLOCK_SIZE_K": 128,
    "GROUP_SIZE_M": 1,
    "num_warps": 4,
    "num_stages": 2,
    "waves_per_eu": 2,
    "matrix_instr_nonkdim": 16,
    "cache_modifier": null,
    "NUM_KSPLIT": 1
  }
}
