aiter/ops/triton/configs/gemm/gfx1201-BATCHED_GEMM-A8W8-A_PER_TOKEN_GROUP_PREQUANT_W_PER_BATCHED_TENSOR_QUANT-N=512-K=128.json
{
    "M_LEQ_16": {
        "BLOCK_SIZE_M": 16,
        "BLOCK_SIZE_N": 32,
        "GROUP_SIZE_M": 1,
        "num_warps": 8,
        "num_stages": 1,
        "waves_per_eu": 6,
        "matrix_instr_nonkdim": 16,
        "cache_modifier": ".cg",
        "kpack": 1
    },
    "M_LEQ_32": {
        "BLOCK_SIZE_M": 16,
        "BLOCK_SIZE_N": 128,
        "GROUP_SIZE_M": 8,
        "num_warps": 8,
        "num_stages": 1,
        "waves_per_eu": 8,
        "matrix_instr_nonkdim": 16,
        "cache_modifier": ".cg",
        "kpack": 1
    },
    "M_LEQ_64": {
        "BLOCK_SIZE_M": 16,
        "BLOCK_SIZE_N": 128,
        "GROUP_SIZE_M": 4,
        "num_warps": 8,
        "num_stages": 1,
        "waves_per_eu": 4,
        "matrix_instr_nonkdim": 16,
        "cache_modifier": ".cg",
        "kpack": 1
    },
    "M_LEQ_128": {
        "BLOCK_SIZE_M": 16,
        "BLOCK_SIZE_N": 128,
        "GROUP_SIZE_M": 4,
        "num_warps": 8,
        "num_stages": 1,
        "waves_per_eu": 4,
        "matrix_instr_nonkdim": 16,
        "cache_modifier": null,
        "kpack": 1
    },
    "M_LEQ_256": {
        "BLOCK_SIZE_M": 16,
        "BLOCK_SIZE_N": 128,
        "GROUP_SIZE_M": 4,
        "num_warps": 8,
        "num_stages": 1,
        "waves_per_eu": 4,
        "matrix_instr_nonkdim": 16,
        "cache_modifier": ".cg",
        "kpack": 1
    },
    "any": {
        "BLOCK_SIZE_M": 16,
        "BLOCK_SIZE_N": 256,
        "GROUP_SIZE_M": 4,
        "num_warps": 8,
        "num_stages": 1,
        "waves_per_eu": 4,
        "matrix_instr_nonkdim": 16,
        "cache_modifier": ".cg",
        "kpack": 1
    }
}
