aiter/ops/triton/configs/gemm/gfx942-GEMM-A8W8_BLOCKSCALE-N=7168-K=2048.json
{
    "M_LEQ_4": {
        "BLOCK_SIZE_M": 16,
        "BLOCK_SIZE_N": 64,
        "BLOCK_SIZE_K": 128,
        "GROUP_SIZE_M": 1,
        "num_warps": 2,
        "num_stages": 2,
        "waves_per_eu": 2,
        "cache_modifier": null,
        "NUM_KSPLIT": 1,
        "GROUP_K": 128,
        "GROUP_N": 128,
        "kpack": 2
    },
    "M_LEQ_8": {
        "BLOCK_SIZE_M": 16,
        "BLOCK_SIZE_N": 64,
        "BLOCK_SIZE_K": 128,
        "GROUP_SIZE_M": 1,
        "num_warps": 2,
        "num_stages": 2,
        "waves_per_eu": 2,
        "cache_modifier": null,
        "NUM_KSPLIT": 1,
        "GROUP_K": 128,
        "GROUP_N": 128,
        "kpack": 2
    },
    "M_LEQ_16": {
        "BLOCK_SIZE_M": 16,
        "BLOCK_SIZE_N": 16,
        "BLOCK_SIZE_K": 128,
        "GROUP_SIZE_M": 2,
        "num_warps": 4,
        "num_stages": 2,
        "waves_per_eu": 0,
        "NUM_KSPLIT": 1,
        "cache_modifier": ".cg",
        "GROUP_K": 128,
        "GROUP_N": 128,
        "kpack": 2,
        "SPLITK_BLOCK_SIZE": 2048
    },
    "M_LEQ_32": {
        "BLOCK_SIZE_M": 16,
        "BLOCK_SIZE_N": 16,
        "BLOCK_SIZE_K": 128,
        "GROUP_SIZE_M": 2,
        "num_warps": 4,
        "num_stages": 2,
        "waves_per_eu": 0,
        "NUM_KSPLIT": 1,
        "cache_modifier": ".cg",
        "GROUP_K": 128,
        "GROUP_N": 128,
        "kpack": 2,
        "SPLITK_BLOCK_SIZE": 2048
    },
    "M_LEQ_64": {
        "BLOCK_SIZE_M": 64,
        "BLOCK_SIZE_N": 128,
        "BLOCK_SIZE_K": 128,
        "GROUP_SIZE_M": 8,
        "num_warps": 4,
        "num_stages": 3,
        "waves_per_eu": 2,
        "NUM_KSPLIT": 1,
        "cache_modifier": ".cg",
        "GROUP_K": 128,
        "GROUP_N": 128,
        "kpack": 2,
        "SPLITK_BLOCK_SIZE": 2048
    },
    "any": {
        "BLOCK_SIZE_M": 64,
        "BLOCK_SIZE_N": 128,
        "BLOCK_SIZE_K": 128,
        "GROUP_SIZE_M": 4,
        "num_warps": 4,
        "num_stages": 2,
        "waves_per_eu": 0,
        "NUM_KSPLIT": 1,
        "cache_modifier": ".cg",
        "GROUP_K": 128,
        "GROUP_N": 128,
        "kpack": 2
    }
}