aiter/configs/model_configs/a8w8_blockscale_tuned_fmoe_glm5.csv
cu_num,token,model_dim,inter_dim,expert,topk,act_type,dtype,q_dtype_a,q_dtype_w,q_type,use_g1u1,doweight_stage1,block_m,ksplit,us1,kernelName1,err1,us2,kernelName2,err2,us,run_1stage,tflops,bw
256,1,6144,256,257,9,ActivationType.Silu,torch.bfloat16,torch.float8_e4m3fn,torch.float8_e4m3fn,QuantType.per_1x128,1,0,32,6,19.2511,moe_ck2stages_gemm1_256x32x128x128_1x4_MulABScaleExpertWeightA8W8blkscaleSplitk_v1_Nswizzle0_Quant4_MulRoutedWeight0_silu_F8_F8_B16,0.9%,8.356,moe_ck2stages_gemm2_256x32x128x128_1x4_MulABScaleExpertWeightA8W8blkscale_v1_Nswizzle0_Quant4_MulRoutedWeight1_F8_F8_B16,17.7%,27.6071,0,3.08,43926.98
256,2,6144,256,257,9,ActivationType.Silu,torch.bfloat16,torch.float8_e4m3fn,torch.float8_e4m3fn,QuantType.per_1x128,1,0,32,4,24.1099,moe_ck2stages_gemm1_256x32x128x128_1x4_MulABScaleExpertWeightA8W8blkscaleSplitk_v1_Nswizzle0_Quant4_MulRoutedWeight0_silu_F8_F8_B16,0.6%,15.3292,moe_ck2stages_gemm2_256x32x128x128_1x4_MulABScaleExpertWeightA8W8blkscale_v1_Nswizzle0_Quant4_MulRoutedWeight1_F8_F8_B16,17.4%,39.4391,0,4.31,30749.05
256,4,6144,256,257,9,ActivationType.Silu,torch.bfloat16,torch.float8_e4m3fn,torch.float8_e4m3fn,QuantType.per_1x128,1,0,32,3,36.739,moe_ck2stages_gemm1_256x32x128x128_1x4_MulABScaleExpertWeightA8W8blkscaleSplitk_v1_Nswizzle0_Quant4_MulRoutedWeight0_silu_F8_F8_B16,0.9%,18.4441,moe_ck2stages_gemm2_256x32x128x128_1x4_MulABScaleExpertWeightA8W8blkscale_v1_Nswizzle0_Quant4_MulRoutedWeight1_F8_F8_B16,17.5%,55.1831,0,6.16,21976.87
256,8,6144,256,257,9,ActivationType.Silu,torch.bfloat16,torch.float8_e4m3fn,torch.float8_e4m3fn,QuantType.per_1x128,1,0,32,0,79.6053,_ZN5aiter44fmoe_bf16_blockscaleBf16_g1u1_ps_silu_32x128E,0.0%,0.0,,0.0%,79.6053,1,8.54,15235.49
256,16,6144,256,257,9,ActivationType.Silu,torch.bfloat16,torch.float8_e4m3fn,torch.float8_e4m3fn,QuantType.per_1x128,1,0,32,0,125.4067,_ZN5aiter50fmoe_bf16_blockscaleFp8_g1u1_vs_silu_1tg_ps_32x256E,0.0%,0.0,,0.0%,125.4067,1,10.84,9672.31
256,32,6144,256,257,9,ActivationType.Silu,torch.bfloat16,torch.float8_e4m3fn,torch.float8_e4m3fn,QuantType.per_1x128,1,0,32,3,156.0002,moe_ck2stages_gemm1_256x32x128x128_1x4_MulABScaleExpertWeightA8W8blkscaleSplitk_v1_Nswizzle0_Quant4_MulRoutedWeight0_silu_F8_F8_B16,0.8%,71.8745,moe_ck2stages_gemm2_256x32x128x128_1x4_MulABScaleExpertWeightA8W8blkscale_v1_Nswizzle0_Quant4_MulRoutedWeight1_F8_F8_B16,17.5%,227.8747,0,11.93,5324.28
256,64,6144,256,257,9,ActivationType.Silu,torch.bfloat16,torch.float8_e4m3fn,torch.float8_e4m3fn,QuantType.per_1x128,1,0,32,3,159.8955,moe_ck2stages_gemm1_256x32x128x128_1x4_MulABScaleExpertWeightA8W8blkscaleSplitk_v1_Nswizzle0_Quant4_MulRoutedWeight0_silu_F8_F8_B16,0.8%,73.713,moe_ck2stages_gemm2_256x32x128x128_1x4_MulABScaleExpertWeightA8W8blkscale_v1_Nswizzle0_Quant4_MulRoutedWeight1_F8_F8_B16,17.5%,233.6085,0,23.27,5196.12
256,128,6144,256,257,9,ActivationType.Silu,torch.bfloat16,torch.float8_e4m3fn,torch.float8_e4m3fn,QuantType.per_1x128,1,0,32,0,165.9162,moe_ck2stages_gemm1_256x32x128x128_1x4_MulABScaleExpertWeightA8W8blkscaleSplitk_v1_Nswizzle0_Quant4_MulRoutedWeight0_silu_F8_F8_B16,0.1%,75.0628,moe_ck2stages_gemm2_256x32x128x128_1x4_MulABScaleExpertWeightA8W8blkscale_v1_Nswizzle0_Quant4_MulRoutedWeight1_F8_F8_B16,17.5%,240.979,0,45.11,5042.09
256,256,6144,256,257,9,ActivationType.Silu,torch.bfloat16,torch.float8_e4m3fn,torch.float8_e4m3fn,QuantType.per_1x128,1,0,32,0,166.6076,moe_ck2stages_gemm1_256x32x128x128_1x4_MulABScaleExpertWeightA8W8blkscaleSplitk_v1_Nswizzle0_Quant4_MulRoutedWeight0_silu_F8_F8_B16,0.1%,77.4096,moe_ck2stages_gemm2_256x32x128x128_1x4_MulABScaleExpertWeightA8W8blkscale_v1_Nswizzle0_Quant4_MulRoutedWeight1_F8_F8_B16,17.5%,244.0172,0,89.11,4988.98
256,512,6144,256,257,9,ActivationType.Silu,torch.bfloat16,torch.float8_e4m3fn,torch.float8_e4m3fn,QuantType.per_1x128,1,0,32,0,174.0808,moe_ck2stages_gemm1_256x32x128x128_1x4_MulABScaleExpertWeightA8W8blkscaleSplitk_v1_Nswizzle0_Quant4_MulRoutedWeight0_silu_F8_F8_B16,0.1%,83.8513,moe_ck2stages_gemm2_256x32x128x128_1x4_MulABScaleExpertWeightA8W8blkscale_v1_Nswizzle0_Quant4_MulRoutedWeight1_F8_F8_B16,17.4%,257.9321,0,168.6,4738.13
256,1024,6144,256,257,9,ActivationType.Silu,torch.bfloat16,torch.float8_e4m3fn,torch.float8_e4m3fn,QuantType.per_1x128,1,0,64,0,357.602,_ZN5aiter40fmoe_bf16_blockscaleFp8_g1u1_silu_64x256E,0.0%,0.0,,0.0%,357.602,1,243.21,3443.92
256,2048,6144,256,257,9,ActivationType.Silu,torch.bfloat16,torch.float8_e4m3fn,torch.float8_e4m3fn,QuantType.per_1x128,1,0,64,0,500.8267,_ZN5aiter40fmoe_bf16_blockscaleFp8_g1u1_silu_64x256E,0.0%,0.0,,0.0%,500.8267,1,347.32,2496.73
256,4096,6144,256,257,9,ActivationType.Silu,torch.bfloat16,torch.float8_e4m3fn,torch.float8_e4m3fn,QuantType.per_1x128,1,0,64,0,675.1211,_ZN5aiter40fmoe_bf16_blockscaleFp8_g1u1_silu_64x256E,0.0%,0.0,,0.0%,675.1211,1,515.3,1908.07
256,8192,6144,256,257,9,ActivationType.Silu,torch.bfloat16,torch.float8_e4m3fn,torch.float8_e4m3fn,QuantType.per_1x128,1,0,64,0,1122.5513,_ZN5aiter40fmoe_bf16_blockscaleFp8_g1u1_silu_64x256E,0.0%,0.0,,0.0%,1122.5513,1,619.82,1214.8
256,16384,6144,256,257,9,ActivationType.Silu,torch.bfloat16,torch.float8_e4m3fn,torch.float8_e4m3fn,QuantType.per_1x128,1,0,64,0,1995.3897,_ZN5aiter40fmoe_bf16_blockscaleFp8_g1u1_silu_64x256E,0.0%,0.0,,0.0%,1995.3897,1,697.39,759.08
256,32768,6144,256,257,9,ActivationType.Silu,torch.bfloat16,torch.float8_e4m3fn,torch.float8_e4m3fn,QuantType.per_1x128,1,0,64,0,3628.9889,_ZN5aiter40fmoe_bf16_blockscaleFp8_g1u1_silu_64x256E,0.0%,0.0,,0.0%,3628.9889,1,766.92,500.6
