aiter/configs/model_configs/a8w8_blockscale_bpreshuffle_tuned_gemm_qwen3_235b.csv
cu_num,M,N,K,libtype,kernelId,splitK,us,kernelName,tflops,bw,errRatio
256,1,1280,4096,ck,7,0,12.9489,a8w8_blockscale_bpreshuffle_1x128x128_256x16x64x256_16x16_16x16_16x16x1_16x16x1_1x16x1x16_4_1x1_intrawave_v1,0.81,405.4,0.0
256,2,1280,4096,ck,7,0,13.0111,a8w8_blockscale_bpreshuffle_1x128x128_256x16x64x256_16x16_16x16_16x16x1_16x16x1_1x16x1x16_4_1x1_intrawave_v1,1.61,403.98,0.0
256,4,1280,4096,ck,7,0,12.855,a8w8_blockscale_bpreshuffle_1x128x128_256x16x64x256_16x16_16x16_16x16x1_16x16x1_1x16x1x16_4_1x1_intrawave_v1,3.26,409.92,0.0
256,8,1280,4096,ck,7,0,13.1195,a8w8_blockscale_bpreshuffle_1x128x128_256x16x64x256_16x16_16x16_16x16x1_16x16x1_1x16x1x16_4_1x1_intrawave_v1,6.39,403.68,0.0
256,16,1280,4096,ck,7,0,12.1515,a8w8_blockscale_bpreshuffle_1x128x128_256x16x64x256_16x16_16x16_16x16x1_16x16x1_1x16x1x16_4_1x1_intrawave_v1,13.81,440.22,0.0
256,32,1280,4096,ck,7,0,12.0636,a8w8_blockscale_bpreshuffle_1x128x128_256x16x64x256_16x16_16x16_16x16x1_16x16x1_1x16x1x16_4_1x1_intrawave_v1,27.81,452.26,0.0
256,64,1280,4096,ck,7,0,11.9591,a8w8_blockscale_bpreshuffle_1x128x128_256x16x64x256_16x16_16x16_16x16x1_16x16x1_1x16x1x16_4_1x1_intrawave_v1,56.12,474.02,0.0
256,128,1280,4096,ck,7,0,11.795,a8w8_blockscale_bpreshuffle_1x128x128_256x16x64x256_16x16_16x16_16x16x1_16x16x1_1x16x1x16_4_1x1_intrawave_v1,113.79,516.73,0.0
256,256,1280,4096,ck,12,0,12.6183,a8w8_blockscale_bpreshuffle_1x128x128_256x32x64x256_16x16_16x16_16x16x1_16x16x1_1x32x1x8_8_2x1_intrawave_v1,212.74,550.54,0.0
256,512,1280,4096,ck,17,0,14.6566,a8w8_blockscale_bpreshuffle_1x128x128_256x64x64x256_16x16_16x16_16x16x1_16x16x1_1x32x1x8_8_2x1_intrawave_v1,366.3,590.23,0.0
256,1024,1280,4096,ck,17,0,21.4933,a8w8_blockscale_bpreshuffle_1x128x128_256x64x64x256_16x16_16x16_16x16x1_16x16x1_1x32x1x8_8_2x1_intrawave_v1,499.57,561.04,0.0
256,2048,1280,4096,ck,14,0,30.3452,a8w8_blockscale_bpreshuffle_1x128x128_256x64x128x128_16x16_16x16_8x32x1_8x32x1_1x32x1x8_8_2x1_intrawave_v1,707.68,621.99,0.0001
256,4096,1280,4096,ck,13,0,43.6628,a8w8_blockscale_bpreshuffle_1x128x128_256x64x256x128_16x16_16x16_8x32x1_8x32x1_1x32x1x8_8_2x1_intrawave_v1,983.67,744.47,0.0
256,8192,1280,4096,cktile,11,0,66.293,a8w8_blockscale_cktile_192x256x128_4x2x1_16x16x128_intrawave_0x1x0_1,1295.75,901.59,0.0
256,16384,1280,4096,cktile,11,0,129.3201,a8w8_blockscale_cktile_192x256x128_4x2x1_16x16x128_intrawave_0x1x0_1,1328.48,883.81,0.0
256,32768,1280,4096,cktile,11,0,245.7508,a8w8_blockscale_cktile_192x256x128_4x2x1_16x16x128_intrawave_0x1x0_1,1398.15,908.83,0.0
256,1,2304,4096,ck,7,0,12.8681,a8w8_blockscale_bpreshuffle_1x128x128_256x16x64x256_16x16_16x16_16x16x1_16x16x1_1x16x1x16_4_1x1_intrawave_v1,1.47,734.05,0.0
256,2,2304,4096,ck,7,0,12.9331,a8w8_blockscale_bpreshuffle_1x128x128_256x16x64x256_16x16_16x16_16x16x1_16x16x1_1x16x1x16_4_1x1_intrawave_v1,2.92,731.04,0.0
256,4,2304,4096,ck,7,0,12.8197,a8w8_blockscale_bpreshuffle_1x128x128_256x16x64x256_16x16_16x16_16x16x1_16x16x1_1x16x1x16_4_1x1_intrawave_v1,5.89,738.86,0.0
256,8,2304,4096,ck,7,0,12.8411,a8w8_blockscale_bpreshuffle_1x128x128_256x16x64x256_16x16_16x16_16x16x1_16x16x1_1x16x1x16_4_1x1_intrawave_v1,11.76,740.34,0.0
256,16,2304,4096,ck,7,0,11.8579,a8w8_blockscale_bpreshuffle_1x128x128_256x16x64x256_16x16_16x16_16x16x1_16x16x1_1x16x1x16_4_1x1_intrawave_v1,25.47,807.6,0.0
256,32,2304,4096,ck,7,0,11.9991,a8w8_blockscale_bpreshuffle_1x128x128_256x16x64x256_16x16_16x16_16x16x1_16x16x1_1x16x1x16_4_1x1_intrawave_v1,50.34,809.7,0.0
256,64,2304,4096,ck,7,0,12.0375,a8w8_blockscale_bpreshuffle_1x128x128_256x16x64x256_16x16_16x16_16x16x1_16x16x1_1x16x1x16_4_1x1_intrawave_v1,100.35,830.26,0.0
256,128,2304,4096,ck,12,0,12.7292,a8w8_blockscale_bpreshuffle_1x128x128_256x32x64x256_16x16_16x16_16x16x1_16x16x1_1x32x1x8_8_2x1_intrawave_v1,189.79,828.9,0.0
256,256,2304,4096,ck,17,0,14.8289,a8w8_blockscale_bpreshuffle_1x128x128_256x64x64x256_16x16_16x16_16x16x1_16x16x1_1x32x1x8_8_2x1_intrawave_v1,325.84,786.67,0.0
256,512,2304,4096,ck,17,0,21.0801,a8w8_blockscale_bpreshuffle_1x128x128_256x64x64x256_16x16_16x16_16x16x1_16x16x1_1x32x1x8_8_2x1_intrawave_v1,458.43,659.09,0.0
256,1024,2304,4096,ck,2,0,29.486,a8w8_blockscale_bpreshuffle_1x128x128_256x64x64x128_16x16_16x16_8x32x1_8x32x1_1x32x1x8_8_2x1_intrawave_v3,655.48,622.33,0.0
256,2048,2304,4096,ck,14,0,43.9597,a8w8_blockscale_bpreshuffle_1x128x128_256x64x128x128_16x16_16x16_8x32x1_8x32x1_1x32x1x8_8_2x1_intrawave_v1,879.32,620.18,0.0001
256,4096,2304,4096,cktile,11,0,64.6314,a8w8_blockscale_cktile_192x256x128_4x2x1_16x16x128_intrawave_0x1x0_1,1196.16,697.63,0.0
256,8192,2304,4096,cktile,11,0,124.9288,a8w8_blockscale_cktile_192x256x128_4x2x1_16x16x128_intrawave_0x1x0_1,1237.66,646.29,0.0
256,16384,2304,4096,cktile,11,0,218.1091,a8w8_blockscale_cktile_192x256x128_4x2x1_16x16x128_intrawave_0x1x0_1,1417.81,697.1,0.0
256,32768,2304,4096,cktile,11,0,395.5176,a8w8_blockscale_cktile_192x256x128_4x2x1_16x16x128_intrawave_0x1x0_1,1563.71,744.97,0.0
256,1,4096,1024,ck,7,0,5.355,a8w8_blockscale_bpreshuffle_1x128x128_256x16x64x256_16x16_16x16_16x16x1_16x16x1_1x16x1x16_4_1x1_intrawave_v1,1.57,784.97,0.0
256,1,4096,2048,ck,7,0,7.8221,a8w8_blockscale_bpreshuffle_1x128x128_256x16x64x256_16x16_16x16_16x16x1_16x16x1_1x16x1x16_4_1x1_intrawave_v1,2.14,1073.73,0.0
256,1,4096,4096,ck,7,0,12.6324,a8w8_blockscale_bpreshuffle_1x128x128_256x16x64x256_16x16_16x16_16x16x1_16x16x1_1x16x1x16_4_1x1_intrawave_v1,2.66,1329.08,0.0
256,1,4096,8192,ck,7,0,23.6611,a8w8_blockscale_bpreshuffle_1x128x128_256x16x64x256_16x16_16x16_16x16x1_16x16x1_1x16x1x16_4_1x1_intrawave_v1,2.84,1418.82,0.0
256,2,4096,1024,ck,7,0,5.3046,a8w8_blockscale_bpreshuffle_1x128x128_256x16x64x256_16x16_16x16_16x16x1_16x16x1_1x16x1x16_4_1x1_intrawave_v1,3.16,794.17,0.0
256,2,4096,2048,ck,7,0,7.8221,a8w8_blockscale_bpreshuffle_1x128x128_256x16x64x256_16x16_16x16_16x16x1_16x16x1_1x16x1x16_4_1x1_intrawave_v1,4.29,1075.04,0.0
256,2,4096,4096,ck,7,0,12.3902,a8w8_blockscale_bpreshuffle_1x128x128_256x16x64x256_16x16_16x16_16x16x1_16x16x1_1x16x1x16_4_1x1_intrawave_v1,5.42,1356.05,0.0
256,2,4096,8192,ck,7,0,23.5334,a8w8_blockscale_bpreshuffle_1x128x128_256x16x64x256_16x16_16x16_16x16x1_16x16x1_1x16x1x16_4_1x1_intrawave_v1,5.7,1427.21,0.0
256,4,4096,1024,ck,7,0,5.3668,a8w8_blockscale_bpreshuffle_1x128x128_256x16x64x256_16x16_16x16_16x16x1_16x16x1_1x16x1x16_4_1x1_intrawave_v1,6.25,788.4,0.0
256,4,4096,2048,ck,7,0,8.3006,a8w8_blockscale_bpreshuffle_1x128x128_256x16x64x256_16x16_16x16_16x16x1_16x16x1_1x16x1x16_4_1x1_intrawave_v1,8.08,1015.54,0.0
256,4,4096,4096,ck,7,0,12.5586,a8w8_blockscale_bpreshuffle_1x128x128_256x16x64x256_16x16_16x16_16x16x1_16x16x1_1x16x1x16_4_1x1_intrawave_v1,10.69,1339.83,0.0
256,4,4096,8192,ck,7,0,23.3798,a8w8_blockscale_bpreshuffle_1x128x128_256x16x64x256_16x16_16x16_16x16x1_16x16x1_1x16x1x16_4_1x1_intrawave_v1,11.48,1437.99,0.0
256,8,4096,1024,ck,7,0,5.3754,a8w8_blockscale_bpreshuffle_1x128x128_256x16x64x256_16x16_16x16_16x16x1_16x16x1_1x16x1x16_4_1x1_intrawave_v1,12.48,793.99,0.0
256,8,4096,2048,ck,7,0,7.8003,a8w8_blockscale_bpreshuffle_1x128x128_256x16x64x256_16x16_16x16_16x16x1_16x16x1_1x16x1x16_4_1x1_intrawave_v1,17.21,1085.92,0.0
256,8,4096,4096,ck,7,0,12.5781,a8w8_blockscale_bpreshuffle_1x128x128_256x16x64x256_16x16_16x16_16x16x1_16x16x1_1x16x1x16_4_1x1_intrawave_v1,21.34,1341.66,0.0
256,8,4096,8192,ck,7,0,23.5614,a8w8_blockscale_bpreshuffle_1x128x128_256x16x64x256_16x16_16x16_16x16x1_16x16x1_1x16x1x16_4_1x1_intrawave_v1,22.79,1429.69,0.0
256,16,4096,1024,ck,7,0,5.359,a8w8_blockscale_bpreshuffle_1x128x128_256x16x64x256_16x16_16x16_16x16x1_16x16x1_1x16x1x16_4_1x1_intrawave_v1,25.05,810.18,0.0
256,16,4096,2048,ck,7,0,7.5529,a8w8_blockscale_bpreshuffle_1x128x128_256x16x64x256_16x16_16x16_16x16x1_16x16x1_1x16x1x16_4_1x1_intrawave_v1,35.54,1132.34,0.0
256,16,4096,4096,ck,7,0,11.6041,a8w8_blockscale_bpreshuffle_1x128x128_256x16x64x256_16x16_16x16_16x16x1_16x16x1_1x16x1x16_4_1x1_intrawave_v1,46.27,1462.74,0.0
256,16,4096,8192,ck,7,0,21.0936,a8w8_blockscale_bpreshuffle_1x128x128_256x16x64x256_16x16_16x16_16x16x1_16x16x1_1x16x1x16_4_1x1_intrawave_v1,50.9,1603.17,0.0
256,32,4096,1024,ck,7,0,5.554,a8w8_blockscale_bpreshuffle_1x128x128_256x16x64x256_16x16_16x16_16x16x1_16x16x1_1x16x1x16_4_1x1_intrawave_v1,48.33,808.29,0.0
256,32,4096,2048,ck,12,0,7.9451,a8w8_blockscale_bpreshuffle_1x128x128_256x32x64x256_16x16_16x16_16x16x1_16x16x1_1x32x1x8_8_2x1_intrawave_v1,67.57,1097.06,0.0
256,32,4096,4096,ck,7,0,11.5906,a8w8_blockscale_bpreshuffle_1x128x128_256x16x64x256_16x16_16x16_16x16x1_16x16x1_1x16x1x16_4_1x1_intrawave_v1,92.64,1481.41,0.0
256,32,4096,8192,ck,7,0,21.1951,a8w8_blockscale_bpreshuffle_1x128x128_256x16x64x256_16x16_16x16_16x16x1_16x16x1_1x16x1x16_4_1x1_intrawave_v1,101.32,1607.86,0.0
256,64,4096,1024,ck,7,0,5.5953,a8w8_blockscale_bpreshuffle_1x128x128_256x16x64x256_16x16_16x16_16x16x1_16x16x1_1x16x1x16_4_1x1_intrawave_v1,95.95,855.03,0.0
256,64,4096,2048,ck,12,0,8.1591,a8w8_blockscale_bpreshuffle_1x128x128_256x32x64x256_16x16_16x16_16x16x1_16x16x1_1x32x1x8_8_2x1_intrawave_v1,131.6,1108.45,0.0
256,64,4096,4096,ck,7,0,11.5495,a8w8_blockscale_bpreshuffle_1x128x128_256x16x64x256_16x16_16x16_16x16x1_16x16x1_1x16x1x16_4_1x1_intrawave_v1,185.94,1520.73,0.0
256,64,4096,8192,ck,7,0,20.9352,a8w8_blockscale_bpreshuffle_1x128x128_256x16x64x256_16x16_16x16_16x16x1_16x16x1_1x16x1x16_4_1x1_intrawave_v1,205.16,1652.86,0.0
256,128,4096,1024,ck,7,0,5.931,a8w8_blockscale_bpreshuffle_1x128x128_256x16x64x256_16x16_16x16_16x16x1_16x16x1_1x16x1x16_4_1x1_intrawave_v1,181.04,906.08,0.0
256,128,4096,2048,ck,7,0,8.2206,a8w8_blockscale_bpreshuffle_1x128x128_256x16x64x256_16x16_16x16_16x16x1_16x16x1_1x16x1x16_4_1x1_intrawave_v1,261.23,1179.88,0.0
256,128,4096,4096,ck,12,0,12.5223,a8w8_blockscale_bpreshuffle_1x128x128_256x32x64x256_16x16_16x16_16x16x1_16x16x1_1x32x1x8_8_2x1_intrawave_v1,342.99,1465.39,0.0
256,128,4096,8192,ck,12,0,22.6226,a8w8_blockscale_bpreshuffle_1x128x128_256x32x64x256_16x16_16x16_16x16x1_16x16x1_1x32x1x8_8_2x1_intrawave_v1,379.71,1575.93,0.0
256,256,4096,1024,ck,12,0,7.0456,a8w8_blockscale_bpreshuffle_1x128x128_256x32x64x256_16x16_16x16_16x16x1_16x16x1_1x32x1x8_8_2x1_intrawave_v1,304.8,930.17,0.0
256,256,4096,2048,ck,17,0,9.8651,a8w8_blockscale_bpreshuffle_1x128x128_256x64x64x256_16x16_16x16_16x16x1_16x16x1_1x32x1x8_8_2x1_intrawave_v1,435.37,1116.06,0.0
256,256,4096,4096,ck,17,0,14.9257,a8w8_blockscale_bpreshuffle_1x128x128_256x64x64x256_16x16_16x16_16x16x1_16x16x1_1x32x1x8_8_2x1_intrawave_v1,575.51,1334.81,0.0
256,256,4096,8192,ck,17,0,27.0469,a8w8_blockscale_bpreshuffle_1x128x128_256x64x64x256_16x16_16x16_16x16x1_16x16x1_1x32x1x8_8_2x1_intrawave_v1,635.19,1395.68,0.0
256,512,4096,1024,ck,2,0,9.3277,a8w8_blockscale_bpreshuffle_1x128x128_256x64x64x128_16x16_16x16_8x32x1_8x32x1_1x32x1x8_8_2x1_intrawave_v3,460.45,955.53,0.0
256,512,4096,2048,ck,17,0,14.1533,a8w8_blockscale_bpreshuffle_1x128x128_256x64x64x256_16x16_16x16_16x16x1_16x16x1_1x32x1x8_8_2x1_intrawave_v1,606.92,963.13,0.0
256,512,4096,4096,ck,14,0,23.4392,a8w8_blockscale_bpreshuffle_1x128x128_256x64x128x128_16x16_16x16_8x32x1_8x32x1_1x32x1x8_8_2x1_intrawave_v1,732.95,984.19,0.0
256,512,4096,8192,ck,17,0,45.8497,a8w8_blockscale_bpreshuffle_1x128x128_256x64x64x256_16x16_16x16_16x16x1_16x16x1_1x32x1x8_8_2x1_intrawave_v1,749.4,914.79,0.0
256,1024,4096,1024,ck,14,0,13.6119,a8w8_blockscale_bpreshuffle_1x128x128_256x64x128x128_16x16_16x16_8x32x1_8x32x1_1x32x1x8_8_2x1_intrawave_v1,631.06,1001.44,0.0
256,1024,4096,2048,ck,14,0,20.2828,a8w8_blockscale_bpreshuffle_1x128x128_256x64x128x128_16x16_16x16_8x32x1_8x32x1_1x32x1x8_8_2x1_intrawave_v1,847.02,930.56,0.0003
256,1024,4096,4096,ck,13,0,34.5604,a8w8_blockscale_bpreshuffle_1x128x128_256x64x256x128_16x16_16x16_8x32x1_8x32x1_1x32x1x8_8_2x1_intrawave_v1,994.19,849.53,0.0
256,1024,4096,8192,ck,13,0,65.123,a8w8_blockscale_bpreshuffle_1x128x128_256x64x256x128_16x16_16x16_8x32x1_8x32x1_1x32x1x8_8_2x1_intrawave_v1,1055.23,772.87,0.0
256,2048,4096,1024,cktile,10,0,21.2952,a8w8_blockscale_cktile_128x128x128_2x2x1_16x16x128_intrawave_0x1x0_2,806.75,1083.28,0.0
256,2048,4096,2048,ck,13,0,32.9164,a8w8_blockscale_bpreshuffle_1x128x128_256x64x256x128_16x16_16x16_8x32x1_8x32x1_1x32x1x8_8_2x1_intrawave_v1,1043.85,891.96,0.0
256,2048,4096,4096,ck,13,0,58.305,a8w8_blockscale_bpreshuffle_1x128x128_256x64x256x128_16x16_16x16_8x32x1_8x32x1_1x32x1x8_8_2x1_intrawave_v1,1178.62,719.37,0.0
256,2048,4096,8192,cktile,11,0,101.1121,a8w8_blockscale_cktile_192x256x128_4x2x1_16x16x128_intrawave_0x1x0_1,1359.27,663.71,0.0
256,4096,4096,1024,cktile,10,0,40.452,a8w8_blockscale_cktile_128x128x128_2x2x1_16x16x128_intrawave_0x1x0_2,849.4,1036.86,0.0
256,4096,4096,2048,cktile,10,0,65.285,a8w8_blockscale_cktile_128x128x128_2x2x1_16x16x128_intrawave_0x1x0_2,1052.61,770.95,0.0
256,4096,4096,4096,ck,13,0,110.1621,a8w8_blockscale_bpreshuffle_1x128x128_256x64x256x128_16x16_16x16_8x32x1_8x32x1_1x32x1x8_8_2x1_intrawave_v1,1247.61,609.18,0.0
256,4096,4096,8192,ck,13,0,195.9346,a8w8_blockscale_bpreshuffle_1x128x128_256x64x256x128_16x16_16x16_8x32x1_8x32x1_1x32x1x8_8_2x1_intrawave_v1,1402.91,513.76,0.0
256,8192,4096,1024,cktile,10,0,75.5894,a8w8_blockscale_cktile_128x128x128_2x2x1_16x16x128_intrawave_0x1x0_2,909.12,1054.27,0.0
256,8192,4096,2048,cktile,11,0,118.7202,a8w8_blockscale_cktile_192x256x128_4x2x1_16x16x128_intrawave_0x1x0_1,1157.67,777.25,0.0
256,8192,4096,4096,cktile,11,0,184.2345,a8w8_blockscale_cktile_192x256x128_4x2x1_16x16x128_intrawave_0x1x0_1,1492.0,637.45,0.0
256,8192,4096,8192,cktile,11,0,315.8694,a8w8_blockscale_cktile_192x256x128_4x2x1_16x16x128_intrawave_0x1x0_1,1740.45,531.14,0.0
256,16384,4096,1024,cktile,10,0,140.5006,a8w8_blockscale_cktile_128x128x128_2x2x1_16x16x128_intrawave_0x1x0_2,978.21,1104.55,0.0
256,16384,4096,2048,ck,13,0,219.4714,a8w8_blockscale_bpreshuffle_1x128x128_256x64x256x128_16x16_16x16_8x32x1_8x32x1_1x32x1x8_8_2x1_intrawave_v1,1252.45,802.66,0.0
256,16384,4096,4096,cktile,11,0,352.0458,a8w8_blockscale_cktile_192x256x128_4x2x1_16x16x128_intrawave_0x1x0_1,1561.6,619.53,0.0
256,16384,4096,8192,cktile,11,0,619.5344,a8w8_blockscale_cktile_192x256x128_4x2x1_16x16x128_intrawave_0x1x0_1,1774.74,487.45,0.0
256,32768,4096,1024,cktile,10,0,265.6267,a8w8_blockscale_cktile_128x128x128_2x2x1_16x16x128_intrawave_0x1x0_2,1034.83,1152.69,0.0
256,32768,4096,2048,cktile,11,0,416.8353,a8w8_blockscale_cktile_192x256x128_4x2x1_16x16x128_intrawave_0x1x0_1,1318.88,825.11,0.0
256,32768,4096,4096,cktile,11,0,664.8668,a8w8_blockscale_cktile_192x256x128_4x2x1_16x16x128_intrawave_0x1x0_1,1653.73,630.85,0.0
256,32768,4096,8192,cktile,11,0,1181.0728,a8w8_blockscale_cktile_192x256x128_4x2x1_16x16x128_intrawave_0x1x0_1,1861.89,482.97,0.0
256,1,4608,4096,ck,7,0,13.08,a8w8_blockscale_bpreshuffle_1x128x128_256x16x64x256_16x16_16x16_16x16x1_16x16x1_1x16x1x16_4_1x1_intrawave_v1,2.89,1444.01,0.0
256,2,4608,4096,ck,7,0,13.0372,a8w8_blockscale_bpreshuffle_1x128x128_256x16x64x256_16x16_16x16_16x16x1_16x16x1_1x16x1x16_4_1x1_intrawave_v1,5.79,1449.77,0.0
256,4,4608,4096,ck,7,0,13.1149,a8w8_blockscale_bpreshuffle_1x128x128_256x16x64x256_16x16_16x16_16x16x1_16x16x1_1x16x1x16_4_1x1_intrawave_v1,11.51,1443.21,0.0
256,8,4608,4096,ck,7,0,13.1182,a8w8_blockscale_bpreshuffle_1x128x128_256x16x64x256_16x16_16x16_16x16x1_16x16x1_1x16x1x16_4_1x1_intrawave_v1,23.02,1446.91,0.0
256,16,4608,4096,ck,7,0,12.0322,a8w8_blockscale_bpreshuffle_1x128x128_256x16x64x256_16x16_16x16_16x16x1_16x16x1_1x16x1x16_4_1x1_intrawave_v1,50.2,1586.36,0.0
256,32,4608,4096,ck,7,0,12.0598,a8w8_blockscale_bpreshuffle_1x128x128_256x16x64x256_16x16_16x16_16x16x1_16x16x1_1x16x1x16_4_1x1_intrawave_v1,100.16,1600.39,0.0
256,64,4608,4096,ck,12,0,12.8679,a8w8_blockscale_bpreshuffle_1x128x128_256x32x64x256_16x16_16x16_16x16x1_16x16x1_1x32x1x8_8_2x1_intrawave_v1,187.75,1532.99,0.0
256,128,4608,4096,ck,17,0,14.9842,a8w8_blockscale_bpreshuffle_1x128x128_256x64x64x256_16x16_16x16_16x16x1_16x16x1_1x32x1x8_8_2x1_intrawave_v1,322.46,1373.33,0.0
256,256,4608,4096,ck,10,0,21.2782,a8w8_blockscale_bpreshuffle_1x128x128_256x32x64x128_16x16_16x16_8x32x1_8x32x1_1x32x1x8_8_2x1_intrawave_v1,454.16,1047.19,0.0195
256,512,4608,4096,ck,14,0,29.0356,a8w8_blockscale_bpreshuffle_1x128x128_256x64x128x128_16x16_16x16_8x32x1_8x32x1_1x32x1x8_8_2x1_intrawave_v1,665.64,884.78,0.0
256,1024,4608,4096,ck,14,0,44.7469,a8w8_blockscale_bpreshuffle_1x128x128_256x64x128x128_16x16_16x16_8x32x1_8x32x1_1x32x1x8_8_2x1_intrawave_v1,863.85,726.44,0.0002
256,2048,4608,4096,cktile,11,0,63.2891,a8w8_blockscale_cktile_192x256x128_4x2x1_16x16x128_intrawave_0x1x0_1,1221.53,728.99,0.0
256,4096,4608,4096,cktile,11,0,121.773,a8w8_blockscale_cktile_192x256x128_4x2x1_16x16x128_intrawave_0x1x0_1,1269.73,602.76,0.0
256,8192,4608,4096,cktile,11,0,204.5056,a8w8_blockscale_cktile_192x256x128_4x2x1_16x16x128_intrawave_0x1x0_1,1512.12,625.54,0.0
256,16384,4608,4096,cktile,11,0,376.1492,a8w8_blockscale_cktile_192x256x128_4x2x1_16x16x128_intrawave_0x1x0_1,1644.23,630.01,0.0
256,32768,4608,4096,cktile,11,0,740.991,a8w8_blockscale_cktile_192x256x128_4x2x1_16x16x128_intrawave_0x1x0_1,1669.32,614.15,0.0
256,1,9216,4096,ck,7,0,14.1275,a8w8_blockscale_bpreshuffle_1x128x128_256x16x64x256_16x16_16x16_16x16x1_16x16x1_1x16x1x16_4_1x1_intrawave_v1,5.34,2673.6,0.0
256,2,9216,4096,ck,7,0,14.1631,a8w8_blockscale_bpreshuffle_1x128x128_256x16x64x256_16x16_16x16_16x16x1_16x16x1_1x16x1x16_4_1x1_intrawave_v1,10.66,2668.47,0.0
256,4,9216,4096,ck,7,0,14.127,a8w8_blockscale_bpreshuffle_1x128x128_256x16x64x256_16x16_16x16_16x16x1_16x16x1_1x16x1x16_4_1x1_intrawave_v1,21.38,2678.48,0.0
256,8,9216,4096,ck,7,0,14.2075,a8w8_blockscale_bpreshuffle_1x128x128_256x16x64x256_16x16_16x16_16x16x1_16x16x1_1x16x1x16_4_1x1_intrawave_v1,42.51,2669.64,0.0
256,16,9216,4096,ck,7,0,13.0948,a8w8_blockscale_bpreshuffle_1x128x128_256x16x64x256_16x16_16x16_16x16x1_16x16x1_1x16x1x16_4_1x1_intrawave_v1,92.25,2910.25,0.0
256,32,9216,4096,ck,12,0,14.1195,a8w8_blockscale_bpreshuffle_1x128x128_256x32x64x256_16x16_16x16_16x16x1_16x16x1_1x32x1x8_8_2x1_intrawave_v1,171.11,2724.57,0.0
256,64,9216,4096,ck,17,0,16.2567,a8w8_blockscale_bpreshuffle_1x128x128_256x64x64x256_16x16_16x16_16x16x1_16x16x1_1x32x1x8_8_2x1_intrawave_v1,297.22,2410.73,0.0
256,128,9216,4096,ck,17,0,23.1218,a8w8_blockscale_bpreshuffle_1x128x128_256x64x64x256_16x16_16x16_16x16x1_16x16x1_1x32x1x8_8_2x1_intrawave_v1,417.95,1757.32,0.0
256,256,9216,4096,ck,14,0,30.5777,a8w8_blockscale_bpreshuffle_1x128x128_256x64x128x128_16x16_16x16_8x32x1_8x32x1_1x32x1x8_8_2x1_intrawave_v1,632.07,1423.13,0.0
256,512,9216,4096,ck,14,0,44.6573,a8w8_blockscale_bpreshuffle_1x128x128_256x64x128x128_16x16_16x16_8x32x1_8x32x1_1x32x1x8_8_2x1_intrawave_v1,865.59,1103.58,0.0002
256,1024,9216,4096,cktile,11,0,62.7538,a8w8_blockscale_cktile_192x256x128_4x2x1_16x16x128_intrawave_0x1x0_1,1231.95,969.14,0.0
256,2048,9216,4096,cktile,11,0,117.8066,a8w8_blockscale_cktile_192x256x128_4x2x1_16x16x128_intrawave_0x1x0_1,1312.48,712.07,0.0
256,4096,9216,4096,cktile,11,0,201.5236,a8w8_blockscale_cktile_192x256x128_4x2x1_16x16x128_intrawave_0x1x0_1,1534.5,645.2,0.0
256,8192,9216,4096,cktile,11,0,369.4081,a8w8_blockscale_cktile_192x256x128_4x2x1_16x16x128_intrawave_0x1x0_1,1674.23,601.77,0.0
256,16384,9216,4096,cktile,11,0,724.957,a8w8_blockscale_cktile_192x256x128_4x2x1_16x16x128_intrawave_0x1x0_1,1706.24,561.2,0.0
256,32768,9216,4096,cktile,11,0,1438.2692,a8w8_blockscale_cktile_192x256x128_4x2x1_16x16x128_intrawave_0x1x0_1,1720.05,539.5,0.0
