aiter/configs/model_configs/a8w8_blockscale_tuned_fmoe_ds_v3.csv
cu_num,token,model_dim,inter_dim,expert,topk,act_type,dtype,q_dtype_a,q_dtype_w,q_type,use_g1u1,doweight_stage1,block_m,ksplit,us1,kernelName1,err1,us2,kernelName2,err2,us,run_1stage,tflops,bw,_tag
80,2048,2048,192,128,8,ActivationType.Gelu,torch.bfloat16,torch.bfloat16,torch.bfloat16,QuantType.No,1,0,32,0,140.8771,moe_ck2stages_gemm1_256x32x64x128_1x4_TypeCast_v1_Nswizzle0_Quant0_MulRoutedWeight0_gelu_B16_B16_B16,0.0%,134.5253,moe_ck2stages_gemm2_256x32x64x64_1x4_TypeCastExpertWeight_v1_Nswizzle0_Quant0_MulRoutedWeight1_B16_B16_B16,0.0%,275.4024,0,70.18,1127.0,
80,4096,2048,192,128,8,ActivationType.Gelu,torch.bfloat16,torch.bfloat16,torch.bfloat16,QuantType.No,1,0,32,0,140.8771,moe_ck2stages_gemm1_256x32x64x128_1x4_TypeCast_v1_Nswizzle0_Quant0_MulRoutedWeight0_gelu_B16_B16_B16,0.0%,134.5253,moe_ck2stages_gemm2_256x32x64x64_1x4_TypeCastExpertWeight_v1_Nswizzle0_Quant0_MulRoutedWeight1_B16_B16_B16,0.0%,275.4024,0,70.18,1127.0,
80,8192,2048,192,128,8,ActivationType.Gelu,torch.bfloat16,torch.bfloat16,torch.bfloat16,QuantType.No,1,0,32,0,140.8771,moe_ck2stages_gemm1_256x32x64x128_1x4_TypeCast_v1_Nswizzle0_Quant0_MulRoutedWeight0_gelu_B16_B16_B16,0.0%,134.5253,moe_ck2stages_gemm2_256x32x64x64_1x4_TypeCastExpertWeight_v1_Nswizzle0_Quant0_MulRoutedWeight1_B16_B16_B16,0.0%,275.4024,0,70.18,1127.0,
80,16384,2048,192,128,8,ActivationType.Gelu,torch.bfloat16,torch.bfloat16,torch.bfloat16,QuantType.No,1,0,32,0,140.8771,moe_ck2stages_gemm1_256x32x64x128_1x4_TypeCast_v1_Nswizzle0_Quant0_MulRoutedWeight0_gelu_B16_B16_B16,0.0%,134.5253,moe_ck2stages_gemm2_256x32x64x64_1x4_TypeCastExpertWeight_v1_Nswizzle0_Quant0_MulRoutedWeight1_B16_B16_B16,0.0%,275.4024,0,70.18,1127.0,
80,32768,2048,192,128,8,ActivationType.Gelu,torch.bfloat16,torch.bfloat16,torch.bfloat16,QuantType.No,1,0,32,0,140.8771,moe_ck2stages_gemm1_256x32x64x128_1x4_TypeCast_v1_Nswizzle0_Quant0_MulRoutedWeight0_gelu_B16_B16_B16,0.0%,134.5253,moe_ck2stages_gemm2_256x32x64x64_1x4_TypeCastExpertWeight_v1_Nswizzle0_Quant0_MulRoutedWeight1_B16_B16_B16,0.0%,275.4024,0,70.18,1127.0,
80,2048,2048,192,128,8,ActivationType.Gelu,torch.bfloat16,torch.bfloat16,torch.bfloat16,QuantType.No,1,1,32,0,144.9248,moe_ck2stages_gemm1_256x32x64x128_1x4_TypeCastExpertWeight_v1_Nswizzle0_Quant0_MulRoutedWeight1_gelu_B16_B16_B16,0.0%,123.3403,moe_ck2stages_gemm2_256x32x64x64_1x4_TypeCast_v1_Nswizzle0_Quant0_MulRoutedWeight0_B16_B16_B16,0.0%,268.2651,0,72.05,1156.98,
80,4096,2048,192,128,8,ActivationType.Gelu,torch.bfloat16,torch.bfloat16,torch.bfloat16,QuantType.No,1,1,32,0,144.9248,moe_ck2stages_gemm1_256x32x64x128_1x4_TypeCastExpertWeight_v1_Nswizzle0_Quant0_MulRoutedWeight1_gelu_B16_B16_B16,0.0%,123.3403,moe_ck2stages_gemm2_256x32x64x64_1x4_TypeCast_v1_Nswizzle0_Quant0_MulRoutedWeight0_B16_B16_B16,0.0%,268.2651,0,72.05,1156.98,
80,8192,2048,192,128,8,ActivationType.Gelu,torch.bfloat16,torch.bfloat16,torch.bfloat16,QuantType.No,1,1,32,0,144.9248,moe_ck2stages_gemm1_256x32x64x128_1x4_TypeCastExpertWeight_v1_Nswizzle0_Quant0_MulRoutedWeight1_gelu_B16_B16_B16,0.0%,123.3403,moe_ck2stages_gemm2_256x32x64x64_1x4_TypeCast_v1_Nswizzle0_Quant0_MulRoutedWeight0_B16_B16_B16,0.0%,268.2651,0,72.05,1156.98,
80,16384,2048,192,128,8,ActivationType.Gelu,torch.bfloat16,torch.bfloat16,torch.bfloat16,QuantType.No,1,1,32,0,144.9248,moe_ck2stages_gemm1_256x32x64x128_1x4_TypeCastExpertWeight_v1_Nswizzle0_Quant0_MulRoutedWeight1_gelu_B16_B16_B16,0.0%,123.3403,moe_ck2stages_gemm2_256x32x64x64_1x4_TypeCast_v1_Nswizzle0_Quant0_MulRoutedWeight0_B16_B16_B16,0.0%,268.2651,0,72.05,1156.98,
80,32768,2048,192,128,8,ActivationType.Gelu,torch.bfloat16,torch.bfloat16,torch.bfloat16,QuantType.No,1,1,32,0,144.9248,moe_ck2stages_gemm1_256x32x64x128_1x4_TypeCastExpertWeight_v1_Nswizzle0_Quant0_MulRoutedWeight1_gelu_B16_B16_B16,0.0%,123.3403,moe_ck2stages_gemm2_256x32x64x64_1x4_TypeCast_v1_Nswizzle0_Quant0_MulRoutedWeight0_B16_B16_B16,0.0%,268.2651,0,72.05,1156.98,
80,2048,2048,192,128,8,ActivationType.Silu,torch.bfloat16,torch.bfloat16,torch.bfloat16,QuantType.No,1,0,32,0,143.5168,moe_ck2stages_gemm1_256x32x64x64_1x4_TypeCast_v1_Nswizzle0_Quant0_MulRoutedWeight0_silu_B16_B16_B16,0.0%,134.0455,moe_ck2stages_gemm2_256x32x64x64_1x4_TypeCastExpertWeight_v1_Nswizzle0_Quant0_MulRoutedWeight1_B16_B16_B16,0.0%,277.5623,0,69.63,1118.23,
80,4096,2048,192,128,8,ActivationType.Silu,torch.bfloat16,torch.bfloat16,torch.bfloat16,QuantType.No,1,0,32,0,143.5168,moe_ck2stages_gemm1_256x32x64x64_1x4_TypeCast_v1_Nswizzle0_Quant0_MulRoutedWeight0_silu_B16_B16_B16,0.0%,134.0455,moe_ck2stages_gemm2_256x32x64x64_1x4_TypeCastExpertWeight_v1_Nswizzle0_Quant0_MulRoutedWeight1_B16_B16_B16,0.0%,277.5623,0,69.63,1118.23,
80,8192,2048,192,128,8,ActivationType.Silu,torch.bfloat16,torch.bfloat16,torch.bfloat16,QuantType.No,1,0,32,0,143.5168,moe_ck2stages_gemm1_256x32x64x64_1x4_TypeCast_v1_Nswizzle0_Quant0_MulRoutedWeight0_silu_B16_B16_B16,0.0%,134.0455,moe_ck2stages_gemm2_256x32x64x64_1x4_TypeCastExpertWeight_v1_Nswizzle0_Quant0_MulRoutedWeight1_B16_B16_B16,0.0%,277.5623,0,69.63,1118.23,
80,16384,2048,192,128,8,ActivationType.Silu,torch.bfloat16,torch.bfloat16,torch.bfloat16,QuantType.No,1,0,32,0,143.5168,moe_ck2stages_gemm1_256x32x64x64_1x4_TypeCast_v1_Nswizzle0_Quant0_MulRoutedWeight0_silu_B16_B16_B16,0.0%,134.0455,moe_ck2stages_gemm2_256x32x64x64_1x4_TypeCastExpertWeight_v1_Nswizzle0_Quant0_MulRoutedWeight1_B16_B16_B16,0.0%,277.5623,0,69.63,1118.23,
80,32768,2048,192,128,8,ActivationType.Silu,torch.bfloat16,torch.bfloat16,torch.bfloat16,QuantType.No,1,0,32,0,143.5168,moe_ck2stages_gemm1_256x32x64x64_1x4_TypeCast_v1_Nswizzle0_Quant0_MulRoutedWeight0_silu_B16_B16_B16,0.0%,134.0455,moe_ck2stages_gemm2_256x32x64x64_1x4_TypeCastExpertWeight_v1_Nswizzle0_Quant0_MulRoutedWeight1_B16_B16_B16,0.0%,277.5623,0,69.63,1118.23,
80,2048,2048,192,128,8,ActivationType.Silu,torch.bfloat16,torch.bfloat16,torch.bfloat16,QuantType.No,1,1,32,0,141.5184,moe_ck2stages_gemm1_256x32x64x128_1x4_TypeCastExpertWeight_v1_Nswizzle0_Quant0_MulRoutedWeight1_silu_B16_B16_B16,0.0%,122.9113,moe_ck2stages_gemm2_256x32x64x64_1x4_TypeCast_v1_Nswizzle0_Quant0_MulRoutedWeight0_B16_B16_B16,0.0%,264.4297,0,73.09,1173.77,
80,4096,2048,192,128,8,ActivationType.Silu,torch.bfloat16,torch.bfloat16,torch.bfloat16,QuantType.No,1,1,32,0,141.5184,moe_ck2stages_gemm1_256x32x64x128_1x4_TypeCastExpertWeight_v1_Nswizzle0_Quant0_MulRoutedWeight1_silu_B16_B16_B16,0.0%,122.9113,moe_ck2stages_gemm2_256x32x64x64_1x4_TypeCast_v1_Nswizzle0_Quant0_MulRoutedWeight0_B16_B16_B16,0.0%,264.4297,0,73.09,1173.77,
80,8192,2048,192,128,8,ActivationType.Silu,torch.bfloat16,torch.bfloat16,torch.bfloat16,QuantType.No,1,1,32,0,141.5184,moe_ck2stages_gemm1_256x32x64x128_1x4_TypeCastExpertWeight_v1_Nswizzle0_Quant0_MulRoutedWeight1_silu_B16_B16_B16,0.0%,122.9113,moe_ck2stages_gemm2_256x32x64x64_1x4_TypeCast_v1_Nswizzle0_Quant0_MulRoutedWeight0_B16_B16_B16,0.0%,264.4297,0,73.09,1173.77,
80,16384,2048,192,128,8,ActivationType.Silu,torch.bfloat16,torch.bfloat16,torch.bfloat16,QuantType.No,1,1,32,0,141.5184,moe_ck2stages_gemm1_256x32x64x128_1x4_TypeCastExpertWeight_v1_Nswizzle0_Quant0_MulRoutedWeight1_silu_B16_B16_B16,0.0%,122.9113,moe_ck2stages_gemm2_256x32x64x64_1x4_TypeCast_v1_Nswizzle0_Quant0_MulRoutedWeight0_B16_B16_B16,0.0%,264.4297,0,73.09,1173.77,
80,32768,2048,192,128,8,ActivationType.Silu,torch.bfloat16,torch.bfloat16,torch.bfloat16,QuantType.No,1,1,32,0,141.5184,moe_ck2stages_gemm1_256x32x64x128_1x4_TypeCastExpertWeight_v1_Nswizzle0_Quant0_MulRoutedWeight1_silu_B16_B16_B16,0.0%,122.9113,moe_ck2stages_gemm2_256x32x64x64_1x4_TypeCast_v1_Nswizzle0_Quant0_MulRoutedWeight0_B16_B16_B16,0.0%,264.4297,0,73.09,1173.77,
80,2048,4096,192,128,8,ActivationType.Gelu,torch.bfloat16,torch.bfloat16,torch.bfloat16,QuantType.No,1,0,32,0,286.2896,moe_ck2stages_gemm1_256x32x64x64_1x4_TypeCast_v1_Nswizzle0_Quant0_MulRoutedWeight0_gelu_B16_B16_B16,0.0%,254.7276,moe_ck2stages_gemm2_256x32x64x64_1x4_TypeCastExpertWeight_v1_Nswizzle0_Quant0_MulRoutedWeight1_B16_B16_B16,0.1%,541.0172,0,71.45,1147.39,
80,4096,4096,192,128,8,ActivationType.Gelu,torch.bfloat16,torch.bfloat16,torch.bfloat16,QuantType.No,1,0,32,0,286.2896,moe_ck2stages_gemm1_256x32x64x64_1x4_TypeCast_v1_Nswizzle0_Quant0_MulRoutedWeight0_gelu_B16_B16_B16,0.0%,254.7276,moe_ck2stages_gemm2_256x32x64x64_1x4_TypeCastExpertWeight_v1_Nswizzle0_Quant0_MulRoutedWeight1_B16_B16_B16,0.1%,541.0172,0,71.45,1147.39,
80,8192,4096,192,128,8,ActivationType.Gelu,torch.bfloat16,torch.bfloat16,torch.bfloat16,QuantType.No,1,0,32,0,286.2896,moe_ck2stages_gemm1_256x32x64x64_1x4_TypeCast_v1_Nswizzle0_Quant0_MulRoutedWeight0_gelu_B16_B16_B16,0.0%,254.7276,moe_ck2stages_gemm2_256x32x64x64_1x4_TypeCastExpertWeight_v1_Nswizzle0_Quant0_MulRoutedWeight1_B16_B16_B16,0.1%,541.0172,0,71.45,1147.39,
80,16384,4096,192,128,8,ActivationType.Gelu,torch.bfloat16,torch.bfloat16,torch.bfloat16,QuantType.No,1,0,32,0,286.2896,moe_ck2stages_gemm1_256x32x64x64_1x4_TypeCast_v1_Nswizzle0_Quant0_MulRoutedWeight0_gelu_B16_B16_B16,0.0%,254.7276,moe_ck2stages_gemm2_256x32x64x64_1x4_TypeCastExpertWeight_v1_Nswizzle0_Quant0_MulRoutedWeight1_B16_B16_B16,0.1%,541.0172,0,71.45,1147.39,
80,32768,4096,192,128,8,ActivationType.Gelu,torch.bfloat16,torch.bfloat16,torch.bfloat16,QuantType.No,1,0,32,0,286.2896,moe_ck2stages_gemm1_256x32x64x64_1x4_TypeCast_v1_Nswizzle0_Quant0_MulRoutedWeight0_gelu_B16_B16_B16,0.0%,254.7276,moe_ck2stages_gemm2_256x32x64x64_1x4_TypeCastExpertWeight_v1_Nswizzle0_Quant0_MulRoutedWeight1_B16_B16_B16,0.1%,541.0172,0,71.45,1147.39,
80,2048,4096,192,128,8,ActivationType.Gelu,torch.bfloat16,torch.bfloat16,torch.bfloat16,QuantType.No,1,1,32,0,285.499,moe_ck2stages_gemm1_256x32x64x64_1x4_TypeCastExpertWeight_v1_Nswizzle0_Quant0_MulRoutedWeight1_gelu_B16_B16_B16,0.0%,233.8056,moe_ck2stages_gemm2_256x32x64x64_1x4_TypeCast_v1_Nswizzle0_Quant0_MulRoutedWeight0_B16_B16_B16,0.0%,519.3046,0,74.44,1195.36,
80,4096,4096,192,128,8,ActivationType.Gelu,torch.bfloat16,torch.bfloat16,torch.bfloat16,QuantType.No,1,1,32,0,285.499,moe_ck2stages_gemm1_256x32x64x64_1x4_TypeCastExpertWeight_v1_Nswizzle0_Quant0_MulRoutedWeight1_gelu_B16_B16_B16,0.0%,233.8056,moe_ck2stages_gemm2_256x32x64x64_1x4_TypeCast_v1_Nswizzle0_Quant0_MulRoutedWeight0_B16_B16_B16,0.0%,519.3046,0,74.44,1195.36,
80,8192,4096,192,128,8,ActivationType.Gelu,torch.bfloat16,torch.bfloat16,torch.bfloat16,QuantType.No,1,1,32,0,285.499,moe_ck2stages_gemm1_256x32x64x64_1x4_TypeCastExpertWeight_v1_Nswizzle0_Quant0_MulRoutedWeight1_gelu_B16_B16_B16,0.0%,233.8056,moe_ck2stages_gemm2_256x32x64x64_1x4_TypeCast_v1_Nswizzle0_Quant0_MulRoutedWeight0_B16_B16_B16,0.0%,519.3046,0,74.44,1195.36,
80,16384,4096,192,128,8,ActivationType.Gelu,torch.bfloat16,torch.bfloat16,torch.bfloat16,QuantType.No,1,1,32,0,285.499,moe_ck2stages_gemm1_256x32x64x64_1x4_TypeCastExpertWeight_v1_Nswizzle0_Quant0_MulRoutedWeight1_gelu_B16_B16_B16,0.0%,233.8056,moe_ck2stages_gemm2_256x32x64x64_1x4_TypeCast_v1_Nswizzle0_Quant0_MulRoutedWeight0_B16_B16_B16,0.0%,519.3046,0,74.44,1195.36,
80,32768,4096,192,128,8,ActivationType.Gelu,torch.bfloat16,torch.bfloat16,torch.bfloat16,QuantType.No,1,1,32,0,285.499,moe_ck2stages_gemm1_256x32x64x64_1x4_TypeCastExpertWeight_v1_Nswizzle0_Quant0_MulRoutedWeight1_gelu_B16_B16_B16,0.0%,233.8056,moe_ck2stages_gemm2_256x32x64x64_1x4_TypeCast_v1_Nswizzle0_Quant0_MulRoutedWeight0_B16_B16_B16,0.0%,519.3046,0,74.44,1195.36,
80,2048,4096,192,128,8,ActivationType.Silu,torch.bfloat16,torch.bfloat16,torch.bfloat16,QuantType.No,1,0,32,0,283.4477,moe_ck2stages_gemm1_256x32x64x128_1x4_TypeCast_v1_Nswizzle0_Quant0_MulRoutedWeight0_silu_B16_B16_B16,0.0%,254.2291,moe_ck2stages_gemm2_256x32x64x64_1x4_TypeCastExpertWeight_v1_Nswizzle0_Quant0_MulRoutedWeight1_B16_B16_B16,0.1%,537.6768,0,71.89,1154.52,
80,4096,4096,192,128,8,ActivationType.Silu,torch.bfloat16,torch.bfloat16,torch.bfloat16,QuantType.No,1,0,32,0,283.4477,moe_ck2stages_gemm1_256x32x64x128_1x4_TypeCast_v1_Nswizzle0_Quant0_MulRoutedWeight0_silu_B16_B16_B16,0.0%,254.2291,moe_ck2stages_gemm2_256x32x64x64_1x4_TypeCastExpertWeight_v1_Nswizzle0_Quant0_MulRoutedWeight1_B16_B16_B16,0.1%,537.6768,0,71.89,1154.52,
80,8192,4096,192,128,8,ActivationType.Silu,torch.bfloat16,torch.bfloat16,torch.bfloat16,QuantType.No,1,0,32,0,283.4477,moe_ck2stages_gemm1_256x32x64x128_1x4_TypeCast_v1_Nswizzle0_Quant0_MulRoutedWeight0_silu_B16_B16_B16,0.0%,254.2291,moe_ck2stages_gemm2_256x32x64x64_1x4_TypeCastExpertWeight_v1_Nswizzle0_Quant0_MulRoutedWeight1_B16_B16_B16,0.1%,537.6768,0,71.89,1154.52,
80,16384,4096,192,128,8,ActivationType.Silu,torch.bfloat16,torch.bfloat16,torch.bfloat16,QuantType.No,1,0,32,0,283.4477,moe_ck2stages_gemm1_256x32x64x128_1x4_TypeCast_v1_Nswizzle0_Quant0_MulRoutedWeight0_silu_B16_B16_B16,0.0%,254.2291,moe_ck2stages_gemm2_256x32x64x64_1x4_TypeCastExpertWeight_v1_Nswizzle0_Quant0_MulRoutedWeight1_B16_B16_B16,0.1%,537.6768,0,71.89,1154.52,
80,32768,4096,192,128,8,ActivationType.Silu,torch.bfloat16,torch.bfloat16,torch.bfloat16,QuantType.No,1,0,32,0,283.4477,moe_ck2stages_gemm1_256x32x64x128_1x4_TypeCast_v1_Nswizzle0_Quant0_MulRoutedWeight0_silu_B16_B16_B16,0.0%,254.2291,moe_ck2stages_gemm2_256x32x64x64_1x4_TypeCastExpertWeight_v1_Nswizzle0_Quant0_MulRoutedWeight1_B16_B16_B16,0.1%,537.6768,0,71.89,1154.52,
80,2048,4096,192,128,8,ActivationType.Silu,torch.bfloat16,torch.bfloat16,torch.bfloat16,QuantType.No,1,1,32,0,284.4745,moe_ck2stages_gemm1_256x32x64x64_1x4_TypeCastExpertWeight_v1_Nswizzle0_Quant0_MulRoutedWeight1_silu_B16_B16_B16,0.0%,232.9485,moe_ck2stages_gemm2_256x32x64x64_1x4_TypeCast_v1_Nswizzle0_Quant0_MulRoutedWeight0_B16_B16_B16,0.0%,517.423,0,74.71,1199.71,
80,4096,4096,192,128,8,ActivationType.Silu,torch.bfloat16,torch.bfloat16,torch.bfloat16,QuantType.No,1,1,32,0,284.4745,moe_ck2stages_gemm1_256x32x64x64_1x4_TypeCastExpertWeight_v1_Nswizzle0_Quant0_MulRoutedWeight1_silu_B16_B16_B16,0.0%,232.9485,moe_ck2stages_gemm2_256x32x64x64_1x4_TypeCast_v1_Nswizzle0_Quant0_MulRoutedWeight0_B16_B16_B16,0.0%,517.423,0,74.71,1199.71,
80,8192,4096,192,128,8,ActivationType.Silu,torch.bfloat16,torch.bfloat16,torch.bfloat16,QuantType.No,1,1,32,0,284.4745,moe_ck2stages_gemm1_256x32x64x64_1x4_TypeCastExpertWeight_v1_Nswizzle0_Quant0_MulRoutedWeight1_silu_B16_B16_B16,0.0%,232.9485,moe_ck2stages_gemm2_256x32x64x64_1x4_TypeCast_v1_Nswizzle0_Quant0_MulRoutedWeight0_B16_B16_B16,0.0%,517.423,0,74.71,1199.71,
80,16384,4096,192,128,8,ActivationType.Silu,torch.bfloat16,torch.bfloat16,torch.bfloat16,QuantType.No,1,1,32,0,284.4745,moe_ck2stages_gemm1_256x32x64x64_1x4_TypeCastExpertWeight_v1_Nswizzle0_Quant0_MulRoutedWeight1_silu_B16_B16_B16,0.0%,232.9485,moe_ck2stages_gemm2_256x32x64x64_1x4_TypeCast_v1_Nswizzle0_Quant0_MulRoutedWeight0_B16_B16_B16,0.0%,517.423,0,74.71,1199.71,
80,32768,4096,192,128,8,ActivationType.Silu,torch.bfloat16,torch.bfloat16,torch.bfloat16,QuantType.No,1,1,32,0,284.4745,moe_ck2stages_gemm1_256x32x64x64_1x4_TypeCastExpertWeight_v1_Nswizzle0_Quant0_MulRoutedWeight1_silu_B16_B16_B16,0.0%,232.9485,moe_ck2stages_gemm2_256x32x64x64_1x4_TypeCast_v1_Nswizzle0_Quant0_MulRoutedWeight0_B16_B16_B16,0.0%,517.423,0,74.71,1199.71,
80,1,4096,192,128,8,ActivationType.Silu,torch.bfloat16,torch.float8_e4m3fnuz,torch.float8_e4m3fnuz,QuantType.per_Token,1,0,16,0,14.7181,moe_ck2stages_gemm1_256x16x64x256_1x4_MulABScale_v1_Nswizzle0_Quant2_MulRoutedWeight0_silu_F8_F8_B16,0.0%,8.8578,moe_ck2stages_gemm2_64x16x64x64_1x1_MulABScaleExpertWeight_v1_Nswizzle0_Quant2_MulRoutedWeight1_F8_F8_B16,0.1%,23.5759,0,1.6,12809.78,
80,2,4096,192,128,8,ActivationType.Silu,torch.bfloat16,torch.float8_e4m3fnuz,torch.float8_e4m3fnuz,QuantType.per_Token,1,0,16,0,16.1962,moe_ck2stages_gemm1_256x16x64x256_1x4_MulABScale_v1_Nswizzle0_Quant2_MulRoutedWeight0_silu_F8_F8_B16,0.0%,10.9481,moe_ck2stages_gemm2_64x16x64x64_1x1_MulABScaleExpertWeight_v1_Nswizzle0_Quant2_MulRoutedWeight1_F8_F8_B16,0.1%,27.1443,0,2.78,11126.26,
80,4,4096,192,128,8,ActivationType.Silu,torch.bfloat16,torch.float8_e4m3fnuz,torch.float8_e4m3fnuz,QuantType.per_Token,1,0,16,0,22.6085,moe_ck2stages_gemm1_256x16x64x256_1x4_MulABScale_v1_Nswizzle0_Quant2_MulRoutedWeight0_silu_F8_F8_B16,0.0%,21.8513,moe_ck2stages_gemm2_64x16x64x64_1x1_MulABScaleExpertWeight_v1_Nswizzle0_Quant2_MulRoutedWeight1_F8_F8_B16,0.1%,44.4598,0,3.4,6793.53,
80,8,4096,192,128,8,ActivationType.Silu,torch.bfloat16,torch.float8_e4m3fnuz,torch.float8_e4m3fnuz,QuantType.per_Token,1,0,16,0,26.7393,moe_ck2stages_gemm1_256x16x64x256_1x4_MulABScale_v1_Nswizzle0_Quant2_MulRoutedWeight0_silu_F8_F8_B16,0.0%,30.591,moe_ck2stages_gemm2_64x16x64x64_1x1_MulABScaleExpertWeight_v1_Nswizzle0_Quant2_MulRoutedWeight1_F8_F8_B16,0.1%,57.3303,0,5.27,5269.26,
80,16,4096,192,128,8,ActivationType.Silu,torch.bfloat16,torch.float8_e4m3fnuz,torch.float8_e4m3fnuz,QuantType.per_Token,1,0,16,0,44.9474,moe_ck2stages_gemm1_256x16x64x256_1x4_MulABScale_v1_Nswizzle0_Quant2_MulRoutedWeight0_silu_F8_F8_B16,0.0%,44.429,moe_ck2stages_gemm2_64x16x64x64_1x1_MulABScaleExpertWeight_v1_Nswizzle0_Quant2_MulRoutedWeight1_F8_F8_B16,0.1%,89.3764,0,6.76,3381.05,
80,32,4096,192,128,8,ActivationType.Silu,torch.bfloat16,torch.float8_e4m3fnuz,torch.float8_e4m3fnuz,QuantType.per_Token,1,0,32,0,130.6754,_ZN5aiter45fmoe_bf16_pertokenFp8_g1u1_vs_silu_1tg_32x192E,0.0%,0.0,Null,0.0%,130.6754,1,9.24,2314.0,
80,40,4096,192,128,8,ActivationType.Silu,torch.bfloat16,torch.float8_e4m3fnuz,torch.float8_e4m3fnuz,QuantType.per_Token,1,0,32,0,132.1174,_ZN5aiter45fmoe_bf16_pertokenFp8_g1u1_vs_silu_1tg_32x192E,0.0%,0.0,Null,0.0%,132.1174,1,11.43,2289.49,
80,64,4096,192,128,8,ActivationType.Silu,torch.bfloat16,torch.float8_e4m3fnuz,torch.float8_e4m3fnuz,QuantType.per_Token,1,0,32,0,135.0415,_ZN5aiter45fmoe_bf16_pertokenFp8_g1u1_vs_silu_1tg_32x192E,0.0%,0.0,Null,0.0%,135.0415,1,17.89,2242.1,
80,128,4096,192,128,8,ActivationType.Silu,torch.bfloat16,torch.float8_e4m3fnuz,torch.float8_e4m3fnuz,QuantType.per_Token,1,0,32,0,136.8626,_ZN5aiter45fmoe_bf16_pertokenFp8_g1u1_vs_silu_1tg_32x192E,0.0%,0.0,Null,0.0%,136.8626,1,35.3,2218.01,
80,256,4096,192,128,8,ActivationType.Silu,torch.bfloat16,torch.float8_e4m3fnuz,torch.float8_e4m3fnuz,QuantType.per_Token,1,0,32,0,144.1889,_ZN5aiter45fmoe_bf16_pertokenFp8_g1u1_vs_silu_1tg_32x192E,0.0%,0.0,Null,0.0%,144.1889,1,67.02,2116.22,
80,512,4096,192,128,8,ActivationType.Silu,torch.bfloat16,torch.float8_e4m3fnuz,torch.float8_e4m3fnuz,QuantType.per_Token,1,0,32,0,211.5621,_ZN5aiter45fmoe_bf16_pertokenFp8_g1u1_vs_silu_1tg_32x192E,0.0%,0.0,Null,0.0%,211.5621,1,91.36,1457.17,
80,1024,4096,192,128,8,ActivationType.Silu,torch.bfloat16,torch.float8_e4m3fnuz,torch.float8_e4m3fnuz,QuantType.per_Token,1,0,32,0,290.2352,_ZN5aiter45fmoe_bf16_pertokenFp8_g1u1_vs_silu_1tg_32x192E,0.0%,0.0,Null,0.0%,290.2352,1,133.18,1083.85,
80,2048,4096,192,128,8,ActivationType.Silu,torch.bfloat16,torch.float8_e4m3fnuz,torch.float8_e4m3fnuz,QuantType.per_Token,1,0,32,0,553.26,_ZN5aiter45fmoe_bf16_pertokenFp8_g1u1_vs_silu_1tg_32x192E,0.0%,0.0,Null,0.0%,553.26,1,139.73,591.32,
80,4096,4096,192,128,8,ActivationType.Silu,torch.bfloat16,torch.float8_e4m3fnuz,torch.float8_e4m3fnuz,QuantType.per_Token,1,0,32,0,553.26,_ZN5aiter45fmoe_bf16_pertokenFp8_g1u1_vs_silu_1tg_32x192E,0.0%,0.0,Null,0.0%,553.26,1,139.73,591.32,
80,8192,4096,192,128,8,ActivationType.Silu,torch.bfloat16,torch.float8_e4m3fnuz,torch.float8_e4m3fnuz,QuantType.per_Token,1,0,32,0,553.26,_ZN5aiter45fmoe_bf16_pertokenFp8_g1u1_vs_silu_1tg_32x192E,0.0%,0.0,Null,0.0%,553.26,1,139.73,591.32,
80,2048,4096,384,128,8,ActivationType.Gelu,torch.bfloat16,torch.bfloat16,torch.bfloat16,QuantType.No,1,0,32,0,523.5384,moe_ck2stages_gemm1_256x32x64x128_1x4_TypeCast_v1_Nswizzle0_Quant0_MulRoutedWeight0_gelu_B16_B16_B16,0.0%,372.5179,moe_ck2stages_gemm2_256x32x64x64_1x4_TypeCastExpertWeight_v1_Nswizzle0_Quant0_MulRoutedWeight1_B16_B16_B16,0.5%,896.0563,0,86.28,1366.81,
80,4096,4096,384,128,8,ActivationType.Gelu,torch.bfloat16,torch.bfloat16,torch.bfloat16,QuantType.No,1,0,32,0,523.5384,moe_ck2stages_gemm1_256x32x64x128_1x4_TypeCast_v1_Nswizzle0_Quant0_MulRoutedWeight0_gelu_B16_B16_B16,0.0%,372.5179,moe_ck2stages_gemm2_256x32x64x64_1x4_TypeCastExpertWeight_v1_Nswizzle0_Quant0_MulRoutedWeight1_B16_B16_B16,0.5%,896.0563,0,86.28,1366.81,
80,8192,4096,384,128,8,ActivationType.Gelu,torch.bfloat16,torch.bfloat16,torch.bfloat16,QuantType.No,1,0,32,0,523.5384,moe_ck2stages_gemm1_256x32x64x128_1x4_TypeCast_v1_Nswizzle0_Quant0_MulRoutedWeight0_gelu_B16_B16_B16,0.0%,372.5179,moe_ck2stages_gemm2_256x32x64x64_1x4_TypeCastExpertWeight_v1_Nswizzle0_Quant0_MulRoutedWeight1_B16_B16_B16,0.5%,896.0563,0,86.28,1366.81,
80,16384,4096,384,128,8,ActivationType.Gelu,torch.bfloat16,torch.bfloat16,torch.bfloat16,QuantType.No,1,0,32,0,523.5384,moe_ck2stages_gemm1_256x32x64x128_1x4_TypeCast_v1_Nswizzle0_Quant0_MulRoutedWeight0_gelu_B16_B16_B16,0.0%,372.5179,moe_ck2stages_gemm2_256x32x64x64_1x4_TypeCastExpertWeight_v1_Nswizzle0_Quant0_MulRoutedWeight1_B16_B16_B16,0.5%,896.0563,0,86.28,1366.81,
80,32768,4096,384,128,8,ActivationType.Gelu,torch.bfloat16,torch.bfloat16,torch.bfloat16,QuantType.No,1,0,32,0,523.5384,moe_ck2stages_gemm1_256x32x64x128_1x4_TypeCast_v1_Nswizzle0_Quant0_MulRoutedWeight0_gelu_B16_B16_B16,0.0%,372.5179,moe_ck2stages_gemm2_256x32x64x64_1x4_TypeCastExpertWeight_v1_Nswizzle0_Quant0_MulRoutedWeight1_B16_B16_B16,0.5%,896.0563,0,86.28,1366.81,
80,2048,4096,384,128,8,ActivationType.Gelu,torch.bfloat16,torch.bfloat16,torch.bfloat16,QuantType.No,1,1,32,0,524.8862,moe_ck2stages_gemm1_256x32x64x128_1x4_TypeCastExpertWeight_v1_Nswizzle0_Quant0_MulRoutedWeight1_gelu_B16_B16_B16,0.0%,354.9441,moe_ck2stages_gemm2_256x32x64x64_1x4_TypeCast_v1_Nswizzle0_Quant0_MulRoutedWeight0_B16_B16_B16,0.0%,879.8303000000001,0,87.87,1392.01,
80,4096,4096,384,128,8,ActivationType.Gelu,torch.bfloat16,torch.bfloat16,torch.bfloat16,QuantType.No,1,1,32,0,524.8862,moe_ck2stages_gemm1_256x32x64x128_1x4_TypeCastExpertWeight_v1_Nswizzle0_Quant0_MulRoutedWeight1_gelu_B16_B16_B16,0.0%,354.9441,moe_ck2stages_gemm2_256x32x64x64_1x4_TypeCast_v1_Nswizzle0_Quant0_MulRoutedWeight0_B16_B16_B16,0.0%,879.8303000000001,0,87.87,1392.01,
80,8192,4096,384,128,8,ActivationType.Gelu,torch.bfloat16,torch.bfloat16,torch.bfloat16,QuantType.No,1,1,32,0,524.8862,moe_ck2stages_gemm1_256x32x64x128_1x4_TypeCastExpertWeight_v1_Nswizzle0_Quant0_MulRoutedWeight1_gelu_B16_B16_B16,0.0%,354.9441,moe_ck2stages_gemm2_256x32x64x64_1x4_TypeCast_v1_Nswizzle0_Quant0_MulRoutedWeight0_B16_B16_B16,0.0%,879.8303000000001,0,87.87,1392.01,
80,16384,4096,384,128,8,ActivationType.Gelu,torch.bfloat16,torch.bfloat16,torch.bfloat16,QuantType.No,1,1,32,0,524.8862,moe_ck2stages_gemm1_256x32x64x128_1x4_TypeCastExpertWeight_v1_Nswizzle0_Quant0_MulRoutedWeight1_gelu_B16_B16_B16,0.0%,354.9441,moe_ck2stages_gemm2_256x32x64x64_1x4_TypeCast_v1_Nswizzle0_Quant0_MulRoutedWeight0_B16_B16_B16,0.0%,879.8303000000001,0,87.87,1392.01,
80,32768,4096,384,128,8,ActivationType.Gelu,torch.bfloat16,torch.bfloat16,torch.bfloat16,QuantType.No,1,1,32,0,524.8862,moe_ck2stages_gemm1_256x32x64x128_1x4_TypeCastExpertWeight_v1_Nswizzle0_Quant0_MulRoutedWeight1_gelu_B16_B16_B16,0.0%,354.9441,moe_ck2stages_gemm2_256x32x64x64_1x4_TypeCast_v1_Nswizzle0_Quant0_MulRoutedWeight0_B16_B16_B16,0.0%,879.8303000000001,0,87.87,1392.01,
80,2048,4096,384,128,8,ActivationType.Gelu,torch.bfloat16,torch.float8_e4m3fnuz,torch.float8_e4m3fnuz,QuantType.per_1x128,1,0,64,0,509.2109,moe_ck2stages_gemm1_256x64x128x128_1x4_MulABScaleExpertWeightA8W8blkscale_v3_Nswizzle0_Quant4_MulRoutedWeight0_gelu_F8_F8_B16,0.0%,865.0837,moe_ck2stages_gemm2_256x64x128x128_1x4_MulABScaleExpertWeightA8W8blkscale_v3_Nswizzle0_Quant4_MulRoutedWeight1_F8_F8_B16,15.4%,1374.2946,0,56.25,448.64,
80,4096,4096,384,128,8,ActivationType.Gelu,torch.bfloat16,torch.float8_e4m3fnuz,torch.float8_e4m3fnuz,QuantType.per_1x128,1,0,64,0,509.2109,moe_ck2stages_gemm1_256x64x128x128_1x4_MulABScaleExpertWeightA8W8blkscale_v3_Nswizzle0_Quant4_MulRoutedWeight0_gelu_F8_F8_B16,0.0%,865.0837,moe_ck2stages_gemm2_256x64x128x128_1x4_MulABScaleExpertWeightA8W8blkscale_v3_Nswizzle0_Quant4_MulRoutedWeight1_F8_F8_B16,15.4%,1374.2946,0,56.25,448.64,
80,8192,4096,384,128,8,ActivationType.Gelu,torch.bfloat16,torch.float8_e4m3fnuz,torch.float8_e4m3fnuz,QuantType.per_1x128,1,0,64,0,509.2109,moe_ck2stages_gemm1_256x64x128x128_1x4_MulABScaleExpertWeightA8W8blkscale_v3_Nswizzle0_Quant4_MulRoutedWeight0_gelu_F8_F8_B16,0.0%,865.0837,moe_ck2stages_gemm2_256x64x128x128_1x4_MulABScaleExpertWeightA8W8blkscale_v3_Nswizzle0_Quant4_MulRoutedWeight1_F8_F8_B16,15.4%,1374.2946,0,56.25,448.64,
80,16384,4096,384,128,8,ActivationType.Gelu,torch.bfloat16,torch.float8_e4m3fnuz,torch.float8_e4m3fnuz,QuantType.per_1x128,1,0,64,0,509.2109,moe_ck2stages_gemm1_256x64x128x128_1x4_MulABScaleExpertWeightA8W8blkscale_v3_Nswizzle0_Quant4_MulRoutedWeight0_gelu_F8_F8_B16,0.0%,865.0837,moe_ck2stages_gemm2_256x64x128x128_1x4_MulABScaleExpertWeightA8W8blkscale_v3_Nswizzle0_Quant4_MulRoutedWeight1_F8_F8_B16,15.4%,1374.2946,0,56.25,448.64,
80,32768,4096,384,128,8,ActivationType.Gelu,torch.bfloat16,torch.float8_e4m3fnuz,torch.float8_e4m3fnuz,QuantType.per_1x128,1,0,64,0,509.2109,moe_ck2stages_gemm1_256x64x128x128_1x4_MulABScaleExpertWeightA8W8blkscale_v3_Nswizzle0_Quant4_MulRoutedWeight0_gelu_F8_F8_B16,0.0%,865.0837,moe_ck2stages_gemm2_256x64x128x128_1x4_MulABScaleExpertWeightA8W8blkscale_v3_Nswizzle0_Quant4_MulRoutedWeight1_F8_F8_B16,15.4%,1374.2946,0,56.25,448.64,
80,2048,4096,384,128,8,ActivationType.Gelu,torch.bfloat16,torch.float8_e4m3fnuz,torch.float8_e4m3fnuz,QuantType.per_1x128,1,1,64,0,500.5853,moe_ck2stages_gemm1_256x64x128x128_1x4_MulABScaleExpertWeightA8W8blkscale_v3_Nswizzle0_Quant4_MulRoutedWeight1_gelu_F8_F8_B16,0.0%,854.6331,moe_ck2stages_gemm2_256x64x128x128_1x4_MulABScaleExpertWeightA8W8blkscale_v3_Nswizzle0_Quant4_MulRoutedWeight0_F8_F8_B16,16.7%,1355.2184,0,57.05,454.95,
80,4096,4096,384,128,8,ActivationType.Gelu,torch.bfloat16,torch.float8_e4m3fnuz,torch.float8_e4m3fnuz,QuantType.per_1x128,1,1,64,0,500.5853,moe_ck2stages_gemm1_256x64x128x128_1x4_MulABScaleExpertWeightA8W8blkscale_v3_Nswizzle0_Quant4_MulRoutedWeight1_gelu_F8_F8_B16,0.0%,854.6331,moe_ck2stages_gemm2_256x64x128x128_1x4_MulABScaleExpertWeightA8W8blkscale_v3_Nswizzle0_Quant4_MulRoutedWeight0_F8_F8_B16,16.7%,1355.2184,0,57.05,454.95,
80,8192,4096,384,128,8,ActivationType.Gelu,torch.bfloat16,torch.float8_e4m3fnuz,torch.float8_e4m3fnuz,QuantType.per_1x128,1,1,64,0,500.5853,moe_ck2stages_gemm1_256x64x128x128_1x4_MulABScaleExpertWeightA8W8blkscale_v3_Nswizzle0_Quant4_MulRoutedWeight1_gelu_F8_F8_B16,0.0%,854.6331,moe_ck2stages_gemm2_256x64x128x128_1x4_MulABScaleExpertWeightA8W8blkscale_v3_Nswizzle0_Quant4_MulRoutedWeight0_F8_F8_B16,16.7%,1355.2184,0,57.05,454.95,
80,16384,4096,384,128,8,ActivationType.Gelu,torch.bfloat16,torch.float8_e4m3fnuz,torch.float8_e4m3fnuz,QuantType.per_1x128,1,1,64,0,500.5853,moe_ck2stages_gemm1_256x64x128x128_1x4_MulABScaleExpertWeightA8W8blkscale_v3_Nswizzle0_Quant4_MulRoutedWeight1_gelu_F8_F8_B16,0.0%,854.6331,moe_ck2stages_gemm2_256x64x128x128_1x4_MulABScaleExpertWeightA8W8blkscale_v3_Nswizzle0_Quant4_MulRoutedWeight0_F8_F8_B16,16.7%,1355.2184,0,57.05,454.95,
80,32768,4096,384,128,8,ActivationType.Gelu,torch.bfloat16,torch.float8_e4m3fnuz,torch.float8_e4m3fnuz,QuantType.per_1x128,1,1,64,0,500.5853,moe_ck2stages_gemm1_256x64x128x128_1x4_MulABScaleExpertWeightA8W8blkscale_v3_Nswizzle0_Quant4_MulRoutedWeight1_gelu_F8_F8_B16,0.0%,854.6331,moe_ck2stages_gemm2_256x64x128x128_1x4_MulABScaleExpertWeightA8W8blkscale_v3_Nswizzle0_Quant4_MulRoutedWeight0_F8_F8_B16,16.7%,1355.2184,0,57.05,454.95,
80,2048,4096,384,128,8,ActivationType.Gelu,torch.bfloat16,torch.float8_e4m3fnuz,torch.float8_e4m3fnuz,QuantType.per_Tensor,1,0,32,0,264.4639,moe_ck2stages_gemm1_256x32x64x256_1x4_MulABScale_v1_Nswizzle0_Quant1_MulRoutedWeight0_gelu_F8_F8_B16,0.0%,263.7878,moe_ck2stages_gemm2_256x32x64x128_1x4_MulABScaleExpertWeight_v1_Nswizzle0_Quant1_MulRoutedWeight1_F8_F8_B16,0.5%,528.2517,0,146.35,1167.18,
80,4096,4096,384,128,8,ActivationType.Gelu,torch.bfloat16,torch.float8_e4m3fnuz,torch.float8_e4m3fnuz,QuantType.per_Tensor,1,0,32,0,264.4639,moe_ck2stages_gemm1_256x32x64x256_1x4_MulABScale_v1_Nswizzle0_Quant1_MulRoutedWeight0_gelu_F8_F8_B16,0.0%,263.7878,moe_ck2stages_gemm2_256x32x64x128_1x4_MulABScaleExpertWeight_v1_Nswizzle0_Quant1_MulRoutedWeight1_F8_F8_B16,0.5%,528.2517,0,146.35,1167.18,
80,8192,4096,384,128,8,ActivationType.Gelu,torch.bfloat16,torch.float8_e4m3fnuz,torch.float8_e4m3fnuz,QuantType.per_Tensor,1,0,32,0,264.4639,moe_ck2stages_gemm1_256x32x64x256_1x4_MulABScale_v1_Nswizzle0_Quant1_MulRoutedWeight0_gelu_F8_F8_B16,0.0%,263.7878,moe_ck2stages_gemm2_256x32x64x128_1x4_MulABScaleExpertWeight_v1_Nswizzle0_Quant1_MulRoutedWeight1_F8_F8_B16,0.5%,528.2517,0,146.35,1167.18,
80,16384,4096,384,128,8,ActivationType.Gelu,torch.bfloat16,torch.float8_e4m3fnuz,torch.float8_e4m3fnuz,QuantType.per_Tensor,1,0,32,0,264.4639,moe_ck2stages_gemm1_256x32x64x256_1x4_MulABScale_v1_Nswizzle0_Quant1_MulRoutedWeight0_gelu_F8_F8_B16,0.0%,263.7878,moe_ck2stages_gemm2_256x32x64x128_1x4_MulABScaleExpertWeight_v1_Nswizzle0_Quant1_MulRoutedWeight1_F8_F8_B16,0.5%,528.2517,0,146.35,1167.18,
80,32768,4096,384,128,8,ActivationType.Gelu,torch.bfloat16,torch.float8_e4m3fnuz,torch.float8_e4m3fnuz,QuantType.per_Tensor,1,0,32,0,264.4639,moe_ck2stages_gemm1_256x32x64x256_1x4_MulABScale_v1_Nswizzle0_Quant1_MulRoutedWeight0_gelu_F8_F8_B16,0.0%,263.7878,moe_ck2stages_gemm2_256x32x64x128_1x4_MulABScaleExpertWeight_v1_Nswizzle0_Quant1_MulRoutedWeight1_F8_F8_B16,0.5%,528.2517,0,146.35,1167.18,
80,2048,4096,384,128,8,ActivationType.Gelu,torch.bfloat16,torch.float8_e4m3fnuz,torch.float8_e4m3fnuz,QuantType.per_Tensor,1,1,32,0,266.6047,moe_ck2stages_gemm1_256x32x64x256_1x4_MulABScale_v1_Nswizzle0_Quant1_MulRoutedWeight1_gelu_F8_F8_B16,0.0%,248.2173,moe_ck2stages_gemm2_256x32x64x128_1x4_MulABScaleExpertWeight_v1_Nswizzle0_Quant1_MulRoutedWeight0_F8_F8_B16,0.0%,514.822,0,150.17,1197.62,
80,4096,4096,384,128,8,ActivationType.Gelu,torch.bfloat16,torch.float8_e4m3fnuz,torch.float8_e4m3fnuz,QuantType.per_Tensor,1,1,32,0,266.6047,moe_ck2stages_gemm1_256x32x64x256_1x4_MulABScale_v1_Nswizzle0_Quant1_MulRoutedWeight1_gelu_F8_F8_B16,0.0%,248.2173,moe_ck2stages_gemm2_256x32x64x128_1x4_MulABScaleExpertWeight_v1_Nswizzle0_Quant1_MulRoutedWeight0_F8_F8_B16,0.0%,514.822,0,150.17,1197.62,
80,8192,4096,384,128,8,ActivationType.Gelu,torch.bfloat16,torch.float8_e4m3fnuz,torch.float8_e4m3fnuz,QuantType.per_Tensor,1,1,32,0,266.6047,moe_ck2stages_gemm1_256x32x64x256_1x4_MulABScale_v1_Nswizzle0_Quant1_MulRoutedWeight1_gelu_F8_F8_B16,0.0%,248.2173,moe_ck2stages_gemm2_256x32x64x128_1x4_MulABScaleExpertWeight_v1_Nswizzle0_Quant1_MulRoutedWeight0_F8_F8_B16,0.0%,514.822,0,150.17,1197.62,
80,16384,4096,384,128,8,ActivationType.Gelu,torch.bfloat16,torch.float8_e4m3fnuz,torch.float8_e4m3fnuz,QuantType.per_Tensor,1,1,32,0,266.6047,moe_ck2stages_gemm1_256x32x64x256_1x4_MulABScale_v1_Nswizzle0_Quant1_MulRoutedWeight1_gelu_F8_F8_B16,0.0%,248.2173,moe_ck2stages_gemm2_256x32x64x128_1x4_MulABScaleExpertWeight_v1_Nswizzle0_Quant1_MulRoutedWeight0_F8_F8_B16,0.0%,514.822,0,150.17,1197.62,
80,32768,4096,384,128,8,ActivationType.Gelu,torch.bfloat16,torch.float8_e4m3fnuz,torch.float8_e4m3fnuz,QuantType.per_Tensor,1,1,32,0,266.6047,moe_ck2stages_gemm1_256x32x64x256_1x4_MulABScale_v1_Nswizzle0_Quant1_MulRoutedWeight1_gelu_F8_F8_B16,0.0%,248.2173,moe_ck2stages_gemm2_256x32x64x128_1x4_MulABScaleExpertWeight_v1_Nswizzle0_Quant1_MulRoutedWeight0_F8_F8_B16,0.0%,514.822,0,150.17,1197.62,
80,2048,4096,384,128,8,ActivationType.Gelu,torch.bfloat16,torch.float8_e4m3fnuz,torch.float8_e4m3fnuz,QuantType.per_Token,1,0,32,0,272.9741,_ZN5aiter48fmoe_stage1_bf16_pertokenFp8_g1u1_32x128_3tg_pf3E,0.0%,313.1772,moe_ck2stages_gemm2_256x32x64x128_1x4_MulABScaleExpertWeight_v1_Nswizzle0_Quant2_MulRoutedWeight1_F8_F8_B16,0.5%,586.1513,0,131.89,1051.88,
80,4096,4096,384,128,8,ActivationType.Gelu,torch.bfloat16,torch.float8_e4m3fnuz,torch.float8_e4m3fnuz,QuantType.per_Token,1,0,32,0,272.9741,_ZN5aiter48fmoe_stage1_bf16_pertokenFp8_g1u1_32x128_3tg_pf3E,0.0%,313.1772,moe_ck2stages_gemm2_256x32x64x128_1x4_MulABScaleExpertWeight_v1_Nswizzle0_Quant2_MulRoutedWeight1_F8_F8_B16,0.5%,586.1513,0,131.89,1051.88,
80,8192,4096,384,128,8,ActivationType.Gelu,torch.bfloat16,torch.float8_e4m3fnuz,torch.float8_e4m3fnuz,QuantType.per_Token,1,0,32,0,272.9741,_ZN5aiter48fmoe_stage1_bf16_pertokenFp8_g1u1_32x128_3tg_pf3E,0.0%,313.1772,moe_ck2stages_gemm2_256x32x64x128_1x4_MulABScaleExpertWeight_v1_Nswizzle0_Quant2_MulRoutedWeight1_F8_F8_B16,0.5%,586.1513,0,131.89,1051.88,
80,16384,4096,384,128,8,ActivationType.Gelu,torch.bfloat16,torch.float8_e4m3fnuz,torch.float8_e4m3fnuz,QuantType.per_Token,1,0,32,0,272.9741,_ZN5aiter48fmoe_stage1_bf16_pertokenFp8_g1u1_32x128_3tg_pf3E,0.0%,313.1772,moe_ck2stages_gemm2_256x32x64x128_1x4_MulABScaleExpertWeight_v1_Nswizzle0_Quant2_MulRoutedWeight1_F8_F8_B16,0.5%,586.1513,0,131.89,1051.88,
80,32768,4096,384,128,8,ActivationType.Gelu,torch.bfloat16,torch.float8_e4m3fnuz,torch.float8_e4m3fnuz,QuantType.per_Token,1,0,32,0,272.9741,_ZN5aiter48fmoe_stage1_bf16_pertokenFp8_g1u1_32x128_3tg_pf3E,0.0%,313.1772,moe_ck2stages_gemm2_256x32x64x128_1x4_MulABScaleExpertWeight_v1_Nswizzle0_Quant2_MulRoutedWeight1_F8_F8_B16,0.5%,586.1513,0,131.89,1051.88,
80,2048,4096,384,128,8,ActivationType.Gelu,torch.bfloat16,torch.float8_e4m3fnuz,torch.float8_e4m3fnuz,QuantType.per_Token,1,1,32,0,271.6424,_ZN5aiter57fmoe_stage1_bf16_pertokenFp8_doweight_g1u1_32x128_3tg_pf3E,0.0%,302.5119,moe_ck2stages_gemm2_256x32x64x128_1x4_MulABScaleExpertWeight_v1_Nswizzle0_Quant2_MulRoutedWeight0_F8_F8_B16,0.0%,574.1543,0,134.65,1073.86,
80,4096,4096,384,128,8,ActivationType.Gelu,torch.bfloat16,torch.float8_e4m3fnuz,torch.float8_e4m3fnuz,QuantType.per_Token,1,1,32,0,271.6424,_ZN5aiter57fmoe_stage1_bf16_pertokenFp8_doweight_g1u1_32x128_3tg_pf3E,0.0%,302.5119,moe_ck2stages_gemm2_256x32x64x128_1x4_MulABScaleExpertWeight_v1_Nswizzle0_Quant2_MulRoutedWeight0_F8_F8_B16,0.0%,574.1543,0,134.65,1073.86,
80,8192,4096,384,128,8,ActivationType.Gelu,torch.bfloat16,torch.float8_e4m3fnuz,torch.float8_e4m3fnuz,QuantType.per_Token,1,1,32,0,271.6424,_ZN5aiter57fmoe_stage1_bf16_pertokenFp8_doweight_g1u1_32x128_3tg_pf3E,0.0%,302.5119,moe_ck2stages_gemm2_256x32x64x128_1x4_MulABScaleExpertWeight_v1_Nswizzle0_Quant2_MulRoutedWeight0_F8_F8_B16,0.0%,574.1543,0,134.65,1073.86,
80,16384,4096,384,128,8,ActivationType.Gelu,torch.bfloat16,torch.float8_e4m3fnuz,torch.float8_e4m3fnuz,QuantType.per_Token,1,1,32,0,271.6424,_ZN5aiter57fmoe_stage1_bf16_pertokenFp8_doweight_g1u1_32x128_3tg_pf3E,0.0%,302.5119,moe_ck2stages_gemm2_256x32x64x128_1x4_MulABScaleExpertWeight_v1_Nswizzle0_Quant2_MulRoutedWeight0_F8_F8_B16,0.0%,574.1543,0,134.65,1073.86,
80,32768,4096,384,128,8,ActivationType.Gelu,torch.bfloat16,torch.float8_e4m3fnuz,torch.float8_e4m3fnuz,QuantType.per_Token,1,1,32,0,271.6424,_ZN5aiter57fmoe_stage1_bf16_pertokenFp8_doweight_g1u1_32x128_3tg_pf3E,0.0%,302.5119,moe_ck2stages_gemm2_256x32x64x128_1x4_MulABScaleExpertWeight_v1_Nswizzle0_Quant2_MulRoutedWeight0_F8_F8_B16,0.0%,574.1543,0,134.65,1073.86,
80,2048,4096,384,128,8,ActivationType.Silu,torch.bfloat16,torch.bfloat16,torch.bfloat16,QuantType.No,1,0,32,0,523.4769,moe_ck2stages_gemm1_256x32x64x128_1x4_TypeCast_v1_Nswizzle0_Quant0_MulRoutedWeight0_silu_B16_B16_B16,0.0%,371.6201,moe_ck2stages_gemm2_256x32x64x64_1x4_TypeCastExpertWeight_v1_Nswizzle0_Quant0_MulRoutedWeight1_B16_B16_B16,0.4%,895.097,0,86.37,1368.27,
80,4096,4096,384,128,8,ActivationType.Silu,torch.bfloat16,torch.bfloat16,torch.bfloat16,QuantType.No,1,0,32,0,523.4769,moe_ck2stages_gemm1_256x32x64x128_1x4_TypeCast_v1_Nswizzle0_Quant0_MulRoutedWeight0_silu_B16_B16_B16,0.0%,371.6201,moe_ck2stages_gemm2_256x32x64x64_1x4_TypeCastExpertWeight_v1_Nswizzle0_Quant0_MulRoutedWeight1_B16_B16_B16,0.4%,895.097,0,86.37,1368.27,
80,8192,4096,384,128,8,ActivationType.Silu,torch.bfloat16,torch.bfloat16,torch.bfloat16,QuantType.No,1,0,32,0,523.4769,moe_ck2stages_gemm1_256x32x64x128_1x4_TypeCast_v1_Nswizzle0_Quant0_MulRoutedWeight0_silu_B16_B16_B16,0.0%,371.6201,moe_ck2stages_gemm2_256x32x64x64_1x4_TypeCastExpertWeight_v1_Nswizzle0_Quant0_MulRoutedWeight1_B16_B16_B16,0.4%,895.097,0,86.37,1368.27,
80,16384,4096,384,128,8,ActivationType.Silu,torch.bfloat16,torch.bfloat16,torch.bfloat16,QuantType.No,1,0,32,0,523.4769,moe_ck2stages_gemm1_256x32x64x128_1x4_TypeCast_v1_Nswizzle0_Quant0_MulRoutedWeight0_silu_B16_B16_B16,0.0%,371.6201,moe_ck2stages_gemm2_256x32x64x64_1x4_TypeCastExpertWeight_v1_Nswizzle0_Quant0_MulRoutedWeight1_B16_B16_B16,0.4%,895.097,0,86.37,1368.27,
80,32768,4096,384,128,8,ActivationType.Silu,torch.bfloat16,torch.bfloat16,torch.bfloat16,QuantType.No,1,0,32,0,523.4769,moe_ck2stages_gemm1_256x32x64x128_1x4_TypeCast_v1_Nswizzle0_Quant0_MulRoutedWeight0_silu_B16_B16_B16,0.0%,371.6201,moe_ck2stages_gemm2_256x32x64x64_1x4_TypeCastExpertWeight_v1_Nswizzle0_Quant0_MulRoutedWeight1_B16_B16_B16,0.4%,895.097,0,86.37,1368.27,
80,2048,4096,384,128,8,ActivationType.Silu,torch.bfloat16,torch.bfloat16,torch.bfloat16,QuantType.No,1,1,32,0,524.4171,moe_ck2stages_gemm1_256x32x64x128_1x4_TypeCastExpertWeight_v1_Nswizzle0_Quant0_MulRoutedWeight1_silu_B16_B16_B16,0.0%,354.8123,moe_ck2stages_gemm2_256x32x64x64_1x4_TypeCast_v1_Nswizzle0_Quant0_MulRoutedWeight0_B16_B16_B16,0.0%,879.2293999999999,0,87.93,1392.97,
80,4096,4096,384,128,8,ActivationType.Silu,torch.bfloat16,torch.bfloat16,torch.bfloat16,QuantType.No,1,1,32,0,524.4171,moe_ck2stages_gemm1_256x32x64x128_1x4_TypeCastExpertWeight_v1_Nswizzle0_Quant0_MulRoutedWeight1_silu_B16_B16_B16,0.0%,354.8123,moe_ck2stages_gemm2_256x32x64x64_1x4_TypeCast_v1_Nswizzle0_Quant0_MulRoutedWeight0_B16_B16_B16,0.0%,879.2293999999999,0,87.93,1392.97,
80,8192,4096,384,128,8,ActivationType.Silu,torch.bfloat16,torch.bfloat16,torch.bfloat16,QuantType.No,1,1,32,0,524.4171,moe_ck2stages_gemm1_256x32x64x128_1x4_TypeCastExpertWeight_v1_Nswizzle0_Quant0_MulRoutedWeight1_silu_B16_B16_B16,0.0%,354.8123,moe_ck2stages_gemm2_256x32x64x64_1x4_TypeCast_v1_Nswizzle0_Quant0_MulRoutedWeight0_B16_B16_B16,0.0%,879.2293999999999,0,87.93,1392.97,
80,16384,4096,384,128,8,ActivationType.Silu,torch.bfloat16,torch.bfloat16,torch.bfloat16,QuantType.No,1,1,32,0,524.4171,moe_ck2stages_gemm1_256x32x64x128_1x4_TypeCastExpertWeight_v1_Nswizzle0_Quant0_MulRoutedWeight1_silu_B16_B16_B16,0.0%,354.8123,moe_ck2stages_gemm2_256x32x64x64_1x4_TypeCast_v1_Nswizzle0_Quant0_MulRoutedWeight0_B16_B16_B16,0.0%,879.2293999999999,0,87.93,1392.97,
80,32768,4096,384,128,8,ActivationType.Silu,torch.bfloat16,torch.bfloat16,torch.bfloat16,QuantType.No,1,1,32,0,524.4171,moe_ck2stages_gemm1_256x32x64x128_1x4_TypeCastExpertWeight_v1_Nswizzle0_Quant0_MulRoutedWeight1_silu_B16_B16_B16,0.0%,354.8123,moe_ck2stages_gemm2_256x32x64x64_1x4_TypeCast_v1_Nswizzle0_Quant0_MulRoutedWeight0_B16_B16_B16,0.0%,879.2293999999999,0,87.93,1392.97,
80,2048,4096,384,128,8,ActivationType.Silu,torch.bfloat16,torch.float8_e4m3fnuz,torch.float8_e4m3fnuz,QuantType.per_1x128,1,1,64,0,495.1237,moe_ck2stages_gemm1_256x64x128x128_1x4_MulABScaleExpertWeightA8W8blkscale_v3_Nswizzle0_Quant4_MulRoutedWeight1_silu_F8_F8_B16,0.0%,858.9692,moe_ck2stages_gemm2_256x64x128x128_1x4_MulABScaleExpertWeightA8W8blkscale_v3_Nswizzle0_Quant4_MulRoutedWeight0_F8_F8_B16,16.7%,1354.0929,0,57.09,455.33,
80,4096,4096,384,128,8,ActivationType.Silu,torch.bfloat16,torch.float8_e4m3fnuz,torch.float8_e4m3fnuz,QuantType.per_1x128,1,1,64,0,495.1237,moe_ck2stages_gemm1_256x64x128x128_1x4_MulABScaleExpertWeightA8W8blkscale_v3_Nswizzle0_Quant4_MulRoutedWeight1_silu_F8_F8_B16,0.0%,858.9692,moe_ck2stages_gemm2_256x64x128x128_1x4_MulABScaleExpertWeightA8W8blkscale_v3_Nswizzle0_Quant4_MulRoutedWeight0_F8_F8_B16,16.7%,1354.0929,0,57.09,455.33,
80,8192,4096,384,128,8,ActivationType.Silu,torch.bfloat16,torch.float8_e4m3fnuz,torch.float8_e4m3fnuz,QuantType.per_1x128,1,1,64,0,495.1237,moe_ck2stages_gemm1_256x64x128x128_1x4_MulABScaleExpertWeightA8W8blkscale_v3_Nswizzle0_Quant4_MulRoutedWeight1_silu_F8_F8_B16,0.0%,858.9692,moe_ck2stages_gemm2_256x64x128x128_1x4_MulABScaleExpertWeightA8W8blkscale_v3_Nswizzle0_Quant4_MulRoutedWeight0_F8_F8_B16,16.7%,1354.0929,0,57.09,455.33,
80,16384,4096,384,128,8,ActivationType.Silu,torch.bfloat16,torch.float8_e4m3fnuz,torch.float8_e4m3fnuz,QuantType.per_1x128,1,1,64,0,495.1237,moe_ck2stages_gemm1_256x64x128x128_1x4_MulABScaleExpertWeightA8W8blkscale_v3_Nswizzle0_Quant4_MulRoutedWeight1_silu_F8_F8_B16,0.0%,858.9692,moe_ck2stages_gemm2_256x64x128x128_1x4_MulABScaleExpertWeightA8W8blkscale_v3_Nswizzle0_Quant4_MulRoutedWeight0_F8_F8_B16,16.7%,1354.0929,0,57.09,455.33,
80,32768,4096,384,128,8,ActivationType.Silu,torch.bfloat16,torch.float8_e4m3fnuz,torch.float8_e4m3fnuz,QuantType.per_1x128,1,1,64,0,495.1237,moe_ck2stages_gemm1_256x64x128x128_1x4_MulABScaleExpertWeightA8W8blkscale_v3_Nswizzle0_Quant4_MulRoutedWeight1_silu_F8_F8_B16,0.0%,858.9692,moe_ck2stages_gemm2_256x64x128x128_1x4_MulABScaleExpertWeightA8W8blkscale_v3_Nswizzle0_Quant4_MulRoutedWeight0_F8_F8_B16,16.7%,1354.0929,0,57.09,455.33,
80,2048,4096,384,128,8,ActivationType.Silu,torch.bfloat16,torch.float8_e4m3fnuz,torch.float8_e4m3fnuz,QuantType.per_Tensor,1,0,32,0,269.7206,moe_ck2stages_gemm1_256x32x64x256_1x4_MulABScale_v1_Nswizzle0_Quant1_MulRoutedWeight0_silu_F8_F8_B16,0.0%,263.4387,moe_ck2stages_gemm2_256x32x64x128_1x4_MulABScaleExpertWeight_v1_Nswizzle0_Quant1_MulRoutedWeight1_F8_F8_B16,0.4%,533.1593,0,145.0,1156.43,
80,4096,4096,384,128,8,ActivationType.Silu,torch.bfloat16,torch.float8_e4m3fnuz,torch.float8_e4m3fnuz,QuantType.per_Tensor,1,0,32,0,269.7206,moe_ck2stages_gemm1_256x32x64x256_1x4_MulABScale_v1_Nswizzle0_Quant1_MulRoutedWeight0_silu_F8_F8_B16,0.0%,263.4387,moe_ck2stages_gemm2_256x32x64x128_1x4_MulABScaleExpertWeight_v1_Nswizzle0_Quant1_MulRoutedWeight1_F8_F8_B16,0.4%,533.1593,0,145.0,1156.43,
80,8192,4096,384,128,8,ActivationType.Silu,torch.bfloat16,torch.float8_e4m3fnuz,torch.float8_e4m3fnuz,QuantType.per_Tensor,1,0,32,0,269.7206,moe_ck2stages_gemm1_256x32x64x256_1x4_MulABScale_v1_Nswizzle0_Quant1_MulRoutedWeight0_silu_F8_F8_B16,0.0%,263.4387,moe_ck2stages_gemm2_256x32x64x128_1x4_MulABScaleExpertWeight_v1_Nswizzle0_Quant1_MulRoutedWeight1_F8_F8_B16,0.4%,533.1593,0,145.0,1156.43,
80,16384,4096,384,128,8,ActivationType.Silu,torch.bfloat16,torch.float8_e4m3fnuz,torch.float8_e4m3fnuz,QuantType.per_Tensor,1,0,32,0,269.7206,moe_ck2stages_gemm1_256x32x64x256_1x4_MulABScale_v1_Nswizzle0_Quant1_MulRoutedWeight0_silu_F8_F8_B16,0.0%,263.4387,moe_ck2stages_gemm2_256x32x64x128_1x4_MulABScaleExpertWeight_v1_Nswizzle0_Quant1_MulRoutedWeight1_F8_F8_B16,0.4%,533.1593,0,145.0,1156.43,
80,32768,4096,384,128,8,ActivationType.Silu,torch.bfloat16,torch.float8_e4m3fnuz,torch.float8_e4m3fnuz,QuantType.per_Tensor,1,0,32,0,269.7206,moe_ck2stages_gemm1_256x32x64x256_1x4_MulABScale_v1_Nswizzle0_Quant1_MulRoutedWeight0_silu_F8_F8_B16,0.0%,263.4387,moe_ck2stages_gemm2_256x32x64x128_1x4_MulABScaleExpertWeight_v1_Nswizzle0_Quant1_MulRoutedWeight1_F8_F8_B16,0.4%,533.1593,0,145.0,1156.43,
80,2048,4096,384,128,8,ActivationType.Silu,torch.bfloat16,torch.float8_e4m3fnuz,torch.float8_e4m3fnuz,QuantType.per_Tensor,1,1,32,0,269.4957,moe_ck2stages_gemm1_256x32x64x256_1x4_MulABScale_v1_Nswizzle0_Quant1_MulRoutedWeight1_silu_F8_F8_B16,0.0%,248.2335,moe_ck2stages_gemm2_256x32x64x128_1x4_MulABScaleExpertWeight_v1_Nswizzle0_Quant1_MulRoutedWeight0_F8_F8_B16,0.0%,517.7292,0,149.32,1190.9,
80,4096,4096,384,128,8,ActivationType.Silu,torch.bfloat16,torch.float8_e4m3fnuz,torch.float8_e4m3fnuz,QuantType.per_Tensor,1,1,32,0,269.4957,moe_ck2stages_gemm1_256x32x64x256_1x4_MulABScale_v1_Nswizzle0_Quant1_MulRoutedWeight1_silu_F8_F8_B16,0.0%,248.2335,moe_ck2stages_gemm2_256x32x64x128_1x4_MulABScaleExpertWeight_v1_Nswizzle0_Quant1_MulRoutedWeight0_F8_F8_B16,0.0%,517.7292,0,149.32,1190.9,
80,8192,4096,384,128,8,ActivationType.Silu,torch.bfloat16,torch.float8_e4m3fnuz,torch.float8_e4m3fnuz,QuantType.per_Tensor,1,1,32,0,269.4957,moe_ck2stages_gemm1_256x32x64x256_1x4_MulABScale_v1_Nswizzle0_Quant1_MulRoutedWeight1_silu_F8_F8_B16,0.0%,248.2335,moe_ck2stages_gemm2_256x32x64x128_1x4_MulABScaleExpertWeight_v1_Nswizzle0_Quant1_MulRoutedWeight0_F8_F8_B16,0.0%,517.7292,0,149.32,1190.9,
80,16384,4096,384,128,8,ActivationType.Silu,torch.bfloat16,torch.float8_e4m3fnuz,torch.float8_e4m3fnuz,QuantType.per_Tensor,1,1,32,0,269.4957,moe_ck2stages_gemm1_256x32x64x256_1x4_MulABScale_v1_Nswizzle0_Quant1_MulRoutedWeight1_silu_F8_F8_B16,0.0%,248.2335,moe_ck2stages_gemm2_256x32x64x128_1x4_MulABScaleExpertWeight_v1_Nswizzle0_Quant1_MulRoutedWeight0_F8_F8_B16,0.0%,517.7292,0,149.32,1190.9,
80,32768,4096,384,128,8,ActivationType.Silu,torch.bfloat16,torch.float8_e4m3fnuz,torch.float8_e4m3fnuz,QuantType.per_Tensor,1,1,32,0,269.4957,moe_ck2stages_gemm1_256x32x64x256_1x4_MulABScale_v1_Nswizzle0_Quant1_MulRoutedWeight1_silu_F8_F8_B16,0.0%,248.2335,moe_ck2stages_gemm2_256x32x64x128_1x4_MulABScaleExpertWeight_v1_Nswizzle0_Quant1_MulRoutedWeight0_F8_F8_B16,0.0%,517.7292,0,149.32,1190.9,
80,2048,4096,384,128,8,ActivationType.Silu,torch.bfloat16,torch.float8_e4m3fnuz,torch.float8_e4m3fnuz,QuantType.per_Token,1,0,32,0,272.1056,moe_ck2stages_gemm1_256x32x64x256_1x4_MulABScale_v1_Nswizzle0_Quant2_MulRoutedWeight0_silu_F8_F8_B16,0.0%,314.319,moe_ck2stages_gemm2_256x32x64x128_1x4_MulABScaleExpertWeight_v1_Nswizzle0_Quant2_MulRoutedWeight1_F8_F8_B16,0.4%,586.4246,0,131.83,1051.39,
80,4096,4096,384,128,8,ActivationType.Silu,torch.bfloat16,torch.float8_e4m3fnuz,torch.float8_e4m3fnuz,QuantType.per_Token,1,0,32,0,272.1056,moe_ck2stages_gemm1_256x32x64x256_1x4_MulABScale_v1_Nswizzle0_Quant2_MulRoutedWeight0_silu_F8_F8_B16,0.0%,314.319,moe_ck2stages_gemm2_256x32x64x128_1x4_MulABScaleExpertWeight_v1_Nswizzle0_Quant2_MulRoutedWeight1_F8_F8_B16,0.4%,586.4246,0,131.83,1051.39,
80,8192,4096,384,128,8,ActivationType.Silu,torch.bfloat16,torch.float8_e4m3fnuz,torch.float8_e4m3fnuz,QuantType.per_Token,1,0,32,0,272.1056,moe_ck2stages_gemm1_256x32x64x256_1x4_MulABScale_v1_Nswizzle0_Quant2_MulRoutedWeight0_silu_F8_F8_B16,0.0%,314.319,moe_ck2stages_gemm2_256x32x64x128_1x4_MulABScaleExpertWeight_v1_Nswizzle0_Quant2_MulRoutedWeight1_F8_F8_B16,0.4%,586.4246,0,131.83,1051.39,
80,16384,4096,384,128,8,ActivationType.Silu,torch.bfloat16,torch.float8_e4m3fnuz,torch.float8_e4m3fnuz,QuantType.per_Token,1,0,32,0,272.1056,moe_ck2stages_gemm1_256x32x64x256_1x4_MulABScale_v1_Nswizzle0_Quant2_MulRoutedWeight0_silu_F8_F8_B16,0.0%,314.319,moe_ck2stages_gemm2_256x32x64x128_1x4_MulABScaleExpertWeight_v1_Nswizzle0_Quant2_MulRoutedWeight1_F8_F8_B16,0.4%,586.4246,0,131.83,1051.39,
80,32768,4096,384,128,8,ActivationType.Silu,torch.bfloat16,torch.float8_e4m3fnuz,torch.float8_e4m3fnuz,QuantType.per_Token,1,0,32,0,272.1056,moe_ck2stages_gemm1_256x32x64x256_1x4_MulABScale_v1_Nswizzle0_Quant2_MulRoutedWeight0_silu_F8_F8_B16,0.0%,314.319,moe_ck2stages_gemm2_256x32x64x128_1x4_MulABScaleExpertWeight_v1_Nswizzle0_Quant2_MulRoutedWeight1_F8_F8_B16,0.4%,586.4246,0,131.83,1051.39,
80,2048,4096,384,128,8,ActivationType.Silu,torch.bfloat16,torch.float8_e4m3fnuz,torch.float8_e4m3fnuz,QuantType.per_Token,1,1,32,0,268.8237,moe_ck2stages_gemm1_256x32x64x256_1x4_MulABScale_v1_Nswizzle0_Quant2_MulRoutedWeight1_silu_F8_F8_B16,0.0%,301.9153,moe_ck2stages_gemm2_256x32x64x128_1x4_MulABScaleExpertWeight_v1_Nswizzle0_Quant2_MulRoutedWeight0_F8_F8_B16,0.0%,570.739,0,135.45,1080.29,
80,4096,4096,384,128,8,ActivationType.Silu,torch.bfloat16,torch.float8_e4m3fnuz,torch.float8_e4m3fnuz,QuantType.per_Token,1,1,32,0,268.8237,moe_ck2stages_gemm1_256x32x64x256_1x4_MulABScale_v1_Nswizzle0_Quant2_MulRoutedWeight1_silu_F8_F8_B16,0.0%,301.9153,moe_ck2stages_gemm2_256x32x64x128_1x4_MulABScaleExpertWeight_v1_Nswizzle0_Quant2_MulRoutedWeight0_F8_F8_B16,0.0%,570.739,0,135.45,1080.29,
80,8192,4096,384,128,8,ActivationType.Silu,torch.bfloat16,torch.float8_e4m3fnuz,torch.float8_e4m3fnuz,QuantType.per_Token,1,1,32,0,268.8237,moe_ck2stages_gemm1_256x32x64x256_1x4_MulABScale_v1_Nswizzle0_Quant2_MulRoutedWeight1_silu_F8_F8_B16,0.0%,301.9153,moe_ck2stages_gemm2_256x32x64x128_1x4_MulABScaleExpertWeight_v1_Nswizzle0_Quant2_MulRoutedWeight0_F8_F8_B16,0.0%,570.739,0,135.45,1080.29,
80,16384,4096,384,128,8,ActivationType.Silu,torch.bfloat16,torch.float8_e4m3fnuz,torch.float8_e4m3fnuz,QuantType.per_Token,1,1,32,0,268.8237,moe_ck2stages_gemm1_256x32x64x256_1x4_MulABScale_v1_Nswizzle0_Quant2_MulRoutedWeight1_silu_F8_F8_B16,0.0%,301.9153,moe_ck2stages_gemm2_256x32x64x128_1x4_MulABScaleExpertWeight_v1_Nswizzle0_Quant2_MulRoutedWeight0_F8_F8_B16,0.0%,570.739,0,135.45,1080.29,
80,32768,4096,384,128,8,ActivationType.Silu,torch.bfloat16,torch.float8_e4m3fnuz,torch.float8_e4m3fnuz,QuantType.per_Token,1,1,32,0,268.8237,moe_ck2stages_gemm1_256x32x64x256_1x4_MulABScale_v1_Nswizzle0_Quant2_MulRoutedWeight1_silu_F8_F8_B16,0.0%,301.9153,moe_ck2stages_gemm2_256x32x64x128_1x4_MulABScaleExpertWeight_v1_Nswizzle0_Quant2_MulRoutedWeight0_F8_F8_B16,0.0%,570.739,0,135.45,1080.29,
80,2048,7168,256,256,8,ActivationType.Gelu,torch.bfloat16,torch.bfloat16,torch.bfloat16,QuantType.No,1,0,32,0,785.2244,moe_ck2stages_gemm1_256x32x64x128_1x4_TypeCast_v1_Nswizzle0_Quant0_MulRoutedWeight0_gelu_B16_B16_B16,0.0%,600.8826,moe_ck2stages_gemm2_256x32x64x64_1x4_TypeCastExpertWeight_v1_Nswizzle0_Quant0_MulRoutedWeight1_B16_B16_B16,1.6%,1386.107,0,65.07,2054.63,
80,4096,7168,256,256,8,ActivationType.Gelu,torch.bfloat16,torch.bfloat16,torch.bfloat16,QuantType.No,1,0,32,0,785.2244,moe_ck2stages_gemm1_256x32x64x128_1x4_TypeCast_v1_Nswizzle0_Quant0_MulRoutedWeight0_gelu_B16_B16_B16,0.0%,600.8826,moe_ck2stages_gemm2_256x32x64x64_1x4_TypeCastExpertWeight_v1_Nswizzle0_Quant0_MulRoutedWeight1_B16_B16_B16,1.6%,1386.107,0,65.07,2054.63,
80,8192,7168,256,256,8,ActivationType.Gelu,torch.bfloat16,torch.bfloat16,torch.bfloat16,QuantType.No,1,0,32,0,785.2244,moe_ck2stages_gemm1_256x32x64x128_1x4_TypeCast_v1_Nswizzle0_Quant0_MulRoutedWeight0_gelu_B16_B16_B16,0.0%,600.8826,moe_ck2stages_gemm2_256x32x64x64_1x4_TypeCastExpertWeight_v1_Nswizzle0_Quant0_MulRoutedWeight1_B16_B16_B16,1.6%,1386.107,0,65.07,2054.63,
80,16384,7168,256,256,8,ActivationType.Gelu,torch.bfloat16,torch.bfloat16,torch.bfloat16,QuantType.No,1,0,32,0,785.2244,moe_ck2stages_gemm1_256x32x64x128_1x4_TypeCast_v1_Nswizzle0_Quant0_MulRoutedWeight0_gelu_B16_B16_B16,0.0%,600.8826,moe_ck2stages_gemm2_256x32x64x64_1x4_TypeCastExpertWeight_v1_Nswizzle0_Quant0_MulRoutedWeight1_B16_B16_B16,1.6%,1386.107,0,65.07,2054.63,
80,32768,7168,256,256,8,ActivationType.Gelu,torch.bfloat16,torch.bfloat16,torch.bfloat16,QuantType.No,1,0,32,0,785.2244,moe_ck2stages_gemm1_256x32x64x128_1x4_TypeCast_v1_Nswizzle0_Quant0_MulRoutedWeight0_gelu_B16_B16_B16,0.0%,600.8826,moe_ck2stages_gemm2_256x32x64x64_1x4_TypeCastExpertWeight_v1_Nswizzle0_Quant0_MulRoutedWeight1_B16_B16_B16,1.6%,1386.107,0,65.07,2054.63,
80,2048,7168,256,256,8,ActivationType.Gelu,torch.bfloat16,torch.bfloat16,torch.bfloat16,QuantType.No,1,1,32,0,781.9082,moe_ck2stages_gemm1_256x32x64x128_1x4_TypeCastExpertWeight_v1_Nswizzle0_Quant0_MulRoutedWeight1_gelu_B16_B16_B16,0.0%,569.3894,moe_ck2stages_gemm2_256x32x64x64_1x4_TypeCast_v1_Nswizzle0_Quant0_MulRoutedWeight0_B16_B16_B16,0.0%,1351.2976,0,66.75,2107.55,
80,4096,7168,256,256,8,ActivationType.Gelu,torch.bfloat16,torch.bfloat16,torch.bfloat16,QuantType.No,1,1,32,0,781.9082,moe_ck2stages_gemm1_256x32x64x128_1x4_TypeCastExpertWeight_v1_Nswizzle0_Quant0_MulRoutedWeight1_gelu_B16_B16_B16,0.0%,569.3894,moe_ck2stages_gemm2_256x32x64x64_1x4_TypeCast_v1_Nswizzle0_Quant0_MulRoutedWeight0_B16_B16_B16,0.0%,1351.2976,0,66.75,2107.55,
80,8192,7168,256,256,8,ActivationType.Gelu,torch.bfloat16,torch.bfloat16,torch.bfloat16,QuantType.No,1,1,32,0,781.9082,moe_ck2stages_gemm1_256x32x64x128_1x4_TypeCastExpertWeight_v1_Nswizzle0_Quant0_MulRoutedWeight1_gelu_B16_B16_B16,0.0%,569.3894,moe_ck2stages_gemm2_256x32x64x64_1x4_TypeCast_v1_Nswizzle0_Quant0_MulRoutedWeight0_B16_B16_B16,0.0%,1351.2976,0,66.75,2107.55,
80,16384,7168,256,256,8,ActivationType.Gelu,torch.bfloat16,torch.bfloat16,torch.bfloat16,QuantType.No,1,1,32,0,781.9082,moe_ck2stages_gemm1_256x32x64x128_1x4_TypeCastExpertWeight_v1_Nswizzle0_Quant0_MulRoutedWeight1_gelu_B16_B16_B16,0.0%,569.3894,moe_ck2stages_gemm2_256x32x64x64_1x4_TypeCast_v1_Nswizzle0_Quant0_MulRoutedWeight0_B16_B16_B16,0.0%,1351.2976,0,66.75,2107.55,
80,32768,7168,256,256,8,ActivationType.Gelu,torch.bfloat16,torch.bfloat16,torch.bfloat16,QuantType.No,1,1,32,0,781.9082,moe_ck2stages_gemm1_256x32x64x128_1x4_TypeCastExpertWeight_v1_Nswizzle0_Quant0_MulRoutedWeight1_gelu_B16_B16_B16,0.0%,569.3894,moe_ck2stages_gemm2_256x32x64x64_1x4_TypeCast_v1_Nswizzle0_Quant0_MulRoutedWeight0_B16_B16_B16,0.0%,1351.2976,0,66.75,2107.55,
80,2048,7168,256,256,8,ActivationType.Gelu,torch.bfloat16,torch.float8_e4m3fnuz,torch.float8_e4m3fnuz,QuantType.per_1x128,1,0,16,0,556.9903,moe_ck2stages_gemm1_256x16x128x256_1x4_MulABScaleExpertWeightA8W8blkscale_v1_Nswizzle0_Quant4_MulRoutedWeight0_gelu_F8_F8_B16,0.0%,555.6941,moe_ck2stages_gemm2_256x16x128x256_1x4_MulABScaleExpertWeightA8W8blkscale_v1_Nswizzle0_Quant4_MulRoutedWeight1_F8_F8_B16,15.6%,1112.6844,0,81.06,1286.35,
80,4096,7168,256,256,8,ActivationType.Gelu,torch.bfloat16,torch.float8_e4m3fnuz,torch.float8_e4m3fnuz,QuantType.per_1x128,1,0,16,0,556.9903,moe_ck2stages_gemm1_256x16x128x256_1x4_MulABScaleExpertWeightA8W8blkscale_v1_Nswizzle0_Quant4_MulRoutedWeight0_gelu_F8_F8_B16,0.0%,555.6941,moe_ck2stages_gemm2_256x16x128x256_1x4_MulABScaleExpertWeightA8W8blkscale_v1_Nswizzle0_Quant4_MulRoutedWeight1_F8_F8_B16,15.6%,1112.6844,0,81.06,1286.35,
80,8192,7168,256,256,8,ActivationType.Gelu,torch.bfloat16,torch.float8_e4m3fnuz,torch.float8_e4m3fnuz,QuantType.per_1x128,1,0,16,0,556.9903,moe_ck2stages_gemm1_256x16x128x256_1x4_MulABScaleExpertWeightA8W8blkscale_v1_Nswizzle0_Quant4_MulRoutedWeight0_gelu_F8_F8_B16,0.0%,555.6941,moe_ck2stages_gemm2_256x16x128x256_1x4_MulABScaleExpertWeightA8W8blkscale_v1_Nswizzle0_Quant4_MulRoutedWeight1_F8_F8_B16,15.6%,1112.6844,0,81.06,1286.35,
80,16384,7168,256,256,8,ActivationType.Gelu,torch.bfloat16,torch.float8_e4m3fnuz,torch.float8_e4m3fnuz,QuantType.per_1x128,1,0,16,0,556.9903,moe_ck2stages_gemm1_256x16x128x256_1x4_MulABScaleExpertWeightA8W8blkscale_v1_Nswizzle0_Quant4_MulRoutedWeight0_gelu_F8_F8_B16,0.0%,555.6941,moe_ck2stages_gemm2_256x16x128x256_1x4_MulABScaleExpertWeightA8W8blkscale_v1_Nswizzle0_Quant4_MulRoutedWeight1_F8_F8_B16,15.6%,1112.6844,0,81.06,1286.35,
80,32768,7168,256,256,8,ActivationType.Gelu,torch.bfloat16,torch.float8_e4m3fnuz,torch.float8_e4m3fnuz,QuantType.per_1x128,1,0,16,0,556.9903,moe_ck2stages_gemm1_256x16x128x256_1x4_MulABScaleExpertWeightA8W8blkscale_v1_Nswizzle0_Quant4_MulRoutedWeight0_gelu_F8_F8_B16,0.0%,555.6941,moe_ck2stages_gemm2_256x16x128x256_1x4_MulABScaleExpertWeightA8W8blkscale_v1_Nswizzle0_Quant4_MulRoutedWeight1_F8_F8_B16,15.6%,1112.6844,0,81.06,1286.35,
80,2048,7168,256,256,8,ActivationType.Gelu,torch.bfloat16,torch.float8_e4m3fnuz,torch.float8_e4m3fnuz,QuantType.per_1x128,1,1,16,0,560.9966,moe_ck2stages_gemm1_256x16x128x256_1x4_MulABScaleExpertWeightA8W8blkscale_v1_Nswizzle0_Quant4_MulRoutedWeight1_gelu_F8_F8_B16,0.0%,549.7671,moe_ck2stages_gemm2_256x16x128x256_1x4_MulABScaleExpertWeightA8W8blkscale_v1_Nswizzle0_Quant4_MulRoutedWeight0_F8_F8_B16,16.6%,1110.7637,0,81.2,1288.58,
80,4096,7168,256,256,8,ActivationType.Gelu,torch.bfloat16,torch.float8_e4m3fnuz,torch.float8_e4m3fnuz,QuantType.per_1x128,1,1,16,0,560.9966,moe_ck2stages_gemm1_256x16x128x256_1x4_MulABScaleExpertWeightA8W8blkscale_v1_Nswizzle0_Quant4_MulRoutedWeight1_gelu_F8_F8_B16,0.0%,549.7671,moe_ck2stages_gemm2_256x16x128x256_1x4_MulABScaleExpertWeightA8W8blkscale_v1_Nswizzle0_Quant4_MulRoutedWeight0_F8_F8_B16,16.6%,1110.7637,0,81.2,1288.58,
80,8192,7168,256,256,8,ActivationType.Gelu,torch.bfloat16,torch.float8_e4m3fnuz,torch.float8_e4m3fnuz,QuantType.per_1x128,1,1,16,0,560.9966,moe_ck2stages_gemm1_256x16x128x256_1x4_MulABScaleExpertWeightA8W8blkscale_v1_Nswizzle0_Quant4_MulRoutedWeight1_gelu_F8_F8_B16,0.0%,549.7671,moe_ck2stages_gemm2_256x16x128x256_1x4_MulABScaleExpertWeightA8W8blkscale_v1_Nswizzle0_Quant4_MulRoutedWeight0_F8_F8_B16,16.6%,1110.7637,0,81.2,1288.58,
80,16384,7168,256,256,8,ActivationType.Gelu,torch.bfloat16,torch.float8_e4m3fnuz,torch.float8_e4m3fnuz,QuantType.per_1x128,1,1,16,0,560.9966,moe_ck2stages_gemm1_256x16x128x256_1x4_MulABScaleExpertWeightA8W8blkscale_v1_Nswizzle0_Quant4_MulRoutedWeight1_gelu_F8_F8_B16,0.0%,549.7671,moe_ck2stages_gemm2_256x16x128x256_1x4_MulABScaleExpertWeightA8W8blkscale_v1_Nswizzle0_Quant4_MulRoutedWeight0_F8_F8_B16,16.6%,1110.7637,0,81.2,1288.58,
80,32768,7168,256,256,8,ActivationType.Gelu,torch.bfloat16,torch.float8_e4m3fnuz,torch.float8_e4m3fnuz,QuantType.per_1x128,1,1,16,0,560.9966,moe_ck2stages_gemm1_256x16x128x256_1x4_MulABScaleExpertWeightA8W8blkscale_v1_Nswizzle0_Quant4_MulRoutedWeight1_gelu_F8_F8_B16,0.0%,549.7671,moe_ck2stages_gemm2_256x16x128x256_1x4_MulABScaleExpertWeightA8W8blkscale_v1_Nswizzle0_Quant4_MulRoutedWeight0_F8_F8_B16,16.6%,1110.7637,0,81.2,1288.58,
80,2048,7168,256,256,8,ActivationType.Gelu,torch.bfloat16,torch.float8_e4m3fnuz,torch.float8_e4m3fnuz,QuantType.per_Tensor,1,0,32,0,388.4815,moe_ck2stages_gemm1_256x32x64x256_1x4_MulABScale_v1_Nswizzle0_Quant1_MulRoutedWeight0_gelu_F8_F8_B16,0.0%,429.5016,moe_ck2stages_gemm2_256x32x64x128_1x4_MulABScaleExpertWeight_v1_Nswizzle0_Quant1_MulRoutedWeight1_F8_F8_B16,1.6%,817.9830999999999,0,110.26,1749.8,
80,4096,7168,256,256,8,ActivationType.Gelu,torch.bfloat16,torch.float8_e4m3fnuz,torch.float8_e4m3fnuz,QuantType.per_Tensor,1,0,32,0,388.4815,moe_ck2stages_gemm1_256x32x64x256_1x4_MulABScale_v1_Nswizzle0_Quant1_MulRoutedWeight0_gelu_F8_F8_B16,0.0%,429.5016,moe_ck2stages_gemm2_256x32x64x128_1x4_MulABScaleExpertWeight_v1_Nswizzle0_Quant1_MulRoutedWeight1_F8_F8_B16,1.6%,817.9830999999999,0,110.26,1749.8,
80,8192,7168,256,256,8,ActivationType.Gelu,torch.bfloat16,torch.float8_e4m3fnuz,torch.float8_e4m3fnuz,QuantType.per_Tensor,1,0,32,0,388.4815,moe_ck2stages_gemm1_256x32x64x256_1x4_MulABScale_v1_Nswizzle0_Quant1_MulRoutedWeight0_gelu_F8_F8_B16,0.0%,429.5016,moe_ck2stages_gemm2_256x32x64x128_1x4_MulABScaleExpertWeight_v1_Nswizzle0_Quant1_MulRoutedWeight1_F8_F8_B16,1.6%,817.9830999999999,0,110.26,1749.8,
80,16384,7168,256,256,8,ActivationType.Gelu,torch.bfloat16,torch.float8_e4m3fnuz,torch.float8_e4m3fnuz,QuantType.per_Tensor,1,0,32,0,388.4815,moe_ck2stages_gemm1_256x32x64x256_1x4_MulABScale_v1_Nswizzle0_Quant1_MulRoutedWeight0_gelu_F8_F8_B16,0.0%,429.5016,moe_ck2stages_gemm2_256x32x64x128_1x4_MulABScaleExpertWeight_v1_Nswizzle0_Quant1_MulRoutedWeight1_F8_F8_B16,1.6%,817.9830999999999,0,110.26,1749.8,
80,32768,7168,256,256,8,ActivationType.Gelu,torch.bfloat16,torch.float8_e4m3fnuz,torch.float8_e4m3fnuz,QuantType.per_Tensor,1,0,32,0,388.4815,moe_ck2stages_gemm1_256x32x64x256_1x4_MulABScale_v1_Nswizzle0_Quant1_MulRoutedWeight0_gelu_F8_F8_B16,0.0%,429.5016,moe_ck2stages_gemm2_256x32x64x128_1x4_MulABScaleExpertWeight_v1_Nswizzle0_Quant1_MulRoutedWeight1_F8_F8_B16,1.6%,817.9830999999999,0,110.26,1749.8,
80,2048,7168,256,256,8,ActivationType.Gelu,torch.bfloat16,torch.float8_e4m3fnuz,torch.float8_e4m3fnuz,QuantType.per_Tensor,1,1,32,0,390.4133,moe_ck2stages_gemm1_256x32x64x256_1x4_MulABScale_v1_Nswizzle0_Quant1_MulRoutedWeight1_gelu_F8_F8_B16,0.0%,410.897,moe_ck2stages_gemm2_256x32x64x128_1x4_MulABScaleExpertWeight_v1_Nswizzle0_Quant1_MulRoutedWeight0_F8_F8_B16,0.0%,801.3103,0,112.56,1786.21,
80,4096,7168,256,256,8,ActivationType.Gelu,torch.bfloat16,torch.float8_e4m3fnuz,torch.float8_e4m3fnuz,QuantType.per_Tensor,1,1,32,0,390.4133,moe_ck2stages_gemm1_256x32x64x256_1x4_MulABScale_v1_Nswizzle0_Quant1_MulRoutedWeight1_gelu_F8_F8_B16,0.0%,410.897,moe_ck2stages_gemm2_256x32x64x128_1x4_MulABScaleExpertWeight_v1_Nswizzle0_Quant1_MulRoutedWeight0_F8_F8_B16,0.0%,801.3103,0,112.56,1786.21,
80,8192,7168,256,256,8,ActivationType.Gelu,torch.bfloat16,torch.float8_e4m3fnuz,torch.float8_e4m3fnuz,QuantType.per_Tensor,1,1,32,0,390.4133,moe_ck2stages_gemm1_256x32x64x256_1x4_MulABScale_v1_Nswizzle0_Quant1_MulRoutedWeight1_gelu_F8_F8_B16,0.0%,410.897,moe_ck2stages_gemm2_256x32x64x128_1x4_MulABScaleExpertWeight_v1_Nswizzle0_Quant1_MulRoutedWeight0_F8_F8_B16,0.0%,801.3103,0,112.56,1786.21,
80,16384,7168,256,256,8,ActivationType.Gelu,torch.bfloat16,torch.float8_e4m3fnuz,torch.float8_e4m3fnuz,QuantType.per_Tensor,1,1,32,0,390.4133,moe_ck2stages_gemm1_256x32x64x256_1x4_MulABScale_v1_Nswizzle0_Quant1_MulRoutedWeight1_gelu_F8_F8_B16,0.0%,410.897,moe_ck2stages_gemm2_256x32x64x128_1x4_MulABScaleExpertWeight_v1_Nswizzle0_Quant1_MulRoutedWeight0_F8_F8_B16,0.0%,801.3103,0,112.56,1786.21,
80,32768,7168,256,256,8,ActivationType.Gelu,torch.bfloat16,torch.float8_e4m3fnuz,torch.float8_e4m3fnuz,QuantType.per_Tensor,1,1,32,0,390.4133,moe_ck2stages_gemm1_256x32x64x256_1x4_MulABScale_v1_Nswizzle0_Quant1_MulRoutedWeight1_gelu_F8_F8_B16,0.0%,410.897,moe_ck2stages_gemm2_256x32x64x128_1x4_MulABScaleExpertWeight_v1_Nswizzle0_Quant1_MulRoutedWeight0_F8_F8_B16,0.0%,801.3103,0,112.56,1786.21,
80,2048,7168,256,256,8,ActivationType.Gelu,torch.bfloat16,torch.float8_e4m3fnuz,torch.float8_e4m3fnuz,QuantType.per_Token,1,0,32,0,390.1172,_ZN5aiter48fmoe_stage1_bf16_pertokenFp8_g1u1_32x256_2tg_pf3E,0.0%,531.1275,moe_ck2stages_gemm2_256x32x64x128_1x4_MulABScaleExpertWeight_v1_Nswizzle0_Quant2_MulRoutedWeight1_F8_F8_B16,1.6%,921.2447,0,97.9,1553.67,
80,4096,7168,256,256,8,ActivationType.Gelu,torch.bfloat16,torch.float8_e4m3fnuz,torch.float8_e4m3fnuz,QuantType.per_Token,1,0,32,0,390.1172,_ZN5aiter48fmoe_stage1_bf16_pertokenFp8_g1u1_32x256_2tg_pf3E,0.0%,531.1275,moe_ck2stages_gemm2_256x32x64x128_1x4_MulABScaleExpertWeight_v1_Nswizzle0_Quant2_MulRoutedWeight1_F8_F8_B16,1.6%,921.2447,0,97.9,1553.67,
80,8192,7168,256,256,8,ActivationType.Gelu,torch.bfloat16,torch.float8_e4m3fnuz,torch.float8_e4m3fnuz,QuantType.per_Token,1,0,32,0,390.1172,_ZN5aiter48fmoe_stage1_bf16_pertokenFp8_g1u1_32x256_2tg_pf3E,0.0%,531.1275,moe_ck2stages_gemm2_256x32x64x128_1x4_MulABScaleExpertWeight_v1_Nswizzle0_Quant2_MulRoutedWeight1_F8_F8_B16,1.6%,921.2447,0,97.9,1553.67,
80,16384,7168,256,256,8,ActivationType.Gelu,torch.bfloat16,torch.float8_e4m3fnuz,torch.float8_e4m3fnuz,QuantType.per_Token,1,0,32,0,390.1172,_ZN5aiter48fmoe_stage1_bf16_pertokenFp8_g1u1_32x256_2tg_pf3E,0.0%,531.1275,moe_ck2stages_gemm2_256x32x64x128_1x4_MulABScaleExpertWeight_v1_Nswizzle0_Quant2_MulRoutedWeight1_F8_F8_B16,1.6%,921.2447,0,97.9,1553.67,
80,32768,7168,256,256,8,ActivationType.Gelu,torch.bfloat16,torch.float8_e4m3fnuz,torch.float8_e4m3fnuz,QuantType.per_Token,1,0,32,0,390.1172,_ZN5aiter48fmoe_stage1_bf16_pertokenFp8_g1u1_32x256_2tg_pf3E,0.0%,531.1275,moe_ck2stages_gemm2_256x32x64x128_1x4_MulABScaleExpertWeight_v1_Nswizzle0_Quant2_MulRoutedWeight1_F8_F8_B16,1.6%,921.2447,0,97.9,1553.67,
80,2048,7168,256,256,8,ActivationType.Gelu,torch.bfloat16,torch.float8_e4m3fnuz,torch.float8_e4m3fnuz,QuantType.per_Token,1,1,32,0,385.5365,_ZN5aiter57fmoe_stage1_bf16_pertokenFp8_doweight_g1u1_32x256_2tg_pf3E,0.0%,515.5173,moe_ck2stages_gemm2_256x32x64x128_1x4_MulABScaleExpertWeight_v1_Nswizzle0_Quant2_MulRoutedWeight0_F8_F8_B16,0.0%,901.0538,0,100.1,1588.48,
80,4096,7168,256,256,8,ActivationType.Gelu,torch.bfloat16,torch.float8_e4m3fnuz,torch.float8_e4m3fnuz,QuantType.per_Token,1,1,32,0,385.5365,_ZN5aiter57fmoe_stage1_bf16_pertokenFp8_doweight_g1u1_32x256_2tg_pf3E,0.0%,515.5173,moe_ck2stages_gemm2_256x32x64x128_1x4_MulABScaleExpertWeight_v1_Nswizzle0_Quant2_MulRoutedWeight0_F8_F8_B16,0.0%,901.0538,0,100.1,1588.48,
80,8192,7168,256,256,8,ActivationType.Gelu,torch.bfloat16,torch.float8_e4m3fnuz,torch.float8_e4m3fnuz,QuantType.per_Token,1,1,32,0,385.5365,_ZN5aiter57fmoe_stage1_bf16_pertokenFp8_doweight_g1u1_32x256_2tg_pf3E,0.0%,515.5173,moe_ck2stages_gemm2_256x32x64x128_1x4_MulABScaleExpertWeight_v1_Nswizzle0_Quant2_MulRoutedWeight0_F8_F8_B16,0.0%,901.0538,0,100.1,1588.48,
80,16384,7168,256,256,8,ActivationType.Gelu,torch.bfloat16,torch.float8_e4m3fnuz,torch.float8_e4m3fnuz,QuantType.per_Token,1,1,32,0,385.5365,_ZN5aiter57fmoe_stage1_bf16_pertokenFp8_doweight_g1u1_32x256_2tg_pf3E,0.0%,515.5173,moe_ck2stages_gemm2_256x32x64x128_1x4_MulABScaleExpertWeight_v1_Nswizzle0_Quant2_MulRoutedWeight0_F8_F8_B16,0.0%,901.0538,0,100.1,1588.48,
80,32768,7168,256,256,8,ActivationType.Gelu,torch.bfloat16,torch.float8_e4m3fnuz,torch.float8_e4m3fnuz,QuantType.per_Token,1,1,32,0,385.5365,_ZN5aiter57fmoe_stage1_bf16_pertokenFp8_doweight_g1u1_32x256_2tg_pf3E,0.0%,515.5173,moe_ck2stages_gemm2_256x32x64x128_1x4_MulABScaleExpertWeight_v1_Nswizzle0_Quant2_MulRoutedWeight0_F8_F8_B16,0.0%,901.0538,0,100.1,1588.48,
80,2048,7168,256,256,8,ActivationType.Silu,torch.bfloat16,torch.bfloat16,torch.bfloat16,QuantType.No,1,0,32,0,783.2767,moe_ck2stages_gemm1_256x32x64x128_1x4_TypeCast_v1_Nswizzle0_Quant0_MulRoutedWeight0_silu_B16_B16_B16,0.0%,600.1759,moe_ck2stages_gemm2_256x32x64x64_1x4_TypeCastExpertWeight_v1_Nswizzle0_Quant0_MulRoutedWeight1_B16_B16_B16,1.3%,1383.4526,0,65.2,2058.57,
80,4096,7168,256,256,8,ActivationType.Silu,torch.bfloat16,torch.bfloat16,torch.bfloat16,QuantType.No,1,0,32,0,783.2767,moe_ck2stages_gemm1_256x32x64x128_1x4_TypeCast_v1_Nswizzle0_Quant0_MulRoutedWeight0_silu_B16_B16_B16,0.0%,600.1759,moe_ck2stages_gemm2_256x32x64x64_1x4_TypeCastExpertWeight_v1_Nswizzle0_Quant0_MulRoutedWeight1_B16_B16_B16,1.3%,1383.4526,0,65.2,2058.57,
80,8192,7168,256,256,8,ActivationType.Silu,torch.bfloat16,torch.bfloat16,torch.bfloat16,QuantType.No,1,0,32,0,783.2767,moe_ck2stages_gemm1_256x32x64x128_1x4_TypeCast_v1_Nswizzle0_Quant0_MulRoutedWeight0_silu_B16_B16_B16,0.0%,600.1759,moe_ck2stages_gemm2_256x32x64x64_1x4_TypeCastExpertWeight_v1_Nswizzle0_Quant0_MulRoutedWeight1_B16_B16_B16,1.3%,1383.4526,0,65.2,2058.57,
80,16384,7168,256,256,8,ActivationType.Silu,torch.bfloat16,torch.bfloat16,torch.bfloat16,QuantType.No,1,0,32,0,783.2767,moe_ck2stages_gemm1_256x32x64x128_1x4_TypeCast_v1_Nswizzle0_Quant0_MulRoutedWeight0_silu_B16_B16_B16,0.0%,600.1759,moe_ck2stages_gemm2_256x32x64x64_1x4_TypeCastExpertWeight_v1_Nswizzle0_Quant0_MulRoutedWeight1_B16_B16_B16,1.3%,1383.4526,0,65.2,2058.57,
80,32768,7168,256,256,8,ActivationType.Silu,torch.bfloat16,torch.bfloat16,torch.bfloat16,QuantType.No,1,0,32,0,783.2767,moe_ck2stages_gemm1_256x32x64x128_1x4_TypeCast_v1_Nswizzle0_Quant0_MulRoutedWeight0_silu_B16_B16_B16,0.0%,600.1759,moe_ck2stages_gemm2_256x32x64x64_1x4_TypeCastExpertWeight_v1_Nswizzle0_Quant0_MulRoutedWeight1_B16_B16_B16,1.3%,1383.4526,0,65.2,2058.57,
80,2048,7168,256,256,8,ActivationType.Silu,torch.bfloat16,torch.bfloat16,torch.bfloat16,QuantType.No,1,1,32,0,784.9765,moe_ck2stages_gemm1_256x32x64x128_1x4_TypeCastExpertWeight_v1_Nswizzle0_Quant0_MulRoutedWeight1_silu_B16_B16_B16,0.0%,567.3861,moe_ck2stages_gemm2_256x32x64x64_1x4_TypeCast_v1_Nswizzle0_Quant0_MulRoutedWeight0_B16_B16_B16,0.0%,1352.3626,0,66.69,2105.89,
80,4096,7168,256,256,8,ActivationType.Silu,torch.bfloat16,torch.bfloat16,torch.bfloat16,QuantType.No,1,1,32,0,784.9765,moe_ck2stages_gemm1_256x32x64x128_1x4_TypeCastExpertWeight_v1_Nswizzle0_Quant0_MulRoutedWeight1_silu_B16_B16_B16,0.0%,567.3861,moe_ck2stages_gemm2_256x32x64x64_1x4_TypeCast_v1_Nswizzle0_Quant0_MulRoutedWeight0_B16_B16_B16,0.0%,1352.3626,0,66.69,2105.89,
80,8192,7168,256,256,8,ActivationType.Silu,torch.bfloat16,torch.bfloat16,torch.bfloat16,QuantType.No,1,1,32,0,784.9765,moe_ck2stages_gemm1_256x32x64x128_1x4_TypeCastExpertWeight_v1_Nswizzle0_Quant0_MulRoutedWeight1_silu_B16_B16_B16,0.0%,567.3861,moe_ck2stages_gemm2_256x32x64x64_1x4_TypeCast_v1_Nswizzle0_Quant0_MulRoutedWeight0_B16_B16_B16,0.0%,1352.3626,0,66.69,2105.89,
80,16384,7168,256,256,8,ActivationType.Silu,torch.bfloat16,torch.bfloat16,torch.bfloat16,QuantType.No,1,1,32,0,784.9765,moe_ck2stages_gemm1_256x32x64x128_1x4_TypeCastExpertWeight_v1_Nswizzle0_Quant0_MulRoutedWeight1_silu_B16_B16_B16,0.0%,567.3861,moe_ck2stages_gemm2_256x32x64x64_1x4_TypeCast_v1_Nswizzle0_Quant0_MulRoutedWeight0_B16_B16_B16,0.0%,1352.3626,0,66.69,2105.89,
80,32768,7168,256,256,8,ActivationType.Silu,torch.bfloat16,torch.bfloat16,torch.bfloat16,QuantType.No,1,1,32,0,784.9765,moe_ck2stages_gemm1_256x32x64x128_1x4_TypeCastExpertWeight_v1_Nswizzle0_Quant0_MulRoutedWeight1_silu_B16_B16_B16,0.0%,567.3861,moe_ck2stages_gemm2_256x32x64x64_1x4_TypeCast_v1_Nswizzle0_Quant0_MulRoutedWeight0_B16_B16_B16,0.0%,1352.3626,0,66.69,2105.89,
80,2048,7168,256,256,8,ActivationType.Silu,torch.bfloat16,torch.float8_e4m3fnuz,torch.float8_e4m3fnuz,QuantType.per_1x128,1,0,16,0,557.7338,moe_ck2stages_gemm1_256x16x128x256_1x4_MulABScaleExpertWeightA8W8blkscale_v1_Nswizzle0_Quant4_MulRoutedWeight0_silu_F8_F8_B16,0.0%,556.9381,moe_ck2stages_gemm2_256x16x128x256_1x4_MulABScaleExpertWeightA8W8blkscale_v1_Nswizzle0_Quant4_MulRoutedWeight1_F8_F8_B16,15.6%,1114.6719,0,80.92,1284.06,
80,4096,7168,256,256,8,ActivationType.Silu,torch.bfloat16,torch.float8_e4m3fnuz,torch.float8_e4m3fnuz,QuantType.per_1x128,1,0,16,0,557.7338,moe_ck2stages_gemm1_256x16x128x256_1x4_MulABScaleExpertWeightA8W8blkscale_v1_Nswizzle0_Quant4_MulRoutedWeight0_silu_F8_F8_B16,0.0%,556.9381,moe_ck2stages_gemm2_256x16x128x256_1x4_MulABScaleExpertWeightA8W8blkscale_v1_Nswizzle0_Quant4_MulRoutedWeight1_F8_F8_B16,15.6%,1114.6719,0,80.92,1284.06,
80,8192,7168,256,256,8,ActivationType.Silu,torch.bfloat16,torch.float8_e4m3fnuz,torch.float8_e4m3fnuz,QuantType.per_1x128,1,0,16,0,557.7338,moe_ck2stages_gemm1_256x16x128x256_1x4_MulABScaleExpertWeightA8W8blkscale_v1_Nswizzle0_Quant4_MulRoutedWeight0_silu_F8_F8_B16,0.0%,556.9381,moe_ck2stages_gemm2_256x16x128x256_1x4_MulABScaleExpertWeightA8W8blkscale_v1_Nswizzle0_Quant4_MulRoutedWeight1_F8_F8_B16,15.6%,1114.6719,0,80.92,1284.06,
80,16384,7168,256,256,8,ActivationType.Silu,torch.bfloat16,torch.float8_e4m3fnuz,torch.float8_e4m3fnuz,QuantType.per_1x128,1,0,16,0,557.7338,moe_ck2stages_gemm1_256x16x128x256_1x4_MulABScaleExpertWeightA8W8blkscale_v1_Nswizzle0_Quant4_MulRoutedWeight0_silu_F8_F8_B16,0.0%,556.9381,moe_ck2stages_gemm2_256x16x128x256_1x4_MulABScaleExpertWeightA8W8blkscale_v1_Nswizzle0_Quant4_MulRoutedWeight1_F8_F8_B16,15.6%,1114.6719,0,80.92,1284.06,
80,32768,7168,256,256,8,ActivationType.Silu,torch.bfloat16,torch.float8_e4m3fnuz,torch.float8_e4m3fnuz,QuantType.per_1x128,1,0,16,0,557.7338,moe_ck2stages_gemm1_256x16x128x256_1x4_MulABScaleExpertWeightA8W8blkscale_v1_Nswizzle0_Quant4_MulRoutedWeight0_silu_F8_F8_B16,0.0%,556.9381,moe_ck2stages_gemm2_256x16x128x256_1x4_MulABScaleExpertWeightA8W8blkscale_v1_Nswizzle0_Quant4_MulRoutedWeight1_F8_F8_B16,15.6%,1114.6719,0,80.92,1284.06,
80,2048,7168,256,256,8,ActivationType.Silu,torch.bfloat16,torch.float8_e4m3fnuz,torch.float8_e4m3fnuz,QuantType.per_1x128,1,1,16,0,558.3594,moe_ck2stages_gemm1_256x16x128x256_1x4_MulABScaleExpertWeightA8W8blkscale_v1_Nswizzle0_Quant4_MulRoutedWeight1_silu_F8_F8_B16,0.0%,555.8992,moe_ck2stages_gemm2_256x16x128x256_1x4_MulABScaleExpertWeightA8W8blkscale_v1_Nswizzle0_Quant4_MulRoutedWeight0_F8_F8_B16,16.7%,1114.2586,0,80.95,1284.54,
80,4096,7168,256,256,8,ActivationType.Silu,torch.bfloat16,torch.float8_e4m3fnuz,torch.float8_e4m3fnuz,QuantType.per_1x128,1,1,16,0,558.3594,moe_ck2stages_gemm1_256x16x128x256_1x4_MulABScaleExpertWeightA8W8blkscale_v1_Nswizzle0_Quant4_MulRoutedWeight1_silu_F8_F8_B16,0.0%,555.8992,moe_ck2stages_gemm2_256x16x128x256_1x4_MulABScaleExpertWeightA8W8blkscale_v1_Nswizzle0_Quant4_MulRoutedWeight0_F8_F8_B16,16.7%,1114.2586,0,80.95,1284.54,
80,8192,7168,256,256,8,ActivationType.Silu,torch.bfloat16,torch.float8_e4m3fnuz,torch.float8_e4m3fnuz,QuantType.per_1x128,1,1,16,0,558.3594,moe_ck2stages_gemm1_256x16x128x256_1x4_MulABScaleExpertWeightA8W8blkscale_v1_Nswizzle0_Quant4_MulRoutedWeight1_silu_F8_F8_B16,0.0%,555.8992,moe_ck2stages_gemm2_256x16x128x256_1x4_MulABScaleExpertWeightA8W8blkscale_v1_Nswizzle0_Quant4_MulRoutedWeight0_F8_F8_B16,16.7%,1114.2586,0,80.95,1284.54,
80,16384,7168,256,256,8,ActivationType.Silu,torch.bfloat16,torch.float8_e4m3fnuz,torch.float8_e4m3fnuz,QuantType.per_1x128,1,1,16,0,558.3594,moe_ck2stages_gemm1_256x16x128x256_1x4_MulABScaleExpertWeightA8W8blkscale_v1_Nswizzle0_Quant4_MulRoutedWeight1_silu_F8_F8_B16,0.0%,555.8992,moe_ck2stages_gemm2_256x16x128x256_1x4_MulABScaleExpertWeightA8W8blkscale_v1_Nswizzle0_Quant4_MulRoutedWeight0_F8_F8_B16,16.7%,1114.2586,0,80.95,1284.54,
80,32768,7168,256,256,8,ActivationType.Silu,torch.bfloat16,torch.float8_e4m3fnuz,torch.float8_e4m3fnuz,QuantType.per_1x128,1,1,16,0,558.3594,moe_ck2stages_gemm1_256x16x128x256_1x4_MulABScaleExpertWeightA8W8blkscale_v1_Nswizzle0_Quant4_MulRoutedWeight1_silu_F8_F8_B16,0.0%,555.8992,moe_ck2stages_gemm2_256x16x128x256_1x4_MulABScaleExpertWeightA8W8blkscale_v1_Nswizzle0_Quant4_MulRoutedWeight0_F8_F8_B16,16.7%,1114.2586,0,80.95,1284.54,
80,2048,7168,256,256,8,ActivationType.Silu,torch.bfloat16,torch.float8_e4m3fnuz,torch.float8_e4m3fnuz,QuantType.per_Tensor,1,0,32,0,394.9761,_ZN5aiter48fmoe_stage1_bf16_pertokenFp8_g1u1_32x256_2tg_pf3E,0.0%,427.6178,moe_ck2stages_gemm2_256x32x64x128_1x4_MulABScaleExpertWeight_v1_Nswizzle0_Quant1_MulRoutedWeight1_F8_F8_B16,1.3%,822.5939,0,109.65,1739.99,
80,4096,7168,256,256,8,ActivationType.Silu,torch.bfloat16,torch.float8_e4m3fnuz,torch.float8_e4m3fnuz,QuantType.per_Tensor,1,0,32,0,394.9761,_ZN5aiter48fmoe_stage1_bf16_pertokenFp8_g1u1_32x256_2tg_pf3E,0.0%,427.6178,moe_ck2stages_gemm2_256x32x64x128_1x4_MulABScaleExpertWeight_v1_Nswizzle0_Quant1_MulRoutedWeight1_F8_F8_B16,1.3%,822.5939,0,109.65,1739.99,
80,8192,7168,256,256,8,ActivationType.Silu,torch.bfloat16,torch.float8_e4m3fnuz,torch.float8_e4m3fnuz,QuantType.per_Tensor,1,0,32,0,394.9761,_ZN5aiter48fmoe_stage1_bf16_pertokenFp8_g1u1_32x256_2tg_pf3E,0.0%,427.6178,moe_ck2stages_gemm2_256x32x64x128_1x4_MulABScaleExpertWeight_v1_Nswizzle0_Quant1_MulRoutedWeight1_F8_F8_B16,1.3%,822.5939,0,109.65,1739.99,
80,16384,7168,256,256,8,ActivationType.Silu,torch.bfloat16,torch.float8_e4m3fnuz,torch.float8_e4m3fnuz,QuantType.per_Tensor,1,0,32,0,394.9761,_ZN5aiter48fmoe_stage1_bf16_pertokenFp8_g1u1_32x256_2tg_pf3E,0.0%,427.6178,moe_ck2stages_gemm2_256x32x64x128_1x4_MulABScaleExpertWeight_v1_Nswizzle0_Quant1_MulRoutedWeight1_F8_F8_B16,1.3%,822.5939,0,109.65,1739.99,
80,32768,7168,256,256,8,ActivationType.Silu,torch.bfloat16,torch.float8_e4m3fnuz,torch.float8_e4m3fnuz,QuantType.per_Tensor,1,0,32,0,394.9761,_ZN5aiter48fmoe_stage1_bf16_pertokenFp8_g1u1_32x256_2tg_pf3E,0.0%,427.6178,moe_ck2stages_gemm2_256x32x64x128_1x4_MulABScaleExpertWeight_v1_Nswizzle0_Quant1_MulRoutedWeight1_F8_F8_B16,1.3%,822.5939,0,109.65,1739.99,
80,2048,7168,256,256,8,ActivationType.Silu,torch.bfloat16,torch.float8_e4m3fnuz,torch.float8_e4m3fnuz,QuantType.per_Tensor,1,1,32,0,398.3967,_ZN5aiter57fmoe_stage1_bf16_pertokenFp8_doweight_g1u1_32x256_2tg_pf3E,0.0%,410.8972,moe_ck2stages_gemm2_256x32x64x128_1x4_MulABScaleExpertWeight_v1_Nswizzle0_Quant1_MulRoutedWeight0_F8_F8_B16,0.0%,809.2939,0,111.45,1768.59,
80,4096,7168,256,256,8,ActivationType.Silu,torch.bfloat16,torch.float8_e4m3fnuz,torch.float8_e4m3fnuz,QuantType.per_Tensor,1,1,32,0,398.3967,_ZN5aiter57fmoe_stage1_bf16_pertokenFp8_doweight_g1u1_32x256_2tg_pf3E,0.0%,410.8972,moe_ck2stages_gemm2_256x32x64x128_1x4_MulABScaleExpertWeight_v1_Nswizzle0_Quant1_MulRoutedWeight0_F8_F8_B16,0.0%,809.2939,0,111.45,1768.59,
80,8192,7168,256,256,8,ActivationType.Silu,torch.bfloat16,torch.float8_e4m3fnuz,torch.float8_e4m3fnuz,QuantType.per_Tensor,1,1,32,0,398.3967,_ZN5aiter57fmoe_stage1_bf16_pertokenFp8_doweight_g1u1_32x256_2tg_pf3E,0.0%,410.8972,moe_ck2stages_gemm2_256x32x64x128_1x4_MulABScaleExpertWeight_v1_Nswizzle0_Quant1_MulRoutedWeight0_F8_F8_B16,0.0%,809.2939,0,111.45,1768.59,
80,16384,7168,256,256,8,ActivationType.Silu,torch.bfloat16,torch.float8_e4m3fnuz,torch.float8_e4m3fnuz,QuantType.per_Tensor,1,1,32,0,398.3967,_ZN5aiter57fmoe_stage1_bf16_pertokenFp8_doweight_g1u1_32x256_2tg_pf3E,0.0%,410.8972,moe_ck2stages_gemm2_256x32x64x128_1x4_MulABScaleExpertWeight_v1_Nswizzle0_Quant1_MulRoutedWeight0_F8_F8_B16,0.0%,809.2939,0,111.45,1768.59,
80,32768,7168,256,256,8,ActivationType.Silu,torch.bfloat16,torch.float8_e4m3fnuz,torch.float8_e4m3fnuz,QuantType.per_Tensor,1,1,32,0,398.3967,_ZN5aiter57fmoe_stage1_bf16_pertokenFp8_doweight_g1u1_32x256_2tg_pf3E,0.0%,410.8972,moe_ck2stages_gemm2_256x32x64x128_1x4_MulABScaleExpertWeight_v1_Nswizzle0_Quant1_MulRoutedWeight0_F8_F8_B16,0.0%,809.2939,0,111.45,1768.59,
80,1,7168,256,256,8,ActivationType.Silu,torch.bfloat16,torch.float8_e4m3fnuz,torch.float8_e4m3fnuz,QuantType.per_Token,1,0,16,0,39.3207,moe_ck2stages_gemm1_256x16x128x256_1x4_MulABScale_v1_Nswizzle0_Quant2_MulRoutedWeight0_silu_F8_F8_B16,0.0%,12.9446,moe_ck2stages_gemm2_256x16x128x256_1x4_MulABScaleExpertWeight_v1_Nswizzle0_Quant2_MulRoutedWeight1_F8_F8_B16,1.2%,52.2653,0,1.69,26964.5,
80,2,7168,256,256,8,ActivationType.Silu,torch.bfloat16,torch.float8_e4m3fnuz,torch.float8_e4m3fnuz,QuantType.per_Token,1,0,16,0,40.8689,moe_ck2stages_gemm1_256x16x128x256_1x4_MulABScale_v1_Nswizzle0_Quant2_MulRoutedWeight0_silu_F8_F8_B16,0.0%,18.1489,moe_ck2stages_gemm2_256x16x128x256_1x4_MulABScaleExpertWeight_v1_Nswizzle0_Quant2_MulRoutedWeight1_F8_F8_B16,1.2%,59.0178,0,2.98,23879.73,
80,4,7168,256,256,8,ActivationType.Silu,torch.bfloat16,torch.float8_e4m3fnuz,torch.float8_e4m3fnuz,QuantType.per_Token,1,0,16,0,46.2328,moe_ck2stages_gemm1_256x16x128x256_1x4_MulABScale_v1_Nswizzle0_Quant2_MulRoutedWeight0_silu_F8_F8_B16,0.7%,28.8818,moe_ck2stages_gemm2_256x16x128x256_1x4_MulABScaleExpertWeight_v1_Nswizzle0_Quant2_MulRoutedWeight1_F8_F8_B16,1.4%,75.1146,0,4.69,18762.96,
80,8,7168,256,256,8,ActivationType.Silu,torch.bfloat16,torch.float8_e4m3fnuz,torch.float8_e4m3fnuz,QuantType.per_Token,1,0,16,0,64.2093,moe_ck2stages_gemm1_256x16x128x256_1x4_MulABScale_v1_Nswizzle0_Quant2_MulRoutedWeight0_silu_F8_F8_B16,1.8%,45.801,moe_ck2stages_gemm2_256x16x128x256_1x4_MulABScaleExpertWeight_v1_Nswizzle0_Quant2_MulRoutedWeight1_F8_F8_B16,1.4%,110.0103,0,6.41,12812.06,
80,16,7168,256,256,8,ActivationType.Silu,torch.bfloat16,torch.float8_e4m3fnuz,torch.float8_e4m3fnuz,QuantType.per_Token,1,0,16,0,116.5659,moe_ck2stages_gemm1_256x16x128x256_1x4_MulABScale_v1_Nswizzle0_Quant2_MulRoutedWeight0_silu_F8_F8_B16,0.0%,74.8227,moe_ck2stages_gemm2_256x16x128x256_1x4_MulABScaleExpertWeight_v1_Nswizzle0_Quant2_MulRoutedWeight1_F8_F8_B16,1.3%,191.3886,0,7.36,7365.28,
80,32,7168,256,256,8,ActivationType.Silu,torch.bfloat16,torch.float8_e4m3fnuz,torch.float8_e4m3fnuz,QuantType.per_Token,1,0,16,0,192.7713,moe_ck2stages_gemm1_256x16x128x256_1x4_MulABScale_v1_Nswizzle0_Quant2_MulRoutedWeight0_silu_F8_F8_B16,6.2%,126.9169,moe_ck2stages_gemm2_256x16x128x256_1x4_MulABScaleExpertWeight_v1_Nswizzle0_Quant2_MulRoutedWeight1_F8_F8_B16,1.3%,319.6882,0,8.82,4410.47,
80,64,7168,256,256,8,ActivationType.Silu,torch.bfloat16,torch.float8_e4m3fnuz,torch.float8_e4m3fnuz,QuantType.per_Token,1,0,32,0,412.7488,_ZN5aiter45fmoe_bf16_pertokenFp8_g1u1_vs_silu_1tg_32x256E,0.0%,0.0,Null,0.0%,412.7488,1,13.66,3417.73,
80,128,7168,256,256,8,ActivationType.Silu,torch.bfloat16,torch.float8_e4m3fnuz,torch.float8_e4m3fnuz,QuantType.per_Token,1,0,16,0,285.3733,moe_ck2stages_gemm1_256x16x128x256_1x4_MulABScale_v1_Nswizzle0_Quant2_MulRoutedWeight0_silu_F8_F8_B16,6.3%,202.3184,moe_ck2stages_gemm2_256x16x128x256_1x4_MulABScaleExpertWeight_v1_Nswizzle0_Quant2_MulRoutedWeight1_F8_F8_B16,1.3%,487.6917,0,23.12,2895.35,
80,256,7168,256,256,8,ActivationType.Silu,torch.bfloat16,torch.float8_e4m3fnuz,torch.float8_e4m3fnuz,QuantType.per_Token,1,0,16,0,295.5849,moe_ck2stages_gemm1_256x16x128x256_1x4_MulABScale_v1_Nswizzle0_Quant2_MulRoutedWeight0_silu_F8_F8_B16,0.0%,214.8909,moe_ck2stages_gemm2_256x16x128x256_1x4_MulABScaleExpertWeight_v1_Nswizzle0_Quant2_MulRoutedWeight1_F8_F8_B16,1.3%,510.4758,0,44.17,2771.51,
80,1024,7168,256,256,8,ActivationType.Silu,torch.bfloat16,torch.float8_e4m3fnuz,torch.float8_e4m3fnuz,QuantType.per_Token,1,0,32,0,718.9196,_ZN5aiter45fmoe_bf16_pertokenFp8_g1u1_vs_silu_1tg_32x256E,0.0%,0.0,Null,0.0%,718.9196,1,125.46,1990.91,
80,2048,7168,256,256,8,ActivationType.Silu,torch.bfloat16,torch.float8_e4m3fnuz,torch.float8_e4m3fnuz,QuantType.per_Token,1,0,32,0,1195.0627,_ZN5aiter45fmoe_bf16_pertokenFp8_g1u1_vs_silu_1tg_32x256E,0.0%,0.0,Null,0.0%,1195.0627,1,150.94,1216.11,
80,4096,7168,256,256,8,ActivationType.Silu,torch.bfloat16,torch.float8_e4m3fnuz,torch.float8_e4m3fnuz,QuantType.per_Token,1,0,32,0,1195.0627,_ZN5aiter45fmoe_bf16_pertokenFp8_g1u1_vs_silu_1tg_32x256E,0.0%,0.0,Null,0.0%,1195.0627,1,150.94,1216.11,
80,8192,7168,256,256,8,ActivationType.Silu,torch.bfloat16,torch.float8_e4m3fnuz,torch.float8_e4m3fnuz,QuantType.per_Token,1,0,32,0,1195.0627,_ZN5aiter45fmoe_bf16_pertokenFp8_g1u1_vs_silu_1tg_32x256E,0.0%,0.0,Null,0.0%,1195.0627,1,150.94,1216.11,
80,16384,7168,256,256,8,ActivationType.Silu,torch.bfloat16,torch.float8_e4m3fnuz,torch.float8_e4m3fnuz,QuantType.per_Token,1,0,32,0,723.0851,_ZN5aiter48fmoe_bf16_pertokenFp8_g1u1_vs_silu_1tg_ps_32x256E,0.0%,0.0,Null,0.0%,723.0851,1,124.74,1979.44,
80,32768,7168,256,256,8,ActivationType.Silu,torch.bfloat16,torch.float8_e4m3fnuz,torch.float8_e4m3fnuz,QuantType.per_Token,1,0,32,0,723.0851,_ZN5aiter48fmoe_bf16_pertokenFp8_g1u1_vs_silu_1tg_ps_32x256E,0.0%,0.0,Null,0.0%,723.0851,1,124.74,1979.44,
80,2048,7168,256,256,8,ActivationType.Silu,torch.bfloat16,torch.float8_e4m3fnuz,torch.float8_e4m3fnuz,QuantType.per_Token,1,1,32,0,394.0843,_ZN5aiter57fmoe_stage1_bf16_pertokenFp8_doweight_g1u1_32x256_2tg_pf3E,0.0%,517.6212,moe_ck2stages_gemm2_256x32x64x128_1x4_MulABScaleExpertWeight_v1_Nswizzle0_Quant2_MulRoutedWeight0_F8_F8_B16,0.0%,911.7055,0,98.93,1569.92,
80,4096,7168,256,256,8,ActivationType.Silu,torch.bfloat16,torch.float8_e4m3fnuz,torch.float8_e4m3fnuz,QuantType.per_Token,1,1,32,0,394.0843,_ZN5aiter57fmoe_stage1_bf16_pertokenFp8_doweight_g1u1_32x256_2tg_pf3E,0.0%,517.6212,moe_ck2stages_gemm2_256x32x64x128_1x4_MulABScaleExpertWeight_v1_Nswizzle0_Quant2_MulRoutedWeight0_F8_F8_B16,0.0%,911.7055,0,98.93,1569.92,
80,8192,7168,256,256,8,ActivationType.Silu,torch.bfloat16,torch.float8_e4m3fnuz,torch.float8_e4m3fnuz,QuantType.per_Token,1,1,32,0,394.0843,_ZN5aiter57fmoe_stage1_bf16_pertokenFp8_doweight_g1u1_32x256_2tg_pf3E,0.0%,517.6212,moe_ck2stages_gemm2_256x32x64x128_1x4_MulABScaleExpertWeight_v1_Nswizzle0_Quant2_MulRoutedWeight0_F8_F8_B16,0.0%,911.7055,0,98.93,1569.92,
80,16384,7168,256,256,8,ActivationType.Silu,torch.bfloat16,torch.float8_e4m3fnuz,torch.float8_e4m3fnuz,QuantType.per_Token,1,1,32,0,394.0843,_ZN5aiter57fmoe_stage1_bf16_pertokenFp8_doweight_g1u1_32x256_2tg_pf3E,0.0%,517.6212,moe_ck2stages_gemm2_256x32x64x128_1x4_MulABScaleExpertWeight_v1_Nswizzle0_Quant2_MulRoutedWeight0_F8_F8_B16,0.0%,911.7055,0,98.93,1569.92,
80,32768,7168,256,256,8,ActivationType.Silu,torch.bfloat16,torch.float8_e4m3fnuz,torch.float8_e4m3fnuz,QuantType.per_Token,1,1,32,0,394.0843,_ZN5aiter57fmoe_stage1_bf16_pertokenFp8_doweight_g1u1_32x256_2tg_pf3E,0.0%,517.6212,moe_ck2stages_gemm2_256x32x64x128_1x4_MulABScaleExpertWeight_v1_Nswizzle0_Quant2_MulRoutedWeight0_F8_F8_B16,0.0%,911.7055,0,98.93,1569.92,
80,1,7168,256,257,9,ActivationType.Silu,torch.bfloat16,torch.float8_e4m3fnuz,torch.float8_e4m3fnuz,QuantType.per_Token,1,0,16,0,39.59,moe_ck2stages_gemm1_256x16x128x256_1x4_MulABScale_v1_Nswizzle0_Quant2_MulRoutedWeight0_silu_F8_F8_B16,0.0%,13.014,moe_ck2stages_gemm2_256x16x128x256_1x4_MulABScaleExpertWeight_v1_Nswizzle0_Quant2_MulRoutedWeight1_F8_F8_B16,1.2%,52.604,0,1.88,26895.53,
80,2,7168,256,257,9,ActivationType.Silu,torch.bfloat16,torch.float8_e4m3fnuz,torch.float8_e4m3fnuz,QuantType.per_Token,1,0,16,0,41.4577,moe_ck2stages_gemm1_256x16x128x256_1x4_MulABScale_v1_Nswizzle0_Quant2_MulRoutedWeight0_silu_F8_F8_B16,0.0%,19.353,moe_ck2stages_gemm2_256x16x128x256_1x4_MulABScaleExpertWeight_v1_Nswizzle0_Quant2_MulRoutedWeight1_F8_F8_B16,1.2%,60.8107,0,3.26,23266.2,
80,4,7168,256,257,9,ActivationType.Silu,torch.bfloat16,torch.float8_e4m3fnuz,torch.float8_e4m3fnuz,QuantType.per_Token,1,0,16,0,48.5685,moe_ck2stages_gemm1_256x16x128x256_1x4_MulABScale_v1_Nswizzle0_Quant2_MulRoutedWeight0_silu_F8_F8_B16,0.0%,32.2906,moe_ck2stages_gemm2_256x16x128x256_1x4_MulABScaleExpertWeight_v1_Nswizzle0_Quant2_MulRoutedWeight1_F8_F8_B16,1.3%,80.8591,0,4.9,17498.06,
80,8,7168,256,257,9,ActivationType.Silu,torch.bfloat16,torch.float8_e4m3fnuz,torch.float8_e4m3fnuz,QuantType.per_Token,1,0,16,0,72.5315,moe_ck2stages_gemm1_256x16x128x256_1x4_MulABScale_v1_Nswizzle0_Quant2_MulRoutedWeight0_silu_F8_F8_B16,0.0%,52.4907,moe_ck2stages_gemm2_256x16x128x256_1x4_MulABScaleExpertWeight_v1_Nswizzle0_Quant2_MulRoutedWeight1_F8_F8_B16,1.3%,125.0222,0,6.34,11317.7,
80,16,7168,256,257,9,ActivationType.Silu,torch.bfloat16,torch.float8_e4m3fnuz,torch.float8_e4m3fnuz,QuantType.per_Token,1,0,16,0,122.8339,moe_ck2stages_gemm1_256x16x128x256_1x4_MulABScale_v1_Nswizzle0_Quant2_MulRoutedWeight0_silu_F8_F8_B16,0.0%,81.6731,moe_ck2stages_gemm2_256x16x128x256_1x4_MulABScaleExpertWeight_v1_Nswizzle0_Quant2_MulRoutedWeight1_F8_F8_B16,1.3%,204.507,0,7.75,6919.74,
80,32,7168,256,257,9,ActivationType.Silu,torch.bfloat16,torch.float8_e4m3fnuz,torch.float8_e4m3fnuz,QuantType.per_Token,1,0,16,0,201.5918,moe_ck2stages_gemm1_256x16x128x256_1x4_MulABScale_v1_Nswizzle0_Quant2_MulRoutedWeight0_silu_F8_F8_B16,7.5%,129.3064,moe_ck2stages_gemm2_256x16x128x256_1x4_MulABScaleExpertWeight_v1_Nswizzle0_Quant2_MulRoutedWeight1_F8_F8_B16,1.3%,330.8982,0,9.58,4277.69,
80,64,7168,256,257,9,ActivationType.Silu,torch.bfloat16,torch.float8_e4m3fnuz,torch.float8_e4m3fnuz,QuantType.per_Token,1,0,32,0,430.9915,_ZN5aiter45fmoe_bf16_pertokenFp8_g1u1_vs_silu_1tg_32x256E,0.0%,0.0,Null,0.0%,430.9915,1,14.71,3285.84,
80,128,7168,256,257,9,ActivationType.Silu,torch.bfloat16,torch.float8_e4m3fnuz,torch.float8_e4m3fnuz,QuantType.per_Token,1,0,16,0,285.6053,moe_ck2stages_gemm1_256x16x128x256_1x4_MulABScale_v1_Nswizzle0_Quant2_MulRoutedWeight0_silu_F8_F8_B16,3.7%,204.5325,moe_ck2stages_gemm2_256x16x128x256_1x4_MulABScaleExpertWeight_v1_Nswizzle0_Quant2_MulRoutedWeight1_F8_F8_B16,1.4%,490.1378,0,25.88,2892.13,
80,256,7168,256,257,9,ActivationType.Silu,torch.bfloat16,torch.float8_e4m3fnuz,torch.float8_e4m3fnuz,QuantType.per_Token,1,0,16,0,302.4733,moe_ck2stages_gemm1_256x16x128x256_1x4_MulABScale_v1_Nswizzle0_Quant2_MulRoutedWeight0_silu_F8_F8_B16,2.5%,221.0756,moe_ck2stages_gemm2_256x16x128x256_1x4_MulABScaleExpertWeight_v1_Nswizzle0_Quant2_MulRoutedWeight1_F8_F8_B16,1.4%,523.5489,0,48.45,2712.82,
80,1024,7168,256,257,9,ActivationType.Silu,torch.bfloat16,torch.float8_e4m3fnuz,torch.float8_e4m3fnuz,QuantType.per_Token,1,0,32,0,826.1396,_ZN5aiter45fmoe_bf16_pertokenFp8_g1u1_vs_silu_1tg_32x256E,0.0%,0.0,Null,0.0%,826.1396,1,122.82,1739.19,
80,2048,7168,256,257,9,ActivationType.Silu,torch.bfloat16,torch.float8_e4m3fnuz,torch.float8_e4m3fnuz,QuantType.per_Token,1,0,32,0,1278.9473,_ZN5aiter45fmoe_bf16_pertokenFp8_g1u1_vs_silu_1tg_32x256E,0.0%,0.0,Null,0.0%,1278.9473,1,158.68,1140.65,
80,4096,7168,256,257,9,ActivationType.Silu,torch.bfloat16,torch.float8_e4m3fnuz,torch.float8_e4m3fnuz,QuantType.per_Token,1,0,32,0,1278.9473,_ZN5aiter45fmoe_bf16_pertokenFp8_g1u1_vs_silu_1tg_32x256E,0.0%,0.0,Null,0.0%,1278.9473,1,158.68,1140.65,
80,8192,7168,256,257,9,ActivationType.Silu,torch.bfloat16,torch.float8_e4m3fnuz,torch.float8_e4m3fnuz,QuantType.per_Token,1,0,32,0,1278.9473,_ZN5aiter45fmoe_bf16_pertokenFp8_g1u1_vs_silu_1tg_32x256E,0.0%,0.0,Null,0.0%,1278.9473,1,158.68,1140.65,
80,16384,7168,256,257,9,ActivationType.Silu,torch.bfloat16,torch.float8_e4m3fnuz,torch.float8_e4m3fnuz,QuantType.per_Token,1,0,32,0,827.4898,_ZN5aiter48fmoe_bf16_pertokenFp8_g1u1_vs_silu_1tg_ps_32x256E,0.0%,0.0,Null,0.0%,827.4898,1,122.62,1736.35,
80,32768,7168,256,257,9,ActivationType.Silu,torch.bfloat16,torch.float8_e4m3fnuz,torch.float8_e4m3fnuz,QuantType.per_Token,1,0,32,0,827.4898,_ZN5aiter48fmoe_bf16_pertokenFp8_g1u1_vs_silu_1tg_ps_32x256E,0.0%,0.0,Null,0.0%,827.4898,1,122.62,1736.35,
80,2048,7168,512,256,8,ActivationType.Gelu,torch.bfloat16,torch.bfloat16,torch.bfloat16,QuantType.No,1,0,32,0,1545.4364,moe_ck2stages_gemm1_256x32x64x128_1x4_TypeCast_v1_Nswizzle0_Quant0_MulRoutedWeight0_gelu_B16_B16_B16,0.0%,1026.4073,moe_ck2stages_gemm2_256x32x64x64_1x4_TypeCastExpertWeight_v1_Nswizzle0_Quant0_MulRoutedWeight1_B16_B16_B16,3.3%,2571.8437000000004,0,70.14,2203.29,
80,4096,7168,512,256,8,ActivationType.Gelu,torch.bfloat16,torch.bfloat16,torch.bfloat16,QuantType.No,1,0,32,0,1545.4364,moe_ck2stages_gemm1_256x32x64x128_1x4_TypeCast_v1_Nswizzle0_Quant0_MulRoutedWeight0_gelu_B16_B16_B16,0.0%,1026.4073,moe_ck2stages_gemm2_256x32x64x64_1x4_TypeCastExpertWeight_v1_Nswizzle0_Quant0_MulRoutedWeight1_B16_B16_B16,3.3%,2571.8437000000004,0,70.14,2203.29,
80,8192,7168,512,256,8,ActivationType.Gelu,torch.bfloat16,torch.bfloat16,torch.bfloat16,QuantType.No,1,0,32,0,1545.4364,moe_ck2stages_gemm1_256x32x64x128_1x4_TypeCast_v1_Nswizzle0_Quant0_MulRoutedWeight0_gelu_B16_B16_B16,0.0%,1026.4073,moe_ck2stages_gemm2_256x32x64x64_1x4_TypeCastExpertWeight_v1_Nswizzle0_Quant0_MulRoutedWeight1_B16_B16_B16,3.3%,2571.8437000000004,0,70.14,2203.29,
80,16384,7168,512,256,8,ActivationType.Gelu,torch.bfloat16,torch.bfloat16,torch.bfloat16,QuantType.No,1,0,32,0,1545.4364,moe_ck2stages_gemm1_256x32x64x128_1x4_TypeCast_v1_Nswizzle0_Quant0_MulRoutedWeight0_gelu_B16_B16_B16,0.0%,1026.4073,moe_ck2stages_gemm2_256x32x64x64_1x4_TypeCastExpertWeight_v1_Nswizzle0_Quant0_MulRoutedWeight1_B16_B16_B16,3.3%,2571.8437000000004,0,70.14,2203.29,
80,32768,7168,512,256,8,ActivationType.Gelu,torch.bfloat16,torch.bfloat16,torch.bfloat16,QuantType.No,1,0,32,0,1545.4364,moe_ck2stages_gemm1_256x32x64x128_1x4_TypeCast_v1_Nswizzle0_Quant0_MulRoutedWeight0_gelu_B16_B16_B16,0.0%,1026.4073,moe_ck2stages_gemm2_256x32x64x64_1x4_TypeCastExpertWeight_v1_Nswizzle0_Quant0_MulRoutedWeight1_B16_B16_B16,3.3%,2571.8437000000004,0,70.14,2203.29,
80,2048,7168,512,256,8,ActivationType.Gelu,torch.bfloat16,torch.bfloat16,torch.bfloat16,QuantType.No,1,1,32,0,1551.7224,moe_ck2stages_gemm1_256x32x64x128_1x4_TypeCastExpertWeight_v1_Nswizzle0_Quant0_MulRoutedWeight1_gelu_B16_B16_B16,0.0%,998.809,moe_ck2stages_gemm2_256x32x64x64_1x4_TypeCast_v1_Nswizzle0_Quant0_MulRoutedWeight0_B16_B16_B16,0.0%,2550.5314,0,70.73,2221.7,
80,4096,7168,512,256,8,ActivationType.Gelu,torch.bfloat16,torch.bfloat16,torch.bfloat16,QuantType.No,1,1,32,0,1551.7224,moe_ck2stages_gemm1_256x32x64x128_1x4_TypeCastExpertWeight_v1_Nswizzle0_Quant0_MulRoutedWeight1_gelu_B16_B16_B16,0.0%,998.809,moe_ck2stages_gemm2_256x32x64x64_1x4_TypeCast_v1_Nswizzle0_Quant0_MulRoutedWeight0_B16_B16_B16,0.0%,2550.5314,0,70.73,2221.7,
80,8192,7168,512,256,8,ActivationType.Gelu,torch.bfloat16,torch.bfloat16,torch.bfloat16,QuantType.No,1,1,32,0,1551.7224,moe_ck2stages_gemm1_256x32x64x128_1x4_TypeCastExpertWeight_v1_Nswizzle0_Quant0_MulRoutedWeight1_gelu_B16_B16_B16,0.0%,998.809,moe_ck2stages_gemm2_256x32x64x64_1x4_TypeCast_v1_Nswizzle0_Quant0_MulRoutedWeight0_B16_B16_B16,0.0%,2550.5314,0,70.73,2221.7,
80,16384,7168,512,256,8,ActivationType.Gelu,torch.bfloat16,torch.bfloat16,torch.bfloat16,QuantType.No,1,1,32,0,1551.7224,moe_ck2stages_gemm1_256x32x64x128_1x4_TypeCastExpertWeight_v1_Nswizzle0_Quant0_MulRoutedWeight1_gelu_B16_B16_B16,0.0%,998.809,moe_ck2stages_gemm2_256x32x64x64_1x4_TypeCast_v1_Nswizzle0_Quant0_MulRoutedWeight0_B16_B16_B16,0.0%,2550.5314,0,70.73,2221.7,
80,32768,7168,512,256,8,ActivationType.Gelu,torch.bfloat16,torch.bfloat16,torch.bfloat16,QuantType.No,1,1,32,0,1551.7224,moe_ck2stages_gemm1_256x32x64x128_1x4_TypeCastExpertWeight_v1_Nswizzle0_Quant0_MulRoutedWeight1_gelu_B16_B16_B16,0.0%,998.809,moe_ck2stages_gemm2_256x32x64x64_1x4_TypeCast_v1_Nswizzle0_Quant0_MulRoutedWeight0_B16_B16_B16,0.0%,2550.5314,0,70.73,2221.7,
80,2048,7168,512,256,8,ActivationType.Gelu,torch.bfloat16,torch.float8_e4m3fnuz,torch.float8_e4m3fnuz,QuantType.per_1x128,1,0,16,0,1032.1656,moe_ck2stages_gemm1_256x16x128x256_1x4_MulABScaleExpertWeightA8W8blkscale_v1_Nswizzle0_Quant4_MulRoutedWeight0_gelu_F8_F8_B16,0.0%,839.6044,moe_ck2stages_gemm2_256x16x128x256_1x4_MulABScaleExpertWeightA8W8blkscale_v1_Nswizzle0_Quant4_MulRoutedWeight1_F8_F8_B16,15.6%,1871.77,0,96.37,1517.6,
80,4096,7168,512,256,8,ActivationType.Gelu,torch.bfloat16,torch.float8_e4m3fnuz,torch.float8_e4m3fnuz,QuantType.per_1x128,1,0,16,0,1032.1656,moe_ck2stages_gemm1_256x16x128x256_1x4_MulABScaleExpertWeightA8W8blkscale_v1_Nswizzle0_Quant4_MulRoutedWeight0_gelu_F8_F8_B16,0.0%,839.6044,moe_ck2stages_gemm2_256x16x128x256_1x4_MulABScaleExpertWeightA8W8blkscale_v1_Nswizzle0_Quant4_MulRoutedWeight1_F8_F8_B16,15.6%,1871.77,0,96.37,1517.6,
80,8192,7168,512,256,8,ActivationType.Gelu,torch.bfloat16,torch.float8_e4m3fnuz,torch.float8_e4m3fnuz,QuantType.per_1x128,1,0,16,0,1032.1656,moe_ck2stages_gemm1_256x16x128x256_1x4_MulABScaleExpertWeightA8W8blkscale_v1_Nswizzle0_Quant4_MulRoutedWeight0_gelu_F8_F8_B16,0.0%,839.6044,moe_ck2stages_gemm2_256x16x128x256_1x4_MulABScaleExpertWeightA8W8blkscale_v1_Nswizzle0_Quant4_MulRoutedWeight1_F8_F8_B16,15.6%,1871.77,0,96.37,1517.6,
80,16384,7168,512,256,8,ActivationType.Gelu,torch.bfloat16,torch.float8_e4m3fnuz,torch.float8_e4m3fnuz,QuantType.per_1x128,1,0,16,0,1032.1656,moe_ck2stages_gemm1_256x16x128x256_1x4_MulABScaleExpertWeightA8W8blkscale_v1_Nswizzle0_Quant4_MulRoutedWeight0_gelu_F8_F8_B16,0.0%,839.6044,moe_ck2stages_gemm2_256x16x128x256_1x4_MulABScaleExpertWeightA8W8blkscale_v1_Nswizzle0_Quant4_MulRoutedWeight1_F8_F8_B16,15.6%,1871.77,0,96.37,1517.6,
80,32768,7168,512,256,8,ActivationType.Gelu,torch.bfloat16,torch.float8_e4m3fnuz,torch.float8_e4m3fnuz,QuantType.per_1x128,1,0,16,0,1032.1656,moe_ck2stages_gemm1_256x16x128x256_1x4_MulABScaleExpertWeightA8W8blkscale_v1_Nswizzle0_Quant4_MulRoutedWeight0_gelu_F8_F8_B16,0.0%,839.6044,moe_ck2stages_gemm2_256x16x128x256_1x4_MulABScaleExpertWeightA8W8blkscale_v1_Nswizzle0_Quant4_MulRoutedWeight1_F8_F8_B16,15.6%,1871.77,0,96.37,1517.6,
80,2048,7168,512,256,8,ActivationType.Gelu,torch.bfloat16,torch.float8_e4m3fnuz,torch.float8_e4m3fnuz,QuantType.per_1x128,1,1,16,0,1040.5956,moe_ck2stages_gemm1_256x16x128x256_1x4_MulABScaleExpertWeightA8W8blkscale_v1_Nswizzle0_Quant4_MulRoutedWeight1_gelu_F8_F8_B16,0.0%,844.24,moe_ck2stages_gemm2_256x16x128x256_1x4_MulABScaleExpertWeightA8W8blkscale_v1_Nswizzle0_Quant4_MulRoutedWeight0_F8_F8_B16,16.7%,1884.8356,0,95.71,1507.08,
80,4096,7168,512,256,8,ActivationType.Gelu,torch.bfloat16,torch.float8_e4m3fnuz,torch.float8_e4m3fnuz,QuantType.per_1x128,1,1,16,0,1040.5956,moe_ck2stages_gemm1_256x16x128x256_1x4_MulABScaleExpertWeightA8W8blkscale_v1_Nswizzle0_Quant4_MulRoutedWeight1_gelu_F8_F8_B16,0.0%,844.24,moe_ck2stages_gemm2_256x16x128x256_1x4_MulABScaleExpertWeightA8W8blkscale_v1_Nswizzle0_Quant4_MulRoutedWeight0_F8_F8_B16,16.7%,1884.8356,0,95.71,1507.08,
80,8192,7168,512,256,8,ActivationType.Gelu,torch.bfloat16,torch.float8_e4m3fnuz,torch.float8_e4m3fnuz,QuantType.per_1x128,1,1,16,0,1040.5956,moe_ck2stages_gemm1_256x16x128x256_1x4_MulABScaleExpertWeightA8W8blkscale_v1_Nswizzle0_Quant4_MulRoutedWeight1_gelu_F8_F8_B16,0.0%,844.24,moe_ck2stages_gemm2_256x16x128x256_1x4_MulABScaleExpertWeightA8W8blkscale_v1_Nswizzle0_Quant4_MulRoutedWeight0_F8_F8_B16,16.7%,1884.8356,0,95.71,1507.08,
80,16384,7168,512,256,8,ActivationType.Gelu,torch.bfloat16,torch.float8_e4m3fnuz,torch.float8_e4m3fnuz,QuantType.per_1x128,1,1,16,0,1040.5956,moe_ck2stages_gemm1_256x16x128x256_1x4_MulABScaleExpertWeightA8W8blkscale_v1_Nswizzle0_Quant4_MulRoutedWeight1_gelu_F8_F8_B16,0.0%,844.24,moe_ck2stages_gemm2_256x16x128x256_1x4_MulABScaleExpertWeightA8W8blkscale_v1_Nswizzle0_Quant4_MulRoutedWeight0_F8_F8_B16,16.7%,1884.8356,0,95.71,1507.08,
80,32768,7168,512,256,8,ActivationType.Gelu,torch.bfloat16,torch.float8_e4m3fnuz,torch.float8_e4m3fnuz,QuantType.per_1x128,1,1,16,0,1040.5956,moe_ck2stages_gemm1_256x16x128x256_1x4_MulABScaleExpertWeightA8W8blkscale_v1_Nswizzle0_Quant4_MulRoutedWeight1_gelu_F8_F8_B16,0.0%,844.24,moe_ck2stages_gemm2_256x16x128x256_1x4_MulABScaleExpertWeightA8W8blkscale_v1_Nswizzle0_Quant4_MulRoutedWeight0_F8_F8_B16,16.7%,1884.8356,0,95.71,1507.08,
80,2048,7168,512,256,8,ActivationType.Gelu,torch.bfloat16,torch.float8_e4m3fnuz,torch.float8_e4m3fnuz,QuantType.per_Tensor,1,0,32,0,761.7135,_ZN5aiter44fmoe_stage1_bf16_pertokenFp8_g1u1_32x512_pf3E,0.0%,621.4747,moe_ck2stages_gemm2_256x32x64x128_1x4_MulABScaleExpertWeight_v1_Nswizzle0_Quant1_MulRoutedWeight1_F8_F8_B16,3.3%,1383.1882,0,130.42,2053.66,
80,4096,7168,512,256,8,ActivationType.Gelu,torch.bfloat16,torch.float8_e4m3fnuz,torch.float8_e4m3fnuz,QuantType.per_Tensor,1,0,32,0,761.7135,_ZN5aiter44fmoe_stage1_bf16_pertokenFp8_g1u1_32x512_pf3E,0.0%,621.4747,moe_ck2stages_gemm2_256x32x64x128_1x4_MulABScaleExpertWeight_v1_Nswizzle0_Quant1_MulRoutedWeight1_F8_F8_B16,3.3%,1383.1882,0,130.42,2053.66,
80,8192,7168,512,256,8,ActivationType.Gelu,torch.bfloat16,torch.float8_e4m3fnuz,torch.float8_e4m3fnuz,QuantType.per_Tensor,1,0,32,0,761.7135,_ZN5aiter44fmoe_stage1_bf16_pertokenFp8_g1u1_32x512_pf3E,0.0%,621.4747,moe_ck2stages_gemm2_256x32x64x128_1x4_MulABScaleExpertWeight_v1_Nswizzle0_Quant1_MulRoutedWeight1_F8_F8_B16,3.3%,1383.1882,0,130.42,2053.66,
80,16384,7168,512,256,8,ActivationType.Gelu,torch.bfloat16,torch.float8_e4m3fnuz,torch.float8_e4m3fnuz,QuantType.per_Tensor,1,0,32,0,761.7135,_ZN5aiter44fmoe_stage1_bf16_pertokenFp8_g1u1_32x512_pf3E,0.0%,621.4747,moe_ck2stages_gemm2_256x32x64x128_1x4_MulABScaleExpertWeight_v1_Nswizzle0_Quant1_MulRoutedWeight1_F8_F8_B16,3.3%,1383.1882,0,130.42,2053.66,
80,32768,7168,512,256,8,ActivationType.Gelu,torch.bfloat16,torch.float8_e4m3fnuz,torch.float8_e4m3fnuz,QuantType.per_Tensor,1,0,32,0,761.7135,_ZN5aiter44fmoe_stage1_bf16_pertokenFp8_g1u1_32x512_pf3E,0.0%,621.4747,moe_ck2stages_gemm2_256x32x64x128_1x4_MulABScaleExpertWeight_v1_Nswizzle0_Quant1_MulRoutedWeight1_F8_F8_B16,3.3%,1383.1882,0,130.42,2053.66,
80,2048,7168,512,256,8,ActivationType.Gelu,torch.bfloat16,torch.float8_e4m3fnuz,torch.float8_e4m3fnuz,QuantType.per_Tensor,1,1,32,0,759.5362,_ZN5aiter53fmoe_stage1_bf16_pertokenFp8_doweight_g1u1_32x512_pf3E,0.0%,596.1779,moe_ck2stages_gemm2_256x32x64x128_1x4_MulABScaleExpertWeight_v1_Nswizzle0_Quant1_MulRoutedWeight0_F8_F8_B16,0.0%,1355.7141,0,133.06,2095.27,
80,4096,7168,512,256,8,ActivationType.Gelu,torch.bfloat16,torch.float8_e4m3fnuz,torch.float8_e4m3fnuz,QuantType.per_Tensor,1,1,32,0,759.5362,_ZN5aiter53fmoe_stage1_bf16_pertokenFp8_doweight_g1u1_32x512_pf3E,0.0%,596.1779,moe_ck2stages_gemm2_256x32x64x128_1x4_MulABScaleExpertWeight_v1_Nswizzle0_Quant1_MulRoutedWeight0_F8_F8_B16,0.0%,1355.7141,0,133.06,2095.27,
80,8192,7168,512,256,8,ActivationType.Gelu,torch.bfloat16,torch.float8_e4m3fnuz,torch.float8_e4m3fnuz,QuantType.per_Tensor,1,1,32,0,759.5362,_ZN5aiter53fmoe_stage1_bf16_pertokenFp8_doweight_g1u1_32x512_pf3E,0.0%,596.1779,moe_ck2stages_gemm2_256x32x64x128_1x4_MulABScaleExpertWeight_v1_Nswizzle0_Quant1_MulRoutedWeight0_F8_F8_B16,0.0%,1355.7141,0,133.06,2095.27,
80,16384,7168,512,256,8,ActivationType.Gelu,torch.bfloat16,torch.float8_e4m3fnuz,torch.float8_e4m3fnuz,QuantType.per_Tensor,1,1,32,0,759.5362,_ZN5aiter53fmoe_stage1_bf16_pertokenFp8_doweight_g1u1_32x512_pf3E,0.0%,596.1779,moe_ck2stages_gemm2_256x32x64x128_1x4_MulABScaleExpertWeight_v1_Nswizzle0_Quant1_MulRoutedWeight0_F8_F8_B16,0.0%,1355.7141,0,133.06,2095.27,
80,32768,7168,512,256,8,ActivationType.Gelu,torch.bfloat16,torch.float8_e4m3fnuz,torch.float8_e4m3fnuz,QuantType.per_Tensor,1,1,32,0,759.5362,_ZN5aiter53fmoe_stage1_bf16_pertokenFp8_doweight_g1u1_32x512_pf3E,0.0%,596.1779,moe_ck2stages_gemm2_256x32x64x128_1x4_MulABScaleExpertWeight_v1_Nswizzle0_Quant1_MulRoutedWeight0_F8_F8_B16,0.0%,1355.7141,0,133.06,2095.27,
80,2048,7168,512,256,8,ActivationType.Gelu,torch.bfloat16,torch.float8_e4m3fnuz,torch.float8_e4m3fnuz,QuantType.per_Token,1,0,32,0,750.417,_ZN5aiter44fmoe_stage1_bf16_pertokenFp8_g1u1_32x512_pf3E,0.0%,717.4604,moe_ck2stages_gemm2_256x32x64x128_1x4_MulABScaleExpertWeight_v1_Nswizzle0_Quant2_MulRoutedWeight1_F8_F8_B16,3.3%,1467.8774,0,122.89,1935.17,
80,4096,7168,512,256,8,ActivationType.Gelu,torch.bfloat16,torch.float8_e4m3fnuz,torch.float8_e4m3fnuz,QuantType.per_Token,1,0,32,0,750.417,_ZN5aiter44fmoe_stage1_bf16_pertokenFp8_g1u1_32x512_pf3E,0.0%,717.4604,moe_ck2stages_gemm2_256x32x64x128_1x4_MulABScaleExpertWeight_v1_Nswizzle0_Quant2_MulRoutedWeight1_F8_F8_B16,3.3%,1467.8774,0,122.89,1935.17,
80,8192,7168,512,256,8,ActivationType.Gelu,torch.bfloat16,torch.float8_e4m3fnuz,torch.float8_e4m3fnuz,QuantType.per_Token,1,0,32,0,750.417,_ZN5aiter44fmoe_stage1_bf16_pertokenFp8_g1u1_32x512_pf3E,0.0%,717.4604,moe_ck2stages_gemm2_256x32x64x128_1x4_MulABScaleExpertWeight_v1_Nswizzle0_Quant2_MulRoutedWeight1_F8_F8_B16,3.3%,1467.8774,0,122.89,1935.17,
80,16384,7168,512,256,8,ActivationType.Gelu,torch.bfloat16,torch.float8_e4m3fnuz,torch.float8_e4m3fnuz,QuantType.per_Token,1,0,32,0,750.417,_ZN5aiter44fmoe_stage1_bf16_pertokenFp8_g1u1_32x512_pf3E,0.0%,717.4604,moe_ck2stages_gemm2_256x32x64x128_1x4_MulABScaleExpertWeight_v1_Nswizzle0_Quant2_MulRoutedWeight1_F8_F8_B16,3.3%,1467.8774,0,122.89,1935.17,
80,32768,7168,512,256,8,ActivationType.Gelu,torch.bfloat16,torch.float8_e4m3fnuz,torch.float8_e4m3fnuz,QuantType.per_Token,1,0,32,0,750.417,_ZN5aiter44fmoe_stage1_bf16_pertokenFp8_g1u1_32x512_pf3E,0.0%,717.4604,moe_ck2stages_gemm2_256x32x64x128_1x4_MulABScaleExpertWeight_v1_Nswizzle0_Quant2_MulRoutedWeight1_F8_F8_B16,3.3%,1467.8774,0,122.89,1935.17,
80,2048,7168,512,256,8,ActivationType.Gelu,torch.bfloat16,torch.float8_e4m3fnuz,torch.float8_e4m3fnuz,QuantType.per_Token,1,1,32,0,749.1329,_ZN5aiter53fmoe_stage1_bf16_pertokenFp8_doweight_g1u1_32x512_pf3E,0.0%,695.2144,moe_ck2stages_gemm2_256x32x64x128_1x4_MulABScaleExpertWeight_v1_Nswizzle0_Quant2_MulRoutedWeight0_F8_F8_B16,0.0%,1444.3473,0,124.89,1966.7,
80,4096,7168,512,256,8,ActivationType.Gelu,torch.bfloat16,torch.float8_e4m3fnuz,torch.float8_e4m3fnuz,QuantType.per_Token,1,1,32,0,749.1329,_ZN5aiter53fmoe_stage1_bf16_pertokenFp8_doweight_g1u1_32x512_pf3E,0.0%,695.2144,moe_ck2stages_gemm2_256x32x64x128_1x4_MulABScaleExpertWeight_v1_Nswizzle0_Quant2_MulRoutedWeight0_F8_F8_B16,0.0%,1444.3473,0,124.89,1966.7,
80,8192,7168,512,256,8,ActivationType.Gelu,torch.bfloat16,torch.float8_e4m3fnuz,torch.float8_e4m3fnuz,QuantType.per_Token,1,1,32,0,749.1329,_ZN5aiter53fmoe_stage1_bf16_pertokenFp8_doweight_g1u1_32x512_pf3E,0.0%,695.2144,moe_ck2stages_gemm2_256x32x64x128_1x4_MulABScaleExpertWeight_v1_Nswizzle0_Quant2_MulRoutedWeight0_F8_F8_B16,0.0%,1444.3473,0,124.89,1966.7,
80,16384,7168,512,256,8,ActivationType.Gelu,torch.bfloat16,torch.float8_e4m3fnuz,torch.float8_e4m3fnuz,QuantType.per_Token,1,1,32,0,749.1329,_ZN5aiter53fmoe_stage1_bf16_pertokenFp8_doweight_g1u1_32x512_pf3E,0.0%,695.2144,moe_ck2stages_gemm2_256x32x64x128_1x4_MulABScaleExpertWeight_v1_Nswizzle0_Quant2_MulRoutedWeight0_F8_F8_B16,0.0%,1444.3473,0,124.89,1966.7,
80,32768,7168,512,256,8,ActivationType.Gelu,torch.bfloat16,torch.float8_e4m3fnuz,torch.float8_e4m3fnuz,QuantType.per_Token,1,1,32,0,749.1329,_ZN5aiter53fmoe_stage1_bf16_pertokenFp8_doweight_g1u1_32x512_pf3E,0.0%,695.2144,moe_ck2stages_gemm2_256x32x64x128_1x4_MulABScaleExpertWeight_v1_Nswizzle0_Quant2_MulRoutedWeight0_F8_F8_B16,0.0%,1444.3473,0,124.89,1966.7,
80,2048,7168,512,256,8,ActivationType.Silu,torch.bfloat16,torch.bfloat16,torch.bfloat16,QuantType.No,1,0,32,0,1545.4564,moe_ck2stages_gemm1_256x32x64x128_1x4_TypeCast_v1_Nswizzle0_Quant0_MulRoutedWeight0_silu_B16_B16_B16,0.0%,1031.1042,moe_ck2stages_gemm2_256x32x64x64_1x4_TypeCastExpertWeight_v1_Nswizzle0_Quant0_MulRoutedWeight1_B16_B16_B16,2.8%,2576.5606,0,70.01,2199.25,
80,4096,7168,512,256,8,ActivationType.Silu,torch.bfloat16,torch.bfloat16,torch.bfloat16,QuantType.No,1,0,32,0,1545.4564,moe_ck2stages_gemm1_256x32x64x128_1x4_TypeCast_v1_Nswizzle0_Quant0_MulRoutedWeight0_silu_B16_B16_B16,0.0%,1031.1042,moe_ck2stages_gemm2_256x32x64x64_1x4_TypeCastExpertWeight_v1_Nswizzle0_Quant0_MulRoutedWeight1_B16_B16_B16,2.8%,2576.5606,0,70.01,2199.25,
80,8192,7168,512,256,8,ActivationType.Silu,torch.bfloat16,torch.bfloat16,torch.bfloat16,QuantType.No,1,0,32,0,1545.4564,moe_ck2stages_gemm1_256x32x64x128_1x4_TypeCast_v1_Nswizzle0_Quant0_MulRoutedWeight0_silu_B16_B16_B16,0.0%,1031.1042,moe_ck2stages_gemm2_256x32x64x64_1x4_TypeCastExpertWeight_v1_Nswizzle0_Quant0_MulRoutedWeight1_B16_B16_B16,2.8%,2576.5606,0,70.01,2199.25,
80,16384,7168,512,256,8,ActivationType.Silu,torch.bfloat16,torch.bfloat16,torch.bfloat16,QuantType.No,1,0,32,0,1545.4564,moe_ck2stages_gemm1_256x32x64x128_1x4_TypeCast_v1_Nswizzle0_Quant0_MulRoutedWeight0_silu_B16_B16_B16,0.0%,1031.1042,moe_ck2stages_gemm2_256x32x64x64_1x4_TypeCastExpertWeight_v1_Nswizzle0_Quant0_MulRoutedWeight1_B16_B16_B16,2.8%,2576.5606,0,70.01,2199.25,
80,32768,7168,512,256,8,ActivationType.Silu,torch.bfloat16,torch.bfloat16,torch.bfloat16,QuantType.No,1,0,32,0,1545.4564,moe_ck2stages_gemm1_256x32x64x128_1x4_TypeCast_v1_Nswizzle0_Quant0_MulRoutedWeight0_silu_B16_B16_B16,0.0%,1031.1042,moe_ck2stages_gemm2_256x32x64x64_1x4_TypeCastExpertWeight_v1_Nswizzle0_Quant0_MulRoutedWeight1_B16_B16_B16,2.8%,2576.5606,0,70.01,2199.25,
80,2048,7168,512,256,8,ActivationType.Silu,torch.bfloat16,torch.bfloat16,torch.bfloat16,QuantType.No,1,1,32,0,1538.2556,moe_ck2stages_gemm1_256x32x64x128_1x4_TypeCastExpertWeight_v1_Nswizzle0_Quant0_MulRoutedWeight1_silu_B16_B16_B16,0.0%,1005.4051,moe_ck2stages_gemm2_256x32x64x64_1x4_TypeCast_v1_Nswizzle0_Quant0_MulRoutedWeight0_B16_B16_B16,0.0%,2543.6607,0,70.92,2227.7,
80,4096,7168,512,256,8,ActivationType.Silu,torch.bfloat16,torch.bfloat16,torch.bfloat16,QuantType.No,1,1,32,0,1538.2556,moe_ck2stages_gemm1_256x32x64x128_1x4_TypeCastExpertWeight_v1_Nswizzle0_Quant0_MulRoutedWeight1_silu_B16_B16_B16,0.0%,1005.4051,moe_ck2stages_gemm2_256x32x64x64_1x4_TypeCast_v1_Nswizzle0_Quant0_MulRoutedWeight0_B16_B16_B16,0.0%,2543.6607,0,70.92,2227.7,
80,8192,7168,512,256,8,ActivationType.Silu,torch.bfloat16,torch.bfloat16,torch.bfloat16,QuantType.No,1,1,32,0,1538.2556,moe_ck2stages_gemm1_256x32x64x128_1x4_TypeCastExpertWeight_v1_Nswizzle0_Quant0_MulRoutedWeight1_silu_B16_B16_B16,0.0%,1005.4051,moe_ck2stages_gemm2_256x32x64x64_1x4_TypeCast_v1_Nswizzle0_Quant0_MulRoutedWeight0_B16_B16_B16,0.0%,2543.6607,0,70.92,2227.7,
80,16384,7168,512,256,8,ActivationType.Silu,torch.bfloat16,torch.bfloat16,torch.bfloat16,QuantType.No,1,1,32,0,1538.2556,moe_ck2stages_gemm1_256x32x64x128_1x4_TypeCastExpertWeight_v1_Nswizzle0_Quant0_MulRoutedWeight1_silu_B16_B16_B16,0.0%,1005.4051,moe_ck2stages_gemm2_256x32x64x64_1x4_TypeCast_v1_Nswizzle0_Quant0_MulRoutedWeight0_B16_B16_B16,0.0%,2543.6607,0,70.92,2227.7,
80,32768,7168,512,256,8,ActivationType.Silu,torch.bfloat16,torch.bfloat16,torch.bfloat16,QuantType.No,1,1,32,0,1538.2556,moe_ck2stages_gemm1_256x32x64x128_1x4_TypeCastExpertWeight_v1_Nswizzle0_Quant0_MulRoutedWeight1_silu_B16_B16_B16,0.0%,1005.4051,moe_ck2stages_gemm2_256x32x64x64_1x4_TypeCast_v1_Nswizzle0_Quant0_MulRoutedWeight0_B16_B16_B16,0.0%,2543.6607,0,70.92,2227.7,
80,2048,7168,512,256,8,ActivationType.Silu,torch.bfloat16,torch.float8_e4m3fnuz,torch.float8_e4m3fnuz,QuantType.per_1x128,1,0,16,0,1027.6111,moe_ck2stages_gemm1_256x16x128x256_1x4_MulABScaleExpertWeightA8W8blkscale_v1_Nswizzle0_Quant4_MulRoutedWeight0_silu_F8_F8_B16,0.0%,841.9358,moe_ck2stages_gemm2_256x16x128x256_1x4_MulABScaleExpertWeightA8W8blkscale_v1_Nswizzle0_Quant4_MulRoutedWeight1_F8_F8_B16,15.6%,1869.5469,0,96.49,1519.4,
80,4096,7168,512,256,8,ActivationType.Silu,torch.bfloat16,torch.float8_e4m3fnuz,torch.float8_e4m3fnuz,QuantType.per_1x128,1,0,16,0,1027.6111,moe_ck2stages_gemm1_256x16x128x256_1x4_MulABScaleExpertWeightA8W8blkscale_v1_Nswizzle0_Quant4_MulRoutedWeight0_silu_F8_F8_B16,0.0%,841.9358,moe_ck2stages_gemm2_256x16x128x256_1x4_MulABScaleExpertWeightA8W8blkscale_v1_Nswizzle0_Quant4_MulRoutedWeight1_F8_F8_B16,15.6%,1869.5469,0,96.49,1519.4,
80,8192,7168,512,256,8,ActivationType.Silu,torch.bfloat16,torch.float8_e4m3fnuz,torch.float8_e4m3fnuz,QuantType.per_1x128,1,0,16,0,1027.6111,moe_ck2stages_gemm1_256x16x128x256_1x4_MulABScaleExpertWeightA8W8blkscale_v1_Nswizzle0_Quant4_MulRoutedWeight0_silu_F8_F8_B16,0.0%,841.9358,moe_ck2stages_gemm2_256x16x128x256_1x4_MulABScaleExpertWeightA8W8blkscale_v1_Nswizzle0_Quant4_MulRoutedWeight1_F8_F8_B16,15.6%,1869.5469,0,96.49,1519.4,
80,16384,7168,512,256,8,ActivationType.Silu,torch.bfloat16,torch.float8_e4m3fnuz,torch.float8_e4m3fnuz,QuantType.per_1x128,1,0,16,0,1027.6111,moe_ck2stages_gemm1_256x16x128x256_1x4_MulABScaleExpertWeightA8W8blkscale_v1_Nswizzle0_Quant4_MulRoutedWeight0_silu_F8_F8_B16,0.0%,841.9358,moe_ck2stages_gemm2_256x16x128x256_1x4_MulABScaleExpertWeightA8W8blkscale_v1_Nswizzle0_Quant4_MulRoutedWeight1_F8_F8_B16,15.6%,1869.5469,0,96.49,1519.4,
80,32768,7168,512,256,8,ActivationType.Silu,torch.bfloat16,torch.float8_e4m3fnuz,torch.float8_e4m3fnuz,QuantType.per_1x128,1,0,16,0,1027.6111,moe_ck2stages_gemm1_256x16x128x256_1x4_MulABScaleExpertWeightA8W8blkscale_v1_Nswizzle0_Quant4_MulRoutedWeight0_silu_F8_F8_B16,0.0%,841.9358,moe_ck2stages_gemm2_256x16x128x256_1x4_MulABScaleExpertWeightA8W8blkscale_v1_Nswizzle0_Quant4_MulRoutedWeight1_F8_F8_B16,15.6%,1869.5469,0,96.49,1519.4,
80,2048,7168,512,256,8,ActivationType.Silu,torch.bfloat16,torch.float8_e4m3fnuz,torch.float8_e4m3fnuz,QuantType.per_1x128,1,1,16,0,1059.0782,moe_ck2stages_gemm1_256x16x128x256_1x4_MulABScaleExpertWeightA8W8blkscale_v1_Nswizzle0_Quant4_MulRoutedWeight1_silu_F8_F8_B16,0.0%,841.9574,moe_ck2stages_gemm2_256x16x128x256_1x4_MulABScaleExpertWeightA8W8blkscale_v1_Nswizzle0_Quant4_MulRoutedWeight0_F8_F8_B16,16.7%,1901.0356,0,94.89,1494.23,
80,4096,7168,512,256,8,ActivationType.Silu,torch.bfloat16,torch.float8_e4m3fnuz,torch.float8_e4m3fnuz,QuantType.per_1x128,1,1,16,0,1059.0782,moe_ck2stages_gemm1_256x16x128x256_1x4_MulABScaleExpertWeightA8W8blkscale_v1_Nswizzle0_Quant4_MulRoutedWeight1_silu_F8_F8_B16,0.0%,841.9574,moe_ck2stages_gemm2_256x16x128x256_1x4_MulABScaleExpertWeightA8W8blkscale_v1_Nswizzle0_Quant4_MulRoutedWeight0_F8_F8_B16,16.7%,1901.0356,0,94.89,1494.23,
80,8192,7168,512,256,8,ActivationType.Silu,torch.bfloat16,torch.float8_e4m3fnuz,torch.float8_e4m3fnuz,QuantType.per_1x128,1,1,16,0,1059.0782,moe_ck2stages_gemm1_256x16x128x256_1x4_MulABScaleExpertWeightA8W8blkscale_v1_Nswizzle0_Quant4_MulRoutedWeight1_silu_F8_F8_B16,0.0%,841.9574,moe_ck2stages_gemm2_256x16x128x256_1x4_MulABScaleExpertWeightA8W8blkscale_v1_Nswizzle0_Quant4_MulRoutedWeight0_F8_F8_B16,16.7%,1901.0356,0,94.89,1494.23,
80,16384,7168,512,256,8,ActivationType.Silu,torch.bfloat16,torch.float8_e4m3fnuz,torch.float8_e4m3fnuz,QuantType.per_1x128,1,1,16,0,1059.0782,moe_ck2stages_gemm1_256x16x128x256_1x4_MulABScaleExpertWeightA8W8blkscale_v1_Nswizzle0_Quant4_MulRoutedWeight1_silu_F8_F8_B16,0.0%,841.9574,moe_ck2stages_gemm2_256x16x128x256_1x4_MulABScaleExpertWeightA8W8blkscale_v1_Nswizzle0_Quant4_MulRoutedWeight0_F8_F8_B16,16.7%,1901.0356,0,94.89,1494.23,
80,32768,7168,512,256,8,ActivationType.Silu,torch.bfloat16,torch.float8_e4m3fnuz,torch.float8_e4m3fnuz,QuantType.per_1x128,1,1,16,0,1059.0782,moe_ck2stages_gemm1_256x16x128x256_1x4_MulABScaleExpertWeightA8W8blkscale_v1_Nswizzle0_Quant4_MulRoutedWeight1_silu_F8_F8_B16,0.0%,841.9574,moe_ck2stages_gemm2_256x16x128x256_1x4_MulABScaleExpertWeightA8W8blkscale_v1_Nswizzle0_Quant4_MulRoutedWeight0_F8_F8_B16,16.7%,1901.0356,0,94.89,1494.23,
80,2048,7168,512,256,8,ActivationType.Silu,torch.bfloat16,torch.float8_e4m3fnuz,torch.float8_e4m3fnuz,QuantType.per_Tensor,1,0,32,0,762.665,_ZN5aiter44fmoe_stage1_bf16_pertokenFp8_g1u1_32x512_pf3E,0.0%,620.1682,moe_ck2stages_gemm2_256x32x64x128_1x4_MulABScaleExpertWeight_v1_Nswizzle0_Quant1_MulRoutedWeight1_F8_F8_B16,2.8%,1382.8332,0,130.45,2054.18,
80,4096,7168,512,256,8,ActivationType.Silu,torch.bfloat16,torch.float8_e4m3fnuz,torch.float8_e4m3fnuz,QuantType.per_Tensor,1,0,32,0,762.665,_ZN5aiter44fmoe_stage1_bf16_pertokenFp8_g1u1_32x512_pf3E,0.0%,620.1682,moe_ck2stages_gemm2_256x32x64x128_1x4_MulABScaleExpertWeight_v1_Nswizzle0_Quant1_MulRoutedWeight1_F8_F8_B16,2.8%,1382.8332,0,130.45,2054.18,
80,8192,7168,512,256,8,ActivationType.Silu,torch.bfloat16,torch.float8_e4m3fnuz,torch.float8_e4m3fnuz,QuantType.per_Tensor,1,0,32,0,762.665,_ZN5aiter44fmoe_stage1_bf16_pertokenFp8_g1u1_32x512_pf3E,0.0%,620.1682,moe_ck2stages_gemm2_256x32x64x128_1x4_MulABScaleExpertWeight_v1_Nswizzle0_Quant1_MulRoutedWeight1_F8_F8_B16,2.8%,1382.8332,0,130.45,2054.18,
80,16384,7168,512,256,8,ActivationType.Silu,torch.bfloat16,torch.float8_e4m3fnuz,torch.float8_e4m3fnuz,QuantType.per_Tensor,1,0,32,0,762.665,_ZN5aiter44fmoe_stage1_bf16_pertokenFp8_g1u1_32x512_pf3E,0.0%,620.1682,moe_ck2stages_gemm2_256x32x64x128_1x4_MulABScaleExpertWeight_v1_Nswizzle0_Quant1_MulRoutedWeight1_F8_F8_B16,2.8%,1382.8332,0,130.45,2054.18,
80,32768,7168,512,256,8,ActivationType.Silu,torch.bfloat16,torch.float8_e4m3fnuz,torch.float8_e4m3fnuz,QuantType.per_Tensor,1,0,32,0,762.665,_ZN5aiter44fmoe_stage1_bf16_pertokenFp8_g1u1_32x512_pf3E,0.0%,620.1682,moe_ck2stages_gemm2_256x32x64x128_1x4_MulABScaleExpertWeight_v1_Nswizzle0_Quant1_MulRoutedWeight1_F8_F8_B16,2.8%,1382.8332,0,130.45,2054.18,
80,2048,7168,512,256,8,ActivationType.Silu,torch.bfloat16,torch.float8_e4m3fnuz,torch.float8_e4m3fnuz,QuantType.per_Tensor,1,1,32,0,763.616,_ZN5aiter53fmoe_stage1_bf16_pertokenFp8_doweight_g1u1_32x512_pf3E,0.0%,611.4583,moe_ck2stages_gemm2_256x32x64x128_1x4_MulABScaleExpertWeight_v1_Nswizzle0_Quant1_MulRoutedWeight0_F8_F8_B16,0.0%,1375.0743,0,131.18,2065.77,
80,4096,7168,512,256,8,ActivationType.Silu,torch.bfloat16,torch.float8_e4m3fnuz,torch.float8_e4m3fnuz,QuantType.per_Tensor,1,1,32,0,763.616,_ZN5aiter53fmoe_stage1_bf16_pertokenFp8_doweight_g1u1_32x512_pf3E,0.0%,611.4583,moe_ck2stages_gemm2_256x32x64x128_1x4_MulABScaleExpertWeight_v1_Nswizzle0_Quant1_MulRoutedWeight0_F8_F8_B16,0.0%,1375.0743,0,131.18,2065.77,
80,8192,7168,512,256,8,ActivationType.Silu,torch.bfloat16,torch.float8_e4m3fnuz,torch.float8_e4m3fnuz,QuantType.per_Tensor,1,1,32,0,763.616,_ZN5aiter53fmoe_stage1_bf16_pertokenFp8_doweight_g1u1_32x512_pf3E,0.0%,611.4583,moe_ck2stages_gemm2_256x32x64x128_1x4_MulABScaleExpertWeight_v1_Nswizzle0_Quant1_MulRoutedWeight0_F8_F8_B16,0.0%,1375.0743,0,131.18,2065.77,
80,16384,7168,512,256,8,ActivationType.Silu,torch.bfloat16,torch.float8_e4m3fnuz,torch.float8_e4m3fnuz,QuantType.per_Tensor,1,1,32,0,763.616,_ZN5aiter53fmoe_stage1_bf16_pertokenFp8_doweight_g1u1_32x512_pf3E,0.0%,611.4583,moe_ck2stages_gemm2_256x32x64x128_1x4_MulABScaleExpertWeight_v1_Nswizzle0_Quant1_MulRoutedWeight0_F8_F8_B16,0.0%,1375.0743,0,131.18,2065.77,
80,32768,7168,512,256,8,ActivationType.Silu,torch.bfloat16,torch.float8_e4m3fnuz,torch.float8_e4m3fnuz,QuantType.per_Tensor,1,1,32,0,763.616,_ZN5aiter53fmoe_stage1_bf16_pertokenFp8_doweight_g1u1_32x512_pf3E,0.0%,611.4583,moe_ck2stages_gemm2_256x32x64x128_1x4_MulABScaleExpertWeight_v1_Nswizzle0_Quant1_MulRoutedWeight0_F8_F8_B16,0.0%,1375.0743,0,131.18,2065.77,
80,2048,7168,512,256,8,ActivationType.Silu,torch.bfloat16,torch.float8_e4m3fnuz,torch.float8_e4m3fnuz,QuantType.per_Token,1,0,32,0,750.5786,_ZN5aiter44fmoe_stage1_bf16_pertokenFp8_g1u1_32x512_pf3E,0.0%,718.1941,moe_ck2stages_gemm2_256x32x64x128_1x4_MulABScaleExpertWeight_v1_Nswizzle0_Quant2_MulRoutedWeight1_F8_F8_B16,2.8%,1468.7727,0,122.82,1933.99,
80,4096,7168,512,256,8,ActivationType.Silu,torch.bfloat16,torch.float8_e4m3fnuz,torch.float8_e4m3fnuz,QuantType.per_Token,1,0,32,0,750.5786,_ZN5aiter44fmoe_stage1_bf16_pertokenFp8_g1u1_32x512_pf3E,0.0%,718.1941,moe_ck2stages_gemm2_256x32x64x128_1x4_MulABScaleExpertWeight_v1_Nswizzle0_Quant2_MulRoutedWeight1_F8_F8_B16,2.8%,1468.7727,0,122.82,1933.99,
80,8192,7168,512,256,8,ActivationType.Silu,torch.bfloat16,torch.float8_e4m3fnuz,torch.float8_e4m3fnuz,QuantType.per_Token,1,0,32,0,750.5786,_ZN5aiter44fmoe_stage1_bf16_pertokenFp8_g1u1_32x512_pf3E,0.0%,718.1941,moe_ck2stages_gemm2_256x32x64x128_1x4_MulABScaleExpertWeight_v1_Nswizzle0_Quant2_MulRoutedWeight1_F8_F8_B16,2.8%,1468.7727,0,122.82,1933.99,
80,16384,7168,512,256,8,ActivationType.Silu,torch.bfloat16,torch.float8_e4m3fnuz,torch.float8_e4m3fnuz,QuantType.per_Token,1,0,32,0,750.5786,_ZN5aiter44fmoe_stage1_bf16_pertokenFp8_g1u1_32x512_pf3E,0.0%,718.1941,moe_ck2stages_gemm2_256x32x64x128_1x4_MulABScaleExpertWeight_v1_Nswizzle0_Quant2_MulRoutedWeight1_F8_F8_B16,2.8%,1468.7727,0,122.82,1933.99,
80,32768,7168,512,256,8,ActivationType.Silu,torch.bfloat16,torch.float8_e4m3fnuz,torch.float8_e4m3fnuz,QuantType.per_Token,1,0,32,0,750.5786,_ZN5aiter44fmoe_stage1_bf16_pertokenFp8_g1u1_32x512_pf3E,0.0%,718.1941,moe_ck2stages_gemm2_256x32x64x128_1x4_MulABScaleExpertWeight_v1_Nswizzle0_Quant2_MulRoutedWeight1_F8_F8_B16,2.8%,1468.7727,0,122.82,1933.99,
80,2048,7168,512,256,8,ActivationType.Silu,torch.bfloat16,torch.float8_e4m3fnuz,torch.float8_e4m3fnuz,QuantType.per_Token,1,1,32,0,752.5409,_ZN5aiter53fmoe_stage1_bf16_pertokenFp8_doweight_g1u1_32x512_pf3E,0.0%,695.4453,moe_ck2stages_gemm2_256x32x64x128_1x4_MulABScaleExpertWeight_v1_Nswizzle0_Quant2_MulRoutedWeight0_F8_F8_B16,0.0%,1447.9861999999998,0,124.58,1961.75,
80,4096,7168,512,256,8,ActivationType.Silu,torch.bfloat16,torch.float8_e4m3fnuz,torch.float8_e4m3fnuz,QuantType.per_Token,1,1,32,0,752.5409,_ZN5aiter53fmoe_stage1_bf16_pertokenFp8_doweight_g1u1_32x512_pf3E,0.0%,695.4453,moe_ck2stages_gemm2_256x32x64x128_1x4_MulABScaleExpertWeight_v1_Nswizzle0_Quant2_MulRoutedWeight0_F8_F8_B16,0.0%,1447.9861999999998,0,124.58,1961.75,
80,8192,7168,512,256,8,ActivationType.Silu,torch.bfloat16,torch.float8_e4m3fnuz,torch.float8_e4m3fnuz,QuantType.per_Token,1,1,32,0,752.5409,_ZN5aiter53fmoe_stage1_bf16_pertokenFp8_doweight_g1u1_32x512_pf3E,0.0%,695.4453,moe_ck2stages_gemm2_256x32x64x128_1x4_MulABScaleExpertWeight_v1_Nswizzle0_Quant2_MulRoutedWeight0_F8_F8_B16,0.0%,1447.9861999999998,0,124.58,1961.75,
80,16384,7168,512,256,8,ActivationType.Silu,torch.bfloat16,torch.float8_e4m3fnuz,torch.float8_e4m3fnuz,QuantType.per_Token,1,1,32,0,752.5409,_ZN5aiter53fmoe_stage1_bf16_pertokenFp8_doweight_g1u1_32x512_pf3E,0.0%,695.4453,moe_ck2stages_gemm2_256x32x64x128_1x4_MulABScaleExpertWeight_v1_Nswizzle0_Quant2_MulRoutedWeight0_F8_F8_B16,0.0%,1447.9861999999998,0,124.58,1961.75,
80,32768,7168,512,256,8,ActivationType.Silu,torch.bfloat16,torch.float8_e4m3fnuz,torch.float8_e4m3fnuz,QuantType.per_Token,1,1,32,0,752.5409,_ZN5aiter53fmoe_stage1_bf16_pertokenFp8_doweight_g1u1_32x512_pf3E,0.0%,695.4453,moe_ck2stages_gemm2_256x32x64x128_1x4_MulABScaleExpertWeight_v1_Nswizzle0_Quant2_MulRoutedWeight0_F8_F8_B16,0.0%,1447.9861999999998,0,124.58,1961.75,
80,2048,7168,2048,33,10,ActivationType.Silu,torch.bfloat16,torch.float8_e4m3fnuz,torch.float8_e4m3fnuz,QuantType.per_1x128,1,0,32,0,4205.8762,_ZN5aiter50fmoe_bf16_blockscaleFp8_g1u1_vs_silu_1tg_ps_32x256E,0.9%,0.0,Null,0.0%,4205.8762,1,214.45,350.78,
80,4096,7168,2048,33,10,ActivationType.Silu,torch.bfloat16,torch.float8_e4m3fnuz,torch.float8_e4m3fnuz,QuantType.per_1x128,1,0,32,0,4205.8762,_ZN5aiter50fmoe_bf16_blockscaleFp8_g1u1_vs_silu_1tg_ps_32x256E,0.9%,0.0,Null,0.0%,4205.8762,1,214.45,350.78,
80,8192,7168,2048,33,10,ActivationType.Silu,torch.bfloat16,torch.float8_e4m3fnuz,torch.float8_e4m3fnuz,QuantType.per_1x128,1,0,32,0,4205.8762,_ZN5aiter50fmoe_bf16_blockscaleFp8_g1u1_vs_silu_1tg_ps_32x256E,0.9%,0.0,Null,0.0%,4205.8762,1,214.45,350.78,
80,16384,7168,2048,33,10,ActivationType.Silu,torch.bfloat16,torch.float8_e4m3fnuz,torch.float8_e4m3fnuz,QuantType.per_1x128,1,0,32,0,4205.8762,_ZN5aiter50fmoe_bf16_blockscaleFp8_g1u1_vs_silu_1tg_ps_32x256E,0.9%,0.0,Null,0.0%,4205.8762,1,214.45,350.78,
80,32768,7168,2048,33,10,ActivationType.Silu,torch.bfloat16,torch.float8_e4m3fnuz,torch.float8_e4m3fnuz,QuantType.per_1x128,1,0,32,0,4205.8762,_ZN5aiter50fmoe_bf16_blockscaleFp8_g1u1_vs_silu_1tg_ps_32x256E,0.9%,0.0,Null,0.0%,4205.8762,1,214.45,350.78,
80,2048,7168,2048,33,10,ActivationType.Silu,torch.bfloat16,torch.float8_e4m3fnuz,torch.float8_e4m3fnuz,QuantType.per_Token,1,0,32,0,3226.5114,_ZN5aiter45fmoe_bf16_pertokenFp8_g1u1_vs_silu_1tg_32x512E,5.3%,0.0,Null,0.0%,3226.5114,1,279.54,457.26,
80,4096,7168,2048,33,10,ActivationType.Silu,torch.bfloat16,torch.float8_e4m3fnuz,torch.float8_e4m3fnuz,QuantType.per_Token,1,0,32,0,3226.5114,_ZN5aiter45fmoe_bf16_pertokenFp8_g1u1_vs_silu_1tg_32x512E,5.3%,0.0,Null,0.0%,3226.5114,1,279.54,457.26,
80,8192,7168,2048,33,10,ActivationType.Silu,torch.bfloat16,torch.float8_e4m3fnuz,torch.float8_e4m3fnuz,QuantType.per_Token,1,0,32,0,3226.5114,_ZN5aiter45fmoe_bf16_pertokenFp8_g1u1_vs_silu_1tg_32x512E,5.3%,0.0,Null,0.0%,3226.5114,1,279.54,457.26,
80,16384,7168,2048,33,10,ActivationType.Silu,torch.bfloat16,torch.float8_e4m3fnuz,torch.float8_e4m3fnuz,QuantType.per_Token,1,0,32,0,3226.5114,_ZN5aiter48fmoe_bf16_pertokenFp8_g1u1_vs_silu_1tg_ps_32x512E,5.3%,0.0,Null,0.0%,3226.5114,1,279.54,457.26,
80,32768,7168,2048,33,10,ActivationType.Silu,torch.bfloat16,torch.float8_e4m3fnuz,torch.float8_e4m3fnuz,QuantType.per_Token,1,0,32,0,3226.5114,_ZN5aiter48fmoe_bf16_pertokenFp8_g1u1_vs_silu_1tg_ps_32x512E,5.3%,0.0,Null,0.0%,3226.5114,1,279.54,457.26,
256,4096,4096,384,128,8,ActivationType.Silu,torch.bfloat16,torch.float8_e4m3fn,torch.float8_e4m3fn,QuantType.per_1x128,1,0,64,0,124.3946,moe_ck2stages_gemm1_256x64x128x128_1x4_MulABScaleExpertWeightA8W8blkscale_v3_Nswizzle0_Quant4_MulRoutedWeight0_silu_F8_F8_B16,0.1%,473.4248,moe_ck2stages_gemm2_256x64x128x128_1x4_MulABScaleExpertWeightA8W8blkscale_v3_Nswizzle0_Quant4_MulRoutedWeight1_F8_F8_B16,15.5%,597.8194,0,129.32,1031.35,
256,8192,4096,384,128,8,ActivationType.Silu,torch.bfloat16,torch.float8_e4m3fn,torch.float8_e4m3fn,QuantType.per_1x128,1,0,64,0,124.3946,moe_ck2stages_gemm1_256x64x128x128_1x4_MulABScaleExpertWeightA8W8blkscale_v3_Nswizzle0_Quant4_MulRoutedWeight0_silu_F8_F8_B16,0.1%,473.4248,moe_ck2stages_gemm2_256x64x128x128_1x4_MulABScaleExpertWeightA8W8blkscale_v3_Nswizzle0_Quant4_MulRoutedWeight1_F8_F8_B16,15.5%,597.8194,0,129.32,1031.35,
256,16384,4096,384,128,8,ActivationType.Silu,torch.bfloat16,torch.float8_e4m3fn,torch.float8_e4m3fn,QuantType.per_1x128,1,0,64,0,124.3946,moe_ck2stages_gemm1_256x64x128x128_1x4_MulABScaleExpertWeightA8W8blkscale_v3_Nswizzle0_Quant4_MulRoutedWeight0_silu_F8_F8_B16,0.1%,473.4248,moe_ck2stages_gemm2_256x64x128x128_1x4_MulABScaleExpertWeightA8W8blkscale_v3_Nswizzle0_Quant4_MulRoutedWeight1_F8_F8_B16,15.5%,597.8194,0,129.32,1031.35,
256,32768,4096,384,128,8,ActivationType.Silu,torch.bfloat16,torch.float8_e4m3fn,torch.float8_e4m3fn,QuantType.per_1x128,1,0,64,0,124.3946,moe_ck2stages_gemm1_256x64x128x128_1x4_MulABScaleExpertWeightA8W8blkscale_v3_Nswizzle0_Quant4_MulRoutedWeight0_silu_F8_F8_B16,0.1%,473.4248,moe_ck2stages_gemm2_256x64x128x128_1x4_MulABScaleExpertWeightA8W8blkscale_v3_Nswizzle0_Quant4_MulRoutedWeight1_F8_F8_B16,15.5%,597.8194,0,129.32,1031.35,
256,1,4096,384,128,8,ActivationType.Silu,torch.bfloat16,torch.float8_e4m3fn,torch.float8_e4m3fn,QuantType.per_1x128,1,1,64,0,56.2731,moe_ck2stages_gemm1_256x64x128x128_1x4_MulABScaleExpertWeightA8W8blkscale_v3_Nswizzle0_Quant4_MulRoutedWeight1_silu_F8_F8_B16,0.1%,45.5448,moe_ck2stages_gemm2_256x64x128x128_1x4_MulABScaleExpertWeightA8W8blkscale_v3_Nswizzle0_Quant4_MulRoutedWeight0_F8_F8_B16,16.7%,101.8179,0,11.86,5933.89,
256,2,4096,384,128,8,ActivationType.Silu,torch.bfloat16,torch.float8_e4m3fn,torch.float8_e4m3fn,QuantType.per_1x128,1,1,64,0,56.2731,moe_ck2stages_gemm1_256x64x128x128_1x4_MulABScaleExpertWeightA8W8blkscale_v3_Nswizzle0_Quant4_MulRoutedWeight1_silu_F8_F8_B16,0.1%,45.5448,moe_ck2stages_gemm2_256x64x128x128_1x4_MulABScaleExpertWeightA8W8blkscale_v3_Nswizzle0_Quant4_MulRoutedWeight0_F8_F8_B16,16.7%,101.8179,0,11.86,5933.89,
256,4,4096,384,128,8,ActivationType.Silu,torch.bfloat16,torch.float8_e4m3fn,torch.float8_e4m3fn,QuantType.per_1x128,1,1,64,0,56.2731,moe_ck2stages_gemm1_256x64x128x128_1x4_MulABScaleExpertWeightA8W8blkscale_v3_Nswizzle0_Quant4_MulRoutedWeight1_silu_F8_F8_B16,0.1%,45.5448,moe_ck2stages_gemm2_256x64x128x128_1x4_MulABScaleExpertWeightA8W8blkscale_v3_Nswizzle0_Quant4_MulRoutedWeight0_F8_F8_B16,16.7%,101.8179,0,11.86,5933.89,
256,8,4096,384,128,8,ActivationType.Silu,torch.bfloat16,torch.float8_e4m3fn,torch.float8_e4m3fn,QuantType.per_1x128,1,1,64,0,56.2731,moe_ck2stages_gemm1_256x64x128x128_1x4_MulABScaleExpertWeightA8W8blkscale_v3_Nswizzle0_Quant4_MulRoutedWeight1_silu_F8_F8_B16,0.1%,45.5448,moe_ck2stages_gemm2_256x64x128x128_1x4_MulABScaleExpertWeightA8W8blkscale_v3_Nswizzle0_Quant4_MulRoutedWeight0_F8_F8_B16,16.7%,101.8179,0,11.86,5933.89,
256,16,4096,384,128,8,ActivationType.Silu,torch.bfloat16,torch.float8_e4m3fn,torch.float8_e4m3fn,QuantType.per_1x128,1,1,64,0,56.2731,moe_ck2stages_gemm1_256x64x128x128_1x4_MulABScaleExpertWeightA8W8blkscale_v3_Nswizzle0_Quant4_MulRoutedWeight1_silu_F8_F8_B16,0.1%,45.5448,moe_ck2stages_gemm2_256x64x128x128_1x4_MulABScaleExpertWeightA8W8blkscale_v3_Nswizzle0_Quant4_MulRoutedWeight0_F8_F8_B16,16.7%,101.8179,0,11.86,5933.89,
256,32,4096,384,128,8,ActivationType.Silu,torch.bfloat16,torch.float8_e4m3fn,torch.float8_e4m3fn,QuantType.per_1x128,1,1,64,0,80.9637,moe_ck2stages_gemm1_256x64x128x128_1x4_MulABScaleExpertWeightA8W8blkscale_v3_Nswizzle0_Quant4_MulRoutedWeight1_silu_F8_F8_B16,0.1%,59.914,moe_ck2stages_gemm2_256x64x128x128_1x4_MulABScaleExpertWeightA8W8blkscale_v3_Nswizzle0_Quant4_MulRoutedWeight0_F8_F8_B16,16.8%,140.8777,0,17.15,4290.05,
256,64,4096,384,128,8,ActivationType.Silu,torch.bfloat16,torch.float8_e4m3fn,torch.float8_e4m3fn,QuantType.per_1x128,1,1,64,0,84.98,moe_ck2stages_gemm1_256x64x128x128_1x4_MulABScaleExpertWeightA8W8blkscale_v3_Nswizzle0_Quant4_MulRoutedWeight1_silu_F8_F8_B16,0.1%,66.4795,moe_ck2stages_gemm2_256x64x128x128_1x4_MulABScaleExpertWeightA8W8blkscale_v3_Nswizzle0_Quant4_MulRoutedWeight0_F8_F8_B16,16.8%,151.4595,0,31.9,3992.92,
256,128,4096,384,128,8,ActivationType.Silu,torch.bfloat16,torch.float8_e4m3fn,torch.float8_e4m3fn,QuantType.per_1x128,1,1,64,0,88.6975,moe_ck2stages_gemm1_256x64x128x128_1x4_MulABScaleExpertWeightA8W8blkscale_v3_Nswizzle0_Quant4_MulRoutedWeight1_silu_F8_F8_B16,0.1%,86.5349,moe_ck2stages_gemm2_256x64x128x128_1x4_MulABScaleExpertWeightA8W8blkscale_v3_Nswizzle0_Quant4_MulRoutedWeight0_F8_F8_B16,16.7%,175.2324,0,55.15,3455.71,
256,256,4096,384,128,8,ActivationType.Silu,torch.bfloat16,torch.float8_e4m3fn,torch.float8_e4m3fn,QuantType.per_1x128,1,1,64,0,88.5757,moe_ck2stages_gemm1_256x64x128x128_1x4_MulABScaleExpertWeightA8W8blkscale_v3_Nswizzle0_Quant4_MulRoutedWeight1_silu_F8_F8_B16,0.1%,141.8788,moe_ck2stages_gemm2_256x64x128x128_1x4_MulABScaleExpertWeightA8W8blkscale_v3_Nswizzle0_Quant4_MulRoutedWeight0_F8_F8_B16,16.7%,230.4545,0,83.87,2634.47,
256,512,4096,384,128,8,ActivationType.Silu,torch.bfloat16,torch.float8_e4m3fn,torch.float8_e4m3fn,QuantType.per_1x128,1,1,64,0,93.59,moe_ck2stages_gemm1_256x64x128x128_1x4_MulABScaleExpertWeightA8W8blkscale_v3_Nswizzle0_Quant4_MulRoutedWeight1_silu_F8_F8_B16,0.1%,247.6998,moe_ck2stages_gemm2_256x64x128x128_1x4_MulABScaleExpertWeightA8W8blkscale_v3_Nswizzle0_Quant4_MulRoutedWeight0_F8_F8_B16,16.7%,341.2898,0,113.26,1788.13,
256,1024,4096,384,128,8,ActivationType.Silu,torch.bfloat16,torch.float8_e4m3fn,torch.float8_e4m3fn,QuantType.per_1x128,1,1,64,0,126.8404,moe_ck2stages_gemm1_256x64x128x128_1x4_MulABScaleExpertWeightA8W8blkscale_v3_Nswizzle0_Quant4_MulRoutedWeight1_silu_F8_F8_B16,0.1%,473.289,moe_ck2stages_gemm2_256x64x128x128_1x4_MulABScaleExpertWeightA8W8blkscale_v3_Nswizzle0_Quant4_MulRoutedWeight0_F8_F8_B16,16.7%,600.1294,0,128.82,1027.38,
256,2048,4096,384,128,8,ActivationType.Silu,torch.bfloat16,torch.float8_e4m3fn,torch.float8_e4m3fn,QuantType.per_1x128,1,1,64,0,126.8404,moe_ck2stages_gemm1_256x64x128x128_1x4_MulABScaleExpertWeightA8W8blkscale_v3_Nswizzle0_Quant4_MulRoutedWeight1_silu_F8_F8_B16,0.1%,473.289,moe_ck2stages_gemm2_256x64x128x128_1x4_MulABScaleExpertWeightA8W8blkscale_v3_Nswizzle0_Quant4_MulRoutedWeight0_F8_F8_B16,16.7%,600.1294,0,128.82,1027.38,
256,4096,4096,384,128,8,ActivationType.Silu,torch.bfloat16,torch.float8_e4m3fn,torch.float8_e4m3fn,QuantType.per_1x128,1,1,64,0,126.8404,moe_ck2stages_gemm1_256x64x128x128_1x4_MulABScaleExpertWeightA8W8blkscale_v3_Nswizzle0_Quant4_MulRoutedWeight1_silu_F8_F8_B16,0.1%,473.289,moe_ck2stages_gemm2_256x64x128x128_1x4_MulABScaleExpertWeightA8W8blkscale_v3_Nswizzle0_Quant4_MulRoutedWeight0_F8_F8_B16,16.7%,600.1294,0,128.82,1027.38,
256,8192,4096,384,128,8,ActivationType.Silu,torch.bfloat16,torch.float8_e4m3fn,torch.float8_e4m3fn,QuantType.per_1x128,1,1,64,0,126.8404,moe_ck2stages_gemm1_256x64x128x128_1x4_MulABScaleExpertWeightA8W8blkscale_v3_Nswizzle0_Quant4_MulRoutedWeight1_silu_F8_F8_B16,0.1%,473.289,moe_ck2stages_gemm2_256x64x128x128_1x4_MulABScaleExpertWeightA8W8blkscale_v3_Nswizzle0_Quant4_MulRoutedWeight0_F8_F8_B16,16.7%,600.1294,0,128.82,1027.38,
256,16384,4096,384,128,8,ActivationType.Silu,torch.bfloat16,torch.float8_e4m3fn,torch.float8_e4m3fn,QuantType.per_1x128,1,1,64,0,126.8404,moe_ck2stages_gemm1_256x64x128x128_1x4_MulABScaleExpertWeightA8W8blkscale_v3_Nswizzle0_Quant4_MulRoutedWeight1_silu_F8_F8_B16,0.1%,473.289,moe_ck2stages_gemm2_256x64x128x128_1x4_MulABScaleExpertWeightA8W8blkscale_v3_Nswizzle0_Quant4_MulRoutedWeight0_F8_F8_B16,16.7%,600.1294,0,128.82,1027.38,
256,32768,4096,384,128,8,ActivationType.Silu,torch.bfloat16,torch.float8_e4m3fn,torch.float8_e4m3fn,QuantType.per_1x128,1,1,64,0,126.8404,moe_ck2stages_gemm1_256x64x128x128_1x4_MulABScaleExpertWeightA8W8blkscale_v3_Nswizzle0_Quant4_MulRoutedWeight1_silu_F8_F8_B16,0.1%,473.289,moe_ck2stages_gemm2_256x64x128x128_1x4_MulABScaleExpertWeightA8W8blkscale_v3_Nswizzle0_Quant4_MulRoutedWeight0_F8_F8_B16,16.7%,600.1294,0,128.82,1027.38,
256,1,5120,1024,128,1,ActivationType.Silu,torch.bfloat16,torch.float8_e4m3fn,torch.float8_e4m3fn,QuantType.per_Token,1,1,32,0,0.0,_ZN5aiter46fmoe_bf16_pertokenFp8_g1u1_tkw1_silu_1tg_32x64E,0.0%,0.0,Null,0,0.0,1,0.0,0.0,
256,2,5120,1024,128,1,ActivationType.Silu,torch.bfloat16,torch.float8_e4m3fn,torch.float8_e4m3fn,QuantType.per_Token,1,1,32,0,0.0,_ZN5aiter46fmoe_bf16_pertokenFp8_g1u1_tkw1_silu_1tg_32x64E,0.0%,0.0,Null,0,0.0,1,0.0,0.0,
256,4,5120,1024,128,1,ActivationType.Silu,torch.bfloat16,torch.float8_e4m3fn,torch.float8_e4m3fn,QuantType.per_Token,1,1,32,0,0.0,_ZN5aiter46fmoe_bf16_pertokenFp8_g1u1_tkw1_silu_1tg_32x64E,0.0%,0.0,Null,0,0.0,1,0.0,0.0,
256,8,5120,1024,128,1,ActivationType.Silu,torch.bfloat16,torch.float8_e4m3fn,torch.float8_e4m3fn,QuantType.per_Token,1,1,32,0,0.0,_ZN5aiter46fmoe_bf16_pertokenFp8_g1u1_tkw1_silu_1tg_32x64E,0.0%,0.0,Null,0,0.0,1,0.0,0.0,
256,16,5120,1024,128,1,ActivationType.Silu,torch.bfloat16,torch.float8_e4m3fn,torch.float8_e4m3fn,QuantType.per_Token,1,1,32,0,0.0,_ZN5aiter46fmoe_bf16_pertokenFp8_g1u1_tkw1_silu_1tg_32x64E,0.0%,0.0,Null,0,0.0,1,0.0,0.0,
256,1,7168,256,257,9,ActivationType.Silu,torch.bfloat16,torch.float8_e4m3fn,torch.float8_e4m3fn,QuantType.per_1x128,1,0,16,0,77.4907,_ZN5aiter47fmoe_bf16_blockscaleFp8_g1u1_vs_pf2_silu_16x128E,0.0%,0.0,,0.0%,77.4907,1,10.23,18259.78,
256,2,7168,256,257,9,ActivationType.Silu,torch.bfloat16,torch.float8_e4m3fn,torch.float8_e4m3fn,QuantType.per_1x128,1,0,16,0,77.4907,_ZN5aiter47fmoe_bf16_blockscaleFp8_g1u1_vs_pf2_silu_16x128E,0.0%,0.0,,0.0%,77.4907,1,10.23,18259.78,
256,4,7168,256,257,9,ActivationType.Silu,torch.bfloat16,torch.float8_e4m3fn,torch.float8_e4m3fn,QuantType.per_1x128,1,0,16,0,77.4907,_ZN5aiter47fmoe_bf16_blockscaleFp8_g1u1_vs_pf2_silu_16x128E,0.0%,0.0,,0.0%,77.4907,1,10.23,18259.78,
256,8,7168,256,257,9,ActivationType.Silu,torch.bfloat16,torch.float8_e4m3fn,torch.float8_e4m3fn,QuantType.per_1x128,1,0,16,0,77.4907,_ZN5aiter47fmoe_bf16_blockscaleFp8_g1u1_vs_pf2_silu_16x128E,0.0%,0.0,,0.0%,77.4907,1,10.23,18259.78,
256,16,7168,256,257,9,ActivationType.Silu,torch.bfloat16,torch.float8_e4m3fn,torch.float8_e4m3fn,QuantType.per_1x128,1,0,16,0,71.1678,moe_ck2stages_gemm1_256x16x128x256_1x4_MulABScaleExpertWeightA8W8blkscale_v1_Nswizzle0_Quant4_MulRoutedWeight0_silu_F8_F8_B16,0.1%,41.5098,moe_ck2stages_gemm2_256x16x128x256_1x4_MulABScaleExpertWeightA8W8blkscale_v1_Nswizzle0_Quant4_MulRoutedWeight1_F8_F8_B16,15.6%,112.6776,0,12.51,12510.3,
256,32,7168,256,257,9,ActivationType.Silu,torch.bfloat16,torch.float8_e4m3fn,torch.float8_e4m3fn,QuantType.per_1x128,1,0,32,0,158.4834,_ZN5aiter49fmoe_bf16_blockscaleFp8_g1u1_novs_silu_1tg_32x256E,0.0%,0.0,Null,0.0%,158.4834,1,17.78,8896.67,
256,64,7168,256,257,9,ActivationType.Silu,torch.bfloat16,torch.float8_e4m3fn,torch.float8_e4m3fn,QuantType.per_1x128,1,0,32,0,212.9873,_ZN5aiter50fmoe_bf16_blockscaleFp8_g1u1_vs_silu_1tg_ps_32x256E,0.0%,0.0,Null,0.0%,212.9873,1,26.47,6623.22,
256,128,7168,256,257,9,ActivationType.Silu,torch.bfloat16,torch.float8_e4m3fn,torch.float8_e4m3fn,QuantType.per_1x128,1,0,32,0,241.6039,_ZN5aiter50fmoe_bf16_blockscaleFp8_g1u1_vs_silu_1tg_ps_32x256E,0.0%,0.0,Null,0.0%,241.6039,1,46.66,5844.44,
256,256,7168,256,257,9,ActivationType.Silu,torch.bfloat16,torch.float8_e4m3fn,torch.float8_e4m3fn,QuantType.per_1x128,1,0,32,0,249.5786,_ZN5aiter49fmoe_bf16_blockscaleFp8_g1u1_novs_silu_1tg_32x256E,0.0%,0.0,Null,0.0%,249.5786,1,90.35,5668.72,
256,512,7168,256,257,9,ActivationType.Silu,torch.bfloat16,torch.float8_e4m3fn,torch.float8_e4m3fn,QuantType.per_1x128,1,0,32,0,260.9691,_ZN5aiter47fmoe_bf16_blockscaleFp8_g1u1_vs_silu_1tg_32x256E,0.0%,0.0,Null,0.0%,260.9691,1,172.81,5442.39,
256,1024,7168,256,257,9,ActivationType.Silu,torch.bfloat16,torch.float8_e4m3fn,torch.float8_e4m3fn,QuantType.per_1x128,1,0,32,0,359.4797,_ZN5aiter49fmoe_bf16_blockscaleFp8_g1u1_novs_silu_1tg_32x256E,0.0%,0.0,Null,0.0%,359.4797,1,250.9,3981.61,
256,2048,7168,256,257,9,ActivationType.Silu,torch.bfloat16,torch.float8_e4m3fn,torch.float8_e4m3fn,QuantType.per_1x128,1,0,32,0,359.4797,_ZN5aiter49fmoe_bf16_blockscaleFp8_g1u1_novs_silu_1tg_32x256E,0.0%,0.0,Null,0.0%,359.4797,1,250.9,3981.61,
256,4096,7168,256,257,9,ActivationType.Silu,torch.bfloat16,torch.float8_e4m3fn,torch.float8_e4m3fn,QuantType.per_1x128,1,0,32,0,359.4797,_ZN5aiter49fmoe_bf16_blockscaleFp8_g1u1_novs_silu_1tg_32x256E,0.0%,0.0,Null,0.0%,359.4797,1,250.9,3981.61,
256,8192,7168,256,257,9,ActivationType.Silu,torch.bfloat16,torch.float8_e4m3fn,torch.float8_e4m3fn,QuantType.per_1x128,1,0,32,0,359.4797,_ZN5aiter49fmoe_bf16_blockscaleFp8_g1u1_novs_silu_1tg_32x256E,0.0%,0.0,Null,0.0%,359.4797,1,250.9,3981.61,
256,16384,7168,256,257,9,ActivationType.Silu,torch.bfloat16,torch.float8_e4m3fn,torch.float8_e4m3fn,QuantType.per_1x128,1,0,32,0,359.4797,_ZN5aiter52fmoe_bf16_blockscaleFp8_g1u1_novs_silu_1tg_ps_32x256E,0.0%,0.0,Null,0.0%,359.4797,1,250.9,3981.61,
256,32768,7168,256,257,9,ActivationType.Silu,torch.bfloat16,torch.float8_e4m3fn,torch.float8_e4m3fn,QuantType.per_1x128,1,0,32,0,359.4797,_ZN5aiter52fmoe_bf16_blockscaleFp8_g1u1_novs_silu_1tg_ps_32x256E,0.0%,0.0,Null,0.0%,359.4797,1,250.9,3981.61,
256,1,7168,512,257,9,ActivationType.Silu,torch.bfloat16,torch.float8_e4m3fn,torch.float8_e4m3fn,QuantType.per_1x128,1,0,16,0,45.8865,moe_ck2stages_gemm1_256x16x128x256_1x4_MulABScaleExpertWeightA8W8blkscale_v1_Nswizzle0_Quant4_MulRoutedWeight0_silu_F8_F8_B16,0.1%,10.9563,moe_ck2stages_gemm2_128x16x128x128_1x2_MulABScaleExpertWeightA8W8blkscale_v1_Nswizzle0_Quant4_MulRoutedWeight1_F8_F8_B16,15.8%,56.8428,0,3.49,49779.46,
256,2,7168,512,257,9,ActivationType.Silu,torch.bfloat16,torch.float8_e4m3fn,torch.float8_e4m3fn,QuantType.per_1x128,1,0,16,0,62.7228,_ZN5aiter47fmoe_bf16_blockscaleFp8_g1u1_vs_pf2_silu_16x128E,0.0%,0.0,,0.0%,62.7228,1,6.32,45113.19,
256,4,7168,512,257,9,ActivationType.Silu,torch.bfloat16,torch.float8_e4m3fn,torch.float8_e4m3fn,QuantType.per_1x128,1,0,16,0,78.6512,_ZN5aiter47fmoe_bf16_blockscaleFp8_g1u1_vs_pf2_silu_16x128E,0.0%,0.0,,0.0%,78.6512,1,10.08,35977.43,
256,8,7168,512,257,9,ActivationType.Silu,torch.bfloat16,torch.float8_e4m3fn,torch.float8_e4m3fn,QuantType.per_1x128,1,0,16,0,128.1741,_ZN5aiter47fmoe_bf16_blockscaleFp8_g1u1_vs_pf2_silu_16x128E,0.0%,0.0,,0.0%,128.1741,1,12.37,22077.43,
256,16,7168,512,257,9,ActivationType.Silu,torch.bfloat16,torch.float8_e4m3fn,torch.float8_e4m3fn,QuantType.per_1x128,1,0,16,0,211.2661,_ZN5aiter47fmoe_bf16_blockscaleFp8_g1u1_vs_pf2_silu_16x128E,0.0%,0.0,,0.0%,211.2661,1,15.01,13395.08,
256,32,7168,512,257,9,ActivationType.Silu,torch.bfloat16,torch.float8_e4m3fn,torch.float8_e4m3fn,QuantType.per_1x128,1,0,16,0,218.1954,moe_ck2stages_gemm1_256x16x128x256_1x4_MulABScaleExpertWeightA8W8blkscale_v1_Nswizzle0_Quant4_MulRoutedWeight0_silu_F8_F8_B16,0.1%,110.1563,moe_ck2stages_gemm2_256x16x128x256_1x4_MulABScaleExpertWeightA8W8blkscale_v1_Nswizzle0_Quant4_MulRoutedWeight1_F8_F8_B16,17.2%,328.3517,0,19.31,8619.63,
256,64,7168,512,257,9,ActivationType.Silu,torch.bfloat16,torch.float8_e4m3fn,torch.float8_e4m3fn,QuantType.per_1x128,1,0,16,0,281.8906,moe_ck2stages_gemm1_256x16x128x256_1x4_MulABScaleExpertWeightA8W8blkscale_v1_Nswizzle0_Quant4_MulRoutedWeight0_silu_F8_F8_B16,0.1%,136.8115,moe_ck2stages_gemm2_256x16x128x256_1x4_MulABScaleExpertWeightA8W8blkscale_v1_Nswizzle0_Quant4_MulRoutedWeight1_F8_F8_B16,17.0%,418.7021,0,30.29,6761.27,
256,128,7168,512,257,9,ActivationType.Silu,torch.bfloat16,torch.float8_e4m3fn,torch.float8_e4m3fn,QuantType.per_1x128,1,0,16,0,310.6027,moe_ck2stages_gemm1_256x16x128x256_1x4_MulABScaleExpertWeightA8W8blkscale_v1_Nswizzle0_Quant4_MulRoutedWeight0_silu_F8_F8_B16,0.1%,161.3951,moe_ck2stages_gemm2_256x16x128x256_1x4_MulABScaleExpertWeightA8W8blkscale_v1_Nswizzle0_Quant4_MulRoutedWeight1_F8_F8_B16,17.0%,471.9978,0,53.74,6000.74,
256,256,7168,512,257,9,ActivationType.Silu,torch.bfloat16,torch.float8_e4m3fn,torch.float8_e4m3fn,QuantType.per_1x128,1,0,16,0,343.698,moe_ck2stages_gemm1_256x16x128x256_1x4_MulABScaleExpertWeightA8W8blkscale_v1_Nswizzle0_Quant4_MulRoutedWeight0_silu_F8_F8_B16,0.1%,172.001,moe_ck2stages_gemm2_256x16x128x256_1x4_MulABScaleExpertWeightA8W8blkscale_v1_Nswizzle0_Quant4_MulRoutedWeight1_F8_F8_B16,16.9%,515.699,0,98.38,5497.56,
256,512,7168,512,257,9,ActivationType.Silu,torch.bfloat16,torch.float8_e4m3fn,torch.float8_e4m3fn,QuantType.per_1x128,1,0,32,0,358.796,moe_ck2stages_gemm1_256x32x128x128_1x4_MulABScaleExpertWeightA8W8blkscale_v1_Nswizzle0_Quant4_MulRoutedWeight0_silu_F8_F8_B16,0.1%,181.7047,moe_ck2stages_gemm2_256x32x128x128_1x4_MulABScaleExpertWeightA8W8blkscale_v1_Nswizzle0_Quant4_MulRoutedWeight1_F8_F8_B16,16.8%,540.5007,0,187.73,5255.48,
256,1024,7168,512,257,9,ActivationType.Silu,torch.bfloat16,torch.float8_e4m3fn,torch.float8_e4m3fn,QuantType.per_1x128,1,0,64,0,673.6803,_ZN5aiter46fmoe_bf16_blockscaleFp8_g1u1_vs_ps_silu_64x256E,0.0%,0.0,,0.0%,673.6803,1,301.24,4232.87,
256,2048,7168,512,257,9,ActivationType.Silu,torch.bfloat16,torch.float8_e4m3fn,torch.float8_e4m3fn,QuantType.per_1x128,1,0,64,0,873.5909,_ZN5aiter46fmoe_bf16_blockscaleFp8_g1u1_vs_ps_silu_64x256E,0.0%,0.0,,0.0%,873.5909,1,464.6,3289.44,
256,4096,7168,512,257,9,ActivationType.Silu,torch.bfloat16,torch.float8_e4m3fn,torch.float8_e4m3fn,QuantType.per_1x128,1,0,64,0,1294.01,_ZN5aiter46fmoe_bf16_blockscaleFp8_g1u1_vs_ps_silu_64x256E,0.0%,0.0,,0.0%,1294.01,1,627.31,2254.75,
256,8192,7168,512,257,9,ActivationType.Silu,torch.bfloat16,torch.float8_e4m3fn,torch.float8_e4m3fn,QuantType.per_1x128,1,0,64,0,2305.846,_ZN5aiter46fmoe_bf16_blockscaleFp8_g1u1_vs_ps_silu_64x256E,0.0%,0.0,,0.0%,2305.846,1,704.08,1303.53,
