aiter/configs/model_configs/a8w8_blockscale_bpreshuffle_tuned_gemm_dsv3.csv
cu_num,M,N,K,libtype,kernelId,splitK,us,kernelName,tflops,bw,errRatio
256,16,3072,1536,asm,5,6,6.2764,_ZN5aiter42fp8gemm_bf16_blockscale_BpreShuffle_32x128E,24.06,771.38,0.0
256,16,4096,512,ck,7,3,3.1003,a8w8_blockscale_bpreshuffle_1x128x128_256x16x64x256_16x16_16x16_16x16x1_16x16x1_1x16x1x16_4_1x1_intrawave_v1,21.65,721.35,0.0
256,16,7168,2048,ck,7,3,7.3311,a8w8_blockscale_bpreshuffle_1x128x128_256x16x64x256_16x16_16x16_16x16x1_16x16x1_1x16x1x16_4_1x1_intrawave_v1,64.08,2038.19,0.0
256,16,4608,7168,asm,13,6,10.6569,_ZN5aiter42fp8gemm_bf16_blockscale_BpreShuffle_48x128E,99.18,3124.01,0.0039
256,16,7168,2304,ck,7,2,8.1436,a8w8_blockscale_bpreshuffle_1x128x128_256x16x64x256_16x16_16x16_16x16x1_16x16x1_1x16x1x16_4_1x1_intrawave_v1,64.9,2060.67,0.0
256,16,128,7168,asm,7,8,7.1972,_ZN5aiter42fp8gemm_bf16_blockscale_BpreShuffle_32x128E,4.08,143.98,0.0161
256,16,2112,7168,ck,7,3,17.3577,a8w8_blockscale_bpreshuffle_1x128x128_256x16x64x256_16x16_16x16_16x16x1_16x16x1_1x16x1x16_4_1x1_intrawave_v1,27.91,882.67,0.0
256,16,2240,7168,ck,7,2,17.4387,a8w8_blockscale_bpreshuffle_1x128x128_256x16x64x256_16x16_16x16_16x16x1_16x16x1_1x16x1x16_4_1x1_intrawave_v1,29.46,931.42,0.0
256,16,8192,1536,ck,7,2,6.5706,a8w8_blockscale_bpreshuffle_1x128x128_256x16x64x256_16x16_16x16_16x16x1_16x16x1_1x16x1x16_4_1x1_intrawave_v1,61.28,1958.67,0.0
256,16,11264,1536,ck,7,0,6.7797,a8w8_blockscale_bpreshuffle_1x128x128_256x16x64x256_16x16_16x16_16x16x1_16x16x1_1x16x1x16_4_1x1_intrawave_v1,81.66,2608.75,0
256,32,3072,1536,asm,6,7,6.4081,_ZN5aiter42fp8gemm_bf16_blockscale_BpreShuffle_32x128E,47.13,774.7,0.0
256,32,4096,512,ck,7,3,3.3335,a8w8_blockscale_bpreshuffle_1x128x128_256x16x64x256_16x16_16x16_16x16x1_16x16x1_1x16x1x16_4_1x1_intrawave_v1,40.26,712.67,0.0
256,32,7168,2048,ck,7,2,7.4283,a8w8_blockscale_bpreshuffle_1x128x128_256x16x64x256_16x16_16x16_16x16x1_16x16x1_1x16x1x16_4_1x1_intrawave_v1,126.48,2046.81,0.0
256,32,4608,7168,asm,14,7,11.1661,_ZN5aiter42fp8gemm_bf16_blockscale_BpreShuffle_48x128E,189.32,3005.03,0.0064
256,32,7168,2304,asm,3,4,8.1926,_ZN5aiter42fp8gemm_bf16_blockscale_BpreShuffle_32x128E,129.01,2080.85,0.0
256,32,128,7168,asm,7,8,6.9733,_ZN5aiter42fp8gemm_bf16_blockscale_BpreShuffle_32x128E,8.42,165.64,0.001
256,32,2112,7168,ck,7,0,17.8478,a8w8_blockscale_bpreshuffle_1x128x128_256x16x64x256_16x16_16x16_16x16x1_16x16x1_1x16x1x16_4_1x1_intrawave_v1,54.29,868.64,0.0
256,32,2240,7168,ck,7,0,17.8057,a8w8_blockscale_bpreshuffle_1x128x128_256x16x64x256_16x16_16x16_16x16x1_16x16x1_1x16x1x16_4_1x1_intrawave_v1,57.71,922.69,0.0
256,32,8192,1536,ck,7,0,6.6621,a8w8_blockscale_bpreshuffle_1x128x128_256x16x64x256_16x16_16x16_16x16x1_16x16x1_1x16x1x16_4_1x1_intrawave_v1,120.88,1974.81,0.0
256,32,11264,1536,ck,12,3,7.3765,a8w8_blockscale_bpreshuffle_1x128x128_256x32x64x256_16x16_16x16_16x16x1_16x16x1_1x32x1x8_8_2x1_intrawave_v1,150.11,2449.88,0.0
256,48,3072,1536,ck,7,1,6.5323,a8w8_blockscale_bpreshuffle_1x128x128_256x16x64x256_16x16_16x16_16x16x1_16x16x1_1x16x1x16_4_1x1_intrawave_v1,69.35,778.78,0.0
256,48,4096,512,ck,7,0,3.4031,a8w8_blockscale_bpreshuffle_1x128x128_256x16x64x256_16x16_16x16_16x16x1_16x16x1_1x16x1x16_4_1x1_intrawave_v1,59.16,739.02,0
256,48,7168,2048,ck,6,3,8.0207,a8w8_blockscale_bpreshuffle_1x128x128_256x16x128x256_16x16_16x16_16x16x1_16x16x1_1x16x1x16_8_1x2_intrawave_v1,175.71,1928.32,0.0
256,48,4608,7168,asm,38,7,12.6501,_ZN5aiter42fp8gemm_bf16_blockscale_BpreShuffle_96x128E,250.66,2673.23,0.0053
256,48,7168,2304,ck,7,1,9.0018,a8w8_blockscale_bpreshuffle_1x128x128_256x16x64x256_16x16_16x16_16x16x1_16x16x1_1x16x1x16_4_1x1_intrawave_v1,176.13,1923.37,0.0
256,48,128,7168,asm,7,8,6.5843,_ZN5aiter42fp8gemm_bf16_blockscale_BpreShuffle_32x128E,13.38,193.47,0.0099
256,48,2112,7168,ck,7,0,17.0509,a8w8_blockscale_bpreshuffle_1x128x128_256x16x64x256_16x16_16x16_16x16x1_16x16x1_1x16x1x16_4_1x1_intrawave_v1,85.23,919.93,0.0
256,48,2240,7168,ck,7,3,17.1924,a8w8_blockscale_bpreshuffle_1x128x128_256x16x64x256_16x16_16x16_16x16x1_16x16x1_1x16x1x16_4_1x1_intrawave_v1,89.66,966.44,0.0
256,48,8192,1536,ck,6,0,7.2732,a8w8_blockscale_bpreshuffle_1x128x128_256x16x128x256_16x16_16x16_16x16x1_16x16x1_1x16x1x16_8_1x2_intrawave_v1,166.08,1848.3,0
256,48,11264,1536,ck,6,0,7.746,a8w8_blockscale_bpreshuffle_1x128x128_256x16x128x256_16x16_16x16_16x16x1_16x16x1_1x16x1x16_8_1x2_intrawave_v1,214.43,2382.72,0
256,64,3072,1536,ck,7,0,6.5146,a8w8_blockscale_bpreshuffle_1x128x128_256x16x64x256_16x16_16x16_16x16x1_16x16x1_1x16x1x16_4_1x1_intrawave_v1,92.71,799.76,0.0
256,64,4096,512,ck,7,1,3.5829,a8w8_blockscale_bpreshuffle_1x128x128_256x16x64x256_16x16_16x16_16x16x1_16x16x1_1x16x1x16_4_1x1_intrawave_v1,74.92,740.8,0.0
256,64,7168,2048,ck,12,3,7.9064,a8w8_blockscale_bpreshuffle_1x128x128_256x32x64x256_16x16_16x16_16x16x1_16x16x1_1x32x1x8_8_2x1_intrawave_v1,237.66,1989.36,0.0
256,64,4608,7168,asm,22,7,12.4013,_ZN5aiter42fp8gemm_bf16_blockscale_BpreShuffle_64x128E,340.92,2748.0,0.005
256,64,7168,2304,ck,12,0,8.8565,a8w8_blockscale_bpreshuffle_1x128x128_256x32x64x256_16x16_16x16_16x16x1_16x16x1_1x32x1x8_8_2x1_intrawave_v1,238.69,1984.99,0.0
256,64,128,7168,asm,23,8,8.0659,_ZN5aiter42fp8gemm_bf16_blockscale_BpreShuffle_64x128E,14.56,172.66,0.0085
256,64,2112,7168,ck,7,3,17.1991,a8w8_blockscale_bpreshuffle_1x128x128_256x16x64x256_16x16_16x16_16x16x1_16x16x1_1x16x1x16_4_1x1_intrawave_v1,112.67,922.6,0.0
256,64,2240,7168,ck,7,2,17.4564,a8w8_blockscale_bpreshuffle_1x128x128_256x16x64x256_16x16_16x16_16x16x1_16x16x1_1x16x1x16_4_1x1_intrawave_v1,117.73,962.5,0.0
256,64,8192,1536,ck,12,0,7.2158,a8w8_blockscale_bpreshuffle_1x128x128_256x32x64x256_16x16_16x16_16x16x1_16x16x1_1x32x1x8_8_2x1_intrawave_v1,223.21,1902.74,0
256,64,11264,1536,ck,17,2,8.4511,a8w8_blockscale_bpreshuffle_1x128x128_256x64x64x256_16x16_16x16_16x16x1_16x16x1_1x32x1x8_8_2x1_intrawave_v1,262.05,2229.48,0.0
256,80,3072,1536,ck,7,2,6.505,a8w8_blockscale_bpreshuffle_1x128x128_256x16x64x256_16x16_16x16_16x16x1_16x16x1_1x16x1x16_4_1x1_intrawave_v1,116.06,819.83,0.0
256,80,4096,512,ck,12,0,3.932,a8w8_blockscale_bpreshuffle_1x128x128_256x32x64x256_16x16_16x16_16x16x1_16x16x1_1x32x1x8_8_2x1_intrawave_v1,85.34,710.45,0.0
256,80,7168,2048,ck,12,2,9.5219,a8w8_blockscale_bpreshuffle_1x128x128_256x32x64x256_16x16_16x16_16x16x1_16x16x1_1x32x1x8_8_2x1_intrawave_v1,246.67,1679.37,0.0
256,80,4608,7168,asm,30,7,13.779,_ZN5aiter42fp8gemm_bf16_blockscale_BpreShuffle_80x128E,383.54,2492.26,0.006
256,80,7168,2304,ck,17,0,10.1472,a8w8_blockscale_bpreshuffle_1x128x128_256x64x64x256_16x16_16x16_16x16x1_16x16x1_1x32x1x8_8_2x1_intrawave_v1,260.41,1758.74,0
256,80,128,7168,asm,7,8,7.4168,_ZN5aiter42fp8gemm_bf16_blockscale_BpreShuffle_32x128E,19.79,203.78,0.005
256,80,2112,7168,ck,7,2,17.0531,a8w8_blockscale_bpreshuffle_1x128x128_256x16x64x256_16x16_16x16_16x16x1_16x16x1_1x16x1x16_4_1x1_intrawave_v1,142.04,941.19,0.0
256,80,2240,7168,ck,7,3,17.2223,a8w8_blockscale_bpreshuffle_1x128x128_256x16x64x256_16x16_16x16_16x16x1_16x16x1_1x16x1x16_4_1x1_intrawave_v1,149.17,986.4,0.0
256,80,8192,1536,ck,17,3,8.3905,a8w8_blockscale_bpreshuffle_1x128x128_256x64x64x256_16x16_16x16_16x16x1_16x16x1_1x32x1x8_8_2x1_intrawave_v1,239.95,1670.52,0.0
256,80,11264,1536,ck,12,1,9.6443,a8w8_blockscale_bpreshuffle_1x128x128_256x32x64x256_16x16_16x16_16x16x1_16x16x1_1x32x1x8_8_2x1_intrawave_v1,287.03,1993.57,0.0
256,96,3072,1536,ck,7,1,6.6543,a8w8_blockscale_bpreshuffle_1x128x128_256x16x64x256_16x16_16x16_16x16x1_16x16x1_1x16x1x16_4_1x1_intrawave_v1,136.15,819.9,0.0
256,96,4096,512,ck,7,3,3.9702,a8w8_blockscale_bpreshuffle_1x128x128_256x16x64x256_16x16_16x16_16x16x1_16x16x1_1x16x1x16_4_1x1_intrawave_v1,101.42,738.69,0.0
256,96,7168,2048,ck,17,1,9.2696,a8w8_blockscale_bpreshuffle_1x128x128_256x64x64x256_16x16_16x16_16x16x1_16x16x1_1x32x1x8_8_2x1_intrawave_v1,304.07,1753.36,0.0
256,96,4608,7168,asm,36,5,14.8482,_ZN5aiter42fp8gemm_bf16_blockscale_BpreShuffle_96x128E,427.11,2330.45,0.0031
256,96,7168,2304,ck,17,0,10.1868,a8w8_blockscale_bpreshuffle_1x128x128_256x64x64x256_16x16_16x16_16x16x1_16x16x1_1x32x1x8_8_2x1_intrawave_v1,311.27,1778.04,0
256,96,128,7168,asm,5,6,8.482,_ZN5aiter42fp8gemm_bf16_blockscale_BpreShuffle_32x128E,20.77,192.2,0.0038
256,96,2112,7168,ck,7,2,16.8306,a8w8_blockscale_bpreshuffle_1x128x128_256x16x64x256_16x16_16x16_16x16x1_16x16x1_1x16x1x16_4_1x1_intrawave_v1,172.7,964.46,0.0
256,96,2240,7168,ck,7,3,17.5704,a8w8_blockscale_bpreshuffle_1x128x128_256x16x64x256_16x16_16x16_16x16x1_16x16x1_1x16x1x16_4_1x1_intrawave_v1,175.45,977.47,0.0
256,96,8192,1536,ck,12,0,8.448,a8w8_blockscale_bpreshuffle_1x128x128_256x32x64x256_16x16_16x16_16x16x1_16x16x1_1x32x1x8_8_2x1_intrawave_v1,285.98,1693.09,0.0
256,96,11264,1536,ck,12,0,9.5339,a8w8_blockscale_bpreshuffle_1x128x128_256x32x64x256_16x16_16x16_16x16x1_16x16x1_1x32x1x8_8_2x1_intrawave_v1,348.43,2057.04,0.0
256,112,3072,1536,ck,6,0,6.6529,a8w8_blockscale_bpreshuffle_1x128x128_256x16x128x256_16x16_16x16_16x16x1_16x16x1_1x16x1x16_8_1x2_intrawave_v1,158.87,838.54,0
256,112,4096,512,ck,6,1,4.0329,a8w8_blockscale_bpreshuffle_1x128x128_256x16x128x256_16x16_16x16_16x16x1_16x16x1_1x16x1x16_8_1x2_intrawave_v1,116.48,761.73,0.0
256,112,7168,2048,ck,11,1,9.3243,a8w8_blockscale_bpreshuffle_1x128x128_256x32x128x256_16x16_16x16_16x16x1_16x16x1_1x32x1x8_8_2x1_intrawave_v1,352.66,1771.19,0.0
256,112,4608,7168,asm,45,6,16.3143,_ZN5aiter43fp8gemm_bf16_blockscale_BpreShuffle_128x128E,453.51,2137.09,0.004
256,112,7168,2304,ck,17,0,10.2514,a8w8_blockscale_bpreshuffle_1x128x128_256x64x64x256_16x16_16x16_16x16x1_16x16x1_1x32x1x8_8_2x1_intrawave_v1,360.87,1792.8,0
256,112,128,7168,asm,15,8,7.7176,_ZN5aiter42fp8gemm_bf16_blockscale_BpreShuffle_48x128E,26.63,226.62,0.0091
256,112,2112,7168,ck,7,3,17.0191,a8w8_blockscale_bpreshuffle_1x128x128_256x16x64x256_16x16_16x16_16x16x1_16x16x1_1x16x1x16_4_1x1_intrawave_v1,199.25,964.49,0.0
256,112,2240,7168,ck,7,1,16.9806,a8w8_blockscale_bpreshuffle_1x128x128_256x16x64x256_16x16_16x16_16x16x1_16x16x1_1x16x1x16_4_1x1_intrawave_v1,211.81,1022.4,0.0
256,112,8192,1536,ck,12,2,8.5253,a8w8_blockscale_bpreshuffle_1x128x128_256x32x64x256_16x16_16x16_16x16x1_16x16x1_1x32x1x8_8_2x1_intrawave_v1,330.61,1711.37,0.0
256,112,11264,1536,ck,10,0,10.6725,a8w8_blockscale_bpreshuffle_1x128x128_256x32x64x128_16x16_16x16_8x32x1_8x32x1_1x32x1x8_8_2x1_intrawave_v1,363.13,1873.66,0.0192
256,128,3072,1536,ck,6,0,6.7885,a8w8_blockscale_bpreshuffle_1x128x128_256x16x128x256_16x16_16x16_16x16x1_16x16x1_1x16x1x16_8_1x2_intrawave_v1,177.94,839.9,0
256,128,4096,512,ck,6,0,3.9371,a8w8_blockscale_bpreshuffle_1x128x128_256x16x128x256_16x16_16x16_16x16x1_16x16x1_1x16x1x16_8_1x2_intrawave_v1,136.36,815.64,0
256,128,7168,2048,ck,17,3,9.0475,a8w8_blockscale_bpreshuffle_1x128x128_256x64x64x256_16x16_16x16_16x16x1_16x16x1_1x32x1x8_8_2x1_intrawave_v1,415.37,1854.35,0.0
256,128,4608,7168,asm,45,6,17.8321,_ZN5aiter43fp8gemm_bf16_blockscale_BpreShuffle_128x128E,474.19,1969.89,0.0042
256,128,7168,2304,ck,17,1,10.1686,a8w8_blockscale_bpreshuffle_1x128x128_256x64x64x256_16x16_16x16_16x16x1_16x16x1_1x32x1x8_8_2x1_intrawave_v1,415.78,1833.58,0.0
256,128,128,7168,asm,6,7,7.3283,_ZN5aiter42fp8gemm_bf16_blockscale_BpreShuffle_32x128E,32.05,254.87,0.0054
256,128,2112,7168,ck,7,2,17.2367,a8w8_blockscale_bpreshuffle_1x128x128_256x16x64x256_16x16_16x16_16x16x1_16x16x1_1x16x1x16_4_1x1_intrawave_v1,224.84,962.89,0.0
256,128,2240,7168,ck,12,3,18.23,a8w8_blockscale_bpreshuffle_1x128x128_256x32x64x256_16x16_16x16_16x16x1_16x16x1_1x32x1x8_8_2x1_intrawave_v1,225.48,962.55,0.0
256,128,8192,1536,ck,12,2,8.2962,a8w8_blockscale_bpreshuffle_1x128x128_256x32x64x256_16x16_16x16_16x16x1_16x16x1_1x32x1x8_8_2x1_intrawave_v1,388.28,1793.19,0.0
256,128,11264,1536,ck,10,0,10.7933,a8w8_blockscale_bpreshuffle_1x128x128_256x32x64x128_16x16_16x16_8x32x1_8x32x1_1x32x1x8_8_2x1_intrawave_v1,410.36,1888.37,0.0237
256,144,3072,1536,ck,7,0,7.0076,a8w8_blockscale_bpreshuffle_1x128x128_256x16x64x256_16x16_16x16_16x16x1_16x16x1_1x16x1x16_4_1x1_intrawave_v1,193.93,831.17,0.0
256,144,4096,512,ck,7,3,4.633,a8w8_blockscale_bpreshuffle_1x128x128_256x16x64x256_16x16_16x16_16x16x1_16x16x1_1x16x1x16_4_1x1_intrawave_v1,130.36,723.19,0.0
256,144,7168,2048,asm,8,1,11.2196,_ZN5aiter42fp8gemm_bf16_blockscale_BpreShuffle_48x128E,376.83,1518.71,0.0
256,144,4608,7168,asm,34,3,18.5343,_ZN5aiter42fp8gemm_bf16_blockscale_BpreShuffle_96x128E,513.25,1909.4,0.0003
256,144,7168,2304,asm,8,1,12.192,_ZN5aiter42fp8gemm_bf16_blockscale_BpreShuffle_48x128E,390.12,1551.12,0.0
256,144,128,7168,asm,7,8,8.1289,_ZN5aiter42fp8gemm_bf16_blockscale_BpreShuffle_32x128E,32.51,244.38,0.0114
256,144,2112,7168,ck,7,1,17.4845,a8w8_blockscale_bpreshuffle_1x128x128_256x16x64x256_16x16_16x16_16x16x1_16x16x1_1x16x1x16_4_1x1_intrawave_v1,249.36,959.67,0.0
256,144,2240,7168,ck,7,3,17.646,a8w8_blockscale_bpreshuffle_1x128x128_256x16x64x256_16x16_16x16_16x16x1_16x16x1_1x16x1x16_4_1x1_intrawave_v1,262.05,1004.97,0.0
256,144,8192,1536,asm,8,1,10.1357,_ZN5aiter42fp8gemm_bf16_blockscale_BpreShuffle_48x128E,357.54,1496.04,0.0
256,144,11264,1536,asm,24,1,11.5457,_ZN5aiter42fp8gemm_bf16_blockscale_BpreShuffle_80x128E,431.57,1798.65,0.0
256,160,3072,1536,ck,6,0,6.5502,a8w8_blockscale_bpreshuffle_1x128x128_256x16x128x256_16x16_16x16_16x16x1_16x16x1_1x16x1x16_8_1x2_intrawave_v1,230.52,907.97,0
256,160,4096,512,ck,7,0,4.728,a8w8_blockscale_bpreshuffle_1x128x128_256x16x64x256_16x16_16x16_16x16x1_16x16x1_1x16x1x16_4_1x1_intrawave_v1,141.94,738.11,0.0
256,160,7168,2048,asm,8,1,11.2718,_ZN5aiter42fp8gemm_bf16_blockscale_BpreShuffle_48x128E,416.76,1534.94,0.0
256,160,4608,7168,asm,26,3,18.999,_ZN5aiter42fp8gemm_bf16_blockscale_BpreShuffle_80x128E,556.33,1876.5,0.0003
256,160,7168,2304,asm,8,1,12.1765,_ZN5aiter42fp8gemm_bf16_blockscale_BpreShuffle_48x128E,434.02,1574.96,0.0
256,160,128,7168,asm,15,8,7.5736,_ZN5aiter42fp8gemm_bf16_blockscale_BpreShuffle_48x128E,38.77,277.98,0.0114
256,160,2112,7168,ck,12,0,18.2479,a8w8_blockscale_bpreshuffle_1x128x128_256x32x64x256_16x16_16x16_16x16x1_16x16x1_1x32x1x8_8_2x1_intrawave_v1,265.48,929.51,0.0
256,160,2240,7168,ck,12,3,18.2574,a8w8_blockscale_bpreshuffle_1x128x128_256x32x64x256_16x16_16x16_16x16x1_16x16x1_1x32x1x8_8_2x1_intrawave_v1,281.42,981.52,0.0
256,160,8192,1536,asm,8,1,10.0088,_ZN5aiter42fp8gemm_bf16_blockscale_BpreShuffle_48x128E,402.3,1543.65,0.0
256,160,11264,1536,asm,24,1,11.8264,_ZN5aiter42fp8gemm_bf16_blockscale_BpreShuffle_80x128E,468.15,1788.52,0.0
256,176,3072,1536,ck,12,0,7.0386,a8w8_blockscale_bpreshuffle_1x128x128_256x32x64x256_16x16_16x16_16x16x1_16x16x1_1x32x1x8_8_2x1_intrawave_v1,235.98,862.43,0
256,176,4096,512,ck,7,3,4.6972,a8w8_blockscale_bpreshuffle_1x128x128_256x16x64x256_16x16_16x16_16x16x1_16x16x1_1x16x1x16_4_1x1_intrawave_v1,157.16,772.6,0.0
256,176,7168,2048,asm,8,1,11.5341,_ZN5aiter42fp8gemm_bf16_blockscale_BpreShuffle_48x128E,448.01,1522.76,0.0
256,176,4608,7168,asm,34,3,20.1453,_ZN5aiter42fp8gemm_bf16_blockscale_BpreShuffle_96x128E,577.14,1782.73,0.0003
256,176,7168,2304,asm,8,1,12.5219,_ZN5aiter42fp8gemm_bf16_blockscale_BpreShuffle_48x128E,464.25,1552.78,0.0
256,176,128,7168,asm,15,8,7.4618,_ZN5aiter42fp8gemm_bf16_blockscale_BpreShuffle_48x128E,43.28,298.07,0.0047
256,176,2112,7168,ck,7,3,19.4163,a8w8_blockscale_bpreshuffle_1x128x128_256x16x64x256_16x16_16x16_16x16x1_16x16x1_1x16x1x16_4_1x1_intrawave_v1,274.45,882.96,0.0
256,176,2240,7168,ck,7,2,19.5537,a8w8_blockscale_bpreshuffle_1x128x128_256x16x64x256_16x16_16x16_16x16x1_16x16x1_1x16x1x16_4_1x1_intrawave_v1,289.04,925.98,0.0
256,176,8192,1536,asm,8,1,10.1467,_ZN5aiter42fp8gemm_bf16_blockscale_BpreShuffle_48x128E,436.51,1550.93,0.0
256,176,11264,1536,ck,15,2,12.8527,a8w8_blockscale_bpreshuffle_1x128x128_256x64x64x128_16x16_16x16_8x32x1_8x32x1_1x32x1x8_8_2x1_intrawave_v1,473.84,1675.66,0.0097
256,192,3072,1536,ck,12,2,7.5469,a8w8_blockscale_bpreshuffle_1x128x128_256x32x64x256_16x16_16x16_16x16x1_16x16x1_1x32x1x8_8_2x1_intrawave_v1,240.09,820.62,0.0
256,192,4096,512,ck,7,0,4.752,a8w8_blockscale_bpreshuffle_1x128x128_256x16x64x256_16x16_16x16_16x16x1_16x16x1_1x16x1x16_4_1x1_intrawave_v1,169.47,793.0,0.0
256,192,7168,2048,asm,8,1,11.294,_ZN5aiter42fp8gemm_bf16_blockscale_BpreShuffle_48x128E,499.13,1578.34,0.0
256,192,4608,7168,asm,34,3,20.1015,_ZN5aiter42fp8gemm_bf16_blockscale_BpreShuffle_96x128E,630.98,1799.66,0.0004
256,192,7168,2304,asm,8,1,12.6005,_ZN5aiter42fp8gemm_bf16_blockscale_BpreShuffle_48x128E,503.3,1564.22,0.0
256,192,128,7168,asm,15,8,8.1981,_ZN5aiter42fp8gemm_bf16_blockscale_BpreShuffle_48x128E,42.98,285.79,0.0173
256,192,2112,7168,ck,12,1,18.0372,a8w8_blockscale_bpreshuffle_1x128x128_256x32x64x256_16x16_16x16_16x16x1_16x16x1_1x32x1x8_8_2x1_intrawave_v1,322.3,960.57,0.0
256,192,2240,7168,ck,12,1,18.2415,a8w8_blockscale_bpreshuffle_1x128x128_256x32x64x256_16x16_16x16_16x16x1_16x16x1_1x32x1x8_8_2x1_intrawave_v1,338.0,1002.81,0.0
256,192,8192,1536,ck,12,0,10.6821,a8w8_blockscale_bpreshuffle_1x128x128_256x32x64x256_16x16_16x16_16x16x1_16x16x1_1x32x1x8_8_2x1_intrawave_v1,452.33,1500.04,0
256,192,11264,1536,ck,15,0,12.7928,a8w8_blockscale_bpreshuffle_1x128x128_256x64x64x128_16x16_16x16_8x32x1_8x32x1_1x32x1x8_8_2x1_intrawave_v1,519.34,1713.6,0.0007
256,208,3072,1536,ck,12,3,7.8303,a8w8_blockscale_bpreshuffle_1x128x128_256x32x64x256_16x16_16x16_16x16x1_16x16x1_1x32x1x8_8_2x1_intrawave_v1,250.68,806.61,0.0
256,208,4096,512,ck,11,1,4.8273,a8w8_blockscale_bpreshuffle_1x128x128_256x32x128x256_16x16_16x16_16x16x1_16x16x1_1x32x1x8_8_2x1_intrawave_v1,180.73,809.48,0.0
256,208,7168,2048,asm,16,1,12.1456,_ZN5aiter42fp8gemm_bf16_blockscale_BpreShuffle_64x128E,502.81,1489.26,0.0
256,208,4608,7168,asm,42,3,22.7241,_ZN5aiter43fp8gemm_bf16_blockscale_BpreShuffle_128x128E,604.67,1603.5,0.0004
256,208,7168,2304,ck,16,1,13.367,a8w8_blockscale_bpreshuffle_1x128x128_256x64x128x256_16x16_16x16_16x16x1_16x16x1_1x32x1x8_8_2x1_intrawave_v1,513.97,1494.44,0.0
256,208,128,7168,asm,7,8,8.0912,_ZN5aiter42fp8gemm_bf16_blockscale_BpreShuffle_32x128E,47.17,304.24,0.0132
256,208,2112,7168,ck,7,0,19.6245,a8w8_blockscale_bpreshuffle_1x128x128_256x16x64x256_16x16_16x16_16x16x1_16x16x1_1x16x1x16_4_1x1_intrawave_v1,320.91,892.17,0.0
256,208,2240,7168,ck,7,1,19.7835,a8w8_blockscale_bpreshuffle_1x128x128_256x16x64x256_16x16_16x16_16x16x1_16x16x1_1x16x1x16_4_1x1_intrawave_v1,337.63,934.07,0.0
256,208,8192,1536,asm,16,1,10.8189,_ZN5aiter42fp8gemm_bf16_blockscale_BpreShuffle_64x128E,483.83,1507.57,0.0
256,208,11264,1536,ck,15,3,13.6269,a8w8_blockscale_bpreshuffle_1x128x128_256x64x64x128_16x16_16x16_8x32x1_8x32x1_1x32x1x8_8_2x1_intrawave_v1,528.18,1636.97,0.0123
256,224,3072,1536,ck,11,0,7.7348,a8w8_blockscale_bpreshuffle_1x128x128_256x32x128x256_16x16_16x16_16x16x1_16x16x1_1x32x1x8_8_2x1_intrawave_v1,273.3,832.46,0
256,224,4096,512,ck,11,2,4.823,a8w8_blockscale_bpreshuffle_1x128x128_256x32x128x256_16x16_16x16_16x16x1_16x16x1_1x32x1x8_8_2x1_intrawave_v1,194.8,839.07,0.0
256,224,7168,2048,ck,17,3,12.3768,a8w8_blockscale_bpreshuffle_1x128x128_256x64x64x256_16x16_16x16_16x16x1_16x16x1_1x32x1x8_8_2x1_intrawave_v1,531.37,1482.62,0.0
256,224,4608,7168,asm,33,2,22.8698,_ZN5aiter42fp8gemm_bf16_blockscale_BpreShuffle_96x128E,647.03,1604.74,0.0
256,224,7168,2304,asm,16,1,13.3733,_ZN5aiter42fp8gemm_bf16_blockscale_BpreShuffle_64x128E,553.25,1513.65,0.0
256,224,128,7168,asm,15,8,8.5412,_ZN5aiter42fp8gemm_bf16_blockscale_BpreShuffle_48x128E,48.12,302.12,0.0134
256,224,2112,7168,ck,12,1,18.1848,a8w8_blockscale_bpreshuffle_1x128x128_256x32x64x256_16x16_16x16_16x16x1_16x16x1_1x32x1x8_8_2x1_intrawave_v1,372.96,972.82,0.0
256,224,2240,7168,ck,12,1,18.1415,a8w8_blockscale_bpreshuffle_1x128x128_256x32x64x256_16x16_16x16_16x16x1_16x16x1_1x32x1x8_8_2x1_intrawave_v1,396.51,1028.88,0.0
256,224,8192,1536,ck,17,0,11.0501,a8w8_blockscale_bpreshuffle_1x128x128_256x64x64x256_16x16_16x16_16x16x1_16x16x1_1x32x1x8_8_2x1_intrawave_v1,510.14,1501.98,0
256,224,11264,1536,ck,15,0,13.7163,a8w8_blockscale_bpreshuffle_1x128x128_256x64x64x128_16x16_16x16_8x32x1_8x32x1_1x32x1x8_8_2x1_intrawave_v1,565.1,1654.37,0.012
256,240,3072,1536,ck,11,0,7.7708,a8w8_blockscale_bpreshuffle_1x128x128_256x32x128x256_16x16_16x16_16x16x1_16x16x1_1x32x1x8_8_2x1_intrawave_v1,291.47,844.42,0
256,240,4096,512,ck,11,2,4.7936,a8w8_blockscale_bpreshuffle_1x128x128_256x32x128x256_16x16_16x16_16x16x1_16x16x1_1x32x1x8_8_2x1_intrawave_v1,210.0,873.27,0.0
256,240,7168,2048,asm,16,1,12.5073,_ZN5aiter42fp8gemm_bf16_blockscale_BpreShuffle_64x128E,563.39,1488.11,0.0
256,240,4608,7168,asm,25,2,23.9032,_ZN5aiter42fp8gemm_bf16_blockscale_BpreShuffle_80x128E,663.28,1546.33,0.0
256,240,7168,2304,ck,16,2,13.5012,a8w8_blockscale_bpreshuffle_1x128x128_256x64x128x256_16x16_16x16_16x16x1_16x16x1_1x32x1x8_8_2x1_intrawave_v1,587.15,1519.03,0.0
256,240,128,7168,asm,7,8,7.7842,_ZN5aiter42fp8gemm_bf16_blockscale_BpreShuffle_32x128E,56.58,346.76,0.0087
256,240,2112,7168,ck,7,3,20.2312,a8w8_blockscale_bpreshuffle_1x128x128_256x16x64x256_16x16_16x16_16x16x1_16x16x1_1x16x1x16_4_1x1_intrawave_v1,359.18,883.43,0.0
256,240,2240,7168,ck,17,0,22.073,a8w8_blockscale_bpreshuffle_1x128x128_256x64x64x256_16x16_16x16_16x16x1_16x16x1_1x32x1x8_8_2x1_intrawave_v1,349.16,854.07,0.0
256,240,8192,1536,asm,16,1,11.0477,_ZN5aiter42fp8gemm_bf16_blockscale_BpreShuffle_64x128E,546.7,1528.26,0.0
256,240,11264,1536,ck,15,3,14.0758,a8w8_blockscale_bpreshuffle_1x128x128_256x64x64x128_16x16_16x16_8x32x1_8x32x1_1x32x1x8_8_2x1_intrawave_v1,590.0,1639.47,0.0115
256,256,3072,1536,ck,12,0,7.5085,a8w8_blockscale_bpreshuffle_1x128x128_256x32x64x256_16x16_16x16_16x16x1_16x16x1_1x32x1x8_8_2x1_intrawave_v1,321.76,890.28,0
256,256,4096,512,ck,11,0,4.7913,a8w8_blockscale_bpreshuffle_1x128x128_256x32x128x256_16x16_16x16_16x16x1_16x16x1_1x32x1x8_8_2x1_intrawave_v1,224.1,902.76,0.0
256,256,7168,2048,ck,17,0,12.5436,a8w8_blockscale_bpreshuffle_1x128x128_256x64x64x256_16x16_16x16_16x16x1_16x16x1_1x32x1x8_8_2x1_intrawave_v1,599.21,1504.7,0.0
256,256,4608,7168,asm,33,2,25.5601,_ZN5aiter42fp8gemm_bf16_blockscale_BpreShuffle_96x128E,661.63,1456.35,0.0
256,256,7168,2304,asm,16,1,13.674,_ZN5aiter42fp8gemm_bf16_blockscale_BpreShuffle_64x128E,618.38,1519.3,0.0
256,256,128,7168,asm,6,7,8.1336,_ZN5aiter42fp8gemm_bf16_blockscale_BpreShuffle_32x128E,57.76,346.47,0.0058
256,256,2112,7168,ck,12,0,19.287,a8w8_blockscale_bpreshuffle_1x128x128_256x32x64x256_16x16_16x16_16x16x1_16x16x1_1x32x1x8_8_2x1_intrawave_v1,401.88,936.13,0.0
256,256,2240,7168,ck,17,2,21.5759,a8w8_blockscale_bpreshuffle_1x128x128_256x64x64x256_16x16_16x16_16x16x1_16x16x1_1x32x1x8_8_2x1_intrawave_v1,381.02,882.38,0.0
256,256,8192,1536,asm,16,1,10.6419,_ZN5aiter42fp8gemm_bf16_blockscale_BpreShuffle_64x128E,605.39,1613.47,0.0
256,256,11264,1536,ck,15,0,14.24,a8w8_blockscale_bpreshuffle_1x128x128_256x64x64x128_16x16_16x16_8x32x1_8x32x1_1x32x1x8_8_2x1_intrawave_v1,622.08,1647.6,0.0011
256,288,3072,1536,ck,17,0,7.9157,a8w8_blockscale_bpreshuffle_1x128x128_256x64x64x256_16x16_16x16_16x16x1_16x16x1_1x32x1x8_8_2x1_intrawave_v1,343.36,875.53,0
256,288,4096,512,ck,12,1,5.7603,a8w8_blockscale_bpreshuffle_1x128x128_256x32x64x256_16x16_16x16_16x16x1_16x16x1_1x32x1x8_8_2x1_intrawave_v1,209.7,799.25,0.0
256,288,7168,2048,asm,24,1,13.7051,_ZN5aiter42fp8gemm_bf16_blockscale_BpreShuffle_80x128E,616.98,1415.43,0.0
256,288,4608,7168,asm,33,2,26.6528,_ZN5aiter42fp8gemm_bf16_blockscale_BpreShuffle_96x128E,713.82,1416.31,0.0
256,288,7168,2304,asm,24,1,14.1789,_ZN5aiter42fp8gemm_bf16_blockscale_BpreShuffle_80x128E,670.9,1502.75,0.0
256,288,128,7168,asm,15,8,8.4151,_ZN5aiter42fp8gemm_bf16_blockscale_BpreShuffle_48x128E,62.8,363.11,0.0022
256,288,2112,7168,ck,12,0,19.8441,a8w8_blockscale_bpreshuffle_1x128x128_256x32x64x256_16x16_16x16_16x16x1_16x16x1_1x32x1x8_8_2x1_intrawave_v1,439.42,928.22,0.0
256,288,2240,7168,ck,12,2,20.1114,a8w8_blockscale_bpreshuffle_1x128x128_256x32x64x256_16x16_16x16_16x16x1_16x16x1_1x32x1x8_8_2x1_intrawave_v1,459.86,965.17,0.0
256,288,8192,1536,asm,24,1,11.5728,_ZN5aiter42fp8gemm_bf16_blockscale_BpreShuffle_80x128E,626.28,1533.24,0.0
256,288,11264,1536,ck,14,3,15.1537,a8w8_blockscale_bpreshuffle_1x128x128_256x64x128x128_16x16_16x16_8x32x1_8x32x1_1x32x1x8_8_2x1_intrawave_v1,657.64,1599.08,0.0
256,320,3072,1536,ck,12,3,8.2119,a8w8_blockscale_bpreshuffle_1x128x128_256x32x64x256_16x16_16x16_16x16x1_16x16x1_1x32x1x8_8_2x1_intrawave_v1,367.75,873.88,0.0
256,320,4096,512,ck,12,0,5.7154,a8w8_blockscale_bpreshuffle_1x128x128_256x32x64x256_16x16_16x16_16x16x1_16x16x1_1x32x1x8_8_2x1_intrawave_v1,234.84,854.26,0
256,320,7168,2048,asm,24,1,13.8928,_ZN5aiter42fp8gemm_bf16_blockscale_BpreShuffle_80x128E,676.27,1434.05,0.0
256,320,4608,7168,asm,8,1,29.1816,_ZN5aiter42fp8gemm_bf16_blockscale_BpreShuffle_48x128E,724.4,1311.55,0.0
256,320,7168,2304,asm,24,1,14.9345,_ZN5aiter42fp8gemm_bf16_blockscale_BpreShuffle_80x128E,707.73,1462.38,0.0
256,320,128,7168,asm,7,8,8.3181,_ZN5aiter42fp8gemm_bf16_blockscale_BpreShuffle_32x128E,70.59,395.91,0.0066
256,320,2112,7168,ck,17,3,21.4147,a8w8_blockscale_bpreshuffle_1x128x128_256x64x64x256_16x16_16x16_16x16x1_16x16x1_1x32x1x8_8_2x1_intrawave_v1,452.44,877.17,0.0
256,320,2240,7168,ck,17,0,21.2539,a8w8_blockscale_bpreshuffle_1x128x128_256x64x64x256_16x16_16x16_16x16x1_16x16x1_1x32x1x8_8_2x1_intrawave_v1,483.49,930.83,0.0
256,320,8192,1536,asm,24,1,12.3507,_ZN5aiter42fp8gemm_bf16_blockscale_BpreShuffle_80x128E,652.03,1483.1,0.0
256,320,11264,1536,ck,14,3,15.3123,a8w8_blockscale_bpreshuffle_1x128x128_256x64x128x128_16x16_16x16_8x32x1_8x32x1_1x32x1x8_8_2x1_intrawave_v1,723.14,1632.8,0.0
256,352,3072,1536,ck,12,2,8.8327,a8w8_blockscale_bpreshuffle_1x128x128_256x32x64x256_16x16_16x16_16x16x1_16x16x1_1x32x1x8_8_2x1_intrawave_v1,376.09,840.28,0.0
256,352,4096,512,ck,12,2,5.8572,a8w8_blockscale_bpreshuffle_1x128x128_256x32x64x256_16x16_16x16_16x16x1_16x16x1_1x32x1x8_8_2x1_intrawave_v1,252.06,881.13,0.0
256,352,7168,2048,ck,15,3,15.9963,a8w8_blockscale_bpreshuffle_1x128x128_256x64x64x128_16x16_16x16_8x32x1_8x32x1_1x32x1x8_8_2x1_intrawave_v1,646.07,1278.25,0.0137
256,352,4608,7168,asm,41,2,29.3262,_ZN5aiter43fp8gemm_bf16_blockscale_BpreShuffle_128x128E,792.92,1322.96,0.0
256,352,7168,2304,ck,15,1,18.1549,a8w8_blockscale_bpreshuffle_1x128x128_256x64x64x128_16x16_16x16_8x32x1_8x32x1_1x32x1x8_8_2x1_intrawave_v1,640.41,1232.3,0.0137
256,352,128,7168,asm,7,8,8.7962,_ZN5aiter42fp8gemm_bf16_blockscale_BpreShuffle_32x128E,73.43,401.4,0.0107
256,352,2112,7168,ck,17,3,22.0945,a8w8_blockscale_bpreshuffle_1x128x128_256x64x64x256_16x16_16x16_16x16x1_16x16x1_1x32x1x8_8_2x1_intrawave_v1,482.37,866.68,0.0
256,352,2240,7168,ck,17,2,22.225,a8w8_blockscale_bpreshuffle_1x128x128_256x64x64x256_16x16_16x16_16x16x1_16x16x1_1x32x1x8_8_2x1_intrawave_v1,508.6,906.93,0.0
256,352,8192,1536,asm,32,1,13.257,_ZN5aiter42fp8gemm_bf16_blockscale_BpreShuffle_96x128E,668.2,1424.96,0.0
256,352,11264,1536,ck,8,3,17.6526,a8w8_blockscale_bpreshuffle_1x128x128_256x32x256x128_16x16_16x16_8x32x1_8x32x1_1x32x1x8_8_2x1_intrawave_v1,690.0,1459.96,0.0
256,384,3072,1536,ck,10,1,9.3199,a8w8_blockscale_bpreshuffle_1x128x128_256x32x64x128_16x16_16x16_8x32x1_8x32x1_1x32x1x8_8_2x1_intrawave_v1,388.83,822.72,0.0225
256,384,4096,512,ck,12,1,5.9036,a8w8_blockscale_bpreshuffle_1x128x128_256x32x64x256_16x16_16x16_16x16x1_16x16x1_1x32x1x8_8_2x1_intrawave_v1,272.82,921.38,0.0
256,384,7168,2048,asm,32,1,14.8117,_ZN5aiter42fp8gemm_bf16_blockscale_BpreShuffle_96x128E,761.17,1415.88,0.0
256,384,4608,7168,asm,41,2,30.7791,_ZN5aiter43fp8gemm_bf16_blockscale_BpreShuffle_128x128E,824.17,1277.54,0.0
256,384,7168,2304,asm,32,1,17.3615,_ZN5aiter42fp8gemm_bf16_blockscale_BpreShuffle_96x128E,730.56,1319.29,0.0
256,384,128,7168,asm,31,8,9.6024,_ZN5aiter42fp8gemm_bf16_blockscale_BpreShuffle_80x128E,73.38,392.44,0.0112
256,384,2112,7168,ck,17,0,21.5422,a8w8_blockscale_bpreshuffle_1x128x128_256x64x64x256_16x16_16x16_16x16x1_16x16x1_1x32x1x8_8_2x1_intrawave_v1,539.71,905.82,0.0
256,384,2240,7168,ck,17,3,21.6497,a8w8_blockscale_bpreshuffle_1x128x128_256x64x64x256_16x16_16x16_16x16x1_16x16x1_1x32x1x8_8_2x1_intrawave_v1,569.58,948.24,0.0
256,384,8192,1536,asm,32,1,13.1496,_ZN5aiter42fp8gemm_bf16_blockscale_BpreShuffle_96x128E,734.9,1480.21,0.0
256,384,11264,1536,ck,14,3,18.6755,a8w8_blockscale_bpreshuffle_1x128x128_256x64x128x128_16x16_16x16_8x32x1_8x32x1_1x32x1x8_8_2x1_intrawave_v1,711.5,1421.22,0.0
256,416,3072,1536,ck,12,1,9.7029,a8w8_blockscale_bpreshuffle_1x128x128_256x32x64x256_16x16_16x16_16x16x1_16x16x1_1x32x1x8_8_2x1_intrawave_v1,404.61,815.58,0.0
256,416,4096,512,ck,11,0,6.3357,a8w8_blockscale_bpreshuffle_1x128x128_256x32x128x256_16x16_16x16_16x16x1_16x16x1_1x32x1x8_8_2x1_intrawave_v1,275.4,902.51,0
256,416,7168,2048,ck,14,1,16.7666,a8w8_blockscale_bpreshuffle_1x128x128_256x64x128x128_16x16_16x16_8x32x1_8x32x1_1x32x1x8_8_2x1_intrawave_v1,728.46,1282.06,0.0001
256,416,4608,7168,asm,16,1,30.9257,_ZN5aiter42fp8gemm_bf16_blockscale_BpreShuffle_64x128E,888.62,1288.44,0.0
256,416,7168,2304,asm,40,1,18.6971,_ZN5aiter43fp8gemm_bf16_blockscale_BpreShuffle_128x128E,734.9,1253.53,0.0
256,416,128,7168,asm,7,8,8.5054,_ZN5aiter42fp8gemm_bf16_blockscale_BpreShuffle_32x128E,89.75,470.98,0.0061
256,416,2112,7168,ck,17,2,22.2431,a8w8_blockscale_bpreshuffle_1x128x128_256x64x64x256_16x16_16x16_16x16x1_16x16x1_1x32x1x8_8_2x1_intrawave_v1,566.27,893.67,0.0
256,416,2240,7168,ck,17,2,22.4992,a8w8_blockscale_bpreshuffle_1x128x128_256x64x64x256_16x16_16x16_16x16x1_16x16x1_1x32x1x8_8_2x1_intrawave_v1,593.75,929.01,0.0
256,416,8192,1536,ck,14,3,15.0323,a8w8_blockscale_bpreshuffle_1x128x128_256x64x128x128_16x16_16x16_8x32x1_8x32x1_1x32x1x8_8_2x1_intrawave_v1,696.43,1332.97,0.0
256,416,11264,1536,ck,14,3,19.5392,a8w8_blockscale_bpreshuffle_1x128x128_256x64x128x128_16x16_16x16_8x32x1_8x32x1_1x32x1x8_8_2x1_intrawave_v1,736.72,1397.81,0.0001
256,448,3072,1536,ck,11,1,9.7595,a8w8_blockscale_bpreshuffle_1x128x128_256x32x128x256_16x16_16x16_16x16x1_16x16x1_1x32x1x8_8_2x1_intrawave_v1,433.2,836.03,0.0
256,448,4096,512,ck,16,3,6.3258,a8w8_blockscale_bpreshuffle_1x128x128_256x64x128x256_16x16_16x16_16x16x1_16x16x1_1x32x1x8_8_2x1_intrawave_v1,297.05,947.95,0.0
256,448,7168,2048,ck,14,1,16.7109,a8w8_blockscale_bpreshuffle_1x128x128_256x64x128x128_16x16_16x16_8x32x1_8x32x1_1x32x1x8_8_2x1_intrawave_v1,787.11,1317.71,0.0001
256,448,4608,7168,asm,16,1,31.2127,_ZN5aiter42fp8gemm_bf16_blockscale_BpreShuffle_64x128E,948.17,1293.39,0.0
256,448,7168,2304,ck,14,2,18.8634,a8w8_blockscale_bpreshuffle_1x128x128_256x64x128x128_16x16_16x16_8x32x1_8x32x1_1x32x1x8_8_2x1_intrawave_v1,784.46,1270.7,0.0
256,448,128,7168,asm,7,8,9.3659,_ZN5aiter42fp8gemm_bf16_blockscale_BpreShuffle_32x128E,87.77,453.08,0.0115
256,448,2112,7168,ck,17,0,21.4387,a8w8_blockscale_bpreshuffle_1x128x128_256x64x64x256_16x16_16x16_16x16x1_16x16x1_1x32x1x8_8_2x1_intrawave_v1,632.71,944.2,0.0
256,448,2240,7168,ck,17,0,21.7719,a8w8_blockscale_bpreshuffle_1x128x128_256x64x64x256_16x16_16x16_16x16x1_16x16x1_1x32x1x8_8_2x1_intrawave_v1,660.78,977.16,0.0
256,448,8192,1536,ck,14,1,15.0331,a8w8_blockscale_bpreshuffle_1x128x128_256x64x128x128_16x16_16x16_8x32x1_8x32x1_1x32x1x8_8_2x1_intrawave_v1,749.96,1371.05,0.0
256,448,11264,1536,ck,14,3,19.5201,a8w8_blockscale_bpreshuffle_1x128x128_256x64x128x128_16x16_16x16_8x32x1_8x32x1_1x32x1x8_8_2x1_intrawave_v1,794.16,1438.63,0.0001
256,480,3072,1536,ck,12,3,9.6774,a8w8_blockscale_bpreshuffle_1x128x128_256x32x64x256_16x16_16x16_16x16x1_16x16x1_1x32x1x8_8_2x1_intrawave_v1,468.09,868.52,0.0
256,480,4096,512,ck,2,0,6.2848,a8w8_blockscale_bpreshuffle_1x128x128_256x64x64x128_16x16_16x16_8x32x1_8x32x1_1x32x1x8_8_2x1_intrawave_v3,320.34,998.45,0.0116
256,480,7168,2048,ck,14,0,17.1345,a8w8_blockscale_bpreshuffle_1x128x128_256x64x128x128_16x16_16x16_8x32x1_8x32x1_1x32x1x8_8_2x1_intrawave_v1,822.48,1315.73,0.0001
256,480,4608,7168,asm,24,1,33.5143,_ZN5aiter42fp8gemm_bf16_blockscale_BpreShuffle_80x128E,946.13,1220.21,0.0
256,480,7168,2304,asm,40,1,19.244,_ZN5aiter43fp8gemm_bf16_blockscale_BpreShuffle_128x128E,823.87,1273.24,0.0
256,480,128,7168,asm,15,8,9.0494,_ZN5aiter42fp8gemm_bf16_blockscale_BpreShuffle_48x128E,97.33,495.17,0.01
256,480,2112,7168,ck,12,0,23.7018,a8w8_blockscale_bpreshuffle_1x128x128_256x32x64x256_16x16_16x16_16x16x1_16x16x1_1x32x1x8_8_2x1_intrawave_v1,613.17,869.43,0.0
256,480,2240,7168,ck,10,3,29.6138,a8w8_blockscale_bpreshuffle_1x128x128_256x32x64x128_16x16_16x16_8x32x1_8x32x1_1x32x1x8_8_2x1_intrawave_v1,520.5,730.99,0.0198
256,480,8192,1536,ck,14,2,15.2122,a8w8_blockscale_bpreshuffle_1x128x128_256x64x128x128_16x16_16x16_8x32x1_8x32x1_1x32x1x8_8_2x1_intrawave_v1,794.07,1392.6,0.0
256,480,11264,1536,ck,14,1,19.9085,a8w8_blockscale_bpreshuffle_1x128x128_256x64x128x128_16x16_16x16_8x32x1_8x32x1_1x32x1x8_8_2x1_intrawave_v1,834.29,1449.24,0.0002
256,512,3072,1536,ck,12,0,10.3254,a8w8_blockscale_bpreshuffle_1x128x128_256x32x64x256_16x16_16x16_16x16x1_16x16x1_1x32x1x8_8_2x1_intrawave_v1,467.96,837.81,0
256,512,4096,512,ck,16,0,6.3359,a8w8_blockscale_bpreshuffle_1x128x128_256x64x128x256_16x16_16x16_16x16x1_16x16x1_1x32x1x8_8_2x1_intrawave_v1,338.94,1034.36,0
256,512,7168,2048,ck,14,0,17.153,a8w8_blockscale_bpreshuffle_1x128x128_256x64x128x128_16x16_16x16_8x32x1_8x32x1_1x32x1x8_8_2x1_intrawave_v1,876.37,1344.88,0.0001
256,512,4608,7168,asm,24,1,33.4546,_ZN5aiter42fp8gemm_bf16_blockscale_BpreShuffle_80x128E,1011.01,1238.06,0.0
256,512,7168,2304,asm,40,1,19.102,_ZN5aiter43fp8gemm_bf16_blockscale_BpreShuffle_128x128E,885.32,1310.58,0.0
256,512,128,7168,asm,14,7,9.3667,_ZN5aiter42fp8gemm_bf16_blockscale_BpreShuffle_48x128E,100.3,503.76,0.0058
256,512,2112,7168,ck,17,1,28.0195,a8w8_blockscale_bpreshuffle_1x128x128_256x64x64x256_16x16_16x16_16x16x1_16x16x1_1x32x1x8_8_2x1_intrawave_v1,553.26,748.46,0.0
256,512,2240,7168,ck,15,3,31.3983,a8w8_blockscale_bpreshuffle_1x128x128_256x64x64x128_16x16_16x16_8x32x1_8x32x1_1x32x1x8_8_2x1_intrawave_v1,523.65,701.31,0.0006
256,512,8192,1536,ck,14,2,15.1464,a8w8_blockscale_bpreshuffle_1x128x128_256x64x128x128_16x16_16x16_8x32x1_8x32x1_1x32x1x8_8_2x1_intrawave_v1,850.69,1436.51,0.0001
256,512,11264,1536,ck,14,1,20.0605,a8w8_blockscale_bpreshuffle_1x128x128_256x64x128x128_16x16_16x16_8x32x1_8x32x1_1x32x1x8_8_2x1_intrawave_v1,883.17,1476.65,0.0001
256,544,3072,1536,ck,11,1,10.4856,a8w8_blockscale_bpreshuffle_1x128x128_256x32x128x256_16x16_16x16_16x16x1_16x16x1_1x32x1x8_8_2x1_intrawave_v1,489.61,848.45,0.0
256,544,4096,512,ck,11,0,6.5542,a8w8_blockscale_bpreshuffle_1x128x128_256x32x128x256_16x16_16x16_16x16x1_16x16x1_1x32x1x8_8_2x1_intrawave_v1,348.13,1042.4,0
256,544,7168,2048,ck,14,3,17.7698,a8w8_blockscale_bpreshuffle_1x128x128_256x64x128x128_16x16_16x16_8x32x1_8x32x1_1x32x1x8_8_2x1_intrawave_v1,898.82,1327.7,0.0001
256,544,4608,7168,asm,24,1,34.0193,_ZN5aiter42fp8gemm_bf16_blockscale_BpreShuffle_80x128E,1056.36,1232.92,0.0
256,544,7168,2304,ck,14,1,20.1601,a8w8_blockscale_bpreshuffle_1x128x128_256x64x128x128_16x16_16x16_8x32x1_8x32x1_1x32x1x8_8_2x1_intrawave_v1,891.29,1268.21,0.0
256,544,128,7168,asm,7,8,8.7489,_ZN5aiter42fp8gemm_bf16_blockscale_BpreShuffle_32x128E,114.1,566.49,0.0061
256,544,2112,7168,ck,17,0,29.7409,a8w8_blockscale_bpreshuffle_1x128x128_256x64x64x256_16x16_16x16_16x16x1_16x16x1_1x32x1x8_8_2x1_intrawave_v1,553.82,717.4,0.0
256,544,2240,7168,ck,17,0,29.9084,a8w8_blockscale_bpreshuffle_1x128x128_256x64x64x256_16x16_16x16_16x16x1_16x16x1_1x32x1x8_8_2x1_intrawave_v1,584.09,748.71,0.0
256,544,8192,1536,ck,14,1,19.3656,a8w8_blockscale_bpreshuffle_1x128x128_256x64x128x128_16x16_16x16_8x32x1_8x32x1_1x32x1x8_8_2x1_intrawave_v1,706.93,1153.15,0.0001
256,544,11264,1536,ck,13,1,22.4778,a8w8_blockscale_bpreshuffle_1x128x128_256x64x256x128_16x16_16x16_8x32x1_8x32x1_1x32x1x8_8_2x1_intrawave_v1,837.45,1352.1,0.0
256,576,3072,1536,ck,11,1,10.5727,a8w8_blockscale_bpreshuffle_1x128x128_256x32x128x256_16x16_16x16_16x16x1_16x16x1_1x32x1x8_8_2x1_intrawave_v1,514.14,864.71,0.0
256,576,4096,512,ck,11,0,6.4566,a8w8_blockscale_bpreshuffle_1x128x128_256x32x128x256_16x16_16x16_16x16x1_16x16x1_1x32x1x8_8_2x1_intrawave_v1,374.18,1101.3,0
256,576,7168,2048,ck,14,3,17.6484,a8w8_blockscale_bpreshuffle_1x128x128_256x64x128x128_16x16_16x16_8x32x1_8x32x1_1x32x1x8_8_2x1_intrawave_v1,958.24,1366.54,0.0001
256,576,4608,7168,asm,32,1,36.4035,_ZN5aiter42fp8gemm_bf16_blockscale_BpreShuffle_96x128E,1045.25,1166.57,0.0
256,576,7168,2304,ck,14,1,20.0346,a8w8_blockscale_bpreshuffle_1x128x128_256x64x128x128_16x16_16x16_8x32x1_8x32x1_1x32x1x8_8_2x1_intrawave_v1,949.63,1302.73,0.0
256,576,128,7168,asm,6,7,9.4592,_ZN5aiter42fp8gemm_bf16_blockscale_BpreShuffle_32x128E,111.74,549.07,0.0087
256,576,2112,7168,ck,17,0,29.3292,a8w8_blockscale_bpreshuffle_1x128x128_256x64x64x256_16x16_16x16_16x16x1_16x16x1_1x32x1x8_8_2x1_intrawave_v1,594.63,739.9,0
256,576,2240,7168,ck,17,0,29.4991,a8w8_blockscale_bpreshuffle_1x128x128_256x64x64x256_16x16_16x16_16x16x1_16x16x1_1x32x1x8_8_2x1_intrawave_v1,627.03,771.74,0
256,576,8192,1536,ck,14,3,19.2608,a8w8_blockscale_bpreshuffle_1x128x128_256x64x128x128_16x16_16x16_8x32x1_8x32x1_1x32x1x8_8_2x1_intrawave_v1,752.59,1189.19,0.0
256,576,11264,1536,ck,13,3,22.5761,a8w8_blockscale_bpreshuffle_1x128x128_256x64x256x128_16x16_16x16_8x32x1_8x32x1_1x32x1x8_8_2x1_intrawave_v1,882.85,1380.33,0.0
256,608,3072,1536,ck,11,0,10.6415,a8w8_blockscale_bpreshuffle_1x128x128_256x32x128x256_16x16_16x16_16x16x1_16x16x1_1x32x1x8_8_2x1_intrawave_v1,539.19,882.21,0.0
256,608,4096,512,ck,11,0,6.5322,a8w8_blockscale_bpreshuffle_1x128x128_256x32x128x256_16x16_16x16_16x16x1_16x16x1_1x32x1x8_8_2x1_intrawave_v1,390.39,1131.19,0
256,608,7168,2048,ck,14,0,22.1034,a8w8_blockscale_bpreshuffle_1x128x128_256x64x128x128_16x16_16x16_8x32x1_8x32x1_1x32x1x8_8_2x1_intrawave_v1,807.61,1114.83,0.0001
256,608,4608,7168,asm,32,1,36.8876,_ZN5aiter42fp8gemm_bf16_blockscale_BpreShuffle_96x128E,1088.84,1165.48,0.0
256,608,7168,2304,ck,14,1,24.7051,a8w8_blockscale_bpreshuffle_1x128x128_256x64x128x128_16x16_16x16_8x32x1_8x32x1_1x32x1x8_8_2x1_intrawave_v1,812.88,1078.0,0.0
256,608,128,7168,asm,7,8,9.4973,_ZN5aiter42fp8gemm_bf16_blockscale_BpreShuffle_32x128E,117.47,571.88,0.0079
256,608,2112,7168,ck,12,0,30.4959,a8w8_blockscale_bpreshuffle_1x128x128_256x32x64x256_16x16_16x16_16x16x1_16x16x1_1x32x1x8_8_2x1_intrawave_v1,603.65,723.54,0.0
256,608,2240,7168,ck,12,0,31.2891,a8w8_blockscale_bpreshuffle_1x128x128_256x32x64x256_16x16_16x16_16x16x1_16x16x1_1x32x1x8_8_2x1_intrawave_v1,624.0,739.5,0.0
256,608,8192,1536,ck,14,0,19.506,a8w8_blockscale_bpreshuffle_1x128x128_256x64x128x128_16x16_16x16_8x32x1_8x32x1_1x32x1x8_8_2x1_intrawave_v1,784.42,1203.64,0.0001
256,608,11264,1536,ck,13,0,22.9322,a8w8_blockscale_bpreshuffle_1x128x128_256x64x256x128_16x16_16x16_8x32x1_8x32x1_1x32x1x8_8_2x1_intrawave_v1,917.43,1392.47,0.0
256,640,3072,1536,ck,17,1,11.0174,a8w8_blockscale_bpreshuffle_1x128x128_256x64x64x256_16x16_16x16_16x16x1_16x16x1_1x32x1x8_8_2x1_intrawave_v1,548.21,874.42,0.0
256,640,4096,512,ck,12,0,6.9388,a8w8_blockscale_bpreshuffle_1x128x128_256x32x64x256_16x16_16x16_16x16x1_16x16x1_1x32x1x8_8_2x1_intrawave_v1,386.86,1105.05,0
256,640,7168,2048,ck,14,3,21.8009,a8w8_blockscale_bpreshuffle_1x128x128_256x64x128x128_16x16_16x16_8x32x1_8x32x1_1x32x1x8_8_2x1_intrawave_v1,861.91,1154.35,0.0001
256,640,4608,7168,asm,32,1,38.4839,_ZN5aiter42fp8gemm_bf16_blockscale_BpreShuffle_96x128E,1098.6,1130.76,0.0
256,640,7168,2304,ck,14,3,24.4852,a8w8_blockscale_bpreshuffle_1x128x128_256x64x128x128_16x16_16x16_8x32x1_8x32x1_1x32x1x8_8_2x1_intrawave_v1,863.35,1109.43,0.0001
256,640,128,7168,asm,15,8,9.017,_ZN5aiter42fp8gemm_bf16_blockscale_BpreShuffle_48x128E,130.24,628.69,0.0138
256,640,2112,7168,ck,12,3,31.0586,a8w8_blockscale_bpreshuffle_1x128x128_256x32x64x256_16x16_16x16_16x16x1_16x16x1_1x32x1x8_8_2x1_intrawave_v1,623.91,722.17,0.0
256,640,2240,7168,ck,17,0,31.3738,a8w8_blockscale_bpreshuffle_1x128x128_256x64x64x256_16x16_16x16_16x16x1_16x16x1_1x32x1x8_8_2x1_intrawave_v1,655.07,749.38,0.0
256,640,8192,1536,ck,14,2,19.2185,a8w8_blockscale_bpreshuffle_1x128x128_256x64x128x128_16x16_16x16_8x32x1_8x32x1_1x32x1x8_8_2x1_intrawave_v1,838.05,1251.49,0.0001
256,640,11264,1536,ck,13,3,23.1444,a8w8_blockscale_bpreshuffle_1x128x128_256x64x256x128_16x16_16x16_8x32x1_8x32x1_1x32x1x8_8_2x1_intrawave_v1,956.86,1412.98,0.0
256,672,3072,1536,ck,11,0,11.1656,a8w8_blockscale_bpreshuffle_1x128x128_256x32x128x256_16x16_16x16_16x16x1_16x16x1_1x32x1x8_8_2x1_intrawave_v1,567.98,884.82,0
256,672,4096,512,ck,9,0,7.2846,a8w8_blockscale_bpreshuffle_1x128x128_256x32x128x128_16x16_16x16_8x32x1_8x32x1_1x32x1x8_8_2x1_intrawave_v1,386.92,1090.83,0
256,672,7168,2048,ck,14,2,22.5385,a8w8_blockscale_bpreshuffle_1x128x128_256x64x128x128_16x16_16x16_8x32x1_8x32x1_1x32x1x8_8_2x1_intrawave_v1,875.39,1139.83,0.0001
256,672,4608,7168,asm,32,1,37.6267,_ZN5aiter42fp8gemm_bf16_blockscale_BpreShuffle_96x128E,1179.81,1170.45,0.0
256,672,7168,2304,ck,14,0,25.263,a8w8_blockscale_bpreshuffle_1x128x128_256x64x128x128_16x16_16x16_8x32x1_8x32x1_1x32x1x8_8_2x1_intrawave_v1,878.61,1096.35,0.0001
256,672,128,7168,asm,6,7,9.6219,_ZN5aiter42fp8gemm_bf16_blockscale_BpreShuffle_32x128E,128.16,613.85,0.0047
256,672,2112,7168,ck,17,2,32.2248,a8w8_blockscale_bpreshuffle_1x128x128_256x64x64x256_16x16_16x16_16x16x1_16x16x1_1x32x1x8_8_2x1_intrawave_v1,631.39,707.35,0.0
256,672,2240,7168,ck,17,0,32.7518,a8w8_blockscale_bpreshuffle_1x128x128_256x64x64x256_16x16_16x16_16x16x1_16x16x1_1x32x1x8_8_2x1_intrawave_v1,658.89,729.24,0
256,672,8192,1536,ck,14,0,19.8966,a8w8_blockscale_bpreshuffle_1x128x128_256x64x128x128_16x16_16x16_8x32x1_8x32x1_1x32x1x8_8_2x1_intrawave_v1,849.97,1237.66,0.0001
256,672,11264,1536,ck,13,3,23.3473,a8w8_blockscale_bpreshuffle_1x128x128_256x64x256x128_16x16_16x16_8x32x1_8x32x1_1x32x1x8_8_2x1_intrawave_v1,995.97,1433.68,0.0
256,704,3072,1536,asm,24,1,12.2575,_ZN5aiter42fp8gemm_bf16_blockscale_BpreShuffle_80x128E,542.02,826.05,0.0
256,704,4096,512,ck,9,0,7.2722,a8w8_blockscale_bpreshuffle_1x128x128_256x32x128x128_16x16_16x16_8x32x1_8x32x1_1x32x1x8_8_2x1_intrawave_v1,406.04,1130.99,0
256,704,7168,2048,ck,14,3,22.2333,a8w8_blockscale_bpreshuffle_1x128x128_256x64x128x128_16x16_16x16_8x32x1_8x32x1_1x32x1x8_8_2x1_intrawave_v1,929.67,1179.06,0.0002
256,704,4608,7168,asm,40,1,44.1321,_ZN5aiter43fp8gemm_bf16_blockscale_BpreShuffle_128x128E,1053.8,1009.8,0.0
256,704,7168,2304,ck,14,0,24.77,a8w8_blockscale_bpreshuffle_1x128x128_256x64x128x128_16x16_16x16_8x32x1_8x32x1_1x32x1x8_8_2x1_intrawave_v1,938.77,1139.67,0.0001
256,704,128,7168,asm,7,8,9.6443,_ZN5aiter42fp8gemm_bf16_blockscale_BpreShuffle_32x128E,133.95,637.06,0.0097
256,704,2112,7168,ck,17,2,31.5498,a8w8_blockscale_bpreshuffle_1x128x128_256x64x64x256_16x16_16x16_16x16x1_16x16x1_1x32x1x8_8_2x1_intrawave_v1,675.61,734.04,0.0
256,704,2240,7168,ck,17,2,31.8007,a8w8_blockscale_bpreshuffle_1x128x128_256x64x64x256_16x16_16x16_16x16x1_16x16x1_1x32x1x8_8_2x1_intrawave_v1,710.91,762.77,0.0
256,704,8192,1536,ck,14,1,19.8748,a8w8_blockscale_bpreshuffle_1x128x128_256x64x128x128_16x16_16x16_8x32x1_8x32x1_1x32x1x8_8_2x1_intrawave_v1,891.42,1267.87,0.0002
256,704,11264,1536,ck,13,2,23.4518,a8w8_blockscale_bpreshuffle_1x128x128_256x64x256x128_16x16_16x16_8x32x1_8x32x1_1x32x1x8_8_2x1_intrawave_v1,1038.75,1460.13,0.0
256,736,3072,1536,asm,24,1,12.1358,_ZN5aiter42fp8gemm_bf16_blockscale_BpreShuffle_80x128E,572.34,854.58,0.0
256,736,4096,512,ck,2,3,7.7288,a8w8_blockscale_bpreshuffle_1x128x128_256x64x64x128_16x16_16x16_8x32x1_8x32x1_1x32x1x8_8_2x1_intrawave_v3,399.42,1100.21,0.0001
256,736,7168,2048,ck,14,0,22.9481,a8w8_blockscale_bpreshuffle_1x128x128_256x64x128x128_16x16_16x16_8x32x1_8x32x1_1x32x1x8_8_2x1_intrawave_v1,941.65,1165.18,0.0002
256,736,4608,7168,ck,14,0,46.8222,a8w8_blockscale_bpreshuffle_1x128x128_256x64x128x128_16x16_16x16_8x32x1_8x32x1_1x32x1x8_8_2x1_intrawave_v1,1038.4,962.98,0.0
256,736,7168,2304,ck,14,1,25.8464,a8w8_blockscale_bpreshuffle_1x128x128_256x64x128x128_16x16_16x16_8x32x1_8x32x1_1x32x1x8_8_2x1_intrawave_v1,940.56,1112.81,0.0001
256,736,128,7168,asm,15,8,9.1623,_ZN5aiter42fp8gemm_bf16_blockscale_BpreShuffle_48x128E,147.4,696.5,0.0078
256,736,2112,7168,ck,17,3,31.7043,a8w8_blockscale_bpreshuffle_1x128x128_256x64x64x256_16x16_16x16_16x16x1_16x16x1_1x32x1x8_8_2x1_intrawave_v1,702.88,741.96,0.0
256,736,2240,7168,ck,17,3,32.8531,a8w8_blockscale_bpreshuffle_1x128x128_256x64x64x256_16x16_16x16_16x16x1_16x16x1_1x32x1x8_8_2x1_intrawave_v1,719.41,749.68,0.0
256,736,8192,1536,ck,14,3,20.4225,a8w8_blockscale_bpreshuffle_1x128x128_256x64x128x128_16x16_16x16_8x32x1_8x32x1_1x32x1x8_8_2x1_intrawave_v1,906.94,1261.94,0.0002
256,736,11264,1536,ck,14,3,28.1025,a8w8_blockscale_bpreshuffle_1x128x128_256x64x128x128_16x16_16x16_8x32x1_8x32x1_1x32x1x8_8_2x1_intrawave_v1,906.25,1245.89,0.0002
256,768,3072,1536,ck,15,3,12.7279,a8w8_blockscale_bpreshuffle_1x128x128_256x64x64x128_16x16_16x16_8x32x1_8x32x1_1x32x1x8_8_2x1_intrawave_v1,569.44,834.14,0.0009
256,768,4096,512,ck,9,0,7.1138,a8w8_blockscale_bpreshuffle_1x128x128_256x32x128x128_16x16_16x16_8x32x1_8x32x1_1x32x1x8_8_2x1_intrawave_v1,452.81,1234.48,0
256,768,7168,2048,ck,14,1,22.8152,a8w8_blockscale_bpreshuffle_1x128x128_256x64x128x128_16x16_16x16_8x32x1_8x32x1_1x32x1x8_8_2x1_intrawave_v1,988.31,1194.95,0.0003
256,768,4608,7168,asm,40,1,46.251,_ZN5aiter43fp8gemm_bf16_blockscale_BpreShuffle_128x128E,1096.93,986.21,0.0
256,768,7168,2304,ck,14,1,25.3116,a8w8_blockscale_bpreshuffle_1x128x128_256x64x128x128_16x16_16x16_8x32x1_8x32x1_1x32x1x8_8_2x1_intrawave_v1,1002.19,1157.36,0.0001
256,768,128,7168,asm,14,7,9.7826,_ZN5aiter42fp8gemm_bf16_blockscale_BpreShuffle_48x128E,144.06,676.62,0.0017
256,768,2112,7168,ck,17,0,31.2224,a8w8_blockscale_bpreshuffle_1x128x128_256x64x64x256_16x16_16x16_16x16x1_16x16x1_1x32x1x8_8_2x1_intrawave_v1,744.76,765.09,0.0
256,768,2240,7168,ck,17,2,32.4117,a8w8_blockscale_bpreshuffle_1x128x128_256x64x64x256_16x16_16x16_16x16x1_16x16x1_1x32x1x8_8_2x1_intrawave_v1,760.91,771.39,0.0
256,768,8192,1536,ck,14,3,20.1874,a8w8_blockscale_bpreshuffle_1x128x128_256x64x128x128_16x16_16x16_8x32x1_8x32x1_1x32x1x8_8_2x1_intrawave_v1,957.4,1305.05,0.0002
256,768,11264,1536,ck,14,0,27.8839,a8w8_blockscale_bpreshuffle_1x128x128_256x64x128x128_16x16_16x16_8x32x1_8x32x1_1x32x1x8_8_2x1_intrawave_v1,953.06,1283.27,0.0002
256,800,3072,1536,asm,24,1,12.0527,_ZN5aiter42fp8gemm_bf16_blockscale_BpreShuffle_80x128E,626.39,901.26,0.0
256,800,4096,512,ck,16,0,7.9615,a8w8_blockscale_bpreshuffle_1x128x128_256x64x128x256_16x16_16x16_16x16x1_16x16x1_1x32x1x8_8_2x1_intrawave_v1,421.46,1138.02,0.0
256,800,7168,2048,ck,14,3,23.7531,a8w8_blockscale_bpreshuffle_1x128x128_256x64x128x128_16x16_16x16_8x32x1_8x32x1_1x32x1x8_8_2x1_intrawave_v1,988.84,1169.84,0.0002
256,800,4608,7168,asm,40,1,45.4026,_ZN5aiter43fp8gemm_bf16_blockscale_BpreShuffle_128x128E,1163.99,1016.18,0.0
256,800,7168,2304,ck,14,3,26.9931,a8w8_blockscale_bpreshuffle_1x128x128_256x64x128x128_16x16_16x16_8x32x1_8x32x1_1x32x1x8_8_2x1_intrawave_v1,978.92,1104.99,0.0002
256,800,128,7168,asm,14,7,9.6773,_ZN5aiter42fp8gemm_bf16_blockscale_BpreShuffle_48x128E,151.7,708.53,0.0083
256,800,2112,7168,ck,17,1,32.9452,a8w8_blockscale_bpreshuffle_1x128x128_256x64x64x256_16x16_16x16_16x16x1_16x16x1_1x32x1x8_8_2x1_intrawave_v1,735.22,736.14,0.0
256,800,2240,7168,ck,17,1,33.4921,a8w8_blockscale_bpreshuffle_1x128x128_256x64x64x256_16x16_16x16_16x16x1_16x16x1_1x32x1x8_8_2x1_intrawave_v1,767.05,757.63,0.0
256,800,8192,1536,ck,13,2,22.3618,a8w8_blockscale_bpreshuffle_1x128x128_256x64x256x128_16x16_16x16_8x32x1_8x32x1_1x32x1x8_8_2x1_intrawave_v1,900.31,1203.79,0.0
256,800,11264,1536,ck,14,0,29.0828,a8w8_blockscale_bpreshuffle_1x128x128_256x64x128x128_16x16_16x16_8x32x1_8x32x1_1x32x1x8_8_2x1_intrawave_v1,951.85,1256.85,0.0002
256,832,3072,1536,ck,14,0,13.3109,a8w8_blockscale_bpreshuffle_1x128x128_256x64x128x128_16x16_16x16_8x32x1_8x32x1_1x32x1x8_8_2x1_intrawave_v1,589.87,834.53,0.0001
256,832,4096,512,ck,1,2,8.2779,a8w8_blockscale_bpreshuffle_1x128x128_256x64x128x128_16x16_16x16_8x32x1_8x32x1_1x32x1x8_8_2x1_intrawave_v3,421.56,1128.17,0.0
256,832,7168,2048,ck,14,1,23.339,a8w8_blockscale_bpreshuffle_1x128x128_256x64x128x128_16x16_16x16_8x32x1_8x32x1_1x32x1x8_8_2x1_intrawave_v1,1046.64,1213.06,0.0002
256,832,4608,7168,asm,40,1,48.3206,_ZN5aiter43fp8gemm_bf16_blockscale_BpreShuffle_128x128E,1137.45,965.67,0.0
256,832,7168,2304,ck,14,1,26.6255,a8w8_blockscale_bpreshuffle_1x128x128_256x64x128x128_16x16_16x16_8x32x1_8x32x1_1x32x1x8_8_2x1_intrawave_v1,1032.13,1140.24,0.0002
256,832,128,7168,asm,7,8,8.9652,_ZN5aiter42fp8gemm_bf16_blockscale_BpreShuffle_32x128E,170.29,791.31,0.0124
256,832,2112,7168,ck,17,0,31.9565,a8w8_blockscale_bpreshuffle_1x128x128_256x64x64x256_16x16_16x16_16x16x1_16x16x1_1x32x1x8_8_2x1_intrawave_v1,788.29,770.33,0.0
256,832,2240,7168,ck,17,1,32.4485,a8w8_blockscale_bpreshuffle_1x128x128_256x64x64x256_16x16_16x16_16x16x1_16x16x1_1x32x1x8_8_2x1_intrawave_v1,823.39,793.49,0.0
256,832,8192,1536,ck,13,0,22.2917,a8w8_blockscale_bpreshuffle_1x128x128_256x64x256x128_16x16_16x16_8x32x1_8x32x1_1x32x1x8_8_2x1_intrawave_v1,939.27,1233.3,0.0
256,832,11264,1536,ck,14,0,29.5287,a8w8_blockscale_bpreshuffle_1x128x128_256x64x128x128_16x16_16x16_8x32x1_8x32x1_1x32x1x8_8_2x1_intrawave_v1,974.97,1263.95,0.0002
256,864,3072,1536,ck,11,1,13.447,a8w8_blockscale_bpreshuffle_1x128x128_256x32x128x256_16x16_16x16_16x16x1_16x16x1_1x32x1x8_8_2x1_intrawave_v1,606.36,844.36,0.0
256,864,4096,512,ck,16,3,8.2738,a8w8_blockscale_bpreshuffle_1x128x128_256x64x128x256_16x16_16x16_16x16x1_16x16x1_1x32x1x8_8_2x1_intrawave_v1,437.99,1162.39,0.0
256,864,7168,2048,ck,13,0,25.9384,a8w8_blockscale_bpreshuffle_1x128x128_256x64x256x128_16x16_16x16_8x32x1_8x32x1_1x32x1x8_8_2x1_intrawave_v1,977.98,1111.7,0
256,864,4608,7168,asm,40,1,48.211,_ZN5aiter43fp8gemm_bf16_blockscale_BpreShuffle_128x128E,1183.88,978.74,0.0
256,864,7168,2304,ck,13,0,28.4282,a8w8_blockscale_bpreshuffle_1x128x128_256x64x256x128_16x16_16x16_8x32x1_8x32x1_1x32x1x8_8_2x1_intrawave_v1,1003.86,1086.67,0
256,864,128,7168,asm,23,8,9.687,_ZN5aiter42fp8gemm_bf16_blockscale_BpreShuffle_64x128E,163.67,756.87,0.0069
256,864,2112,7168,ck,17,0,32.9555,a8w8_blockscale_bpreshuffle_1x128x128_256x64x64x256_16x16_16x16_16x16x1_16x16x1_1x32x1x8_8_2x1_intrawave_v1,793.79,758.04,0.0
256,864,2240,7168,ck,17,0,33.6904,a8w8_blockscale_bpreshuffle_1x128x128_256x64x64x256_16x16_16x16_16x16x1_16x16x1_1x32x1x8_8_2x1_intrawave_v1,823.54,775.3,0.0
256,864,8192,1536,ck,13,0,22.8305,a8w8_blockscale_bpreshuffle_1x128x128_256x64x256x128_16x16_16x16_8x32x1_8x32x1_1x32x1x8_8_2x1_intrawave_v1,952.38,1229.31,0
256,864,11264,1536,ck,14,2,29.4095,a8w8_blockscale_bpreshuffle_1x128x128_256x64x128x128_16x16_16x16_8x32x1_8x32x1_1x32x1x8_8_2x1_intrawave_v1,1016.58,1295.25,0.0002
256,896,3072,1536,asm,32,1,13.4318,_ZN5aiter42fp8gemm_bf16_blockscale_BpreShuffle_96x128E,629.53,863.61,0.0
256,896,4096,512,ck,12,1,8.3732,a8w8_blockscale_bpreshuffle_1x128x128_256x32x64x256_16x16_16x16_16x16x1_16x16x1_1x32x1x8_8_2x1_intrawave_v1,448.82,1181.86,0.0
256,896,7168,2048,ck,13,1,25.52,a8w8_blockscale_bpreshuffle_1x128x128_256x64x256x128_16x16_16x16_8x32x1_8x32x1_1x32x1x8_8_2x1_intrawave_v1,1030.83,1150.48,0.0
256,896,4608,7168,ck,14,1,49.2333,a8w8_blockscale_bpreshuffle_1x128x128_256x64x128x128_16x16_16x16_8x32x1_8x32x1_1x32x1x8_8_2x1_intrawave_v1,1202.24,969.06,0.0001
256,896,7168,2304,ck,13,0,28.0756,a8w8_blockscale_bpreshuffle_1x128x128_256x64x256x128_16x16_16x16_8x32x1_8x32x1_1x32x1x8_8_2x1_intrawave_v1,1054.12,1119.28,0.0
256,896,128,7168,asm,15,8,9.2527,_ZN5aiter42fp8gemm_bf16_blockscale_BpreShuffle_48x128E,177.7,818.08,0.0077
256,896,2112,7168,ck,17,1,32.7393,a8w8_blockscale_bpreshuffle_1x128x128_256x64x64x256_16x16_16x16_16x16x1_16x16x1_1x32x1x8_8_2x1_intrawave_v1,828.63,774.18,0.0
256,896,2240,7168,ck,17,2,33.6934,a8w8_blockscale_bpreshuffle_1x128x128_256x64x64x256_16x16_16x16_16x16x1_16x16x1_1x32x1x8_8_2x1_intrawave_v1,853.96,786.29,0.0
256,896,8192,1536,ck,13,0,22.7169,a8w8_blockscale_bpreshuffle_1x128x128_256x64x256x128_16x16_16x16_8x32x1_8x32x1_1x32x1x8_8_2x1_intrawave_v1,992.59,1260.7,0.0
256,896,11264,1536,ck,14,3,29.6756,a8w8_blockscale_bpreshuffle_1x128x128_256x64x128x128_16x16_16x16_8x32x1_8x32x1_1x32x1x8_8_2x1_intrawave_v1,1044.77,1309.59,0.0002
256,928,3072,1536,asm,32,1,13.6679,_ZN5aiter42fp8gemm_bf16_blockscale_BpreShuffle_96x128E,640.75,866.68,0.0
256,928,4096,512,ck,16,3,8.4091,a8w8_blockscale_bpreshuffle_1x128x128_256x64x128x256_16x16_16x16_16x16x1_16x16x1_1x32x1x8_8_2x1_intrawave_v1,462.87,1209.93,0.0
256,928,7168,2048,ck,13,3,26.8124,a8w8_blockscale_bpreshuffle_1x128x128_256x64x256x128_16x16_16x16_8x32x1_8x32x1_1x32x1x8_8_2x1_intrawave_v1,1016.18,1114.57,0.0
256,928,4608,7168,ck,14,2,61.4459,a8w8_blockscale_bpreshuffle_1x128x128_256x64x128x128_16x16_16x16_8x32x1_8x32x1_1x32x1x8_8_2x1_intrawave_v1,997.69,784.99,0.0001
256,928,7168,2304,ck,13,1,29.3826,a8w8_blockscale_bpreshuffle_1x128x128_256x64x256x128_16x16_16x16_8x32x1_8x32x1_1x32x1x8_8_2x1_intrawave_v1,1043.2,1087.62,0.0
256,928,128,7168,asm,14,7,9.7555,_ZN5aiter42fp8gemm_bf16_blockscale_BpreShuffle_48x128E,174.56,800.26,0.005
256,928,2112,7168,ck,17,1,34.0955,a8w8_blockscale_bpreshuffle_1x128x128_256x64x64x256_16x16_16x16_16x16x1_16x16x1_1x32x1x8_8_2x1_intrawave_v1,824.09,754.08,0.0
256,928,2240,7168,ck,15,0,41.3108,a8w8_blockscale_bpreshuffle_1x128x128_256x64x64x128_16x16_16x16_8x32x1_8x32x1_1x32x1x8_8_2x1_intrawave_v1,721.37,650.33,0.0103
256,928,8192,1536,ck,13,3,23.4081,a8w8_blockscale_bpreshuffle_1x128x128_256x64x256x128_16x16_16x16_8x32x1_8x32x1_1x32x1x8_8_2x1_intrawave_v1,997.68,1247.97,0.0
256,928,11264,1536,ck,13,0,31.8831,a8w8_blockscale_bpreshuffle_1x128x128_256x64x256x128_16x16_16x16_8x32x1_8x32x1_1x32x1x8_8_2x1_intrawave_v1,1007.17,1243.07,0.0
256,960,3072,1536,asm,32,1,13.2265,_ZN5aiter42fp8gemm_bf16_blockscale_BpreShuffle_96x128E,684.97,914.18,0.0
256,960,4096,512,ck,14,1,8.3342,a8w8_blockscale_bpreshuffle_1x128x128_256x64x128x128_16x16_16x16_8x32x1_8x32x1_1x32x1x8_8_2x1_intrawave_v1,483.13,1254.23,0.0
256,960,7168,2048,ck,13,1,26.4534,a8w8_blockscale_bpreshuffle_1x128x128_256x64x256x128_16x16_16x16_8x32x1_8x32x1_1x32x1x8_8_2x1_intrawave_v1,1065.49,1149.52,0.0
256,960,4608,7168,ck,13,3,60.8237,a8w8_blockscale_bpreshuffle_1x128x128_256x64x256x128_16x16_16x16_8x32x1_8x32x1_1x32x1x8_8_2x1_intrawave_v1,1042.65,801.64,0.0
256,960,7168,2304,ck,13,1,29.2546,a8w8_blockscale_bpreshuffle_1x128x128_256x64x256x128_16x16_16x16_8x32x1_8x32x1_1x32x1x8_8_2x1_intrawave_v1,1083.9,1110.58,0.0
256,960,128,7168,asm,7,8,9.8867,_ZN5aiter42fp8gemm_bf16_blockscale_BpreShuffle_32x128E,178.18,813.67,0.0106
256,960,2112,7168,ck,17,3,33.1244,a8w8_blockscale_bpreshuffle_1x128x128_256x64x64x256_16x16_16x16_16x16x1_16x16x1_1x32x1x8_8_2x1_intrawave_v1,877.5,787.19,0.0
256,960,2240,7168,ck,15,1,40.2247,a8w8_blockscale_bpreshuffle_1x128x128_256x64x64x128_16x16_16x16_8x32x1_8x32x1_1x32x1x8_8_2x1_intrawave_v1,766.4,677.16,0.0026
256,960,8192,1536,ck,13,0,23.29,a8w8_blockscale_bpreshuffle_1x128x128_256x64x256x128_16x16_16x16_8x32x1_8x32x1_1x32x1x8_8_2x1_intrawave_v1,1037.32,1278.92,0.0
256,960,11264,1536,ck,13,0,31.4909,a8w8_blockscale_bpreshuffle_1x128x128_256x64x256x128_16x16_16x16_8x32x1_8x32x1_1x32x1x8_8_2x1_intrawave_v1,1054.87,1283.0,0.0
256,992,3072,1536,ck,15,0,14.206,a8w8_blockscale_bpreshuffle_1x128x128_256x64x64x128_16x16_16x16_8x32x1_8x32x1_1x32x1x8_8_2x1_intrawave_v1,659.0,868.45,0.0135
256,992,4096,512,ck,16,2,8.3513,a8w8_blockscale_bpreshuffle_1x128x128_256x64x128x256_16x16_16x16_16x16x1_16x16x1_1x32x1x8_8_2x1_intrawave_v1,498.22,1285.01,0.0
256,992,7168,2048,ck,13,0,27.1606,a8w8_blockscale_bpreshuffle_1x128x128_256x64x256x128_16x16_16x16_8x32x1_8x32x1_1x32x1x8_8_2x1_intrawave_v1,1072.33,1138.89,0.0
256,992,4608,7168,ck,14,2,64.6791,a8w8_blockscale_bpreshuffle_1x128x128_256x64x128x128_16x16_16x16_8x32x1_8x32x1_1x32x1x8_8_2x1_intrawave_v1,1013.18,761.96,0.0001
256,992,7168,2304,ck,13,3,30.3407,a8w8_blockscale_bpreshuffle_1x128x128_256x64x256x128_16x16_16x16_8x32x1_8x32x1_1x32x1x8_8_2x1_intrawave_v1,1079.93,1088.37,0.0
256,992,128,7168,asm,15,8,10.0899,_ZN5aiter42fp8gemm_bf16_blockscale_BpreShuffle_48x128E,180.41,820.83,0.0016
256,992,2112,7168,ck,15,1,42.6313,a8w8_blockscale_bpreshuffle_1x128x128_256x64x64x128_16x16_16x16_8x32x1_8x32x1_1x32x1x8_8_2x1_intrawave_v1,704.54,620.19,0.0174
256,992,2240,7168,ck,15,2,43.7813,a8w8_blockscale_bpreshuffle_1x128x128_256x64x64x128_16x16_16x16_8x32x1_8x32x1_1x32x1x8_8_2x1_intrawave_v1,727.61,630.66,0.017
256,992,8192,1536,ck,13,0,24.0643,a8w8_blockscale_bpreshuffle_1x128x128_256x64x256x128_16x16_16x16_8x32x1_8x32x1_1x32x1x8_8_2x1_intrawave_v1,1037.41,1261.6,0.0
256,992,11264,1536,ck,13,2,35.486,a8w8_blockscale_bpreshuffle_1x128x128_256x64x256x128_16x16_16x16_8x32x1_8x32x1_1x32x1x8_8_2x1_intrawave_v1,967.32,1160.26,0.0
256,1024,3072,1536,ck,15,3,14.1697,a8w8_blockscale_bpreshuffle_1x128x128_256x64x64x128_16x16_16x16_8x32x1_8x32x1_1x32x1x8_8_2x1_intrawave_v1,682.0,888.02,0.0013
256,1024,4096,512,ck,14,1,8.1752,a8w8_blockscale_bpreshuffle_1x128x128_256x64x128x128_16x16_16x16_8x32x1_8x32x1_1x32x1x8_8_2x1_intrawave_v1,525.37,1346.76,0.0
256,1024,7168,2048,ck,13,0,27.317,a8w8_blockscale_bpreshuffle_1x128x128_256x64x256x128_16x16_16x16_8x32x1_8x32x1_1x32x1x8_8_2x1_intrawave_v1,1100.59,1151.56,0.0
256,1024,4608,7168,ck,14,0,64.8459,a8w8_blockscale_bpreshuffle_1x128x128_256x64x128x128_16x16_16x16_8x32x1_8x32x1_1x32x1x8_8_2x1_intrawave_v1,1043.18,768.09,0.0001
256,1024,7168,2304,ck,13,0,30.0679,a8w8_blockscale_bpreshuffle_1x128x128_256x64x256x128_16x16_16x16_8x32x1_8x32x1_1x32x1x8_8_2x1_intrawave_v1,1124.88,1115.96,0.0
256,1024,128,7168,asm,6,7,9.4051,_ZN5aiter42fp8gemm_bf16_blockscale_BpreShuffle_32x128E,199.79,905.86,0.0096
256,1024,2112,7168,ck,15,1,42.1398,a8w8_blockscale_bpreshuffle_1x128x128_256x64x64x128_16x16_16x16_8x32x1_8x32x1_1x32x1x8_8_2x1_intrawave_v1,735.75,636.08,0.0024
256,1024,2240,7168,ck,2,3,44.5328,a8w8_blockscale_bpreshuffle_1x128x128_256x64x64x128_16x16_16x16_8x32x1_8x32x1_1x32x1x8_8_2x1_intrawave_v3,738.41,628.39,0.0002
256,1024,8192,1536,ck,13,2,23.881,a8w8_blockscale_bpreshuffle_1x128x128_256x64x256x128_16x16_16x16_8x32x1_8x32x1_1x32x1x8_8_2x1_intrawave_v1,1079.09,1295.3,0.0
256,1024,11264,1536,ck,13,0,35.1602,a8w8_blockscale_bpreshuffle_1x128x128_256x64x256x128_16x16_16x16_8x32x1_8x32x1_1x32x1x8_8_2x1_intrawave_v1,1007.77,1192.91,0.0
256,1088,3072,1536,ck,14,0,14.2987,a8w8_blockscale_bpreshuffle_1x128x128_256x64x128x128_16x16_16x16_8x32x1_8x32x1_1x32x1x8_8_2x1_intrawave_v1,718.08,914.38,0.0001
256,1088,4096,512,ck,11,3,10.1811,a8w8_blockscale_bpreshuffle_1x128x128_256x32x128x256_16x16_16x16_16x16x1_16x16x1_1x32x1x8_8_2x1_intrawave_v1,448.22,1136.13,0.0
256,1088,7168,2048,ck,13,1,27.3968,a8w8_blockscale_bpreshuffle_1x128x128_256x64x256x128_16x16_16x16_8x32x1_8x32x1_1x32x1x8_8_2x1_intrawave_v1,1165.97,1186.48,0.0
256,1088,4608,7168,ck,14,3,63.0424,a8w8_blockscale_bpreshuffle_1x128x128_256x64x128x128_16x16_16x16_8x32x1_8x32x1_1x32x1x8_8_2x1_intrawave_v1,1140.08,806.69,0.0002
256,1088,7168,2304,ck,13,0,30.6088,a8w8_blockscale_bpreshuffle_1x128x128_256x64x256x128_16x16_16x16_8x32x1_8x32x1_1x32x1x8_8_2x1_intrawave_v1,1174.07,1131.03,0.0
256,1088,128,7168,asm,15,8,10.2009,_ZN5aiter42fp8gemm_bf16_blockscale_BpreShuffle_48x128E,195.72,881.77,0.0106
256,1088,2112,7168,ck,15,3,41.2423,a8w8_blockscale_bpreshuffle_1x128x128_256x64x64x128_16x16_16x16_8x32x1_8x32x1_1x32x1x8_8_2x1_intrawave_v1,798.74,667.6,0.0035
256,1088,2240,7168,ck,15,2,41.4553,a8w8_blockscale_bpreshuffle_1x128x128_256x64x64x128_16x16_16x16_8x32x1_8x32x1_1x32x1x8_8_2x1_intrawave_v1,842.8,693.02,0.0038
256,1088,8192,1536,ck,14,1,28.5022,a8w8_blockscale_bpreshuffle_1x128x128_256x64x128x128_16x16_16x16_8x32x1_8x32x1_1x32x1x8_8_2x1_intrawave_v1,960.64,1125.52,0.0001
256,1088,11264,1536,ck,13,1,33.9498,a8w8_blockscale_bpreshuffle_1x128x128_256x64x256x128_16x16_16x16_8x32x1_8x32x1_1x32x1x8_8_2x1_intrawave_v1,1108.93,1280.81,0.0
256,1152,3072,1536,ck,14,0,14.452,a8w8_blockscale_bpreshuffle_1x128x128_256x64x128x128_16x16_16x16_8x32x1_8x32x1_1x32x1x8_8_2x1_intrawave_v1,752.26,938.69,0.0
256,1152,4096,512,ck,11,2,10.4471,a8w8_blockscale_bpreshuffle_1x128x128_256x32x128x256_16x16_16x16_16x16x1_16x16x1_1x32x1x8_8_2x1_intrawave_v1,462.51,1160.53,0.0
256,1152,7168,2048,ck,13,0,28.252,a8w8_blockscale_bpreshuffle_1x128x128_256x64x256x128_16x16_16x16_8x32x1_8x32x1_1x32x1x8_8_2x1_intrawave_v1,1197.18,1187.68,0.0
256,1152,4608,7168,ck,13,0,63.9377,a8w8_blockscale_bpreshuffle_1x128x128_256x64x256x128_16x16_16x16_8x32x1_8x32x1_1x32x1x8_8_2x1_intrawave_v1,1190.24,811.8,0
256,1152,7168,2304,ck,13,2,30.6705,a8w8_blockscale_bpreshuffle_1x128x128_256x64x256x128_16x16_16x16_8x32x1_8x32x1_1x32x1x8_8_2x1_intrawave_v1,1240.63,1163.47,0.0
256,1152,128,7168,asm,15,8,9.6912,_ZN5aiter42fp8gemm_bf16_blockscale_BpreShuffle_48x128E,218.13,977.17,0.0068
256,1152,2112,7168,ck,15,1,41.524,a8w8_blockscale_bpreshuffle_1x128x128_256x64x64x128_16x16_16x16_8x32x1_8x32x1_1x32x1x8_8_2x1_intrawave_v1,839.99,680.63,0.0034
256,1152,2240,7168,ck,15,0,42.9315,a8w8_blockscale_bpreshuffle_1x128x128_256x64x64x128_16x16_16x16_8x32x1_8x32x1_1x32x1x8_8_2x1_intrawave_v1,861.69,686.55,0.0101
256,1152,8192,1536,ck,14,1,28.3076,a8w8_blockscale_bpreshuffle_1x128x128_256x64x128x128_16x16_16x16_8x32x1_8x32x1_1x32x1x8_8_2x1_intrawave_v1,1024.14,1173.77,0.0001
256,1152,11264,1536,ck,14,3,36.2905,a8w8_blockscale_bpreshuffle_1x128x128_256x64x128x128_16x16_16x16_8x32x1_8x32x1_1x32x1x8_8_2x1_intrawave_v1,1098.43,1240.63,0.0002
256,1216,3072,1536,ck,14,3,14.6779,a8w8_blockscale_bpreshuffle_1x128x128_256x64x128x128_16x16_16x16_8x32x1_8x32x1_1x32x1x8_8_2x1_intrawave_v1,781.83,957.73,0.0
256,1216,4096,512,ck,17,3,10.4403,a8w8_blockscale_bpreshuffle_1x128x128_256x64x64x256_16x16_16x16_16x16x1_16x16x1_1x32x1x8_8_2x1_intrawave_v1,488.52,1214.64,0.0
256,1216,7168,2048,ck,14,2,33.2001,a8w8_blockscale_bpreshuffle_1x128x128_256x64x128x128_16x16_16x16_8x32x1_8x32x1_1x32x1x8_8_2x1_intrawave_v1,1075.36,1042.26,0.0003
256,1216,4608,7168,ck,13,0,64.1537,a8w8_blockscale_bpreshuffle_1x128x128_256x64x256x128_16x16_16x16_8x32x1_8x32x1_1x32x1x8_8_2x1_intrawave_v1,1252.14,825.41,0
256,1216,7168,2304,ck,14,1,36.1184,a8w8_blockscale_bpreshuffle_1x128x128_256x64x128x128_16x16_16x16_8x32x1_8x32x1_1x32x1x8_8_2x1_intrawave_v1,1112.03,1017.47,0.0002
256,1216,128,7168,asm,14,7,10.335,_ZN5aiter42fp8gemm_bf16_blockscale_BpreShuffle_48x128E,215.9,962.27,0.0075
256,1216,2112,7168,ck,15,0,41.9743,a8w8_blockscale_bpreshuffle_1x128x128_256x64x64x128_16x16_16x16_8x32x1_8x32x1_1x32x1x8_8_2x1_intrawave_v1,877.15,690.7,0.0042
256,1216,2240,7168,ck,15,1,44.5513,a8w8_blockscale_bpreshuffle_1x128x128_256x64x64x128_16x16_16x16_8x32x1_8x32x1_1x32x1x8_8_2x1_intrawave_v1,876.49,678.33,0.0047
256,1216,8192,1536,ck,14,0,29.5668,a8w8_blockscale_bpreshuffle_1x128x128_256x64x128x128_16x16_16x16_8x32x1_8x32x1_1x32x1x8_8_2x1_intrawave_v1,1035.0,1162.58,0.0002
256,1216,11264,1536,ck,14,2,38.9557,a8w8_blockscale_bpreshuffle_1x128x128_256x64x128x128_16x16_16x16_8x32x1_8x32x1_1x32x1x8_8_2x1_intrawave_v1,1080.13,1195.29,0.0003
256,1280,3072,1536,ck,14,0,14.8012,a8w8_blockscale_bpreshuffle_1x128x128_256x64x128x128_16x16_16x16_8x32x1_8x32x1_1x32x1x8_8_2x1_intrawave_v1,816.12,982.96,0.0
256,1280,4096,512,ck,9,0,10.7165,a8w8_blockscale_bpreshuffle_1x128x128_256x32x128x128_16x16_16x16_8x32x1_8x32x1_1x32x1x8_8_2x1_intrawave_v1,500.98,1235.32,0.0002
256,1280,7168,2048,ck,14,2,33.4219,a8w8_blockscale_bpreshuffle_1x128x128_256x64x128x128_16x16_16x16_8x32x1_8x32x1_1x32x1x8_8_2x1_intrawave_v1,1124.44,1066.71,0.0003
256,1280,4608,7168,ck,13,1,65.5408,a8w8_blockscale_bpreshuffle_1x128x128_256x64x256x128_16x16_16x16_8x32x1_8x32x1_1x32x1x8_8_2x1_intrawave_v1,1290.15,823.94,0.0
256,1280,7168,2304,ck,14,0,38.4207,a8w8_blockscale_bpreshuffle_1x128x128_256x64x128x128_16x16_16x16_8x32x1_8x32x1_1x32x1x8_8_2x1_intrawave_v1,1100.41,984.22,0.0003
256,1280,128,7168,asm,15,8,10.3145,_ZN5aiter42fp8gemm_bf16_blockscale_BpreShuffle_48x128E,227.72,1010.25,0.0085
256,1280,2112,7168,ck,15,1,43.2067,a8w8_blockscale_bpreshuffle_1x128x128_256x64x64x128_16x16_16x16_8x32x1_8x32x1_1x32x1x8_8_2x1_intrawave_v1,896.98,687.87,0.0051
256,1280,2240,7168,ck,15,0,46.3178,a8w8_blockscale_bpreshuffle_1x128x128_256x64x64x128_16x16_16x16_8x32x1_8x32x1_1x32x1x8_8_2x1_intrawave_v1,887.44,668.55,0.0055
256,1280,8192,1536,ck,14,0,29.7623,a8w8_blockscale_bpreshuffle_1x128x128_256x64x128x128_16x16_16x16_8x32x1_8x32x1_1x32x1x8_8_2x1_intrawave_v1,1082.32,1193.47,0.0002
256,1280,11264,1536,ck,13,0,38.9672,a8w8_blockscale_bpreshuffle_1x128x128_256x64x256x128_16x16_16x16_8x32x1_8x32x1_1x32x1x8_8_2x1_intrawave_v1,1136.64,1234.46,0.0
256,1344,3072,1536,ck,14,2,15.0639,a8w8_blockscale_bpreshuffle_1x128x128_256x64x128x128_16x16_16x16_8x32x1_8x32x1_1x32x1x8_8_2x1_intrawave_v1,841.98,998.45,0.0
256,1344,4096,512,ck,14,3,10.7615,a8w8_blockscale_bpreshuffle_1x128x128_256x64x128x128_16x16_16x16_8x32x1_8x32x1_1x32x1x8_8_2x1_intrawave_v1,523.83,1281.91,0.0002
256,1344,7168,2048,ck,14,0,35.111,a8w8_blockscale_bpreshuffle_1x128x128_256x64x128x128_16x16_16x16_8x32x1_8x32x1_1x32x1x8_8_2x1_intrawave_v1,1123.86,1045.26,0.0003
256,1344,4608,7168,ck,14,1,69.0212,a8w8_blockscale_bpreshuffle_1x128x128_256x64x128x128_16x16_16x16_8x32x1_8x32x1_1x32x1x8_8_2x1_intrawave_v1,1286.34,797.58,0.0002
256,1344,7168,2304,ck,14,1,39.2161,a8w8_blockscale_bpreshuffle_1x128x128_256x64x128x128_16x16_16x16_8x32x1_8x32x1_1x32x1x8_8_2x1_intrawave_v1,1132.0,991.41,0.0003
256,1344,128,7168,asm,15,8,9.6694,_ZN5aiter42fp8gemm_bf16_blockscale_BpreShuffle_48x128E,255.06,1126.79,0.0116
256,1344,2112,7168,ck,15,2,45.9966,a8w8_blockscale_bpreshuffle_1x128x128_256x64x64x128_16x16_16x16_8x32x1_8x32x1_1x32x1x8_8_2x1_intrawave_v1,884.7,662.0,0.0052
256,1344,2240,7168,ck,15,2,47.0606,a8w8_blockscale_bpreshuffle_1x128x128_256x64x64x128_16x16_16x16_8x32x1_8x32x1_1x32x1x8_8_2x1_intrawave_v1,917.1,673.84,0.0061
256,1344,8192,1536,ck,13,0,31.5224,a8w8_blockscale_bpreshuffle_1x128x128_256x64x256x128_16x16_16x16_8x32x1_8x32x1_1x32x1x8_8_2x1_intrawave_v1,1072.98,1163.22,0.0
256,1344,11264,1536,ck,13,3,42.545,a8w8_blockscale_bpreshuffle_1x128x128_256x64x256x128_16x16_16x16_8x32x1_8x32x1_1x32x1x8_8_2x1_intrawave_v1,1093.11,1166.85,0.0
256,1408,3072,1536,ck,14,3,18.1285,a8w8_blockscale_bpreshuffle_1x128x128_256x64x128x128_16x16_16x16_8x32x1_8x32x1_1x32x1x8_8_2x1_intrawave_v1,732.96,856.77,0.0
256,1408,4096,512,ck,14,2,11.1235,a8w8_blockscale_bpreshuffle_1x128x128_256x64x128x128_16x16_16x16_8x32x1_8x32x1_1x32x1x8_8_2x1_intrawave_v1,530.91,1290.28,0.0002
256,1408,7168,2048,ck,14,2,34.9489,a8w8_blockscale_bpreshuffle_1x128x128_256x64x128x128_16x16_16x16_8x32x1_8x32x1_1x32x1x8_8_2x1_intrawave_v1,1182.84,1080.11,0.0003
256,1408,4608,7168,ck,13,0,67.567,a8w8_blockscale_bpreshuffle_1x128x128_256x64x256x128_16x16_16x16_8x32x1_8x32x1_1x32x1x8_8_2x1_intrawave_v1,1376.6,830.27,0
256,1408,7168,2304,ck,14,2,39.6157,a8w8_blockscale_bpreshuffle_1x128x128_256x64x128x128_16x16_16x16_8x32x1_8x32x1_1x32x1x8_8_2x1_intrawave_v1,1173.94,1008.29,0.0003
256,1408,128,7168,asm,15,8,10.1742,_ZN5aiter42fp8gemm_bf16_blockscale_BpreShuffle_48x128E,253.95,1117.58,0.0055
256,1408,2112,7168,ck,15,1,46.709,a8w8_blockscale_bpreshuffle_1x128x128_256x64x64x128_16x16_16x16_8x32x1_8x32x1_1x32x1x8_8_2x1_intrawave_v1,912.69,667.51,0.0058
256,1408,2240,7168,ck,2,3,55.1594,a8w8_blockscale_bpreshuffle_1x128x128_256x64x64x128_16x16_16x16_8x32x1_8x32x1_1x32x1x8_8_2x1_intrawave_v3,819.71,588.42,0.0004
256,1408,8192,1536,ck,13,0,31.7962,a8w8_blockscale_bpreshuffle_1x128x128_256x64x256x128_16x16_16x16_8x32x1_8x32x1_1x32x1x8_8_2x1_intrawave_v1,1114.39,1189.27,0
256,1408,11264,1536,ck,13,1,40.8609,a8w8_blockscale_bpreshuffle_1x128x128_256x64x256x128_16x16_16x16_8x32x1_8x32x1_1x32x1x8_8_2x1_intrawave_v1,1192.36,1252.63,0.0
256,1472,3072,1536,ck,14,1,18.562,a8w8_blockscale_bpreshuffle_1x128x128_256x64x128x128_16x16_16x16_8x32x1_8x32x1_1x32x1x8_8_2x1_intrawave_v1,748.39,863.24,0.0
256,1472,4096,512,ck,16,2,11.3453,a8w8_blockscale_bpreshuffle_1x128x128_256x64x128x256_16x16_16x16_16x16x1_16x16x1_1x32x1x8_8_2x1_intrawave_v1,544.19,1314.15,0.0
256,1472,7168,2048,ck,13,0,37.9293,a8w8_blockscale_bpreshuffle_1x128x128_256x64x256x128_16x16_16x16_8x32x1_8x32x1_1x32x1x8_8_2x1_intrawave_v1,1139.44,1022.88,0.0
256,1472,4608,7168,ck,13,0,69.698,a8w8_blockscale_bpreshuffle_1x128x128_256x64x256x128_16x16_16x16_8x32x1_8x32x1_1x32x1x8_8_2x1_intrawave_v1,1395.17,819.93,0.0
256,1472,7168,2304,ck,13,0,41.5365,a8w8_blockscale_bpreshuffle_1x128x128_256x64x256x128_16x16_16x16_8x32x1_8x32x1_1x32x1x8_8_2x1_intrawave_v1,1170.55,987.3,0.0
256,1472,128,7168,asm,15,8,10.4621,_ZN5aiter42fp8gemm_bf16_blockscale_BpreShuffle_48x128E,258.18,1132.24,0.0121
256,1472,2112,7168,ck,15,2,47.2406,a8w8_blockscale_bpreshuffle_1x128x128_256x64x64x128_16x16_16x16_8x32x1_8x32x1_1x32x1x8_8_2x1_intrawave_v1,943.44,675.43,0.0062
256,1472,2240,7168,ck,15,0,55.4447,a8w8_blockscale_bpreshuffle_1x128x128_256x64x64x128_16x16_16x16_8x32x1_8x32x1_1x32x1x8_8_2x1_intrawave_v1,852.56,598.83,0.0067
256,1472,8192,1536,ck,13,0,32.4447,a8w8_blockscale_bpreshuffle_1x128x128_256x64x256x128_16x16_16x16_8x32x1_8x32x1_1x32x1x8_8_2x1_intrawave_v1,1141.76,1200.85,0
256,1472,11264,1536,ck,13,3,41.599,a8w8_blockscale_bpreshuffle_1x128x128_256x64x256x128_16x16_16x16_8x32x1_8x32x1_1x32x1x8_8_2x1_intrawave_v1,1224.44,1267.43,0.0
256,1536,3072,1536,ck,14,2,18.5729,a8w8_blockscale_bpreshuffle_1x128x128_256x64x128x128_16x16_16x16_8x32x1_8x32x1_1x32x1x8_8_2x1_intrawave_v1,780.47,889.2,0.0001
256,1536,4096,512,ck,16,1,11.4763,a8w8_blockscale_bpreshuffle_1x128x128_256x64x128x256_16x16_16x16_16x16x1_16x16x1_1x32x1x8_8_2x1_intrawave_v1,561.37,1347.69,0.0
256,1536,7168,2048,ck,13,1,37.3297,a8w8_blockscale_bpreshuffle_1x128x128_256x64x256x128_16x16_16x16_8x32x1_8x32x1_1x32x1x8_8_2x1_intrawave_v1,1208.08,1067.4,0.0
256,1536,4608,7168,ck,13,0,74.1864,a8w8_blockscale_bpreshuffle_1x128x128_256x64x256x128_16x16_16x16_8x32x1_8x32x1_1x32x1x8_8_2x1_intrawave_v1,1367.75,784.46,0
256,1536,7168,2304,ck,13,1,41.6893,a8w8_blockscale_bpreshuffle_1x128x128_256x64x256x128_16x16_16x16_8x32x1_8x32x1_1x32x1x8_8_2x1_intrawave_v1,1216.96,1009.23,0.0
256,1536,128,7168,asm,31,8,10.8903,_ZN5aiter42fp8gemm_bf16_blockscale_BpreShuffle_80x128E,258.81,1131.35,0.0136
256,1536,2112,7168,ck,15,3,56.0902,a8w8_blockscale_bpreshuffle_1x128x128_256x64x64x128_16x16_16x16_8x32x1_8x32x1_1x32x1x8_8_2x1_intrawave_v1,829.14,581.87,0.0063
256,1536,2240,7168,ck,15,1,56.6377,a8w8_blockscale_bpreshuffle_1x128x128_256x64x64x128_16x16_16x16_8x32x1_8x32x1_1x32x1x8_8_2x1_intrawave_v1,870.89,599.38,0.0069
256,1536,8192,1536,ck,13,3,32.7976,a8w8_blockscale_bpreshuffle_1x128x128_256x64x256x128_16x16_16x16_8x32x1_8x32x1_1x32x1x8_8_2x1_intrawave_v1,1178.58,1222.9,0.0
256,1536,11264,1536,ck,13,0,47.4698,a8w8_blockscale_bpreshuffle_1x128x128_256x64x256x128_16x16_16x16_8x32x1_8x32x1_1x32x1x8_8_2x1_intrawave_v1,1119.66,1143.12,0
256,1600,3072,1536,ck,14,3,18.8508,a8w8_blockscale_bpreshuffle_1x128x128_256x64x128x128_16x16_16x16_8x32x1_8x32x1_1x32x1x8_8_2x1_intrawave_v1,801.0,902.17,0.0001
256,1600,4096,512,ck,11,3,12.1772,a8w8_blockscale_bpreshuffle_1x128x128_256x32x128x256_16x16_16x16_16x16x1_16x16x1_1x32x1x8_8_2x1_intrawave_v1,551.1,1315.87,0.0
256,1600,7168,2048,ck,13,1,38.9505,a8w8_blockscale_bpreshuffle_1x128x128_256x64x256x128_16x16_16x16_8x32x1_8x32x1_1x32x1x8_8_2x1_intrawave_v1,1206.05,1049.91,0.0
256,1600,4608,7168,ck,13,0,76.2076,a8w8_blockscale_bpreshuffle_1x128x128_256x64x256x128_16x16_16x16_8x32x1_8x32x1_1x32x1x8_8_2x1_intrawave_v1,1386.95,777.41,0
256,1600,7168,2304,ck,13,0,42.8905,a8w8_blockscale_bpreshuffle_1x128x128_256x64x256x128_16x16_16x16_8x32x1_8x32x1_1x32x1x8_8_2x1_intrawave_v1,1232.17,1005.8,0.0
256,1600,128,7168,asm,23,8,11.2312,_ZN5aiter42fp8gemm_bf16_blockscale_BpreShuffle_64x128E,261.42,1139.32,0.0047
256,1600,2112,7168,ck,15,2,56.5454,a8w8_blockscale_bpreshuffle_1x128x128_256x64x64x128_16x16_16x16_8x32x1_8x32x1_1x32x1x8_8_2x1_intrawave_v1,856.73,590.07,0.0068
256,1600,2240,7168,ck,15,2,58.1541,a8w8_blockscale_bpreshuffle_1x128x128_256x64x64x128_16x16_16x16_8x32x1_8x32x1_1x32x1x8_8_2x1_intrawave_v1,883.52,596.57,0.0071
256,1600,8192,1536,ck,14,2,38.9245,a8w8_blockscale_bpreshuffle_1x128x128_256x64x128x128_16x16_16x16_8x32x1_8x32x1_1x32x1x8_8_2x1_intrawave_v1,1034.45,1059.87,0.0002
256,1600,11264,1536,ck,13,0,48.686,a8w8_blockscale_bpreshuffle_1x128x128_256x64x256x128_16x16_16x16_8x32x1_8x32x1_1x32x1x8_8_2x1_intrawave_v1,1137.18,1146.2,0
256,1664,3072,1536,ck,14,1,18.8912,a8w8_blockscale_bpreshuffle_1x128x128_256x64x128x128_16x16_16x16_8x32x1_8x32x1_1x32x1x8_8_2x1_intrawave_v1,831.26,926.26,0.0001
256,1664,4096,512,ck,11,0,12.3475,a8w8_blockscale_bpreshuffle_1x128x128_256x32x128x256_16x16_16x16_16x16x1_16x16x1_1x32x1x8_8_2x1_intrawave_v1,565.24,1342.83,0.0
256,1664,7168,2048,ck,13,2,39.1433,a8w8_blockscale_bpreshuffle_1x128x128_256x64x256x128_16x16_16x16_8x32x1_8x32x1_1x32x1x8_8_2x1_intrawave_v1,1248.11,1071.53,0.0
256,1664,4608,7168,ck,13,2,75.5728,a8w8_blockscale_bpreshuffle_1x128x128_256x64x256x128_16x16_16x16_8x32x1_8x32x1_1x32x1x8_8_2x1_intrawave_v1,1454.55,797.82,0.0
256,1664,7168,2304,ck,13,0,44.1393,a8w8_blockscale_bpreshuffle_1x128x128_256x64x256x128_16x16_16x16_8x32x1_8x32x1_1x32x1x8_8_2x1_intrawave_v1,1245.2,1001.47,0.0
256,1664,128,7168,asm,13,6,10.8834,_ZN5aiter42fp8gemm_bf16_blockscale_BpreShuffle_48x128E,280.56,1219.38,0.0021
256,1664,2112,7168,ck,15,2,57.1595,a8w8_blockscale_bpreshuffle_1x128x128_256x64x64x128_16x16_16x16_8x32x1_8x32x1_1x32x1x8_8_2x1_intrawave_v1,881.43,596.49,0.0073
256,1664,2240,7168,ck,15,1,58.1557,a8w8_blockscale_bpreshuffle_1x128x128_256x64x64x128_16x16_16x16_8x32x1_8x32x1_1x32x1x8_8_2x1_intrawave_v1,918.83,609.37,0.0081
256,1664,8192,1536,ck,13,2,38.7061,a8w8_blockscale_bpreshuffle_1x128x128_256x64x256x128_16x16_16x16_8x32x1_8x32x1_1x32x1x8_8_2x1_intrawave_v1,1081.89,1095.48,0.0
256,1664,11264,1536,ck,13,3,48.4674,a8w8_blockscale_bpreshuffle_1x128x128_256x64x256x128_16x16_16x16_8x32x1_8x32x1_1x32x1x8_8_2x1_intrawave_v1,1188.0,1183.15,0.0
256,1728,3072,1536,ck,14,0,19.1946,a8w8_blockscale_bpreshuffle_1x128x128_256x64x128x128_16x16_16x16_8x32x1_8x32x1_1x32x1x8_8_2x1_intrawave_v1,849.59,937.22,0.0001
256,1728,4096,512,ck,11,1,12.4536,a8w8_blockscale_bpreshuffle_1x128x128_256x32x128x256_16x16_16x16_16x16x1_16x16x1_1x32x1x8_8_2x1_intrawave_v1,581.98,1376.12,0.0
256,1728,7168,2048,ck,13,2,39.6049,a8w8_blockscale_bpreshuffle_1x128x128_256x64x256x128_16x16_16x16_8x32x1_8x32x1_1x32x1x8_8_2x1_intrawave_v1,1281.01,1085.51,0.0
256,1728,4608,7168,ck,13,3,76.958,a8w8_blockscale_bpreshuffle_1x128x128_256x64x256x128_16x16_16x16_8x32x1_8x32x1_1x32x1x8_8_2x1_intrawave_v1,1483.3,797.08,0.0
256,1728,7168,2304,ck,13,1,45.0662,a8w8_blockscale_bpreshuffle_1x128x128_256x64x256x128_16x16_16x16_8x32x1_8x32x1_1x32x1x8_8_2x1_intrawave_v1,1266.49,1004.5,0.0
256,1728,128,7168,asm,23,8,11.3761,_ZN5aiter42fp8gemm_bf16_blockscale_BpreShuffle_64x128E,278.73,1208.34,0.0027
256,1728,2112,7168,ck,15,1,58.4338,a8w8_blockscale_bpreshuffle_1x128x128_256x64x64x128_16x16_16x16_8x32x1_8x32x1_1x32x1x8_8_2x1_intrawave_v1,895.37,595.96,0.0077
256,1728,2240,7168,ck,2,1,59.647,a8w8_blockscale_bpreshuffle_1x128x128_256x64x64x128_16x16_16x16_8x32x1_8x32x1_1x32x1x8_8_2x1_intrawave_v3,930.32,606.64,0.0005
256,1728,8192,1536,ck,13,0,39.0433,a8w8_blockscale_bpreshuffle_1x128x128_256x64x256x128_16x16_16x16_8x32x1_8x32x1_1x32x1x8_8_2x1_intrawave_v1,1113.8,1115.39,0.0
256,1728,11264,1536,ck,13,0,49.8322,a8w8_blockscale_bpreshuffle_1x128x128_256x64x256x128_16x16_16x16_8x32x1_8x32x1_1x32x1x8_8_2x1_intrawave_v1,1199.91,1181.65,0.0
256,1792,3072,1536,ck,14,1,19.3262,a8w8_blockscale_bpreshuffle_1x128x128_256x64x128x128_16x16_16x16_8x32x1_8x32x1_1x32x1x8_8_2x1_intrawave_v1,875.05,956.27,0.0001
256,1792,4096,512,ck,11,1,12.5652,a8w8_blockscale_bpreshuffle_1x128x128_256x32x128x256_16x16_16x16_16x16x1_16x16x1_1x32x1x8_8_2x1_intrawave_v1,598.18,1408.23,0.0
256,1792,7168,2048,ck,14,1,45.0106,a8w8_blockscale_bpreshuffle_1x128x128_256x64x128x128_16x16_16x16_8x32x1_8x32x1_1x32x1x8_8_2x1_intrawave_v1,1168.91,978.44,0.0003
256,1792,4608,7168,ck,13,0,78.8364,a8w8_blockscale_bpreshuffle_1x128x128_256x64x256x128_16x16_16x16_8x32x1_8x32x1_1x32x1x8_8_2x1_intrawave_v1,1501.59,791.39,0.0
256,1792,7168,2304,ck,13,1,49.7486,a8w8_blockscale_bpreshuffle_1x128x128_256x64x256x128_16x16_16x16_8x32x1_8x32x1_1x32x1x8_8_2x1_intrawave_v1,1189.78,931.36,0.0
256,1792,128,7168,asm,23,8,11.6799,_ZN5aiter42fp8gemm_bf16_blockscale_BpreShuffle_64x128E,281.54,1217.59,0.0123
256,1792,2112,7168,ck,15,0,58.5148,a8w8_blockscale_bpreshuffle_1x128x128_256x64x64x128_16x16_16x16_8x32x1_8x32x1_1x32x1x8_8_2x1_intrawave_v1,927.24,607.59,0.0137
256,1792,2240,7168,ck,15,0,60.4126,a8w8_blockscale_bpreshuffle_1x128x128_256x64x64x128_16x16_16x16_8x32x1_8x32x1_1x32x1x8_8_2x1_intrawave_v1,952.55,611.29,0.0131
256,1792,8192,1536,ck,13,0,39.9475,a8w8_blockscale_bpreshuffle_1x128x128_256x64x256x128_16x16_16x16_8x32x1_8x32x1_1x32x1x8_8_2x1_intrawave_v1,1128.91,1118.86,0
256,1792,11264,1536,ck,13,0,50.5023,a8w8_blockscale_bpreshuffle_1x128x128_256x64x256x128_16x16_16x16_8x32x1_8x32x1_1x32x1x8_8_2x1_intrawave_v1,1227.84,1196.46,0
256,1856,3072,1536,ck,14,2,19.6128,a8w8_blockscale_bpreshuffle_1x128x128_256x64x128x128_16x16_16x16_8x32x1_8x32x1_1x32x1x8_8_2x1_intrawave_v1,893.06,967.36,0.0001
256,1856,4096,512,ck,11,1,13.2214,a8w8_blockscale_bpreshuffle_1x128x128_256x32x128x256_16x16_16x16_16x16x1_16x16x1_1x32x1x8_8_2x1_intrawave_v1,588.79,1380.47,0.0
256,1856,7168,2048,ck,14,0,46.4731,a8w8_blockscale_bpreshuffle_1x128x128_256x64x128x128_16x16_16x16_8x32x1_8x32x1_1x32x1x8_8_2x1_intrawave_v1,1172.56,970.21,0.0003
256,1856,4608,7168,ck,14,3,98.3699,a8w8_blockscale_bpreshuffle_1x128x128_256x64x128x128_16x16_16x16_8x32x1_8x32x1_1x32x1x8_8_2x1_intrawave_v1,1246.4,644.9,0.0002
256,1856,7168,2304,ck,14,0,50.7571,a8w8_blockscale_bpreshuffle_1x128x128_256x64x128x128_16x16_16x16_8x32x1_8x32x1_1x32x1x8_8_2x1_intrawave_v1,1207.79,933.84,0.0003
256,1856,128,7168,asm,23,8,10.726,_ZN5aiter42fp8gemm_bf16_blockscale_BpreShuffle_64x128E,317.53,1370.17,0.0045
256,1856,2112,7168,ck,2,2,60.6023,a8w8_blockscale_bpreshuffle_1x128x128_256x64x64x128_16x16_16x16_8x32x1_8x32x1_1x32x1x8_8_2x1_intrawave_v3,927.28,598.7,0.0006
256,1856,2240,7168,ck,15,0,62.0007,a8w8_blockscale_bpreshuffle_1x128x128_256x64x64x128_16x16_16x16_8x32x1_8x32x1_1x32x1x8_8_2x1_intrawave_v1,961.3,607.65,0.0083
256,1856,8192,1536,ck,13,0,41.1411,a8w8_blockscale_bpreshuffle_1x128x128_256x64x256x128_16x16_16x16_8x32x1_8x32x1_1x32x1x8_8_2x1_intrawave_v1,1135.31,1114.27,0
256,1856,11264,1536,ck,13,1,51.6266,a8w8_blockscale_bpreshuffle_1x128x128_256x64x256x128_16x16_16x16_8x32x1_8x32x1_1x32x1x8_8_2x1_intrawave_v1,1243.99,1200.24,0.0
256,1920,3072,1536,ck,14,0,19.807,a8w8_blockscale_bpreshuffle_1x128x128_256x64x128x128_16x16_16x16_8x32x1_8x32x1_1x32x1x8_8_2x1_intrawave_v1,914.8,982.69,0.0002
256,1920,4096,512,ck,11,1,13.6247,a8w8_blockscale_bpreshuffle_1x128x128_256x32x128x256_16x16_16x16_16x16x1_16x16x1_1x32x1x8_8_2x1_intrawave_v1,591.06,1380.5,0.0
256,1920,7168,2048,ck,13,2,46.4202,a8w8_blockscale_bpreshuffle_1x128x128_256x64x256x128_16x16_16x16_8x32x1_8x32x1_1x32x1x8_8_2x1_intrawave_v1,1214.37,993.91,0.0
256,1920,4608,7168,ck,14,0,99.6721,a8w8_blockscale_bpreshuffle_1x128x128_256x64x128x128_16x16_16x16_8x32x1_8x32x1_1x32x1x8_8_2x1_intrawave_v1,1272.53,647.0,0.0002
256,1920,7168,2304,ck,13,0,52.3907,a8w8_blockscale_bpreshuffle_1x128x128_256x64x256x128_16x16_16x16_8x32x1_8x32x1_1x32x1x8_8_2x1_intrawave_v1,1210.48,925.05,0
256,1920,128,7168,asm,12,5,11.6706,_ZN5aiter42fp8gemm_bf16_blockscale_BpreShuffle_48x128E,301.89,1299.98,0.0025
256,1920,2112,7168,ck,2,1,62.4284,a8w8_blockscale_bpreshuffle_1x128x128_256x64x64x128_16x16_16x16_8x32x1_8x32x1_1x32x1x8_8_2x1_intrawave_v3,931.2,592.86,0.0006
256,1920,2240,7168,ck,15,2,69.1036,a8w8_blockscale_bpreshuffle_1x128x128_256x64x64x128_16x16_16x16_8x32x1_8x32x1_1x32x1x8_8_2x1_intrawave_v1,892.23,555.98,0.0082
256,1920,8192,1536,ck,13,3,42.1933,a8w8_blockscale_bpreshuffle_1x128x128_256x64x256x128_16x16_16x16_8x32x1_8x32x1_1x32x1x8_8_2x1_intrawave_v1,1145.17,1113.67,0.0
256,1920,11264,1536,ck,13,1,57.8779,a8w8_blockscale_bpreshuffle_1x128x128_256x64x256x128_16x16_16x16_8x32x1_8x32x1_1x32x1x8_8_2x1_intrawave_v1,1147.9,1097.21,0.0
256,1984,3072,1536,ck,14,3,20.2425,a8w8_blockscale_bpreshuffle_1x128x128_256x64x128x128_16x16_16x16_8x32x1_8x32x1_1x32x1x8_8_2x1_intrawave_v1,924.95,985.83,0.0001
256,1984,4096,512,ck,16,2,13.8804,a8w8_blockscale_bpreshuffle_1x128x128_256x64x128x256_16x16_16x16_16x16x1_16x16x1_1x32x1x8_8_2x1_intrawave_v1,599.51,1395.2,0.0
256,1984,7168,2048,ck,13,3,49.5392,a8w8_blockscale_bpreshuffle_1x128x128_256x64x256x128_16x16_16x16_8x32x1_8x32x1_1x32x1x8_8_2x1_intrawave_v1,1175.85,952.5,0.0
256,1984,4608,7168,ck,14,0,101.9497,a8w8_blockscale_bpreshuffle_1x128x128_256x64x128x128_16x16_16x16_8x32x1_8x32x1_1x32x1x8_8_2x1_intrawave_v1,1285.57,642.83,0.0002
256,1984,7168,2304,ck,13,0,54.3635,a8w8_blockscale_bpreshuffle_1x128x128_256x64x256x128_16x16_16x16_8x32x1_8x32x1_1x32x1x8_8_2x1_intrawave_v1,1205.44,911.07,0
256,1984,128,7168,asm,39,8,12.6948,_ZN5aiter42fp8gemm_bf16_blockscale_BpreShuffle_96x128E,286.78,1232.53,0.011
256,1984,2112,7168,ck,15,1,63.9223,a8w8_blockscale_bpreshuffle_1x128x128_256x64x64x128_16x16_16x16_8x32x1_8x32x1_1x32x1x8_8_2x1_intrawave_v1,939.75,590.41,0.0084
256,1984,2240,7168,ck,15,2,70.213,a8w8_blockscale_bpreshuffle_1x128x128_256x64x64x128_16x16_16x16_8x32x1_8x32x1_1x32x1x8_8_2x1_intrawave_v1,907.4,557.82,0.0077
256,1984,8192,1536,ck,13,0,43.673,a8w8_blockscale_bpreshuffle_1x128x128_256x64x256x128_16x16_16x16_8x32x1_8x32x1_1x32x1x8_8_2x1_intrawave_v1,1143.25,1102.2,0
256,1984,11264,1536,ck,13,1,58.732,a8w8_blockscale_bpreshuffle_1x128x128_256x64x256x128_16x16_16x16_8x32x1_8x32x1_1x32x1x8_8_2x1_intrawave_v1,1168.91,1107.48,0.0
256,2048,3072,1536,ck,14,3,20.2985,a8w8_blockscale_bpreshuffle_1x128x128_256x64x128x128_16x16_16x16_8x32x1_8x32x1_1x32x1x8_8_2x1_intrawave_v1,952.16,1007.33,0.0002
256,2048,4096,512,ck,9,3,14.4315,a8w8_blockscale_bpreshuffle_1x128x128_256x32x128x128_16x16_16x16_8x32x1_8x32x1_1x32x1x8_8_2x1_intrawave_v1,595.22,1380.52,0.0
256,2048,7168,2048,ck,13,1,49.8865,a8w8_blockscale_bpreshuffle_1x128x128_256x64x256x128_16x16_16x16_8x32x1_8x32x1_1x32x1x8_8_2x1_intrawave_v1,1205.33,966.88,0.0
256,2048,4608,7168,ck,14,3,106.3731,a8w8_blockscale_bpreshuffle_1x128x128_256x64x128x128_16x16_16x16_8x32x1_8x32x1_1x32x1x8_8_2x1_intrawave_v1,1271.86,625.95,0.0002
256,2048,7168,2304,ck,13,0,55.6578,a8w8_blockscale_bpreshuffle_1x128x128_256x64x256x128_16x16_16x16_8x32x1_8x32x1_1x32x1x8_8_2x1_intrawave_v1,1215.39,909.02,0.0
256,2048,128,7168,asm,3,4,12.039,_ZN5aiter42fp8gemm_bf16_blockscale_BpreShuffle_32x128E,312.16,1339.14,0.0017
256,2048,2112,7168,ck,17,0,74.1411,a8w8_blockscale_bpreshuffle_1x128x128_256x64x64x256_16x16_16x16_16x16x1_16x16x1_1x32x1x8_8_2x1_intrawave_v1,836.36,518.87,0.0
256,2048,2240,7168,ck,17,1,74.9805,a8w8_blockscale_bpreshuffle_1x128x128_256x64x64x256_16x16_16x16_16x16x1_16x16x1_1x32x1x8_8_2x1_intrawave_v1,877.12,532.29,0.0
256,2048,8192,1536,ck,13,3,44.8748,a8w8_blockscale_bpreshuffle_1x128x128_256x64x256x128_16x16_16x16_8x32x1_8x32x1_1x32x1x8_8_2x1_intrawave_v1,1148.52,1098.23,0.0
256,2048,11264,1536,ck,13,2,62.1034,a8w8_blockscale_bpreshuffle_1x128x128_256x64x256x128_16x16_16x16_8x32x1_8x32x1_1x32x1x8_8_2x1_intrawave_v1,1141.11,1072.16,0.0
256,4096,3072,1536,ck,13,0,33.098,a8w8_blockscale_bpreshuffle_1x128x128_256x64x256x128_16x16_16x16_8x32x1_8x32x1_1x32x1x8_8_2x1_intrawave_v1,1167.89,1092.99,0
256,4096,4096,512,ck,16,1,23.8701,a8w8_blockscale_bpreshuffle_1x128x128_256x64x128x256_16x16_16x16_16x16x1_16x16x1_1x32x1x8_8_2x1_intrawave_v1,719.72,1581.42,0.0
256,4096,7168,2048,ck,13,0,85.7357,a8w8_blockscale_bpreshuffle_1x128x128_256x64x256x128_16x16_16x16_8x32x1_8x32x1_1x32x1x8_8_2x1_intrawave_v1,1402.67,953.97,0.0
256,4096,4608,7168,ck,13,2,170.6318,a8w8_blockscale_bpreshuffle_1x128x128_256x64x256x128_16x16_16x16_8x32x1_8x32x1_1x32x1x8_8_2x1_intrawave_v1,1585.77,586.87,0.0
256,4096,7168,2304,ck,13,0,94.5045,a8w8_blockscale_bpreshuffle_1x128x128_256x64x256x128_16x16_16x16_8x32x1_8x32x1_1x32x1x8_8_2x1_intrawave_v1,1431.59,895.96,0.0
256,4096,128,7168,asm,36,5,15.9887,_ZN5aiter42fp8gemm_bf16_blockscale_BpreShuffle_96x128E,470.09,1959.27,0.0036
256,4096,2112,7168,ck,15,1,122.808,a8w8_blockscale_bpreshuffle_1x128x128_256x64x64x128_16x16_16x16_8x32x1_8x32x1_1x32x1x8_8_2x1_intrawave_v1,1009.85,503.23,0.0085
256,4096,2240,7168,ck,15,1,125.1656,a8w8_blockscale_bpreshuffle_1x128x128_256x64x64x128_16x16_16x16_8x32x1_8x32x1_1x32x1x8_8_2x1_intrawave_v1,1050.87,509.46,0.0092
256,4096,8192,1536,ck,13,0,80.1809,a8w8_blockscale_bpreshuffle_1x128x128_256x64x256x128_16x16_16x16_8x32x1_8x32x1_1x32x1x8_8_2x1_intrawave_v1,1285.58,1072.37,0.0
256,4096,11264,1536,ck,13,2,105.4676,a8w8_blockscale_bpreshuffle_1x128x128_256x64x256x128_16x16_16x16_8x32x1_8x32x1_1x32x1x8_8_2x1_intrawave_v1,1343.86,1098.61,0.0
256,8192,3072,1536,ck,13,1,61.2235,a8w8_blockscale_bpreshuffle_1x128x128_256x64x256x128_16x16_16x16_8x32x1_8x32x1_1x32x1x8_8_2x1_intrawave_v1,1262.74,1104.69,0.0
256,8192,4096,512,ck,16,1,42.0877,a8w8_blockscale_bpreshuffle_1x128x128_256x64x128x256_16x16_16x16_16x16x1_16x16x1_1x32x1x8_8_2x1_intrawave_v1,816.38,1743.99,0.0
256,8192,7168,2048,ck,13,0,157.6682,a8w8_blockscale_bpreshuffle_1x128x128_256x64x256x128_16x16_16x16_8x32x1_8x32x1_1x32x1x8_8_2x1_intrawave_v1,1525.47,944.37,0
256,8192,4608,7168,ck,13,0,303.8251,a8w8_blockscale_bpreshuffle_1x128x128_256x64x256x128_16x16_16x16_8x32x1_8x32x1_1x32x1x8_8_2x1_intrawave_v1,1781.18,550.47,0
256,8192,7168,2304,ck,13,3,172.9382,a8w8_blockscale_bpreshuffle_1x128x128_256x64x256x128_16x16_16x16_8x32x1_8x32x1_1x32x1x8_8_2x1_intrawave_v1,1564.62,883.73,0.0
256,8192,128,7168,ck,17,3,22.7383,a8w8_blockscale_bpreshuffle_1x128x128_256x64x64x256_16x16_16x16_16x16x1_16x16x1_1x32x1x8_8_2x1_intrawave_v1,661.1,2715.02,0.0
256,8192,2112,7168,ck,15,1,223.055,a8w8_blockscale_bpreshuffle_1x128x128_256x64x64x128_16x16_16x16_8x32x1_8x32x1_1x32x1x8_8_2x1_intrawave_v1,1111.99,486.26,0.0093
256,8192,2240,7168,ck,15,2,231.8409,a8w8_blockscale_bpreshuffle_1x128x128_256x64x64x128_16x16_16x16_8x32x1_8x32x1_1x32x1x8_8_2x1_intrawave_v1,1134.69,480.83,0.0095
256,8192,8192,1536,ck,13,1,147.3138,a8w8_blockscale_bpreshuffle_1x128x128_256x64x256x128_16x16_16x16_8x32x1_8x32x1_1x32x1x8_8_2x1_intrawave_v1,1399.45,1081.93,0.0
256,8192,11264,1536,ck,13,0,191.915,a8w8_blockscale_bpreshuffle_1x128x128_256x64x256x128_16x16_16x16_8x32x1_8x32x1_1x32x1x8_8_2x1_intrawave_v1,1477.05,1117.34,0.0
256,16384,3072,1536,ck,13,0,112.7521,a8w8_blockscale_bpreshuffle_1x128x128_256x64x256x128_16x16_16x16_8x32x1_8x32x1_1x32x1x8_8_2x1_intrawave_v1,1371.32,1157.83,0
256,16384,4096,512,ck,16,1,79.1436,a8w8_blockscale_bpreshuffle_1x128x128_256x64x128x256_16x16_16x16_16x16x1_16x16x1_1x32x1x8_8_2x1_intrawave_v1,868.29,1828.37,0.0
256,16384,7168,2048,ck,13,1,293.0906,a8w8_blockscale_bpreshuffle_1x128x128_256x64x256x128_16x16_16x16_8x32x1_8x32x1_1x32x1x8_8_2x1_intrawave_v1,1641.25,965.97,0.0
256,16384,4608,7168,ck,13,2,574.9211,a8w8_blockscale_bpreshuffle_1x128x128_256x64x256x128_16x16_16x16_8x32x1_8x32x1_1x32x1x8_8_2x1_intrawave_v1,1882.57,524.36,0.0
256,16384,7168,2304,ck,13,3,322.3124,a8w8_blockscale_bpreshuffle_1x128x128_256x64x256x128_16x16_16x16_8x32x1_8x32x1_1x32x1x8_8_2x1_intrawave_v1,1679.01,897.09,0.0
256,16384,128,7168,asm,41,2,33.8487,_ZN5aiter43fp8gemm_bf16_blockscale_BpreShuffle_128x128E,888.21,3620.59,0.0
256,16384,2112,7168,ck,15,0,415.4193,a8w8_blockscale_bpreshuffle_1x128x128_256x64x64x128_16x16_16x16_8x32x1_8x32x1_1x32x1x8_8_2x1_intrawave_v1,1194.14,485.74,0.0096
256,16384,2240,7168,ck,15,3,435.2481,a8w8_blockscale_bpreshuffle_1x128x128_256x64x64x128_16x16_16x16_8x32x1_8x32x1_1x32x1x8_8_2x1_intrawave_v1,1208.81,475.35,0.0095
256,16384,8192,1536,ck,13,3,274.0824,a8w8_blockscale_bpreshuffle_1x128x128_256x64x256x128_16x16_16x16_8x32x1_8x32x1_1x32x1x8_8_2x1_intrawave_v1,1504.35,1117.12,0.0
256,16384,11264,1536,ck,13,0,356.6236,a8w8_blockscale_bpreshuffle_1x128x128_256x64x256x128_16x16_16x16_8x32x1_8x32x1_1x32x1x8_8_2x1_intrawave_v1,1589.73,1154.06,0
256,32768,3072,1536,ck,13,1,211.2639,a8w8_blockscale_bpreshuffle_1x128x128_256x64x256x128_16x16_16x16_8x32x1_8x32x1_1x32x1x8_8_2x1_intrawave_v1,1463.75,1213.54,0.0
256,32768,4096,512,ck,16,2,144.0402,a8w8_blockscale_bpreshuffle_1x128x128_256x64x128x256_16x16_16x16_16x16x1_16x16x1_1x32x1x8_8_2x1_intrawave_v1,954.17,1994.65,0.0
256,32768,7168,2048,ck,13,0,562.434,a8w8_blockscale_bpreshuffle_1x128x128_256x64x256x128_16x16_16x16_8x32x1_8x32x1_1x32x1x8_8_2x1_intrawave_v1,1710.55,980.65,0.0
256,32768,4608,7168,ck,13,0,1101.5999,a8w8_blockscale_bpreshuffle_1x128x128_256x64x256x128_16x16_16x16_8x32x1_8x32x1_1x32x1x8_8_2x1_intrawave_v1,1965.02,517.34,0
256,32768,7168,2304,ck,13,3,614.5125,a8w8_blockscale_bpreshuffle_1x128x128_256x64x256x128_16x16_16x16_8x32x1_8x32x1_1x32x1x8_8_2x1_intrawave_v1,1761.29,914.18,0.0
256,32768,128,7168,asm,40,1,57.7487,_ZN5aiter43fp8gemm_bf16_blockscale_BpreShuffle_128x128E,1041.23,4228.44,0.0
256,32768,2112,7168,ck,15,0,803.075,a8w8_blockscale_bpreshuffle_1x128x128_256x64x64x128_16x16_16x16_8x32x1_8x32x1_1x32x1x8_8_2x1_intrawave_v1,1235.42,483.68,0.0096
256,32768,2240,7168,ck,15,1,834.1016,a8w8_blockscale_bpreshuffle_1x128x128_256x64x64x128_16x16_16x16_8x32x1_8x32x1_1x32x1x8_8_2x1_intrawave_v1,1261.56,476.85,0.0099
256,32768,8192,1536,ck,13,0,515.9307,a8w8_blockscale_bpreshuffle_1x128x128_256x64x256x128_16x16_16x16_8x32x1_8x32x1_1x32x1x8_8_2x1_intrawave_v1,1598.34,1162.53,0.0
256,32768,11264,1536,ck,13,1,685.4543,a8w8_blockscale_bpreshuffle_1x128x128_256x64x256x128_16x16_16x16_8x32x1_8x32x1_1x32x1x8_8_2x1_intrawave_v1,1654.19,1175.62,0.0
256,16,3072,3072,ck,12,0,10.8643,a8w8_blockscale_bpreshuffle_1x128x128_256x32x64x256_16x16_16x16_16x16x1_16x16x1_1x32x1x8_8_2x1_intrawave_v1,27.8,882.21,0.0
256,32,3072,3072,ck,12,0,10.0661,a8w8_blockscale_bpreshuffle_1x128x128_256x32x64x256_16x16_16x16_16x16x1_16x16x1_1x32x1x8_8_2x1_intrawave_v1,60.0,966.82,0.0
256,48,3072,3072,ck,7,0,10.0112,a8w8_blockscale_bpreshuffle_1x128x128_256x16x64x256_16x16_16x16_16x16x1_16x16x1_1x16x1x16_4_1x1_intrawave_v1,90.5,986.85,0.0
256,64,3072,3072,ck,7,0,10.4768,a8w8_blockscale_bpreshuffle_1x128x128_256x16x64x256_16x16_16x16_16x16x1_16x16x1_1x16x1x16_4_1x1_intrawave_v1,115.3,957.07,0.0
256,80,3072,3072,ck,7,0,9.8464,a8w8_blockscale_bpreshuffle_1x128x128_256x16x64x256_16x16_16x16_16x16x1_16x16x1_1x16x1x16_4_1x1_intrawave_v1,153.35,1033.32,0.0
256,96,3072,3072,ck,7,0,10.1259,a8w8_blockscale_bpreshuffle_1x128x128_256x16x64x256_16x16_16x16_16x16x1_16x16x1_1x16x1x16_4_1x1_intrawave_v1,178.94,1019.36,0.0
256,112,3072,3072,ck,7,0,10.3199,a8w8_blockscale_bpreshuffle_1x128x128_256x16x64x256_16x16_16x16_16x16x1_16x16x1_1x16x1x16_4_1x1_intrawave_v1,204.84,1014.48,0.0
256,128,3072,3072,ck,7,0,10.5946,a8w8_blockscale_bpreshuffle_1x128x128_256x16x64x256_16x16_16x16_16x16x1_16x16x1_1x16x1x16_4_1x1_intrawave_v1,228.03,1002.1,0.0
256,144,3072,3072,ck,7,0,10.5488,a8w8_blockscale_bpreshuffle_1x128x128_256x16x64x256_16x16_16x16_16x16x1_16x16x1_1x16x1x16_4_1x1_intrawave_v1,257.65,1020.43,0.0
256,160,3072,3072,ck,7,0,10.8107,a8w8_blockscale_bpreshuffle_1x128x128_256x16x64x256_16x16_16x16_16x16x1_16x16x1_1x16x1x16_4_1x1_intrawave_v1,279.34,1009.35,0.0
256,176,3072,3072,ck,12,0,11.2876,a8w8_blockscale_bpreshuffle_1x128x128_256x32x64x256_16x16_16x16_16x16x1_16x16x1_1x32x1x8_8_2x1_intrawave_v1,294.3,979.77,0.0
256,192,3072,3072,ck,12,0,10.7415,a8w8_blockscale_bpreshuffle_1x128x128_256x32x64x256_16x16_16x16_16x16x1_16x16x1_1x32x1x8_8_2x1_intrawave_v1,337.37,1043.3,0.0
256,208,3072,3072,ck,12,0,11.8938,a8w8_blockscale_bpreshuffle_1x128x128_256x32x64x256_16x16_16x16_16x16x1_16x16x1_1x32x1x8_8_2x1_intrawave_v1,330.08,954.62,0.0
256,224,3072,3072,ck,12,0,11.6742,a8w8_blockscale_bpreshuffle_1x128x128_256x32x64x256_16x16_16x16_16x16x1_16x16x1_1x32x1x8_8_2x1_intrawave_v1,362.15,985.21,0.0
256,240,3072,3072,ck,17,0,11.9951,a8w8_blockscale_bpreshuffle_1x128x128_256x64x64x256_16x16_16x16_16x16x1_16x16x1_1x32x1x8_8_2x1_intrawave_v1,377.64,971.15,0.0
256,256,3072,3072,ck,17,0,11.4616,a8w8_blockscale_bpreshuffle_1x128x128_256x64x64x256_16x16_16x16_16x16x1_16x16x1_1x32x1x8_8_2x1_intrawave_v1,421.57,1029.22,0.0
256,288,3072,3072,ck,17,0,12.0648,a8w8_blockscale_bpreshuffle_1x128x128_256x64x64x256_16x16_16x16_16x16x1_16x16x1_1x32x1x8_8_2x1_intrawave_v1,450.55,1002.2,0.0
256,320,3072,3072,ck,17,0,11.7039,a8w8_blockscale_bpreshuffle_1x128x128_256x64x64x256_16x16_16x16_16x16x1_16x16x1_1x32x1x8_8_2x1_intrawave_v1,516.05,1058.31,0.0
256,352,3072,3072,ck,12,0,14.9334,a8w8_blockscale_bpreshuffle_1x128x128_256x32x64x256_16x16_16x16_16x16x1_16x16x1_1x32x1x8_8_2x1_intrawave_v1,444.89,849.18,0.0
256,384,3072,3072,ck,11,0,14.9477,a8w8_blockscale_bpreshuffle_1x128x128_256x32x128x256_16x16_16x16_16x16x1_16x16x1_1x32x1x8_8_2x1_intrawave_v1,484.87,868.1,0.0
256,416,3072,3072,ck,11,0,15.6581,a8w8_blockscale_bpreshuffle_1x128x128_256x32x128x256_16x16_16x16_16x16x1_16x16x1_1x32x1x8_8_2x1_intrawave_v1,501.45,847.55,0.0
256,448,3072,3072,ck,11,0,15.35,a8w8_blockscale_bpreshuffle_1x128x128_256x32x128x256_16x16_16x16_16x16x1_16x16x1_1x32x1x8_8_2x1_intrawave_v1,550.86,883.78,0.0
256,480,3072,3072,ck,12,0,16.5126,a8w8_blockscale_bpreshuffle_1x128x128_256x32x64x256_16x16_16x16_16x16x1_16x16x1_1x32x1x8_8_2x1_intrawave_v1,548.65,839.41,0.0
256,512,3072,3072,ck,17,0,16.8731,a8w8_blockscale_bpreshuffle_1x128x128_256x64x64x256_16x16_16x16_16x16x1_16x16x1_1x32x1x8_8_2x1_intrawave_v1,572.73,838.96,0.0
256,544,3072,3072,ck,11,0,16.8172,a8w8_blockscale_bpreshuffle_1x128x128_256x32x128x256_16x16_16x16_16x16x1_16x16x1_1x32x1x8_8_2x1_intrawave_v1,610.54,859.28,0.0
256,576,3072,3072,ck,17,0,16.5957,a8w8_blockscale_bpreshuffle_1x128x128_256x64x64x256_16x16_16x16_16x16x1_16x16x1_1x32x1x8_8_2x1_intrawave_v1,655.09,888.52,0.0
256,608,3072,3072,ck,11,0,17.1532,a8w8_blockscale_bpreshuffle_1x128x128_256x32x128x256_16x16_16x16_16x16x1_16x16x1_1x32x1x8_8_2x1_intrawave_v1,669.01,876.83,0.0
256,640,3072,3072,ck,17,0,17.2266,a8w8_blockscale_bpreshuffle_1x128x128_256x64x64x256_16x16_16x16_16x16x1_16x16x1_1x32x1x8_8_2x1_intrawave_v1,701.22,890.22,0.0
256,672,3072,3072,ck,11,0,17.4485,a8w8_blockscale_bpreshuffle_1x128x128_256x32x128x256_16x16_16x16_16x16x1_16x16x1_1x32x1x8_8_2x1_intrawave_v1,726.91,895.8,0.0
256,704,3072,3072,ck,15,0,19.8801,a8w8_blockscale_bpreshuffle_1x128x128_256x64x64x128_16x16_16x16_8x32x1_8x32x1_1x32x1x8_8_2x1_intrawave_v1,668.38,801.06,0.0136
256,736,3072,3072,ck,15,0,20.9578,a8w8_blockscale_bpreshuffle_1x128x128_256x64x64x128_16x16_16x16_8x32x1_8x32x1_1x32x1x8_8_2x1_intrawave_v1,662.83,773.94,0.0154
256,768,3072,3072,ck,14,0,20.4681,a8w8_blockscale_bpreshuffle_1x128x128_256x64x128x128_16x16_16x16_8x32x1_8x32x1_1x32x1x8_8_2x1_intrawave_v1,708.2,806.87,0.0
256,800,3072,3072,ck,11,0,21.7345,a8w8_blockscale_bpreshuffle_1x128x128_256x32x128x256_16x16_16x16_16x16x1_16x16x1_1x32x1x8_8_2x1_intrawave_v1,694.72,773.42,0.0
256,832,3072,3072,ck,14,0,20.8965,a8w8_blockscale_bpreshuffle_1x128x128_256x64x128x128_16x16_16x16_8x32x1_8x32x1_1x32x1x8_8_2x1_intrawave_v1,751.49,818.55,0.0001
256,864,3072,3072,ck,14,0,22.2577,a8w8_blockscale_bpreshuffle_1x128x128_256x64x128x128_16x16_16x16_8x32x1_8x32x1_1x32x1x8_8_2x1_intrawave_v1,732.67,781.74,0.0001
256,896,3072,3072,ck,14,0,21.1753,a8w8_blockscale_bpreshuffle_1x128x128_256x64x128x128_16x16_16x16_8x32x1_8x32x1_1x32x1x8_8_2x1_intrawave_v1,798.64,835.63,0.0
256,928,3072,3072,ck,14,0,22.8326,a8w8_blockscale_bpreshuffle_1x128x128_256x64x128x128_16x16_16x16_8x32x1_8x32x1_1x32x1x8_8_2x1_intrawave_v1,767.12,787.89,0.0
256,960,3072,3072,ck,14,0,22.7877,a8w8_blockscale_bpreshuffle_1x128x128_256x64x128x128_16x16_16x16_8x32x1_8x32x1_1x32x1x8_8_2x1_intrawave_v1,795.14,802.39,0.0001
256,992,3072,3072,ck,14,0,23.2898,a8w8_blockscale_bpreshuffle_1x128x128_256x64x128x128_16x16_16x16_8x32x1_8x32x1_1x32x1x8_8_2x1_intrawave_v1,803.93,797.75,0.0001
256,1024,3072,3072,ck,14,0,23.4592,a8w8_blockscale_bpreshuffle_1x128x128_256x64x128x128_16x16_16x16_8x32x1_8x32x1_1x32x1x8_8_2x1_intrawave_v1,823.87,804.56,0.0001
256,1088,3072,3072,ck,14,0,22.7673,a8w8_blockscale_bpreshuffle_1x128x128_256x64x128x128_16x16_16x16_8x32x1_8x32x1_1x32x1x8_8_2x1_intrawave_v1,901.97,854.92,0.0001
256,1152,3072,3072,ck,14,0,23.2107,a8w8_blockscale_bpreshuffle_1x128x128_256x64x128x128_16x16_16x16_8x32x1_8x32x1_1x32x1x8_8_2x1_intrawave_v1,936.78,864.0,0.0002
256,1216,3072,3072,ck,14,0,23.5252,a8w8_blockscale_bpreshuffle_1x128x128_256x64x128x128_16x16_16x16_8x32x1_8x32x1_1x32x1x8_8_2x1_intrawave_v1,975.6,877.52,0.0001
256,1280,3072,3072,ck,14,0,24.1498,a8w8_blockscale_bpreshuffle_1x128x128_256x64x128x128_16x16_16x16_8x32x1_8x32x1_1x32x1x8_8_2x1_intrawave_v1,1000.39,879.25,0.0001
256,1344,3072,3072,ck,14,0,24.6412,a8w8_blockscale_bpreshuffle_1x128x128_256x64x128x128_16x16_16x16_8x32x1_8x32x1_1x32x1x8_8_2x1_intrawave_v1,1029.46,885.65,0.0002
256,1408,3072,3072,ck,14,0,30.0214,a8w8_blockscale_bpreshuffle_1x128x128_256x64x128x128_16x16_16x16_8x32x1_8x32x1_1x32x1x8_8_2x1_intrawave_v1,885.21,746.58,0.0001
256,1472,3072,3072,ck,14,0,30.4428,a8w8_blockscale_bpreshuffle_1x128x128_256x64x128x128_16x16_16x16_8x32x1_8x32x1_1x32x1x8_8_2x1_intrawave_v1,912.63,755.62,0.0002
256,1536,3072,3072,ck,14,0,30.487,a8w8_blockscale_bpreshuffle_1x128x128_256x64x128x128_16x16_16x16_8x32x1_8x32x1_1x32x1x8_8_2x1_intrawave_v1,950.93,773.87,0.0002
256,1600,3072,3072,ck,14,0,30.5264,a8w8_blockscale_bpreshuffle_1x128x128_256x64x128x128_16x16_16x16_8x32x1_8x32x1_1x32x1x8_8_2x1_intrawave_v1,989.27,792.19,0.0002
256,1664,3072,3072,ck,14,0,30.6966,a8w8_blockscale_bpreshuffle_1x128x128_256x64x128x128_16x16_16x16_8x32x1_8x32x1_1x32x1x8_8_2x1_intrawave_v1,1023.14,807.01,0.0002
256,1728,3072,3072,ck,14,0,30.8783,a8w8_blockscale_bpreshuffle_1x128x128_256x64x128x128_16x16_16x16_8x32x1_8x32x1_1x32x1x8_8_2x1_intrawave_v1,1056.24,821.37,0.0002
256,1792,3072,3072,ck,14,0,31.901,a8w8_blockscale_bpreshuffle_1x128x128_256x64x128x128_16x16_16x16_8x32x1_8x32x1_1x32x1x8_8_2x1_intrawave_v1,1060.24,813.52,0.0003
256,1856,3072,3072,ck,14,0,32.3245,a8w8_blockscale_bpreshuffle_1x128x128_256x64x128x128_16x16_16x16_8x32x1_8x32x1_1x32x1x8_8_2x1_intrawave_v1,1083.72,821.11,0.0002
256,1920,3072,3072,ck,14,0,31.9945,a8w8_blockscale_bpreshuffle_1x128x128_256x64x128x128_16x16_16x16_8x32x1_8x32x1_1x32x1x8_8_2x1_intrawave_v1,1132.66,848.02,0.0002
256,1984,3072,3072,ck,14,0,34.6977,a8w8_blockscale_bpreshuffle_1x128x128_256x64x128x128_16x16_16x16_8x32x1_8x32x1_1x32x1x8_8_2x1_intrawave_v1,1079.23,798.95,0.0002
256,2048,3072,3072,ck,14,0,34.5613,a8w8_blockscale_bpreshuffle_1x128x128_256x64x128x128_16x16_16x16_8x32x1_8x32x1_1x32x1x8_8_2x1_intrawave_v1,1118.44,819.17,0.0002
256,4096,3072,3072,ck,13,0,57.9315,a8w8_blockscale_bpreshuffle_1x128x128_256x64x256x128_16x16_16x16_8x32x1_8x32x1_1x32x1x8_8_2x1_intrawave_v1,1334.5,814.51,0.0
256,8192,3072,3072,ck,13,0,108.3602,a8w8_blockscale_bpreshuffle_1x128x128_256x64x256x128_16x16_16x16_8x32x1_8x32x1_1x32x1x8_8_2x1_intrawave_v1,1426.9,783.82,0.0
256,16384,3072,3072,ck,13,0,189.7915,a8w8_blockscale_bpreshuffle_1x128x128_256x64x256x128_16x16_16x16_8x32x1_8x32x1_1x32x1x8_8_2x1_intrawave_v1,1629.35,845.31,0.0
256,32768,3072,3072,ck,13,0,358.2762,a8w8_blockscale_bpreshuffle_1x128x128_256x64x256x128_16x16_16x16_8x32x1_8x32x1_1x32x1x8_8_2x1_intrawave_v1,1726.25,869.24,0.0
256,16,4096,3072,ck,7,0,9.739,a8w8_blockscale_bpreshuffle_1x128x128_256x16x64x256_16x16_16x16_16x16x1_16x16x1_1x16x1x16_4_1x1_intrawave_v1,41.34,1310.52,0.0
256,32,4096,3072,ck,7,0,9.6595,a8w8_blockscale_bpreshuffle_1x128x128_256x16x64x256_16x16_16x16_16x16x1_16x16x1_1x16x1x16_4_1x1_intrawave_v1,83.37,1339.96,0.0
256,48,4096,3072,ck,7,0,9.196,a8w8_blockscale_bpreshuffle_1x128x128_256x16x64x256_16x16_16x16_16x16x1_16x16x1_1x16x1x16_4_1x1_intrawave_v1,131.36,1427.1,0.0
256,64,4096,3072,ck,12,0,9.8331,a8w8_blockscale_bpreshuffle_1x128x128_256x32x64x256_16x16_16x16_16x16x1_16x16x1_1x32x1x8_8_2x1_intrawave_v1,163.8,1352.96,0.0
256,80,4096,3072,ck,6,0,10.5196,a8w8_blockscale_bpreshuffle_1x128x128_256x16x128x256_16x16_16x16_16x16x1_16x16x1_1x16x1x16_8_1x2_intrawave_v1,191.38,1281.8,0.0
256,96,4096,3072,ck,7,0,10.4256,a8w8_blockscale_bpreshuffle_1x128x128_256x16x64x256_16x16_16x16_16x16x1_16x16x1_1x16x1x16_4_1x1_intrawave_v1,231.73,1310.64,0.0
256,112,4096,3072,ck,6,0,10.3373,a8w8_blockscale_bpreshuffle_1x128x128_256x16x128x256_16x16_16x16_16x16x1_16x16x1_1x16x1x16_8_1x2_intrawave_v1,272.66,1339.27,0.0
256,128,4096,3072,ck,12,0,9.7601,a8w8_blockscale_bpreshuffle_1x128x128_256x32x64x256_16x16_16x16_16x16x1_16x16x1_1x32x1x8_8_2x1_intrawave_v1,330.04,1436.94,0.0
256,144,4096,3072,ck,17,0,11.6731,a8w8_blockscale_bpreshuffle_1x128x128_256x64x64x256_16x16_16x16_16x16x1_16x16x1_1x32x1x8_8_2x1_intrawave_v1,310.45,1216.89,0.0
256,160,4096,3072,ck,17,0,11.6939,a8w8_blockscale_bpreshuffle_1x128x128_256x64x64x256_16x16_16x16_16x16x1_16x16x1_1x32x1x8_8_2x1_intrawave_v1,344.33,1230.14,0.0
256,176,4096,3072,ck,17,0,11.6841,a8w8_blockscale_bpreshuffle_1x128x128_256x64x64x256_16x16_16x16_16x16x1_16x16x1_1x32x1x8_8_2x1_intrawave_v1,379.08,1246.6,0.0
256,192,4096,3072,ck,17,0,11.5052,a8w8_blockscale_bpreshuffle_1x128x128_256x64x64x256_16x16_16x16_16x16x1_16x16x1_1x32x1x8_8_2x1_intrawave_v1,419.97,1281.65,0.0
256,208,4096,3072,ck,17,0,11.9045,a8w8_blockscale_bpreshuffle_1x128x128_256x64x64x256_16x16_16x16_16x16x1_16x16x1_1x32x1x8_8_2x1_intrawave_v1,439.71,1253.8,0.0
256,224,4096,3072,ck,17,0,11.8573,a8w8_blockscale_bpreshuffle_1x128x128_256x64x64x256_16x16_16x16_16x16x1_16x16x1_1x32x1x8_8_2x1_intrawave_v1,475.42,1273.99,0.0
256,240,4096,3072,ck,17,0,11.8667,a8w8_blockscale_bpreshuffle_1x128x128_256x64x64x256_16x16_16x16_16x16x1_16x16x1_1x32x1x8_8_2x1_intrawave_v1,508.97,1288.17,0.0
256,256,4096,3072,ck,17,0,11.6088,a8w8_blockscale_bpreshuffle_1x128x128_256x64x64x256_16x16_16x16_16x16x1_16x16x1_1x32x1x8_8_2x1_intrawave_v1,554.96,1332.31,0.0
256,288,4096,3072,ck,10,0,15.8248,a8w8_blockscale_bpreshuffle_1x128x128_256x32x64x128_16x16_16x16_8x32x1_8x32x1_1x32x1x8_8_2x1_intrawave_v1,458.0,1000.14,0.018
256,320,4096,3072,ck,12,0,15.7249,a8w8_blockscale_bpreshuffle_1x128x128_256x32x64x256_16x16_16x16_16x16x1_16x16x1_1x32x1x8_8_2x1_intrawave_v1,512.12,1029.41,0.0
256,352,4096,3072,ck,12,0,16.4664,a8w8_blockscale_bpreshuffle_1x128x128_256x32x64x256_16x16_16x16_16x16x1_16x16x1_1x32x1x8_8_2x1_intrawave_v1,537.97,1004.95,0.0
256,384,4096,3072,ck,11,0,15.604,a8w8_blockscale_bpreshuffle_1x128x128_256x32x128x256_16x16_16x16_16x16x1_16x16x1_1x32x1x8_8_2x1_intrawave_v1,619.31,1083.59,0.0
256,416,4096,3072,ck,11,0,17.0516,a8w8_blockscale_bpreshuffle_1x128x128_256x32x128x256_16x16_16x16_16x16x1_16x16x1_1x32x1x8_8_2x1_intrawave_v1,613.96,1012.73,0.0
256,448,4096,3072,ck,17,0,16.6974,a8w8_blockscale_bpreshuffle_1x128x128_256x64x64x256_16x16_16x16_16x16x1_16x16x1_1x32x1x8_8_2x1_intrawave_v1,675.21,1055.8,0.0
256,480,4096,3072,ck,17,0,17.9281,a8w8_blockscale_bpreshuffle_1x128x128_256x64x64x256_16x16_16x16_16x16x1_16x16x1_1x32x1x8_8_2x1_intrawave_v1,673.78,1003.43,0.0
256,512,4096,3072,ck,17,0,17.291,a8w8_blockscale_bpreshuffle_1x128x128_256x64x64x256_16x16_16x16_16x16x1_16x16x1_1x32x1x8_8_2x1_intrawave_v1,745.18,1061.25,0.0
256,544,4096,3072,ck,14,0,21.1567,a8w8_blockscale_bpreshuffle_1x128x128_256x64x128x128_16x16_16x16_8x32x1_8x32x1_1x32x1x8_8_2x1_intrawave_v1,647.09,884.38,0.0
256,576,4096,3072,ck,14,0,20.57,a8w8_blockscale_bpreshuffle_1x128x128_256x64x128x128_16x16_16x16_8x32x1_8x32x1_1x32x1x8_8_2x1_intrawave_v1,704.69,927.13,0.0
256,608,4096,3072,ck,11,0,22.0168,a8w8_blockscale_bpreshuffle_1x128x128_256x32x128x256_16x16_16x16_16x16x1_16x16x1_1x32x1x8_8_2x1_intrawave_v1,694.96,882.57,0.0
256,640,4096,3072,ck,15,0,21.9972,a8w8_blockscale_bpreshuffle_1x128x128_256x64x64x128_16x16_16x16_8x32x1_8x32x1_1x32x1x8_8_2x1_intrawave_v1,732.19,899.75,0.0114
256,672,4096,3072,ck,14,0,22.57,a8w8_blockscale_bpreshuffle_1x128x128_256x64x128x128_16x16_16x16_8x32x1_8x32x1_1x32x1x8_8_2x1_intrawave_v1,749.29,892.88,0.0
256,704,4096,3072,ck,14,0,22.373,a8w8_blockscale_bpreshuffle_1x128x128_256x64x128x128_16x16_16x16_8x32x1_8x32x1_1x32x1x8_8_2x1_intrawave_v1,791.88,916.85,0.0001
256,736,4096,3072,ck,14,0,22.7021,a8w8_blockscale_bpreshuffle_1x128x128_256x64x128x128_16x16_16x16_8x32x1_8x32x1_1x32x1x8_8_2x1_intrawave_v1,815.87,919.44,0.0001
256,768,4096,3072,ck,14,0,21.4006,a8w8_blockscale_bpreshuffle_1x128x128_256x64x128x128_16x16_16x16_8x32x1_8x32x1_1x32x1x8_8_2x1_intrawave_v1,903.12,992.2,0.0001
256,800,4096,3072,ck,14,0,23.4331,a8w8_blockscale_bpreshuffle_1x128x128_256x64x128x128_16x16_16x16_8x32x1_8x32x1_1x32x1x8_8_2x1_intrawave_v1,859.15,921.52,0.0001
256,832,4096,3072,ck,14,0,23.3145,a8w8_blockscale_bpreshuffle_1x128x128_256x64x128x128_16x16_16x16_8x32x1_8x32x1_1x32x1x8_8_2x1_intrawave_v1,898.07,941.67,0.0001
256,864,4096,3072,ck,14,0,24.3196,a8w8_blockscale_bpreshuffle_1x128x128_256x64x128x128_16x16_16x16_8x32x1_8x32x1_1x32x1x8_8_2x1_intrawave_v1,894.06,917.57,0.0001
256,896,4096,3072,ck,14,0,23.6425,a8w8_blockscale_bpreshuffle_1x128x128_256x64x128x128_16x16_16x16_8x32x1_8x32x1_1x32x1x8_8_2x1_intrawave_v1,953.73,959.1,0.0001
256,928,4096,3072,ck,14,0,24.743,a8w8_blockscale_bpreshuffle_1x128x128_256x64x128x128_16x16_16x16_8x32x1_8x32x1_1x32x1x8_8_2x1_intrawave_v1,943.86,931.01,0.0001
256,960,4096,3072,ck,14,0,24.0362,a8w8_blockscale_bpreshuffle_1x128x128_256x64x128x128_16x16_16x16_8x32x1_8x32x1_1x32x1x8_8_2x1_intrawave_v1,1005.12,973.38,0.0001
256,992,4096,3072,ck,14,0,25.488,a8w8_blockscale_bpreshuffle_1x128x128_256x64x128x128_16x16_16x16_8x32x1_8x32x1_1x32x1x8_8_2x1_intrawave_v1,979.46,932.08,0.0001
256,1024,4096,3072,ck,13,0,25.208,a8w8_blockscale_bpreshuffle_1x128x128_256x64x256x128_16x16_16x16_8x32x1_8x32x1_1x32x1x8_8_2x1_intrawave_v1,1022.29,956.73,0.0
256,1088,4096,3072,ck,14,0,30.9108,a8w8_blockscale_bpreshuffle_1x128x128_256x64x128x128_16x16_16x16_8x32x1_8x32x1_1x32x1x8_8_2x1_intrawave_v1,885.79,803.54,0.0002
256,1152,4096,3072,ck,14,0,30.3988,a8w8_blockscale_bpreshuffle_1x128x128_256x64x128x128_16x16_16x16_8x32x1_8x32x1_1x32x1x8_8_2x1_intrawave_v1,953.69,840.79,0.0002
256,1216,4096,3072,ck,14,0,31.5244,a8w8_blockscale_bpreshuffle_1x128x128_256x64x128x128_16x16_16x16_8x32x1_8x32x1_1x32x1x8_8_2x1_intrawave_v1,970.73,833.64,0.0002
256,1280,4096,3072,ck,14,0,31.6536,a8w8_blockscale_bpreshuffle_1x128x128_256x64x128x128_16x16_16x16_8x32x1_8x32x1_1x32x1x8_8_2x1_intrawave_v1,1017.65,853.01,0.0002
256,1344,4096,3072,ck,14,0,32.1892,a8w8_blockscale_bpreshuffle_1x128x128_256x64x128x128_16x16_16x16_8x32x1_8x32x1_1x32x1x8_8_2x1_intrawave_v1,1050.75,861.21,0.0002
256,1408,4096,3072,ck,14,0,31.9836,a8w8_blockscale_bpreshuffle_1x128x128_256x64x128x128_16x16_16x16_8x32x1_8x32x1_1x32x1x8_8_2x1_intrawave_v1,1107.86,889.29,0.0002
256,1472,4096,3072,ck,13,0,32.9633,a8w8_blockscale_bpreshuffle_1x128x128_256x64x256x128_16x16_16x16_8x32x1_8x32x1_1x32x1x8_8_2x1_intrawave_v1,1123.8,884.73,0.0
256,1536,4096,3072,ck,13,0,33.6192,a8w8_blockscale_bpreshuffle_1x128x128_256x64x256x128_16x16_16x16_8x32x1_8x32x1_1x32x1x8_8_2x1_intrawave_v1,1149.78,888.91,0.0
256,1600,4096,3072,ck,13,0,33.902,a8w8_blockscale_bpreshuffle_1x128x128_256x64x256x128_16x16_16x16_8x32x1_8x32x1_1x32x1x8_8_2x1_intrawave_v1,1187.7,902.76,0.0
256,1664,4096,3072,ck,13,0,34.2564,a8w8_blockscale_bpreshuffle_1x128x128_256x64x256x128_16x16_16x16_8x32x1_8x32x1_1x32x1x8_8_2x1_intrawave_v1,1222.43,914.46,0.0
256,1728,4096,3072,ck,13,0,35.1168,a8w8_blockscale_bpreshuffle_1x128x128_256x64x256x128_16x16_16x16_8x32x1_8x32x1_1x32x1x8_8_2x1_intrawave_v1,1238.34,912.59,0.0
256,1792,4096,3072,ck,13,0,35.6792,a8w8_blockscale_bpreshuffle_1x128x128_256x64x256x128_16x16_16x16_8x32x1_8x32x1_1x32x1x8_8_2x1_intrawave_v1,1263.96,918.41,0.0
256,1856,4096,3072,ck,13,0,36.6115,a8w8_blockscale_bpreshuffle_1x128x128_256x64x256x128_16x16_16x16_8x32x1_8x32x1_1x32x1x8_8_2x1_intrawave_v1,1275.77,914.71,0.0
256,1920,4096,3072,ck,13,0,36.8344,a8w8_blockscale_bpreshuffle_1x128x128_256x64x256x128_16x16_16x16_8x32x1_8x32x1_1x32x1x8_8_2x1_intrawave_v1,1311.77,928.75,0.0
256,1984,4096,3072,ck,13,0,39.3613,a8w8_blockscale_bpreshuffle_1x128x128_256x64x256x128_16x16_16x16_8x32x1_8x32x1_1x32x1x8_8_2x1_intrawave_v1,1268.48,887.44,0.0
256,2048,4096,3072,ck,13,0,39.895,a8w8_blockscale_bpreshuffle_1x128x128_256x64x256x128_16x16_16x16_8x32x1_8x32x1_1x32x1x8_8_2x1_intrawave_v1,1291.88,893.64,0.0
256,4096,4096,3072,ck,13,0,69.9759,a8w8_blockscale_bpreshuffle_1x128x128_256x64x256x128_16x16_16x16_8x32x1_8x32x1_1x32x1x8_8_2x1_intrawave_v1,1473.07,839.15,0.0
256,8192,4096,3072,ck,13,0,132.8948,a8w8_blockscale_bpreshuffle_1x128x128_256x64x256x128_16x16_16x16_8x32x1_8x32x1_1x32x1x8_8_2x1_intrawave_v1,1551.29,789.03,0.0
256,16384,4096,3072,ck,13,0,248.2157,a8w8_blockscale_bpreshuffle_1x128x128_256x64x256x128_16x16_16x16_8x32x1_8x32x1_1x32x1x8_8_2x1_intrawave_v1,1661.12,794.2,0.0
256,32768,4096,3072,ck,13,0,483.0947,a8w8_blockscale_bpreshuffle_1x128x128_256x64x256x128_16x16_16x16_8x32x1_8x32x1_1x32x1x8_8_2x1_intrawave_v1,1706.98,790.08,0.0
80,16,128,7168,asm,22,7,10.6465,_ZN5aiter42fp8gemm_bf16_blockscale_BpreShuffle_64x128E,2.76,97.34,0.0044
80,32,128,7168,asm,15,8,10.0301,_ZN5aiter42fp8gemm_bf16_blockscale_BpreShuffle_48x128E,5.85,115.16,0.0059
80,48,128,7168,asm,7,8,10.3674,_ZN5aiter42fp8gemm_bf16_blockscale_BpreShuffle_32x128E,8.5,122.87,0.0018
80,64,128,7168,asm,7,8,9.8312,_ZN5aiter42fp8gemm_bf16_blockscale_BpreShuffle_32x128E,11.95,141.66,0.014
80,80,128,7168,asm,7,8,9.3006,_ZN5aiter42fp8gemm_bf16_blockscale_BpreShuffle_32x128E,15.78,162.51,0.002
80,96,128,7168,asm,6,7,10.388,_ZN5aiter42fp8gemm_bf16_blockscale_BpreShuffle_32x128E,16.96,156.93,0.0043
80,112,128,7168,asm,7,8,9.5081,_ZN5aiter42fp8gemm_bf16_blockscale_BpreShuffle_32x128E,21.62,183.95,0.0057
80,128,128,7168,asm,5,6,9.8641,_ZN5aiter42fp8gemm_bf16_blockscale_BpreShuffle_32x128E,23.81,189.35,0.0061
80,144,128,7168,asm,15,8,10.1416,_ZN5aiter42fp8gemm_bf16_blockscale_BpreShuffle_48x128E,26.06,195.88,0.0157
80,160,128,7168,asm,7,8,9.2372,_ZN5aiter42fp8gemm_bf16_blockscale_BpreShuffle_32x128E,31.78,227.92,0.0064
80,176,128,7168,asm,6,7,11.0592,_ZN5aiter42fp8gemm_bf16_blockscale_BpreShuffle_32x128E,29.2,201.11,0.0008
80,192,128,7168,asm,6,7,10.2037,_ZN5aiter42fp8gemm_bf16_blockscale_BpreShuffle_32x128E,34.53,229.61,0.0086
80,208,128,7168,asm,7,8,9.8587,_ZN5aiter42fp8gemm_bf16_blockscale_BpreShuffle_32x128E,38.72,249.7,0.0006
80,224,128,7168,asm,5,6,15.2548,_ZN5aiter42fp8gemm_bf16_blockscale_BpreShuffle_32x128E,26.95,169.16,0.0061
80,240,128,7168,asm,23,8,11.6501,_ZN5aiter42fp8gemm_bf16_blockscale_BpreShuffle_64x128E,37.8,231.69,0.0113
80,256,128,7168,asm,13,6,16.5247,_ZN5aiter42fp8gemm_bf16_blockscale_BpreShuffle_48x128E,28.43,170.54,0.0028
80,288,128,7168,asm,7,8,10.3684,_ZN5aiter42fp8gemm_bf16_blockscale_BpreShuffle_32x128E,50.97,294.7,0.0111
80,320,128,7168,asm,3,4,13.5173,_ZN5aiter42fp8gemm_bf16_blockscale_BpreShuffle_32x128E,43.44,243.63,0.0004
80,352,128,7168,asm,5,6,11.0925,_ZN5aiter42fp8gemm_bf16_blockscale_BpreShuffle_32x128E,58.23,318.3,0.0022
80,384,128,7168,asm,5,6,11.5405,_ZN5aiter42fp8gemm_bf16_blockscale_BpreShuffle_32x128E,61.06,326.53,0.005
80,416,128,7168,asm,15,8,11.2336,_ZN5aiter42fp8gemm_bf16_blockscale_BpreShuffle_48x128E,67.95,356.6,0.0076
80,448,128,7168,asm,15,8,11.1036,_ZN5aiter42fp8gemm_bf16_blockscale_BpreShuffle_48x128E,74.04,382.17,0.0036
80,480,128,7168,asm,13,6,14.3467,_ZN5aiter42fp8gemm_bf16_blockscale_BpreShuffle_48x128E,61.39,312.34,0.0034
80,512,128,7168,asm,4,5,12.3887,_ZN5aiter42fp8gemm_bf16_blockscale_BpreShuffle_32x128E,75.84,380.88,0.0037
80,544,128,7168,asm,30,7,14.0137,_ZN5aiter42fp8gemm_bf16_blockscale_BpreShuffle_80x128E,71.23,353.67,0.0029
80,576,128,7168,asm,12,5,14.1619,_ZN5aiter42fp8gemm_bf16_blockscale_BpreShuffle_48x128E,74.63,366.74,0.0017
80,608,128,7168,asm,3,4,13.1673,_ZN5aiter42fp8gemm_bf16_blockscale_BpreShuffle_32x128E,84.73,412.48,0.0017
80,640,128,7168,asm,11,4,14.3629,_ZN5aiter42fp8gemm_bf16_blockscale_BpreShuffle_48x128E,81.77,394.69,0.0008
80,672,128,7168,asm,22,7,13.3581,_ZN5aiter42fp8gemm_bf16_blockscale_BpreShuffle_64x128E,92.31,442.16,0.0017
80,704,128,7168,asm,11,4,14.7713,_ZN5aiter42fp8gemm_bf16_blockscale_BpreShuffle_48x128E,87.46,415.94,0.002
80,736,128,7168,asm,31,8,13.922,_ZN5aiter42fp8gemm_bf16_blockscale_BpreShuffle_80x128E,97.01,458.38,0.0114
80,768,128,7168,asm,20,5,15.2985,_ZN5aiter42fp8gemm_bf16_blockscale_BpreShuffle_64x128E,92.12,432.67,0.0028
80,800,128,7168,asm,39,8,15.4465,_ZN5aiter42fp8gemm_bf16_blockscale_BpreShuffle_96x128E,95.04,443.9,0.0071
80,832,128,7168,asm,11,4,14.98,_ZN5aiter42fp8gemm_bf16_blockscale_BpreShuffle_48x128E,101.92,473.58,0.0015
80,864,128,7168,asm,30,7,14.4597,_ZN5aiter42fp8gemm_bf16_blockscale_BpreShuffle_80x128E,109.65,507.05,0.0059
80,896,128,7168,asm,11,4,15.0833,_ZN5aiter42fp8gemm_bf16_blockscale_BpreShuffle_48x128E,109.01,501.84,0.0009
80,928,128,7168,asm,11,4,14.6217,_ZN5aiter42fp8gemm_bf16_blockscale_BpreShuffle_48x128E,116.46,533.93,0.0017
80,960,128,7168,asm,11,4,15.1061,_ZN5aiter42fp8gemm_bf16_blockscale_BpreShuffle_48x128E,116.62,532.54,0.0032
80,992,128,7168,asm,14,7,18.9441,_ZN5aiter42fp8gemm_bf16_blockscale_BpreShuffle_48x128E,96.09,437.19,0.0088
80,1024,128,7168,asm,19,4,16.7633,_ZN5aiter42fp8gemm_bf16_blockscale_BpreShuffle_64x128E,112.09,508.23,0.0025
80,1088,128,7168,asm,19,4,16.7152,_ZN5aiter42fp8gemm_bf16_blockscale_BpreShuffle_64x128E,119.44,538.12,0.0004
80,1152,128,7168,ck,12,3,31.0926,a8w8_blockscale_bpreshuffle_1x128x128_256x32x64x256_16x16_16x16_16x16x1_16x16x1_1x32x1x8_8_2x1_intrawave_v1,67.99,304.57,0.0
80,1216,128,7168,asm,28,5,24.4431,_ZN5aiter42fp8gemm_bf16_blockscale_BpreShuffle_80x128E,91.29,406.87,0.0003
80,1280,128,7168,asm,9,2,24.3393,_ZN5aiter42fp8gemm_bf16_blockscale_BpreShuffle_48x128E,96.5,428.12,0.0
80,1344,128,7168,asm,22,7,21.8913,_ZN5aiter42fp8gemm_bf16_blockscale_BpreShuffle_64x128E,112.66,497.7,0.0041
80,1408,128,7168,asm,27,4,18.4322,_ZN5aiter42fp8gemm_bf16_blockscale_BpreShuffle_80x128E,140.17,616.88,0.0018
80,1472,128,7168,asm,26,3,21.6272,_ZN5aiter42fp8gemm_bf16_blockscale_BpreShuffle_80x128E,124.9,547.72,0.0001
80,1536,128,7168,asm,9,2,20.7191,_ZN5aiter42fp8gemm_bf16_blockscale_BpreShuffle_48x128E,136.04,594.66,0.0
80,1600,128,7168,asm,14,7,26.8381,_ZN5aiter42fp8gemm_bf16_blockscale_BpreShuffle_48x128E,109.4,476.78,0.0043
80,1664,128,7168,asm,35,4,20.9902,_ZN5aiter42fp8gemm_bf16_blockscale_BpreShuffle_96x128E,145.47,632.25,0.001
80,1728,128,7168,asm,44,5,23.5872,_ZN5aiter43fp8gemm_bf16_blockscale_BpreShuffle_128x128E,134.43,582.78,0.0044
80,1792,128,7168,asm,34,3,25.3413,_ZN5aiter42fp8gemm_bf16_blockscale_BpreShuffle_96x128E,129.76,561.19,0.0001
80,1856,128,7168,asm,34,3,24.4438,_ZN5aiter42fp8gemm_bf16_blockscale_BpreShuffle_96x128E,139.33,601.23,0.0002
80,1920,128,7168,asm,26,3,22.8347,_ZN5aiter42fp8gemm_bf16_blockscale_BpreShuffle_80x128E,154.29,664.41,0.0002
80,1984,128,7168,asm,26,3,21.8381,_ZN5aiter42fp8gemm_bf16_blockscale_BpreShuffle_80x128E,166.71,716.49,0.0001
80,2048,128,7168,asm,44,5,24.0419,_ZN5aiter43fp8gemm_bf16_blockscale_BpreShuffle_128x128E,156.31,670.57,0.0007
80,4096,128,7168,asm,16,1,39.0213,_ZN5aiter42fp8gemm_bf16_blockscale_BpreShuffle_64x128E,192.62,802.8,0.0
80,8192,128,7168,asm,40,1,68.0161,_ZN5aiter43fp8gemm_bf16_blockscale_BpreShuffle_128x128E,221.01,907.65,0.0
80,16384,128,7168,asm,40,1,132.4202,_ZN5aiter43fp8gemm_bf16_blockscale_BpreShuffle_128x128E,227.04,925.48,0.0
80,32768,128,7168,asm,16,1,259.3219,_ZN5aiter42fp8gemm_bf16_blockscale_BpreShuffle_64x128E,231.87,941.64,0.0
80,16,2112,7168,ck,12,0,23.6603,a8w8_blockscale_bpreshuffle_1x128x128_256x32x64x256_16x16_16x16_16x16x1_16x16x1_1x32x1x8_8_2x1_intrawave_v1,20.47,647.54,0.0
80,32,2112,7168,ck,7,1,18.7062,a8w8_blockscale_bpreshuffle_1x128x128_256x16x64x256_16x16_16x16_16x16x1_16x16x1_1x16x1x16_4_1x1_intrawave_v1,51.79,828.78,0.0
80,48,2112,7168,ck,7,3,22.5911,a8w8_blockscale_bpreshuffle_1x128x128_256x16x64x256_16x16_16x16_16x16x1_16x16x1_1x16x1x16_4_1x1_intrawave_v1,64.33,694.33,0.0
80,64,2112,7168,ck,7,0,23.0019,a8w8_blockscale_bpreshuffle_1x128x128_256x16x64x256_16x16_16x16_16x16x1_16x16x1_1x16x1x16_4_1x1_intrawave_v1,84.24,689.85,0.0
80,80,2112,7168,ck,7,2,30.772,a8w8_blockscale_bpreshuffle_1x128x128_256x16x64x256_16x16_16x16_16x16x1_16x16x1_1x16x1x16_4_1x1_intrawave_v1,78.71,521.58,0.0
80,96,2112,7168,ck,7,0,32.1563,a8w8_blockscale_bpreshuffle_1x128x128_256x16x64x256_16x16_16x16_16x16x1_16x16x1_1x16x1x16_4_1x1_intrawave_v1,90.39,504.8,0.0
80,112,2112,7168,ck,7,0,32.8606,a8w8_blockscale_bpreshuffle_1x128x128_256x16x64x256_16x16_16x16_16x16x1_16x16x1_1x16x1x16_4_1x1_intrawave_v1,103.2,499.53,0.0
80,128,2112,7168,ck,12,3,31.3145,a8w8_blockscale_bpreshuffle_1x128x128_256x32x64x256_16x16_16x16_16x16x1_16x16x1_1x32x1x8_8_2x1_intrawave_v1,123.76,530.01,0.0
80,144,2112,7168,ck,7,3,41.5785,a8w8_blockscale_bpreshuffle_1x128x128_256x16x64x256_16x16_16x16_16x16x1_16x16x1_1x16x1x16_4_1x1_intrawave_v1,104.86,403.56,0.0
80,160,2112,7168,ck,10,3,37.5587,a8w8_blockscale_bpreshuffle_1x128x128_256x32x64x128_16x16_16x16_8x32x1_8x32x1_1x32x1x8_8_2x1_intrawave_v1,128.98,451.6,0.0
80,176,2112,7168,ck,12,3,43.8119,a8w8_blockscale_bpreshuffle_1x128x128_256x32x64x256_16x16_16x16_16x16x1_16x16x1_1x32x1x8_8_2x1_intrawave_v1,121.63,391.3,0.0
80,192,2112,7168,ck,12,0,42.9951,a8w8_blockscale_bpreshuffle_1x128x128_256x32x64x256_16x16_16x16_16x16x1_16x16x1_1x32x1x8_8_2x1_intrawave_v1,135.21,402.98,0.0
80,208,2112,7168,ck,12,0,44.0833,a8w8_blockscale_bpreshuffle_1x128x128_256x32x64x256_16x16_16x16_16x16x1_16x16x1_1x32x1x8_8_2x1_intrawave_v1,142.86,397.17,0.0
80,224,2112,7168,ck,18,0,50.9057,a8w8_blockscale_1x128x128_256x64x64x256_16x16_32x32_1x1_16x16x1_16x16x1_1x32x1x8_8_1x1_intrawave_v1,133.23,347.52,0.0
80,240,2112,7168,ck,18,0,52.9712,a8w8_blockscale_1x128x128_256x64x64x256_16x16_32x32_1x1_16x16x1_16x16x1_1x32x1x8_8_1x1_intrawave_v1,137.18,337.41,0.0
80,256,2112,7168,ck,18,1,50.5966,a8w8_blockscale_1x128x128_256x64x64x256_16x16_32x32_1x1_16x16x1_16x16x1_1x32x1x8_8_1x1_intrawave_v1,153.19,356.85,0.0
80,288,2112,7168,ck,15,2,72.5971,a8w8_blockscale_bpreshuffle_1x128x128_256x64x64x128_16x16_16x16_8x32x1_8x32x1_1x32x1x8_8_2x1_intrawave_v1,120.11,253.73,0.0
80,320,2112,7168,ck,10,0,67.3121,a8w8_blockscale_bpreshuffle_1x128x128_256x32x64x128_16x16_16x16_8x32x1_8x32x1_1x32x1x8_8_2x1_intrawave_v1,143.94,279.06,0.0
80,352,2112,7168,ck,15,1,77.7762,a8w8_blockscale_bpreshuffle_1x128x128_256x64x64x128_16x16_16x16_8x32x1_8x32x1_1x32x1x8_8_2x1_intrawave_v1,137.03,246.2,0.0
80,384,2112,7168,ck,15,3,73.2789,a8w8_blockscale_bpreshuffle_1x128x128_256x64x64x128_16x16_16x16_8x32x1_8x32x1_1x32x1x8_8_2x1_intrawave_v1,158.66,266.29,0.0
80,416,2112,7168,ck,15,3,76.2256,a8w8_blockscale_bpreshuffle_1x128x128_256x64x64x128_16x16_16x16_8x32x1_8x32x1_1x32x1x8_8_2x1_intrawave_v1,165.24,260.78,0.0
80,448,2112,7168,ck,15,0,74.4891,a8w8_blockscale_bpreshuffle_1x128x128_256x64x64x128_16x16_16x16_8x32x1_8x32x1_1x32x1x8_8_2x1_intrawave_v1,182.1,271.75,0.0
80,480,2112,7168,ck,10,3,90.1347,a8w8_blockscale_bpreshuffle_1x128x128_256x32x64x128_16x16_16x16_8x32x1_8x32x1_1x32x1x8_8_2x1_intrawave_v1,161.24,228.62,0.0
80,512,2112,7168,ck,10,2,92.5787,a8w8_blockscale_bpreshuffle_1x128x128_256x32x64x128_16x16_16x16_8x32x1_8x32x1_1x32x1x8_8_2x1_intrawave_v1,167.45,226.53,0.0
80,544,2112,7168,ck,15,0,98.3112,a8w8_blockscale_bpreshuffle_1x128x128_256x64x64x128_16x16_16x16_8x32x1_8x32x1_1x32x1x8_8_2x1_intrawave_v1,167.54,217.03,0.0
80,576,2112,7168,ck,18,0,102.6027,a8w8_blockscale_1x128x128_256x64x64x256_16x16_32x32_1x1_16x16x1_16x16x1_1x32x1x8_8_1x1_intrawave_v1,169.98,211.5,0.0
80,608,2112,7168,ck,15,1,122.8018,a8w8_blockscale_bpreshuffle_1x128x128_256x64x64x128_16x16_16x16_8x32x1_8x32x1_1x32x1x8_8_2x1_intrawave_v1,149.91,179.68,0.0
80,640,2112,7168,ck,10,0,115.5271,a8w8_blockscale_bpreshuffle_1x128x128_256x32x64x128_16x16_16x16_8x32x1_8x32x1_1x32x1x8_8_2x1_intrawave_v1,167.73,194.15,0.0
80,672,2112,7168,ck,10,3,114.5717,a8w8_blockscale_bpreshuffle_1x128x128_256x32x64x128_16x16_16x16_8x32x1_8x32x1_1x32x1x8_8_2x1_intrawave_v1,177.59,198.95,0.0
80,704,2112,7168,ck,18,3,123.5442,a8w8_blockscale_1x128x128_256x64x64x256_16x16_32x32_1x1_16x16x1_16x16x1_1x32x1x8_8_1x1_intrawave_v1,172.53,187.45,0.0
80,736,2112,7168,ck,15,1,137.1724,a8w8_blockscale_bpreshuffle_1x128x128_256x64x64x128_16x16_16x16_8x32x1_8x32x1_1x32x1x8_8_2x1_intrawave_v1,162.45,171.49,0.0
80,768,2112,7168,ck,15,3,120.5227,a8w8_blockscale_bpreshuffle_1x128x128_256x64x64x128_16x16_16x16_8x32x1_8x32x1_1x32x1x8_8_2x1_intrawave_v1,192.94,198.2,0.0
80,800,2112,7168,ck,15,3,142.6149,a8w8_blockscale_bpreshuffle_1x128x128_256x64x64x128_16x16_16x16_8x32x1_8x32x1_1x32x1x8_8_2x1_intrawave_v1,169.84,170.06,0.0
80,832,2112,7168,ck,12,0,140.7894,a8w8_blockscale_bpreshuffle_1x128x128_256x32x64x256_16x16_16x16_16x16x1_16x16x1_1x32x1x8_8_2x1_intrawave_v1,178.93,174.85,0.0
80,864,2112,7168,ck,0,3,152.8837,a8w8_blockscale_1x128x128_256x128x128x128_16x16_32x32_2x2_8x32x1_8x32x1_1x32x1x8_8_1x1_intrawave_v3,171.11,163.4,0.0
80,896,2112,7168,ck,0,3,149.6146,a8w8_blockscale_1x128x128_256x128x128x128_16x16_32x32_2x2_8x32x1_8x32x1_1x32x1x8_8_1x1_intrawave_v3,181.32,169.41,0.0
80,928,2112,7168,ck,12,3,166.4346,a8w8_blockscale_bpreshuffle_1x128x128_256x32x64x256_16x16_16x16_16x16x1_16x16x1_1x32x1x8_8_2x1_intrawave_v1,168.82,154.48,0.0
80,960,2112,7168,ck,0,0,149.1206,a8w8_blockscale_1x128x128_256x128x128x128_16x16_32x32_2x2_8x32x1_8x32x1_1x32x1x8_8_1x1_intrawave_v3,194.92,174.86,0.0
80,992,2112,7168,ck,0,2,150.0126,a8w8_blockscale_1x128x128_256x128x128x128_16x16_32x32_2x2_8x32x1_8x32x1_1x32x1x8_8_1x1_intrawave_v3,200.22,176.25,0.0
80,1024,2112,7168,ck,0,0,148.8746,a8w8_blockscale_1x128x128_256x128x128x128_16x16_32x32_2x2_8x32x1_8x32x1_1x32x1x8_8_1x1_intrawave_v3,208.26,180.05,0.0
80,1088,2112,7168,ck,2,3,185.3203,a8w8_blockscale_bpreshuffle_1x128x128_256x64x64x128_16x16_16x16_8x32x1_8x32x1_1x32x1x8_8_2x1_intrawave_v3,177.76,148.57,0.0
80,1152,2112,7168,ck,2,3,184.7078,a8w8_blockscale_bpreshuffle_1x128x128_256x64x64x128_16x16_16x16_8x32x1_8x32x1_1x32x1x8_8_2x1_intrawave_v3,188.84,153.01,0.0
80,1216,2112,7168,ck,15,0,184.5069,a8w8_blockscale_bpreshuffle_1x128x128_256x64x64x128_16x16_16x16_8x32x1_8x32x1_1x32x1x8_8_2x1_intrawave_v1,199.55,157.13,0.0
80,1280,2112,7168,ck,10,3,199.4315,a8w8_blockscale_bpreshuffle_1x128x128_256x32x64x128_16x16_16x16_8x32x1_8x32x1_1x32x1x8_8_2x1_intrawave_v1,194.33,149.03,0.0
80,1344,2112,7168,ck,15,0,205.5999,a8w8_blockscale_bpreshuffle_1x128x128_256x64x64x128_16x16_16x16_8x32x1_8x32x1_1x32x1x8_8_2x1_intrawave_v1,197.92,148.1,0.0
80,1408,2112,7168,ck,15,3,227.2546,a8w8_blockscale_bpreshuffle_1x128x128_256x64x64x128_16x16_16x16_8x32x1_8x32x1_1x32x1x8_8_2x1_intrawave_v1,187.59,137.2,0.0
80,1472,2112,7168,ck,10,0,228.157,a8w8_blockscale_bpreshuffle_1x128x128_256x32x64x128_16x16_16x16_8x32x1_8x32x1_1x32x1x8_8_2x1_intrawave_v1,195.34,139.85,0.0
80,1536,2112,7168,ck,15,3,226.6035,a8w8_blockscale_bpreshuffle_1x128x128_256x64x64x128_16x16_16x16_8x32x1_8x32x1_1x32x1x8_8_2x1_intrawave_v1,205.23,144.03,0.0
80,1600,2112,7168,ck,15,0,270.0431,a8w8_blockscale_bpreshuffle_1x128x128_256x64x64x128_16x16_16x16_8x32x1_8x32x1_1x32x1x8_8_2x1_intrawave_v1,179.39,123.56,0.0
80,1664,2112,7168,ck,15,0,287.3805,a8w8_blockscale_bpreshuffle_1x128x128_256x64x64x128_16x16_16x16_8x32x1_8x32x1_1x32x1x8_8_2x1_intrawave_v1,175.31,118.64,0.0
80,1728,2112,7168,ck,18,0,282.1242,a8w8_blockscale_1x128x128_256x64x64x256_16x16_32x32_1x1_16x16x1_16x16x1_1x32x1x8_8_1x1_intrawave_v1,185.45,123.44,0.0
80,1792,2112,7168,ck,0,3,235.508,a8w8_blockscale_1x128x128_256x128x128x128_16x16_32x32_2x2_8x32x1_8x32x1_1x32x1x8_8_1x1_intrawave_v3,230.39,150.96,0.0
80,1856,2112,7168,ck,0,0,306.8587,a8w8_blockscale_1x128x128_256x128x128x128_16x16_32x32_2x2_8x32x1_8x32x1_1x32x1x8_8_1x1_intrawave_v3,183.13,118.24,0.0
80,1920,2112,7168,ck,2,3,295.7295,a8w8_blockscale_bpreshuffle_1x128x128_256x64x64x128_16x16_16x16_8x32x1_8x32x1_1x32x1x8_8_2x1_intrawave_v3,196.58,125.15,0.0
80,1984,2112,7168,ck,15,3,296.2956,a8w8_blockscale_bpreshuffle_1x128x128_256x64x64x128_16x16_16x16_8x32x1_8x32x1_1x32x1x8_8_2x1_intrawave_v1,202.74,127.37,0.0
80,2048,2112,7168,ck,2,1,307.1182,a8w8_blockscale_bpreshuffle_1x128x128_256x64x64x128_16x16_16x16_8x32x1_8x32x1_1x32x1x8_8_2x1_intrawave_v3,201.9,125.26,0.0
80,4096,2112,7168,ck,0,0,536.254,a8w8_blockscale_1x128x128_256x128x128x128_16x16_32x32_2x2_8x32x1_8x32x1_1x32x1x8_8_1x1_intrawave_v3,231.27,115.24,0.0
80,8192,2112,7168,ck,2,2,1167.6141,a8w8_blockscale_bpreshuffle_1x128x128_256x64x64x128_16x16_16x16_8x32x1_8x32x1_1x32x1x8_8_2x1_intrawave_v3,212.43,92.89,0.0
80,16384,2112,7168,ck,0,1,2039.6488,a8w8_blockscale_1x128x128_256x128x128x128_16x16_32x32_2x2_8x32x1_8x32x1_1x32x1x8_8_1x1_intrawave_v3,243.21,98.93,0.0
80,32768,2112,7168,ck,0,2,3928.3651,a8w8_blockscale_1x128x128_256x128x128x128_16x16_32x32_2x2_8x32x1_8x32x1_1x32x1x8_8_1x1_intrawave_v3,252.56,98.88,0.0
80,16,2240,7168,ck,7,1,22.2811,a8w8_blockscale_bpreshuffle_1x128x128_256x16x64x256_16x16_16x16_16x16x1_16x16x1_1x16x1x16_4_1x1_intrawave_v1,23.06,728.99,0.0
80,32,2240,7168,ck,7,0,19.4437,a8w8_blockscale_bpreshuffle_1x128x128_256x16x64x256_16x16_16x16_16x16x1_16x16x1_1x16x1x16_4_1x1_intrawave_v1,52.85,844.96,0.0
80,48,2240,7168,ck,7,2,27.3375,a8w8_blockscale_bpreshuffle_1x128x128_256x16x64x256_16x16_16x16_16x16x1_16x16x1_1x16x1x16_4_1x1_intrawave_v1,56.38,607.79,0.0
80,64,2240,7168,cktile,1,3,36.4494,a8w8_blockscale_cktile_16x128x256_1x4x1_16x16x64_intrawave_0x1x0_1,56.39,460.96,0.0
80,80,2240,7168,ck,18,1,52.3427,a8w8_blockscale_1x128x128_256x64x64x256_16x16_32x32_1x1_16x16x1_16x16x1_1x32x1x8_8_1x1_intrawave_v1,49.08,324.56,0.0
80,96,2240,7168,ck,7,1,56.5123,a8w8_blockscale_bpreshuffle_1x128x128_256x16x64x256_16x16_16x16_16x16x1_16x16x1_1x16x1x16_4_1x1_intrawave_v1,54.55,303.91,0.0
80,112,2240,7168,ck,13,2,43.7563,a8w8_blockscale_1x128x128_256x32x64x256_16x16_16x16_2x1_16x16x1_16x16x1_1x32x1x8_8_2x1_intrawave_v1,82.2,396.76,0.0
80,128,2240,7168,ck,12,2,31.738,a8w8_blockscale_bpreshuffle_1x128x128_256x32x64x256_16x16_16x16_16x16x1_16x16x1_1x32x1x8_8_2x1_intrawave_v1,129.51,552.88,0.0
80,144,2240,7168,ck,10,0,38.3248,a8w8_blockscale_bpreshuffle_1x128x128_256x32x64x128_16x16_16x16_8x32x1_8x32x1_1x32x1x8_8_2x1_intrawave_v1,120.66,462.72,0.0
80,160,2240,7168,ck,10,3,38.7197,a8w8_blockscale_bpreshuffle_1x128x128_256x32x64x128_16x16_16x16_8x32x1_8x32x1_1x32x1x8_8_2x1_intrawave_v1,132.7,462.81,0.0
80,176,2240,7168,ck,18,0,51.0655,a8w8_blockscale_1x128x128_256x64x64x256_16x16_32x32_1x1_16x16x1_16x16x1_1x32x1x8_8_1x1_intrawave_v1,110.68,354.57,0.0
80,192,2240,7168,ck,10,3,41.6438,a8w8_blockscale_bpreshuffle_1x128x128_256x32x64x128_16x16_16x16_8x32x1_8x32x1_1x32x1x8_8_2x1_intrawave_v1,148.06,439.27,0.0
80,208,2240,7168,ck,18,0,51.377,a8w8_blockscale_1x128x128_256x64x64x256_16x16_32x32_1x1_16x16x1_16x16x1_1x32x1x8_8_1x1_intrawave_v1,130.01,359.68,0.0
80,224,2240,7168,ck,18,3,51.5303,a8w8_blockscale_1x128x128_256x64x64x256_16x16_32x32_1x1_16x16x1_16x16x1_1x32x1x8_8_1x1_intrawave_v1,139.59,362.22,0.0
80,240,2240,7168,ck,18,2,51.4236,a8w8_blockscale_1x128x128_256x64x64x256_16x16_32x32_1x1_16x16x1_16x16x1_1x32x1x8_8_1x1_intrawave_v1,149.87,366.6,0.0
80,256,2240,7168,ck,18,1,50.8361,a8w8_blockscale_1x128x128_256x64x64x256_16x16_32x32_1x1_16x16x1_16x16x1_1x32x1x8_8_1x1_intrawave_v1,161.71,374.5,0.0
80,288,2240,7168,ck,12,0,57.384,a8w8_blockscale_bpreshuffle_1x128x128_256x32x64x256_16x16_16x16_16x16x1_16x16x1_1x32x1x8_8_2x1_intrawave_v1,161.17,338.26,0.0
80,320,2240,7168,ck,10,0,68.5348,a8w8_blockscale_bpreshuffle_1x128x128_256x32x64x128_16x16_16x16_8x32x1_8x32x1_1x32x1x8_8_2x1_intrawave_v1,149.94,288.67,0.0
80,352,2240,7168,ck,10,2,69.0393,a8w8_blockscale_bpreshuffle_1x128x128_256x32x64x128_16x16_16x16_8x32x1_8x32x1_1x32x1x8_8_2x1_intrawave_v1,163.73,291.96,0.0
80,384,2240,7168,ck,15,2,73.3225,a8w8_blockscale_bpreshuffle_1x128x128_256x64x64x128_16x16_16x16_8x32x1_8x32x1_1x32x1x8_8_2x1_intrawave_v1,168.18,279.98,0.0
80,416,2240,7168,ck,15,3,91.4483,a8w8_blockscale_bpreshuffle_1x128x128_256x64x64x128_16x16_16x16_8x32x1_8x32x1_1x32x1x8_8_2x1_intrawave_v1,146.08,228.57,0.0
80,448,2240,7168,ck,2,3,90.5468,a8w8_blockscale_bpreshuffle_1x128x128_256x64x64x128_16x16_16x16_8x32x1_8x32x1_1x32x1x8_8_2x1_intrawave_v3,158.88,234.96,0.0
80,480,2240,7168,ck,0,1,90.9034,a8w8_blockscale_1x128x128_256x128x128x128_16x16_32x32_2x2_8x32x1_8x32x1_1x32x1x8_8_1x1_intrawave_v3,169.57,238.14,0.0
80,512,2240,7168,ck,10,2,92.9694,a8w8_blockscale_bpreshuffle_1x128x128_256x32x64x128_16x16_16x16_8x32x1_8x32x1_1x32x1x8_8_2x1_intrawave_v1,176.85,236.85,0.0
80,544,2240,7168,ck,18,2,100.7096,a8w8_blockscale_1x128x128_256x64x64x256_16x16_32x32_1x1_16x16x1_16x16x1_1x32x1x8_8_1x1_intrawave_v1,173.46,222.35,0.0
80,576,2240,7168,ck,18,2,99.0885,a8w8_blockscale_1x128x128_256x64x64x256_16x16_32x32_1x1_16x16x1_16x16x1_1x32x1x8_8_1x1_intrawave_v1,186.67,229.75,0.0
80,608,2240,7168,ck,10,3,113.0306,a8w8_blockscale_bpreshuffle_1x128x128_256x32x64x128_16x16_16x16_8x32x1_8x32x1_1x32x1x8_8_2x1_intrawave_v1,172.74,204.71,0.0
80,640,2240,7168,ck,12,2,116.088,a8w8_blockscale_bpreshuffle_1x128x128_256x32x64x256_16x16_16x16_16x16x1_16x16x1_1x32x1x8_8_2x1_intrawave_v1,177.04,202.53,0.0
80,672,2240,7168,ck,10,2,124.3791,a8w8_blockscale_bpreshuffle_1x128x128_256x32x64x128_16x16_16x16_8x32x1_8x32x1_1x32x1x8_8_2x1_intrawave_v1,173.5,192.02,0.0
80,704,2240,7168,ck,18,0,123.5424,a8w8_blockscale_1x128x128_256x64x64x256_16x16_32x32_1x1_16x16x1_16x16x1_1x32x1x8_8_1x1_intrawave_v1,182.99,196.34,0.0
80,736,2240,7168,ck,10,1,134.736,a8w8_blockscale_bpreshuffle_1x128x128_256x32x64x128_16x16_16x16_8x32x1_8x32x1_1x32x1x8_8_2x1_intrawave_v1,175.42,182.8,0.0
80,768,2240,7168,ck,15,2,139.5088,a8w8_blockscale_bpreshuffle_1x128x128_256x64x64x128_16x16_16x16_8x32x1_8x32x1_1x32x1x8_8_2x1_intrawave_v1,176.78,179.21,0.0
80,800,2240,7168,ck,10,1,138.6845,a8w8_blockscale_bpreshuffle_1x128x128_256x32x64x128_16x16_16x16_8x32x1_8x32x1_1x32x1x8_8_2x1_intrawave_v1,185.24,182.97,0.0
80,832,2240,7168,ck,15,1,141.2531,a8w8_blockscale_bpreshuffle_1x128x128_256x64x64x128_16x16_16x16_8x32x1_8x32x1_1x32x1x8_8_2x1_intrawave_v1,189.15,182.28,0.0
80,864,2240,7168,ck,0,0,150.6074,a8w8_blockscale_1x128x128_256x128x128x128_16x16_32x32_2x2_8x32x1_8x32x1_1x32x1x8_8_1x1_intrawave_v3,184.22,173.43,0.0
80,896,2240,7168,ck,0,0,147.4308,a8w8_blockscale_1x128x128_256x128x128x128_16x16_32x32_2x2_8x32x1_8x32x1_1x32x1x8_8_1x1_intrawave_v3,195.16,179.7,0.0
80,928,2240,7168,ck,0,2,149.3374,a8w8_blockscale_1x128x128_256x128x128x128_16x16_32x32_2x2_8x32x1_8x32x1_1x32x1x8_8_1x1_intrawave_v3,199.55,179.9,0.0
80,960,2240,7168,ck,0,1,149.5254,a8w8_blockscale_1x128x128_256x128x128x128_16x16_32x32_2x2_8x32x1_8x32x1_1x32x1x8_8_1x1_intrawave_v3,206.17,182.17,0.0
80,992,2240,7168,ck,17,1,180.5731,a8w8_blockscale_bpreshuffle_1x128x128_256x64x64x256_16x16_16x16_16x16x1_16x16x1_1x32x1x8_8_2x1_intrawave_v1,176.41,152.91,0.0
80,1024,2240,7168,ck,0,1,154.4744,a8w8_blockscale_1x128x128_256x128x128x128_16x16_32x32_2x2_8x32x1_8x32x1_1x32x1x8_8_1x1_intrawave_v3,212.87,181.16,0.0
80,1088,2240,7168,ck,15,1,207.3036,a8w8_blockscale_bpreshuffle_1x128x128_256x64x64x128_16x16_16x16_8x32x1_8x32x1_1x32x1x8_8_2x1_intrawave_v1,168.54,138.59,0.0
80,1152,2240,7168,ck,2,1,187.2433,a8w8_blockscale_bpreshuffle_1x128x128_256x64x64x128_16x16_16x16_8x32x1_8x32x1_1x32x1x8_8_2x1_intrawave_v3,197.57,157.41,0.0
80,1216,2240,7168,ck,12,3,212.8623,a8w8_blockscale_bpreshuffle_1x128x128_256x32x64x256_16x16_16x16_16x16x1_16x16x1_1x32x1x8_8_2x1_intrawave_v1,183.45,141.97,0.0
80,1280,2240,7168,ck,2,2,209.9311,a8w8_blockscale_bpreshuffle_1x128x128_256x64x64x128_16x16_16x16_8x32x1_8x32x1_1x32x1x8_8_2x1_intrawave_v3,195.8,147.5,0.0
80,1344,2240,7168,ck,2,0,227.4998,a8w8_blockscale_bpreshuffle_1x128x128_256x64x64x128_16x16_16x16_8x32x1_8x32x1_1x32x1x8_8_2x1_intrawave_v3,189.71,139.39,0.0
80,1408,2240,7168,ck,18,1,237.8866,a8w8_blockscale_1x128x128_256x64x64x256_16x16_32x32_1x1_16x16x1_16x16x1_1x32x1x8_8_1x1_intrawave_v1,190.07,136.44,0.0
80,1472,2240,7168,ck,18,3,260.0442,a8w8_blockscale_1x128x128_256x64x64x256_16x16_32x32_1x1_16x16x1_16x16x1_1x32x1x8_8_1x1_intrawave_v1,181.78,127.68,0.0
80,1536,2240,7168,ck,0,1,234.8921,a8w8_blockscale_1x128x128_256x128x128x128_16x16_32x32_2x2_8x32x1_8x32x1_1x32x1x8_8_1x1_intrawave_v3,209.99,144.52,0.0
80,1600,2240,7168,ck,15,2,251.1305,a8w8_blockscale_bpreshuffle_1x128x128_256x64x64x128_16x16_16x16_8x32x1_8x32x1_1x32x1x8_8_2x1_intrawave_v1,204.6,138.15,0.0
80,1664,2240,7168,ck,15,3,271.6226,a8w8_blockscale_bpreshuffle_1x128x128_256x64x64x128_16x16_16x16_8x32x1_8x32x1_1x32x1x8_8_2x1_intrawave_v1,196.73,130.47,0.0
80,1728,2240,7168,ck,15,1,295.8199,a8w8_blockscale_bpreshuffle_1x128x128_256x64x64x128_16x16_16x16_8x32x1_8x32x1_1x32x1x8_8_2x1_intrawave_v1,187.58,122.32,0.0
80,1792,2240,7168,ck,2,2,304.2139,a8w8_blockscale_bpreshuffle_1x128x128_256x64x64x128_16x16_16x16_8x32x1_8x32x1_1x32x1x8_8_2x1_intrawave_v3,189.16,121.39,0.0
80,1856,2240,7168,ck,2,3,294.3285,a8w8_blockscale_bpreshuffle_1x128x128_256x64x64x128_16x16_16x16_8x32x1_8x32x1_1x32x1x8_8_2x1_intrawave_v3,202.5,128.0,0.0
80,1920,2240,7168,ck,0,2,301.3231,a8w8_blockscale_1x128x128_256x128x128x128_16x16_32x32_2x2_8x32x1_8x32x1_1x32x1x8_8_1x1_intrawave_v3,204.62,127.51,0.0
80,1984,2240,7168,ck,0,2,296.0213,a8w8_blockscale_1x128x128_256x128x128x128_16x16_32x32_2x2_8x32x1_8x32x1_1x32x1x8_8_1x1_intrawave_v3,215.23,132.31,0.0
80,2048,2240,7168,ck,0,2,295.4876,a8w8_blockscale_1x128x128_256x128x128x128_16x16_32x32_2x2_8x32x1_8x32x1_1x32x1x8_8_1x1_intrawave_v3,222.57,135.07,0.0
80,4096,2240,7168,ck,0,2,584.8641,a8w8_blockscale_1x128x128_256x128x128x128_16x16_32x32_2x2_8x32x1_8x32x1_1x32x1x8_8_1x1_intrawave_v3,224.9,109.03,0.0
80,8192,2240,7168,ck,0,2,1130.857,a8w8_blockscale_1x128x128_256x128x128x128_16x16_32x32_2x2_8x32x1_8x32x1_1x32x1x8_8_1x1_intrawave_v3,232.63,98.58,0.0
80,16384,2240,7168,ck,0,0,2216.2882,a8w8_blockscale_1x128x128_256x128x128x128_16x16_32x32_2x2_8x32x1_8x32x1_1x32x1x8_8_1x1_intrawave_v3,237.39,93.35,0.0
80,32768,2240,7168,ck,0,0,4419.5716,a8w8_blockscale_1x128x128_256x128x128x128_16x16_32x32_2x2_8x32x1_8x32x1_1x32x1x8_8_1x1_intrawave_v3,238.09,89.99,0.0
80,16,3072,7168,asm,2,3,15.1265,_ZN5aiter42fp8gemm_bf16_blockscale_BpreShuffle_32x128E,46.58,1469.81,0.0003
80,32,3072,7168,asm,4,5,20.4617,_ZN5aiter42fp8gemm_bf16_blockscale_BpreShuffle_32x128E,68.87,1096.98,0.0027
80,48,3072,7168,asm,26,3,21.5208,_ZN5aiter42fp8gemm_bf16_blockscale_BpreShuffle_80x128E,98.23,1052.89,0.0003
80,64,3072,7168,asm,17,2,26.0664,_ZN5aiter42fp8gemm_bf16_blockscale_BpreShuffle_64x128E,108.13,877.45,0.0
80,80,3072,7168,asm,33,2,31.4195,_ZN5aiter42fp8gemm_bf16_blockscale_BpreShuffle_96x128E,112.13,734.74,0.0
80,96,3072,7168,asm,33,2,32.2154,_ZN5aiter42fp8gemm_bf16_blockscale_BpreShuffle_96x128E,131.24,723.2,0.0
80,112,3072,7168,asm,41,2,41.0742,_ZN5aiter43fp8gemm_bf16_blockscale_BpreShuffle_128x128E,120.09,572.4,0.0
80,128,3072,7168,asm,42,3,30.3239,_ZN5aiter43fp8gemm_bf16_blockscale_BpreShuffle_128x128E,185.9,782.35,0.0004
80,144,3072,7168,asm,9,2,37.1982,_ZN5aiter42fp8gemm_bf16_blockscale_BpreShuffle_48x128E,170.49,643.5,0.0
80,160,3072,7168,asm,17,2,44.7602,_ZN5aiter42fp8gemm_bf16_blockscale_BpreShuffle_64x128E,157.43,539.54,0.0
80,176,3072,7168,asm,17,2,43.5516,_ZN5aiter42fp8gemm_bf16_blockscale_BpreShuffle_64x128E,177.97,559.41,0.0
80,192,3072,7168,ck,18,1,51.3535,a8w8_blockscale_1x128x128_256x64x64x256_16x16_32x32_1x1_16x16x1_16x16x1_1x32x1x8_8_1x1_intrawave_v1,164.66,478.57,0.0
80,208,3072,7168,ck,9,0,63.6248,a8w8_blockscale_bpreshuffle_1x128x128_256x32x128x128_16x16_16x16_8x32x1_8x32x1_1x32x1x8_8_2x1_intrawave_v1,143.97,389.61,0.0
80,224,3072,7168,asm,44,5,59.0159,_ZN5aiter43fp8gemm_bf16_blockscale_BpreShuffle_128x128E,167.16,423.65,0.0023
80,240,3072,7168,asm,18,3,63.6535,_ZN5aiter42fp8gemm_bf16_blockscale_BpreShuffle_64x128E,166.05,396.13,0.0003
80,256,3072,7168,asm,32,1,52.2683,_ZN5aiter42fp8gemm_bf16_blockscale_BpreShuffle_96x128E,215.7,486.49,0.0
80,288,3072,7168,ck,15,2,77.2482,a8w8_blockscale_bpreshuffle_1x128x128_256x64x64x128_16x16_16x16_8x32x1_8x32x1_1x32x1x8_8_2x1_intrawave_v1,164.19,334.69,0.0
80,320,3072,7168,asm,16,1,82.0836,_ZN5aiter42fp8gemm_bf16_blockscale_BpreShuffle_64x128E,171.69,320.16,0.0
80,352,3072,7168,asm,8,1,87.7528,_ZN5aiter42fp8gemm_bf16_blockscale_BpreShuffle_48x128E,176.66,304.33,0.0
80,384,3072,7168,asm,40,1,66.496,_ZN5aiter43fp8gemm_bf16_blockscale_BpreShuffle_128x128E,254.32,408.02,0.0
80,416,3072,7168,asm,9,2,102.7035,_ZN5aiter42fp8gemm_bf16_blockscale_BpreShuffle_48x128E,178.38,268.32,0.0
80,448,3072,7168,asm,8,1,91.7317,_ZN5aiter42fp8gemm_bf16_blockscale_BpreShuffle_48x128E,215.08,305.06,0.0
80,480,3072,7168,ck,9,1,108.061,a8w8_blockscale_bpreshuffle_1x128x128_256x32x128x128_16x16_16x16_8x32x1_8x32x1_1x32x1x8_8_2x1_intrawave_v1,195.62,262.91,0.0
80,512,3072,7168,ck,9,3,106.9252,a8w8_blockscale_bpreshuffle_1x128x128_256x32x128x128_16x16_16x16_8x32x1_8x32x1_1x32x1x8_8_2x1_intrawave_v1,210.88,269.68,0.0
80,544,3072,7168,ck,14,0,118.1064,a8w8_blockscale_bpreshuffle_1x128x128_256x64x128x128_16x16_16x16_8x32x1_8x32x1_1x32x1x8_8_2x1_intrawave_v1,202.85,247.76,0.0
80,576,3072,7168,ck,14,2,118.7652,a8w8_blockscale_bpreshuffle_1x128x128_256x64x128x128_16x16_16x16_8x32x1_8x32x1_1x32x1x8_8_2x1_intrawave_v1,213.59,249.97,0.0
80,608,3072,7168,asm,17,2,125.6525,_ZN5aiter42fp8gemm_bf16_blockscale_BpreShuffle_64x128E,213.1,239.66,0.0
80,640,3072,7168,asm,8,1,143.1488,_ZN5aiter42fp8gemm_bf16_blockscale_BpreShuffle_48x128E,196.9,213.34,0.0
80,672,3072,7168,asm,24,1,128.7298,_ZN5aiter42fp8gemm_bf16_blockscale_BpreShuffle_80x128E,229.9,240.55,0.0
80,704,3072,7168,asm,40,1,129.9142,_ZN5aiter43fp8gemm_bf16_blockscale_BpreShuffle_128x128E,238.65,241.63,0.0
80,736,3072,7168,asm,16,1,142.9045,_ZN5aiter42fp8gemm_bf16_blockscale_BpreShuffle_64x128E,226.82,222.65,0.0
80,768,3072,7168,ck,13,0,141.5221,a8w8_blockscale_bpreshuffle_1x128x128_256x64x256x128_16x16_16x16_8x32x1_8x32x1_1x32x1x8_8_2x1_intrawave_v1,238.99,227.84,0.0
80,800,3072,7168,asm,24,1,129.8573,_ZN5aiter42fp8gemm_bf16_blockscale_BpreShuffle_80x128E,271.31,251.58,0.0
80,832,3072,7168,ck,13,3,144.4781,a8w8_blockscale_bpreshuffle_1x128x128_256x64x256x128_16x16_16x16_8x32x1_8x32x1_1x32x1x8_8_2x1_intrawave_v1,253.61,229.07,0.0
80,864,3072,7168,asm,32,1,151.0642,_ZN5aiter42fp8gemm_bf16_blockscale_BpreShuffle_96x128E,251.88,221.9,0.0
80,896,3072,7168,asm,32,1,150.827,_ZN5aiter42fp8gemm_bf16_blockscale_BpreShuffle_96x128E,261.62,225.08,0.0
80,928,3072,7168,asm,32,1,151.6636,_ZN5aiter42fp8gemm_bf16_blockscale_BpreShuffle_96x128E,269.47,226.64,0.0
80,960,3072,7168,ck,14,1,176.5726,a8w8_blockscale_bpreshuffle_1x128x128_256x64x128x128_16x16_16x16_8x32x1_8x32x1_1x32x1x8_8_2x1_intrawave_v1,239.44,197.08,0.0
80,992,3072,7168,asm,16,1,178.6712,_ZN5aiter42fp8gemm_bf16_blockscale_BpreShuffle_64x128E,244.52,197.15,0.0
80,1024,3072,7168,ck,14,3,176.2933,a8w8_blockscale_bpreshuffle_1x128x128_256x64x128x128_16x16_16x16_8x32x1_8x32x1_1x32x1x8_8_2x1_intrawave_v1,255.81,202.23,0.0
80,1088,3072,7168,asm,40,1,192.9444,_ZN5aiter43fp8gemm_bf16_blockscale_BpreShuffle_128x128E,248.34,189.19,0.0
80,1152,3072,7168,ck,14,1,208.1749,a8w8_blockscale_bpreshuffle_1x128x128_256x64x128x128_16x16_16x16_8x32x1_8x32x1_1x32x1x8_8_2x1_intrawave_v1,243.71,179.44,0.0
80,1216,3072,7168,asm,40,1,194.9385,_ZN5aiter43fp8gemm_bf16_blockscale_BpreShuffle_128x128E,274.72,196.0,0.0
80,1280,3072,7168,ck,14,1,210.1075,a8w8_blockscale_bpreshuffle_1x128x128_256x64x128x128_16x16_16x16_8x32x1_8x32x1_1x32x1x8_8_2x1_intrawave_v1,268.3,185.9,0.0
80,1344,3072,7168,ck,14,0,240.5106,a8w8_blockscale_bpreshuffle_1x128x128_256x64x128x128_16x16_16x16_8x32x1_8x32x1_1x32x1x8_8_2x1_intrawave_v1,246.1,165.94,0.0
80,1408,3072,7168,ck,14,1,241.4586,a8w8_blockscale_bpreshuffle_1x128x128_256x64x128x128_16x16_16x16_8x32x1_8x32x1_1x32x1x8_8_2x1_intrawave_v1,256.81,168.82,0.0
80,1472,3072,7168,ck,14,0,242.1619,a8w8_blockscale_bpreshuffle_1x128x128_256x64x128x128_16x16_16x16_8x32x1_8x32x1_1x32x1x8_8_2x1_intrawave_v1,267.7,171.85,0.0
80,1536,3072,7168,asm,40,1,257.5899,_ZN5aiter43fp8gemm_bf16_blockscale_BpreShuffle_128x128E,262.61,164.86,0.0
80,1600,3072,7168,asm,24,1,256.8756,_ZN5aiter42fp8gemm_bf16_blockscale_BpreShuffle_80x128E,274.31,168.64,0.0
80,1664,3072,7168,ck,14,0,274.8188,a8w8_blockscale_bpreshuffle_1x128x128_256x64x128x128_16x16_16x16_8x32x1_8x32x1_1x32x1x8_8_2x1_intrawave_v1,266.66,160.73,0.0
80,1728,3072,7168,asm,32,1,297.8662,_ZN5aiter42fp8gemm_bf16_blockscale_BpreShuffle_96x128E,255.49,151.15,0.0
80,1792,3072,7168,ck,9,2,325.5651,a8w8_blockscale_bpreshuffle_1x128x128_256x32x128x128_16x16_16x16_8x32x1_8x32x1_1x32x1x8_8_2x1_intrawave_v1,242.41,140.91,0.0
80,1856,3072,7168,asm,32,1,298.824,_ZN5aiter42fp8gemm_bf16_blockscale_BpreShuffle_96x128E,273.53,156.37,0.0
80,1920,3072,7168,ck,14,1,309.9114,a8w8_blockscale_bpreshuffle_1x128x128_256x64x128x128_16x16_16x16_8x32x1_8x32x1_1x32x1x8_8_2x1_intrawave_v1,272.84,153.52,0.0
80,1984,3072,7168,asm,40,1,321.1265,_ZN5aiter43fp8gemm_bf16_blockscale_BpreShuffle_128x128E,272.09,150.82,0.0
80,2048,3072,7168,ck,14,1,338.0443,a8w8_blockscale_bpreshuffle_1x128x128_256x64x128x128_16x16_16x16_8x32x1_8x32x1_1x32x1x8_8_2x1_intrawave_v1,266.81,145.79,0.0
80,4096,3072,7168,asm,40,1,638.9677,_ZN5aiter43fp8gemm_bf16_blockscale_BpreShuffle_128x128E,282.31,119.8,0.0
80,8192,3072,7168,ck,14,1,1279.9197,a8w8_blockscale_bpreshuffle_1x128x128_256x64x128x128_16x16_16x16_8x32x1_8x32x1_1x32x1x8_8_2x1_intrawave_v1,281.87,102.41,0.0
80,16384,3072,7168,asm,40,1,2482.5136,_ZN5aiter43fp8gemm_bf16_blockscale_BpreShuffle_128x128E,290.65,96.73,0.0
80,32768,3072,7168,ck,14,1,5035.2657,a8w8_blockscale_bpreshuffle_1x128x128_256x64x128x128_16x16_16x16_8x32x1_8x32x1_1x32x1x8_8_2x1_intrawave_v1,286.6,91.0,0.0
80,16,4096,7168,ck,7,2,18.003,a8w8_blockscale_bpreshuffle_1x128x128_256x16x64x256_16x16_16x16_16x16x1_16x16x1_1x16x1x16_4_1x1_intrawave_v1,52.19,1644.5,0.0
80,32,4096,7168,asm,1,2,19.4233,_ZN5aiter42fp8gemm_bf16_blockscale_BpreShuffle_32x128E,96.74,1536.9,0.0
80,48,4096,7168,asm,9,2,20.7437,_ZN5aiter42fp8gemm_bf16_blockscale_BpreShuffle_48x128E,135.88,1450.92,0.0
80,64,4096,7168,asm,20,5,26.429,_ZN5aiter42fp8gemm_bf16_blockscale_BpreShuffle_64x128E,142.2,1148.1,0.003
80,80,4096,7168,asm,25,2,27.5123,_ZN5aiter42fp8gemm_bf16_blockscale_BpreShuffle_80x128E,170.75,1111.83,0.0
80,96,4096,7168,asm,33,2,31.582,_ZN5aiter42fp8gemm_bf16_blockscale_BpreShuffle_96x128E,178.49,976.34,0.0
80,112,4096,7168,asm,16,1,37.4418,_ZN5aiter42fp8gemm_bf16_blockscale_BpreShuffle_64x128E,175.65,830.1,0.0
80,128,4096,7168,asm,16,1,38.5218,_ZN5aiter42fp8gemm_bf16_blockscale_BpreShuffle_64x128E,195.12,813.21,0.0
80,144,4096,7168,ck,9,2,49.1439,a8w8_blockscale_bpreshuffle_1x128x128_256x32x128x128_16x16_16x16_8x32x1_8x32x1_1x32x1x8_8_2x1_intrawave_v1,172.06,642.44,0.0
80,160,4096,7168,asm,24,1,44.9699,_ZN5aiter42fp8gemm_bf16_blockscale_BpreShuffle_80x128E,208.92,707.53,0.0
80,176,4096,7168,asm,32,1,51.6108,_ZN5aiter42fp8gemm_bf16_blockscale_BpreShuffle_96x128E,200.24,621.26,0.0
80,192,4096,7168,asm,32,1,54.6125,_ZN5aiter42fp8gemm_bf16_blockscale_BpreShuffle_96x128E,206.44,591.61,0.0
80,208,4096,7168,ck,9,3,66.1193,a8w8_blockscale_bpreshuffle_1x128x128_256x32x128x128_16x16_16x16_8x32x1_8x32x1_1x32x1x8_8_2x1_intrawave_v1,184.72,492.37,0.0
80,224,4096,7168,asm,40,1,66.1709,_ZN5aiter43fp8gemm_bf16_blockscale_BpreShuffle_128x128E,198.78,495.7,0.0
80,240,4096,7168,asm,40,1,65.9368,_ZN5aiter43fp8gemm_bf16_blockscale_BpreShuffle_128x128E,213.73,501.18,0.0
80,256,4096,7168,asm,40,1,74.078,_ZN5aiter43fp8gemm_bf16_blockscale_BpreShuffle_128x128E,202.93,449.42,0.0
80,288,4096,7168,ck,14,0,81.5242,a8w8_blockscale_bpreshuffle_1x128x128_256x64x128x128_16x16_16x16_8x32x1_8x32x1_1x32x1x8_8_2x1_intrawave_v1,207.44,414.4,0.0
80,320,4096,7168,ck,14,3,79.1211,a8w8_blockscale_bpreshuffle_1x128x128_256x64x128x128_16x16_16x16_8x32x1_8x32x1_1x32x1x8_8_2x1_intrawave_v1,237.49,433.2,0.0
80,352,4096,7168,asm,24,1,87.3612,_ZN5aiter42fp8gemm_bf16_blockscale_BpreShuffle_80x128E,236.6,397.97,0.0
80,384,4096,7168,asm,25,2,100.7915,_ZN5aiter42fp8gemm_bf16_blockscale_BpreShuffle_80x128E,223.72,349.81,0.0
80,416,4096,7168,asm,32,1,101.729,_ZN5aiter42fp8gemm_bf16_blockscale_BpreShuffle_96x128E,240.12,351.42,0.0
80,448,4096,7168,asm,16,1,108.5212,_ZN5aiter42fp8gemm_bf16_blockscale_BpreShuffle_64x128E,242.41,333.96,0.0
80,480,4096,7168,asm,32,1,102.2639,_ZN5aiter42fp8gemm_bf16_blockscale_BpreShuffle_96x128E,275.62,359.2,0.0
80,512,4096,7168,asm,42,3,136.3012,_ZN5aiter43fp8gemm_bf16_blockscale_BpreShuffle_128x128E,220.58,273.1,0.0003
80,544,4096,7168,asm,40,1,130.2093,_ZN5aiter43fp8gemm_bf16_blockscale_BpreShuffle_128x128E,245.33,289.66,0.0
80,576,4096,7168,ck,13,0,142.7673,a8w8_blockscale_bpreshuffle_1x128x128_256x64x256x128_16x16_16x16_8x32x1_8x32x1_1x32x1x8_8_2x1_intrawave_v1,236.91,267.62,0.0
80,608,4096,7168,asm,40,1,130.5689,_ZN5aiter43fp8gemm_bf16_blockscale_BpreShuffle_128x128E,273.43,296.39,0.0
80,640,4096,7168,ck,13,0,145.2895,a8w8_blockscale_bpreshuffle_1x128x128_256x64x256x128_16x16_16x16_8x32x1_8x32x1_1x32x1x8_8_2x1_intrawave_v1,258.66,269.74,0.0
80,672,4096,7168,asm,32,1,151.3693,_ZN5aiter42fp8gemm_bf16_blockscale_BpreShuffle_96x128E,260.69,262.15,0.0
80,704,4096,7168,ck,14,3,175.7245,a8w8_blockscale_bpreshuffle_1x128x128_256x64x128x128_16x16_16x16_8x32x1_8x32x1_1x32x1x8_8_2x1_intrawave_v1,235.25,228.62,0.0
80,736,4096,7168,asm,16,1,179.0296,_ZN5aiter42fp8gemm_bf16_blockscale_BpreShuffle_64x128E,241.4,227.14,0.0
80,768,4096,7168,ck,14,2,177.1756,a8w8_blockscale_bpreshuffle_1x128x128_256x64x128x128_16x16_16x16_8x32x1_8x32x1_1x32x1x8_8_2x1_intrawave_v1,254.53,232.29,0.0
80,800,4096,7168,asm,24,1,172.636,_ZN5aiter42fp8gemm_bf16_blockscale_BpreShuffle_80x128E,272.11,241.25,0.0
80,832,4096,7168,ck,14,1,207.0344,a8w8_blockscale_bpreshuffle_1x128x128_256x64x128x128_16x16_16x16_8x32x1_8x32x1_1x32x1x8_8_2x1_intrawave_v1,235.98,203.54,0.0
80,864,4096,7168,asm,24,1,211.509,_ZN5aiter42fp8gemm_bf16_blockscale_BpreShuffle_80x128E,239.87,201.56,0.0
80,896,4096,7168,ck,14,1,207.9777,a8w8_blockscale_bpreshuffle_1x128x128_256x64x128x128_16x16_16x16_8x32x1_8x32x1_1x32x1x8_8_2x1_intrawave_v1,252.98,207.34,0.0
80,928,4096,7168,asm,32,1,200.8497,_ZN5aiter42fp8gemm_bf16_blockscale_BpreShuffle_96x128E,271.31,217.15,0.0
80,960,4096,7168,asm,32,1,201.2652,_ZN5aiter42fp8gemm_bf16_blockscale_BpreShuffle_96x128E,280.09,219.14,0.0
80,992,4096,7168,asm,32,1,246.0048,_ZN5aiter42fp8gemm_bf16_blockscale_BpreShuffle_96x128E,236.79,181.29,0.0
80,1024,4096,7168,ck,14,0,241.0169,a8w8_blockscale_bpreshuffle_1x128x128_256x64x128x128_16x16_16x16_8x32x1_8x32x1_1x32x1x8_8_2x1_intrawave_v1,249.48,187.08,0.0
80,1088,4096,7168,ck,14,1,245.0917,a8w8_blockscale_bpreshuffle_1x128x128_256x64x128x128_16x16_16x16_8x32x1_8x32x1_1x32x1x8_8_2x1_intrawave_v1,260.67,187.98,0.0
80,1152,4096,7168,asm,24,1,256.0912,_ZN5aiter42fp8gemm_bf16_blockscale_BpreShuffle_80x128E,264.15,183.74,0.0
80,1216,4096,7168,asm,40,1,258.1303,_ZN5aiter43fp8gemm_bf16_blockscale_BpreShuffle_128x128E,276.62,186.1,0.0
80,1280,4096,7168,ck,14,1,274.7749,a8w8_blockscale_bpreshuffle_1x128x128_256x64x128x128_16x16_16x16_8x32x1_8x32x1_1x32x1x8_8_2x1_intrawave_v1,273.54,178.4,0.0
80,1344,4096,7168,asm,32,1,299.191,_ZN5aiter42fp8gemm_bf16_blockscale_BpreShuffle_96x128E,263.78,167.13,0.0
80,1408,4096,7168,ck,14,1,314.7369,a8w8_blockscale_bpreshuffle_1x128x128_256x64x128x128_16x16_16x16_8x32x1_8x32x1_1x32x1x8_8_2x1_intrawave_v1,262.69,162.0,0.0
80,1472,4096,7168,asm,40,1,321.8322,_ZN5aiter43fp8gemm_bf16_blockscale_BpreShuffle_128x128E,268.58,161.48,0.0
80,1536,4096,7168,asm,40,1,321.2089,_ZN5aiter43fp8gemm_bf16_blockscale_BpreShuffle_128x128E,280.8,164.86,0.0
80,1600,4096,7168,ck,13,1,342.2524,a8w8_blockscale_bpreshuffle_1x128x128_256x64x256x128_16x16_16x16_8x32x1_8x32x1_1x32x1x8_8_2x1_intrawave_v1,274.51,157.59,0.0
80,1664,4096,7168,ck,14,2,370.9299,a8w8_blockscale_bpreshuffle_1x128x128_256x64x128x128_16x16_16x16_8x32x1_8x32x1_1x32x1x8_8_2x1_intrawave_v1,263.42,148.06,0.0
80,1728,4096,7168,asm,24,1,380.9967,_ZN5aiter42fp8gemm_bf16_blockscale_BpreShuffle_80x128E,266.32,146.73,0.0
80,1792,4096,7168,ck,14,1,404.888,a8w8_blockscale_bpreshuffle_1x128x128_256x64x128x128_16x16_16x16_8x32x1_8x32x1_1x32x1x8_8_2x1_intrawave_v1,259.89,140.5,0.0
80,1856,4096,7168,asm,40,1,386.7708,_ZN5aiter43fp8gemm_bf16_blockscale_BpreShuffle_128x128E,281.78,149.62,0.0
80,1920,4096,7168,asm,40,1,386.6691,_ZN5aiter43fp8gemm_bf16_blockscale_BpreShuffle_128x128E,291.57,152.2,0.0
80,1984,4096,7168,asm,24,1,424.6418,_ZN5aiter42fp8gemm_bf16_blockscale_BpreShuffle_80x128E,274.35,140.91,0.0
80,2048,4096,7168,ck,14,2,437.5002,a8w8_blockscale_bpreshuffle_1x128x128_256x64x128x128_16x16_16x16_8x32x1_8x32x1_1x32x1x8_8_2x1_intrawave_v1,274.88,139.01,0.0
80,4096,4096,7168,asm,40,1,829.8264,_ZN5aiter43fp8gemm_bf16_blockscale_BpreShuffle_128x128E,289.84,111.2,0.0
80,8192,4096,7168,ck,14,1,1698.8978,a8w8_blockscale_bpreshuffle_1x128x128_256x64x128x128_16x16_16x16_8x32x1_8x32x1_1x32x1x8_8_2x1_intrawave_v1,283.15,91.35,0.0
80,16384,4096,7168,ck,14,0,3348.9612,a8w8_blockscale_bpreshuffle_1x128x128_256x64x128x128_16x16_16x16_8x32x1_8x32x1_1x32x1x8_8_2x1_intrawave_v1,287.27,83.91,0.0
80,32768,4096,7168,ck,14,1,6668.7605,a8w8_blockscale_bpreshuffle_1x128x128_256x64x128x128_16x16_16x16_8x32x1_8x32x1_1x32x1x8_8_2x1_intrawave_v1,288.53,79.88,0.0
80,16,4608,7168,asm,1,2,18.5936,_ZN5aiter42fp8gemm_bf16_blockscale_BpreShuffle_32x128E,56.85,1790.52,0.0
80,32,4608,7168,asm,1,2,20.497,_ZN5aiter42fp8gemm_bf16_blockscale_BpreShuffle_32x128E,103.13,1637.04,0.0
80,48,4608,7168,asm,9,2,21.4112,_ZN5aiter42fp8gemm_bf16_blockscale_BpreShuffle_48x128E,148.1,1579.39,0.0
80,64,4608,7168,asm,27,4,32.4441,_ZN5aiter42fp8gemm_bf16_blockscale_BpreShuffle_80x128E,130.31,1050.38,0.0018
80,80,4608,7168,asm,25,2,27.8561,_ZN5aiter42fp8gemm_bf16_blockscale_BpreShuffle_80x128E,189.72,1232.8,0.0
80,96,4608,7168,asm,8,1,32.5745,_ZN5aiter42fp8gemm_bf16_blockscale_BpreShuffle_48x128E,194.69,1062.27,0.0
80,112,4608,7168,asm,24,1,44.5111,_ZN5aiter42fp8gemm_bf16_blockscale_BpreShuffle_80x128E,166.22,783.29,0.0
80,128,4608,7168,asm,24,1,44.6253,_ZN5aiter42fp8gemm_bf16_blockscale_BpreShuffle_80x128E,189.48,787.16,0.0
80,144,4608,7168,asm,25,2,50.5438,_ZN5aiter42fp8gemm_bf16_blockscale_BpreShuffle_80x128E,188.21,700.17,0.0
80,160,4608,7168,asm,24,1,45.5446,_ZN5aiter42fp8gemm_bf16_blockscale_BpreShuffle_80x128E,232.07,782.78,0.0
80,176,4608,7168,asm,32,1,52.495,_ZN5aiter42fp8gemm_bf16_blockscale_BpreShuffle_96x128E,221.48,684.14,0.0
80,192,4608,7168,asm,32,1,52.2788,_ZN5aiter42fp8gemm_bf16_blockscale_BpreShuffle_96x128E,242.61,691.98,0.0
80,208,4608,7168,asm,40,1,66.3228,_ZN5aiter43fp8gemm_bf16_blockscale_BpreShuffle_128x128E,207.18,549.4,0.0
80,224,4608,7168,asm,25,2,74.6142,_ZN5aiter42fp8gemm_bf16_blockscale_BpreShuffle_80x128E,198.32,491.87,0.0
80,240,4608,7168,asm,40,1,66.3317,_ZN5aiter43fp8gemm_bf16_blockscale_BpreShuffle_128x128E,239.02,557.23,0.0
80,256,4608,7168,asm,16,1,73.4996,_ZN5aiter42fp8gemm_bf16_blockscale_BpreShuffle_64x128E,230.09,506.46,0.0
80,288,4608,7168,asm,24,1,86.4158,_ZN5aiter42fp8gemm_bf16_blockscale_BpreShuffle_80x128E,220.16,436.83,0.0
80,320,4608,7168,asm,32,1,101.1115,_ZN5aiter42fp8gemm_bf16_blockscale_BpreShuffle_96x128E,209.07,378.52,0.0
80,352,4608,7168,asm,32,1,100.6612,_ZN5aiter42fp8gemm_bf16_blockscale_BpreShuffle_96x128E,231.0,385.42,0.0
80,384,4608,7168,asm,32,1,101.417,_ZN5aiter42fp8gemm_bf16_blockscale_BpreShuffle_96x128E,250.13,387.72,0.0
80,416,4608,7168,ck,8,2,125.625,a8w8_blockscale_bpreshuffle_1x128x128_256x32x256x128_16x16_16x16_8x32x1_8x32x1_1x32x1x8_8_2x1_intrawave_v1,218.75,317.18,0.0
80,448,4608,7168,asm,40,1,129.7306,_ZN5aiter43fp8gemm_bf16_blockscale_BpreShuffle_128x128E,228.13,311.18,0.0
80,480,4608,7168,asm,24,1,128.9775,_ZN5aiter42fp8gemm_bf16_blockscale_BpreShuffle_80x128E,245.85,317.07,0.0
80,512,4608,7168,ck,13,2,141.942,a8w8_blockscale_bpreshuffle_1x128x128_256x64x256x128_16x16_16x16_8x32x1_8x32x1_1x32x1x8_8_2x1_intrawave_v1,238.29,291.8,0.0
80,544,4608,7168,asm,32,1,149.8057,_ZN5aiter42fp8gemm_bf16_blockscale_BpreShuffle_96x128E,239.89,279.98,0.0
80,576,4608,7168,ck,14,2,174.7991,a8w8_blockscale_bpreshuffle_1x128x128_256x64x128x128_16x16_16x16_8x32x1_8x32x1_1x32x1x8_8_2x1_intrawave_v1,217.68,242.95,0.0
80,608,4608,7168,asm,24,1,170.1228,_ZN5aiter42fp8gemm_bf16_blockscale_BpreShuffle_80x128E,236.09,252.71,0.0
80,640,4608,7168,asm,16,1,177.6442,_ZN5aiter42fp8gemm_bf16_blockscale_BpreShuffle_64x128E,238.0,244.96,0.0
80,672,4608,7168,asm,16,1,177.8749,_ZN5aiter42fp8gemm_bf16_blockscale_BpreShuffle_64x128E,249.57,247.59,0.0
80,704,4608,7168,ck,14,2,177.3077,a8w8_blockscale_bpreshuffle_1x128x128_256x64x128x128_16x16_16x16_8x32x1_8x32x1_1x32x1x8_8_2x1_intrawave_v1,262.29,251.34,0.0
80,736,4608,7168,asm,40,1,193.7625,_ZN5aiter43fp8gemm_bf16_blockscale_BpreShuffle_128x128E,250.93,232.7,0.0
80,768,4608,7168,asm,40,1,193.7739,_ZN5aiter43fp8gemm_bf16_blockscale_BpreShuffle_128x128E,261.82,235.39,0.0
80,800,4608,7168,asm,24,1,212.1477,_ZN5aiter42fp8gemm_bf16_blockscale_BpreShuffle_80x128E,249.11,217.48,0.0
80,832,4608,7168,ck,14,3,209.2843,a8w8_blockscale_bpreshuffle_1x128x128_256x64x128x128_16x16_16x16_8x32x1_8x32x1_1x32x1x8_8_2x1_intrawave_v1,262.62,222.96,0.0
80,864,4608,7168,asm,24,1,213.1009,_ZN5aiter42fp8gemm_bf16_blockscale_BpreShuffle_80x128E,267.84,221.43,0.0
80,896,4608,7168,ck,14,3,241.727,a8w8_blockscale_bpreshuffle_1x128x128_256x64x128x128_16x16_16x16_8x32x1_8x32x1_1x32x1x8_8_2x1_intrawave_v1,244.86,197.37,0.0
80,928,4608,7168,asm,32,1,247.1644,_ZN5aiter42fp8gemm_bf16_blockscale_BpreShuffle_96x128E,248.03,195.15,0.0
80,960,4608,7168,ck,14,3,244.1019,a8w8_blockscale_bpreshuffle_1x128x128_256x64x128x128_16x16_16x16_8x32x1_8x32x1_1x32x1x8_8_2x1_intrawave_v1,259.8,199.75,0.0
80,992,4608,7168,asm,32,1,249.629,_ZN5aiter42fp8gemm_bf16_blockscale_BpreShuffle_96x128E,262.52,197.43,0.0
80,1024,4608,7168,asm,24,1,254.657,_ZN5aiter42fp8gemm_bf16_blockscale_BpreShuffle_80x128E,265.63,195.59,0.0
80,1088,4608,7168,ck,13,2,274.2551,a8w8_blockscale_bpreshuffle_1x128x128_256x64x256x128_16x16_16x16_8x32x1_8x32x1_1x32x1x8_8_2x1_intrawave_v1,262.07,185.43,0.0
80,1152,4608,7168,asm,24,1,295.653,_ZN5aiter42fp8gemm_bf16_blockscale_BpreShuffle_80x128E,257.4,175.56,0.0
80,1216,4608,7168,ck,14,3,305.9418,a8w8_blockscale_bpreshuffle_1x128x128_256x64x128x128_16x16_16x16_8x32x1_8x32x1_1x32x1x8_8_2x1_intrawave_v1,262.56,173.08,0.0
80,1280,4608,7168,ck,14,3,307.633,a8w8_blockscale_bpreshuffle_1x128x128_256x64x128x128_16x16_16x16_8x32x1_8x32x1_1x32x1x8_8_2x1_intrawave_v1,274.86,175.54,0.0
80,1344,4608,7168,asm,40,1,319.9906,_ZN5aiter43fp8gemm_bf16_blockscale_BpreShuffle_128x128E,277.46,172.04,0.0
80,1408,4608,7168,asm,40,1,323.1302,_ZN5aiter43fp8gemm_bf16_blockscale_BpreShuffle_128x128E,287.85,173.61,0.0
80,1472,4608,7168,ck,14,3,370.7329,a8w8_blockscale_bpreshuffle_1x128x128_256x64x128x128_16x16_16x16_8x32x1_8x32x1_1x32x1x8_8_2x1_intrawave_v1,262.29,154.15,0.0
80,1536,4608,7168,ck,14,3,371.4455,a8w8_blockscale_bpreshuffle_1x128x128_256x64x128x128_16x16_16x16_8x32x1_8x32x1_1x32x1x8_8_2x1_intrawave_v1,273.17,156.67,0.0
80,1600,4608,7168,asm,24,1,381.7387,_ZN5aiter42fp8gemm_bf16_blockscale_BpreShuffle_80x128E,276.88,155.2,0.0
80,1664,4608,7168,asm,40,1,384.7672,_ZN5aiter43fp8gemm_bf16_blockscale_BpreShuffle_128x128E,285.69,156.7,0.0
80,1728,4608,7168,asm,24,1,423.1707,_ZN5aiter42fp8gemm_bf16_blockscale_BpreShuffle_80x128E,269.75,144.96,0.0
80,1792,4608,7168,ck,14,3,436.4111,a8w8_blockscale_bpreshuffle_1x128x128_256x64x128x128_16x16_16x16_8x32x1_8x32x1_1x32x1x8_8_2x1_intrawave_v1,271.26,142.96,0.0
80,1856,4608,7168,asm,32,1,446.2788,_ZN5aiter42fp8gemm_bf16_blockscale_BpreShuffle_96x128E,274.73,142.15,0.0
80,1920,4608,7168,asm,40,1,447.27,_ZN5aiter43fp8gemm_bf16_blockscale_BpreShuffle_128x128E,283.58,144.18,0.0
80,1984,4608,7168,ck,14,2,474.1145,a8w8_blockscale_bpreshuffle_1x128x128_256x64x128x128_16x16_16x16_8x32x1_8x32x1_1x32x1x8_8_2x1_intrawave_v1,276.44,138.23,0.0
80,2048,4608,7168,ck,14,2,501.7092,a8w8_blockscale_bpreshuffle_1x128x128_256x64x128x128_16x16_16x16_8x32x1_8x32x1_1x32x1x8_8_2x1_intrawave_v1,269.66,132.72,0.0
80,4096,4608,7168,ck,14,3,954.4035,a8w8_blockscale_bpreshuffle_1x128x128_256x64x128x128_16x16_16x16_8x32x1_8x32x1_1x32x1x8_8_2x1_intrawave_v1,283.51,104.92,0.0
80,8192,4608,7168,asm,40,1,1848.2208,_ZN5aiter43fp8gemm_bf16_blockscale_BpreShuffle_128x128E,292.8,90.49,0.0
80,16384,4608,7168,asm,40,1,3691.1662,_ZN5aiter43fp8gemm_bf16_blockscale_BpreShuffle_128x128E,293.22,81.67,0.0
80,32768,4608,7168,ck,14,3,7482.3215,a8w8_blockscale_bpreshuffle_1x128x128_256x64x128x128_16x16_16x16_8x32x1_8x32x1_1x32x1x8_8_2x1_intrawave_v1,289.3,76.17,0.0
80,1,7168,7168,ck,6,3,23.5753,a8w8_blockscale_bpreshuffle_1x128x128_256x16x128x256_16x16_16x16_16x16x1_16x16x1_1x16x1x16_8_1x2_intrawave_v1,4.36,2180.32,0.0
80,2,7168,7168,ck,6,2,23.5987,a8w8_blockscale_bpreshuffle_1x128x128_256x16x128x256_16x16_16x16_16x16x1_16x16x1_1x16x1x16_8_1x2_intrawave_v1,8.71,2179.07,0.0
80,4,7168,7168,ck,6,1,23.5811,a8w8_blockscale_bpreshuffle_1x128x128_256x16x128x256_16x16_16x16_16x16x1_16x16x1_1x16x1x16_8_1x2_intrawave_v1,17.43,2182.52,0.0
80,8,7168,7168,ck,6,1,23.7961,a8w8_blockscale_bpreshuffle_1x128x128_256x16x128x256_16x16_16x16_16x16x1_16x16x1_1x16x1x16_8_1x2_intrawave_v1,34.55,2166.42,0.0
80,16,7168,7168,ck,6,3,23.64,a8w8_blockscale_bpreshuffle_1x128x128_256x16x128x256_16x16_16x16_16x16x1_16x16x1_1x16x1x16_8_1x2_intrawave_v1,69.55,2188.0,0.0
80,32,7168,7168,asm,8,1,31.7689,_ZN5aiter42fp8gemm_bf16_blockscale_BpreShuffle_48x128E,103.51,1638.97,0.0
80,48,7168,7168,asm,8,1,32.6977,_ZN5aiter42fp8gemm_bf16_blockscale_BpreShuffle_48x128E,150.85,1602.94,0.0
80,64,7168,7168,ck,10,0,43.8596,a8w8_blockscale_bpreshuffle_1x128x128_256x32x64x128_16x16_16x16_8x32x1_8x32x1_1x32x1x8_8_2x1_intrawave_v1,149.95,1202.85,0.0
80,80,7168,7168,asm,24,1,45.065,_ZN5aiter42fp8gemm_bf16_blockscale_BpreShuffle_80x128E,182.42,1178.31,0.0
80,96,7168,7168,asm,9,2,54.3595,_ZN5aiter42fp8gemm_bf16_blockscale_BpreShuffle_48x128E,181.48,983.17,0.0
80,112,7168,7168,asm,17,2,64.2175,_ZN5aiter42fp8gemm_bf16_blockscale_BpreShuffle_64x128E,179.22,837.6,0.0
80,128,7168,7168,asm,40,1,66.156,_ZN5aiter43fp8gemm_bf16_blockscale_BpreShuffle_128x128E,198.82,818.26,0.0
80,144,7168,7168,asm,24,1,85.5061,_ZN5aiter42fp8gemm_bf16_blockscale_BpreShuffle_80x128E,173.06,637.11,0.0
80,160,7168,7168,ck,8,2,84.4601,a8w8_blockscale_bpreshuffle_1x128x128_256x32x256x128_16x16_16x16_8x32x1_8x32x1_1x32x1x8_8_2x1_intrawave_v1,194.67,649.07,0.0
80,176,7168,7168,asm,33,2,89.2163,_ZN5aiter42fp8gemm_bf16_blockscale_BpreShuffle_96x128E,202.72,618.33,0.0
80,192,7168,7168,asm,34,3,104.8942,_ZN5aiter42fp8gemm_bf16_blockscale_BpreShuffle_96x128E,188.09,529.19,0.0003
80,208,7168,7168,asm,16,1,107.8413,_ZN5aiter42fp8gemm_bf16_blockscale_BpreShuffle_64x128E,198.2,517.92,0.0
80,224,7168,7168,ck,9,1,110.6773,a8w8_blockscale_bpreshuffle_1x128x128_256x32x128x128_16x16_16x16_8x32x1_8x32x1_1x32x1x8_8_2x1_intrawave_v1,207.98,507.76,0.0
80,240,7168,7168,asm,16,1,108.8417,_ZN5aiter42fp8gemm_bf16_blockscale_BpreShuffle_64x128E,226.59,519.48,0.0
80,256,7168,7168,asm,16,1,109.492,_ZN5aiter42fp8gemm_bf16_blockscale_BpreShuffle_64x128E,240.26,519.54,0.0
80,288,7168,7168,asm,24,1,128.8767,_ZN5aiter42fp8gemm_bf16_blockscale_BpreShuffle_80x128E,229.64,446.73,0.0
80,320,7168,7168,asm,24,1,129.7803,_ZN5aiter42fp8gemm_bf16_blockscale_BpreShuffle_80x128E,253.38,448.92,0.0
80,352,7168,7168,asm,32,1,150.6286,_ZN5aiter42fp8gemm_bf16_blockscale_BpreShuffle_96x128E,240.14,391.36,0.0
80,384,7168,7168,asm,24,1,170.1681,_ZN5aiter42fp8gemm_bf16_blockscale_BpreShuffle_80x128E,231.89,350.46,0.0
80,416,7168,7168,asm,16,1,178.5732,_ZN5aiter42fp8gemm_bf16_blockscale_BpreShuffle_64x128E,239.39,337.82,0.0
80,448,7168,7168,asm,16,1,178.7366,_ZN5aiter42fp8gemm_bf16_blockscale_BpreShuffle_64x128E,257.57,341.36,0.0
80,480,7168,7168,asm,40,1,193.465,_ZN5aiter43fp8gemm_bf16_blockscale_BpreShuffle_128x128E,254.96,318.93,0.0
80,512,7168,7168,ck,14,0,208.7432,a8w8_blockscale_bpreshuffle_1x128x128_256x64x128x128_16x16_16x16_8x32x1_8x32x1_1x32x1x8_8_2x1_intrawave_v1,252.05,298.89,0.0
80,544,7168,7168,asm,24,1,214.224,_ZN5aiter42fp8gemm_bf16_blockscale_BpreShuffle_80x128E,260.95,294.45,0.0
80,576,7168,7168,ck,14,2,243.59,a8w8_blockscale_bpreshuffle_1x128x128_256x64x128x128_16x16_16x16_8x32x1_8x32x1_1x32x1x8_8_2x1_intrawave_v1,242.99,261.78,0.0
80,608,7168,7168,asm,16,1,249.4979,_ZN5aiter42fp8gemm_bf16_blockscale_BpreShuffle_64x128E,250.42,258.34,0.0
80,640,7168,7168,ck,14,3,245.6262,a8w8_blockscale_bpreshuffle_1x128x128_256x64x128x128_16x16_16x16_8x32x1_8x32x1_1x32x1x8_8_2x1_intrawave_v1,267.75,265.21,0.0
80,672,7168,7168,asm,32,1,250.8517,_ZN5aiter42fp8gemm_bf16_blockscale_BpreShuffle_96x128E,275.28,262.43,0.0
80,704,7168,7168,ck,13,3,276.0552,a8w8_blockscale_bpreshuffle_1x128x128_256x64x256x128_16x16_16x16_8x32x1_8x32x1_1x32x1x8_8_2x1_intrawave_v1,262.06,240.96,0.0
80,736,7168,7168,asm,32,1,297.1745,_ZN5aiter42fp8gemm_bf16_blockscale_BpreShuffle_96x128E,254.5,226.15,0.0
80,768,7168,7168,asm,24,1,297.148,_ZN5aiter42fp8gemm_bf16_blockscale_BpreShuffle_80x128E,265.59,228.49,0.0
80,800,7168,7168,asm,24,1,298.2101,_ZN5aiter42fp8gemm_bf16_blockscale_BpreShuffle_80x128E,275.67,229.98,0.0
80,832,7168,7168,ck,14,3,338.9283,a8w8_blockscale_bpreshuffle_1x128x128_256x64x128x128_16x16_16x16_8x32x1_8x32x1_1x32x1x8_8_2x1_intrawave_v1,252.26,204.38,0.0
80,864,7168,7168,asm,40,1,320.936,_ZN5aiter43fp8gemm_bf16_blockscale_BpreShuffle_128x128E,276.64,217.99,0.0
80,896,7168,7168,ck,14,3,341.7041,a8w8_blockscale_bpreshuffle_1x128x128_256x64x128x128_16x16_16x16_8x32x1_8x32x1_1x32x1x8_8_2x1_intrawave_v1,269.45,206.75,0.0
80,928,7168,7168,asm,32,1,349.473,_ZN5aiter42fp8gemm_bf16_blockscale_BpreShuffle_96x128E,272.87,204.12,0.0
80,960,7168,7168,asm,32,1,350.1286,_ZN5aiter42fp8gemm_bf16_blockscale_BpreShuffle_96x128E,281.75,205.71,0.0
80,992,7168,7168,asm,40,1,384.2042,_ZN5aiter43fp8gemm_bf16_blockscale_BpreShuffle_128x128E,265.32,189.25,0.0
80,1024,7168,7168,asm,40,1,383.057,_ZN5aiter43fp8gemm_bf16_blockscale_BpreShuffle_128x128E,274.7,191.62,0.0
80,1088,7168,7168,ck,13,0,408.2497,a8w8_blockscale_bpreshuffle_1x128x128_256x64x256x128_16x16_16x16_8x32x1_8x32x1_1x32x1x8_8_2x1_intrawave_v1,273.86,183.16,0.0
80,1152,7168,7168,ck,14,0,436.6943,a8w8_blockscale_bpreshuffle_1x128x128_256x64x128x128_16x16_16x16_8x32x1_8x32x1_1x32x1x8_8_2x1_intrawave_v1,271.08,174.38,0.0
80,1216,7168,7168,asm,40,1,447.2244,_ZN5aiter43fp8gemm_bf16_blockscale_BpreShuffle_128x128E,279.4,173.36,0.0
80,1280,7168,7168,ck,13,1,471.1197,a8w8_blockscale_bpreshuffle_1x128x128_256x64x256x128_16x16_16x16_8x32x1_8x32x1_1x32x1x8_8_2x1_intrawave_v1,279.19,167.48,0.0
80,1344,7168,7168,asm,32,1,495.3409,_ZN5aiter42fp8gemm_bf16_blockscale_BpreShuffle_96x128E,278.82,162.07,0.0
80,1408,7168,7168,asm,40,1,510.859,_ZN5aiter43fp8gemm_bf16_blockscale_BpreShuffle_128x128E,283.22,159.84,0.0
80,1472,7168,7168,ck,14,0,564.657,a8w8_blockscale_bpreshuffle_1x128x128_256x64x128x128_16x16_16x16_8x32x1_8x32x1_1x32x1x8_8_2x1_intrawave_v1,267.89,147.05,0.0
80,1536,7168,7168,ck,14,0,565.9818,a8w8_blockscale_bpreshuffle_1x128x128_256x64x128x128_16x16_16x16_8x32x1_8x32x1_1x32x1x8_8_2x1_intrawave_v1,278.88,149.14,0.0
80,1600,7168,7168,asm,24,1,591.6719,_ZN5aiter42fp8gemm_bf16_blockscale_BpreShuffle_80x128E,277.88,144.99,0.0
80,1664,7168,7168,asm,24,1,632.343,_ZN5aiter42fp8gemm_bf16_blockscale_BpreShuffle_80x128E,270.41,137.84,0.0
80,1728,7168,7168,ck,14,0,631.675,a8w8_blockscale_bpreshuffle_1x128x128_256x64x128x128_16x16_16x16_8x32x1_8x32x1_1x32x1x8_8_2x1_intrawave_v1,281.11,140.17,0.0
80,1792,7168,7168,ck,13,0,663.1001,a8w8_blockscale_bpreshuffle_1x128x128_256x64x256x128_16x16_16x16_8x32x1_8x32x1_1x32x1x8_8_2x1_intrawave_v1,277.71,135.6,0.0
80,1856,7168,7168,asm,32,1,692.8565,_ZN5aiter42fp8gemm_bf16_blockscale_BpreShuffle_96x128E,275.27,131.76,0.0
80,1920,7168,7168,asm,32,1,693.704,_ZN5aiter42fp8gemm_bf16_blockscale_BpreShuffle_96x128E,284.42,133.58,0.0
80,1984,7168,7168,ck,14,0,736.6302,a8w8_blockscale_bpreshuffle_1x128x128_256x64x128x128_16x16_16x16_8x32x1_8x32x1_1x32x1x8_8_2x1_intrawave_v1,276.77,127.67,0.0
80,2048,7168,7168,ck,14,2,757.9474,a8w8_blockscale_bpreshuffle_1x128x128_256x64x128x128_16x16_16x16_8x32x1_8x32x1_1x32x1x8_8_2x1_intrawave_v1,277.66,125.89,0.0
80,4096,7168,7168,asm,40,1,1468.8506,_ZN5aiter43fp8gemm_bf16_blockscale_BpreShuffle_128x128E,286.56,94.95,0.0
80,6144,7168,7168,asm,40,1,2164.2124,_ZN5aiter43fp8gemm_bf16_blockscale_BpreShuffle_128x128E,291.73,84.79,0.0
80,8120,7168,7168,asm,40,1,2855.2666,_ZN5aiter43fp8gemm_bf16_blockscale_BpreShuffle_128x128E,292.24,79.15,0.0
80,8192,7168,7168,asm,40,1,2875.008,_ZN5aiter43fp8gemm_bf16_blockscale_BpreShuffle_128x128E,292.8,79.14,0.0
80,10240,7168,7168,asm,40,1,3555.4182,_ZN5aiter43fp8gemm_bf16_blockscale_BpreShuffle_128x128E,295.96,76.39,0.0
80,12288,7168,7168,asm,40,1,4314.1997,_ZN5aiter43fp8gemm_bf16_blockscale_BpreShuffle_128x128E,292.69,73.16,0.0
80,14336,7168,7168,asm,40,1,5012.6749,_ZN5aiter43fp8gemm_bf16_blockscale_BpreShuffle_128x128E,293.89,71.75,0.0
80,16384,7168,7168,asm,40,1,5708.7567,_ZN5aiter43fp8gemm_bf16_blockscale_BpreShuffle_128x128E,294.92,70.72,0.0
80,32768,7168,7168,asm,40,1,11443.2052,_ZN5aiter43fp8gemm_bf16_blockscale_BpreShuffle_128x128E,294.26,66.07,0.0
80,16,8192,7168,ck,6,2,23.9162,a8w8_blockscale_bpreshuffle_1x128x128_256x16x128x256_16x16_16x16_16x16x1_16x16x1_1x16x1x16_8_1x2_intrawave_v1,78.57,2471.01,0.0
80,32,8192,7168,asm,8,1,32.0308,_ZN5aiter42fp8gemm_bf16_blockscale_BpreShuffle_48x128E,117.33,1856.77,0.0
80,48,8192,7168,asm,8,1,41.0805,_ZN5aiter42fp8gemm_bf16_blockscale_BpreShuffle_48x128E,137.22,1456.91,0.0
80,64,8192,7168,asm,16,1,39.7457,_ZN5aiter42fp8gemm_bf16_blockscale_BpreShuffle_64x128E,189.11,1515.32,0.0
80,80,8192,7168,asm,32,1,51.4959,_ZN5aiter42fp8gemm_bf16_blockscale_BpreShuffle_96x128E,182.45,1176.88,0.0
80,96,8192,7168,asm,33,2,58.9983,_ZN5aiter42fp8gemm_bf16_blockscale_BpreShuffle_96x128E,191.1,1033.61,0.0
80,112,8192,7168,asm,40,1,73.5075,_ZN5aiter43fp8gemm_bf16_blockscale_BpreShuffle_128x128E,178.94,834.72,0.0
80,128,8192,7168,asm,40,1,66.7202,_ZN5aiter43fp8gemm_bf16_blockscale_BpreShuffle_128x128E,225.3,925.28,0.0
80,144,8192,7168,asm,9,2,86.4107,_ZN5aiter42fp8gemm_bf16_blockscale_BpreShuffle_48x128E,195.71,718.8,0.0
80,160,8192,7168,ck,8,3,85.2943,a8w8_blockscale_bpreshuffle_1x128x128_256x32x256x128_16x16_16x16_8x32x1_8x32x1_1x32x1x8_8_2x1_intrawave_v1,220.3,732.62,0.0
80,176,8192,7168,asm,32,1,100.369,_ZN5aiter42fp8gemm_bf16_blockscale_BpreShuffle_96x128E,205.94,626.34,0.0
80,192,8192,7168,asm,32,1,101.5487,_ZN5aiter42fp8gemm_bf16_blockscale_BpreShuffle_96x128E,222.05,622.78,0.0
80,208,8192,7168,asm,8,1,117.6305,_ZN5aiter42fp8gemm_bf16_blockscale_BpreShuffle_48x128E,207.66,540.84,0.0
80,224,8192,7168,ck,8,1,125.7953,a8w8_blockscale_bpreshuffle_1x128x128_256x32x256x128_16x16_16x16_8x32x1_8x32x1_1x32x1x8_8_2x1_intrawave_v1,209.12,508.73,0.0
80,240,8192,7168,asm,25,2,126.1215,_ZN5aiter42fp8gemm_bf16_blockscale_BpreShuffle_80x128E,223.48,510.4,0.0
80,256,8192,7168,asm,42,3,136.7336,_ZN5aiter43fp8gemm_bf16_blockscale_BpreShuffle_128x128E,219.88,473.55,0.0004
80,288,8192,7168,asm,33,2,146.211,_ZN5aiter42fp8gemm_bf16_blockscale_BpreShuffle_96x128E,231.33,448.0,0.0
80,320,8192,7168,asm,16,1,144.7888,_ZN5aiter42fp8gemm_bf16_blockscale_BpreShuffle_64x128E,259.56,457.61,0.0
80,352,8192,7168,ck,14,2,183.3292,a8w8_blockscale_bpreshuffle_1x128x128_256x64x128x128_16x16_16x16_8x32x1_8x32x1_1x32x1x8_8_2x1_intrawave_v1,225.49,365.52,0.0
80,384,8192,7168,ck,14,1,179.3146,a8w8_blockscale_bpreshuffle_1x128x128_256x64x128x128_16x16_16x16_8x32x1_8x32x1_1x32x1x8_8_2x1_intrawave_v1,251.5,377.91,0.0
80,416,8192,7168,ck,14,3,215.5589,a8w8_blockscale_bpreshuffle_1x128x128_256x64x128x128_16x16_16x16_8x32x1_8x32x1_1x32x1x8_8_2x1_intrawave_v1,226.64,317.86,0.0
80,448,8192,7168,asm,32,1,200.6137,_ZN5aiter42fp8gemm_bf16_blockscale_BpreShuffle_96x128E,262.26,345.3,0.0
80,480,8192,7168,ck,8,0,237.8333,a8w8_blockscale_bpreshuffle_1x128x128_256x32x256x128_16x16_16x16_8x32x1_8x32x1_1x32x1x8_8_2x1_intrawave_v1,237.02,294.43,0.0
80,512,8192,7168,ck,14,0,242.4133,a8w8_blockscale_bpreshuffle_1x128x128_256x64x128x128_16x16_16x16_8x32x1_8x32x1_1x32x1x8_8_2x1_intrawave_v1,248.05,291.98,0.0
80,544,8192,7168,asm,40,1,256.7801,_ZN5aiter43fp8gemm_bf16_blockscale_BpreShuffle_128x128E,248.8,278.58,0.0
80,576,8192,7168,asm,32,1,250.1093,_ZN5aiter42fp8gemm_bf16_blockscale_BpreShuffle_96x128E,270.46,289.02,0.0
80,608,8192,7168,ck,14,3,288.3311,a8w8_blockscale_bpreshuffle_1x128x128_256x64x128x128_16x16_16x16_8x32x1_8x32x1_1x32x1x8_8_2x1_intrawave_v1,247.65,253.32,0.0
80,640,8192,7168,asm,40,1,257.6048,_ZN5aiter43fp8gemm_bf16_blockscale_BpreShuffle_128x128E,291.77,286.46,0.0
80,672,8192,7168,asm,32,1,298.1733,_ZN5aiter42fp8gemm_bf16_blockscale_BpreShuffle_96x128E,264.68,250.01,0.0
80,704,8192,7168,ck,14,1,309.7916,a8w8_blockscale_bpreshuffle_1x128x128_256x64x128x128_16x16_16x16_8x32x1_8x32x1_1x32x1x8_8_2x1_intrawave_v1,266.88,243.07,0.0
80,736,8192,7168,asm,40,1,319.1321,_ZN5aiter43fp8gemm_bf16_blockscale_BpreShuffle_128x128E,270.85,238.32,0.0
80,768,8192,7168,asm,40,1,320.9167,_ZN5aiter43fp8gemm_bf16_blockscale_BpreShuffle_128x128E,281.05,239.34,0.0
80,800,8192,7168,ck,9,1,385.7492,a8w8_blockscale_bpreshuffle_1x128x128_256x32x128x128_16x16_16x16_8x32x1_8x32x1_1x32x1x8_8_2x1_intrawave_v1,243.56,201.07,0.0
80,832,8192,7168,ck,14,3,372.5136,a8w8_blockscale_bpreshuffle_1x128x128_256x64x128x128_16x16_16x16_8x32x1_8x32x1_1x32x1x8_8_2x1_intrawave_v1,262.3,210.24,0.0
80,864,8192,7168,ck,14,2,417.8184,a8w8_blockscale_bpreshuffle_1x128x128_256x64x128x128_16x16_16x16_8x32x1_8x32x1_1x32x1x8_8_2x1_intrawave_v1,242.85,189.24,0.0
80,896,8192,7168,asm,40,1,385.3427,_ZN5aiter43fp8gemm_bf16_blockscale_BpreShuffle_128x128E,273.07,207.15,0.0
80,928,8192,7168,asm,32,1,396.8531,_ZN5aiter42fp8gemm_bf16_blockscale_BpreShuffle_96x128E,274.62,203.04,0.0
80,960,8192,7168,asm,32,1,398.1946,_ZN5aiter42fp8gemm_bf16_blockscale_BpreShuffle_96x128E,283.14,204.25,0.0
80,992,8192,7168,ck,14,3,450.7,a8w8_blockscale_bpreshuffle_1x128x128_256x64x128x128_16x16_16x16_8x32x1_8x32x1_1x32x1x8_8_2x1_intrawave_v1,258.49,182.13,0.0
80,1024,8192,7168,ck,14,0,438.4654,a8w8_blockscale_bpreshuffle_1x128x128_256x64x128x128_16x16_16x16_8x32x1_8x32x1_1x32x1x8_8_2x1_intrawave_v1,274.27,188.93,0.0
80,1088,8192,7168,ck,14,1,473.2636,a8w8_blockscale_bpreshuffle_1x128x128_256x64x128x128_16x16_16x16_8x32x1_8x32x1_1x32x1x8_8_2x1_intrawave_v1,269.99,178.22,0.0
80,1152,8192,7168,asm,32,1,496.9282,_ZN5aiter42fp8gemm_bf16_blockscale_BpreShuffle_96x128E,272.26,172.77,0.0
80,1216,8192,7168,asm,40,1,513.4095,_ZN5aiter43fp8gemm_bf16_blockscale_BpreShuffle_128x128E,278.16,170.16,0.0
80,1280,8192,7168,ck,14,0,535.0073,a8w8_blockscale_bpreshuffle_1x128x128_256x64x128x128_16x16_16x16_8x32x1_8x32x1_1x32x1x8_8_2x1_intrawave_v1,280.98,166.1,0.0
80,1344,8192,7168,ck,14,1,568.9306,a8w8_blockscale_bpreshuffle_1x128x128_256x64x128x128_16x16_16x16_8x32x1_8x32x1_1x32x1x8_8_2x1_intrawave_v1,277.43,158.85,0.0
80,1408,8192,7168,asm,32,1,594.6092,_ZN5aiter42fp8gemm_bf16_blockscale_BpreShuffle_96x128E,278.09,154.52,0.0
80,1472,8192,7168,asm,32,1,640.0313,_ZN5aiter42fp8gemm_bf16_blockscale_BpreShuffle_96x128E,270.1,145.91,0.0
80,1536,8192,7168,asm,32,1,641.8934,_ZN5aiter42fp8gemm_bf16_blockscale_BpreShuffle_96x128E,281.03,147.84,0.0
80,1600,8192,7168,ck,14,1,666.7882,a8w8_blockscale_bpreshuffle_1x128x128_256x64x128x128_16x16_16x16_8x32x1_8x32x1_1x32x1x8_8_2x1_intrawave_v1,281.81,144.58,0.0
80,1664,8192,7168,ck,14,2,696.7348,a8w8_blockscale_bpreshuffle_1x128x128_256x64x128x128_16x16_16x16_8x32x1_8x32x1_1x32x1x8_8_2x1_intrawave_v1,280.48,140.53,0.0
80,1728,8192,7168,ck,13,0,729.2998,a8w8_blockscale_bpreshuffle_1x128x128_256x64x256x128_16x16_16x16_8x32x1_8x32x1_1x32x1x8_8_2x1_intrawave_v1,278.26,136.32,0.0
80,1792,8192,7168,ck,14,3,764.6305,a8w8_blockscale_bpreshuffle_1x128x128_256x64x128x128_16x16_16x16_8x32x1_8x32x1_1x32x1x8_8_2x1_intrawave_v1,275.24,131.99,0.0
80,1856,8192,7168,ck,14,1,794.8892,a8w8_blockscale_bpreshuffle_1x128x128_256x64x128x128_16x16_16x16_8x32x1_8x32x1_1x32x1x8_8_2x1_intrawave_v1,274.21,128.86,0.0
80,1920,8192,7168,asm,40,1,764.4981,_ZN5aiter43fp8gemm_bf16_blockscale_BpreShuffle_128x128E,294.95,135.96,0.0
80,1984,8192,7168,ck,14,2,834.4814,a8w8_blockscale_bpreshuffle_1x128x128_256x64x128x128_16x16_16x16_8x32x1_8x32x1_1x32x1x8_8_2x1_intrawave_v1,279.22,126.36,0.0
80,2048,8192,7168,ck,14,3,855.2088,a8w8_blockscale_bpreshuffle_1x128x128_256x64x128x128_16x16_16x16_8x32x1_8x32x1_1x32x1x8_8_2x1_intrawave_v1,281.24,125.06,0.0
80,4096,8192,7168,ck,13,1,1706.6235,a8w8_blockscale_bpreshuffle_1x128x128_256x64x256x128_16x16_16x16_8x32x1_8x32x1_1x32x1x8_8_2x1_intrawave_v1,281.86,90.93,0.0
80,8192,8192,7168,ck,14,0,3349.4823,a8w8_blockscale_bpreshuffle_1x128x128_256x64x128x128_16x16_16x16_8x32x1_8x32x1_1x32x1x8_8_2x1_intrawave_v1,287.23,75.13,0.0
80,16384,8192,7168,ck,14,1,6677.3313,a8w8_blockscale_bpreshuffle_1x128x128_256x64x128x128_16x16_16x16_8x32x1_8x32x1_1x32x1x8_8_2x1_intrawave_v1,288.16,66.58,0.0
80,32768,8192,7168,asm,40,1,13023.9367,_ZN5aiter43fp8gemm_bf16_blockscale_BpreShuffle_128x128E,295.48,63.77,0.0
80,16,11264,7168,ck,5,0,38.1818,a8w8_blockscale_bpreshuffle_1x128x128_256x16x64x128_8x16_16x16_16x16x1_8x32x1_1x16x1x16_4_1x1_intrawave_v1,67.67,2127.07,0.0
80,32,11264,7168,ck,10,3,46.8788,a8w8_blockscale_bpreshuffle_1x128x128_256x32x64x128_16x16_16x16_8x32x1_8x32x1_1x32x1x8_8_2x1_intrawave_v1,110.23,1742.59,0.0
80,48,11264,7168,asm,10,3,55.1635,_ZN5aiter42fp8gemm_bf16_blockscale_BpreShuffle_48x128E,140.51,1489.5,0.0004
80,64,11264,7168,asm,18,3,64.9122,_ZN5aiter42fp8gemm_bf16_blockscale_BpreShuffle_64x128E,159.21,1273.12,0.0003
80,80,11264,7168,asm,27,4,77.0231,_ZN5aiter42fp8gemm_bf16_blockscale_BpreShuffle_80x128E,167.72,1079.11,0.0016
80,96,11264,7168,ck,8,3,86.2419,a8w8_blockscale_bpreshuffle_1x128x128_256x32x256x128_16x16_16x16_8x32x1_8x32x1_1x32x1x8_8_2x1_intrawave_v1,179.75,969.26,0.0
80,112,11264,7168,asm,16,1,107.5901,_ZN5aiter42fp8gemm_bf16_blockscale_BpreShuffle_64x128E,168.1,781.36,0.0
80,128,11264,7168,asm,17,2,105.1068,_ZN5aiter42fp8gemm_bf16_blockscale_BpreShuffle_64x128E,196.65,804.34,0.0
80,144,11264,7168,asm,8,1,121.9152,_ZN5aiter42fp8gemm_bf16_blockscale_BpreShuffle_48x128E,190.73,697.34,0.0
80,160,11264,7168,asm,25,2,125.6197,_ZN5aiter42fp8gemm_bf16_blockscale_BpreShuffle_80x128E,205.68,680.56,0.0
80,176,11264,7168,asm,16,1,143.5368,_ZN5aiter42fp8gemm_bf16_blockscale_BpreShuffle_64x128E,198.0,598.92,0.0
80,192,11264,7168,ck,13,0,144.0961,a8w8_blockscale_bpreshuffle_1x128x128_256x64x256x128_16x16_16x16_8x32x1_8x32x1_1x32x1x8_8_2x1_intrawave_v1,215.16,599.89,0.0
80,208,11264,7168,ck,8,1,166.2824,a8w8_blockscale_bpreshuffle_1x128x128_256x32x256x128_16x16_16x16_8x32x1_8x32x1_1x32x1x8_8_2x1_intrawave_v1,201.99,522.71,0.0
80,224,11264,7168,ck,8,2,162.7381,a8w8_blockscale_bpreshuffle_1x128x128_256x32x256x128_16x16_16x16_8x32x1_8x32x1_1x32x1x8_8_2x1_intrawave_v1,222.27,537.01,0.0
80,240,11264,7168,asm,16,1,178.1052,_ZN5aiter42fp8gemm_bf16_blockscale_BpreShuffle_64x128E,217.6,493.35,0.0
80,256,11264,7168,ck,14,1,177.4441,a8w8_blockscale_bpreshuffle_1x128x128_256x64x128x128_16x16_16x16_8x32x1_8x32x1_1x32x1x8_8_2x1_intrawave_v1,232.97,497.86,0.0
80,288,11264,7168,asm,32,1,200.3618,_ZN5aiter42fp8gemm_bf16_blockscale_BpreShuffle_96x128E,232.11,445.66,0.0
80,320,11264,7168,ck,14,2,213.2608,a8w8_blockscale_bpreshuffle_1x128x128_256x64x128x128_16x16_16x16_8x32x1_8x32x1_1x32x1x8_8_2x1_intrawave_v1,242.3,423.16,0.0
80,352,11264,7168,asm,32,1,248.7806,_ZN5aiter42fp8gemm_bf16_blockscale_BpreShuffle_96x128E,228.48,366.56,0.0
80,384,11264,7168,ck,14,2,246.2709,a8w8_blockscale_bpreshuffle_1x128x128_256x64x128x128_16x16_16x16_8x32x1_8x32x1_1x32x1x8_8_2x1_intrawave_v1,251.79,374.16,0.0
80,416,11264,7168,ck,14,1,285.2629,a8w8_blockscale_bpreshuffle_1x128x128_256x64x128x128_16x16_16x16_8x32x1_8x32x1_1x32x1x8_8_2x1_intrawave_v1,235.49,326.34,0.0
80,448,11264,7168,ck,14,0,277.5675,a8w8_blockscale_bpreshuffle_1x128x128_256x64x128x128_16x16_16x16_8x32x1_8x32x1_1x32x1x8_8_2x1_intrawave_v1,260.63,338.82,0.0
80,480,11264,7168,asm,32,1,299.7927,_ZN5aiter42fp8gemm_bf16_blockscale_BpreShuffle_96x128E,258.55,316.87,0.0
80,512,11264,7168,ck,14,2,314.3717,a8w8_blockscale_bpreshuffle_1x128x128_256x64x128x128_16x16_16x16_8x32x1_8x32x1_1x32x1x8_8_2x1_intrawave_v1,262.99,305.2,0.0
80,544,11264,7168,asm,24,1,341.3637,_ZN5aiter42fp8gemm_bf16_blockscale_BpreShuffle_80x128E,257.34,283.85,0.0
80,576,11264,7168,ck,14,3,344.7778,a8w8_blockscale_bpreshuffle_1x128x128_256x64x128x128_16x16_16x16_8x32x1_8x32x1_1x32x1x8_8_2x1_intrawave_v1,269.78,283.79,0.0
80,608,11264,7168,asm,24,1,381.7287,_ZN5aiter42fp8gemm_bf16_blockscale_BpreShuffle_80x128E,257.2,258.81,0.0
80,640,11264,7168,asm,24,1,385.1096,_ZN5aiter42fp8gemm_bf16_blockscale_BpreShuffle_80x128E,268.36,259.01,0.0
80,672,11264,7168,asm,24,1,425.8625,_ZN5aiter42fp8gemm_bf16_blockscale_BpreShuffle_80x128E,254.81,236.45,0.0
80,704,11264,7168,asm,24,1,426.5402,_ZN5aiter42fp8gemm_bf16_blockscale_BpreShuffle_80x128E,266.52,238.3,0.0
80,736,11264,7168,asm,24,1,467.5409,_ZN5aiter42fp8gemm_bf16_blockscale_BpreShuffle_80x128E,254.2,219.44,0.0
80,768,11264,7168,asm,40,1,449.0192,_ZN5aiter43fp8gemm_bf16_blockscale_BpreShuffle_128x128E,276.2,230.61,0.0
80,800,11264,7168,asm,40,1,507.3083,_ZN5aiter43fp8gemm_bf16_blockscale_BpreShuffle_128x128E,254.65,205.98,0.0
80,832,11264,7168,asm,32,1,498.4339,_ZN5aiter42fp8gemm_bf16_blockscale_BpreShuffle_96x128E,269.55,211.56,0.0
80,864,11264,7168,asm,40,1,513.1425,_ZN5aiter43fp8gemm_bf16_blockscale_BpreShuffle_128x128E,271.89,207.35,0.0
80,896,11264,7168,asm,40,1,513.3961,_ZN5aiter43fp8gemm_bf16_blockscale_BpreShuffle_128x128E,281.82,209.09,0.0
80,928,11264,7168,asm,32,1,548.9777,_ZN5aiter42fp8gemm_bf16_blockscale_BpreShuffle_96x128E,272.97,197.27,0.0
80,960,11264,7168,asm,32,1,548.9444,_ZN5aiter42fp8gemm_bf16_blockscale_BpreShuffle_96x128E,282.4,199.02,0.0
80,992,11264,7168,asm,40,1,575.8271,_ZN5aiter43fp8gemm_bf16_blockscale_BpreShuffle_128x128E,278.19,191.37,0.0
80,1024,11264,7168,asm,40,1,578.0348,_ZN5aiter43fp8gemm_bf16_blockscale_BpreShuffle_128x128E,286.07,192.29,0.0
80,1088,11264,7168,asm,40,1,640.7616,_ZN5aiter43fp8gemm_bf16_blockscale_BpreShuffle_128x128E,274.19,176.43,0.0
80,1152,11264,7168,asm,40,1,644.1453,_ZN5aiter43fp8gemm_bf16_blockscale_BpreShuffle_128x128E,288.79,178.45,0.0
80,1216,11264,7168,ck,14,0,701.7567,a8w8_blockscale_bpreshuffle_1x128x128_256x64x128x128_16x16_16x16_8x32x1_8x32x1_1x32x1x8_8_2x1_intrawave_v1,279.81,166.51,0.0
80,1280,11264,7168,asm,40,1,706.5111,_ZN5aiter43fp8gemm_bf16_blockscale_BpreShuffle_128x128E,292.56,168.08,0.0
80,1344,11264,7168,asm,32,1,789.0277,_ZN5aiter42fp8gemm_bf16_blockscale_BpreShuffle_96x128E,275.06,152.91,0.0
80,1408,11264,7168,asm,40,1,828.5124,_ZN5aiter43fp8gemm_bf16_blockscale_BpreShuffle_128x128E,274.43,147.92,0.0
80,1472,11264,7168,ck,14,0,858.1954,a8w8_blockscale_bpreshuffle_1x128x128_256x64x128x128_16x16_16x16_8x32x1_8x32x1_1x32x1x8_8_2x1_intrawave_v1,276.98,145.02,0.0
80,1536,11264,7168,asm,32,1,889.1411,_ZN5aiter42fp8gemm_bf16_blockscale_BpreShuffle_96x128E,278.96,142.11,0.0
80,1600,11264,7168,ck,13,2,924.2456,a8w8_blockscale_bpreshuffle_1x128x128_256x64x256x128_16x16_16x16_8x32x1_8x32x1_1x32x1x8_8_2x1_intrawave_v1,279.55,138.77,0.0
80,1664,11264,7168,asm,40,1,955.4787,_ZN5aiter43fp8gemm_bf16_blockscale_BpreShuffle_128x128E,281.22,136.22,0.0
80,1728,11264,7168,ck,13,0,988.7122,a8w8_blockscale_bpreshuffle_1x128x128_256x64x256x128_16x16_16x16_8x32x1_8x32x1_1x32x1x8_8_2x1_intrawave_v1,282.22,133.56,0.0
80,1792,11264,7168,asm,40,1,1020.118,_ZN5aiter43fp8gemm_bf16_blockscale_BpreShuffle_128x128E,283.67,131.31,0.0
80,1856,11264,7168,ck,13,1,1057.273,a8w8_blockscale_bpreshuffle_1x128x128_256x64x256x128_16x16_16x16_8x32x1_8x32x1_1x32x1x8_8_2x1_intrawave_v1,283.47,128.5,0.0
80,1920,11264,7168,asm,40,1,1081.6593,_ZN5aiter43fp8gemm_bf16_blockscale_BpreShuffle_128x128E,286.64,127.36,0.0
80,1984,11264,7168,asm,40,1,1143.0595,_ZN5aiter43fp8gemm_bf16_blockscale_BpreShuffle_128x128E,280.28,122.18,0.0
80,2048,11264,7168,asm,40,1,1149.1991,_ZN5aiter43fp8gemm_bf16_blockscale_BpreShuffle_128x128E,287.78,123.18,0.0
80,4096,11264,7168,asm,40,1,2290.1988,_ZN5aiter43fp8gemm_bf16_blockscale_BpreShuffle_128x128E,288.81,88.37,0.0
80,8192,11264,7168,asm,40,1,4516.5285,_ZN5aiter43fp8gemm_bf16_blockscale_BpreShuffle_128x128E,292.89,71.74,0.0
80,16384,11264,7168,asm,40,1,8973.0138,_ZN5aiter43fp8gemm_bf16_blockscale_BpreShuffle_128x128E,294.85,63.22,0.0
80,32768,11264,7168,asm,40,1,17950.7803,_ZN5aiter43fp8gemm_bf16_blockscale_BpreShuffle_128x128E,294.77,58.71,0.0
80,1,36864,7168,ck,6,1,89.6419,a8w8_blockscale_bpreshuffle_1x128x128_256x16x128x256_16x16_16x16_16x16x1_16x16x1_1x16x1x16_8_1x2_intrawave_v1,5.9,2948.64,0.0
80,2,36864,7168,ck,6,0,90.1795,a8w8_blockscale_bpreshuffle_1x128x128_256x16x128x256_16x16_16x16_16x16x1_16x16x1_1x16x1x16_8_1x2_intrawave_v1,11.72,2931.96,0.0
80,4,36864,7168,ck,6,2,91.1123,a8w8_blockscale_bpreshuffle_1x128x128_256x16x128x256_16x16_16x16_16x16x1_16x16x1_1x16x1x16_8_1x2_intrawave_v1,23.2,2903.72,0.0
80,8,36864,7168,ck,3,0,93.7991,a8w8_blockscale_bpreshuffle_1x128x128_256x16x256x128_8x16_16x16_16x16x1_8x32x1_1x16x1x16_8_1x2_intrawave_v1,45.07,2824.0,0.0
80,16,36864,7168,ck,6,2,95.5539,a8w8_blockscale_bpreshuffle_1x128x128_256x16x128x256_16x16_16x16_16x16x1_16x16x1_1x16x1x16_8_1x2_intrawave_v1,88.49,2778.91,0.0
80,32,36864,7168,ck,8,0,108.2804,a8w8_blockscale_bpreshuffle_1x128x128_256x32x256x128_16x16_16x16_8x32x1_8x32x1_1x32x1x8_8_2x1_intrawave_v1,156.18,2464.25,0.0
80,64,36864,7168,ck,13,0,153.5646,a8w8_blockscale_bpreshuffle_1x128x128_256x64x256x128_16x16_16x16_8x32x1_8x32x1_1x32x1x8_8_2x1_intrawave_v1,220.25,1754.43,0.0
80,128,36864,7168,asm,40,1,259.7714,_ZN5aiter43fp8gemm_bf16_blockscale_BpreShuffle_128x128E,260.4,1057.07,0.0
80,256,36864,7168,ck,14,2,511.5262,a8w8_blockscale_bpreshuffle_1x128x128_256x64x128x128_16x16_16x16_8x32x1_8x32x1_1x32x1x8_8_2x1_intrawave_v1,264.49,557.06,0.0
80,512,36864,7168,ck,14,3,967.378,a8w8_blockscale_bpreshuffle_1x128x128_256x64x128x128_16x16_16x16_8x32x1_8x32x1_1x32x1x8_8_2x1_intrawave_v1,279.71,315.97,0.0
80,1024,36864,7168,ck,14,2,1900.8635,a8w8_blockscale_bpreshuffle_1x128x128_256x64x128x128_16x16_16x16_8x32x1_8x32x1_1x32x1x8_8_2x1_intrawave_v1,284.69,182.59,0.0
80,2048,36864,7168,ck,14,2,3766.2105,a8w8_blockscale_bpreshuffle_1x128x128_256x64x128x128_16x16_16x16_8x32x1_8x32x1_1x32x1x8_8_2x1_intrawave_v1,287.38,114.15,0.0
80,4096,36864,7168,ck,14,2,7492.5257,a8w8_blockscale_bpreshuffle_1x128x128_256x64x128x128_16x16_16x16_8x32x1_8x32x1_1x32x1x8_8_2x1_intrawave_v1,288.91,79.49,0.0
80,6144,36864,7168,ck,14,1,11215.0116,a8w8_blockscale_bpreshuffle_1x128x128_256x64x128x128_16x16_16x16_8x32x1_8x32x1_1x32x1x8_8_2x1_intrawave_v1,289.52,67.88,0.0
80,8120,36864,7168,asm,40,1,14662.1209,_ZN5aiter43fp8gemm_bf16_blockscale_BpreShuffle_128x128E,292.68,62.82,0.0
80,10240,36864,7168,ck,14,3,18660.9695,a8w8_blockscale_bpreshuffle_1x128x128_256x64x128x128_16x16_16x16_8x32x1_8x32x1_1x32x1x8_8_2x1_intrawave_v1,290.0,58.55,0.0
80,12288,36864,7168,ck,14,2,22389.3392,a8w8_blockscale_bpreshuffle_1x128x128_256x64x128x128_16x16_16x16_8x32x1_8x32x1_1x32x1x8_8_2x1_intrawave_v1,290.05,56.2,0.0
80,14336,36864,7168,asm,40,1,25813.8084,_ZN5aiter43fp8gemm_bf16_blockscale_BpreShuffle_128x128E,293.5,55.16,0.0
80,16384,36864,7168,asm,40,1,29352.5525,_ZN5aiter43fp8gemm_bf16_blockscale_BpreShuffle_128x128E,294.99,54.16,0.0
