aiter/configs/model_configs/a8w8_blockscale_bpreshuffle_tuned_gemm_dsv3.csv
cu_num,M,N,K,libtype,kernelId,splitK,us,kernelName,tflops,bw,errRatio
256,16,128,7168,ck,7,0,11.505,a8w8_blockscale_bpreshuffle_1x128x128_256x16x64x256_16x16_16x16_16x16x1_16x16x1_1x16x1x16_4_1x1_intrawave_v1,2.55,90.07,0.0
256,32,128,7168,ck,7,0,11.8878,a8w8_blockscale_bpreshuffle_1x128x128_256x16x64x256_16x16_16x16_16x16x1_16x16x1_1x16x1x16_4_1x1_intrawave_v1,4.94,97.16,0.0
256,48,128,7168,ck,7,0,11.9924,a8w8_blockscale_bpreshuffle_1x128x128_256x16x64x256_16x16_16x16_16x16x1_16x16x1_1x16x1x16_4_1x1_intrawave_v1,7.34,106.22,0.0
256,64,128,7168,ck,7,0,12.0692,a8w8_blockscale_bpreshuffle_1x128x128_256x16x64x256_16x16_16x16_16x16x1_16x16x1_1x16x1x16_4_1x1_intrawave_v1,9.73,115.39,0.0
256,80,128,7168,ck,7,0,12.0562,a8w8_blockscale_bpreshuffle_1x128x128_256x16x64x256_16x16_16x16_16x16x1_16x16x1_1x16x1x16_4_1x1_intrawave_v1,12.18,125.36,0.0
256,96,128,7168,ck,7,0,12.0555,a8w8_blockscale_bpreshuffle_1x128x128_256x16x64x256_16x16_16x16_16x16x1_16x16x1_1x16x1x16_4_1x1_intrawave_v1,14.61,135.23,0.0
256,112,128,7168,ck,7,0,12.0848,a8w8_blockscale_bpreshuffle_1x128x128_256x16x64x256_16x16_16x16_16x16x1_16x16x1_1x16x1x16_4_1x1_intrawave_v1,17.01,144.73,0.0
256,128,128,7168,ck,7,0,12.0382,a8w8_blockscale_bpreshuffle_1x128x128_256x16x64x256_16x16_16x16_16x16x1_16x16x1_1x16x1x16_4_1x1_intrawave_v1,19.51,155.15,0.0
256,144,128,7168,ck,7,0,12.0917,a8w8_blockscale_bpreshuffle_1x128x128_256x16x64x256_16x16_16x16_16x16x1_16x16x1_1x16x1x16_4_1x1_intrawave_v1,21.85,164.29,0.0
256,160,128,7168,ck,7,0,13.0587,a8w8_blockscale_bpreshuffle_1x128x128_256x16x64x256_16x16_16x16_16x16x1_16x16x1_1x16x1x16_4_1x1_intrawave_v1,22.48,161.22,0.0
256,176,128,7168,ck,7,0,12.158,a8w8_blockscale_bpreshuffle_1x128x128_256x16x64x256_16x16_16x16_16x16x1_16x16x1_1x16x1x16_4_1x1_intrawave_v1,26.56,182.94,0.0
256,192,128,7168,ck,7,0,14.8475,a8w8_blockscale_bpreshuffle_1x128x128_256x16x64x256_16x16_16x16_16x16x1_16x16x1_1x16x1x16_4_1x1_intrawave_v1,23.73,157.8,0.0
256,208,128,7168,ck,7,0,14.4723,a8w8_blockscale_bpreshuffle_1x128x128_256x16x64x256_16x16_16x16_16x16x1_16x16x1_1x16x1x16_4_1x1_intrawave_v1,26.37,170.1,0.0
256,224,128,7168,ck,7,0,14.8871,a8w8_blockscale_bpreshuffle_1x128x128_256x16x64x256_16x16_16x16_16x16x1_16x16x1_1x16x1x16_4_1x1_intrawave_v1,27.61,173.34,0.0
256,240,128,7168,ck,7,0,15.2099,a8w8_blockscale_bpreshuffle_1x128x128_256x16x64x256_16x16_16x16_16x16x1_16x16x1_1x16x1x16_4_1x1_intrawave_v1,28.95,177.47,0.0
256,256,128,7168,ck,7,0,15.0707,a8w8_blockscale_bpreshuffle_1x128x128_256x16x64x256_16x16_16x16_16x16x1_16x16x1_1x16x1x16_4_1x1_intrawave_v1,31.17,186.99,0.0
256,288,128,7168,ck,7,0,16.2614,a8w8_blockscale_bpreshuffle_1x128x128_256x16x64x256_16x16_16x16_16x16x1_16x16x1_1x16x1x16_4_1x1_intrawave_v1,32.5,187.91,0.0
256,320,128,7168,ck,7,0,16.8078,a8w8_blockscale_bpreshuffle_1x128x128_256x16x64x256_16x16_16x16_16x16x1_16x16x1_1x16x1x16_4_1x1_intrawave_v1,34.94,195.93,0.0
256,352,128,7168,ck,7,0,17.0878,a8w8_blockscale_bpreshuffle_1x128x128_256x16x64x256_16x16_16x16_16x16x1_16x16x1_1x16x1x16_4_1x1_intrawave_v1,37.8,206.62,0.0
256,384,128,7168,ck,7,0,17.2622,a8w8_blockscale_bpreshuffle_1x128x128_256x16x64x256_16x16_16x16_16x16x1_16x16x1_1x16x1x16_4_1x1_intrawave_v1,40.82,218.3,0.0
256,416,128,7168,ck,7,0,17.4125,a8w8_blockscale_bpreshuffle_1x128x128_256x16x64x256_16x16_16x16_16x16x1_16x16x1_1x16x1x16_4_1x1_intrawave_v1,43.84,230.06,0.0
256,448,128,7168,ck,7,0,17.3859,a8w8_blockscale_bpreshuffle_1x128x128_256x16x64x256_16x16_16x16_16x16x1_16x16x1_1x16x1x16_4_1x1_intrawave_v1,47.28,244.07,0.0
256,480,128,7168,ck,7,0,17.4979,a8w8_blockscale_bpreshuffle_1x128x128_256x16x64x256_16x16_16x16_16x16x1_16x16x1_1x16x1x16_4_1x1_intrawave_v1,50.34,256.09,0.0
256,512,128,7168,ck,7,0,17.413,a8w8_blockscale_bpreshuffle_1x128x128_256x16x64x256_16x16_16x16_16x16x1_16x16x1_1x16x1x16_4_1x1_intrawave_v1,53.96,270.98,0.0
256,544,128,7168,ck,7,0,17.5851,a8w8_blockscale_bpreshuffle_1x128x128_256x16x64x256_16x16_16x16_16x16x1_16x16x1_1x16x1x16_4_1x1_intrawave_v1,56.77,281.84,0.0
256,576,128,7168,ck,7,0,17.5028,a8w8_blockscale_bpreshuffle_1x128x128_256x16x64x256_16x16_16x16_16x16x1_16x16x1_1x16x1x16_4_1x1_intrawave_v1,60.39,296.74,0.0
256,608,128,7168,ck,7,0,17.5467,a8w8_blockscale_bpreshuffle_1x128x128_256x16x64x256_16x16_16x16_16x16x1_16x16x1_1x16x1x16_4_1x1_intrawave_v1,63.58,309.53,0.0
256,640,128,7168,ck,7,0,17.6052,a8w8_blockscale_bpreshuffle_1x128x128_256x16x64x256_16x16_16x16_16x16x1_16x16x1_1x16x1x16_4_1x1_intrawave_v1,66.71,322.0,0.0
256,672,128,7168,ck,7,0,17.6787,a8w8_blockscale_bpreshuffle_1x128x128_256x16x64x256_16x16_16x16_16x16x1_16x16x1_1x16x1x16_4_1x1_intrawave_v1,69.75,334.1,0.0
256,704,128,7168,ck,7,0,17.6803,a8w8_blockscale_bpreshuffle_1x128x128_256x16x64x256_16x16_16x16_16x16x1_16x16x1_1x16x1x16_4_1x1_intrawave_v1,73.07,347.51,0.0
256,736,128,7168,ck,7,0,17.6407,a8w8_blockscale_bpreshuffle_1x128x128_256x16x64x256_16x16_16x16_16x16x1_16x16x1_1x16x1x16_4_1x1_intrawave_v1,76.56,361.75,0.0
256,768,128,7168,ck,7,0,17.7411,a8w8_blockscale_bpreshuffle_1x128x128_256x16x64x256_16x16_16x16_16x16x1_16x16x1_1x16x1x16_4_1x1_intrawave_v1,79.44,373.1,0.0
256,800,128,7168,ck,7,0,17.6551,a8w8_blockscale_bpreshuffle_1x128x128_256x16x64x256_16x16_16x16_16x16x1_16x16x1_1x16x1x16_4_1x1_intrawave_v1,83.15,388.37,0.0
256,832,128,7168,ck,7,0,17.7847,a8w8_blockscale_bpreshuffle_1x128x128_256x16x64x256_16x16_16x16_16x16x1_16x16x1_1x16x1x16_4_1x1_intrawave_v1,85.84,398.9,0.0
256,864,128,7168,ck,7,0,17.7817,a8w8_blockscale_bpreshuffle_1x128x128_256x16x64x256_16x16_16x16_16x16x1_16x16x1_1x16x1x16_4_1x1_intrawave_v1,89.16,412.33,0.0
256,896,128,7168,ck,7,0,17.7943,a8w8_blockscale_bpreshuffle_1x128x128_256x16x64x256_16x16_16x16_16x16x1_16x16x1_1x16x1x16_4_1x1_intrawave_v1,92.4,425.38,0.0
256,928,128,7168,ck,7,0,17.6423,a8w8_blockscale_bpreshuffle_1x128x128_256x16x64x256_16x16_16x16_16x16x1_16x16x1_1x16x1x16_4_1x1_intrawave_v1,96.52,442.51,0.0
256,960,128,7168,ck,7,0,17.7311,a8w8_blockscale_bpreshuffle_1x128x128_256x16x64x256_16x16_16x16_16x16x1_16x16x1_1x16x1x16_4_1x1_intrawave_v1,99.35,453.7,0.0
256,992,128,7168,ck,7,0,17.7467,a8w8_blockscale_bpreshuffle_1x128x128_256x16x64x256_16x16_16x16_16x16x1_16x16x1_1x16x1x16_4_1x1_intrawave_v1,102.57,466.68,0.0
256,1024,128,7168,ck,7,0,17.6107,a8w8_blockscale_bpreshuffle_1x128x128_256x16x64x256_16x16_16x16_16x16x1_16x16x1_1x16x1x16_4_1x1_intrawave_v1,106.7,483.78,0.0
256,1088,128,7168,ck,7,0,17.7895,a8w8_blockscale_bpreshuffle_1x128x128_256x16x64x256_16x16_16x16_16x16x1_16x16x1_1x16x1x16_4_1x1_intrawave_v1,112.23,505.63,0.0
256,1152,128,7168,ck,7,0,17.7083,a8w8_blockscale_bpreshuffle_1x128x128_256x16x64x256_16x16_16x16_16x16x1_16x16x1_1x16x1x16_4_1x1_intrawave_v1,119.38,534.77,0.0
256,1216,128,7168,ck,7,0,17.6131,a8w8_blockscale_bpreshuffle_1x128x128_256x16x64x256_16x16_16x16_16x16x1_16x16x1_1x16x1x16_4_1x1_intrawave_v1,126.69,564.64,0.0
256,1280,128,7168,ck,7,0,17.8507,a8w8_blockscale_bpreshuffle_1x128x128_256x16x64x256_16x16_16x16_16x16x1_16x16x1_1x16x1x16_4_1x1_intrawave_v1,131.58,583.74,0.0
256,1344,128,7168,ck,7,0,17.392,a8w8_blockscale_bpreshuffle_1x128x128_256x16x64x256_16x16_16x16_16x16x1_16x16x1_1x16x1x16_4_1x1_intrawave_v1,141.8,626.46,0.0
256,1408,128,7168,ck,7,0,17.505,a8w8_blockscale_bpreshuffle_1x128x128_256x16x64x256_16x16_16x16_16x16x1_16x16x1_1x16x1x16_4_1x1_intrawave_v1,147.6,649.56,0.0
256,1472,128,7168,ck,7,0,17.6332,a8w8_blockscale_bpreshuffle_1x128x128_256x16x64x256_16x16_16x16_16x16x1_16x16x1_1x16x1x16_4_1x1_intrawave_v1,153.18,671.78,0.0
256,1536,128,7168,ck,7,0,17.1432,a8w8_blockscale_bpreshuffle_1x128x128_256x16x64x256_16x16_16x16_16x16x1_16x16x1_1x16x1x16_4_1x1_intrawave_v1,164.41,718.7,0.0
256,1600,128,7168,ck,7,0,17.3541,a8w8_blockscale_bpreshuffle_1x128x128_256x16x64x256_16x16_16x16_16x16x1_16x16x1_1x16x1x16_4_1x1_intrawave_v1,169.18,737.34,0.0
256,1664,128,7168,ck,7,0,17.2836,a8w8_blockscale_bpreshuffle_1x128x128_256x16x64x256_16x16_16x16_16x16x1_16x16x1_1x16x1x16_4_1x1_intrawave_v1,176.67,767.84,0.0
256,1728,128,7168,ck,7,0,17.1811,a8w8_blockscale_bpreshuffle_1x128x128_256x16x64x256_16x16_16x16_16x16x1_16x16x1_1x16x1x16_4_1x1_intrawave_v1,184.56,800.08,0.0
256,1792,128,7168,ck,7,0,17.2704,a8w8_blockscale_bpreshuffle_1x128x128_256x16x64x256_16x16_16x16_16x16x1_16x16x1_1x16x1x16_4_1x1_intrawave_v1,190.4,823.45,0.0
256,1856,128,7168,ck,7,0,17.2718,a8w8_blockscale_bpreshuffle_1x128x128_256x16x64x256_16x16_16x16_16x16x1_16x16x1_1x16x1x16_4_1x1_intrawave_v1,197.19,850.89,0.0
256,1920,128,7168,ck,7,0,17.2306,a8w8_blockscale_bpreshuffle_1x128x128_256x16x64x256_16x16_16x16_16x16x1_16x16x1_1x16x1x16_4_1x1_intrawave_v1,204.47,880.5,0.0
256,1984,128,7168,ck,7,0,17.2781,a8w8_blockscale_bpreshuffle_1x128x128_256x16x64x256_16x16_16x16_16x16x1_16x16x1_1x16x1x16_4_1x1_intrawave_v1,210.71,905.58,0.0
256,2048,128,7168,ck,7,0,17.362,a8w8_blockscale_bpreshuffle_1x128x128_256x16x64x256_16x16_16x16_16x16x1_16x16x1_1x16x1x16_4_1x1_intrawave_v1,216.46,928.57,0.0
256,4096,128,7168,ck,12,0,19.412,a8w8_blockscale_bpreshuffle_1x128x128_256x32x64x256_16x16_16x16_16x16x1_16x16x1_1x32x1x8_8_2x1_intrawave_v1,387.19,1613.75,0.0
256,8192,128,7168,ck,17,0,24.9429,a8w8_blockscale_bpreshuffle_1x128x128_256x64x64x256_16x16_16x16_16x16x1_16x16x1_1x32x1x8_8_2x1_intrawave_v1,602.67,2475.05,0.0
256,16384,128,7168,ck,14,0,43.7724,a8w8_blockscale_bpreshuffle_1x128x128_256x64x128x128_16x16_16x16_8x32x1_8x32x1_1x32x1x8_8_2x1_intrawave_v1,686.84,2799.76,0.0
256,32768,128,7168,ck,14,0,68.2729,a8w8_blockscale_bpreshuffle_1x128x128_256x64x128x128_16x16_16x16_8x32x1_8x32x1_1x32x1x8_8_2x1_intrawave_v1,880.72,3576.63,0.0
256,16,2112,7168,ck,7,0,18.0923,a8w8_blockscale_bpreshuffle_1x128x128_256x16x64x256_16x16_16x16_16x16x1_16x16x1_1x16x1x16_4_1x1_intrawave_v1,26.78,846.83,0.0
256,32,2112,7168,ck,7,0,17.9586,a8w8_blockscale_bpreshuffle_1x128x128_256x16x64x256_16x16_16x16_16x16x1_16x16x1_1x16x1x16_4_1x1_intrawave_v1,53.95,863.28,0.0
256,48,2112,7168,ck,7,0,17.914,a8w8_blockscale_bpreshuffle_1x128x128_256x16x64x256_16x16_16x16_16x16x1_16x16x1_1x16x1x16_4_1x1_intrawave_v1,81.13,875.61,0.0
256,64,2112,7168,ck,7,0,17.8234,a8w8_blockscale_bpreshuffle_1x128x128_256x16x64x256_16x16_16x16_16x16x1_16x16x1_1x16x1x16_4_1x1_intrawave_v1,108.72,890.28,0.0
256,80,2112,7168,ck,7,0,17.7596,a8w8_blockscale_bpreshuffle_1x128x128_256x16x64x256_16x16_16x16_16x16x1_16x16x1_1x16x1x16_4_1x1_intrawave_v1,136.39,903.75,0.0
256,96,2112,7168,ck,7,0,17.7404,a8w8_blockscale_bpreshuffle_1x128x128_256x16x64x256_16x16_16x16_16x16x1_16x16x1_1x16x1x16_4_1x1_intrawave_v1,163.84,915.0,0.0
256,112,2112,7168,ck,7,0,17.5551,a8w8_blockscale_bpreshuffle_1x128x128_256x16x64x256_16x16_16x16_16x16x1_16x16x1_1x16x1x16_4_1x1_intrawave_v1,193.17,935.04,0.0
256,128,2112,7168,ck,7,0,17.8441,a8w8_blockscale_bpreshuffle_1x128x128_256x16x64x256_16x16_16x16_16x16x1_16x16x1_1x16x1x16_4_1x1_intrawave_v1,217.19,930.11,0.0
256,144,2112,7168,ck,7,0,18.3719,a8w8_blockscale_bpreshuffle_1x128x128_256x16x64x256_16x16_16x16_16x16x1_16x16x1_1x16x1x16_4_1x1_intrawave_v1,237.32,913.31,0.0
256,160,2112,7168,ck,12,0,18.976,a8w8_blockscale_bpreshuffle_1x128x128_256x32x64x256_16x16_16x16_16x16x1_16x16x1_1x32x1x8_8_2x1_intrawave_v1,255.29,893.84,0.0
256,176,2112,7168,ck,7,0,20.2684,a8w8_blockscale_bpreshuffle_1x128x128_256x16x64x256_16x16_16x16_16x16x1_16x16x1_1x16x1x16_4_1x1_intrawave_v1,262.91,845.84,0.0
256,192,2112,7168,ck,12,0,19.0589,a8w8_blockscale_bpreshuffle_1x128x128_256x32x64x256_16x16_16x16_16x16x1_16x16x1_1x32x1x8_8_2x1_intrawave_v1,305.02,909.08,0.0
256,208,2112,7168,ck,7,0,20.7897,a8w8_blockscale_bpreshuffle_1x128x128_256x16x64x256_16x16_16x16_16x16x1_16x16x1_1x16x1x16_4_1x1_intrawave_v1,302.93,842.16,0.0
256,224,2112,7168,ck,12,0,19.0857,a8w8_blockscale_bpreshuffle_1x128x128_256x32x64x256_16x16_16x16_16x16x1_16x16x1_1x32x1x8_8_2x1_intrawave_v1,355.35,926.9,0.0
256,240,2112,7168,ck,7,0,21.3691,a8w8_blockscale_bpreshuffle_1x128x128_256x16x64x256_16x16_16x16_16x16x1_16x16x1_1x16x1x16_4_1x1_intrawave_v1,340.05,836.39,0.0
256,256,2112,7168,ck,12,0,21.0409,a8w8_blockscale_bpreshuffle_1x128x128_256x32x64x256_16x16_16x16_16x16x1_16x16x1_1x32x1x8_8_2x1_intrawave_v1,368.38,858.1,0.0
256,288,2112,7168,ck,12,0,21.3773,a8w8_blockscale_bpreshuffle_1x128x128_256x32x64x256_16x16_16x16_16x16x1_16x16x1_1x32x1x8_8_2x1_intrawave_v1,407.91,861.65,0.0
256,320,2112,7168,ck,17,0,22.6571,a8w8_blockscale_bpreshuffle_1x128x128_256x64x64x256_16x16_16x16_16x16x1_16x16x1_1x32x1x8_8_2x1_intrawave_v1,427.63,829.07,0.0
256,352,2112,7168,ck,12,0,24.7748,a8w8_blockscale_bpreshuffle_1x128x128_256x32x64x256_16x16_16x16_16x16x1_16x16x1_1x32x1x8_8_2x1_intrawave_v1,430.18,772.91,0.0
256,384,2112,7168,ck,17,0,22.7902,a8w8_blockscale_bpreshuffle_1x128x128_256x64x64x256_16x16_16x16_16x16x1_16x16x1_1x32x1x8_8_2x1_intrawave_v1,510.16,856.22,0.0
256,416,2112,7168,ck,12,0,26.1143,a8w8_blockscale_bpreshuffle_1x128x128_256x32x64x256_16x16_16x16_16x16x1_16x16x1_1x32x1x8_8_2x1_intrawave_v1,482.32,761.19,0.0
256,448,2112,7168,ck,17,0,23.663,a8w8_blockscale_bpreshuffle_1x128x128_256x64x64x256_16x16_16x16_16x16x1_16x16x1_1x32x1x8_8_2x1_intrawave_v1,573.23,855.45,0.0
256,480,2112,7168,ck,12,0,26.7744,a8w8_blockscale_bpreshuffle_1x128x128_256x32x64x256_16x16_16x16_16x16x1_16x16x1_1x32x1x8_8_2x1_intrawave_v1,542.8,769.65,0.0
256,512,2112,7168,ck,17,0,30.6787,a8w8_blockscale_bpreshuffle_1x128x128_256x64x64x256_16x16_16x16_16x16x1_16x16x1_1x32x1x8_8_2x1_intrawave_v1,505.31,683.59,0.0
256,544,2112,7168,ck,12,0,33.4143,a8w8_blockscale_bpreshuffle_1x128x128_256x32x64x256_16x16_16x16_16x16x1_16x16x1_1x32x1x8_8_2x1_intrawave_v1,492.93,638.53,0.0
256,576,2112,7168,ck,17,0,32.2392,a8w8_blockscale_bpreshuffle_1x128x128_256x64x64x256_16x16_16x16_16x16x1_16x16x1_1x32x1x8_8_2x1_intrawave_v1,540.95,673.11,0.0
256,608,2112,7168,ck,12,0,34.0988,a8w8_blockscale_bpreshuffle_1x128x128_256x32x64x256_16x16_16x16_16x16x1_16x16x1_1x32x1x8_8_2x1_intrawave_v1,539.87,647.09,0.0
256,640,2112,7168,ck,10,0,34.0117,a8w8_blockscale_bpreshuffle_1x128x128_256x32x64x128_16x16_16x16_8x32x1_8x32x1_1x32x1x8_8_2x1_intrawave_v1,569.74,659.47,0.0165
256,672,2112,7168,ck,12,0,35.4731,a8w8_blockscale_bpreshuffle_1x128x128_256x32x64x256_16x16_16x16_16x16x1_16x16x1_1x32x1x8_8_2x1_intrawave_v1,573.58,642.58,0.0
256,704,2112,7168,ck,17,0,34.7376,a8w8_blockscale_bpreshuffle_1x128x128_256x64x64x256_16x16_16x16_16x16x1_16x16x1_1x32x1x8_8_2x1_intrawave_v1,613.61,666.68,0.0
256,736,2112,7168,ck,12,0,36.6104,a8w8_blockscale_bpreshuffle_1x128x128_256x32x64x256_16x16_16x16_16x16x1_16x16x1_1x32x1x8_8_2x1_intrawave_v1,608.69,642.53,0.0
256,768,2112,7168,ck,17,0,34.1729,a8w8_blockscale_bpreshuffle_1x128x128_256x64x64x256_16x16_16x16_16x16x1_16x16x1_1x32x1x8_8_2x1_intrawave_v1,680.46,699.03,0.0
256,800,2112,7168,ck,10,0,43.392,a8w8_blockscale_bpreshuffle_1x128x128_256x32x64x128_16x16_16x16_8x32x1_8x32x1_1x32x1x8_8_2x1_intrawave_v1,558.22,558.91,0.0207
256,832,2112,7168,ck,17,0,36.202,a8w8_blockscale_bpreshuffle_1x128x128_256x64x64x256_16x16_16x16_16x16x1_16x16x1_1x32x1x8_8_2x1_intrawave_v1,695.85,679.99,0.0
256,864,2112,7168,ck,2,0,44.498,a8w8_blockscale_bpreshuffle_1x128x128_256x64x64x128_16x16_16x16_8x32x1_8x32x1_1x32x1x8_8_2x1_intrawave_v3,587.89,561.41,0.0046
256,896,2112,7168,ck,15,0,37.1716,a8w8_blockscale_bpreshuffle_1x128x128_256x64x64x128_16x16_16x16_8x32x1_8x32x1_1x32x1x8_8_2x1_intrawave_v1,729.82,681.87,0.0028
256,928,2112,7168,ck,2,0,46.2337,a8w8_blockscale_bpreshuffle_1x128x128_256x64x64x128_16x16_16x16_8x32x1_8x32x1_1x32x1x8_8_2x1_intrawave_v3,607.73,556.1,0.0052
256,960,2112,7168,ck,17,0,35.3362,a8w8_blockscale_bpreshuffle_1x128x128_256x64x64x256_16x16_16x16_16x16x1_16x16x1_1x32x1x8_8_2x1_intrawave_v1,822.57,737.92,0.0
256,992,2112,7168,ck,10,0,50.8693,a8w8_blockscale_bpreshuffle_1x128x128_256x32x64x128_16x16_16x16_8x32x1_8x32x1_1x32x1x8_8_2x1_intrawave_v1,590.44,519.76,0.0225
256,1024,2112,7168,ck,15,0,47.8732,a8w8_blockscale_bpreshuffle_1x128x128_256x64x64x128_16x16_16x16_8x32x1_8x32x1_1x32x1x8_8_2x1_intrawave_v1,647.63,559.9,0.0023
256,1088,2112,7168,ck,15,0,47.8725,a8w8_blockscale_bpreshuffle_1x128x128_256x64x64x128_16x16_16x16_8x32x1_8x32x1_1x32x1x8_8_2x1_intrawave_v1,688.12,575.14,0.0034
256,1152,2112,7168,ck,15,0,47.6801,a8w8_blockscale_bpreshuffle_1x128x128_256x64x64x128_16x16_16x16_8x32x1_8x32x1_1x32x1x8_8_2x1_intrawave_v1,731.54,592.75,0.0039
256,1216,2112,7168,ck,2,0,49.4197,a8w8_blockscale_bpreshuffle_1x128x128_256x64x64x128_16x16_16x16_8x32x1_8x32x1_1x32x1x8_8_2x1_intrawave_v3,745.0,586.64,0.0
256,1280,2112,7168,ck,15,0,50.8317,a8w8_blockscale_bpreshuffle_1x128x128_256x64x64x128_16x16_16x16_8x32x1_8x32x1_1x32x1x8_8_2x1_intrawave_v1,762.43,584.69,0.0048
256,1344,2112,7168,ck,15,0,53.6193,a8w8_blockscale_bpreshuffle_1x128x128_256x64x64x128_16x16_16x16_8x32x1_8x32x1_1x32x1x8_8_2x1_intrawave_v1,758.93,567.89,0.0055
256,1408,2112,7168,ck,15,0,55.7937,a8w8_blockscale_bpreshuffle_1x128x128_256x64x64x128_16x16_16x16_8x32x1_8x32x1_1x32x1x8_8_2x1_intrawave_v1,764.08,558.82,0.0058
256,1472,2112,7168,ck,2,0,56.8769,a8w8_blockscale_bpreshuffle_1x128x128_256x64x64x128_16x16_16x16_8x32x1_8x32x1_1x32x1x8_8_2x1_intrawave_v3,783.6,561.0,0.0
256,1536,2112,7168,ck,15,0,63.5361,a8w8_blockscale_bpreshuffle_1x128x128_256x64x64x128_16x16_16x16_8x32x1_8x32x1_1x32x1x8_8_2x1_intrawave_v1,731.97,513.68,0.0065
256,1600,2112,7168,ck,2,0,65.6426,a8w8_blockscale_bpreshuffle_1x128x128_256x64x64x128_16x16_16x16_8x32x1_8x32x1_1x32x1x8_8_2x1_intrawave_v3,738.0,508.3,0.0
256,1664,2112,7168,ck,15,0,68.077,a8w8_blockscale_bpreshuffle_1x128x128_256x64x64x128_16x16_16x16_8x32x1_8x32x1_1x32x1x8_8_2x1_intrawave_v1,740.07,500.83,0.0074
256,1728,2112,7168,ck,2,0,69.475,a8w8_blockscale_bpreshuffle_1x128x128_256x64x64x128_16x16_16x16_8x32x1_8x32x1_1x32x1x8_8_2x1_intrawave_v3,753.07,501.25,0.0
256,1792,2112,7168,ck,15,0,69.7706,a8w8_blockscale_bpreshuffle_1x128x128_256x64x64x128_16x16_16x16_8x32x1_8x32x1_1x32x1x8_8_2x1_intrawave_v1,777.66,509.57,0.0081
256,1856,2112,7168,cktile,10,0,70.9166,a8w8_blockscale_cktile_128x128x128_2x2x1_16x16x128_intrawave_0x1x0_2,792.41,511.62,0.0
256,1920,2112,7168,cktile,10,0,72.9688,a8w8_blockscale_cktile_128x128x128_2x2x1_16x16x128_intrawave_0x1x0_2,796.68,507.22,0.0
256,1984,2112,7168,ck,15,0,75.249,a8w8_blockscale_bpreshuffle_1x128x128_256x64x64x128_16x16_16x16_8x32x1_8x32x1_1x32x1x8_8_2x1_intrawave_v1,798.29,501.54,0.0085
256,2048,2112,7168,cktile,10,0,83.131,a8w8_blockscale_cktile_128x128x128_2x2x1_16x16x128_intrawave_0x1x0_2,745.91,462.76,0.0
256,4096,2112,7168,cktile,11,0,100.9519,a8w8_blockscale_cktile_192x256x128_4x2x1_16x16x128_intrawave_0x1x0_1,1228.48,612.18,0.0
256,8192,2112,7168,cktile,11,0,190.14,a8w8_blockscale_cktile_192x256x128_4x2x1_16x16x128_intrawave_0x1x0_1,1304.48,570.43,0.0
256,16384,2112,7168,cktile,11,0,333.2477,a8w8_blockscale_cktile_192x256x128_4x2x1_16x16x128_intrawave_0x1x0_1,1488.59,605.51,0.0
256,32768,2112,7168,cktile,11,0,621.4315,a8w8_blockscale_cktile_192x256x128_4x2x1_16x16x128_intrawave_0x1x0_1,1596.54,625.06,0.0
256,16,2240,7168,ck,7,0,18.0776,a8w8_blockscale_bpreshuffle_1x128x128_256x16x64x256_16x16_16x16_16x16x1_16x16x1_1x16x1x16_4_1x1_intrawave_v1,28.42,898.5,0.0
256,32,2240,7168,ck,7,0,17.9667,a8w8_blockscale_bpreshuffle_1x128x128_256x16x64x256_16x16_16x16_16x16x1_16x16x1_1x16x1x16_4_1x1_intrawave_v1,57.19,914.42,0.0
256,48,2240,7168,ck,7,0,17.9591,a8w8_blockscale_bpreshuffle_1x128x128_256x16x64x256_16x16_16x16_16x16x1_16x16x1_1x16x1x16_4_1x1_intrawave_v1,85.83,925.18,0.0
256,64,2240,7168,ck,7,0,17.7635,a8w8_blockscale_bpreshuffle_1x128x128_256x16x64x256_16x16_16x16_16x16x1_16x16x1_1x16x1x16_4_1x1_intrawave_v1,115.7,945.86,0.0
256,80,2240,7168,ck,7,0,17.9415,a8w8_blockscale_bpreshuffle_1x128x128_256x16x64x256_16x16_16x16_16x16x1_16x16x1_1x16x1x16_4_1x1_intrawave_v1,143.19,946.86,0.0
256,96,2240,7168,ck,7,0,17.5692,a8w8_blockscale_bpreshuffle_1x128x128_256x16x64x256_16x16_16x16_16x16x1_16x16x1_1x16x1x16_4_1x1_intrawave_v1,175.47,977.54,0.0
256,112,2240,7168,ck,7,0,17.6954,a8w8_blockscale_bpreshuffle_1x128x128_256x16x64x256_16x16_16x16_16x16x1_16x16x1_1x16x1x16_4_1x1_intrawave_v1,203.25,981.1,0.0
256,128,2240,7168,ck,12,0,19.0889,a8w8_blockscale_bpreshuffle_1x128x128_256x32x64x256_16x16_16x16_16x16x1_16x16x1_1x32x1x8_8_2x1_intrawave_v1,215.33,919.24,0.0
256,144,2240,7168,ck,7,0,18.2154,a8w8_blockscale_bpreshuffle_1x128x128_256x16x64x256_16x16_16x16_16x16x1_16x16x1_1x16x1x16_4_1x1_intrawave_v1,253.86,973.55,0.0
256,160,2240,7168,ck,12,0,19.1996,a8w8_blockscale_bpreshuffle_1x128x128_256x32x64x256_16x16_16x16_16x16x1_16x16x1_1x32x1x8_8_2x1_intrawave_v1,267.61,933.35,0.0
256,176,2240,7168,ck,7,0,20.3764,a8w8_blockscale_bpreshuffle_1x128x128_256x16x64x256_16x16_16x16_16x16x1_16x16x1_1x16x1x16_4_1x1_intrawave_v1,277.37,888.6,0.0
256,192,2240,7168,ck,12,0,19.1776,a8w8_blockscale_bpreshuffle_1x128x128_256x32x64x256_16x16_16x16_16x16x1_16x16x1_1x32x1x8_8_2x1_intrawave_v1,321.5,953.86,0.0
256,208,2240,7168,ck,7,0,20.7226,a8w8_blockscale_bpreshuffle_1x128x128_256x16x64x256_16x16_16x16_16x16x1_16x16x1_1x16x1x16_4_1x1_intrawave_v1,322.33,891.74,0.0
256,224,2240,7168,ck,12,0,19.1337,a8w8_blockscale_bpreshuffle_1x128x128_256x32x64x256_16x16_16x16_16x16x1_16x16x1_1x32x1x8_8_2x1_intrawave_v1,375.95,975.53,0.0
256,240,2240,7168,ck,12,0,24.9779,a8w8_blockscale_bpreshuffle_1x128x128_256x32x64x256_16x16_16x16_16x16x1_16x16x1_1x32x1x8_8_2x1_intrawave_v1,308.55,754.74,0.0
256,256,2240,7168,ck,17,0,22.4283,a8w8_blockscale_bpreshuffle_1x128x128_256x64x64x256_16x16_16x16_16x16x1_16x16x1_1x32x1x8_8_2x1_intrawave_v1,366.54,848.85,0.0
256,288,2240,7168,ck,12,0,21.3127,a8w8_blockscale_bpreshuffle_1x128x128_256x32x64x256_16x16_16x16_16x16x1_16x16x1_1x32x1x8_8_2x1_intrawave_v1,433.94,910.77,0.0
256,320,2240,7168,ck,17,0,22.5858,a8w8_blockscale_bpreshuffle_1x128x128_256x64x64x256_16x16_16x16_16x16x1_16x16x1_1x32x1x8_8_2x1_intrawave_v1,454.98,875.93,0.0
256,352,2240,7168,ck,12,0,25.3227,a8w8_blockscale_bpreshuffle_1x128x128_256x32x64x256_16x16_16x16_16x16x1_16x16x1_1x32x1x8_8_2x1_intrawave_v1,446.38,795.98,0.0
256,384,2240,7168,ck,17,0,23.1045,a8w8_blockscale_bpreshuffle_1x128x128_256x64x64x256_16x16_16x16_16x16x1_16x16x1_1x32x1x8_8_2x1_intrawave_v1,533.72,888.53,0.0
256,416,2240,7168,ck,12,0,25.7777,a8w8_blockscale_bpreshuffle_1x128x128_256x32x64x256_16x16_16x16_16x16x1_16x16x1_1x32x1x8_8_2x1_intrawave_v1,518.23,810.85,0.0
256,448,2240,7168,ck,17,0,23.9607,a8w8_blockscale_bpreshuffle_1x128x128_256x64x64x256_16x16_16x16_16x16x1_16x16x1_1x32x1x8_8_2x1_intrawave_v1,600.42,887.9,0.0
256,480,2240,7168,ck,10,0,32.2978,a8w8_blockscale_bpreshuffle_1x128x128_256x32x64x128_16x16_16x16_8x32x1_8x32x1_1x32x1x8_8_2x1_intrawave_v1,477.25,670.24,0.0175
256,512,2240,7168,ck,17,0,33.8023,a8w8_blockscale_bpreshuffle_1x128x128_256x64x64x256_16x16_16x16_16x16x1_16x16x1_1x32x1x8_8_2x1_intrawave_v1,486.41,651.44,0.0
256,544,2240,7168,ck,10,0,32.7061,a8w8_blockscale_bpreshuffle_1x128x128_256x32x64x128_16x16_16x16_8x32x1_8x32x1_1x32x1x8_8_2x1_intrawave_v1,534.13,684.67,0.0179
256,576,2240,7168,ck,17,0,33.124,a8w8_blockscale_bpreshuffle_1x128x128_256x64x64x256_16x16_16x16_16x16x1_16x16x1_1x32x1x8_8_2x1_intrawave_v1,558.41,687.28,0.0
256,608,2240,7168,ck,10,0,35.3848,a8w8_blockscale_bpreshuffle_1x128x128_256x32x64x128_16x16_16x16_8x32x1_8x32x1_1x32x1x8_8_2x1_intrawave_v1,551.78,653.91,0.0204
256,640,2240,7168,ck,17,0,34.1769,a8w8_blockscale_bpreshuffle_1x128x128_256x64x64x256_16x16_16x16_16x16x1_16x16x1_1x32x1x8_8_2x1_intrawave_v1,601.34,687.92,0.0
256,672,2240,7168,ck,10,0,37.4348,a8w8_blockscale_bpreshuffle_1x128x128_256x32x64x128_16x16_16x16_8x32x1_8x32x1_1x32x1x8_8_2x1_intrawave_v1,576.46,638.01,0.0216
256,704,2240,7168,ck,17,0,36.5408,a8w8_blockscale_bpreshuffle_1x128x128_256x64x64x256_16x16_16x16_16x16x1_16x16x1_1x32x1x8_8_2x1_intrawave_v1,618.69,663.82,0.0
256,736,2240,7168,ck,17,0,42.5132,a8w8_blockscale_bpreshuffle_1x128x128_256x64x64x256_16x16_16x16_16x16x1_16x16x1_1x32x1x8_8_2x1_intrawave_v1,555.94,579.33,0.0
256,768,2240,7168,ck,17,0,36.8168,a8w8_blockscale_bpreshuffle_1x128x128_256x64x64x256_16x16_16x16_16x16x1_16x16x1_1x32x1x8_8_2x1_intrawave_v1,669.87,679.09,0.0
256,800,2240,7168,ck,2,0,44.506,a8w8_blockscale_bpreshuffle_1x128x128_256x64x64x128_16x16_16x16_8x32x1_8x32x1_1x32x1x8_8_2x1_intrawave_v3,577.23,570.14,0.0043
256,832,2240,7168,ck,17,0,35.0303,a8w8_blockscale_bpreshuffle_1x128x128_256x64x64x256_16x16_16x16_16x16x1_16x16x1_1x32x1x8_8_2x1_intrawave_v1,762.7,735.01,0.0
256,864,2240,7168,ck,2,0,45.666,a8w8_blockscale_bpreshuffle_1x128x128_256x64x64x128_16x16_16x16_8x32x1_8x32x1_1x32x1x8_8_2x1_intrawave_v3,607.57,571.98,0.0051
256,896,2240,7168,ck,15,0,37.9328,a8w8_blockscale_bpreshuffle_1x128x128_256x64x64x128_16x16_16x16_8x32x1_8x32x1_1x32x1x8_8_2x1_intrawave_v1,758.52,698.42,0.0029
256,928,2240,7168,ck,10,0,49.7013,a8w8_blockscale_bpreshuffle_1x128x128_256x32x64x128_16x16_16x16_8x32x1_8x32x1_1x32x1x8_8_2x1_intrawave_v1,599.59,540.54,0.0207
256,960,2240,7168,ck,15,0,46.6607,a8w8_blockscale_bpreshuffle_1x128x128_256x64x64x128_16x16_16x16_8x32x1_8x32x1_1x32x1x8_8_2x1_intrawave_v1,660.69,583.75,0.0022
256,992,2240,7168,ck,2,0,54.9069,a8w8_blockscale_bpreshuffle_1x128x128_256x64x64x128_16x16_16x16_8x32x1_8x32x1_1x32x1x8_8_2x1_intrawave_v3,580.18,502.87,0.0059
256,1024,2240,7168,ck,15,0,50.2429,a8w8_blockscale_bpreshuffle_1x128x128_256x64x64x128_16x16_16x16_8x32x1_8x32x1_1x32x1x8_8_2x1_intrawave_v1,654.49,556.97,0.0032
256,1088,2240,7168,ck,15,0,49.8009,a8w8_blockscale_bpreshuffle_1x128x128_256x64x64x128_16x16_16x16_8x32x1_8x32x1_1x32x1x8_8_2x1_intrawave_v1,701.56,576.88,0.0037
256,1152,2240,7168,ck,15,0,51.0701,a8w8_blockscale_bpreshuffle_1x128x128_256x64x64x128_16x16_16x16_8x32x1_8x32x1_1x32x1x8_8_2x1_intrawave_v1,724.37,577.14,0.0045
256,1216,2240,7168,ck,15,0,51.3797,a8w8_blockscale_bpreshuffle_1x128x128_256x64x64x128_16x16_16x16_8x32x1_8x32x1_1x32x1x8_8_2x1_intrawave_v1,760.01,588.18,0.0049
256,1280,2240,7168,ck,15,0,54.0609,a8w8_blockscale_bpreshuffle_1x128x128_256x64x64x128_16x16_16x16_8x32x1_8x32x1_1x32x1x8_8_2x1_intrawave_v1,760.33,572.79,0.0054
256,1344,2240,7168,ck,15,0,54.3569,a8w8_blockscale_bpreshuffle_1x128x128_256x64x64x128_16x16_16x16_8x32x1_8x32x1_1x32x1x8_8_2x1_intrawave_v1,794.0,583.39,0.006
256,1408,2240,7168,ck,15,0,63.0529,a8w8_blockscale_bpreshuffle_1x128x128_256x64x64x128_16x16_16x16_8x32x1_8x32x1_1x32x1x8_8_2x1_intrawave_v1,717.09,514.75,0.0061
256,1472,2240,7168,ck,15,0,66.1266,a8w8_blockscale_bpreshuffle_1x128x128_256x64x64x128_16x16_16x16_8x32x1_8x32x1_1x32x1x8_8_2x1_intrawave_v1,714.84,502.1,0.0067
256,1536,2240,7168,ck,15,0,65.8222,a8w8_blockscale_bpreshuffle_1x128x128_256x64x64x128_16x16_16x16_8x32x1_8x32x1_1x32x1x8_8_2x1_intrawave_v1,749.37,515.75,0.0071
256,1600,2240,7168,ck,15,0,66.2369,a8w8_blockscale_bpreshuffle_1x128x128_256x64x64x128_16x16_16x16_8x32x1_8x32x1_1x32x1x8_8_2x1_intrawave_v1,775.7,523.77,0.0074
256,1664,2240,7168,cktile,10,0,68.5286,a8w8_blockscale_cktile_128x128x128_2x2x1_16x16x128_intrawave_0x1x0_2,779.75,517.14,0.0
256,1728,2240,7168,cktile,10,0,69.4766,a8w8_blockscale_cktile_128x128x128_2x2x1_16x16x128_intrawave_0x1x0_2,798.7,520.81,0.0
256,1792,2240,7168,cktile,10,0,69.5646,a8w8_blockscale_cktile_128x128x128_2x2x1_16x16x128_intrawave_0x1x0_2,827.23,530.87,0.0
256,1856,2240,7168,ck,2,0,74.6702,a8w8_blockscale_bpreshuffle_1x128x128_256x64x64x128_16x16_16x16_8x32x1_8x32x1_1x32x1x8_8_2x1_intrawave_v3,798.19,504.55,0.0
256,1920,2240,7168,cktile,10,0,80.5554,a8w8_blockscale_cktile_128x128x128_2x2x1_16x16x128_intrawave_0x1x0_2,765.39,476.94,0.0
256,1984,2240,7168,cktile,10,0,85.7083,a8w8_blockscale_cktile_128x128x128_2x2x1_16x16x128_intrawave_0x1x0_2,743.35,456.97,0.0
256,2048,2240,7168,cktile,10,0,86.4039,a8w8_blockscale_cktile_128x128x128_2x2x1_16x16x128_intrawave_0x1x0_2,761.15,461.92,0.0
256,4096,2240,7168,cktile,11,0,101.0415,a8w8_blockscale_cktile_192x256x128_4x2x1_16x16x128_intrawave_0x1x0_1,1301.78,631.09,0.0
256,8192,2240,7168,cktile,11,0,192.6768,a8w8_blockscale_cktile_192x256x128_4x2x1_16x16x128_intrawave_0x1x0_1,1365.33,578.57,0.0
256,16384,2240,7168,cktile,11,0,339.7061,a8w8_blockscale_cktile_192x256x128_4x2x1_16x16x128_intrawave_0x1x0_1,1548.79,609.05,0.0
256,32768,2240,7168,cktile,11,0,631.1333,a8w8_blockscale_cktile_192x256x128_4x2x1_16x16x128_intrawave_0x1x0_1,1667.27,630.2,0.0
256,16,3072,1536,ck,7,0,6.7025,a8w8_blockscale_bpreshuffle_1x128x128_256x16x64x256_16x16_16x16_16x16x1_16x16x1_1x16x1x16_4_1x1_intrawave_v1,22.53,722.34,0.0
256,32,3072,1536,ck,7,0,6.8681,a8w8_blockscale_bpreshuffle_1x128x128_256x16x64x256_16x16_16x16_16x16x1_16x16x1_1x16x1x16_4_1x1_intrawave_v1,43.97,722.81,0.0
256,48,3072,1536,ck,7,0,6.83,a8w8_blockscale_bpreshuffle_1x128x128_256x16x64x256_16x16_16x16_16x16x1_16x16x1_1x16x1x16_4_1x1_intrawave_v1,66.32,744.84,0.0
256,64,3072,1536,ck,7,0,6.7877,a8w8_blockscale_bpreshuffle_1x128x128_256x16x64x256_16x16_16x16_16x16x1_16x16x1_1x16x1x16_4_1x1_intrawave_v1,88.98,767.58,0.0
256,80,3072,1536,ck,7,0,6.8085,a8w8_blockscale_bpreshuffle_1x128x128_256x16x64x256_16x16_16x16_16x16x1_16x16x1_1x16x1x16_4_1x1_intrawave_v1,110.89,783.28,0.0
256,96,3072,1536,ck,7,0,7.073,a8w8_blockscale_bpreshuffle_1x128x128_256x16x64x256_16x16_16x16_16x16x1_16x16x1_1x16x1x16_4_1x1_intrawave_v1,128.09,771.37,0.0
256,112,3072,1536,ck,7,0,7.231,a8w8_blockscale_bpreshuffle_1x128x128_256x16x64x256_16x16_16x16_16x16x1_16x16x1_1x16x1x16_4_1x1_intrawave_v1,146.17,771.5,0.0
256,128,3072,1536,ck,7,0,7.2927,a8w8_blockscale_bpreshuffle_1x128x128_256x16x64x256_16x16_16x16_16x16x1_16x16x1_1x16x1x16_4_1x1_intrawave_v1,165.64,781.83,0.0
256,144,3072,1536,ck,7,0,7.4292,a8w8_blockscale_bpreshuffle_1x128x128_256x16x64x256_16x16_16x16_16x16x1_16x16x1_1x16x1x16_4_1x1_intrawave_v1,182.92,784.0,0.0
256,160,3072,1536,ck,6,0,7.4872,a8w8_blockscale_bpreshuffle_1x128x128_256x16x128x256_16x16_16x16_16x16x1_16x16x1_1x16x1x16_8_1x2_intrawave_v1,201.67,794.34,0.0
256,176,3072,1536,ck,7,0,7.9619,a8w8_blockscale_bpreshuffle_1x128x128_256x16x64x256_16x16_16x16_16x16x1_16x16x1_1x16x1x16_4_1x1_intrawave_v1,208.61,762.42,0.0
256,192,3072,1536,ck,7,0,8.0274,a8w8_blockscale_bpreshuffle_1x128x128_256x16x64x256_16x16_16x16_16x16x1_16x16x1_1x16x1x16_4_1x1_intrawave_v1,225.72,771.5,0.0
256,208,3072,1536,ck,7,0,8.6978,a8w8_blockscale_bpreshuffle_1x128x128_256x16x64x256_16x16_16x16_16x16x1_16x16x1_1x16x1x16_4_1x1_intrawave_v1,225.68,726.16,0.0
256,224,3072,1536,ck,12,0,8.1845,a8w8_blockscale_bpreshuffle_1x128x128_256x32x64x256_16x16_16x16_16x16x1_16x16x1_1x32x1x8_8_2x1_intrawave_v1,258.28,786.72,0.0
256,240,3072,1536,ck,12,0,8.755,a8w8_blockscale_bpreshuffle_1x128x128_256x32x64x256_16x16_16x16_16x16x1_16x16x1_1x32x1x8_8_2x1_intrawave_v1,258.7,749.49,0.0
256,256,3072,1536,ck,12,0,8.4836,a8w8_blockscale_bpreshuffle_1x128x128_256x32x64x256_16x16_16x16_16x16x1_16x16x1_1x32x1x8_8_2x1_intrawave_v1,284.78,787.95,0.0
256,288,3072,1536,ck,12,0,8.6917,a8w8_blockscale_bpreshuffle_1x128x128_256x32x64x256_16x16_16x16_16x16x1_16x16x1_1x32x1x8_8_2x1_intrawave_v1,312.7,797.36,0.0
256,320,3072,1536,ck,11,0,8.8048,a8w8_blockscale_bpreshuffle_1x128x128_256x32x128x256_16x16_16x16_16x16x1_16x16x1_1x32x1x8_8_2x1_intrawave_v1,342.98,815.03,0.0
256,352,3072,1536,ck,12,0,10.1006,a8w8_blockscale_bpreshuffle_1x128x128_256x32x64x256_16x16_16x16_16x16x1_16x16x1_1x32x1x8_8_2x1_intrawave_v1,328.88,734.8,0.0
256,384,3072,1536,ck,12,0,10.4219,a8w8_blockscale_bpreshuffle_1x128x128_256x32x64x256_16x16_16x16_16x16x1_16x16x1_1x32x1x8_8_2x1_intrawave_v1,347.72,735.73,0.0
256,416,3072,1536,ck,12,0,10.9022,a8w8_blockscale_bpreshuffle_1x128x128_256x32x64x256_16x16_16x16_16x16x1_16x16x1_1x32x1x8_8_2x1_intrawave_v1,360.1,725.86,0.0
256,448,3072,1536,ck,10,0,11.0919,a8w8_blockscale_bpreshuffle_1x128x128_256x32x64x128_16x16_16x16_8x32x1_8x32x1_1x32x1x8_8_2x1_intrawave_v1,381.17,735.6,0.0241
256,480,3072,1536,ck,12,0,11.3425,a8w8_blockscale_bpreshuffle_1x128x128_256x32x64x256_16x16_16x16_16x16x1_16x16x1_1x32x1x8_8_2x1_intrawave_v1,399.37,741.02,0.0
256,512,3072,1536,ck,12,0,11.3073,a8w8_blockscale_bpreshuffle_1x128x128_256x32x64x256_16x16_16x16_16x16x1_16x16x1_1x32x1x8_8_2x1_intrawave_v1,427.32,765.06,0.0
256,544,3072,1536,ck,11,0,11.738,a8w8_blockscale_bpreshuffle_1x128x128_256x32x128x256_16x16_16x16_16x16x1_16x16x1_1x32x1x8_8_2x1_intrawave_v1,437.37,757.92,0.0
256,576,3072,1536,ck,11,0,11.7952,a8w8_blockscale_bpreshuffle_1x128x128_256x32x128x256_16x16_16x16_16x16x1_16x16x1_1x32x1x8_8_2x1_intrawave_v1,460.85,775.08,0.0
256,608,3072,1536,ck,11,0,11.9174,a8w8_blockscale_bpreshuffle_1x128x128_256x32x128x256_16x16_16x16_16x16x1_16x16x1_1x32x1x8_8_2x1_intrawave_v1,481.46,787.76,0.0
256,640,3072,1536,ck,17,0,12.0023,a8w8_blockscale_bpreshuffle_1x128x128_256x64x64x256_16x16_16x16_16x16x1_16x16x1_1x32x1x8_8_2x1_intrawave_v1,503.22,802.66,0.0
256,672,3072,1536,ck,11,0,12.1762,a8w8_blockscale_bpreshuffle_1x128x128_256x32x128x256_16x16_16x16_16x16x1_16x16x1_1x32x1x8_8_2x1_intrawave_v1,520.83,811.38,0.0
256,704,3072,1536,ck,15,0,14.062,a8w8_blockscale_bpreshuffle_1x128x128_256x64x64x128_16x16_16x16_8x32x1_8x32x1_1x32x1x8_8_2x1_intrawave_v1,472.46,720.05,0.0008
256,736,3072,1536,ck,11,0,14.5078,a8w8_blockscale_bpreshuffle_1x128x128_256x32x128x256_16x16_16x16_16x16x1_16x16x1_1x32x1x8_8_2x1_intrawave_v1,478.76,714.86,0.0
256,768,3072,1536,ck,15,0,14.2741,a8w8_blockscale_bpreshuffle_1x128x128_256x64x64x128_16x16_16x16_8x32x1_8x32x1_1x32x1x8_8_2x1_intrawave_v1,507.76,743.78,0.001
256,800,3072,1536,ck,11,0,14.5902,a8w8_blockscale_bpreshuffle_1x128x128_256x32x128x256_16x16_16x16_16x16x1_16x16x1_1x32x1x8_8_2x1_intrawave_v1,517.45,744.51,0.0
256,832,3072,1536,ck,11,0,14.7824,a8w8_blockscale_bpreshuffle_1x128x128_256x32x128x256_16x16_16x16_16x16x1_16x16x1_1x32x1x8_8_2x1_intrawave_v1,531.15,751.46,0.0
256,864,3072,1536,ck,11,0,14.9721,a8w8_blockscale_bpreshuffle_1x128x128_256x32x128x256_16x16_16x16_16x16x1_16x16x1_1x32x1x8_8_2x1_intrawave_v1,544.59,758.35,0.0
256,896,3072,1536,ck,11,0,14.9383,a8w8_blockscale_bpreshuffle_1x128x128_256x32x128x256_16x16_16x16_16x16x1_16x16x1_1x32x1x8_8_2x1_intrawave_v1,566.04,776.52,0.0
256,928,3072,1536,ck,11,0,15.1752,a8w8_blockscale_bpreshuffle_1x128x128_256x32x128x256_16x16_16x16_16x16x1_16x16x1_1x32x1x8_8_2x1_intrawave_v1,577.11,780.59,0.0
256,960,3072,1536,ck,11,0,15.4874,a8w8_blockscale_bpreshuffle_1x128x128_256x32x128x256_16x16_16x16_16x16x1_16x16x1_1x32x1x8_8_2x1_intrawave_v1,584.97,780.72,0.0
256,992,3072,1536,ck,11,0,15.8391,a8w8_blockscale_bpreshuffle_1x128x128_256x32x128x256_16x16_16x16_16x16x1_16x16x1_1x32x1x8_8_2x1_intrawave_v1,591.05,778.9,0.0
256,1024,3072,1536,ck,15,0,15.9063,a8w8_blockscale_bpreshuffle_1x128x128_256x64x64x128_16x16_16x16_8x32x1_8x32x1_1x32x1x8_8_2x1_intrawave_v1,607.54,791.06,0.0017
256,1088,3072,1536,ck,14,0,16.035,a8w8_blockscale_bpreshuffle_1x128x128_256x64x128x128_16x16_16x16_8x32x1_8x32x1_1x32x1x8_8_2x1_intrawave_v1,640.33,815.37,0.0001
256,1152,3072,1536,ck,14,0,16.2424,a8w8_blockscale_bpreshuffle_1x128x128_256x64x128x128_16x16_16x16_8x32x1_8x32x1_1x32x1x8_8_2x1_intrawave_v1,669.34,835.22,0.0001
256,1216,3072,1536,ck,14,0,16.3987,a8w8_blockscale_bpreshuffle_1x128x128_256x64x128x128_16x16_16x16_8x32x1_8x32x1_1x32x1x8_8_2x1_intrawave_v1,699.79,857.23,0.0
256,1280,3072,1536,ck,14,0,16.7124,a8w8_blockscale_bpreshuffle_1x128x128_256x64x128x128_16x16_16x16_8x32x1_8x32x1_1x32x1x8_8_2x1_intrawave_v1,722.79,870.55,0.0
256,1344,3072,1536,ck,14,0,16.8379,a8w8_blockscale_bpreshuffle_1x128x128_256x64x128x128_16x16_16x16_8x32x1_8x32x1_1x32x1x8_8_2x1_intrawave_v1,753.28,893.25,0.0
256,1408,3072,1536,ck,14,0,20.3686,a8w8_blockscale_bpreshuffle_1x128x128_256x64x128x128_16x16_16x16_8x32x1_8x32x1_1x32x1x8_8_2x1_intrawave_v1,652.35,762.55,0.0
256,1472,3072,1536,ck,14,0,20.7842,a8w8_blockscale_bpreshuffle_1x128x128_256x64x128x128_16x16_16x16_8x32x1_8x32x1_1x32x1x8_8_2x1_intrawave_v1,668.37,770.95,0.0
256,1536,3072,1536,ck,14,0,20.7052,a8w8_blockscale_bpreshuffle_1x128x128_256x64x128x128_16x16_16x16_8x32x1_8x32x1_1x32x1x8_8_2x1_intrawave_v1,700.09,797.63,0.0001
256,1600,3072,1536,ck,14,0,21.1668,a8w8_blockscale_bpreshuffle_1x128x128_256x64x128x128_16x16_16x16_8x32x1_8x32x1_1x32x1x8_8_2x1_intrawave_v1,713.36,803.46,0.0001
256,1664,3072,1536,ck,14,0,21.6973,a8w8_blockscale_bpreshuffle_1x128x128_256x64x128x128_16x16_16x16_8x32x1_8x32x1_1x32x1x8_8_2x1_intrawave_v1,723.75,806.46,0.0001
256,1728,3072,1536,ck,14,0,21.7935,a8w8_blockscale_bpreshuffle_1x128x128_256x64x128x128_16x16_16x16_8x32x1_8x32x1_1x32x1x8_8_2x1_intrawave_v1,748.27,825.46,0.0001
256,1792,3072,1536,ck,14,0,21.9831,a8w8_blockscale_bpreshuffle_1x128x128_256x64x128x128_16x16_16x16_8x32x1_8x32x1_1x32x1x8_8_2x1_intrawave_v1,769.29,840.7,0.0001
256,1856,3072,1536,ck,14,0,22.3847,a8w8_blockscale_bpreshuffle_1x128x128_256x64x128x128_16x16_16x16_8x32x1_8x32x1_1x32x1x8_8_2x1_intrawave_v1,782.47,847.57,0.0001
256,1920,3072,1536,ck,14,0,22.3349,a8w8_blockscale_bpreshuffle_1x128x128_256x64x128x128_16x16_16x16_8x32x1_8x32x1_1x32x1x8_8_2x1_intrawave_v1,811.26,871.47,0.0001
256,1984,3072,1536,ck,14,0,22.6682,a8w8_blockscale_bpreshuffle_1x128x128_256x64x128x128_16x16_16x16_8x32x1_8x32x1_1x32x1x8_8_2x1_intrawave_v1,825.98,880.34,0.0002
256,2048,3072,1536,ck,14,0,22.8971,a8w8_blockscale_bpreshuffle_1x128x128_256x64x128x128_16x16_16x16_8x32x1_8x32x1_1x32x1x8_8_2x1_intrawave_v1,844.1,893.01,0.0002
256,4096,3072,1536,ck,13,0,41.7584,a8w8_blockscale_bpreshuffle_1x128x128_256x64x256x128_16x16_16x16_8x32x1_8x32x1_1x32x1x8_8_2x1_intrawave_v1,925.67,866.31,0.0
256,8192,3072,1536,ck,13,0,76.5446,a8w8_blockscale_bpreshuffle_1x128x128_256x64x256x128_16x16_16x16_8x32x1_8x32x1_1x32x1x8_8_2x1_intrawave_v1,1009.99,883.58,0.0
256,16384,3072,1536,cktile,11,0,138.6763,a8w8_blockscale_cktile_192x256x128_4x2x1_16x16x128_intrawave_0x1x0_1,1114.96,941.38,0.0
256,32768,3072,1536,cktile,11,0,253.6892,a8w8_blockscale_cktile_192x256x128_4x2x1_16x16x128_intrawave_0x1x0_1,1218.96,1010.59,0.0
256,16,4096,512,ck,7,0,3.1753,a8w8_blockscale_bpreshuffle_1x128x128_256x16x64x256_16x16_16x16_16x16x1_16x16x1_1x16x1x16_4_1x1_intrawave_v1,21.13,704.32,0.0
256,32,4096,512,ck,7,0,3.4606,a8w8_blockscale_bpreshuffle_1x128x128_256x16x64x256_16x16_16x16_16x16x1_16x16x1_1x16x1x16_4_1x1_intrawave_v1,38.78,686.49,0.0
256,48,4096,512,ck,7,0,3.605,a8w8_blockscale_bpreshuffle_1x128x128_256x16x64x256_16x16_16x16_16x16x1_16x16x1_1x16x1x16_4_1x1_intrawave_v1,55.85,697.63,0.0
256,64,4096,512,ck,7,0,3.6226,a8w8_blockscale_bpreshuffle_1x128x128_256x16x64x256_16x16_16x16_16x16x1_16x16x1_1x16x1x16_4_1x1_intrawave_v1,74.1,732.68,0.0
256,80,4096,512,cktile,2,0,4.1736,a8w8_blockscale_cktile_16x128x256_1x4x1_16x16x64_intrawave_0x1x0_1,80.4,669.32,0.0
256,96,4096,512,ck,7,0,4.1603,a8w8_blockscale_bpreshuffle_1x128x128_256x16x64x256_16x16_16x16_16x16x1_16x16x1_1x16x1x16_4_1x1_intrawave_v1,96.78,704.93,0.0
256,112,4096,512,ck,6,0,4.3138,a8w8_blockscale_bpreshuffle_1x128x128_256x16x128x256_16x16_16x16_16x16x1_16x16x1_1x16x1x16_8_1x2_intrawave_v1,108.9,712.13,0.0
256,128,4096,512,ck,7,0,4.261,a8w8_blockscale_bpreshuffle_1x128x128_256x16x64x256_16x16_16x16_16x16x1_16x16x1_1x16x1x16_4_1x1_intrawave_v1,126.0,753.64,0.0
256,144,4096,512,ck,7,0,4.8851,a8w8_blockscale_bpreshuffle_1x128x128_256x16x64x256_16x16_16x16_16x16x1_16x16x1_1x16x1x16_4_1x1_intrawave_v1,123.64,685.87,0.0
256,160,4096,512,ck,7,0,4.9594,a8w8_blockscale_bpreshuffle_1x128x128_256x16x64x256_16x16_16x16_16x16x1_16x16x1_1x16x1x16_4_1x1_intrawave_v1,135.32,703.67,0.0
256,176,4096,512,cktile,1,0,4.9469,a8w8_blockscale_cktile_16x128x256_1x4x1_16x16x128_intrawave_0x1x0_2,149.22,733.6,0.0
256,192,4096,512,cktile,1,0,4.9233,a8w8_blockscale_cktile_16x128x256_1x4x1_16x16x128_intrawave_0x1x0_2,163.57,765.41,0.0
256,208,4096,512,ck,11,0,5.2984,a8w8_blockscale_bpreshuffle_1x128x128_256x32x128x256_16x16_16x16_16x16x1_16x16x1_1x32x1x8_8_2x1_intrawave_v1,164.66,737.5,0.0
256,224,4096,512,ck,11,0,5.3017,a8w8_blockscale_bpreshuffle_1x128x128_256x32x128x256_16x16_16x16_16x16x1_16x16x1_1x32x1x8_8_2x1_intrawave_v1,177.21,763.31,0.0
256,240,4096,512,cktile,1,0,5.112,a8w8_blockscale_cktile_16x128x256_1x4x1_16x16x128_intrawave_0x1x0_2,196.92,818.88,0.0
256,256,4096,512,cktile,0,0,5.2442,a8w8_blockscale_cktile_16x128x256_1x4x1_16x16x128_intrawave_0x1x0_1,204.75,824.79,0.0
256,288,4096,512,ck,7,0,6.189,a8w8_blockscale_bpreshuffle_1x128x128_256x16x64x256_16x16_16x16_16x16x1_16x16x1_1x16x1x16_4_1x1_intrawave_v1,195.18,743.88,0.0
256,320,4096,512,ck,7,0,6.2704,a8w8_blockscale_bpreshuffle_1x128x128_256x16x64x256_16x16_16x16_16x16x1_16x16x1_1x16x1x16_4_1x1_intrawave_v1,214.05,778.65,0.0
256,352,4096,512,ck,12,0,6.4807,a8w8_blockscale_bpreshuffle_1x128x128_256x32x64x256_16x16_16x16_16x16x1_16x16x1_1x32x1x8_8_2x1_intrawave_v1,227.81,796.36,0.0
256,384,4096,512,ck,12,0,6.5224,a8w8_blockscale_bpreshuffle_1x128x128_256x32x64x256_16x16_16x16_16x16x1_16x16x1_1x32x1x8_8_2x1_intrawave_v1,246.94,833.97,0.0
256,416,4096,512,ck,11,0,6.9418,a8w8_blockscale_bpreshuffle_1x128x128_256x32x128x256_16x16_16x16_16x16x1_16x16x1_1x32x1x8_8_2x1_intrawave_v1,251.35,823.71,0.0
256,448,4096,512,ck,11,0,6.9882,a8w8_blockscale_bpreshuffle_1x128x128_256x32x128x256_16x16_16x16_16x16x1_16x16x1_1x32x1x8_8_2x1_intrawave_v1,268.89,858.1,0.0
256,480,4096,512,ck,11,0,7.0664,a8w8_blockscale_bpreshuffle_1x128x128_256x32x128x256_16x16_16x16_16x16x1_16x16x1_1x32x1x8_8_2x1_intrawave_v1,284.91,888.02,0.0
256,512,4096,512,ck,11,0,7.0419,a8w8_blockscale_bpreshuffle_1x128x128_256x32x128x256_16x16_16x16_16x16x1_16x16x1_1x32x1x8_8_2x1_intrawave_v1,304.96,930.66,0.0
256,544,4096,512,ck,12,0,8.2345,a8w8_blockscale_bpreshuffle_1x128x128_256x32x64x256_16x16_16x16_16x16x1_16x16x1_1x32x1x8_8_2x1_intrawave_v1,277.09,829.7,0.0
256,576,4096,512,ck,12,0,8.4037,a8w8_blockscale_bpreshuffle_1x128x128_256x32x64x256_16x16_16x16_16x16x1_16x16x1_1x32x1x8_8_2x1_intrawave_v1,287.48,846.13,0.0
256,608,4096,512,ck,11,0,8.4465,a8w8_blockscale_bpreshuffle_1x128x128_256x32x128x256_16x16_16x16_16x16x1_16x16x1_1x32x1x8_8_2x1_intrawave_v1,301.92,874.82,0.0
256,640,4096,512,ck,12,0,8.4201,a8w8_blockscale_bpreshuffle_1x128x128_256x32x64x256_16x16_16x16_16x16x1_16x16x1_1x32x1x8_8_2x1_intrawave_v1,318.8,910.64,0.0
256,672,4096,512,ck,11,0,8.6693,a8w8_blockscale_bpreshuffle_1x128x128_256x32x128x256_16x16_16x16_16x16x1_16x16x1_1x32x1x8_8_2x1_intrawave_v1,325.12,916.6,0.0
256,704,4096,512,ck,11,0,8.6601,a8w8_blockscale_bpreshuffle_1x128x128_256x32x128x256_16x16_16x16_16x16x1_16x16x1_1x32x1x8_8_2x1_intrawave_v1,340.96,949.73,0.0
256,736,4096,512,ck,11,0,8.826,a8w8_blockscale_bpreshuffle_1x128x128_256x32x128x256_16x16_16x16_16x16x1_16x16x1_1x32x1x8_8_2x1_intrawave_v1,349.76,963.44,0.0
256,768,4096,512,ck,11,0,8.8168,a8w8_blockscale_bpreshuffle_1x128x128_256x32x128x256_16x16_16x16_16x16x1_16x16x1_1x32x1x8_8_2x1_intrawave_v1,365.35,996.03,0.0
256,800,4096,512,ck,11,0,9.687,a8w8_blockscale_bpreshuffle_1x128x128_256x32x128x256_16x16_16x16_16x16x1_16x16x1_1x32x1x8_8_2x1_intrawave_v1,346.39,935.31,0.0
256,832,4096,512,ck,16,0,9.5333,a8w8_blockscale_bpreshuffle_1x128x128_256x64x128x256_16x16_16x16_16x16x1_16x16x1_1x32x1x8_8_2x1_intrawave_v1,366.05,979.61,0.0
256,864,4096,512,cktile,5,0,10.2828,a8w8_blockscale_cktile_32x128x128_1x4x1_16x16x128_intrawave_0x1x0_2,352.42,935.29,0.0
256,896,4096,512,ck,16,0,9.5571,a8w8_blockscale_bpreshuffle_1x128x128_256x64x128x256_16x16_16x16_16x16x1_16x16x1_1x32x1x8_8_2x1_intrawave_v1,393.23,1035.45,0.0
256,928,4096,512,ck,16,0,10.0201,a8w8_blockscale_bpreshuffle_1x128x128_256x64x128x256_16x16_16x16_16x16x1_16x16x1_1x32x1x8_8_2x1_intrawave_v1,388.45,1015.41,0.0
256,960,4096,512,cktile,5,0,10.5104,a8w8_blockscale_cktile_32x128x128_1x4x1_16x16x128_intrawave_0x1x0_2,383.1,994.54,0.0
256,992,4096,512,ck,11,0,10.0919,a8w8_blockscale_bpreshuffle_1x128x128_256x32x128x256_16x16_16x16_16x16x1_16x16x1_1x32x1x8_8_2x1_intrawave_v1,412.29,1063.38,0.0
256,1024,4096,512,ck,11,0,10.4353,a8w8_blockscale_bpreshuffle_1x128x128_256x32x128x256_16x16_16x16_16x16x1_16x16x1_1x32x1x8_8_2x1_intrawave_v1,411.58,1055.08,0.0
256,1088,4096,512,ck,12,0,11.7309,a8w8_blockscale_bpreshuffle_1x128x128_256x32x64x256_16x16_16x16_16x16x1_16x16x1_1x32x1x8_8_2x1_intrawave_v1,389.01,986.04,0.0
256,1152,4096,512,ck,12,0,11.852,a8w8_blockscale_bpreshuffle_1x128x128_256x32x64x256_16x16_16x16_16x16x1_16x16x1_1x32x1x8_8_2x1_intrawave_v1,407.68,1022.96,0.0
256,1216,4096,512,ck,11,0,11.8252,a8w8_blockscale_bpreshuffle_1x128x128_256x32x128x256_16x16_16x16_16x16x1_16x16x1_1x32x1x8_8_2x1_intrawave_v1,431.31,1072.39,0.0
256,1280,4096,512,ck,11,0,11.8403,a8w8_blockscale_bpreshuffle_1x128x128_256x32x128x256_16x16_16x16_16x16x1_16x16x1_1x32x1x8_8_2x1_intrawave_v1,453.43,1118.07,0.0
256,1344,4096,512,ck,11,0,12.9471,a8w8_blockscale_bpreshuffle_1x128x128_256x32x128x256_16x16_16x16_16x16x1_16x16x1_1x32x1x8_8_2x1_intrawave_v1,435.4,1065.51,0.0
256,1408,4096,512,ck,11,0,13.1049,a8w8_blockscale_bpreshuffle_1x128x128_256x32x128x256_16x16_16x16_16x16x1_16x16x1_1x32x1x8_8_2x1_intrawave_v1,450.64,1095.19,0.0
256,1472,4096,512,ck,11,0,13.134,a8w8_blockscale_bpreshuffle_1x128x128_256x32x128x256_16x16_16x16_16x16x1_16x16x1_1x32x1x8_8_2x1_intrawave_v1,470.08,1135.18,0.0
256,1536,4096,512,ck,11,0,13.333,a8w8_blockscale_bpreshuffle_1x128x128_256x32x128x256_16x16_16x16_16x16x1_16x16x1_1x32x1x8_8_2x1_intrawave_v1,483.2,1160.02,0.0
256,1600,4096,512,cktile,10,0,13.8795,a8w8_blockscale_cktile_128x128x128_2x2x1_16x16x128_intrawave_0x1x0_2,483.51,1154.48,0.0
256,1664,4096,512,cktile,10,0,14.0252,a8w8_blockscale_cktile_128x128x128_2x2x1_16x16x128_intrawave_0x1x0_2,497.63,1182.2,0.0
256,1728,4096,512,cktile,10,0,14.1616,a8w8_blockscale_cktile_128x128x128_2x2x1_16x16x128_intrawave_0x1x0_2,511.79,1210.15,0.0
256,1792,4096,512,cktile,10,0,14.2314,a8w8_blockscale_cktile_128x128x128_2x2x1_16x16x128_intrawave_0x1x0_2,528.14,1243.36,0.0
256,1856,4096,512,cktile,10,0,14.4552,a8w8_blockscale_cktile_128x128x128_2x2x1_16x16x128_intrawave_0x1x0_2,538.53,1262.64,0.0
256,1920,4096,512,cktile,10,0,14.5278,a8w8_blockscale_cktile_128x128x128_2x2x1_16x16x128_intrawave_0x1x0_2,554.32,1294.68,0.0
256,1984,4096,512,cktile,10,0,14.5045,a8w8_blockscale_cktile_128x128x128_2x2x1_16x16x128_intrawave_0x1x0_2,573.72,1335.16,0.0
256,2048,4096,512,cktile,10,0,14.6923,a8w8_blockscale_cktile_128x128x128_2x2x1_16x16x128_intrawave_0x1x0_2,584.66,1356.01,0.0
256,4096,4096,512,cktile,10,0,26.404,a8w8_blockscale_cktile_128x128x128_2x2x1_16x16x128_intrawave_0x1x0_2,650.65,1429.66,0.0
256,8192,4096,512,cktile,10,0,50.5797,a8w8_blockscale_cktile_128x128x128_2x2x1_16x16x128_intrawave_0x1x0_2,679.32,1451.18,0.0
256,16384,4096,512,cktile,10,0,91.7259,a8w8_blockscale_cktile_128x128x128_2x2x1_16x16x128_intrawave_0x1x0_2,749.18,1577.56,0.0
256,32768,4096,512,cktile,10,0,173.8407,a8w8_blockscale_cktile_128x128x128_2x2x1_16x16x128_intrawave_0x1x0_2,790.6,1652.72,0.0
256,16,4608,7168,ck,7,0,18.555,a8w8_blockscale_bpreshuffle_1x128x128_256x16x64x256_16x16_16x16_16x16x1_16x16x1_1x16x1x16_4_1x1_intrawave_v1,56.96,1794.25,0.0
256,32,4608,7168,ck,7,0,18.509,a8w8_blockscale_bpreshuffle_1x128x128_256x16x64x256_16x16_16x16_16x16x1_16x16x1_1x16x1x16_4_1x1_intrawave_v1,114.21,1812.87,0.0
256,48,4608,7168,ck,7,0,18.4745,a8w8_blockscale_bpreshuffle_1x128x128_256x16x64x256_16x16_16x16_16x16x1_16x16x1_1x16x1x16_4_1x1_intrawave_v1,171.64,1830.45,0.0
256,64,4608,7168,ck,12,0,19.8564,a8w8_blockscale_bpreshuffle_1x128x128_256x32x64x256_16x16_16x16_16x16x1_16x16x1_1x32x1x8_8_2x1_intrawave_v1,212.92,1716.26,0.0
256,80,4608,7168,ck,7,0,21.5691,a8w8_blockscale_bpreshuffle_1x128x128_256x16x64x256_16x16_16x16_16x16x1_16x16x1_1x16x1x16_4_1x1_intrawave_v1,245.02,1592.13,0.0
256,96,4608,7168,ck,12,0,19.8482,a8w8_blockscale_bpreshuffle_1x128x128_256x32x64x256_16x16_16x16_16x16x1_16x16x1_1x32x1x8_8_2x1_intrawave_v1,319.51,1743.38,0.0
256,112,4608,7168,ck,6,0,21.7435,a8w8_blockscale_bpreshuffle_1x128x128_256x16x128x256_16x16_16x16_16x16x1_16x16x1_1x16x1x16_8_1x2_intrawave_v1,340.27,1603.47,0.0
256,128,4608,7168,ck,17,0,23.0946,a8w8_blockscale_bpreshuffle_1x128x128_256x64x64x256_16x16_16x16_16x16x1_16x16x1_1x32x1x8_8_2x1_intrawave_v1,366.13,1521.02,0.0
256,144,4608,7168,ck,12,0,27.1374,a8w8_blockscale_bpreshuffle_1x128x128_256x32x64x256_16x16_16x16_16x16x1_16x16x1_1x32x1x8_8_2x1_intrawave_v1,350.54,1304.08,0.0
256,160,4608,7168,ck,11,0,24.2129,a8w8_blockscale_bpreshuffle_1x128x128_256x32x128x256_16x16_16x16_16x16x1_16x16x1_1x32x1x8_8_2x1_intrawave_v1,436.53,1472.42,0.0
256,176,4608,7168,ck,12,0,28.0367,a8w8_blockscale_bpreshuffle_1x128x128_256x32x64x256_16x16_16x16_16x16x1_16x16x1_1x32x1x8_8_2x1_intrawave_v1,414.69,1280.95,0.0
256,192,4608,7168,ck,17,0,23.6408,a8w8_blockscale_bpreshuffle_1x128x128_256x64x64x256_16x16_16x16_16x16x1_16x16x1_1x32x1x8_8_2x1_intrawave_v1,536.51,1530.23,0.0
256,208,4608,7168,ck,12,0,28.8396,a8w8_blockscale_bpreshuffle_1x128x128_256x32x64x256_16x16_16x16_16x16x1_16x16x1_1x32x1x8_8_2x1_intrawave_v1,476.45,1263.47,0.0
256,224,4608,7168,ck,11,0,25.0679,a8w8_blockscale_bpreshuffle_1x128x128_256x32x128x256_16x16_16x16_16x16x1_16x16x1_1x32x1x8_8_2x1_intrawave_v1,590.3,1464.03,0.0
256,240,4608,7168,ck,10,0,36.499,a8w8_blockscale_bpreshuffle_1x128x128_256x32x64x128_16x16_16x16_8x32x1_8x32x1_1x32x1x8_8_2x1_intrawave_v1,434.38,1012.69,0.0194
256,256,4608,7168,ck,17,0,34.8729,a8w8_blockscale_bpreshuffle_1x128x128_256x64x64x256_16x16_16x16_16x16x1_16x16x1_1x32x1x8_8_2x1_intrawave_v1,484.94,1067.43,0.0
256,288,4608,7168,ck,10,0,36.2038,a8w8_blockscale_bpreshuffle_1x128x128_256x32x64x128_16x16_16x16_8x32x1_8x32x1_1x32x1x8_8_2x1_intrawave_v1,525.51,1042.67,0.0188
256,320,4608,7168,ck,17,0,34.9779,a8w8_blockscale_bpreshuffle_1x128x128_256x64x64x256_16x16_16x16_16x16x1_16x16x1_1x32x1x8_8_2x1_intrawave_v1,604.36,1094.21,0.0
256,352,4608,7168,ck,9,0,40.1188,a8w8_blockscale_bpreshuffle_1x128x128_256x32x128x128_16x16_16x16_8x32x1_8x32x1_1x32x1x8_8_2x1_intrawave_v1,579.61,967.06,0.0
256,384,4608,7168,ck,17,0,35.1424,a8w8_blockscale_bpreshuffle_1x128x128_256x64x64x256_16x16_16x16_16x16x1_16x16x1_1x32x1x8_8_2x1_intrawave_v1,721.84,1118.92,0.0
256,416,4608,7168,ck,11,0,41.3048,a8w8_blockscale_bpreshuffle_1x128x128_256x32x128x256_16x16_16x16_16x16x1_16x16x1_1x32x1x8_8_2x1_intrawave_v1,665.32,964.68,0.0
256,448,4608,7168,ck,17,0,37.3692,a8w8_blockscale_bpreshuffle_1x128x128_256x64x64x256_16x16_16x16_16x16x1_16x16x1_1x32x1x8_8_2x1_intrawave_v1,791.96,1080.31,0.0
256,480,4608,7168,ck,9,0,49.2221,a8w8_blockscale_bpreshuffle_1x128x128_256x32x128x128_16x16_16x16_8x32x1_8x32x1_1x32x1x8_8_2x1_intrawave_v1,644.2,830.82,0.0
256,512,4608,7168,ck,14,0,49.0922,a8w8_blockscale_bpreshuffle_1x128x128_256x64x128x128_16x16_16x16_8x32x1_8x32x1_1x32x1x8_8_2x1_intrawave_v1,688.97,843.69,0.0
256,544,4608,7168,ck,14,0,50.6336,a8w8_blockscale_bpreshuffle_1x128x128_256x64x128x128_16x16_16x16_8x32x1_8x32x1_1x32x1x8_8_2x1_intrawave_v1,709.74,828.36,0.0
256,576,4608,7168,ck,14,0,47.4169,a8w8_blockscale_bpreshuffle_1x128x128_256x64x128x128_16x16_16x16_8x32x1_8x32x1_1x32x1x8_8_2x1_intrawave_v1,802.47,895.62,0.0
256,608,4608,7168,ck,14,0,55.4485,a8w8_blockscale_bpreshuffle_1x128x128_256x64x128x128_16x16_16x16_8x32x1_8x32x1_1x32x1x8_8_2x1_intrawave_v1,724.36,775.34,0.0
256,640,4608,7168,ck,14,0,50.9337,a8w8_blockscale_bpreshuffle_1x128x128_256x64x128x128_16x16_16x16_8x32x1_8x32x1_1x32x1x8_8_2x1_intrawave_v1,830.07,854.36,0.0001
256,672,4608,7168,ck,14,0,55.8229,a8w8_blockscale_bpreshuffle_1x128x128_256x64x128x128_16x16_16x16_8x32x1_8x32x1_1x32x1x8_8_2x1_intrawave_v1,795.24,788.93,0.0
256,704,4608,7168,ck,14,0,53.1185,a8w8_blockscale_bpreshuffle_1x128x128_256x64x128x128_16x16_16x16_8x32x1_8x32x1_1x32x1x8_8_2x1_intrawave_v1,875.52,838.96,0.0001
256,736,4608,7168,ck,14,0,58.0421,a8w8_blockscale_bpreshuffle_1x128x128_256x64x128x128_16x16_16x16_8x32x1_8x32x1_1x32x1x8_8_2x1_intrawave_v1,837.67,776.83,0.0
256,768,4608,7168,ck,13,0,53.7729,a8w8_blockscale_bpreshuffle_1x128x128_256x64x256x128_16x16_16x16_8x32x1_8x32x1_1x32x1x8_8_2x1_intrawave_v1,943.49,848.25,0.0
256,800,4608,7168,ck,14,0,60.4185,a8w8_blockscale_bpreshuffle_1x128x128_256x64x128x128_16x16_16x16_8x32x1_8x32x1_1x32x1x8_8_2x1_intrawave_v1,874.7,763.63,0.0
256,832,4608,7168,ck,14,0,56.2349,a8w8_blockscale_bpreshuffle_1x128x128_256x64x128x128_16x16_16x16_8x32x1_8x32x1_1x32x1x8_8_2x1_intrawave_v1,977.37,829.76,0.0001
256,864,4608,7168,ck,14,0,61.5149,a8w8_blockscale_bpreshuffle_1x128x128_256x64x128x128_16x16_16x16_8x32x1_8x32x1_1x32x1x8_8_2x1_intrawave_v1,927.84,767.06,0.0
256,896,4608,7168,ck,13,0,57.5637,a8w8_blockscale_bpreshuffle_1x128x128_256x64x256x128_16x16_16x16_8x32x1_8x32x1_1x32x1x8_8_2x1_intrawave_v1,1028.25,828.82,0.0
256,928,4608,7168,ck,1,0,78.9598,a8w8_blockscale_bpreshuffle_1x128x128_256x64x128x128_16x16_16x16_8x32x1_8x32x1_1x32x1x8_8_2x1_intrawave_v3,776.39,610.87,0.0
256,960,4608,7168,ck,14,0,71.9694,a8w8_blockscale_bpreshuffle_1x128x128_256x64x128x128_16x16_16x16_8x32x1_8x32x1_1x32x1x8_8_2x1_intrawave_v1,881.18,677.49,0.0002
256,992,4608,7168,ck,1,0,79.1962,a8w8_blockscale_bpreshuffle_1x128x128_256x64x128x128_16x16_16x16_8x32x1_8x32x1_1x32x1x8_8_2x1_intrawave_v3,827.46,622.29,0.0
256,1024,4608,7168,ck,14,0,75.9624,a8w8_blockscale_bpreshuffle_1x128x128_256x64x128x128_16x16_16x16_8x32x1_8x32x1_1x32x1x8_8_2x1_intrawave_v1,890.52,655.68,0.0001
256,1088,4608,7168,ck,13,0,73.6666,a8w8_blockscale_bpreshuffle_1x128x128_256x64x256x128_16x16_16x16_8x32x1_8x32x1_1x32x1x8_8_2x1_intrawave_v1,975.66,690.35,0.0
256,1152,4608,7168,ck,13,0,75.6192,a8w8_blockscale_bpreshuffle_1x128x128_256x64x256x128_16x16_16x16_8x32x1_8x32x1_1x32x1x8_8_2x1_intrawave_v1,1006.38,686.39,0.0
256,1216,4608,7168,ck,13,0,76.8154,a8w8_blockscale_bpreshuffle_1x128x128_256x64x256x128_16x16_16x16_8x32x1_8x32x1_1x32x1x8_8_2x1_intrawave_v1,1045.74,689.36,0.0
256,1280,4608,7168,ck,13,0,76.691,a8w8_blockscale_bpreshuffle_1x128x128_256x64x256x128_16x16_16x16_8x32x1_8x32x1_1x32x1x8_8_2x1_intrawave_v1,1102.57,704.15,0.0
256,1344,4608,7168,ck,13,0,84.3935,a8w8_blockscale_bpreshuffle_1x128x128_256x64x256x128_16x16_16x16_8x32x1_8x32x1_1x32x1x8_8_2x1_intrawave_v1,1052.04,652.3,0.0
256,1408,4608,7168,ck,13,0,82.2798,a8w8_blockscale_bpreshuffle_1x128x128_256x64x256x128_16x16_16x16_8x32x1_8x32x1_1x32x1x8_8_2x1_intrawave_v1,1130.45,681.81,0.0
256,1472,4608,7168,ck,13,0,82.6742,a8w8_blockscale_bpreshuffle_1x128x128_256x64x256x128_16x16_16x16_8x32x1_8x32x1_1x32x1x8_8_2x1_intrawave_v1,1176.19,691.24,0.0
256,1536,4608,7168,ck,13,0,88.9692,a8w8_blockscale_bpreshuffle_1x128x128_256x64x256x128_16x16_16x16_8x32x1_8x32x1_1x32x1x8_8_2x1_intrawave_v1,1140.49,654.11,0.0
256,1600,4608,7168,ck,13,0,89.1099,a8w8_blockscale_bpreshuffle_1x128x128_256x64x256x128_16x16_16x16_8x32x1_8x32x1_1x32x1x8_8_2x1_intrawave_v1,1186.14,664.85,0.0
256,1664,4608,7168,cktile,11,0,92.0155,a8w8_blockscale_cktile_192x256x128_4x2x1_16x16x128_intrawave_0x1x0_1,1194.63,655.25,0.0
256,1728,4608,7168,cktile,11,0,89.7331,a8w8_blockscale_cktile_192x256x128_4x2x1_16x16x128_intrawave_0x1x0_1,1272.13,683.6,0.0
256,1792,4608,7168,cktile,11,0,94.3667,a8w8_blockscale_cktile_192x256x128_4x2x1_16x16x128_intrawave_0x1x0_1,1254.47,661.15,0.0
256,1856,4608,7168,cktile,11,0,95.1695,a8w8_blockscale_cktile_192x256x128_4x2x1_16x16x128_intrawave_0x1x0_1,1288.31,666.59,0.0
256,1920,4608,7168,cktile,11,0,93.6479,a8w8_blockscale_cktile_192x256x128_4x2x1_16x16x128_intrawave_0x1x0_1,1354.39,688.62,0.0
256,1984,4608,7168,cktile,11,0,96.9199,a8w8_blockscale_cktile_192x256x128_4x2x1_16x16x128_intrawave_0x1x0_1,1352.29,676.19,0.0
256,2048,4608,7168,cktile,11,0,95.7619,a8w8_blockscale_cktile_192x256x128_4x2x1_16x16x128_intrawave_0x1x0_1,1412.79,695.31,0.0
256,4096,4608,7168,cktile,11,0,188.208,a8w8_blockscale_cktile_192x256x128_4x2x1_16x16x128_intrawave_0x1x0_1,1437.68,532.07,0.0
256,8192,4608,7168,cktile,11,0,317.6814,a8w8_blockscale_cktile_192x256x128_4x2x1_16x16x128_intrawave_0x1x0_1,1703.49,526.46,0.0
256,16384,4608,7168,cktile,11,0,602.7612,a8w8_blockscale_cktile_192x256x128_4x2x1_16x16x128_intrawave_0x1x0_1,1795.62,500.14,0.0
256,32768,4608,7168,cktile,11,0,1203.5556,a8w8_blockscale_cktile_192x256x128_4x2x1_16x16x128_intrawave_0x1x0_1,1798.56,473.51,0.0
256,16,7168,2048,ck,7,0,7.6111,a8w8_blockscale_bpreshuffle_1x128x128_256x16x64x256_16x16_16x16_16x16x1_16x16x1_1x16x1x16_4_1x1_intrawave_v1,61.72,1963.21,0.0
256,16,7168,2304,ck,7,0,8.5741,a8w8_blockscale_bpreshuffle_1x128x128_256x16x64x256_16x16_16x16_16x16x1_16x16x1_1x16x1x16_4_1x1_intrawave_v1,61.64,1957.21,0.0
256,32,7168,2048,ck,7,0,7.7928,a8w8_blockscale_bpreshuffle_1x128x128_256x16x64x256_16x16_16x16_16x16x1_16x16x1_1x16x1x16_4_1x1_intrawave_v1,120.56,1951.08,0.0
256,32,7168,2304,ck,7,0,8.7857,a8w8_blockscale_bpreshuffle_1x128x128_256x16x64x256_16x16_16x16_16x16x1_16x16x1_1x16x1x16_4_1x1_intrawave_v1,120.31,1940.37,0.0
256,48,7168,2048,ck,7,0,8.56,a8w8_blockscale_bpreshuffle_1x128x128_256x16x64x256_16x16_16x16_16x16x1_16x16x1_1x16x1x16_4_1x1_intrawave_v1,164.64,1806.83,0.0
256,48,7168,2304,ck,7,0,9.4359,a8w8_blockscale_bpreshuffle_1x128x128_256x16x64x256_16x16_16x16_16x16x1_16x16x1_1x16x1x16_4_1x1_intrawave_v1,168.02,1834.89,0.0
256,64,7168,2048,ck,12,0,8.419,a8w8_blockscale_bpreshuffle_1x128x128_256x32x64x256_16x16_16x16_16x16x1_16x16x1_1x32x1x8_8_2x1_intrawave_v1,223.19,1868.23,0.0
256,64,7168,2304,ck,7,0,9.4465,a8w8_blockscale_bpreshuffle_1x128x128_256x16x64x256_16x16_16x16_16x16x1_16x16x1_1x16x1x16_4_1x1_intrawave_v1,223.78,1861.01,0.0
256,80,7168,2048,ck,12,0,10.327,a8w8_blockscale_bpreshuffle_1x128x128_256x32x64x256_16x16_16x16_16x16x1_16x16x1_1x32x1x8_8_2x1_intrawave_v1,227.44,1548.44,0.0
256,80,7168,2304,ck,11,0,11.4535,a8w8_blockscale_bpreshuffle_1x128x128_256x32x128x256_16x16_16x16_16x16x1_16x16x1_1x32x1x8_8_2x1_intrawave_v1,230.71,1558.15,0.0
256,96,7168,2048,ck,12,0,10.2359,a8w8_blockscale_bpreshuffle_1x128x128_256x32x64x256_16x16_16x16_16x16x1_16x16x1_1x32x1x8_8_2x1_intrawave_v1,275.36,1587.84,0.0
256,96,7168,2304,ck,11,0,11.3162,a8w8_blockscale_bpreshuffle_1x128x128_256x32x128x256_16x16_16x16_16x16x1_16x16x1_1x32x1x8_8_2x1_intrawave_v1,280.21,1600.58,0.0
256,112,7168,2048,ck,12,0,11.2984,a8w8_blockscale_bpreshuffle_1x128x128_256x32x64x256_16x16_16x16_16x16x1_16x16x1_1x32x1x8_8_2x1_intrawave_v1,291.04,1461.72,0.0
256,112,7168,2304,ck,17,0,11.6035,a8w8_blockscale_bpreshuffle_1x128x128_256x64x64x256_16x16_16x16_16x16x1_16x16x1_1x32x1x8_8_2x1_intrawave_v1,318.82,1583.9,0.0
256,128,7168,2048,ck,11,0,10.6245,a8w8_blockscale_bpreshuffle_1x128x128_256x32x128x256_16x16_16x16_16x16x1_16x16x1_1x32x1x8_8_2x1_intrawave_v1,353.72,1579.11,0.0
256,128,7168,2304,ck,11,0,11.1767,a8w8_blockscale_bpreshuffle_1x128x128_256x32x128x256_16x16_16x16_16x16x1_16x16x1_1x32x1x8_8_2x1_intrawave_v1,378.27,1668.2,0.0
256,144,7168,2048,cktile,3,0,12.3614,a8w8_blockscale_cktile_16x128x256_1x4x1_16x16x64_intrawave_0x1x0_2,342.02,1378.43,0.0
256,144,7168,2304,ck,10,0,14.0518,a8w8_blockscale_bpreshuffle_1x128x128_256x32x64x128_16x16_16x16_8x32x1_8x32x1_1x32x1x8_8_2x1_intrawave_v1,338.49,1345.82,0.0184
256,160,7168,2048,ck,10,0,12.4416,a8w8_blockscale_bpreshuffle_1x128x128_256x32x64x128_16x16_16x16_8x32x1_8x32x1_1x32x1x8_8_2x1_intrawave_v1,377.57,1390.62,0.0206
256,160,7168,2304,ck,10,0,14.1369,a8w8_blockscale_bpreshuffle_1x128x128_256x32x64x128_16x16_16x16_8x32x1_8x32x1_1x32x1x8_8_2x1_intrawave_v1,373.83,1356.55,0.0222
256,176,7168,2048,ck,12,0,13.1566,a8w8_blockscale_bpreshuffle_1x128x128_256x32x64x256_16x16_16x16_16x16x1_16x16x1_1x32x1x8_8_2x1_intrawave_v1,392.76,1334.97,0.0
256,176,7168,2304,ck,10,0,14.5737,a8w8_blockscale_bpreshuffle_1x128x128_256x32x64x128_16x16_16x16_8x32x1_8x32x1_1x32x1x8_8_2x1_intrawave_v1,398.89,1334.16,0.0205
256,192,7168,2048,ck,10,0,12.933,a8w8_blockscale_bpreshuffle_1x128x128_256x32x64x128_16x16_16x16_8x32x1_8x32x1_1x32x1x8_8_2x1_intrawave_v1,435.87,1378.32,0.0219
256,192,7168,2304,ck,16,0,14.5424,a8w8_blockscale_bpreshuffle_1x128x128_256x64x128x256_16x16_16x16_16x16x1_16x16x1_1x32x1x8_8_2x1_intrawave_v1,436.09,1355.34,0.0
256,208,7168,2048,ck,9,0,13.9422,a8w8_blockscale_bpreshuffle_1x128x128_256x32x128x128_16x16_16x16_8x32x1_8x32x1_1x32x1x8_8_2x1_intrawave_v1,438.02,1297.35,0.0
256,208,7168,2304,ck,17,0,15.5344,a8w8_blockscale_bpreshuffle_1x128x128_256x64x64x256_16x16_16x16_16x16x1_16x16x1_1x32x1x8_8_2x1_intrawave_v1,442.26,1285.93,0.0
256,224,7168,2048,ck,9,0,14.029,a8w8_blockscale_bpreshuffle_1x128x128_256x32x128x128_16x16_16x16_8x32x1_8x32x1_1x32x1x8_8_2x1_intrawave_v1,468.79,1308.01,0.0
256,224,7168,2304,ck,17,0,15.4988,a8w8_blockscale_bpreshuffle_1x128x128_256x64x64x256_16x16_16x16_16x16x1_16x16x1_1x32x1x8_8_2x1_intrawave_v1,477.38,1306.06,0.0
256,240,7168,2048,ck,9,0,14.2322,a8w8_blockscale_bpreshuffle_1x128x128_256x32x128x128_16x16_16x16_8x32x1_8x32x1_1x32x1x8_8_2x1_intrawave_v1,495.1,1307.75,0.0
256,240,7168,2304,ck,17,0,16.1526,a8w8_blockscale_bpreshuffle_1x128x128_256x64x64x256_16x16_16x16_16x16x1_16x16x1_1x32x1x8_8_2x1_intrawave_v1,490.77,1269.68,0.0
256,256,7168,2048,ck,17,0,13.8207,a8w8_blockscale_bpreshuffle_1x128x128_256x64x64x256_16x16_16x16_16x16x1_16x16x1_1x32x1x8_8_2x1_intrawave_v1,543.84,1365.66,0.0
256,256,7168,2304,ck,16,0,14.6249,a8w8_blockscale_bpreshuffle_1x128x128_256x64x128x256_16x16_16x16_16x16x1_16x16x1_1x32x1x8_8_2x1_intrawave_v1,578.17,1420.52,0.0
256,288,7168,2048,ck,11,0,15.6281,a8w8_blockscale_bpreshuffle_1x128x128_256x32x128x256_16x16_16x16_16x16x1_16x16x1_1x32x1x8_8_2x1_intrawave_v1,541.06,1241.27,0.0
256,288,7168,2304,ck,11,0,17.2349,a8w8_blockscale_bpreshuffle_1x128x128_256x32x128x256_16x16_16x16_16x16x1_16x16x1_1x32x1x8_8_2x1_intrawave_v1,551.94,1236.29,0.0
256,320,7168,2048,ck,9,0,17.1163,a8w8_blockscale_bpreshuffle_1x128x128_256x32x128x128_16x16_16x16_8x32x1_8x32x1_1x32x1x8_8_2x1_intrawave_v1,548.91,1163.97,0.0
256,320,7168,2304,ck,14,0,19.1726,a8w8_blockscale_bpreshuffle_1x128x128_256x64x128x128_16x16_16x16_8x32x1_8x32x1_1x32x1x8_8_2x1_intrawave_v1,551.29,1139.12,0.0
256,352,7168,2048,ck,9,0,17.9431,a8w8_blockscale_bpreshuffle_1x128x128_256x32x128x128_16x16_16x16_8x32x1_8x32x1_1x32x1x8_8_2x1_intrawave_v1,575.97,1139.56,0.0
256,352,7168,2304,ck,9,0,20.6769,a8w8_blockscale_bpreshuffle_1x128x128_256x32x128x128_16x16_16x16_8x32x1_8x32x1_1x32x1x8_8_2x1_intrawave_v1,562.3,1082.0,0.0
256,384,7168,2048,ck,15,0,18.0634,a8w8_blockscale_bpreshuffle_1x128x128_256x64x64x128_16x16_16x16_8x32x1_8x32x1_1x32x1x8_8_2x1_intrawave_v1,624.15,1161.0,0.0018
256,384,7168,2304,ck,15,0,20.2585,a8w8_blockscale_bpreshuffle_1x128x128_256x64x64x128_16x16_16x16_8x32x1_8x32x1_1x32x1x8_8_2x1_intrawave_v1,626.09,1130.63,0.0021
256,416,7168,2048,ck,9,0,19.2985,a8w8_blockscale_bpreshuffle_1x128x128_256x32x128x128_16x16_16x16_8x32x1_8x32x1_1x32x1x8_8_2x1_intrawave_v1,632.89,1113.86,0.0
256,416,7168,2304,ck,14,0,21.901,a8w8_blockscale_bpreshuffle_1x128x128_256x64x128x128_16x16_16x16_8x32x1_8x32x1_1x32x1x8_8_2x1_intrawave_v1,627.39,1070.15,0.0
256,448,7168,2048,ck,14,0,18.5038,a8w8_blockscale_bpreshuffle_1x128x128_256x64x128x128_16x16_16x16_8x32x1_8x32x1_1x32x1x8_8_2x1_intrawave_v1,710.85,1190.03,0.0001
256,448,7168,2304,ck,14,0,21.2556,a8w8_blockscale_bpreshuffle_1x128x128_256x64x128x128_16x16_16x16_8x32x1_8x32x1_1x32x1x8_8_2x1_intrawave_v1,696.17,1127.69,0.0001
256,480,7168,2048,ck,14,0,20.2524,a8w8_blockscale_bpreshuffle_1x128x128_256x64x128x128_16x16_16x16_8x32x1_8x32x1_1x32x1x8_8_2x1_intrawave_v1,695.86,1113.17,0.0
256,480,7168,2304,ck,14,0,23.2743,a8w8_blockscale_bpreshuffle_1x128x128_256x64x128x128_16x16_16x16_8x32x1_8x32x1_1x32x1x8_8_2x1_intrawave_v1,681.2,1052.76,0.0001
256,512,7168,2048,ck,14,0,18.9,a8w8_blockscale_bpreshuffle_1x128x128_256x64x128x128_16x16_16x16_8x32x1_8x32x1_1x32x1x8_8_2x1_intrawave_v1,795.36,1220.56,0.0002
256,512,7168,2304,ck,14,0,21.5382,a8w8_blockscale_bpreshuffle_1x128x128_256x64x128x128_16x16_16x16_8x32x1_8x32x1_1x32x1x8_8_2x1_intrawave_v1,785.18,1162.34,0.0001
256,544,7168,2048,ck,14,0,20.9832,a8w8_blockscale_bpreshuffle_1x128x128_256x64x128x128_16x16_16x16_8x32x1_8x32x1_1x32x1x8_8_2x1_intrawave_v1,761.18,1124.37,0.0
256,544,7168,2304,ck,14,0,23.4457,a8w8_blockscale_bpreshuffle_1x128x128_256x64x128x128_16x16_16x16_8x32x1_8x32x1_1x32x1x8_8_2x1_intrawave_v1,766.38,1090.49,0.0
256,576,7168,2048,ck,14,0,20.3315,a8w8_blockscale_bpreshuffle_1x128x128_256x64x128x128_16x16_16x16_8x32x1_8x32x1_1x32x1x8_8_2x1_intrawave_v1,831.78,1186.2,0.0002
256,576,7168,2304,ck,14,0,22.5527,a8w8_blockscale_bpreshuffle_1x128x128_256x64x128x128_16x16_16x16_8x32x1_8x32x1_1x32x1x8_8_2x1_intrawave_v1,843.6,1157.28,0.0001
256,608,7168,2048,ck,11,0,26.7479,a8w8_blockscale_bpreshuffle_1x128x128_256x32x128x256_16x16_16x16_16x16x1_16x16x1_1x32x1x8_8_2x1_intrawave_v1,667.38,921.25,0.0
256,608,7168,2304,cktile,10,0,29.8596,a8w8_blockscale_cktile_128x128x128_2x2x1_16x16x128_intrawave_0x1x0_2,672.56,891.91,0.0
256,640,7168,2048,ck,14,0,25.8103,a8w8_blockscale_bpreshuffle_1x128x128_256x64x128x128_16x16_16x16_8x32x1_8x32x1_1x32x1x8_8_2x1_intrawave_v1,728.02,975.03,0.0004
256,640,7168,2304,ck,14,0,27.7107,a8w8_blockscale_bpreshuffle_1x128x128_256x64x128x128_16x16_16x16_8x32x1_8x32x1_1x32x1x8_8_2x1_intrawave_v1,762.86,980.3,0.0001
256,672,7168,2048,ck,1,0,27.02,a8w8_blockscale_bpreshuffle_1x128x128_256x64x128x128_16x16_16x16_8x32x1_8x32x1_1x32x1x8_8_2x1_intrawave_v3,730.2,950.78,0.0
256,672,7168,2304,cktile,10,0,31.3143,a8w8_blockscale_cktile_128x128x128_2x2x1_16x16x128_intrawave_0x1x0_2,708.82,884.49,0.0
256,704,7168,2048,ck,14,0,25.8024,a8w8_blockscale_bpreshuffle_1x128x128_256x64x128x128_16x16_16x16_8x32x1_8x32x1_1x32x1x8_8_2x1_intrawave_v1,801.07,1015.97,0.0002
256,704,7168,2304,ck,13,0,29.6267,a8w8_blockscale_bpreshuffle_1x128x128_256x64x256x128_16x16_16x16_8x32x1_8x32x1_1x32x1x8_8_2x1_intrawave_v1,784.87,952.84,0.0
256,736,7168,2048,ck,1,0,29.3924,a8w8_blockscale_bpreshuffle_1x128x128_256x64x128x128_16x16_16x16_8x32x1_8x32x1_1x32x1x8_8_2x1_intrawave_v3,735.19,909.71,0.0
256,736,7168,2304,ck,1,0,30.8808,a8w8_blockscale_bpreshuffle_1x128x128_256x64x128x128_16x16_16x16_8x32x1_8x32x1_1x32x1x8_8_2x1_intrawave_v3,787.23,931.39,0.0
256,768,7168,2048,ck,14,0,25.8987,a8w8_blockscale_bpreshuffle_1x128x128_256x64x128x128_16x16_16x16_8x32x1_8x32x1_1x32x1x8_8_2x1_intrawave_v1,870.65,1052.68,0.0002
256,768,7168,2304,ck,14,0,30.1624,a8w8_blockscale_bpreshuffle_1x128x128_256x64x128x128_16x16_16x16_8x32x1_8x32x1_1x32x1x8_8_2x1_intrawave_v1,841.02,971.23,0.0001
256,800,7168,2048,ck,1,0,30.718,a8w8_blockscale_bpreshuffle_1x128x128_256x64x128x128_16x16_16x16_8x32x1_8x32x1_1x32x1x8_8_2x1_intrawave_v3,764.64,904.59,0.0
256,800,7168,2304,ck,1,0,32.7428,a8w8_blockscale_bpreshuffle_1x128x128_256x64x128x128_16x16_16x16_8x32x1_8x32x1_1x32x1x8_8_2x1_intrawave_v3,807.02,910.95,0.0
256,832,7168,2048,ck,14,0,27.9659,a8w8_blockscale_bpreshuffle_1x128x128_256x64x128x128_16x16_16x16_8x32x1_8x32x1_1x32x1x8_8_2x1_intrawave_v1,873.48,1012.36,0.0003
256,832,7168,2304,ck,13,0,29.9357,a8w8_blockscale_bpreshuffle_1x128x128_256x64x256x128_16x16_16x16_8x32x1_8x32x1_1x32x1x8_8_2x1_intrawave_v1,918.0,1014.16,0.0
256,864,7168,2048,cktile,10,0,31.7488,a8w8_blockscale_cktile_128x128x128_2x2x1_16x16x128_intrawave_0x1x0_2,799.0,908.25,0.0
256,864,7168,2304,cktile,10,0,32.7959,a8w8_blockscale_cktile_128x128x128_2x2x1_16x16x128_intrawave_0x1x0_2,870.17,941.95,0.0
256,896,7168,2048,ck,13,0,28.93,a8w8_blockscale_bpreshuffle_1x128x128_256x64x256x128_16x16_16x16_8x32x1_8x32x1_1x32x1x8_8_2x1_intrawave_v1,909.32,1014.87,0.0
256,896,7168,2304,cktile,10,0,32.9988,a8w8_blockscale_cktile_128x128x128_2x2x1_16x16x128_intrawave_0x1x0_2,896.85,952.29,0.0
256,928,7168,2048,cktile,10,0,31.6218,a8w8_blockscale_cktile_128x128x128_2x2x1_16x16x128_intrawave_0x1x0_2,861.63,945.06,0.0
256,928,7168,2304,cktile,10,0,33.7984,a8w8_blockscale_cktile_128x128x128_2x2x1_16x16x128_intrawave_0x1x0_2,906.91,945.52,0.0
256,960,7168,2048,ck,13,0,31.2896,a8w8_blockscale_bpreshuffle_1x128x128_256x64x256x128_16x16_16x16_8x32x1_8x32x1_1x32x1x8_8_2x1_intrawave_v1,900.8,971.85,0.0
256,960,7168,2304,cktile,10,0,33.584,a8w8_blockscale_cktile_128x128x128_2x2x1_16x16x128_intrawave_0x1x0_2,944.17,967.41,0.0
256,992,7168,2048,cktile,10,0,32.824,a8w8_blockscale_cktile_128x128x128_2x2x1_16x16x128_intrawave_0x1x0_2,887.32,942.39,0.0
256,992,7168,2304,cktile,10,0,34.1116,a8w8_blockscale_cktile_128x128x128_2x2x1_16x16x128_intrawave_0x1x0_2,960.55,968.06,0.0
256,1024,7168,2048,ck,13,0,31.8356,a8w8_blockscale_bpreshuffle_1x128x128_256x64x256x128_16x16_16x16_8x32x1_8x32x1_1x32x1x8_8_2x1_intrawave_v1,944.38,988.12,0.0
256,1024,7168,2304,cktile,10,0,34.2752,a8w8_blockscale_cktile_128x128x128_2x2x1_16x16x128_intrawave_0x1x0_2,986.8,978.97,0.0
256,1088,7168,2048,ck,13,0,33.6188,a8w8_blockscale_bpreshuffle_1x128x128_256x64x256x128_16x16_16x16_8x32x1_8x32x1_1x32x1x8_8_2x1_intrawave_v1,950.18,966.9,0.0
256,1088,7168,2304,cktile,10,0,35.6373,a8w8_blockscale_cktile_128x128x128_2x2x1_16x16x128_intrawave_0x1x0_2,1008.4,971.44,0.0
256,1152,7168,2048,ck,13,0,31.956,a8w8_blockscale_bpreshuffle_1x128x128_256x64x256x128_16x16_16x16_8x32x1_8x32x1_1x32x1x8_8_2x1_intrawave_v1,1058.42,1050.02,0.0
256,1152,7168,2304,cktile,10,0,36.1012,a8w8_blockscale_cktile_128x128x128_2x2x1_16x16x128_intrawave_0x1x0_2,1054.0,988.45,0.0
256,1216,7168,2048,ck,14,0,35.9228,a8w8_blockscale_bpreshuffle_1x128x128_256x64x128x128_16x16_16x16_8x32x1_8x32x1_1x32x1x8_8_2x1_intrawave_v1,993.85,963.26,0.0003
256,1216,7168,2304,cktile,11,0,41.0492,a8w8_blockscale_cktile_192x256x128_4x2x1_16x16x128_intrawave_0x1x0_1,978.45,895.25,0.0
256,1280,7168,2048,cktile,11,0,39.0156,a8w8_blockscale_cktile_192x256x128_4x2x1_16x16x128_intrawave_0x1x0_1,963.23,913.78,0.0
256,1280,7168,2304,cktile,11,0,41.5576,a8w8_blockscale_cktile_192x256x128_4x2x1_16x16x128_intrawave_0x1x0_1,1017.35,909.92,0.0
256,1344,7168,2048,cktile,11,0,38.2968,a8w8_blockscale_cktile_192x256x128_4x2x1_16x16x128_intrawave_0x1x0_1,1030.37,958.31,0.0
256,1344,7168,2304,cktile,11,0,41.5096,a8w8_blockscale_cktile_192x256x128_4x2x1_16x16x128_intrawave_0x1x0_1,1069.45,936.63,0.0
256,1408,7168,2048,cktile,11,0,38.9296,a8w8_blockscale_cktile_192x256x128_4x2x1_16x16x128_intrawave_0x1x0_1,1061.89,969.67,0.0
256,1408,7168,2304,cktile,11,0,42.876,a8w8_blockscale_cktile_192x256x128_4x2x1_16x16x128_intrawave_0x1x0_1,1084.67,931.62,0.0
256,1472,7168,2048,cktile,11,0,38.2327,a8w8_blockscale_cktile_192x256x128_4x2x1_16x16x128_intrawave_0x1x0_1,1130.4,1014.77,0.0
256,1472,7168,2304,cktile,11,0,42.4108,a8w8_blockscale_cktile_192x256x128_4x2x1_16x16x128_intrawave_0x1x0_1,1146.41,966.95,0.0
256,1536,7168,2048,cktile,11,0,40.2196,a8w8_blockscale_cktile_192x256x128_4x2x1_16x16x128_intrawave_0x1x0_1,1121.27,990.71,0.0
256,1536,7168,2304,cktile,11,0,43.1824,a8w8_blockscale_cktile_192x256x128_4x2x1_16x16x128_intrawave_0x1x0_1,1174.88,974.33,0.0
256,1600,7168,2048,cktile,11,0,38.9144,a8w8_blockscale_cktile_192x256x128_4x2x1_16x16x128_intrawave_0x1x0_1,1207.17,1050.88,0.0
256,1600,7168,2304,cktile,11,0,43.938,a8w8_blockscale_cktile_192x256x128_4x2x1_16x16x128_intrawave_0x1x0_1,1202.79,981.82,0.0
256,1664,7168,2048,cktile,11,0,41.0004,a8w8_blockscale_cktile_192x256x128_4x2x1_16x16x128_intrawave_0x1x0_1,1191.58,1022.99,0.0
256,1664,7168,2304,cktile,11,0,44.2472,a8w8_blockscale_cktile_192x256x128_4x2x1_16x16x128_intrawave_0x1x0_1,1242.16,999.02,0.0
256,1728,7168,2048,cktile,11,0,41.6596,a8w8_blockscale_cktile_192x256x128_4x2x1_16x16x128_intrawave_0x1x0_1,1217.83,1031.97,0.0
256,1728,7168,2304,cktile,11,0,45.5844,a8w8_blockscale_cktile_192x256x128_4x2x1_16x16x128_intrawave_0x1x0_1,1252.1,993.08,0.0
256,1792,7168,2048,ck,13,0,56.7725,a8w8_blockscale_bpreshuffle_1x128x128_256x64x256x128_16x16_16x16_8x32x1_8x32x1_1x32x1x8_8_2x1_intrawave_v1,926.74,775.73,0.0
256,1792,7168,2304,ck,13,0,62.2469,a8w8_blockscale_bpreshuffle_1x128x128_256x64x256x128_16x16_16x16_8x32x1_8x32x1_1x32x1x8_8_2x1_intrawave_v1,950.89,744.36,0.0
256,1856,7168,2048,ck,13,0,56.3733,a8w8_blockscale_bpreshuffle_1x128x128_256x64x256x128_16x16_16x16_8x32x1_8x32x1_1x32x1x8_8_2x1_intrawave_v1,966.63,799.82,0.0
256,1856,7168,2304,cktile,10,0,63.6644,a8w8_blockscale_cktile_128x128x128_2x2x1_16x16x128_intrawave_0x1x0_2,962.92,744.51,0.0
256,1920,7168,2048,ck,13,0,56.1169,a8w8_blockscale_bpreshuffle_1x128x128_256x64x256x128_16x16_16x16_8x32x1_8x32x1_1x32x1x8_8_2x1_intrawave_v1,1004.54,822.16,0.0
256,1920,7168,2304,ck,13,0,62.9845,a8w8_blockscale_bpreshuffle_1x128x128_256x64x256x128_16x16_16x16_8x32x1_8x32x1_1x32x1x8_8_2x1_intrawave_v1,1006.88,769.46,0.0
256,1984,7168,2048,ck,13,0,58.7289,a8w8_blockscale_bpreshuffle_1x128x128_256x64x256x128_16x16_16x16_8x32x1_8x32x1_1x32x1x8_8_2x1_intrawave_v1,991.85,803.45,0.0
256,1984,7168,2304,cktile,10,0,64.8445,a8w8_blockscale_cktile_128x128x128_2x2x1_16x16x128_intrawave_0x1x0_2,1010.6,763.81,0.0
256,2048,7168,2048,cktile,10,0,61.2953,a8w8_blockscale_cktile_128x128x128_2x2x1_16x16x128_intrawave_0x1x0_2,980.98,786.92,0.0
256,2048,7168,2304,ck,13,0,65.5189,a8w8_blockscale_bpreshuffle_1x128x128_256x64x256x128_16x16_16x16_8x32x1_8x32x1_1x32x1x8_8_2x1_intrawave_v1,1032.46,772.2,0.0
256,4096,7168,2048,cktile,11,0,106.7422,a8w8_blockscale_cktile_192x256x128_4x2x1_16x16x128_intrawave_0x1x0_1,1126.63,766.23,0.0
256,4096,7168,2304,cktile,11,0,117.5296,a8w8_blockscale_cktile_192x256x128_4x2x1_16x16x128_intrawave_0x1x0_1,1151.13,720.44,0.0
256,8192,7168,2048,cktile,11,0,187.1224,a8w8_blockscale_cktile_192x256x128_4x2x1_16x16x128_intrawave_0x1x0_1,1285.35,795.72,0.0
256,8192,7168,2304,cktile,11,0,198.6652,a8w8_blockscale_cktile_192x256x128_4x2x1_16x16x128_intrawave_0x1x0_1,1362.0,769.28,0.0
256,16384,7168,2048,cktile,11,0,342.0215,a8w8_blockscale_cktile_192x256x128_4x2x1_16x16x128_intrawave_0x1x0_1,1406.45,827.77,0.0
256,16384,7168,2304,cktile,11,0,370.8923,a8w8_blockscale_cktile_192x256x128_4x2x1_16x16x128_intrawave_0x1x0_1,1459.09,779.59,0.0
256,32768,7168,2048,cktile,11,0,674.6093,a8w8_blockscale_cktile_192x256x128_4x2x1_16x16x128_intrawave_0x1x0_1,1426.12,817.59,0.0
256,32768,7168,2304,cktile,11,0,727.2953,a8w8_blockscale_cktile_192x256x128_4x2x1_16x16x128_intrawave_0x1x0_1,1488.16,772.42,0.0
256,16,8192,1536,ck,7,0,6.7889,a8w8_blockscale_bpreshuffle_1x128x128_256x16x64x256_16x16_16x16_16x16x1_16x16x1_1x16x1x16_4_1x1_intrawave_v1,59.31,1895.69,0.0
256,32,8192,1536,ck,7,0,7.0,a8w8_blockscale_bpreshuffle_1x128x128_256x16x64x256_16x16_16x16_16x16x1_16x16x1_1x16x1x16_4_1x1_intrawave_v1,115.04,1879.48,0.0
256,48,8192,1536,ck,6,0,7.6765,a8w8_blockscale_bpreshuffle_1x128x128_256x16x128x256_16x16_16x16_16x16x1_16x16x1_1x16x1x16_8_1x2_intrawave_v1,157.36,1751.2,0.0
256,64,8192,1536,ck,12,0,7.5149,a8w8_blockscale_bpreshuffle_1x128x128_256x32x64x256_16x16_16x16_16x16x1_16x16x1_1x32x1x8_8_2x1_intrawave_v1,214.32,1827.01,0.0
256,80,8192,1536,ck,12,0,8.4722,a8w8_blockscale_bpreshuffle_1x128x128_256x32x64x256_16x16_16x16_16x16x1_16x16x1_1x32x1x8_8_2x1_intrawave_v1,237.63,1654.41,0.0
256,96,8192,1536,ck,12,0,8.759,a8w8_blockscale_bpreshuffle_1x128x128_256x32x64x256_16x16_16x16_16x16x1_16x16x1_1x32x1x8_8_2x1_intrawave_v1,275.82,1632.98,0.0
256,112,8192,1536,ck,12,0,8.8795,a8w8_blockscale_bpreshuffle_1x128x128_256x32x64x256_16x16_16x16_16x16x1_16x16x1_1x32x1x8_8_2x1_intrawave_v1,317.42,1643.11,0.0
256,128,8192,1536,ck,17,0,8.8535,a8w8_blockscale_bpreshuffle_1x128x128_256x64x64x256_16x16_16x16_16x16x1_16x16x1_1x32x1x8_8_2x1_intrawave_v1,363.84,1680.32,0.0
256,144,8192,1536,ck,10,0,11.1879,a8w8_blockscale_bpreshuffle_1x128x128_256x32x64x128_16x16_16x16_8x32x1_8x32x1_1x32x1x8_8_2x1_intrawave_v1,323.91,1355.34,0.0198
256,160,8192,1536,ck,10,0,11.2517,a8w8_blockscale_bpreshuffle_1x128x128_256x32x64x128_16x16_16x16_8x32x1_8x32x1_1x32x1x8_8_2x1_intrawave_v1,357.86,1373.14,0.0245
256,176,8192,1536,ck,10,0,11.4084,a8w8_blockscale_bpreshuffle_1x128x128_256x32x64x128_16x16_16x16_8x32x1_8x32x1_1x32x1x8_8_2x1_intrawave_v1,388.24,1379.41,0.0218
256,192,8192,1536,ck,12,0,11.427,a8w8_blockscale_bpreshuffle_1x128x128_256x32x64x256_16x16_16x16_16x16x1_16x16x1_1x32x1x8_8_2x1_intrawave_v1,422.84,1402.25,0.0
256,208,8192,1536,ck,11,0,12.2646,a8w8_blockscale_bpreshuffle_1x128x128_256x32x128x256_16x16_16x16_16x16x1_16x16x1_1x32x1x8_8_2x1_intrawave_v1,426.8,1329.87,0.0
256,224,8192,1536,ck,11,0,12.2766,a8w8_blockscale_bpreshuffle_1x128x128_256x32x128x256_16x16_16x16_16x16x1_16x16x1_1x32x1x8_8_2x1_intrawave_v1,459.18,1351.92,0.0
256,240,8192,1536,ck,11,0,12.7327,a8w8_blockscale_bpreshuffle_1x128x128_256x32x128x256_16x16_16x16_16x16x1_16x16x1_1x32x1x8_8_2x1_intrawave_v1,474.35,1326.01,0.0
256,256,8192,1536,ck,17,0,12.0834,a8w8_blockscale_bpreshuffle_1x128x128_256x64x64x256_16x16_16x16_16x16x1_16x16x1_1x32x1x8_8_2x1_intrawave_v1,533.17,1420.99,0.0
256,288,8192,1536,ck,9,0,15.7181,a8w8_blockscale_bpreshuffle_1x128x128_256x32x128x128_16x16_16x16_8x32x1_8x32x1_1x32x1x8_8_2x1_intrawave_v1,461.11,1128.88,0.0
256,320,8192,1536,ck,11,0,15.2142,a8w8_blockscale_bpreshuffle_1x128x128_256x32x128x256_16x16_16x16_16x16x1_16x16x1_1x32x1x8_8_2x1_intrawave_v1,529.31,1203.96,0.0
256,352,8192,1536,ck,11,0,15.5319,a8w8_blockscale_bpreshuffle_1x128x128_256x32x128x256_16x16_16x16_16x16x1_16x16x1_1x32x1x8_8_2x1_intrawave_v1,570.33,1216.26,0.0
256,384,8192,1536,ck,15,0,16.1084,a8w8_blockscale_bpreshuffle_1x128x128_256x64x64x128_16x16_16x16_8x32x1_8x32x1_1x32x1x8_8_2x1_intrawave_v1,599.92,1208.33,0.0021
256,416,8192,1536,ck,14,0,17.8496,a8w8_blockscale_bpreshuffle_1x128x128_256x64x128x128_16x16_16x16_8x32x1_8x32x1_1x32x1x8_8_2x1_intrawave_v1,586.51,1122.58,0.0
256,448,8192,1536,ck,14,0,16.9035,a8w8_blockscale_bpreshuffle_1x128x128_256x64x128x128_16x16_16x16_8x32x1_8x32x1_1x32x1x8_8_2x1_intrawave_v1,666.98,1219.34,0.0
256,480,8192,1536,ck,14,0,18.0668,a8w8_blockscale_bpreshuffle_1x128x128_256x64x128x128_16x16_16x16_8x32x1_8x32x1_1x32x1x8_8_2x1_intrawave_v1,668.61,1172.57,0.0
256,512,8192,1536,ck,14,0,16.8753,a8w8_blockscale_bpreshuffle_1x128x128_256x64x128x128_16x16_16x16_8x32x1_8x32x1_1x32x1x8_8_2x1_intrawave_v1,763.54,1289.34,0.0
256,544,8192,1536,cktile,10,0,22.8667,a8w8_blockscale_cktile_128x128x128_2x2x1_16x16x128_intrawave_0x1x0_2,598.7,976.59,0.0
256,576,8192,1536,ck,14,0,22.0163,a8w8_blockscale_bpreshuffle_1x128x128_256x64x128x128_16x16_16x16_8x32x1_8x32x1_1x32x1x8_8_2x1_intrawave_v1,658.4,1040.36,0.0
256,608,8192,1536,ck,11,0,22.6727,a8w8_blockscale_bpreshuffle_1x128x128_256x32x128x256_16x16_16x16_16x16x1_16x16x1_1x32x1x8_8_2x1_intrawave_v1,674.86,1035.53,0.0
256,640,8192,1536,ck,14,0,22.2663,a8w8_blockscale_bpreshuffle_1x128x128_256x64x128x128_16x16_16x16_8x32x1_8x32x1_1x32x1x8_8_2x1_intrawave_v1,723.34,1080.18,0.0001
256,672,8192,1536,ck,1,0,23.6039,a8w8_blockscale_bpreshuffle_1x128x128_256x64x128x128_16x16_16x16_8x32x1_8x32x1_1x32x1x8_8_2x1_intrawave_v3,716.47,1043.27,0.0
256,704,8192,1536,ck,14,0,23.0263,a8w8_blockscale_bpreshuffle_1x128x128_256x64x128x128_16x16_16x16_8x32x1_8x32x1_1x32x1x8_8_2x1_intrawave_v1,769.41,1094.34,0.0001
256,736,8192,1536,cktile,10,0,24.9207,a8w8_blockscale_cktile_128x128x128_2x2x1_16x16x128_intrawave_0x1x0_2,743.24,1034.16,0.0
256,768,8192,1536,ck,14,0,22.7644,a8w8_blockscale_bpreshuffle_1x128x128_256x64x128x128_16x16_16x16_8x32x1_8x32x1_1x32x1x8_8_2x1_intrawave_v1,849.02,1157.31,0.0002
256,800,8192,1536,cktile,10,0,25.3271,a8w8_blockscale_cktile_128x128x128_2x2x1_16x16x128_intrawave_0x1x0_2,794.91,1062.85,0.0
256,832,8192,1536,ck,13,0,25.4933,a8w8_blockscale_bpreshuffle_1x128x128_256x64x256x128_16x16_16x16_8x32x1_8x32x1_1x32x1x8_8_2x1_intrawave_v1,821.31,1078.41,0.0
256,864,8192,1536,cktile,10,0,25.4111,a8w8_blockscale_cktile_128x128x128_2x2x1_16x16x128_intrawave_0x1x0_2,855.66,1104.47,0.0
256,896,8192,1536,cktile,10,0,25.6275,a8w8_blockscale_cktile_128x128x128_2x2x1_16x16x128_intrawave_0x1x0_2,879.86,1117.52,0.0
256,928,8192,1536,cktile,10,0,27.4135,a8w8_blockscale_cktile_128x128x128_2x2x1_16x16x128_intrawave_0x1x0_2,851.91,1065.63,0.0
256,960,8192,1536,ck,13,0,26.8495,a8w8_blockscale_bpreshuffle_1x128x128_256x64x256x128_16x16_16x16_8x32x1_8x32x1_1x32x1x8_8_2x1_intrawave_v1,899.8,1109.37,0.0
256,992,8192,1536,cktile,10,0,27.4052,a8w8_blockscale_cktile_128x128x128_2x2x1_16x16x128_intrawave_0x1x0_2,910.94,1107.8,0.0
256,1024,8192,1536,cktile,10,0,27.2768,a8w8_blockscale_cktile_128x128x128_2x2x1_16x16x128_intrawave_0x1x0_2,944.75,1134.04,0.0
256,1088,8192,1536,cktile,11,0,31.9941,a8w8_blockscale_cktile_192x256x128_4x2x1_16x16x128_intrawave_0x1x0_1,855.8,1002.68,0.0
256,1152,8192,1536,cktile,11,0,31.9284,a8w8_blockscale_cktile_192x256x128_4x2x1_16x16x128_intrawave_0x1x0_1,908.0,1040.66,0.0
256,1216,8192,1536,cktile,11,0,32.6102,a8w8_blockscale_cktile_192x256x128_4x2x1_16x16x128_intrawave_0x1x0_1,938.41,1054.08,0.0
256,1280,8192,1536,cktile,11,0,32.4396,a8w8_blockscale_cktile_192x256x128_4x2x1_16x16x128_intrawave_0x1x0_1,992.99,1094.97,0.0
256,1344,8192,1536,cktile,11,0,32.7073,a8w8_blockscale_cktile_192x256x128_4x2x1_16x16x128_intrawave_0x1x0_1,1034.11,1121.08,0.0
256,1408,8192,1536,cktile,11,0,33.756,a8w8_blockscale_cktile_192x256x128_4x2x1_16x16x128_intrawave_0x1x0_1,1049.69,1120.22,0.0
256,1472,8192,1536,cktile,11,0,34.0296,a8w8_blockscale_cktile_192x256x128_4x2x1_16x16x128_intrawave_0x1x0_1,1088.58,1144.92,0.0
256,1536,8192,1536,cktile,11,0,34.31,a8w8_blockscale_cktile_192x256x128_4x2x1_16x16x128_intrawave_0x1x0_1,1126.63,1168.99,0.0
256,1600,8192,1536,ck,14,0,46.8101,a8w8_blockscale_bpreshuffle_1x128x128_256x64x128x128_16x16_16x16_8x32x1_8x32x1_1x32x1x8_8_2x1_intrawave_v1,860.18,881.33,0.0003
256,1664,8192,1536,ck,13,0,45.4304,a8w8_blockscale_bpreshuffle_1x128x128_256x64x256x128_16x16_16x16_8x32x1_8x32x1_1x32x1x8_8_2x1_intrawave_v1,921.76,933.34,0.0
256,1728,8192,1536,ck,13,0,46.8841,a8w8_blockscale_bpreshuffle_1x128x128_256x64x256x128_16x16_16x16_8x32x1_8x32x1_1x32x1x8_8_2x1_intrawave_v1,927.53,928.86,0.0
256,1792,8192,1536,ck,13,0,49.0521,a8w8_blockscale_bpreshuffle_1x128x128_256x64x256x128_16x16_16x16_8x32x1_8x32x1_1x32x1x8_8_2x1_intrawave_v1,919.37,911.19,0.0
256,1856,8192,1536,ck,13,0,49.6693,a8w8_blockscale_bpreshuffle_1x128x128_256x64x256x128_16x16_16x16_8x32x1_8x32x1_1x32x1x8_8_2x1_intrawave_v1,940.38,922.95,0.0
256,1920,8192,1536,ck,13,0,50.9425,a8w8_blockscale_bpreshuffle_1x128x128_256x64x256x128_16x16_16x16_8x32x1_8x32x1_1x32x1x8_8_2x1_intrawave_v1,948.49,922.4,0.0
256,1984,8192,1536,cktile,10,0,50.9229,a8w8_blockscale_cktile_128x128x128_2x2x1_16x16x128_intrawave_0x1x0_2,980.48,945.28,0.0
256,2048,8192,1536,cktile,10,0,52.3313,a8w8_blockscale_cktile_128x128x128_2x2x1_16x16x128_intrawave_0x1x0_2,984.87,941.75,0.0
256,4096,8192,1536,cktile,11,0,96.3063,a8w8_blockscale_cktile_192x256x128_4x2x1_16x16x128_intrawave_0x1x0_1,1070.33,892.81,0.0
256,8192,8192,1536,ck,13,0,179.6331,a8w8_blockscale_bpreshuffle_1x128x128_256x64x256x128_16x16_16x16_8x32x1_8x32x1_1x32x1x8_8_2x1_intrawave_v1,1147.66,887.27,0.0
256,16384,8192,1536,cktile,11,0,342.0146,a8w8_blockscale_cktile_192x256x128_4x2x1_16x16x128_intrawave_0x1x0_1,1205.55,895.24,0.0
256,32768,8192,1536,ck,13,0,671.1189,a8w8_blockscale_bpreshuffle_1x128x128_256x64x256x128_16x16_16x16_8x32x1_8x32x1_1x32x1x8_8_2x1_intrawave_v1,1228.74,893.71,0.0
256,16,11264,1536,ck,7,0,7.2084,a8w8_blockscale_bpreshuffle_1x128x128_256x16x64x256_16x16_16x16_16x16x1_16x16x1_1x16x1x16_4_1x1_intrawave_v1,76.81,2453.6,0.0
256,32,11264,1536,ck,12,0,7.9603,a8w8_blockscale_bpreshuffle_1x128x128_256x32x64x256_16x16_16x16_16x16x1_16x16x1_1x32x1x8_8_2x1_intrawave_v1,139.1,2270.21,0.0
256,48,11264,1536,ck,7,0,8.4141,a8w8_blockscale_bpreshuffle_1x128x128_256x16x64x256_16x16_16x16_16x16x1_16x16x1_1x16x1x16_4_1x1_intrawave_v1,197.4,2193.53,0.0
256,64,11264,1536,ck,17,0,9.1016,a8w8_blockscale_bpreshuffle_1x128x128_256x64x64x256_16x16_16x16_16x16x1_16x16x1_1x32x1x8_8_2x1_intrawave_v1,243.32,2070.14,0.0
256,80,11264,1536,cktile,3,0,10.6633,a8w8_blockscale_cktile_16x128x256_1x4x1_16x16x64_intrawave_0x1x0_2,259.6,1803.07,0.0
256,96,11264,1536,ck,12,0,11.1478,a8w8_blockscale_bpreshuffle_1x128x128_256x32x64x256_16x16_16x16_16x16x1_16x16x1_1x32x1x8_8_2x1_intrawave_v1,297.99,1759.24,0.0
256,112,11264,1536,ck,12,0,11.5147,a8w8_blockscale_bpreshuffle_1x128x128_256x32x64x256_16x16_16x16_16x16x1_16x16x1_1x32x1x8_8_2x1_intrawave_v1,336.57,1736.62,0.0
256,128,11264,1536,ck,12,0,11.5032,a8w8_blockscale_bpreshuffle_1x128x128_256x32x64x256_16x16_16x16_16x16x1_16x16x1_1x32x1x8_8_2x1_intrawave_v1,385.04,1771.83,0.0
256,144,11264,1536,ck,9,0,12.8943,a8w8_blockscale_bpreshuffle_1x128x128_256x32x128x128_16x16_16x16_8x32x1_8x32x1_1x32x1x8_8_2x1_intrawave_v1,386.44,1610.53,0.0
256,160,11264,1536,ck,9,0,13.0627,a8w8_blockscale_bpreshuffle_1x128x128_256x32x128x128_16x16_16x16_8x32x1_8x32x1_1x32x1x8_8_2x1_intrawave_v1,423.84,1619.25,0.0
256,176,11264,1536,ck,9,0,14.4861,a8w8_blockscale_bpreshuffle_1x128x128_256x32x128x128_16x16_16x16_8x32x1_8x32x1_1x32x1x8_8_2x1_intrawave_v1,420.41,1486.72,0.0
256,192,11264,1536,ck,15,0,14.4058,a8w8_blockscale_bpreshuffle_1x128x128_256x64x64x128_16x16_16x16_8x32x1_8x32x1_1x32x1x8_8_2x1_intrawave_v1,461.19,1521.73,0.0009
256,208,11264,1536,ck,9,0,15.8293,a8w8_blockscale_bpreshuffle_1x128x128_256x32x128x128_16x16_16x16_8x32x1_8x32x1_1x32x1x8_8_2x1_intrawave_v1,454.69,1409.21,0.0
256,224,11264,1536,ck,11,0,15.5754,a8w8_blockscale_bpreshuffle_1x128x128_256x32x128x256_16x16_16x16_16x16x1_16x16x1_1x32x1x8_8_2x1_intrawave_v1,497.65,1456.9,0.0
256,240,11264,1536,ck,9,0,16.1857,a8w8_blockscale_bpreshuffle_1x128x128_256x32x128x128_16x16_16x16_8x32x1_8x32x1_1x32x1x8_8_2x1_intrawave_v1,513.09,1425.76,0.0
256,256,11264,1536,ck,11,0,16.0891,a8w8_blockscale_bpreshuffle_1x128x128_256x32x128x256_16x16_16x16_16x16x1_16x16x1_1x32x1x8_8_2x1_intrawave_v1,550.58,1458.25,0.0
256,288,11264,1536,ck,14,0,17.4005,a8w8_blockscale_bpreshuffle_1x128x128_256x64x128x128_16x16_16x16_8x32x1_8x32x1_1x32x1x8_8_2x1_intrawave_v1,572.72,1392.6,0.0
256,320,11264,1536,ck,14,0,17.2458,a8w8_blockscale_bpreshuffle_1x128x128_256x64x128x128_16x16_16x16_8x32x1_8x32x1_1x32x1x8_8_2x1_intrawave_v1,642.07,1449.74,0.0
256,352,11264,1536,ck,11,0,19.8905,a8w8_blockscale_bpreshuffle_1x128x128_256x32x128x256_16x16_16x16_16x16x1_16x16x1_1x32x1x8_8_2x1_intrawave_v1,612.37,1295.7,0.0
256,384,11264,1536,ck,14,0,21.4537,a8w8_blockscale_bpreshuffle_1x128x128_256x64x128x128_16x16_16x16_8x32x1_8x32x1_1x32x1x8_8_2x1_intrawave_v1,619.36,1237.18,0.0
256,416,11264,1536,ck,1,0,23.3951,a8w8_blockscale_bpreshuffle_1x128x128_256x64x128x128_16x16_16x16_8x32x1_8x32x1_1x32x1x8_8_2x1_intrawave_v3,615.29,1167.43,0.0
256,448,11264,1536,ck,14,0,22.2573,a8w8_blockscale_bpreshuffle_1x128x128_256x64x128x128_16x16_16x16_8x32x1_8x32x1_1x32x1x8_8_2x1_intrawave_v1,696.5,1261.71,0.0001
256,480,11264,1536,cktile,10,0,23.8643,a8w8_blockscale_cktile_128x128x128_2x2x1_16x16x128_intrawave_0x1x0_2,696.0,1209.01,0.0
256,512,11264,1536,ck,14,0,22.9422,a8w8_blockscale_bpreshuffle_1x128x128_256x64x128x128_16x16_16x16_8x32x1_8x32x1_1x32x1x8_8_2x1_intrawave_v1,772.23,1291.17,0.0001
256,544,11264,1536,cktile,10,0,25.0252,a8w8_blockscale_cktile_128x128x128_2x2x1_16x16x128_intrawave_0x1x0_2,752.2,1214.47,0.0
256,576,11264,1536,cktile,10,0,25.3655,a8w8_blockscale_cktile_128x128x128_2x2x1_16x16x128_intrawave_0x1x0_2,785.77,1228.53,0.0
256,608,11264,1536,cktile,10,0,25.3047,a8w8_blockscale_cktile_128x128x128_2x2x1_16x16x128_intrawave_0x1x0_2,831.41,1261.92,0.0
256,640,11264,1536,cktile,10,0,25.6742,a8w8_blockscale_cktile_128x128x128_2x2x1_16x16x128_intrawave_0x1x0_2,862.58,1273.75,0.0
256,672,11264,1536,cktile,11,0,31.2436,a8w8_blockscale_cktile_192x256x128_4x2x1_16x16x128_intrawave_0x1x0_1,744.26,1071.34,0.0
256,704,11264,1536,ck,13,0,27.1272,a8w8_blockscale_bpreshuffle_1x128x128_256x64x256x128_16x16_16x16_8x32x1_8x32x1_1x32x1x8_8_2x1_intrawave_v1,898.01,1262.3,0.0
256,736,11264,1536,cktile,11,0,31.5974,a8w8_blockscale_cktile_192x256x128_4x2x1_16x16x128_intrawave_0x1x0_1,806.01,1108.09,0.0
256,768,11264,1536,cktile,11,0,32.2464,a8w8_blockscale_cktile_192x256x128_4x2x1_16x16x128_intrawave_0x1x0_1,824.13,1109.66,0.0
256,800,11264,1536,cktile,11,0,32.3583,a8w8_blockscale_cktile_192x256x128_4x2x1_16x16x128_intrawave_0x1x0_1,855.5,1129.62,0.0
256,832,11264,1536,cktile,11,0,32.5996,a8w8_blockscale_cktile_192x256x128_4x2x1_16x16x128_intrawave_0x1x0_1,883.13,1144.88,0.0
256,864,11264,1536,cktile,11,0,33.512,a8w8_blockscale_cktile_192x256x128_4x2x1_16x16x128_intrawave_0x1x0_1,892.13,1136.69,0.0
256,896,11264,1536,cktile,11,0,32.5428,a8w8_blockscale_cktile_192x256x128_4x2x1_16x16x128_intrawave_0x1x0_1,952.72,1194.21,0.0
256,928,11264,1536,cktile,11,0,33.5816,a8w8_blockscale_cktile_192x256x128_4x2x1_16x16x128_intrawave_0x1x0_1,956.23,1180.2,0.0
256,960,11264,1536,cktile,11,0,32.7413,a8w8_blockscale_cktile_192x256x128_4x2x1_16x16x128_intrawave_0x1x0_1,1014.59,1234.01,0.0
256,992,11264,1536,cktile,10,0,41.9266,a8w8_blockscale_cktile_128x128x128_2x2x1_16x16x128_intrawave_0x1x0_2,818.72,982.03,0.0
256,1024,11264,1536,ck,13,0,41.7492,a8w8_blockscale_bpreshuffle_1x128x128_256x64x256x128_16x16_16x16_8x32x1_8x32x1_1x32x1x8_8_2x1_intrawave_v1,848.72,1004.64,0.0
256,1088,11264,1536,ck,13,0,40.3176,a8w8_blockscale_bpreshuffle_1x128x128_256x64x256x128_16x16_16x16_8x32x1_8x32x1_1x32x1x8_8_2x1_intrawave_v1,933.79,1078.51,0.0
256,1152,11264,1536,cktile,10,0,46.8041,a8w8_blockscale_cktile_128x128x128_2x2x1_16x16x128_intrawave_0x1x0_2,851.69,961.95,0.0
256,1216,11264,1536,ck,13,0,45.6116,a8w8_blockscale_bpreshuffle_1x128x128_256x64x256x128_16x16_16x16_8x32x1_8x32x1_1x32x1x8_8_2x1_intrawave_v1,922.51,1020.87,0.0
256,1280,11264,1536,ck,14,0,46.55,a8w8_blockscale_bpreshuffle_1x128x128_256x64x128x128_16x16_16x16_8x32x1_8x32x1_1x32x1x8_8_2x1_intrawave_v1,951.49,1033.37,0.0003
256,1344,11264,1536,cktile,10,0,50.5969,a8w8_blockscale_cktile_128x128x128_2x2x1_16x16x128_intrawave_0x1x0_2,919.16,981.16,0.0
256,1408,11264,1536,cktile,10,0,49.6349,a8w8_blockscale_cktile_128x128x128_2x2x1_16x16x128_intrawave_0x1x0_2,981.59,1031.2,0.0
256,1472,11264,1536,ck,13,0,52.1893,a8w8_blockscale_bpreshuffle_1x128x128_256x64x256x128_16x16_16x16_8x32x1_8x32x1_1x32x1x8_8_2x1_intrawave_v1,975.98,1010.24,0.0
256,1536,11264,1536,ck,13,0,58.2381,a8w8_blockscale_bpreshuffle_1x128x128_256x64x256x128_16x16_16x16_8x32x1_8x32x1_1x32x1x8_8_2x1_intrawave_v1,912.64,931.76,0.0
256,1600,11264,1536,ck,13,0,59.7053,a8w8_blockscale_bpreshuffle_1x128x128_256x64x256x128_16x16_16x16_8x32x1_8x32x1_1x32x1x8_8_2x1_intrawave_v1,927.3,934.66,0.0
256,1664,11264,1536,ck,13,0,59.6349,a8w8_blockscale_bpreshuffle_1x128x128_256x64x256x128_16x16_16x16_8x32x1_8x32x1_1x32x1x8_8_2x1_intrawave_v1,965.53,961.58,0.0
256,1728,11264,1536,ck,13,0,59.0929,a8w8_blockscale_bpreshuffle_1x128x128_256x64x256x128_16x16_16x16_8x32x1_8x32x1_1x32x1x8_8_2x1_intrawave_v1,1011.86,996.47,0.0
256,1792,11264,1536,ck,13,0,61.6749,a8w8_blockscale_bpreshuffle_1x128x128_256x64x256x128_16x16_16x16_8x32x1_8x32x1_1x32x1x8_8_2x1_intrawave_v1,1005.41,979.72,0.0
256,1856,11264,1536,cktile,11,0,64.3449,a8w8_blockscale_cktile_192x256x128_4x2x1_16x16x128_intrawave_0x1x0_1,998.11,963.0,0.0
256,1920,11264,1536,cktile,11,0,66.039,a8w8_blockscale_cktile_192x256x128_4x2x1_16x16x128_intrawave_0x1x0_1,1006.04,961.62,0.0
256,1984,11264,1536,cktile,11,0,65.217,a8w8_blockscale_cktile_192x256x128_4x2x1_16x16x128_intrawave_0x1x0_1,1052.68,997.35,0.0
256,2048,11264,1536,cktile,11,0,66.091,a8w8_blockscale_cktile_192x256x128_4x2x1_16x16x128_intrawave_0x1x0_1,1072.26,1007.47,0.0
256,4096,11264,1536,cktile,11,0,125.4256,a8w8_blockscale_cktile_192x256x128_4x2x1_16x16x128_intrawave_0x1x0_1,1130.02,923.8,0.0
256,8192,11264,1536,ck,13,0,236.67,a8w8_blockscale_bpreshuffle_1x128x128_256x64x256x128_16x16_16x16_8x32x1_8x32x1_1x32x1x8_8_2x1_intrawave_v1,1197.73,906.05,0.0
256,16384,11264,1536,cktile,11,0,462.2531,a8w8_blockscale_cktile_192x256x128_4x2x1_16x16x128_intrawave_0x1x0_1,1226.46,890.35,0.0
256,32768,11264,1536,cktile,11,0,898.663,a8w8_blockscale_cktile_192x256x128_4x2x1_16x16x128_intrawave_0x1x0_1,1261.73,896.7,0.0
