aiter/configs/model_configs/dsv3_a8w8_bpreshuffle_tuned_gemm.csv
cu_num,M,N,K,q_dtype_w,libtype,kernelId,splitK,us,kernelName,tflops,bw,errRatio
256,1,6144,1536,torch.float8_e4m3fn,ck,5,0,5.7647,a8w8_bpreshuffle_256x16x64x512_16x16_16x16_32x8x1_32x8x1_1x16x1x16_4x4x1_1x1_intrawave_v1,3.27,1639.46,0.0
256,2,6144,1536,torch.float8_e4m3fn,ck,10,0,5.7535,a8w8_bpreshuffle_128x16x32x512_16x16_16x16_32x4x1_32x4x1_1x16x1x8_4x4x1_1x1_intrawave_v1,6.56,1645.06,0.0
256,4,6144,1536,torch.float8_e4m3fn,ck,10,0,5.7738,a8w8_bpreshuffle_128x16x32x512_16x16_16x16_32x4x1_32x4x1_1x16x1x8_4x4x1_1x1_intrawave_v1,13.08,1644.06,0.0
256,8,6144,1536,torch.float8_e4m3fn,ck,10,0,5.824,a8w8_bpreshuffle_128x16x32x512_16x16_16x16_32x4x1_32x4x1_1x16x1x8_4x4x1_1x1_intrawave_v1,25.93,1639.38,0.0
256,16,6144,1536,torch.float8_e4m3fn,ck,10,0,5.8011,a8w8_bpreshuffle_128x16x32x512_16x16_16x16_32x4x1_32x4x1_1x16x1x8_4x4x1_1x1_intrawave_v1,52.06,1664.92,0.0
256,32,6144,1536,torch.float8_e4m3fn,ck,10,0,6.0087,a8w8_bpreshuffle_128x16x32x512_16x16_16x16_32x4x1_32x4x1_1x16x1x8_4x4x1_1x1_intrawave_v1,100.52,1644.21,0.0
256,64,6144,1536,torch.float8_e4m3fn,ck,5,0,6.8238,a8w8_bpreshuffle_256x16x64x512_16x16_16x16_32x8x1_32x8x1_1x16x1x16_4x4x1_1x1_intrawave_v1,177.02,1512.64,0.0
256,128,6144,1536,torch.float8_e4m3fn,ck,119,0,7.7745,a8w8_bpreshuffle_256x32x128x256_16x16_16x16_16x16x1_16x16x1_1x16x1x16_8x8x1_1x2_intrawave_v1,310.75,1441.46,0.0
256,256,6144,1536,torch.float8_e4m3fn,ck,112,0,10.024,a8w8_bpreshuffle_256x32x64x256_16x16_16x16_16x16x1_16x16x1_1x32x1x8_8x8x1_2x1_intrawave_v1,482.03,1294.51,0.0
256,512,6144,1536,torch.float8_e4m3fn,ck,77,0,12.9924,a8w8_bpreshuffle_256x64x64x128_16x16_16x16_8x32x1_8x32x1_1x32x1x8_8x8x1_2x1_intrawave_v3,743.79,1271.13,0.0
256,1024,6144,1536,torch.float8_e4m3fn,ck,121,0,19.3447,a8w8_bpreshuffle_256x64x128x256_16x16_16x16_16x16x1_16x16x1_1x16x1x16_8x8x1_1x2_intrawave_v3,999.1,1219.61,0.0
256,2048,6144,1536,torch.float8_e4m3fn,ck,68,0,30.1273,a8w8_bpreshuffle_256x128x192x128_16x16_16x16_8x32x1_8x32x1_1x32x1x8_8x8x1_2x1_intrawave_v3,1283.05,1252.97,0.0
256,4096,6144,1536,torch.float8_e4m3fn,ck,141,0,57.5611,a8w8_bpreshuffle_256x160x128x128_16x16_16x16_8x32x1_8x32x1_1x16x1x16_8x8x1_1x2_intrawave_v3,1343.08,1147.66,0.0
256,8192,6144,1536,torch.float8_e4m3fn,ck,141,0,103.7775,a8w8_bpreshuffle_256x160x128x128_16x16_16x16_8x32x1_8x32x1_1x16x1x16_8x8x1_1x2_intrawave_v3,1489.91,1182.18,0.0
256,16384,6144,1536,torch.float8_e4m3fn,ck,143,0,190.1067,a8w8_bpreshuffle_256x192x128x128_16x16_16x16_8x32x1_8x32x1_1x16x1x16_8x8x1_1x2_intrawave_v3,1626.65,1241.04,0.0
256,1,7168,4096,torch.float8_e4m3fn,cktile,138,0,9.338,a8w8_bpreshuffle_cktile_0x0x8x4x1x0x0x0x0x4_16x64x512_1x4x1_16x16x128_default,6.29,3146.13,0.0
256,2,7168,4096,torch.float8_e4m3fn,ck,10,0,9.2269,a8w8_bpreshuffle_128x16x32x512_16x16_16x16_32x4x1_32x4x1_1x16x1x8_4x4x1_1x1_intrawave_v1,12.73,3186.01,0.0
256,4,7168,4096,torch.float8_e4m3fn,cktile,138,0,9.5269,a8w8_bpreshuffle_cktile_0x0x8x4x1x0x0x0x0x4_16x64x512_1x4x1_16x16x128_default,24.65,3089.55,0.0
256,8,7168,4096,torch.float8_e4m3fn,cktile,2,0,9.6702,a8w8_bpreshuffle_cktile_0x0x8x4x1x0x0x0x0x1_16x64x512_1x4x1_16x16x128_default,48.58,3051.39,0.0
256,16,7168,4096,torch.float8_e4m3fn,ck,24,0,8.9318,a8w8_bpreshuffle_128x16x32x512_16x16_16x16_32x4x1_32x4x1_1x16x1x8_4x4x1_1x1_intrawave_v2,105.19,3320.16,0.0
256,32,7168,4096,torch.float8_e4m3fn,cktile,137,0,9.7916,a8w8_bpreshuffle_cktile_0x0x8x4x1x0x0x0x0x3_16x64x512_1x4x1_16x16x128_default,191.9,3058.74,0.0
256,64,7168,4096,torch.float8_e4m3fn,cktile,37,0,11.3316,a8w8_bpreshuffle_cktile_0x0x8x4x1x0x0x0x0x2_32x64x512_1x4x1_16x16x128_default,331.65,2695.1,0.0
256,128,7168,4096,torch.float8_e4m3fn,ck,114,0,14.084,a8w8_bpreshuffle_256x64x64x256_16x16_16x16_16x16x1_16x16x1_1x32x1x8_8x8x1_2x1_intrawave_v3,533.67,2252.16,0.0
256,256,7168,4096,torch.float8_e4m3fn,ck,65,0,17.5236,a8w8_bpreshuffle_256x128x64x256_16x16_16x16_16x16x1_16x16x1_1x32x1x8_8x8x1_2x1_intrawave_v3,857.84,1944.73,0.0
256,512,7168,4096,torch.float8_e4m3fn,ck,139,0,25.1676,a8w8_bpreshuffle_256x128x128x256_16x16_16x16_16x16x1_16x16x1_1x16x1x16_8x8x1_1x2_intrawave_v3,1194.58,1541.56,0.0
256,1024,7168,4096,torch.float8_e4m3fn,ck,154,0,38.5605,a8w8_bpreshuffle_256x128x256x256_16x16_16x16_16x16x1_16x16x1_1x16x1x16_8x8x1_1x2_intrawave_v3,1559.36,1250.88,0.0
256,2048,7168,4096,torch.float8_e4m3fn,ck,33,0,69.3264,a8w8_bpreshuffle_256x256x256x128_16x16_16x16_8x32x1_8x32x1_1x32x1x8_8x8x1_2x1_intrawave_v3,1734.68,968.01,0.0
256,4096,7168,4096,torch.float8_e4m3fn,ck,51,0,128.1913,a8w8_bpreshuffle_256x192x128x128_16x16_16x16_8x32x1_8x32x1_1x32x1x8_8x8x1_2x1_intrawave_v3,1876.24,817.98,0.0
256,8192,7168,4096,torch.float8_e4m3fn,ck,51,0,235.0881,a8w8_bpreshuffle_256x192x128x128_16x16_16x16_8x32x1_8x32x1_1x32x1x8_8x8x1_2x1_intrawave_v3,2046.2,767.18,0.0
256,16384,7168,4096,torch.float8_e4m3fn,ck,33,0,440.2175,a8w8_bpreshuffle_256x256x256x128_16x16_16x16_8x32x1_8x32x1_1x32x1x8_8x8x1_2x1_intrawave_v3,2185.45,752.7,0.0
256,1,8192,512,torch.float8_e4m3fn,cktile,30,0,3.5429,a8w8_bpreshuffle_cktile_0x0x8x4x1x0x0x0x0x2_16x64x512_1x4x1_16x16x128_default,2.37,1188.63,0.0
256,2,8192,512,torch.float8_e4m3fn,cktile,30,0,3.5942,a8w8_bpreshuffle_cktile_0x0x8x4x1x0x0x0x0x2_16x64x512_1x4x1_16x16x128_default,4.67,1176.37,0.0
256,4,8192,512,torch.float8_e4m3fn,cktile,30,0,3.525,a8w8_bpreshuffle_cktile_0x0x8x4x1x0x0x0x0x2_16x64x512_1x4x1_16x16x128_default,9.52,1209.05,0.0
256,8,8192,512,torch.float8_e4m3fn,cktile,138,0,3.6239,a8w8_bpreshuffle_cktile_0x0x8x4x1x0x0x0x0x4_16x64x512_1x4x1_16x16x128_default,18.52,1194.7,0.0
256,16,8192,512,torch.float8_e4m3fn,cktile,138,0,3.6015,a8w8_bpreshuffle_cktile_0x0x8x4x1x0x0x0x0x4_16x64x512_1x4x1_16x16x128_default,37.27,1239.66,0.0
256,32,8192,512,torch.float8_e4m3fn,cktile,2,0,3.6727,a8w8_bpreshuffle_cktile_0x0x8x4x1x0x0x0x0x1_16x64x512_1x4x1_16x16x128_default,73.09,1289.24,0.0
256,64,8192,512,torch.float8_e4m3fn,cktile,37,0,4.8855,a8w8_bpreshuffle_cktile_0x0x8x4x1x0x0x0x0x2_32x64x512_1x4x1_16x16x128_default,109.89,1079.86,0.0
256,128,8192,512,torch.float8_e4m3fn,ck,76,0,5.5876,a8w8_bpreshuffle_256x32x64x128_16x16_16x16_8x32x1_8x32x1_1x32x1x8_8x8x1_2x1_intrawave_v1,192.17,1137.7,0.0
256,256,8192,512,torch.float8_e4m3fn,ck,84,0,6.6419,a8w8_bpreshuffle_256x32x128x128_16x16_16x16_8x32x1_8x32x1_1x32x1x8_8x8x1_2x1_intrawave_v1,323.32,1282.72,0.0
256,512,8192,512,torch.float8_e4m3fn,ck,78,0,9.5127,a8w8_bpreshuffle_256x96x64x128_16x16_16x16_8x32x1_8x32x1_1x32x1x8_8x8x1_2x1_intrawave_v3,451.5,1350.31,0.0
256,1024,8192,512,torch.float8_e4m3fn,ck,86,0,13.4701,a8w8_bpreshuffle_256x96x128x128_16x16_16x16_8x32x1_8x32x1_1x32x1x8_8x8x1_2x1_intrawave_v3,637.7,1595.82,0.0
256,2048,8192,512,torch.float8_e4m3fn,ck,86,0,22.0387,a8w8_bpreshuffle_256x96x128x128_16x16_16x16_8x32x1_8x32x1_1x32x1x8_8x8x1_2x1_intrawave_v3,779.53,1760.42,0.0
256,4096,8192,512,torch.float8_e4m3fn,ck,86,0,40.9594,a8w8_bpreshuffle_256x96x128x128_16x16_16x16_8x32x1_8x32x1_1x32x1x8_8x8x1_2x1_intrawave_v3,838.87,1792.03,0.0
256,8192,8192,512,torch.float8_e4m3fn,ck,86,0,74.4073,a8w8_bpreshuffle_256x96x128x128_16x16_16x16_8x32x1_8x32x1_1x32x1x8_8x8x1_2x1_intrawave_v3,923.56,1916.56,0.0
256,16384,8192,512,torch.float8_e4m3fn,ck,143,0,138.1708,a8w8_bpreshuffle_256x192x128x128_16x16_16x16_8x32x1_8x32x1_1x16x1x16_8x8x1_1x2_intrawave_v3,994.7,2033.85,0.0
