aiter/configs/model_configs/dsv4_bf16_tuned_gemm.csv
gfx,cu_num,M,N,K,bias,dtype,outdtype,scaleAB,bpreshuffle,libtype,solidx,splitK,us,kernelName,err_ratio,tflops,bw
gfx950,256,1,64,7168,False,torch.bfloat16,torch.bfloat16,False,False,skinny,2,0,4.5299,sol2,0.0,0.2,205.74
gfx950,256,2,64,7168,False,torch.bfloat16,torch.bfloat16,False,False,skinny,2,0,4.7029,sol2,0.0,0.39,201.24
gfx950,256,4,64,7168,False,torch.bfloat16,torch.bfloat16,False,False,asm,1,16,5.139,_ZN5aiter39bf16gemm_fp32bf16_tn_32x64_splitk_cleanE,0.0195,0.71,189.8
gfx950,256,8,64,7168,False,torch.bfloat16,torch.bfloat16,False,False,asm,5,16,5.3178,_ZN5aiter39bf16gemm_fp32bf16_tn_64x64_splitk_cleanE,0.0352,1.38,194.29
gfx950,256,16,64,7168,False,torch.bfloat16,torch.bfloat16,False,False,asm,3,16,5.2526,_ZN5aiter39bf16gemm_fp32bf16_tn_48x64_splitk_cleanE,0.0273,2.79,218.74
gfx950,256,32,64,7168,False,torch.bfloat16,torch.bfloat16,False,False,asm,1,16,5.4922,_ZN5aiter39bf16gemm_fp32bf16_tn_32x64_splitk_cleanE,0.0312,5.35,251.33
gfx950,256,48,64,7168,False,torch.bfloat16,torch.bfloat16,False,False,asm,3,16,5.1796,_ZN5aiter39bf16gemm_fp32bf16_tn_48x64_splitk_cleanE,0.0283,8.5,311.18
gfx950,256,64,64,7168,False,torch.bfloat16,torch.bfloat16,False,False,asm,1,14,5.4629,_ZN5aiter39bf16gemm_fp32bf16_tn_32x64_splitk_cleanE,0.0303,10.75,337.4
gfx950,256,80,64,7168,False,torch.bfloat16,torch.bfloat16,False,False,asm,3,14,5.7831,_ZN5aiter39bf16gemm_fp32bf16_tn_48x64_splitk_cleanE,0.0285,12.69,358.74
gfx950,256,96,64,7168,False,torch.bfloat16,torch.bfloat16,False,False,asm,3,16,5.8807,_ZN5aiter39bf16gemm_fp32bf16_tn_48x64_splitk_cleanE,0.0298,14.98,392.14
gfx950,256,112,64,7168,False,torch.bfloat16,torch.bfloat16,False,False,asm,5,16,6.4176,_ZN5aiter39bf16gemm_fp32bf16_tn_64x64_splitk_cleanE,0.0301,16.01,395.39
gfx950,256,128,64,7168,False,torch.bfloat16,torch.bfloat16,False,False,asm,5,14,6.778,_ZN5aiter39bf16gemm_fp32bf16_tn_64x64_splitk_cleanE,0.0295,17.33,408.51
gfx950,256,144,64,7168,False,torch.bfloat16,torch.bfloat16,False,False,asm,7,16,7.1482,_ZN5aiter39bf16gemm_fp32bf16_tn_80x64_splitk_cleanE,0.029,18.48,419.73
gfx950,256,160,64,7168,False,torch.bfloat16,torch.bfloat16,False,False,asm,5,16,7.4624,_ZN5aiter39bf16gemm_fp32bf16_tn_64x64_splitk_cleanE,0.0316,19.67,433.07
gfx950,256,176,64,7168,False,torch.bfloat16,torch.bfloat16,False,False,asm,5,16,7.5634,_ZN5aiter39bf16gemm_fp32bf16_tn_64x64_splitk_cleanE,0.0297,21.35,457.89
gfx950,256,192,64,7168,False,torch.bfloat16,torch.bfloat16,False,False,asm,5,16,7.637,_ZN5aiter39bf16gemm_fp32bf16_tn_64x64_splitk_cleanE,0.0313,23.07,483.78
gfx950,256,208,64,7168,False,torch.bfloat16,torch.bfloat16,False,False,asm,5,16,8.1886,_ZN5aiter39bf16gemm_fp32bf16_tn_64x64_splitk_cleanE,0.0313,23.31,479.45
gfx950,256,224,64,7168,False,torch.bfloat16,torch.bfloat16,False,False,asm,7,16,8.3223,_ZN5aiter39bf16gemm_fp32bf16_tn_80x64_splitk_cleanE,0.0308,24.7,499.55
gfx950,256,240,64,7168,False,torch.bfloat16,torch.bfloat16,False,False,asm,5,16,8.265,_ZN5aiter39bf16gemm_fp32bf16_tn_64x64_splitk_cleanE,0.0298,26.64,531.02
gfx950,256,256,64,7168,False,torch.bfloat16,torch.bfloat16,False,False,asm,8,16,8.2847,_ZN5aiter39bf16gemm_fp32bf16_tn_96x64_splitk_cleanE,0.0303,28.35,557.69
gfx950,256,288,64,7168,False,torch.bfloat16,torch.bfloat16,False,False,asm,8,16,8.4447,_ZN5aiter39bf16gemm_fp32bf16_tn_96x64_splitk_cleanE,0.0305,31.29,601.93
gfx950,256,320,64,7168,False,torch.bfloat16,torch.bfloat16,False,False,asm,7,16,8.7934,_ZN5aiter39bf16gemm_fp32bf16_tn_80x64_splitk_cleanE,0.0306,33.39,630.7
gfx950,256,352,64,7168,False,torch.bfloat16,torch.bfloat16,False,False,asm,8,16,9.0374,_ZN5aiter39bf16gemm_fp32bf16_tn_96x64_splitk_cleanE,0.0306,35.74,664.89
gfx950,256,384,64,7168,False,torch.bfloat16,torch.bfloat16,False,False,asm,8,16,9.2399,_ZN5aiter39bf16gemm_fp32bf16_tn_96x64_splitk_cleanE,0.0298,38.13,700.41
gfx950,256,416,64,7168,False,torch.bfloat16,torch.bfloat16,False,False,flydsl,70,7,9.6138,flydsl_gemm2_abf16_wbf16_bf16_t16x64x256_split_k7_block_m_warp1_block_n_warp2_async_copyTrue_b_to_ldsFalse_b_preshuffleFalse_c_to_ldsFalse_gfx950,0.0188,39.7,721.31
gfx950,256,448,64,7168,False,torch.bfloat16,torch.bfloat16,False,False,flydsl,70,7,9.5803,flydsl_gemm2_abf16_wbf16_bf16_t16x64x256_split_k7_block_m_warp1_block_n_warp2_async_copyTrue_b_to_ldsFalse_b_preshuffleFalse_c_to_ldsFalse_gfx950,0.0184,42.9,772.14
gfx950,256,480,64,7168,False,torch.bfloat16,torch.bfloat16,False,False,asm,8,14,9.877,_ZN5aiter39bf16gemm_fp32bf16_tn_96x64_splitk_cleanE,0.0276,44.59,795.81
gfx950,256,512,64,7168,False,torch.bfloat16,torch.bfloat16,False,False,flydsl,70,7,10.4387,flydsl_gemm2_abf16_wbf16_bf16_t16x64x256_split_k7_block_m_warp1_block_n_warp2_async_copyTrue_b_to_ldsFalse_b_preshuffleFalse_c_to_ldsFalse_gfx950,0.0193,45.0,797.33
gfx950,256,544,64,7168,False,torch.bfloat16,torch.bfloat16,False,False,flydsl,70,7,10.0679,flydsl_gemm2_abf16_wbf16_bf16_t16x64x256_split_k7_block_m_warp1_block_n_warp2_async_copyTrue_b_to_ldsFalse_b_preshuffleFalse_c_to_ldsFalse_gfx950,0.0201,49.58,872.67
gfx950,256,576,64,7168,False,torch.bfloat16,torch.bfloat16,False,False,flydsl,70,7,10.1397,flydsl_gemm2_abf16_wbf16_bf16_t16x64x256_split_k7_block_m_warp1_block_n_warp2_async_copyTrue_b_to_ldsFalse_b_preshuffleFalse_c_to_ldsFalse_gfx950,0.0198,52.12,912.13
gfx950,256,608,64,7168,False,torch.bfloat16,torch.bfloat16,False,False,flydsl,168,7,10.5047,flydsl_gemm2_abf16_wbf16_bf16_t32x64x256_split_k7_block_m_warp1_block_n_warp4_async_copyTrue_b_to_ldsTrue_b_preshuffleFalse_c_to_ldsFalse_gfx950,0.0205,53.1,924.5
gfx950,256,640,64,7168,False,torch.bfloat16,torch.bfloat16,False,False,flydsl,168,7,10.4229,flydsl_gemm2_abf16_wbf16_bf16_t32x64x256_split_k7_block_m_warp1_block_n_warp4_async_copyTrue_b_to_ldsTrue_b_preshuffleFalse_c_to_ldsFalse_gfx950,0.0202,56.34,976.16
gfx950,256,672,64,7168,False,torch.bfloat16,torch.bfloat16,False,False,flydsl,170,7,10.4218,flydsl_gemm2_abf16_wbf16_bf16_t32x64x256_split_k7_block_m_warp2_block_n_warp2_async_copyTrue_b_to_ldsTrue_b_preshuffleFalse_c_to_ldsFalse_gfx950,0.0193,59.16,1020.68
gfx950,256,704,64,7168,False,torch.bfloat16,torch.bfloat16,False,False,flydsl,167,7,10.6361,flydsl_gemm2_abf16_wbf16_bf16_t32x64x256_split_k7_block_m_warp1_block_n_warp4_async_copyTrue_b_to_ldsFalse_b_preshuffleFalse_c_to_ldsFalse_gfx950,0.0199,60.73,1043.63
gfx950,256,736,64,7168,False,torch.bfloat16,torch.bfloat16,False,False,flydsl,168,7,10.5474,flydsl_gemm2_abf16_wbf16_bf16_t32x64x256_split_k7_block_m_warp1_block_n_warp4_async_copyTrue_b_to_ldsTrue_b_preshuffleFalse_c_to_ldsFalse_gfx950,0.0197,64.02,1096.29
gfx950,256,768,64,7168,False,torch.bfloat16,torch.bfloat16,False,False,flydsl,166,7,10.8566,flydsl_gemm2_abf16_wbf16_bf16_t32x64x256_split_k7_block_m_warp1_block_n_warp2_async_copyTrue_b_to_ldsFalse_b_preshuffleFalse_c_to_ldsFalse_gfx950,0.0198,64.9,1107.7
gfx950,256,800,64,7168,False,torch.bfloat16,torch.bfloat16,False,False,flydsl,168,7,10.7966,flydsl_gemm2_abf16_wbf16_bf16_t32x64x256_split_k7_block_m_warp1_block_n_warp4_async_copyTrue_b_to_ldsTrue_b_preshuffleFalse_c_to_ldsFalse_gfx950,0.0206,67.98,1156.73
gfx950,256,832,64,7168,False,torch.bfloat16,torch.bfloat16,False,False,flydsl,168,7,11.2013,flydsl_gemm2_abf16_wbf16_bf16_t32x64x256_split_k7_block_m_warp1_block_n_warp4_async_copyTrue_b_to_ldsTrue_b_preshuffleFalse_c_to_ldsFalse_gfx950,0.0196,68.15,1156.25
gfx950,256,864,64,7168,False,torch.bfloat16,torch.bfloat16,False,False,flydsl,168,7,11.183,flydsl_gemm2_abf16_wbf16_bf16_t32x64x256_split_k7_block_m_warp1_block_n_warp4_async_copyTrue_b_to_ldsTrue_b_preshuffleFalse_c_to_ldsFalse_gfx950,0.0201,70.89,1199.54
gfx950,256,896,64,7168,False,torch.bfloat16,torch.bfloat16,False,False,flydsl,168,7,11.2449,flydsl_gemm2_abf16_wbf16_bf16_t32x64x256_split_k7_block_m_warp1_block_n_warp4_async_copyTrue_b_to_ldsTrue_b_preshuffleFalse_c_to_ldsFalse_gfx950,0.0194,73.11,1234.09
gfx950,256,928,64,7168,False,torch.bfloat16,torch.bfloat16,False,False,flydsl,170,7,11.444,flydsl_gemm2_abf16_wbf16_bf16_t32x64x256_split_k7_block_m_warp2_block_n_warp2_async_copyTrue_b_to_ldsTrue_b_preshuffleFalse_c_to_ldsFalse_gfx950,0.0197,74.4,1253.07
gfx950,256,960,64,7168,False,torch.bfloat16,torch.bfloat16,False,False,flydsl,168,7,11.5774,flydsl_gemm2_abf16_wbf16_bf16_t32x64x256_split_k7_block_m_warp1_block_n_warp4_async_copyTrue_b_to_ldsTrue_b_preshuffleFalse_c_to_ldsFalse_gfx950,0.0193,76.08,1278.61
gfx950,256,992,64,7168,False,torch.bfloat16,torch.bfloat16,False,False,flydsl,170,7,11.6492,flydsl_gemm2_abf16_wbf16_bf16_t32x64x256_split_k7_block_m_warp2_block_n_warp2_async_copyTrue_b_to_ldsTrue_b_preshuffleFalse_c_to_ldsFalse_gfx950,0.0196,78.13,1310.46
gfx950,256,1024,64,7168,False,torch.bfloat16,torch.bfloat16,False,False,flydsl,170,7,11.9896,flydsl_gemm2_abf16_wbf16_bf16_t32x64x256_split_k7_block_m_warp2_block_n_warp2_async_copyTrue_b_to_ldsTrue_b_preshuffleFalse_c_to_ldsFalse_gfx950,0.0201,78.36,1311.86
gfx950,256,1088,64,7168,False,torch.bfloat16,torch.bfloat16,False,False,flydsl,168,7,12.1305,flydsl_gemm2_abf16_wbf16_bf16_t32x64x256_split_k7_block_m_warp1_block_n_warp4_async_copyTrue_b_to_ldsTrue_b_preshuffleFalse_c_to_ldsFalse_gfx950,0.0197,82.29,1372.93
gfx950,256,1152,64,7168,False,torch.bfloat16,torch.bfloat16,False,False,flydsl,170,7,12.2982,flydsl_gemm2_abf16_wbf16_bf16_t32x64x256_split_k7_block_m_warp2_block_n_warp2_async_copyTrue_b_to_ldsTrue_b_preshuffleFalse_c_to_ldsFalse_gfx950,0.0197,85.94,1429.48
gfx950,256,1216,64,7168,False,torch.bfloat16,torch.bfloat16,False,False,flydsl,204,7,12.8014,flydsl_gemm2_abf16_wbf16_bf16_t48x64x256_split_k7_block_m_warp1_block_n_warp2_async_copyTrue_b_to_ldsFalse_b_preshuffleFalse_c_to_ldsFalse_gfx950,0.0197,87.15,1445.6
gfx950,256,1280,64,7168,False,torch.bfloat16,torch.bfloat16,False,False,flydsl,204,7,13.0687,flydsl_gemm2_abf16_wbf16_bf16_t48x64x256_split_k7_block_m_warp1_block_n_warp2_async_copyTrue_b_to_ldsFalse_b_preshuffleFalse_c_to_ldsFalse_gfx950,0.0198,89.86,1486.87
gfx950,256,1344,64,7168,False,torch.bfloat16,torch.bfloat16,False,False,asm,1,6,13.7018,_ZN5aiter39bf16gemm_fp32bf16_tn_32x64_splitk_cleanE,0.0183,90.0,1485.73
gfx950,256,1408,64,7168,False,torch.bfloat16,torch.bfloat16,False,False,flydsl,204,7,13.3714,flydsl_gemm2_abf16_wbf16_bf16_t48x64x256_split_k7_block_m_warp1_block_n_warp2_async_copyTrue_b_to_ldsFalse_b_preshuffleFalse_c_to_ldsFalse_gfx950,0.0199,96.61,1591.67
gfx950,256,1472,64,7168,False,torch.bfloat16,torch.bfloat16,False,False,flydsl,204,7,13.8156,flydsl_gemm2_abf16_wbf16_bf16_t48x64x256_split_k7_block_m_warp1_block_n_warp2_async_copyTrue_b_to_ldsFalse_b_preshuffleFalse_c_to_ldsFalse_gfx950,0.0202,97.76,1607.5
gfx950,256,1536,64,7168,False,torch.bfloat16,torch.bfloat16,False,False,flydsl,204,7,13.9874,flydsl_gemm2_abf16_wbf16_bf16_t48x64x256_split_k7_block_m_warp1_block_n_warp2_async_copyTrue_b_to_ldsFalse_b_preshuffleFalse_c_to_ldsFalse_gfx950,0.0204,100.75,1653.93
gfx950,256,1600,64,7168,False,torch.bfloat16,torch.bfloat16,False,False,asm,3,6,14.0703,_ZN5aiter39bf16gemm_fp32bf16_tn_48x64_splitk_cleanE,0.018,104.33,1709.98
gfx950,256,1664,64,7168,False,torch.bfloat16,torch.bfloat16,False,False,asm,3,6,14.4142,_ZN5aiter39bf16gemm_fp32bf16_tn_48x64_splitk_cleanE,0.0178,105.92,1733.4
gfx950,256,1728,64,7168,False,torch.bfloat16,torch.bfloat16,False,False,asm,3,6,14.4716,_ZN5aiter39bf16gemm_fp32bf16_tn_48x64_splitk_cleanE,0.0183,109.56,1790.49
gfx950,256,1792,64,7168,False,torch.bfloat16,torch.bfloat16,False,False,asm,3,6,14.4503,_ZN5aiter39bf16gemm_fp32bf16_tn_48x64_splitk_cleanE,0.0177,113.78,1857.19
gfx950,256,1856,64,7168,False,torch.bfloat16,torch.bfloat16,False,False,asm,3,6,14.3596,_ZN5aiter39bf16gemm_fp32bf16_tn_48x64_splitk_cleanE,0.0178,118.59,1933.39
gfx950,256,1920,64,7168,False,torch.bfloat16,torch.bfloat16,False,False,asm,3,6,14.3887,_ZN5aiter39bf16gemm_fp32bf16_tn_48x64_splitk_cleanE,0.0177,122.43,1993.81
gfx950,256,1984,64,7168,False,torch.bfloat16,torch.bfloat16,False,False,asm,3,6,14.6218,_ZN5aiter39bf16gemm_fp32bf16_tn_48x64_splitk_cleanE,0.018,124.49,2025.34
gfx950,256,2048,64,7168,False,torch.bfloat16,torch.bfloat16,False,False,asm,5,6,14.985,_ZN5aiter39bf16gemm_fp32bf16_tn_64x64_splitk_cleanE,0.0178,125.4,2038.02
gfx950,256,4096,64,7168,False,torch.bfloat16,torch.bfloat16,False,False,asm,5,4,18.5733,_ZN5aiter39bf16gemm_fp32bf16_tn_64x64_splitk_cleanE,0.0139,202.34,3239.17
gfx950,256,6144,64,7168,False,torch.bfloat16,torch.bfloat16,False,False,asm,8,4,23.514,_ZN5aiter39bf16gemm_fp32bf16_tn_96x64_splitk_cleanE,0.0136,239.74,3818.33
gfx950,256,8192,64,7168,False,torch.bfloat16,torch.bfloat16,False,False,asm,5,2,31.1965,_ZN5aiter39bf16gemm_fp32bf16_tn_64x64_splitk_cleanE,0.006,240.93,3827.56
gfx950,256,10240,64,7168,False,torch.bfloat16,torch.bfloat16,False,False,asm,7,2,33.8031,_ZN5aiter39bf16gemm_fp32bf16_tn_80x64_splitk_cleanE,0.0058,277.94,4408.73
gfx950,256,12288,64,7168,False,torch.bfloat16,torch.bfloat16,False,False,asm,8,2,37.7266,_ZN5aiter39bf16gemm_fp32bf16_tn_96x64_splitk_cleanE,0.0061,298.84,4735.42
gfx950,256,14336,64,7168,False,torch.bfloat16,torch.bfloat16,False,False,torch,0,0,46.3248,native,0.0,283.94,4495.94
gfx950,256,16384,64,7168,False,torch.bfloat16,torch.bfloat16,False,False,torch,0,0,49.2672,native,0.0,305.12,4828.68
gfx950,256,32768,64,7168,False,torch.bfloat16,torch.bfloat16,False,False,torch,0,0,81.5809,native,0.0,368.53,5820.9
gfx950,256,1,384,7168,False,torch.bfloat16,torch.bfloat16,False,False,skinny,2,0,7.84,sol2,0.0,0.7,704.1
gfx950,256,2,384,7168,False,torch.bfloat16,torch.bfloat16,False,False,flydsl,40,7,8.3003,flydsl_gemm2_abf16_wbf16_bf16_t16x64x256_split_k7_block_m_warp1_block_n_warp2_async_copyTrue_b_to_ldsFalse_b_preshuffleFalse_c_to_ldsFalse_gfx950,0.0182,1.33,666.87
gfx950,256,4,384,7168,False,torch.bfloat16,torch.bfloat16,False,False,flydsl,40,7,8.1675,flydsl_gemm2_abf16_wbf16_bf16_t16x64x256_split_k7_block_m_warp1_block_n_warp2_async_copyTrue_b_to_ldsFalse_b_preshuffleFalse_c_to_ldsFalse_gfx950,0.0286,2.7,681.41
gfx950,256,96,384,7168,False,torch.bfloat16,torch.bfloat16,False,False,flydsl,164,7,10.0683,flydsl_gemm2_abf16_wbf16_bf16_t16x64x256_split_k7_block_m_warp1_block_n_warp2_async_copyTrue_b_to_ldsFalse_b_preshuffleFalse_c_to_ldsFalse_gfx950,0.0205,52.49,690.78
gfx950,256,144,384,7168,False,torch.bfloat16,torch.bfloat16,False,False,flydsl,371,7,11.2917,flydsl_gemm2_abf16_wbf16_bf16_t32x64x256_split_k7_block_m_warp1_block_n_warp4_async_copyTrue_b_to_ldsFalse_b_preshuffleFalse_c_to_ldsFalse_gfx950,0.0202,70.2,680.15
gfx950,256,160,384,7168,False,torch.bfloat16,torch.bfloat16,False,False,flydsl,371,7,11.7346,flydsl_gemm2_abf16_wbf16_bf16_t32x64x256_split_k7_block_m_warp1_block_n_warp4_async_copyTrue_b_to_ldsFalse_b_preshuffleFalse_c_to_ldsFalse_gfx950,0.0197,75.06,675.07
gfx950,256,192,384,7168,False,torch.bfloat16,torch.bfloat16,False,False,flydsl,371,7,12.5413,flydsl_gemm2_abf16_wbf16_bf16_t32x64x256_split_k7_block_m_warp1_block_n_warp4_async_copyTrue_b_to_ldsFalse_b_preshuffleFalse_c_to_ldsFalse_gfx950,0.0201,84.28,670.19
gfx950,256,208,384,7168,False,torch.bfloat16,torch.bfloat16,False,False,flydsl,436,7,13.2475,flydsl_gemm2_abf16_wbf16_bf16_t48x64x256_split_k7_block_m_warp1_block_n_warp2_async_copyTrue_b_to_ldsFalse_b_preshuffleFalse_c_to_ldsFalse_gfx950,0.0202,86.43,652.7
gfx950,256,256,384,7168,False,torch.bfloat16,torch.bfloat16,False,False,asm,5,7,13.799,_ZN5aiter39bf16gemm_fp32bf16_tn_64x64_splitk_cleanE,0.0197,102.13,679.15
gfx950,256,288,384,7168,False,torch.bfloat16,torch.bfloat16,False,False,asm,3,6,13.999,_ZN5aiter39bf16gemm_fp32bf16_tn_48x64_splitk_cleanE,0.0186,113.25,703.98
gfx950,256,352,384,7168,False,torch.bfloat16,torch.bfloat16,False,False,asm,5,5,14.4992,_ZN5aiter39bf16gemm_fp32bf16_tn_64x64_splitk_cleanE,0.0162,133.65,746.36
gfx950,256,384,384,7168,False,torch.bfloat16,torch.bfloat16,False,False,asm,3,5,14.5283,_ZN5aiter39bf16gemm_fp32bf16_tn_48x64_splitk_cleanE,0.0163,145.5,778.13
gfx950,256,416,384,7168,False,torch.bfloat16,torch.bfloat16,False,False,asm,5,5,14.6068,_ZN5aiter39bf16gemm_fp32bf16_tn_64x64_splitk_cleanE,0.0164,156.78,807.04
gfx950,256,480,384,7168,False,torch.bfloat16,torch.bfloat16,False,False,asm,7,5,15.4159,_ZN5aiter39bf16gemm_fp32bf16_tn_80x64_splitk_cleanE,0.0163,171.41,827.39
gfx950,256,544,384,7168,False,torch.bfloat16,torch.bfloat16,False,False,asm,7,5,16.125,_ZN5aiter39bf16gemm_fp32bf16_tn_80x64_splitk_cleanE,0.0162,185.72,850.95
gfx950,256,576,384,7168,False,torch.bfloat16,torch.bfloat16,False,False,asm,7,5,16.3096,_ZN5aiter39bf16gemm_fp32bf16_tn_80x64_splitk_cleanE,0.0161,194.42,870.96
gfx950,256,608,384,7168,False,torch.bfloat16,torch.bfloat16,False,False,asm,7,5,16.6165,_ZN5aiter39bf16gemm_fp32bf16_tn_80x64_splitk_cleanE,0.0158,201.43,883.96
gfx950,256,640,384,7168,False,torch.bfloat16,torch.bfloat16,False,False,asm,8,5,16.9084,_ZN5aiter39bf16gemm_fp32bf16_tn_96x64_splitk_cleanE,0.0158,208.37,897.28
gfx950,256,672,384,7168,False,torch.bfloat16,torch.bfloat16,False,False,asm,7,4,17.3422,_ZN5aiter39bf16gemm_fp32bf16_tn_80x64_splitk_cleanE,0.0134,213.32,902.71
gfx950,256,704,384,7168,False,torch.bfloat16,torch.bfloat16,False,False,asm,7,4,17.543,_ZN5aiter39bf16gemm_fp32bf16_tn_80x64_splitk_cleanE,0.0135,220.92,919.92
gfx950,256,736,384,7168,False,torch.bfloat16,torch.bfloat16,False,False,asm,7,4,17.5614,_ZN5aiter39bf16gemm_fp32bf16_tn_80x64_splitk_cleanE,0.0135,230.72,946.48
gfx950,256,768,384,7168,False,torch.bfloat16,torch.bfloat16,False,False,asm,7,4,18.1806,_ZN5aiter39bf16gemm_fp32bf16_tn_80x64_splitk_cleanE,0.0137,232.55,940.83
gfx950,256,800,384,7168,False,torch.bfloat16,torch.bfloat16,False,False,asm,7,4,18.3111,_ZN5aiter39bf16gemm_fp32bf16_tn_80x64_splitk_cleanE,0.0135,240.51,960.52
gfx950,256,832,384,7168,False,torch.bfloat16,torch.bfloat16,False,False,asm,8,4,18.0728,_ZN5aiter39bf16gemm_fp32bf16_tn_96x64_splitk_cleanE,0.0135,253.43,999.93
gfx950,256,864,384,7168,False,torch.bfloat16,torch.bfloat16,False,False,asm,8,4,18.6321,_ZN5aiter39bf16gemm_fp32bf16_tn_96x64_splitk_cleanE,0.0135,255.28,995.86
gfx950,256,896,384,7168,False,torch.bfloat16,torch.bfloat16,False,False,asm,5,3,19.4034,_ZN5aiter39bf16gemm_fp32bf16_tn_64x64_splitk_cleanE,0.0103,254.21,981.18
gfx950,256,928,384,7168,False,torch.bfloat16,torch.bfloat16,False,False,asm,8,4,19.649,_ZN5aiter39bf16gemm_fp32bf16_tn_96x64_splitk_cleanE,0.0135,260.0,993.51
gfx950,256,960,384,7168,False,torch.bfloat16,torch.bfloat16,False,False,torch,0,0,21.7759,native,0.0,242.69,918.67
gfx950,256,992,384,7168,False,torch.bfloat16,torch.bfloat16,False,False,torch,0,0,20.5408,native,0.0,265.86,997.44
gfx950,256,1024,384,7168,False,torch.bfloat16,torch.bfloat16,False,False,asm,7,3,20.9837,_ZN5aiter39bf16gemm_fp32bf16_tn_80x64_splitk_cleanE,0.0103,268.64,999.42
gfx950,256,1088,384,7168,False,torch.bfloat16,torch.bfloat16,False,False,torch,0,0,21.2322,native,0.0,282.09,1033.25
gfx950,256,1152,384,7168,False,torch.bfloat16,torch.bfloat16,False,False,torch,0,0,21.5026,native,0.0,294.93,1065.21
gfx950,256,1216,384,7168,False,torch.bfloat16,torch.bfloat16,False,False,torch,0,0,21.8248,native,0.0,306.72,1093.78
gfx950,256,1280,384,7168,False,torch.bfloat16,torch.bfloat16,False,False,torch,0,0,22.0759,native,0.0,319.19,1125.12
gfx950,256,1344,384,7168,False,torch.bfloat16,torch.bfloat16,False,False,torch,0,0,22.1125,native,0.0,334.6,1166.98
gfx950,256,1408,384,7168,False,torch.bfloat16,torch.bfloat16,False,False,torch,0,0,25.4704,native,0.0,304.32,1051.08
gfx950,256,1472,384,7168,False,torch.bfloat16,torch.bfloat16,False,False,torch,0,0,25.4261,native,0.0,318.7,1090.93
gfx950,256,1536,384,7168,False,torch.bfloat16,torch.bfloat16,False,False,torch,0,0,26.1113,native,0.0,323.83,1099.32
gfx950,256,1600,384,7168,False,torch.bfloat16,torch.bfloat16,False,False,torch,0,0,26.2478,native,0.0,335.57,1130.43
gfx950,256,1664,384,7168,False,torch.bfloat16,torch.bfloat16,False,False,torch,0,0,27.0193,native,0.0,339.03,1133.93
gfx950,256,1728,384,7168,False,torch.bfloat16,torch.bfloat16,False,False,torch,0,0,26.7737,native,0.0,355.3,1180.44
gfx950,256,1792,384,7168,False,torch.bfloat16,torch.bfloat16,False,False,torch,0,0,27.5945,native,0.0,357.5,1180.36
gfx950,256,1856,384,7168,False,torch.bfloat16,torch.bfloat16,False,False,torch,0,0,28.4467,native,0.0,359.17,1178.98
gfx950,256,1920,384,7168,False,torch.bfloat16,torch.bfloat16,False,False,torch,0,0,29.4437,native,0.0,358.98,1171.89
gfx950,256,1984,384,7168,False,torch.bfloat16,torch.bfloat16,False,False,torch,0,0,29.4039,native,0.0,371.45,1206.35
gfx950,256,2048,384,7168,False,torch.bfloat16,torch.bfloat16,False,False,torch,0,0,29.2101,native,0.0,385.97,1247.45
gfx950,256,4096,384,7168,False,torch.bfloat16,torch.bfloat16,False,False,torch,0,0,45.0292,native,0.0,500.75,1496.16
gfx950,256,6144,384,7168,False,torch.bfloat16,torch.bfloat16,False,False,torch,0,0,59.3511,native,0.0,569.88,1656.31
gfx950,256,8192,384,7168,False,torch.bfloat16,torch.bfloat16,False,False,torch,0,0,66.6899,native,0.0,676.22,1937.88
gfx950,256,10240,384,7168,False,torch.bfloat16,torch.bfloat16,False,False,torch,0,0,74.4687,native,0.0,756.98,2150.84
gfx950,256,12288,384,7168,False,torch.bfloat16,torch.bfloat16,False,False,torch,0,0,85.8713,native,0.0,787.76,2225.46
gfx950,256,14336,384,7168,False,torch.bfloat16,torch.bfloat16,False,False,torch,0,0,95.0771,native,0.0,830.06,2335.33
gfx950,256,16384,384,7168,False,torch.bfloat16,torch.bfloat16,False,False,torch,0,0,101.7665,native,0.0,886.29,2485.78
gfx950,256,1,512,7168,False,torch.bfloat16,torch.bfloat16,False,False,skinny,2,0,8.4119,sol2,0.0,0.87,874.4
gfx950,256,2,512,7168,False,torch.bfloat16,torch.bfloat16,False,False,flydsl,68,7,8.6461,flydsl_gemm2_abf16_wbf16_bf16_t16x64x256_split_k7_block_m_warp1_block_n_warp2_async_copyTrue_b_to_ldsFalse_b_preshuffleFalse_c_to_ldsFalse_gfx950,0.0186,1.7,852.49
gfx950,256,4,512,7168,False,torch.bfloat16,torch.bfloat16,False,False,flydsl,68,7,8.5046,flydsl_gemm2_abf16_wbf16_bf16_t16x64x256_split_k7_block_m_warp1_block_n_warp2_async_copyTrue_b_to_ldsFalse_b_preshuffleFalse_c_to_ldsFalse_gfx950,0.019,3.45,870.29
gfx950,256,8,512,7168,False,torch.bfloat16,torch.bfloat16,False,False,flydsl,68,7,8.3958,flydsl_gemm2_abf16_wbf16_bf16_t16x64x256_split_k7_block_m_warp1_block_n_warp2_async_copyTrue_b_to_ldsFalse_b_preshuffleFalse_c_to_ldsFalse_gfx950,0.0171,6.99,888.89
gfx950,256,16,512,7168,False,torch.bfloat16,torch.bfloat16,False,False,flydsl,68,7,9.111,flydsl_gemm2_abf16_wbf16_bf16_t16x64x256_split_k7_block_m_warp1_block_n_warp2_async_copyTrue_b_to_ldsFalse_b_preshuffleFalse_c_to_ldsFalse_gfx950,0.0203,12.89,832.6
gfx950,256,32,512,7168,False,torch.bfloat16,torch.bfloat16,False,False,flydsl,68,7,9.164,flydsl_gemm2_abf16_wbf16_bf16_t16x64x256_split_k7_block_m_warp1_block_n_warp2_async_copyTrue_b_to_ldsFalse_b_preshuffleFalse_c_to_ldsFalse_gfx950,0.0184,25.63,854.6
gfx950,256,48,512,7168,False,torch.bfloat16,torch.bfloat16,False,False,flydsl,68,7,9.5439,flydsl_gemm2_abf16_wbf16_bf16_t16x64x256_split_k7_block_m_warp1_block_n_warp2_async_copyTrue_b_to_ldsFalse_b_preshuffleFalse_c_to_ldsFalse_gfx950,0.0181,36.92,846.33
gfx950,256,64,512,7168,False,torch.bfloat16,torch.bfloat16,False,False,flydsl,244,7,10.0743,flydsl_gemm2_abf16_wbf16_bf16_t16x64x256_split_k7_block_m_warp1_block_n_warp2_async_copyTrue_b_to_ldsFalse_b_preshuffleFalse_c_to_ldsFalse_gfx950,0.0187,46.63,826.17
gfx950,256,80,512,7168,False,torch.bfloat16,torch.bfloat16,False,False,flydsl,424,7,10.3667,flydsl_gemm2_abf16_wbf16_bf16_t32x64x256_split_k7_block_m_warp1_block_n_warp4_async_copyTrue_b_to_ldsTrue_b_preshuffleFalse_c_to_ldsFalse_gfx950,0.0194,56.64,826.57
gfx950,256,96,512,7168,False,torch.bfloat16,torch.bfloat16,False,False,flydsl,424,7,11.1855,flydsl_gemm2_abf16_wbf16_bf16_t32x64x256_split_k7_block_m_warp1_block_n_warp4_async_copyTrue_b_to_ldsTrue_b_preshuffleFalse_c_to_ldsFalse_gfx950,0.0202,63.0,788.04
gfx950,256,112,512,7168,False,torch.bfloat16,torch.bfloat16,False,False,flydsl,426,7,10.9104,flydsl_gemm2_abf16_wbf16_bf16_t32x64x256_split_k7_block_m_warp2_block_n_warp2_async_copyTrue_b_to_ldsTrue_b_preshuffleFalse_c_to_ldsFalse_gfx950,0.0201,75.35,830.43
gfx950,256,128,512,7168,False,torch.bfloat16,torch.bfloat16,False,False,flydsl,546,7,11.6967,flydsl_gemm2_abf16_wbf16_bf16_t32x64x256_split_k7_block_m_warp2_block_n_warp2_async_copyTrue_b_to_ldsTrue_b_preshuffleFalse_c_to_ldsFalse_gfx950,0.0202,80.32,795.62
gfx950,256,144,512,7168,False,torch.bfloat16,torch.bfloat16,False,False,flydsl,636,7,12.9628,flydsl_gemm2_abf16_wbf16_bf16_t48x64x256_split_k7_block_m_warp1_block_n_warp2_async_copyTrue_b_to_ldsFalse_b_preshuffleFalse_c_to_ldsFalse_gfx950,0.0209,81.54,736.87
gfx950,256,160,512,7168,False,torch.bfloat16,torch.bfloat16,False,False,flydsl,636,7,12.9607,flydsl_gemm2_abf16_wbf16_bf16_t48x64x256_split_k7_block_m_warp1_block_n_warp2_async_copyTrue_b_to_ldsFalse_b_preshuffleFalse_c_to_ldsFalse_gfx950,0.0198,90.61,755.95
gfx950,256,176,512,7168,False,torch.bfloat16,torch.bfloat16,False,False,asm,5,7,13.3591,_ZN5aiter39bf16gemm_fp32bf16_tn_64x64_splitk_cleanE,0.0202,96.7,751.8
gfx950,256,192,512,7168,False,torch.bfloat16,torch.bfloat16,False,False,asm,3,7,13.8486,_ZN5aiter39bf16gemm_fp32bf16_tn_48x64_splitk_cleanE,0.02,101.76,742.97
gfx950,256,208,512,7168,False,torch.bfloat16,torch.bfloat16,False,False,asm,3,6,13.6802,_ZN5aiter39bf16gemm_fp32bf16_tn_48x64_splitk_cleanE,0.0184,111.6,770.08
gfx950,256,224,512,7168,False,torch.bfloat16,torch.bfloat16,False,False,asm,7,7,13.9765,_ZN5aiter39bf16gemm_fp32bf16_tn_80x64_splitk_cleanE,0.0201,117.64,771.34
gfx950,256,240,512,7168,False,torch.bfloat16,torch.bfloat16,False,False,asm,3,6,13.9283,_ZN5aiter39bf16gemm_fp32bf16_tn_48x64_splitk_cleanE,0.0187,126.48,791.66
gfx950,256,256,512,7168,False,torch.bfloat16,torch.bfloat16,False,False,asm,5,6,14.0607,_ZN5aiter39bf16gemm_fp32bf16_tn_64x64_splitk_cleanE,0.0183,133.64,801.68
gfx950,256,288,512,7168,False,torch.bfloat16,torch.bfloat16,False,False,asm,5,6,14.306,_ZN5aiter39bf16gemm_fp32bf16_tn_64x64_splitk_cleanE,0.0183,147.77,822.29
gfx950,256,320,512,7168,False,torch.bfloat16,torch.bfloat16,False,False,asm,5,6,14.3899,_ZN5aiter39bf16gemm_fp32bf16_tn_64x64_splitk_cleanE,0.0183,163.23,851.66
gfx950,256,352,512,7168,False,torch.bfloat16,torch.bfloat16,False,False,asm,7,6,14.7794,_ZN5aiter39bf16gemm_fp32bf16_tn_80x64_splitk_cleanE,0.0186,174.82,862.47
gfx950,256,384,512,7168,False,torch.bfloat16,torch.bfloat16,False,False,asm,5,5,15.2196,_ZN5aiter39bf16gemm_fp32bf16_tn_64x64_splitk_cleanE,0.0158,185.19,869.82
gfx950,256,416,512,7168,False,torch.bfloat16,torch.bfloat16,False,False,asm,8,6,15.3571,_ZN5aiter39bf16gemm_fp32bf16_tn_96x64_splitk_cleanE,0.0183,198.83,894.04
gfx950,256,448,512,7168,False,torch.bfloat16,torch.bfloat16,False,False,asm,8,6,15.9927,_ZN5aiter39bf16gemm_fp32bf16_tn_96x64_splitk_cleanE,0.0182,205.61,889.24
gfx950,256,480,512,7168,False,torch.bfloat16,torch.bfloat16,False,False,asm,8,6,16.0585,_ZN5aiter39bf16gemm_fp32bf16_tn_96x64_splitk_cleanE,0.0184,219.4,916.2
gfx950,256,512,512,7168,False,torch.bfloat16,torch.bfloat16,False,False,asm,8,5,16.5474,_ZN5aiter39bf16gemm_fp32bf16_tn_96x64_splitk_cleanE,0.0161,227.11,918.84
gfx950,256,544,512,7168,False,torch.bfloat16,torch.bfloat16,False,False,asm,8,5,17.0133,_ZN5aiter39bf16gemm_fp32bf16_tn_96x64_splitk_cleanE,0.0162,234.7,922.56
gfx950,256,576,512,7168,False,torch.bfloat16,torch.bfloat16,False,False,asm,8,5,17.2144,_ZN5aiter39bf16gemm_fp32bf16_tn_96x64_splitk_cleanE,0.0162,245.6,940.34
gfx950,256,608,512,7168,False,torch.bfloat16,torch.bfloat16,False,False,asm,7,4,17.7293,_ZN5aiter39bf16gemm_fp32bf16_tn_80x64_splitk_cleanE,0.0136,251.72,940.75
gfx950,256,640,512,7168,False,torch.bfloat16,torch.bfloat16,False,False,asm,7,4,18.1619,_ZN5aiter39bf16gemm_fp32bf16_tn_80x64_splitk_cleanE,0.0135,258.65,945.41
gfx950,256,672,512,7168,False,torch.bfloat16,torch.bfloat16,False,False,asm,8,4,18.7541,_ZN5aiter39bf16gemm_fp32bf16_tn_96x64_splitk_cleanE,0.0134,263.01,941.76
gfx950,256,704,512,7168,False,torch.bfloat16,torch.bfloat16,False,False,asm,8,4,18.72,_ZN5aiter39bf16gemm_fp32bf16_tn_96x64_splitk_cleanE,0.0134,276.04,969.74
gfx950,256,736,512,7168,False,torch.bfloat16,torch.bfloat16,False,False,asm,8,4,19.2095,_ZN5aiter39bf16gemm_fp32bf16_tn_96x64_splitk_cleanE,0.0135,281.23,970.61
gfx950,256,768,512,7168,False,torch.bfloat16,torch.bfloat16,False,False,asm,7,3,20.1577,_ZN5aiter39bf16gemm_fp32bf16_tn_80x64_splitk_cleanE,0.0103,279.65,949.34
gfx950,256,800,512,7168,False,torch.bfloat16,torch.bfloat16,False,False,torch,0,0,21.1405,native,0.0,277.76,928.46
gfx950,256,832,512,7168,False,torch.bfloat16,torch.bfloat16,False,False,torch,0,0,21.4557,native,0.0,284.63,937.73
gfx950,256,864,512,7168,False,torch.bfloat16,torch.bfloat16,False,False,torch,0,0,21.8883,native,0.0,289.73,941.65
gfx950,256,896,512,7168,False,torch.bfloat16,torch.bfloat16,False,False,asm,8,3,21.6865,_ZN5aiter39bf16gemm_fp32bf16_tn_96x64_splitk_cleanE,0.0104,303.26,973.08
gfx950,256,928,512,7168,False,torch.bfloat16,torch.bfloat16,False,False,torch,0,0,21.1391,native,0.0,322.23,1021.52
gfx950,256,960,512,7168,False,torch.bfloat16,torch.bfloat16,False,False,torch,0,0,22.052,native,0.0,319.54,1001.53
gfx950,256,992,512,7168,False,torch.bfloat16,torch.bfloat16,False,False,torch,0,0,21.5702,native,0.0,337.56,1046.68
gfx950,256,1024,512,7168,False,torch.bfloat16,torch.bfloat16,False,False,torch,0,0,21.6845,native,0.0,346.62,1063.83
gfx950,256,1088,512,7168,False,torch.bfloat16,torch.bfloat16,False,False,torch,0,0,25.1863,native,0.0,317.08,954.95
gfx950,256,1152,512,7168,False,torch.bfloat16,torch.bfloat16,False,False,torch,0,0,25.5293,native,0.0,331.22,980.63
gfx950,256,1216,512,7168,False,torch.bfloat16,torch.bfloat16,False,False,torch,0,0,26.3204,native,0.0,339.11,988.5
gfx950,256,1280,512,7168,False,torch.bfloat16,torch.bfloat16,False,False,torch,0,0,26.2503,native,0.0,357.91,1028.59
gfx950,256,1344,512,7168,False,torch.bfloat16,torch.bfloat16,False,False,torch,0,0,26.8872,native,0.0,366.9,1040.79
gfx950,256,1408,512,7168,False,torch.bfloat16,torch.bfloat16,False,False,torch,0,0,28.5117,native,0.0,362.47,1015.97
gfx950,256,1472,512,7168,False,torch.bfloat16,torch.bfloat16,False,False,torch,0,0,29.3366,native,0.0,368.3,1020.91
gfx950,256,1536,512,7168,False,torch.bfloat16,torch.bfloat16,False,False,torch,0,0,30.0584,native,0.0,375.08,1029.1
gfx950,256,1600,512,7168,False,torch.bfloat16,torch.bfloat16,False,False,torch,0,0,31.2877,native,0.0,375.36,1020.08
gfx950,256,1664,512,7168,False,torch.bfloat16,torch.bfloat16,False,False,torch,0,0,31.743,native,0.0,384.77,1036.42
gfx950,256,1728,512,7168,False,torch.bfloat16,torch.bfloat16,False,False,torch,0,0,32.2354,native,0.0,393.47,1051.08
gfx950,256,1792,512,7168,False,torch.bfloat16,torch.bfloat16,False,False,torch,0,0,32.0168,native,0.0,410.83,1088.96
gfx950,256,1856,512,7168,False,torch.bfloat16,torch.bfloat16,False,False,torch,0,0,32.382,native,0.0,420.7,1107.04
gfx950,256,1920,512,7168,False,torch.bfloat16,torch.bfloat16,False,False,torch,0,0,32.7886,native,0.0,429.81,1123.29
gfx950,256,1984,512,7168,False,torch.bfloat16,torch.bfloat16,False,False,torch,0,0,33.6793,native,0.0,432.39,1122.77
gfx950,256,2048,512,7168,False,torch.bfloat16,torch.bfloat16,False,False,torch,0,0,32.7756,native,0.0,458.65,1183.73
gfx950,256,4096,512,7168,False,torch.bfloat16,torch.bfloat16,False,False,torch,0,0,50.5976,native,0.0,594.19,1388.5
gfx950,256,6144,512,7168,False,torch.bfloat16,torch.bfloat16,False,False,torch,0,0,73.9596,native,0.0,609.75,1375.24
gfx950,256,8192,512,7168,False,torch.bfloat16,torch.bfloat16,False,False,torch,0,0,85.4989,native,0.0,703.28,1557.55
gfx950,256,10240,512,7168,False,torch.bfloat16,torch.bfloat16,False,False,torch,0,0,108.6154,auto,0.0,692.0,1515.68
gfx950,256,12288,512,7168,False,torch.bfloat16,torch.bfloat16,False,False,torch,0,0,110.0151,native,0.0,819.84,1782.33
gfx950,256,14336,512,7168,False,torch.bfloat16,torch.bfloat16,False,False,torch,0,0,115.8627,auto,0.0,908.2,1963.88
gfx950,256,16384,512,7168,False,torch.bfloat16,torch.bfloat16,False,False,torch,0,0,117.064,auto,0.0,1027.29,2212.45
gfx950,256,32768,512,7168,False,torch.bfloat16,torch.bfloat16,False,False,torch,0,0,180.1721,native,0.0,1334.94,2834.27
gfx950,256,1,1024,7168,False,torch.bfloat16,torch.bfloat16,False,False,flydsl,68,7,8.8405,flydsl_gemm2_abf16_wbf16_bf16_t16x64x256_split_k7_block_m_warp1_block_n_warp2_async_copyTrue_b_to_ldsFalse_b_preshuffleFalse_c_to_ldsFalse_gfx950,0.0176,1.66,1662.4
gfx950,256,2,1024,7168,False,torch.bfloat16,torch.bfloat16,False,False,flydsl,68,7,8.8696,flydsl_gemm2_abf16_wbf16_bf16_t16x64x256_split_k7_block_m_warp1_block_n_warp2_async_copyTrue_b_to_ldsFalse_b_preshuffleFalse_c_to_ldsFalse_gfx950,0.0176,3.31,1658.79
gfx950,256,4,1024,7168,False,torch.bfloat16,torch.bfloat16,False,False,flydsl,68,7,9.2283,flydsl_gemm2_abf16_wbf16_bf16_t16x64x256_split_k7_block_m_warp1_block_n_warp2_async_copyTrue_b_to_ldsFalse_b_preshuffleFalse_c_to_ldsFalse_gfx950,0.019,6.36,1597.87
gfx950,256,8,1024,7168,False,torch.bfloat16,torch.bfloat16,False,False,flydsl,68,7,8.8646,flydsl_gemm2_abf16_wbf16_bf16_t16x64x256_split_k7_block_m_warp1_block_n_warp2_async_copyTrue_b_to_ldsFalse_b_preshuffleFalse_c_to_ldsFalse_gfx950,0.02,13.25,1670.82
gfx950,256,16,1024,7168,False,torch.bfloat16,torch.bfloat16,False,False,flydsl,68,7,9.1267,flydsl_gemm2_abf16_wbf16_bf16_t16x64x256_split_k7_block_m_warp1_block_n_warp2_async_copyTrue_b_to_ldsFalse_b_preshuffleFalse_c_to_ldsFalse_gfx950,0.0199,25.74,1637.2
gfx950,256,24,1024,7168,False,torch.bfloat16,torch.bfloat16,False,False,flydsl,68,7,9.8423,flydsl_gemm2_abf16_wbf16_bf16_t16x64x256_split_k7_block_m_warp1_block_n_warp2_async_copyTrue_b_to_ldsFalse_b_preshuffleFalse_c_to_ldsFalse_gfx950,0.0181,35.8,1531.48
gfx950,256,32,1024,7168,False,torch.bfloat16,torch.bfloat16,False,False,flydsl,68,7,9.9037,flydsl_gemm2_abf16_wbf16_bf16_t16x64x256_split_k7_block_m_warp1_block_n_warp2_async_copyTrue_b_to_ldsFalse_b_preshuffleFalse_c_to_ldsFalse_gfx950,0.0189,47.43,1535.22
gfx950,256,40,1024,7168,False,torch.bfloat16,torch.bfloat16,False,False,flydsl,246,7,10.1212,flydsl_gemm2_abf16_wbf16_bf16_t32x64x256_split_k7_block_m_warp1_block_n_warp2_async_copyTrue_b_to_ldsFalse_b_preshuffleFalse_c_to_ldsFalse_gfx950,0.0198,58.02,1515.18
gfx950,256,48,1024,7168,False,torch.bfloat16,torch.bfloat16,False,False,flydsl,337,7,9.865,flydsl_gemm2_abf16_wbf16_bf16_t32x64x256_split_k7_block_m_warp1_block_n_warp4_async_copyTrue_b_to_ldsTrue_b_preshuffleFalse_c_to_ldsFalse_gfx950,0.0194,71.43,1567.82
gfx950,256,56,1024,7168,False,torch.bfloat16,torch.bfloat16,False,False,flydsl,427,7,10.4867,flydsl_gemm2_abf16_wbf16_bf16_t32x64x256_split_k7_block_m_warp2_block_n_warp2_async_copyTrue_b_to_ldsTrue_b_preshuffleFalse_c_to_ldsFalse_gfx950,0.0188,78.39,1487.37
gfx950,256,64,1024,7168,False,torch.bfloat16,torch.bfloat16,False,False,flydsl,668,7,10.5939,flydsl_gemm2_abf16_wbf16_bf16_t32x64x256_split_k7_block_m_warp2_block_n_warp2_async_copyTrue_b_to_ldsTrue_b_preshuffleFalse_c_to_ldsFalse_gfx950,0.0188,88.69,1484.69
gfx950,256,72,1024,7168,False,torch.bfloat16,torch.bfloat16,False,False,flydsl,1028,7,12.9536,flydsl_gemm2_abf16_wbf16_bf16_t64x64x256_split_k7_block_m_warp2_block_n_warp2_async_copyTrue_b_to_ldsTrue_b_preshuffleFalse_c_to_ldsFalse_gfx950,0.02,81.6,1224.35
gfx950,256,80,1024,7168,False,torch.bfloat16,torch.bfloat16,False,False,flydsl,516,7,12.967,flydsl_gemm2_abf16_wbf16_bf16_t48x64x256_split_k7_block_m_warp1_block_n_warp2_async_copyTrue_b_to_ldsFalse_b_preshuffleFalse_c_to_ldsFalse_gfx950,0.02,90.57,1233.19
gfx950,256,88,1024,7168,False,torch.bfloat16,torch.bfloat16,False,False,asm,1,5,13.9335,_ZN5aiter39bf16gemm_fp32bf16_tn_32x64_splitk_cleanE,0.0162,92.72,1157.06
gfx950,256,96,1024,7168,False,torch.bfloat16,torch.bfloat16,False,False,asm,3,6,13.8168,_ZN5aiter39bf16gemm_fp32bf16_tn_48x64_splitk_cleanE,0.0178,102.0,1176.32
gfx950,256,104,1024,7168,False,torch.bfloat16,torch.bfloat16,False,False,asm,5,6,14.2129,_ZN5aiter39bf16gemm_fp32bf16_tn_64x64_splitk_cleanE,0.018,107.42,1152.76
gfx950,256,112,1024,7168,False,torch.bfloat16,torch.bfloat16,False,False,asm,5,7,14.2435,_ZN5aiter39bf16gemm_fp32bf16_tn_64x64_splitk_cleanE,0.0194,115.43,1159.48
gfx950,256,120,1024,7168,False,torch.bfloat16,torch.bfloat16,False,False,asm,5,6,14.3959,_ZN5aiter39bf16gemm_fp32bf16_tn_64x64_splitk_cleanE,0.0181,122.37,1156.31
gfx950,256,128,1024,7168,False,torch.bfloat16,torch.bfloat16,False,False,asm,7,8,14.493,_ZN5aiter39bf16gemm_fp32bf16_tn_80x64_splitk_cleanE,0.0218,129.65,1157.61
gfx950,256,136,1024,7168,False,torch.bfloat16,torch.bfloat16,False,False,asm,3,5,14.714,_ZN5aiter39bf16gemm_fp32bf16_tn_48x64_splitk_cleanE,0.0162,135.69,1149.13
gfx950,256,144,1024,7168,False,torch.bfloat16,torch.bfloat16,False,False,asm,3,5,14.4653,_ZN5aiter39bf16gemm_fp32bf16_tn_48x64_splitk_cleanE,0.016,146.14,1177.95
gfx950,256,152,1024,7168,False,torch.bfloat16,torch.bfloat16,False,False,asm,7,7,14.7479,_ZN5aiter39bf16gemm_fp32bf16_tn_80x64_splitk_cleanE,0.0206,151.3,1164.26
gfx950,256,160,1024,7168,False,torch.bfloat16,torch.bfloat16,False,False,asm,7,6,14.8795,_ZN5aiter39bf16gemm_fp32bf16_tn_80x64_splitk_cleanE,0.0185,157.86,1162.77
gfx950,256,168,1024,7168,False,torch.bfloat16,torch.bfloat16,False,False,asm,5,5,14.9201,_ZN5aiter39bf16gemm_fp32bf16_tn_64x64_splitk_cleanE,0.0163,165.3,1168.4
gfx950,256,176,1024,7168,False,torch.bfloat16,torch.bfloat16,False,False,asm,8,7,15.0293,_ZN5aiter39bf16gemm_fp32bf16_tn_96x64_splitk_cleanE,0.0199,171.91,1168.63
gfx950,256,184,1024,7168,False,torch.bfloat16,torch.bfloat16,False,False,asm,5,5,15.2612,_ZN5aiter39bf16gemm_fp32bf16_tn_64x64_splitk_cleanE,0.0162,176.99,1159.46
gfx950,256,192,1024,7168,False,torch.bfloat16,torch.bfloat16,False,False,asm,5,5,15.3106,_ZN5aiter39bf16gemm_fp32bf16_tn_64x64_splitk_cleanE,0.0163,184.09,1164.28
gfx950,256,200,1024,7168,False,torch.bfloat16,torch.bfloat16,False,False,asm,7,5,15.415,_ZN5aiter39bf16gemm_fp32bf16_tn_80x64_splitk_cleanE,0.0162,190.46,1164.9
gfx950,256,208,1024,7168,False,torch.bfloat16,torch.bfloat16,False,False,asm,7,5,15.5644,_ZN5aiter39bf16gemm_fp32bf16_tn_80x64_splitk_cleanE,0.0162,196.18,1162.14
gfx950,256,216,1024,7168,False,torch.bfloat16,torch.bfloat16,False,False,asm,7,5,15.6173,_ZN5aiter39bf16gemm_fp32bf16_tn_80x64_splitk_cleanE,0.0162,203.04,1166.59
gfx950,256,224,1024,7168,False,torch.bfloat16,torch.bfloat16,False,False,asm,7,5,15.9662,_ZN5aiter39bf16gemm_fp32bf16_tn_80x64_splitk_cleanE,0.0163,205.96,1149.31
gfx950,256,232,1024,7168,False,torch.bfloat16,torch.bfloat16,False,False,asm,7,5,15.8927,_ZN5aiter39bf16gemm_fp32bf16_tn_80x64_splitk_cleanE,0.0161,214.3,1162.87
gfx950,256,240,1024,7168,False,torch.bfloat16,torch.bfloat16,False,False,asm,7,5,15.8561,_ZN5aiter39bf16gemm_fp32bf16_tn_80x64_splitk_cleanE,0.0162,222.2,1173.82
gfx950,256,248,1024,7168,False,torch.bfloat16,torch.bfloat16,False,False,asm,8,5,16.1733,_ZN5aiter39bf16gemm_fp32bf16_tn_96x64_splitk_cleanE,0.0162,225.1,1158.9
gfx950,256,256,1024,7168,False,torch.bfloat16,torch.bfloat16,False,False,asm,8,5,16.2589,_ZN5aiter39bf16gemm_fp32bf16_tn_96x64_splitk_cleanE,0.0164,231.14,1160.86
gfx950,256,264,1024,7168,False,torch.bfloat16,torch.bfloat16,False,False,asm,8,5,16.4312,_ZN5aiter39bf16gemm_fp32bf16_tn_96x64_splitk_cleanE,0.0162,235.86,1156.67
gfx950,256,272,1024,7168,False,torch.bfloat16,torch.bfloat16,False,False,asm,8,5,16.4581,_ZN5aiter39bf16gemm_fp32bf16_tn_96x64_splitk_cleanE,0.0161,242.61,1162.74
gfx950,256,280,1024,7168,False,torch.bfloat16,torch.bfloat16,False,False,asm,8,5,16.5508,_ZN5aiter39bf16gemm_fp32bf16_tn_96x64_splitk_cleanE,0.0163,248.35,1164.15
gfx950,256,288,1024,7168,False,torch.bfloat16,torch.bfloat16,False,False,asm,8,5,16.6374,_ZN5aiter39bf16gemm_fp32bf16_tn_96x64_splitk_cleanE,0.0162,254.12,1165.97
gfx950,256,296,1024,7168,False,torch.bfloat16,torch.bfloat16,False,False,asm,7,4,17.3769,_ZN5aiter39bf16gemm_fp32bf16_tn_80x64_splitk_cleanE,0.0138,250.06,1123.89
gfx950,256,304,1024,7168,False,torch.bfloat16,torch.bfloat16,False,False,asm,7,4,17.5554,_ZN5aiter39bf16gemm_fp32bf16_tn_80x64_splitk_cleanE,0.0138,254.21,1119.93
gfx950,256,312,1024,7168,False,torch.bfloat16,torch.bfloat16,False,False,asm,7,4,17.6566,_ZN5aiter39bf16gemm_fp32bf16_tn_80x64_splitk_cleanE,0.0137,259.4,1120.93
gfx950,256,320,1024,7168,False,torch.bfloat16,torch.bfloat16,False,False,asm,8,4,17.7543,_ZN5aiter39bf16gemm_fp32bf16_tn_96x64_splitk_cleanE,0.0138,264.59,1122.15
gfx950,256,328,1024,7168,False,torch.bfloat16,torch.bfloat16,False,False,asm,8,4,18.1946,_ZN5aiter39bf16gemm_fp32bf16_tn_96x64_splitk_cleanE,0.0138,264.64,1102.2
gfx950,256,336,1024,7168,False,torch.bfloat16,torch.bfloat16,False,False,asm,8,4,18.2072,_ZN5aiter39bf16gemm_fp32bf16_tn_96x64_splitk_cleanE,0.0139,270.91,1108.63
gfx950,256,344,1024,7168,False,torch.bfloat16,torch.bfloat16,False,False,asm,8,4,18.2544,_ZN5aiter39bf16gemm_fp32bf16_tn_96x64_splitk_cleanE,0.0138,276.64,1112.95
gfx950,256,352,1024,7168,False,torch.bfloat16,torch.bfloat16,False,False,asm,8,4,18.3649,_ZN5aiter39bf16gemm_fp32bf16_tn_96x64_splitk_cleanE,0.0138,281.37,1113.39
gfx950,256,376,1024,7168,False,torch.bfloat16,torch.bfloat16,False,False,asm,8,4,18.8057,_ZN5aiter39bf16gemm_fp32bf16_tn_96x64_splitk_cleanE,0.0139,293.51,1108.2
gfx950,256,384,1024,7168,False,torch.bfloat16,torch.bfloat16,False,False,asm,8,4,18.7016,_ZN5aiter39bf16gemm_fp32bf16_tn_96x64_splitk_cleanE,0.0138,301.43,1121.38
gfx950,256,416,1024,7168,False,torch.bfloat16,torch.bfloat16,False,False,asm,8,3,20.4936,_ZN5aiter39bf16gemm_fp32bf16_tn_96x64_splitk_cleanE,0.0106,297.99,1048.9
gfx950,256,448,1024,7168,False,torch.bfloat16,torch.bfloat16,False,False,torch,0,0,21.6342,native,0.0,303.99,1017.84
gfx950,256,480,1024,7168,False,torch.bfloat16,torch.bfloat16,False,False,torch,0,0,21.1658,native,0.0,332.92,1065.13
gfx950,256,512,1024,7168,False,torch.bfloat16,torch.bfloat16,False,False,torch,0,0,21.5794,native,0.0,348.3,1069.01
gfx950,256,544,1024,7168,False,torch.bfloat16,torch.bfloat16,False,False,torch,0,0,26.4828,native,0.0,301.55,890.88
gfx950,256,576,1024,7168,False,torch.bfloat16,torch.bfloat16,False,False,torch,0,0,26.0659,native,0.0,324.4,925.24
gfx950,256,608,1024,7168,False,torch.bfloat16,torch.bfloat16,False,False,torch,0,0,26.9499,native,0.0,331.19,914.35
gfx950,256,640,1024,7168,False,torch.bfloat16,torch.bfloat16,False,False,torch,0,0,27.4604,native,0.0,342.14,916.44
gfx950,256,672,1024,7168,False,torch.bfloat16,torch.bfloat16,False,False,torch,0,0,26.0038,native,0.0,379.37,987.94
gfx950,256,704,1024,7168,False,torch.bfloat16,torch.bfloat16,False,False,asm,8,2,28.8131,_ZN5aiter39bf16gemm_fp32bf16_tn_96x64_splitk_cleanE,0.006,358.68,909.81
gfx950,256,736,1024,7168,False,torch.bfloat16,torch.bfloat16,False,False,asm,8,2,28.877,_ZN5aiter39bf16gemm_fp32bf16_tn_96x64_splitk_cleanE,0.006,374.16,925.95
gfx950,256,768,1024,7168,False,torch.bfloat16,torch.bfloat16,False,False,torch,0,0,29.1007,native,0.0,387.42,936.85
gfx950,256,800,1024,7168,False,torch.bfloat16,torch.bfloat16,False,False,torch,0,0,31.5877,native,0.0,371.79,879.69
gfx950,256,832,1024,7168,False,torch.bfloat16,torch.bfloat16,False,False,torch,0,0,31.3761,native,0.0,389.27,902.33
gfx950,256,864,1024,7168,False,torch.bfloat16,torch.bfloat16,False,False,torch,0,0,31.9559,native,0.0,396.91,902.36
gfx950,256,896,1024,7168,False,torch.bfloat16,torch.bfloat16,False,False,torch,0,0,32.8571,native,0.0,400.32,893.57
gfx950,256,928,1024,7168,False,torch.bfloat16,torch.bfloat16,False,False,torch,0,0,31.342,native,0.0,434.66,953.49
gfx950,256,960,1024,7168,False,torch.bfloat16,torch.bfloat16,False,False,torch,0,0,32.7575,native,0.0,430.22,928.3
gfx950,256,992,1024,7168,False,torch.bfloat16,torch.bfloat16,False,False,torch,0,0,33.053,native,0.0,440.58,935.86
gfx950,256,1024,1024,7168,False,torch.bfloat16,torch.bfloat16,False,False,torch,0,0,33.1564,native,0.0,453.38,948.75
gfx950,256,1088,1024,7168,False,torch.bfloat16,torch.bfloat16,False,False,torch,0,0,41.0181,native,0.0,389.39,792.48
gfx950,256,1152,1024,7168,False,torch.bfloat16,torch.bfloat16,False,False,torch,0,0,38.2461,native,0.0,442.17,877.33
gfx950,256,1216,1024,7168,False,torch.bfloat16,torch.bfloat16,False,False,torch,0,0,42.0006,native,0.0,425.02,823.87
gfx950,256,1280,1024,7168,False,torch.bfloat16,torch.bfloat16,False,False,torch,0,0,44.2541,native,0.0,424.6,805.61
gfx950,256,1344,1024,7168,False,torch.bfloat16,torch.bfloat16,False,False,torch,0,0,44.6014,native,0.0,442.36,822.85
gfx950,256,1408,1024,7168,False,torch.bfloat16,torch.bfloat16,False,False,torch,0,0,42.6672,native,0.0,484.44,884.72
gfx950,256,1472,1024,7168,False,torch.bfloat16,torch.bfloat16,False,False,torch,0,0,43.0773,native,0.0,501.63,900.64
gfx950,256,1536,1024,7168,False,torch.bfloat16,torch.bfloat16,False,False,torch,0,0,43.4899,native,0.0,518.48,916.21
gfx950,256,1600,1024,7168,False,torch.bfloat16,torch.bfloat16,False,False,torch,0,0,47.7202,native,0.0,492.2,856.96
gfx950,256,1664,1024,7168,False,torch.bfloat16,torch.bfloat16,False,False,torch,0,0,45.0863,native,0.0,541.8,930.28
gfx950,256,1728,1024,7168,False,torch.bfloat16,torch.bfloat16,False,False,torch,0,0,46.1288,native,0.0,549.92,931.99
gfx950,256,1792,1024,7168,False,torch.bfloat16,torch.bfloat16,False,False,torch,0,0,46.1236,native,0.0,570.35,954.83
gfx950,256,1856,1024,7168,False,torch.bfloat16,torch.bfloat16,False,False,torch,0,0,45.952,native,0.0,592.93,981.21
gfx950,256,1920,1024,7168,False,torch.bfloat16,torch.bfloat16,False,False,torch,0,0,48.9524,native,0.0,575.78,942.49
gfx950,256,1984,1024,7168,False,torch.bfloat16,torch.bfloat16,False,False,torch,0,0,56.4402,native,0.0,516.04,836.03
gfx950,256,2048,1024,7168,False,torch.bfloat16,torch.bfloat16,False,False,torch,0,0,50.8946,native,0.0,590.73,947.73
gfx950,256,4096,1024,7168,False,torch.bfloat16,torch.bfloat16,False,False,torch,0,0,81.5888,native,0.0,736.98,1002.45
gfx950,256,6144,1024,7168,False,torch.bfloat16,torch.bfloat16,False,False,torch,0,0,106.6188,native,0.0,845.95,1081.83
gfx950,256,8192,1024,7168,False,torch.bfloat16,torch.bfloat16,False,False,torch,0,0,118.9086,auto,0.0,1011.36,1252.2
gfx950,256,10240,1024,7168,False,torch.bfloat16,torch.bfloat16,False,False,torch,0,0,137.5062,native,0.0,1093.22,1326.87
gfx950,256,12288,1024,7168,False,torch.bfloat16,torch.bfloat16,False,False,torch,0,0,150.938,native,0.0,1195.12,1431.1
gfx950,256,14336,1024,7168,False,torch.bfloat16,torch.bfloat16,False,False,torch,0,0,166.3515,native,0.0,1265.11,1500.2
gfx950,256,16384,1024,7168,False,torch.bfloat16,torch.bfloat16,False,False,torch,0,0,170.6176,native,0.0,1409.69,1659.36
gfx950,256,32768,1024,7168,False,torch.bfloat16,torch.bfloat16,False,False,torch,0,0,333.7051,native,0.0,1441.5,1652.81
gfx950,256,1,2048,7168,False,torch.bfloat16,torch.bfloat16,False,False,flydsl,68,7,9.4101,flydsl_gemm2_abf16_wbf16_bf16_t16x64x256_split_k7_block_m_warp1_block_n_warp2_async_copyTrue_b_to_ldsFalse_b_preshuffleFalse_c_to_ldsFalse_gfx950,0.0142,3.12,3122.02
gfx950,256,2,2048,7168,False,torch.bfloat16,torch.bfloat16,False,False,flydsl,68,7,9.8692,flydsl_gemm2_abf16_wbf16_bf16_t16x64x256_split_k7_block_m_warp1_block_n_warp2_async_copyTrue_b_to_ldsFalse_b_preshuffleFalse_c_to_ldsFalse_gfx950,0.0166,5.95,2978.66
gfx950,256,4,2048,7168,False,torch.bfloat16,torch.bfloat16,False,False,flydsl,68,7,9.2284,flydsl_gemm2_abf16_wbf16_bf16_t16x64x256_split_k7_block_m_warp1_block_n_warp2_async_copyTrue_b_to_ldsFalse_b_preshuffleFalse_c_to_ldsFalse_gfx950,0.0175,12.73,3189.49
gfx950,256,8,2048,7168,False,torch.bfloat16,torch.bfloat16,False,False,flydsl,68,7,9.4851,flydsl_gemm2_abf16_wbf16_bf16_t16x64x256_split_k7_block_m_warp1_block_n_warp2_async_copyTrue_b_to_ldsFalse_b_preshuffleFalse_c_to_ldsFalse_gfx950,0.0173,24.76,3110.94
gfx950,256,16,2048,7168,False,torch.bfloat16,torch.bfloat16,False,False,flydsl,68,7,10.2204,flydsl_gemm2_abf16_wbf16_bf16_t16x64x256_split_k7_block_m_warp1_block_n_warp2_async_copyTrue_b_to_ldsFalse_b_preshuffleFalse_c_to_ldsFalse_gfx950,0.0199,45.96,2901.55
gfx950,256,32,2048,7168,False,torch.bfloat16,torch.bfloat16,False,False,flydsl,246,7,11.9133,flydsl_gemm2_abf16_wbf16_bf16_t32x64x256_split_k7_block_m_warp1_block_n_warp2_async_copyTrue_b_to_ldsFalse_b_preshuffleFalse_c_to_ldsFalse_gfx950,0.0195,78.86,2513.99
gfx950,256,48,2048,7168,False,torch.bfloat16,torch.bfloat16,False,False,flydsl,340,7,13.9991,flydsl_gemm2_abf16_wbf16_bf16_t48x64x256_split_k7_block_m_warp1_block_n_warp2_async_copyTrue_b_to_ldsFalse_b_preshuffleFalse_c_to_ldsFalse_gfx950,0.0199,100.67,2160.49
gfx950,256,64,2048,7168,False,torch.bfloat16,torch.bfloat16,False,False,flydsl,686,7,14.7682,flydsl_gemm2_abf16_wbf16_bf16_t64x64x256_split_k7_block_m_warp1_block_n_warp2_async_copyTrue_b_to_ldsFalse_b_preshuffleFalse_c_to_ldsFalse_gfx950,0.0195,127.24,2067.94
gfx950,256,80,2048,7168,False,torch.bfloat16,torch.bfloat16,False,False,asm,7,6,15.4743,_ZN5aiter39bf16gemm_fp32bf16_tn_80x64_splitk_cleanE,0.0177,151.79,1992.64
gfx950,256,96,2048,7168,False,torch.bfloat16,torch.bfloat16,False,False,asm,8,6,16.1416,_ZN5aiter39bf16gemm_fp32bf16_tn_96x64_splitk_cleanE,0.0179,174.62,1928.53
gfx950,256,112,2048,7168,False,torch.bfloat16,torch.bfloat16,False,False,asm,5,4,16.9119,_ZN5aiter39bf16gemm_fp32bf16_tn_64x64_splitk_cleanE,0.0138,194.44,1858.13
gfx950,256,128,2048,7168,False,torch.bfloat16,torch.bfloat16,False,False,asm,5,4,17.1417,_ZN5aiter39bf16gemm_fp32bf16_tn_64x64_splitk_cleanE,0.0142,219.24,1850.42
gfx950,256,144,2048,7168,False,torch.bfloat16,torch.bfloat16,False,False,asm,7,4,17.764,_ZN5aiter39bf16gemm_fp32bf16_tn_80x64_splitk_cleanE,0.0142,238.0,1802.2
gfx950,256,160,2048,7168,False,torch.bfloat16,torch.bfloat16,False,False,asm,7,4,18.1221,_ZN5aiter39bf16gemm_fp32bf16_tn_80x64_splitk_cleanE,0.0142,259.22,1782.86
gfx950,256,176,2048,7168,False,torch.bfloat16,torch.bfloat16,False,False,asm,8,4,18.434,_ZN5aiter39bf16gemm_fp32bf16_tn_96x64_splitk_cleanE,0.0141,280.32,1768.7
gfx950,256,192,2048,7168,False,torch.bfloat16,torch.bfloat16,False,False,asm,8,4,19.0947,_ZN5aiter39bf16gemm_fp32bf16_tn_96x64_splitk_cleanE,0.0141,295.22,1722.94
gfx950,256,208,2048,7168,False,torch.bfloat16,torch.bfloat16,False,False,torch,0,0,22.1231,native,0.0,276.04,1500.42
gfx950,256,224,2048,7168,False,torch.bfloat16,torch.bfloat16,False,False,torch,0,0,22.3183,native,0.0,294.68,1500.51
gfx950,256,240,2048,7168,False,torch.bfloat16,torch.bfloat16,False,False,torch,0,0,23.3596,native,0.0,301.65,1446.25
gfx950,256,256,2048,7168,False,torch.bfloat16,torch.bfloat16,False,False,torch,0,0,23.2783,native,0.0,322.88,1463.97
gfx950,256,288,2048,7168,False,torch.bfloat16,torch.bfloat16,False,False,asm,7,2,27.0242,_ZN5aiter39bf16gemm_fp32bf16_tn_80x64_splitk_cleanE,0.0061,312.89,1282.87
gfx950,256,320,2048,7168,False,torch.bfloat16,torch.bfloat16,False,False,torch,0,0,27.7123,native,0.0,339.03,1272.3
gfx950,256,352,2048,7168,False,torch.bfloat16,torch.bfloat16,False,False,asm,8,2,28.8349,_ZN5aiter39bf16gemm_fp32bf16_tn_96x64_splitk_cleanE,0.0061,358.41,1243.22
gfx950,256,384,2048,7168,False,torch.bfloat16,torch.bfloat16,False,False,torch,0,0,28.8691,native,0.0,390.53,1262.18
gfx950,256,416,2048,7168,False,torch.bfloat16,torch.bfloat16,False,False,torch,0,0,32.4792,native,0.0,376.05,1140.05
gfx950,256,448,2048,7168,False,torch.bfloat16,torch.bfloat16,False,False,torch,0,0,32.7592,native,0.0,401.52,1148.31
gfx950,256,480,2048,7168,False,torch.bfloat16,torch.bfloat16,False,False,torch,0,0,32.8244,native,0.0,429.34,1164.0
gfx950,256,512,2048,7168,False,torch.bfloat16,torch.bfloat16,False,False,torch,0,0,34.112,native,0.0,440.68,1137.35
gfx950,256,544,2048,7168,False,torch.bfloat16,torch.bfloat16,False,False,torch,0,0,44.7985,native,0.0,356.53,879.21
gfx950,256,576,2048,7168,False,torch.bfloat16,torch.bfloat16,False,False,torch,0,0,45.0147,native,0.0,375.69,888.09
gfx950,256,608,2048,7168,False,torch.bfloat16,torch.bfloat16,False,False,torch,0,0,46.6185,native,0.0,382.92,870.19
gfx950,256,640,2048,7168,False,torch.bfloat16,torch.bfloat16,False,False,torch,0,0,46.6389,native,0.0,402.89,882.45
gfx950,256,672,2048,7168,False,torch.bfloat16,torch.bfloat16,False,False,torch,0,0,40.7751,native,0.0,483.87,1023.82
gfx950,256,704,2048,7168,False,torch.bfloat16,torch.bfloat16,False,False,torch,0,0,44.4442,native,0.0,465.07,952.57
gfx950,256,736,2048,7168,False,torch.bfloat16,torch.bfloat16,False,False,torch,0,0,44.1252,native,0.0,489.72,972.82
gfx950,256,768,2048,7168,False,torch.bfloat16,torch.bfloat16,False,False,torch,0,0,44.141,native,0.0,510.83,985.84
gfx950,256,800,2048,7168,False,torch.bfloat16,torch.bfloat16,False,False,torch,0,0,48.0765,native,0.0,488.56,917.41
gfx950,256,832,2048,7168,False,torch.bfloat16,torch.bfloat16,False,False,torch,0,0,46.7824,native,0.0,522.15,955.39
gfx950,256,864,2048,7168,False,torch.bfloat16,torch.bfloat16,False,False,torch,0,0,45.4627,native,0.0,557.98,996.1
gfx950,256,896,2048,7168,False,torch.bfloat16,torch.bfloat16,False,False,torch,0,0,47.374,native,0.0,555.3,968.36
gfx950,256,928,2048,7168,False,torch.bfloat16,torch.bfloat16,False,False,torch,0,0,55.0438,native,0.0,494.99,844.15
gfx950,256,960,2048,7168,False,torch.bfloat16,torch.bfloat16,False,False,torch,0,0,56.8626,native,0.0,495.68,827.52
gfx950,256,992,2048,7168,False,torch.bfloat16,torch.bfloat16,False,False,torch,0,0,48.5312,native,0.0,600.13,981.73
gfx950,256,1024,2048,7168,False,torch.bfloat16,torch.bfloat16,False,False,torch,0,0,49.1108,native,0.0,612.18,982.16
gfx950,256,1088,2048,7168,False,torch.bfloat16,torch.bfloat16,False,False,torch,0,0,61.9171,native,0.0,515.91,798.07
gfx950,256,1152,2048,7168,False,torch.bfloat16,torch.bfloat16,False,False,torch,0,0,63.0131,native,0.0,536.76,802.91
gfx950,256,1216,2048,7168,False,torch.bfloat16,torch.bfloat16,False,False,torch,0,0,64.2787,native,0.0,555.42,805.45
gfx950,256,1280,2048,7168,False,torch.bfloat16,torch.bfloat16,False,False,torch,0,0,64.7456,native,0.0,580.44,817.86
gfx950,256,1344,2048,7168,False,torch.bfloat16,torch.bfloat16,False,False,torch,0,0,66.8722,native,0.0,590.08,809.5
gfx950,256,1408,2048,7168,False,torch.bfloat16,torch.bfloat16,False,False,torch,0,0,68.6391,native,0.0,602.27,805.84
gfx950,256,1472,2048,7168,False,torch.bfloat16,torch.bfloat16,False,False,torch,0,0,68.7327,native,0.0,628.79,821.91
gfx950,256,1536,2048,7168,False,torch.bfloat16,torch.bfloat16,False,False,torch,0,0,70.522,native,0.0,639.48,817.78
gfx950,256,1600,2048,7168,False,torch.bfloat16,torch.bfloat16,False,False,torch,0,0,72.1114,native,0.0,651.44,816.12
gfx950,256,1664,2048,7168,False,torch.bfloat16,torch.bfloat16,False,False,torch,0,0,73.3081,native,0.0,666.44,818.89
gfx950,256,1728,2048,7168,False,torch.bfloat16,torch.bfloat16,False,False,torch,0,0,74.312,native,0.0,682.72,823.7
gfx950,256,1792,2048,7168,False,torch.bfloat16,torch.bfloat16,False,False,torch,0,0,75.0524,native,0.0,701.02,831.29
gfx950,256,1856,2048,7168,False,torch.bfloat16,torch.bfloat16,False,False,torch,0,0,77.2088,native,0.0,705.78,823.35
gfx950,256,1920,2048,7168,False,torch.bfloat16,torch.bfloat16,False,False,torch,0,0,80.5432,native,0.0,699.89,803.91
gfx950,256,1984,2048,7168,False,torch.bfloat16,torch.bfloat16,False,False,torch,0,0,82.9159,native,0.0,702.53,795.13
gfx950,256,2048,2048,7168,False,torch.bfloat16,torch.bfloat16,False,False,torch,0,0,82.8118,native,0.0,726.1,810.38
gfx950,256,4096,2048,7168,False,torch.bfloat16,torch.bfloat16,False,False,torch,0,0,114.2544,auto,0.0,1052.56,917.76
gfx950,256,6144,2048,7168,False,torch.bfloat16,torch.bfloat16,False,False,torch,0,0,146.8743,native,0.0,1228.18,970.94
gfx950,256,8192,2048,7168,False,torch.bfloat16,torch.bfloat16,False,False,torch,0,0,167.8032,native,0.0,1433.33,1074.8
gfx950,256,10240,2048,7168,False,torch.bfloat16,torch.bfloat16,False,False,torch,0,0,256.6952,native,0.0,1171.22,849.66
gfx950,256,12288,2048,7168,False,torch.bfloat16,torch.bfloat16,False,False,torch,0,0,276.7836,native,0.0,1303.46,924.38
gfx950,256,14336,2048,7168,False,torch.bfloat16,torch.bfloat16,False,False,torch,0,0,301.5217,native,0.0,1395.94,973.73
gfx950,256,16384,2048,7168,False,torch.bfloat16,torch.bfloat16,False,False,torch,0,0,324.2494,native,0.0,1483.54,1021.9
gfx950,256,32768,2048,7168,False,torch.bfloat16,torch.bfloat16,False,False,torch,0,0,632.769,native,0.0,1520.42,1000.9
