aiter/configs/model_configs/dsv4_bf16_tuned_gemm.csv
gfx,cu_num,M,N,K,bias,dtype,outdtype,scaleAB,bpreshuffle,libtype,solidx,splitK,us,kernelName,err_ratio,tflops,bw
gfx950,256,1,64,7168,False,torch.bfloat16,torch.bfloat16,False,False,skinny,2,0,4.195,sol2,0.0,0.22,222.16
gfx950,256,2,64,7168,False,torch.bfloat16,torch.bfloat16,False,False,asm,3,14,5.4106,_ZN5aiter39bf16gemm_fp32bf16_tn_48x64_splitk_cleanE,0.0312,0.34,174.92
gfx950,256,4,64,7168,False,torch.bfloat16,torch.bfloat16,False,False,asm,1,16,5.0217,_ZN5aiter39bf16gemm_fp32bf16_tn_32x64_splitk_cleanE,0.0391,0.73,194.23
gfx950,256,8,64,7168,False,torch.bfloat16,torch.bfloat16,False,False,asm,1,16,5.0048,_ZN5aiter39bf16gemm_fp32bf16_tn_32x64_splitk_cleanE,0.0254,1.47,206.45
gfx950,256,16,64,7168,False,torch.bfloat16,torch.bfloat16,False,False,asm,1,16,5.0591,_ZN5aiter39bf16gemm_fp32bf16_tn_32x64_splitk_cleanE,0.0273,2.9,227.1
gfx950,256,32,64,7168,False,torch.bfloat16,torch.bfloat16,False,False,asm,1,16,5.0467,_ZN5aiter39bf16gemm_fp32bf16_tn_32x64_splitk_cleanE,0.0317,5.82,273.52
gfx950,256,48,64,7168,False,torch.bfloat16,torch.bfloat16,False,False,asm,3,16,5.7805,_ZN5aiter39bf16gemm_fp32bf16_tn_48x64_splitk_cleanE,0.0306,7.62,278.83
gfx950,256,64,64,7168,False,torch.bfloat16,torch.bfloat16,False,False,asm,1,16,5.491,_ZN5aiter39bf16gemm_fp32bf16_tn_32x64_splitk_cleanE,0.032,10.69,335.68
gfx950,256,80,64,7168,False,torch.bfloat16,torch.bfloat16,False,False,asm,3,16,5.8249,_ZN5aiter39bf16gemm_fp32bf16_tn_48x64_splitk_cleanE,0.0334,12.6,356.16
gfx950,256,96,64,7168,False,torch.bfloat16,torch.bfloat16,False,False,asm,3,14,6.1631,_ZN5aiter39bf16gemm_fp32bf16_tn_48x64_splitk_cleanE,0.029,14.29,374.17
gfx950,256,112,64,7168,False,torch.bfloat16,torch.bfloat16,False,False,asm,3,14,6.6516,_ZN5aiter39bf16gemm_fp32bf16_tn_48x64_splitk_cleanE,0.0276,15.45,381.48
gfx950,256,128,64,7168,False,torch.bfloat16,torch.bfloat16,False,False,asm,5,16,6.6656,_ZN5aiter39bf16gemm_fp32bf16_tn_64x64_splitk_cleanE,0.028,17.62,415.4
gfx950,256,144,64,7168,False,torch.bfloat16,torch.bfloat16,False,False,asm,5,16,7.3173,_ZN5aiter39bf16gemm_fp32bf16_tn_64x64_splitk_cleanE,0.0316,18.06,410.03
gfx950,256,160,64,7168,False,torch.bfloat16,torch.bfloat16,False,False,asm,7,16,7.4189,_ZN5aiter39bf16gemm_fp32bf16_tn_80x64_splitk_cleanE,0.029,19.79,435.61
gfx950,256,176,64,7168,False,torch.bfloat16,torch.bfloat16,False,False,asm,5,16,7.578,_ZN5aiter39bf16gemm_fp32bf16_tn_64x64_splitk_cleanE,0.0279,21.31,457.0
gfx950,256,192,64,7168,False,torch.bfloat16,torch.bfloat16,False,False,asm,5,14,7.7818,_ZN5aiter39bf16gemm_fp32bf16_tn_64x64_splitk_cleanE,0.0296,22.64,474.77
gfx950,256,208,64,7168,False,torch.bfloat16,torch.bfloat16,False,False,asm,7,16,7.8519,_ZN5aiter39bf16gemm_fp32bf16_tn_80x64_splitk_cleanE,0.03,24.31,500.01
gfx950,256,224,64,7168,False,torch.bfloat16,torch.bfloat16,False,False,asm,5,14,8.2515,_ZN5aiter39bf16gemm_fp32bf16_tn_64x64_splitk_cleanE,0.0297,24.91,503.84
gfx950,256,240,64,7168,False,torch.bfloat16,torch.bfloat16,False,False,asm,7,16,8.0749,_ZN5aiter39bf16gemm_fp32bf16_tn_80x64_splitk_cleanE,0.0298,27.27,543.52
gfx950,256,256,64,7168,False,torch.bfloat16,torch.bfloat16,False,False,asm,8,16,8.3352,_ZN5aiter39bf16gemm_fp32bf16_tn_96x64_splitk_cleanE,0.03,28.18,554.31
gfx950,256,288,64,7168,False,torch.bfloat16,torch.bfloat16,False,False,asm,8,16,8.5126,_ZN5aiter39bf16gemm_fp32bf16_tn_96x64_splitk_cleanE,0.0309,31.04,597.13
gfx950,256,320,64,7168,False,torch.bfloat16,torch.bfloat16,False,False,asm,7,16,8.787,_ZN5aiter39bf16gemm_fp32bf16_tn_80x64_splitk_cleanE,0.0272,33.41,631.16
gfx950,256,352,64,7168,False,torch.bfloat16,torch.bfloat16,False,False,asm,8,14,9.215,_ZN5aiter39bf16gemm_fp32bf16_tn_96x64_splitk_cleanE,0.0276,35.05,652.07
gfx950,256,384,64,7168,False,torch.bfloat16,torch.bfloat16,False,False,asm,8,16,9.2367,_ZN5aiter39bf16gemm_fp32bf16_tn_96x64_splitk_cleanE,0.029,38.14,700.65
gfx950,256,416,64,7168,False,torch.bfloat16,torch.bfloat16,False,False,flydsl,70,7,9.6089,flydsl_gemm2_abf16_wbf16_bf16_t16x64x256_split_k7_block_m_warp1_block_n_warp2_async_copyTrue_b_to_ldsFalse_b_preshuffleFalse_c_to_ldsFalse_gfx950,0.0196,39.72,721.68
gfx950,256,448,64,7168,False,torch.bfloat16,torch.bfloat16,False,False,flydsl,70,7,9.4109,flydsl_gemm2_abf16_wbf16_bf16_t16x64x256_split_k7_block_m_warp1_block_n_warp2_async_copyTrue_b_to_ldsFalse_b_preshuffleFalse_c_to_ldsFalse_gfx950,0.0193,43.68,786.04
gfx950,256,480,64,7168,False,torch.bfloat16,torch.bfloat16,False,False,flydsl,70,7,9.2766,flydsl_gemm2_abf16_wbf16_bf16_t16x64x256_split_k7_block_m_warp1_block_n_warp2_async_copyTrue_b_to_ldsFalse_b_preshuffleFalse_c_to_ldsFalse_gfx950,0.0194,47.47,847.32
gfx950,256,512,64,7168,False,torch.bfloat16,torch.bfloat16,False,False,flydsl,204,7,9.7884,flydsl_gemm2_abf16_wbf16_bf16_t48x64x256_split_k7_block_m_warp1_block_n_warp2_async_copyTrue_b_to_ldsFalse_b_preshuffleFalse_c_to_ldsFalse_gfx950,0.0193,47.99,850.3
gfx950,256,544,64,7168,False,torch.bfloat16,torch.bfloat16,False,False,flydsl,167,7,9.7056,flydsl_gemm2_abf16_wbf16_bf16_t32x64x256_split_k7_block_m_warp1_block_n_warp4_async_copyTrue_b_to_ldsFalse_b_preshuffleFalse_c_to_ldsFalse_gfx950,0.0194,51.43,905.24
gfx950,256,576,64,7168,False,torch.bfloat16,torch.bfloat16,False,False,flydsl,170,7,9.4461,flydsl_gemm2_abf16_wbf16_bf16_t32x64x256_split_k7_block_m_warp2_block_n_warp2_async_copyTrue_b_to_ldsTrue_b_preshuffleFalse_c_to_ldsFalse_gfx950,0.0201,55.95,979.11
gfx950,256,608,64,7168,False,torch.bfloat16,torch.bfloat16,False,False,flydsl,167,7,9.4472,flydsl_gemm2_abf16_wbf16_bf16_t32x64x256_split_k7_block_m_warp1_block_n_warp4_async_copyTrue_b_to_ldsFalse_b_preshuffleFalse_c_to_ldsFalse_gfx950,0.0202,59.05,1027.99
gfx950,256,640,64,7168,False,torch.bfloat16,torch.bfloat16,False,False,flydsl,168,7,9.9315,flydsl_gemm2_abf16_wbf16_bf16_t32x64x256_split_k7_block_m_warp1_block_n_warp4_async_copyTrue_b_to_ldsTrue_b_preshuffleFalse_c_to_ldsFalse_gfx950,0.0205,59.13,1024.46
gfx950,256,672,64,7168,False,torch.bfloat16,torch.bfloat16,False,False,flydsl,167,7,9.808,flydsl_gemm2_abf16_wbf16_bf16_t32x64x256_split_k7_block_m_warp1_block_n_warp4_async_copyTrue_b_to_ldsFalse_b_preshuffleFalse_c_to_ldsFalse_gfx950,0.0197,62.86,1084.55
gfx950,256,704,64,7168,False,torch.bfloat16,torch.bfloat16,False,False,flydsl,168,7,10.4584,flydsl_gemm2_abf16_wbf16_bf16_t32x64x256_split_k7_block_m_warp1_block_n_warp4_async_copyTrue_b_to_ldsTrue_b_preshuffleFalse_c_to_ldsFalse_gfx950,0.0201,61.76,1061.36
gfx950,256,736,64,7168,False,torch.bfloat16,torch.bfloat16,False,False,flydsl,168,7,9.5967,flydsl_gemm2_abf16_wbf16_bf16_t32x64x256_split_k7_block_m_warp1_block_n_warp4_async_copyTrue_b_to_ldsTrue_b_preshuffleFalse_c_to_ldsFalse_gfx950,0.0199,70.37,1204.89
gfx950,256,768,64,7168,False,torch.bfloat16,torch.bfloat16,False,False,flydsl,168,7,10.561,flydsl_gemm2_abf16_wbf16_bf16_t32x64x256_split_k7_block_m_warp1_block_n_warp4_async_copyTrue_b_to_ldsTrue_b_preshuffleFalse_c_to_ldsFalse_gfx950,0.0198,66.72,1138.7
gfx950,256,800,64,7168,False,torch.bfloat16,torch.bfloat16,False,False,flydsl,168,7,10.0226,flydsl_gemm2_abf16_wbf16_bf16_t32x64x256_split_k7_block_m_warp1_block_n_warp4_async_copyTrue_b_to_ldsTrue_b_preshuffleFalse_c_to_ldsFalse_gfx950,0.0192,73.23,1246.05
gfx950,256,832,64,7168,False,torch.bfloat16,torch.bfloat16,False,False,flydsl,167,7,10.7347,flydsl_gemm2_abf16_wbf16_bf16_t32x64x256_split_k7_block_m_warp1_block_n_warp4_async_copyTrue_b_to_ldsFalse_b_preshuffleFalse_c_to_ldsFalse_gfx950,0.0199,71.11,1206.51
gfx950,256,864,64,7168,False,torch.bfloat16,torch.bfloat16,False,False,flydsl,167,7,10.5427,flydsl_gemm2_abf16_wbf16_bf16_t32x64x256_split_k7_block_m_warp1_block_n_warp4_async_copyTrue_b_to_ldsFalse_b_preshuffleFalse_c_to_ldsFalse_gfx950,0.0201,75.19,1272.39
gfx950,256,896,64,7168,False,torch.bfloat16,torch.bfloat16,False,False,flydsl,170,7,10.9012,flydsl_gemm2_abf16_wbf16_bf16_t32x64x256_split_k7_block_m_warp2_block_n_warp2_async_copyTrue_b_to_ldsTrue_b_preshuffleFalse_c_to_ldsFalse_gfx950,0.0199,75.41,1273.0
gfx950,256,928,64,7168,False,torch.bfloat16,torch.bfloat16,False,False,flydsl,167,7,10.8216,flydsl_gemm2_abf16_wbf16_bf16_t32x64x256_split_k7_block_m_warp1_block_n_warp4_async_copyTrue_b_to_ldsFalse_b_preshuffleFalse_c_to_ldsFalse_gfx950,0.0204,78.68,1325.14
gfx950,256,960,64,7168,False,torch.bfloat16,torch.bfloat16,False,False,flydsl,168,7,11.0489,flydsl_gemm2_abf16_wbf16_bf16_t32x64x256_split_k7_block_m_warp1_block_n_warp4_async_copyTrue_b_to_ldsTrue_b_preshuffleFalse_c_to_ldsFalse_gfx950,0.0198,79.72,1339.77
gfx950,256,992,64,7168,False,torch.bfloat16,torch.bfloat16,False,False,opus,1202,4,11.9537,opus_gemm_flatmm_splitk_256x32x32x128_2x1_16x16x32_0x0x0_wgpcu2_nooob,0.0,76.14,1277.08
gfx950,256,1024,64,7168,False,torch.bfloat16,torch.bfloat16,False,False,torch,0,0,11.7299,native,0.0,80.1,1340.9
gfx950,256,1088,64,7168,False,torch.bfloat16,torch.bfloat16,False,False,opus,1202,4,12.5708,opus_gemm_flatmm_splitk_256x32x32x128_2x1_16x16x32_0x0x0_wgpcu2_nooob,0.0,79.41,1324.84
gfx950,256,1152,64,7168,False,torch.bfloat16,torch.bfloat16,False,False,opus,1202,4,12.5797,opus_gemm_flatmm_splitk_256x32x32x128_2x1_16x16x32_0x0x0_wgpcu2_nooob,0.0,84.02,1397.49
gfx950,256,1216,64,7168,False,torch.bfloat16,torch.bfloat16,False,False,opus,1205,6,12.7695,opus_gemm_flatmm_splitk_256x64x32x64_2x1_16x16x32_0x0x0_wgpcu2_nooob,0.0,87.37,1449.21
gfx950,256,1280,64,7168,False,torch.bfloat16,torch.bfloat16,False,False,flydsl,204,7,13.1745,flydsl_gemm2_abf16_wbf16_bf16_t48x64x256_split_k7_block_m_warp1_block_n_warp2_async_copyTrue_b_to_ldsFalse_b_preshuffleFalse_c_to_ldsFalse_gfx950,0.0197,89.14,1474.93
gfx950,256,1344,64,7168,False,torch.bfloat16,torch.bfloat16,False,False,opus,1205,6,13.109,opus_gemm_flatmm_splitk_256x64x32x64_2x1_16x16x32_0x0x0_wgpcu2_nooob,0.0,94.07,1552.91
gfx950,256,1408,64,7168,False,torch.bfloat16,torch.bfloat16,False,False,asm,3,6,13.795,_ZN5aiter39bf16gemm_fp32bf16_tn_48x64_splitk_cleanE,0.0183,93.65,1542.79
gfx950,256,1472,64,7168,False,torch.bfloat16,torch.bfloat16,False,False,flydsl,204,7,13.796,flydsl_gemm2_abf16_wbf16_bf16_t48x64x256_split_k7_block_m_warp1_block_n_warp2_async_copyTrue_b_to_ldsFalse_b_preshuffleFalse_c_to_ldsFalse_gfx950,0.0206,97.9,1609.78
gfx950,256,1536,64,7168,False,torch.bfloat16,torch.bfloat16,False,False,flydsl,204,7,13.9555,flydsl_gemm2_abf16_wbf16_bf16_t48x64x256_split_k7_block_m_warp1_block_n_warp2_async_copyTrue_b_to_ldsFalse_b_preshuffleFalse_c_to_ldsFalse_gfx950,0.0201,100.98,1657.71
gfx950,256,1600,64,7168,False,torch.bfloat16,torch.bfloat16,False,False,flydsl,204,7,14.0472,flydsl_gemm2_abf16_wbf16_bf16_t48x64x256_split_k7_block_m_warp1_block_n_warp2_async_copyTrue_b_to_ldsFalse_b_preshuffleFalse_c_to_ldsFalse_gfx950,0.0204,104.51,1712.79
gfx950,256,1664,64,7168,False,torch.bfloat16,torch.bfloat16,False,False,asm,3,6,14.1427,_ZN5aiter39bf16gemm_fp32bf16_tn_48x64_splitk_cleanE,0.0181,107.95,1766.68
gfx950,256,1728,64,7168,False,torch.bfloat16,torch.bfloat16,False,False,asm,3,6,14.2338,_ZN5aiter39bf16gemm_fp32bf16_tn_48x64_splitk_cleanE,0.0181,111.39,1820.41
gfx950,256,1792,64,7168,False,torch.bfloat16,torch.bfloat16,False,False,asm,3,6,14.2841,_ZN5aiter39bf16gemm_fp32bf16_tn_48x64_splitk_cleanE,0.018,115.1,1878.8
gfx950,256,1856,64,7168,False,torch.bfloat16,torch.bfloat16,False,False,asm,3,6,14.3445,_ZN5aiter39bf16gemm_fp32bf16_tn_48x64_splitk_cleanE,0.0174,118.71,1935.42
gfx950,256,1920,64,7168,False,torch.bfloat16,torch.bfloat16,False,False,asm,3,6,14.5253,_ZN5aiter39bf16gemm_fp32bf16_tn_48x64_splitk_cleanE,0.0176,121.28,1975.06
gfx950,256,1984,64,7168,False,torch.bfloat16,torch.bfloat16,False,False,asm,3,6,14.692,_ZN5aiter39bf16gemm_fp32bf16_tn_48x64_splitk_cleanE,0.018,123.9,2015.66
gfx950,256,2048,64,7168,False,torch.bfloat16,torch.bfloat16,False,False,asm,5,6,15.1291,_ZN5aiter39bf16gemm_fp32bf16_tn_64x64_splitk_cleanE,0.0175,124.2,2018.61
gfx950,256,4096,64,7168,False,torch.bfloat16,torch.bfloat16,False,False,asm,8,5,18.8115,_ZN5aiter39bf16gemm_fp32bf16_tn_96x64_splitk_cleanE,0.0158,199.78,3198.15
gfx950,256,6144,64,7168,False,torch.bfloat16,torch.bfloat16,False,False,asm,8,4,23.245,_ZN5aiter39bf16gemm_fp32bf16_tn_96x64_splitk_cleanE,0.0136,242.51,3862.52
gfx950,256,8192,64,7168,False,torch.bfloat16,torch.bfloat16,False,False,torch,0,0,29.3229,native,0.0,256.33,4072.13
gfx950,256,10240,64,7168,False,torch.bfloat16,torch.bfloat16,False,False,torch,0,0,31.835,native,0.0,295.12,4681.29
gfx950,256,12288,64,7168,False,torch.bfloat16,torch.bfloat16,False,False,asm,8,2,37.3528,_ZN5aiter39bf16gemm_fp32bf16_tn_96x64_splitk_cleanE,0.0061,301.83,4782.8
gfx950,256,14336,64,7168,False,torch.bfloat16,torch.bfloat16,False,False,torch,0,0,43.7206,native,0.0,300.85,4763.74
gfx950,256,16384,64,7168,False,torch.bfloat16,torch.bfloat16,False,False,torch,0,0,48.9911,native,0.0,306.84,4855.9
gfx950,256,32768,64,7168,False,torch.bfloat16,torch.bfloat16,False,False,torch,0,0,85.1775,native,0.0,352.97,5575.11
gfx950,256,1,384,7168,False,torch.bfloat16,torch.bfloat16,False,False,skinny,2,0,7.756,sol2,0.0,0.71,711.72
gfx950,256,2,384,7168,False,torch.bfloat16,torch.bfloat16,False,False,flydsl,40,7,7.9825,flydsl_gemm2_abf16_wbf16_bf16_t16x64x256_split_k7_block_m_warp1_block_n_warp2_async_copyTrue_b_to_ldsFalse_b_preshuffleFalse_c_to_ldsFalse_gfx950,0.0156,1.38,693.42
gfx950,256,4,384,7168,False,torch.bfloat16,torch.bfloat16,False,False,flydsl,40,7,8.1712,flydsl_gemm2_abf16_wbf16_bf16_t16x64x256_split_k7_block_m_warp1_block_n_warp2_async_copyTrue_b_to_ldsFalse_b_preshuffleFalse_c_to_ldsFalse_gfx950,0.0215,2.69,681.1
gfx950,256,96,384,7168,False,torch.bfloat16,torch.bfloat16,False,False,flydsl,280,7,9.3101,flydsl_gemm2_abf16_wbf16_bf16_t32x64x256_split_k7_block_m_warp1_block_n_warp2_async_copyTrue_b_to_ldsFalse_b_preshuffleFalse_c_to_ldsFalse_gfx950,0.0205,56.76,747.04
gfx950,256,144,384,7168,False,torch.bfloat16,torch.bfloat16,False,False,flydsl,371,7,10.1565,flydsl_gemm2_abf16_wbf16_bf16_t32x64x256_split_k7_block_m_warp1_block_n_warp4_async_copyTrue_b_to_ldsFalse_b_preshuffleFalse_c_to_ldsFalse_gfx950,0.0205,78.05,756.17
gfx950,256,160,384,7168,False,torch.bfloat16,torch.bfloat16,False,False,torch,0,0,11.3779,native,0.0,77.41,696.23
gfx950,256,192,384,7168,False,torch.bfloat16,torch.bfloat16,False,False,opus,1203,8,12.1573,opus_gemm_flatmm_splitk_256x32x64x64_2x1_16x16x32_0x0x0_wgpcu2_nooob,0.0,86.94,691.35
gfx950,256,208,384,7168,False,torch.bfloat16,torch.bfloat16,False,False,opus,203,6,12.6221,opus_gemm_flatmm_splitk_256x32x64x64_2x1_16x16x32_0x0x0_wgpcu2,0.0,90.72,685.04
gfx950,256,256,384,7168,False,torch.bfloat16,torch.bfloat16,False,False,opus,1203,6,13.3428,opus_gemm_flatmm_splitk_256x32x64x64_2x1_16x16x32_0x0x0_wgpcu2_nooob,0.0,105.62,702.37
gfx950,256,288,384,7168,False,torch.bfloat16,torch.bfloat16,False,False,opus,200,8,13.6806,opus_gemm_flatmm_splitk_256x64x64x64_2x1_16x16x32_0x0x0_wgpcu2,0.0,115.89,720.36
gfx950,256,352,384,7168,False,torch.bfloat16,torch.bfloat16,False,False,opus,200,6,14.2369,opus_gemm_flatmm_splitk_256x64x64x64_2x1_16x16x32_0x0x0_wgpcu2,0.0,136.11,760.11
gfx950,256,384,384,7168,False,torch.bfloat16,torch.bfloat16,False,False,opus,1200,6,13.7858,opus_gemm_flatmm_splitk_256x64x64x64_2x1_16x16x32_0x0x0_wgpcu2_nooob,0.0,153.34,820.04
gfx950,256,416,384,7168,False,torch.bfloat16,torch.bfloat16,False,False,opus,200,6,14.1898,opus_gemm_flatmm_splitk_256x64x64x64_2x1_16x16x32_0x0x0_wgpcu2,0.0,161.39,830.76
gfx950,256,480,384,7168,False,torch.bfloat16,torch.bfloat16,False,False,opus,200,5,15.3346,opus_gemm_flatmm_splitk_256x64x64x64_2x1_16x16x32_0x0x0_wgpcu2,0.0,172.32,831.78
gfx950,256,544,384,7168,False,torch.bfloat16,torch.bfloat16,False,False,asm,7,5,16.0646,_ZN5aiter39bf16gemm_fp32bf16_tn_80x64_splitk_cleanE,0.0163,186.42,854.15
gfx950,256,576,384,7168,False,torch.bfloat16,torch.bfloat16,False,False,opus,1220,6,16.0396,opus_gemm_flatmm_splitk_256x96x64x64_2x1_16x16x32_0x0x0_wgpcu1_nooob,0.0,197.69,885.62
gfx950,256,608,384,7168,False,torch.bfloat16,torch.bfloat16,False,False,asm,5,4,16.6352,_ZN5aiter39bf16gemm_fp32bf16_tn_64x64_splitk_cleanE,0.0136,201.2,882.96
gfx950,256,640,384,7168,False,torch.bfloat16,torch.bfloat16,False,False,asm,5,4,16.8343,_ZN5aiter39bf16gemm_fp32bf16_tn_64x64_splitk_cleanE,0.0135,209.29,901.23
gfx950,256,672,384,7168,False,torch.bfloat16,torch.bfloat16,False,False,asm,7,4,17.0527,_ZN5aiter39bf16gemm_fp32bf16_tn_80x64_splitk_cleanE,0.0134,216.94,918.03
gfx950,256,704,384,7168,False,torch.bfloat16,torch.bfloat16,False,False,opus,1200,4,17.1527,opus_gemm_flatmm_splitk_256x64x64x64_2x1_16x16x32_0x0x0_wgpcu2_nooob,0.0,225.94,940.86
gfx950,256,736,384,7168,False,torch.bfloat16,torch.bfloat16,False,False,asm,7,4,17.6421,_ZN5aiter39bf16gemm_fp32bf16_tn_80x64_splitk_cleanE,0.0136,229.66,942.15
gfx950,256,768,384,7168,False,torch.bfloat16,torch.bfloat16,False,False,opus,1200,7,17.9675,opus_gemm_flatmm_splitk_256x64x64x64_2x1_16x16x32_0x0x0_wgpcu2_nooob,0.0,235.31,951.99
gfx950,256,800,384,7168,False,torch.bfloat16,torch.bfloat16,False,False,asm,8,4,18.3752,_ZN5aiter39bf16gemm_fp32bf16_tn_96x64_splitk_cleanE,0.0134,239.67,957.17
gfx950,256,832,384,7168,False,torch.bfloat16,torch.bfloat16,False,False,opus,1216,4,18.7191,opus_gemm_flatmm_splitk_256x64x96x128_2x1_16x16x32_0x0x0_wgpcu1_nooob,0.0,244.68,965.41
gfx950,256,864,384,7168,False,torch.bfloat16,torch.bfloat16,False,False,opus,1222,4,18.4419,opus_gemm_flatmm_splitk_256x96x64x128_2x1_16x16x32_0x0x0_wgpcu1_nooob,0.0,257.91,1006.13
gfx950,256,896,384,7168,False,torch.bfloat16,torch.bfloat16,False,False,opus,1200,6,19.2073,opus_gemm_flatmm_splitk_256x64x64x64_2x1_16x16x32_0x0x0_wgpcu2_nooob,0.0,256.8,991.2
gfx950,256,928,384,7168,False,torch.bfloat16,torch.bfloat16,False,False,asm,8,4,19.5385,_ZN5aiter39bf16gemm_fp32bf16_tn_96x64_splitk_cleanE,0.0137,261.47,999.13
gfx950,256,960,384,7168,False,torch.bfloat16,torch.bfloat16,False,False,opus,216,4,19.7076,opus_gemm_flatmm_splitk_256x64x96x128_2x1_16x16x32_0x0x0_wgpcu1,0.0,268.16,1015.08
gfx950,256,992,384,7168,False,torch.bfloat16,torch.bfloat16,False,False,asm,7,3,20.4156,_ZN5aiter39bf16gemm_fp32bf16_tn_80x64_splitk_cleanE,0.0103,267.49,1003.56
gfx950,256,1024,384,7168,False,torch.bfloat16,torch.bfloat16,False,False,asm,7,3,20.56,_ZN5aiter39bf16gemm_fp32bf16_tn_80x64_splitk_cleanE,0.0104,274.18,1020.02
gfx950,256,1088,384,7168,False,torch.bfloat16,torch.bfloat16,False,False,asm,7,3,20.3145,_ZN5aiter39bf16gemm_fp32bf16_tn_80x64_splitk_cleanE,0.0106,294.84,1079.93
gfx950,256,1152,384,7168,False,torch.bfloat16,torch.bfloat16,False,False,torch,0,0,21.7939,native,0.0,290.99,1050.97
gfx950,256,1216,384,7168,False,torch.bfloat16,torch.bfloat16,False,False,asm,8,3,23.3772,_ZN5aiter39bf16gemm_fp32bf16_tn_96x64_splitk_cleanE,0.0103,286.35,1021.14
gfx950,256,1280,384,7168,False,torch.bfloat16,torch.bfloat16,False,False,asm,8,3,23.4373,_ZN5aiter39bf16gemm_fp32bf16_tn_96x64_splitk_cleanE,0.0104,300.65,1059.77
gfx950,256,1344,384,7168,False,torch.bfloat16,torch.bfloat16,False,False,opus,1200,4,24.0505,opus_gemm_flatmm_splitk_256x64x64x64_2x1_16x16x32_0x0x0_wgpcu2_nooob,0.0,307.63,1072.94
gfx950,256,1408,384,7168,False,torch.bfloat16,torch.bfloat16,False,False,torch,0,0,23.3092,native,0.0,332.53,1148.54
gfx950,256,1472,384,7168,False,torch.bfloat16,torch.bfloat16,False,False,torch,0,0,23.1364,native,0.0,350.24,1198.89
gfx950,256,1536,384,7168,False,torch.bfloat16,torch.bfloat16,False,False,torch,0,0,23.273,native,0.0,363.33,1233.39
gfx950,256,1600,384,7168,False,torch.bfloat16,torch.bfloat16,False,False,torch,0,0,24.203,native,0.0,363.92,1225.94
gfx950,256,1664,384,7168,False,torch.bfloat16,torch.bfloat16,False,False,torch,0,0,24.0326,native,0.0,381.16,1274.85
gfx950,256,1728,384,7168,False,torch.bfloat16,torch.bfloat16,False,False,opus,1221,4,27.4989,opus_gemm_flatmm_splitk_256x96x64x64_2x1_16x16x32_0x0x0_wgpcu2_nooob,0.0,345.93,1149.31
gfx950,256,1792,384,7168,False,torch.bfloat16,torch.bfloat16,False,False,opus,1216,2,29.7232,opus_gemm_flatmm_splitk_256x64x96x128_2x1_16x16x32_0x0x0_wgpcu1_nooob,0.0,331.9,1095.82
gfx950,256,1856,384,7168,False,torch.bfloat16,torch.bfloat16,False,False,opus,1215,4,29.6804,opus_gemm_flatmm_splitk_256x64x96x64_2x1_16x16x32_0x0x0_wgpcu2_nooob,0.0,344.24,1129.97
gfx950,256,1920,384,7168,False,torch.bfloat16,torch.bfloat16,False,False,opus,1222,2,29.3681,opus_gemm_flatmm_splitk_256x96x64x128_2x1_16x16x32_0x0x0_wgpcu1_nooob,0.0,359.9,1174.9
gfx950,256,1984,384,7168,False,torch.bfloat16,torch.bfloat16,False,False,opus,222,2,31.0782,opus_gemm_flatmm_splitk_256x96x64x128_2x1_16x16x32_0x0x0_wgpcu1,0.0,351.44,1141.36
gfx950,256,2048,384,7168,False,torch.bfloat16,torch.bfloat16,False,False,torch,0,0,28.3933,native,0.0,397.08,1283.33
gfx950,256,4096,384,7168,False,torch.bfloat16,torch.bfloat16,False,False,torch,0,0,47.2094,native,0.0,477.63,1427.07
gfx950,256,6144,384,7168,False,torch.bfloat16,torch.bfloat16,False,False,torch,0,0,54.7362,native,0.0,617.93,1795.96
gfx950,256,8192,384,7168,False,torch.bfloat16,torch.bfloat16,False,False,torch,0,0,73.9355,native,0.0,609.95,1747.97
gfx950,256,10240,384,7168,False,torch.bfloat16,torch.bfloat16,False,False,torch,0,0,82.14,native,0.0,686.28,1949.96
gfx950,256,12288,384,7168,False,torch.bfloat16,torch.bfloat16,False,False,torch,0,0,80.7616,native,0.0,837.6,2366.26
gfx950,256,14336,384,7168,False,torch.bfloat16,torch.bfloat16,False,False,torch,0,0,90.4665,native,0.0,872.37,2454.34
gfx950,256,16384,384,7168,False,torch.bfloat16,torch.bfloat16,False,False,torch,0,0,99.8904,native,0.0,902.93,2532.47
gfx950,256,1,512,7168,False,torch.bfloat16,torch.bfloat16,False,False,skinny,2,0,7.8988,sol2,0.0,0.93,931.2
gfx950,256,2,512,7168,False,torch.bfloat16,torch.bfloat16,False,False,flydsl,68,7,8.237,flydsl_gemm2_abf16_wbf16_bf16_t16x64x256_split_k7_block_m_warp1_block_n_warp2_async_copyTrue_b_to_ldsFalse_b_preshuffleFalse_c_to_ldsFalse_gfx950,0.0156,1.78,894.83
gfx950,256,4,512,7168,False,torch.bfloat16,torch.bfloat16,False,False,flydsl,68,7,8.3512,flydsl_gemm2_abf16_wbf16_bf16_t16x64x256_split_k7_block_m_warp1_block_n_warp2_async_copyTrue_b_to_ldsFalse_b_preshuffleFalse_c_to_ldsFalse_gfx950,0.0186,3.52,886.28
gfx950,256,8,512,7168,False,torch.bfloat16,torch.bfloat16,False,False,flydsl,68,7,8.3132,flydsl_gemm2_abf16_wbf16_bf16_t16x64x256_split_k7_block_m_warp1_block_n_warp2_async_copyTrue_b_to_ldsFalse_b_preshuffleFalse_c_to_ldsFalse_gfx950,0.0171,7.06,897.72
gfx950,256,16,512,7168,False,torch.bfloat16,torch.bfloat16,False,False,flydsl,68,7,8.8938,flydsl_gemm2_abf16_wbf16_bf16_t16x64x256_split_k7_block_m_warp1_block_n_warp2_async_copyTrue_b_to_ldsFalse_b_preshuffleFalse_c_to_ldsFalse_gfx950,0.0205,13.2,852.93
gfx950,256,32,512,7168,False,torch.bfloat16,torch.bfloat16,False,False,flydsl,68,7,9.1632,flydsl_gemm2_abf16_wbf16_bf16_t16x64x256_split_k7_block_m_warp1_block_n_warp2_async_copyTrue_b_to_ldsFalse_b_preshuffleFalse_c_to_ldsFalse_gfx950,0.0197,25.63,854.67
gfx950,256,48,512,7168,False,torch.bfloat16,torch.bfloat16,False,False,flydsl,68,7,9.2225,flydsl_gemm2_abf16_wbf16_bf16_t16x64x256_split_k7_block_m_warp1_block_n_warp2_async_copyTrue_b_to_ldsFalse_b_preshuffleFalse_c_to_ldsFalse_gfx950,0.019,38.2,875.83
gfx950,256,64,512,7168,False,torch.bfloat16,torch.bfloat16,False,False,flydsl,403,8,9.8024,flydsl_gemm2_abf16_wbf16_bf16_t32x64x128_split_k8_block_m_warp1_block_n_warp4_async_copyTrue_b_to_ldsFalse_b_preshuffleFalse_c_to_ldsFalse_gfx950,0.0216,47.92,849.09
gfx950,256,80,512,7168,False,torch.bfloat16,torch.bfloat16,False,False,flydsl,422,7,9.2064,flydsl_gemm2_abf16_wbf16_bf16_t32x64x256_split_k7_block_m_warp1_block_n_warp2_async_copyTrue_b_to_ldsFalse_b_preshuffleFalse_c_to_ldsFalse_gfx950,0.0203,63.78,930.75
gfx950,256,96,512,7168,False,torch.bfloat16,torch.bfloat16,False,False,flydsl,424,7,10.4223,flydsl_gemm2_abf16_wbf16_bf16_t32x64x256_split_k7_block_m_warp1_block_n_warp4_async_copyTrue_b_to_ldsTrue_b_preshuffleFalse_c_to_ldsFalse_gfx950,0.019,67.61,845.74
gfx950,256,112,512,7168,False,torch.bfloat16,torch.bfloat16,False,False,flydsl,426,7,10.0711,flydsl_gemm2_abf16_wbf16_bf16_t32x64x256_split_k7_block_m_warp2_block_n_warp2_async_copyTrue_b_to_ldsTrue_b_preshuffleFalse_c_to_ldsFalse_gfx950,0.02,81.63,899.64
gfx950,256,128,512,7168,False,torch.bfloat16,torch.bfloat16,False,False,flydsl,546,7,11.1279,flydsl_gemm2_abf16_wbf16_bf16_t32x64x256_split_k7_block_m_warp2_block_n_warp2_async_copyTrue_b_to_ldsTrue_b_preshuffleFalse_c_to_ldsFalse_gfx950,0.0202,84.43,836.29
gfx950,256,144,512,7168,False,torch.bfloat16,torch.bfloat16,False,False,opus,203,6,12.5083,opus_gemm_flatmm_splitk_256x32x64x64_2x1_16x16x32_0x0x0_wgpcu2,0.0,84.5,763.64
gfx950,256,160,512,7168,False,torch.bfloat16,torch.bfloat16,False,False,opus,1203,6,12.5706,opus_gemm_flatmm_splitk_256x32x64x64_2x1_16x16x32_0x0x0_wgpcu2_nooob,0.0,93.42,779.41
gfx950,256,176,512,7168,False,torch.bfloat16,torch.bfloat16,False,False,opus,218,7,12.944,opus_gemm_flatmm_splitk_256x96x32x64_2x1_16x16x32_0x0x0_wgpcu2,0.0,99.8,775.91
gfx950,256,192,512,7168,False,torch.bfloat16,torch.bfloat16,False,False,opus,1218,7,12.7599,opus_gemm_flatmm_splitk_256x96x32x64_2x1_16x16x32_0x0x0_wgpcu2_nooob,0.0,110.45,806.37
gfx950,256,208,512,7168,False,torch.bfloat16,torch.bfloat16,False,False,opus,200,7,13.2541,opus_gemm_flatmm_splitk_256x64x64x64_2x1_16x16x32_0x0x0_wgpcu2,0.0,115.19,794.84
gfx950,256,224,512,7168,False,torch.bfloat16,torch.bfloat16,False,False,opus,212,6,13.6293,opus_gemm_flatmm_splitk_256x32x96x64_2x1_16x16x32_0x0x0_wgpcu2,0.0,120.63,790.99
gfx950,256,240,512,7168,False,torch.bfloat16,torch.bfloat16,False,False,opus,200,7,13.6221,opus_gemm_flatmm_splitk_256x64x64x64_2x1_16x16x32_0x0x0_wgpcu2,0.0,129.32,809.45
gfx950,256,256,512,7168,False,torch.bfloat16,torch.bfloat16,False,False,opus,1200,7,13.3999,opus_gemm_flatmm_splitk_256x64x64x64_2x1_16x16x32_0x0x0_wgpcu2_nooob,0.0,140.23,841.21
gfx950,256,288,512,7168,False,torch.bfloat16,torch.bfloat16,False,False,opus,200,6,14.2169,opus_gemm_flatmm_splitk_256x64x64x64_2x1_16x16x32_0x0x0_wgpcu2,0.0,148.69,827.45
gfx950,256,320,512,7168,False,torch.bfloat16,torch.bfloat16,False,False,opus,1200,6,14.0827,opus_gemm_flatmm_splitk_256x64x64x64_2x1_16x16x32_0x0x0_wgpcu2_nooob,0.0,166.79,870.23
gfx950,256,352,512,7168,False,torch.bfloat16,torch.bfloat16,False,False,asm,7,6,15.1451,_ZN5aiter39bf16gemm_fp32bf16_tn_80x64_splitk_cleanE,0.0183,170.6,841.64
gfx950,256,384,512,7168,False,torch.bfloat16,torch.bfloat16,False,False,asm,7,6,15.1596,_ZN5aiter39bf16gemm_fp32bf16_tn_80x64_splitk_cleanE,0.0184,185.93,873.26
gfx950,256,416,512,7168,False,torch.bfloat16,torch.bfloat16,False,False,asm,8,6,15.4695,_ZN5aiter39bf16gemm_fp32bf16_tn_96x64_splitk_cleanE,0.0181,197.39,887.54
gfx950,256,448,512,7168,False,torch.bfloat16,torch.bfloat16,False,False,asm,8,6,15.9937,_ZN5aiter39bf16gemm_fp32bf16_tn_96x64_splitk_cleanE,0.0183,205.6,889.18
gfx950,256,480,512,7168,False,torch.bfloat16,torch.bfloat16,False,False,asm,8,6,16.1355,_ZN5aiter39bf16gemm_fp32bf16_tn_96x64_splitk_cleanE,0.0182,218.35,911.83
gfx950,256,512,512,7168,False,torch.bfloat16,torch.bfloat16,False,False,asm,8,5,16.7068,_ZN5aiter39bf16gemm_fp32bf16_tn_96x64_splitk_cleanE,0.016,224.94,910.07
gfx950,256,544,512,7168,False,torch.bfloat16,torch.bfloat16,False,False,asm,8,5,16.8996,_ZN5aiter39bf16gemm_fp32bf16_tn_96x64_splitk_cleanE,0.016,236.28,928.77
gfx950,256,576,512,7168,False,torch.bfloat16,torch.bfloat16,False,False,asm,8,5,17.2579,_ZN5aiter39bf16gemm_fp32bf16_tn_96x64_splitk_cleanE,0.0162,244.98,937.97
gfx950,256,608,512,7168,False,torch.bfloat16,torch.bfloat16,False,False,asm,7,4,17.7596,_ZN5aiter39bf16gemm_fp32bf16_tn_80x64_splitk_cleanE,0.0135,251.29,939.15
gfx950,256,640,512,7168,False,torch.bfloat16,torch.bfloat16,False,False,asm,8,4,18.1416,_ZN5aiter39bf16gemm_fp32bf16_tn_96x64_splitk_cleanE,0.0134,258.94,946.47
gfx950,256,672,512,7168,False,torch.bfloat16,torch.bfloat16,False,False,opus,1220,4,18.2271,opus_gemm_flatmm_splitk_256x96x64x64_2x1_16x16x32_0x0x0_wgpcu1_nooob,0.0,270.61,968.99
gfx950,256,704,512,7168,False,torch.bfloat16,torch.bfloat16,False,False,asm,8,4,18.9482,_ZN5aiter39bf16gemm_fp32bf16_tn_96x64_splitk_cleanE,0.0136,272.71,958.06
gfx950,256,736,512,7168,False,torch.bfloat16,torch.bfloat16,False,False,asm,8,4,19.3752,_ZN5aiter39bf16gemm_fp32bf16_tn_96x64_splitk_cleanE,0.0137,278.82,962.31
gfx950,256,768,512,7168,False,torch.bfloat16,torch.bfloat16,False,False,asm,8,4,19.7858,_ZN5aiter39bf16gemm_fp32bf16_tn_96x64_splitk_cleanE,0.0134,284.91,967.18
gfx950,256,800,512,7168,False,torch.bfloat16,torch.bfloat16,False,False,asm,7,3,20.4947,_ZN5aiter39bf16gemm_fp32bf16_tn_80x64_splitk_cleanE,0.0104,286.51,957.71
gfx950,256,832,512,7168,False,torch.bfloat16,torch.bfloat16,False,False,asm,8,3,21.7508,_ZN5aiter39bf16gemm_fp32bf16_tn_96x64_splitk_cleanE,0.0104,280.77,925.0
gfx950,256,864,512,7168,False,torch.bfloat16,torch.bfloat16,False,False,opus,1221,4,22.0594,opus_gemm_flatmm_splitk_256x96x64x64_2x1_16x16x32_0x0x0_wgpcu2_nooob,0.0,287.49,934.34
gfx950,256,896,512,7168,False,torch.bfloat16,torch.bfloat16,False,False,torch,0,0,21.6908,native,0.0,303.2,972.88
gfx950,256,928,512,7168,False,torch.bfloat16,torch.bfloat16,False,False,torch,0,0,21.6173,native,0.0,315.1,998.93
gfx950,256,960,512,7168,False,torch.bfloat16,torch.bfloat16,False,False,torch,0,0,21.5731,native,0.0,326.63,1023.76
gfx950,256,992,512,7168,False,torch.bfloat16,torch.bfloat16,False,False,opus,200,4,24.2715,opus_gemm_flatmm_splitk_256x64x64x64_2x1_16x16x32_0x0x0_wgpcu2,0.0,299.99,930.19
gfx950,256,1024,512,7168,False,torch.bfloat16,torch.bfloat16,False,False,opus,1200,2,24.4494,opus_gemm_flatmm_splitk_256x64x64x64_2x1_16x16x32_0x0x0_wgpcu2_nooob,0.0,307.42,943.53
gfx950,256,1088,512,7168,False,torch.bfloat16,torch.bfloat16,False,False,opus,1200,2,25.3728,opus_gemm_flatmm_splitk_256x64x64x64_2x1_16x16x32_0x0x0_wgpcu2_nooob,0.0,314.74,947.93
gfx950,256,1152,512,7168,False,torch.bfloat16,torch.bfloat16,False,False,torch,0,0,26.4923,native,0.0,319.18,944.98
gfx950,256,1216,512,7168,False,torch.bfloat16,torch.bfloat16,False,False,torch,0,0,26.1445,native,0.0,341.39,995.15
gfx950,256,1280,512,7168,False,torch.bfloat16,torch.bfloat16,False,False,torch,0,0,26.4113,native,0.0,355.73,1022.32
gfx950,256,1344,512,7168,False,torch.bfloat16,torch.bfloat16,False,False,opus,1221,4,27.2167,opus_gemm_flatmm_splitk_256x96x64x64_2x1_16x16x32_0x0x0_wgpcu2_nooob,0.0,362.46,1028.19
gfx950,256,1408,512,7168,False,torch.bfloat16,torch.bfloat16,False,False,torch,0,0,27.769,native,0.0,372.17,1043.14
gfx950,256,1472,512,7168,False,torch.bfloat16,torch.bfloat16,False,False,torch,0,0,27.9079,native,0.0,387.15,1073.17
gfx950,256,1536,512,7168,False,torch.bfloat16,torch.bfloat16,False,False,torch,0,0,28.3241,native,0.0,398.05,1092.11
gfx950,256,1600,512,7168,False,torch.bfloat16,torch.bfloat16,False,False,opus,1200,2,37.4108,opus_gemm_flatmm_splitk_256x64x64x64_2x1_16x16x32_0x0x0_wgpcu2_nooob,0.0,313.92,853.12
gfx950,256,1664,512,7168,False,torch.bfloat16,torch.bfloat16,False,False,torch,0,0,30.1712,native,0.0,404.82,1090.41
gfx950,256,1728,512,7168,False,torch.bfloat16,torch.bfloat16,False,False,torch,0,0,30.6007,native,0.0,414.49,1107.23
gfx950,256,1792,512,7168,False,torch.bfloat16,torch.bfloat16,False,False,torch,0,0,30.5265,native,0.0,430.88,1142.13
gfx950,256,1856,512,7168,False,torch.bfloat16,torch.bfloat16,False,False,torch,0,0,31.5114,native,0.0,432.32,1137.63
gfx950,256,1920,512,7168,False,torch.bfloat16,torch.bfloat16,False,False,torch,0,0,32.4126,native,0.0,434.8,1136.32
gfx950,256,1984,512,7168,False,torch.bfloat16,torch.bfloat16,False,False,torch,0,0,32.524,native,0.0,447.75,1162.66
gfx950,256,2048,512,7168,False,torch.bfloat16,torch.bfloat16,False,False,torch,0,0,29.9782,native,0.0,501.44,1294.18
gfx950,256,4096,512,7168,False,torch.bfloat16,torch.bfloat16,False,False,torch,0,0,52.2449,native,0.0,575.46,1344.72
gfx950,256,6144,512,7168,False,torch.bfloat16,torch.bfloat16,False,False,torch,0,0,70.0322,native,0.0,643.95,1452.36
gfx950,256,8192,512,7168,False,torch.bfloat16,torch.bfloat16,False,False,torch,0,0,85.0491,native,0.0,707.0,1565.79
gfx950,256,10240,512,7168,False,torch.bfloat16,torch.bfloat16,False,False,torch,0,0,94.1512,native,0.0,798.31,1748.53
gfx950,256,12288,512,7168,False,torch.bfloat16,torch.bfloat16,False,False,torch,0,0,108.6717,native,0.0,829.97,1804.37
gfx950,256,14336,512,7168,False,torch.bfloat16,torch.bfloat16,False,False,triton,0,0,114.9339,auto,0.0,915.54,1979.76
gfx950,256,16384,512,7168,False,torch.bfloat16,torch.bfloat16,False,False,opus,1401,0,110.8565,opus_gemm_mono_tile_512x128x256x64_2x4_16x16x32_0x0x0_nooob,0.0,1084.82,2336.34
gfx950,256,32768,512,7168,False,torch.bfloat16,torch.bfloat16,False,False,torch,0,0,170.5685,native,0.0,1410.1,2993.85
gfx950,256,1,1024,7168,False,torch.bfloat16,torch.bfloat16,False,False,flydsl,68,7,8.5133,flydsl_gemm2_abf16_wbf16_bf16_t16x64x256_split_k7_block_m_warp1_block_n_warp2_async_copyTrue_b_to_ldsFalse_b_preshuffleFalse_c_to_ldsFalse_gfx950,0.0205,1.72,1726.29
gfx950,256,2,1024,7168,False,torch.bfloat16,torch.bfloat16,False,False,flydsl,68,7,8.8029,flydsl_gemm2_abf16_wbf16_bf16_t16x64x256_split_k7_block_m_warp1_block_n_warp2_async_copyTrue_b_to_ldsFalse_b_preshuffleFalse_c_to_ldsFalse_gfx950,0.0171,3.34,1671.36
gfx950,256,4,1024,7168,False,torch.bfloat16,torch.bfloat16,False,False,flydsl,68,7,9.1391,flydsl_gemm2_abf16_wbf16_bf16_t16x64x256_split_k7_block_m_warp1_block_n_warp2_async_copyTrue_b_to_ldsFalse_b_preshuffleFalse_c_to_ldsFalse_gfx950,0.0193,6.43,1613.46
gfx950,256,8,1024,7168,False,torch.bfloat16,torch.bfloat16,False,False,flydsl,68,7,8.8698,flydsl_gemm2_abf16_wbf16_bf16_t16x64x256_split_k7_block_m_warp1_block_n_warp2_async_copyTrue_b_to_ldsFalse_b_preshuffleFalse_c_to_ldsFalse_gfx950,0.0182,13.24,1669.84
gfx950,256,16,1024,7168,False,torch.bfloat16,torch.bfloat16,False,False,flydsl,68,7,9.1879,flydsl_gemm2_abf16_wbf16_bf16_t16x64x256_split_k7_block_m_warp1_block_n_warp2_async_copyTrue_b_to_ldsFalse_b_preshuffleFalse_c_to_ldsFalse_gfx950,0.02,25.56,1626.29
gfx950,256,24,1024,7168,False,torch.bfloat16,torch.bfloat16,False,False,flydsl,68,7,9.3599,flydsl_gemm2_abf16_wbf16_bf16_t16x64x256_split_k7_block_m_warp1_block_n_warp2_async_copyTrue_b_to_ldsFalse_b_preshuffleFalse_c_to_ldsFalse_gfx950,0.0192,37.64,1610.41
gfx950,256,32,1024,7168,False,torch.bfloat16,torch.bfloat16,False,False,flydsl,68,7,9.3025,flydsl_gemm2_abf16_wbf16_bf16_t16x64x256_split_k7_block_m_warp1_block_n_warp2_async_copyTrue_b_to_ldsFalse_b_preshuffleFalse_c_to_ldsFalse_gfx950,0.0196,50.5,1634.44
gfx950,256,40,1024,7168,False,torch.bfloat16,torch.bfloat16,False,False,flydsl,247,7,9.7064,flydsl_gemm2_abf16_wbf16_bf16_t32x64x256_split_k7_block_m_warp1_block_n_warp4_async_copyTrue_b_to_ldsFalse_b_preshuffleFalse_c_to_ldsFalse_gfx950,0.0196,60.5,1579.93
gfx950,256,48,1024,7168,False,torch.bfloat16,torch.bfloat16,False,False,flydsl,248,7,9.8509,flydsl_gemm2_abf16_wbf16_bf16_t32x64x256_split_k7_block_m_warp1_block_n_warp4_async_copyTrue_b_to_ldsTrue_b_preshuffleFalse_c_to_ldsFalse_gfx950,0.0196,71.53,1570.06
gfx950,256,56,1024,7168,False,torch.bfloat16,torch.bfloat16,False,False,flydsl,247,7,10.6456,flydsl_gemm2_abf16_wbf16_bf16_t32x64x256_split_k7_block_m_warp1_block_n_warp4_async_copyTrue_b_to_ldsFalse_b_preshuffleFalse_c_to_ldsFalse_gfx950,0.0192,77.22,1465.17
gfx950,256,64,1024,7168,False,torch.bfloat16,torch.bfloat16,False,False,flydsl,426,7,10.565,flydsl_gemm2_abf16_wbf16_bf16_t32x64x256_split_k7_block_m_warp2_block_n_warp2_async_copyTrue_b_to_ldsTrue_b_preshuffleFalse_c_to_ldsFalse_gfx950,0.0198,88.93,1488.75
gfx950,256,72,1024,7168,False,torch.bfloat16,torch.bfloat16,False,False,opus,200,8,12.5422,opus_gemm_flatmm_splitk_256x64x64x64_2x1_16x16x32_0x0x0_wgpcu2,0.0,84.27,1264.51
gfx950,256,80,1024,7168,False,torch.bfloat16,torch.bfloat16,False,False,opus,218,8,12.56,opus_gemm_flatmm_splitk_256x96x32x64_2x1_16x16x32_0x0x0_wgpcu2,0.0,93.5,1273.15
gfx950,256,88,1024,7168,False,torch.bfloat16,torch.bfloat16,False,False,opus,218,8,12.8186,opus_gemm_flatmm_splitk_256x96x32x64_2x1_16x16x32_0x0x0_wgpcu2,0.0,100.78,1257.69
gfx950,256,96,1024,7168,False,torch.bfloat16,torch.bfloat16,False,False,opus,1218,8,12.8114,opus_gemm_flatmm_splitk_256x96x32x64_2x1_16x16x32_0x0x0_wgpcu2_nooob,0.0,110.0,1268.63
gfx950,256,104,1024,7168,False,torch.bfloat16,torch.bfloat16,False,False,opus,200,8,12.8654,opus_gemm_flatmm_splitk_256x64x64x64_2x1_16x16x32_0x0x0_wgpcu2,0.0,118.67,1273.49
gfx950,256,112,1024,7168,False,torch.bfloat16,torch.bfloat16,False,False,opus,200,8,13.18,opus_gemm_flatmm_splitk_256x64x64x64_2x1_16x16x32_0x0x0_wgpcu2,0.0,124.75,1253.04
gfx950,256,120,1024,7168,False,torch.bfloat16,torch.bfloat16,False,False,opus,200,8,13.2986,opus_gemm_flatmm_splitk_256x64x64x64_2x1_16x16x32_0x0x0_wgpcu2,0.0,132.47,1251.72
gfx950,256,128,1024,7168,False,torch.bfloat16,torch.bfloat16,False,False,opus,1200,7,13.1436,opus_gemm_flatmm_splitk_256x64x64x64_2x1_16x16x32_0x0x0_wgpcu2_nooob,0.0,142.96,1276.46
gfx950,256,136,1024,7168,False,torch.bfloat16,torch.bfloat16,False,False,asm,3,5,14.6343,_ZN5aiter39bf16gemm_fp32bf16_tn_48x64_splitk_cleanE,0.0163,136.43,1155.39
gfx950,256,144,1024,7168,False,torch.bfloat16,torch.bfloat16,False,False,asm,3,5,14.7386,_ZN5aiter39bf16gemm_fp32bf16_tn_48x64_splitk_cleanE,0.0164,143.43,1156.1
gfx950,256,152,1024,7168,False,torch.bfloat16,torch.bfloat16,False,False,asm,7,7,14.7955,_ZN5aiter39bf16gemm_fp32bf16_tn_80x64_splitk_cleanE,0.0201,150.81,1160.52
gfx950,256,160,1024,7168,False,torch.bfloat16,torch.bfloat16,False,False,asm,7,7,15.147,_ZN5aiter39bf16gemm_fp32bf16_tn_80x64_splitk_cleanE,0.0199,155.07,1142.24
gfx950,256,168,1024,7168,False,torch.bfloat16,torch.bfloat16,False,False,asm,5,5,15.1167,_ZN5aiter39bf16gemm_fp32bf16_tn_64x64_splitk_cleanE,0.0162,163.15,1153.2
gfx950,256,176,1024,7168,False,torch.bfloat16,torch.bfloat16,False,False,asm,5,5,15.1096,_ZN5aiter39bf16gemm_fp32bf16_tn_64x64_splitk_cleanE,0.0164,171.0,1162.42
gfx950,256,184,1024,7168,False,torch.bfloat16,torch.bfloat16,False,False,asm,8,8,15.3488,_ZN5aiter39bf16gemm_fp32bf16_tn_96x64_splitk_cleanE,0.0219,175.98,1152.84
gfx950,256,192,1024,7168,False,torch.bfloat16,torch.bfloat16,False,False,asm,5,5,15.2528,_ZN5aiter39bf16gemm_fp32bf16_tn_64x64_splitk_cleanE,0.0162,184.79,1168.69
gfx950,256,200,1024,7168,False,torch.bfloat16,torch.bfloat16,False,False,asm,7,5,15.784,_ZN5aiter39bf16gemm_fp32bf16_tn_80x64_splitk_cleanE,0.0163,186.01,1137.66
gfx950,256,208,1024,7168,False,torch.bfloat16,torch.bfloat16,False,False,asm,7,5,15.6534,_ZN5aiter39bf16gemm_fp32bf16_tn_80x64_splitk_cleanE,0.0161,195.07,1155.53
gfx950,256,216,1024,7168,False,torch.bfloat16,torch.bfloat16,False,False,asm,7,5,15.8885,_ZN5aiter39bf16gemm_fp32bf16_tn_80x64_splitk_cleanE,0.0163,199.57,1146.68
gfx950,256,224,1024,7168,False,torch.bfloat16,torch.bfloat16,False,False,asm,7,5,16.0577,_ZN5aiter39bf16gemm_fp32bf16_tn_80x64_splitk_cleanE,0.0161,204.78,1142.76
gfx950,256,232,1024,7168,False,torch.bfloat16,torch.bfloat16,False,False,asm,7,5,16.0787,_ZN5aiter39bf16gemm_fp32bf16_tn_80x64_splitk_cleanE,0.0163,211.82,1149.42
gfx950,256,240,1024,7168,False,torch.bfloat16,torch.bfloat16,False,False,asm,8,5,16.031,_ZN5aiter39bf16gemm_fp32bf16_tn_96x64_splitk_cleanE,0.0163,219.78,1161.01
gfx950,256,248,1024,7168,False,torch.bfloat16,torch.bfloat16,False,False,asm,8,5,16.381,_ZN5aiter39bf16gemm_fp32bf16_tn_96x64_splitk_cleanE,0.0162,222.25,1144.21
gfx950,256,256,1024,7168,False,torch.bfloat16,torch.bfloat16,False,False,asm,8,5,16.3251,_ZN5aiter39bf16gemm_fp32bf16_tn_96x64_splitk_cleanE,0.0164,230.2,1156.16
gfx950,256,264,1024,7168,False,torch.bfloat16,torch.bfloat16,False,False,asm,8,5,16.6057,_ZN5aiter39bf16gemm_fp32bf16_tn_96x64_splitk_cleanE,0.0163,233.39,1144.51
gfx950,256,272,1024,7168,False,torch.bfloat16,torch.bfloat16,False,False,asm,8,5,16.4912,_ZN5aiter39bf16gemm_fp32bf16_tn_96x64_splitk_cleanE,0.0164,242.13,1160.41
gfx950,256,280,1024,7168,False,torch.bfloat16,torch.bfloat16,False,False,asm,8,5,16.7351,_ZN5aiter39bf16gemm_fp32bf16_tn_96x64_splitk_cleanE,0.0165,245.62,1151.33
gfx950,256,288,1024,7168,False,torch.bfloat16,torch.bfloat16,False,False,asm,8,5,16.8014,_ZN5aiter39bf16gemm_fp32bf16_tn_96x64_splitk_cleanE,0.0163,251.64,1154.59
gfx950,256,296,1024,7168,False,torch.bfloat16,torch.bfloat16,False,False,asm,7,4,17.612,_ZN5aiter39bf16gemm_fp32bf16_tn_80x64_splitk_cleanE,0.0139,246.72,1108.89
gfx950,256,304,1024,7168,False,torch.bfloat16,torch.bfloat16,False,False,asm,7,4,17.78,_ZN5aiter39bf16gemm_fp32bf16_tn_80x64_splitk_cleanE,0.0138,251.0,1105.78
gfx950,256,312,1024,7168,False,torch.bfloat16,torch.bfloat16,False,False,asm,7,4,17.832,_ZN5aiter39bf16gemm_fp32bf16_tn_80x64_splitk_cleanE,0.0139,256.85,1109.91
gfx950,256,320,1024,7168,False,torch.bfloat16,torch.bfloat16,False,False,asm,7,4,17.9117,_ZN5aiter39bf16gemm_fp32bf16_tn_80x64_splitk_cleanE,0.0139,262.27,1112.29
gfx950,256,328,1024,7168,False,torch.bfloat16,torch.bfloat16,False,False,asm,8,4,18.181,_ZN5aiter39bf16gemm_fp32bf16_tn_96x64_splitk_cleanE,0.0138,264.84,1103.02
gfx950,256,336,1024,7168,False,torch.bfloat16,torch.bfloat16,False,False,asm,8,4,18.3968,_ZN5aiter39bf16gemm_fp32bf16_tn_96x64_splitk_cleanE,0.0138,268.12,1097.21
gfx950,256,344,1024,7168,False,torch.bfloat16,torch.bfloat16,False,False,asm,8,4,18.2675,_ZN5aiter39bf16gemm_fp32bf16_tn_96x64_splitk_cleanE,0.0138,276.44,1112.15
gfx950,256,352,1024,7168,False,torch.bfloat16,torch.bfloat16,False,False,asm,8,4,18.4308,_ZN5aiter39bf16gemm_fp32bf16_tn_96x64_splitk_cleanE,0.0138,280.37,1109.41
gfx950,256,376,1024,7168,False,torch.bfloat16,torch.bfloat16,False,False,asm,8,4,18.9513,_ZN5aiter39bf16gemm_fp32bf16_tn_96x64_splitk_cleanE,0.0138,291.26,1099.68
gfx950,256,384,1024,7168,False,torch.bfloat16,torch.bfloat16,False,False,asm,8,4,18.9619,_ZN5aiter39bf16gemm_fp32bf16_tn_96x64_splitk_cleanE,0.0138,297.29,1105.98
gfx950,256,416,1024,7168,False,torch.bfloat16,torch.bfloat16,False,False,asm,8,3,20.7081,_ZN5aiter39bf16gemm_fp32bf16_tn_96x64_splitk_cleanE,0.0106,294.9,1038.04
gfx950,256,448,1024,7168,False,torch.bfloat16,torch.bfloat16,False,False,torch,0,0,21.5668,native,0.0,304.94,1021.02
gfx950,256,480,1024,7168,False,torch.bfloat16,torch.bfloat16,False,False,opus,200,4,23.1867,opus_gemm_flatmm_splitk_256x64x64x64_2x1_16x16x32_0x0x0_wgpcu2,0.0,303.9,972.3
gfx950,256,512,1024,7168,False,torch.bfloat16,torch.bfloat16,False,False,torch,0,0,19.4215,native,0.0,387.0,1187.79
gfx950,256,544,1024,7168,False,torch.bfloat16,torch.bfloat16,False,False,asm,7,2,27.1352,_ZN5aiter39bf16gemm_fp32bf16_tn_80x64_splitk_cleanE,0.0061,294.3,869.46
gfx950,256,576,1024,7168,False,torch.bfloat16,torch.bfloat16,False,False,torch,0,0,21.0495,native,0.0,401.71,1145.74
gfx950,256,608,1024,7168,False,torch.bfloat16,torch.bfloat16,False,False,torch,0,0,26.5456,native,0.0,336.23,928.27
gfx950,256,640,1024,7168,False,torch.bfloat16,torch.bfloat16,False,False,torch,0,0,26.8312,native,0.0,350.16,937.93
gfx950,256,672,1024,7168,False,torch.bfloat16,torch.bfloat16,False,False,opus,1221,4,27.658,opus_gemm_flatmm_splitk_256x96x64x64_2x1_16x16x32_0x0x0_wgpcu2_nooob,0.0,356.68,928.85
gfx950,256,704,1024,7168,False,torch.bfloat16,torch.bfloat16,False,False,torch,0,0,28.1021,native,0.0,367.76,932.83
gfx950,256,736,1024,7168,False,torch.bfloat16,torch.bfloat16,False,False,torch,0,0,28.0228,native,0.0,385.56,954.18
gfx950,256,768,1024,7168,False,torch.bfloat16,torch.bfloat16,False,False,torch,0,0,28.1604,native,0.0,400.36,968.13
gfx950,256,800,1024,7168,False,torch.bfloat16,torch.bfloat16,False,False,opus,200,2,37.7212,opus_gemm_flatmm_splitk_256x64x64x64_2x1_16x16x32_0x0x0_wgpcu2,0.0,311.34,736.65
gfx950,256,832,1024,7168,False,torch.bfloat16,torch.bfloat16,False,False,torch,0,0,30.3309,native,0.0,402.69,933.42
gfx950,256,864,1024,7168,False,torch.bfloat16,torch.bfloat16,False,False,torch,0,0,31.3638,native,0.0,404.4,919.4
gfx950,256,896,1024,7168,False,torch.bfloat16,torch.bfloat16,False,False,torch,0,0,30.7206,native,0.0,428.16,955.71
gfx950,256,928,1024,7168,False,torch.bfloat16,torch.bfloat16,False,False,torch,0,0,32.4558,native,0.0,419.74,920.77
gfx950,256,960,1024,7168,False,torch.bfloat16,torch.bfloat16,False,False,torch,0,0,32.655,native,0.0,431.57,931.21
gfx950,256,992,1024,7168,False,torch.bfloat16,torch.bfloat16,False,False,torch,0,0,33.2178,native,0.0,438.4,931.22
gfx950,256,1024,1024,7168,False,torch.bfloat16,torch.bfloat16,False,False,torch,0,0,28.046,native,0.0,535.99,1121.63
gfx950,256,1088,1024,7168,False,torch.bfloat16,torch.bfloat16,False,False,torch,0,0,35.1726,native,0.0,454.1,924.18
gfx950,256,1152,1024,7168,False,torch.bfloat16,torch.bfloat16,False,False,torch,0,0,35.1733,native,0.0,480.8,953.97
gfx950,256,1216,1024,7168,False,torch.bfloat16,torch.bfloat16,False,False,torch,0,0,36.6771,native,0.0,486.71,943.45
gfx950,256,1280,1024,7168,False,torch.bfloat16,torch.bfloat16,False,False,torch,0,0,35.8826,native,0.0,523.67,993.56
gfx950,256,1344,1024,7168,False,torch.bfloat16,torch.bfloat16,False,False,torch,0,0,39.6347,native,0.0,497.8,925.96
gfx950,256,1408,1024,7168,False,torch.bfloat16,torch.bfloat16,False,False,torch,0,0,39.9991,native,0.0,516.75,943.74
gfx950,256,1472,1024,7168,False,torch.bfloat16,torch.bfloat16,False,False,torch,0,0,39.9759,native,0.0,540.55,970.52
gfx950,256,1536,1024,7168,False,torch.bfloat16,torch.bfloat16,False,False,torch,0,0,36.9213,native,0.0,610.72,1079.21
gfx950,256,1600,1024,7168,False,torch.bfloat16,torch.bfloat16,False,False,torch,0,0,42.7448,native,0.0,549.5,956.71
gfx950,256,1664,1024,7168,False,torch.bfloat16,torch.bfloat16,False,False,torch,0,0,46.0156,native,0.0,530.86,911.5
gfx950,256,1728,1024,7168,False,torch.bfloat16,torch.bfloat16,False,False,torch,0,0,44.4392,native,0.0,570.83,967.43
gfx950,256,1792,1024,7168,False,torch.bfloat16,torch.bfloat16,False,False,torch,0,0,45.174,native,0.0,582.34,974.9
gfx950,256,1856,1024,7168,False,torch.bfloat16,torch.bfloat16,False,False,torch,0,0,49.3334,native,0.0,552.29,913.96
gfx950,256,1920,1024,7168,False,torch.bfloat16,torch.bfloat16,False,False,torch,0,0,47.0684,native,0.0,598.82,980.22
gfx950,256,1984,1024,7168,False,torch.bfloat16,torch.bfloat16,False,False,torch,0,0,50.4496,native,0.0,577.31,935.31
gfx950,256,2048,1024,7168,False,torch.bfloat16,torch.bfloat16,False,False,torch,0,0,43.537,native,0.0,690.56,1107.9
gfx950,256,4096,1024,7168,False,torch.bfloat16,torch.bfloat16,False,False,torch,0,0,68.9699,native,0.0,871.82,1185.86
gfx950,256,6144,1024,7168,False,torch.bfloat16,torch.bfloat16,False,False,torch,0,0,104.4099,native,0.0,863.85,1104.72
gfx950,256,8192,1024,7168,False,torch.bfloat16,torch.bfloat16,False,False,opus,1401,0,107.1617,opus_gemm_mono_tile_512x128x256x64_2x4_16x16x32_0x0x0_nooob,0.0,1122.22,1389.47
gfx950,256,10240,1024,7168,False,torch.bfloat16,torch.bfloat16,False,False,torch,0,0,126.5171,native,0.0,1188.17,1442.12
gfx950,256,12288,1024,7168,False,torch.bfloat16,torch.bfloat16,False,False,opus,1400,0,133.6707,opus_gemm_mono_tile_512x192x256x64_2x4_16x16x32_0x0x0_nooob,0.0,1349.5,1615.96
gfx950,256,14336,1024,7168,False,torch.bfloat16,torch.bfloat16,False,False,torch,0,0,160.3423,native,0.0,1312.53,1556.43
gfx950,256,16384,1024,7168,False,torch.bfloat16,torch.bfloat16,False,False,torch,0,0,167.2162,native,0.0,1438.37,1693.11
gfx950,256,32768,1024,7168,False,torch.bfloat16,torch.bfloat16,False,False,torch,0,0,316.221,native,0.0,1521.2,1744.19
gfx950,256,1,2048,7168,False,torch.bfloat16,torch.bfloat16,False,False,flydsl,68,7,9.26,flydsl_gemm2_abf16_wbf16_bf16_t16x64x256_split_k7_block_m_warp1_block_n_warp2_async_copyTrue_b_to_ldsFalse_b_preshuffleFalse_c_to_ldsFalse_gfx950,0.02,3.17,3172.63
gfx950,256,2,2048,7168,False,torch.bfloat16,torch.bfloat16,False,False,flydsl,68,7,9.056,flydsl_gemm2_abf16_wbf16_bf16_t16x64x256_split_k7_block_m_warp1_block_n_warp2_async_copyTrue_b_to_ldsFalse_b_preshuffleFalse_c_to_ldsFalse_gfx950,0.0161,6.48,3246.13
gfx950,256,4,2048,7168,False,torch.bfloat16,torch.bfloat16,False,False,flydsl,68,7,9.2512,flydsl_gemm2_abf16_wbf16_bf16_t16x64x256_split_k7_block_m_warp1_block_n_warp2_async_copyTrue_b_to_ldsFalse_b_preshuffleFalse_c_to_ldsFalse_gfx950,0.0186,12.69,3181.63
gfx950,256,8,2048,7168,False,torch.bfloat16,torch.bfloat16,False,False,flydsl,68,7,9.5514,flydsl_gemm2_abf16_wbf16_bf16_t16x64x256_split_k7_block_m_warp1_block_n_warp2_async_copyTrue_b_to_ldsFalse_b_preshuffleFalse_c_to_ldsFalse_gfx950,0.0182,24.59,3089.35
gfx950,256,16,2048,7168,False,torch.bfloat16,torch.bfloat16,False,False,flydsl,68,7,9.6484,flydsl_gemm2_abf16_wbf16_bf16_t16x64x256_split_k7_block_m_warp1_block_n_warp2_async_copyTrue_b_to_ldsFalse_b_preshuffleFalse_c_to_ldsFalse_gfx950,0.0206,48.69,3073.57
gfx950,256,32,2048,7168,False,torch.bfloat16,torch.bfloat16,False,False,opus,203,8,12.3849,opus_gemm_flatmm_splitk_256x32x64x64_2x1_16x16x32_0x0x0_wgpcu2,0.0,75.86,2418.26
gfx950,256,48,2048,7168,False,torch.bfloat16,torch.bfloat16,False,False,opus,200,8,13.4901,opus_gemm_flatmm_splitk_256x64x64x64_2x1_16x16x32_0x0x0_wgpcu2,0.0,104.47,2242.0
gfx950,256,64,2048,7168,False,torch.bfloat16,torch.bfloat16,False,False,opus,1200,8,13.6786,opus_gemm_flatmm_splitk_256x64x64x64_2x1_16x16x32_0x0x0_wgpcu2_nooob,0.0,137.37,2232.67
gfx950,256,80,2048,7168,False,torch.bfloat16,torch.bfloat16,False,False,asm,7,6,15.5517,_ZN5aiter39bf16gemm_fp32bf16_tn_80x64_splitk_cleanE,0.0181,151.03,1982.72
gfx950,256,96,2048,7168,False,torch.bfloat16,torch.bfloat16,False,False,opus,1222,10,15.8597,opus_gemm_flatmm_splitk_256x96x64x128_2x1_16x16x32_0x0x0_wgpcu1_nooob,0.0,177.72,1962.81
gfx950,256,112,2048,7168,False,torch.bfloat16,torch.bfloat16,False,False,opus,200,4,16.9108,opus_gemm_flatmm_splitk_256x64x64x64_2x1_16x16x32_0x0x0_wgpcu2,0.0,194.45,1858.25
gfx950,256,128,2048,7168,False,torch.bfloat16,torch.bfloat16,False,False,asm,5,4,17.1818,_ZN5aiter39bf16gemm_fp32bf16_tn_64x64_splitk_cleanE,0.014,218.73,1846.11
gfx950,256,144,2048,7168,False,torch.bfloat16,torch.bfloat16,False,False,asm,7,4,17.9574,_ZN5aiter39bf16gemm_fp32bf16_tn_80x64_splitk_cleanE,0.0142,235.44,1782.79
gfx950,256,160,2048,7168,False,torch.bfloat16,torch.bfloat16,False,False,asm,7,4,18.0964,_ZN5aiter39bf16gemm_fp32bf16_tn_80x64_splitk_cleanE,0.0142,259.59,1785.4
gfx950,256,176,2048,7168,False,torch.bfloat16,torch.bfloat16,False,False,asm,8,4,18.9192,_ZN5aiter39bf16gemm_fp32bf16_tn_96x64_splitk_cleanE,0.0142,273.13,1723.34
gfx950,256,192,2048,7168,False,torch.bfloat16,torch.bfloat16,False,False,asm,8,4,19.126,_ZN5aiter39bf16gemm_fp32bf16_tn_96x64_splitk_cleanE,0.0142,294.74,1720.12
gfx950,256,208,2048,7168,False,torch.bfloat16,torch.bfloat16,False,False,torch,0,0,22.618,native,0.0,270.0,1467.59
gfx950,256,224,2048,7168,False,torch.bfloat16,torch.bfloat16,False,False,opus,200,4,22.6094,opus_gemm_flatmm_splitk_256x64x64x64_2x1_16x16x32_0x0x0_wgpcu2,0.0,290.88,1481.19
gfx950,256,240,2048,7168,False,torch.bfloat16,torch.bfloat16,False,False,torch,0,0,23.8152,native,0.0,295.88,1418.58
gfx950,256,256,2048,7168,False,torch.bfloat16,torch.bfloat16,False,False,torch,0,0,21.2193,native,0.0,354.21,1606.02
gfx950,256,288,2048,7168,False,torch.bfloat16,torch.bfloat16,False,False,asm,7,2,26.991,_ZN5aiter39bf16gemm_fp32bf16_tn_80x64_splitk_cleanE,0.0061,313.28,1284.45
gfx950,256,320,2048,7168,False,torch.bfloat16,torch.bfloat16,False,False,torch,0,0,26.1063,native,0.0,359.88,1350.57
gfx950,256,352,2048,7168,False,torch.bfloat16,torch.bfloat16,False,False,torch,0,0,27.9019,native,0.0,370.4,1284.79
gfx950,256,384,2048,7168,False,torch.bfloat16,torch.bfloat16,False,False,torch,0,0,28.3363,native,0.0,397.87,1285.91
gfx950,256,416,2048,7168,False,torch.bfloat16,torch.bfloat16,False,False,torch,0,0,29.8728,native,0.0,408.86,1239.52
gfx950,256,448,2048,7168,False,torch.bfloat16,torch.bfloat16,False,False,torch,0,0,30.7502,native,0.0,427.75,1223.33
gfx950,256,480,2048,7168,False,torch.bfloat16,torch.bfloat16,False,False,torch,0,0,32.5686,native,0.0,432.71,1173.14
gfx950,256,512,2048,7168,False,torch.bfloat16,torch.bfloat16,False,False,torch,0,0,29.0942,native,0.0,516.68,1333.51
gfx950,256,544,2048,7168,False,torch.bfloat16,torch.bfloat16,False,False,torch,0,0,35.7779,native,0.0,446.42,1100.88
gfx950,256,576,2048,7168,False,torch.bfloat16,torch.bfloat16,False,False,torch,0,0,30.7462,native,0.0,550.03,1300.22
gfx950,256,608,2048,7168,False,torch.bfloat16,torch.bfloat16,False,False,torch,0,0,36.2572,native,0.0,492.34,1118.86
gfx950,256,640,2048,7168,False,torch.bfloat16,torch.bfloat16,False,False,torch,0,0,36.609,native,0.0,513.27,1124.22
gfx950,256,672,2048,7168,False,torch.bfloat16,torch.bfloat16,False,False,torch,0,0,39.9539,native,0.0,493.82,1044.87
gfx950,256,704,2048,7168,False,torch.bfloat16,torch.bfloat16,False,False,torch,0,0,40.2423,native,0.0,513.63,1052.03
gfx950,256,736,2048,7168,False,torch.bfloat16,torch.bfloat16,False,False,torch,0,0,39.8147,native,0.0,542.74,1078.15
gfx950,256,768,2048,7168,False,torch.bfloat16,torch.bfloat16,False,False,torch,0,0,40.9716,native,0.0,550.35,1062.1
gfx950,256,800,2048,7168,False,torch.bfloat16,torch.bfloat16,False,False,torch,0,0,43.4003,native,0.0,541.2,1016.25
gfx950,256,832,2048,7168,False,torch.bfloat16,torch.bfloat16,False,False,torch,0,0,44.1603,native,0.0,553.16,1012.12
gfx950,256,864,2048,7168,False,torch.bfloat16,torch.bfloat16,False,False,torch,0,0,45.1264,native,0.0,562.14,1003.52
gfx950,256,896,2048,7168,False,torch.bfloat16,torch.bfloat16,False,False,torch,0,0,46.4496,native,0.0,566.35,987.63
gfx950,256,928,2048,7168,False,torch.bfloat16,torch.bfloat16,False,False,torch,0,0,46.566,native,0.0,585.11,997.83
gfx950,256,960,2048,7168,False,torch.bfloat16,torch.bfloat16,False,False,torch,0,0,47.9536,native,0.0,587.77,981.26
gfx950,256,992,2048,7168,False,torch.bfloat16,torch.bfloat16,False,False,torch,0,0,50.6896,native,0.0,574.58,939.93
gfx950,256,1024,2048,7168,False,torch.bfloat16,torch.bfloat16,False,False,torch,0,0,43.0191,native,0.0,698.87,1121.23
gfx950,256,1088,2048,7168,False,torch.bfloat16,torch.bfloat16,False,False,torch,0,0,51.9912,native,0.0,614.41,950.43
gfx950,256,1152,2048,7168,False,torch.bfloat16,torch.bfloat16,False,False,torch,0,0,53.2623,native,0.0,635.02,949.9
gfx950,256,1216,2048,7168,False,torch.bfloat16,torch.bfloat16,False,False,torch,0,0,55.9528,native,0.0,638.07,925.31
gfx950,256,1280,2048,7168,False,torch.bfloat16,torch.bfloat16,False,False,torch,0,0,53.3354,native,0.0,704.62,992.83
gfx950,256,1344,2048,7168,False,torch.bfloat16,torch.bfloat16,False,False,torch,0,0,58.0101,native,0.0,680.23,933.16
gfx950,256,1408,2048,7168,False,torch.bfloat16,torch.bfloat16,False,False,torch,0,0,58.2013,native,0.0,710.28,950.36
gfx950,256,1472,2048,7168,False,torch.bfloat16,torch.bfloat16,False,False,torch,0,0,72.0924,native,0.0,599.48,783.61
gfx950,256,1536,2048,7168,False,torch.bfloat16,torch.bfloat16,False,False,torch,0,0,56.751,native,0.0,794.65,1016.22
gfx950,256,1600,2048,7168,False,torch.bfloat16,torch.bfloat16,False,False,torch,0,0,74.4234,native,0.0,631.2,790.76
gfx950,256,1664,2048,7168,False,torch.bfloat16,torch.bfloat16,False,False,torch,0,0,77.207,native,0.0,632.78,777.53
gfx950,256,1728,2048,7168,False,torch.bfloat16,torch.bfloat16,False,False,torch,0,0,74.4932,native,0.0,681.06,821.69
gfx950,256,1792,2048,7168,False,torch.bfloat16,torch.bfloat16,False,False,torch,0,0,80.7984,native,0.0,651.17,772.17
gfx950,256,1856,2048,7168,False,torch.bfloat16,torch.bfloat16,False,False,torch,0,0,80.8092,native,0.0,674.33,786.67
gfx950,256,1920,2048,7168,False,torch.bfloat16,torch.bfloat16,False,False,torch,0,0,82.4793,native,0.0,683.46,785.04
gfx950,256,1984,2048,7168,False,torch.bfloat16,torch.bfloat16,False,False,torch,0,0,81.4648,native,0.0,715.04,809.3
gfx950,256,2048,2048,7168,False,torch.bfloat16,torch.bfloat16,False,False,torch,0,0,83.6545,native,0.0,718.78,802.21
gfx950,256,4096,2048,7168,False,torch.bfloat16,torch.bfloat16,False,False,opus,1401,0,107.2229,opus_gemm_mono_tile_512x128x256x64_2x4_16x16x32_0x0x0_nooob,0.0,1121.58,977.94
gfx950,256,6144,2048,7168,False,torch.bfloat16,torch.bfloat16,False,False,opus,1400,0,134.3312,opus_gemm_mono_tile_512x192x256x64_2x4_16x16x32_0x0x0_nooob,0.0,1342.86,1061.6
gfx950,256,8192,2048,7168,False,torch.bfloat16,torch.bfloat16,False,False,torch,0,0,170.6147,native,0.0,1409.72,1057.09
gfx950,256,10240,2048,7168,False,torch.bfloat16,torch.bfloat16,False,False,torch,0,0,238.0791,native,0.0,1262.81,916.1
gfx950,256,12288,2048,7168,False,torch.bfloat16,torch.bfloat16,False,False,opus,1400,0,260.1903,opus_gemm_mono_tile_512x192x256x64_2x4_16x16x32_0x0x0_nooob,0.0,1386.59,983.33
gfx950,256,14336,2048,7168,False,torch.bfloat16,torch.bfloat16,False,False,torch,0,0,309.6516,native,0.0,1359.29,948.17
gfx950,256,16384,2048,7168,False,torch.bfloat16,torch.bfloat16,False,False,torch,0,0,309.4906,native,0.0,1554.28,1070.63
gfx950,256,32768,2048,7168,False,torch.bfloat16,torch.bfloat16,False,False,torch,0,0,617.1103,native,0.0,1559.0,1026.3
