aiter/configs/model_configs/gptoss_bf16_tuned_gemm.csv
gfx,cu_num,M,N,K,bias,dtype,outdtype,scaleAB,bpreshuffle,libtype,solidx,splitK,us,kernelName,err_ratio,tflops,bw
gfx950,256,1,128,2880,True,torch.bfloat16,torch.bfloat16,False,False,flydsl,2013,9,4.0893,flydsl_gemm5_abf16_wbf16_bf16_t16x64x64_split_k9_block_m_warp1_block_n_warp1_block_k_warp2_async_copyTrue_b_to_ldsTrue_b_preshuffleFalse_c_to_ldsFalse_gfx950,0.0391,0.18,181.77
gfx950,256,2,128,2880,True,torch.bfloat16,torch.bfloat16,False,False,flydsl,2013,9,4.1575,flydsl_gemm5_abf16_wbf16_bf16_t16x64x64_split_k9_block_m_warp1_block_n_warp1_block_k_warp2_async_copyTrue_b_to_ldsTrue_b_preshuffleFalse_c_to_ldsFalse_gfx950,0.0234,0.35,180.23
gfx950,256,4,128,2880,True,torch.bfloat16,torch.bfloat16,False,False,flydsl,2011,9,4.0752,flydsl_gemm5_abf16_wbf16_bf16_t16x64x64_split_k9_block_m_warp1_block_n_warp1_block_k_warp1_async_copyTrue_b_to_ldsTrue_b_preshuffleFalse_c_to_ldsFalse_gfx950,0.0156,0.72,186.82
gfx950,256,8,128,2880,True,torch.bfloat16,torch.bfloat16,False,False,flydsl,2015,9,3.9712,flydsl_gemm5_abf16_wbf16_bf16_t16x64x64_split_k9_block_m_warp1_block_n_warp2_block_k_warp1_async_copyTrue_b_to_ldsTrue_b_preshuffleFalse_c_to_ldsFalse_gfx950,0.0146,1.49,197.78
gfx950,256,16,128,2880,True,torch.bfloat16,torch.bfloat16,False,False,flydsl,1359,9,4.3366,flydsl_gemm4_abf16_wbf16_bf16_t16x64x64_split_k9_block_m_warp1_block_n_warp2_block_k_warp1_async_copyTrue_b_to_ldsTrue_b_preshuffleFalse_c_to_ldsFalse_gfx950,0.0151,2.72,192.21
gfx950,256,32,128,2880,True,torch.bfloat16,torch.bfloat16,False,False,flydsl,1359,9,4.2972,flydsl_gemm4_abf16_wbf16_bf16_t16x64x64_split_k9_block_m_warp1_block_n_warp2_block_k_warp1_async_copyTrue_b_to_ldsTrue_b_preshuffleFalse_c_to_ldsFalse_gfx950,0.0186,5.49,216.37
gfx950,256,48,128,2880,True,torch.bfloat16,torch.bfloat16,False,False,flydsl,2153,9,4.4081,flydsl_gemm5_abf16_wbf16_bf16_t32x64x64_split_k9_block_m_warp1_block_n_warp4_block_k_warp1_async_copyTrue_b_to_ldsTrue_b_preshuffleFalse_c_to_ldsFalse_gfx950,0.015,8.03,232.76
gfx950,256,64,128,2880,True,torch.bfloat16,torch.bfloat16,False,False,flydsl,2311,9,4.4795,flydsl_gemm4_abf16_wbf16_bf16_t32x64x64_split_k9_block_m_warp1_block_n_warp2_block_k_warp2_async_copyTrue_b_to_ldsTrue_b_preshuffleFalse_c_to_ldsFalse_gfx950,0.0236,10.53,250.54
gfx950,256,80,128,2880,True,torch.bfloat16,torch.bfloat16,False,False,flydsl,3243,9,4.3343,flydsl_gemm5_abf16_wbf16_bf16_t32x64x64_split_k9_block_m_warp2_block_n_warp1_block_k_warp1_async_copyTrue_b_to_ldsTrue_b_preshuffleFalse_c_to_ldsFalse_gfx950,0.0175,13.61,281.14
gfx950,256,96,128,2880,True,torch.bfloat16,torch.bfloat16,False,False,flydsl,3247,9,4.5202,flydsl_gemm5_abf16_wbf16_bf16_t32x64x64_split_k9_block_m_warp2_block_n_warp2_block_k_warp1_async_copyTrue_b_to_ldsTrue_b_preshuffleFalse_c_to_ldsFalse_gfx950,0.0165,15.66,290.88
gfx950,256,112,128,2880,True,torch.bfloat16,torch.bfloat16,False,False,flydsl,3295,9,4.746,flydsl_gemm5_abf16_wbf16_bf16_t48x64x64_split_k9_block_m_warp1_block_n_warp2_block_k_warp1_async_copyTrue_b_to_ldsTrue_b_preshuffleFalse_c_to_ldsFalse_gfx950,0.0169,17.4,297.32
gfx950,256,128,128,2880,True,torch.bfloat16,torch.bfloat16,False,False,flydsl,4441,9,4.9195,flydsl_gemm5_abf16_wbf16_bf16_t64x64x64_split_k9_block_m_warp2_block_n_warp2_block_k_warp1_async_copyTrue_b_to_ldsTrue_b_preshuffleFalse_c_to_ldsFalse_gfx950,0.0159,19.18,306.4
gfx950,256,256,128,2880,True,torch.bfloat16,torch.bfloat16,False,False,flydsl,4107,5,5.5818,flydsl_gemm5_abf16_wbf16_bf16_t32x64x64_split_k5_block_m_warp1_block_n_warp4_block_k_warp1_async_copyTrue_b_to_ldsTrue_b_preshuffleFalse_c_to_ldsFalse_gfx950,0.0122,33.81,408.0
gfx950,256,1,640,2880,True,torch.bfloat16,torch.bfloat16,False,False,flydsl,2015,9,4.9166,flydsl_gemm5_abf16_wbf16_bf16_t16x64x64_split_k9_block_m_warp1_block_n_warp2_block_k_warp1_async_copyTrue_b_to_ldsTrue_b_preshuffleFalse_c_to_ldsFalse_gfx950,0.0125,0.75,751.22
gfx950,256,2,640,2880,True,torch.bfloat16,torch.bfloat16,False,False,flydsl,2011,9,4.9227,flydsl_gemm5_abf16_wbf16_bf16_t16x64x64_split_k9_block_m_warp1_block_n_warp1_block_k_warp1_async_copyTrue_b_to_ldsTrue_b_preshuffleFalse_c_to_ldsFalse_gfx950,0.0141,1.5,751.72
gfx950,256,4,640,2880,True,torch.bfloat16,torch.bfloat16,False,False,flydsl,2015,9,4.9483,flydsl_gemm5_abf16_wbf16_bf16_t16x64x64_split_k9_block_m_warp1_block_n_warp2_block_k_warp1_async_copyTrue_b_to_ldsTrue_b_preshuffleFalse_c_to_ldsFalse_gfx950,0.0148,2.98,750.67
gfx950,256,8,640,2880,True,torch.bfloat16,torch.bfloat16,False,False,flydsl,2013,9,4.8494,flydsl_gemm5_abf16_wbf16_bf16_t16x64x64_split_k9_block_m_warp1_block_n_warp1_block_k_warp2_async_copyTrue_b_to_ldsTrue_b_preshuffleFalse_c_to_ldsFalse_gfx950,0.0254,6.08,771.79
gfx950,256,16,640,2880,True,torch.bfloat16,torch.bfloat16,False,False,flydsl,2013,9,5.2201,flydsl_gemm5_abf16_wbf16_bf16_t16x64x64_split_k9_block_m_warp1_block_n_warp1_block_k_warp2_async_copyTrue_b_to_ldsTrue_b_preshuffleFalse_c_to_ldsFalse_gfx950,0.0261,11.3,727.77
gfx950,256,32,640,2880,True,torch.bfloat16,torch.bfloat16,False,False,flydsl,2153,9,5.7635,flydsl_gemm5_abf16_wbf16_bf16_t32x64x64_split_k9_block_m_warp1_block_n_warp4_block_k_warp1_async_copyTrue_b_to_ldsTrue_b_preshuffleFalse_c_to_ldsFalse_gfx950,0.0192,20.47,678.7
gfx950,256,48,640,2880,True,torch.bfloat16,torch.bfloat16,False,False,flydsl,2009,5,5.9635,flydsl_gemm5_abf16_wbf16_bf16_t16x64x64_split_k5_block_m_warp1_block_n_warp2_block_k_warp1_async_copyTrue_b_to_ldsTrue_b_preshuffleFalse_c_to_ldsFalse_gfx950,0.0141,29.67,674.83
gfx950,256,64,640,2880,True,torch.bfloat16,torch.bfloat16,False,False,flydsl,3229,5,6.6275,flydsl_gemm5_abf16_wbf16_bf16_t32x64x64_split_k5_block_m_warp2_block_n_warp2_block_k_warp1_async_copyTrue_b_to_ldsTrue_b_preshuffleFalse_c_to_ldsFalse_gfx950,0.0131,35.6,624.21
gfx950,256,80,640,2880,True,torch.bfloat16,torch.bfloat16,False,False,flydsl,3223,5,6.8527,flydsl_gemm5_abf16_wbf16_bf16_t32x64x64_split_k5_block_m_warp1_block_n_warp4_block_k_warp1_async_copyTrue_b_to_ldsTrue_b_preshuffleFalse_c_to_ldsFalse_gfx950,0.0133,43.04,620.14
gfx950,256,96,640,2880,True,torch.bfloat16,torch.bfloat16,False,False,flydsl,3223,5,7.1515,flydsl_gemm5_abf16_wbf16_bf16_t32x64x64_split_k5_block_m_warp1_block_n_warp4_block_k_warp1_async_copyTrue_b_to_ldsTrue_b_preshuffleFalse_c_to_ldsFalse_gfx950,0.0136,49.49,609.98
gfx950,256,112,640,2880,True,torch.bfloat16,torch.bfloat16,False,False,flydsl,3091,3,7.6371,flydsl_gemm5_abf16_wbf16_bf16_t16x64x64_split_k3_block_m_warp1_block_n_warp2_block_k_warp1_async_copyTrue_b_to_ldsTrue_b_preshuffleFalse_c_to_ldsFalse_gfx950,0.0089,54.06,585.94
gfx950,256,128,640,2880,True,torch.bfloat16,torch.bfloat16,False,False,flydsl,3839,3,7.7624,flydsl_gemm5_abf16_wbf16_bf16_t16x64x64_split_k3_block_m_warp1_block_n_warp2_block_k_warp1_async_copyTrue_b_to_ldsTrue_b_preshuffleFalse_c_to_ldsFalse_gfx950,0.0087,60.79,590.99
gfx950,256,256,640,2880,True,torch.bfloat16,torch.bfloat16,False,False,flydsl,4089,3,9.7017,flydsl_gemm5_abf16_wbf16_bf16_t32x64x64_split_k3_block_m_warp1_block_n_warp4_block_k_warp1_async_copyTrue_b_to_ldsTrue_b_preshuffleFalse_c_to_ldsFalse_gfx950,0.0094,97.27,565.74
gfx950,256,1,2560,2880,True,torch.bfloat16,torch.bfloat16,False,False,flydsl,2969,5,5.9702,flydsl_gemm5_abf16_wbf16_bf16_t16x64x64_split_k5_block_m_warp1_block_n_warp2_block_k_warp1_async_copyTrue_b_to_ldsTrue_b_preshuffleFalse_c_to_ldsFalse_gfx950,0.0117,2.47,2471.69
gfx950,256,2,2560,2880,True,torch.bfloat16,torch.bfloat16,False,False,flydsl,2969,5,5.9021,flydsl_gemm5_abf16_wbf16_bf16_t16x64x64_split_k5_block_m_warp1_block_n_warp2_block_k_warp1_async_copyTrue_b_to_ldsTrue_b_preshuffleFalse_c_to_ldsFalse_gfx950,0.0131,5.0,2502.05
gfx950,256,4,2560,2880,True,torch.bfloat16,torch.bfloat16,False,False,flydsl,2033,5,6.1478,flydsl_gemm4_abf16_wbf16_bf16_t16x64x64_split_k5_block_m_warp1_block_n_warp2_block_k_warp1_async_copyTrue_b_to_ldsTrue_b_preshuffleFalse_c_to_ldsFalse_gfx950,0.0142,9.59,2405.6
gfx950,256,8,2560,2880,True,torch.bfloat16,torch.bfloat16,False,False,flydsl,2969,5,6.2263,flydsl_gemm5_abf16_wbf16_bf16_t16x64x64_split_k5_block_m_warp1_block_n_warp2_block_k_warp1_async_copyTrue_b_to_ldsTrue_b_preshuffleFalse_c_to_ldsFalse_gfx950,0.0126,18.95,2382.26
gfx950,256,16,2560,2880,True,torch.bfloat16,torch.bfloat16,False,False,flydsl,2033,5,6.8063,flydsl_gemm4_abf16_wbf16_bf16_t16x64x64_split_k5_block_m_warp1_block_n_warp2_block_k_warp1_async_copyTrue_b_to_ldsTrue_b_preshuffleFalse_c_to_ldsFalse_gfx950,0.0136,34.66,2192.04
gfx950,256,32,2560,2880,True,torch.bfloat16,torch.bfloat16,False,False,flydsl,2961,3,8.0781,flydsl_gemm5_abf16_wbf16_bf16_t16x64x64_split_k3_block_m_warp1_block_n_warp1_block_k_warp2_async_copyTrue_b_to_ldsTrue_b_preshuffleFalse_c_to_ldsFalse_gfx950,0.0156,58.41,1868.48
gfx950,256,48,2560,2880,True,torch.bfloat16,torch.bfloat16,False,False,flydsl,3113,3,8.7224,flydsl_gemm5_abf16_wbf16_bf16_t32x64x64_split_k3_block_m_warp1_block_n_warp4_block_k_warp1_async_copyTrue_b_to_ldsTrue_b_preshuffleFalse_c_to_ldsFalse_gfx950,0.0091,81.15,1750.42
gfx950,256,64,2560,2880,True,torch.bfloat16,torch.bfloat16,False,False,flydsl,4615,3,9.7044,flydsl_gemm5_abf16_wbf16_bf16_t32x64x64_split_k3_block_m_warp2_block_n_warp2_block_k_warp1_async_copyTrue_b_to_ldsTrue_b_preshuffleFalse_c_to_ldsFalse_gfx950,0.0092,97.25,1591.23
gfx950,256,80,2560,2880,True,torch.bfloat16,torch.bfloat16,False,False,flydsl,4615,3,10.947,flydsl_gemm5_abf16_wbf16_bf16_t32x64x64_split_k3_block_m_warp2_block_n_warp2_block_k_warp1_async_copyTrue_b_to_ldsTrue_b_preshuffleFalse_c_to_ldsFalse_gfx950,0.0092,107.76,1426.51
gfx950,256,96,2560,2880,True,torch.bfloat16,torch.bfloat16,False,False,asm,3,3,11.2984,_ZN5aiter39bf16gemm_fp32bf16_tn_48x64_splitk_cleanE,0.0074,125.29,1397.55
gfx950,256,112,2560,2880,True,torch.bfloat16,torch.bfloat16,False,False,asm,5,3,11.794,_ZN5aiter39bf16gemm_fp32bf16_tn_64x64_splitk_cleanE,0.0075,140.03,1353.58
gfx950,256,128,2560,2880,True,torch.bfloat16,torch.bfloat16,False,False,asm,5,3,11.7377,_ZN5aiter39bf16gemm_fp32bf16_tn_64x64_splitk_cleanE,0.0074,160.8,1374.91
gfx950,256,256,2560,2880,True,torch.bfloat16,torch.bfloat16,False,False,flydsl,6099,1,14.9753,flydsl_gemm5_abf16_wbf16_bf16_t64x64x64_split_k1_block_m_warp2_block_n_warp4_block_k_warp1_async_copyTrue_b_to_ldsTrue_b_preshuffleFalse_c_to_ldsFalse_gfx950,0.0,252.07,1170.65
gfx950,256,1,2880,512,True,torch.bfloat16,torch.bfloat16,False,False,triton,0,0,4.1598,auto,0.0,0.71,710.59
gfx950,256,1,2880,2048,True,torch.bfloat16,torch.bfloat16,False,False,flydsl,1869,4,5.5646,flydsl_gemm4_abf16_wbf16_bf16_t16x64x128_split_k4_block_m_warp1_block_n_warp2_block_k_warp1_async_copyTrue_b_to_ldsTrue_b_preshuffleFalse_c_to_ldsFalse_gfx950,0.0087,2.12,2121.69
gfx950,256,1,2880,4096,True,torch.bfloat16,torch.bfloat16,False,False,flydsl,1869,4,7.0777,flydsl_gemm4_abf16_wbf16_bf16_t16x64x128_split_k4_block_m_warp1_block_n_warp2_block_k_warp1_async_copyTrue_b_to_ldsTrue_b_preshuffleFalse_c_to_ldsFalse_gfx950,0.0139,3.33,3335.39
gfx950,256,2,2880,512,True,torch.bfloat16,torch.bfloat16,False,False,triton,0,0,3.6874,auto,0.0,1.6,803.46
gfx950,256,2,2880,2048,True,torch.bfloat16,torch.bfloat16,False,False,flydsl,999,4,5.7496,flydsl_gemm3_abf16_wbf16_bf16_t16x64x128_split_k4_block_m_warp1_block_n_warp1_block_k_warp2_async_copyTrue_b_to_ldsTrue_b_preshuffleFalse_c_to_ldsFalse_gfx950,0.0168,4.1,2055.13
gfx950,256,2,2880,4096,True,torch.bfloat16,torch.bfloat16,False,False,flydsl,2665,4,7.1824,flydsl_gemm5_abf16_wbf16_bf16_t16x64x128_split_k4_block_m_warp1_block_n_warp2_block_k_warp1_async_copyTrue_b_to_ldsTrue_b_preshuffleFalse_c_to_ldsFalse_gfx950,0.0127,6.57,3288.71
gfx950,256,4,2880,512,True,torch.bfloat16,torch.bfloat16,False,False,triton,0,0,4.2518,auto,0.0,2.77,700.0
gfx950,256,4,2880,2048,True,torch.bfloat16,torch.bfloat16,False,False,flydsl,1867,4,5.7601,flydsl_gemm4_abf16_wbf16_bf16_t16x64x128_split_k4_block_m_warp1_block_n_warp1_block_k_warp2_async_copyTrue_b_to_ldsTrue_b_preshuffleFalse_c_to_ldsFalse_gfx950,0.0156,8.19,2054.81
gfx950,256,4,2880,4096,True,torch.bfloat16,torch.bfloat16,False,False,flydsl,1867,4,7.3034,flydsl_gemm4_abf16_wbf16_bf16_t16x64x128_split_k4_block_m_warp1_block_n_warp1_block_k_warp2_async_copyTrue_b_to_ldsTrue_b_preshuffleFalse_c_to_ldsFalse_gfx950,0.0214,12.92,3238.05
gfx950,256,8,2880,512,True,torch.bfloat16,torch.bfloat16,False,False,triton,0,0,3.6135,auto,0.0,6.53,831.16
gfx950,256,8,2880,2048,True,torch.bfloat16,torch.bfloat16,False,False,flydsl,1869,4,5.8031,flydsl_gemm4_abf16_wbf16_bf16_t16x64x128_split_k4_block_m_warp1_block_n_warp2_block_k_warp1_async_copyTrue_b_to_ldsTrue_b_preshuffleFalse_c_to_ldsFalse_gfx950,0.0094,16.26,2046.38
gfx950,256,8,2880,4096,True,torch.bfloat16,torch.bfloat16,False,False,flydsl,1893,4,7.7386,flydsl_gemm4_abf16_wbf16_bf16_t16x64x256_split_k4_block_m_warp1_block_n_warp2_block_k_warp1_async_copyTrue_b_to_ldsTrue_b_preshuffleFalse_c_to_ldsFalse_gfx950,0.0128,24.39,3063.16
gfx950,256,16,2880,512,True,torch.bfloat16,torch.bfloat16,False,False,triton,0,0,2.907,auto,0.0,16.23,1051.83
gfx950,256,16,2880,2048,True,torch.bfloat16,torch.bfloat16,False,False,flydsl,2701,4,6.1751,flydsl_gemm5_abf16_wbf16_bf16_t16x64x64_split_k4_block_m_warp1_block_n_warp2_block_k_warp1_async_copyTrue_b_to_ldsTrue_b_preshuffleFalse_c_to_ldsFalse_gfx950,0.0101,30.57,1935.87
gfx950,256,16,2880,4096,True,torch.bfloat16,torch.bfloat16,False,False,flydsl,2665,4,7.9023,flydsl_gemm5_abf16_wbf16_bf16_t16x64x128_split_k4_block_m_warp1_block_n_warp2_block_k_warp1_async_copyTrue_b_to_ldsTrue_b_preshuffleFalse_c_to_ldsFalse_gfx950,0.014,47.77,3013.83
gfx950,256,32,2880,512,True,torch.bfloat16,torch.bfloat16,False,False,triton,0,0,3.5473,auto,0.0,26.6,892.57
gfx950,256,32,2880,2048,True,torch.bfloat16,torch.bfloat16,False,False,triton,0,0,7.1928,auto,0.0,52.48,1683.89
gfx950,256,32,2880,4096,True,torch.bfloat16,torch.bfloat16,False,False,flydsl,1971,4,9.34,flydsl_gemm4_abf16_wbf16_bf16_t32x64x128_split_k4_block_m_warp1_block_n_warp4_block_k_warp1_async_copyTrue_b_to_ldsTrue_b_preshuffleFalse_c_to_ldsFalse_gfx950,0.0137,80.83,2573.81
gfx950,256,48,2880,512,True,torch.bfloat16,torch.bfloat16,False,False,flydsl,2089,1,4.2243,flydsl_gemm5_abf16_wbf16_bf16_t16x64x64_split_k1_block_m_warp1_block_n_warp1_block_k_warp2_async_copyTrue_b_to_ldsTrue_b_preshuffleFalse_c_to_ldsFalse_gfx950,0.001,33.51,775.22
gfx950,256,48,2880,2048,True,torch.bfloat16,torch.bfloat16,False,False,flydsl,1953,2,8.0263,flydsl_gemm4_abf16_wbf16_bf16_t32x64x128_split_k2_block_m_warp1_block_n_warp4_block_k_warp1_async_copyTrue_b_to_ldsTrue_b_preshuffleFalse_c_to_ldsFalse_gfx950,0.0051,70.55,1528.67
gfx950,256,48,2880,4096,True,torch.bfloat16,torch.bfloat16,False,False,flydsl,2157,4,11.3313,flydsl_gemm4_abf16_wbf16_bf16_t48x64x64_split_k4_block_m_warp1_block_n_warp2_block_k_warp1_async_copyTrue_b_to_ldsTrue_b_preshuffleFalse_c_to_ldsFalse_gfx950,0.0133,99.94,2141.21
gfx950,256,64,2880,512,True,torch.bfloat16,torch.bfloat16,False,False,triton,0,0,4.2011,auto,0.0,44.93,805.34
gfx950,256,64,2880,2048,True,torch.bfloat16,torch.bfloat16,False,False,flydsl,3865,2,8.7506,flydsl_gemm5_abf16_wbf16_bf16_t32x64x64_split_k2_block_m_warp1_block_n_warp4_block_k_warp1_async_copyTrue_b_to_ldsTrue_b_preshuffleFalse_c_to_ldsFalse_gfx950,0.0052,86.28,1420.16
gfx950,256,64,2880,4096,True,torch.bfloat16,torch.bfloat16,False,False,triton,0,0,11.6028,auto,0.0,130.14,2110.34
gfx950,256,80,2880,512,True,torch.bfloat16,torch.bfloat16,False,False,flydsl,3077,1,4.376,flydsl_gemm5_abf16_wbf16_bf16_t32x64x64_split_k1_block_m_warp1_block_n_warp4_block_k_warp1_async_copyTrue_b_to_ldsTrue_b_preshuffleFalse_c_to_ldsFalse_gfx950,0.0,53.91,797.95
gfx950,256,80,2880,2048,True,torch.bfloat16,torch.bfloat16,False,False,flydsl,2755,1,9.0319,flydsl_gemm4_abf16_wbf16_bf16_t32x64x128_split_k1_block_m_warp2_block_n_warp1_block_k_warp2_async_copyTrue_b_to_ldsTrue_b_preshuffleFalse_c_to_ldsFalse_gfx950,0.0034,104.49,1393.39
gfx950,256,80,2880,4096,True,torch.bfloat16,torch.bfloat16,False,False,asm,7,5,12.7738,_ZN5aiter39bf16gemm_fp32bf16_tn_80x64_splitk_cleanE,0.0135,147.76,1934.36
gfx950,256,96,2880,512,True,torch.bfloat16,torch.bfloat16,False,False,flydsl,2184,1,4.5743,flydsl_gemm4_abf16_wbf16_bf16_t32x64x128_split_k1_block_m_warp2_block_n_warp1_block_k_warp2_async_copyTrue_b_to_ldsTrue_b_preshuffleFalse_c_to_ldsFalse_gfx950,0.0011,61.89,787.09
gfx950,256,96,2880,2048,True,torch.bfloat16,torch.bfloat16,False,False,flydsl,2755,1,9.3222,flydsl_gemm4_abf16_wbf16_bf16_t32x64x128_split_k1_block_m_warp2_block_n_warp1_block_k_warp2_async_copyTrue_b_to_ldsTrue_b_preshuffleFalse_c_to_ldsFalse_gfx950,0.0034,121.48,1366.92
gfx950,256,96,2880,4096,True,torch.bfloat16,torch.bfloat16,False,False,asm,8,5,13.535,_ZN5aiter39bf16gemm_fp32bf16_tn_96x64_splitk_cleanE,0.0137,167.34,1842.07
gfx950,256,112,2880,512,True,torch.bfloat16,torch.bfloat16,False,False,flydsl,1319,1,4.6741,flydsl_gemm3_abf16_wbf16_bf16_t32x64x128_split_k1_block_m_warp2_block_n_warp2_block_k_warp1_async_copyTrue_b_to_ldsTrue_b_preshuffleFalse_c_to_ldsFalse_gfx950,0.0,70.67,793.51
gfx950,256,112,2880,2048,True,torch.bfloat16,torch.bfloat16,False,False,flydsl,2751,1,9.6594,flydsl_gemm4_abf16_wbf16_bf16_t32x64x128_split_k1_block_m_warp1_block_n_warp4_block_k_warp1_async_copyTrue_b_to_ldsTrue_b_preshuffleFalse_c_to_ldsFalse_gfx950,0.0,136.78,1335.52
gfx950,256,112,2880,4096,True,torch.bfloat16,torch.bfloat16,False,False,flydsl,3045,2,15.0102,flydsl_gemm4_abf16_wbf16_bf16_t64x64x128_split_k2_block_m_warp4_block_n_warp1_block_k_warp2_async_copyTrue_b_to_ldsTrue_b_preshuffleFalse_c_to_ldsFalse_gfx950,0.0137,176.04,1675.9
gfx950,256,128,2880,512,True,torch.bfloat16,torch.bfloat16,False,False,triton,0,0,4.2807,auto,0.0,88.18,891.79
gfx950,256,128,2880,2048,True,torch.bfloat16,torch.bfloat16,False,False,flydsl,4459,1,9.9749,flydsl_gemm5_abf16_wbf16_bf16_t32x64x64_split_k1_block_m_warp1_block_n_warp4_block_k_warp1_async_copyTrue_b_to_ldsTrue_b_preshuffleFalse_c_to_ldsFalse_gfx950,0.0,151.37,1309.09
gfx950,256,128,2880,4096,True,torch.bfloat16,torch.bfloat16,False,False,triton,0,0,14.9752,auto,0.0,201.66,1694.72
gfx950,256,256,2880,512,True,torch.bfloat16,torch.bfloat16,False,False,flydsl,3933,1,5.3235,flydsl_gemm5_abf16_wbf16_bf16_t64x64x64_split_k1_block_m_warp4_block_n_warp2_block_k_warp1_async_copyTrue_b_to_ldsTrue_b_preshuffleFalse_c_to_ldsFalse_gfx950,0.0,141.82,880.21
gfx950,256,256,2880,2048,True,torch.bfloat16,torch.bfloat16,False,False,flydsl,4605,1,11.7962,flydsl_gemm5_abf16_wbf16_bf16_t64x64x128_split_k1_block_m_warp2_block_n_warp2_block_k_warp2_async_copyTrue_b_to_ldsTrue_b_preshuffleFalse_c_to_ldsFalse_gfx950,0.0035,256.01,1213.92
gfx950,256,1,5120,2880,True,torch.bfloat16,torch.bfloat16,False,False,flydsl,2025,3,7.975,flydsl_gemm4_abf16_wbf16_bf16_t16x64x64_split_k3_block_m_warp1_block_n_warp1_block_k_warp2_async_copyTrue_b_to_ldsTrue_b_preshuffleFalse_c_to_ldsFalse_gfx950,0.0152,3.7,3699.96
gfx950,256,2,5120,2880,True,torch.bfloat16,torch.bfloat16,False,False,flydsl,2027,3,7.9071,flydsl_gemm4_abf16_wbf16_bf16_t16x64x64_split_k3_block_m_warp1_block_n_warp2_block_k_warp1_async_copyTrue_b_to_ldsTrue_b_preshuffleFalse_c_to_ldsFalse_gfx950,0.0077,7.46,3733.76
gfx950,256,4,5120,2880,True,torch.bfloat16,torch.bfloat16,False,False,flydsl,2963,3,8.072,flydsl_gemm5_abf16_wbf16_bf16_t16x64x64_split_k3_block_m_warp1_block_n_warp2_block_k_warp1_async_copyTrue_b_to_ldsTrue_b_preshuffleFalse_c_to_ldsFalse_gfx950,0.0091,14.61,3661.45
gfx950,256,8,5120,2880,True,torch.bfloat16,torch.bfloat16,False,False,flydsl,2027,3,8.2444,flydsl_gemm4_abf16_wbf16_bf16_t16x64x64_split_k3_block_m_warp1_block_n_warp2_block_k_warp1_async_copyTrue_b_to_ldsTrue_b_preshuffleFalse_c_to_ldsFalse_gfx950,0.0092,28.62,3592.64
gfx950,256,16,5120,2880,True,torch.bfloat16,torch.bfloat16,False,False,flydsl,2961,3,8.8987,flydsl_gemm5_abf16_wbf16_bf16_t16x64x64_split_k3_block_m_warp1_block_n_warp1_block_k_warp2_async_copyTrue_b_to_ldsTrue_b_preshuffleFalse_c_to_ldsFalse_gfx950,0.0161,53.03,3342.87
gfx950,256,32,5120,2880,True,torch.bfloat16,torch.bfloat16,False,False,triton,0,0,10.4321,auto,0.0,90.46,2876.05
gfx950,256,48,5120,2880,True,torch.bfloat16,torch.bfloat16,False,False,flydsl,2315,3,12.4203,flydsl_gemm4_abf16_wbf16_bf16_t48x64x64_split_k3_block_m_warp1_block_n_warp2_block_k_warp1_async_copyTrue_b_to_ldsTrue_b_preshuffleFalse_c_to_ldsFalse_gfx950,0.0091,113.97,2436.27
gfx950,256,64,5120,2880,True,torch.bfloat16,torch.bfloat16,False,False,flydsl,4597,1,12.7132,flydsl_gemm5_abf16_wbf16_bf16_t32x64x64_split_k1_block_m_warp2_block_n_warp2_block_k_warp1_async_copyTrue_b_to_ldsTrue_b_preshuffleFalse_c_to_ldsFalse_gfx950,0.0,148.46,2400.28
gfx950,256,80,5120,2880,True,torch.bfloat16,torch.bfloat16,False,False,flydsl,4591,1,12.5024,flydsl_gemm5_abf16_wbf16_bf16_t32x64x64_split_k1_block_m_warp1_block_n_warp4_block_k_warp1_async_copyTrue_b_to_ldsTrue_b_preshuffleFalse_c_to_ldsFalse_gfx950,0.0,188.71,2461.22
gfx950,256,96,5120,2880,True,torch.bfloat16,torch.bfloat16,False,False,flydsl,4589,1,12.6401,flydsl_gemm5_abf16_wbf16_bf16_t32x64x64_split_k1_block_m_warp1_block_n_warp2_block_k_warp2_async_copyTrue_b_to_ldsTrue_b_preshuffleFalse_c_to_ldsFalse_gfx950,0.0042,223.98,2454.66
gfx950,256,112,5120,2880,True,torch.bfloat16,torch.bfloat16,False,False,flydsl,3343,1,14.123,flydsl_gemm4_abf16_wbf16_bf16_t32x64x64_split_k1_block_m_warp1_block_n_warp1_block_k_warp2_async_copyTrue_b_to_ldsTrue_b_preshuffleFalse_c_to_ldsFalse_gfx950,0.0042,233.87,2215.05
gfx950,256,128,5120,2880,True,torch.bfloat16,torch.bfloat16,False,False,flydsl,4415,1,15.106,flydsl_gemm4_abf16_wbf16_bf16_t48x64x64_split_k1_block_m_warp1_block_n_warp1_block_k_warp2_async_copyTrue_b_to_ldsTrue_b_preshuffleFalse_c_to_ldsFalse_gfx950,0.0042,249.89,2087.86
