aiter/configs/model_configs/kimik2_fp4_tuned_fmoe.csv
cu_num,token,model_dim,inter_dim,expert,topk,act_type,dtype,q_dtype_a,q_dtype_w,q_type,use_g1u1,doweight_stage1,block_m,ksplit,us1,kernelName1,err1,us2,kernelName2,err2,us,run_1stage,tflops,bw,_tag
256,1,7168,256,384,8,ActivationType.Silu,torch.bfloat16,torch.float4_e2m1fn_x2,torch.float4_e2m1fn_x2,QuantType.per_1x32,1,0,32,0,13.0095,flydsl_moe1_afp4_wfp4_bf16_t32x128x256_w3_kb14_go_fq,19.6%,7.6993,moe_ck2stages_gemm2_64x32x32x128_1x1_MulABScaleExpertWeightShuffled_v1_Nswizzle0_Quant3_MulRoutedWeight1_FP4X2_FP4X2_B16,1.7%,20.7088,0,4.25,102079.83,
256,2,7168,256,384,8,ActivationType.Silu,torch.bfloat16,torch.float4_e2m1fn_x2,torch.float4_e2m1fn_x2,QuantType.per_1x32,1,0,32,0,15.5303,flydsl_moe1_afp4_wfp4_bf16_t32x128x256_w3_kb4_go_fq,17.8%,8.5351,moe_ck2stages_gemm2_64x32x32x128_1x1_MulABScaleExpertWeightShuffled_v1_Nswizzle0_Quant3_MulRoutedWeight1_FP4X2_FP4X2_B16,1.3%,24.0654,0,7.32,87842.8,
256,4,7168,256,384,8,ActivationType.Silu,torch.bfloat16,torch.float4_e2m1fn_x2,torch.float4_e2m1fn_x2,QuantType.per_1x32,1,0,32,0,20.1584,flydsl_moe1_afp4_wfp4_bf16_t32x128x256_w3_kb4_bnt0_go_fq,16.2%,12.7855,flydsl_moe2_afp4_wfp4_bf16_t32x256x256_atomic,1.3%,32.9439,0,10.69,64170.16,
256,128,7168,256,384,8,ActivationType.Silu,torch.bfloat16,torch.float4_e2m1fn_x2,torch.float4_e2m1fn_x2,QuantType.per_1x32,1,0,32,0,116.3628,flydsl_moe1_afp4_wfp4_bf16_t32x128x256_w3_fq,17.7%,73.0769,flydsl_moe2_afp4_wfp4_bf16_t16x128x256_atomic_sbm32,1.2%,189.4397,0,59.51,11173.38,
256,256,7168,256,384,8,ActivationType.Silu,torch.bfloat16,torch.float4_e2m1fn_x2,torch.float4_e2m1fn_x2,QuantType.per_1x32,1,0,32,0,116.724,flydsl_moe1_afp4_wfp4_bf16_t32x128x256_w4_fq,17.6%,76.4649,flydsl_moe2_afp4_wfp4_bf16_t16x128x256_atomic_persist_sbm32,1.2%,193.1889,0,116.72,10970.79,
256,512,7168,256,384,8,ActivationType.Silu,torch.bfloat16,torch.float4_e2m1fn_x2,torch.float4_e2m1fn_x2,QuantType.per_1x32,1,0,32,0,122.6113,flydsl_moe1_afp4_wfp4_bf16_t32x128x256_w4,0.0%,83.6555,flydsl_moe2_afp4_wfp4_bf16_t16x128x256_atomic_sbm32,1.2%,206.2668,0,218.64,10301.9,
256,1024,7168,256,384,8,ActivationType.Silu,torch.bfloat16,torch.float4_e2m1fn_x2,torch.float4_e2m1fn_x2,QuantType.per_1x32,1,0,64,0,128.8658,flydsl_moe1_afp4_wfp4_bf16_t64x128x256,0.0%,103.0812,flydsl_moe2_afp4_wfp4_bf16_t32x128x256_atomic_persist_sbm64,1.2%,231.947,0,388.86,9208.78,
256,2048,7168,256,384,8,ActivationType.Silu,torch.bfloat16,torch.float4_e2m1fn_x2,torch.float4_e2m1fn_x2,QuantType.per_1x32,1,0,64,0,134.8893,flydsl_moe1_afp4_wfp4_bf16_t64x64x256_w3,0.0%,160.4899,flydsl_moe2_afp4_wfp4_bf16_t64x256x256_reduce_persist,0.0%,295.3792,0,610.7,7305.76,
256,4096,7168,256,384,8,ActivationType.Silu,torch.bfloat16,torch.float4_e2m1fn_x2,torch.float4_e2m1fn_x2,QuantType.per_1x32,1,0,128,0,157.0015,flydsl_moe1_afp4_wfp4_bf16_t128x128x256_w2,0.0%,265.9482,flydsl_moe2_afp4_wfp4_bf16_t64x256x256_reduce_persist_sbm128,0.0%,422.9497,0,853.0,5206.32,
256,8192,7168,256,384,8,ActivationType.Silu,torch.bfloat16,torch.float4_e2m1fn_x2,torch.float4_e2m1fn_x2,QuantType.per_1x32,1,0,128,0,257.8398,moe_ck2stages_gemm1_256x128x128x128_1x4_MulABScaleShuffled_v3_Nswizzle0_Quant3_MulRoutedWeight0_silu_FP4X2_FP4X2_B16,0.0%,454.789,flydsl_moe2_afp4_wfp4_bf16_t64x256x256_reduce_persist_sbm128,0.0%,712.6288,0,1012.53,3213.58,
256,16384,7168,256,384,8,ActivationType.Silu,torch.bfloat16,torch.float4_e2m1fn_x2,torch.float4_e2m1fn_x2,QuantType.per_1x32,1,0,128,0,413.4922,flydsl_moe1_afp4_wfp4_bf16_t128x64x256_w4_bnt0,0.0%,944.3863,flydsl_moe2_afp4_wfp4_bf16_t64x256x256_reduce_persist_sbm128,0.0%,1357.8785,0,1062.77,1816.25,
256,32768,7168,256,384,8,ActivationType.Silu,torch.bfloat16,torch.float4_e2m1fn_x2,torch.float4_e2m1fn_x2,QuantType.per_1x32,1,0,128,0,649.1995000000001,moe_ck2stages_gemm1_256x128x128x128_1x4_MulABScaleShuffled_v3_Nswizzle0_Quant3_MulRoutedWeight0_silu_FP4X2_FP4X2_B16,0.0%,1812.8153,flydsl_moe2_afp4_wfp4_bf16_t64x256x256_reduce_persist_sbm128,0.0%,2462.0148,0,1172.3,1144.82,
256,1,7168,512,384,8,ActivationType.Silu,torch.bfloat16,torch.float4_e2m1fn_x2,torch.float4_e2m1fn_x2,QuantType.per_1x32,1,0,32,0,15.8954,flydsl_moe1_afp4_wfp4_bf16_t32x128x256_w3_kb7_go_fq,12.7%,7.3138,moe_ck2stages_gemm2_256x32x128x128_1x4_MulABScaleExpertWeightShuffled_v3_Nswizzle0_Quant3_MulRoutedWeight1_FP4X2_FP4X2_B16,2.8%,23.2092,0,7.59,182163.97,
256,2,7168,512,384,8,ActivationType.Silu,torch.bfloat16,torch.float4_e2m1fn_x2,torch.float4_e2m1fn_x2,QuantType.per_1x32,1,0,32,0,20.1367,flydsl_moe1_afp4_wfp4_bf16_t32x128x256_w3_kb4_go_fq,15.3%,13.292,flydsl_moe2_afp4_wfp4_bf16_t32x128x256_atomic,3.0%,33.4287,0,10.54,126475.2,
256,4,7168,512,384,8,ActivationType.Silu,torch.bfloat16,torch.float4_e2m1fn_x2,torch.float4_e2m1fn_x2,QuantType.per_1x32,1,0,32,0,28.4176,flydsl_moe1_afp4_wfp4_bf16_t32x32x256_w3,0.0%,17.6699,flydsl_moe2_afp4_wfp4_bf16_t32x128x256_atomic,2.8%,46.0875,0,15.29,91737.34,
256,8,7168,512,384,8,ActivationType.Silu,torch.bfloat16,torch.float4_e2m1fn_x2,torch.float4_e2m1fn_x2,QuantType.per_1x32,1,0,32,0,43.8662,flydsl_moe1_afp4_wfp4_bf16_t32x64x256_w2,0.0%,27.6115,moe_ck2stages_gemm2_64x32x32x128_1x1_MulABScaleExpertWeightShuffled_v1_Nswizzle0_Quant3_MulRoutedWeight1_FP4X2_FP4X2_B16,2.8%,71.4777,0,19.72,59151.74,
256,128,7168,512,384,8,ActivationType.Silu,torch.bfloat16,torch.float4_e2m1fn_x2,torch.float4_e2m1fn_x2,QuantType.per_1x32,1,0,32,0,231.6487,flydsl_moe1_afp4_wfp4_bf16_t32x64x256_w4,0.0%,126.5251,moe_ck2stages_gemm2_64x32x32x128_1x1_MulABScaleExpertWeightShuffled_v1_Nswizzle0_Quant3_MulRoutedWeight1_FP4X2_FP4X2_B16,2.7%,358.1738,0,62.95,11811.61,
256,256,7168,512,384,8,ActivationType.Silu,torch.bfloat16,torch.float4_e2m1fn_x2,torch.float4_e2m1fn_x2,QuantType.per_1x32,1,0,32,0,228.5827,flydsl_moe1_afp4_wfp4_bf16_t32x128x256_w3_fq,17.5%,133.9335,moe_ck2stages_gemm2_256x32x128x128_1x4_MulABScaleExpertWeightShuffled_v3_Nswizzle0_Quant3_MulRoutedWeight1_FP4X2_FP4X2_B16,2.7%,362.5162,0,124.4,11677.72,
256,512,7168,512,384,8,ActivationType.Silu,torch.bfloat16,torch.float4_e2m1fn_x2,torch.float4_e2m1fn_x2,QuantType.per_1x32,1,0,32,0,235.2137,flydsl_moe1_afp4_wfp4_bf16_t32x128x256,0.0%,144.7757,flydsl_moe2_afp4_wfp4_bf16_t16x256x256_atomic_sbm32,2.7%,379.9894,0,237.36,11155.23,
256,1024,7168,512,384,8,ActivationType.Silu,torch.bfloat16,torch.float4_e2m1fn_x2,torch.float4_e2m1fn_x2,QuantType.per_1x32,1,0,64,0,234.1493,flydsl_moe1_afp4_wfp4_bf16_t64x128x256_w4_fq,17.3%,161.2929,flydsl_moe2_afp4_wfp4_bf16_t32x256x256_atomic_sbm64,2.7%,395.4422,0,456.17,10747.15,
256,2048,7168,512,384,8,ActivationType.Silu,torch.bfloat16,torch.float4_e2m1fn_x2,torch.float4_e2m1fn_x2,QuantType.per_1x32,1,0,64,0,242.3866,flydsl_moe1_afp4_wfp4_bf16_t64x128x256_w2_fq,17.3%,207.6627,flydsl_moe2_afp4_wfp4_bf16_t64x128x256_atomic_persist,2.7%,450.0493,0,801.64,9492.07,
256,4096,7168,512,384,8,ActivationType.Silu,torch.bfloat16,torch.float4_e2m1fn_x2,torch.float4_e2m1fn_x2,QuantType.per_1x32,1,0,128,0,298.5723,flydsl_moe1_afp4_wfp4_bf16_t128x128x256_w3,0.0%,375.1883,flydsl_moe2_afp4_wfp4_bf16_t64x128x256_reduce_sbm128,0.3%,673.7606,0,1070.94,6405.75,
256,8192,7168,512,384,8,ActivationType.Silu,torch.bfloat16,torch.float4_e2m1fn_x2,torch.float4_e2m1fn_x2,QuantType.per_1x32,1,0,128,0,487.2589,moe_ck2stages_gemm1_256x128x128x128_1x4_MulABScaleShuffled_v3_Nswizzle0_Quant3_MulRoutedWeight0_silu_FP4X2_FP4X2_B16,0.0%,615.2087,flydsl_moe2_afp4_wfp4_bf16_t64x128x256_reduce_persist_sbm128,0.3%,1102.4676,0,1308.98,3994.69,
256,16384,7168,512,384,8,ActivationType.Silu,torch.bfloat16,torch.float4_e2m1fn_x2,torch.float4_e2m1fn_x2,QuantType.per_1x32,1,0,128,0,667.1980000000001,moe_ck2stages_gemm1_256x128x128x128_1x4_MulABScaleShuffled_v3_Nswizzle0_Quant3_MulRoutedWeight0_silu_FP4X2_FP4X2_B16,0.0%,1187.0398,flydsl_moe2_afp4_wfp4_bf16_t64x128x256_reduce_sbm128,0.3%,1854.2378,0,1556.55,2470.11,
256,32768,7168,512,384,8,ActivationType.Silu,torch.bfloat16,torch.float4_e2m1fn_x2,torch.float4_e2m1fn_x2,QuantType.per_1x32,1,0,128,0,1194.451,moe_ck2stages_gemm1_256x128x128x128_1x4_MulABScaleShuffled_v3_Nswizzle0_Quant3_MulRoutedWeight0_silu_FP4X2_FP4X2_B16,0.0%,2296.5456,flydsl_moe2_afp4_wfp4_bf16_t64x128x256_reduce_sbm128,0.3%,3490.9966,0,1653.52,1412.92,
256,1,7168,256,384,8,ActivationType.Silu,torch.bfloat16,torch.float4_e2m1fn_x2,torch.float4_e2m1fn_x2,QuantType.per_1x32,1,0,32,0,24.3769,moe_ck2stages_gemm1_64x32x32x128_1x1_MulABScaleShuffled_v3_Nswizzle0_Quant3_MulRoutedWeight0_silu_FP4X2_FP4X2_B16,0.0,7.6993,moe_ck2stages_gemm2_64x32x32x128_1x1_MulABScaleExpertWeightShuffled_v1_Nswizzle0_Quant3_MulRoutedWeight1_FP4X2_FP4X2_B16,0.0167,32.0762,0,0.0,0.0,flydsl_fallback
256,2,7168,256,384,8,ActivationType.Silu,torch.bfloat16,torch.float4_e2m1fn_x2,torch.float4_e2m1fn_x2,QuantType.per_1x32,1,0,32,0,24.7356,moe_ck2stages_gemm1_64x32x32x128_1x1_MulABScaleShuffled_v3_Nswizzle0_Quant3_MulRoutedWeight0_silu_FP4X2_FP4X2_B16,0.0,8.5351,moe_ck2stages_gemm2_64x32x32x128_1x1_MulABScaleExpertWeightShuffled_v1_Nswizzle0_Quant3_MulRoutedWeight1_FP4X2_FP4X2_B16,0.013,33.2707,0,0.0,0.0,flydsl_fallback
256,4,7168,256,384,8,ActivationType.Silu,torch.bfloat16,torch.float4_e2m1fn_x2,torch.float4_e2m1fn_x2,QuantType.per_1x32,1,0,32,0,26.3275,moe_ck2stages_gemm1_64x32x32x128_1x1_MulABScaleShuffled_v3_Nswizzle0_Quant3_MulRoutedWeight0_silu_FP4X2_FP4X2_B16,0.0,14.9345,moe_ck2stages_gemm2_64x32x32x128_1x1_MulABScaleExpertWeightShuffled_v1_Nswizzle0_Quant3_MulRoutedWeight1_FP4X2_FP4X2_B16,0.0129,41.262,0,0.0,0.0,flydsl_fallback
256,8,7168,256,384,8,ActivationType.Silu,torch.bfloat16,torch.float4_e2m1fn_x2,torch.float4_e2m1fn_x2,QuantType.per_1x32,1,0,32,0,32.7287,moe_ck2stages_gemm1_64x32x32x128_1x1_MulABScaleShuffled_v3_Nswizzle0_Quant3_MulRoutedWeight0_silu_FP4X2_FP4X2_B16,0.0,19.0831,moe_ck2stages_gemm2_64x32x32x128_1x1_MulABScaleExpertWeightShuffled_v1_Nswizzle0_Quant3_MulRoutedWeight1_FP4X2_FP4X2_B16,0.012,51.8118,0,0.0,0.0,flydsl_fallback
256,16,7168,256,384,8,ActivationType.Silu,torch.bfloat16,torch.float4_e2m1fn_x2,torch.float4_e2m1fn_x2,QuantType.per_1x32,1,0,32,0,50.2469,moe_ck2stages_gemm1_64x32x32x128_1x1_MulABScaleShuffled_v3_Nswizzle0_Quant3_MulRoutedWeight0_silu_FP4X2_FP4X2_B16,0.0,29.2028,moe_ck2stages_gemm2_64x32x32x128_1x1_MulABScaleExpertWeightShuffled_v1_Nswizzle0_Quant3_MulRoutedWeight1_FP4X2_FP4X2_B16,0.012,79.4497,0,0.0,0.0,flydsl_fallback
256,32,7168,256,384,8,ActivationType.Silu,torch.bfloat16,torch.float4_e2m1fn_x2,torch.float4_e2m1fn_x2,QuantType.per_1x32,1,0,32,0,92.1504,moe_ck2stages_gemm1_64x32x32x128_1x1_MulABScaleShuffled_v3_Nswizzle0_Quant3_MulRoutedWeight0_silu_FP4X2_FP4X2_B16,0.0,50.6549,moe_ck2stages_gemm2_64x32x32x128_1x1_MulABScaleExpertWeightShuffled_v1_Nswizzle0_Quant3_MulRoutedWeight1_FP4X2_FP4X2_B16,0.0119,142.8053,0,0.0,0.0,flydsl_fallback
256,64,7168,256,384,8,ActivationType.Silu,torch.bfloat16,torch.float4_e2m1fn_x2,torch.float4_e2m1fn_x2,QuantType.per_1x32,1,0,32,0,133.4544,moe_ck2stages_gemm1_64x32x32x128_1x1_MulABScaleShuffled_v3_Nswizzle0_Quant3_MulRoutedWeight0_silu_FP4X2_FP4X2_B16,0.0,72.4641,moe_ck2stages_gemm2_64x32x32x128_1x1_MulABScaleExpertWeightShuffled_v1_Nswizzle0_Quant3_MulRoutedWeight1_FP4X2_FP4X2_B16,0.0114,205.9185,0,0.0,0.0,flydsl_fallback
256,128,7168,256,384,8,ActivationType.Silu,torch.bfloat16,torch.float4_e2m1fn_x2,torch.float4_e2m1fn_x2,QuantType.per_1x32,1,0,32,0,134.18040000000002,moe_ck2stages_gemm1_64x32x32x128_1x1_MulABScaleShuffled_v3_Nswizzle0_Quant3_MulRoutedWeight0_silu_FP4X2_FP4X2_B16,0.0,74.865,moe_ck2stages_gemm2_64x32x32x128_1x1_MulABScaleExpertWeightShuffled_v1_Nswizzle0_Quant3_MulRoutedWeight1_FP4X2_FP4X2_B16,0.0117,209.0454,0,0.0,0.0,flydsl_fallback
256,256,7168,256,384,8,ActivationType.Silu,torch.bfloat16,torch.float4_e2m1fn_x2,torch.float4_e2m1fn_x2,QuantType.per_1x32,1,0,32,0,135.3579,moe_ck2stages_gemm1_64x32x32x128_1x1_MulABScaleShuffled_v3_Nswizzle0_Quant3_MulRoutedWeight0_silu_FP4X2_FP4X2_B16,0.0,79.0897,moe_ck2stages_gemm2_64x32x32x128_1x1_MulABScaleExpertWeightShuffled_v1_Nswizzle0_Quant3_MulRoutedWeight1_FP4X2_FP4X2_B16,0.0116,214.4476,0,0.0,0.0,flydsl_fallback
256,2048,7168,256,384,8,ActivationType.Silu,torch.bfloat16,torch.float4_e2m1fn_x2,torch.float4_e2m1fn_x2,QuantType.per_1x32,1,0,64,0,148.597,moe_ck2stages_gemm1_256x64x128x128_1x4_MulABScaleShuffled_v3_Nswizzle0_Quant3_MulRoutedWeight0_silu_FP4X2_FP4X2_B16,0.0,216.8895,moe_ck2stages_gemm2_64x64x128x128_1x1_MulABScaleExpertWeightShuffled_v3_Nswizzle0_Quant3_MulRoutedWeight1_FP4X2_FP4X2_B16,0.0116,365.4865,0,0.0,0.0,flydsl_fallback
256,4096,7168,256,384,8,ActivationType.Silu,torch.bfloat16,torch.float4_e2m1fn_x2,torch.float4_e2m1fn_x2,QuantType.per_1x32,1,0,128,0,164.802,moe_ck2stages_gemm1_256x128x128x128_1x4_MulABScaleShuffled_v3_Nswizzle0_Quant3_MulRoutedWeight0_silu_FP4X2_FP4X2_B16,0.0,399.0634,moe_ck2stages_gemm2_64x128x128x128_1x1_MulABScaleExpertWeightShuffled_v3_Nswizzle0_Quant3_MulRoutedWeight1_FP4X2_FP4X2_B16,0.0116,563.8654,0,0.0,0.0,flydsl_fallback
256,8192,7168,256,384,8,ActivationType.Silu,torch.bfloat16,torch.float4_e2m1fn_x2,torch.float4_e2m1fn_x2,QuantType.per_1x32,1,0,128,0,257.8398,moe_ck2stages_gemm1_256x128x128x128_1x4_MulABScaleShuffled_v3_Nswizzle0_Quant3_MulRoutedWeight0_silu_FP4X2_FP4X2_B16,0.0,758.1182,moe_ck2stages_gemm2_64x128x128x128_1x1_MulABScaleExpertWeightShuffled_v3_Nswizzle0_Quant3_MulRoutedWeight1_FP4X2_FP4X2_B16,0.0117,1015.958,0,0.0,0.0,flydsl_fallback
256,16384,7168,256,384,8,ActivationType.Silu,torch.bfloat16,torch.float4_e2m1fn_x2,torch.float4_e2m1fn_x2,QuantType.per_1x32,1,0,128,0,427.3933,moe_ck2stages_gemm1_256x128x128x128_1x4_MulABScaleShuffled_v3_Nswizzle0_Quant3_MulRoutedWeight0_silu_FP4X2_FP4X2_B16,0.0,1454.6027,moe_ck2stages_gemm2_64x128x128x128_1x1_MulABScaleExpertWeightShuffled_v3_Nswizzle0_Quant3_MulRoutedWeight1_FP4X2_FP4X2_B16,0.0116,1881.996,0,0.0,0.0,flydsl_fallback
256,32768,7168,256,384,8,ActivationType.Silu,torch.bfloat16,torch.float4_e2m1fn_x2,torch.float4_e2m1fn_x2,QuantType.per_1x32,1,0,128,0,649.1995000000001,moe_ck2stages_gemm1_256x128x128x128_1x4_MulABScaleShuffled_v3_Nswizzle0_Quant3_MulRoutedWeight0_silu_FP4X2_FP4X2_B16,0.0,2868.8752,moe_ck2stages_gemm2_64x128x128x128_1x1_MulABScaleExpertWeightShuffled_v3_Nswizzle0_Quant3_MulRoutedWeight1_FP4X2_FP4X2_B16,0.0116,3518.0747,0,0.0,0.0,flydsl_fallback
256,1,7168,512,384,8,ActivationType.Silu,torch.bfloat16,torch.float4_e2m1fn_x2,torch.float4_e2m1fn_x2,QuantType.per_1x32,1,0,32,0,24.6279,moe_ck2stages_gemm1_64x32x32x128_1x1_MulABScaleShuffled_v3_Nswizzle0_Quant3_MulRoutedWeight0_silu_FP4X2_FP4X2_B16,0.0,7.3138,moe_ck2stages_gemm2_256x32x128x128_1x4_MulABScaleExpertWeightShuffled_v3_Nswizzle0_Quant3_MulRoutedWeight1_FP4X2_FP4X2_B16,0.028,31.9417,0,0.0,0.0,flydsl_fallback
256,2,7168,512,384,8,ActivationType.Silu,torch.bfloat16,torch.float4_e2m1fn_x2,torch.float4_e2m1fn_x2,QuantType.per_1x32,1,0,32,0,26.6857,moe_ck2stages_gemm1_64x32x32x128_1x1_MulABScaleShuffled_v3_Nswizzle0_Quant3_MulRoutedWeight0_silu_FP4X2_FP4X2_B16,0.0,13.9741,moe_ck2stages_gemm2_256x32x128x128_1x4_MulABScaleExpertWeightShuffled_v3_Nswizzle0_Quant3_MulRoutedWeight1_FP4X2_FP4X2_B16,0.0284,40.6598,0,0.0,0.0,flydsl_fallback
256,4,7168,512,384,8,ActivationType.Silu,torch.bfloat16,torch.float4_e2m1fn_x2,torch.float4_e2m1fn_x2,QuantType.per_1x32,1,0,32,0,30.9985,moe_ck2stages_gemm1_64x32x32x128_1x1_MulABScaleShuffled_v3_Nswizzle0_Quant3_MulRoutedWeight0_silu_FP4X2_FP4X2_B16,0.0,18.3433,moe_ck2stages_gemm2_64x32x32x128_1x1_MulABScaleExpertWeightShuffled_v1_Nswizzle0_Quant3_MulRoutedWeight1_FP4X2_FP4X2_B16,0.0277,49.3418,0,0.0,0.0,flydsl_fallback
256,8,7168,512,384,8,ActivationType.Silu,torch.bfloat16,torch.float4_e2m1fn_x2,torch.float4_e2m1fn_x2,QuantType.per_1x32,1,0,32,0,49.5923,moe_ck2stages_gemm1_64x32x32x128_1x1_MulABScaleShuffled_v3_Nswizzle0_Quant3_MulRoutedWeight0_silu_FP4X2_FP4X2_B16,0.0,27.6115,moe_ck2stages_gemm2_64x32x32x128_1x1_MulABScaleExpertWeightShuffled_v1_Nswizzle0_Quant3_MulRoutedWeight1_FP4X2_FP4X2_B16,0.0282,77.2038,0,0.0,0.0,flydsl_fallback
256,16,7168,512,384,8,ActivationType.Silu,torch.bfloat16,torch.float4_e2m1fn_x2,torch.float4_e2m1fn_x2,QuantType.per_1x32,1,0,32,0,92.1467,moe_ck2stages_gemm1_64x32x32x128_1x1_MulABScaleShuffled_v3_Nswizzle0_Quant3_MulRoutedWeight0_silu_FP4X2_FP4X2_B16,0.0,46.9738,moe_ck2stages_gemm2_64x32x32x128_1x1_MulABScaleExpertWeightShuffled_v1_Nswizzle0_Quant3_MulRoutedWeight1_FP4X2_FP4X2_B16,0.0278,139.1205,0,0.0,0.0,flydsl_fallback
256,32,7168,512,384,8,ActivationType.Silu,torch.bfloat16,torch.float4_e2m1fn_x2,torch.float4_e2m1fn_x2,QuantType.per_1x32,1,0,32,0,174.1771,moe_ck2stages_gemm1_64x32x32x128_1x1_MulABScaleShuffled_v3_Nswizzle0_Quant3_MulRoutedWeight0_silu_FP4X2_FP4X2_B16,0.0,84.8609,moe_ck2stages_gemm2_64x32x32x128_1x1_MulABScaleExpertWeightShuffled_v1_Nswizzle0_Quant3_MulRoutedWeight1_FP4X2_FP4X2_B16,0.0275,259.038,0,0.0,0.0,flydsl_fallback
256,64,7168,512,384,8,ActivationType.Silu,torch.bfloat16,torch.float4_e2m1fn_x2,torch.float4_e2m1fn_x2,QuantType.per_1x32,1,0,32,0,258.317,moe_ck2stages_gemm1_256x32x128x128_1x4_MulABScaleShuffled_v3_Nswizzle0_Quant3_MulRoutedWeight0_silu_FP4X2_FP4X2_B16,0.0,124.0186,moe_ck2stages_gemm2_64x32x32x128_1x1_MulABScaleExpertWeightShuffled_v1_Nswizzle0_Quant3_MulRoutedWeight1_FP4X2_FP4X2_B16,0.0275,382.3356,0,0.0,0.0,flydsl_fallback
256,128,7168,512,384,8,ActivationType.Silu,torch.bfloat16,torch.float4_e2m1fn_x2,torch.float4_e2m1fn_x2,QuantType.per_1x32,1,0,32,0,256.4105,moe_ck2stages_gemm1_64x32x32x128_1x1_MulABScaleShuffled_v3_Nswizzle0_Quant3_MulRoutedWeight0_silu_FP4X2_FP4X2_B16,0.0,126.5251,moe_ck2stages_gemm2_64x32x32x128_1x1_MulABScaleExpertWeightShuffled_v1_Nswizzle0_Quant3_MulRoutedWeight1_FP4X2_FP4X2_B16,0.0274,382.9356,0,0.0,0.0,flydsl_fallback
256,256,7168,512,384,8,ActivationType.Silu,torch.bfloat16,torch.float4_e2m1fn_x2,torch.float4_e2m1fn_x2,QuantType.per_1x32,1,0,32,0,258.373,moe_ck2stages_gemm1_256x32x128x128_1x4_MulABScaleShuffled_v3_Nswizzle0_Quant3_MulRoutedWeight0_silu_FP4X2_FP4X2_B16,0.0,133.9335,moe_ck2stages_gemm2_256x32x128x128_1x4_MulABScaleExpertWeightShuffled_v3_Nswizzle0_Quant3_MulRoutedWeight1_FP4X2_FP4X2_B16,0.0272,392.3065,0,0.0,0.0,flydsl_fallback
256,512,7168,512,384,8,ActivationType.Silu,torch.bfloat16,torch.float4_e2m1fn_x2,torch.float4_e2m1fn_x2,QuantType.per_1x32,1,0,32,0,264.5979,moe_ck2stages_gemm1_256x32x128x128_1x4_MulABScaleShuffled_v3_Nswizzle0_Quant3_MulRoutedWeight0_silu_FP4X2_FP4X2_B16,0.0,148.9177,moe_ck2stages_gemm2_256x32x128x128_1x4_MulABScaleExpertWeightShuffled_v3_Nswizzle0_Quant3_MulRoutedWeight1_FP4X2_FP4X2_B16,0.0274,413.5156,0,0.0,0.0,flydsl_fallback
256,1024,7168,512,384,8,ActivationType.Silu,torch.bfloat16,torch.float4_e2m1fn_x2,torch.float4_e2m1fn_x2,QuantType.per_1x32,1,0,32,0,269.9848,moe_ck2stages_gemm1_256x32x128x128_1x4_MulABScaleShuffled_v3_Nswizzle0_Quant3_MulRoutedWeight0_silu_FP4X2_FP4X2_B16,0.0,179.6268,moe_ck2stages_gemm2_64x32x32x128_1x1_MulABScaleExpertWeightShuffled_v1_Nswizzle0_Quant3_MulRoutedWeight1_FP4X2_FP4X2_B16,0.0274,449.6116,0,0.0,0.0,flydsl_fallback
256,4096,7168,512,384,8,ActivationType.Silu,torch.bfloat16,torch.float4_e2m1fn_x2,torch.float4_e2m1fn_x2,QuantType.per_1x32,1,0,32,0,455.9638000000001,moe_ck2stages_gemm1_64x32x32x128_1x1_MulABScaleShuffled_v3_Nswizzle0_Quant3_MulRoutedWeight0_silu_FP4X2_FP4X2_B16,0.0,470.6254,moe_ck2stages_gemm2_64x32x32x128_1x1_MulABScaleExpertWeightShuffled_v1_Nswizzle0_Quant3_MulRoutedWeight1_FP4X2_FP4X2_B16,0.0272,926.5892,0,0.0,0.0,flydsl_fallback
256,8192,7168,512,384,8,ActivationType.Silu,torch.bfloat16,torch.float4_e2m1fn_x2,torch.float4_e2m1fn_x2,QuantType.per_1x32,1,0,64,0,512.1967999999999,moe_ck2stages_gemm1_256x64x128x128_1x4_MulABScaleShuffled_v3_Nswizzle0_Quant3_MulRoutedWeight0_silu_FP4X2_FP4X2_B16,0.0,947.0349,moe_ck2stages_gemm2_64x64x128x128_1x1_MulABScaleExpertWeightShuffled_v3_Nswizzle0_Quant3_MulRoutedWeight1_FP4X2_FP4X2_B16,0.0273,1459.2317,0,0.0,0.0,flydsl_fallback
256,16384,7168,512,384,8,ActivationType.Silu,torch.bfloat16,torch.float4_e2m1fn_x2,torch.float4_e2m1fn_x2,QuantType.per_1x32,1,0,64,0,826.4788000000001,moe_ck2stages_gemm1_256x64x128x128_1x4_MulABScaleShuffled_v3_Nswizzle0_Quant3_MulRoutedWeight0_silu_FP4X2_FP4X2_B16,0.0,1824.3511,moe_ck2stages_gemm2_64x64x128x128_1x1_MulABScaleExpertWeightShuffled_v3_Nswizzle0_Quant3_MulRoutedWeight1_FP4X2_FP4X2_B16,0.0273,2650.8299,0,0.0,0.0,flydsl_fallback
256,32768,7168,512,384,8,ActivationType.Silu,torch.bfloat16,torch.float4_e2m1fn_x2,torch.float4_e2m1fn_x2,QuantType.per_1x32,1,0,64,0,1443.3101,moe_ck2stages_gemm1_256x64x128x128_1x4_MulABScaleShuffled_v3_Nswizzle0_Quant3_MulRoutedWeight0_silu_FP4X2_FP4X2_B16,0.0,3480.6829,moe_ck2stages_gemm2_64x64x128x128_1x1_MulABScaleExpertWeightShuffled_v3_Nswizzle0_Quant3_MulRoutedWeight1_FP4X2_FP4X2_B16,0.0273,4923.993,0,0.0,0.0,flydsl_fallback
256,1,7168,512,385,9,ActivationType.Silu,torch.bfloat16,torch.float4_e2m1fn_x2,torch.float4_e2m1fn_x2,QuantType.per_1x32,1,0,32,0,17.4266,flydsl_moe1_afp4_wfp4_bf16_t32x128x256_w3_kb7_fq,17.5%,8.6908,moe_ck2stages_gemm2_256x32x128x128_1x4_MulABScaleExpertWeightShuffled_v3_Nswizzle0_Quant3_MulRoutedWeight1_FP4X2_FP4X2_B16,2.6%,26.1174,0,7.59,162301.38,
256,2,7168,512,385,9,ActivationType.Silu,torch.bfloat16,torch.float4_e2m1fn_x2,torch.float4_e2m1fn_x2,QuantType.per_1x32,1,0,32,0,23.4976,flydsl_moe1_afp4_wfp4_bf16_t32x128x256_w3_kb7_fq,18.9%,13.9977,flydsl_moe2_afp4_wfp4_bf16_t32x128x256_atomic,2.7%,37.4953,0,10.57,113051.81,
256,4,7168,512,385,9,ActivationType.Silu,torch.bfloat16,torch.float4_e2m1fn_x2,torch.float4_e2m1fn_x2,QuantType.per_1x32,1,0,32,0,30.6887,flydsl_moe1_afp4_wfp4_bf16_t32x32x256_w4,0.0%,19.3962,moe_ck2stages_gemm2_64x32x32x128_1x1_MulABScaleExpertWeightShuffled_v1_Nswizzle0_Quant3_MulRoutedWeight1_FP4X2_FP4X2_B16,2.8%,50.0849,0,15.83,84635.38,
256,8,7168,512,385,9,ActivationType.Silu,torch.bfloat16,torch.float4_e2m1fn_x2,torch.float4_e2m1fn_x2,QuantType.per_1x32,1,0,32,0,54.2648,flydsl_moe1_afp4_wfp4_bf16_t32x64x256_w3,0.0%,29.4271,moe_ck2stages_gemm2_64x32x32x128_1x1_MulABScaleExpertWeightShuffled_v1_Nswizzle0_Quant3_MulRoutedWeight1_FP4X2_FP4X2_B16,2.8%,83.6919,0,18.94,50650.55,
256,16,7168,512,385,9,ActivationType.Silu,torch.bfloat16,torch.float4_e2m1fn_x2,torch.float4_e2m1fn_x2,QuantType.per_1x32,1,0,32,0,95.6116,flydsl_moe1_afp4_wfp4_bf16_t32x32x256_w3,0.0%,50.8507,moe_ck2stages_gemm2_64x32x32x128_1x1_MulABScaleExpertWeightShuffled_v1_Nswizzle0_Quant3_MulRoutedWeight1_FP4X2_FP4X2_B16,2.8%,146.4623,0,21.65,28944.05,
256,32,7168,512,385,9,ActivationType.Silu,torch.bfloat16,torch.float4_e2m1fn_x2,torch.float4_e2m1fn_x2,QuantType.per_1x32,1,0,32,0,177.2808,flydsl_moe1_afp4_wfp4_bf16_t32x64x256_w3,0.0%,94.2491,moe_ck2stages_gemm2_64x32x32x128_1x1_MulABScaleExpertWeightShuffled_v1_Nswizzle0_Quant3_MulRoutedWeight1_FP4X2_FP4X2_B16,2.9%,271.5299,0,23.36,15613.59,
256,64,7168,512,385,9,ActivationType.Silu,torch.bfloat16,torch.float4_e2m1fn_x2,torch.float4_e2m1fn_x2,QuantType.per_1x32,1,0,32,0,237.964,flydsl_moe1_afp4_wfp4_bf16_t32x64x256_w4_fq,17.6%,124.4419,moe_ck2stages_gemm2_256x32x128x128_1x4_MulABScaleExpertWeightShuffled_v3_Nswizzle0_Quant3_MulRoutedWeight1_FP4X2_FP4X2_B16,2.9%,362.4059,0,35.0,11700.26,
256,128,7168,512,385,9,ActivationType.Silu,torch.bfloat16,torch.float4_e2m1fn_x2,torch.float4_e2m1fn_x2,QuantType.per_1x32,1,0,32,0,243.1985,flydsl_moe1_afp4_wfp4_bf16_t32x64x256_w4,0.0%,128.3068,moe_ck2stages_gemm2_64x32x32x128_1x1_MulABScaleExpertWeightShuffled_v1_Nswizzle0_Quant3_MulRoutedWeight1_FP4X2_FP4X2_B16,2.9%,371.5053,0,68.28,11417.39,
256,256,7168,512,385,9,ActivationType.Silu,torch.bfloat16,torch.float4_e2m1fn_x2,torch.float4_e2m1fn_x2,QuantType.per_1x32,1,0,32,0,241.4227,flydsl_moe1_afp4_wfp4_bf16_t32x64x256_w4_fq,17.2%,136.1026,moe_ck2stages_gemm2_256x32x128x128_1x4_MulABScaleExpertWeightShuffled_v3_Nswizzle0_Quant3_MulRoutedWeight1_FP4X2_FP4X2_B16,2.9%,377.5253,0,134.39,11242.62,
256,512,7168,512,385,9,ActivationType.Silu,torch.bfloat16,torch.float4_e2m1fn_x2,torch.float4_e2m1fn_x2,QuantType.per_1x32,1,0,32,0,243.6353,flydsl_moe1_afp4_wfp4_bf16_t32x64x256_w4_fq,17.2%,145.6777,flydsl_moe2_afp4_wfp4_bf16_t16x256x256_atomic_sbm32,2.8%,389.313,0,260.64,10916.35,
256,1024,7168,512,385,9,ActivationType.Silu,torch.bfloat16,torch.float4_e2m1fn_x2,torch.float4_e2m1fn_x2,QuantType.per_1x32,1,0,32,0,249.5588,flydsl_moe1_afp4_wfp4_bf16_t32x64x256_w4_fq,17.3%,163.7732,flydsl_moe2_afp4_wfp4_bf16_t32x256x256_atomic,2.9%,413.332,0,490.98,10308.63,
256,2048,7168,512,385,9,ActivationType.Silu,torch.bfloat16,torch.float4_e2m1fn_x2,torch.float4_e2m1fn_x2,QuantType.per_1x32,1,0,64,0,259.2312,flydsl_moe1_afp4_wfp4_bf16_t64x128x256_w2_fq,17.2%,235.7503,flydsl_moe2_afp4_wfp4_bf16_t64x256x256_atomic,2.8%,494.9815,0,819.98,8652.66,
256,4096,7168,512,385,9,ActivationType.Silu,torch.bfloat16,torch.float4_e2m1fn_x2,torch.float4_e2m1fn_x2,QuantType.per_1x32,1,0,128,0,332.02500000000003,flydsl_moe1_afp4_wfp4_bf16_t128x128x256,0.0%,400.6833,flydsl_moe2_afp4_wfp4_bf16_t64x128x256_reduce_sbm128,0.2%,732.7083,0,1107.87,5905.42,
256,8192,7168,512,385,9,ActivationType.Silu,torch.bfloat16,torch.float4_e2m1fn_x2,torch.float4_e2m1fn_x2,QuantType.per_1x32,1,0,64,0,519.2058000000001,flydsl_moe1_afp4_wfp4_bf16_t64x64x256_w4_bnt0,0.0%,660.8668,flydsl_moe2_afp4_wfp4_bf16_t64x128x256_reduce_persist,0.2%,1180.0726,0,1375.76,3741.32,
256,16384,7168,512,385,9,ActivationType.Silu,torch.bfloat16,torch.float4_e2m1fn_x2,torch.float4_e2m1fn_x2,QuantType.per_1x32,1,0,128,0,713.2205,moe_ck2stages_gemm1_256x128x128x128_1x4_MulABScaleShuffled_v3_Nswizzle0_Quant3_MulRoutedWeight0_silu_FP4X2_FP4X2_B16,0.0%,1294.6795,flydsl_moe2_afp4_wfp4_bf16_t64x128x256_reduce_sbm128,0.2%,2007.9,0,1617.11,2286.56,
256,32768,7168,512,385,9,ActivationType.Silu,torch.bfloat16,torch.float4_e2m1fn_x2,torch.float4_e2m1fn_x2,QuantType.per_1x32,1,0,128,0,1339.8209,moe_ck2stages_gemm1_256x128x128x128_1x4_MulABScaleShuffled_v3_Nswizzle0_Quant3_MulRoutedWeight0_silu_FP4X2_FP4X2_B16,0.0%,2597.4961,flydsl_moe2_afp4_wfp4_bf16_t64x128x256_reduce_sbm128,0.2%,3937.317,0,1649.34,1255.55,
256,2048,7168,512,385,9,ActivationType.Silu,torch.bfloat16,torch.float4_e2m1fn_x2,torch.float4_e2m1fn_x2,QuantType.per_1x32,1,0,64,0,290.6519,moe_ck2stages_gemm1_256x64x128x128_1x4_MulABScaleShuffled_v3_Nswizzle0_Quant3_MulRoutedWeight0_silu_FP4X2_FP4X2_B16,0.0,351.8324,moe_ck2stages_gemm2_64x64x128x128_1x1_MulABScaleExpertWeightShuffled_v3_Nswizzle0_Quant3_MulRoutedWeight1_FP4X2_FP4X2_B16,0.0284,642.4843,0,0.0,0.0,flydsl_fallback
256,4096,7168,512,385,9,ActivationType.Silu,torch.bfloat16,torch.float4_e2m1fn_x2,torch.float4_e2m1fn_x2,QuantType.per_1x32,1,0,32,0,473.317,moe_ck2stages_gemm1_256x32x128x128_1x4_MulABScaleShuffled_v3_Nswizzle0_Quant3_MulRoutedWeight0_silu_FP4X2_FP4X2_B16,0.0,530.5079,moe_ck2stages_gemm2_64x32x32x128_1x1_MulABScaleExpertWeightShuffled_v1_Nswizzle0_Quant3_MulRoutedWeight1_FP4X2_FP4X2_B16,0.0284,1003.8249,0,0.0,0.0,flydsl_fallback
256,8192,7168,512,385,9,ActivationType.Silu,torch.bfloat16,torch.float4_e2m1fn_x2,torch.float4_e2m1fn_x2,QuantType.per_1x32,1,0,64,0,536.5642,moe_ck2stages_gemm1_256x64x128x128_1x4_MulABScaleShuffled_v3_Nswizzle0_Quant3_MulRoutedWeight0_silu_FP4X2_FP4X2_B16,0.0,1016.8039,moe_ck2stages_gemm2_64x64x128x128_1x1_MulABScaleExpertWeightShuffled_v3_Nswizzle0_Quant3_MulRoutedWeight1_FP4X2_FP4X2_B16,0.0284,1553.3681,0,0.0,0.0,flydsl_fallback
256,16384,7168,512,385,9,ActivationType.Silu,torch.bfloat16,torch.float4_e2m1fn_x2,torch.float4_e2m1fn_x2,QuantType.per_1x32,1,0,64,0,873.5785,moe_ck2stages_gemm1_256x64x128x128_1x4_MulABScaleShuffled_v3_Nswizzle0_Quant3_MulRoutedWeight0_silu_FP4X2_FP4X2_B16,0.0,2056.7812,moe_ck2stages_gemm2_64x64x128x128_1x1_MulABScaleExpertWeightShuffled_v3_Nswizzle0_Quant3_MulRoutedWeight1_FP4X2_FP4X2_B16,0.0285,2930.3597,0,0.0,0.0,flydsl_fallback
256,32768,7168,512,385,9,ActivationType.Silu,torch.bfloat16,torch.float4_e2m1fn_x2,torch.float4_e2m1fn_x2,QuantType.per_1x32,1,0,64,0,1657.502,moe_ck2stages_gemm1_256x64x128x128_1x4_MulABScaleShuffled_v3_Nswizzle0_Quant3_MulRoutedWeight0_silu_FP4X2_FP4X2_B16,0.0,4158.1849,moe_ck2stages_gemm2_64x64x128x128_1x1_MulABScaleExpertWeightShuffled_v3_Nswizzle0_Quant3_MulRoutedWeight1_FP4X2_FP4X2_B16,0.0285,5815.6869,0,0.0,0.0,flydsl_fallback
