aiter/configs/model_configs/kimik2_bf16_tuned_gemm.csv
cu_num,M,N,K,bias,dtype,outdtype,scaleAB,bpreshuffle,libtype,solidx,splitK,us,kernelName,err_ratio,tflops,bw
256,1,2112,7168,False,torch.bfloat16,torch.bfloat16,False,False,flydsl,39,16,9.3501,flydsl_gemm2_abf16_wbf16_bf16_t32x64x64_split_k16_block_m_warp2_block_n_warp2_async_copyTrue_b_to_ldsTrue_b_preshuffleFalse_c_to_ldsFalse_gfx950,0.0,3.24,3240.19
256,2,2112,7168,False,torch.bfloat16,torch.bfloat16,False,False,flydsl,39,16,9.3766,flydsl_gemm2_abf16_wbf16_bf16_t32x64x64_split_k16_block_m_warp2_block_n_warp2_async_copyTrue_b_to_ldsTrue_b_preshuffleFalse_c_to_ldsFalse_gfx950,0.0,6.46,3233.03
256,4,2112,7168,False,torch.bfloat16,torch.bfloat16,False,False,flydsl,39,16,9.7801,flydsl_gemm2_abf16_wbf16_bf16_t32x64x64_split_k16_block_m_warp2_block_n_warp2_async_copyTrue_b_to_ldsTrue_b_preshuffleFalse_c_to_ldsFalse_gfx950,0.0,12.38,3103.42
256,8,2112,7168,False,torch.bfloat16,torch.bfloat16,False,False,flydsl,217,8,10.621,flydsl_gemm2_abf16_wbf16_bf16_t32x64x128_split_k8_block_m_warp2_block_n_warp2_async_copyTrue_b_to_ldsTrue_b_preshuffleFalse_c_to_ldsFalse_gfx950,0.0,22.81,2864.71
256,16,2112,7168,False,torch.bfloat16,torch.bfloat16,False,False,flydsl,217,8,11.4248,flydsl_gemm2_abf16_wbf16_bf16_t32x64x128_split_k8_block_m_warp2_block_n_warp2_async_copyTrue_b_to_ldsTrue_b_preshuffleFalse_c_to_ldsFalse_gfx950,0.0,42.4,2676.17
256,24,2112,7168,False,torch.bfloat16,torch.bfloat16,False,False,flydsl,217,8,12.3343,flydsl_gemm2_abf16_wbf16_bf16_t32x64x128_split_k8_block_m_warp2_block_n_warp2_async_copyTrue_b_to_ldsTrue_b_preshuffleFalse_c_to_ldsFalse_gfx950,0.0,58.91,2490.87
256,32,2112,7168,False,torch.bfloat16,torch.bfloat16,False,False,flydsl,217,8,13.276,flydsl_gemm2_abf16_wbf16_bf16_t32x64x128_split_k8_block_m_warp2_block_n_warp2_async_copyTrue_b_to_ldsTrue_b_preshuffleFalse_c_to_ldsFalse_gfx950,0.0,72.98,2325.36
256,40,2112,7168,False,torch.bfloat16,torch.bfloat16,False,False,asm,3,7,14.3139,_ZN5aiter39bf16gemm_fp32bf16_tn_48x64_splitk_cleanE,0.0194,84.61,2167.13
256,48,2112,7168,False,torch.bfloat16,torch.bfloat16,False,False,asm,3,6,14.6708,_ZN5aiter39bf16gemm_fp32bf16_tn_48x64_splitk_cleanE,0.018,99.06,2124.53
256,56,2112,7168,False,torch.bfloat16,torch.bfloat16,False,False,asm,5,6,15.0293,_ZN5aiter39bf16gemm_fp32bf16_tn_64x64_splitk_cleanE,0.0176,112.82,2083.73
256,64,2112,7168,False,torch.bfloat16,torch.bfloat16,False,False,asm,5,6,14.6227,_ZN5aiter39bf16gemm_fp32bf16_tn_64x64_splitk_cleanE,0.018,132.52,2151.82
256,72,2112,7168,False,torch.bfloat16,torch.bfloat16,False,False,asm,8,7,15.0844,_ZN5aiter39bf16gemm_fp32bf16_tn_96x64_splitk_cleanE,0.0198,144.52,2095.8
256,80,2112,7168,False,torch.bfloat16,torch.bfloat16,False,False,asm,7,6,15.8189,_ZN5aiter39bf16gemm_fp32bf16_tn_80x64_splitk_cleanE,0.0175,153.12,2007.88
256,88,2112,7168,False,torch.bfloat16,torch.bfloat16,False,False,asm,8,7,16.1244,_ZN5aiter39bf16gemm_fp32bf16_tn_96x64_splitk_cleanE,0.02,165.24,1979.04
256,96,2112,7168,False,torch.bfloat16,torch.bfloat16,False,False,asm,8,6,16.1623,_ZN5aiter39bf16gemm_fp32bf16_tn_96x64_splitk_cleanE,0.0181,179.84,1983.59
256,112,2112,7168,False,torch.bfloat16,torch.bfloat16,False,False,asm,5,3,19.5749,_ZN5aiter39bf16gemm_fp32bf16_tn_64x64_splitk_cleanE,0.0104,173.24,1652.95
256,128,2112,7168,False,torch.bfloat16,torch.bfloat16,False,False,asm,5,3,19.9118,_ZN5aiter39bf16gemm_fp32bf16_tn_64x64_splitk_cleanE,0.0105,194.64,1639.9
256,136,2112,7168,False,torch.bfloat16,torch.bfloat16,False,False,asm,7,3,20.2326,_ZN5aiter39bf16gemm_fp32bf16_tn_80x64_splitk_cleanE,0.0106,203.52,1621.23
256,144,2112,7168,False,torch.bfloat16,torch.bfloat16,False,False,asm,7,3,20.2948,_ZN5aiter39bf16gemm_fp32bf16_tn_80x64_splitk_cleanE,0.0106,214.83,1623.58
256,256,2112,7168,False,torch.bfloat16,torch.bfloat16,False,False,asm,8,2,28.5227,_ZN5aiter39bf16gemm_fp32bf16_tn_96x64_splitk_cleanE,0.006,271.75,1228.11
256,360,2112,7168,False,torch.bfloat16,torch.bfloat16,False,False,asm,6,1,43.3357,_ZN5aiter37bf16gemm_fp32bf16_tn_64x64_pf3_splitkE,0.0,251.52,852.86
256,368,2112,7168,False,torch.bfloat16,torch.bfloat16,False,False,asm,6,1,44.0418,_ZN5aiter37bf16gemm_fp32bf16_tn_64x64_pf3_splitkE,0.0,252.99,842.56
256,376,2112,7168,False,torch.bfloat16,torch.bfloat16,False,False,asm,6,1,43.5006,_ZN5aiter37bf16gemm_fp32bf16_tn_64x64_pf3_splitkE,0.0,261.71,856.45
256,384,2112,7168,False,torch.bfloat16,torch.bfloat16,False,False,asm,6,1,44.2105,_ZN5aiter37bf16gemm_fp32bf16_tn_64x64_pf3_splitkE,0.0,262.98,846.06
256,1,3072,1536,False,torch.bfloat16,torch.bfloat16,False,False,flydsl,37,8,6.6176,flydsl_gemm2_abf16_wbf16_bf16_t32x64x64_split_k8_block_m_warp2_block_n_warp2_async_copyTrue_b_to_ldsTrue_b_preshuffleFalse_c_to_ldsFalse_gfx950,0.0,1.43,1427.47
256,2,3072,1536,False,torch.bfloat16,torch.bfloat16,False,False,flydsl,37,8,6.2737,flydsl_gemm2_abf16_wbf16_bf16_t32x64x64_split_k8_block_m_warp2_block_n_warp2_async_copyTrue_b_to_ldsTrue_b_preshuffleFalse_c_to_ldsFalse_gfx950,0.0,3.01,1507.18
256,4,3072,1536,False,torch.bfloat16,torch.bfloat16,False,False,flydsl,37,8,6.3438,flydsl_gemm2_abf16_wbf16_bf16_t32x64x64_split_k8_block_m_warp2_block_n_warp2_async_copyTrue_b_to_ldsTrue_b_preshuffleFalse_c_to_ldsFalse_gfx950,0.0,5.95,1493.43
256,8,3072,1536,False,torch.bfloat16,torch.bfloat16,False,False,flydsl,215,4,6.6059,flydsl_gemm2_abf16_wbf16_bf16_t32x64x128_split_k4_block_m_warp2_block_n_warp2_async_copyTrue_b_to_ldsTrue_b_preshuffleFalse_c_to_ldsFalse_gfx950,0.0,11.43,1439.75
256,16,3072,1536,False,torch.bfloat16,torch.bfloat16,False,False,flydsl,215,4,6.7587,flydsl_gemm2_abf16_wbf16_bf16_t32x64x128_split_k4_block_m_warp2_block_n_warp2_async_copyTrue_b_to_ldsTrue_b_preshuffleFalse_c_to_ldsFalse_gfx950,0.0,22.34,1418.12
256,24,3072,1536,False,torch.bfloat16,torch.bfloat16,False,False,flydsl,215,4,7.3113,flydsl_gemm2_abf16_wbf16_bf16_t32x64x128_split_k4_block_m_warp2_block_n_warp2_async_copyTrue_b_to_ldsTrue_b_preshuffleFalse_c_to_ldsFalse_gfx950,0.0,30.98,1321.03
256,32,3072,1536,False,torch.bfloat16,torch.bfloat16,False,False,flydsl,215,4,7.9776,flydsl_gemm2_abf16_wbf16_bf16_t32x64x128_split_k4_block_m_warp2_block_n_warp2_async_copyTrue_b_to_ldsTrue_b_preshuffleFalse_c_to_ldsFalse_gfx950,0.0,37.85,1219.92
256,48,3072,1536,False,torch.bfloat16,torch.bfloat16,False,False,asm,3,3,9.043,_ZN5aiter39bf16gemm_fp32bf16_tn_48x64_splitk_cleanE,0.0058,50.09,1092.51
256,64,3072,1536,False,torch.bfloat16,torch.bfloat16,False,False,asm,1,2,9.2107,_ZN5aiter39bf16gemm_fp32bf16_tn_32x64_splitk_cleanE,0.0027,65.57,1088.63
256,80,3072,1536,False,torch.bfloat16,torch.bfloat16,False,False,asm,7,4,9.3113,_ZN5aiter39bf16gemm_fp32bf16_tn_80x64_splitk_cleanE,0.0076,81.08,1092.7
256,96,3072,1536,False,torch.bfloat16,torch.bfloat16,False,False,asm,8,4,9.668,_ZN5aiter39bf16gemm_fp32bf16_tn_96x64_splitk_cleanE,0.0076,93.71,1067.64
256,112,3072,1536,False,torch.bfloat16,torch.bfloat16,False,False,asm,7,2,10.0235,_ZN5aiter39bf16gemm_fp32bf16_tn_80x64_splitk_cleanE,0.0028,105.45,1044.48
256,128,3072,1536,False,torch.bfloat16,torch.bfloat16,False,False,asm,5,2,10.3007,_ZN5aiter39bf16gemm_fp32bf16_tn_64x64_splitk_cleanE,0.0028,117.27,1030.69
256,176,3072,1536,False,torch.bfloat16,torch.bfloat16,False,False,asm,8,2,10.6186,_ZN5aiter39bf16gemm_fp32bf16_tn_96x64_splitk_cleanE,0.0028,156.42,1041.49
256,184,3072,1536,False,torch.bfloat16,torch.bfloat16,False,False,asm,8,2,11.3581,_ZN5aiter39bf16gemm_fp32bf16_tn_96x64_splitk_cleanE,0.0028,152.88,980.18
256,192,3072,1536,False,torch.bfloat16,torch.bfloat16,False,False,asm,8,2,11.3328,_ZN5aiter39bf16gemm_fp32bf16_tn_96x64_splitk_cleanE,0.0028,159.88,988.87
256,256,3072,1536,False,torch.bfloat16,torch.bfloat16,False,False,asm,6,1,12.3141,_ZN5aiter37bf16gemm_fp32bf16_tn_64x64_pf3_splitkE,0.0,196.19,957.97
256,1,4096,512,False,torch.bfloat16,torch.bfloat16,False,False,triton,0,0,4.4851,auto,0.0,0.94,937.22
256,2,4096,512,False,torch.bfloat16,torch.bfloat16,False,False,triton,0,0,5.0614,auto,0.0,1.66,832.33
256,24,4096,512,False,torch.bfloat16,torch.bfloat16,False,False,triton,0,0,4.4326,auto,0.0,22.71,996.14
256,32,4096,512,False,torch.bfloat16,torch.bfloat16,False,False,triton,0,0,4.5855,auto,0.0,29.27,979.0
256,40,4096,512,False,torch.bfloat16,torch.bfloat16,False,False,triton,0,0,5.5363,auto,0.0,30.3,824.19
256,48,4096,512,False,torch.bfloat16,torch.bfloat16,False,False,flydsl,211,1,6.4199,flydsl_gemm2_abf16_wbf16_bf16_t32x64x128_split_k1_block_m_warp2_block_n_warp2_async_copyTrue_b_to_ldsTrue_b_preshuffleFalse_c_to_ldsFalse_gfx950,0.0,31.36,722.24
256,56,4096,512,False,torch.bfloat16,torch.bfloat16,False,False,flydsl,211,1,6.4325,flydsl_gemm2_abf16_wbf16_bf16_t32x64x128_split_k1_block_m_warp2_block_n_warp2_async_copyTrue_b_to_ldsTrue_b_preshuffleFalse_c_to_ldsFalse_gfx950,0.0,36.51,732.28
256,64,4096,512,False,torch.bfloat16,torch.bfloat16,False,False,triton,0,0,5.0343,auto,0.0,53.32,950.31
256,80,4096,512,False,torch.bfloat16,torch.bfloat16,False,False,flydsl,211,1,5.9722,flydsl_gemm2_abf16_wbf16_bf16_t32x64x128_split_k1_block_m_warp2_block_n_warp2_async_copyTrue_b_to_ldsTrue_b_preshuffleFalse_c_to_ldsFalse_gfx950,0.0,56.18,825.76
256,88,4096,512,False,torch.bfloat16,torch.bfloat16,False,False,flydsl,211,1,6.0027,flydsl_gemm2_abf16_wbf16_bf16_t32x64x128_split_k1_block_m_warp2_block_n_warp2_async_copyTrue_b_to_ldsTrue_b_preshuffleFalse_c_to_ldsFalse_gfx950,0.0,61.49,833.84
256,96,4096,512,False,torch.bfloat16,torch.bfloat16,False,False,flydsl,211,1,6.2717,flydsl_gemm2_abf16_wbf16_bf16_t32x64x128_split_k1_block_m_warp2_block_n_warp2_async_copyTrue_b_to_ldsTrue_b_preshuffleFalse_c_to_ldsFalse_gfx950,0.0,64.2,809.83
256,104,4096,512,False,torch.bfloat16,torch.bfloat16,False,False,flydsl,211,1,6.3442,flydsl_gemm2_abf16_wbf16_bf16_t32x64x128_split_k1_block_m_warp2_block_n_warp2_async_copyTrue_b_to_ldsTrue_b_preshuffleFalse_c_to_ldsFalse_gfx950,0.0,68.76,812.2
256,112,4096,512,False,torch.bfloat16,torch.bfloat16,False,False,asm,2,1,6.1142,_ZN5aiter37bf16gemm_fp32bf16_tn_32x64_pf3_splitkE,0.0,76.83,854.81
256,120,4096,512,False,torch.bfloat16,torch.bfloat16,False,False,flydsl,211,1,6.4135,flydsl_gemm2_abf16_wbf16_bf16_t32x64x128_split_k1_block_m_warp2_block_n_warp2_async_copyTrue_b_to_ldsTrue_b_preshuffleFalse_c_to_ldsFalse_gfx950,0.0,78.48,826.42
256,128,4096,512,False,torch.bfloat16,torch.bfloat16,False,False,triton,0,0,5.7015,auto,0.0,94.16,942.55
256,136,4096,512,False,torch.bfloat16,torch.bfloat16,False,False,asm,4,1,6.4072,_ZN5aiter37bf16gemm_fp32bf16_tn_48x64_pf3_splitkE,0.0,89.03,850.24
256,144,4096,512,False,torch.bfloat16,torch.bfloat16,False,False,flydsl,211,1,6.6452,flydsl_gemm2_abf16_wbf16_bf16_t32x64x128_split_k1_block_m_warp2_block_n_warp2_async_copyTrue_b_to_ldsTrue_b_preshuffleFalse_c_to_ldsFalse_gfx950,0.0,90.89,830.88
256,152,4096,512,False,torch.bfloat16,torch.bfloat16,False,False,flydsl,211,1,6.6893,flydsl_gemm2_abf16_wbf16_bf16_t32x64x128_split_k1_block_m_warp2_block_n_warp2_async_copyTrue_b_to_ldsTrue_b_preshuffleFalse_c_to_ldsFalse_gfx950,0.0,95.31,836.44
256,160,4096,512,False,torch.bfloat16,torch.bfloat16,False,False,flydsl,211,1,6.7174,flydsl_gemm2_abf16_wbf16_bf16_t32x64x128_split_k1_block_m_warp2_block_n_warp2_async_copyTrue_b_to_ldsTrue_b_preshuffleFalse_c_to_ldsFalse_gfx950,0.0,99.9,843.91
256,168,4096,512,False,torch.bfloat16,torch.bfloat16,False,False,flydsl,211,1,6.7783,flydsl_gemm2_abf16_wbf16_bf16_t32x64x128_split_k1_block_m_warp2_block_n_warp2_async_copyTrue_b_to_ldsTrue_b_preshuffleFalse_c_to_ldsFalse_gfx950,0.0,103.96,847.21
256,176,4096,512,False,torch.bfloat16,torch.bfloat16,False,False,flydsl,211,1,6.8942,flydsl_gemm2_abf16_wbf16_bf16_t32x64x128_split_k1_block_m_warp2_block_n_warp2_async_copyTrue_b_to_ldsTrue_b_preshuffleFalse_c_to_ldsFalse_gfx950,0.0,107.08,843.66
256,184,4096,512,False,torch.bfloat16,torch.bfloat16,False,False,flydsl,211,1,6.846,flydsl_gemm2_abf16_wbf16_bf16_t32x64x128_split_k1_block_m_warp2_block_n_warp2_async_copyTrue_b_to_ldsTrue_b_preshuffleFalse_c_to_ldsFalse_gfx950,0.0,112.73,860.36
256,192,4096,512,False,torch.bfloat16,torch.bfloat16,False,False,flydsl,211,1,6.9534,flydsl_gemm2_abf16_wbf16_bf16_t32x64x128_split_k1_block_m_warp2_block_n_warp2_async_copyTrue_b_to_ldsTrue_b_preshuffleFalse_c_to_ldsFalse_gfx950,0.0,115.82,857.68
256,200,4096,512,False,torch.bfloat16,torch.bfloat16,False,False,flydsl,271,1,7.149,flydsl_gemm2_abf16_wbf16_bf16_t64x64x128_split_k1_block_m_warp2_block_n_warp2_async_copyTrue_b_to_ldsTrue_b_preshuffleFalse_c_to_ldsFalse_gfx950,0.0,117.34,844.53
256,208,4096,512,False,torch.bfloat16,torch.bfloat16,False,False,flydsl,271,1,7.1306,flydsl_gemm2_abf16_wbf16_bf16_t64x64x128_split_k1_block_m_warp2_block_n_warp2_async_copyTrue_b_to_ldsTrue_b_preshuffleFalse_c_to_ldsFalse_gfx950,0.0,122.35,857.04
256,216,4096,512,False,torch.bfloat16,torch.bfloat16,False,False,flydsl,271,1,7.1338,flydsl_gemm2_abf16_wbf16_bf16_t64x64x128_split_k1_block_m_warp2_block_n_warp2_async_copyTrue_b_to_ldsTrue_b_preshuffleFalse_c_to_ldsFalse_gfx950,0.0,127.0,867.0
256,224,4096,512,False,torch.bfloat16,torch.bfloat16,False,False,flydsl,271,1,7.1669,flydsl_gemm2_abf16_wbf16_bf16_t64x64x128_split_k1_block_m_warp2_block_n_warp2_async_copyTrue_b_to_ldsTrue_b_preshuffleFalse_c_to_ldsFalse_gfx950,0.0,131.09,873.27
256,232,4096,512,False,torch.bfloat16,torch.bfloat16,False,False,flydsl,271,1,7.1636,flydsl_gemm2_abf16_wbf16_bf16_t64x64x128_split_k1_block_m_warp2_block_n_warp2_async_copyTrue_b_to_ldsTrue_b_preshuffleFalse_c_to_ldsFalse_gfx950,0.0,135.84,883.97
256,240,4096,512,False,torch.bfloat16,torch.bfloat16,False,False,asm,6,1,6.8718,_ZN5aiter37bf16gemm_fp32bf16_tn_64x64_pf3_splitkE,0.0,146.49,932.24
256,248,4096,512,False,torch.bfloat16,torch.bfloat16,False,False,flydsl,271,1,7.3464,flydsl_gemm2_abf16_wbf16_bf16_t64x64x128_split_k1_block_m_warp2_block_n_warp2_async_copyTrue_b_to_ldsTrue_b_preshuffleFalse_c_to_ldsFalse_gfx950,0.0,141.59,882.04
256,256,4096,512,False,torch.bfloat16,torch.bfloat16,False,False,asm,6,1,6.8851,_ZN5aiter37bf16gemm_fp32bf16_tn_64x64_pf3_splitkE,0.0,155.95,951.85
256,264,4096,512,False,torch.bfloat16,torch.bfloat16,False,False,flydsl,91,1,8.7723,flydsl_gemm2_abf16_wbf16_bf16_t64x64x64_split_k1_block_m_warp2_block_n_warp2_async_copyTrue_b_to_ldsTrue_b_preshuffleFalse_c_to_ldsFalse_gfx950,0.0,126.23,755.48
256,272,4096,512,False,torch.bfloat16,torch.bfloat16,False,False,flydsl,91,1,8.7224,flydsl_gemm2_abf16_wbf16_bf16_t64x64x64_split_k1_block_m_warp2_block_n_warp2_async_copyTrue_b_to_ldsTrue_b_preshuffleFalse_c_to_ldsFalse_gfx950,0.0,130.8,768.26
256,280,4096,512,False,torch.bfloat16,torch.bfloat16,False,False,flydsl,271,1,7.2951,flydsl_gemm2_abf16_wbf16_bf16_t64x64x128_split_k1_block_m_warp2_block_n_warp2_async_copyTrue_b_to_ldsTrue_b_preshuffleFalse_c_to_ldsFalse_gfx950,0.0,160.99,928.68
256,288,4096,512,False,torch.bfloat16,torch.bfloat16,False,False,flydsl,271,1,7.4172,flydsl_gemm2_abf16_wbf16_bf16_t64x64x128_split_k1_block_m_warp2_block_n_warp2_async_copyTrue_b_to_ldsTrue_b_preshuffleFalse_c_to_ldsFalse_gfx950,0.0,162.86,923.33
256,320,4096,512,False,torch.bfloat16,torch.bfloat16,False,False,flydsl,91,1,8.8313,flydsl_gemm2_abf16_wbf16_bf16_t64x64x64_split_k1_block_m_warp2_block_n_warp2_async_copyTrue_b_to_ldsTrue_b_preshuffleFalse_c_to_ldsFalse_gfx950,0.0,151.98,808.88
256,328,4096,512,False,torch.bfloat16,torch.bfloat16,False,False,flydsl,271,1,7.7361,flydsl_gemm2_abf16_wbf16_bf16_t64x64x128_split_k1_block_m_warp2_block_n_warp2_async_copyTrue_b_to_ldsTrue_b_preshuffleFalse_c_to_ldsFalse_gfx950,0.0,177.83,932.92
256,344,4096,512,False,torch.bfloat16,torch.bfloat16,False,False,flydsl,271,1,7.5668,flydsl_gemm2_abf16_wbf16_bf16_t64x64x128_split_k1_block_m_warp2_block_n_warp2_async_copyTrue_b_to_ldsTrue_b_preshuffleFalse_c_to_ldsFalse_gfx950,0.0,190.68,973.28
256,352,4096,512,False,torch.bfloat16,torch.bfloat16,False,False,asm,9,1,7.7114,_ZN5aiter37bf16gemm_fp32bf16_tn_96x64_pf3_splitkE,0.0,191.46,964.59
256,360,4096,512,False,torch.bfloat16,torch.bfloat16,False,False,flydsl,271,1,7.6848,flydsl_gemm2_abf16_wbf16_bf16_t64x64x128_split_k1_block_m_warp2_block_n_warp2_async_copyTrue_b_to_ldsTrue_b_preshuffleFalse_c_to_ldsFalse_gfx950,0.0,196.49,977.52
256,368,4096,512,False,torch.bfloat16,torch.bfloat16,False,False,flydsl,91,1,9.0153,flydsl_gemm2_abf16_wbf16_bf16_t64x64x64_split_k1_block_m_warp2_block_n_warp2_async_copyTrue_b_to_ldsTrue_b_preshuffleFalse_c_to_ldsFalse_gfx950,0.0,171.21,841.43
256,376,4096,512,False,torch.bfloat16,torch.bfloat16,False,False,flydsl,271,1,7.7297,flydsl_gemm2_abf16_wbf16_bf16_t64x64x128_split_k1_block_m_warp2_block_n_warp2_async_copyTrue_b_to_ldsTrue_b_preshuffleFalse_c_to_ldsFalse_gfx950,0.0,204.03,990.92
256,384,4096,512,False,torch.bfloat16,torch.bfloat16,False,False,flydsl,271,1,7.7945,flydsl_gemm2_abf16_wbf16_bf16_t64x64x128_split_k1_block_m_warp2_block_n_warp2_async_copyTrue_b_to_ldsTrue_b_preshuffleFalse_c_to_ldsFalse_gfx950,0.0,206.64,992.15
256,392,4096,512,False,torch.bfloat16,torch.bfloat16,False,False,flydsl,121,1,9.4617,flydsl_gemm2_abf16_wbf16_bf16_t96x64x64_split_k1_block_m_warp2_block_n_warp2_async_copyTrue_b_to_ldsTrue_b_preshuffleFalse_c_to_ldsFalse_gfx950,0.0,173.77,825.12
256,400,4096,512,False,torch.bfloat16,torch.bfloat16,False,False,flydsl,271,1,8.0566,flydsl_gemm2_abf16_wbf16_bf16_t64x64x128_split_k1_block_m_warp2_block_n_warp2_async_copyTrue_b_to_ldsTrue_b_preshuffleFalse_c_to_ldsFalse_gfx950,0.0,208.24,978.16
256,424,4096,512,False,torch.bfloat16,torch.bfloat16,False,False,flydsl,271,1,8.1302,flydsl_gemm2_abf16_wbf16_bf16_t64x64x128_split_k1_block_m_warp2_block_n_warp2_async_copyTrue_b_to_ldsTrue_b_preshuffleFalse_c_to_ldsFalse_gfx950,0.0,218.74,996.52
256,448,4096,512,False,torch.bfloat16,torch.bfloat16,False,False,flydsl,301,1,8.5161,flydsl_gemm2_abf16_wbf16_bf16_t96x64x128_split_k1_block_m_warp2_block_n_warp2_async_copyTrue_b_to_ldsTrue_b_preshuffleFalse_c_to_ldsFalse_gfx950,0.0,220.65,977.33
256,456,4096,512,False,torch.bfloat16,torch.bfloat16,False,False,flydsl,121,1,9.6885,flydsl_gemm2_abf16_wbf16_bf16_t96x64x64_split_k1_block_m_warp2_block_n_warp2_async_copyTrue_b_to_ldsTrue_b_preshuffleFalse_c_to_ldsFalse_gfx950,0.0,197.41,866.67
256,488,4096,512,False,torch.bfloat16,torch.bfloat16,False,False,flydsl,121,1,9.6501,flydsl_gemm2_abf16_wbf16_bf16_t96x64x64_split_k1_block_m_warp2_block_n_warp2_async_copyTrue_b_to_ldsTrue_b_preshuffleFalse_c_to_ldsFalse_gfx950,0.0,212.1,900.68
256,496,4096,512,False,torch.bfloat16,torch.bfloat16,False,False,flydsl,301,1,8.7233,flydsl_gemm2_abf16_wbf16_bf16_t96x64x128_split_k1_block_m_warp2_block_n_warp2_async_copyTrue_b_to_ldsTrue_b_preshuffleFalse_c_to_ldsFalse_gfx950,0.0,238.49,1004.84
256,1,7168,2048,False,torch.bfloat16,torch.bfloat16,False,False,flydsl,47,8,9.1452,flydsl_gemm2_abf16_wbf16_bf16_t32x128x64_split_k8_block_m_warp2_block_n_warp2_async_copyTrue_b_to_ldsTrue_b_preshuffleFalse_c_to_ldsFalse_gfx950,0.0,3.21,3212.46
256,2,7168,2048,False,torch.bfloat16,torch.bfloat16,False,False,flydsl,47,8,8.7896,flydsl_gemm2_abf16_wbf16_bf16_t32x128x64_split_k8_block_m_warp2_block_n_warp2_async_copyTrue_b_to_ldsTrue_b_preshuffleFalse_c_to_ldsFalse_gfx950,0.0,6.68,3344.52
256,4,7168,2048,False,torch.bfloat16,torch.bfloat16,False,False,flydsl,215,4,8.961,flydsl_gemm2_abf16_wbf16_bf16_t32x64x128_split_k4_block_m_warp2_block_n_warp2_async_copyTrue_b_to_ldsTrue_b_preshuffleFalse_c_to_ldsFalse_gfx950,0.0,13.11,3284.66
256,8,7168,2048,False,torch.bfloat16,torch.bfloat16,False,False,flydsl,215,4,9.4235,flydsl_gemm2_abf16_wbf16_bf16_t32x64x128_split_k4_block_m_warp2_block_n_warp2_async_copyTrue_b_to_ldsTrue_b_preshuffleFalse_c_to_ldsFalse_gfx950,0.0,24.92,3131.27
256,16,7168,2048,False,torch.bfloat16,torch.bfloat16,False,False,triton,0,0,10.6246,auto,0.0,44.21,2791.17
256,32,7168,2048,False,torch.bfloat16,torch.bfloat16,False,False,triton,0,0,11.3815,auto,0.0,82.55,2631.46
256,48,7168,2048,False,torch.bfloat16,torch.bfloat16,False,False,asm,3,2,13.0225,_ZN5aiter39bf16gemm_fp32bf16_tn_48x64_splitk_cleanE,0.0034,108.22,2322.51
256,64,7168,2048,False,torch.bfloat16,torch.bfloat16,False,False,triton,0,0,11.9472,auto,0.0,157.28,2556.23
256,80,7168,2048,False,torch.bfloat16,torch.bfloat16,False,False,asm,7,2,14.0021,_ZN5aiter39bf16gemm_fp32bf16_tn_80x64_splitk_cleanE,0.0034,167.75,2202.15
256,96,7168,2048,False,torch.bfloat16,torch.bfloat16,False,False,asm,8,2,14.2839,_ZN5aiter39bf16gemm_fp32bf16_tn_96x64_splitk_cleanE,0.0034,197.33,2179.35
256,112,7168,2048,False,torch.bfloat16,torch.bfloat16,False,False,asm,6,1,16.1354,_ZN5aiter37bf16gemm_fp32bf16_tn_64x64_pf3_splitkE,0.0,203.8,1947.55
256,128,7168,2048,False,torch.bfloat16,torch.bfloat16,False,False,triton,0,0,15.4031,auto,0.0,243.98,2059.29
256,200,7168,2048,False,torch.bfloat16,torch.bfloat16,False,False,flydsl,301,1,21.0906,flydsl_gemm2_abf16_wbf16_bf16_t96x64x128_split_k1_block_m_warp2_block_n_warp2_async_copyTrue_b_to_ldsTrue_b_preshuffleFalse_c_to_ldsFalse_gfx950,0.0,278.42,1566.89
256,208,7168,2048,False,torch.bfloat16,torch.bfloat16,False,False,flydsl,301,1,21.1448,flydsl_gemm2_abf16_wbf16_bf16_t96x64x128_split_k1_block_m_warp2_block_n_warp2_async_copyTrue_b_to_ldsTrue_b_preshuffleFalse_c_to_ldsFalse_gfx950,0.0,288.81,1569.84
256,216,7168,2048,False,torch.bfloat16,torch.bfloat16,False,False,flydsl,301,1,21.2766,flydsl_gemm2_abf16_wbf16_bf16_t96x64x128_split_k1_block_m_warp2_block_n_warp2_async_copyTrue_b_to_ldsTrue_b_preshuffleFalse_c_to_ldsFalse_gfx950,0.0,298.06,1567.05
256,224,7168,2048,False,torch.bfloat16,torch.bfloat16,False,False,flydsl,301,1,21.381,flydsl_gemm2_abf16_wbf16_bf16_t96x64x128_split_k1_block_m_warp2_block_n_warp2_async_copyTrue_b_to_ldsTrue_b_preshuffleFalse_c_to_ldsFalse_gfx950,0.0,307.59,1566.29
256,232,7168,2048,False,torch.bfloat16,torch.bfloat16,False,False,flydsl,301,1,21.7124,flydsl_gemm2_abf16_wbf16_bf16_t96x64x128_split_k1_block_m_warp2_block_n_warp2_async_copyTrue_b_to_ldsTrue_b_preshuffleFalse_c_to_ldsFalse_gfx950,0.0,313.72,1549.18
256,240,7168,2048,False,torch.bfloat16,torch.bfloat16,False,False,flydsl,301,1,21.7644,flydsl_gemm2_abf16_wbf16_bf16_t96x64x128_split_k1_block_m_warp2_block_n_warp2_async_copyTrue_b_to_ldsTrue_b_preshuffleFalse_c_to_ldsFalse_gfx950,0.0,323.76,1552.25
256,248,7168,2048,False,torch.bfloat16,torch.bfloat16,False,False,flydsl,301,1,21.782,flydsl_gemm2_abf16_wbf16_bf16_t96x64x128_split_k1_block_m_warp2_block_n_warp2_async_copyTrue_b_to_ldsTrue_b_preshuffleFalse_c_to_ldsFalse_gfx950,0.0,334.28,1557.76
256,256,7168,2048,False,torch.bfloat16,torch.bfloat16,False,False,flydsl,301,1,22.1506,flydsl_gemm2_abf16_wbf16_bf16_t96x64x128_split_k1_block_m_warp2_block_n_warp2_async_copyTrue_b_to_ldsTrue_b_preshuffleFalse_c_to_ldsFalse_gfx950,0.0,339.32,1538.5
256,1,384,7168,False,torch.bfloat16,torch.bfloat16,False,False,flydsl,39,16,8.2673,flydsl_gemm2_abf16_wbf16_bf16_t32x64x64_split_k16_block_m_warp2_block_n_warp2_async_copyTrue_b_to_ldsTrue_b_preshuffleFalse_c_to_ldsFalse_gfx950,0.0,0.67,667.7
256,2,384,7168,False,torch.bfloat16,torch.bfloat16,False,False,flydsl,39,16,8.4853,flydsl_gemm2_abf16_wbf16_bf16_t32x64x64_split_k16_block_m_warp2_block_n_warp2_async_copyTrue_b_to_ldsTrue_b_preshuffleFalse_c_to_ldsFalse_gfx950,0.0,1.3,652.33
256,4,384,7168,False,torch.bfloat16,torch.bfloat16,False,False,flydsl,39,16,8.3665,flydsl_gemm2_abf16_wbf16_bf16_t32x64x64_split_k16_block_m_warp2_block_n_warp2_async_copyTrue_b_to_ldsTrue_b_preshuffleFalse_c_to_ldsFalse_gfx950,0.0,2.63,665.2
256,8,384,7168,False,torch.bfloat16,torch.bfloat16,False,False,flydsl,39,16,8.6306,flydsl_gemm2_abf16_wbf16_bf16_t32x64x64_split_k16_block_m_warp2_block_n_warp2_async_copyTrue_b_to_ldsTrue_b_preshuffleFalse_c_to_ldsFalse_gfx950,0.0,5.1,651.85
256,16,384,7168,False,torch.bfloat16,torch.bfloat16,False,False,flydsl,39,16,8.6867,flydsl_gemm2_abf16_wbf16_bf16_t32x64x64_split_k16_block_m_warp2_block_n_warp2_async_copyTrue_b_to_ldsTrue_b_preshuffleFalse_c_to_ldsFalse_gfx950,0.0,10.14,661.55
256,24,384,7168,False,torch.bfloat16,torch.bfloat16,False,False,flydsl,39,16,8.7444,flydsl_gemm2_abf16_wbf16_bf16_t32x64x64_split_k16_block_m_warp2_block_n_warp2_async_copyTrue_b_to_ldsTrue_b_preshuffleFalse_c_to_ldsFalse_gfx950,0.0,15.11,671.0
256,32,384,7168,False,torch.bfloat16,torch.bfloat16,False,False,flydsl,39,16,8.8861,flydsl_gemm2_abf16_wbf16_bf16_t32x64x64_split_k16_block_m_warp2_block_n_warp2_async_copyTrue_b_to_ldsTrue_b_preshuffleFalse_c_to_ldsFalse_gfx950,0.0,19.82,673.9
256,40,384,7168,False,torch.bfloat16,torch.bfloat16,False,False,flydsl,39,16,9.4432,flydsl_gemm2_abf16_wbf16_bf16_t32x64x64_split_k16_block_m_warp2_block_n_warp2_async_copyTrue_b_to_ldsTrue_b_preshuffleFalse_c_to_ldsFalse_gfx950,0.0,23.32,646.94
256,48,384,7168,False,torch.bfloat16,torch.bfloat16,False,False,flydsl,217,8,9.8912,flydsl_gemm2_abf16_wbf16_bf16_t32x64x128_split_k8_block_m_warp2_block_n_warp2_async_copyTrue_b_to_ldsTrue_b_preshuffleFalse_c_to_ldsFalse_gfx950,0.0,26.71,629.85
256,56,384,7168,False,torch.bfloat16,torch.bfloat16,False,False,flydsl,217,8,9.8987,flydsl_gemm2_abf16_wbf16_bf16_t32x64x128_split_k8_block_m_warp2_block_n_warp2_async_copyTrue_b_to_ldsTrue_b_preshuffleFalse_c_to_ldsFalse_gfx950,0.0,31.14,641.58
256,64,384,7168,False,torch.bfloat16,torch.bfloat16,False,False,flydsl,217,8,10.11,flydsl_gemm2_abf16_wbf16_bf16_t32x64x128_split_k8_block_m_warp2_block_n_warp2_async_copyTrue_b_to_ldsTrue_b_preshuffleFalse_c_to_ldsFalse_gfx950,0.0,34.85,640.12
256,72,384,7168,False,torch.bfloat16,torch.bfloat16,False,False,flydsl,217,8,10.0269,flydsl_gemm2_abf16_wbf16_bf16_t32x64x128_split_k8_block_m_warp2_block_n_warp2_async_copyTrue_b_to_ldsTrue_b_preshuffleFalse_c_to_ldsFalse_gfx950,0.0,39.53,657.48
256,80,384,7168,False,torch.bfloat16,torch.bfloat16,False,False,flydsl,277,8,10.8589,flydsl_gemm2_abf16_wbf16_bf16_t64x64x128_split_k8_block_m_warp2_block_n_warp2_async_copyTrue_b_to_ldsTrue_b_preshuffleFalse_c_to_ldsFalse_gfx950,0.0,40.56,618.23
256,88,384,7168,False,torch.bfloat16,torch.bfloat16,False,False,flydsl,217,8,10.9286,flydsl_gemm2_abf16_wbf16_bf16_t32x64x128_split_k8_block_m_warp2_block_n_warp2_async_copyTrue_b_to_ldsTrue_b_preshuffleFalse_c_to_ldsFalse_gfx950,0.0,44.33,625.35
256,96,384,7168,False,torch.bfloat16,torch.bfloat16,False,False,flydsl,277,8,11.4666,flydsl_gemm2_abf16_wbf16_bf16_t64x64x128_split_k8_block_m_warp2_block_n_warp2_async_copyTrue_b_to_ldsTrue_b_preshuffleFalse_c_to_ldsFalse_gfx950,0.0,46.09,606.55
256,104,384,7168,False,torch.bfloat16,torch.bfloat16,False,False,flydsl,217,8,10.8052,flydsl_gemm2_abf16_wbf16_bf16_t32x64x128_split_k8_block_m_warp2_block_n_warp2_async_copyTrue_b_to_ldsTrue_b_preshuffleFalse_c_to_ldsFalse_gfx950,0.0,52.99,654.85
256,112,384,7168,False,torch.bfloat16,torch.bfloat16,False,False,flydsl,217,8,10.9637,flydsl_gemm2_abf16_wbf16_bf16_t32x64x128_split_k8_block_m_warp2_block_n_warp2_async_copyTrue_b_to_ldsTrue_b_preshuffleFalse_c_to_ldsFalse_gfx950,0.0,56.24,656.41
256,120,384,7168,False,torch.bfloat16,torch.bfloat16,False,False,flydsl,217,8,10.9485,flydsl_gemm2_abf16_wbf16_bf16_t32x64x128_split_k8_block_m_warp2_block_n_warp2_async_copyTrue_b_to_ldsTrue_b_preshuffleFalse_c_to_ldsFalse_gfx950,0.0,60.34,668.36
256,136,384,7168,False,torch.bfloat16,torch.bfloat16,False,False,asm,7,8,12.5129,_ZN5aiter39bf16gemm_fp32bf16_tn_80x64_splitk_cleanE,0.0225,59.83,604.11
256,168,384,7168,False,torch.bfloat16,torch.bfloat16,False,False,asm,8,10,12.8567,_ZN5aiter39bf16gemm_fp32bf16_tn_96x64_splitk_cleanE,0.0248,71.93,625.55
256,176,384,7168,False,torch.bfloat16,torch.bfloat16,False,False,asm,8,8,12.9456,_ZN5aiter39bf16gemm_fp32bf16_tn_96x64_splitk_cleanE,0.0218,74.84,630.59
256,184,384,7168,False,torch.bfloat16,torch.bfloat16,False,False,asm,8,8,12.4417,_ZN5aiter39bf16gemm_fp32bf16_tn_96x64_splitk_cleanE,0.0218,81.41,665.84
256,192,384,7168,False,torch.bfloat16,torch.bfloat16,False,False,asm,8,9,13.1416,_ZN5aiter39bf16gemm_fp32bf16_tn_96x64_splitk_cleanE,0.023,80.43,639.57
256,200,384,7168,False,torch.bfloat16,torch.bfloat16,False,False,flydsl,277,8,13.3939,flydsl_gemm2_abf16_wbf16_bf16_t64x64x128_split_k8_block_m_warp2_block_n_warp2_async_copyTrue_b_to_ldsTrue_b_preshuffleFalse_c_to_ldsFalse_gfx950,0.0,82.2,636.55
256,208,384,7168,False,torch.bfloat16,torch.bfloat16,False,False,flydsl,277,8,13.6897,flydsl_gemm2_abf16_wbf16_bf16_t64x64x128_split_k8_block_m_warp2_block_n_warp2_async_copyTrue_b_to_ldsTrue_b_preshuffleFalse_c_to_ldsFalse_gfx950,0.0,83.64,631.62
256,216,384,7168,False,torch.bfloat16,torch.bfloat16,False,False,flydsl,277,8,14.0595,flydsl_gemm2_abf16_wbf16_bf16_t64x64x128_split_k8_block_m_warp2_block_n_warp2_async_copyTrue_b_to_ldsTrue_b_preshuffleFalse_c_to_ldsFalse_gfx950,0.0,84.58,623.6
256,224,384,7168,False,torch.bfloat16,torch.bfloat16,False,False,asm,5,7,13.7138,_ZN5aiter39bf16gemm_fp32bf16_tn_64x64_splitk_cleanE,0.0206,89.92,648.13
256,232,384,7168,False,torch.bfloat16,torch.bfloat16,False,False,asm,3,6,13.7502,_ZN5aiter39bf16gemm_fp32bf16_tn_48x64_splitk_cleanE,0.0185,92.88,655.2
256,240,384,7168,False,torch.bfloat16,torch.bfloat16,False,False,asm,3,6,13.205,_ZN5aiter39bf16gemm_fp32bf16_tn_48x64_splitk_cleanE,0.0184,100.05,691.4
256,248,384,7168,False,torch.bfloat16,torch.bfloat16,False,False,asm,3,6,13.0434,_ZN5aiter39bf16gemm_fp32bf16_tn_48x64_splitk_cleanE,0.0188,104.67,709.23
256,256,384,7168,False,torch.bfloat16,torch.bfloat16,False,False,asm,3,6,13.9448,_ZN5aiter39bf16gemm_fp32bf16_tn_48x64_splitk_cleanE,0.0188,101.06,672.05
256,264,384,7168,False,torch.bfloat16,torch.bfloat16,False,False,asm,3,6,13.997,_ZN5aiter39bf16gemm_fp32bf16_tn_48x64_splitk_cleanE,0.0187,103.83,678.18
256,272,384,7168,False,torch.bfloat16,torch.bfloat16,False,False,asm,3,6,14.0363,_ZN5aiter39bf16gemm_fp32bf16_tn_48x64_splitk_cleanE,0.0186,106.68,684.89
256,280,384,7168,False,torch.bfloat16,torch.bfloat16,False,False,asm,5,7,14.0317,_ZN5aiter39bf16gemm_fp32bf16_tn_64x64_splitk_cleanE,0.0203,109.85,693.73
256,288,384,7168,False,torch.bfloat16,torch.bfloat16,False,False,asm,7,7,14.1267,_ZN5aiter39bf16gemm_fp32bf16_tn_80x64_splitk_cleanE,0.02,112.23,697.61
256,296,384,7168,False,torch.bfloat16,torch.bfloat16,False,False,asm,5,6,14.0558,_ZN5aiter39bf16gemm_fp32bf16_tn_64x64_splitk_cleanE,0.0187,115.93,709.73
256,304,384,7168,False,torch.bfloat16,torch.bfloat16,False,False,asm,7,7,14.1491,_ZN5aiter39bf16gemm_fp32bf16_tn_80x64_splitk_cleanE,0.0193,118.28,713.59
256,312,384,7168,False,torch.bfloat16,torch.bfloat16,False,False,asm,3,6,14.0362,_ZN5aiter39bf16gemm_fp32bf16_tn_48x64_splitk_cleanE,0.0186,122.37,727.94
256,320,384,7168,False,torch.bfloat16,torch.bfloat16,False,False,asm,3,6,13.5745,_ZN5aiter39bf16gemm_fp32bf16_tn_48x64_splitk_cleanE,0.019,129.77,761.6
256,328,384,7168,False,torch.bfloat16,torch.bfloat16,False,False,asm,3,5,14.1857,_ZN5aiter39bf16gemm_fp32bf16_tn_48x64_splitk_cleanE,0.0159,127.29,737.3
256,336,384,7168,False,torch.bfloat16,torch.bfloat16,False,False,asm,3,6,13.618,_ZN5aiter39bf16gemm_fp32bf16_tn_48x64_splitk_cleanE,0.0189,135.83,776.91
256,344,384,7168,False,torch.bfloat16,torch.bfloat16,False,False,asm,5,6,14.3843,_ZN5aiter39bf16gemm_fp32bf16_tn_64x64_splitk_cleanE,0.0185,131.65,743.92
256,352,384,7168,False,torch.bfloat16,torch.bfloat16,False,False,asm,5,6,14.1549,_ZN5aiter39bf16gemm_fp32bf16_tn_64x64_splitk_cleanE,0.0187,136.9,764.51
256,360,384,7168,False,torch.bfloat16,torch.bfloat16,False,False,asm,3,5,14.5417,_ZN5aiter39bf16gemm_fp32bf16_tn_48x64_splitk_cleanE,0.0161,136.28,752.49
256,368,384,7168,False,torch.bfloat16,torch.bfloat16,False,False,asm,7,6,14.5374,_ZN5aiter39bf16gemm_fp32bf16_tn_80x64_splitk_cleanE,0.0185,139.35,761.02
256,376,384,7168,False,torch.bfloat16,torch.bfloat16,False,False,asm,7,6,14.6245,_ZN5aiter39bf16gemm_fp32bf16_tn_80x64_splitk_cleanE,0.0186,141.54,764.75
256,384,384,7168,False,torch.bfloat16,torch.bfloat16,False,False,asm,5,6,14.5723,_ZN5aiter39bf16gemm_fp32bf16_tn_64x64_splitk_cleanE,0.0188,145.06,775.78
256,392,384,7168,False,torch.bfloat16,torch.bfloat16,False,False,asm,5,5,14.6161,_ZN5aiter39bf16gemm_fp32bf16_tn_64x64_splitk_cleanE,0.0162,147.64,781.73
256,400,384,7168,False,torch.bfloat16,torch.bfloat16,False,False,asm,5,5,14.3612,_ZN5aiter39bf16gemm_fp32bf16_tn_64x64_splitk_cleanE,0.0162,153.33,804.02
256,408,384,7168,False,torch.bfloat16,torch.bfloat16,False,False,asm,5,5,14.7061,_ZN5aiter39bf16gemm_fp32bf16_tn_64x64_splitk_cleanE,0.0162,152.73,793.38
256,416,384,7168,False,torch.bfloat16,torch.bfloat16,False,False,asm,5,5,14.7836,_ZN5aiter39bf16gemm_fp32bf16_tn_64x64_splitk_cleanE,0.0162,154.91,797.39
256,424,384,7168,False,torch.bfloat16,torch.bfloat16,False,False,asm,5,5,14.7904,_ZN5aiter39bf16gemm_fp32bf16_tn_64x64_splitk_cleanE,0.0164,157.81,805.19
256,432,384,7168,False,torch.bfloat16,torch.bfloat16,False,False,asm,5,5,14.9919,_ZN5aiter39bf16gemm_fp32bf16_tn_64x64_splitk_cleanE,0.0162,158.63,802.43
256,440,384,7168,False,torch.bfloat16,torch.bfloat16,False,False,asm,5,5,14.8858,_ZN5aiter39bf16gemm_fp32bf16_tn_64x64_splitk_cleanE,0.0163,162.72,816.27
256,448,384,7168,False,torch.bfloat16,torch.bfloat16,False,False,asm,5,5,15.0895,_ZN5aiter39bf16gemm_fp32bf16_tn_64x64_splitk_cleanE,0.0161,163.44,813.26
256,456,384,7168,False,torch.bfloat16,torch.bfloat16,False,False,asm,5,5,15.2088,_ZN5aiter39bf16gemm_fp32bf16_tn_64x64_splitk_cleanE,0.0163,165.06,814.82
256,464,384,7168,False,torch.bfloat16,torch.bfloat16,False,False,asm,5,5,15.177,_ZN5aiter39bf16gemm_fp32bf16_tn_64x64_splitk_cleanE,0.0162,168.3,824.49
256,472,384,7168,False,torch.bfloat16,torch.bfloat16,False,False,asm,5,5,15.3007,_ZN5aiter39bf16gemm_fp32bf16_tn_64x64_splitk_cleanE,0.0162,169.82,825.72
256,480,384,7168,False,torch.bfloat16,torch.bfloat16,False,False,asm,5,5,15.346,_ZN5aiter39bf16gemm_fp32bf16_tn_64x64_splitk_cleanE,0.0161,172.19,831.16
256,488,384,7168,False,torch.bfloat16,torch.bfloat16,False,False,asm,7,5,15.5019,_ZN5aiter39bf16gemm_fp32bf16_tn_80x64_splitk_cleanE,0.0163,173.3,830.59
256,496,384,7168,False,torch.bfloat16,torch.bfloat16,False,False,asm,5,5,15.4961,_ZN5aiter39bf16gemm_fp32bf16_tn_64x64_splitk_cleanE,0.0162,176.21,838.7
256,504,384,7168,False,torch.bfloat16,torch.bfloat16,False,False,asm,7,5,15.5376,_ZN5aiter39bf16gemm_fp32bf16_tn_80x64_splitk_cleanE,0.0162,178.57,844.24
256,512,384,7168,False,torch.bfloat16,torch.bfloat16,False,False,asm,5,5,15.6923,_ZN5aiter39bf16gemm_fp32bf16_tn_64x64_splitk_cleanE,0.0161,179.61,843.62
256,1,1024,7168,False,torch.bfloat16,torch.bfloat16,False,False,flydsl,39,16,9.3379,flydsl_gemm2_abf16_wbf16_bf16_t32x64x64_split_k16_block_m_warp2_block_n_warp2_async_copyTrue_b_to_ldsTrue_b_preshuffleFalse_c_to_ldsFalse_gfx950,0.0,1.57,1573.86
256,2,1024,7168,False,torch.bfloat16,torch.bfloat16,False,False,flydsl,39,16,8.8497,flydsl_gemm2_abf16_wbf16_bf16_t32x64x64_split_k16_block_m_warp2_block_n_warp2_async_copyTrue_b_to_ldsTrue_b_preshuffleFalse_c_to_ldsFalse_gfx950,0.0,3.32,1662.53
256,4,1024,7168,False,torch.bfloat16,torch.bfloat16,False,False,flydsl,39,16,9.3436,flydsl_gemm2_abf16_wbf16_bf16_t32x64x64_split_k16_block_m_warp2_block_n_warp2_async_copyTrue_b_to_ldsTrue_b_preshuffleFalse_c_to_ldsFalse_gfx950,0.0,6.28,1578.15
256,8,1024,7168,False,torch.bfloat16,torch.bfloat16,False,False,flydsl,39,16,8.9677,flydsl_gemm2_abf16_wbf16_bf16_t32x64x64_split_k16_block_m_warp2_block_n_warp2_async_copyTrue_b_to_ldsTrue_b_preshuffleFalse_c_to_ldsFalse_gfx950,0.0,13.1,1651.61
256,16,1024,7168,False,torch.bfloat16,torch.bfloat16,False,False,flydsl,39,16,9.005,flydsl_gemm2_abf16_wbf16_bf16_t32x64x64_split_k16_block_m_warp2_block_n_warp2_async_copyTrue_b_to_ldsTrue_b_preshuffleFalse_c_to_ldsFalse_gfx950,0.0,26.08,1659.33
256,24,1024,7168,False,torch.bfloat16,torch.bfloat16,False,False,flydsl,217,8,10.0591,flydsl_gemm2_abf16_wbf16_bf16_t32x64x128_split_k8_block_m_warp2_block_n_warp2_async_copyTrue_b_to_ldsTrue_b_preshuffleFalse_c_to_ldsFalse_gfx950,0.0,35.02,1498.47
256,32,1024,7168,False,torch.bfloat16,torch.bfloat16,False,False,flydsl,217,8,10.3083,flydsl_gemm2_abf16_wbf16_bf16_t32x64x128_split_k8_block_m_warp2_block_n_warp2_async_copyTrue_b_to_ldsTrue_b_preshuffleFalse_c_to_ldsFalse_gfx950,0.0,45.57,1474.96
256,40,1024,7168,False,torch.bfloat16,torch.bfloat16,False,False,flydsl,217,8,10.9422,flydsl_gemm2_abf16_wbf16_bf16_t32x64x128_split_k8_block_m_warp2_block_n_warp2_async_copyTrue_b_to_ldsTrue_b_preshuffleFalse_c_to_ldsFalse_gfx950,0.0,53.66,1401.49
256,72,1024,7168,False,torch.bfloat16,torch.bfloat16,False,False,asm,3,6,13.7492,_ZN5aiter39bf16gemm_fp32bf16_tn_48x64_splitk_cleanE,0.0174,76.87,1153.5
256,80,1024,7168,False,torch.bfloat16,torch.bfloat16,False,False,asm,3,6,13.5885,_ZN5aiter39bf16gemm_fp32bf16_tn_48x64_splitk_cleanE,0.0179,86.43,1176.79
256,88,1024,7168,False,torch.bfloat16,torch.bfloat16,False,False,asm,1,5,13.9756,_ZN5aiter39bf16gemm_fp32bf16_tn_32x64_splitk_cleanE,0.0162,92.44,1153.57
256,96,1024,7168,False,torch.bfloat16,torch.bfloat16,False,False,asm,3,6,13.8999,_ZN5aiter39bf16gemm_fp32bf16_tn_48x64_splitk_cleanE,0.0181,101.39,1169.28
256,104,1024,7168,False,torch.bfloat16,torch.bfloat16,False,False,asm,3,5,14.1683,_ZN5aiter39bf16gemm_fp32bf16_tn_48x64_splitk_cleanE,0.0157,107.76,1156.38
256,112,1024,7168,False,torch.bfloat16,torch.bfloat16,False,False,asm,7,7,14.2858,_ZN5aiter39bf16gemm_fp32bf16_tn_80x64_splitk_cleanE,0.0203,115.09,1156.05
256,120,1024,7168,False,torch.bfloat16,torch.bfloat16,False,False,asm,5,6,14.4044,_ZN5aiter39bf16gemm_fp32bf16_tn_64x64_splitk_cleanE,0.0182,122.3,1155.63
256,128,1024,7168,False,torch.bfloat16,torch.bfloat16,False,False,asm,5,7,14.3206,_ZN5aiter39bf16gemm_fp32bf16_tn_64x64_splitk_cleanE,0.0202,131.21,1171.54
256,136,1024,7168,False,torch.bfloat16,torch.bfloat16,False,False,asm,7,7,14.5367,_ZN5aiter39bf16gemm_fp32bf16_tn_80x64_splitk_cleanE,0.0202,137.34,1163.14
256,144,1024,7168,False,torch.bfloat16,torch.bfloat16,False,False,asm,3,5,14.7263,_ZN5aiter39bf16gemm_fp32bf16_tn_48x64_splitk_cleanE,0.0162,143.55,1157.07
256,152,1024,7168,False,torch.bfloat16,torch.bfloat16,False,False,asm,5,5,14.8838,_ZN5aiter39bf16gemm_fp32bf16_tn_64x64_splitk_cleanE,0.0162,149.92,1153.63
256,160,1024,7168,False,torch.bfloat16,torch.bfloat16,False,False,asm,5,5,14.8739,_ZN5aiter39bf16gemm_fp32bf16_tn_64x64_splitk_cleanE,0.0159,157.91,1163.21
256,168,1024,7168,False,torch.bfloat16,torch.bfloat16,False,False,asm,5,5,15.2068,_ZN5aiter39bf16gemm_fp32bf16_tn_64x64_splitk_cleanE,0.016,162.18,1146.37
256,176,1024,7168,False,torch.bfloat16,torch.bfloat16,False,False,asm,5,5,15.105,_ZN5aiter39bf16gemm_fp32bf16_tn_64x64_splitk_cleanE,0.0163,171.05,1162.77
256,184,1024,7168,False,torch.bfloat16,torch.bfloat16,False,False,asm,5,5,15.2228,_ZN5aiter39bf16gemm_fp32bf16_tn_64x64_splitk_cleanE,0.0161,177.44,1162.38
256,192,1024,7168,False,torch.bfloat16,torch.bfloat16,False,False,asm,5,5,14.6664,_ZN5aiter39bf16gemm_fp32bf16_tn_64x64_splitk_cleanE,0.0162,192.18,1215.42
256,200,1024,7168,False,torch.bfloat16,torch.bfloat16,False,False,asm,7,5,15.3582,_ZN5aiter39bf16gemm_fp32bf16_tn_80x64_splitk_cleanE,0.0161,191.17,1169.2
256,208,1024,7168,False,torch.bfloat16,torch.bfloat16,False,False,asm,7,5,15.6999,_ZN5aiter39bf16gemm_fp32bf16_tn_80x64_splitk_cleanE,0.0163,194.49,1152.11
256,216,1024,7168,False,torch.bfloat16,torch.bfloat16,False,False,asm,7,5,15.6515,_ZN5aiter39bf16gemm_fp32bf16_tn_80x64_splitk_cleanE,0.0161,202.59,1164.04
256,224,1024,7168,False,torch.bfloat16,torch.bfloat16,False,False,asm,7,5,15.7154,_ZN5aiter39bf16gemm_fp32bf16_tn_80x64_splitk_cleanE,0.0162,209.24,1167.65
256,232,1024,7168,False,torch.bfloat16,torch.bfloat16,False,False,asm,8,5,16.0842,_ZN5aiter39bf16gemm_fp32bf16_tn_96x64_splitk_cleanE,0.0162,211.75,1149.03
256,240,1024,7168,False,torch.bfloat16,torch.bfloat16,False,False,asm,7,5,15.9649,_ZN5aiter39bf16gemm_fp32bf16_tn_80x64_splitk_cleanE,0.0162,220.69,1165.82
256,248,1024,7168,False,torch.bfloat16,torch.bfloat16,False,False,asm,8,5,16.3657,_ZN5aiter39bf16gemm_fp32bf16_tn_96x64_splitk_cleanE,0.0162,222.46,1145.28
256,256,1024,7168,False,torch.bfloat16,torch.bfloat16,False,False,asm,8,5,16.2678,_ZN5aiter39bf16gemm_fp32bf16_tn_96x64_splitk_cleanE,0.0162,231.01,1160.23
256,264,1024,7168,False,torch.bfloat16,torch.bfloat16,False,False,asm,8,5,16.3531,_ZN5aiter39bf16gemm_fp32bf16_tn_96x64_splitk_cleanE,0.0164,236.99,1162.19
256,272,1024,7168,False,torch.bfloat16,torch.bfloat16,False,False,asm,8,5,16.465,_ZN5aiter39bf16gemm_fp32bf16_tn_96x64_splitk_cleanE,0.0162,242.51,1162.25
256,280,1024,7168,False,torch.bfloat16,torch.bfloat16,False,False,asm,8,5,16.6496,_ZN5aiter39bf16gemm_fp32bf16_tn_96x64_splitk_cleanE,0.0164,246.88,1157.24
256,288,1024,7168,False,torch.bfloat16,torch.bfloat16,False,False,asm,8,5,17.1636,_ZN5aiter39bf16gemm_fp32bf16_tn_96x64_splitk_cleanE,0.0162,246.33,1130.22
256,296,1024,7168,False,torch.bfloat16,torch.bfloat16,False,False,asm,7,4,17.3667,_ZN5aiter39bf16gemm_fp32bf16_tn_80x64_splitk_cleanE,0.0138,250.21,1124.55
256,304,1024,7168,False,torch.bfloat16,torch.bfloat16,False,False,asm,7,4,17.623,_ZN5aiter39bf16gemm_fp32bf16_tn_80x64_splitk_cleanE,0.0137,253.23,1115.63
256,312,1024,7168,False,torch.bfloat16,torch.bfloat16,False,False,asm,7,4,17.8372,_ZN5aiter39bf16gemm_fp32bf16_tn_80x64_splitk_cleanE,0.0138,256.78,1109.58
256,320,1024,7168,False,torch.bfloat16,torch.bfloat16,False,False,asm,7,4,17.7354,_ZN5aiter39bf16gemm_fp32bf16_tn_80x64_splitk_cleanE,0.0138,264.87,1123.34
256,328,1024,7168,False,torch.bfloat16,torch.bfloat16,False,False,asm,8,4,18.226,_ZN5aiter39bf16gemm_fp32bf16_tn_96x64_splitk_cleanE,0.0137,264.19,1100.3
256,336,1024,7168,False,torch.bfloat16,torch.bfloat16,False,False,asm,8,4,18.1608,_ZN5aiter39bf16gemm_fp32bf16_tn_96x64_splitk_cleanE,0.0139,271.6,1111.46
256,344,1024,7168,False,torch.bfloat16,torch.bfloat16,False,False,asm,8,4,18.5378,_ZN5aiter39bf16gemm_fp32bf16_tn_96x64_splitk_cleanE,0.0137,272.41,1095.93
256,352,1024,7168,False,torch.bfloat16,torch.bfloat16,False,False,asm,8,4,18.2392,_ZN5aiter39bf16gemm_fp32bf16_tn_96x64_splitk_cleanE,0.0137,283.31,1121.06
256,360,1024,7168,False,torch.bfloat16,torch.bfloat16,False,False,asm,8,4,18.675,_ZN5aiter39bf16gemm_fp32bf16_tn_96x64_splitk_cleanE,0.0137,282.99,1101.92
256,368,1024,7168,False,torch.bfloat16,torch.bfloat16,False,False,asm,8,4,18.8126,_ZN5aiter39bf16gemm_fp32bf16_tn_96x64_splitk_cleanE,0.0138,287.16,1100.82
256,376,1024,7168,False,torch.bfloat16,torch.bfloat16,False,False,asm,8,4,18.9182,_ZN5aiter39bf16gemm_fp32bf16_tn_96x64_splitk_cleanE,0.0139,291.77,1101.61
256,384,1024,7168,False,torch.bfloat16,torch.bfloat16,False,False,asm,8,4,18.9243,_ZN5aiter39bf16gemm_fp32bf16_tn_96x64_splitk_cleanE,0.0138,297.88,1108.18
256,392,1024,7168,False,torch.bfloat16,torch.bfloat16,False,False,asm,7,3,20.4007,_ZN5aiter39bf16gemm_fp32bf16_tn_80x64_splitk_cleanE,0.0105,282.08,1034.41
256,400,1024,7168,False,torch.bfloat16,torch.bfloat16,False,False,asm,7,3,20.3122,_ZN5aiter39bf16gemm_fp32bf16_tn_80x64_splitk_cleanE,0.0106,289.09,1045.37
256,2,7168,512,False,torch.bfloat16,torch.bfloat16,False,False,triton,0,0,4.9943,auto,0.0,2.94,1475.83
256,4,7168,512,False,torch.bfloat16,torch.bfloat16,False,False,triton,0,0,4.9934,auto,0.0,5.88,1482.25
256,8,7168,512,False,torch.bfloat16,torch.bfloat16,False,False,triton,0,0,5.5511,auto,0.0,10.58,1344.4
256,16,7168,512,False,torch.bfloat16,torch.bfloat16,False,False,triton,0,0,4.7742,auto,0.0,24.6,1588.91
256,24,7168,512,False,torch.bfloat16,torch.bfloat16,False,False,triton,0,0,5.4124,auto,0.0,32.55,1424.26
256,32,7168,512,False,torch.bfloat16,torch.bfloat16,False,False,triton,0,0,4.9819,auto,0.0,47.15,1572.0
256,40,7168,512,False,torch.bfloat16,torch.bfloat16,False,False,triton,0,0,6.0779,auto,0.0,48.31,1308.75
256,48,7168,512,False,torch.bfloat16,torch.bfloat16,False,False,flydsl,211,1,6.8419,flydsl_gemm2_abf16_wbf16_bf16_t32x64x128_split_k1_block_m_warp2_block_n_warp2_async_copyTrue_b_to_ldsTrue_b_preshuffleFalse_c_to_ldsFalse_gfx950,0.0,51.49,1180.56
256,56,7168,512,False,torch.bfloat16,torch.bfloat16,False,False,flydsl,211,1,6.4529,flydsl_gemm2_abf16_wbf16_bf16_t32x64x128_split_k1_block_m_warp2_block_n_warp2_async_copyTrue_b_to_ldsTrue_b_preshuffleFalse_c_to_ldsFalse_gfx950,0.0,63.7,1270.77
256,64,7168,512,False,torch.bfloat16,torch.bfloat16,False,False,triton,0,0,6.0235,auto,0.0,77.99,1381.77
256,72,7168,512,False,torch.bfloat16,torch.bfloat16,False,False,asm,4,1,6.6035,_ZN5aiter37bf16gemm_fp32bf16_tn_48x64_pf3_splitkE,0.0,80.03,1279.01
256,80,7168,512,False,torch.bfloat16,torch.bfloat16,False,False,flydsl,211,1,6.8698,flydsl_gemm2_abf16_wbf16_bf16_t32x64x128_split_k1_block_m_warp2_block_n_warp2_async_copyTrue_b_to_ldsTrue_b_preshuffleFalse_c_to_ldsFalse_gfx950,0.0,85.48,1247.32
256,96,7168,512,False,torch.bfloat16,torch.bfloat16,False,False,flydsl,211,1,7.3467,flydsl_gemm2_abf16_wbf16_bf16_t32x64x128_split_k1_block_m_warp2_block_n_warp2_async_copyTrue_b_to_ldsTrue_b_preshuffleFalse_c_to_ldsFalse_gfx950,0.0,95.91,1199.81
256,104,7168,512,False,torch.bfloat16,torch.bfloat16,False,False,flydsl,271,1,7.4742,flydsl_gemm2_abf16_wbf16_bf16_t64x64x128_split_k1_block_m_warp2_block_n_warp2_async_copyTrue_b_to_ldsTrue_b_preshuffleFalse_c_to_ldsFalse_gfx950,0.0,102.13,1195.77
256,112,7168,512,False,torch.bfloat16,torch.bfloat16,False,False,asm,6,1,6.9158,_ZN5aiter37bf16gemm_fp32bf16_tn_64x64_pf3_splitkE,0.0,118.87,1310.09
256,128,7168,512,False,torch.bfloat16,torch.bfloat16,False,False,triton,0,0,6.8915,auto,0.0,136.33,1350.38
256,136,7168,512,False,torch.bfloat16,torch.bfloat16,False,False,flydsl,271,1,7.6068,flydsl_gemm2_abf16_wbf16_bf16_t64x64x128_split_k1_block_m_warp2_block_n_warp2_async_copyTrue_b_to_ldsTrue_b_preshuffleFalse_c_to_ldsFalse_gfx950,0.0,131.23,1239.54
256,144,7168,512,False,torch.bfloat16,torch.bfloat16,False,False,flydsl,301,1,8.197,flydsl_gemm2_abf16_wbf16_bf16_t96x64x128_split_k1_block_m_warp2_block_n_warp2_async_copyTrue_b_to_ldsTrue_b_preshuffleFalse_c_to_ldsFalse_gfx950,0.0,128.94,1165.28
256,152,7168,512,False,torch.bfloat16,torch.bfloat16,False,False,flydsl,301,1,8.213,flydsl_gemm2_abf16_wbf16_bf16_t96x64x128_split_k1_block_m_warp2_block_n_warp2_async_copyTrue_b_to_ldsTrue_b_preshuffleFalse_c_to_ldsFalse_gfx950,0.0,135.84,1177.99
256,160,7168,512,False,torch.bfloat16,torch.bfloat16,False,False,flydsl,271,1,7.7499,flydsl_gemm2_abf16_wbf16_bf16_t64x64x128_split_k1_block_m_warp2_block_n_warp2_async_copyTrue_b_to_ldsTrue_b_preshuffleFalse_c_to_ldsFalse_gfx950,0.0,151.54,1264.22
256,168,7168,512,False,torch.bfloat16,torch.bfloat16,False,False,flydsl,271,1,7.951,flydsl_gemm2_abf16_wbf16_bf16_t64x64x128_split_k1_block_m_warp2_block_n_warp2_async_copyTrue_b_to_ldsTrue_b_preshuffleFalse_c_to_ldsFalse_gfx950,0.0,155.09,1247.7
256,192,7168,512,False,torch.bfloat16,torch.bfloat16,False,False,flydsl,271,1,7.9723,flydsl_gemm2_abf16_wbf16_bf16_t64x64x128_split_k1_block_m_warp2_block_n_warp2_async_copyTrue_b_to_ldsTrue_b_preshuffleFalse_c_to_ldsFalse_gfx950,0.0,176.77,1290.61
256,208,7168,512,False,torch.bfloat16,torch.bfloat16,False,False,flydsl,271,1,8.4509,flydsl_gemm2_abf16_wbf16_bf16_t64x64x128_split_k1_block_m_warp2_block_n_warp2_async_copyTrue_b_to_ldsTrue_b_preshuffleFalse_c_to_ldsFalse_gfx950,0.0,180.66,1246.6
256,224,7168,512,False,torch.bfloat16,torch.bfloat16,False,False,flydsl,271,1,8.5706,flydsl_gemm2_abf16_wbf16_bf16_t64x64x128_split_k1_block_m_warp2_block_n_warp2_async_copyTrue_b_to_ldsTrue_b_preshuffleFalse_c_to_ldsFalse_gfx950,0.0,191.84,1257.86
256,240,7168,512,False,torch.bfloat16,torch.bfloat16,False,False,flydsl,271,1,8.7346,flydsl_gemm2_abf16_wbf16_bf16_t64x64x128_split_k1_block_m_warp2_block_n_warp2_async_copyTrue_b_to_ldsTrue_b_preshuffleFalse_c_to_ldsFalse_gfx950,0.0,201.68,1262.38
256,248,7168,512,False,torch.bfloat16,torch.bfloat16,False,False,flydsl,331,1,8.8966,flydsl_gemm2_abf16_wbf16_bf16_t128x64x128_split_k1_block_m_warp2_block_n_warp2_async_copyTrue_b_to_ldsTrue_b_preshuffleFalse_c_to_ldsFalse_gfx950,0.0,204.61,1253.21
256,264,7168,512,False,torch.bfloat16,torch.bfloat16,False,False,flydsl,121,1,9.9865,flydsl_gemm2_abf16_wbf16_bf16_t96x64x64_split_k1_block_m_warp2_block_n_warp2_async_copyTrue_b_to_ldsTrue_b_preshuffleFalse_c_to_ldsFalse_gfx950,0.0,194.04,1141.04
256,272,7168,512,False,torch.bfloat16,torch.bfloat16,False,False,flydsl,121,1,9.9672,flydsl_gemm2_abf16_wbf16_bf16_t96x64x64_split_k1_block_m_warp2_block_n_warp2_async_copyTrue_b_to_ldsTrue_b_preshuffleFalse_c_to_ldsFalse_gfx950,0.0,200.31,1155.58
256,280,7168,512,False,torch.bfloat16,torch.bfloat16,False,False,flydsl,121,1,10.2274,flydsl_gemm2_abf16_wbf16_bf16_t96x64x64_split_k1_block_m_warp2_block_n_warp2_async_copyTrue_b_to_ldsTrue_b_preshuffleFalse_c_to_ldsFalse_gfx950,0.0,200.95,1138.21
256,288,7168,512,False,torch.bfloat16,torch.bfloat16,False,False,flydsl,301,1,9.0197,flydsl_gemm2_abf16_wbf16_bf16_t96x64x128_split_k1_block_m_warp2_block_n_warp2_async_copyTrue_b_to_ldsTrue_b_preshuffleFalse_c_to_ldsFalse_gfx950,0.0,234.37,1304.22
256,296,7168,512,False,torch.bfloat16,torch.bfloat16,False,False,flydsl,121,1,10.3616,flydsl_gemm2_abf16_wbf16_bf16_t96x64x64_split_k1_block_m_warp2_block_n_warp2_async_copyTrue_b_to_ldsTrue_b_preshuffleFalse_c_to_ldsFalse_gfx950,0.0,209.68,1147.17
256,304,7168,512,False,torch.bfloat16,torch.bfloat16,False,False,flydsl,301,1,9.6502,flydsl_gemm2_abf16_wbf16_bf16_t96x64x128_split_k1_block_m_warp2_block_n_warp2_async_copyTrue_b_to_ldsTrue_b_preshuffleFalse_c_to_ldsFalse_gfx950,0.0,231.22,1244.47
256,312,7168,512,False,torch.bfloat16,torch.bfloat16,False,False,flydsl,121,1,10.7268,flydsl_gemm2_abf16_wbf16_bf16_t96x64x64_split_k1_block_m_warp2_block_n_warp2_async_copyTrue_b_to_ldsTrue_b_preshuffleFalse_c_to_ldsFalse_gfx950,0.0,213.49,1131.04
256,320,7168,512,False,torch.bfloat16,torch.bfloat16,False,False,flydsl,301,1,9.3945,flydsl_gemm2_abf16_wbf16_bf16_t96x64x128_split_k1_block_m_warp2_block_n_warp2_async_copyTrue_b_to_ldsTrue_b_preshuffleFalse_c_to_ldsFalse_gfx950,0.0,250.02,1304.51
256,328,7168,512,False,torch.bfloat16,torch.bfloat16,False,False,flydsl,301,1,9.5916,flydsl_gemm2_abf16_wbf16_bf16_t96x64x128_split_k1_block_m_warp2_block_n_warp2_async_copyTrue_b_to_ldsTrue_b_preshuffleFalse_c_to_ldsFalse_gfx950,0.0,251.0,1290.52
256,336,7168,512,False,torch.bfloat16,torch.bfloat16,False,False,flydsl,121,1,10.4197,flydsl_gemm2_abf16_wbf16_bf16_t96x64x64_split_k1_block_m_warp2_block_n_warp2_async_copyTrue_b_to_ldsTrue_b_preshuffleFalse_c_to_ldsFalse_gfx950,0.0,236.69,1199.75
256,344,7168,512,False,torch.bfloat16,torch.bfloat16,False,False,flydsl,121,1,10.943,flydsl_gemm2_abf16_wbf16_bf16_t96x64x64_split_k1_block_m_warp2_block_n_warp2_async_copyTrue_b_to_ldsTrue_b_preshuffleFalse_c_to_ldsFalse_gfx950,0.0,230.74,1153.6
256,352,7168,512,False,torch.bfloat16,torch.bfloat16,False,False,flydsl,301,1,9.997,flydsl_gemm2_abf16_wbf16_bf16_t96x64x128_split_k1_block_m_warp2_block_n_warp2_async_copyTrue_b_to_ldsTrue_b_preshuffleFalse_c_to_ldsFalse_gfx950,0.0,258.45,1275.05
256,360,7168,512,False,torch.bfloat16,torch.bfloat16,False,False,flydsl,121,1,10.6719,flydsl_gemm2_abf16_wbf16_bf16_t96x64x64_split_k1_block_m_warp2_block_n_warp2_async_copyTrue_b_to_ldsTrue_b_preshuffleFalse_c_to_ldsFalse_gfx950,0.0,247.6,1205.94
256,368,7168,512,False,torch.bfloat16,torch.bfloat16,False,False,flydsl,301,1,10.1456,flydsl_gemm2_abf16_wbf16_bf16_t96x64x128_split_k1_block_m_warp2_block_n_warp2_async_copyTrue_b_to_ldsTrue_b_preshuffleFalse_c_to_ldsFalse_gfx950,0.0,266.24,1280.6
256,376,7168,512,False,torch.bfloat16,torch.bfloat16,False,False,flydsl,301,1,10.2371,flydsl_gemm2_abf16_wbf16_bf16_t96x64x128_split_k1_block_m_warp2_block_n_warp2_async_copyTrue_b_to_ldsTrue_b_preshuffleFalse_c_to_ldsFalse_gfx950,0.0,269.59,1281.17
256,384,7168,512,False,torch.bfloat16,torch.bfloat16,False,False,flydsl,301,1,10.0111,flydsl_gemm2_abf16_wbf16_bf16_t96x64x128_split_k1_block_m_warp2_block_n_warp2_async_copyTrue_b_to_ldsTrue_b_preshuffleFalse_c_to_ldsFalse_gfx950,0.0,281.55,1322.36
256,392,7168,512,False,torch.bfloat16,torch.bfloat16,False,False,flydsl,151,1,11.2829,flydsl_gemm2_abf16_wbf16_bf16_t128x64x64_split_k1_block_m_warp2_block_n_warp2_async_copyTrue_b_to_ldsTrue_b_preshuffleFalse_c_to_ldsFalse_gfx950,0.0,255.01,1184.2
256,400,7168,512,False,torch.bfloat16,torch.bfloat16,False,False,flydsl,151,1,11.445,flydsl_gemm2_abf16_wbf16_bf16_t128x64x64_split_k1_block_m_warp2_block_n_warp2_async_copyTrue_b_to_ldsTrue_b_preshuffleFalse_c_to_ldsFalse_gfx950,0.0,256.53,1178.16
256,408,7168,512,False,torch.bfloat16,torch.bfloat16,False,False,flydsl,151,1,11.167,flydsl_gemm2_abf16_wbf16_bf16_t128x64x64_split_k1_block_m_warp2_block_n_warp2_async_copyTrue_b_to_ldsTrue_b_preshuffleFalse_c_to_ldsFalse_gfx950,0.0,268.18,1218.49
256,416,7168,512,False,torch.bfloat16,torch.bfloat16,False,False,flydsl,151,1,11.2953,flydsl_gemm2_abf16_wbf16_bf16_t128x64x64_split_k1_block_m_warp2_block_n_warp2_async_copyTrue_b_to_ldsTrue_b_preshuffleFalse_c_to_ldsFalse_gfx950,0.0,270.33,1215.53
256,424,7168,512,False,torch.bfloat16,torch.bfloat16,False,False,flydsl,151,1,11.3604,flydsl_gemm2_abf16_wbf16_bf16_t128x64x64_split_k1_block_m_warp2_block_n_warp2_async_copyTrue_b_to_ldsTrue_b_preshuffleFalse_c_to_ldsFalse_gfx950,0.0,273.95,1219.39
256,432,7168,512,False,torch.bfloat16,torch.bfloat16,False,False,flydsl,151,1,11.8201,flydsl_gemm2_abf16_wbf16_bf16_t128x64x64_split_k1_block_m_warp2_block_n_warp2_async_copyTrue_b_to_ldsTrue_b_preshuffleFalse_c_to_ldsFalse_gfx950,0.0,268.26,1182.35
256,440,7168,512,False,torch.bfloat16,torch.bfloat16,False,False,flydsl,151,1,11.8181,flydsl_gemm2_abf16_wbf16_bf16_t128x64x64_split_k1_block_m_warp2_block_n_warp2_async_copyTrue_b_to_ldsTrue_b_preshuffleFalse_c_to_ldsFalse_gfx950,0.0,273.28,1192.95
256,448,7168,512,False,torch.bfloat16,torch.bfloat16,False,False,flydsl,151,1,11.7373,flydsl_gemm2_abf16_wbf16_bf16_t128x64x64_split_k1_block_m_warp2_block_n_warp2_async_copyTrue_b_to_ldsTrue_b_preshuffleFalse_c_to_ldsFalse_gfx950,0.0,280.16,1211.64
256,456,7168,512,False,torch.bfloat16,torch.bfloat16,False,False,flydsl,151,1,11.7334,flydsl_gemm2_abf16_wbf16_bf16_t128x64x64_split_k1_block_m_warp2_block_n_warp2_async_copyTrue_b_to_ldsTrue_b_preshuffleFalse_c_to_ldsFalse_gfx950,0.0,285.26,1222.51
256,464,7168,512,False,torch.bfloat16,torch.bfloat16,False,False,flydsl,151,1,11.7426,flydsl_gemm2_abf16_wbf16_bf16_t128x64x64_split_k1_block_m_warp2_block_n_warp2_async_copyTrue_b_to_ldsTrue_b_preshuffleFalse_c_to_ldsFalse_gfx950,0.0,290.04,1232.02
256,472,7168,512,False,torch.bfloat16,torch.bfloat16,False,False,flydsl,151,1,11.5632,flydsl_gemm2_abf16_wbf16_bf16_t128x64x64_split_k1_block_m_warp2_block_n_warp2_async_copyTrue_b_to_ldsTrue_b_preshuffleFalse_c_to_ldsFalse_gfx950,0.0,299.61,1261.75
256,480,7168,512,False,torch.bfloat16,torch.bfloat16,False,False,flydsl,151,1,12.0183,flydsl_gemm2_abf16_wbf16_bf16_t128x64x64_split_k1_block_m_warp2_block_n_warp2_async_copyTrue_b_to_ldsTrue_b_preshuffleFalse_c_to_ldsFalse_gfx950,0.0,293.15,1224.2
256,488,7168,512,False,torch.bfloat16,torch.bfloat16,False,False,flydsl,151,1,11.9779,flydsl_gemm2_abf16_wbf16_bf16_t128x64x64_split_k1_block_m_warp2_block_n_warp2_async_copyTrue_b_to_ldsTrue_b_preshuffleFalse_c_to_ldsFalse_gfx950,0.0,299.05,1238.59
256,496,7168,512,False,torch.bfloat16,torch.bfloat16,False,False,flydsl,151,1,12.0544,flydsl_gemm2_abf16_wbf16_bf16_t128x64x64_split_k1_block_m_warp2_block_n_warp2_async_copyTrue_b_to_ldsTrue_b_preshuffleFalse_c_to_ldsFalse_gfx950,0.0,302.02,1240.92
256,504,7168,512,False,torch.bfloat16,torch.bfloat16,False,False,flydsl,151,1,11.7306,flydsl_gemm2_abf16_wbf16_bf16_t128x64x64_split_k1_block_m_warp2_block_n_warp2_async_copyTrue_b_to_ldsTrue_b_preshuffleFalse_c_to_ldsFalse_gfx950,0.0,315.36,1285.66
256,512,7168,512,False,torch.bfloat16,torch.bfloat16,False,False,flydsl,151,1,11.9822,flydsl_gemm2_abf16_wbf16_bf16_t128x64x64_split_k1_block_m_warp2_block_n_warp2_async_copyTrue_b_to_ldsTrue_b_preshuffleFalse_c_to_ldsFalse_gfx950,0.0,313.64,1268.91
256,144,384,7168,False,torch.bfloat16,torch.bfloat16,False,False,asm,7,10,12.5466,_ZN5aiter39bf16gemm_fp32bf16_tn_80x64_splitk_cleanE,0.0241,63.18,612.12
256,152,384,7168,False,torch.bfloat16,torch.bfloat16,False,False,asm,7,8,12.6565,_ZN5aiter39bf16gemm_fp32bf16_tn_80x64_splitk_cleanE,0.0222,66.11,616.35
256,160,384,7168,False,torch.bfloat16,torch.bfloat16,False,False,asm,7,9,12.8035,_ZN5aiter39bf16gemm_fp32bf16_tn_80x64_splitk_cleanE,0.0224,68.79,618.71
256,456,1024,7168,False,torch.bfloat16,torch.bfloat16,False,False,asm,8,3,21.5821,_ZN5aiter39bf16gemm_fp32bf16_tn_96x64_splitk_cleanE,0.0107,310.17,1026.37
256,464,1024,7168,False,torch.bfloat16,torch.bfloat16,False,False,asm,8,3,21.6839,_ZN5aiter39bf16gemm_fp32bf16_tn_96x64_splitk_cleanE,0.0107,314.13,1027.59
256,472,1024,7168,False,torch.bfloat16,torch.bfloat16,False,False,asm,8,3,21.9029,_ZN5aiter39bf16gemm_fp32bf16_tn_96x64_splitk_cleanE,0.0107,316.35,1023.3
256,480,1024,7168,False,torch.bfloat16,torch.bfloat16,False,False,asm,8,3,21.9079,_ZN5aiter39bf16gemm_fp32bf16_tn_96x64_splitk_cleanE,0.0108,321.64,1029.05
256,488,1024,7168,False,torch.bfloat16,torch.bfloat16,False,False,asm,5,2,25.5097,_ZN5aiter39bf16gemm_fp32bf16_tn_64x64_splitk_cleanE,0.0061,280.83,888.9
256,496,1024,7168,False,torch.bfloat16,torch.bfloat16,False,False,asm,5,2,25.6402,_ZN5aiter39bf16gemm_fp32bf16_tn_64x64_splitk_cleanE,0.0061,283.98,889.48
256,504,1024,7168,False,torch.bfloat16,torch.bfloat16,False,False,asm,5,2,25.7917,_ZN5aiter39bf16gemm_fp32bf16_tn_64x64_splitk_cleanE,0.0061,286.87,889.34
256,88,1536,1536,False,torch.bfloat16,torch.bfloat16,False,False,asm,1,3,8.1679,_ZN5aiter39bf16gemm_fp32bf16_tn_32x64_splitk_cleanE,0.0058,50.84,643.89
256,96,1536,1536,False,torch.bfloat16,torch.bfloat16,False,False,asm,1,3,8.2325,_ZN5aiter39bf16gemm_fp32bf16_tn_32x64_splitk_cleanE,0.0058,55.02,644.81
256,168,1536,1536,False,torch.bfloat16,torch.bfloat16,False,False,asm,5,3,8.8181,_ZN5aiter39bf16gemm_fp32bf16_tn_64x64_splitk_cleanE,0.0058,89.9,652.16
256,176,1536,1536,False,torch.bfloat16,torch.bfloat16,False,False,asm,5,3,9.0191,_ZN5aiter39bf16gemm_fp32bf16_tn_64x64_splitk_cleanE,0.0057,92.08,643.07
256,184,1536,1536,False,torch.bfloat16,torch.bfloat16,False,False,asm,5,3,9.0376,_ZN5aiter39bf16gemm_fp32bf16_tn_64x64_splitk_cleanE,0.0057,96.07,647.19
256,192,1536,1536,False,torch.bfloat16,torch.bfloat16,False,False,asm,5,3,8.9939,_ZN5aiter39bf16gemm_fp32bf16_tn_64x64_splitk_cleanE,0.0058,100.73,655.8
256,200,1536,1536,False,torch.bfloat16,torch.bfloat16,False,False,asm,7,3,9.2267,_ZN5aiter39bf16gemm_fp32bf16_tn_80x64_splitk_cleanE,0.0057,102.28,644.58
256,208,1536,1536,False,torch.bfloat16,torch.bfloat16,False,False,asm,7,3,9.3175,_ZN5aiter39bf16gemm_fp32bf16_tn_80x64_splitk_cleanE,0.0058,105.34,643.58
256,216,1536,1536,False,torch.bfloat16,torch.bfloat16,False,False,asm,7,3,9.2818,_ZN5aiter39bf16gemm_fp32bf16_tn_80x64_splitk_cleanE,0.0057,109.81,651.35
256,224,1536,1536,False,torch.bfloat16,torch.bfloat16,False,False,asm,7,3,9.5115,_ZN5aiter39bf16gemm_fp32bf16_tn_80x64_splitk_cleanE,0.0057,111.12,640.79
256,232,1536,1536,False,torch.bfloat16,torch.bfloat16,False,False,asm,8,3,9.6187,_ZN5aiter39bf16gemm_fp32bf16_tn_96x64_splitk_cleanE,0.0058,113.81,638.76
256,240,1536,1536,False,torch.bfloat16,torch.bfloat16,False,False,asm,7,3,9.5099,_ZN5aiter39bf16gemm_fp32bf16_tn_80x64_splitk_cleanE,0.0057,119.08,651.23
256,328,1536,1536,False,torch.bfloat16,torch.bfloat16,False,False,asm,7,2,10.3411,_ZN5aiter39bf16gemm_fp32bf16_tn_80x64_splitk_cleanE,0.0028,149.66,651.17
256,120,2112,7168,False,torch.bfloat16,torch.bfloat16,False,False,asm,5,3,19.5331,_ZN5aiter39bf16gemm_fp32bf16_tn_64x64_splitk_cleanE,0.0106,186.01,1664.09
256,152,2112,7168,False,torch.bfloat16,torch.bfloat16,False,False,asm,7,3,20.6393,_ZN5aiter39bf16gemm_fp32bf16_tn_80x64_splitk_cleanE,0.0107,222.98,1603.68
256,160,2112,7168,False,torch.bfloat16,torch.bfloat16,False,False,asm,7,3,20.8121,_ZN5aiter39bf16gemm_fp32bf16_tn_80x64_splitk_cleanE,0.0106,232.77,1597.5
256,168,2112,7168,False,torch.bfloat16,torch.bfloat16,False,False,asm,8,3,21.2508,_ZN5aiter39bf16gemm_fp32bf16_tn_96x64_splitk_cleanE,0.0106,239.36,1571.5
256,176,2112,7168,False,torch.bfloat16,torch.bfloat16,False,False,asm,8,3,21.4824,_ZN5aiter39bf16gemm_fp32bf16_tn_96x64_splitk_cleanE,0.0106,248.06,1561.47
256,184,2112,7168,False,torch.bfloat16,torch.bfloat16,False,False,asm,8,3,21.6938,_ZN5aiter39bf16gemm_fp32bf16_tn_96x64_splitk_cleanE,0.0107,256.81,1553.1
256,192,2112,7168,False,torch.bfloat16,torch.bfloat16,False,False,asm,8,3,21.8515,_ZN5aiter39bf16gemm_fp32bf16_tn_96x64_splitk_cleanE,0.0106,266.04,1548.69
256,200,2112,7168,False,torch.bfloat16,torch.bfloat16,False,False,asm,7,2,26.2125,_ZN5aiter39bf16gemm_fp32bf16_tn_80x64_splitk_cleanE,0.006,231.02,1296.7
256,208,2112,7168,False,torch.bfloat16,torch.bfloat16,False,False,asm,7,2,26.5685,_ZN5aiter39bf16gemm_fp32bf16_tn_80x64_splitk_cleanE,0.006,237.04,1284.91
256,216,2112,7168,False,torch.bfloat16,torch.bfloat16,False,False,asm,7,2,26.6477,_ZN5aiter39bf16gemm_fp32bf16_tn_80x64_splitk_cleanE,0.006,245.42,1286.66
256,224,2112,7168,False,torch.bfloat16,torch.bfloat16,False,False,asm,7,2,26.8323,_ZN5aiter39bf16gemm_fp32bf16_tn_80x64_splitk_cleanE,0.006,252.76,1283.34
256,232,2112,7168,False,torch.bfloat16,torch.bfloat16,False,False,asm,7,2,27.1967,_ZN5aiter39bf16gemm_fp32bf16_tn_80x64_splitk_cleanE,0.006,258.28,1271.61
256,240,2112,7168,False,torch.bfloat16,torch.bfloat16,False,False,asm,7,2,27.3724,_ZN5aiter39bf16gemm_fp32bf16_tn_80x64_splitk_cleanE,0.006,265.47,1268.87
256,264,2112,7168,False,torch.bfloat16,torch.bfloat16,False,False,asm,8,2,28.4038,_ZN5aiter39bf16gemm_fp32bf16_tn_96x64_splitk_cleanE,0.006,281.42,1238.48
256,272,2112,7168,False,torch.bfloat16,torch.bfloat16,False,False,asm,8,2,28.5123,_ZN5aiter39bf16gemm_fp32bf16_tn_96x64_splitk_cleanE,0.0061,288.84,1238.97
256,280,2112,7168,False,torch.bfloat16,torch.bfloat16,False,False,asm,8,2,28.8775,_ZN5aiter39bf16gemm_fp32bf16_tn_96x64_splitk_cleanE,0.0061,293.58,1228.45
256,288,2112,7168,False,torch.bfloat16,torch.bfloat16,False,False,asm,8,2,28.9429,_ZN5aiter39bf16gemm_fp32bf16_tn_96x64_splitk_cleanE,0.0061,301.28,1230.8
256,104,3072,1536,False,torch.bfloat16,torch.bfloat16,False,False,asm,7,2,9.9897,_ZN5aiter39bf16gemm_fp32bf16_tn_80x64_splitk_cleanE,0.0028,98.25,1040.64
256,136,3072,1536,False,torch.bfloat16,torch.bfloat16,False,False,asm,7,2,10.6637,_ZN5aiter39bf16gemm_fp32bf16_tn_80x64_splitk_cleanE,0.0028,120.36,1002.52
256,144,3072,1536,False,torch.bfloat16,torch.bfloat16,False,False,asm,7,2,10.5831,_ZN5aiter39bf16gemm_fp32bf16_tn_80x64_splitk_cleanE,0.0027,128.41,1017.12
256,152,3072,1536,False,torch.bfloat16,torch.bfloat16,False,False,asm,7,2,11.0581,_ZN5aiter39bf16gemm_fp32bf16_tn_80x64_splitk_cleanE,0.0028,129.72,980.1
256,160,3072,1536,False,torch.bfloat16,torch.bfloat16,False,False,asm,8,2,10.9111,_ZN5aiter39bf16gemm_fp32bf16_tn_96x64_splitk_cleanE,0.0028,138.39,1000.06
256,168,3072,1536,False,torch.bfloat16,torch.bfloat16,False,False,asm,8,2,11.0756,_ZN5aiter39bf16gemm_fp32bf16_tn_96x64_splitk_cleanE,0.0028,143.15,991.86
256,200,3072,1536,False,torch.bfloat16,torch.bfloat16,False,False,asm,4,1,12.2001,_ZN5aiter37bf16gemm_fp32bf16_tn_48x64_pf3_splitkE,0.0,154.71,924.61
256,208,3072,1536,False,torch.bfloat16,torch.bfloat16,False,False,asm,4,1,12.0106,_ZN5aiter37bf16gemm_fp32bf16_tn_48x64_pf3_splitkE,0.0,163.43,945.34
256,216,3072,1536,False,torch.bfloat16,torch.bfloat16,False,False,asm,4,1,11.7401,_ZN5aiter37bf16gemm_fp32bf16_tn_48x64_pf3_splitkE,0.0,173.63,973.4
256,224,3072,1536,False,torch.bfloat16,torch.bfloat16,False,False,asm,6,1,12.2504,_ZN5aiter37bf16gemm_fp32bf16_tn_64x64_pf3_splitkE,0.0,172.56,938.87
256,232,3072,1536,False,torch.bfloat16,torch.bfloat16,False,False,asm,6,1,12.1948,_ZN5aiter37bf16gemm_fp32bf16_tn_64x64_pf3_splitkE,0.0,179.54,949.2
256,240,3072,1536,False,torch.bfloat16,torch.bfloat16,False,False,asm,4,1,11.8776,_ZN5aiter37bf16gemm_fp32bf16_tn_48x64_pf3_splitkE,0.0,190.69,980.76
256,416,3072,1536,False,torch.bfloat16,torch.bfloat16,False,False,asm,9,1,13.9463,_ZN5aiter37bf16gemm_fp32bf16_tn_96x64_pf3_splitkE,0.0,281.5,951.58
256,424,3072,1536,False,torch.bfloat16,torch.bfloat16,False,False,flydsl,271,1,16.3511,flydsl_gemm2_abf16_wbf16_bf16_t64x64x128_split_k1_block_m_warp2_block_n_warp2_async_copyTrue_b_to_ldsTrue_b_preshuffleFalse_c_to_ldsFalse_gfx950,0.0,244.72,816.14
256,432,3072,1536,False,torch.bfloat16,torch.bfloat16,False,False,asm,9,1,14.0366,_ZN5aiter37bf16gemm_fp32bf16_tn_96x64_pf3_splitkE,0.0,290.45,955.96
256,440,3072,1536,False,torch.bfloat16,torch.bfloat16,False,False,asm,9,1,13.6186,_ZN5aiter37bf16gemm_fp32bf16_tn_96x64_pf3_splitkE,0.0,304.9,990.72
256,456,3072,1536,False,torch.bfloat16,torch.bfloat16,False,False,asm,9,1,13.8104,_ZN5aiter37bf16gemm_fp32bf16_tn_96x64_pf3_splitkE,0.0,311.6,987.64
256,4,4096,512,False,torch.bfloat16,torch.bfloat16,False,False,triton,0,0,4.5506,auto,0.0,3.69,929.8
256,8,4096,512,False,torch.bfloat16,torch.bfloat16,False,False,triton,0,0,4.5407,auto,0.0,7.39,939.95
256,16,4096,512,False,torch.bfloat16,torch.bfloat16,False,False,triton,0,0,4.3534,auto,0.0,15.42,997.33
256,72,4096,512,False,torch.bfloat16,torch.bfloat16,False,False,flydsl,211,1,6.2647,flydsl_gemm2_abf16_wbf16_bf16_t32x64x128_split_k1_block_m_warp2_block_n_warp2_async_copyTrue_b_to_ldsTrue_b_preshuffleFalse_c_to_ldsFalse_gfx950,0.0,48.21,775.44
256,296,4096,512,False,torch.bfloat16,torch.bfloat16,False,False,flydsl,91,1,8.868,flydsl_gemm2_abf16_wbf16_bf16_t64x64x64_split_k1_block_m_warp2_block_n_warp2_async_copyTrue_b_to_ldsTrue_b_preshuffleFalse_c_to_ldsFalse_gfx950,0.0,140.0,780.59
256,304,4096,512,False,torch.bfloat16,torch.bfloat16,False,False,flydsl,271,1,7.5545,flydsl_gemm2_abf16_wbf16_bf16_t64x64x128_split_k1_block_m_warp2_block_n_warp2_async_copyTrue_b_to_ldsTrue_b_preshuffleFalse_c_to_ldsFalse_gfx950,0.0,168.78,926.06
256,312,4096,512,False,torch.bfloat16,torch.bfloat16,False,False,asm,9,1,7.9431,_ZN5aiter37bf16gemm_fp32bf16_tn_96x64_pf3_splitkE,0.0,164.75,890.04
256,336,4096,512,False,torch.bfloat16,torch.bfloat16,False,False,flydsl,271,1,7.5014,flydsl_gemm2_abf16_wbf16_bf16_t64x64x128_split_k1_block_m_warp2_block_n_warp2_async_copyTrue_b_to_ldsTrue_b_preshuffleFalse_c_to_ldsFalse_gfx950,0.0,187.87,971.94
256,512,4096,512,False,torch.bfloat16,torch.bfloat16,False,False,triton,0,0,8.2983,auto,0.0,258.79,1074.06
256,1,7168,512,False,torch.bfloat16,torch.bfloat16,False,False,triton,0,0,5.3382,auto,0.0,1.38,1377.88
256,1,7168,1024,False,torch.bfloat16,torch.bfloat16,False,False,flydsl,227,8,6.4796,flydsl_gemm2_abf16_wbf16_bf16_t32x128x128_split_k8_block_m_warp2_block_n_warp2_async_copyTrue_b_to_ldsTrue_b_preshuffleFalse_c_to_ldsFalse_gfx950,0.0,2.27,2268.11
256,2,7168,1024,False,torch.bfloat16,torch.bfloat16,False,False,flydsl,237,8,6.8986,flydsl_gemm2_abf16_wbf16_bf16_t32x256x128_split_k8_block_m_warp2_block_n_warp2_async_copyTrue_b_to_ldsTrue_b_preshuffleFalse_c_to_ldsFalse_gfx950,0.0,4.26,2132.73
256,16,7168,1024,False,torch.bfloat16,torch.bfloat16,False,False,triton,0,0,7.4158,auto,0.0,31.67,2014.92
256,24,7168,1024,False,torch.bfloat16,torch.bfloat16,False,False,triton,0,0,7.5691,auto,0.0,46.55,1991.42
256,24,7168,2048,False,torch.bfloat16,torch.bfloat16,False,False,triton,0,0,11.3968,auto,0.0,61.83,2614.99
256,32,7168,1024,False,torch.bfloat16,torch.bfloat16,False,False,triton,0,0,6.5764,auto,0.0,71.43,2311.96
256,40,7168,1024,False,torch.bfloat16,torch.bfloat16,False,False,triton,0,0,7.9803,auto,0.0,73.58,1921.66
256,40,7168,2048,False,torch.bfloat16,torch.bfloat16,False,False,triton,0,0,12.1517,auto,0.0,96.65,2476.81
256,48,7168,1024,False,torch.bfloat16,torch.bfloat16,False,False,triton,0,0,8.5938,auto,0.0,81.99,1799.73
256,56,7168,1024,False,torch.bfloat16,torch.bfloat16,False,False,triton,0,0,8.8118,auto,0.0,93.29,1770.08
256,56,7168,2048,False,torch.bfloat16,torch.bfloat16,False,False,triton,0,0,12.6431,auto,0.0,130.04,2403.87
256,64,7168,1024,False,torch.bfloat16,torch.bfloat16,False,False,triton,0,0,8.0737,auto,0.0,116.37,1948.13
256,72,7168,1024,False,torch.bfloat16,torch.bfloat16,False,False,flydsl,301,1,11.3646,flydsl_gemm2_abf16_wbf16_bf16_t96x64x128_split_k1_block_m_warp2_block_n_warp2_async_copyTrue_b_to_ldsTrue_b_preshuffleFalse_c_to_ldsFalse_gfx950,0.0,93.01,1395.54
256,80,7168,1024,False,torch.bfloat16,torch.bfloat16,False,False,flydsl,301,1,11.4417,flydsl_gemm2_abf16_wbf16_bf16_t96x64x128_split_k1_block_m_warp2_block_n_warp2_async_copyTrue_b_to_ldsTrue_b_preshuffleFalse_c_to_ldsFalse_gfx950,0.0,102.64,1397.59
256,88,7168,512,False,torch.bfloat16,torch.bfloat16,False,False,flydsl,211,1,7.2019,flydsl_gemm2_abf16_wbf16_bf16_t32x64x128_split_k1_block_m_warp2_block_n_warp2_async_copyTrue_b_to_ldsTrue_b_preshuffleFalse_c_to_ldsFalse_gfx950,0.0,89.69,1206.86
256,88,7168,1024,False,torch.bfloat16,torch.bfloat16,False,False,flydsl,301,1,11.327,flydsl_gemm2_abf16_wbf16_bf16_t96x64x128_split_k1_block_m_warp2_block_n_warp2_async_copyTrue_b_to_ldsTrue_b_preshuffleFalse_c_to_ldsFalse_gfx950,0.0,114.05,1423.31
256,96,7168,1024,False,torch.bfloat16,torch.bfloat16,False,False,flydsl,301,1,11.5201,flydsl_gemm2_abf16_wbf16_bf16_t96x64x128_split_k1_block_m_warp2_block_n_warp2_async_copyTrue_b_to_ldsTrue_b_preshuffleFalse_c_to_ldsFalse_gfx950,0.0,122.33,1410.83
256,104,7168,2048,False,torch.bfloat16,torch.bfloat16,False,False,asm,6,1,15.4702,_ZN5aiter37bf16gemm_fp32bf16_tn_64x64_pf3_splitkE,0.0,197.38,2021.76
256,120,7168,512,False,torch.bfloat16,torch.bfloat16,False,False,asm,6,1,6.9667,_ZN5aiter37bf16gemm_fp32bf16_tn_64x64_pf3_splitkE,0.0,126.43,1318.16
256,120,7168,2048,False,torch.bfloat16,torch.bfloat16,False,False,asm,6,1,15.9439,_ZN5aiter37bf16gemm_fp32bf16_tn_64x64_pf3_splitkE,0.0,220.98,1980.19
256,136,7168,2048,False,torch.bfloat16,torch.bfloat16,False,False,asm,9,1,17.2568,_ZN5aiter37bf16gemm_fp32bf16_tn_96x64_pf3_splitkE,0.0,231.39,1846.63
256,144,7168,1024,False,torch.bfloat16,torch.bfloat16,False,False,asm,9,1,10.3748,_ZN5aiter37bf16gemm_fp32bf16_tn_96x64_pf3_splitkE,0.0,203.76,1642.38
256,144,7168,2048,False,torch.bfloat16,torch.bfloat16,False,False,asm,9,1,17.4208,_ZN5aiter37bf16gemm_fp32bf16_tn_96x64_pf3_splitkE,0.0,242.69,1837.71
256,152,7168,2048,False,torch.bfloat16,torch.bfloat16,False,False,asm,9,1,16.9128,_ZN5aiter37bf16gemm_fp32bf16_tn_96x64_pf3_splitkE,0.0,263.87,1901.62
256,160,7168,2048,False,torch.bfloat16,torch.bfloat16,False,False,asm,9,1,17.185,_ZN5aiter37bf16gemm_fp32bf16_tn_96x64_pf3_splitkE,0.0,273.36,1880.08
256,168,7168,1024,False,torch.bfloat16,torch.bfloat16,False,False,asm,9,1,10.5421,_ZN5aiter37bf16gemm_fp32bf16_tn_96x64_pf3_splitkE,0.0,233.94,1653.62
256,168,7168,2048,False,torch.bfloat16,torch.bfloat16,False,False,asm,9,1,17.6956,_ZN5aiter37bf16gemm_fp32bf16_tn_96x64_pf3_splitkE,0.0,278.74,1834.17
256,176,7168,512,False,torch.bfloat16,torch.bfloat16,False,False,flydsl,301,1,8.2681,flydsl_gemm2_abf16_wbf16_bf16_t96x64x128_split_k1_block_m_warp2_block_n_warp2_async_copyTrue_b_to_ldsTrue_b_preshuffleFalse_c_to_ldsFalse_gfx950,0.0,156.25,1214.72
256,176,7168,1024,False,torch.bfloat16,torch.bfloat16,False,False,flydsl,271,1,11.5344,flydsl_gemm2_abf16_wbf16_bf16_t64x64x128_split_k1_block_m_warp2_block_n_warp2_async_copyTrue_b_to_ldsTrue_b_preshuffleFalse_c_to_ldsFalse_gfx950,0.0,224.0,1522.72
256,176,7168,2048,False,torch.bfloat16,torch.bfloat16,False,False,asm,9,1,17.4199,_ZN5aiter37bf16gemm_fp32bf16_tn_96x64_pf3_splitkE,0.0,296.64,1871.66
256,184,7168,1024,False,torch.bfloat16,torch.bfloat16,False,False,asm,9,1,11.3243,_ZN5aiter37bf16gemm_fp32bf16_tn_96x64_pf3_splitkE,0.0,238.53,1562.54
256,184,7168,2048,False,torch.bfloat16,torch.bfloat16,False,False,asm,9,1,17.2726,_ZN5aiter37bf16gemm_fp32bf16_tn_96x64_pf3_splitkE,0.0,312.76,1896.16
256,192,7168,1024,False,torch.bfloat16,torch.bfloat16,False,False,asm,9,1,11.2561,_ZN5aiter37bf16gemm_fp32bf16_tn_96x64_pf3_splitkE,0.0,250.4,1583.66
256,192,7168,2048,False,torch.bfloat16,torch.bfloat16,False,False,asm,9,1,17.9259,_ZN5aiter37bf16gemm_fp32bf16_tn_96x64_pf3_splitkE,0.0,314.47,1835.28
256,256,7168,512,False,torch.bfloat16,torch.bfloat16,False,False,triton,0,0,8.7892,auto,0.0,213.79,1282.5
256,1,1536,1536,False,torch.bfloat16,torch.bfloat16,False,False,flydsl,36,8,6.0032,flydsl_gemm2_abf16_wbf16_bf16_t32x64x64_split_k8_block_m_warp1_block_n_warp4_async_copyTrue_b_to_ldsFalse_b_preshuffleFalse_c_to_ldsFalse_gfx950,0.0,0.79,787.04
256,2,1536,1536,False,torch.bfloat16,torch.bfloat16,False,False,flydsl,36,8,5.6343,flydsl_gemm2_abf16_wbf16_bf16_t32x64x64_split_k8_block_m_warp1_block_n_warp4_async_copyTrue_b_to_ldsFalse_b_preshuffleFalse_c_to_ldsFalse_gfx950,0.0,1.67,839.66
256,32,1536,1536,False,torch.bfloat16,torch.bfloat16,False,False,flydsl,215,4,6.5514,flydsl_gemm2_abf16_wbf16_bf16_t32x64x128_split_k4_block_m_warp2_block_n_warp2_async_copyTrue_b_to_ldsTrue_b_preshuffleFalse_c_to_ldsFalse_gfx950,0.0,23.05,750.25
256,40,1536,1536,False,torch.bfloat16,torch.bfloat16,False,False,flydsl,215,4,6.9801,flydsl_gemm2_abf16_wbf16_bf16_t32x64x128_split_k4_block_m_warp2_block_n_warp2_async_copyTrue_b_to_ldsTrue_b_preshuffleFalse_c_to_ldsFalse_gfx950,0.0,27.04,711.21
256,48,1536,1536,False,torch.bfloat16,torch.bfloat16,False,False,flydsl,215,4,7.3909,flydsl_gemm2_abf16_wbf16_bf16_t32x64x128_split_k4_block_m_warp2_block_n_warp2_async_copyTrue_b_to_ldsTrue_b_preshuffleFalse_c_to_ldsFalse_gfx950,0.0,30.64,678.33
256,56,1536,1536,False,torch.bfloat16,torch.bfloat16,False,False,flydsl,215,4,7.7636,flydsl_gemm2_abf16_wbf16_bf16_t32x64x128_split_k4_block_m_warp2_block_n_warp2_async_copyTrue_b_to_ldsTrue_b_preshuffleFalse_c_to_ldsFalse_gfx950,0.0,34.04,652.1
256,152,7168,1024,False,torch.bfloat16,torch.bfloat16,False,False,flydsl,271,1,11.208,flydsl_gemm2_abf16_wbf16_bf16_t64x64x128_split_k1_block_m_warp2_block_n_warp2_async_copyTrue_b_to_ldsTrue_b_preshuffleFalse_c_to_ldsFalse_gfx950,0.0,199.09,1531.98
256,160,7168,1024,False,torch.bfloat16,torch.bfloat16,False,False,flydsl,301,1,12.0205,flydsl_gemm2_abf16_wbf16_bf16_t96x64x128_split_k1_block_m_warp2_block_n_warp2_async_copyTrue_b_to_ldsTrue_b_preshuffleFalse_c_to_ldsFalse_gfx950,0.0,195.4,1439.33
256,264,7168,1024,False,torch.bfloat16,torch.bfloat16,False,False,flydsl,301,1,13.0316,flydsl_gemm2_abf16_wbf16_bf16_t96x64x128_split_k1_block_m_warp2_block_n_warp2_async_copyTrue_b_to_ldsTrue_b_preshuffleFalse_c_to_ldsFalse_gfx950,0.0,297.39,1458.41
256,272,7168,1024,False,torch.bfloat16,torch.bfloat16,False,False,flydsl,301,1,13.1377,flydsl_gemm2_abf16_wbf16_bf16_t96x64x128_split_k1_block_m_warp2_block_n_warp2_async_copyTrue_b_to_ldsTrue_b_preshuffleFalse_c_to_ldsFalse_gfx950,0.0,303.93,1456.61
256,296,7168,1024,False,torch.bfloat16,torch.bfloat16,False,False,flydsl,301,1,13.164,flydsl_gemm2_abf16_wbf16_bf16_t96x64x128_split_k1_block_m_warp2_block_n_warp2_async_copyTrue_b_to_ldsTrue_b_preshuffleFalse_c_to_ldsFalse_gfx950,0.0,330.09,1483.57
256,304,7168,1024,False,torch.bfloat16,torch.bfloat16,False,False,flydsl,301,1,13.4057,flydsl_gemm2_abf16_wbf16_bf16_t96x64x128_split_k1_block_m_warp2_block_n_warp2_async_copyTrue_b_to_ldsTrue_b_preshuffleFalse_c_to_ldsFalse_gfx950,0.0,332.9,1466.61
256,312,7168,1024,False,torch.bfloat16,torch.bfloat16,False,False,flydsl,301,1,13.5965,flydsl_gemm2_abf16_wbf16_bf16_t96x64x128_split_k1_block_m_warp2_block_n_warp2_async_copyTrue_b_to_ldsTrue_b_preshuffleFalse_c_to_ldsFalse_gfx950,0.0,336.87,1455.66
256,320,7168,1024,False,torch.bfloat16,torch.bfloat16,False,False,flydsl,301,1,13.4864,flydsl_gemm2_abf16_wbf16_bf16_t96x64x128_split_k1_block_m_warp2_block_n_warp2_async_copyTrue_b_to_ldsTrue_b_preshuffleFalse_c_to_ldsFalse_gfx950,0.0,348.32,1477.26
256,328,7168,1024,False,torch.bfloat16,torch.bfloat16,False,False,flydsl,301,1,13.5958,flydsl_gemm2_abf16_wbf16_bf16_t96x64x128_split_k1_block_m_warp2_block_n_warp2_async_copyTrue_b_to_ldsTrue_b_preshuffleFalse_c_to_ldsFalse_gfx950,0.0,354.16,1475.01
256,336,7168,1024,False,torch.bfloat16,torch.bfloat16,False,False,flydsl,301,1,13.7168,flydsl_gemm2_abf16_wbf16_bf16_t96x64x128_split_k1_block_m_warp2_block_n_warp2_async_copyTrue_b_to_ldsTrue_b_preshuffleFalse_c_to_ldsFalse_gfx950,0.0,359.6,1471.56
256,344,7168,1024,False,torch.bfloat16,torch.bfloat16,False,False,flydsl,301,1,13.8203,flydsl_gemm2_abf16_wbf16_bf16_t96x64x128_split_k1_block_m_warp2_block_n_warp2_async_copyTrue_b_to_ldsTrue_b_preshuffleFalse_c_to_ldsFalse_gfx950,0.0,365.4,1470.02
256,352,7168,1024,False,torch.bfloat16,torch.bfloat16,False,False,flydsl,301,1,14.1414,flydsl_gemm2_abf16_wbf16_bf16_t96x64x128_split_k1_block_m_warp2_block_n_warp2_async_copyTrue_b_to_ldsTrue_b_preshuffleFalse_c_to_ldsFalse_gfx950,0.0,365.41,1445.91
256,360,7168,1024,False,torch.bfloat16,torch.bfloat16,False,False,flydsl,301,1,14.1018,flydsl_gemm2_abf16_wbf16_bf16_t96x64x128_split_k1_block_m_warp2_block_n_warp2_async_copyTrue_b_to_ldsTrue_b_preshuffleFalse_c_to_ldsFalse_gfx950,0.0,374.76,1459.27
256,368,7168,1024,False,torch.bfloat16,torch.bfloat16,False,False,flydsl,301,1,14.6026,flydsl_gemm2_abf16_wbf16_bf16_t96x64x128_split_k1_block_m_warp2_block_n_warp2_async_copyTrue_b_to_ldsTrue_b_preshuffleFalse_c_to_ldsFalse_gfx950,0.0,369.95,1418.2
256,376,7168,1024,False,torch.bfloat16,torch.bfloat16,False,False,flydsl,301,1,14.543,flydsl_gemm2_abf16_wbf16_bf16_t96x64x128_split_k1_block_m_warp2_block_n_warp2_async_copyTrue_b_to_ldsTrue_b_preshuffleFalse_c_to_ldsFalse_gfx950,0.0,379.54,1433.02
256,408,4096,512,False,torch.bfloat16,torch.bfloat16,False,False,flydsl,301,1,8.3591,flydsl_gemm2_abf16_wbf16_bf16_t96x64x128_split_k1_block_m_warp2_block_n_warp2_async_copyTrue_b_to_ldsTrue_b_preshuffleFalse_c_to_ldsFalse_gfx950,0.0,204.72,951.59
256,416,4096,512,False,torch.bfloat16,torch.bfloat16,False,False,flydsl,301,1,8.3326,flydsl_gemm2_abf16_wbf16_bf16_t96x64x128_split_k1_block_m_warp2_block_n_warp2_async_copyTrue_b_to_ldsTrue_b_preshuffleFalse_c_to_ldsFalse_gfx950,0.0,209.4,963.47
256,464,4096,512,False,torch.bfloat16,torch.bfloat16,False,False,flydsl,121,1,9.6804,flydsl_gemm2_abf16_wbf16_bf16_t96x64x64_split_k1_block_m_warp2_block_n_warp2_async_copyTrue_b_to_ldsTrue_b_preshuffleFalse_c_to_ldsFalse_gfx950,0.0,201.04,875.02
256,472,4096,512,False,torch.bfloat16,torch.bfloat16,False,False,flydsl,121,1,9.6761,flydsl_gemm2_abf16_wbf16_bf16_t96x64x64_split_k1_block_m_warp2_block_n_warp2_async_copyTrue_b_to_ldsTrue_b_preshuffleFalse_c_to_ldsFalse_gfx950,0.0,204.6,883.03
256,480,4096,512,False,torch.bfloat16,torch.bfloat16,False,False,flydsl,301,1,8.7323,flydsl_gemm2_abf16_wbf16_bf16_t96x64x128_split_k1_block_m_warp2_block_n_warp2_async_copyTrue_b_to_ldsTrue_b_preshuffleFalse_c_to_ldsFalse_gfx950,0.0,230.55,986.91
256,504,4096,512,False,torch.bfloat16,torch.bfloat16,False,False,flydsl,301,1,8.4812,flydsl_gemm2_abf16_wbf16_bf16_t96x64x128_split_k1_block_m_warp2_block_n_warp2_async_copyTrue_b_to_ldsTrue_b_preshuffleFalse_c_to_ldsFalse_gfx950,0.0,249.25,1042.21
256,128,384,7168,False,torch.bfloat16,torch.bfloat16,False,False,flydsl,217,8,11.5909,flydsl_gemm2_abf16_wbf16_bf16_t32x64x128_split_k8_block_m_warp2_block_n_warp2_async_copyTrue_b_to_ldsTrue_b_preshuffleFalse_c_to_ldsFalse_gfx950,0.0,60.79,641.74
256,200,7168,512,False,torch.bfloat16,torch.bfloat16,False,False,flydsl,301,1,8.505,flydsl_gemm2_abf16_wbf16_bf16_t96x64x128_split_k1_block_m_warp2_block_n_warp2_async_copyTrue_b_to_ldsTrue_b_preshuffleFalse_c_to_ldsFalse_gfx950,0.0,172.6,1224.22
256,232,7168,512,False,torch.bfloat16,torch.bfloat16,False,False,flydsl,271,1,8.6378,flydsl_gemm2_abf16_wbf16_bf16_t64x64x128_split_k1_block_m_warp2_block_n_warp2_async_copyTrue_b_to_ldsTrue_b_preshuffleFalse_c_to_ldsFalse_gfx950,0.0,197.14,1262.31
256,24,1536,1536,False,torch.bfloat16,torch.bfloat16,False,False,flydsl,215,4,6.8803,flydsl_gemm2_abf16_wbf16_bf16_t32x64x128_split_k4_block_m_warp2_block_n_warp2_async_copyTrue_b_to_ldsTrue_b_preshuffleFalse_c_to_ldsFalse_gfx950,0.0,16.46,707.25
256,432,4096,512,False,torch.bfloat16,torch.bfloat16,False,False,flydsl,271,1,8.1125,flydsl_gemm2_abf16_wbf16_bf16_t64x64x128_split_k1_block_m_warp2_block_n_warp2_async_copyTrue_b_to_ldsTrue_b_preshuffleFalse_c_to_ldsFalse_gfx950,0.0,223.35,1007.78
256,440,4096,512,False,torch.bfloat16,torch.bfloat16,False,False,flydsl,121,1,9.56,flydsl_gemm2_abf16_wbf16_bf16_t96x64x64_split_k1_block_m_warp2_block_n_warp2_async_copyTrue_b_to_ldsTrue_b_preshuffleFalse_c_to_ldsFalse_gfx950,0.0,193.04,862.9
256,4,7168,1024,False,torch.bfloat16,torch.bfloat16,False,False,flydsl,45,4,7.3877,flydsl_gemm2_abf16_wbf16_bf16_t32x128x64_split_k4_block_m_warp2_block_n_warp2_async_copyTrue_b_to_ldsTrue_b_preshuffleFalse_c_to_ldsFalse_gfx950,0.0,7.95,1995.96
256,184,7168,512,False,torch.bfloat16,torch.bfloat16,False,False,flydsl,271,1,7.7607,flydsl_gemm2_abf16_wbf16_bf16_t64x64x128_split_k1_block_m_warp2_block_n_warp2_async_copyTrue_b_to_ldsTrue_b_preshuffleFalse_c_to_ldsFalse_gfx950,0.0,174.03,1309.97
256,216,7168,512,False,torch.bfloat16,torch.bfloat16,False,False,flydsl,91,1,9.8614,flydsl_gemm2_abf16_wbf16_bf16_t64x64x64_split_k1_block_m_warp2_block_n_warp2_async_copyTrue_b_to_ldsTrue_b_preshuffleFalse_c_to_ldsFalse_gfx950,0.0,160.77,1080.76
256,48,1024,7168,False,torch.bfloat16,torch.bfloat16,False,False,flydsl,277,8,12.0728,flydsl_gemm2_abf16_wbf16_bf16_t64x64x128_split_k8_block_m_warp2_block_n_warp2_async_copyTrue_b_to_ldsTrue_b_preshuffleFalse_c_to_ldsFalse_gfx950,0.0,58.37,1281.1
