aiter/configs/model_configs/kimik2_bf16_tuned_gemm.csv
gfx,cu_num,M,N,K,bias,dtype,outdtype,scaleAB,bpreshuffle,libtype,solidx,splitK,us,kernelName,err_ratio,tflops,bw
gfx950,256,8,384,7168,False,torch.bfloat16,torch.bfloat16,False,False,flydsl,4743,7,6.174,flydsl_gemm4_abf16_wbf16_bf16_t16x64x128_split_k7_block_m_warp1_block_n_warp2_block_k_warp1_async_copyTrue_b_to_ldsTrue_b_preshuffleFalse_c_to_ldsFalse_gfx950,0.0182,7.13,911.22
gfx950,256,16,384,7168,False,torch.bfloat16,torch.bfloat16,False,False,flydsl,4749,8,6.5591,flydsl_gemm4_abf16_wbf16_bf16_t16x64x128_split_k8_block_m_warp1_block_n_warp2_block_k_warp1_async_copyTrue_b_to_ldsTrue_b_preshuffleFalse_c_to_ldsFalse_gfx950,0.0234,13.43,876.14
gfx950,256,24,384,7168,False,torch.bfloat16,torch.bfloat16,False,False,flydsl,6646,8,6.5312,flydsl_gemm5_abf16_wbf16_bf16_t16x64x128_split_k8_block_m_warp1_block_n_warp2_block_k_warp1_async_copyTrue_b_to_ldsTrue_b_preshuffleFalse_c_to_ldsFalse_gfx950,0.0224,20.23,898.38
gfx950,256,32,384,7168,False,torch.bfloat16,torch.bfloat16,False,False,flydsl,6646,8,6.7705,flydsl_gemm5_abf16_wbf16_bf16_t16x64x128_split_k8_block_m_warp1_block_n_warp2_block_k_warp1_async_copyTrue_b_to_ldsTrue_b_preshuffleFalse_c_to_ldsFalse_gfx950,0.0212,26.02,884.48
gfx950,256,40,384,7168,False,torch.bfloat16,torch.bfloat16,False,False,flydsl,5173,8,6.8657,flydsl_gemm4_abf16_wbf16_bf16_t32x64x128_split_k8_block_m_warp1_block_n_warp4_block_k_warp1_async_copyTrue_b_to_ldsTrue_b_preshuffleFalse_c_to_ldsFalse_gfx950,0.0195,32.07,889.81
gfx950,256,48,384,7168,False,torch.bfloat16,torch.bfloat16,False,False,flydsl,6992,8,7.1054,flydsl_gemm5_abf16_wbf16_bf16_t32x64x128_split_k8_block_m_warp2_block_n_warp1_block_k_warp2_async_copyTrue_b_to_ldsTrue_b_preshuffleFalse_c_to_ldsFalse_gfx950,0.0284,37.19,876.8
gfx950,256,56,384,7168,False,torch.bfloat16,torch.bfloat16,False,False,asm,5,14,9.3551,_ZN5aiter39bf16gemm_fp32bf16_tn_64x64_splitk_cleanE,0.0279,32.95,678.86
gfx950,256,64,384,7168,False,torch.bfloat16,torch.bfloat16,False,False,flydsl,4402,7,7.5879,flydsl_gemm3_abf16_wbf16_bf16_t32x64x128_split_k7_block_m_warp2_block_n_warp2_block_k_warp1_async_copyTrue_b_to_ldsTrue_b_preshuffleFalse_c_to_ldsFalse_gfx950,0.0192,46.43,852.89
gfx950,256,72,384,7168,False,torch.bfloat16,torch.bfloat16,False,False,flydsl,7082,7,7.7983,flydsl_gemm4_abf16_wbf16_bf16_t32x64x128_split_k7_block_m_warp2_block_n_warp2_block_k_warp1_async_copyTrue_b_to_ldsTrue_b_preshuffleFalse_c_to_ldsFalse_gfx950,0.0202,50.83,845.38
gfx950,256,80,384,7168,False,torch.bfloat16,torch.bfloat16,False,False,flydsl,9545,8,7.9086,flydsl_gemm5_abf16_wbf16_bf16_t32x64x64_split_k8_block_m_warp1_block_n_warp4_block_k_warp1_async_copyTrue_b_to_ldsTrue_b_preshuffleFalse_c_to_ldsFalse_gfx950,0.0217,55.69,848.87
gfx950,256,88,384,7168,False,torch.bfloat16,torch.bfloat16,False,False,asm,8,14,9.9299,_ZN5aiter39bf16gemm_fp32bf16_tn_96x64_splitk_cleanE,0.0281,48.79,688.24
gfx950,256,104,384,7168,False,torch.bfloat16,torch.bfloat16,False,False,flydsl,9533,7,8.892,flydsl_gemm5_abf16_wbf16_bf16_t32x64x64_split_k7_block_m_warp2_block_n_warp2_block_k_warp1_async_copyTrue_b_to_ldsTrue_b_preshuffleFalse_c_to_ldsFalse_gfx950,0.0201,64.39,795.75
gfx950,256,112,384,7168,False,torch.bfloat16,torch.bfloat16,False,False,flydsl,9399,7,9.1405,flydsl_gemm5_abf16_wbf16_bf16_t32x64x128_split_k7_block_m_warp1_block_n_warp2_block_k_warp2_async_copyTrue_b_to_ldsTrue_b_preshuffleFalse_c_to_ldsFalse_gfx950,0.0266,67.45,787.34
gfx950,256,120,384,7168,False,torch.bfloat16,torch.bfloat16,False,False,flydsl,6658,4,9.3175,flydsl_gemm4_abf16_wbf16_bf16_t16x64x128_split_k4_block_m_warp1_block_n_warp2_block_k_warp1_async_copyTrue_b_to_ldsTrue_b_preshuffleFalse_c_to_ldsFalse_gfx950,0.0141,70.9,785.35
gfx950,256,128,384,7168,False,torch.bfloat16,torch.bfloat16,False,False,flydsl,7593,4,9.6871,flydsl_gemm4_abf16_wbf16_bf16_t16x64x128_split_k4_block_m_warp1_block_n_warp2_block_k_warp1_async_copyTrue_b_to_ldsTrue_b_preshuffleFalse_c_to_ldsFalse_gfx950,0.0144,72.74,767.86
gfx950,256,136,384,7168,False,torch.bfloat16,torch.bfloat16,False,False,flydsl,10887,7,9.555,flydsl_gemm5_abf16_wbf16_bf16_t32x64x64_split_k7_block_m_warp1_block_n_warp4_block_k_warp1_async_copyTrue_b_to_ldsTrue_b_preshuffleFalse_c_to_ldsFalse_gfx950,0.0202,78.36,791.12
gfx950,256,168,384,7168,False,torch.bfloat16,torch.bfloat16,False,False,flydsl,8246,4,10.3211,flydsl_gemm4_abf16_wbf16_bf16_t32x64x128_split_k4_block_m_warp1_block_n_warp2_block_k_warp2_async_copyTrue_b_to_ldsTrue_b_preshuffleFalse_c_to_ldsFalse_gfx950,0.0214,89.61,779.23
gfx950,256,176,384,7168,False,torch.bfloat16,torch.bfloat16,False,False,flydsl,8248,4,10.6039,flydsl_gemm4_abf16_wbf16_bf16_t32x64x128_split_k4_block_m_warp1_block_n_warp4_block_k_warp1_async_copyTrue_b_to_ldsTrue_b_preshuffleFalse_c_to_ldsFalse_gfx950,0.0142,91.37,769.84
gfx950,256,184,384,7168,False,torch.bfloat16,torch.bfloat16,False,False,flydsl,10747,4,10.9743,flydsl_gemm5_abf16_wbf16_bf16_t32x64x128_split_k4_block_m_warp2_block_n_warp1_block_k_warp2_async_copyTrue_b_to_ldsTrue_b_preshuffleFalse_c_to_ldsFalse_gfx950,0.0215,92.3,754.87
gfx950,256,200,384,7168,False,torch.bfloat16,torch.bfloat16,False,False,flydsl,8248,4,10.6011,flydsl_gemm4_abf16_wbf16_bf16_t32x64x128_split_k4_block_m_warp1_block_n_warp4_block_k_warp1_async_copyTrue_b_to_ldsTrue_b_preshuffleFalse_c_to_ldsFalse_gfx950,0.0142,103.86,804.24
gfx950,256,216,384,7168,False,torch.bfloat16,torch.bfloat16,False,False,asm,3,6,13.5653,_ZN5aiter39bf16gemm_fp32bf16_tn_48x64_splitk_cleanE,0.0183,87.66,646.32
gfx950,256,224,384,7168,False,torch.bfloat16,torch.bfloat16,False,False,asm,3,7,13.5753,_ZN5aiter39bf16gemm_fp32bf16_tn_48x64_splitk_cleanE,0.0199,90.84,654.74
gfx950,256,232,384,7168,False,torch.bfloat16,torch.bfloat16,False,False,asm,3,6,13.6708,_ZN5aiter39bf16gemm_fp32bf16_tn_48x64_splitk_cleanE,0.0183,93.42,659.01
gfx950,256,240,384,7168,False,torch.bfloat16,torch.bfloat16,False,False,asm,3,6,13.7164,_ZN5aiter39bf16gemm_fp32bf16_tn_48x64_splitk_cleanE,0.018,96.32,665.63
gfx950,256,248,384,7168,False,torch.bfloat16,torch.bfloat16,False,False,asm,5,7,13.7676,_ZN5aiter39bf16gemm_fp32bf16_tn_64x64_splitk_cleanE,0.0205,99.16,671.93
gfx950,256,264,384,7168,False,torch.bfloat16,torch.bfloat16,False,False,asm,3,6,14.0505,_ZN5aiter39bf16gemm_fp32bf16_tn_48x64_splitk_cleanE,0.0182,103.44,675.6
gfx950,256,272,384,7168,False,torch.bfloat16,torch.bfloat16,False,False,asm,3,6,14.142,_ZN5aiter39bf16gemm_fp32bf16_tn_48x64_splitk_cleanE,0.0185,105.88,679.77
gfx950,256,280,384,7168,False,torch.bfloat16,torch.bfloat16,False,False,asm,3,6,14.0565,_ZN5aiter39bf16gemm_fp32bf16_tn_48x64_splitk_cleanE,0.0184,109.66,692.5
gfx950,256,296,384,7168,False,torch.bfloat16,torch.bfloat16,False,False,asm,3,6,14.0038,_ZN5aiter39bf16gemm_fp32bf16_tn_48x64_splitk_cleanE,0.0186,116.36,712.36
gfx950,256,304,384,7168,False,torch.bfloat16,torch.bfloat16,False,False,asm,3,6,14.3644,_ZN5aiter39bf16gemm_fp32bf16_tn_48x64_splitk_cleanE,0.0187,116.51,702.89
gfx950,256,312,384,7168,False,torch.bfloat16,torch.bfloat16,False,False,asm,5,6,14.2119,_ZN5aiter39bf16gemm_fp32bf16_tn_64x64_splitk_cleanE,0.0189,120.85,718.94
gfx950,256,320,384,7168,False,torch.bfloat16,torch.bfloat16,False,False,asm,3,6,14.0163,_ZN5aiter39bf16gemm_fp32bf16_tn_48x64_splitk_cleanE,0.0187,125.68,737.59
gfx950,256,328,384,7168,False,torch.bfloat16,torch.bfloat16,False,False,asm,3,6,14.1727,_ZN5aiter39bf16gemm_fp32bf16_tn_48x64_splitk_cleanE,0.0188,127.4,737.98
gfx950,256,336,384,7168,False,torch.bfloat16,torch.bfloat16,False,False,asm,3,5,14.2772,_ZN5aiter39bf16gemm_fp32bf16_tn_48x64_splitk_cleanE,0.0162,129.56,741.04
gfx950,256,344,384,7168,False,torch.bfloat16,torch.bfloat16,False,False,asm,5,6,14.3755,_ZN5aiter39bf16gemm_fp32bf16_tn_64x64_splitk_cleanE,0.0184,131.73,744.38
gfx950,256,360,384,7168,False,torch.bfloat16,torch.bfloat16,False,False,asm,5,6,14.4607,_ZN5aiter39bf16gemm_fp32bf16_tn_64x64_splitk_cleanE,0.0187,137.05,756.7
gfx950,256,368,384,7168,False,torch.bfloat16,torch.bfloat16,False,False,asm,5,6,14.5298,_ZN5aiter39bf16gemm_fp32bf16_tn_64x64_splitk_cleanE,0.0186,139.43,761.42
gfx950,256,376,384,7168,False,torch.bfloat16,torch.bfloat16,False,False,asm,3,5,14.5702,_ZN5aiter39bf16gemm_fp32bf16_tn_48x64_splitk_cleanE,0.0161,142.06,767.6
gfx950,256,392,384,7168,False,torch.bfloat16,torch.bfloat16,False,False,asm,5,5,14.7176,_ZN5aiter39bf16gemm_fp32bf16_tn_64x64_splitk_cleanE,0.0162,146.63,776.34
gfx950,256,400,384,7168,False,torch.bfloat16,torch.bfloat16,False,False,asm,5,5,14.7254,_ZN5aiter39bf16gemm_fp32bf16_tn_64x64_splitk_cleanE,0.0163,149.54,784.13
gfx950,256,408,384,7168,False,torch.bfloat16,torch.bfloat16,False,False,asm,5,5,14.8111,_ZN5aiter39bf16gemm_fp32bf16_tn_64x64_splitk_cleanE,0.0161,151.65,787.75
gfx950,256,424,384,7168,False,torch.bfloat16,torch.bfloat16,False,False,asm,5,5,15.0387,_ZN5aiter39bf16gemm_fp32bf16_tn_64x64_splitk_cleanE,0.0163,155.21,791.9
gfx950,256,432,384,7168,False,torch.bfloat16,torch.bfloat16,False,False,asm,5,5,14.9946,_ZN5aiter39bf16gemm_fp32bf16_tn_64x64_splitk_cleanE,0.0162,158.6,802.29
gfx950,256,440,384,7168,False,torch.bfloat16,torch.bfloat16,False,False,asm,5,5,14.9368,_ZN5aiter39bf16gemm_fp32bf16_tn_64x64_splitk_cleanE,0.0162,162.16,813.48
gfx950,256,448,384,7168,False,torch.bfloat16,torch.bfloat16,False,False,asm,5,5,15.0012,_ZN5aiter39bf16gemm_fp32bf16_tn_64x64_splitk_cleanE,0.0162,164.4,818.04
gfx950,256,456,384,7168,False,torch.bfloat16,torch.bfloat16,False,False,asm,7,5,15.275,_ZN5aiter39bf16gemm_fp32bf16_tn_80x64_splitk_cleanE,0.0161,164.34,811.29
gfx950,256,464,384,7168,False,torch.bfloat16,torch.bfloat16,False,False,asm,5,5,15.3249,_ZN5aiter39bf16gemm_fp32bf16_tn_64x64_splitk_cleanE,0.0164,166.68,816.53
gfx950,256,472,384,7168,False,torch.bfloat16,torch.bfloat16,False,False,asm,5,5,15.4675,_ZN5aiter39bf16gemm_fp32bf16_tn_64x64_splitk_cleanE,0.0162,167.99,816.82
gfx950,256,488,384,7168,False,torch.bfloat16,torch.bfloat16,False,False,asm,7,5,15.4672,_ZN5aiter39bf16gemm_fp32bf16_tn_80x64_splitk_cleanE,0.0164,173.69,832.46
gfx950,256,496,384,7168,False,torch.bfloat16,torch.bfloat16,False,False,asm,5,5,15.5009,_ZN5aiter39bf16gemm_fp32bf16_tn_64x64_splitk_cleanE,0.0163,176.15,838.44
gfx950,256,504,384,7168,False,torch.bfloat16,torch.bfloat16,False,False,asm,5,5,15.5875,_ZN5aiter39bf16gemm_fp32bf16_tn_64x64_splitk_cleanE,0.0163,178.0,841.54
gfx950,256,512,384,7168,False,torch.bfloat16,torch.bfloat16,False,False,opus,1200,5,14.9901,opus_gemm_flatmm_splitk_256x64x64x64_2x1_16x16x32_0x0x0_wgpcu2_nooob,0.0,188.03,883.13
gfx950,256,4,2112,7168,False,torch.bfloat16,torch.bfloat16,False,False,flydsl,1171,7,8.3644,flydsl_gemm3_abf16_wbf16_bf16_t16x64x128_split_k7_block_m_warp1_block_n_warp2_block_k_warp1_async_copyTrue_b_to_ldsTrue_b_preshuffleFalse_c_to_ldsFalse_gfx950,0.0188,14.48,3628.7
gfx950,256,8,2112,7168,False,torch.bfloat16,torch.bfloat16,False,False,flydsl,3205,7,8.5582,flydsl_gemm5_abf16_wbf16_bf16_t16x64x64_split_k7_block_m_warp1_block_n_warp2_block_k_warp1_async_copyTrue_b_to_ldsTrue_b_preshuffleFalse_c_to_ldsFalse_gfx950,0.0179,28.3,3555.2
gfx950,256,16,2112,7168,False,torch.bfloat16,torch.bfloat16,False,False,flydsl,3205,7,9.1715,flydsl_gemm5_abf16_wbf16_bf16_t16x64x64_split_k7_block_m_warp1_block_n_warp2_block_k_warp1_async_copyTrue_b_to_ldsTrue_b_preshuffleFalse_c_to_ldsFalse_gfx950,0.0193,52.82,3333.65
gfx950,256,24,2112,7168,False,torch.bfloat16,torch.bfloat16,False,False,flydsl,2251,4,13.1089,flydsl_gemm4_abf16_wbf16_bf16_t16x64x64_split_k4_block_m_warp1_block_n_warp2_block_k_warp1_async_copyTrue_b_to_ldsTrue_b_preshuffleFalse_c_to_ldsFalse_gfx950,0.0139,55.43,2343.68
gfx950,256,32,2112,7168,False,torch.bfloat16,torch.bfloat16,False,False,flydsl,3403,7,10.7509,flydsl_gemm5_abf16_wbf16_bf16_t32x64x64_split_k7_block_m_warp1_block_n_warp4_block_k_warp1_async_copyTrue_b_to_ldsTrue_b_preshuffleFalse_c_to_ldsFalse_gfx950,0.0195,90.12,2871.53
gfx950,256,40,2112,7168,False,torch.bfloat16,torch.bfloat16,False,False,asm,3,6,14.7343,_ZN5aiter39bf16gemm_fp32bf16_tn_48x64_splitk_cleanE,0.0185,82.2,2105.29
gfx950,256,48,2112,7168,False,torch.bfloat16,torch.bfloat16,False,False,asm,3,6,14.7667,_ZN5aiter39bf16gemm_fp32bf16_tn_48x64_splitk_cleanE,0.0181,98.42,2110.73
gfx950,256,56,2112,7168,False,torch.bfloat16,torch.bfloat16,False,False,asm,5,6,15.4235,_ZN5aiter39bf16gemm_fp32bf16_tn_64x64_splitk_cleanE,0.0181,109.93,2030.47
gfx950,256,72,2112,7168,False,torch.bfloat16,torch.bfloat16,False,False,asm,7,6,15.6998,_ZN5aiter39bf16gemm_fp32bf16_tn_80x64_splitk_cleanE,0.0177,138.85,2013.65
gfx950,256,88,2112,7168,False,torch.bfloat16,torch.bfloat16,False,False,asm,8,7,16.2598,_ZN5aiter39bf16gemm_fp32bf16_tn_96x64_splitk_cleanE,0.02,163.87,1962.56
gfx950,256,360,4096,512,False,torch.bfloat16,torch.bfloat16,False,False,flydsl,9172,1,5.9212,flydsl_gemm4_abf16_wbf16_bf16_t96x64x64_split_k1_block_m_warp2_block_n_warp2_block_k_warp1_async_copyTrue_b_to_ldsTrue_b_preshuffleFalse_c_to_ldsFalse_gfx950,0.0,255.01,1268.67
gfx950,256,1,7168,512,False,torch.bfloat16,torch.bfloat16,False,False,triton,0,0,5.3991,auto,0.0,1.36,1362.34
gfx950,256,48,7168,512,False,torch.bfloat16,torch.bfloat16,False,False,flydsl,2839,1,4.7638,flydsl_gemm3_abf16_wbf16_bf16_t32x64x128_split_k1_block_m_warp2_block_n_warp2_block_k_warp1_async_copyTrue_b_to_ldsTrue_b_preshuffleFalse_c_to_ldsFalse_gfx950,0.0,73.96,1695.56
gfx950,256,72,7168,512,False,torch.bfloat16,torch.bfloat16,False,False,asm,4,1,6.6171,_ZN5aiter37bf16gemm_fp32bf16_tn_48x64_pf3_splitkE,0.0,79.87,1276.38
gfx950,256,80,7168,512,False,torch.bfloat16,torch.bfloat16,False,False,asm,4,1,6.5744,_ZN5aiter37bf16gemm_fp32bf16_tn_48x64_pf3_splitkE,0.0,89.32,1303.36
gfx950,256,120,7168,512,False,torch.bfloat16,torch.bfloat16,False,False,flydsl,7640,1,5.4063,flydsl_gemm4_abf16_wbf16_bf16_t64x64x64_split_k1_block_m_warp2_block_n_warp2_block_k_warp1_async_copyTrue_b_to_ldsTrue_b_preshuffleFalse_c_to_ldsFalse_gfx950,0.0,162.92,1698.62
gfx950,256,128,7168,512,False,torch.bfloat16,torch.bfloat16,False,False,flydsl,8796,1,5.4778,flydsl_gemm4_abf16_wbf16_bf16_t64x64x64_split_k1_block_m_warp2_block_n_warp2_block_k_warp1_async_copyTrue_b_to_ldsTrue_b_preshuffleFalse_c_to_ldsFalse_gfx950,0.0,171.51,1698.88
gfx942,80,168,384,7168,False,torch.bfloat16,torch.bfloat16,False,False,opus,50211,8,20.8034,opus_gemm_gfx942_splitk_p1_256x64x64x64_2x2_16x16x16_0x0x0,0.0,44.46,386.6
gfx942,80,176,384,7168,False,torch.bfloat16,torch.bfloat16,False,False,opus,50211,8,20.632,opus_gemm_gfx942_splitk_p1_256x64x64x64_2x2_16x16x16_0x0x0,0.0,46.96,395.66
gfx942,80,184,384,7168,False,torch.bfloat16,torch.bfloat16,False,False,opus,50211,8,21.0217,opus_gemm_gfx942_splitk_p1_256x64x64x64_2x2_16x16x16_0x0x0,0.0,48.18,394.08
gfx942,80,328,384,7168,False,torch.bfloat16,torch.bfloat16,False,False,opus,50200,8,29.3805,opus_gemm_gfx942_splitk_legacy_512x128x128x64_2x4_16x16x16_0x0x0,0.0,61.46,355.99
gfx942,80,336,384,7168,False,torch.bfloat16,torch.bfloat16,False,False,opus,50200,8,29.5682,opus_gemm_gfx942_splitk_legacy_512x128x128x64_2x4_16x16x16_0x0x0,0.0,62.56,357.82
gfx942,80,344,384,7168,False,torch.bfloat16,torch.bfloat16,False,False,opus,50200,8,29.6615,opus_gemm_gfx942_splitk_legacy_512x128x128x64_2x4_16x16x16_0x0x0,0.0,63.84,360.76
gfx942,80,360,384,7168,False,torch.bfloat16,torch.bfloat16,False,False,opus,50200,8,29.8782,opus_gemm_gfx942_splitk_legacy_512x128x128x64_2x4_16x16x16_0x0x0,0.0,66.33,366.24
gfx942,80,368,384,7168,False,torch.bfloat16,torch.bfloat16,False,False,opus,50200,8,30.0582,opus_gemm_gfx942_splitk_legacy_512x128x128x64_2x4_16x16x16_0x0x0,0.0,67.4,368.06
gfx942,80,376,384,7168,False,torch.bfloat16,torch.bfloat16,False,False,opus,50200,8,30.2422,opus_gemm_gfx942_splitk_legacy_512x128x128x64_2x4_16x16x16_0x0x0,0.0,68.44,369.82
gfx942,80,392,384,7168,False,torch.bfloat16,torch.bfloat16,False,False,opus,50200,6,34.2745,opus_gemm_gfx942_splitk_legacy_512x128x128x64_2x4_16x16x16_0x0x0,0.0,62.96,333.36
gfx942,80,400,384,7168,False,torch.bfloat16,torch.bfloat16,False,False,opus,50200,6,34.2548,opus_gemm_gfx942_splitk_legacy_512x128x128x64_2x4_16x16x16_0x0x0,0.0,64.28,337.08
gfx942,80,408,384,7168,False,torch.bfloat16,torch.bfloat16,False,False,opus,50200,6,34.3957,opus_gemm_gfx942_splitk_legacy_512x128x128x64_2x4_16x16x16_0x0x0,0.0,65.3,339.21
gfx942,80,424,384,7168,False,torch.bfloat16,torch.bfloat16,False,False,opus,50200,6,34.3013,opus_gemm_gfx942_splitk_legacy_512x128x128x64_2x4_16x16x16_0x0x0,0.0,68.05,347.19
gfx942,80,432,384,7168,False,torch.bfloat16,torch.bfloat16,False,False,opus,50200,6,34.8201,opus_gemm_gfx942_splitk_legacy_512x128x128x64_2x4_16x16x16_0x0x0,0.0,68.3,345.49
gfx942,80,440,384,7168,False,torch.bfloat16,torch.bfloat16,False,False,opus,50200,6,35.0038,opus_gemm_gfx942_splitk_legacy_512x128x128x64_2x4_16x16x16_0x0x0,0.0,69.2,347.13
gfx942,80,448,384,7168,False,torch.bfloat16,torch.bfloat16,False,False,opus,50200,6,35.004,opus_gemm_gfx942_splitk_legacy_512x128x128x64_2x4_16x16x16_0x0x0,0.0,70.46,350.58
gfx942,80,456,384,7168,False,torch.bfloat16,torch.bfloat16,False,False,opus,50200,6,35.1986,opus_gemm_gfx942_splitk_legacy_512x128x128x64_2x4_16x16x16_0x0x0,0.0,71.32,352.07
gfx942,80,464,384,7168,False,torch.bfloat16,torch.bfloat16,False,False,opus,50200,6,35.1434,opus_gemm_gfx942_splitk_legacy_512x128x128x64_2x4_16x16x16_0x0x0,0.0,72.68,356.06
gfx942,80,472,384,7168,False,torch.bfloat16,torch.bfloat16,False,False,opus,50200,6,35.3493,opus_gemm_gfx942_splitk_legacy_512x128x128x64_2x4_16x16x16_0x0x0,0.0,73.51,357.41
gfx942,80,488,384,7168,False,torch.bfloat16,torch.bfloat16,False,False,opus,50200,6,35.6812,opus_gemm_gfx942_splitk_legacy_512x128x128x64_2x4_16x16x16_0x0x0,0.0,75.29,360.86
gfx942,80,496,384,7168,False,torch.bfloat16,torch.bfloat16,False,False,opus,50200,6,35.7075,opus_gemm_gfx942_splitk_legacy_512x128x128x64_2x4_16x16x16_0x0x0,0.0,76.47,363.97
gfx942,80,504,384,7168,False,torch.bfloat16,torch.bfloat16,False,False,opus,50200,6,35.6134,opus_gemm_gfx942_splitk_legacy_512x128x128x64_2x4_16x16x16_0x0x0,0.0,77.91,368.33
gfx942,80,360,4096,512,False,torch.bfloat16,torch.bfloat16,False,False,opus,50011,0,24.4607,opus_gemm_gfx942_p1_256x64x64x64_2x2_16x16x16_0x0x0,0.0,61.73,307.11
gfx942,80,1,7168,512,False,torch.bfloat16,torch.bfloat16,False,False,opus,50011,0,9.6876,opus_gemm_gfx942_p1_256x64x64x64_2x2_16x16x16_0x0x0,0.0,0.76,759.26
gfx942,80,48,7168,512,False,torch.bfloat16,torch.bfloat16,False,False,opus,50003,0,10.7835,opus_gemm_gfx942_p1_bk128_256x64x64x128_2x2_16x16x16_0x0x0,0.0,32.67,749.04
gfx942,80,72,7168,512,False,torch.bfloat16,torch.bfloat16,False,False,opus,50000,0,14.5067,opus_gemm_gfx942_512x128x128x64_2x4_16x16x16_0x0x0,0.0,36.43,582.21
gfx942,80,80,7168,512,False,torch.bfloat16,torch.bfloat16,False,False,opus,50000,0,14.7701,opus_gemm_gfx942_512x128x128x64_2x4_16x16x16_0x0x0,0.0,39.76,580.15
gfx942,80,120,7168,512,False,torch.bfloat16,torch.bfloat16,False,False,opus,50000,0,15.6373,opus_gemm_gfx942_512x128x128x64_2x4_16x16x16_0x0x0,0.0,56.33,587.26
