aiter/configs/model_configs/minimax_m3_eagle_bf16_tuned_gemm.csv
gfx,cu_num,M,N,K,bias,dtype,outdtype,scaleAB,bpreshuffle,libtype,solidx,splitK,us,kernelName,err_ratio,tflops,bw
gfx950,256,1,2304,6144,False,torch.bfloat16,torch.bfloat16,False,False,flydsl,2600,6,7.632,flydsl_gemm3_abf16_wbf16_bf16_t16x64x128_split_k6_block_m_warp1_block_n_warp2_block_k_warp1_async_copyTrue_b_to_ldsTrue_b_preshuffleFalse_c_to_ldsFalse_gfx950,0.0135,3.71,3711.8
gfx950,256,1,2560,6144,False,torch.bfloat16,torch.bfloat16,False,False,flydsl,7470,6,8.153,flydsl_gemm8_abf16_wbf16_bf16_t16x64x64_split_k6_block_m_warp1_block_n_warp1_block_k_warp1_async_copyTrue_b_to_ldsTrue_b_preshuffleFalse_c_to_ldsFalse_gfx950,0.0148,3.86,3860.5
gfx950,256,1,6144,2048,False,torch.bfloat16,torch.bfloat16,False,False,flydsl,4016,2,6.9232,flydsl_gemm7_abf16_wbf16_bf16_t16x64x64_split_k2_block_m_warp1_block_n_warp1_block_k_warp2_async_copyTrue_b_to_ldsTrue_b_preshuffleFalse_c_to_ldsFalse_gfx950,0.0076,3.63,3637.37
gfx950,256,1,6144,4608,False,torch.bfloat16,torch.bfloat16,False,False,flydsl,6707,2,11.2657,flydsl_gemm6_abf16_wbf16_bf16_t16x64x64_split_k2_block_m_warp1_block_n_warp2_block_k_warp1_async_copyTrue_b_to_ldsTrue_b_preshuffleFalse_c_to_ldsFalse_gfx950,0.005,5.03,5028.06
gfx950,256,1,6144,12288,False,torch.bfloat16,torch.bfloat16,False,False,flydsl,2528,4,27.7247,flydsl_gemm3_abf16_wbf16_bf16_t16x128x128_split_k4_block_m_warp1_block_n_warp4_block_k_warp1_async_copyTrue_b_to_ldsTrue_b_preshuffleFalse_c_to_ldsFalse_gfx950,0.0146,5.45,5447.55
gfx950,256,1,6144,18432,False,torch.bfloat16,torch.bfloat16,False,False,flydsl,7279,2,38.7122,flydsl_gemm6_abf16_wbf16_bf16_t16x64x128_split_k2_block_m_warp1_block_n_warp1_block_k_warp2_async_copyTrue_b_to_ldsTrue_b_preshuffleFalse_c_to_ldsFalse_gfx950,0.0161,5.85,5851.94
gfx950,256,1,9216,6144,False,torch.bfloat16,torch.bfloat16,False,False,flydsl,35,6,21.2801,flydsl_gemm2_abf16_wbf16_bf16_t16x128x128_split_k6_block_m_warp1_block_n_warp4_block_k_warp1_async_copyTrue_b_to_ldsTrue_b_preshuffleFalse_c_to_ldsFalse_gfx950,0.0179,5.32,5323.14
gfx950,256,1,50016,6144,False,torch.bfloat16,torch.bfloat16,False,False,triton,0,0,102.3889,auto,0.0,6.0,6003.67
gfx950,256,2,2304,6144,False,torch.bfloat16,torch.bfloat16,False,False,flydsl,2600,6,7.7182,flydsl_gemm3_abf16_wbf16_bf16_t16x64x128_split_k6_block_m_warp1_block_n_warp2_block_k_warp1_async_copyTrue_b_to_ldsTrue_b_preshuffleFalse_c_to_ldsFalse_gfx950,0.0135,7.34,3672.53
gfx950,256,2,2560,6144,False,torch.bfloat16,torch.bfloat16,False,False,flydsl,7038,6,8.3745,flydsl_gemm7_abf16_wbf16_bf16_t16x64x64_split_k6_block_m_warp1_block_n_warp2_block_k_warp1_async_copyTrue_b_to_ldsTrue_b_preshuffleFalse_c_to_ldsFalse_gfx950,0.0133,7.51,3760.47
gfx950,256,2,6144,2048,False,torch.bfloat16,torch.bfloat16,False,False,flydsl,3653,2,7.0945,flydsl_gemm6_abf16_wbf16_bf16_t16x64x64_split_k2_block_m_warp1_block_n_warp2_block_k_warp1_async_copyTrue_b_to_ldsTrue_b_preshuffleFalse_c_to_ldsFalse_gfx950,0.0027,7.09,3551.85
gfx950,256,2,6144,4608,False,torch.bfloat16,torch.bfloat16,False,False,flydsl,7384,4,11.8387,flydsl_gemm7_abf16_wbf16_bf16_t16x128x64_split_k4_block_m_warp1_block_n_warp2_block_k_warp1_async_copyTrue_b_to_ldsTrue_b_preshuffleFalse_c_to_ldsFalse_gfx950,0.0116,9.57,4786.51
gfx950,256,2,6144,12288,False,torch.bfloat16,torch.bfloat16,False,False,flydsl,4222,4,27.8445,flydsl_gemm4_abf16_wbf16_bf16_t16x128x128_split_k4_block_m_warp1_block_n_warp4_block_k_warp1_async_copyTrue_b_to_ldsTrue_b_preshuffleFalse_c_to_ldsFalse_gfx950,0.0144,10.85,5425.44
gfx950,256,2,6144,18432,False,torch.bfloat16,torch.bfloat16,False,False,flydsl,4895,2,38.8141,flydsl_gemm4_abf16_wbf16_bf16_t16x64x128_split_k2_block_m_warp1_block_n_warp1_block_k_warp2_async_copyTrue_b_to_ldsTrue_b_preshuffleFalse_c_to_ldsFalse_gfx950,0.0155,11.67,5837.85
gfx950,256,2,9216,6144,False,torch.bfloat16,torch.bfloat16,False,False,flydsl,35,6,21.5288,flydsl_gemm2_abf16_wbf16_bf16_t16x128x128_split_k6_block_m_warp1_block_n_warp4_block_k_warp1_async_copyTrue_b_to_ldsTrue_b_preshuffleFalse_c_to_ldsFalse_gfx950,0.0178,10.52,5263.07
gfx950,256,2,50016,6144,False,torch.bfloat16,torch.bfloat16,False,False,triton,0,0,103.0938,auto,0.0,11.92,5963.71
gfx950,256,4,2304,6144,False,torch.bfloat16,torch.bfloat16,False,False,flydsl,2600,6,8.0303,flydsl_gemm3_abf16_wbf16_bf16_t16x64x128_split_k6_block_m_warp1_block_n_warp2_block_k_warp1_async_copyTrue_b_to_ldsTrue_b_preshuffleFalse_c_to_ldsFalse_gfx950,0.0157,14.1,3534.01
gfx950,256,4,2560,6144,False,torch.bfloat16,torch.bfloat16,False,False,flydsl,6401,6,8.3749,flydsl_gemm6_abf16_wbf16_bf16_t16x64x64_split_k6_block_m_warp1_block_n_warp2_block_k_warp1_async_copyTrue_b_to_ldsTrue_b_preshuffleFalse_c_to_ldsFalse_gfx950,0.0154,15.02,3764.45
gfx950,256,4,6144,2048,False,torch.bfloat16,torch.bfloat16,False,False,flydsl,2449,2,7.263,flydsl_gemm4_abf16_wbf16_bf16_t16x64x128_split_k2_block_m_warp1_block_n_warp2_block_k_warp1_async_copyTrue_b_to_ldsTrue_b_preshuffleFalse_c_to_ldsFalse_gfx950,0.0029,13.86,3473.96
gfx950,256,4,6144,4608,False,torch.bfloat16,torch.bfloat16,False,False,flydsl,7915,2,11.6443,flydsl_gemm8_abf16_wbf16_bf16_t16x64x64_split_k2_block_m_warp1_block_n_warp1_block_k_warp2_async_copyTrue_b_to_ldsTrue_b_preshuffleFalse_c_to_ldsFalse_gfx950,0.0121,19.45,4870.12
gfx950,256,4,6144,12288,False,torch.bfloat16,torch.bfloat16,False,False,flydsl,2528,4,27.9453,flydsl_gemm3_abf16_wbf16_bf16_t16x128x128_split_k4_block_m_warp1_block_n_warp4_block_k_warp1_async_copyTrue_b_to_ldsTrue_b_preshuffleFalse_c_to_ldsFalse_gfx950,0.0144,21.61,5408.51
gfx950,256,4,6144,18432,False,torch.bfloat16,torch.bfloat16,False,False,flydsl,6319,2,38.9574,flydsl_gemm5_abf16_wbf16_bf16_t16x64x128_split_k2_block_m_warp1_block_n_warp1_block_k_warp2_async_copyTrue_b_to_ldsTrue_b_preshuffleFalse_c_to_ldsFalse_gfx950,0.0165,23.26,5818.9
gfx950,256,4,9216,6144,False,torch.bfloat16,torch.bfloat16,False,False,flydsl,35,6,21.9301,flydsl_gemm2_abf16_wbf16_bf16_t16x128x128_split_k6_block_m_warp1_block_n_warp4_block_k_warp1_async_copyTrue_b_to_ldsTrue_b_preshuffleFalse_c_to_ldsFalse_gfx950,0.017,20.66,5169.57
gfx950,256,4,50016,6144,False,torch.bfloat16,torch.bfloat16,False,False,triton,0,0,103.6984,auto,0.0,23.71,5931.1
gfx950,256,8,2304,6144,False,torch.bfloat16,torch.bfloat16,False,False,flydsl,7472,6,8.1056,flydsl_gemm8_abf16_wbf16_bf16_t16x64x64_split_k6_block_m_warp1_block_n_warp2_block_k_warp1_async_copyTrue_b_to_ldsTrue_b_preshuffleFalse_c_to_ldsFalse_gfx950,0.0186,27.94,3509.51
gfx950,256,8,2560,6144,False,torch.bfloat16,torch.bfloat16,False,False,flydsl,7038,6,8.636,flydsl_gemm7_abf16_wbf16_bf16_t16x64x64_split_k6_block_m_warp1_block_n_warp2_block_k_warp1_async_copyTrue_b_to_ldsTrue_b_preshuffleFalse_c_to_ldsFalse_gfx950,0.0173,29.14,3658.7
gfx950,256,8,6144,2048,False,torch.bfloat16,torch.bfloat16,False,False,triton,0,0,7.3991,auto,0.0,27.21,3418.92
gfx950,256,8,6144,4608,False,torch.bfloat16,torch.bfloat16,False,False,flydsl,7423,2,12.4128,flydsl_gemm7_abf16_wbf16_bf16_t16x64x64_split_k2_block_m_warp1_block_n_warp2_block_k_warp1_async_copyTrue_b_to_ldsTrue_b_preshuffleFalse_c_to_ldsFalse_gfx950,0.0049,36.49,4575.53
gfx950,256,8,6144,6144,False,torch.bfloat16,torch.bfloat16,False,False,flydsl,5531,2,15.176,flydsl_gemm5_abf16_wbf16_bf16_t16x64x128_split_k2_block_m_warp1_block_n_warp2_block_k_warp1_async_copyTrue_b_to_ldsTrue_b_preshuffleFalse_c_to_ldsFalse_gfx950,0.0058,39.8,4987.75
gfx950,256,8,6144,12288,False,torch.bfloat16,torch.bfloat16,False,False,flydsl,2528,4,28.316,flydsl_gemm3_abf16_wbf16_bf16_t16x128x128_split_k4_block_m_warp1_block_n_warp4_block_k_warp1_async_copyTrue_b_to_ldsTrue_b_preshuffleFalse_c_to_ldsFalse_gfx950,0.0154,42.66,5342.91
gfx950,256,8,6144,18432,False,torch.bfloat16,torch.bfloat16,False,False,flydsl,4896,2,39.0567,flydsl_gemm4_abf16_wbf16_bf16_t16x64x128_split_k2_block_m_warp1_block_n_warp2_block_k_warp1_async_copyTrue_b_to_ldsTrue_b_preshuffleFalse_c_to_ldsFalse_gfx950,0.0076,46.39,5809.13
gfx950,256,8,9216,6144,False,torch.bfloat16,torch.bfloat16,False,False,flydsl,32,6,22.9846,flydsl_gemm2_abf16_wbf16_bf16_t16x128x128_split_k6_block_m_warp1_block_n_warp1_block_k_warp4_async_copyTrue_b_to_ldsTrue_b_preshuffleFalse_c_to_ldsFalse_gfx950,0.0325,39.42,4937.74
gfx950,256,8,50016,6144,False,torch.bfloat16,torch.bfloat16,False,False,triton,0,0,104.5808,auto,0.0,47.01,5885.36
gfx950,256,16,2304,6144,False,torch.bfloat16,torch.bfloat16,False,False,flydsl,7472,6,8.6242,flydsl_gemm8_abf16_wbf16_bf16_t16x64x64_split_k6_block_m_warp1_block_n_warp2_block_k_warp1_async_copyTrue_b_to_ldsTrue_b_preshuffleFalse_c_to_ldsFalse_gfx950,0.0171,52.52,3314.15
gfx950,256,16,2560,6144,False,torch.bfloat16,torch.bfloat16,False,False,flydsl,4294,6,9.4844,flydsl_gemm4_abf16_wbf16_bf16_t16x64x128_split_k6_block_m_warp1_block_n_warp2_block_k_warp1_async_copyTrue_b_to_ldsTrue_b_preshuffleFalse_c_to_ldsFalse_gfx950,0.0175,53.07,3346.11
gfx950,256,16,6144,2048,False,torch.bfloat16,torch.bfloat16,False,False,triton,0,0,7.9217,auto,0.0,50.83,3209.91
gfx950,256,16,6144,4608,False,torch.bfloat16,torch.bfloat16,False,False,flydsl,4401,2,12.6048,flydsl_gemm4_abf16_wbf16_bf16_t16x64x128_split_k2_block_m_warp1_block_n_warp2_block_k_warp1_async_copyTrue_b_to_ldsTrue_b_preshuffleFalse_c_to_ldsFalse_gfx950,0.005,71.87,4519.48
gfx950,256,16,6144,12288,False,torch.bfloat16,torch.bfloat16,False,False,flydsl,2528,4,29.2579,flydsl_gemm3_abf16_wbf16_bf16_t16x128x128_split_k4_block_m_warp1_block_n_warp4_block_k_warp1_async_copyTrue_b_to_ldsTrue_b_preshuffleFalse_c_to_ldsFalse_gfx950,0.0149,82.57,5180.99
gfx950,256,16,6144,18432,False,torch.bfloat16,torch.bfloat16,False,False,flydsl,2983,2,39.9249,flydsl_gemm3_abf16_wbf16_bf16_t16x64x256_split_k2_block_m_warp1_block_n_warp1_block_k_warp2_async_copyTrue_b_to_ldsTrue_b_preshuffleFalse_c_to_ldsFalse_gfx950,0.0167,90.77,5692.66
gfx950,256,16,9216,6144,False,torch.bfloat16,torch.bfloat16,False,False,flydsl,4210,2,24.4916,flydsl_gemm4_abf16_wbf16_bf16_t16x128x128_split_k2_block_m_warp1_block_n_warp4_block_k_warp1_async_copyTrue_b_to_ldsTrue_b_preshuffleFalse_c_to_ldsFalse_gfx950,0.0054,73.98,4643.95
gfx950,256,16,50016,6144,False,torch.bfloat16,torch.bfloat16,False,False,triton,0,0,109.9794,auto,0.0,89.41,5604.63
gfx950,256,32,2304,6144,False,torch.bfloat16,torch.bfloat16,False,False,flydsl,7589,6,10.1809,flydsl_gemm8_abf16_wbf16_bf16_t32x64x64_split_k6_block_m_warp1_block_n_warp4_block_k_warp1_async_copyTrue_b_to_ldsTrue_b_preshuffleFalse_c_to_ldsFalse_gfx950,0.0172,88.99,2833.96
gfx950,256,32,2560,6144,False,torch.bfloat16,torch.bfloat16,False,False,flydsl,5533,3,10.4483,flydsl_gemm5_abf16_wbf16_bf16_t16x64x128_split_k3_block_m_warp1_block_n_warp1_block_k_warp2_async_copyTrue_b_to_ldsTrue_b_preshuffleFalse_c_to_ldsFalse_gfx950,0.0175,96.34,3064.07
gfx950,256,32,6144,2048,False,torch.bfloat16,torch.bfloat16,False,False,triton,0,0,8.173,auto,0.0,98.53,3143.29
gfx950,256,32,6144,4608,False,torch.bfloat16,torch.bfloat16,False,False,triton,0,0,14.4783,auto,0.0,125.15,3958.42
gfx950,256,32,6144,12288,False,torch.bfloat16,torch.bfloat16,False,False,flydsl,2714,4,31.9239,flydsl_gemm3_abf16_wbf16_bf16_t32x128x128_split_k4_block_m_warp2_block_n_warp2_block_k_warp2_async_copyTrue_b_to_ldsTrue_b_preshuffleFalse_c_to_ldsFalse_gfx950,0.0228,151.35,4766.79
gfx950,256,32,6144,18432,False,torch.bfloat16,torch.bfloat16,False,False,flydsl,3375,2,43.3481,flydsl_gemm3_abf16_wbf16_bf16_t32x64x256_split_k2_block_m_warp1_block_n_warp4_block_k_warp1_async_copyTrue_b_to_ldsTrue_b_preshuffleFalse_c_to_ldsFalse_gfx950,0.0077,167.2,5261.25
gfx950,256,32,9216,6144,False,torch.bfloat16,torch.bfloat16,False,False,flydsl,4282,1,27.1169,flydsl_gemm4_abf16_wbf16_bf16_t16x64x128_split_k1_block_m_warp1_block_n_warp2_block_k_warp1_async_copyTrue_b_to_ldsTrue_b_preshuffleFalse_c_to_ldsFalse_gfx950,0.0,133.64,4212.47
gfx950,256,32,50016,6144,False,torch.bfloat16,torch.bfloat16,False,False,triton,0,0,119.3278,auto,0.0,164.82,5180.61
gfx950,256,64,2304,6144,False,torch.bfloat16,torch.bfloat16,False,False,flydsl,4947,4,13.0628,flydsl_gemm3_abf16_wbf16_bf16_t64x64x128_split_k4_block_m_warp4_block_n_warp1_block_k_warp1_async_copyTrue_b_to_ldsTrue_b_preshuffleFalse_c_to_ldsFalse_gfx950,0.013,138.71,2250.12
gfx950,256,64,2560,6144,False,torch.bfloat16,torch.bfloat16,False,False,flydsl,6160,3,12.8967,flydsl_gemm4_abf16_wbf16_bf16_t32x64x128_split_k3_block_m_warp2_block_n_warp2_block_k_warp1_async_copyTrue_b_to_ldsTrue_b_preshuffleFalse_c_to_ldsFalse_gfx950,0.0101,156.11,2525.56
gfx950,256,64,6144,2048,False,torch.bfloat16,torch.bfloat16,False,False,flydsl,3508,1,9.6728,flydsl_gemm4_abf16_wbf16_bf16_t32x64x128_split_k1_block_m_warp2_block_n_warp2_block_k_warp1_async_copyTrue_b_to_ldsTrue_b_preshuffleFalse_c_to_ldsFalse_gfx950,0.0,166.51,2710.11
gfx950,256,64,6144,4608,False,torch.bfloat16,torch.bfloat16,False,False,triton,0,0,18.2873,auto,0.0,198.16,3171.56
gfx950,256,64,6144,12288,False,torch.bfloat16,torch.bfloat16,False,False,torch,0,0,36.9248,native,0.0,261.71,4153.15
gfx950,256,64,6144,18432,False,torch.bfloat16,torch.bfloat16,False,False,torch,0,0,47.3602,native,0.0,306.07,4848.76
gfx950,256,64,9216,6144,False,torch.bfloat16,torch.bfloat16,False,False,flydsl,4166,1,30.8581,flydsl_gemm3_abf16_wbf16_bf16_t32x64x128_split_k1_block_m_warp2_block_n_warp1_block_k_warp1_async_copyTrue_b_to_ldsTrue_b_preshuffleFalse_c_to_ldsFalse_gfx950,0.0,234.87,3733.62
gfx950,256,64,50016,6144,False,torch.bfloat16,torch.bfloat16,False,False,torch,0,0,127.4985,native,0.0,308.51,4876.8
gfx950,256,128,2304,6144,False,torch.bfloat16,torch.bfloat16,False,False,asm,5,3,17.5597,_ZN5aiter39bf16gemm_fp32bf16_tn_64x64_splitk_cleanE,0.0101,206.37,1735.46
gfx950,256,128,2560,6144,False,torch.bfloat16,torch.bfloat16,False,False,asm,5,3,18.2592,_ZN5aiter39bf16gemm_fp32bf16_tn_64x64_splitk_cleanE,0.0101,220.52,1844.85
gfx950,256,128,6144,2048,False,torch.bfloat16,torch.bfloat16,False,False,flydsl,4892,1,11.2883,flydsl_gemm5_abf16_wbf16_bf16_t64x64x128_split_k1_block_m_warp4_block_n_warp2_block_k_warp1_async_copyTrue_b_to_ldsTrue_b_preshuffleFalse_c_to_ldsFalse_gfx950,0.0,285.36,2415.15
gfx950,256,128,6144,4608,False,torch.bfloat16,torch.bfloat16,False,False,flydsl,7460,1,22.7009,flydsl_gemm4_abf16_wbf16_bf16_t48x64x64_split_k1_block_m_warp1_block_n_warp2_block_k_warp1_async_copyTrue_b_to_ldsTrue_b_preshuffleFalse_c_to_ldsFalse_gfx950,0.0,319.27,2615.56
gfx950,256,128,6144,12288,False,torch.bfloat16,torch.bfloat16,False,False,torch,0,0,42.7609,native,0.0,451.99,3641.49
gfx950,256,128,6144,18432,False,torch.bfloat16,torch.bfloat16,False,False,torch,0,0,54.4478,native,0.0,532.46,4275.36
gfx950,256,128,9216,6144,False,torch.bfloat16,torch.bfloat16,False,False,torch,0,0,37.9916,native,0.0,381.55,3084.32
gfx950,256,128,50016,6144,False,torch.bfloat16,torch.bfloat16,False,False,torch,0,0,144.8803,native,0.0,542.99,4341.33
gfx950,256,196,128,6144,False,torch.bfloat16,torch.bfloat16,False,False,flydsl,8784,8,6.6515,flydsl_gemm8_abf16_wbf16_bf16_t16x64x64_split_k8_block_m_warp1_block_n_warp2_block_k_warp1_async_copyTrue_b_to_ldsTrue_b_preshuffleFalse_c_to_ldsFalse_gfx950,0.0213,46.35,606.1
gfx950,256,196,2304,6144,False,torch.bfloat16,torch.bfloat16,False,False,flydsl,6895,1,20.0019,flydsl_gemm4_abf16_wbf16_bf16_t32x64x128_split_k1_block_m_warp1_block_n_warp4_block_k_warp1_async_copyTrue_b_to_ldsTrue_b_preshuffleFalse_c_to_ldsFalse_gfx950,0.0,277.43,1581.01
gfx950,256,196,2560,6144,False,torch.bfloat16,torch.bfloat16,False,False,asm,7,2,23.4609,_ZN5aiter39bf16gemm_fp32bf16_tn_80x64_splitk_cleanE,0.0058,262.8,1486.27
gfx950,256,196,6144,2048,False,torch.bfloat16,torch.bfloat16,False,False,flydsl,2244,1,14.2707,flydsl_gemm3_abf16_wbf16_bf16_t128x64x128_split_k1_block_m_warp2_block_n_warp4_block_k_warp2_async_copyTrue_b_to_ldsTrue_b_preshuffleFalse_c_to_ldsFalse_gfx950,0.0034,345.64,1988.49
gfx950,256,196,6144,3072,False,torch.bfloat16,torch.bfloat16,False,False,flydsl,3874,1,19.7757,flydsl_gemm3_abf16_wbf16_bf16_t128x64x128_split_k1_block_m_warp2_block_n_warp4_block_k_warp2_async_copyTrue_b_to_ldsTrue_b_preshuffleFalse_c_to_ldsFalse_gfx950,0.0042,374.13,2091.53
gfx950,256,196,6144,4608,False,torch.bfloat16,torch.bfloat16,False,False,flydsl,4077,1,27.9519,flydsl_gemm3_abf16_wbf16_bf16_t128x64x128_split_k1_block_m_warp4_block_n_warp2_block_k_warp2_async_copyTrue_b_to_ldsTrue_b_preshuffleFalse_c_to_ldsFalse_gfx950,0.0052,397.04,2176.52
gfx950,256,196,6144,6144,False,torch.bfloat16,torch.bfloat16,False,False,flydsl,3938,1,36.9808,flydsl_gemm3_abf16_wbf16_bf16_t128x64x128_split_k1_block_m_warp2_block_n_warp4_block_k_warp2_async_copyTrue_b_to_ldsTrue_b_preshuffleFalse_c_to_ldsFalse_gfx950,0.0057,400.14,2171.79
gfx950,256,196,6144,12288,False,torch.bfloat16,torch.bfloat16,False,False,torch,0,0,61.3591,native,0.0,482.32,2578.6
gfx950,256,196,6144,18432,False,torch.bfloat16,torch.bfloat16,False,False,torch,0,0,74.969,native,0.0,592.14,3149.65
gfx950,256,196,9216,6144,False,torch.bfloat16,torch.bfloat16,False,False,torch,0,0,47.5847,native,0.0,466.46,2506.42
gfx950,256,196,50016,6144,False,torch.bfloat16,torch.bfloat16,False,False,opus,9,0,168.0445,opus_gemm_512x256x256x64_2x4_16x16x32_0x0x0,0.0,716.84,3788.35
gfx950,256,256,2304,6144,False,torch.bfloat16,torch.bfloat16,False,False,torch,0,0,24.5201,native,0.0,295.58,1331.03
gfx950,256,256,2560,6144,False,torch.bfloat16,torch.bfloat16,False,False,asm,8,2,25.3391,_ZN5aiter39bf16gemm_fp32bf16_tn_96x64_splitk_cleanE,0.0057,317.81,1417.32
gfx950,256,256,6144,2048,False,torch.bfloat16,torch.bfloat16,False,False,flydsl,4440,1,15.1609,flydsl_gemm4_abf16_wbf16_bf16_t96x64x64_split_k1_block_m_warp2_block_n_warp2_block_k_warp1_async_copyTrue_b_to_ldsTrue_b_preshuffleFalse_c_to_ldsFalse_gfx950,0.0,424.94,1936.57
gfx950,256,256,6144,4608,False,torch.bfloat16,torch.bfloat16,False,False,torch,0,0,30.1422,native,0.0,480.9,2061.17
gfx950,256,256,6144,12288,False,torch.bfloat16,torch.bfloat16,False,False,flydsl,7773,1,78.8468,flydsl_gemm4_abf16_wbf16_bf16_t96x64x64_split_k1_block_m_warp2_block_n_warp2_block_k_warp1_async_copyTrue_b_to_ldsTrue_b_preshuffleFalse_c_to_ldsFalse_gfx950,0.0,490.25,2034.73
gfx950,256,256,6144,18432,False,torch.bfloat16,torch.bfloat16,False,False,torch,0,0,86.3833,native,0.0,671.22,2767.61
gfx950,256,256,9216,6144,False,torch.bfloat16,torch.bfloat16,False,False,torch,0,0,51.8722,native,0.0,558.89,2334.79
gfx950,256,256,50016,6144,False,torch.bfloat16,torch.bfloat16,False,False,torch,0,0,168.7337,native,0.0,932.46,3812.82
gfx950,256,320,128,6144,False,torch.bfloat16,torch.bfloat16,False,False,flydsl,5287,6,7.6935,flydsl_gemm4_abf16_wbf16_bf16_t16x64x128_split_k6_block_m_warp1_block_n_warp1_block_k_warp2_async_copyTrue_b_to_ldsTrue_b_preshuffleFalse_c_to_ldsFalse_gfx950,0.0266,65.42,726.19
gfx950,256,320,2304,6144,False,torch.bfloat16,torch.bfloat16,False,False,flydsl,5531,1,27.1301,flydsl_gemm3_abf16_wbf16_bf16_t64x64x128_split_k1_block_m_warp2_block_n_warp2_block_k_warp2_async_copyTrue_b_to_ldsTrue_b_preshuffleFalse_c_to_ldsFalse_gfx950,0.0055,333.94,1242.84
gfx950,256,320,2560,6144,False,torch.bfloat16,torch.bfloat16,False,False,flydsl,5531,1,27.2613,flydsl_gemm3_abf16_wbf16_bf16_t64x64x128_split_k1_block_m_warp2_block_n_warp2_block_k_warp2_async_copyTrue_b_to_ldsTrue_b_preshuffleFalse_c_to_ldsFalse_gfx950,0.0055,369.25,1358.26
gfx950,256,320,6144,2048,False,torch.bfloat16,torch.bfloat16,False,False,flydsl,2932,1,15.5421,flydsl_gemm3_abf16_wbf16_bf16_t64x128x128_split_k1_block_m_warp2_block_n_warp4_block_k_warp2_async_copyTrue_b_to_ldsTrue_b_preshuffleFalse_c_to_ldsFalse_gfx950,0.0034,518.15,1956.54
gfx950,256,320,6144,3072,False,torch.bfloat16,torch.bfloat16,False,False,flydsl,5066,1,21.9178,flydsl_gemm3_abf16_wbf16_bf16_t64x128x128_split_k1_block_m_warp2_block_n_warp4_block_k_warp2_async_copyTrue_b_to_ldsTrue_b_preshuffleFalse_c_to_ldsFalse_gfx950,0.0042,551.13,1991.39
gfx950,256,320,6144,4608,False,torch.bfloat16,torch.bfloat16,False,False,flydsl,5348,1,32.3949,flydsl_gemm3_abf16_wbf16_bf16_t64x128x128_split_k1_block_m_warp2_block_n_warp4_block_k_warp2_async_copyTrue_b_to_ldsTrue_b_preshuffleFalse_c_to_ldsFalse_gfx950,0.0052,559.33,1960.32
gfx950,256,320,6144,6144,False,torch.bfloat16,torch.bfloat16,False,False,flydsl,5142,1,42.1862,flydsl_gemm3_abf16_wbf16_bf16_t64x128x128_split_k1_block_m_warp2_block_n_warp4_block_k_warp2_async_copyTrue_b_to_ldsTrue_b_preshuffleFalse_c_to_ldsFalse_gfx950,0.0057,572.68,1976.04
gfx950,256,320,6144,12288,False,torch.bfloat16,torch.bfloat16,False,False,torch,0,0,79.0458,native,0.0,611.27,2059.46
gfx950,256,320,6144,18432,False,torch.bfloat16,torch.bfloat16,False,False,torch,0,0,100.3848,native,0.0,722.0,2412.93
gfx950,256,320,9216,6144,False,torch.bfloat16,torch.bfloat16,False,False,flydsl,6156,1,59.2289,flydsl_gemm4_abf16_wbf16_bf16_t128x128x64_split_k1_block_m_warp4_block_n_warp4_block_k_warp1_async_copyTrue_b_to_ldsTrue_b_preshuffleFalse_c_to_ldsFalse_gfx950,0.0,611.84,2077.98
gfx950,256,320,50016,6144,False,torch.bfloat16,torch.bfloat16,False,False,torch,0,0,211.3786,native,0.0,930.42,3077.6
gfx950,256,512,128,6144,False,torch.bfloat16,torch.bfloat16,False,False,flydsl,5284,4,9.3755,flydsl_gemm4_abf16_wbf16_bf16_t16x64x128_split_k4_block_m_warp1_block_n_warp1_block_k_warp2_async_copyTrue_b_to_ldsTrue_b_preshuffleFalse_c_to_ldsFalse_gfx950,0.0214,85.89,852.8
gfx950,256,512,2304,6144,False,torch.bfloat16,torch.bfloat16,False,False,flydsl,7710,1,33.9135,flydsl_gemm4_abf16_wbf16_bf16_t96x64x128_split_k1_block_m_warp2_block_n_warp2_block_k_warp1_async_copyTrue_b_to_ldsTrue_b_preshuffleFalse_c_to_ldsFalse_gfx950,0.0,427.43,1089.9
gfx950,256,512,2560,6144,False,torch.bfloat16,torch.bfloat16,False,False,flydsl,7706,1,34.2563,flydsl_gemm4_abf16_wbf16_bf16_t96x64x128_split_k1_block_m_warp1_block_n_warp2_block_k_warp2_async_copyTrue_b_to_ldsTrue_b_preshuffleFalse_c_to_ldsFalse_gfx950,0.0057,470.17,1178.47
gfx950,256,512,6144,2048,False,torch.bfloat16,torch.bfloat16,False,False,flydsl,3507,1,21.5278,flydsl_gemm4_abf16_wbf16_bf16_t128x128x64_split_k1_block_m_warp2_block_n_warp4_block_k_warp1_async_copyTrue_b_to_ldsTrue_b_preshuffleFalse_c_to_ldsFalse_gfx950,0.0,598.52,1558.66
gfx950,256,512,6144,3072,False,torch.bfloat16,torch.bfloat16,False,False,flydsl,6080,1,31.2831,flydsl_gemm4_abf16_wbf16_bf16_t128x128x64_split_k1_block_m_warp4_block_n_warp4_block_k_warp1_async_copyTrue_b_to_ldsTrue_b_preshuffleFalse_c_to_ldsFalse_gfx950,0.0,617.82,1508.35
gfx950,256,512,6144,4608,False,torch.bfloat16,torch.bfloat16,False,False,flydsl,6448,1,44.702,flydsl_gemm4_abf16_wbf16_bf16_t128x128x64_split_k1_block_m_warp4_block_n_warp4_block_k_warp1_async_copyTrue_b_to_ldsTrue_b_preshuffleFalse_c_to_ldsFalse_gfx950,0.0,648.54,1512.98
gfx950,256,512,6144,6144,False,torch.bfloat16,torch.bfloat16,False,False,flydsl,6156,1,58.6555,flydsl_gemm4_abf16_wbf16_bf16_t128x128x64_split_k1_block_m_warp4_block_n_warp4_block_k_warp1_async_copyTrue_b_to_ldsTrue_b_preshuffleFalse_c_to_ldsFalse_gfx950,0.0,659.01,1501.66
gfx950,256,512,6144,12288,False,torch.bfloat16,torch.bfloat16,False,False,torch,0,0,101.7255,native,0.0,759.98,1669.88
gfx950,256,512,6144,18432,False,torch.bfloat16,torch.bfloat16,False,False,torch,0,0,142.6715,native,0.0,812.81,1763.9
gfx950,256,512,9216,6144,False,torch.bfloat16,torch.bfloat16,False,False,flydsl,5787,1,84.8153,flydsl_gemm3_abf16_wbf16_bf16_t80x128x64_split_k1_block_m_warp1_block_n_warp2_block_k_warp1_async_copyTrue_b_to_ldsTrue_b_preshuffleFalse_c_to_ldsFalse_gfx950,0.0,683.63,1520.66
gfx950,256,512,50016,6144,False,torch.bfloat16,torch.bfloat16,False,False,torch,0,0,286.3382,native,0.0,1098.96,2347.24
gfx950,256,1024,128,6144,False,torch.bfloat16,torch.bfloat16,False,False,flydsl,3865,4,10.5962,flydsl_gemm3_abf16_wbf16_bf16_t32x64x128_split_k4_block_m_warp2_block_n_warp1_block_k_warp2_async_copyTrue_b_to_ldsTrue_b_preshuffleFalse_c_to_ldsFalse_gfx950,0.0209,152.0,1360.67
gfx950,256,1024,2304,6144,False,torch.bfloat16,torch.bfloat16,False,False,torch,0,0,50.2186,native,0.0,577.3,908.29
gfx950,256,1024,2560,6144,False,torch.bfloat16,torch.bfloat16,False,False,torch,0,0,49.6932,native,0.0,648.22,991.75
gfx950,256,1024,6144,2048,False,torch.bfloat16,torch.bfloat16,False,False,flydsl,2488,1,34.3352,flydsl_gemm3_abf16_wbf16_bf16_t256x128x64_split_k1_block_m_warp4_block_n_warp4_block_k_warp1_async_copyTrue_b_to_ldsTrue_b_preshuffleFalse_c_to_ldsFalse_gfx950,0.0,750.54,1221.58
gfx950,256,1024,6144,3072,False,torch.bfloat16,torch.bfloat16,False,False,torch,0,0,48.9624,native,0.0,789.48,1156.46
gfx950,256,1024,6144,4608,False,torch.bfloat16,torch.bfloat16,False,False,torch,0,0,68.959,native,0.0,840.82,1140.43
gfx950,256,1024,6144,6144,False,torch.bfloat16,torch.bfloat16,False,False,torch,0,0,79.4064,native,0.0,973.59,1267.7
gfx950,256,1024,6144,12288,False,torch.bfloat16,torch.bfloat16,False,False,torch,0,0,145.5676,native,0.0,1062.18,1296.61
gfx950,256,1024,6144,18432,False,torch.bfloat16,torch.bfloat16,False,False,torch,0,0,198.9335,native,0.0,1165.86,1391.54
gfx950,256,1024,9216,6144,False,torch.bfloat16,torch.bfloat16,False,False,torch,0,0,114.2432,native,0.0,1015.06,1266.63
gfx950,256,1024,50016,6144,False,torch.bfloat16,torch.bfloat16,False,False,torch,0,0,571.4903,native,0.0,1101.24,1276.68
gfx950,256,2048,128,6144,False,torch.bfloat16,torch.bfloat16,False,False,asm,5,4,15.6885,_ZN5aiter39bf16gemm_fp32bf16_tn_64x64_splitk_cleanE,0.013,205.32,1737.77
gfx950,256,2048,2304,6144,False,torch.bfloat16,torch.bfloat16,False,False,torch,0,0,74.5488,native,0.0,777.77,843.94
gfx950,256,2048,2560,6144,False,torch.bfloat16,torch.bfloat16,False,False,torch,0,0,76.1904,native,0.0,845.57,880.8
gfx950,256,2048,6144,2048,False,torch.bfloat16,torch.bfloat16,False,False,torch,0,0,52.1713,native,0.0,987.89,1125.53
gfx950,256,2048,6144,3072,False,torch.bfloat16,torch.bfloat16,False,False,torch,0,0,72.6451,native,0.0,1064.21,1039.26
gfx950,256,2048,6144,4608,False,torch.bfloat16,torch.bfloat16,False,False,torch,0,0,101.3455,native,0.0,1144.25,993.27
gfx950,256,2048,6144,6144,False,torch.bfloat16,torch.bfloat16,False,False,torch,0,0,129.3834,native,0.0,1195.04,972.53
gfx950,256,2048,6144,12288,False,torch.bfloat16,torch.bfloat16,False,False,torch,0,0,239.6452,native,0.0,1290.4,945.12
gfx950,256,2048,6144,18432,False,torch.bfloat16,torch.bfloat16,False,False,asm,10,1,351.2205,_ZN5aiter24bf16gemm_bf16_tn_256x256E,0.0,1320.7,931.48
gfx950,256,2048,9216,6144,False,torch.bfloat16,torch.bfloat16,False,False,torch,0,0,213.0331,native,0.0,1088.7,826.92
gfx950,256,2048,50016,6144,False,torch.bfloat16,torch.bfloat16,False,False,torch,0,0,938.8087,native,0.0,1340.74,899.68
gfx950,256,4096,128,6144,False,torch.bfloat16,torch.bfloat16,False,False,flydsl,6831,1,23.6078,flydsl_gemm5_abf16_wbf16_bf16_t32x64x128_split_k1_block_m_warp1_block_n_warp2_block_k_warp2_async_copyTrue_b_to_ldsTrue_b_preshuffleFalse_c_to_ldsFalse_gfx950,0.0058,272.9,2243.03
gfx950,256,4096,2304,6144,False,torch.bfloat16,torch.bfloat16,False,False,torch,0,0,112.4709,native,0.0,1031.06,867.05
gfx950,256,4096,2560,6144,False,torch.bfloat16,torch.bfloat16,False,False,torch,0,0,116.0093,native,0.0,1110.68,885.79
gfx950,256,4096,6144,2048,False,torch.bfloat16,torch.bfloat16,False,False,torch,0,0,98.7783,native,0.0,1043.54,934.16
gfx950,256,4096,6144,3072,False,torch.bfloat16,torch.bfloat16,False,False,torch,0,0,133.14,native,0.0,1161.33,850.58
gfx950,256,4096,6144,4608,False,torch.bfloat16,torch.bfloat16,False,False,torch,0,0,183.5122,native,0.0,1263.83,788.52
gfx950,256,4096,6144,6144,False,torch.bfloat16,torch.bfloat16,False,False,torch,0,0,244.2654,native,0.0,1265.99,721.19
gfx950,256,4096,6144,12288,False,torch.bfloat16,torch.bfloat16,False,False,torch,0,0,462.4625,native,0.0,1337.35,653.0
gfx950,256,4096,6144,18432,False,torch.bfloat16,torch.bfloat16,False,False,torch,0,0,690.9803,native,0.0,1342.6,619.15
gfx950,256,4096,9216,6144,False,torch.bfloat16,torch.bfloat16,False,False,torch,0,0,354.9603,native,0.0,1306.78,673.53
gfx950,256,4096,50016,6144,False,torch.bfloat16,torch.bfloat16,False,False,torch,0,0,1785.8897,native,0.0,1409.6,601.75
gfx950,256,8192,128,6144,False,torch.bfloat16,torch.bfloat16,False,False,torch,0,0,33.7545,native,0.0,381.72,3090.95
gfx950,256,8192,2304,6144,False,torch.bfloat16,torch.bfloat16,False,False,torch,0,0,212.3699,native,0.0,1092.1,785.06
gfx950,256,8192,2560,6144,False,torch.bfloat16,torch.bfloat16,False,False,torch,0,0,218.6696,native,0.0,1178.48,796.01
gfx950,256,8192,6144,2048,False,torch.bfloat16,torch.bfloat16,False,False,torch,0,0,161.8963,native,0.0,1273.4,984.48
gfx950,256,8192,6144,3072,False,torch.bfloat16,torch.bfloat16,False,False,torch,0,0,226.5372,native,0.0,1365.06,833.17
gfx950,256,8192,6144,4608,False,torch.bfloat16,torch.bfloat16,False,False,asm,10,1,323.969,_ZN5aiter24bf16gemm_bf16_tn_256x256E,0.0,1431.79,718.54
gfx950,256,8192,6144,6144,False,torch.bfloat16,torch.bfloat16,False,False,asm,10,1,410.101,_ZN5aiter24bf16gemm_bf16_tn_256x256E,0.0,1508.1,675.01
gfx950,256,8192,6144,12288,False,torch.bfloat16,torch.bfloat16,False,False,asm,10,1,818.7937,_ZN5aiter24bf16gemm_bf16_tn_256x256E,0.0,1510.7,553.23
gfx950,256,8192,6144,18432,False,torch.bfloat16,torch.bfloat16,False,False,asm,10,1,1176.1014,_ZN5aiter24bf16gemm_bf16_tn_256x256E,0.0,1577.61,534.94
gfx950,256,8192,9216,6144,False,torch.bfloat16,torch.bfloat16,False,False,asm,10,1,642.4189,_ZN5aiter24bf16gemm_bf16_tn_256x256E,0.0,1444.09,568.02
gfx950,256,8192,50016,6144,False,torch.bfloat16,torch.bfloat16,False,False,torch,0,0,3520.7733,native,0.0,1430.02,435.9
gfx950,256,16384,2304,6144,False,torch.bfloat16,torch.bfloat16,False,False,torch,0,0,356.6864,native,0.0,1300.46,855.47
gfx950,256,16384,2560,6144,False,torch.bfloat16,torch.bfloat16,False,False,torch,0,0,397.2797,native,0.0,1297.31,797.1
gfx950,256,16384,6144,2048,False,torch.bfloat16,torch.bfloat16,False,False,torch,0,0,308.7958,native,0.0,1335.24,950.79
gfx950,256,16384,6144,4608,False,torch.bfloat16,torch.bfloat16,False,False,torch,0,0,613.6774,native,0.0,1511.73,666.38
gfx950,256,16384,6144,12288,False,torch.bfloat16,torch.bfloat16,False,False,torch,0,0,1560.1716,native,0.0,1585.66,483.9
gfx950,256,16384,6144,18432,False,torch.bfloat16,torch.bfloat16,False,False,asm,10,1,2410.4692,_ZN5aiter24bf16gemm_bf16_tn_256x256E,0.0,1539.47,428.05
gfx950,256,16384,9216,6144,False,torch.bfloat16,torch.bfloat16,False,False,asm,10,1,1202.5289,_ZN5aiter24bf16gemm_bf16_tn_256x256E,0.0,1542.94,512.72
gfx950,256,16384,50016,6144,False,torch.bfloat16,torch.bfloat16,False,False,torch,0,0,6937.2331,native,0.0,1451.52,353.87
gfx950,256,32768,128,6144,False,torch.bfloat16,torch.bfloat16,False,False,torch,0,0,86.6542,native,0.0,594.77,4761.62
gfx950,256,32768,2304,6144,False,torch.bfloat16,torch.bfloat16,False,False,asm,10,1,687.055,_ZN5aiter24bf16gemm_bf16_tn_256x256E,0.0,1350.27,847.04
gfx950,256,32768,2560,6144,False,torch.bfloat16,torch.bfloat16,False,False,torch,0,0,676.5677,native,0.0,1523.56,889.61
gfx950,256,32768,6144,2048,False,torch.bfloat16,torch.bfloat16,False,False,torch,0,0,577.7226,native,0.0,1427.39,972.85
gfx950,256,32768,6144,3072,False,torch.bfloat16,torch.bfloat16,False,False,torch,0,0,840.8616,native,0.0,1471.05,763.18
gfx950,256,32768,6144,4608,False,torch.bfloat16,torch.bfloat16,False,False,asm,10,1,1243.7631,_ZN5aiter24bf16gemm_bf16_tn_256x256E,0.0,1491.78,612.07
gfx950,256,32768,6144,6144,False,torch.bfloat16,torch.bfloat16,False,False,torch,0,0,1584.5537,native,0.0,1561.26,555.87
gfx950,256,32768,6144,12288,False,torch.bfloat16,torch.bfloat16,False,False,torch,0,0,3207.5069,native,0.0,1542.57,423.68
gfx950,256,32768,6144,18432,False,torch.bfloat16,torch.bfloat16,False,False,asm,10,1,4855.3337,_ZN5aiter24bf16gemm_bf16_tn_256x256E,0.0,1528.57,378.37
gfx950,256,32768,9216,6144,False,torch.bfloat16,torch.bfloat16,False,False,asm,10,1,2451.0053,_ZN5aiter24bf16gemm_bf16_tn_256x256E,0.0,1514.01,456.91
gfx950,256,32768,50016,6144,False,torch.bfloat16,torch.bfloat16,False,False,torch,0,0,13839.0848,native,0.0,1455.23,310.36
