aiter/configs/model_configs/qwen3next_80b_fp8_tuned_fmoe.csv
cu_num,token,model_dim,inter_dim,expert,topk,act_type,dtype,q_dtype_a,q_dtype_w,q_type,use_g1u1,doweight_stage1,block_m,ksplit,us1,kernelName1,err1,us2,kernelName2,err2,us,run_1stage,xbf16,flat,tflops,bw,_tag
256,1,2048,512,512,10,ActivationType.Silu,torch.bfloat16,torch.float8_e4m3fn,torch.float8_e4m3fn,QuantType.per_1x128,1,0,1,0,29.1764,_ZN5aiter48fmoe_bf16_blockscaleBf16_g1u1_flat_vs_silu_1x128E,0.0%,0.0,,0.0%,29.1764,1,1,1,2.16,55202.8,
256,2,2048,512,512,10,ActivationType.Silu,torch.bfloat16,torch.float8_e4m3fn,torch.float8_e4m3fn,QuantType.per_1x128,1,0,1,0,30.2924,_ZN5aiter48fmoe_bf16_blockscaleBf16_g1u1_flat_vs_silu_1x128E,0.0%,0.0,,0.0%,30.2924,1,1,1,4.15,53169.28,
256,4,2048,512,512,10,ActivationType.Silu,torch.bfloat16,torch.float8_e4m3fn,torch.float8_e4m3fn,QuantType.per_1x128,1,0,1,0,34.0904,_ZN5aiter48fmoe_bf16_blockscaleBf16_g1u1_flat_vs_silu_1x128E,0.0%,0.0,,0.0%,34.0904,1,1,1,7.38,47246.07,
256,8,2048,512,512,10,ActivationType.Silu,torch.bfloat16,torch.float8_e4m3fn,torch.float8_e4m3fn,QuantType.per_1x128,1,0,1,0,57.7894,_ZN5aiter48fmoe_bf16_blockscaleBf16_g1u1_flat_vs_silu_1x256E,0.0%,0.0,,0.0%,57.7894,1,1,1,8.71,27871.23,
256,16,2048,512,512,10,ActivationType.Silu,torch.bfloat16,torch.float8_e4m3fn,torch.float8_e4m3fn,QuantType.per_1x128,1,0,16,0,91.5941,_ZN5aiter48fmoe_bf16_blockscaleBf16_g1u1_vs_pf2_silu_16x128E,0.0%,0.0,,0.0%,91.5941,1,1,0,10.99,17585.31,
256,32,2048,512,512,10,ActivationType.Silu,torch.bfloat16,torch.float8_e4m3fn,torch.float8_e4m3fn,QuantType.per_1x128,1,0,32,0,147.9891,_ZN5aiter47fmoe_bf16_blockscaleBf16_g1u1_vs_ps_silu_32x256E,0.0%,0.0,,0.0%,147.9891,1,1,0,13.6,10884.65,
256,64,2048,512,512,10,ActivationType.Silu,torch.bfloat16,torch.float8_e4m3fn,torch.float8_e4m3fn,QuantType.per_1x128,1,0,16,0,218.5007,_ZN5aiter48fmoe_bf16_blockscaleBf16_g1u1_vs_pf2_silu_16x128E,0.0%,0.0,,0.0%,218.5007,1,1,0,18.43,7373.0,
256,128,2048,512,512,10,ActivationType.Silu,torch.bfloat16,torch.float8_e4m3fn,torch.float8_e4m3fn,QuantType.per_1x128,1,0,32,0,277.4264,_ZN5aiter47fmoe_bf16_blockscaleBf16_g1u1_vs_ps_silu_32x256E,0.0%,0.0,,0.0%,277.4264,1,1,0,29.03,5808.38,
256,256,2048,512,512,10,ActivationType.Silu,torch.bfloat16,torch.float8_e4m3fn,torch.float8_e4m3fn,QuantType.per_1x128,1,0,32,0,313.4877,_ZN5aiter47fmoe_bf16_blockscaleBf16_g1u1_vs_ps_silu_32x256E,0.0%,0.0,,0.0%,313.4877,1,1,0,51.38,5142.74,
256,512,2048,512,512,10,ActivationType.Silu,torch.bfloat16,torch.float8_e4m3fn,torch.float8_e4m3fn,QuantType.per_1x128,1,0,64,0,324.3542,_ZN5aiter46fmoe_bf16_blockscaleFp8_g1u1_vs_ps_silu_64x256E,0.0%,0.0,,0.0%,324.3542,1,0,0,99.31,4975.3,
256,1024,2048,512,512,10,ActivationType.Silu,torch.bfloat16,torch.float8_e4m3fn,torch.float8_e4m3fn,QuantType.per_1x128,1,0,64,0,332.7789,_ZN5aiter46fmoe_bf16_blockscaleFp8_g1u1_vs_ps_silu_64x256E,0.0%,0.0,,0.0%,332.7789,1,0,0,193.6,4858.79,
256,2048,2048,512,512,10,ActivationType.Silu,torch.bfloat16,torch.float8_e4m3fn,torch.float8_e4m3fn,QuantType.per_1x128,1,0,64,0,370.374,_ZN5aiter46fmoe_bf16_blockscaleFp8_g1u1_vs_ps_silu_64x256E,0.0%,0.0,,0.0%,370.374,1,0,0,347.89,4382.59,
256,4096,2048,512,512,10,ActivationType.Silu,torch.bfloat16,torch.float8_e4m3fn,torch.float8_e4m3fn,QuantType.per_1x128,1,0,64,0,509.1613,_ZN5aiter46fmoe_bf16_blockscaleFp8_g1u1_vs_ps_silu_64x256E,0.0%,0.0,,0.0%,509.1613,1,0,0,506.12,3212.69,
256,8192,2048,512,512,10,ActivationType.Silu,torch.bfloat16,torch.float8_e4m3fn,torch.float8_e4m3fn,QuantType.per_1x128,1,0,64,0,794.4984,_ZN5aiter46fmoe_bf16_blockscaleFp8_g1u1_vs_ps_silu_64x256E,0.0%,0.0,,0.0%,794.4984,1,0,0,648.71,2090.56,
256,16384,2048,512,512,10,ActivationType.Silu,torch.bfloat16,torch.float8_e4m3fn,torch.float8_e4m3fn,QuantType.per_1x128,1,0,64,0,1405.7109,_ZN5aiter46fmoe_bf16_blockscaleFp8_g1u1_vs_ps_silu_64x256E,0.0%,0.0,,0.0%,1405.7109,1,0,0,733.29,1217.37,
256,32768,2048,512,512,10,ActivationType.Silu,torch.bfloat16,torch.float8_e4m3fn,torch.float8_e4m3fn,QuantType.per_1x128,1,0,64,0,2808.0146,_ZN5aiter46fmoe_bf16_blockscaleFp8_g1u1_vs_ps_silu_64x256E,0.0%,0.0,,0.0%,2808.0146,1,0,0,734.18,645.27,
256,1,2048,512,513,11,ActivationType.Silu,torch.bfloat16,torch.float8_e4m3fn,torch.float8_e4m3fn,QuantType.per_1x128,1,0,1,0,29.0768,_ZN5aiter48fmoe_bf16_blockscaleBf16_g1u1_flat_vs_silu_1x128E,0.0%,0.0,,0.0%,29.0768,1,1,1,2.38,55500.08,
256,2,2048,512,513,11,ActivationType.Silu,torch.bfloat16,torch.float8_e4m3fn,torch.float8_e4m3fn,QuantType.per_1x128,1,0,1,0,30.0194,_ZN5aiter48fmoe_bf16_blockscaleBf16_g1u1_flat_vs_silu_1x128E,0.0%,0.0,,0.0%,30.0194,1,1,1,4.61,53757.6,
256,4,2048,512,513,11,ActivationType.Silu,torch.bfloat16,torch.float8_e4m3fn,torch.float8_e4m3fn,QuantType.per_1x128,1,0,1,0,36.3075,_ZN5aiter48fmoe_bf16_blockscaleBf16_g1u1_flat_vs_silu_1x128E,0.0%,0.0,,0.0%,36.3075,1,1,1,7.62,44447.65,
256,8,2048,512,513,11,ActivationType.Silu,torch.bfloat16,torch.float8_e4m3fn,torch.float8_e4m3fn,QuantType.per_1x128,1,0,1,0,65.2815,_ZN5aiter48fmoe_bf16_blockscaleBf16_g1u1_flat_vs_silu_1x256E,0.0%,0.0,,0.0%,65.2815,1,1,1,8.48,24720.75,
256,16,2048,512,513,11,ActivationType.Silu,torch.bfloat16,torch.float8_e4m3fn,torch.float8_e4m3fn,QuantType.per_1x128,1,0,16,0,103.2466,_ZN5aiter48fmoe_bf16_blockscaleBf16_g1u1_vs_pf2_silu_16x128E,0.0%,0.0,,0.0%,103.2466,1,1,0,10.72,15631.09,
256,32,2048,512,513,11,ActivationType.Silu,torch.bfloat16,torch.float8_e4m3fn,torch.float8_e4m3fn,QuantType.per_1x128,1,0,16,0,154.5498,_ZN5aiter48fmoe_bf16_blockscaleBf16_g1u1_vs_pf2_silu_16x128E,0.0%,0.0,,0.0%,154.5498,1,1,0,14.33,10442.95,
256,64,2048,512,513,11,ActivationType.Silu,torch.bfloat16,torch.float8_e4m3fn,torch.float8_e4m3fn,QuantType.per_1x128,1,0,16,0,239.3439,_ZN5aiter48fmoe_bf16_blockscaleBf16_g1u1_vs_pf2_silu_16x128E,0.0%,0.0,,0.0%,239.3439,1,1,0,18.51,6744.07,
256,128,2048,512,513,11,ActivationType.Silu,torch.bfloat16,torch.float8_e4m3fn,torch.float8_e4m3fn,QuantType.per_1x128,1,0,32,0,288.8707,_ZN5aiter47fmoe_bf16_blockscaleBf16_g1u1_vs_ps_silu_32x256E,0.0%,0.0,,0.0%,288.8707,1,1,0,30.67,5589.16,
256,256,2048,512,513,11,ActivationType.Silu,torch.bfloat16,torch.float8_e4m3fn,torch.float8_e4m3fn,QuantType.per_1x128,1,0,32,0,313.76480000000004,_ZN5aiter47fmoe_bf16_blockscaleBf16_g1u1_vs_ps_silu_32x256E,0.0%,0.0,,0.0%,313.7648,1,1,0,56.47,5148.22,
256,512,2048,512,513,11,ActivationType.Silu,torch.bfloat16,torch.float8_e4m3fn,torch.float8_e4m3fn,QuantType.per_1x128,1,0,64,0,332.80120000000005,_ZN5aiter46fmoe_bf16_blockscaleFp8_g1u1_vs_ps_silu_64x256E,0.0%,0.0,,0.0%,332.8012,1,0,0,106.47,4858.47,
256,1024,2048,512,513,11,ActivationType.Silu,torch.bfloat16,torch.float8_e4m3fn,torch.float8_e4m3fn,QuantType.per_1x128,1,0,32,0,235.0555,moe_ck2stages_gemm1_256x32x128x128_1x4_MulABScaleExpertWeightA8W8blkscale_v1_Nswizzle0_Quant4_MulRoutedWeight0_silu_F8_F8_B16,0.1%,114.2163,moe_ck2stages_gemm2_256x32x128x128_1x4_MulABScaleExpertWeightA8W8blkscale_v1_Nswizzle0_Quant4_MulRoutedWeight1_F8_F8_B16,18.6%,349.2718,0,0,0,202.9,4638.36,
256,2048,2048,512,513,11,ActivationType.Silu,torch.bfloat16,torch.float8_e4m3fn,torch.float8_e4m3fn,QuantType.per_1x128,1,0,64,0,389.7528,_ZN5aiter46fmoe_bf16_blockscaleFp8_g1u1_vs_ps_silu_64x256E,0.0%,0.0,,0.0%,389.7528,1,0,0,363.65,4172.75,
256,4096,2048,512,513,11,ActivationType.Silu,torch.bfloat16,torch.float8_e4m3fn,torch.float8_e4m3fn,QuantType.per_1x128,1,0,64,0,522.7891999999999,_ZN5aiter46fmoe_bf16_blockscaleFp8_g1u1_vs_ps_silu_64x256E,0.0%,0.0,,0.0%,522.7892,1,0,0,542.22,3134.96,
256,8192,2048,512,513,11,ActivationType.Silu,torch.bfloat16,torch.float8_e4m3fn,torch.float8_e4m3fn,QuantType.per_1x128,1,0,64,0,839.8261,_ZN5aiter46fmoe_bf16_blockscaleFp8_g1u1_vs_ps_silu_64x256E,0.0%,0.0,,0.0%,839.8261,1,0,0,675.06,1981.47,
256,16384,2048,512,513,11,ActivationType.Silu,torch.bfloat16,torch.float8_e4m3fn,torch.float8_e4m3fn,QuantType.per_1x128,1,0,64,0,1531.6153000000002,_ZN5aiter46fmoe_bf16_blockscaleFp8_g1u1_vs_ps_silu_64x256E,0.0%,0.0,,0.0%,1531.6153,1,0,0,740.31,1119.36,
256,32768,2048,512,513,11,ActivationType.Silu,torch.bfloat16,torch.float8_e4m3fn,torch.float8_e4m3fn,QuantType.per_1x128,1,0,64,0,3007.0927,_ZN5aiter46fmoe_bf16_blockscaleFp8_g1u1_vs_ps_silu_64x256E,0.0%,0.0,,0.0%,3007.0927,1,0,0,754.13,603.6,
256,1,2048,256,512,10,ActivationType.Silu,torch.bfloat16,torch.float8_e4m3fn,torch.float8_e4m3fn,QuantType.per_1x128,1,0,1,0,28.065,_ZN5aiter48fmoe_bf16_blockscaleBf16_g1u1_flat_vs_silu_1x128E,0.0%,0.0,,0.0%,28.065,1,1,1,1.12,28694.55,
256,2,2048,256,512,10,ActivationType.Silu,torch.bfloat16,torch.float8_e4m3fn,torch.float8_e4m3fn,QuantType.per_1x128,1,0,1,0,28.7218,_ZN5aiter48fmoe_bf16_blockscaleBf16_g1u1_flat_vs_silu_1x128E,0.0%,0.0,,0.0%,28.7218,1,1,1,2.19,28038.59,
256,4,2048,256,512,10,ActivationType.Silu,torch.bfloat16,torch.float8_e4m3fn,torch.float8_e4m3fn,QuantType.per_1x128,1,0,1,0,30.1027,_ZN5aiter48fmoe_bf16_blockscaleBf16_g1u1_flat_vs_silu_1x128E,0.0%,0.0,,0.0%,30.1027,1,1,1,4.18,26752.78,
256,8,2048,256,512,10,ActivationType.Silu,torch.bfloat16,torch.float8_e4m3fn,torch.float8_e4m3fn,QuantType.per_1x128,1,0,1,0,36.8989,_ZN5aiter48fmoe_bf16_blockscaleBf16_g1u1_flat_vs_silu_1x128E,0.0%,0.0,,0.0%,36.8989,1,1,1,6.82,21826.0,
256,16,2048,256,512,10,ActivationType.Silu,torch.bfloat16,torch.float8_e4m3fn,torch.float8_e4m3fn,QuantType.per_1x128,1,0,32,0,52.8053,_ZN5aiter47fmoe_bf16_blockscaleBf16_g1u1_vs_ps_silu_32x256E,0.0%,0.0,,0.0%,52.8053,1,1,0,9.53,15252.35,
256,32,2048,256,512,10,ActivationType.Silu,torch.bfloat16,torch.float8_e4m3fn,torch.float8_e4m3fn,QuantType.per_1x128,1,0,16,0,83.4519,_ZN5aiter48fmoe_bf16_blockscaleBf16_g1u1_vs_pf2_silu_16x128E,0.0%,0.0,,0.0%,83.4519,1,1,0,12.06,9652.3,
256,64,2048,256,512,10,ActivationType.Silu,torch.bfloat16,torch.float8_e4m3fn,torch.float8_e4m3fn,QuantType.per_1x128,1,0,16,0,119.0158,_ZN5aiter48fmoe_bf16_blockscaleBf16_g1u1_vs_pf2_silu_16x128E,0.0%,0.0,,0.0%,119.0158,1,1,0,16.92,6769.69,
256,128,2048,256,512,10,ActivationType.Silu,torch.bfloat16,torch.float8_e4m3fn,torch.float8_e4m3fn,QuantType.per_1x128,1,0,32,0,151.1291,_ZN5aiter47fmoe_bf16_blockscaleBf16_g1u1_vs_ps_silu_32x256E,0.0%,0.0,,0.0%,151.1291,1,1,0,26.64,5333.8,
256,256,2048,256,512,10,ActivationType.Silu,torch.bfloat16,torch.float8_e4m3fn,torch.float8_e4m3fn,QuantType.per_1x128,1,0,32,0,163.6889,_ZN5aiter47fmoe_bf16_blockscaleBf16_g1u1_vs_ps_silu_32x256E,0.0%,0.0,,0.0%,163.6889,1,1,0,49.2,4929.35,
256,512,2048,256,512,10,ActivationType.Silu,torch.bfloat16,torch.float8_e4m3fn,torch.float8_e4m3fn,QuantType.per_1x128,1,0,64,0,168.69969999999998,_ZN5aiter46fmoe_bf16_blockscaleFp8_g1u1_vs_ps_silu_64x256E,0.0%,0.0,,0.0%,168.6997,1,0,0,95.47,4792.26,
256,1024,2048,256,512,10,ActivationType.Silu,torch.bfloat16,torch.float8_e4m3fn,torch.float8_e4m3fn,QuantType.per_1x128,1,0,64,0,176.8019,_ZN5aiter46fmoe_bf16_blockscaleFp8_g1u1_vs_ps_silu_64x256E,0.0%,0.0,,0.0%,176.8019,1,0,0,182.19,4590.44,
256,2048,2048,256,512,10,ActivationType.Silu,torch.bfloat16,torch.float8_e4m3fn,torch.float8_e4m3fn,QuantType.per_1x128,1,0,64,0,201.6111,_ZN5aiter46fmoe_bf16_blockscaleFp8_g1u1_vs_ps_silu_64x256E,0.0%,0.0,,0.0%,201.6111,1,0,0,319.55,4056.77,
256,4096,2048,256,512,10,ActivationType.Silu,torch.bfloat16,torch.float8_e4m3fn,torch.float8_e4m3fn,QuantType.per_1x128,1,0,64,0,279.00590000000005,_ZN5aiter46fmoe_bf16_blockscaleFp8_g1u1_vs_ps_silu_64x256E,0.0%,0.0,,0.0%,279.0059,1,0,0,461.81,2976.54,
256,8192,2048,256,512,10,ActivationType.Silu,torch.bfloat16,torch.float8_e4m3fn,torch.float8_e4m3fn,QuantType.per_1x128,1,0,64,0,444.1293,_ZN5aiter46fmoe_bf16_blockscaleFp8_g1u1_vs_ps_silu_64x256E,0.0%,0.0,,0.0%,444.1293,1,0,0,580.23,1926.55,
256,16384,2048,256,512,10,ActivationType.Silu,torch.bfloat16,torch.float8_e4m3fn,torch.float8_e4m3fn,QuantType.per_1x128,1,0,64,0,772.2301000000001,_ZN5aiter46fmoe_bf16_blockscaleFp8_g1u1_vs_ps_silu_64x256E,0.0%,0.0,,0.0%,772.2301,1,0,0,667.41,1173.19,
256,32768,2048,256,512,10,ActivationType.Silu,torch.bfloat16,torch.float8_e4m3fn,torch.float8_e4m3fn,QuantType.per_1x128,1,0,64,0,1469.694,_ZN5aiter46fmoe_bf16_blockscaleFp8_g1u1_vs_ps_silu_64x256E,0.0%,0.0,,0.0%,1469.694,1,0,0,701.37,684.93,
256,1,2048,256,513,11,ActivationType.Silu,torch.bfloat16,torch.float8_e4m3fn,torch.float8_e4m3fn,QuantType.per_1x128,1,0,1,0,28.2544,_ZN5aiter48fmoe_bf16_blockscaleBf16_g1u1_flat_vs_silu_1x128E,0.0%,0.0,,0.0%,28.2544,1,1,1,1.22,28557.87,
256,2,2048,256,513,11,ActivationType.Silu,torch.bfloat16,torch.float8_e4m3fn,torch.float8_e4m3fn,QuantType.per_1x128,1,0,1,0,28.718,_ZN5aiter48fmoe_bf16_blockscaleBf16_g1u1_flat_vs_silu_1x128E,0.0%,0.0,,0.0%,28.718,1,1,1,2.41,28097.07,
256,4,2048,256,513,11,ActivationType.Silu,torch.bfloat16,torch.float8_e4m3fn,torch.float8_e4m3fn,QuantType.per_1x128,1,0,1,0,31.4185,_ZN5aiter48fmoe_bf16_blockscaleBf16_g1u1_flat_vs_silu_1x128E,0.0%,0.0,,0.0%,31.4185,1,1,1,4.41,25682.44,
256,8,2048,256,513,11,ActivationType.Silu,torch.bfloat16,torch.float8_e4m3fn,torch.float8_e4m3fn,QuantType.per_1x128,1,0,1,0,36.489,_ZN5aiter48fmoe_bf16_blockscaleBf16_g1u1_flat_vs_silu_1x128E,0.0%,0.0,,0.0%,36.489,1,1,1,7.59,22114.29,
256,16,2048,256,513,11,ActivationType.Silu,torch.bfloat16,torch.float8_e4m3fn,torch.float8_e4m3fn,QuantType.per_1x128,1,0,32,0,52.4307,_ZN5aiter47fmoe_bf16_blockscaleBf16_g1u1_vs_ps_silu_32x256E,0.0%,0.0,,0.0%,52.4307,1,1,0,10.56,15391.32,
256,32,2048,256,513,11,ActivationType.Silu,torch.bfloat16,torch.float8_e4m3fn,torch.float8_e4m3fn,QuantType.per_1x128,1,0,16,0,87.0681,_ZN5aiter48fmoe_bf16_blockscaleBf16_g1u1_vs_pf2_silu_16x128E,0.0%,0.0,,0.0%,87.0681,1,1,0,12.72,9269.48,
256,64,2048,256,513,11,ActivationType.Silu,torch.bfloat16,torch.float8_e4m3fn,torch.float8_e4m3fn,QuantType.per_1x128,1,0,16,0,122.8161,_ZN5aiter48fmoe_bf16_blockscaleBf16_g1u1_vs_pf2_silu_16x128E,0.0%,0.0,,0.0%,122.8161,1,1,0,18.03,6573.02,
256,128,2048,256,513,11,ActivationType.Silu,torch.bfloat16,torch.float8_e4m3fn,torch.float8_e4m3fn,QuantType.per_1x128,1,0,32,0,154.546,_ZN5aiter47fmoe_bf16_blockscaleBf16_g1u1_vs_ps_silu_32x256E,0.0%,0.0,,0.0%,154.546,1,1,0,28.66,5226.05,
256,256,2048,256,513,11,ActivationType.Silu,torch.bfloat16,torch.float8_e4m3fn,torch.float8_e4m3fn,QuantType.per_1x128,1,0,64,0,165.4888,_ZN5aiter46fmoe_bf16_blockscaleFp8_g1u1_vs_ps_silu_64x256E,0.0%,0.0,,0.0%,165.4888,1,0,0,53.53,4885.24,
256,512,2048,256,513,11,ActivationType.Silu,torch.bfloat16,torch.float8_e4m3fn,torch.float8_e4m3fn,QuantType.per_1x128,1,0,32,0,185.5596,_ZN5aiter47fmoe_bf16_blockscaleBf16_g1u1_vs_ps_silu_32x256E,0.0%,0.0,,0.0%,185.5596,1,1,0,95.48,4365.31,
256,1024,2048,256,513,11,ActivationType.Silu,torch.bfloat16,torch.float8_e4m3fn,torch.float8_e4m3fn,QuantType.per_1x128,1,0,32,0,137.2473,moe_ck2stages_gemm1_256x32x128x128_1x4_MulABScaleExpertWeightA8W8blkscale_v1_Nswizzle0_Quant4_MulRoutedWeight0_silu_F8_F8_B16,0.1%,61.1266,moe_ck2stages_gemm2_256x32x128x128_1x4_MulABScaleExpertWeightA8W8blkscale_v1_Nswizzle0_Quant4_MulRoutedWeight1_F8_F8_B16,18.5%,198.3739,0,0,0,178.62,4099.18,
256,2048,2048,256,513,11,ActivationType.Silu,torch.bfloat16,torch.float8_e4m3fn,torch.float8_e4m3fn,QuantType.per_1x128,1,0,64,0,231.3277,_ZN5aiter46fmoe_bf16_blockscaleFp8_g1u1_vs_ps_silu_64x256E,0.0%,0.0,,0.0%,231.3277,1,0,0,306.35,3542.43,
256,4096,2048,256,513,11,ActivationType.Silu,torch.bfloat16,torch.float8_e4m3fn,torch.float8_e4m3fn,QuantType.per_1x128,1,0,64,0,282.437,_ZN5aiter46fmoe_bf16_blockscaleFp8_g1u1_vs_ps_silu_64x256E,0.0%,0.0,,0.0%,282.437,1,0,0,501.82,2945.95,
256,8192,2048,256,513,11,ActivationType.Silu,torch.bfloat16,torch.float8_e4m3fn,torch.float8_e4m3fn,QuantType.per_1x128,1,0,64,0,452.9141,_ZN5aiter46fmoe_bf16_blockscaleFp8_g1u1_vs_ps_silu_64x256E,0.0%,0.0,,0.0%,452.9141,1,0,0,625.88,1892.66,
256,16384,2048,256,513,11,ActivationType.Silu,torch.bfloat16,torch.float8_e4m3fn,torch.float8_e4m3fn,QuantType.per_1x128,1,0,64,0,840.2042,_ZN5aiter46fmoe_bf16_blockscaleFp8_g1u1_vs_ps_silu_64x256E,0.0%,0.0,,0.0%,840.2042,1,0,0,674.76,1080.15,
256,32768,2048,256,513,11,ActivationType.Silu,torch.bfloat16,torch.float8_e4m3fn,torch.float8_e4m3fn,QuantType.per_1x128,1,0,64,0,1626.0768999999998,_ZN5aiter46fmoe_bf16_blockscaleFp8_g1u1_vs_ps_silu_64x256E,0.0%,0.0,,0.0%,1626.0769,1,0,0,697.3,620.02,
256,1,2048,128,512,10,ActivationType.Silu,torch.bfloat16,torch.float8_e4m3fn,torch.float8_e4m3fn,QuantType.per_1x128,1,0,1,0,28.1481,_ZN5aiter48fmoe_bf16_blockscaleBf16_g1u1_flat_vs_silu_1x128E,0.0%,0.0,,0.0%,28.1481,1,1,1,0.56,14305.03,
256,2,2048,128,512,10,ActivationType.Silu,torch.bfloat16,torch.float8_e4m3fn,torch.float8_e4m3fn,QuantType.per_1x128,1,0,1,0,28.4279,_ZN5aiter48fmoe_bf16_blockscaleBf16_g1u1_flat_vs_silu_1x128E,0.0%,0.0,,0.0%,28.4279,1,1,1,1.11,14164.45,
256,4,2048,128,512,10,ActivationType.Silu,torch.bfloat16,torch.float8_e4m3fn,torch.float8_e4m3fn,QuantType.per_1x128,1,0,1,0,28.5314,_ZN5aiter48fmoe_bf16_blockscaleBf16_g1u1_flat_vs_silu_1x128E,0.0%,0.0,,0.0%,28.5314,1,1,1,2.21,14113.49,
256,8,2048,128,512,10,ActivationType.Silu,torch.bfloat16,torch.float8_e4m3fn,torch.float8_e4m3fn,QuantType.per_1x128,1,0,1,0,31.8857,_ZN5aiter48fmoe_bf16_blockscaleBf16_g1u1_flat_vs_silu_1x128E,0.0%,0.0,,0.0%,31.8857,1,1,1,3.95,12629.56,
256,16,2048,128,512,10,ActivationType.Silu,torch.bfloat16,torch.float8_e4m3fn,torch.float8_e4m3fn,QuantType.per_1x128,1,0,1,0,36.1666,_ZN5aiter48fmoe_bf16_blockscaleBf16_g1u1_flat_vs_silu_1x128E,0.0%,0.0,,0.0%,36.1666,1,1,1,6.96,11136.01,
256,32,2048,128,512,10,ActivationType.Silu,torch.bfloat16,torch.float8_e4m3fn,torch.float8_e4m3fn,QuantType.per_1x128,1,0,16,0,50.2673,_ZN5aiter48fmoe_bf16_blockscaleBf16_g1u1_vs_pf2_silu_16x128E,0.0%,0.0,,0.0%,50.2673,1,1,0,10.01,8014.15,
256,64,2048,128,512,10,ActivationType.Silu,torch.bfloat16,torch.float8_e4m3fn,torch.float8_e4m3fn,QuantType.per_1x128,1,0,32,0,71.05590000000001,_ZN5aiter47fmoe_bf16_blockscaleBf16_g1u1_vs_ps_silu_32x128E,0.0%,0.0,,0.0%,71.0559,1,1,0,14.17,5672.24,
256,128,2048,128,512,10,ActivationType.Silu,torch.bfloat16,torch.float8_e4m3fn,torch.float8_e4m3fn,QuantType.per_1x128,1,0,16,0,81.57,_ZN5aiter48fmoe_bf16_blockscaleBf16_g1u1_vs_pf2_silu_16x128E,0.0%,0.0,,0.0%,81.57,1,1,0,24.68,4945.93,
256,256,2048,128,512,10,ActivationType.Silu,torch.bfloat16,torch.float8_e4m3fn,torch.float8_e4m3fn,QuantType.per_1x128,1,0,64,0,99.278,_ZN5aiter46fmoe_bf16_blockscaleFp8_g1u1_vs_ps_silu_64x128E,0.0%,0.0,,0.0%,99.278,1,0,0,40.56,4071.66,
256,512,2048,128,512,10,ActivationType.Silu,torch.bfloat16,torch.float8_e4m3fn,torch.float8_e4m3fn,QuantType.per_1x128,1,0,64,0,102.6568,_ZN5aiter46fmoe_bf16_blockscaleFp8_g1u1_vs_ps_silu_64x128E,0.0%,0.0,,0.0%,102.6568,1,0,0,78.45,3952.97,
256,1024,2048,128,512,10,ActivationType.Silu,torch.bfloat16,torch.float8_e4m3fn,torch.float8_e4m3fn,QuantType.per_1x128,1,0,64,0,111.484,_ZN5aiter46fmoe_bf16_blockscaleFp8_g1u1_vs_ps_silu_64x128E,0.0%,0.0,,0.0%,111.484,1,0,0,144.47,3668.19,
256,2048,2048,128,512,10,ActivationType.Silu,torch.bfloat16,torch.float8_e4m3fn,torch.float8_e4m3fn,QuantType.per_1x128,1,0,64,0,149.3489,_ZN5aiter46fmoe_bf16_blockscaleFp8_g1u1_vs_ps_silu_64x128E,0.0%,0.0,,0.0%,149.3489,1,0,0,215.68,2780.31,
256,4096,2048,128,512,10,ActivationType.Silu,torch.bfloat16,torch.float8_e4m3fn,torch.float8_e4m3fn,QuantType.per_1x128,1,0,64,0,227.6115,_ZN5aiter46fmoe_bf16_blockscaleFp8_g1u1_vs_ps_silu_64x128E,0.0%,0.0,,0.0%,227.6115,1,0,0,283.05,1879.6,
256,8192,2048,128,512,10,ActivationType.Silu,torch.bfloat16,torch.float8_e4m3fn,torch.float8_e4m3fn,QuantType.per_1x128,1,0,64,0,373.0238000000001,_ZN5aiter46fmoe_bf16_blockscaleFp8_g1u1_vs_ps_silu_64x128E,0.0%,0.0,,0.0%,373.0238,1,0,0,345.42,1214.36,
256,16384,2048,128,512,10,ActivationType.Silu,torch.bfloat16,torch.float8_e4m3fn,torch.float8_e4m3fn,QuantType.per_1x128,1,0,64,0,675.8134,_ZN5aiter46fmoe_bf16_blockscaleFp8_g1u1_vs_ps_silu_64x128E,0.0%,0.0,,0.0%,675.8134,1,0,0,381.32,744.76,
256,32768,2048,128,512,10,ActivationType.Silu,torch.bfloat16,torch.float8_e4m3fn,torch.float8_e4m3fn,QuantType.per_1x128,1,0,64,0,1285.1706,_ZN5aiter46fmoe_bf16_blockscaleFp8_g1u1_vs_ps_silu_64x128E,0.0%,0.0,,0.0%,1285.1706,1,0,0,401.03,469.96,
256,1,2048,128,513,11,ActivationType.Silu,torch.bfloat16,torch.float8_e4m3fn,torch.float8_e4m3fn,QuantType.per_1x128,1,0,1,0,28.0958,_ZN5aiter48fmoe_bf16_blockscaleBf16_g1u1_flat_vs_silu_1x128E,0.0%,0.0,,0.0%,28.0958,1,1,1,0.62,14359.65,
256,2,2048,128,513,11,ActivationType.Silu,torch.bfloat16,torch.float8_e4m3fn,torch.float8_e4m3fn,QuantType.per_1x128,1,0,1,0,28.2101,_ZN5aiter48fmoe_bf16_blockscaleBf16_g1u1_flat_vs_silu_1x128E,0.0%,0.0,,0.0%,28.2101,1,1,1,1.23,14301.68,
256,4,2048,128,513,11,ActivationType.Silu,torch.bfloat16,torch.float8_e4m3fn,torch.float8_e4m3fn,QuantType.per_1x128,1,0,1,0,28.7164,_ZN5aiter48fmoe_bf16_blockscaleBf16_g1u1_flat_vs_silu_1x128E,0.0%,0.0,,0.0%,28.7164,1,1,1,2.41,14049.96,
256,8,2048,128,513,11,ActivationType.Silu,torch.bfloat16,torch.float8_e4m3fn,torch.float8_e4m3fn,QuantType.per_1x128,1,0,1,0,32.0345,_ZN5aiter48fmoe_bf16_blockscaleBf16_g1u1_flat_vs_silu_1x128E,0.0%,0.0,,0.0%,32.0345,1,1,1,4.32,12595.44,
256,16,2048,128,513,11,ActivationType.Silu,torch.bfloat16,torch.float8_e4m3fn,torch.float8_e4m3fn,QuantType.per_1x128,1,0,1,0,35.6245,_ZN5aiter48fmoe_bf16_blockscaleBf16_g1u1_flat_vs_silu_1x128E,0.0%,0.0,,0.0%,35.6245,1,1,1,7.77,11327.54,
256,32,2048,128,513,11,ActivationType.Silu,torch.bfloat16,torch.float8_e4m3fn,torch.float8_e4m3fn,QuantType.per_1x128,1,0,16,0,53.1625,_ZN5aiter48fmoe_bf16_blockscaleBf16_g1u1_vs_pf2_silu_16x128E,0.0%,0.0,,0.0%,53.1625,1,1,0,10.41,7592.5,
256,64,2048,128,513,11,ActivationType.Silu,torch.bfloat16,torch.float8_e4m3fn,torch.float8_e4m3fn,QuantType.per_1x128,1,0,16,0,72.8415,_ZN5aiter48fmoe_bf16_blockscaleBf16_g1u1_vs_pf2_silu_16x128E,0.0%,0.0,,0.0%,72.8415,1,1,0,15.2,5543.99,
256,128,2048,128,513,11,ActivationType.Silu,torch.bfloat16,torch.float8_e4m3fn,torch.float8_e4m3fn,QuantType.per_1x128,1,0,32,0,85.57209999999999,_ZN5aiter47fmoe_bf16_blockscaleBf16_g1u1_vs_ps_silu_32x128E,0.0%,0.0,,0.0%,85.5721,1,1,0,25.88,4723.81,
256,256,2048,128,513,11,ActivationType.Silu,torch.bfloat16,torch.float8_e4m3fn,torch.float8_e4m3fn,QuantType.per_1x128,1,0,64,0,100.745,_ZN5aiter46fmoe_bf16_blockscaleFp8_g1u1_vs_ps_silu_64x128E,0.0%,0.0,,0.0%,100.745,1,0,0,43.96,4020.17,
256,512,2048,128,513,11,ActivationType.Silu,torch.bfloat16,torch.float8_e4m3fn,torch.float8_e4m3fn,QuantType.per_1x128,1,0,32,0,113.3104,_ZN5aiter47fmoe_bf16_blockscaleBf16_g1u1_vs_ps_silu_32x128E,0.0%,0.0,,0.0%,113.3104,1,1,0,78.18,3588.24,
256,1024,2048,128,513,11,ActivationType.Silu,torch.bfloat16,torch.float8_e4m3fn,torch.float8_e4m3fn,QuantType.per_1x128,1,0,64,0,135.7911,_ZN5aiter46fmoe_bf16_blockscaleFp8_g1u1_vs_ps_silu_64x128E,0.0%,0.0,,0.0%,135.7911,1,0,0,130.47,3017.36,
256,2048,2048,128,513,11,ActivationType.Silu,torch.bfloat16,torch.float8_e4m3fn,torch.float8_e4m3fn,QuantType.per_1x128,1,0,64,0,176.42190000000002,_ZN5aiter46fmoe_bf16_blockscaleFp8_g1u1_vs_ps_silu_64x128E,0.0%,0.0,,0.0%,176.4219,1,0,0,200.85,2358.11,
256,4096,2048,128,513,11,ActivationType.Silu,torch.bfloat16,torch.float8_e4m3fn,torch.float8_e4m3fn,QuantType.per_1x128,1,0,64,0,236.171,_ZN5aiter46fmoe_bf16_blockscaleFp8_g1u1_vs_ps_silu_64x128E,0.0%,0.0,,0.0%,236.171,1,0,0,300.07,1814.81,
256,8192,2048,128,513,11,ActivationType.Silu,torch.bfloat16,torch.float8_e4m3fn,torch.float8_e4m3fn,QuantType.per_1x128,1,0,64,0,414.6880000000001,_ZN5aiter46fmoe_bf16_blockscaleFp8_g1u1_vs_ps_silu_64x128E,0.0%,0.0,,0.0%,414.688,1,0,0,341.78,1094.25,
256,16384,2048,128,513,11,ActivationType.Silu,torch.bfloat16,torch.float8_e4m3fn,torch.float8_e4m3fn,QuantType.per_1x128,1,0,64,0,742.6066000000001,_ZN5aiter46fmoe_bf16_blockscaleFp8_g1u1_vs_ps_silu_64x128E,0.0%,0.0,,0.0%,742.6066,1,0,0,381.72,678.83,
256,32768,2048,128,513,11,ActivationType.Silu,torch.bfloat16,torch.float8_e4m3fn,torch.float8_e4m3fn,QuantType.per_1x128,1,0,64,0,1400.2168,_ZN5aiter46fmoe_bf16_blockscaleFp8_g1u1_vs_ps_silu_64x128E,0.0%,0.0,,0.0%,1400.2168,1,0,0,404.89,431.91,
256,1,2048,512,512,10,ActivationType.Gelu,torch.bfloat16,torch.float8_e4m3fn,torch.float8_e4m3fn,QuantType.per_1x128,1,0,1,0,27.2452,_ZN5aiter48fmoe_bf16_blockscaleBf16_g1u1_flat_vs_gelu_1x128E,0.0%,0.0,,0.0%,27.2452,1,1,1,2.31,59115.69,
256,2,2048,512,512,10,ActivationType.Gelu,torch.bfloat16,torch.float8_e4m3fn,torch.float8_e4m3fn,QuantType.per_1x128,1,0,1,0,28.3603,_ZN5aiter48fmoe_bf16_blockscaleBf16_g1u1_flat_vs_gelu_1x128E,0.0%,0.0,,0.0%,28.3603,1,1,1,4.44,56791.54,
256,8,2048,512,512,10,ActivationType.Gelu,torch.bfloat16,torch.float8_e4m3fn,torch.float8_e4m3fn,QuantType.per_1x128,1,0,1,0,54.7402,_ZN5aiter48fmoe_bf16_blockscaleBf16_g1u1_flat_vs_gelu_1x256E,0.0%,0.0,,0.0%,54.7402,1,1,1,9.19,29423.75,
256,16,2048,512,512,10,ActivationType.Gelu,torch.bfloat16,torch.float8_e4m3fn,torch.float8_e4m3fn,QuantType.per_1x128,1,0,1,0,93.0479,_ZN5aiter48fmoe_bf16_blockscaleBf16_g1u1_flat_vs_gelu_1x128E,0.0%,0.0,,0.0%,93.0479,1,1,1,10.82,17310.56,
256,2,2048,512,513,11,ActivationType.Gelu,torch.bfloat16,torch.float8_e4m3fn,torch.float8_e4m3fn,QuantType.per_1x128,1,0,1,0,29.8369,_ZN5aiter48fmoe_bf16_blockscaleBf16_g1u1_flat_vs_gelu_1x128E,0.0%,0.0,,0.0%,29.8369,1,1,1,4.64,54086.41,
256,4,2048,512,513,11,ActivationType.Gelu,torch.bfloat16,torch.float8_e4m3fn,torch.float8_e4m3fn,QuantType.per_1x128,1,0,1,0,35.6395,_ZN5aiter48fmoe_bf16_blockscaleBf16_g1u1_flat_vs_gelu_1x128E,0.0%,0.0,,0.0%,35.6395,1,1,1,7.77,45280.74,
256,8,2048,512,513,11,ActivationType.Gelu,torch.bfloat16,torch.float8_e4m3fn,torch.float8_e4m3fn,QuantType.per_1x128,1,0,1,0,61.7887,_ZN5aiter48fmoe_bf16_blockscaleBf16_g1u1_flat_vs_gelu_1x256E,0.0%,0.0,,0.0%,61.7887,1,1,1,8.96,26118.17,
256,1,2048,256,512,10,ActivationType.Gelu,torch.bfloat16,torch.float8_e4m3fn,torch.float8_e4m3fn,QuantType.per_1x128,1,0,1,0,26.4605,_ZN5aiter48fmoe_bf16_blockscaleBf16_g1u1_flat_vs_gelu_1x128E,0.0%,0.0,,0.0%,26.4605,1,1,1,1.19,30434.52,
256,2,2048,256,512,10,ActivationType.Gelu,torch.bfloat16,torch.float8_e4m3fn,torch.float8_e4m3fn,QuantType.per_1x128,1,0,1,0,29.5358,_ZN5aiter48fmoe_bf16_blockscaleBf16_g1u1_flat_vs_gelu_1x128E,0.0%,0.0,,0.0%,29.5358,1,1,1,2.13,27265.85,
256,8,2048,256,512,10,ActivationType.Gelu,torch.bfloat16,torch.float8_e4m3fn,torch.float8_e4m3fn,QuantType.per_1x128,1,0,1,0,33.7063,_ZN5aiter48fmoe_bf16_blockscaleBf16_g1u1_flat_vs_gelu_1x128E,0.0%,0.0,,0.0%,33.7063,1,1,1,7.47,23893.32,
256,16,2048,256,512,10,ActivationType.Gelu,torch.bfloat16,torch.float8_e4m3fn,torch.float8_e4m3fn,QuantType.per_1x128,1,0,1,0,55.6421,_ZN5aiter48fmoe_bf16_blockscaleBf16_g1u1_flat_vs_gelu_1x256E,0.0%,0.0,,0.0%,55.6421,1,1,1,9.05,14474.74,
256,1,2048,256,513,11,ActivationType.Gelu,torch.bfloat16,torch.float8_e4m3fn,torch.float8_e4m3fn,QuantType.per_1x128,1,0,1,0,26.5982,_ZN5aiter48fmoe_bf16_blockscaleBf16_g1u1_flat_vs_gelu_1x128E,0.0%,0.0,,0.0%,26.5982,1,1,1,1.3,30336.09,
256,8,2048,256,513,11,ActivationType.Gelu,torch.bfloat16,torch.float8_e4m3fn,torch.float8_e4m3fn,QuantType.per_1x128,1,0,1,0,33.3916,_ZN5aiter48fmoe_bf16_blockscaleBf16_g1u1_flat_vs_gelu_1x128E,0.0%,0.0,,0.0%,33.3916,1,1,1,8.29,24165.61,
256,16,2048,256,513,11,ActivationType.Gelu,torch.bfloat16,torch.float8_e4m3fn,torch.float8_e4m3fn,QuantType.per_1x128,1,0,1,0,55.3907,_ZN5aiter48fmoe_bf16_blockscaleBf16_g1u1_flat_vs_gelu_1x256E,0.0%,0.0,,0.0%,55.3907,1,1,1,10.0,14568.83,
256,1,2048,128,512,10,ActivationType.Gelu,torch.bfloat16,torch.float8_e4m3fn,torch.float8_e4m3fn,QuantType.per_1x128,1,0,1,0,27.2123,_ZN5aiter48fmoe_bf16_blockscaleBf16_g1u1_flat_vs_gelu_1x128E,0.0%,0.0,,0.0%,27.2123,1,1,1,0.58,14796.96,
256,2,2048,128,512,10,ActivationType.Gelu,torch.bfloat16,torch.float8_e4m3fn,torch.float8_e4m3fn,QuantType.per_1x128,1,0,1,0,27.0059,_ZN5aiter48fmoe_bf16_blockscaleBf16_g1u1_flat_vs_gelu_1x128E,0.0%,0.0,,0.0%,27.0059,1,1,1,1.16,14910.28,
256,4,2048,128,512,10,ActivationType.Gelu,torch.bfloat16,torch.float8_e4m3fn,torch.float8_e4m3fn,QuantType.per_1x128,1,0,1,0,27.4053,_ZN5aiter48fmoe_bf16_blockscaleBf16_g1u1_flat_vs_gelu_1x128E,0.0%,0.0,,0.0%,27.4053,1,1,1,2.3,14693.43,
256,8,2048,128,512,10,ActivationType.Gelu,torch.bfloat16,torch.float8_e4m3fn,torch.float8_e4m3fn,QuantType.per_1x128,1,0,1,0,29.2864,_ZN5aiter48fmoe_bf16_blockscaleBf16_g1u1_flat_vs_gelu_1x128E,0.0%,0.0,,0.0%,29.2864,1,1,1,4.3,13750.49,
256,16,2048,128,512,10,ActivationType.Gelu,torch.bfloat16,torch.float8_e4m3fn,torch.float8_e4m3fn,QuantType.per_1x128,1,0,1,0,33.6522,_ZN5aiter48fmoe_bf16_blockscaleBf16_g1u1_flat_vs_gelu_1x128E,0.0%,0.0,,0.0%,33.6522,1,1,1,7.48,11968.06,
256,2,2048,128,513,11,ActivationType.Gelu,torch.bfloat16,torch.float8_e4m3fn,torch.float8_e4m3fn,QuantType.per_1x128,1,0,1,0,27.3774,_ZN5aiter48fmoe_bf16_blockscaleBf16_g1u1_flat_vs_gelu_1x128E,0.0%,0.0,,0.0%,27.3774,1,1,1,1.26,14736.68,
256,4,2048,128,513,11,ActivationType.Gelu,torch.bfloat16,torch.float8_e4m3fn,torch.float8_e4m3fn,QuantType.per_1x128,1,0,1,0,27.8708,_ZN5aiter48fmoe_bf16_blockscaleBf16_g1u1_flat_vs_gelu_1x128E,0.0%,0.0,,0.0%,27.8708,1,1,1,2.48,14476.23,
256,8,2048,128,513,11,ActivationType.Gelu,torch.bfloat16,torch.float8_e4m3fn,torch.float8_e4m3fn,QuantType.per_1x128,1,0,1,0,29.8761,_ZN5aiter48fmoe_bf16_blockscaleBf16_g1u1_flat_vs_gelu_1x128E,0.0%,0.0,,0.0%,29.8761,1,1,1,4.63,13505.4,
