aiter/configs/model_configs/qwen3_235b_bf16_tuned_fmoe.csv
cu_num,token,model_dim,inter_dim,expert,topk,act_type,dtype,q_dtype_a,q_dtype_w,q_type,use_g1u1,doweight_stage1,block_m,ksplit,us1,kernelName1,err1,us2,kernelName2,err2,us,run_1stage,xbf16,tflops,bw,_tag
256,1,4096,384,128,8,ActivationType.Silu,torch.bfloat16,torch.bfloat16,torch.bfloat16,QuantType.No,1,0,32,0,25.6519,moe_ck2stages_gemm1_256x32x64x128_1x4_TypeCast_v1_Nswizzle0_Quant0_MulRoutedWeight0_silu_B16_B16_B16,0.0%,9.2504,moe_ck2stages_gemm2_256x32x64x64_1x4_TypeCast_v1_Nswizzle0_Quant0_MulRoutedWeight1_B16_B16_B16,0.3%,34.9023,0,0,2.16,34610.21,
256,2,4096,384,128,8,ActivationType.Silu,torch.bfloat16,torch.bfloat16,torch.bfloat16,QuantType.No,1,0,32,0,27.5466,moe_ck2stages_gemm1_256x32x64x128_1x4_TypeCast_v1_Nswizzle0_Quant0_MulRoutedWeight0_silu_B16_B16_B16,0.0%,17.3969,moe_ck2stages_gemm2_256x32x64x64_1x4_TypeCast_v1_Nswizzle0_Quant0_MulRoutedWeight1_B16_B16_B16,0.4%,44.9435,0,0,3.36,26878.02,
256,4,4096,384,128,8,ActivationType.Silu,torch.bfloat16,torch.bfloat16,torch.bfloat16,QuantType.No,1,0,32,0,32.7806,moe_ck2stages_gemm1_256x32x64x128_1x4_TypeCast_v1_Nswizzle0_Quant0_MulRoutedWeight0_silu_B16_B16_B16,0.0%,22.4269,moe_ck2stages_gemm2_256x32x128x128_1x4_TypeCast_v1_Nswizzle0_Quant0_MulRoutedWeight1_B16_B16_B16,0.4%,55.2075,0,0,5.47,21881.54,
256,8,4096,384,128,8,ActivationType.Silu,torch.bfloat16,torch.bfloat16,torch.bfloat16,QuantType.No,1,0,32,0,58.1181,moe_ck2stages_gemm1_256x32x64x64_1x4_TypeCast_v1_Nswizzle0_Quant0_MulRoutedWeight0_silu_B16_B16_B16,0.0%,34.3805,moe_ck2stages_gemm2_256x32x128x128_1x4_TypeCast_v1_Nswizzle0_Quant0_MulRoutedWeight1_B16_B16_B16,0.4%,92.4986,0,0,6.53,13060.64,
256,16,4096,384,128,8,ActivationType.Silu,torch.bfloat16,torch.bfloat16,torch.bfloat16,QuantType.No,1,0,32,0,90.0426,moe_ck2stages_gemm1_256x32x64x128_1x4_TypeCast_v1_Nswizzle0_Quant0_MulRoutedWeight0_silu_B16_B16_B16,0.0%,50.6559,moe_ck2stages_gemm2_256x32x128x128_1x4_TypeCast_v1_Nswizzle0_Quant0_MulRoutedWeight1_B16_B16_B16,0.4%,140.6985,0,0,8.59,8587.31,
256,32,4096,384,128,8,ActivationType.Silu,torch.bfloat16,torch.bfloat16,torch.bfloat16,QuantType.No,1,0,32,0,127.8366,moe_ck2stages_gemm1_256x32x64x128_1x4_TypeCast_v1_Nswizzle0_Quant0_MulRoutedWeight0_silu_B16_B16_B16,0.0%,68.2598,moe_ck2stages_gemm2_256x32x128x128_1x4_TypeCast_v1_Nswizzle0_Quant0_MulRoutedWeight1_B16_B16_B16,0.4%,196.0964,0,0,12.32,6162.7,
256,64,4096,384,128,8,ActivationType.Silu,torch.bfloat16,torch.bfloat16,torch.bfloat16,QuantType.No,1,0,32,0,136.1702,moe_ck2stages_gemm1_256x32x64x128_1x4_TypeCast_v1_Nswizzle0_Quant0_MulRoutedWeight0_silu_B16_B16_B16,0.0%,74.8871,moe_ck2stages_gemm2_256x32x64x64_1x4_TypeCast_v1_Nswizzle0_Quant0_MulRoutedWeight1_B16_B16_B16,0.4%,211.0573,0,0,22.89,5728.34,
256,128,4096,384,128,8,ActivationType.Silu,torch.bfloat16,torch.bfloat16,torch.bfloat16,QuantType.No,1,0,32,0,138.0199,moe_ck2stages_gemm1_256x32x64x128_1x4_TypeCast_v1_Nswizzle0_Quant0_MulRoutedWeight0_silu_B16_B16_B16,0.0%,76.728,moe_ck2stages_gemm2_256x32x64x64_1x4_TypeCast_v1_Nswizzle0_Quant0_MulRoutedWeight1_B16_B16_B16,0.4%,214.7479,0,0,45.0,5634.78,
256,256,4096,384,128,8,ActivationType.Silu,torch.bfloat16,torch.bfloat16,torch.bfloat16,QuantType.No,1,0,32,0,140.4918,moe_ck2stages_gemm1_256x32x64x128_1x4_TypeCast_v1_Nswizzle0_Quant0_MulRoutedWeight0_silu_B16_B16_B16,0.0%,80.2598,moe_ck2stages_gemm2_256x32x64x64_1x4_TypeCast_v1_Nswizzle0_Quant0_MulRoutedWeight1_B16_B16_B16,0.4%,220.7516,0,0,87.55,5491.03,
256,512,4096,384,128,8,ActivationType.Silu,torch.bfloat16,torch.bfloat16,torch.bfloat16,QuantType.No,1,0,64,0,145.1529,moe_ck2stages_gemm1_256x64x64x128_1x4_TypeCast_v1_Nswizzle0_Quant0_MulRoutedWeight0_silu_B16_B16_B16,0.0%,89.5603,moe_ck2stages_gemm2_256x64x64x64_1x4_TypeCast_v1_Nswizzle0_Quant0_MulRoutedWeight1_B16_B16_B16,0.4%,234.7132,0,0,164.69,5182.27,
256,1024,4096,384,128,8,ActivationType.Silu,torch.bfloat16,torch.bfloat16,torch.bfloat16,QuantType.No,1,0,128,0,170.3325,moe_ck2stages_gemm1_256x128x64x64_1x4_TypeCast_v1_Nswizzle0_Quant0_MulRoutedWeight0_silu_B16_B16_B16,0.0%,121.7016,moe_ck2stages_gemm2_256x128x64x64_1x4_TypeCast_v3_Nswizzle0_Quant0_MulRoutedWeight1_B16_B16_B16,0.4%,292.0341,0,0,264.73,4193.81,
256,2048,4096,384,128,8,ActivationType.Silu,torch.bfloat16,torch.bfloat16,torch.bfloat16,QuantType.No,1,0,128,0,255.1849,moe_ck2stages_gemm1_256x128x128x64_1x4_TypeCast_v3_Nswizzle0_Quant0_MulRoutedWeight0_silu_B16_B16_B16,0.0%,169.7393,moe_ck2stages_gemm2_256x128x64x64_1x4_TypeCast_v3_Nswizzle0_Quant0_MulRoutedWeight1_B16_B16_B16,0.4%,424.9242,0,0,363.87,2921.73,
256,4096,4096,384,128,8,ActivationType.Silu,torch.bfloat16,torch.bfloat16,torch.bfloat16,QuantType.No,1,0,128,0,374.4311,moe_ck2stages_gemm1_256x128x128x64_1x4_TypeCast_v3_Nswizzle0_Quant0_MulRoutedWeight0_silu_B16_B16_B16,0.0%,282.9883,moe_ck2stages_gemm2_256x128x64x64_1x4_TypeCast_v3_Nswizzle0_Quant0_MulRoutedWeight1_B16_B16_B16,0.4%,657.4194,0,0,470.38,1939.51,
256,8192,4096,384,128,8,ActivationType.Silu,torch.bfloat16,torch.bfloat16,torch.bfloat16,QuantType.No,1,0,128,0,688.2845,moe_ck2stages_gemm1_256x128x128x64_1x4_TypeCast_v3_Nswizzle0_Quant0_MulRoutedWeight0_silu_B16_B16_B16,0.0%,502.2363,moe_ck2stages_gemm2_256x128x64x64_1x4_TypeCast_v3_Nswizzle0_Quant0_MulRoutedWeight1_B16_B16_B16,0.4%,1190.5208,0,0,519.5,1127.39,
256,16384,4096,384,128,8,ActivationType.Silu,torch.bfloat16,torch.bfloat16,torch.bfloat16,QuantType.No,1,0,128,0,1278.7463,moe_ck2stages_gemm1_256x128x128x64_1x4_TypeCast_v3_Nswizzle0_Quant0_MulRoutedWeight0_silu_B16_B16_B16,0.0%,966.9571,moe_ck2stages_gemm2_256x128x64x64_1x4_TypeCast_v3_Nswizzle0_Quant0_MulRoutedWeight1_B16_B16_B16,0.4%,2245.7034,0,0,550.81,657.43,
256,32768,4096,384,128,8,ActivationType.Silu,torch.bfloat16,torch.bfloat16,torch.bfloat16,QuantType.No,1,0,128,0,2125.7129,moe_ck2stages_gemm1_256x128x128x64_1x4_TypeCast_v3_Nswizzle0_Quant0_MulRoutedWeight0_silu_B16_B16_B16,0.0%,1935.3483,moe_ck2stages_gemm2_256x128x64x64_1x4_TypeCast_v3_Nswizzle0_Quant0_MulRoutedWeight1_B16_B16_B16,0.4%,4061.0612,0,0,609.18,429.65,
304,1,4096,384,128,8,ActivationType.Silu,torch.bfloat16,torch.bfloat16,torch.bfloat16,QuantType.No,1,0,32,0,22.4432,moe_ck2stages_gemm1_256x32x64x128_1x4_TypeCast_v1_Nswizzle0_Quant0_MulRoutedWeight0_silu_B16_B16_B16,0.0%,11.6139,moe_ck2stages_gemm2_256x32x64x64_1x4_TypeCastExpertWeight_v1_Nswizzle0_Quant0_MulRoutedWeight1_B16_B16_B16,0.3%,34.0571,0,0,2.22,35469.14,
304,2,4096,384,128,8,ActivationType.Silu,torch.bfloat16,torch.bfloat16,torch.bfloat16,QuantType.No,1,0,32,0,30.2153,moe_ck2stages_gemm1_256x32x64x128_1x4_TypeCast_v1_Nswizzle0_Quant0_MulRoutedWeight0_silu_B16_B16_B16,0.0%,22.443,moe_ck2stages_gemm2_256x32x64x128_1x4_TypeCastExpertWeight_v1_Nswizzle0_Quant0_MulRoutedWeight1_B16_B16_B16,0.3%,52.6583,0,0,2.87,22940.21,
304,4,4096,384,128,8,ActivationType.Silu,torch.bfloat16,torch.bfloat16,torch.bfloat16,QuantType.No,1,0,32,0,50.85,moe_ck2stages_gemm1_256x32x64x64_1x4_TypeCast_v1_Nswizzle0_Quant0_MulRoutedWeight0_silu_B16_B16_B16,0.0%,33.5821,moe_ck2stages_gemm2_256x32x64x128_1x4_TypeCastExpertWeight_v1_Nswizzle0_Quant0_MulRoutedWeight1_B16_B16_B16,0.3%,84.4321,0,0,3.58,14307.65,
304,8,4096,384,128,8,ActivationType.Silu,torch.bfloat16,torch.bfloat16,torch.bfloat16,QuantType.No,1,0,32,0,94.0812,moe_ck2stages_gemm1_256x32x64x64_1x4_TypeCast_v1_Nswizzle0_Quant0_MulRoutedWeight0_silu_B16_B16_B16,0.0%,53.8622,moe_ck2stages_gemm2_256x32x64x64_1x4_TypeCastExpertWeight_v1_Nswizzle0_Quant0_MulRoutedWeight1_B16_B16_B16,0.3%,147.9434,0,0,4.08,8165.9,
304,16,4096,384,128,8,ActivationType.Silu,torch.bfloat16,torch.bfloat16,torch.bfloat16,QuantType.No,1,0,32,0,140.9995,moe_ck2stages_gemm1_256x32x64x64_1x4_TypeCast_v1_Nswizzle0_Quant0_MulRoutedWeight0_silu_B16_B16_B16,0.0%,77.2401,moe_ck2stages_gemm2_256x32x64x64_1x4_TypeCastExpertWeight_v1_Nswizzle0_Quant0_MulRoutedWeight1_B16_B16_B16,0.3%,218.2396,0,0,5.54,5536.22,
304,32,4096,384,128,8,ActivationType.Silu,torch.bfloat16,torch.bfloat16,torch.bfloat16,QuantType.No,1,0,32,0,197.6488,moe_ck2stages_gemm1_256x32x64x64_1x4_TypeCast_v1_Nswizzle0_Quant0_MulRoutedWeight0_silu_B16_B16_B16,0.0%,104.6902,moe_ck2stages_gemm2_256x32x64x64_1x4_TypeCastExpertWeight_v1_Nswizzle0_Quant0_MulRoutedWeight1_B16_B16_B16,0.4%,302.339,0,0,7.99,3997.12,
304,64,4096,384,128,8,ActivationType.Silu,torch.bfloat16,torch.bfloat16,torch.bfloat16,QuantType.No,1,0,32,0,214.8082,moe_ck2stages_gemm1_256x32x64x64_1x4_TypeCast_v1_Nswizzle0_Quant0_MulRoutedWeight0_silu_B16_B16_B16,0.0%,123.4785,moe_ck2stages_gemm2_256x32x64x64_1x4_TypeCastExpertWeight_v1_Nswizzle0_Quant0_MulRoutedWeight1_B16_B16_B16,0.4%,338.2867,0,0,14.28,3573.92,
304,128,4096,384,128,8,ActivationType.Silu,torch.bfloat16,torch.bfloat16,torch.bfloat16,QuantType.No,1,0,32,0,223.5931,moe_ck2stages_gemm1_256x32x64x64_1x4_TypeCast_v1_Nswizzle0_Quant0_MulRoutedWeight0_silu_B16_B16_B16,0.0%,128.2833,moe_ck2stages_gemm2_256x32x64x128_1x4_TypeCastExpertWeight_v1_Nswizzle0_Quant0_MulRoutedWeight1_B16_B16_B16,0.4%,351.8764,0,0,27.46,3438.87,
304,256,4096,384,128,8,ActivationType.Silu,torch.bfloat16,torch.bfloat16,torch.bfloat16,QuantType.No,1,0,32,0,228.9039,moe_ck2stages_gemm1_256x32x64x64_1x4_TypeCast_v1_Nswizzle0_Quant0_MulRoutedWeight0_silu_B16_B16_B16,0.0%,127.7025,moe_ck2stages_gemm2_256x32x64x128_1x4_TypeCastExpertWeight_v1_Nswizzle0_Quant0_MulRoutedWeight1_B16_B16_B16,0.4%,356.6064,0,0,54.2,3399.14,
304,512,4096,384,128,8,ActivationType.Silu,torch.bfloat16,torch.bfloat16,torch.bfloat16,QuantType.No,1,0,64,0,259.3087,moe_ck2stages_gemm1_256x64x64x128_1x4_TypeCast_v1_Nswizzle0_Quant0_MulRoutedWeight0_silu_B16_B16_B16,0.0%,152.8433,moe_ck2stages_gemm2_256x64x64x64_1x4_TypeCastExpertWeight_v1_Nswizzle0_Quant0_MulRoutedWeight1_B16_B16_B16,0.4%,412.152,0,0,93.79,2951.21,
304,1024,4096,384,128,8,ActivationType.Silu,torch.bfloat16,torch.bfloat16,torch.bfloat16,QuantType.No,1,0,128,0,312.6271,moe_ck2stages_gemm1_256x128x64x64_1x4_TypeCast_v1_Nswizzle0_Quant0_MulRoutedWeight0_silu_B16_B16_B16,0.0%,212.5374,moe_ck2stages_gemm2_256x128x128x64_1x4_TypeCastExpertWeight_v3_Nswizzle0_Quant0_MulRoutedWeight1_B16_B16_B16,0.4%,525.1645,0,0,147.21,2332.1,
304,2048,4096,384,128,8,ActivationType.Silu,torch.bfloat16,torch.bfloat16,torch.bfloat16,QuantType.No,1,0,128,0,415.7771,moe_ck2stages_gemm1_256x128x128x64_1x4_TypeCast_v3_Nswizzle0_Quant0_MulRoutedWeight0_silu_B16_B16_B16,0.0%,303.8805,moe_ck2stages_gemm2_256x128x128x64_1x4_TypeCastExpertWeight_v3_Nswizzle0_Quant0_MulRoutedWeight1_B16_B16_B16,0.4%,719.6576,0,0,214.85,1725.15,
304,4096,4096,384,128,8,ActivationType.Silu,torch.bfloat16,torch.bfloat16,torch.bfloat16,QuantType.No,1,0,128,0,757.1284,moe_ck2stages_gemm1_256x128x128x64_1x4_TypeCast_v3_Nswizzle0_Quant0_MulRoutedWeight0_silu_B16_B16_B16,0.0%,520.6861,moe_ck2stages_gemm2_256x128x128x64_1x4_TypeCastExpertWeight_v3_Nswizzle0_Quant0_MulRoutedWeight1_B16_B16_B16,0.4%,1277.8145,0,0,242.01,997.85,
304,8192,4096,384,128,8,ActivationType.Silu,torch.bfloat16,torch.bfloat16,torch.bfloat16,QuantType.No,1,0,128,0,1279.3648,moe_ck2stages_gemm1_256x128x128x64_1x4_TypeCast_v3_Nswizzle0_Quant0_MulRoutedWeight0_silu_B16_B16_B16,0.0%,941.476,moe_ck2stages_gemm2_256x128x64x64_1x4_TypeCastExpertWeight_v3_Nswizzle0_Quant0_MulRoutedWeight1_B16_B16_B16,0.4%,2220.8408,0,0,278.49,604.36,
304,16384,4096,384,128,8,ActivationType.Silu,torch.bfloat16,torch.bfloat16,torch.bfloat16,QuantType.No,1,0,128,0,2418.7517,moe_ck2stages_gemm1_256x128x128x64_1x4_TypeCast_v3_Nswizzle0_Quant0_MulRoutedWeight0_silu_B16_B16_B16,0.0%,1798.1623,moe_ck2stages_gemm2_256x128x64x64_1x4_TypeCastExpertWeight_v3_Nswizzle0_Quant0_MulRoutedWeight1_B16_B16_B16,0.4%,4216.914,0,0,293.33,350.11,
304,32768,4096,384,128,8,ActivationType.Silu,torch.bfloat16,torch.bfloat16,torch.bfloat16,QuantType.No,1,0,128,0,3947.154,moe_ck2stages_gemm1_256x128x128x64_1x4_TypeCast_v3_Nswizzle0_Quant0_MulRoutedWeight0_silu_B16_B16_B16,0.0%,3820.2887,moe_ck2stages_gemm2_256x128x64x64_1x4_TypeCastExpertWeight_v3_Nswizzle0_Quant0_MulRoutedWeight1_B16_B16_B16,0.4%,7767.4427,0,0,318.5,224.63,
304,1,4096,192,128,8,ActivationType.Silu,torch.bfloat16,torch.bfloat16,torch.bfloat16,QuantType.No,1,0,32,0,23.3811,moe_ck2stages_gemm1_256x32x64x128_1x4_TypeCast_v1_Nswizzle0_Quant0_MulRoutedWeight0_silu_B16_B16_B16,0.0%,9.3291,moe_ck2stages_gemm2_256x32x64x64_1x4_TypeCastExpertWeight_v1_Nswizzle0_Quant0_MulRoutedWeight1_B16_B16_B16,0.1%,32.7102,0,0,1.15,18465.07,
304,2,4096,192,128,8,ActivationType.Silu,torch.bfloat16,torch.bfloat16,torch.bfloat16,QuantType.No,1,0,32,0,28.6858,moe_ck2stages_gemm1_256x32x64x128_1x4_TypeCast_v1_Nswizzle0_Quant0_MulRoutedWeight0_silu_B16_B16_B16,0.0%,15.1888,moe_ck2stages_gemm2_256x32x64x64_1x4_TypeCastExpertWeight_v1_Nswizzle0_Quant0_MulRoutedWeight1_B16_B16_B16,0.1%,43.8746,0,0,1.72,13766.79,
304,4,4096,192,128,8,ActivationType.Silu,torch.bfloat16,torch.bfloat16,torch.bfloat16,QuantType.No,1,0,32,0,31.6933,moe_ck2stages_gemm1_256x32x64x128_1x4_TypeCast_v1_Nswizzle0_Quant0_MulRoutedWeight0_silu_B16_B16_B16,0.0%,21.6785,moe_ck2stages_gemm2_256x32x64x64_1x4_TypeCastExpertWeight_v1_Nswizzle0_Quant0_MulRoutedWeight1_B16_B16_B16,0.1%,53.3718,0,0,2.83,11317.69,
304,8,4096,192,128,8,ActivationType.Silu,torch.bfloat16,torch.bfloat16,torch.bfloat16,QuantType.No,1,0,32,0,48.8876,moe_ck2stages_gemm1_256x32x64x128_1x4_TypeCast_v1_Nswizzle0_Quant0_MulRoutedWeight0_silu_B16_B16_B16,0.0%,33.9763,moe_ck2stages_gemm2_256x32x64x64_1x4_TypeCastExpertWeight_v1_Nswizzle0_Quant0_MulRoutedWeight1_B16_B16_B16,0.1%,82.8639,0,0,3.64,7290.4,
304,16,4096,192,128,8,ActivationType.Silu,torch.bfloat16,torch.bfloat16,torch.bfloat16,QuantType.No,1,0,32,0,71.5328,moe_ck2stages_gemm1_256x32x64x128_1x4_TypeCast_v1_Nswizzle0_Quant0_MulRoutedWeight0_silu_B16_B16_B16,0.0%,45.1874,moe_ck2stages_gemm2_256x32x64x64_1x4_TypeCastExpertWeight_v1_Nswizzle0_Quant0_MulRoutedWeight1_B16_B16_B16,0.1%,116.7202,0,0,5.17,5176.84,
304,32,4096,192,128,8,ActivationType.Silu,torch.bfloat16,torch.bfloat16,torch.bfloat16,QuantType.No,1,0,32,0,97.5459,moe_ck2stages_gemm1_256x32x64x64_1x4_TypeCast_v1_Nswizzle0_Quant0_MulRoutedWeight0_silu_B16_B16_B16,0.0%,57.1475,moe_ck2stages_gemm2_256x32x64x64_1x4_TypeCastExpertWeight_v1_Nswizzle0_Quant0_MulRoutedWeight1_B16_B16_B16,0.1%,154.6934,0,0,7.81,3907.76,
304,64,4096,192,128,8,ActivationType.Silu,torch.bfloat16,torch.bfloat16,torch.bfloat16,QuantType.No,1,0,32,0,108.9711,moe_ck2stages_gemm1_256x32x64x64_1x4_TypeCast_v1_Nswizzle0_Quant0_MulRoutedWeight0_silu_B16_B16_B16,0.0%,62.6242,moe_ck2stages_gemm2_256x32x64x64_1x4_TypeCastExpertWeight_v1_Nswizzle0_Quant0_MulRoutedWeight1_B16_B16_B16,0.1%,171.5953,0,0,14.08,3525.9,
304,128,4096,192,128,8,ActivationType.Silu,torch.bfloat16,torch.bfloat16,torch.bfloat16,QuantType.No,1,0,32,0,115.4091,moe_ck2stages_gemm1_256x32x64x64_1x4_TypeCast_v1_Nswizzle0_Quant0_MulRoutedWeight0_silu_B16_B16_B16,0.0%,66.4832,moe_ck2stages_gemm2_256x32x64x64_1x4_TypeCastExpertWeight_v1_Nswizzle0_Quant0_MulRoutedWeight1_B16_B16_B16,0.1%,181.8923,0,0,26.56,3332.06,
304,256,4096,192,128,8,ActivationType.Silu,torch.bfloat16,torch.bfloat16,torch.bfloat16,QuantType.No,1,0,32,0,120.5616,moe_ck2stages_gemm1_256x32x64x64_1x4_TypeCast_v1_Nswizzle0_Quant0_MulRoutedWeight0_silu_B16_B16_B16,0.0%,73.7895,moe_ck2stages_gemm2_256x32x64x64_1x4_TypeCastExpertWeight_v1_Nswizzle0_Quant0_MulRoutedWeight1_B16_B16_B16,0.1%,194.3511,0,0,49.72,3129.25,
304,512,4096,192,128,8,ActivationType.Silu,torch.bfloat16,torch.bfloat16,torch.bfloat16,QuantType.No,1,0,32,0,149.3534,moe_ck2stages_gemm1_256x32x64x64_1x4_TypeCast_v1_Nswizzle0_Quant0_MulRoutedWeight0_silu_B16_B16_B16,0.0%,85.5012,moe_ck2stages_gemm2_256x32x64x64_1x4_TypeCastExpertWeight_v1_Nswizzle0_Quant0_MulRoutedWeight1_B16_B16_B16,0.1%,234.8546,0,0,82.29,2607.44,
304,1024,4096,192,128,8,ActivationType.Silu,torch.bfloat16,torch.bfloat16,torch.bfloat16,QuantType.No,1,0,64,0,171.4637,moe_ck2stages_gemm1_256x64x64x64_1x4_TypeCast_v1_Nswizzle0_Quant0_MulRoutedWeight0_silu_B16_B16_B16,0.0%,129.2673,moe_ck2stages_gemm2_256x64x64x64_1x4_TypeCastExpertWeight_v1_Nswizzle0_Quant0_MulRoutedWeight1_B16_B16_B16,0.1%,300.731,0,0,128.54,2064.16,
304,2048,4096,192,128,8,ActivationType.Silu,torch.bfloat16,torch.bfloat16,torch.bfloat16,QuantType.No,1,0,128,0,238.3264,moe_ck2stages_gemm1_256x128x64x64_1x4_TypeCast_v1_Nswizzle0_Quant0_MulRoutedWeight0_silu_B16_B16_B16,0.0%,236.8066,moe_ck2stages_gemm2_256x128x128x64_1x4_TypeCastExpertWeight_v3_Nswizzle0_Quant0_MulRoutedWeight1_B16_B16_B16,0.1%,475.133,0,0,162.71,1341.8,
304,4096,4096,192,128,8,ActivationType.Silu,torch.bfloat16,torch.bfloat16,torch.bfloat16,QuantType.No,1,0,128,0,426.8954,moe_ck2stages_gemm1_256x128x64x64_1x4_TypeCast_v1_Nswizzle0_Quant0_MulRoutedWeight0_silu_B16_B16_B16,0.0%,383.6719,moe_ck2stages_gemm2_256x128x64x64_1x4_TypeCastExpertWeight_v3_Nswizzle0_Quant0_MulRoutedWeight1_B16_B16_B16,0.1%,810.5673,0,0,190.75,827.92,
304,8192,4096,192,128,8,ActivationType.Silu,torch.bfloat16,torch.bfloat16,torch.bfloat16,QuantType.No,1,0,128,0,794.6832,moe_ck2stages_gemm1_256x128x64x64_1x4_TypeCast_v1_Nswizzle0_Quant0_MulRoutedWeight0_silu_B16_B16_B16,0.0%,702.3799,moe_ck2stages_gemm2_256x128x64x64_1x4_TypeCastExpertWeight_v3_Nswizzle0_Quant0_MulRoutedWeight1_B16_B16_B16,0.1%,1497.0631,0,0,206.56,493.1,
304,16384,4096,192,128,8,ActivationType.Silu,torch.bfloat16,torch.bfloat16,torch.bfloat16,QuantType.No,1,0,128,0,1528.4883,moe_ck2stages_gemm1_256x128x64x64_1x4_TypeCast_v1_Nswizzle0_Quant0_MulRoutedWeight0_silu_B16_B16_B16,0.0%,1346.4511,moe_ck2stages_gemm2_256x128x64x64_1x4_TypeCastExpertWeight_v1_Nswizzle0_Quant0_MulRoutedWeight1_B16_B16_B16,0.1%,2874.9394,0,0,215.13,303.46,
304,32768,4096,192,128,8,ActivationType.Silu,torch.bfloat16,torch.bfloat16,torch.bfloat16,QuantType.No,1,0,64,0,2954.1887,moe_ck2stages_gemm1_256x64x64x64_1x4_TypeCast_v1_Nswizzle0_Quant0_MulRoutedWeight0_silu_B16_B16_B16,0.0%,2656.5686,moe_ck2stages_gemm2_256x64x64x64_1x4_TypeCastExpertWeight_v1_Nswizzle0_Quant0_MulRoutedWeight1_B16_B16_B16,0.1%,5610.7573,0,0,220.46,203.33,
