aiter/ops/triton/configs/gfx950-MHC_FUSED_SINKHORN-C=7168.json
{
    "M_LEQ_1": {
        "BLOCK_M": 16,
        "BLOCK_K": 256,
        "BLOCK_C": 128,
        "NUM_KSPLIT": 28,
        "num_warps": 4,
        "num_stages": 1,
        "waves_per_eu": 0
    },
    "M_LEQ_1024": {
        "BLOCK_M": 32,
        "BLOCK_K": 256,
        "BLOCK_C": 256,
        "NUM_KSPLIT": 7,
        "num_warps": 8,
        "num_stages": 2,
        "waves_per_eu": 2
    },
    "M_LEQ_2048": {
        "BLOCK_M": 64,
        "BLOCK_K": 128,
        "BLOCK_C": 64,
        "NUM_KSPLIT": 7,
        "num_warps": 8,
        "num_stages": 2,
        "waves_per_eu": 1
    },
    "M_LEQ_4096": {
        "BLOCK_M": 64,
        "BLOCK_K": 256,
        "BLOCK_C": 64,
        "NUM_KSPLIT": 7,
        "num_warps": 8,
        "num_stages": 2,
        "waves_per_eu": 1
    },
    "M_LEQ_8192": {
        "BLOCK_M": 64,
        "BLOCK_K": 256,
        "BLOCK_C": 256,
        "NUM_KSPLIT": 7,
        "num_warps": 8,
        "num_stages": 2,
        "waves_per_eu": 0
    },
    "M_LEQ_16384": {
        "BLOCK_M": 64,
        "BLOCK_K": 256,
        "BLOCK_C": 256,
        "NUM_KSPLIT": 7,
        "num_warps": 4,
        "num_stages": 1,
        "waves_per_eu": 0
    },
    "any": {
        "BLOCK_M": 64,
        "BLOCK_K": 256,
        "BLOCK_C": 256,
        "NUM_KSPLIT": 7,
        "num_warps": 4,
        "num_stages": 1,
        "waves_per_eu": 0
    }
}
